timestamp;timestamp;obj_regio1;obj_heatingType;obj_telekomTvOffer;obj_cId;obj_newlyConst;obj_balcony;obj_picture;obj_picturecount;obj_pricetrend;obj_telekomUploadSpeed;obj_telekomTrackingGroup;obj_telekomInternetTechnology;obj_yearConstructed;obj_telekomInternetType;obj_pricetrendbuy;obj_scoutId;obj_noParkSpaces;obj_firingTypes;obj_hasKitchen;obj_ExclusiveExpose;obj_telekomInternetProductName;obj_courtage;geo_bln;obj_cellar;obj_purchasePriceRange;obj_yearConstructedRange;obj_rentSubsidy;obj_houseNumber;obj_energyType;obj_pricetrendrent;obj_livingSpace;geo_krs;obj_zipCode;obj_condition;obj_interiorQual;obj_energyEfficiencyClass;ga_cd_cxp_historicallisting;obj_telekomDownloadSpeed;obj_parkingSpace;obj_street;obj_lift;obj_telekomInternetUrlMobile;obj_telekomInternetUrl;obj_streetPlain;obj_typeOfFlat;geo_plz;obj_noRooms;obj_thermalChar;obj_assistedLiving;obj_groupnumber;obj_ityp;obj_telekomHdTelephone;geo_land;ga_cd_via;obj_telekomInternet;obj_immotype;obj_rented;obj_floor;obj_telekomInternetServices;obj_telekomInternetProductAvailable;obj_cwId;obj_purchasePrice;ga_cd_application_requirements;obj_numberOfFloors;obj_noRoomsRange;ga_cd_maillead_default_shown;obj_garden;evt_count_pm_sig;obj_barrierFree;obj_international;obj_regio3;obj_objectnumber;obj_livingSpaceRange;obj_regio2;URL;beschreibung;obj_usableArea;obj_galleryAd;obj_lastRefurbish;ga_cd_developer_virtualreality;ga_cd_via_qualified;obj_project_id;obj_nbp;obj_telekomHybridUploadSpeed;obj_telekomHybridDownloadSpeed
0;2020-05-25 22:33:11.122176;Berlin;district_heating;ONE_YEAR_FREE;15681940;n;y;https://pictures.immobilienscout24.de/listings/da9e56da-2a77-487a-b69d-7db8aca112f2-1364858984.jpg/ORIG/resize/118x118%3E/extent/118x118/format/jpg/quality/80;16;11,37;40 MBit/s;telekom_layer_magenta_l;über VDSL;1986,0;REGULAR;11,37;115633742;1,0;geothermal;n;False;MagentaZuhause L;y;Berlin;y;9;4,0;410,82;no_information;energy_consumption;5,8;110,2;Berlin;10719;no_information;no_information;NO_INFORMATION;False;100 MBit/s;no_information;no_information;y;https://padlock.link/ioml;https://padlock.link/ml;no_information;apartment;10719;4,0;130,1;n;90,0;2,active;True;Deutschland;standard;100 MBit/s;wohnung_kauf;n;3,0;web,email,bank,music,dl-ul,game,sd,mltstr,hd,fast-ul-dl;True;002.01002869861;715000;profile0;7,0;4;True;n;showqualicontactform;y;n;Wilmersdorf_Wilmersdorf;115633742;5;Berlin;/expose/115633742;['Die Wohnung befindet sich in einem sehr gepflegten Mehrfamilienhaus aus den 80er Jahren, welches unter Denkmalschutz steht. Ein Fahrstuhl ist vorhanden. Die 110 qm große 4- Zimmer Wohnung mit Balkon, ist gut geschnitten und besticht durch Ihre Helligkeit. Die Wohnung ist mit Parkettboden versehen. Ein Keller ist vorhanden. Ein Tiefgagargenstellplatz kann auf Anfrage mit dazu erworben werden. Weitere Unterlagen, erhalten Sie bei telefonischer Anfrage 0177- 36 36 992', 'Die Wohnung befindet sich direkt im Herzen der City West, nahe der berühmten Flaniermeile, dem Kurfürstendamm. Umgeben von feinsten Shopping-Adressen, ausgezeichneter Gastronomie, sowie von vielfältigen Geschäften für den täglichen Bedarf, besticht die Immobilie durch ihre zentrale Lage. Auch die Verkehrsanbindung ist optimal.', 'Bei Fragen oder zwecks Besichtigungstermin, erreichen Sie mich unter der 0177-36 36992'];;;;;;;;;
1;2020-05-25 22:33:11.479667;Berlin;central_heating;ONE_YEAR_FREE;15828747;n;y;https://pictures.immobilienscout24.de/listings/d1357e24-7486-4062-b646-94056f652d0b-1346646080.jpg/ORIG/resize/118x118%3E/extent/118x118/format/jpg/quality/80;29;12,24;40 MBit/s;telekom_layer_magenta_l;über VDSL;1918,0;REGULAR;12,24;115409595;;oil;n;False;MagentaZuhause L;y;Berlin;y;9;1,0;334,11;3;energy_required;6,53;145,82;Berlin;10823;well_kept;normal;;False;100 MBit/s;no_information;"Klixstra&szlig;e";n;https://padlock.link/ioml;https://padlock.link/ml;Klixstraße;apartment;10823;5,0;125,8;n;;2,active;True;Deutschland;top;100 MBit/s;wohnung_kauf;n;4,0;web,email,bank,music,dl-ul,game,sd,mltstr,hd,fast-ul-dl;True;002.01004296519;669000;profile0;5,0;5;True;n;showqualicontactform;n;n;Schöneberg_Schöneberg;ETW-2387;6;Berlin;/expose/115409595;['Das Mehrfamilienhaus mit der Adresse, Klixstraße 3, 10823 Berlin/ Schöneberg wurde im Jahr 1918 erbaut.\nDie Eigentumswohnung befindet sich im Vorderhaus, 4.Obergeschoss und verfügt über eine äußerst großzügige Wohnfläche von etwa 145,82 m².\nDas Gemeinschaftseigentum würde saniert.\nDas Gewerbe ist vermietet.\nLeider liegen uns auf Grund des vermieteten Zustands keine Informationen zu genauen Ausstattungsdetails vor.\nAlternativ können Sie sich auch direkt ein Bild vor Ort machen. Wir vereinbaren gern einen Besichtigungstermin für Sie.', 'Die hier angebotene Immobilie befindet sich in einem Vorderhausim beliebten Berliner Stadtteil Schöneberg.\nDie Umgebung ist geprägt durch Wohnhäuser, Restaurants und Geschäfte des täglichen Bedarfs sowie diverse Möbelmärkte. Mehrere Grün- und Parkanlagen im Ortsteil bieten sich als Naherholungsgebiete an.\nEine reichhaltige Auswahl an Restaurants, Bars und netten Cafés findet man im fußläufig erreichbaren Szeneviertel rund um den Akazien-Kiez. Viele Geschäfte des täglichen Bedarfs sowie Apotheken, Kitas und Schulen sind in unmittelbarer Nähe vorhanden und lassen nichts zu wünschen übrig. Die hervorragende Verkehrsanbindung rundet das Angebot ab. Der U- Bahnhof Eisenacher Straße, sowie diverse Buslinien befinden sich in unmittelbarer Umgebung. Mit dem öffentlichen Personennahverkehr oder dem Pkw sind Bewohnerinnen und Bewohner perfekt angebunden.'];;;;;;;;;
2;2020-05-25 22:33:11.875315;Berlin;;ONE_YEAR_FREE;16225148;n;y;https://pictures.immobilienscout24.de/listings/c22ab07c-eb8c-48e3-8e88-4792843dcbba-1358304080.jpg/ORIG/resize/118x118%3E/extent/118x118/format/jpg/quality/80;23;9,73;40 MBit/s;telekom_layer_magenta_l;über VDSL;1972,0;REGULAR;9,73;116548516;;no_information;y;False;MagentaZuhause L;y;Berlin;n;9;3,0;;no_information;no_information;3,79;109,0;Berlin;14195;no_information;no_information;;False;100 MBit/s;underground_garage;no_information;n;https://padlock.link/ioml;https://padlock.link/ml;no_information;maisonette;14195;4,0;;n;;2,active;True;Deutschland;standard;100 MBit/s;wohnung_kauf;n;;web,email,bank,music,dl-ul,game,sd,mltstr,hd,fast-ul-dl;True;001.15930480;645000;profile0;;4;True;n;showqualicontactform;n;n;Dahlem_Zehlendorf;781;5;Berlin;/expose/116548516;['Vis-a-vis zur Villa des Bundespräsidenten residieren !\n\nDas im typischen 70er Jahre Stil angelegte kleine charmante Mehrfamilienhaus verfügt über 10 vorwiegend selbstgenutzte Einheiten. Es wurde 1972 auf einem ca. 2.552 qm großen Grundstück erbaut und ist in seinem zeitgenössischen Erscheinungsbild gepflegt erhalten worden. Technisch und optisch ist dieses Anwesen in einem guten Zustand. Über die Tiefgarage, welche über 15 Stellplätze verfügt, gelangt man direkt zum Highlight dieses eleganten Anwesens. Der Wellnessbereich mit einem beheizten Indoor Pool mit den großzügigen Maßen von 5 x 12 m, sowie einer gemütlichen Sauna und ansprechenden Sanitäranlagen runden das Wohnerlebnis in diesem Haus ab. Dieser Bereich befindet sich im Untergeschoss und ist durch die Tiefgarage immer trockenen Fußes erreichbar. Zudem gibt es durch eine große Glasschiebetür einen direkten Zugang zu dem wunderschönen ruhigen Garten, welcher zum relaxen und erholen einlädt.\n\nDer sehr ansprechende Grundriss dieser großzügig geschnittenen 4 Zimmer Wohnung bietet viel Platz für Paare und auch Familien. Die Wohnung befindet sich im Hochparterre und wird unsaniert angeboten, sie bietet daher vielfältige Möglichkeiten sich seine ganz individuelle Wohnumgebung zu gestalten. \n\nSie besticht durch Ihren sehr durchdachten Grundriss und ihre Lage im Hochparterre. Nach nur wenigen Stufen erreichen Sie den Eingangsbereich, welcher sich in eine große Diele öffnet, die auch als Essbereich mit genutzt werden kann. Diese hat eine Wand aus Glasquadern, welche sehr viel Helligkeit in die Wohnung bringt. Es ist ein Parkettboden verlegt, welcher einen gelungenen Übergang zu den Fliesen in der Küche bietet. Eine klassische Küche mit Geräten ist verbaut, müßte aber sicher erneuert werden. \n\nDie ganze Wohnung ist durch Gitter, welche man innen vorziehen kann gesichert. Mit Blick zu dem parkähnlichen Garten liegt wunderschön das große, helle mit einer großen Glasfront ausgestattete Wohnzimmer. Auch hier ist Parkett verlegt. Man gelangt vom Wohnzimmer direkt auf den Balkon mit Blick auf die Villa des Bundespräsidenten und den schönen Garten. Ein kleiner Abstellraum bietet auch hier Komfort.\nSeparat liegen die 3 freundlichen, hellen Zimmer welche als Schlaf, Ankleide oder Kinderzimmer genutzt werden können. In diesen Bereich ist auch das großzügige hellgeflieste Badezimmer mit Fenster, und Badewanne integriert. Ein Gäste WC befindet sich im Eingangsbereich der Wohnung. \n\nVom Eingangsbereich erreicht man über eine Wendeltreppe nach unten den geräumigen Hobbyraum mit zusätzlichen 30 qm, die nicht in der Wohnfläche enthalten sind. In diesem Bereich ist auch ein Duschbad verbaut und mit dem Einbau einer kleinen Küchenzeile wäre es möglich aus dem Bereich eine separate Einliegerwohnung zu gestalten. Ein direkter Zugang über die Tiefgararge ist gegeben.\n\nDas Haus verfügt über einen gemeinschaftlich zu nutzenden Wasch- und Trockenraum. \n\nZum Objekt gehört ein Tiefgaragenstellplatz, der für € 25.000,00 separat zu erwerben ist. Weitere Stellplätze auf Anfrage.\n\nAuf dem Dach sind zur Energieunterstützung Sonnenkollektoren verbaut.', 'Ausstattung-Highlights auf einen Blick:\n\n- großzügiger Wohn- und Essbereich\n- Schlafbereich mit 3 Zimmern \n- Gäste-WC\n- ca. 30 qm großer Hobbyraum im Souterrain\n- Parkähnliches Grundstück\n- Swimmingpool und Sauna zur Gemeinschaftsnutzung\n- Tiefgaragenstellplatz mit beheizter Auffahrt', 'In einer der allerbesten Wohnlagen von Berlin befindet sich dieses exklusive kleine Mehrfamilienhaus. Es wurde 1977 von dem Architekten Gert Eckel direkt am beliebten Messelpark auf einem sehr schön begrünten Grundstück erbaut. Der Park beginnt an der Clayallee in Schmargendorf und setzt sich bis in den Bezirk Steglitz -Zehlendorf fort. Er ist sehr naturbelassen und waldartig und hat daher einen ganz besonderen Charme. Ein Paradies für Familien und Freizeitsportler, welche gerne an der frischen Luft Ihren Aktivitäten nachgehen. \n\nIm direkten Umfeld des Hauses stehen klassische Villen, sehr hochwertige Einfamilienhäuser und exklusive Wohnanlagen, welche einen perfekten Rahmen bieten. Hochrangige Persönlichkeiten des öffentlichen Lebens residieren in dieser schönen Villenlage. Dahlem bietet für alle eine hervorragende Infrastruktur mit einem umfangreichen Erholungs- und Freizeitangebot. Die Erich-Kästner Grundschule und das Arndt Gymnasium befinden sich im nahen Umfeld, so dass auch Familien hier ein perfektes Umfeld vorfinden.\n\nEinkaufsmöglichkeiten bietet diese Gegend mit Dahlem und dem Roseneck in vielfältiger Weise. Der Kurfürstendamm und die Schloßstraße in Steglitz sind sowohl mit den öffentlichen Verkehrsmitteln, als auch mit dem eigenen Fahrzeug in kurzer Zeit zu erreichen. Es kann nach Herzenslust geshoppt werden. Auch Geschäftsleute haben in der tollen Lage dieses Objektes eine hervorragende Ausgangslage. \nDie Innenstadt und auch die Flughäfen und Bahnhöfe sind mit dem Auto oder öffentlichen Verkehrsmitteln sehr schnell zu erreichen.\nLast but not least bietet auch der nahegelegene Grunewald ein fantastisches Naherholungsgebiet für Spaziergänge und bunte Wochenendaktivitäten.'];31,0;disabled;;;;;;;
3;2020-05-25 22:33:12.329933;Berlin;central_heating;ONE_YEAR_FREE;213082;n;y;https://pictures.immobilienscout24.de/listings/2bb60064-df33-4f05-a838-cf6f3c64f29c-1359278669.jpg/ORIG/resize/118x118%3E/extent/118x118/format/jpg/quality/80;6;12,78;40 MBit/s;telekom_layer_magenta_l;über VDSL;1919,0;REGULAR;12,78;115988179;;gas;n;False;MagentaZuhause L;y;Berlin;y;9;1,0;410,37;73;energy_consumption;7,25;144,58;Berlin;10555;well_kept;normal;;False;100 MBit/s;no_information;Alt-Moabit;n;https://padlock.link/ioml;https://padlock.link/ml;Alt-Moabit;apartment;10555;5,0;129,0;n;2001,0;2,active;True;Deutschland;standard;100 MBit/s;wohnung_kauf;n;1,0;web,email,bank,music,dl-ul,game,sd,mltstr,hd,fast-ul-dl;True;001.213082;668975;profile0;6,0;5;True;n;;n;n;Tiergarten_Tiergarten;rwi7586;6;Berlin;/expose/115988179;['Es handelt sich bei diesem Objekt um einen Altbau aus dem Jahre 1919 in einem, für diese Zeit typischen, Mix aus Wohnungen und Gewerbe. So findet man hier ein Vorderhaus mit 2 Seitenflügeln und einem Hinterhaus, die den 1. Innenhof umschließen. Hier gibt es Wohnungen und im EG Gewerbeflächen. Errichtet wurden ein Erdgeschoss, 4 Obergeschosse und ein teilweise ausgebautes Dach mit Terrassen. An der Straßenseite des Vorderhauses gibt es Balkone, die anderen Gebäudeteile haben zumeist einen französischen Balkon. \r\rDanach folgt ein 2. Hof und dahinter ein ehemaliges Fabrikgebäude das gewerblich genutzt wird. Dieses ist bereits vollständig verkauft. ', 'Diese Wohnung ist seit 2016 als Büro vermietet und befindet sich im 1. OG des Vorderhauses. Es verfügt neben einem großen Durchgangszimmer über 4 weitere Büroräume, einer Küche, 2 getrennte WCs und 2 Abstellkammern. Ein Zimmer hat einen Balkon, ein weiteres einen Erker. Diese Einheit hat den klassischen Schnitt einer Altbauwohnung, der nur im Sanitärbereich auf die Bürosituation angepasst wurde. Die typischen charakteristischen Merkmale eines Altbaus aus der Gründerzeit sind bewahrt worden. \r\rDas Büro wird vermietet als Kapitalanlage angeboten mit aktuell 3,3% Rendite, und hat einen Gewerbemietvertrag aktuell bis zum 30.11.2021. In der Teilungserklärung ist diese Einheit nun als Wohnung ausgewiesen, eine Nutzung zu Eigenbedarfszwecken (als Wohnung) ist nach Ablauf der Mietzeit möglich.\r\rWeitere Details auf Anfrage. ', 'Berlin-Tiergarten-Mitte - Unterhalb der Turmstraße zwischen Spree und Ottopark gelegen. Von hier aus gelangt man schnell in die Innenstadt, zur Universität und auch zum Reichstag. \rDie Straße Alt-Moabit ist die nach der Turmstraße zweitwichtigste und wohl lebendigste Geschäftsstraße Moabits. Die zentrale Lage bietet zwar keine Ruhe wie in ländlicher Abgeschiedenheit, aber durch diese sind zum Beispiel sämtliche Einkäufe fußläufig zu erledigen, und auch Busse und die U-Bahnlinie U9 schnell erreicht. Die größtenteils sanierten hübschen Jugendstilbauten in der Umgebung bieten eine sehr angenehme Wohnlage, und das Bundestagsufer in der Nähe einen tollen Spreeblick zur Naherholung.', 'Der Käufer hat bei Abschluss des Kaufvertrages eine Provision in Höhe von 7,14 % inkl. Mehrwertsteuer vom Kaufpreis an uns zu zahlen. Verdient und fällig bei Beurkundung. Alle Angaben sind ohne Gewähr und nach den Unterlagen des Eigentümers erstellt. Irrtümer und Änderungen vorbehalten. Bei aller Sorgfalt können wir keine Garantie dafür übernehmen, dass alle Angaben richtig sind, und das Objekt im Augenblick des Zugangs der Offerte noch verfügbar ist. \r\rBei Anfragen bitten wir um vollständige Absenderangaben. \r\rGerne zeigen wir Ihnen das Objekt, und freuen uns auf einen persönlichen Termin mit Ihnen. \r\rSie erreichen uns wie folgt:\rRüdiger Wilkanowski Immobilien\rIn Kooperation mit:\r\rJohannes Rudert Immobilien\rTelefon: 0174-9542360\rFax: 030 / 85605613\r\rGerne zeigen wir Ihnen das Objekt, und freuen uns auf einen persönlichen Termin mit Ihnen. \r\rWeitere interessante Angebote finden Sie auch im Internet unter www.wilkanowski-immobilien.de.\r\rSie wollen Ihre Immobilie verkaufen ?\r \rWir suchen im Stadtgebiet von Berlin Immobilien (freie Eigentumswohnungen, Mehrfamilienhäuser und Einfamilienhäuser). Sprechen sie uns gerne an oder vereinbaren Sie einen persönlichen Termin mit uns: 030-85605612.'];;;;;;;;;
4;2020-05-25 22:33:12.683286;Berlin;central_heating;ONE_YEAR_FREE;371010;n;y;https://pictures.immobilienscout24.de/listings/d8635684-6abd-4a54-9ec6-d08cf419b737-1349763854.jpg/ORIG/resize/118x118%3E/extent/118x118/format/jpg/quality/80;12;12,7;40 MBit/s;telekom_layer_magenta_l;über VDSL;1919,0;REGULAR;12,7;115641707;;gas;n;False;MagentaZuhause L;y;Berlin;n;9;1,0;;no_information;energy_consumption;7,58;122,0;Berlin;10555;no_information;no_information;;False;100 MBit/s;no_information;no_information;y;https://padlock.link/ioml;https://padlock.link/ml;no_information;apartment;10555;4,0;129,0;n;;2,active;True;Deutschland;standard;100 MBit/s;wohnung_kauf;n;;web,email,bank,music,dl-ul,game,sd,mltstr,hd,fast-ul-dl;True;001.371010;549000;profile0;6,0;4;True;n;showqualicontactform;n;n;Tiergarten_Tiergarten;121;6;Berlin;/expose/115641707;"['Klasse Haus, tolle Wohnung. Hell, großzügig, mit Balkon und Aufzug.\nSchöne zentrale Lage. Ideale Wohnungsvorsorge. \nDie Wohnung hat typische Altbaudetails wie hohe Decken, Stuck und Holzböden. \nGut vermietet als Kapitalanlage oder für später zum Selbstbewohnen.\n\n\n\n\n\n\n\n\n\n\n\n.', 'Saniertes historisches Fabrikgebäude\nLoftarchitektur trifft hier auf moderne Bürowelten\nModerner, offener Eingangsbereich\nLastenaufzug / Aufzug\n\nGegensprechanlage\nNiedrige Betriebskosten durch modernste Haustechnik\nOptimiertes Facility Management', 'Schöne Lage in Moabit.\nDer sozial intakte und lebendige Kiez Alt-Moabit wird seit der Wende mit neuer Kraft aus Kultur, Wissenschaft und Wirtschaft befruchtet. Eine sehr gute Nahversorgung mit vielen, auch hochwertigen Geschäften und gastronomischen Einrichtungen, grünen Erholungsbereichen, mit Spreeanbindung und einer quirligen Kulturszene sorgen für eine sehr lebenswerte und angenehme Mischung.\nDer Markt hat diese Standortqualitäten seit geraumer Zeit entdeckt: In der Gotzkowskystrasse sind hochwertige Luxusappartements vom In-Büro Graft (""Brad Pitt"") gestaltet worden. \n1,5 km zum Ernst Reuter Platz\n0,7 km zur U Bahn Turmstrasse.', 'Zusammenfassung:\nStatus:           Vermietet\nLage              VH 4 OG\nm2                  122\nZimmer              4\nNKM:                 €1.022,08\nBetriebskosten  €   135,42\nHeizkosten        €   189,05\nGesamtmiete:   € 1.346,55\n----------------------------------\nWohngeld:        €   352,04\n\nIrrtümer und Änderungen vorbehalten.\nAlle Angaben entstammen den Informationen des Eigentümers. Bei aller Sorgfalt können wir keine Garantie dafür übernehmen, dass alle Angaben richtig sind und das Objekt im Augenblick des Zugangs der Offerte noch verfügbar ist.\nAlle Flächen sind ca. Angaben.\nAlle Verkaufspreise zzgl. 5,95 % Maklerprovision.\n\nSiehe unsere AGB´s und die Widerrufsbelehrung für Verbraucher.']";;;;;;;;;
5;2020-05-25 22:33:13.026253;Berlin;floor_heating;ONE_YEAR_FREE;16553840;n;y;https://pictures.immobilienscout24.de/listings/5ddb6997-5172-4248-8c15-a5a78c9d2d87-1352581140.jpg/ORIG/resize/118x118%3E/extent/118x118/format/jpg/quality/80;4;10,14;40 MBit/s;telekom_layer_magenta_l;über VDSL;1983,0;REGULAR;10,14;115962418;1,0;gas;y;False;MagentaZuhause L;n;Berlin;n;9;4,0;380,0;no_information;energy_consumption;5,19;110,0;Berlin;14195;well_kept;sophisticated;E;False;100 MBit/s;underground_garage;no_information;n;https://padlock.link/ioml;https://padlock.link/ml;no_information;maisonette;14195;4,0;154,7;n;;2,active;True;Deutschland;standard;100 MBit/s;wohnung_kauf;n;1,0;web,email,bank,music,dl-ul,game,sd,mltstr,hd,fast-ul-dl;True;002.01007390668;550000;profile0;;4;True;y;showqualicontactform;n;n;Schmargendorf_Wilmersdorf;115962418;5;Berlin;/expose/115962418;['Wir bieten eine wunderschöne Maisonette-Wohnung in Bestlage Grunewald im Tausch und mit Wertausgleich gegen eine Villa oder ein Mehrfamilienhaus in TOP-Lage von Berlin. \n\nGenießen Sie den Charme und die Exklusivität in Grunewald, aber auch die Nähe zur City-West. Großzügig gestaltete Räume, ein halboffener Küchen- und Wohnbereich mit Zugang auf den großzügigen Balkon, drei weitere Zimmer, zwei Bäder und ein Abstellbereich präsentieren sich in einem gepflegten Zustand.  \nHier wohnen Sie anspruchsvoll und außergewöhnlich. \n\nDas Mehrfamilienhaus wurde ca. 1983 erbaut und wird von der Eigentümergemeinschaft liebevoll gepflegt. Instandhaltungs- und Modernisierungsmaßnahmen werden regelmäßig durchgeführt.  \n\nEin Tiefgaragenstellplatz gehört zu der Wohnung.', '- Maisonette\n- Fussbodenheizung\n- großer Balkon im unteren Bereich der Wohnung\n- Badezimmer mit Badewanne im unteren Bereich\n- Badezimmer mit Dusche im oberen Bereich \n- Küche (Küchenmöbel inkl. Elektrogeräte sind vorhanden)\n- Tiefgaragenstellplatz\n- und vieles mehr', 'Berlin ist die Bundeshauptstadt\nBerlin ist ungewöhnlich außergewöhnlich\nBerlin ist sophisticated\nBerlin ist die grüne Stadt mit vielen Wäldern,\nParks und natürlich dem Wannsee\nBerlin hat den Ku‘damm und noch viel mehr\nBerlin ist Kultur - Berlin ist Szene\nBerlin ist halt Berlin\n\nBerlin hat in den letzten Jahren einen bemerkenswerten Wandel erfahren und prägt sich als Weltstadt und als angesagte Adresse.\nWunderschöne historische Bauten, kulturelle und architektonische Highlights sowie traumhafte Wohnviertel prägen das Stadtbild.\nGenießen Sie diese pulsierende und lebendige Stadt, die so viel zu bieten hat. Grunewald gehört zu den exklusivsten Wohnlagen die Berlin zu bieten hat. Luxuriöse Einfamilienhäuser, noble Villen, Sitz vieler Botschaften, Parkanlagen und natürlich der Grunewald prägen das Ortsbild. Eine ausgezeichnete Infrastruktur, hervorragende Schulen und kulturelle Einrichtungen, attraktive Sportmöglichkeiten und die Nähe zum Kurfürstendamm sind nur einige Highlights die dieses Viertel ausmachen. In Grunewald ist man sich der Exklusivität der Nachbarschaft bewußt.', 'Wir bitten um Ihr Verständnis, das alle Angaben, Daten und Flächen im Exposé und unseren Broschüren, den vorhandenen Unterlagen und Plänen entnommen sind. Maßgeblich sind die Vereinbarungen, die zwischen Verkäufer und Käufer im notariellen Kaufvertrag geregelt sind.'];;;;;;;;;
