2;2020-05-25 22:33:20.891090;Berlin;;ONE_YEAR_FREE;15867627;n;y;https://pictures.immobilienscout24.de/listings/b151fcd1-b0a7-4318-bdb6-870011e00861-1317736662.jpg/ORIG/resize/118x118%3E/extent/118x118/format/jpg/quality/80;15;11,3;40 MBit/s;telekom_layer_magenta_l;über VDSL;1900,0;REGULAR;11,3;113366298;;district_heating;n;True;MagentaZuhause L;n;Berlin;y;10;1,0;337,0;56;;5,73;121,0;Berlin;14057;well_kept;sophisticated;;False;100 MBit/s;no_information;"Suarezstra&szlig;e";y;https://padlock.link/ioml;https://padlock.link/ml;Suarezstraße;apartment;14057;4,0;;n;;2,active;True;Deutschland;schaufenster;100 MBit/s;wohnung_kauf;n;4,0;web,email,bank,music,dl-ul,game,sd,mltstr,hd,fast-ul-dl;True;002.01004615301;840000;profile0;5,0;4;True;n;showqualicontactform;n;n;Charlottenburg_Charlottenburg;AJS19051;6;Berlin;/expose/113366298;['ALT UND NEU IN EINZIGARTIGER VERBINDUNG - SUAREZ KOMBINIERT MODERNE WOHNANSPRÜCHE MIT DEM FLAIR VERGANGENER ZEITEN \n\nEin Spiegel des Stadtteils Berlin- Charlottenburg in einem anspruchsvoll gestalteten Ensemble. \n\nSUAREZ besteht aus zwei Gebäuden, einem Altbau zur Straße und dem Atelierhaus, einem sich harmonisch in den Charakter des Viertels einfügenden Neubau. Verbunden werden beide Objekte durch einen attraktiv gestalteten Gartenhof mit viel Grün, Sitzgelegenheiten und Spielmöglichkeiten für Kinder. Das 6 geschossige Wohnensemble SUAREZ bietet insgesamt 26 Eigentumswohnungen mit 8 PKW Tiefgaragen- Stellplätze. Beide Objekte – Alt- und Neubau – beeindrucken mit der hohen Qualität der Eigentumswohnungen, die hier, abgestimmt auf moderne Wohnansprüche, realisiert werden. \n\nIn den sechs Etagen des Altbaus liegen 15 Wohnungen mit 45 bis 145 Quadratmetern im Ist-Zustand mit viel Gestaltungsspielraum für individuelle Wohnideen zum Verkauf. Vorhandene historische Baubestandteile des Gemeinschaftseigentums werden sorgfältig erhalten und mit großem Aufwand in die Gegenwart transformiert.', 'DIE WICHTIGSTEN FAKTEN IM ÜBERBLICK\n\n+ 3-4 Zimmerwohnung mit ca. 122 m² \n+ Verkauf im Ist-Zustand\n+ Historische Stuck- und Altbauelemente\n+ Deckenhöhe zwischen 3,20 m und 3,50 m \n+ Helle und großzügige Räume\n+ Geräumiger Balkon / Loggia \n+ Ideale Ost-West-Ausrichtung \n+ Neue Fenster gemäß EnEV\n+ Beliebte Wohngegend \n+ Ideale Anbindung an den ÖPNV\n\nAUFWENDIGE REVITALISIERUNG DES GEMEINSCHAFTSEIGENTUMS\n\n+ Neugestaltung der Fassade \n+ Neugestaltung der Treppenhäuser \n+ Modernisierung der Haustechnik (Fernwärme) \n+ Modernisierung der Hauselektrik mit Videogegensprechanlage \n+ Attraktive Neugestaltung des Innenhofs durch Landschaftsarchitekten \n+ Personenaufzug \n', 'BERLIN VON SEINER BESTEN SEITE\n\nDie hohe Lebensqualität der Hauptstadt, ihre Vielfalt und Offenheit, ziehen Menschen aus aller Welt an. Und die ungebrochene Dynamik der Wirtschaft bietet die besten Chancen, um auf Dauer erfolgreich zu bleiben. Die Hauptstadt schafft dabei den Spagat zwischen ihrer industriellen Vergangenheit und der digitalen Zukunft. Eine Mischung, die Berlin für Talente aus aller Welt attraktiv macht. \n\nDer Stadtteil Charlottenburg, in dem SUAREZ liegt, spiegelt diesen Charme Berlins wider. Hier ist der Prunk vergangener Zeiten stets präsent. Zahlreiche Altbauten und viel Grün prägen das Straßenbild und verleihen dem schicken Viertel mit seinen Cafés und Salons ein französisches Flair. Eines der vielen Highlights des Stadtteils ist das Schloss Charlottenburg, das nördlich der Suarezstraße liegt. Der dazu gehörige Schlosspark ist eine grüne Oase mitten in der Stadt und der älteste Park Berlins. Ein malerisches Ziel für eine erholsame Auszeit – wenn man nicht das Glück hat, wie in SUAREZ in direkter Nähe des Lietzensees zu wohnen.', 'Die Wohnung wird provisionsfrei angeboten.\n\nReservierungen sind nach Besichtigung gegen eine Gebühr möglich. Weitere Informationen dazu erhalten Sie nach Besichtigung. \n\nWenn Sie Interesse an einer Besichtigung haben, bitten wir um Mitteilung. Besichtigungstermine werden grundsätzlich individuell stattfinden.\n\nDer Energieausweis befindet sich derzeit in der Erstellung und wird allen potentiellen Interessenten nach Erhalt versandt.'];;disabled;;;;84794,0;True;;
3;2020-05-25 22:33:21.329579;Berlin;floor_heating;ONE_YEAR_FREE;18027065;y;y;https://pictures.immobilienscout24.de/listings/57ec374b-48c7-4a28-9326-7201e394e649-1338579403.jpg/ORIG/resize/118x118%3E/extent/118x118/format/jpg/quality/80;11;11,37;40 MBit/s;telekom_layer_magenta_l;über VDSL;2019,0;REGULAR;11,37;114792688;1,0;;n;False;MagentaZuhause L;y;Berlin;y;10;9,0;312,0;15;;5,79;104,0;Berlin;10711;no_information;luxury;;False;100 MBit/s;no_information;"Katharinenstra&szlig;e";y;https://padlock.link/ioml;https://padlock.link/ml;Katharinenstraße;no_information;10711;4,0;;n;;2,active;True;Deutschland;standard;100 MBit/s;wohnung_kauf;n;2,0;web,email,bank,music,dl-ul,game,sd,mltstr,hd,fast-ul-dl;True;009.9233d0ff-ce69-47de-ab6b-2b67a0fbd406;785000;profile0;6,0;4;True;y;showqualicontactform;y;n;Wilmersdorf_Wilmersdorf;01.34;5;Berlin;/expose/114792688;['Vier individuelle Wohnhäuser in traditioneller Architektursprache und der erste Wohnturm der City West bilden gemeinsam das HIGH WEST in der Heilbronner Straße, Ecke Karlsruher und Katharinenstraße, im Charlottenburger Ortsteil Halensee. Eine Tiefgarage ergänzt das Ensemble auf dem insgesamt 5.000 Quadratmeter großen Grundstück.\nWährend die Häuser komplett neu entstehen, wird der bisher rein gewerblich genutzte Turm entkernt, mit einer modernen Natursteinfassade versehen und durch neue Trennwände in attraktive Wohneinheiten unterteilt. Ob man „hoch hinaus“ will oder es eher „bodenständig“ mag – das HIGH WEST bietet ein breites Spektrum an Wohnungen unterschiedlicher Größe und Ausrichtung. Ein ideales Zuhause sowohl für Familien als auch für Singles und Paare.\n\nHelligkeit prägt die Wohnungen im HIGH WEST, die bis ins letzte Detail durchdacht und kompakt angelegt sind: Die Schlafzimmer liegen zum ruhigen Innenhof, alle Aufenthaltsräume verfügen über große Fensterfronten und jede Wohnung erhält eine Loggia, einen Balkon oder eine Terrasse. Freuen Sie sich auf eine wertige Ausstattung, die sämtliche moderne Standards erfüllt – auf Wunsch sind auch Sonderausführungen möglich. Insbesondere für die Einrichtung der Küchen stehen verschiedene Optionen zur Auswahl. Sprechen Sie uns an, wir beraten Sie gern!', 'Vom lebhaften Ku’damm über die gemütlichen Kieze in direkter Nachbarschaft bis hin zur grünen Lunge, dem Grunewald: Rund um das HIGH WEST erwartet Sie eine bunte Mischung verschiedenster Spots, Quartiere und Naherholungsziele, die ein Großstadtleben voller Abwechslung und Inspirationen bieten.\n\nOb Radeln, Joggen, Paddeln oder Schwimmen: Der Grunewald bietet mit seiner Seenkette, der Havel und dem Wannsee unzählige Möglichkeiten für Erholungssuchende wie Sportbegeisterte. Mit der S-Bahn erreicht man das grüne Paradies vom Bahnhof Charlottenburg aus bereits in fünf Minuten! Schöne Spaziergänge ermöglicht auch der nahe Lietzensee mit seinen idyllischen Uferwegen.\n\nAbseits vom Großstadttrubel geht es am westlichen Ende des Stuttgarter Platzes beschaulich zu. Entlang der schönen Leonhardt- und Windscheidstraße reihen sich originelle Geschäfte und Boutiquen, kreative Werkstätten und Feinkostläden aneinander. In den vielen Cafés und Restaurants trifft sich ein buntes Publikum aus Jung und Alt zum geselligen Miteinander.'];104,0;;;;;;;;
4;2020-05-25 22:33:21.728925;Berlin;no_information;ONE_YEAR_FREE;97549;n;y;https://pictures.immobilienscout24.de/listings/9f49db7d-e2b2-451b-98a0-c378a626dfdf-1368014486.jpg/ORIG/resize/118x118%3E/extent/118x118/format/jpg/quality/80;16;11,12;40 MBit/s;telekom_layer_magenta_l;über VDSL;1933,0;REGULAR;11,12;114080793;;gas;n;False;MagentaZuhause L;y;Berlin;y;9;1,0;;27;energy_required;6,13;113,25;Berlin;10789;no_information;no_information;F;False;100 MBit/s;no_information;"N&uuml;rnberger Stra&szlig;e";n;https://padlock.link/ioml;https://padlock.link/ml;Nürnberger_Straße;apartment;10789;4,0;172,5;n;4,0;2,active;True;Deutschland;top;100 MBit/s;wohnung_kauf;n;3,0;web,email,bank,music,dl-ul,game,sd,mltstr,hd,fast-ul-dl;True;001.97549;699000;profile0;5,0;4;True;n;showqualicontactform;n;n;Charlottenburg_Charlottenburg;Nürnberger27:10;5;Berlin;/expose/114080793;"['- Balkon\n- Bad mit Dusche und Fenster\n- Vorderhaus\n- 3. Obergeschoss', ""Der Altbau befindet sich im Zentrum des ehemaligen West-Berlins in der Nähe der S- und U-Bahn-Station Zoologischer Garten mit Anbindungen zu mehreren Regionalbahnen, Bussen sowie S- und U-Bahnen.\n\nUnweit befindet sich der Kurfürstendamm (Ku'damm), die Kaiser-Wilhelm-Gedächtnis-Kirche,  das Kaufhaus des Westens (KaDeWe), das berühmte Café Kranzler mit Terrasse und der Zoologische Garten mit Aquarium.""]";;;;;;;;;
5;2020-05-25 22:33:22.073215;Berlin;no_information;ONE_YEAR_FREE;5783327;n;y;https://pictures.immobilienscout24.de/listings/b1aa951f-a833-4c8e-b353-0b591bce793c-1343454130.jpg/ORIG/resize/118x118%3E/extent/118x118/format/jpg/quality/80;9;11,3;40 MBit/s;telekom_layer_magenta_l;über VDSL;1906,0;REGULAR;11,3;114759095;;gas;n;False;MagentaZuhause L;y;Berlin;y;9;1,0;;44;;5,73;180,0;Berlin;14059;no_information;no_information;;False;100 MBit/s;no_information;Knobelsdorffstr.;n;https://padlock.link/ioml;https://padlock.link/ml;Knobelsdorffstr.;roof_storey;14059;5,0;;n;1,0;2,active;True;Deutschland;top;100 MBit/s;wohnung_kauf;n;5,0;web,email,bank,music,dl-ul,game,sd,mltstr,hd,fast-ul-dl;True;001.5783327;540000;profile0;5,0;5;True;n;showqualicontactform;n;n;Charlottenburg_Charlottenburg;149;7;Berlin;/expose/114759095;"['In attraktiver Charlottenburger Lage nahe dem Lietzensee und dem Charlottenburger Schloß befindet sich der Berliner Altbau Bj. 1904, in welchem ein Dachgeschoßrohling im Vorderhaus mit Baugenehmigung für zwei Wohnungen angeboten wird. Im Seitenflügel des Objekts ist bereits ein Dachgeschoßausbau erfolgt. Das Haus unterliegt dem Denkmalschutz und ist in der Denkmalliste Charlottenburg-Wilmersdorf aufgeführt. \nEs ist zur Zeit kein Aufzug im Objekt vorhanden.', '- Baugenehmigung\n- Holzschutztechnische Untersuchung\n- Baubeschreibung\n- Flächen- und Rauminhaltsberechnung\n- Flurkarte\n- Lageplan\n- Nutzungsmaßberechnung \n- Bauzeichnungen', 'Der Berliner Bezirk Charlottenburg-Wilmersdorf ist die  begehrteste Lage in der City-West der Hauptstadt.\nEine exzellente Verkehrsanbindung, nahegelgende Grünanlagen sowie eine hervorragende Infrastruktur von Kultur-, Bildungs- und Versorgungseinrichtungen sprechen für sich.\nS-Bahn (S-Bahn Messe-Nord ICC): S2, S25, S41, S42, S46\nU-Bahn (U-Bahnhof Kaiserdamm): U2', 'Alle Angaben beruhen auf Informationen unseres Auftraggebers und erfolgen daher ohne Gewähr. \nBitte schicken Sie Ihre schriftliche Anfrage mit vollständiger Adressangabe und der Angabe Ihrer Telefonnummer. \nBesichtigungstermine sind nach Absprache auch an den Wochenenden möglich.\n ""Ich freue mich auf Ihre Anfrage!"".']";2,0;;;;;;;;
6;2020-05-25 22:33:22.521170;Berlin;oil_heating;ONE_YEAR_FREE;99526;n;y;https://pictures.immobilienscout24.de/listings/1f1faada-e020-44ea-90ea-2108a742f2c8-1362476628.jpg/ORIG/resize/118x118%3E/extent/118x118/format/jpg/quality/80;9;9,57;40 MBit/s;telekom_layer_magenta_l;über VDSL;1973,0;REGULAR;9,57;114845606;1,0;no_information;y;True;MagentaZuhause L;y;Berlin;y;9;3,0;;no_information;energy_consumption;4,05;135,15;Berlin;14195;well_kept;no_information;;False;100 MBit/s;no_information;no_information;n;https://padlock.link/ioml;https://padlock.link/ml;no_information;apartment;14195;4,0;209,8;n;;2,active;True;Deutschland;premium;100 MBit/s;wohnung_kauf;n;1,0;web,email,bank,music,dl-ul,game,sd,mltstr,hd,fast-ul-dl;True;001.99526;662235;profile0;2,0;4;True;y;showqualicontactform;n;n;Dahlem_Zehlendorf;12549;6;Berlin;/expose/114845606;['Sie würden gerne in einer gehobenen und gewachsenen Lage in einem der wohlhabendsten Stadtteile Berlins investieren? Das scheint aufgrund von hohen Einstiegspreisen und wenigen verfügbaren Objekten unmöglich? Diese vermietete 4-Zimmer-Eigentumswohnung Im Dol in Berlin-Dahlem befindet sich in einer namhaften Wohngegend, bietet eine krisensichere und aufgrund des fairen Einstiegspreises wertsteigernde Investmentmöglichkeit. Doch nicht nur als Investment perfekt, sondern auch zur Eigennutzung: Die Wohnung könnte für die eigenen Kinder, die an der naheliegenden Freien Universität studieren, oder als Zweitwohnung genutzt werden. Die Wohnung befindet sich in einem gepflegten, jedoch erneuerungsbedürftigen Zustand.', 'Krisensicheres Investment\r\nFairer Einstiegskaufpreis\r\nLeicht vermietbare Lage, da gehobene Wohngegend mit Botschaften und Freier Universität in der Nähe\r\nSowohl als Investment als auch zur Eigennutzung geeignet', 'Wer in Berlin-Dahlem wohnt, der schätzt die besondere Mischung aus dörflichem Ambiente und großstädtischem Charme: Einerseits ist die Natur mit den vielen Bäumen, Parks und dem weitläufigen Grunewald prägend, andererseits sorgen die Freie Universität, mehrere Museen und Botschaften für internationales Flair. Wem die Geschäftigkeit des studentischen Lebens nicht reicht, der kann die grüne Idylle in nur einem Katzensprung durch das pulsierende Treiben auf Berlins bekanntester Einkaufsmeile, dem Kurfürstendamm, eintauschen. Dank U-Bahn oder Auto ist man in wenigen Minuten am Puls der Zeit mit seinen edlen Boutiquen und gehobenen Restaurants. \r\nWer gut essen gehen möchte, muss aber nicht unbedingt den Stadtteil verlassen: Im Chalet Suisse direkt am Grunewald lassen sich Schweizer Spezialitäten, hausgemachte Kuchen am Roseneck oder authentische italienische Küche im La Maremma genießen. Mehrere Tennisclubs, weitläufige Reit-Wege im Grunewald und verschiedene Fitness-Studios sorgen für den perfekten Freizeitausgleich. Für Familien mit Kindern bietet Berlin Dahlem sehr gute Kindertagesstätten und Schulen.'];;disabled;;;True;;;;
7;2020-05-25 22:33:22.883715;Berlin;central_heating;ONE_YEAR_FREE;76007;n;y;https://pictures.immobilienscout24.de/listings/88684aed-5866-478e-85eb-624a2bc9d414-1371147584.jpg/ORIG/resize/118x118%3E/extent/118x118/format/jpg/quality/80;13;7,89;40 MBit/s;telekom_layer_magenta_l;über VDSL;1895,0;REGULAR;7,89;115186694;;oil;y;True;MagentaZuhause L;y;Berlin;n;10;1,0;780,17;no_information;energy_consumption;3,38;184,33;Berlin;14193;well_kept;no_information;F;False;100 MBit/s;no_information;no_information;n;https://padlock.link/ioml;https://padlock.link/ml;no_information;roof_storey;14193;4,0;168,1;n;15761,0;2,active;True;Deutschland;standard;100 MBit/s;wohnung_kauf;n;3,0;web,email,bank,music,dl-ul,game,sd,mltstr,hd,fast-ul-dl;True;001.76007;795000;profile0;3,0;4;True;n;showqualicontactform;n;n;Grunewald_Wilmersdorf;50981;7;Berlin;/expose/115186694;"['Traumhafte Altbau-Dachgeschoss-Maisonettewohnung mit Blick ins Grüne und Teilblick zum Dianasee. Diese exklusiv über uns angebotene 3-Zimmer-ETW befindet sich im 3. OG (DG) eines Gebäudes aus dem Jahre 1895, welches im Jahr 1953-1957 nach dem Krieg neu aufgebaut und in 17 Einheiten aufgeteilt wurde.\r\n\r\nÜber das Treppenhaus (kein Fahrstuhl) gelangen Sie in die ca. 135 m² große Wohnung. Sie teilt sich auf in ein geräumiges Entree, ein Badezimmer, eine Küche, ein Wohnzimmer mit Balkon, eine Diele und 2 Zimmer. Das Besondere an dieser Einheit sind die vielen Stauräume in den begehbaren Kniestöcken, die hochwertigen Einbauschränke passend zum Stil der Wohnung und die zugeordnete Sondernutzungsfläche im Dachstuhl. Das Badezimmer, welches weiß gefliest ist, bietet eine Dusche, ein Waschbecken und ein WC. Das Highlight bildet der schöne Sonnenbalkon in Südwestlage, in zweiter Reihe zum Seeufer.\r\n\r\nDer Dachstuhl ist aufgeteilt und bietet Stauraumflächen (Kellerersatz) für die zugeordneten Wohnungen. Der hier zur Wohnung gehörende Stauraum wurde mit der unteren 3 Zimmer-Wohnung verbunden und ist als Sondernutzungsfläche (lt. Ergänzungen der Teilungserklärung mit einer Fläche von ca. 48 m²) über eine Treppe innerhalb der Wohnung zu begehen. Er bietet Stau- und Nutzflächen sowie ein Wannenbad. \r\nDie genaue Aufteilung entnehmen Sie bitte den Plänen. Das Bad wurde vom Bauamt genehmigt, die Sondernutzungsfläche ist beheizt und wurde in den 70er Jahren ausgebaut.\r\n\r\nDas mtl. Hausgeld beträgt 745,17 EUR inkl. 93,71 EUR Rücklagen, Heizkosten und den Betriebskosten. Das Anmieten eines KFZ-Stellplatzes (ca. 35,- EUR) auf dem Hof ist ggf. möglich.\r\n\r\nInteressiert? 1. Exposé anfordern 2. virtuellen 360°-Rundgang erleben 3. diskrete Lagebegutachtung von außen 4. persönliche Besichtigung.', ""Der ruhige und grüne Ortsteil Grunewald im Stadtbezirk Charlottenburg/Wilmersdorf gehört neben Dahlem zu den begehrtesten und teuersten Wohnlagen in Berlin. Die Nachbarschaftsbebauung ist durch herrschaftliche Villen, exklusive Einfamilienhäuser oder durch Stadtvillen mit Eigentumswohnungen geprägt. Die unmittelbare Nähe zur City (ca. 5 Minuten bis zum Kurfürstendamm) verbunden mit Naherholung (Wälder und Seen) machen diese Lage einzigartig. Vor allem die Nähe zur City-West, die gute Verkehrsanbindung (S-Bahnhof Grunewald, M19, M186), die vielen Villen und Landhäuser, die kleinen Seen und das viele Grün in den Straßen sowie der Grunewald selbst lassen ein Wohn- und Erholungsgefühl entstehen, das so in der Stadt seinesgleichen sucht.\r\n\r\nHier können Eigentumswohnungen bis zu 10.000 EUR/m² kosten. Wer mieten möchte, muss mit einem Niveau von ca. 15 EUR inkl. Nebenkosten pro m² rechnen. Auch die Baulandpreise sind nirgendwo in Berlin höher als hier. Bedeutende Persönlichkeiten aus Politik, Wirtschaft, Wissenschaft und Kultur ließen sich hier bereits zu Kaiser's Zeiten nieder und noch heute residiert hier ein Teil der Bundes- und Berliner Prominenz. 13 Botschaften und 10 Botschafterresidenzen haben sich in dem exklusiven Ortsteil niedergelassen. Mit dem Auto benötigt man wenige Minuten, um auf die Stadtautobahn oder die Avus zu gelangen.""]";;;1993,0;;;;;;
8;2020-05-25 22:33:23.254692;Berlin;central_heating;ONE_YEAR_FREE;16225148;n;y;https://pictures.immobilienscout24.de/listings/52740516-3d5f-4b8d-ba64-36a423f59a50-1331897040.jpg/ORIG/resize/118x118%3E/extent/118x118/format/jpg/quality/80;8;12,24;40 MBit/s;telekom_layer_magenta_l;über VDSL;1905,0;REGULAR;12,24;113558875;;natural_gas_light;n;False;MagentaZuhause L;y;Berlin;n;8;1,0;;no_information;energy_required;6,53;126,0;Berlin;10781;no_information;no_information;D;False;100 MBit/s;no_information;no_information;y;https://padlock.link/ioml;https://padlock.link/ml;no_information;apartment;10781;4,0;126,6;n;;2,active;True;Deutschland;standard;100 MBit/s;wohnung_kauf;n;1,0;web,email,bank,music,dl-ul,game,sd,mltstr,hd,fast-ul-dl;True;001.15930480;419000;profile0;5,0;4;True;n;showqualicontactform;n;n;Schöneberg_Schöneberg;726;6;Berlin;/expose/113558875;['Die hier angebotene, vermietete Wohnung befindet sich im 1. OG eines schönen Mehrfamilienhauses aus der Gründerzeit.\nSie verfügt über vier Zimmer, die neben der Küche, dem Bad und der Abstellkammer alle vom Flur aus abgehen. Die für diese Altbau-Wohnungen typischen hohen Decken verleihen den Räumen eine offene Großzügigkeit und vermitteln gleich beim Betreten der Wohnung eine gemütliche Wohn-Atmosphäre. Ein kleiner Balkon sorgt für zusätzlichen Wohnkomfort.\n ', 'Das Objekt liegt im Trendkiez Berlin-Schöneberg, der zweifelsohne zu den begehrten Wohnlagen Berlins gehört.\nDie Vielzahl der Einrichtungen hinsichtlich Versorgung und Kultur, Schulen und Kita´s, Cafés und Restaurants mit besonderem Ambiente rund um den Winterfeldtplatz werden besonders von Familien, Künstlern und Studenten geschätzt. \nDie zentrale Lage zwischen Kurfürstendamm und Potsdamer Platz sowie die ideale Anbindung an den öffentlichen Nahverkehr bieten ideale Voraussetzungen für ein mobiles Leben mitten in der Stadt und machen dieses Investment besonders attraktiv.'];;disabled;;;;;;;
9;2020-05-25 22:33:23.600166;Berlin;district_heating;ONE_YEAR_FREE;76007;n;y;https://pictures.immobilienscout24.de/listings/df87da57-4ec7-40fb-9a3c-c58d4a799de2-1350941535.jpg/ORIG/resize/118x118%3E/extent/118x118/format/jpg/quality/80;18;11,37;40 MBit/s;telekom_layer_magenta_l;über VDSL;1900,0;REGULAR;11,37;114292664;;district_heating;y;True;MagentaZuhause L;y;Berlin;y;10;1,0;480,0;no_information;energy_consumption;5,8;145,64;Berlin;10711;well_kept;no_information;E;False;100 MBit/s;no_information;no_information;y;https://padlock.link/ioml;https://padlock.link/ml;no_information;apartment;10711;6,0;130,7;n;16101,0;2,active;True;Deutschland;standard;100 MBit/s;wohnung_kauf;n;4,0;web,email,bank,music,dl-ul,game,sd,mltstr,hd,fast-ul-dl;True;001.76007;849000;profile0;6,0;5;True;n;showqualicontactform;n;n;Wilmersdorf_Wilmersdorf;66519;6;Berlin;/expose/114292664;['Bitte vervollständigen Sie das Anfrageformular mit Ihrem Namen, um ein vollständiges Exposé mit Lagebezeichnung zu erhalten und einen Besichtigungstermin zu vereinbaren. Herzlichen Dank!\r\nSchon bei Betreten des Gebäudes werden Sie durch den sehr guten Zustand der Original-Elemente im Hauseingang begeistert sein. Das Mehrfamilienhaus wurde ca. im Jahre 1900 erbaut. Die hier von uns exklusiv angebotene klassische Berliner Altbauwohnung befindet sich im dritten Obergeschoss, das Sie bequem über einen Aufzug oder auch das Treppenhaus erreichen können.\r\nDie Wohnung bietet ein überaus großzügiges Wohnen mit sehr gut erhaltenen Details aus der Jugendstilzeit. Die Wohnfläche von insgesamt ca. 145,64 m² verteilt sich auf sechs Zimmer, ein tagesbelichtetes Wannenbad, eine Küche mit sehr hochwertiger Einbauküche, einen Flur sowie eine Diele. Die genaue Raumaufteilung entnehmen Sie bitte dem beigefügten Grundriss.\r\nDie großzügigen Zimmer mit einer Deckenhöhe von ca. 3,50 m haben durchgängig noch alle Elemente, wie Stuck, Flügeltüren, original erhaltene Verglasungen und das ursprünglich verlegte Fischgrät-Parkett bzw. Dielenböden. An den sehr gut erhaltenen, aus dem Baujahr stammenden Kassettentüren und Doppelfenstern sind alle originalen Oliven und Klinken vorhanden.\r\nDer gesamte Bereich Küche, Wannenbad und Gäste-WC wurde im Jahr 2006 von Grund auf neu aufgebaut. Das Badezimmer verfügt zusätzlich über eine elektrisch betriebene Fußbodenheizung. Die hochwertige Einbauküche nutzt die Deckenhöhe nahezu vollständig aus.\r\nEine nach Nordosten gerichtete Loggia über die vollständige Breite von zwei Zimmern rundet das Angebot ab.\r\nDie Wohnung ist ein wirkliches Schmuckstück in einem beeindruckenden Gebäude in bester und gefragtester Lage Berlins.\r\nDie Beheizung der Wohnung sowie die Warmwasserversorgung erfolgen komfortabel über das Fernwärmenetz. Das monatliche Hausgeld beträgt zurzeit ca. 480,00 EUR und beinhaltet neben den allgemeinen Hausnebenkosten die Heizkosten und die Insta...', 'Der Berliner Stadtbezirk Charlottenburg ist der City-West zugehörig und zählt seit je her zu den begehrtesten Wohnlagen der Hauptstadt. Die Anhänger urbaner Lebensformen finden in Charlottenburg gehobene Gastronomie, viele Kulturstätten, das Theater des Westens, die Deutsche Oper, mehrere Museen, eine große Anzahl an Kinos, zahllose Kneipen, das Olympiastadion, die Waldbühne, das Schloss Charlottenburg u.v.m. Die exklusive Eigentumswohnung liegt nahe des Adenauerplatzes in einer sehr guten Wohnlage. Die nähere Umgebung lässt ihre Bewohner die angenehme und lebendige Atmosphäre der Weltstadt Berlin deutlich spüren. Auf dem nahe gelegenen Kurfürstendamm finden Sie Geschäfte des täglichen Bedarfs, exklusive Boutiquen und mehrere namhafte Bars. Die Anbindung an das öffentliche Verkehrsnetz ist durch die zentrale Stadtlage besonders gut. Zur U-Bahnstation Adenauerplatz gelangt man in wenigen Gehminuten genauso schnell erreichen Sie den nahe gelegenen S- und Regionalbahnhof Berlin-Charlottenburg.'];;;;;;;;;
10;2020-05-25 22:33:23.963199;Berlin;district_heating;ONE_YEAR_FREE;15754699;n;y;https://pictures.immobilienscout24.de/listings/4c513c40-6d5f-4e6e-a2d6-3e4b4c3f6146-1362566760.jpg/ORIG/resize/118x118%3E/extent/118x118/format/jpg/quality/80;14;11,3;40 MBit/s;telekom_layer_magenta_l;über VDSL;1900,0;REGULAR;11,3;113290068;;district_heating;n;False;MagentaZuhause L;y;Berlin;y;10;1,0;501,14;24;energy_required;5,73;167,5;Berlin;14059;no_information;no_information;;False;100 MBit/s;no_information;Wundtstr.;n;https://padlock.link/ioml;https://padlock.link/ml;Wundtstr.;apartment;14059;5,0;137,0;n;;2,active;True;Deutschland;top;100 MBit/s;wohnung_kauf;n;1,0;web,email,bank,music,dl-ul,game,sd,mltstr,hd,fast-ul-dl;True;001.15650116;829000;profile0;4,0;5;True;n;;n;n;Charlottenburg_Charlottenburg;6079;7;Berlin;/expose/113290068;['Die hier angebotene Wohnung befindet sich im Vorderhaus und verfügt über fünf Zimmer, eine Küche und zwei Bäder.\nUrsprünglich bestand die Wohnung aus zwei separaten Wohneinheiten, die zu einer großen Wohnung zusammengefügt wurden. \nDie Fassade des Hauses wird momentan von dem derzeitigen Eigentümer überarbeitet. \nDas Gebäude in der Wundtstraße 24 besteht aus Vorderhaus und Seitenflügel und verfügt rückseitig über einen ruhigen und gemütlich gestalteten Innenhof.\n', 'Tolle Lage nahe Kaiserdamm und Lietzensee.\nDie Lage sowie die Verkehrsanbindung sind optimal. Nur wenige Fahrminuten von der Stadtautobahn und dem Kurfürstendamm entfernt.\n\nMitten in der City-West gibt es ein vielfältiges Angebot an Aktivitäten. Besonders hervorzuheben sind natürlich der nahegelegene Lietzensee mit seinen idyllischen Uferwegen sowie der Schlosspark des Charlottenburger Schlosses, der zu ausgiebigen Spaziergängen oder Joggingrunden einlädt.\n\n'];;disabled;;;;;;;
