12;2020-05-25 22:32:49.810545;Berlin;gas_heating;ONE_YEAR_FREE;5112798;n;y;https://pictures.immobilienscout24.de/listings/0d6e0b27-235c-42e1-a656-23ff0f57bf51-1368643895.jpg/ORIG/resize/118x118%3E/extent/118x118/format/jpg/quality/80;1;10,14;40 MBit/s;telekom_layer_magenta_l;über VDSL;1918,0;REGULAR;10,14;118267351;;gas;y;False;MagentaZuhause L;y;Berlin;y;9;1,0;348,0;no_information;;5,19;130,0;Berlin;14193;well_kept;sophisticated;;False;100 MBit/s;no_information;no_information;y;https://padlock.link/ioml;https://padlock.link/ml;no_information;apartment;14193;4,0;;n;;2,active;True;Deutschland;standard;100 MBit/s;wohnung_kauf;n;3,0;web,email,bank,music,dl-ul,game,sd,mltstr,hd,fast-ul-dl;True;001.5112798;750000;profile0;5,0;4;True;n;showqualicontactform;n;n;Schmargendorf_Wilmersdorf;118267351;6;Berlin;/expose/118267351;"['Die großzügige Eigentumswohnung liegt im 3. OG eines Gründerzeitaltbaus im Berliner Ortsteil ""Schmargendorf"". Die Wohnung befindet sich in einem liebevoll renovierten Zustand.', 'Insgesamt verfügt die Wohnung über 4 Zimmer, wobei derzeit 2 Zimmer zusammengelegt worden sind. Mit wenig Aufwand lässt sich diese Maßnahme aber wieder rückgängig machen. Des Weiteren sind zwei Balkone und eine Loggia vorhanden. Der Zugang ist sowohl über das Treppenhaus als auch über einen Personenaufzug möglich.', 'Die Umgebung zeichnet sich durch ihre Nähe zur City West stadteinwärts und den weitreichenden Grün- und Erholungsflächen stadtauswärts aus. Der Bahnhof S-Bahnhof ""Hohenzollerndamm"" befindet sich in fußläufiger Entfernung. In naher Umgebung lädt u. a. der Hubertussee zum Spazieren und Verweilen ein.', 'Die Wohnung wird nach Absprache bezugsfrei übergeben.']";;;;;;;;;
13;2020-05-25 22:32:50.147095;Berlin;central_heating;ONE_YEAR_FREE;35456;n;y;https://pictures.immobilienscout24.de/listings/53187d4b-3f1d-470e-9d97-febc2f31ffa5-1370105925.jpg/ORIG/resize/118x118%3E/extent/118x118/format/jpg/quality/80;12;12,24;40 MBit/s;telekom_layer_magenta_l;über VDSL;1903,0;REGULAR;12,24;118528537;;gas;y;False;MagentaZuhause L;y;Berlin;y;10;1,0;395,0;no_information;;6,53;157,14;Berlin;10829;modernized;normal;;False;100 MBit/s;no_information;no_information;y;https://padlock.link/ioml;https://padlock.link/ml;no_information;maisonette;10829;4,0;;n;;2,active;True;Deutschland;top;100 MBit/s;wohnung_kauf;n;4,0;web,email,bank,music,dl-ul,game,sd,mltstr,hd,fast-ul-dl;True;001.35456;830000;profile0;4,0;4;True;n;showqualicontactform;n;n;Schöneberg_Schöneberg;118528537;7;Berlin;/expose/118528537;['Zum Verkauf kommt eine ruhig und hell gelegene Altbauwohnung im vierten Obergeschoss eines  modernisierten Altbaumehrfamilienhauses mit Zugang durch innen liegende Wendeltreppe zum ausgebauten Dachraum mit großzügigem Zimmer und vorgelagerter Sonnenterrasse. \nEingang ist über das IV. Obergeschoss. Hier befinden sich drei separat vom Flur zugängliche Zimmer, eine geräumige Küche mit Vorrats-/Wirtschaftskammer und ein tagesbelichtetes Duschbad. Dem Wohnzimmer ist ein kleiner Balkon vorgelagert.\n\nÜber eine Wendeltreppe gelangt man zum ausgebauten Dachgeschoss mit einem weiteren Bad, WC sowie eingebauter Sauna. Vom großzügigen Zimmer (ca. 50 m²) erreicht man die Sonnenterrasse (13,14 m² brutto).\n\nDie Wohnung ist bequem über einen modernen Lift zu erreichen !', 'Original Stuckelemente, Balkon, Terrasse, Einbauküche, Bad mit Fußbodenheizung  , Bad mit Sauna, Gäste-WC.\n\nModerner Fahrstuhl (Baujahr 2014), neuere Heizungsanlage.', 'Absolut ruhige Wohnlage im Herzen von Schöneberg unweit Akazienkiez. Gute Verkehrsanbindung mit S-Bahnanbindung nach Berlin-Mitte.', 'Im Qualifizierten Alleinauftrag !'];;;1990,0;;;;;;
14;2020-05-25 22:32:50.713795;Berlin;central_heating;ONE_YEAR_FREE;5240003;n;y;https://pictures.immobilienscout24.de/listings/020ba424-c38a-4ed9-8768-51b1f1d9efe4-1370718438.jpg/ORIG/resize/118x118%3E/extent/118x118/format/jpg/quality/80;17;9,73;10 MBit/s;telekom_layer_magenta_m;über VDSL;1978,0;REGULAR;9,73;118640874;1,0;gas;y;False;MagentaZuhause M;y;Berlin;y;9;3,0;550,0;0;;3,79;102,0;Berlin;14195;well_kept;no_information;;False;50 MBit/s;underground_garage;Lentzeallee;n;https://padlock.link/iomm;https://padlock.link/mm;Lentzeallee;apartment;14195;4,0;;n;;2,active;True;Deutschland;standard;50 MBit/s;wohnung_kauf;n;2,0;web,email,bank,music,dl-ul,game,sd,mltstr,hd,fast-ul-dl;True;001.5240003;670000;profile0;2,0;4;True;n;showqualicontactform;n;n;Dahlem_Zehlendorf;ETW 22052020-002;5;Berlin;/expose/118640874;['Das Haus beziehungsweise das Wohnviertel wurde ca. 1978 erbaut und befindet sich in einem sehr gepflegten Zustand.\n\nIm Zuge der Sanierungsmaßnahmen, die 2019 stattfanden, wurden die Dächer erneuert.\n\nDie Einheit ist sehr praktisch und modern mit Nord-Süd-Ausrichtung geschnitten und weist ohne der Terrassen eine Wohnfläche von ca. 102 m² auf. Die Nutzfläche umfasst ca. 118 m².\n\nDiese bestehen aus dem Flur und dem Gäste-WC im Eingangsbereich, aus 2 kleineren ca. 10 m² großen Kinder- oder Arbeitszimmern mit jeweils einem Zugang zur Terrasse, einem geräumigen Wohnzimmer mit ebenfalls einem Zugang zur Terrasse, einer Küche mit EBK, großen Schlafzimmer und einem Wannenbad mit Fenster. Vom Flur aus ist die zweite Terrasse, die nach Osten ausgerichtet ist, erreichbar.\n\nDie komplette Wohnung wurde ca. 2017 renoviert.\n\nAls Fußbodenbelag wurde in der Wohnung hochwertiges Eichenparkett und im Badbereich große Fliesen verlegt.\n\nDes Weiteren gibt es einen Tiefgaragenstellplatz, der im Kaufpreis inkludiert ist.\n\nEin trockener Kellerraum rundet das ansprechende Angebot ab.', 'Die Wohnung befindet sich im 2. OG eines Vorderhauses in beliebtem südwestlichen Ortsteil Dahlem im Bezirk Zehlendorf, das zu den wohlhabendsten Wohngebieten von Berlin zählt. \n\nViele Villen und Parkanlagen prägen das Bild des Ortsteils. Unter anderem sind viele Wissenschaftseinrichtungen, Universitäten und Museen angesiedelt.\n\nFußläufig erreichen Sie mühelos zahlreiche Einkaufsmöglichkeiten, verschiedene Bars und Restaurants, medizinische Versorgungen, Schulen, Kitas und viel mehr, die sich in der unmittelbaren Umgebung befinden um Ihre alltäglichen Bedürfnisse zu erledigen.'];118,0;;2019,0;;;;;;
15;2020-05-25 22:32:51.102778;Berlin;oil_heating;ONE_YEAR_FREE;99526;n;y;https://pictures.immobilienscout24.de/listings/bd42f162-57ca-4abe-8782-3ebd455e5837-1371241805.jpg/ORIG/resize/118x118%3E/extent/118x118/format/jpg/quality/80;10;9,73;40 MBit/s;telekom_layer_magenta_l;über VDSL;1973,0;REGULAR;9,73;118340201;1,0;no_information;y;True;MagentaZuhause L;y;Berlin;y;9;3,0;;no_information;energy_consumption;3,79;105,94;Berlin;14195;well_kept;no_information;;False;100 MBit/s;no_information;no_information;n;https://padlock.link/ioml;https://padlock.link/ml;no_information;apartment;14195;3,5;209,8;n;;2,active;True;Deutschland;premium;100 MBit/s;wohnung_kauf;n;1,0;web,email,bank,music,dl-ul,game,sd,mltstr,hd,fast-ul-dl;True;001.99526;519106;profile0;2,0;3;True;y;showqualicontactform;n;n;Dahlem_Zehlendorf;12546;5;Berlin;/expose/118340201;['Im Dol – das ist nicht einfach nur eine Adresse, sondern eine der begehrtesten Wohnlagen im gut situierten Berlin-Dahlem. Diese optimal geschnittene, renovierungsbedürftige 3,5-Zimmer-Wohnung mit Balkon bietet besonders viel Wohnkomfort: Die Schlafzimmer sind von der Küche und dem Wohnbereich durch einen Flur abgetrennt. Ideal für Kinder oder Selbstständige, die Ruhe brauchen. Die gesamte Wohnung ist in einem gepflegten Zustand, ist allerdings renovierungsbedürftig.\r\nUnd so könnte ein typischer Sonntag für Sie in Ihrem neuen Zuhause aussehen: Ein ausgiebiges Frühstück auf dem Balkon, der Blick schweift von der Zeitung in die Baumwipfel der zahlreichen Kiefern. Plötzlich huscht ein Eichhörnchen vorbei und sorgt mit seiner Geschäftigkeit für ein Schmunzeln. Anschließend ein schöner Spaziergang im Grunewald, der nur einen Steinwurf entfernt liegt. Abends auf einen Cocktail zum Ku’damm an, der in nur zehn Autominuten erreichbar ist.\r\nHinweis: Bei den Innenaufnahmen handelt es sich um Beispiele.', 'Tageslichtbad mit Wanne\r\nGästebad\r\nBalkon\r\n2,80 Meter hohe Decken', 'Wer in Berlin-Dahlem wohnt, der schätzt die besondere Mischung aus dörflichem Ambiente und großstädtischem Charme: Einerseits ist die Natur mit den vielen Bäumen, Parks und dem weitläufigen Grunewald prägend, andererseits sorgen die Freie Universität, mehrere Museen und Botschaften für internationales Flair. Wem die Geschäftigkeit des studentischen Lebens nicht reicht, der kann die grüne Idylle in nur einem Katzensprung durch das pulsierende Treiben auf Berlins bekanntester Einkaufsmeile, dem Kurfürstendamm, eintauschen. Dank U-Bahn oder Auto ist man in wenigen Minuten am Puls der Zeit mit seinen edlen Boutiquen und gehobenen Restaurants. Wer gut essen gehen möchte, muss aber nicht unbedingt den Stadtteil verlassen: Im Chalet Suisse direkt am Grunewald lassen sich Schweizer Spezialitäten, hausgemachte Kuchen am Roseneck oder authentische italienische Küche im La Maremma genießen. Mehrere Tennisclubs, weitläufige Reit-Wege im Grunewald und verschiedene Fitness-Studios sorgen für den perfekten Freizeitausgleich. Für Familien mit Kindern bietet Berlin Dahlem sehr gute Kindertagesstätten und Schulen.'];;disabled;;;True;;;;
16;2020-05-25 22:32:51.459616;Berlin;gas_heating;ONE_YEAR_FREE;18654944;n;y;https://pictures.immobilienscout24.de/listings/8bd13396-3286-4332-ac3f-e4b1fe71e196-1369684761.jpg/ORIG/resize/118x118%3E/extent/118x118/format/jpg/quality/80;24;12,24;40 MBit/s;telekom_layer_magenta_l;über VDSL;1894,0;REGULAR;12,24;118429453;;natural_gas_light;y;False;MagentaZuhause L;n;Berlin;y;9;1,0;197,0;11;;6,53;113,0;Berlin;10777;refurbished;luxury;;False;100 MBit/s;no_information;"Martin-Luther-Stra&szlig;e";n;https://padlock.link/ioml;https://padlock.link/ml;Martin-Luther-Straße;apartment;10777;4,0;;n;;2,active;True;Deutschland;premium;100 MBit/s;wohnung_kauf;n;1,0;web,email,bank,music,dl-ul,game,sd,mltstr,hd,fast-ul-dl;True;009.11a63ed3-a41f-496f-a417-1b0f41efcf17;675000;profile0;1,0;4;True;n;showqualicontactform;n;n;Schöneberg_Schöneberg;ad9996eb-d839-46e5-80b2-145742510a4f;5;Berlin;/expose/118429453;['PROVISIONSFREI!!! Diese schöne und sanierte Wohnung im ersten Stock zeichnet sich durch eine luxuriöse Innenausstattung aus und steht ab sofort zum Kauf. Das klassische Altbau wurde komplett renoviert und unter anderem mit neuen Bädern, Küche und modernen Beleuchtungssystemen ausgestattet. Dezenter Deckenstuck ist teilweise erhalten.\n\nWenn Sie die Wohnung betreten, stehen Sie im großen offenen Wohnbereich, der ringsum Fenster hat und daher extrem hell ist. Direkt von diesem Raum sowie vom Flur aus erreichen Sie einen weiteren Raum, in dem sich der historische Fliesenofen und die typische repräsentative Doppeltür zum Wohnbereich befinden.\n\nDieser schöne und sehr gemütliche Bereich ist durch eine platzsparende Schiebetür (Einbauküche ohne Elektrogeräte) mit Zugang zum Balkon von der Küche getrennt.\n\nDie Gästetoilette befindet sich gegenüber der Küche. Hinter dem privaten Bereich beginnen die beiden Schlafzimmer und das Duschbad.\nDiese beiden Doppelzimmer sind mit geräumigen weißen Hochglanz-Einbauschränken ausgestattet.\n\nDarüber hinaus ist die gesamte Wohnung mit modernen und hochwertigen Beleuchtungssystemen von Osram-LED ausgestattet und ermöglicht dem zukünftigen Eigentümer den sofortigen Einzug. Es fällt keine Provision an.', 'Der Teilbezirk Schöneberg glänzt wie kaum eine anderer mit seiner pulsierenden Lebenszeit und einer hervorragenden Infrastruktur. Das weltbekannte Warenhaus KaDeWe am Wittenbergplatz sowie die zur City West gehörende Tauentzienstraße stellen das ebenso eindrucksvoll unter Beweis wie der über die Grenzen Berlins hinaus bekannte Markt am  Winterfeldplatz, wie die legenden Bars, Cafes und Restaurants in der gesamten Wohngegend. Schönebergs Stadtbild ist geprägt durch eine Architektur, die historische Altbauten mit modernen Neubauten zu verbinden versteht. Eine schöne, sichere Gegend mit hervorragender Verkehrsanbindung.'];;;2017,0;;;;;;
17;2020-05-25 22:32:51.946128;Berlin;floor_heating;;17541223;n;y;https://pictures.immobilienscout24.de/listings/91e6e808-9f70-4bda-983e-b509440db691-1370046524.jpg/ORIG/resize/118x118%3E/extent/118x118/format/jpg/quality/80;5;11,16;;;;2018,0;;11,16;112453915;1,0;district_heating;n;False;;n;Berlin;y;10;9,0;;25;energy_required;6,35;126,6;Berlin;10585;first_time_use;sophisticated;B;False;;underground_garage;"Kaiser-Friedrich-Stra&szlig;e";y;;;Kaiser-Friedrich-Straße;apartment;10585;4,0;58,3;n;;2,active;;Deutschland;premium;;wohnung_kauf;n;2,0;;False;002.01008272719;784900;profile0;;4;True;n;;y;n;Charlottenburg_Charlottenburg;39.;6;Berlin;/expose/112453915;['Ihr Zuhause in der City West \nInmitten Charlottenburgs schönsten Kiezen, genauer in der Kaiser-Friedrich-Straße 25, entstehen 63 Neubau-Eigentumswohnungen. Berlin-Charlottenburg ist dabei in seiner Tradition so modern wie nie. Unter hochgewachsenen Bäumen, auf den breiten Berliner Bordsteinen zwischen Schloss, Lietzensee und Spree tummelt sich das Leben, gut vernetzt und perfekt angebunden. Wohnungen in der Kaiser-Friedrich-Straße 25 passen nicht nur heute zu Ihrem Leben, sondern auch übermorgen. Einfach mit Weitblick.\n\nIn zeitlosem Design hält sich die Fassade im Straßenbild diskret zurück. Das Mehrfamilienhaus entfaltet sich rückseitig zu seiner vollen Größe: Auf sechs Stockwerke verteilen sich 1- bis 4-Zimmer-Wohnungen von ca. 35 bis 224 Quadratmeter – zur Straße hin mit Loggia, zu den drei Innenhöfen mit eindrucksvollen Terrassen. Im Untergeschoss findet sich neben 28 Tiefgaragenstellplätzen auch eine Ladestation für Elektroautos. \n\nAlle Wohnungen sind barrierefrei über insgesamt drei Aufzüge zugänglich, 21 Wohnungen sind barrierefrei nutzbar. Die fünf Wohnungen im obersten Stockwerk präsentieren durch ihre Aufdachterrassen ein einzigartiges 360°-Berlin-Panorama. Die Lage der einzelnen Terrassen im siebten Stock bieten aufgrund ihrer exklusiven Anzahl ausreichend räumliche Distanz zu den Nachbarn und durch gläserne Geländer eine unverbaute Sicht bis zum Teufelsberg und Funkturm im Westen und Deutsche Oper, Ernst-Reuter-Platz und Fernsehturm in östliche Richtung.', 'Die Wohnungsformate bieten kompakte 1-Zimmer- Apartments, geräumige 2- und 3-Zimmer-Wohnungen und großzügige 4-Zimmer-Wohnungen. Die Wohnungen sind mit 3-Schicht-Landhausdielen aus Eiche ausgestattet, unter denen die Fußbodenheizung für eine gleichmäßige Raumtemperatur in allen Räumen sorgt. Schlichte profillose Bodenleisten schließen zu den Wänden ab. Boden und Wände in Küche und Bad werden mit hochwertigen Villeroy & Boch-Fliesen verlegt, die Sie individuell aus sieben Farbnuancen wählen können. Ihr Wohlfühl-Badezimmer erwartet Sie mit stilvollen GROHE-Armaturen, einer schwellenfreien Rainshower und rahmenlosem Glas der Duschverkleidung. Bei Badewanne, Toilette und Waschbecken können Sie zwischen zwei Designs wählen – ganz nach Ihren Wünschen.\n\nAllgemeine Highlights:\n\n- Loggia oder Terrassen\n- Aufdachterrassen über 6. OG \n- Video-Gegensprechanlage\n- Villeroy & Boch-Feinsteinzeugfliesen\n- GROHE-Armaturen im Badezimmer\n- Barrierefreier Zugang zu allen Wohnungen\n- 28 Tiefgaragenstellplätze\n- Ca. 2,70 Meter Deckenhöhe\n- EnEV 2014 (Stand 2016)\n\nWohnungshighlights:\n\n- Ca. 19 m² großer Wohnbereich\n- Ca. 31 m² großer Koch-/Essbereich\n- Modernes Bad mit Badewanne\n- Zusätzliches Duschbad\n- Hauswirtschaftsraum\n- Loggia \n- 2 französische Balkone', 'Im Norden begrenzt durch die Spree liegt die ursprüngliche Altstadt Charlottenburgs zwischen der Nehringstraße und der Achse Zillestraße, die in die Loschmidtstraße übergeht. Mittendrin liegt die Kaiser-Friedrich-Straße 25. Ihr neues Zuhause inmitten eines der ältesten und schönsten Stadtteile Berlins. Der Ortsteil Charlottenburg im Bezirk Charlottenburg-Wilmersdorf besticht durch sein mondänes Stadtbild, kulturelles Angebot, seine grünen Oasen und seinen urigen Berliner Charme. Geprägt ist der Ortsteil von alten Baumbeständen, breiten Bordsteinen, gemütlichen Cafés und typischen Berliner Kneipen.\n\nVerkehrsanbindung:\n\nU-Bahn\n\nAm südlichen Ende der Kaiser-Friedrich-Straße befindet sich der U-Bahnhof Sophie-Charlotte-Platz der U2 (7 Minuten Fußweg) und der U-Bahnhof Bismarckstraße der Linie U2 und U7.\n\nBus\n\nDie gesamte Schloßstraße entlang verkehrt die Buslinie 309. An der Schloßstraße Ecke Spandauer Damm hält die Linie M45. Die Buslinie 109 bringt Sie von der Haltestelle Bismarckstraße/Kaiser-Friedrich-Straße in weniger als 20 Minuten direkt zum Flughafen Berlin-Tegel.\n\nS-Bahn\n\nDer Hauptbahnhof ist zwei S-Bahnstationen entfernt. Der S-Bahnhof Charlottenburg ist in 10 Minuten fußläufig zu erreichen.\n\nAuto\n\nDie Stadtautobahn A100 ist in unter 5 Minuten mit dem Auto über den Kaiserdamm oder die Kantstraße zu erreichen, die Nordtangente bringt Sie über Tegel raus auf die Autobahn in Richtung Hamburg oder über die AVUS nach Süden in Richtung Potsdam.', 'Provisionsfrei für den Erwerber!'];;disabled;;;;71328,0;True;;
18;2020-05-25 22:32:52.317510;Berlin;central_heating;ONE_YEAR_FREE;164338;n;y;https://pictures.immobilienscout24.de/listings/aeb9d98c-a19f-4235-addc-3b958ca7ac12-1370085335.jpg/ORIG/resize/118x118%3E/extent/118x118/format/jpg/quality/80;4;11,73;40 MBit/s;telekom_layer_magenta_l;über VDSL;1903,0;REGULAR;11,73;118526550;;no_information;n;False;MagentaZuhause L;y;Berlin;n;9;1,0;;no_information;;5,75;110,0;Berlin;12169;well_kept;normal;;False;100 MBit/s;no_information;no_information;n;https://padlock.link/ioml;https://padlock.link/ml;no_information;apartment;12169;3,5;;n;;2,active;True;Deutschland;top;100 MBit/s;wohnung_kauf;n;;web,email,bank,music,dl-ul,game,sd,mltstr,hd,fast-ul-dl;True;001.164338;599000;profile0;;3;True;n;showqualicontactform;n;n;Steglitz_Steglitz;AIB12937;5;Berlin;/expose/118526550;"['Es handelt sich um eine stilvolle 3,5-Zimmer-Altbauwohnung mit ca. 110 qm erstklassiger Wohnfläche, gelegen im 2. Obergeschoss eines modernisierten Altbaus aus dem Jahre 1903.\r\rDie Wohnung verfügt über eine Diele, ein Badezimmer, ein erstklassiges Speisezimmer mit Zugang zum Sonnenbalkon, großes & lichtdurchflutetes Wohnzimmer mit Zugang zum Sonnenbalkon, ein herrschaftliches Wohnzimmer, sowie ein großzügiges Schlafzimmer \r\rZu den besonderen Ausstattungsmerkmalen gehören: Parkettböden, Spots im Flur, sowie im Eingangsbereich, ca. 3,30m hohe Decken mit Stuckverzierungen im Wohnzimmer, ein Sonnenbalkon\r\rDie Wohnung befindet sich in einem gutem Gesamtzustand, es besteht jedoch Modernisierungsbedarf bei der Ausstattung des Badezimmers. \r\r \r\rDas monatliche Wohngeld beträgt ca. 308,- €.\r\rDie Heizungs- und Warmwasserversorgung erfolgt über eine Ölzentralheizung.\rDer Energieverbrauchskennwert für das Gebäude beträgt 91,5 kWh/(qm∙a).\r\rWeitere Details teilen wir Ihnen auf Anfrage gern mit.', 'Eine bevorzugte und ruhige Wohnlage in Berlin-Steglitz – dicht am Park! \rDas Objekt befindet sich in direkter Nähe zur Schloßstraße und bietet somit perfekte Verkehrsanbindungen mit Bus und S-Bahn sowie hervorragende Einkaufsmöglichkeiten.', 'Unser Service für Eigentümer\rWir stehen Ihnen bei dem Verkauf Ihrer Immobilie vom Anfang bis zum fertigen Abschluss diskret und kompetent zur Verfügung. \rJeder Schritt erfolgt nach Absprache mit Ihnen. \rSie entscheiden über die Verkaufsstrategie Ihres Objektes, ob diskret und ""off-market"" oder eine qualifizierte Vermarktung in Print- sowie Onlinemedien. \rWir verfügen immer über den richtigen Käufer. \rZudem bewerten wir Ihre Immobilie kostenfrei, entsprechend dem aktuellen Marktwert.\rGerne beraten wir Sie kostenlos persönlich in unserem Büro, per Telefon oder per E-Mail!\rWir freuen uns von Ihnen zu hören!\rwww.immo-boerse.com']";;;2010,0;;;;;;
19;2020-05-25 22:32:52.662280;Berlin;district_heating;ONE_YEAR_FREE;16924112;n;y;https://pictures.immobilienscout24.de/listings/a116051d-926e-4f95-915c-eb9b01d58e84-1370678687.jpg/ORIG/resize/118x118%3E/extent/118x118/format/jpg/quality/80;11;11,37;40 MBit/s;telekom_layer_magenta_l;über VDSL;1900,0;REGULAR;11,37;118632631;;gas;y;False;MagentaZuhause L;y;Berlin;y;9;1,0;;no_information;;5,8;149,0;Berlin;10715;well_kept;normal;;False;100 MBit/s;no_information;no_information;n;https://padlock.link/ioml;https://padlock.link/ml;no_information;no_information;10715;4,0;;n;;2,active;True;Deutschland;standard;100 MBit/s;wohnung_kauf;n;3,0;web,email,bank,music,dl-ul,game,sd,mltstr,hd,fast-ul-dl;True;009.06041d57-de1b-4a48-987b-3b0882138407;695000;profile0;5,0;4;True;n;;n;n;Wilmersdorf_Wilmersdorf;118632631;6;Berlin;/expose/118632631;['+++   Link zum 360° -Rundgang: https://app.immoviewer.com/portal/tour/1803885?accessKey=5e9a   +++\n\nIn begehrter und hervorragend angebundener Wohnlage in Berlin-Wilmersdorf, befindet sich diese großzügige Eigentumswohnung mit Balkon, die auf einer Wohnfläche von rund 149 m² 4 freundliche Zimmer bietet. Die Immobilie ist unbefristet zu einer Jahresnettokaltmiete in Höhe von 17.000 € vermietet. \n\nDas Objekt befindet sich in der 3. Etage eines um 1900 erbauten Mehrparteienhauses und präsentiert sich insgesamt in einem gepflegten Zustand. Die Altbau-Wohnung überzeugt zudem durch charakteristische Deckenhöhen und hochwertige Parkettböden.\n\nHier befinden sich ein helles und geräumiges Wohnzimmer mit schönem Lichterker sowie 3 Schlafzimmer. Eines der Schlafzimmer verfügt über einen Balkon. Die große Wohnküche bietet ausreichend Platz für einen Esstisch und ist mit einer modernen und vollständigen Einbauküche in zeitlosem Weiß versehen. Ein modern gefliestes Badezimmer ist mit einer Duschbadewanne ausgestattet und ein Gäste-Bad mit Dusche sorgt für zusätzlichen Komfort. \n\nDer Energieausweis ist beantragt und liegt bis spätestens zur Besichtigung vor.\n\nObjektnr.: 1023291', '+ Großzügige Eigentumswohnung\n+ Anlageobjekt\n+ Unbefristet vermietet\n+ JNKM: 17.000 €\n+ Vorteilhafter Grundriss\n+ Balkon\n+ Wohnküche mit moderner Einbauküche\n+ 2 Bäder\n+ Holzparkett\n+ Ideale Verkehrsanbindung in beliebter Wohngegend', 'Die Immobilie befindet sich in gefragter Lage von Wilmersdorf, einem Ortsteil im Berliner Bezirk Charlottenburg-Wilmersdorf, dessen Straßenbild geprägt ist von zahlreichen repräsentativen Jugendstilgebäuden und Altbauten im wilhelminischen Stil sowie durch eine ruhige Wohnatmosphäre. Gelegenheit zur Erholung im Grünen bietet der nur etwa 200 m entfernte Rudolph-Wilde-Park und im angrenzenden Bayerischen Viertel sowie im Güntzelkiez genießen Sie eine gepflegte Wohngegend, die mit kleinen, inhabergeführten Läden sowie einer Vielzahl an einladenden Restaurants und charmanten Cafés zu überzeugen weiß.\n\nIn einem Umkreis von ca. 900 m befinden sich verschiedene Supermärkte, Bioläden, Bäckereien sowie Restaurants und Imbisse. Für Ihre medizinische Versorgung stehen Arztpraxen verschiedener Fachrichtungen und Apotheken im nahen Umfeld bereit. Ein facettenreiches Shopping-Angebot erwartet Sie in Form exklusiver Geschäfte, bekannter Modelabels und schicker Designerläden am Kurfürstendamm, den Sie mit der U-Bahn in nur ca. 5 Minuten erreichen.\n\nDie nächste Bushaltestelle befindet sich direkt vor der Haustür und dank des nur ca. 5 Gehminuten entfernten Bahnhofs “Bundesplatz”, an dem sowohl S-Bahn- als auch U-Bahnlinien verkehren, sind Sie hervorragend an das öffentliche Nahverkehrsnetz angebunden. In komfortabler Reichweite verläuft zudem die A100.', 'Vereinbaren Sie noch heute einen Besichtigungstermin!\n_____________________________________________________\n\nAlle Angaben sind ohne Gewähr und basieren ausschließlich auf Informationen, die uns von unserem Auftraggeber zur Verfügung gestellt wurden. Wir übernehmen keine Gewähr für die Vollständigkeit, Richtigkeit und Aktualität der Angaben.\n    '];;disabled;;True;;;;;
