14;2020-05-25 22:32:59.496383;Berlin;;;7330415;n;y;https://pictures.immobilienscout24.de/listings/2dc7f763-6da3-40d9-bac0-7d2d005906ad-1365663223.jpg/ORIG/resize/118x118%3E/extent/118x118/format/jpg/quality/80;1;11,3;;;;1968,0;;11,3;117778592;;no_information;n;False;;n;Berlin;n;9;2,0;;xxxx;;5,73;122,51;Berlin;10627;no_information;no_information;;False;;no_information;"Bismarckstra&szlig;e";n;;;Bismarckstraße;no_information;10627;4,0;;n;;2,active;;Deutschland;premium;;wohnung_kauf;n;;;;001.7330415;550000;profile0;;4;True;n;showqualicontactform;n;n;Charlottenburg_Charlottenburg;59D2115289080620;6;Berlin;/expose/117778592;['Sie erreichen uns von Mo. - So. unter der Telefonnummer 0221-974597-69.\n\nMaisonette-Wohnung Nr. 1102 im 11. und 12. OG (Penthouse), 122,51 m² Wfl., bestehend aus 4 Zimmern, Küche, Diele, Flur, Abstellkammer, Bad, WC und Dachterrasse, Bj. 1968/69\n\n\nBitte kontaktieren Sie uns bei weiteren Fragen telefonisch, von Montag - Sonntag von 08:00 - 20:00 Uhr, unter der Telefonnummer 0221-974597-69.\n\n\nDieses Objekt wird beim zuständigen Amtsgericht versteigert.\n\n\nVerkehrswert: 550.000,00 EUR.\n\n\nSichern Sie sich unter Umständen 30 % Nachlass auf den Verkehrswert und zahlen Sie somit für die oben genannte Immobilie nur 385.000,00 EUR. Ebenso entfallen Notarkosten und Maklercourtage.\n\n\nDies ist eine von bundesweit 25.000 interessanten Immobilien, die wir in der aktuellen, monatlichen Ausgabe unseres kostengünstigen IMMOBILIENVERSTEIGERUNGS-KATALOGES veröffentlichen. Sichern Sie sich jetzt diese Informationen um Ihre Wunschimmobilie preisgünstig zu erwerben.\n\n\nKataloginfos:\nTelefonnummer 0221-974597-69.', 'Die AZ Agentur für Zwangsversteigerungsinformationen GmbH ist der führende Herausgeber von Informationen zu dem Thema Zwangsversteigerungen von Immobilien. Bei uns finden Sie alle Versteigerungstermine und alle wichtigen Daten zu den einzelnen Immobilien, Häusern, Wohnungen.\n\n\nDie in diesem Expose verarbeiteten Daten wurden uns von Dritten übermittelt, bzw. dem gerichtsbestellten Gutachten entnommen und konnten von uns nicht geprüft werden. Eine Haftung kann daher nicht übernommen werden. Irrtum und Zwischenverkauf vorbehalten.\n\n\nZusätzliche Informationen:\nMontags - Sonntags von 08:00 - 20:00 Uhr unter der Telefonnummer 0221-974597-69.'];;disabled;;;True;;;;
15;2020-05-25 22:32:59.946877;Berlin;district_heating;ONE_YEAR_FREE;17228770;n;y;https://pictures.immobilienscout24.de/listings/10421541-d7b5-47c7-80ce-7a3dda836e0e-1366629665.jpg/ORIG/resize/118x118%3E/extent/118x118/format/jpg/quality/80;9;11,37;40 MBit/s;telekom_layer_magenta_l;über VDSL;1902,0;REGULAR;11,37;117938009;;no_information;y;False;MagentaZuhause L;y;Berlin;n;9;1,0;272,0;no_information;energy_consumption;5,8;110,0;Berlin;10709;first_time_use_after_refurbishment;no_information;;False;100 MBit/s;no_information;no_information;n;https://padlock.link/ioml;https://padlock.link/ml;no_information;ground_floor;10709;4,0;147,0;n;;2,active;True;Deutschland;top;100 MBit/s;wohnung_kauf;n;;web,email,bank,music,dl-ul,game,sd,mltstr,hd,fast-ul-dl;True;002.01007994385;700000;profile0;5,0;4;True;n;;n;n;Wilmersdorf_Wilmersdorf;#01165;5;Berlin;/expose/117938009;['Die Ausstattung Ihrer Wohnung lässt nahezu keinen Wunsch offen und weist u.a. folgende Ausstattungsmerkmale auf:\n\n+ Erstbezug nach Sanierung\n+ möblierter Verkauf / neue designer Möbel\n+ repräsentativer Hauseingang\n+ aufwändige Stuckapplikationen\n+ modernes Badezimmer mit Dusche, Wanne, Handtuchhalterheizung und Fenster\n+ hohe Decken\n+ neuverlegtes, hochwertiges Parkett\n+ abgezogener Dielenfußboden im Schlafzimmer\n+ Doppelkasten-Holzfenster\n+ vollausgestattete Einbauküche mit Marken Geräten (Kühl-Gefrierkombi,Geschirrspüler, Backofen, Ceranfelder)\n+ praktischer Hauswirtschaftsraum\n+ edle Einbauschränke im Flur\n+ ruhig gelegen\n+ grün angelegter Innenhof\n+ lichtdurchflutet\n+ ideale Raumaufteilung\n+ ruhig gelegen\n+ Garderobennische \n+ Keller\n+ Fahrradkeller', 'Im Berliner Ortsteil Wilmersdorf sorgen herrschaftliche Stadtvillen, prächtige Einfamilienhäuser sowie auch stilvolle Alt- und Neubauten für eine erstklassige Wohngegend im lebendigen Westberliner Stadtzentrum mit besonders hohem Lebensstandard. Die berühmte Shoppingmeile, Kurfürstendamm, bildet die nördliche Grenze zu Charlottenburg und gilt mit edlen Boutiquen, exklusiven Geschäften sowie einer Vielzahl an Cafés und noblen Sternerestaurants als eine der beliebtesten Gegenden in Berlin. \nDer grünangelegte Volkspark Wilmersdorf zieht sich als breiter Streifen quer durch den Ortsteil und bietet seinen Anwohner einen Ort für Freizeit- und Sportaktivitäten, als auch Erholung mitten in der Natur. \n\nFußläufig zum Kurfürstendamm befindet sich die Wohnung in unmittelbarer Nähe zum Adenauerplatz. Hier sind Sie trotz ruhiger Lage mitten im Geschehen. Der Kurfürstendamm lädt zum Flanieren und Shoppen ein. Zahlreiche Cafés und Restaurants rund um das Westberliner Stadtzentrum bieten unzählige Verführungen und treffen den Geschmack von Jedermann. Nur wenige Minuten von der Wohnung entfernt befinden sich weitere Einkaufsmöglichkeiten, wie ein Penny, Netto, Rewe oder ein Rossmann. Auch haben Sie mehrere Möglichkeiten, die öffentlichen Verkehrsmittel zu nutzen. Mit der U-Bahn U7 und den Buslinien ab Adenauerplatz sind Sie gut an den restlichen Teil Berlins angebunden.', 'Alle Angaben stammen vom Verkäufer. Wir übernehmen hierfür keine Haftung.\n\nIhren Besichtigungstermin können Sie selbstverständlich individuell nach Ihren Wünschen mit uns vereinbaren. Zur Beantwortung Ihrer Fragen können Sie uns jederzeit kontaktieren.\n\nSie möchten Ihre Immobilie verkaufen?\n\nWir stehen Ihnen gerne bei allen Fragen und Anliegen beratend beiseite und treten dafür ein, dass vor allem\nSie profitieren. Nutzen Sie die positive Marktlage und unser geschultes Team, um den Höchstpreis zu erzielen. Gerne unterstützen wir Sie bei all Ihren Fragen und Anliegen rund um Ihre Immobilie. Ganz individuell gehen wir auf Ihre persönlichen Bedürfnisse ein, um Ihnen eine ehrliche und kompetente Beratung zu gewährleisten, denn Ihre Zufriedenheit ist unser Ziel.\n\nIhr IMMODO-Team'];;disabled;;;;;;;
16;2020-05-25 22:33:00.307445;Berlin;central_heating;ONE_YEAR_FREE;11435877;n;y;https://pictures.immobilienscout24.de/listings/d32d6e22-39b1-490c-af2e-cb00f30a6730-1371226553.jpg/ORIG/resize/118x118%3E/extent/118x118/format/jpg/quality/80;16;12,24;40 MBit/s;telekom_layer_magenta_l;über VDSL;1896,0;REGULAR;12,24;117827102;;oil;y;False;MagentaZuhause L;y;Berlin;y;9;1,0;534,95;no_information;energy_consumption;6,53;152,53;Berlin;12157;refurbished;sophisticated;E;False;100 MBit/s;outside;no_information;n;https://padlock.link/ioml;https://padlock.link/ml;no_information;apartment;12157;5,0;143,0;n;1,0;2,active;True;Deutschland;top;100 MBit/s;wohnung_kauf;n;1,0;web,email,bank,music,dl-ul,game,sd,mltstr,hd,fast-ul-dl;True;001.11435877;625000;profile0;4,0;5;True;n;showqualicontactform;n;n;Schöneberg_Schöneberg;20115008;7;Berlin;/expose/117827102;"['Fast jeder Wohnungseigentümer schwärmt davon, wenn er seinen Besuch empfängt und dieser schon allein vom Treppenhaus total begeistert ist. Hier wirkt der Jugendstil in vollem Umfang und versetzt  viele ins Staunen, so dass es wie ein Wandel durch die Zeit ist, bevor die Klingel an der imposant restaurierten Eingangstür geläutet wird. So werden moderne Eigenschaften, wie Komfort und Wohlbehagen in Einklang mit der Stilepoche harmonisch zusammengeführt und zum Wohnerlebnis präsentiert.\n\nDie Größe der Wohnung wird schon im Eingangsbereich mit dem großzügigen Flurbereich sichtbar. Vier Zimmer sowie das Bad mit dem Whirlpool sind von hier aus direkt zu erreichen. Der weitere Zugang führt in die große Wohnküche, der als zentraler Punkt für den zweiten Teil der Wohnung dient. Eine gemütliche Essbar lädt zum Verweilen mit Freunden ein, die hier großartig bewirtet werden können. Ein Wohnzimmer mit Kamin sowie ein Balkonzugang sind von der Küche zu erreichen. Auch in diesem Zimmer verzieren aufwendig restaurierte Stuckelemente den Deckenabschluss. Alle Fußböden erstrahlen nach traditionellem Vorbild wieder im neuen Glanz des alten Parketts oder im Dielenstiel. Der hintere Teil der Wohnung ist mit dem Loftbett und einer Sanitäreinrichtung und Massagedusche für den Elternteil ausgebaut. Insgesamt ist die Wohnung auch mit der neu installierten Elektroanlage, sowie der höchst aufwendige Restauration aller Kastenfenster einem modernen Wohnstil angepasst.\n\nEin Kellerraum steht zur Verfügung und zum besonderen Genuss ist eine gemeinsam genutzte Dachterrasse zur freien Sicht über die Häuser mit Zugang über den Seitenflügel zu erreichen.  Ruhe und Erholung, sowie Entspannung kann man in der grünen Oase des Innenhofes tanken.\nLassen Sie sich begeistern von einem nicht ganz normalen Flair einer Eigentumswohnung mit unbeschreiblichen Highlights.', '- ""Alt Berliner Flair"" im gesamten Wohnbereich\n\n- Dachterrasse mit Blick über die Dächer von Friedenau\n\n- Aufgearbeitetes Parkett und Dielenboden \n\n- Kastenfenster mit moderner Auffrischung\n\n- Gut durchdachte Sanitärinstallationen in 2 Komplettbädern\n\n- Großzügige Alt Berliner Wohnküche im modernen Stil\n\n- Elektroanlage komplett überholt und erneuert\n\n- Exklusive Treppenhausgestaltung im Jugendstil\n\n- Stucksanierungen in fast allen Räumen\n\n- Imposante Raumhöhen\n\n- Whirlpool in Bad', 'Friedenau stellt mit seiner Lage zwischen der Grenze zu Wilmersdorf und Schöneberg im Norden und der Steglitzer Schloßstraße sowie dem Einzugsgebiet von Dahlem im Süden ein Bindeglied zwischen diesen – insgesamt bürgerlich geprägten – Ortsteilen dar. \nDie Mehrzahl der Gebäude in Friedenau stammt vom Beginn des 20. Jahrhunderts. Dadurch hat der Ortsteil einen fast einheitlichen Baubestand. 185 Objekte stehen unter Denkmalschutz und verleihen Friedenau ein besonderes Flair. Friedenau blieb im Zweiten Weltkrieg nicht von den Luftangriffen der Alliierten verschont, die an verschiedenen Stellen Lücken in das Stadtbild rissen. Diese sind aber mittlerweile fast vollständig durch Neubauten ausgefüllt und nur noch vereinzelt sind Baulücken zu finden. Die Neubauten sind im sonst sehr homogenen Stadtbild teilweise Fremdkörper, weil beim Wiederaufbau nach dem Krieg auf denkmalpflegende Aspekte wenig Rücksicht genommen wurde. \nDie beliebte Wohngegend wird durch die Berliner Stadtautobahn geteilt und prägt auch die Kulisse der Straße, wobei die Nähe und der direkte Blick darauf den geschäftlichen Impuls der Großstadt wiedergibt.\nMenschen, die auf einen schnellen Mobilitätsanschluß angewiesen sind, haben bei diesem Standpunkt einen absoluten Vorteil. Da aber der Standpunkt inmitten der Berliner Großstadt liegt, sind auch Wege zu öffentlichen Verkehrsmitteln, zu Schulen und Kindergärten, sowie zu den Gesundheitseinrichtungen wie Ärzte liegen im unmittelbaren Umfeld.', 'GELDWÄSCHE: Als Immobilienmaklerunternehmen ist die von Poll Immobilien GmbH nach § 2 Abs. 1 Nr. 14 und § 11 Abs. 1, 2 Geldwäschegesetz (GwG) dazu verpflichtet, bei der Begründung einer Geschäftsbeziehung die Identität des Vertragspartners festzustellen und zu überprüfen, bzw. sobald ein ernsthaftes Interesse an der Durchführung des Immobilienkaufvertrages besteht. Hierzu ist es erforderlich, dass wir nach § 11 Abs. 4 GwG die relevanten Daten Ihres Personalausweises festhalten (wenn Sie als natürliche Person handeln) – beispielsweise mittels einer Kopie. Bei einer juristischen Person benötigen wir eine Kopie des Handelsregisterauszugs, aus welchem der wirtschaftlich Berechtigte hervorgeht. Das Geldwäschegesetz sieht vor, dass der Makler die Kopien bzw. Unterlagen fünf Jahre aufbewahren muss. Als unser Vertragspartner haben Sie auch ein Mitwirkungspflicht nach § 11 Abs. 6 GwG.\nPROVISIONSHINWEIS: Mit der Anfrage bei und durch Inanspruchnahme der Dienstleistung der Firma von Poll Immobilien GmbH, wird ein Maklervertrag geschlossen. Sofern es durch die Tätigkeit der Firma VON POLL IMMOBILIEN GmbH zu einem wirksamen Hauptvertrag mit der Eigentümerseite kommt, hat der Interessent bei Abschluss\n- eines MIETVERTRAGS keine Provision/Maklercourtage an die von Poll Immobilien GmbH zu zahlen.\n- eines KAUFVERTRAGS die ortsübliche Provision/Maklercourtage an die von Poll Immobilien GmbH gegen Rechnung zu zahlen. \nHAFTUNG: Wir weisen darauf hin, dass die von uns weitergegebenen Objektinformationen, Unterlagen, Pläne etc. vom Verkäufer bzw. Vermieter stammen. Eine Haftung für die Richtigkeit oder Vollständigkeit der Angaben übernehmen wir daher nicht. Es obliegt daher unseren Kunden, die darin enthaltenen Objektinformationen und Angaben auf ihre Richtigkeit hin zu überprüfen. Alle Immobilienangebote sind freibleibend und vorbehaltlich Irrtümer, Zwischenverkauf- und Vermietung oder sonstiger Zwischenverwertung.\n\nUNSER SERVICE FÜR SIE ALS EIGENTÜMER: \nPlanen Sie den Verkauf oder die Vermietung Ihrer Immobilie, so ist es für Sie wichtig, deren Marktwert zu kennen. Lassen Sie kostenfrei und unverbindlich den aktuellen Wert Ihrer Immobilie professionell durch einen unserer Immobilienspezialisten einschätzen. Unser bundesweites und internationales Netzwerk ermöglicht es uns, Verkäufer bzw. Vermieter und Interessenten bestmöglich zusammenzuführen.']";30,0;disabled;2006,0;;;;;;
17;2020-05-25 22:33:00.710370;Berlin;combined_heat_and_power_plant;ONE_YEAR_FREE;18346234;y;y;https://pictures.immobilienscout24.de/listings/a0ac664b-8e80-4857-8294-2131ff9e35da-1366880057.jpg/ORIG/resize/118x118%3E/extent/118x118/format/jpg/quality/80;2;11,3;40 MBit/s;telekom_layer_magenta_l;über VDSL;2021,0;REGULAR;11,3;117991768;;gas;n;False;MagentaZuhause L;n;Berlin;y;10;9,0;348,65;7;;5,76;117,03;Berlin;10587;first_time_use;sophisticated;;False;100 MBit/s;underground_garage;"Pascalstra&szlig;e";y;https://padlock.link/ioml;https://padlock.link/ml;Pascalstraße;apartment;10587;4,0;;n;;2,active;True;Deutschland;top;100 MBit/s;wohnung_kauf;n;1,0;web,email,bank,music,dl-ul,game,sd,mltstr,hd,fast-ul-dl;True;002.01009170479;784000;profile0;7,0;4;True;n;;n;n;Charlottenburg_Charlottenburg;D-1.1 Dietje;5;Berlin;/expose/117991768;[];;;;;;82168,0;True;;
18;2020-05-25 22:33:01.058810;Berlin;district_heating;ONE_YEAR_FREE;15681940;n;y;https://pictures.immobilienscout24.de/listings/2fc7db3b-5238-460d-a94d-39a4cad722f8-1365619508.jpg/ORIG/resize/118x118%3E/extent/118x118/format/jpg/quality/80;14;11,37;40 MBit/s;telekom_layer_magenta_l;über VDSL;1986,0;REGULAR;11,37;117766845;1,0;geothermal;n;False;MagentaZuhause L;y;Berlin;y;10;4,0;410,82;no_information;energy_consumption;5,8;110,2;Berlin;10719;no_information;no_information;NO_INFORMATION;False;100 MBit/s;no_information;no_information;y;https://padlock.link/ioml;https://padlock.link/ml;no_information;apartment;10719;4,0;130,1;n;90,0;2,active;True;Deutschland;standard;100 MBit/s;wohnung_kauf;n;5,0;web,email,bank,music,dl-ul,game,sd,mltstr,hd,fast-ul-dl;True;002.01002869861;777000;profile0;7,0;4;True;n;showqualicontactform;y;n;Wilmersdorf_Wilmersdorf;117766845;5;Berlin;/expose/117766845;['Die Wohnung befindet sich in einem sehr gepflegten Mehrfamilienhaus aus den 80er Jahren, welches unter Denkmalschutz steht. Ein Fahrstuhl ist vorhanden. Die 110 qm große 4- Zimmer Wohnung mit Balkon, ist gut geschnitten und besticht durch Ihre Helligkeit. Die Wohnung ist mit Parkettboden versehen. Das Gäste- WC, das Badezimmer und die Küche müssen renoviert werden. Ein Keller ist vorhanden.  Grundriss und weitere Unterlagen, erhalten Sie bei telefonischer Anfrage', 'Die Wohnung befindet sich direkt im Herzen der City West, nahe der berühmten Flaniermeile, dem Kurfürstendamm. Umgeben von feinsten Shopping-Adressen, ausgezeichneter Gastronomie, sowie von vielfältigen Geschäften für den täglichen Bedarf, besticht die Immobilie durch ihre zentrale Lage. Auch die Verkehrsanbindung ist optimal.'];;;;;;;;;
19;2020-05-25 22:33:01.396316;Berlin;district_heating;ONE_YEAR_FREE;16683611;n;y;https://pictures.immobilienscout24.de/listings/55c0c735-836f-4c18-ac38-fb83b1bca100-1366597589.jpg/ORIG/resize/118x118%3E/extent/118x118/format/jpg/quality/80;2;12,41;40 MBit/s;telekom_layer_magenta_l;über VDSL;;REGULAR;12,41;117929223;;district_heating;n;False;MagentaZuhause L;y;Berlin;y;9;;446,0;0;energy_consumption;6,33;138,0;Berlin;12101;no_information;no_information;;False;100 MBit/s;no_information;Manfred-von-Richthofen-Str.;y;https://padlock.link/ioml;https://padlock.link/ml;Manfred-von-Richthofen-Str.;apartment;12101;4,0;101,0;n;;2,active;True;Deutschland;standard;100 MBit/s;wohnung_kauf;n;1,0;web,email,bank,music,dl-ul,game,sd,mltstr,hd,fast-ul-dl;True;002.01007500398;550000;profile0;;4;True;n;showqualicontactform;n;n;Tempelhof_Tempelhof;117929223;6;Berlin;/expose/117929223;"['Es handelt sich um eine vermietete Arztpraxis gelegen im 1. Obergeschoss eines gepflegten Altbaus aus der Jahrhundertwende (Bj. 1912) in sehr guter Lage von Tempelhof unweit dem Viktoriapark und dem Bergmannkiez. Die Manfred-von-Richthofen-Straße hat sich zu einem angesagten Einkaufs- und Restaurantquartier entwickelt und ist verkehrstechnisch sehr gut angebunden. Das Fliegerviertel ist eine begehrte Wohnlage und bietet durch die Nähe zum Tempelhofer Feld und zur Stadtmitte alle Annehmlichkeiten des urbanen Lebens. Die Praxis verfügt über 138 m² Wohnfläche verteilt auf 4 Zimmer, einen Balkon, eine Küche, ein Bad und einen Flur. Die Mieteinnahmen belaufen sich auf 17.280 € im Jahr (nettokalt). Das Wohngeld beträgt monatlich 446 €, davon sind 243 € auf den Mieter umlegbar. Der Mietvertrag hat eine Laufzeit von ca. 2,5 Jahren zzgl. 2 mal 3 Jahre Verlängerungsoption, d.h. in 2,5 Jahren kann die Miete neu verhandelt werden (hohes Mietsteigerungspotential). Der weitere Vorteil der Gewerbeeinheit ist, dass die Miethöhe nicht unter das Gesetz des Mietendeckels fällt und somit frei verhandelbar ist. \nDie Gewerbeeinheit verfügt über die alten Stilelemente aus dem 19. Jahrhundert (Holzdielen, Doppelkastenfenster, alte Messingsbeschläge, Stuck an der Decke,  Originalfliesen in Bad und Küche, etc.). Das Haus befindet sich in einem guten Zustand, die technischen Einrichtungen sowie die Strangleitungen wurden umfassend erneuert. Zu der Einheit gehört ein Keller.', '- Fahrstuhl\n- Balkon\n- Parkett\n- hohe Decken\n- Stuck\n- Keller', 'Zentral und dennoch ruhig gelegen nahe dem Tempelhofer Feld, dem Viktoriapark und dem Bergmannkiez. Alle Einrichtungen des täglichen Bedarfs sind fußläufig erreichbar. Der U-Bahnhof Platz der Luftbrücke ist nur wenige Gehminuten entfernt.', 'Alle Angaben wurden vom Eigentümer gemacht. Wir übernehmen hierfür keine Haftung oder Gewähr. Irrtum und Zwischenvermietung bzw. -verkauf vorbehalten. Geschäftsgrundlage sind unsere ""Allgemeinen Geschäftsbedingungen"", die Sie jederzeit auf unserer Homepage www.deutscher-immobilien-fundus.de abrufen können. Unsere Provision beträgt 4,76 % vom beurkundeten Kaufpreis inklusive der gesetzlichen Mehrwertsteuer und ist unmittelbar nach Vertragsabschluss vom Käufer an die Firma Deutscher Immobilien Fundus, Inh. Sven Rutsch, zu zahlen.']";;disabled;;;;;;;
20;2020-05-25 22:33:01.899458;Berlin;district_heating;ONE_YEAR_FREE;15681940;n;y;https://pictures.immobilienscout24.de/listings/9bfad6d3-bea9-409b-944e-3ec2452303db-1365619332.jpg/ORIG/resize/118x118%3E/extent/118x118/format/jpg/quality/80;17;11,37;40 MBit/s;telekom_layer_magenta_l;über VDSL;1986,0;REGULAR;11,37;117766793;1,0;geothermal;n;False;MagentaZuhause L;y;Berlin;y;9;4,0;410,82;no_information;energy_consumption;5,8;110,2;Berlin;10719;no_information;no_information;NO_INFORMATION;False;100 MBit/s;no_information;no_information;y;https://padlock.link/ioml;https://padlock.link/ml;no_information;apartment;10719;4,0;130,1;n;90,0;2,active;True;Deutschland;standard;100 MBit/s;wohnung_kauf;n;3,0;web,email,bank,music,dl-ul,game,sd,mltstr,hd,fast-ul-dl;True;002.01002869861;715000;profile0;7,0;4;True;n;showqualicontactform;y;n;Wilmersdorf_Wilmersdorf;117766793;5;Berlin;/expose/117766793;['Die Wohnung befindet sich in einem sehr gepflegten Mehrfamilienhaus aus den 80er Jahren, welches unter Denkmalschutz steht. Ein Fahrstuhl ist vorhanden. Die 110 qm große 4- Zimmer Wohnung mit Balkon, ist gut geschnitten und besticht durch Ihre Helligkeit. Die Wohnung ist mit Parkettboden versehen. Ein Keller ist vorhanden. Ein Tiefgagargenstellplatz kann auf Anfrage mit dazu erworben werden. Weitere Unterlagen, erhalten Sie bei telefonischer Anfrage 0177- 36 36 992', 'Die Wohnung befindet sich direkt im Herzen der City West, nahe der berühmten Flaniermeile, dem Kurfürstendamm. Umgeben von feinsten Shopping-Adressen, ausgezeichneter Gastronomie, sowie von vielfältigen Geschäften für den täglichen Bedarf, besticht die Immobilie durch ihre zentrale Lage. Auch die Verkehrsanbindung ist optimal.', 'Bei Fragen oder zwecks Besichtigungstermin, erreichen Sie mich unter der 0177-36 36992'];;;;;;;;;
0;2020-05-25 22:33:02.856927;Berlin;central_heating;ONE_YEAR_FREE;16480061;n;y;https://pictures.immobilienscout24.de/listings/bf64133a-c9a5-4b2a-a1a6-7dcfc3c8caed-1361805597.jpg/ORIG/resize/118x118%3E/extent/118x118/format/jpg/quality/80;10;12,7;40 MBit/s;telekom_layer_magenta_l;über VDSL;1905,0;REGULAR;12,7;117077500;;gas;n;False;MagentaZuhause L;n;Berlin;y;9;1,0;325,0;73 A;energy_consumption;7,58;100,0;Berlin;10555;well_kept;normal;;False;100 MBit/s;no_information;Alt Moabit;n;https://padlock.link/ioml;https://padlock.link/ml;Alt_Moabit;maisonette;10555;5,0;129,0;n;;2,active;True;Deutschland;top;100 MBit/s;wohnung_kauf;n;1,0;web,email,bank,music,dl-ul,game,sd,mltstr,hd,fast-ul-dl;True;002.01007331745;540000;profile0;;5;True;n;showqualicontactform;n;n;Tiergarten_Tiergarten;FTAMMa;4;Berlin;/expose/117077500;"['Die bezugsfreie und sanierungsbedürftige Maisonette, befindet sich im 1.OG und 2.OG des Seitenflügels eines 5- geschossigen Altbau aus dem Jahr ca. 1905.\n\nMit einer Wohn und Nutzfläche von ca. 100 m², (ca. 50 m² je Geschossfläche), erstreckt sich die Einheit auf 3 Schlafzimmer, 2 Bäder und einer offenen Wohnküche. \n\nDie möglichen Sanierungskosten würden je Ausstattungswunsch zwischen ca. 35.000€ bis 50.000€ betragen. Näheres gern auf Anfrage persönlich.\n\nZu den Ausstattungsmerkmalen der Altbauwohnung zählen:\n- ca. 3,20 m hohe Decken \n- Stuckelemente aus der Grüderzeit\n- Holzdielenböden\n- Holzdoppelkastenfenster,-und türen\n- franz. Balkone (Anbau von Balkonen gemäß \n  Teilungserklärung möglich)\n- 2 Kellerabteile\n\nZur Info: Eine Onlinebesichtigung der Einheit ist möglich. Sofern weiteres Interesse Ihrerseits besteht, stimmen wir gerne einen individuellen Einzelbesichtigungstermin mit Ihnen ab.', '- Onlinebesichtigung möglich\n- Bezugsfrei, ab sofort\n- Gepflegter Altbau mit frischem \n  Fassadenanstrich\n- Aufgeteilt in Wohneigentum im Jahr 2019\n- Anbau Balkone gemäß Teilungserklärung \n  möglich\n- Kellerabteil (zu jeder Wohnung, einer \n  zugeordnet)\n- Begehrte Wohnlage nahe Hauptbahnhof', 'Willkommen im Westfälischen Viertel am Spree/ Wickinger-Ufer!\n\nDie bezugsfreie Eigentumswohnung befindet sich in einer zentralen Lage von Berlin-Moabit/Tiergarten, nahe dem Hauptbahnhof und der neu gebauten Shoppingmall ""Schultheissquartier"".\n\nDie Bushaltestelle für die Linien 101, 106 und 245 sind quasi vor der Haustür, womit man bequem zum U-Bahnhof Turmstraße (U9 Richtung Steglitz oder Osloer Straße) oder zum S-Bahnhof Beusselstraße (Ringbahn) gelangen kann. Die Autobahnauffahrt (A100) Beusselstraße liegt ca. in 1 Kilometer entfernt.\n\nGeschäfte des täglichen Bedarfs sowie Schulen, Kitas und Ärzte sind in naher Umgebung zahlreich vorhanden und bieten eine optimale Infrastruktur.', 'Weitere bezugsfreie Immobilien finden Sie unter: www.homeestate.de\rOder auf unserer Projektseite unter: www.alt-moabit73.de\r\rÜbrigens: Unser Team steht Ihnen an 7 Tagen in der Woche für Besichtigungen gerne zur Verfügung - und das sogar in 8 Sprachen. \r\rWir freuen uns, Sie kennenzulernen.']";100,0;;;;;;;;
