2020-05-11 12:22:26.276157;Berlin;self_contained_central_heating;ONE_YEAR_FREE;18268340;n;n;https://pictures.immobilienscout24.de/listings/316b7b3c-aed5-430d-8b1f-3cd09215c829-1363162455.jpg/ORIG/resize/118x118%3E/extent/118x118/format/jpg/quality/80;19;12.01;2,4 MBit/s;telekom_layer_magenta_m_hybrid2;45;über Hybrid;;WITH_HYBRID;12.01;117314634;gas;n;false;MagentaZuhause M Hybrid (2);y;Berlin;y;6;;152;no_information;;7.88;45;Berlin;10999;refurbished;sophisticated;;false;16 MBit/s;no_information;no_information;n;https://padlock.link/mmh2sa;https://padlock.link/mmhy2;no_information;raised_ground_floor;10999;2;n;2018;;2,active;true;Deutschland;standard;50 MBit/s;wohnung_kauf;n;0;web,email,bank,music,dl-ul,game,sd,mltstr,hd;true;002.01009016528;275000;profile0;;2;true;n;showqualicontactform;n;n;Kreuzberg_Kreuzberg;117314634;2;Berlin;/expose/117314634;"['Sehr geehrte Damen und Herren, Grüße Sie\n\nAttraktive Wohn-Geschäfts Immobilie | Eigentumswohnung mit Gewerblicher 2in1 Nutzung \nMöglichkeit, Bezugsfrei ab sofort (VB)\n\ndas OBJEKT \nim Hochparterre eines gepflegtem Kreuzberger Mehrfamilienhauses befundene 2x Zimmer Wohnung mit + Gewerblicher Nutzung, als Laden Geschäft möglich (Eingetragen im Grundbuch .!)\n \nkurzfristig SELBST Bewohnbar, Mieterfrei Übergabe auf Wunsch \n\n\nDATEN\n• Wohnung + Laden Geschäft \nGewerbliche Nutzung Möglichkeit\n• 2x Zimmer \nZimmer_1  ca 25m²  Zimmer_2 ca 10m² + Badezimmer \n• gesamt ca 45m²\n• Hochparterre ( 4xStufen )\n• 2x Eingange  ( Front & Schaufenster + Treppenhaus Türe )\n•  Teeküche \n•  gemeinsam PKW Stellplätze auf dem Innenhof \n• Gebäude Gedämmt \n• Grundriss/Flächen Änderung möglich.!\n•• Heizungsart:  Gasetagenheizung \nbei der letzten Sanierung wurden die Heizkörper und Dusche entfernt, da als Büro Vermietet \n•• aktuell beheizt mit Elektroheizung \n• Anschluss  Gasetagenheizung + Dusche/Bad jederzeit möglich.! \n\n\nAlle Wartungen durchgeführt/ NEU Saniert zB\nElektrik\nDecken Abgehangen\nWände Verputz\nBadezimmer Neu gefliest ( von Beige auf Grau ) \nAbwasser Rohre \nusw.\n\nTOP Investor Immobilie\nVerkauf im IST zustand & ☆ Mieterfrei ☆\nVermietbarkeit: sehr gut \n\nMIETEINNAHMEN:   SOL_ 2020, 2021.. \n\nMiete:  ca 850 € bis 1000 € Monatlich Netto \nGesamt: _ _   ca 10.200€ bis 12.000€  NKJM\n\n\n\n\nAdresse: \n10999 Berlin Kreuzberg \n( B-Lage ) \n\n\nKäufer Provision:  7,14% inkl. 19% MwSt.\nvom Kaufpreis und vom Käufer zu zahlen, bei Vertrag Verdient & Fällig.\n\n\nDATEN_\nKaufpreis:   275.000 € \nNutzfläche ~Wohn & Gewerbe: ca 45 m²\nKeller: Ja \nStellplatz: Ja, gemeinsam im Innenhof \nVerfügbar: JA, nach VB \nHeizungsart: Gasetagenheizung ( aktuell mit Elektroheizung, Anschluss jederzeit möglich.! )\n\n\nVerbleibe mit freundlichen Grüßen\nHerr Sahan    |  Immobilien', 'IM ALLEINAUFTRAG \nSie interessieren sich für diese Immobilie, haben Fragen zur Finanzierung oder wünschen einen Besichtigungstermin⁉️\nBitte haben Sie Verständnis dafür, dass wir Ihre Anfrage nur bei Übermittlung Ihrer\nVOLLSTÄNDIGEN Kontakt-/ Adressdaten, Mail & Tel-Mobil: ☎️ schnellstmöglich beantworten können und Ihnen erst im Rahmen unserer Exposé Zusendung die genaue Objektadresse benennen. Bei weiterem Interesse stehen wir ihnen dann selbstverständlich zur Verfügung.\n\n❌ keine Anfragen von MAKLER & Vermittlern _ NICHT erwünscht !\n• Diskretion Erwünscht und Oberstes Gebot \n*andere werden dem Verkauf ausgeschlossen.!\n• trotz sorgfältiger Überprüfung sind Fehler nicht ausgeschlossen, Angaben sind vom *dritten\ndaher Alle Angaben unverbindlich und ohne Gewähr, Irrtum und Vorverkauf vorenthalten..!\n•diese Infos, Eckdaten, Fotos sind EIGENTUM der Şahan_Immobilien, anderweitig Veröffentlichung o. Weitergabe an ,,dritte"" wird mit Höhe der Provision bestraft !\n▪mit der Bewerbung auf diese Anzeige sind Sie mit allen Punkten einverstanden.\n• Widerrufs recht besteht, innerhalb von zwei Wochen!\n• Allgemeine AGBs, Datenschutz Gesetzänderungen_  Mai.2018\n\n\n** Die hier eingestellten Flächendefinitionen sind mit größter Sorgfalt recherchiert, erheben jedoch nicht den Anspruch auf Alleingültigkeit und werden lediglich unverbindlich zu Informationszwecken zur Verfügung gestellt. Bitte beachten Sie auch unsere rechtlichen Hinweise.']";;;;;;;;10 MBit/s;50 MBit/s
2020-05-11 12:22:26.631852;Berlin;no_information;;15474925;n;n;https://pictures.immobilienscout24.de/listings/aaa48ed8-31cd-4fec-a7fa-8c1436485117-1363150052.png/ORIG/resize/118x118%3E/extent/118x118/format/jpg/quality/80;27;11.49;;;;;1926;;11.49;117313709;district_heating;y;false;;n;Berlin;y;7;1;286.97;18a#;;6.07;75.34;Berlin;12157;no_information;no_information;;false;;no_information;"Sch&ouml;nhauser Str.";n;;;Schönhauser_Str.;apartment;12157;3;n;;;2,active;;Deutschland;top;;wohnung_kauf;n;2;;;001.15417560;392530;profile0;5;3;true;n;;n;n;Steglitz_Steglitz;VK-19069_WE09_IN_h;3;Berlin;/expose/117313709;"['Dieses hübsche Mehrfamilienhaus, in einer ruhigen Strasse gelegen, wurde 1925-1926 von den Architekten Mebes & Emmerich entworfen und gebaut und steht unter Denkmalschutz. \n\nDas Wohnhaus verfügt über 14 Wohneinheiten, auf 5 Etagen verteilt. \n\nDie bezugsfreie, renovierte Wohnung befindet sich in der zweiten Etage und verfügt über eine Fläche von ca. 75 m².\n\nSie verfügt über insgesamt drei helle Räume, Küche mit Abstellkammer, eine geräumige Diele, sowie ein gefliestes Wannenbad mit Fenster. Hier findet auch eine Waschmaschine ihren Platz.\n\nEs ist eine Einbauküche vorhanden, die auch Platz für einen Essbereich bietet.\n\nDer Bodenbelag der Wohnung verfügt über baujahrstypische, bereits abgezogene Dielen.\n\nDas gesamte Wohnensemble hat einen schönen, parkähnlich angelegten Innenhofbereich mit Spielplatz.\n\nEin Keller rundet das Angebot ab.', 'Die Immobilie befindet sich in einer ruhigen Seitenstraße mitten in Steglitz, damit im günstig gelegenen Südwesten von Berlin, am Übergang zwischen den dicht bebauten Innenstadtbezirken und den Villen- sowie Eigenheimvororten. Steglitz gilt als gehobener und sicherer Berliner Stadtteil. \n\nEinkaufsmöglichkeiten für den täglichen Bedarf befinden sich direkt um die Ecke und die Schlossstraße mit ihrem breiten Kaufangebot ist nur 10 Gehminuten entfernt.\n\nEbenfalls in der Nähe sind der Lauenburger Platz, der Sochos Sportplatz und ""Das Insulaner"", welcher ein großes Freizeitangebot bietet, wie z.B. Minigolf, Planetarium und ein Sommerbad.\n\nIn der Nähe liegt der große Stadtpark Steglitz mit vielfältigen Freizeitmöglichkeiten, sowie der Botanische Garten.\n\nDer Anschluss an den öffentlichen Nahverkehr mit den U-Bahnlinien U-Bahn Linien U5 und U9 sowie die S-Bahnlinie S1 und an die Autobahnen A103 und A100 ist in Steglitz jeweils in wenigen Minuten erreichbar.']";;;;;;;;;
2020-05-11 12:22:26.974146;Berlin;central_heating;ONE_YEAR_FREE;5394580;n;n;https://pictures.immobilienscout24.de/listings/84c88054-1bc7-4279-a9b8-fe96327f4d28-1366892267.jpg/ORIG/resize/118x118%3E/extent/118x118/format/jpg/quality/80;18;14.32;40 MBit/s;telekom_layer_magenta_l;;über VDSL;1929;REGULAR;14.32;117323884;no_information;n;false;MagentaZuhause L;n;Berlin;n;7;1;235;no_information;energy_consumption;8.36;70;Berlin;13351;first_time_use_after_refurbishment;no_information;;false;100 MBit/s;no_information;no_information;n;https://padlock.link/ioml;https://padlock.link/ml;no_information;apartment;13351;3;n;;;2,active;true;Deutschland;top;100 MBit/s;wohnung_kauf;n;1;web,email,bank,music,dl-ul,game,sd,mltstr,hd,fast-ul-dl;true;001.5394580;339000;profile0;;3;true;n;showqualicontactform;n;n;Wedding_Wedding;178635;3;Berlin;/expose/117323884;['Die komfortable und funktional geschnittene 3 Zimmer Wohnung, die in hochwertiger Qualität umgestaltet und vollständig saniert wurde in 2020, verfügt über eine großzügige Wohnküche, ein geräumiges Schlafzimmer sowie ein weiteres Zimmer mit Balkonausgang, welches als Kinder- oder Arbeitszimmer genutzt werden kann. Ein geräumiger Flur sowie ein modernes Badezimmer mit edlen Großfliesen in Betonoptik und bodentiefer Glasdusche runden das Angebot ab.\n\nDie offene Wohnküche lädt zum gemeinsamen Essen und Entspannen ein. Mit einer optimalen Südwest-Ausrichtung bieten die Wohnküche und das große Schlafzimmer ideale Lichtverhältnisse. \n\nGenügend Stellplätze befinden sich vor dem Haus.\n\nDas Hausgeld beträgt ca. 235 € im Monat. Die Zuführung zur Rücklage sowie die Versorgung mit Warmwasser und Heizung sind inklusive.', 'Als Teil der Sanierung wurden folgende Arbeiten durchgeführt:\n\n- Die Dielenböden im gesamten Wohnbereich wurden geschliffen & geölt\n- Komplett neue Elektroinstallation\n- Baderneuerung mit Hans Grohe Ausstattung\n- Begehbare Glasdusche\n- Neues Badfenster\n- Neue Türen in Altbauoptik\n- Neuüberarbeitung der isolierverglasten Fenster\n- Glatt verputze & gestrichene Innenwände\n- Edler Deckenstuck & Altberliner Bodenleisten\n- Hochwertige LED Spotlights in Flur & Bad\n- Hochwertiger Terassenboden auf dem Balkon\n- Großer Abstellraum (8 qm) im Kellergeschoss', 'Inmitten einer ruhigen und gleichzeitig zentralen Lage in gepflegter Umgebung im Innenstadtbezirk Mitte, Ortsteil Wedding befindet sich das Objekt in der Afrikanischen Straße direkt angrenzend an den ca. 70 ha großen Volkspark Rehberge.\n\nDer Volkspark Rehberge liegt östlich des Flughafens Tegel - direkt an der Afrikanischen Straße. Den Park kennzeichnen sehr vielgestaltige Erholungsangebote wie ausgedehnte Sport- und Spielanlagen aber auch waldartige und naturnahe Parkteile. \n\nUnweit des Objekts gelangen Sie zu Fuß in kürzester Zeit zu Kindergärten, Schulen, Ärzten und zahlreichen Einkaufsmöglichkeiten für den täglichen Bedarf  auf der belebten Müllerstraße.  Ferner findet man hier zahlreiche Bildungs- und Kulturangebote.\n\nIn direkter Nachbarschaft befindet sich u.a. ein Deutsch-Französischer Kindergarten, in nur 500 m Entfernung liegt die Möwensee-Grundschule und in 800 m das Lessing-Gymnasium. Die technische Beuth-Hochschule als auch das Virchow-Klinikum der Charité befinden sich in lediglich 1,5 km Entfernung.\n\nWedding, insbesondere Wedding-Mitte, hat sich in den vergangenen Jahren zu einem beliebten Wohnstandort in der Metropole Berlin entwickelt. Die sich überdurchschnittlich verbessernde Sozialstruktur hat einen positiven Einfluss auf die Entwicklung Weddings. \n\nDer gegensätzliche Bezirk vereint die Vorteile eines hippen Szene-Kiezes in hervorragender Lage mit einer familienfreundlichen, im Grünen gelegenen Wohngegend, die ebenso für Studenten und Akademiker als auch Künstler und Familien geeignet ist. Die Szene trifft sich in Clubs, Cafés und Restaurants am Leopold-Kiez.', 'Heizungsart: Zentralheizung\n\nEs bestehen sehr gute Anbindungen an das öffentliche Verkehrsnetz und an die Autobahn.\n\nDer nächstgelegene U-Bahnhof ist der Bahnhof Rehberge der U6 in 700 m Entfernung. Lediglich eine Station davon entfernt, befindet sich der Verkehrsknotenpunkt U-Bhf Seestraße mit Tramverbindung in Richtung Warschauer Straße und Busverbindung zum Hauptbahnhof. Zwei Stationen weiter am Leopoldplatz ist direkte Anbindung an den Ostbahnhof mit Bus und in Richtung Steglitz mit der U9 vorbei am Zoologischen Garten als auch dem Kurfürtsendamm gegeben. Mit der U6 erreicht man die Friedrichstraße sowie den Flughafen Berlin Tegel in nur 10 Min. Mit den öffentlichen Verkehrsmitteln ist auch der Potsdamer Platz über die Friedrichstraße in 20 Minuten erreichbar. Ebenso liegt der Zoologische Garten mit der BVG innerhalb von 15 Minuten in direkter Reichweite. In nur 350 m Entfernung befindet sich die Bushaltestelle Transvaalstraße der Buslinie 221. \n\nDie Ausfahrt Beusselstraße zur A100 befindet sich in nur 4 Autominuten Entfernung. Von der AusfahrtBeusselstraße erreicht man innerhalb weniger Minuten die A111, welche die Berliner Stadtautobahn A100 vom Dreieck Charlottenburg aus mit dem Berliner Ring, der A10, am Kreuz Oranienburg verbindet.\n\n| BESICHTIGUNGEN | \nPersönliche Besichtigungen mit genügend Abstand können direkt vereinbart werden. Für den ersten Eindruck kann ich Ihnen vorab auch eine Videotour der Wohnung zukommen lassen.\n\n| ENGLISH SPEAKERS |\nPersonal viewings are possible. Feel free to reach to call me if you are interested in viewing this property. I can also answer any questions you may have.\n\nMakleranfragen nicht erwünscht.'];;;disabled;;;171;;;
2020-05-11 12:22:27.296308;Berlin;district_heating;;15372281;y;y;https://pictures.immobilienscout24.de/listings/d7e08ca5-c71d-4852-ba9a-6806294b411b-1363125381.jpg/ORIG/resize/118x118%3E/extent/118x118/format/jpg/quality/80;4;10.71;;;;;2020;;10.71;117308417;no_information;n;false;;n;Berlin;y;9;9;;9D;;5.2;96.56;Berlin;12437;first_time_use;sophisticated;;false;;no_information;Eichbuschallee;y;;;Eichbuschallee;no_information;12437;4;n;;;2,active;;Deutschland;premium;;wohnung_kauf;n;;;false;001.15320047;545000;profile0;5;4;true;n;;n;n;Plänterwald_Treptow;EBA/9D/25;4;Berlin;/expose/117308417;"['Das Neubauprojekt ""Wohnen am Plänterwald"" überzeugt durch seine neoklassizistische Architektur und die gehobene Ausstattung der 62 Wohnungen. Durchdachte und vielseitige Grundrisse mit Größen von rund 53 bis 123 m² bzw. von 2 bis 4 Zimmern sind die ideal geeignet für Familien, Paare oder Singles. Die Wohnungen im Gartengeschoss verfügen über große Terrassen und Privatgärten. In den oberen Etagen ermöglicht die aufwendige, teilweise gestaffelte Architektur ebenfalls große Balkone oder Terrassen für jede Wohnung.\n\nIn Treptow ergänzen sich Natur und modernes Leben zu einer spannenden Verbindung, ohne dass man auf die Vorzüge des pulsierenden Metropolenlebens verzichten muss.\n\nAn alles ist gedacht worden: ein gemütliches Wohn-/Esszimmer mit großem Süd-Balkon, ein moderner Küchenbereich, drei helle Schlafzimmer, ein ansprechendes Wannenbad und ein separates Duschbad sowie ein Hauswirtschaftsraum. Alle Zimmer bieten dabei weitreichende Ausblicke auf viel Grün.\n', '- Echtholzparkett in den Wohn- und Schlafräumen\n- energiesparende Fußbodenheizung\n- Feinsteinzeug in den Bädern\n- Sanitärobjekte und Armaturen von Markenherstellern\n- Elektrische Rollläden an allen Fenstern\n- 3-Fach-Verglasung der z.T. bodentiefen Fenster\n- Großzügiger Balkon\n- KfW-55 Energie-Effizienzhaus (EnEV 2016)\n- Aufzug in alle Etagen\n- Abgeschlossener Müllraum\n- Fahrradabstellplätze für jede Wohnung\n- Tiefgaragenstellätze (Ladestationen möglich)\n', 'Auf der einen Seite viel Grün und entspannende Ruhe. Auf der anderen Seite ist man ruckzuck im Zentrum Berlins - ob mit dem Fahrrad, dem Auto oder den öffentlichen Verkehrsmitteln. Die S-Bahnhöfe Plänterwald und Baumschulenweg sind fußläufig in wenigen Minuten zu erreichen. Doch das Hinsetzen in der Bahn lohnt kaum, denn innerhalb von zwei Stationen befindet man sich im quirligen Kiezleben von Friedrichshain, Neukölln oder Kreuzberg.\n\nPlänterwald: 50 Meter zu Fuß\nSpreeufer: 500 Meter zu Fuß\nTreptower Park: 5 Min mit dem Fahrrad\nMediaspree: 10 Min mit dem Fahrrad\nBahnhof Ostkreuz: zwei Stationen mit den öffentlichen Verkehrsmitteln\nAlexanderplatz: 23 Min mit den öffentlichen Verkehrsmitteln\nFriedrichstraße: 27 Min mit den öffentlichen Verkehrsmitteln\nHauptbahnhof: 30 Min mit den öffentlichen Verkehrsmitteln\nKurfürstendamm: 40 Min mit den öffentlichen Verkehrsmitteln\nFlughafen Tegel: 30 Min mit dem Auto\nFlughafen BER: 22 Min mit dem Auto', 'Der Verkauf erfolgt für den Käufer provisionsfrei!\n\nBeratungstermine in unserem Info-Pavillon vor Ort sind nach individueller Vereinbarung weiterhin möglich!\n\nAngaben nach EnEV: Energieausweis befindet sich in der Erstellung.\n\nÄnderungen und Irrtümer vorbehalten. Das Bild- und Planmaterial dient zum Teil der vorläufigen Illustration des Vorhabens. Insbesondere die Visualisierungen o. ä. sind unverbindlich und zeigen teilweise Sonderausstattungen und Einrichtungen, die als Möblierungsvorschläge zu verstehen sind.\n']";;;disabled;86973;true;;;;
2020-05-11 12:22:27.636106;Berlin;self_contained_central_heating;ONE_YEAR_FREE;1145741;n;n;https://pictures.immobilienscout24.de/listings/1ac5d79a-8d06-4483-85bb-b9139e67f345-1363208500.jpg/ORIG/resize/118x118%3E/extent/118x118/format/jpg/quality/80;27;11.35;40 MBit/s;telekom_layer_magenta_l;72.76;über VDSL;1902;REGULAR;11.35;117323123;gas;y;false;MagentaZuhause L;n;Berlin;y;9;1;162;37;energy_consumption;7.54;72.76;Berlin;10249;first_time_use;sophisticated;NO_INFORMATION;false;100 MBit/s;no_information;"Petersburger Stra&szlig;e";y;https://padlock.link/ioml;https://padlock.link/ml;Petersburger_Straße;roof_storey;10249;3;n;2020;2044;2,active;true;Deutschland;standard;100 MBit/s;wohnung_kauf;n;5;web,email,bank,music,dl-ul,game,sd,mltstr,hd,fast-ul-dl;true;001.1145741;526000;profile0;5;3;true;n;showqualicontactform;n;n;Friedrichshain_Friedrichshain;2044.00240;3;Berlin;/expose/117323123;['Vielen Dank für Ihr Interesse an unserem Angebot. \n\nDas Wohn- und Geschäftshaus befindet sich im Bezirk Friedrichshain/Kreuzberg. Das Dachgeschoss wird derzeit ausgebaut, so dass 312,90 m² neuer Wohnraum entsteht. Hier lebt man mitten in Szenebezirk Friedrichshain und kann über den Dächern einen atemberaubenden Blick auf den Berliner Fernsehturm genießen. \n\nAlle Räume sind nach Fertigstellung lichtdurchflutet. Zwei Klimaanlagen sorgen für angenehme Raumtemperatur an heißen Tagen, die moderne Gasetagenheizung für wohlige Wärme im Winter. Alle Wohnräume werden mit hochwertigem Echtholz in einem warmen Braunton belegt.  Auf insgesamt 14,84 m² Terrassenfläche kann eine kleine grüne Oase zum Entspannen entstehen. Die neuen Aufzüge bringen Sie bequem in Ihr neues schönes und besonderes Zuhause. \n\nDer sich direkt vor der Wohnung befindliche Laubengang ist befindet sich hinter der 2. Wohnungseingangstür und ist somit nicht nutzbar für andere Wohnungsnutzer. Der Laubengang dient jedoch als 2. Rettungsweg für diese und der nachbarlichen Wohnung rechts daneben (WE 25). Der Laubengang zählt nicht zur Wohnfläche der Wohnung. \n\nDie Fläche im begrünten Innenhof wird gemäß Freianlagenkonzept gestaltet. Dort entstehen ein Kinderspielplatz sowie Müll- und Fahrradstellplätze. \n\nIm Erdgeschoss befinden sich Gewerbeeinheiten. Diese sind an eine Änderungsschneiderei und an einen Kostümverleih vermietet. Alle anderen Einheiten werden als Wohnraum genutzt. \nDas Objekt wurde um die Jahrhundertwende erbaut und ist ein typischer Altbau. Die Fassade und die Treppenhäuser befinden sich noch im ursprünglichen unsanierten Zustand. Die Fassade und der Hausflur erhalten nach Fertigstellung der Baumaßnahmen einen neuen Anstrich. \n\nDas Miethaus wurde in diesem Jahr nach dem Wohnungseigentumsgesetz aufgeteilt. Die WEG besteht aus 25 Wohnungen. \n\nWährend der Bauphase ist es möglich die Raumaufteilung und die Ausstattung zu beeinflussen. Sofern baulich umsetzbar, werden die Wünsche des Käufers selbstverständlich berücksichtigt.', '- 3 Zimmer (wahlweise auch 2 Zimmer möglich)\n- mod. Gasetagenheizung\n- Fußbodenheizung\n- Parkett in allen Räumen außer Bad\n- gefliestes Wannenbad mit Dusche\n- Einbauküche mit Geräten\n- 2 Klimageräte\n- Abstellraum\n- Aufzug\n- Rauchwarnmelder\n- Laubengang nicht in der Wohnfläche enthalten', 'Das Gebäude liegt mitten im Herzen von Berlin im Szeneviertel mit viel Gastronomie und kleinen Geschäften in der Nähe. Hier pulsiert das Leben. Der Bezirk Friedrichshain ist im Wandel, er wird kontinuierlich erneuert und verschönert.  \n\nInnerhalb von einem ca. fünf bis zehn minütigem Fußweg ist der Volkspark Friedrichshain zu erreichen. Nach ca. 30 min. erreicht man ebenfalls fußläufig die Spree, die direkt hinter dem S-Bahnhof Warschauer Straße und der East-Side-Gallery liegt. Dort befindet sich die Mercedes-Benz Arena, diverse Veranstaltungen sorgen für kulturelle Erlebnisse. \n\nDie Tram-Haltestelle der M10 liegt direkt gegenüber des Wohn- und Geschäftsgebäudes. Andere Verkehrsverbindungen sind innerhalb von 5 - 10 Minuten (U-Bahnhof Frankfurter Tor) zu erreichen. \n\nDie Karl-Marx-Allee ist ebenfalls fußläufig erreichbar. Sie lädt zu einem Einkaufsbummel ein. Wer es lieber geballter mag, begibt sich ins ca. 2 km entfernte Ringcenter. In diesem Einkaufszentrum bieten ca. 100 Fachgeschäfte die unterschiedlichsten Waren an. \n\nAuf dem geräumigen Mittelsteifen der Petersburger Straße, stehen öffentliche Parkplätze zur Verfügung. Derzeit erfolgt noch keine Parkraumbewirtschaftung.', 'Sofern Sie Fragen haben oder einen Beratungstermin wünschen, freuen wir uns über Ihren Anruf oder eine E-Mail von Ihnen. \n\nGern kann das Objekt nach Terminvereinbarung besichtigt werden. \n\nACHTUNG: Da der Fußboden hergestellt wird, sind Besichtigungen aufgrund der Trocknungszeit zwischen 08.05.2020 und 08.06.2020 nicht möglich. \n\nWeitervermittlung über Makler nicht möglich. \n\nAlle Angaben beruhen auf Informationen Dritter, daher ist eine Haftung ausgeschlossen.'];;;;;;;;;
2020-05-11 12:22:27.974507;Berlin;self_contained_central_heating;ONE_YEAR_FREE;18373328;n;y;https://pictures.immobilienscout24.de/listings/5e6596fe-637b-4985-87f7-326a515dff22-1363073727.jpg/ORIG/resize/118x118%3E/extent/118x118/format/jpg/quality/80;19;16.53;40 MBit/s;telekom_layer_magenta_l;2;über VDSL;1911;REGULAR;16.53;117299198;gas;y;false;MagentaZuhause L;y;Berlin;y;6;1;140;no_information;energy_required;9.26;50;Berlin;12043;refurbished;sophisticated;D;false;100 MBit/s;no_information;no_information;n;https://padlock.link/ioml;https://padlock.link/ml;no_information;apartment;12043;1;n;2018;;2,active;true;Deutschland;premium;100 MBit/s;wohnung_kauf;n;1;web,email,bank,music,dl-ul,game,sd,mltstr,hd,fast-ul-dl;true;002.01009196231;260000;profile0;5;1;true;n;showqualicontactform;n;n;Neukölln_Neukölln;117299198;2;Berlin;/expose/117299198;"['Exklusives Wohnen in gefragter Lage - so präsentiert sich diese möblierte und vollständig sanierte 1-Zimmer-Wohnung mit durchdachtem Grundriss. \n\nDie charmante Wohnung befindet sich im Hinterhaus eines im Jahre 1911 errichteten Mehrfamilienhauses. Dort erwartet Sie ein heller Wohnraum, ein frisch saniertes Badezimmer sowie einen Abstellraum, welcher als Ankleidezimmer genutzt werden kann. Ein weiteres Highlight der Eigentumswohnung ist der großzügige Balkon.\n\nIm Wohnzimmer, im Ankleidezimmer sowie im Flur profitieren Sie von einem hochwertigen Fußboden, der in Kombination mit den hohen Decken und den großen Fenstern den typischen Altbaucharme unterstreicht und ein angenehmes Wohngefühl erzeugt. \n\nDie Eigentumswohnung wurde im Jahr 2018 vollständig saniert und eignet sich ebenfalls als rentable Anlage.  Zum jetzigen Zeitpunkt ist die Immobilie bis zum 31.08.2020 vermietet. Im Anschluss steht die Wohnung zur Selbstnutzung oder Weitervermietung zur Verfügung. Das monatliche Hausgeld beträgt 140,- €. \n\nBei Bedarf unterstützen wir Sie vollumfänglich bei der Verwaltung und Vermietung Ihrer Eigentumswohnung. Wir informieren Sie gerne in einem persönlichem Gespräch über die Möglichkeiten und Konditionen unseres Services. Die verkaufsrelevanten Unterlagen können wir Ihnen jederzeit zur Verfügung stellen. \n\nWir freuen uns auf Ihre Rückmeldung!\n\nGrand Urban Immobilien Group GUIG GmbH \nwww.Grand-Urban.de\nsales@grand-urban.de', '+ Keller\n+ Hausgeld: 140,- €\n+ Neue Einbauküche\n+ Sehr gute Infrastruktur\n+ Geschmackvoll möbliert\n+ Lichtdurchflutete Räume\n+ Top-Lage im Trendbezirk\n+ Bezugsfrei ab: 01.09.2020\n+ Als Anlage oder zur Selbstnutzung\n+ Badezimmer mit Dusche und Fenster\n+ Instandhaltungsrücklage; ca. 49.000,-€\n+ Vollständig sanierte Eigentumswohnung', 'Neukölln ist der achte Verwaltungsbezirk von Berlin und hat 329.767 Einwohner. Nach dem Bezirk Friedrichshain-Kreuzberg und dem Bezirk Mitte ist er der am dichtesten besiedelte Bezirk in Berlin. Neukölln wurde nach dem gleichnamigen Ortsteil benannt, der den nördlichen Teil des Bezirks ausmacht.\n\nIn der Auflistung der angesagtesten Szenekieze der Welt steht Neukölln auf Platz 7. Gar nicht so überraschend, so multinational und lebendig wie der Stadtteil ist. Der Ausgleich zwischen Job und Freizeit funktioniert hier wie sonst nirgendwo in der Stadt. Zwischen Kreativen, jungen Familien, Karrierekletterern, Neu- und Altberlinern fühlt man die Dynamik, den sichtbaren Wandel neben dem alltäglichen Treiben. Besonders entlang der Karl-Marx-Straße: Das Karstadt am Hermannplatz soll bald wieder glänzen wie in den Goldenen Zwanzigern. In der Alten Post werden gerade neue Coworking-Flächen gebaut und gegenüber ist ein modernes Büro- und Geschäftshaus geplant. Neukölln hat Zukunft, werden Sie ein Teil davon!\n\nDie angebotene Eigentumswohnung ist in einer sehr beliebten und schönen Gegend von Neukölln. In direkter Nähe ist das Kiehlufer und auch die Sonnenalle und mehere Busverbindungen sowie der U-Bhf, die Verbindungen sind schnell erreichbar. Schulen, Ärzte und Einkaufsmöglichkeiten sind in unmittelbarer Umgebung vorhanden.', 'Alle Angaben sind ohne Gewähr und basieren ausschließlich auf Informationen, die uns von unserem Auftraggeber übermittelt wurden. Wir übernehmen keine Gewähr für die Vollständigkeit, Richtigkeit und Aktualität dieser Angaben. Zwischenvermietung bleibt vorbehalten.']";;true;;;;105;;;
