timestamp;obj_regio1;obj_heatingType;obj_telekomTvOffer;obj_cId;obj_newlyConst;obj_balcony;obj_picture;obj_picturecount;obj_pricetrend;obj_telekomUploadSpeed;obj_telekomTrackingGroup;obj_usableArea;obj_telekomInternetTechnology;obj_yearConstructed;obj_telekomInternetType;obj_pricetrendbuy;obj_scoutId;obj_noParkSpaces;obj_firingTypes;obj_hasKitchen;obj_ExclusiveExpose;obj_telekomInternetProductName;obj_courtage;geo_bln;obj_cellar;obj_purchasePriceRange;obj_yearConstructedRange;obj_houseNumber;obj_energyType;obj_pricetrendrent;obj_livingSpace;geo_krs;obj_zipCode;obj_condition;obj_interiorQual;obj_energyEfficiencyClass;ga_cd_cxp_historicallisting;obj_telekomDownloadSpeed;obj_parkingSpace;obj_street;obj_lift;obj_telekomInternetUrlMobile;obj_telekomInternetUrl;obj_streetPlain;obj_typeOfFlat;geo_plz;obj_noRooms;obj_thermalChar;obj_assistedLiving;obj_ityp;obj_telekomHdTelephone;geo_land;ga_cd_via;obj_telekomInternet;obj_immotype;obj_rented;obj_floor;obj_telekomInternetServices;obj_telekomInternetProductAvailable;obj_cwId;obj_purchasePrice;ga_cd_application_requirements;obj_numberOfFloors;obj_noRoomsRange;ga_cd_maillead_default_shown;obj_garden;evt_count_pm_sig;obj_barrierFree;obj_international;obj_regio3;obj_objectnumber;obj_livingSpaceRange;obj_regio2;URL;beschreibung;obj_rentSubsidy;obj_groupnumber;ga_cd_via_qualified;obj_galleryAd;obj_lastRefurbish;obj_project_id;obj_nbp
2020-05-11 12:45:28.156789;Berlin;central_heating;ONE_YEAR_FREE;16943702;n;n;https://pictures.immobilienscout24.de/listings/c4902a86-ef5c-443f-a1c8-ebaf399f0d97-1331932871.jpg/ORIG/resize/118x118%3E/extent/118x118/format/jpg/quality/80;18;11.12;40 MBit/s;telekom_layer_magenta_l;4;über VDSL;1968;REGULAR;11.12;113880005;1;district_heating;n;false;MagentaZuhause L;y;Berlin;n;3;2;no_information;energy_consumption;6.13;28;Berlin;10587;well_kept;no_information;D;false;100 MBit/s;outside;no_information;y;https://padlock.link/ioml;https://padlock.link/ml;no_information;apartment;10587;1;126.9;n;2,active;true;Deutschland;standard;100 MBit/s;wohnung_kauf;n;4;web,email,bank,music,dl-ul,game,sd,mltstr,hd,fast-ul-dl;true;002.01007727021;139000;profile0;6;1;true;n;showqualicontactform;n;n;Charlottenburg_Charlottenburg;QE176;1;Berlin;/expose/113880005;"['Charlottenburg ist so groß wie eine mittlere Stadt und genauso vielfältig. Zwischen Kurfürstendamm und Schloss dominieren sanierte, zum Teil prunkvolle Altbauten das Stadtbild. Das Viertel Westend ist eine der vornehmsten Villengegenden Berlins, und in der einstigen Arbeitersiedlung Siemensstadt haben moderne Architekten ihre Vorstellungen von urbanen Mehrfamilien-Häusern verwirklicht. Der Kurfürstendamm und seine Seitenstraßen gehören zu den nobelsten Adressen, die Berlin zu bieten hat und die Wohnungen in den prachtvollen Jugendstil-Bauten sind entsprechend teuer. Einfacher und günstiger dagegen wohnt man nördlich des Schlosses. Insgesamt liegen die Mietpreise in Charlottenburg über dem Berliner Durchschnitt. \n\nDie Wohnung befimdet sich in der 4. Etage eines 6-geschossigen Wohn- und Geschäfsthauses.\nZur Wohnung gehören ein PKW-Stellplatz und ein Kellerabteil.\nDas Haus ist mit einem Personenaufzug ausgestattet.', 'Die Wohnung befindet sich auf der Hofseite des Gebäudes und bietet einen schönen Blick ins Grüne.\n\nDie ca. 28 Quadtratmeter Wohnfläche verteilen sich auf ein Zimmer eine kleine Diele, 1 Küchenzeile und ein Bad mit Dusche.\n\nAuf den Fußboden im Zimmer wurde Auslegware verlegt, in der Küche PVC und das Bad ist gefliest.', ""Charlottenburg ist ein Stadtteil im Berliner Westen. Er genießt dank seiner eleganten Vorkriegsbauten und Luxusboutiquen einen exklusiven Ruf. Entlang des Kurfürstendamms, kurz Ku'damm genannt, befinden sich viele Hotels und Kaufhäuser. Das Schloss Charlottenburg ist für seine barocken Innenräume und seinen kunstvoll angelegten Schlossgarten bekannt. Rund um den Savignyplatz, der vor dem Zweiten Weltkrieg ein Treffpunkt für Literaten und Künstler war, ziehen heute asiatische Restaurants ein internationales Publikum an.\n\n\n\nCharlottenburg liegt östlich der Havel und größtenteils südlich der Spree (mit Ausnahme von Charlottenburg-Nord). Der Stadtteil liegt im zentral-westlichen Teil Berlins. \n\nDie Anbindung an den öffentlichen Nahverkehr ist vor allem in zentralen Charlottenburg sehr gut, Es gibt vier U-Bahnlinien (U2, U7, U1, U9 streift) und zwei S-Bahnlinien (zum einen die Stadtbahn, deren Spandauer Arm auch durch Westend fährt), sowie die Ringbahn.\nAußerdem gibt es zahlreiche Busse. \n\nDer Bahnhof Zoologischer Garten musste seinen Rang als größter Fernbahnhof an den Hauptbahnhof abtreten. Einige Fernzüge fahren hier immer noch, hauptsächlich jedoch Nahverkehr.\n\nDie Autofahrer haben eine Anbindung an die Stadtautobahn (A111 und A100).\nVerkehrachsen sind in West-Ost-Richtung: der Heckerdamm im Norden, Spandauer Damm/Otto-Suhr-Allee/Straße des 17. Juni von Spandau bis Brandenburger Tor, die Heerstraße/Kaiserdamm/Bismarckstraße/17.Juni von Westend bis Brandenburger Tor bzw. Heerstraße/Kantstraße bis Zoologischer Garten, und der Ku’damm/Clayallee bis nach Zehlendorf."", 'Alle zum Objekt gemachten Angaben beruhen auf den Angaben Dritter, der Makler übernimmt für deren Richtigkeit keine Gewährleistung. Dieses Angebot ist freibleibend, Zwischenverkauf vorbehalten.\n\nBitte haben Sie Verständnis dafür, dass wir nur vollständig ausgefüllte Kontaktformulare bearbeiten können.\n\nWeitere Objekte und Informationen finden Sie auch auf unserer Homepage\n\nhttp://www.iml-immobilien.de/']";;;;;;;
2020-05-11 12:45:28.466244;Berlin;;;2046440;n;n;https://pictures.immobilienscout24.de/listings/a78b7a7b-a6d3-48c2-9f33-947577198d13-1324760415.jpg/ORIG/resize/118x118%3E/extent/118x118/format/jpg/quality/80;3;11.12;;;;;1928;;11.12;113863627;;no_information;n;false;;y;Berlin;n;7;1;no_information;no_information;6.13;90;Berlin;10589;no_information;no_information;;false;;no_information;no_information;n;;;no_information;apartment;10589;3.5;;n;2,active;;Deutschland;standard;;wohnung_kauf;y;4;;false;001.2046440;358000;profile0;;3;true;n;showqualicontactform;n;n;Charlottenburg_Charlottenburg;MAK_TEG_6;4;Berlin;/expose/113863627;['In einer Wohnbebauung aus den 20-iger Jahren direkt am Ufer der Spree befindet sich die Wohnung in der 4. Etage ohne Aufzug.\n\nEine quadratisch gut geschnittene 3,5 Zimmer Wohnung mit Blick zum Belvedere im Schlosspark von Charlottenburg. Idealerweise liegen die Räume sowohl nach Westen als auch Osten mit einem Balkon und einem kleinen Stehbalkon.\n\nDie Wohnung ist vermietet und es besteht ein Dauerwohnrecht für die Mieter.\n\nAlles Weitere zum Objekt in unserem vollständigen Exposé, das wir Ihnen gerne auf Anfrage - bitte mit Ihren vollständigen Daten zusenden werden.\n\n', 'Gepflegte Wohnanlage mit umfangreicher Modernisierung in den 90-iger Jahren.\n\nSiehe hierzu unser vollständiges Exposé.', 'Gegenüber vom Schlosspark mit optimaler Anbindung u. a. durch U-/ und S-Bahn Jungfernheide, Flughafenbus und die Nähe aller Einkaufszentren von Charlottenburg.'];317.14;;;;;;
2020-05-11 12:45:29.583217;Berlin;self_contained_central_heating;ONE_YEAR_FREE;108356;n;n;https://pictures.immobilienscout24.de/listings/1616b7a1-f18e-4c7f-baec-3ae2a26440df-1324748624.jpg/ORIG/resize/118x118%3E/extent/118x118/format/jpg/quality/80;12;10.94;40 MBit/s;telekom_layer_magenta_l;;über VDSL;1938;REGULAR;10.94;113862699;;gas;y;false;MagentaZuhause L;y;Berlin;y;4;1;30;;5.34;54.72;Berlin;12247;well_kept;normal;;false;100 MBit/s;no_information;"Schulstra&szlig;e";n;https://padlock.link/ioml;https://padlock.link/ml;Schulstraße;roof_storey;12247;2;;n;2,active;true;Deutschland;top;100 MBit/s;wohnung_kauf;n;3;web,email,bank,music,dl-ul,game,sd,mltstr,hd,fast-ul-dl;true;001.108356;170000;profile0;3;2;true;n;showqualicontactform;n;n;Lankwitz_Steglitz;113862699;2;Berlin;/expose/113862699;"['Die Wohnung befindet sich im Dachgeschoss des gepflegten Mehrfamilienhauses.\nDie 54 qm sind optimal aufgeteilt.\nDas Wohngeld setzt sich wie folgt zusammen:\nHausgeld -         137,80 EURO\nInst. Rücklage -   38,74 EURO\n\nBitte beachten Sie das der beigefügte Grundriss nicht aktuell ist. Das Badezimmer befindet sich nun in dem größeren Raum gegenüber der Eingangstür und das auf dem Grundriss eingezeichnete Badezimmer ist nun ein großzügiger Abstellraum.\nDes weiteren wurde die Abstellnsiche im Wohnzimmer geöffnet, so das jetzt ein größerer offener Wohnbereich geschaffen wurde.', '2 Zimmer, Küche, Bad', 'Lankwitz ist ein ruhiger und sehr schöner Bezirk im süden der Stadt. Von der Wohnung aus erreicht man fußläufig mehrere Parks und auch die Shoppingmeile ""Schloßstraße"" ist mit den öffentlichen Verkehrsmitteln oder dem Auto schnell erreichbar.', 'Besichtigungen finden nur mit Interessenten statt, deren Identität für uns nachvollziehbar ist.\n\nBei Interesse übersenden Sie uns bitte Ihre vollständigen Kontaktdaten.']";176.54;;;;;;
2020-05-11 12:45:30.089079;Berlin;central_heating;ONE_YEAR_FREE;179106;n;n;https://pictures.immobilienscout24.de/listings/c37d0da7-d37d-4357-bda5-f0a05a142285-1324748892.jpg/ORIG/resize/118x118%3E/extent/118x118/format/jpg/quality/80;13;10.09;40 MBit/s;telekom_layer_magenta_l;;über VDSL;1904;REGULAR;10.09;113862755;1;gas;y;true;MagentaZuhause L;n;Berlin;y;9;1;no_information;energy_consumption;4.59;98.28;Berlin;14167;mint_condition;sophisticated;E;false;100 MBit/s;outside;no_information;n;https://padlock.link/ioml;https://padlock.link/ml;no_information;apartment;14167;3.5;159;n;2,active;true;Deutschland;standard;100 MBit/s;wohnung_kauf;n;;web,email,bank,music,dl-ul,game,sd,mltstr,hd,fast-ul-dl;true;001.179106;589000;profile0;3;3;true;y;;n;n;Zehlendorf_Zehlendorf;S13485;4;Berlin;/expose/113862755;['Die hier angebotene Eigentumswohnung befindet sich im Hochparterre und Souterrain eines im Jahr 1904 errichteten Mehrfamilienhauses in traumhafter Lage von Zehlendorf. Die jetzigen Eigentümer haben die Wohnung im Jahr 2016 modernisiert, hochwertig ausgestattet und für sich individuell angepasst. Hohe Decken mit Stuck, Parkettböden, hochwertige Fliesen, sowie weitere Zimmer im Souterrain mit Ankleide sind hier nur einige Highlights. Das Umfeld ist geprägt von schönen alten Villen und Parks zum Spazieren gehen oder joggen. Fußläufig erreichen Sie den S-Bahnhof Zehlendorf sowie den Teltower Damm mit diversen Einkaufsmöglichkeiten. \n\nThe condominium offered here is on the raised ground floor and basement of a multi-family house built in 1904 in a fantastic location in Zehlendorf. In 2016, the current owners modernised the house, furnished it to a high standard and adapted it to their individual needs. High ceilings with stucco, parquet floors, high-quality tiles, as well as further rooms in the basement with dressing room are here only some highlights. The environment is characterized by beautiful old villas and parks to walk or jog. Within walking distance you can reach the S-Bahn station Zehlendorf as well as the Teltower Damm with various shopping possibilities.', 'Altbau, Bezug nach Vereinbarung, Einbauküche, Etagenwohnung, Garten/ -mitbenutzung, Gartenterrasse, Gaszentralheizung, gehobene Ausstattung, Gepflegt, Hochparterre, Keller, Maisonette, Modernisiert, Parkett, Renoviert, Selbstnutzung, Stellplatz, Souterrain, unvermietet, Strom', 'Diese Wohnlage gilt als ausgesprochen familienfreundlich: Viele gute Schulen wie z.B. die international renommierte John-F-Kennedy-Schule und Kindergärten sowie der nahe gelegene Heinrich-Laehr-Park sorgen für eine optimale Infrastruktur. Über den nahe gelegenen Teltower Damm erreichen Sie schnell das Zentrum Zehlendorfs mit seinen großzügigen Einkaufsmöglichkeiten und dem S-Bahn-Anschluss. In Gehnähe verfügen Sie über viele Geschäfte des täglichen Bedarfs. Sowohl den Schlachtensee wie auch den Grunewald erreichen Sie in wenigen Minuten. \nThis residential area is considered to be extremely family-friendly: many good schools such as the internationally renowned John F Kennedy School and kindergartens as well as the nearby Heinrich Laehr Park provide an optimal infrastructure. Via the nearby Teltower Damm you can quickly reach the centre of Zehlendorf with its generous shopping facilities and the S-Bahn connection. Within walking distance you will find many shops for your daily needs. Both the Schlachtensee and the Grunewald are just a few minutes away.', 'Sie möchten Ihre Immobilie verkaufen? Wir sind Ihr Partner für einen erfolgreichen Verkauf.\n1. Unsere Experten verfügen über tiefgehende Kenntnis des bestehenden Immobilienmarktes und entwickeln gerne eine individuelle Verkaufsstrategie für Sie. Wir bewerten Ihre Immobilie unverbindlich, kostenfrei und marktgerecht.\n2. Wir sind für Sie da und begleiten Sie von der kostenlosen Beratung bis hin zum Notartermin, immer getreu unserer Philosophie: kompetent, zuverlässig und diskret.\n3. Unser nationales und internationales Netzwerk sowie interne Synergien ermöglichen Ihnen den Zugang zu potenziellen Käufern aus aller Welt und somit einen erfolgreichen Abschluss. \nProfitieren Sie von unserem Know-How, rund 20 Jahren Erfahrung und 6 Büros in den besten Lagen Berlins. Gerne beraten wir Sie kostenlos in unserem Büro, per Telefon oder E-Mail!  \nEnergieausweis vorhanden:\nja'];488;668;;;;;
2020-05-11 12:45:30.398622;Berlin;central_heating;ONE_YEAR_FREE;16123617;n;y;https://pictures.immobilienscout24.de/listings/d086edac-8e76-4b23-86ed-930e6249f489-1351438989.jpg/ORIG/resize/118x118%3E/extent/118x118/format/jpg/quality/80;11;12.1;40 MBit/s;telekom_layer_magenta_l;;über VDSL;1897;REGULAR;12.1;113852487;;gas;y;true;MagentaZuhause L;y;Berlin;y;11;1;no_information;;7.07;297.16;Berlin;10777;fully_renovated;luxury;;false;100 MBit/s;no_information;no_information;y;https://padlock.link/ioml;https://padlock.link/ml;no_information;apartment;10777;7;;n;2,active;true;Deutschland;premium;100 MBit/s;wohnung_kauf;n;1;web,email,bank,music,dl-ul,game,sd,mltstr,hd,fast-ul-dl;true;002.01006554579;2375000;profile0;5;5;true;n;showqualicontactform;n;n;Schöneberg_Schöneberg;DC-BER5258;7;Berlin;/expose/113852487;['Diese einzigartige Altbauwohnung, welche sich in einem imposanten Gründerzeitaltbau befindet, ist ein wahres Unikat. Sie wurde 2012 aufwendig, mit viel Fingerspitzengefühl und Liebe zum Detail saniert. Die Deckenmalereien sowie Kassettendecken sind erhalten geblieben, teilweise wurde der Stuck von Spezialisten freigelegt und feinsäuberlich herausgearbeitet. Selten findet man noch solch große Altbauwohnungen in einem derart gut erhaltenen Zustand. \n\nMit einer Deckenhöhe von 4,20 m und einer Wohnfläche von insgesamt ca. 297 m², welche sich auf sieben Zimmer und drei Bäder verteilt, beeindruckt diese Wohnung mit einer Weitläufigkeit und einem großzügigen und offenem Raumgefühl. Eine geräumige Loggia lädt bei gutem Wetter zum Verweilen und Entspannen ein. Der praktische Grundriss der Wohnung ermöglicht viele Nutzungsmöglichkeiten, wie bspw. für die Familie mit Au-Pair oder die teilgewerbliche Nutzung mit einer Kombination aus Wohnen und Arbeiten. \n\nDiese wirklich einzigartige Altbauwohnung mit hochwertiger Ausstattung und gediegenem Flair, gelegen innerhalb eines lebendigen Szenekiezes, lässt viel Raum für Kreativität und Ideen. Sei es, dass man den alt-herrschaftlichen Stil komplett aufnimmt oder aber gekonnt mit moderner Einrichtung und Kunst verbindet und dadurch dieses Unikat noch mehr unterstreicht.', '• 7 Zimmer \n• 5-6 Schlafzimmer \n• Voll ausgestattete luxuriöse Einbauküche mit Geräten von Gaggenau und Miele\n• 3 großzügige Tageslichtbäder mit Marmor und Designer Sanitärausstattung\n• Parkettfußboden\n• Deckenhöhe ca. 4,20 Meter\n• Stuck, Kassettendecken, Deckenmalereien\n• Flügeltüren\n• Doppelkastenfenster\n• Geräumige Loggia\n• Personenaufzug \n• 2 Kellerabteile', 'Der Teilbezirk Schöneberg glänzt wie kaum eine anderer mit seiner pulsierenden Lebendigkeit und einer hervorragenden Infrastruktur. Das weltbekannte Warenhaus KaDeWe am Wittenbergplatz sowie die zur City West gehörende Tauentzienstraße stellen das ebenso eindrucksvoll unter Beweis wie der über die Grenzen Berlins hinaus bekannte Markt am Winterfeldtplatz, wie die legenden Bars, Cafés und Restaurants in der gesamten Wohngegend oder die seit den zwanziger Jahren des vergangenen Jahrhunderts berühmte Schwulen- und Travestieszene rund um den Nollendorfplatz, ganz zu schweigen von der legendären Potsdamer Straße. \n\nSchönbergs Stadtbild ist geprägt durch eine Architektur, die historische Altbauten mit modernen Neubauten zu verbinden versteht. Wunderschöne Mehrfamilienhäuser am Viktoria-Luise-Platz oder im Bayerischen Viertel säumen ebenso die typischen Berliner Straßen wie aufwendig sanierte Wohnhäuser im Winterfeld-Kiez und im Akazien-Kiez. Auch die viergeschossigen Altbauten rund um die Potsdamer Straße und die Neubauten am Gleisdreieck, dessen langgezogener Park zum Sporteln, Spazierengehen und Verweilen einlädt, versprechen eine hohe Wohnkultur.\n\nU- und S-Bahn sowie etliche Buslinien ermöglichen einen unkomplizierten und schnellen Zugang zu allen anderen Berliner Gegenden, gleich mehrere Anschlussstellen führen auf die Stadtautobahn, sodass auch Außenbezirke und Stadtgrenze innerhalb kürzester Zeit erreicht werden können.'];1300;;true;disabled;;;
2020-05-11 12:45:30.835970;Berlin;district_heating;ONE_YEAR_FREE;17053294;n;y;https://pictures.immobilienscout24.de/listings/fdfae9ff-4ef6-48bf-ab79-286a05e8fa00-1345299047.jpg/ORIG/resize/118x118%3E/extent/118x118/format/jpg/quality/80;7;11.24;40 MBit/s;telekom_layer_magenta_l;;über VDSL;1994;REGULAR;11.24;113897790;;district_heating;y;false;MagentaZuhause L;y;Berlin;y;11;5;no_information;energy_consumption;6.2;230.21;Berlin;10707;no_information;no_information;;false;100 MBit/s;no_information;no_information;y;https://padlock.link/ioml;https://padlock.link/ml;no_information;roof_storey;10707;3;146.8;n;2,active;true;Deutschland;standard;100 MBit/s;wohnung_kauf;y;5;web,email,bank,music,dl-ul,game,sd,mltstr,hd,fast-ul-dl;true;009.ac1dfa0b-218e-4ee8-80be-5d05a0d821f2;2000000;profile0;5;3;true;n;showqualicontactform;n;n;Wilmersdorf_Wilmersdorf;113897790;7;Berlin;/expose/113897790;['Die hier angebotene traumhafte und einzigartige Dachgeschosswohnung in bester Berliner Lage der City West verfügt über drei Zimmer, eine Galerie, eine große Dachterrasse mit Dachgarten sowie zwei weitere Balkone/Terrassen. Die von einem Berliner Architekten 1994 aufwendig und stilvoll ausgebaute Wohnung ist bequem über einen Aufzug zu erreichen. Die Tragkonstruktion des Daches wurde harmonische in das Raumkonzept mit einbezogen. Glas-und Stahlarchitektur kontrastiert mit der Wärme der Ahornböden – ein Wohnerlebnis der besonderen Art: klar, hell und transparent sowie mit viel Liebe zum Detail erreicht. Eine Glas-Stahl-Brücke führt zu einem zweistöckigen Bereich, der mit Dusche und kleiner Küchenzeile Gästen angeboten werden kann. \n\nDie beeindruckenden Fensterflächen öffnen überall einen fantastischen Blick über die Berliner Innenstadt. Die Terrassen der Wohnung sind sowohl nach Osten wie auch nach Westen ausgerichtet und bieten dem Bewohner Ausblicke sowohl auf den Osterberliner Fernsehturm als auch auf den Funkturm.\nDer Mittelpunkt der Wohnung Bilder der loftartige 90 m² große Raum mit fast sieben Metern Höhe, wo sich das Leben zwischen offener Küche Essplatz, Kamin und Stahlbrücke abspielt. Von dort führt der kleine Flur mit Einbauschränken in den Steifgenflügel mit dem Schlafzimmer, das mit einer Glasschiebetür mit dem sehr besonders designten Bad verbunden ist: ovale Badewanne und doppelter Waschtisch mit sandfarbenem brasilianischem Granit eingefasst. Versteckt hinter großen Spiegeln das EC und zu den Atelierfenstern hin die Dusche. Das Schlafzimmer bietet an der Rückwand viel Platz für Garderobe. Ein Hausarbeitsraum, ein Gäste-WC und ein Garderobenraum befinden sich im geräumigen Eingangsbereich, von dem aus Glastüren in alle Wohnräume führen.\n\nDie Wohnung ist seit 2011 vermietet, es gibt keine Sperrfrist und kein Vorkaufsrecht.', '- Architektenwohnung, Baujahr 1994 (DG-Ausbau) in einem Jugendstilbau von 1909 im 5- Obergeschoss mit Fahrstuhl\n- Hausgeld 472,00 €\n- Fernwärmeheizung\n- ca. 230 m² Wohnfläche und drei Terrassen auf ca. 50 m²\n- 6,80 m Raumhöhe im 90 m² Wohn-und Küchenbereich\n- Gästebereich über zwei Etagen mit Dusch/WC und Küchenzeile\n- Ein Schlafzimmer verbunden mit großem Bad\n- Gäste-WC, Wirtschaftsraum, diverse Einbauschränke', 'Die Wohnung befindet sich in einer sehr ruhigen Einbahnstraße. Sie geht vom bekannten Olivaer Platz ab, dessen Umgestaltung zu einem grünen Begegnungsort in diesem Jahr abgeschlossen wird. Der Kurfürstendamm, Magnet der City Werst, liegt direkt dahinter. Exquisite Boutiquen, Restaurants, Cafés und Lebensmittelgeschäfte finden sich auf dem Weg zur Gedächtniskirche genauso wie Theater und Kinos. Durch die zentralen Lage besteht ein sehr gute Anbindung an das öffentliche Nahverkehrsnetz. Die U-Bahn-Station Adenauerplatz und Haltestellen diverser Buslinien sind schnell zu Fuß erreicht, der Fernbahnhof Zoologischer Garten liegt 15 Minuten entfernt. \n\nIn den Nebenstraßen des Kurfürstendamms prägen hochherrschaftliche Wohnhäuser das Bild, wo sich viele kleinere Geschäfte und individuelle Gastronomen niedergelassen haben. Das Umfeld ist sowohl für Einheimische als auch für Zugezogene weiterhin eine der beliebtesten und sehr gefragten Gegenden in Berlin.', 'Vermarktung im Alleinauftrag / Familie'];445.72;;;;;;
2020-05-11 12:45:31.148101;Berlin;central_heating;ONE_YEAR_FREE;15402574;n;n;https://pictures.immobilienscout24.de/listings/f9126f77-e744-4b53-8366-89e6fcfa8c9d-1361443342.jpg/ORIG/resize/118x118%3E/extent/118x118/format/jpg/quality/80;1;16.53;40 MBit/s;telekom_layer_magenta_l;;über VDSL;1905;REGULAR;16.53;113846129;;gas;n;false;MagentaZuhause L;y;Berlin;y;4;1;no_information;energy_consumption;9.26;49;Berlin;12049;well_kept;normal;F;false;100 MBit/s;no_information;no_information;n;https://padlock.link/ioml;https://padlock.link/ml;no_information;apartment;12049;1.5;162;n;2,active;true;Deutschland;premium;100 MBit/s;wohnung_kauf;y;3;web,email,bank,music,dl-ul,game,sd,mltstr,hd,fast-ul-dl;true;001.15350375;162000;profile0;5;1;true;n;showqualicontactform;n;n;Neukölln_Neukölln;F36;2;Berlin;/expose/113846129;['Etage: 3. OG\nZimmeranzahl: 1,5\nWohnfläche ca.: 49 m2\nStrang- und Kellersanierung: 2018\nBad mit Wanne: ja und Fenster\nFahrstuhl: kein, aber laut TE ist es möglich ihn anzubauen.\nBalkon: kein\nBoden: Laminat und Teppich \nHeizung: Gas-Zentralheizung\nZustand: sanierungsbedürftig\n\nVermietet seit: 01.11.1993\n\nEigenbedarfskündigungsschutz: 10 Jahre nach dem Kauf. \n\nBrutto-Kalt-Miete: 310,05 € p.M. ab 1.12.2015 \nHK-VZ: 70,34 €\nWarmmiete: 380,05 €\n\nHausgeld: 229 € (warm), davon umlagefähig: 170,34 €\n2018 hat der Verkäufer auf seine Kosten (ca. 260.000 €) alle Wasser- und Abwasserhauptstränge und den Keller saniert. \nDie zentrale Gasheizungsanlage wird vom Contractor Techem betrieben.', 'Nordneukölln gehört derzeit zu den begehrtesten und historisch gewachsenen Wohnlagen Berlins. Das Gebiet ist heute eine Perle urbaner Wohnkultur: Cafés, Naturkostläden, Galerien haben eröffnet. Am Ostermarkt bieten Künstler und Kunsthandwerker ihre Produkte und Kunstwerke an und Autoren stellen ihre Bücher vor. Hier wohnen weltoffene Menschen, die die Liberalität Berlins zu schätzen wissen.\n\nIn zwei Gehminuten, auf der Hermannstraße befindet sich die U8-Boddinstraße sowie zahlreiche Bushaltestellen. Die nahegelegene Hasenheide bietet viele Freizeitmöglichkeiten an.', 'Ganz wichtig bei der Anfrage: Teilen Sie uns Ihre vollständigen Kontaktdaten: Vor- und Nachnamen, Adresse, Mail und Telefonnummer mit.\n\nSeit einigen Jahren gilt in Deutschland das Geldwäschegesetz. Nach diesem Gesetz ist jedes Immobilienbüro verpflichtet, bei Kontaktaufnahme die Identität des Kunden festzuhalten. \n\nDieses Kaufangebot ist provisionspflichtig. Dem Erwerber wird bei Abschluss eines Kaufvertrages eine Provision in Höhe von 7,14 % des beurkundeten Kaufpreises inkl. der gesetzlichen MwSt. berechnet. \n\nDie in diesem Exposé gemachten Angaben beruhen auf Auskünften des Eigentümers oder vorgelegten Plänen und Berechnungen. Wir übernehmen daher keine Haftung, für die hier gemachten Angaben, insbesondere für Flächenangaben, Grundrisse, Lageskizzen sowie wann was und wie im Hause renoviert und saniert wurde, da wir das nicht persönlich überwachen konnten. Dieses Angebot ist freibleibend, ein Zwischenverkauf bleibt vorbehalten.\n\nHinsichtlich weiterer Dienstleistungen in Zusammenhang mit dem Erwerb, wie Finanzierungen unterstützen wir Sie gerne. Es ist uns leider nicht gestattet, Sie zu steuerrelevanten Aspekten zu beraten. Hierzu wenden Sie sich bitte an Ihren Steuerberater. Wir stehen Ihnen gerne für Fragen zur Verfügung.'];229;;true;disabled;2018;;
