2020-05-11 12:42:50.437914;Berlin;ONE_YEAR_FREE;6735470;n;y;https://pictures.immobilienscout24.de/listings/6ef63e65-7bb3-4f2b-9f2d-a3558c7effa5-1295340143.jpeg/ORIG/resize/118x118%3E/extent/118x118/format/jpg/quality/80;20;12.92;40 MBit/s;telekom_layer_magenta_l;70.75;über VDSL;1959;REGULAR;12.92;70517004;;y;false;MagentaZuhause L;y;Berlin;y;6;2;394;21;energy_required;8.28;70.75;Berlin;10557;well_kept;normal;;false;100 MBit/s;outside;Flensburgerstrasse;y;https://padlock.link/ioml;https://padlock.link/ml;Flensburgerstrasse;apartment;10557;3;151;n;2,active;true;Deutschland;top;100 MBit/s;wohnung_kauf;n;web,email,bank,music,dl-ul,game,sd,mltstr,hd,fast-ul-dl;true;001.6735470;298000;profile0;7;3;true;n;showqualicontactform;n;n;Tiergarten_Tiergarten;EM1;3;Berlin;/expose/70517004;['Großzügige, BEZUGSFREIE \n3-Zimmer Wohnung im Hansaviertel nähe Lessingbrücke .\n\nSpacious VACANT \n2-bedroom apartment in Hansaviertel close to Lessingbrücke \n\nGrande appartement 3 pieces LIBRE  au Hansaviertel pres de Lessingbrücke', 'Die Wohnung besteht aus 3 Zimmern, Küche, einem Bad mit Badewanne ! Ein sonniger Südbalkon mit einem herrlichen Blick in den Garten läd zum Verweilen !\nDer offene Eingangsbereich der zur Küche aufschließt bietet Platz für einen gemütlichen Essplatz.   \n\nThe big entry area close to the kitchen area is ideal as cosy dining place. \n\nL´appartement a 3 piece. Une grande espace entree, près de la cuisine offre l emplacement ideal pour les diner entres amis.', 'Das Hansaviertel ist bekannt für seine zentrale Lage und für seine hohe Lebensqualität dank dem vielen Grün und der nahen Spree. Hier lebt man mitten in der großen Stadt und hat trotzdem alle Vorzüge eines entspannten Vorstadtlebens. \r\n\r\nThe Hansaviertel is renowned for its central location and for its high quality of life - thanks to a very green surrounding and the close by river SPREE. Here one has all the attractiveness of living in a metropolitain city and in the same way one can enjoy quiet subburbian living. \r\n\r\nLe quartier HANSAVIERTEL est fameux pour un emplacement centrale sur Berlin et au meme temps pour la grande qualité de vie grace a beaucoup de verdure et la fleuve SPREE tout pres. Ici on a l´avantage de vivre dans une ville metropolitaine et en meme temps on a tout les avantage d´un vie relaxant.   ', 'Die Wohnung ist  bezugsfrei und kann nach Absprache besichtigt werden. Gerne vereinbaren wir mit Ihnen einen individuellen Termin ! \nBitte haben Sie Verständnis, dass wir Anfragen nur unter vollständiger Angabe Ihres Namens, Ihrer Adresse und Tel. Nummer bearbeiten können. \n\nThe apartment is vacant and can be viewed by arrangement. Please phone us and arrange your personal viewing appointment. Please understand that we can only treat inquiries mentioning your complete name, your adress and your Tel. Number. \n\nL´appartement est vide  et peut etre visité a sur rendez vous. Veuillez s.v.p. arrangez votre rendez-vous personell avec notre bureau. \nMerci pour votre comprehension qu´on peut seulement traiter des demandes mentioner votre nom complet, votre adress et votre numéro de téléphone.'];district_heating;2010;2;;;1;;
2020-05-11 12:42:50.814847;Berlin;;16921323;n;n;https://pictures.immobilienscout24.de/listings/8ecac4a6-f87d-44f2-932f-3fbfd6160054-1333539985.jpg/ORIG/resize/118x118%3E/extent/118x118/format/jpg/quality/80;17;12.7;;;;;1919;;12.7;114454955;gas;n;false;;y;Berlin;n;6;1;171.43;73/73a;energy_consumption;7.58;52.46;Berlin;10555;well_kept;no_information;;false;;no_information;Alt Moabit;n;;;Alt_Moabit;apartment;10555;2;129;n;2,active;;Deutschland;top;;wohnung_kauf;n;;false;009.c282bcb0-d517-4793-83c4-cd4999b68120;269000;profile0;5;2;true;n;showqualicontactform;n;n;Tiergarten_Tiergarten;HA-123-WE32;2;Berlin;/expose/114454955;"['Der sanierte Berliner Altbau, mit seinem für den Bezirk charakteristischen Innenhöfen ist in einem sehr gepflegten Zustand und verfügt über ein Vorderhaus, 2 Seitenflügel und einem Hinterhaus.\n\nDie Wohnung befindet sich im Gartenhaus, ist gut geschnitten und hell. Alle Altbauelemente sind noch vorhanden, Dielung, Stuck, Doppelkastenfenster, Holzkassetteninnentüren sind in einem gepflegten Zustand.\n\n--------\n\nThe renovated Berlin old building, with its characteristic inner courtyards, is in a very well-kept condition and has a front building, 2 side wings and a rear building.\n\nThe apartment is located in the garden house, is well cut and bright. All old building elements are still present, Dielung, stucco, double box windows, wooden cassette interior doors are in a maintained condition.', 'Der Verkauf der Einheiten erfolgt im IST-Zustand. Bitte beachten Sie mögliche zusätzliche Renovierungskosten in Ihrer Kalkulation.   \n\nDas Mehrfamilienhaus, in dem sich die angebotene Wohnung befindet, wurde vor kurzem nach WEG aufgeteilt, daher ist die Instandhaltungsrücklage noch gering.\n\nAlle Wohnungen in dem Haus werden verkauft, gerne erhalten Sie von uns auch eine Aufstellung und Informationen der noch verfügbaren Einheiten.\n\nSobald alle Wohnungen in diesem Haus verkauft wurden, gibt es keine überwiegenden Mehrheitseigner. Die neue Gemeinschaft von Eigentümern findet sich gerade frisch zusammen.\n\n--------\n\nThe units are sold in the ACTUAL state. Please note possible additional renovation costs is your calculation.   \n\nThe apartment building in which the offered apartment is located has recently been divided into flats, so the maintenance reserve is still low.\n\nAll apartments in the house will be sold, we will be happy to provide you with a list and information about the units still available.\n\nOnce all the apartments in this house have been sold, there are no predominant majority owners. The new community of owners is just getting together.', 'Moabit ist in mehrere Ortslagen unterteilt, darunter den sternförmigen Stephankiez rund um den Stephanplatz in der Nähe des neuen Hauptbahnhofs, ein Gründerzeitviertel mit zu 90 Prozent erhaltener historischer Bausubstanz, und zukünftig die Europacity. Weitere Kieze sind der Beusselkiez, der Huttenkiez, der Lehrter-Straßen-Kiez und das Westfälische Viertel mit der Straße Alt-Moabit.\n\nDer Ortsteil wird von den Wasserstraßen Spree, Berlin-Spandauer Schifffahrtskanal, Westhafenkanal und Charlottenburger Verbindungskanal umschlossen und wird von der S-Bahn und Tram tangiert und der U-Bahn durchquert. \n\nMoabit überzeugt durch seinen alternativen Aufbau-Charme und ein deshalb immer jüngeres Publikum. Die kleine Insel im Westen Berlins ist nicht nur besuchens- sondern auch sehr lebenswert.\n\n--------\n\nMoabit is divided into several locations, including the star-shaped Stephaniez around Stephanplatz near the new main railway station, a Wilhelminian quarter with 90 percent preserved historic buildings, and the future Europacity. Further neighbourhoods are the Beusselkiez, the Huttenkiez, the Lehrter-Straßen-Kiez and the Westphalian quarter with the Alt-Moabit street.\n\nThe district is surrounded by the waterways Spree, Berlin-Spandauer Schifffahrtskanal, Westhafenkanal and Charlottenburger Verbindungskanal and is crossed by the S-Bahn and tram and the subway. \n\nMoabit convinces with its alternative structure charm and therefore an ever younger audience. The small island in the west of Berlin is not only worth a visit but also a very good place to live.', ""Als wirtschaftliches Unternehmen sind wir selbstverständlich auf die Zahlung einer Provision angewiesen.\n\nEs gilt ein vom Käufer an uns zu entrichtendes Vermittlungs- bzw. Nachweishonorar (Maklercourtage) bei Abschluss des Kaufvertrages in Höhe von 7,14 % (inkl. gesetzl. MwSt.) auf den tatsächlichen Kaufpreis als vereinbart. Unsere Angebote sind nur für den Empfänger selbst bestimmt. Bei einer Weitergabe an Dritte haftet der Angebotsempfänger für unsere Courtage. Die Inhalte unserer Angebote beruhen auf den Angaben des Verkäufers bzw. anderer fremder Dritter und nicht auf unseren Ermittlungen und erfolgen deshalb ohne Gewähr für deren Richtigkeit. Unsere Angebote erfolgen freibleibend und unverbindlich. Zwischenverkauf bleibt vorbehalten.\n\n--------\n\nAs an economic enterprise, we are naturally dependent on the payment of a commission.\n\nA brokerage or proof fee (broker's commission) to be paid to us by the buyer on conclusion of the purchase contract in the amount of 7.14% (incl. statutory VAT) on the actual purchase price is deemed to have been agreed. Our offers are only intended for the recipient himself. The offeree is liable for our brokerage fee in the event that the offer is passed on to third parties. The contents of our offers are based on the information provided by the seller or other third parties and not on our investigations and are therefore without guarantee for their accuracy. Our offers are subject to confirmation and non-binding. Subject to prior sale.""]";central_heating;;;;;2;;
2020-05-11 12:42:51.160857;Berlin;ONE_YEAR_FREE;185949;n;n;https://pictures.immobilienscout24.de/listings/2f98e0e7-7ba3-4bf5-849e-7b280646b310-1357658237.jpg/ORIG/resize/118x118%3E/extent/118x118/format/jpg/quality/80;15;10.66;40 MBit/s;telekom_layer_magenta_l;;über VDSL;1900;REGULAR;10.66;114435370;no_information;n;true;MagentaZuhause L;n;Berlin;y;7;1;156.59;227;energy_consumption;5.91;43.22;Berlin;10117;well_kept;no_information;D;false;100 MBit/s;no_information;"Torstra&szlig;e";y;https://padlock.link/ioml;https://padlock.link/ml;Torstraße;apartment;10117;1;128.8;n;2,active;true;Deutschland;standard;100 MBit/s;wohnung_kauf;n;web,email,bank,music,dl-ul,game,sd,mltstr,hd,fast-ul-dl;true;001.185949;380000;profile0;5;1;true;n;showqualicontactform;n;n;Mitte_Mitte;16718702;2;Berlin;/expose/114435370;['Willkommen in der Torstraße 225/227! Der stilvolle Gründerzeit-Altbau aus dem Jahr 1900 liegt in zentraler Lage in Berlin-Mitte, fußläufig nur wenige Minuten vom U-Bahnhof Oranienburger Tor entfernt.\r\n\r\nDas Mehrfamilienhaus besticht durch seine geschmackvoll gestaltete Fassade mit überwiegend original erhaltenen Altbau-Elementen. So fallen aufgearbeitete Rundbogen-Fenster und Holzdoppelkasten-Fenster ins Auge. Die Wohnungen im Vorderhaus verfügen teilweise über Balkone oder lichtdurchflutete Erker.\r\nDas Gebäude beeindruckt ebenso durch seine Größe. Es besteht einem Vorderhaus, zwei Seitenflügeln und zwei Gartenhäusern, die über sechs separate Aufgänge und zwei Innenhöfe zu erreichen sind. Auf fünf Etagen verteilen sich im Vorderhaus fünf Gewerbeeinheiten sowie 1- bis 3-Zimmerwohnungen mit Wohnflächen von etwa 40 bis 106 Quadratmeter. Besonders die Wohnungen im Vorderhaus strahlen mit ihren Deckenhöhen von bis zu 3,70 Meter und ihren großen Doppelfenstern einen besonders weiten und lichten Charakter aus. Der Altbau-Charme wird durch überwiegend original erhaltene und überarbeitete Holzböden unterstrichen, die zum Teil als Tafelparkett, Fischgrät-Parkett oder als Dielen ausgeführt sind. Die meisten Wohnungen verfügen über Balkone und ein Großteil ist mit lichtdurchfluteten Erkern ausgestattet.\r\n \r\nIm Zuge von Sanierungsarbeiten wird das Wohnhaus mit Aufzügen ausgestattet und um Dachgeschoss-Wohnungen erweitert. Das Gebäude wird über eine Gaszentralheizung versorgt.\r\n\r\nIm ersten Innenhof befinden sich extra errichtete Abstellmöglichkeiten für Fahrräder.\r\n \r\nObjektseite: www.eigentumswohnung-mitte.de\r\nDrohnenfilm: https://youtu.be/1WlUKWuheNA\r\nWohnbeispiel: https://youtu.be/jZoDEedfQbU\r\n\r\nACCENTRO App für iOS https://goo.gl/KvMJTa und für Android https://goo.gl/ACqL6H', 'Wie der Name ‚Berlin-Mitte‘ verspricht: Hier lebt man mitten im Herzen der Stadt! Mitte setzt sich aus einer Vielzahl an lebendigen Kiezen mit eigenem Charakter zusammen. Die Torstraße liegt in einem der reizvollsten Quartiere – der Spandauer Vorstadt mit dem an kulturhistorischen Schätzen reichen Scheunenviertel.\r\n\r\nWohnen und Leben in der Torstraße bedeutet, alle Annehmlichkeiten des urbanen Lebens der Metropole Berlin direkt vor der Haustür zu haben. Hier bewegt man sich zwischen kulinarischer und kultureller Vielfalt. In südlicher Richtung pulsiert das Leben rund um die Friedrichstraße mit ihrer international renommierten Bühnenlandschaft vom Deutschen Theater über das Berliner Ensemble hin zum Friedrichstadt-Palast. Die nahegelegene Spree lädt zu Ausflügen mit dem Schiff durch die historische Mitte ein.\r\n\r\nDie nur etwa einen Kilometer entfernte Museumsinsel gehört zu den kulturellen Höhepunkten der Stadt, die sowohl Touristen als auch Einheimische immer wieder in ihren Bann zieht. Eine besondere Atmosphäre besonders in den Sommermonaten versprüht der angrenzende Monbijoupark. Die Strandbar an der Uferpromenade lädt unter freiem Himmel zum Tangotanzen ein, die Märchenhütte bietet besondere Interpretationen der Grimm’schen Märchen und im Kinderbad können sich die Kleinen genüsslich die Zeit vertreiben.\r\n\r\nDesign- und Kunstliebhaber kommen im ehemaligen Scheunenviertel zwischen Linienstraße, Weinmeisterstraße und rund um den Hackeschen Markt auf ihre Kosten. Galerien und exklusive Shops sind eine Oase mit besonderem Charme für Flaneure. So vielfältig sich der Kiez am Tag zeigt, so lebendig geht auch das Nachtleben zu. Cafés, Bars und Restaurants jeglicher Couleur lassen das Herz von Berlinern und Gästen gleichermaßen höherschlagen und spiegeln die besondere Atmosphäre der beliebten Metropole wider.'];central_heating;;4900;disabled;;4;;
2020-05-11 12:42:51.512642;Berlin;ONE_YEAR_FREE;15424723;n;y;https://pictures.immobilienscout24.de/listings/52033d39-68b3-46bf-a4a0-c313657aba1d-1348635702.jpg/ORIG/resize/118x118%3E/extent/118x118/format/jpg/quality/80;8;8.95;40 MBit/s;telekom_layer_magenta_l;;über VDSL;1998;REGULAR;8.95;114457179;district_heating;y;false;MagentaZuhause L;y;Berlin;y;5;5;286.03;no_information;energy_required;5.33;70.82;Berlin;12559;well_kept;normal;;false;100 MBit/s;underground_garage;no_information;y;https://padlock.link/ioml;https://padlock.link/ml;no_information;apartment;12559;3;94;n;2,active;true;Deutschland;top;100 MBit/s;wohnung_kauf;y;web,email,bank,music,dl-ul,game,sd,mltstr,hd,fast-ul-dl;true;001.15372524;234361.09;profile0;4;3;true;y;showqualicontactform;y;n;Köpenick_Köpenick;1031;3;Berlin;/expose/114457179;['Das im Jahr 1998 erbaute Wohnensemble befindet sich unweit von der beliebten Köpenicker Altstadt. Die Wohnung selbst befindet sich inmitten einer sehr ruhigen Wohnanlage in grüner Umgebung. Die Bausubstanz der Immobilie befindet sich augenscheinlich in einem sehr guten Zustand. \n\nDie Wohnung ist nach Süd-Osten ausgerichtet und bietet über den angrenzenden Balkon einen wunderschönen Blick ins Grüne. Das Schlafzimmer ist nach Nord-Westen ausgerichtet und heizt sich dadurch auch an warmen Sommertagen nicht stark auf. Die Wohnräume sind mit Parkett ausgestattet, Bad und Küche sind gefliest. Die vorhandene Einbauküche befindet sich in einem gepflegten Zustand und ist im Kaufpreis bereits enthalten.\n\nDie Wohnanlage wird über Privatstraßen nur von Anwohnern befahren. Die Zimmer der hier angebotenen Wohnung liegen von der Straße abgewandt. Die Wohnung ist deshalb besonders ruhig gelegen.\n\nDer Aufzug ist barrierefrei erreichbar und hält in jeder Etage. Auch der Keller ist mit dem Aufzug erreichbar. Die Wohnung eignet sich deshalb nicht nur für junge Singles/Studenten, sondern auch besonders gut für Senioren, die altersgerecht wohnen möchten.\n\nAuf Wunsch kann ein Tiefgaragenstellplatz in direkter Nähe zur Wohnung miterworben werden.', '- Holzfenster mit Isolierverglasung\n- Parkett im Wohn- und Schlafzimmer sowie im Flur\n- Zentralheizung (Fernwärme)\n- Moderne Konvektorenheizkörper\n- Innenliegendes Bad mit Badewanne\n- Balkon mit Südostausrichtung\n- Kabelanschluss\n- Abstellraum im Keller\n- Fahrradabstellbereich im Innenhof\n', 'Treptow-Köpenick ist Berlins größter, wasser- und waldreichste Stadtteil, doch gleichzeitig auch der am wenigsten besiedelte. Durch die hohe Lebensqualität wird Köpenick vor allem bei Familien immer beliebter. Wohnen in Köpenick bedeutet Ruhe, Idylle, Natur und trotzdem eine gute Anbindung an das lebendige Treiben im Herzen der Hauptstadt. Anwohner und Touristen können hier Berlins größtes Waldgebiet, sein einziges Wasserschloss sowie den größten See der Hauptstadt genießen. Auch die historische Alststadt Köpenicks ist eine Sehenswürdigkeit. Sie gehört zu den ältesten Siedlungen Berlins. Vom Allendeviertel aus erreicht man die Köpenicker Altstadt in wenigen Minuten und auch mit den öffentlichen Verkehrsmitteln ist man gut an die Berliner Innenstadt angebunden (S47, Bus 165 und 169, Tram 60, 61 und 63).', 'Gerne lassen wir Ihnen für diese Immobilie bei Vorlage einer Kontaktformularanfrage mit Ihrem Vor- und Nachnamen, Ihrer Wohnanschrift, Ihrer Telefonnummer sowie Email-Adresse, ein ausführliches Exposé mit ergänzenden Angaben (z. B. Grundriss, zusätzliche Fotos und zusätzliche Informationen) zukommen. Unsere Exposés enthalten zudem die Anschrift der Immobilie, damit es ihnen möglich ist, sich zunächst einen Eindruck von der konkreten Lage zu verschaffen. Es gelten unsere Allgemeinen Geschäftsbedingungen. Diese, unser Impressum, eine Ausfertigung unserer Widerrufsbelehrung nebst Widerrufsformular sowie unsere Datenschutzerklärung finden Sie auf unserer Internetseite: www.estate-moments.de. Dieses Verkaufsangebot ist an Kaufinteressenten gerichtet. Bei Zustandekommen eines notariellen Kaufvertrags entsteht unser Anspruch auf Zahlung der genannten Provision somit gegenüber dem Käufer. Darüber hinhaus sind vom Käufer auch die Grunderwerbssteuer (in Berlin 6 % und in Brandenburg 6,5 % des Kaufpreises) sowie die Notar- und Grundbuchgebühren (ca. 2 % des Kaufpreises) zu bezahlen. \n\nLaut Verordnung Nr. 524/2013 der Europäischen Union (EU) sind wir als Immobilienmakler verpflichtet, auf unserer Internetseite im Impressum und bei Verkaufs- oder Vermietungsangeboten einen Hinweis auf die Online-Streitschlichtungsstelle aufzunehmen, die unter der folgenden Adresse zu finden ist: ec.europa.eu/consumers/odr.'];central_heating;1111;;disabled;1;3;;
2020-05-11 12:42:52.037989;Berlin;ONE_YEAR_FREE;4338188;n;y;https://pictures.immobilienscout24.de/listings/7d427d69-f9d7-4c3b-8721-d370352152dd-1333440902.jpg/ORIG/resize/118x118%3E/extent/118x118/format/jpg/quality/80;27;10.71;40 MBit/s;telekom_layer_magenta_l;;über VDSL;1938;REGULAR;10.71;114447320;no_information;n;false;MagentaZuhause L;y;Berlin;y;7;1;;no_information;energy_consumption;6.28;115;Berlin;13583;no_information;no_information;;false;100 MBit/s;no_information;no_information;n;https://padlock.link/ioml;https://padlock.link/ml;no_information;no_information;13583;4;148;n;2,active;true;Deutschland;standard;100 MBit/s;wohnung_kauf;n;web,email,bank,music,dl-ul,game,sd,mltstr,hd,fast-ul-dl;true;001.4338188;395000;profile0;;4;true;n;showqualicontactform;n;n;Spandau_Spandau;92991;5;Berlin;/expose/114447320;['Diese exklusive und modern geschnittene Dachwohnung besticht durch helle Zimmer, eine großzügige Raumaufteilung, einer Top-Lage und vielen weiteren Details wie Klimaanlage, Gäste Bad, charmante Sichtbalken, Süd-Balkon, Nussbaum Parket, Cat 7 Verkabelung, Ausbaupotenzial sowie einer beeindruckenden Deckenhöhe.\n\nVon einem sehr gepflegten Treppenhaus gelangen Sie in eine großzügig geschnittene und architektonisch einzigartige Wohnung. Die fantastische Ausrichtung ermöglicht es Ihnen, spektakulären Sonnenuntergängen auf Ihrer Terrasse beizuwohnen, hier lasst es sich herrlich entspannen. Das eindrucksvolle Wohnzimmer mit einer Deckenhöhe von circa fünf Metern wird durch die Sichtbalken des Dachstuhls zum imposanten Mittelpunkt Ihrer neuen Residenz und bietet Ihnen und Ihrer Familie jede Menge Platz. Vom gemütlichen Familienabend bis zur ausgelassenen Feier mit Freunden hier lässt es sich wohlfühlen. \nDie offene Küche mit Ausblick ist ein echter Hingucker, zwei identisch große Zimmer bieten sich als Kinderzimmer an. Das Elternschlafzimmer bietet Ihnen Privatsphäre und zwei Bäder runden diese besondere Immobilie ab. Zusätzlich Spitzboden circa 24 m² Nutzfläche, Ausbau zu Wohnraum möglich, Erlaubnis zum Einbau von Dachflächenfenstern liegt vor des Weiteren verfügt das Objekt über einen Keller mit circa 6 m².\n\n\nDer Energieverbrauchsausweis gibt folgende Werte an\nEnergieverbrauchskennwert: 148 kWh(m²a)\nEnergieeffizienzwert: E\nEnergieträger: Fernwärme\n\nGerne stehe ich Ihnen für eine Besichtigung zur Verfügung, Sjard Schoenwälder ImmoSky Deutschland GmbH.', 'Im beliebten Bezirk Spandau, dem Falkenhagener Feld in einer ruhigen Nebenstraße mit herrlichem alten Baumbestand befindet sich dieses Refugium der Ruhe.\nDiverse Ausflugsmöglichkeiten, Naherholungsmöglichkeiten sowie Einkaufsmöglichkeiten machen diesen Teil von Spandau so lebenswert.\nSchwimmbad 900m, Sportplätze 300m, Spielplatz 200m und der Spandauer Forst 1,5km stehen zur Erholung bereit.\nIn der Altstadt Spandau sind sowohl nochmals viele Einkaufsmöglichkeiten vorhanden als auch Ärzte, Rechtsanwälte und sonstige Dienstleistungen.\nMehrere Grund- und Oberschulen sind ebenfalls fußläufig erreichbar.'];central_heating;;;disabled;;3;;
2020-05-11 12:42:52.344539;Berlin;;16048948;n;n;https://pictures.immobilienscout24.de/listings/26ddb45c-e531-42b5-ade8-2de5282d0e15-1333436165.jpg/ORIG/resize/118x118%3E/extent/118x118/format/jpg/quality/80;3;10.66;;;;;1970;;10.66;114446404;;n;false;;y;Berlin;n;7;2;;no_information;;5.91;61;Berlin;10117;no_information;no_information;;false;;no_information;no_information;n;;;no_information;apartment;10117;2;;n;2,active;;Deutschland;top;;wohnung_kauf;n;;;001.15850880;330000;profile0;22;2;true;n;showqualicontactform;n;n;Mitte_Mitte;114446404;3;Berlin;/expose/114446404;['Die 2,5 Zimmer Wohnung befindet sich im vorderen zur Leipziger Straße ausgerichteten Gebäude. Die Wohnung liegt in der 7. Etage eines 22-geschossigen Gebäudekomplexes und hat einen schönen Blick über die Stadt zum Westen.\n\n- Die Wohnung wurde 2019 komplett saniert:\n- Neuer Fussboden\n- Neue Sanitäranlagen\n- Einbauküche mit hochwertigen Geräten \n- Balkon\n- Möbliert', 'Sehr zentral in der Nähe von der berühmten Friedrichstrasse!'];no_information;;;;;7;;
