2020-05-11 12:25:53.417048;Berlin;district_heating;ONE_YEAR_FREE;615692;n;y;https://pictures.immobilienscout24.de/listings/21d50776-bbce-43e2-8120-47b70520799a-1360625780.png/ORIG/resize/118x118%3E/extent/118x118/format/jpg/quality/80;8;11.24;40 MBit/s;telekom_layer_magenta_l;;über VDSL;1930;REGULAR;11.24;116969865;district_heating;n;false;MagentaZuhause L;y;Berlin;y;7;1;no_information;energy_consumption;6.2;75.52;Berlin;14197;well_kept;normal;false;100 MBit/s;no_information;no_information;n;https://padlock.link/ioml;https://padlock.link/ml;no_information;apartment;14197;3;115;n;;2,active;true;Deutschland;premium;100 MBit/s;wohnung_kauf;n;3;web,email,bank,music,dl-ul,game,sd,mltstr,hd,fast-ul-dl;true;001.615692;350000;profile0;4;3;true;n;showqualicontactform;n;n;Wilmersdorf_Wilmersdorf;Rheingauviertel;3;Berlin;/expose/116969865;['Die denkmalgeschützte Wohnanlage mit seinen ursprünglich 85 Wohnungen befindet sich in hervorragender Wohnlage im bürgerlichen Rheingauviertel in Berlin (Wilmersdorf). Viele Wohnungseigentümer bewohnen Ihre Wohnung seit vielen Jahren selbst. Kapitalanleger profitieren von langfristigen Mietverträgen, da die Bewohner sich hier rundum wohl fühlen.\n\nErrichtet wurde die Wohnanlage im Jahre 1930. Die Wohnanlage ist voll unterkellert und wird über das zentrale Fernwärmenetz beheizt. Auch die Warmwasserversorgung erfolgt zentral.', 'Die Wohnung umfasst eine Wohnfläche von ca. 74,52 m². Diese verteilt sich auf  zwei großzügige Räume sowie einem kleinen Zimmer, einer Küche sowie ein praktisch gestaltetes Bad. Von einem Zimmer gelangen Sie auf den gemütlichen Balkon. Ein Keller gehört ebenso zur Wohnung.', 'Die angebotene Wohnung befindet sich im stark nachgefragten bürgerlichen Berliner Stadtteil Wilmersdorf, im sogenannten Rheingauviertel unweit vom Rüdesheimer Platz.\n\nKleinere Restaurants, Arztpraxen sowie Ladengeschäfte befinden sich in der näheren Umgebung. In unmittelbarer Nachbarschaft befindet sich die anmutig restaurierte Kirche „Maria unter dem Kreuz“.\n\nZu Fuß sind Sie in 13 Minuten in der Shoppingmeile in der Schlossstraße. Mit dem Auto gelangen Sie in 15 – 17 Minuten zum Zoologischen Garten oder in die Wilmersdorfer Straße.\n\nDie Wohnanlage ist gut an das öffentliche Verkehrsnetz angeschlossen. Die U-Bahnhaltestellen Rüdesheimer Platz (U3) und Friedrich-Wilhelm-Platz (U9) bieten sich hier ebenso gut an wie die Bushaltestellen der Linien 101, 186 und 248.\n\nZudem erreichen Sie die  Berliner Stadtautobahn in wenigen Autominuten.', 'Bei Interesse an einer Wohnungsbesichtigung können Sie gern mit uns einen Einzeltermin vereinbaren. Selbstverständlich wahren wir zu Ihrem Schutz als auch zum Schutz unserer Mitarbeiter die Hygienebestimmungen, den nötigen Sicherheitsabstand und verzichten darauf, die Hände zu schütteln.\n\nSofern Sie sich am Tag der Besichtigung nicht topfit fühlen, bleiben Sie bitte zu Hause und sagen Sie bitte unseren Termin ab. Unsere Mitarbeiter bieten Ihnen gern einen neuen Termin an, sobald Sie wieder gesund sind.\n\nAlternativ haben Sie auch die Möglichkeit, mit uns einen Termin für eine Live-Video-Besichtigung via WhatsApp zu vereinbaren. Dennoch denken wir nicht, dass eine Video-Besichtigung das gleiche Erlebnis ist, wie eine echte Besichtigung.\n\n\nAlle Angaben beruhen auf uns zur Verfügung stehenden Informationen. Änderung und Irrtum vorbehalten.\n\nVom Wohnungseigentümer sind wir exklusiv mit dem Verkauf dieser Eigentumswohnung beauftragt worden.\n\nBitte haben Sie Verständnis dafür, dass wir von Ihnen die beigefügte Widerrufsbelehrung ausgefüllt und unterschrieben vorliegen haben müssen, damit wir für Sie tätig werden können.'];true;;249.51;1;NO_INFORMATION;;true;;
2020-05-11 12:25:53.771069;Berlin;central_heating;ONE_YEAR_FREE;179106;n;n;https://pictures.immobilienscout24.de/listings/06b5aee9-8365-4c62-a0ef-5b7a829646ee-1360634262.jpg/ORIG/resize/118x118%3E/extent/118x118/format/jpg/quality/80;8;10.94;10 MBit/s;telekom_layer_magenta_m_hybrid;8;über Hybrid;1922;WITH_HYBRID;10.94;116970831;no_information;y;true;MagentaZuhause M Hybrid;y;Berlin;y;9;1;no_information;;5.34;104;Berlin;12247;mint_condition;sophisticated;false;50 MBit/s;no_information;no_information;n;https://padlock.link/mmha;https://padlock.link/mmh;no_information;apartment;12247;3.5;;n;;2,active;true;Deutschland;standard;50 MBit/s;wohnung_kauf;n;1;web,email,bank,music,dl-ul,game,sd,mltstr,hd;true;001.179106;569000;profile0;2;3;true;y;;n;n;Lankwitz_Steglitz;S13701;5;Berlin;/expose/116970831;"['Die hier angebotene ca. 104 m² große Wohnung befindet sich im gepflegten klassischen Altbau aus dem Jahr 1922. Über die Treppe gelangen Sie in das erste Obergeschoss. Die großzügig geschnittene dreieinhalb Zimmerwohnung befindet sich in einem sehr guten, ge-pflegten und renovierten Zustand. Ein geräumiger Flurbereich bietet Ihnen viel Platz für eine Garderobe oder Schränke. Von dort aus gelangen Sie in die Zimmer, das große Bad mit Dusche und Badewanne und in die moderne Küche mit hochwertigen Einbauten. Die hohen Decken mit Stuck, der Parkettboden und der Dielenboden heben den Altbaucharme der Wohnung hervor. Ein ca. 8 m² großer Kellerbereich bietet Ihnen zusätzliche Abstellfläche.\n\nThe approx. 104 m² apartment offered here is located in a well-kept classic old building from 1922 and you reach the first floor via stairs. The spacious three-and-a-half room apartment is in a very good, well-kept and renovated condition. A spacious hallway offers you a lot of space for a wardrobe or cupboards. From there you reach the rooms, the large bathroom with shower and bathtub and the modern kitchen with high-quality fittings. The high ceilings with stucco, the parquet flooring and the floorboards emphasize the old-bellied character of the apartment. A cellar area of approx. 8 m² offers you additional storage space.', 'Altbau, Bezug nach Vereinbarung, Dielen, Einbauküche, Etagenwohnung, Fußbodenheizung, Garten/ -mitbenutzung, Gaszentralheizung, gehobene Ausstattung, Gepflegt, Keller, Leerstand, Parkett, Renoviert, Saniert, unvermietet', ""Mitten im beliebten Komponistenviertel! Eine begehrte und gefragte Wohnlage im Herzen von Berlin Steglitz-Zehlendorf. Das Einzugsgebiet ist vorwiegend durch geschmackvolle Stadtvillen aus dem 19. Jahrhundert sowie Ein- und Mehrfamilienhäuser geprägt. In der direkten Nachbarschaft befindet sich ein umfassendes Einzelhandelsangebot. Grund- und weiterführende Schulen sind fußläufig gut zu erreichen, was dieses Viertel auch für Familien besonders attraktiv macht. Sie erreichen den S-Bahnhof Lankwitz bequem in nur wenigen Minuten. Des Weiteren verfügt man über diverse Buslinien in direkter Umgebung. Die Steglitzer Einkaufsmeile, die Schloßstraße, liegt nur wenige Autominuten entfernt und der Kurfürstendamm sowie der Potsdamer Platz sind in ca. 15 Minuten zu erreichen.\nIn the middle of the popular composer's quarter! A sought-after residential area in the heart of Berlin Steglitz-Zehlendorf. The catchment area is mainly characterised by tasteful 19th century town villas as well as detached and multi-family houses. In the direct neighbourhood there is a comprehensive retail offer. Primary and secondary schools are within walking distance, which makes this district particularly attractive for families. The Lankwitz S-Bahn station is just a few minutes' walk away. In addition, there are various bus lines in the immediate vicinity. The Steglitzer shopping mile, the Schloßstraße, is only a few minutes away by car and the Kurfürstendamm as well as Potsdamer Platz can be reached in approx. 15 minutes.\n"", 'Sie möchten Ihre Immobilie verkaufen? Wir sind Ihr Partner für einen erfolgreichen Verkauf. \n1.Unsere Experten verfügen über tiefgehende Kenntnis des bestehenden Immobilienmarktes und entwickeln gerne eine individuelle Verkaufsstrategie für Sie. Wir bewerten Ihre Immobilie unverbindlich, kostenfrei und marktgerecht.\n 2.Wir sind für Sie da und begleiten Sie von der kostenlosen Beratung bis hin zum Notartermin, immer getreu unserer Philosophie: kompetent, zuverlässig und diskret. \n3.Unser nationales und internationales Netzwerk sowie interne Synergien ermöglichen Ihnen den Zugang zu potenziellen Käufern aus aller Welt und somit einen erfolgreichen Abschluss. \nProfitieren Sie von unserem Know-How, rund 25 Jahren Erfahrung und Standorten in den besten Lagen Berlins. Gerne beraten wir Sie kostenlos in unserem Büro, per Telefon oder E-Mail!  \nEnergieausweis vorhanden:\nauf Anfrage']";;;377;668;;;;10 MBit/s;50 MBit/s
2020-05-11 12:25:54.084374;Berlin;central_heating;;14544073;n;y;https://pictures.immobilienscout24.de/listings/6a816b05-4baf-4ec3-8426-aff8a94e4840-1360639903.jpg/ORIG/resize/118x118%3E/extent/118x118/format/jpg/quality/80;1;11.24;;;;;1900;;11.24;116971155;district_heating;n;false;;y;Berlin;y;11;1;no_information;energy_required;6.16;170;Berlin;10719;first_time_use;no_information;false;;no_information;no_information;y;;;no_information;roof_storey;10719;5;112.9;n;;2,active;;Deutschland;standard;;wohnung_kauf;n;5;;;002.01000690340;1480000;profile0;;5;true;n;showqualicontactform;n;n;Wilmersdorf_Wilmersdorf;360+;7;Berlin;/expose/116971155;['Das Wohnhaus befindet nahe der Meierottostraße.\n\nDiverse Einkaufsmögflichkeiten sind vorhanden.', '- Deckenhöhe ca. 3,20 m\n- Trockenbau erstellt\n- großer Wohn/Essbereich \n- Wannenbad geplant\n- Duschbad geplant\n- Terrasse ca. 28 m²\n- bodentiefe Fenster\n- Kamin\n- Kellerraum', '- zum U-Bahnhof Spichernstraße sind es ca. 7 Gehminuten\n\n- zum Kurfürstendamm sind es ca. 5 Gehminuten'];;;;;;;;;
2020-05-11 12:25:54.746610;Berlin;no_information;ONE_YEAR_FREE;174522;n;n;https://pictures.immobilienscout24.de/listings/4e4fe35c-705e-4bd2-b158-a2919dc6c7a0-1365809670.jpg/ORIG/resize/118x118%3E/extent/118x118/format/jpg/quality/80;12;10.59;40 MBit/s;telekom_layer_magenta_l;;über VDSL;1906;REGULAR;10.59;116974002;district_heating;y;true;MagentaZuhause L;y;Berlin;y;3;1;no_information;energy_consumption;6.43;45;Berlin;12437;no_information;no_information;false;100 MBit/s;no_information;no_information;n;https://padlock.link/ioml;https://padlock.link/ml;no_information;apartment;12437;1;121.6;n;;2,active;true;Deutschland;top;100 MBit/s;wohnung_kauf;y;;web,email,bank,music,dl-ul,game,sd,mltstr,hd,fast-ul-dl;true;001.174522;150000;profile0;;1;true;n;showqualicontactform;n;n;Baumschulenweg_Treptow;116974002;2;Berlin;/expose/116974002;['Diese sanierte Wohnung brilliert mit einem tageslichtintensiven Ambiente. Dank der großflächigen Verglasungen ist der Wohnbereich ein stimmungsvoller Raum. In einer gefliesten Raumnische befindet sich die zeitgemäße Einbauküche. Geräumig präsentiert sich das weiß geflieste Badezimmer u.a. mit einer Wanne. Optimiert wird dieses renovierte Apartment von einem Abstellraum sowie einem dazugehörigen Kelleranteil. Die Wärmeversorgung obliegt einer Ölheizung. Im Segment der begehrten Mikrowohnungen in beliebten Stadtteilen sticht diese charmante Wohnung deutlich hervor – eine erstklassige Anlageimmobilie.', 'Sie möchten den Marktwert Ihrer Immobilie wissen oder Ihre Immobilie verkaufen? Wir sind seit 1995 erfolgreich im Verkauf von Immobilien in Berlin, Potsdam und Umgebung tätig. Unsere exzellenten Eigentümerbewertungen sprechen für sich.\n\n•\tOftmals haben wir schon den richtigen Käufer für Ihre Immobilie in unserer Kartei\n•\tWir sind Bellevue Best Property Agent und Mitglied in den Verbänden IVD & FIABCI\n•\tWir benötigen keinen schriftlichen Alleinauftrag\n•\tKosten entstehen Ihnen bei uns keine\n•\tUnsere Spezialisten stehen Ihnen gerne für ein erstes – für Sie unverbindliches - Gespräch zur Verfügung\n\nWir freuen uns über Ihre Kontaktaufnahme unter einkauf@immoberlin.de oder (030) 895 72 20.\nBitte besuchen Sie auch unsere Website: \nhttps://www.immoberlin.de'];;disabled;;;;;;;
2020-05-11 12:25:55.121131;Berlin;central_heating;ONE_YEAR_FREE;145924;n;n;https://pictures.immobilienscout24.de/listings/89a781ee-9368-4159-a700-46005b555c14-1362193563.jpg/ORIG/resize/118x118%3E/extent/118x118/format/jpg/quality/80;9;11.19;40 MBit/s;telekom_layer_magenta_l;;über VDSL;1965;REGULAR;11.19;116971271;district_heating;y;false;MagentaZuhause L;y;Berlin;y;7;2;no_information;energy_consumption;5.36;100;Berlin;13435;well_kept;no_information;false;100 MBit/s;outside;no_information;n;https://padlock.link/ioml;https://padlock.link/ml;no_information;no_information;13435;4;130;n;;2,active;true;Deutschland;top;100 MBit/s;wohnung_kauf;n;1;web,email,bank,music,dl-ul,game,sd,mltstr,hd,fast-ul-dl;true;001.145924;400000;profile0;;4;true;n;showqualicontactform;n;n;Wittenau_Reinickendorf;11009;4;Berlin;/expose/116971271;['Zum Verkauf steht hier eine sehr gepflegte 4-Zimmerwohnung im ersten Obergeschoss. Der Grundriss ist hervorragend für eine vierköpfige Familie geeignet. Eine großzügige Küche mit ausreichend Platz für einen Esstisch ist bereits komplett ausgestattet. Der Wohnbereich mit Zugang zum breiten Balkon mit Westausrichtung bildet das Zentrum und genügend Platz für die ganze Familie. Im hinteren Teil der Wohnung befinden sich die zwei Kinderzimmer sowie das Elternschlafzimmer. Das innenliegende Bad ist hell gefliest und mit einer Badewanne ausgestattet. Zusätzlich befindet sich im Eingangsbereich der Wohnung noch eine Gästetoilette. Ein Stellplatz auf dem Grundstück sowie ein eigenes Kellerabteil runden das Angebot ab.', '- Einbauküche\n- Balkon\n- Wannenbad und Gäste-WC\n- Stellplatz\n- Keller', 'Die hier angebotene Wohnung befindet sich in Wittenau, einem beliebten Ortsteil im Norden Berlins. Das Objekt ist ruhig und zurückgesetzt gelegen. Die Umgebung ist geprägt von Mehrfamilienhäusern, Kleingärten und Gewerbe. Die Einkaufsmöglichkeiten im Nahbereich sind zahlreich gegeben. Auch Kitas und Schulen sind bequem zu erreichen. Gut angebunden ist die Lage durch verschiedene Bus- und S-Bahnlinien sowie die B 96.', 'Bei Abschluss des Kaufvertrages beträgt die vom Erwerber zu zahlende Maklerprovision 7,14% inkl. gesetzlicher Mehrwertsteuer vom beurkundeten Kaufpreis. Die in diesem Angebot genannten Daten stammen vom Eigentümer/Verkäufer, insofern können wir für die Richtigkeit der Angaben keine Haftung und/oder Gewährleistung übernehmen. Irrtum und Zwischenverkauf vorbehalten.'];;;398;;D;1;;;
2020-05-11 12:25:55.468476;Berlin;floor_heating;ONE_YEAR_FREE;18617375;n;y;https://pictures.immobilienscout24.de/listings/97d52428-1b08-43e3-a860-447f9b633e83-1360340989.jpg/ORIG/resize/118x118%3E/extent/118x118/format/jpg/quality/80;13;10.95;40 MBit/s;telekom_layer_magenta_l;;über VDSL;1900;REGULAR;10.95;116944773;district_heating;y;false;MagentaZuhause L;n;Berlin;y;11;1;no_information;;6.54;160;Berlin;10405;mint_condition;luxury;false;100 MBit/s;underground_garage;no_information;y;https://padlock.link/ioml;https://padlock.link/ml;no_information;roof_storey;10405;5;;n;2018;2,active;true;Deutschland;top;100 MBit/s;wohnung_kauf;n;5;web,email,bank,music,dl-ul,game,sd,mltstr,hd,fast-ul-dl;true;009.a07d3c33-9bd7-478e-9a86-6467b4dff6ed;1950000;profile0;5;5;true;n;showqualicontactform;n;n;Prenzlauer_Berg_Prenzlauer_Berg;c073d2e5-9533-46b7-8d1b-0f613dd41a44;7;Berlin;/expose/116944773;['Diese wunderschöne, top ausgestattete, individuelle und dennoch perfekt auf Familien geschnittene 160qm-DG-Wohnung im fünften OG eines Gründerzeithaus besticht durch Luxus und grenzenlosen Komfort. \n\nDer luxuriöse Charakter der Wohnung zeigt sich an allen Stellen, ob innenliegende Treppe zum eigenen Büro mit Blick auf den Alexanderturm, dem Zugang zu einer herrlichen Dachterrasse mit Weitblick über Berlin, modernster Haus Automatisierung der Heizung, Jalousien, Markisen bis hin zur kompletten professionellen WLAN-Infrastruktur für die Steuerung von Musik bis hin zum Backofen. \n\nUmlaufende Balkone, ein Aufzug, riesige Garagenplätze, hochwertige Maßeinbauten in vielen Zimmern, ein hochmoderner Gaskamin per Funkfernbedienung und eine Klimaanlage im Wohnbereich runden dieses wunderschöne Wohnung ab. \n\nDas Dachgeschosse wurde 2005/2006 kernsaniert und hat im Jahr 2018 eine umfangreiche Sanierung erhalten. \n\nEin aktueller Energieausweis liegt zur Besichtigung vor. Das Hausgeld beläuft sich auf 360,00\xa0€ im Monat. Instandhaltungsrücklage auf ca. 100€.  \n\nDie Wohnung wird von privat verkauft.\nMakleranfragen zur Unterstützung beim Verkauft werden ignoriert - wir bitten um Verständnis. \n\n', '- Hohe Wände in der gesamten Wohnung\n- Freigelegte Backsteinwand im Küchenbereich\n- Riesige Schiebefenster (überall bodentief)  \n- Aufzug (bis zur Garage)\n- Großzügiger Keller (mit privatem Vorraum) mit Stahl-Einbauregalen\n- Somfy-Hausautomatisierung für Heizungen, Jalousien sowie Markise mit Steuerung per App, Zentral oder per Alexa samt integrierten Wind/Sonnenmessern \n- Fußbodenheizung in Bädern\n- Ein Bad mit Dusche und separater großer Badewanne\n- Ein Bad mit großer Dusch\n- Separates Gäste-WC mit abgetrenntem Raum für Waschmaschine und Trockner \n- Klima-Anlage im Wohnbereich (komplett generalüberholt)\n- Dachterrasse mit nagelneuem Boden mit Lichtspots\n- Balkon mit separatem abschließbarem Stauraum \n- Jedes Zimmer mit Balkon\n- Eichenparkett, naturbelassen mit innovativem Spezialöl versiegelt (extrem langlebig und betreuungsarm) \n- DAITEM Alarmanlage mit Bewegungsmeldern (SMS + IP) und Feuermeldern\n- Festverbauter Wertschutztresor nach EN3\n- Maßgefertigte Einbauschränke in fast allen Zimmern \n- Professionelle WLAN-Repeater und neuste Sonos im gesamten Objekt\n- Neuer Gaskamin nach Maßanfertigung, steuerbar per Fernbedienung (15.000 €)\n- 2 große Tiefgaragenplätze für z.B. zwei Autos sowie zwei Motorräder mit Elektroanschluss \n- 3 Schlafzimmer\n- 1 Büro (kann auch als Sauna umfunktioniert werden, Starkstromanschluss vorhanden)\n- Küche mit neusten Geräten (Weinkühlschrank, Siemens-Induktionskochfeld sowie Backofen mit WLAN und vielem mehr)\n- Innovatives Quooker-Wasserhahnsystem (Kühlen, Kochen, Sprudeln aus dem Hahn, mit moderner Leogant Wasserfilter-Anlage, auch an Eismaschine des Kühlschrank angeschlossen) (10.000 €)\n- Carex Gardinen inkl. maßgefertigem Schienensystem in der gesamten Wohnung (15.000 €)\n\nund vieles mehr!\n\nDie Wohnung kann auch mit der harmonisch abgestimmten Lichttechnik übernommen werden, mit Luxusprodukten von Tobias Grau bis hin zur per App gesteuerten Occhio Wand- und Deckenleuchten. \n\nAuf Wunsch kann die Wohnung auch vollmöbliert erworben werden.', 'Der Winskiez befindet sich zwischen Bötzow- und Kollwitzkiez im südlichen Prenzlauer Berg.\n\nDie Tramlinien sind alle fußläufig erreichbar. Unmengen an Einkaufsmöglichkeiten, viele kleine Bioläden, Yogas- oder Sportstudios, Apotheken sowie Bäcker sowie wunderschöne Cafés sind um die Ecke. \n\nZum nächsten Spielplatz braucht es 5 Minuten. Zum Alexanderplatz 3min mit dem Auto, 8min mit der Tram oder 25min zu Fuss. ', 'Besichtigungen nur nach Nachweiss der Finanzierbarkeit.\nErwerb und Einzug flexibel möglich.\n'];;;360;;;2;;;
2020-05-11 12:25:55.789341;Berlin;central_heating;ONE_YEAR_FREE;145924;n;y;https://pictures.immobilienscout24.de/listings/360ea4dd-675f-4206-90ed-8d24de3f0ea7-1360717736.jpg/ORIG/resize/118x118%3E/extent/118x118/format/jpg/quality/80;4;11.49;40 MBit/s;telekom_layer_magenta_l;;über VDSL;1975;REGULAR;11.49;116976922;oil;y;false;MagentaZuhause L;y;Berlin;y;7;3;no_information;;6.07;69;Berlin;12167;need_of_renovation;no_information;false;100 MBit/s;outside;no_information;n;https://padlock.link/ioml;https://padlock.link/ml;no_information;apartment;12167;2;;n;;2,active;true;Deutschland;top;100 MBit/s;wohnung_kauf;n;1;web,email,bank,music,dl-ul,game,sd,mltstr,hd,fast-ul-dl;true;001.145924;329000;profile0;3;2;true;n;showqualicontactform;n;n;Steglitz_Steglitz;11007;3;Berlin;/expose/116976922;['Die Wohnung befindet sich im ersten Obergeschoss eines Hauses mit dem Baujahr 1975. Die gesamte Anlage befindet sich in gutem Zustand und und wird laufend Instandgehalten. Die Wohnung bietet zwei Zimmer, die vom Flur aus zu begehen sind. Die Ausrichtung der Wohnung ist mit dem Wohnzimmer und dem Balkon nach Südosten. Das Schlafzimmer und die Küche liegen zum Innenhof. Das Wannenbad ist innenliegend. Die Wohnung ist in einem renovierungsbedürftigen Zustand, bietet aber damit die Möglichkeit alles nach eigenen Vorstellungen zu realisieren.\n\nEin Energieausweis wird zeitnah angefertigt, liegt momentan jedoch nicht vor.', '- Wohnung liegt nach Südosten\n- Innenliegendes Bad \n- abgeschlossene Küche\n- Wohnzimmer mit Balkon\n- Renovierungsbedürftig\n- Stellplatz', 'Die Wohnung liegt in einer ruhigen Straße, die nur von Anwohnern frequentiert wird. Es gibt eine Auswahl von Einkaufsmöglichkeiten, Dienstleistern und Gastronomie in der näheren Umgebung. Schnell zur erreichen ist von hier aus das südliche Berliner Umland. Das Zentrum ist bequem in ungefähr 20 Minuten mit dem Auto erreicht.', 'Bei Abschluss des Kaufvertrages beträgt die vom Erwerber zu zahlende Maklerprovision 7,14% inkl. gesetzlicher Mehrwertsteuer vom beurkundeten Kaufpreis. Die in diesem Angebot genannten Daten stammen vom Eigentümer/Verkäufer, insofern können wir für die Richtigkeit der Angaben keine Haftung und/oder Gewährleistung übernehmen. Irrtum und Zwischenverkauf vorbehalten.'];;;373;;;1;;;
2020-05-11 12:25:56.108268;Berlin;district_heating;ONE_YEAR_FREE;17996698;n;y;https://pictures.immobilienscout24.de/listings/55114f7b-c9a9-4902-a189-c7e71e22c9d8-1359542057.jpg/ORIG/resize/118x118%3E/extent/118x118/format/jpg/quality/80;20;11.12;40 MBit/s;telekom_layer_magenta_l;135;über VDSL;1909;REGULAR;11.12;116871942;gas;y;false;MagentaZuhause L;y;Berlin;y;10;1;no_information;energy_consumption;6.13;117;Berlin;14057;mint_condition;sophisticated;false;100 MBit/s;no_information;no_information;y;https://padlock.link/ioml;https://padlock.link/ml;no_information;no_information;14057;3.5;138.5;n;;2,active;true;Deutschland;top;100 MBit/s;wohnung_kauf;n;5;web,email,bank,music,dl-ul,game,sd,mltstr,hd,fast-ul-dl;true;009.67787689-3224-4a50-a286-ad259536f53f;999950;profile0;5;3;true;n;showqualicontactform;n;n;Charlottenburg_Charlottenburg;116871942;5;Berlin;/expose/116871942;['Bei dem zum Verkauf stehenden Objekt handelt es sich um eine bisher vom Eigentümer genutzte hochwertige Dachgeschosswohnung mit einer großen Dachterrasse (17,58 m²), die über einen Wasseranschluss und einen maßgefertigten Grill verfügt. Die exklusive Dachgeschosswohnung erreicht man bequem über den Aufzug des 10-Parteien-Hauses. Der Mittelpunkt der Wohnung ist der großzügig geschnittene Wohn- /Essbereich inklusive hochwertiger Küche. Von hier gelangt man auch auf die schöne Dachterrasse die zum verweilen einlädt. Neben dem Masterbad mit Dusche, Badewanne, Bidet und einem Waschtisch, gibt es ein weiteres Gäste-Duschbad, einen Abstellraum und ein Ankleidezimmer mit maßgefertigten Einbauschränken.', 'Die Wohnung beinhaltet eine hochwertige Einbauküche und ist in der Küche und im Masterbad mit einer Fußbodenheizung ausgestattet. Die Böden sind mit Echtholzparkett und Fliesen ausgelegt.\nZudem zeichnet sich die Wohnung durch ihre hochwertige Ausstattung wie einer Klimaanlage, einer elektronischen Sonnenschutzmarkise und maßgeschneiderten Einbauschränken aus.\nDie Dachgeschosswohnung verfügt zwar über keinen eigenen PKW-Stellplatz, aber es besteht die Möglichkeit den bestehenden Mietvertrag für den angemieteten externen Stellplatz in der Nachbarschaft für 50 € monatlich zu übernehmen.', 'Die Dachgeschosswohnung liegt im Berliner Bezirk Charlottenburg-Wilmersdorf. Die Bewohner von Charlottenburg schätzen die innerstädtische Lage und die guten Verkehrsverbindungen ins Zentrum Berlins mit Bus, U-Bahn und S-Bahn. Den Ku ́damm mit zahlreichen Einkaufsmöglichkeiten erreicht man in 8-10 Fahrminuten. Im Quartier gibt es außerdem den Lietzensee, Fennsee und den Wilmersdorfer Volkspark, die eine Vielzahl an Freizeitmöglichkeiten bieten.\nDer Lietzensee mit seinen 10 Hektar großen Parkanlagen liegt in direkter Umgebung und lädt zum Entspannen und Spazierengehen ein. Neben einer guten Autobahnanbindung sowie mehreren S-und U- Bahn-Stationen in unmittelbarer Nähe finden Sie auch Schulen, Kitas und zahlreiche Restaurants und Cafés. Die Entfernung zum Berliner Hbf beträgt 4,5 km, zum Flughafen Berlin-Tegel 6,6 km und zum Flughafen Berlin-Schönefeld 25 km.', 'Sämtliche Angaben und Informationen in diesem Angebot erfolgen gemäß den Auskünften des Verkäufers. Sofern nicht ausdrücklich anders vereinbart, prüft die Berlin Impact Real Estate GmbH nicht Vollständigkeit und Richtigkeit solcher Angaben bzw. Auskünfte und übernimmt hierfür keine Haftung. Der Käufer hat diese Informationen selbst eigenverantwortlich zu prüfen.'];;;;;E;;;;
