2020-05-11 12:21:33.409736;Berlin;central_heating;;237210;n;n;https://pictures.immobilienscout24.de/listings/eaeb01d5-4719-476f-a314-e0c7971e2d18-1363667751.jpg/ORIG/resize/118x118%3E/extent/118x118/format/jpg/quality/80;5;11.14;;;;2014;;;;11.14;117402553;gas;n;false;;y;Berlin;n;10;8;no_information;energy_consumption;6.17;207.9;Berlin;10439;mint_condition;no_information;;false;;no_information;no_information;n;;;no_information;apartment;10439;4.5;59;n;2,active;;Deutschland;standard;;wohnung_kauf;n;1;;;001.237210;999000;profile0;4;true;n;showqualicontactform;n;n;Prenzlauer_Berg_Prenzlauer_Berg;5044;7;Berlin;/expose/117402553;"['Diese attraktive 4,5 Zimmer Designer Dachgeschosswohnung auf zwei Ebenen besticht\ndurch den optimalen Schnitt und ihre Großzügigkeit und bildet die Symbiose zwischen moderner Architektur und gehobener Wohnlage.\nEine optimale Tagesbelichtung und gute Durchlüftung der Wohnung wird durch die großzügigen Fensterfronten gewährleistet. Alle Räume wurden mit neuem und hochwertigem Parkettboden ausgestattet, des Weiteren verfügt die Wohnung über ein aufwendiges Beleuchtungskonzept. Die große Ost/Südterrasse bietet einen angenehmen Ausblick auf den begrünten Garten. Des Weiteren verfügt die Wohnung über eine 45 qm große Dachterrasse zur alleinigen Nutzung.\nDie Wohnung wird auf Grund ihres hervorragenden Zustands und besten Raumaufteilung hohen Ansprüchen gerecht.\nHier konnte durch höchste Ansprüche an Umfeld, Innenarchitektur und Ausstattung, dem Traum einer Symbiose zwischen Lifestyle und Wohnen, Arbeiten und Leben wahr werden lassen.\nDas Haus befindet sich in einem wirtschaftlichen und technischen Bestzustand.\n\nEin Pkw-Stellplatz und ein Kellerraum runden dieses besonders attraktive Wohnungsangebot ab. Der Stellplatz/Carport kostet 15.000,- Euro\n\nEinrichtungen des täglichen Bedarfs sind fußläufig erreichbar. Eine gute Verkehrsanbindung ist ebenfalls gegeben. \n\nEine solide Immobilie zum attraktiven Preis!\n\n\n\n\n\nThis attractive 4.5 room designer attic apartment on two levels captivates\nthrough the optimal cut and its generosity and forms the symbiosis between modern architecture and upscale residential area.\nAn optimal daylight exposure and good ventilation of the apartment is ensured by the generous window fronts. All rooms were equipped with new and high-quality parquet floor, furthermore, the apartment has a complex lighting concept. The large east / south facing terrace offers a pleasant view of the leafy courtyard and unobstructed views. Furthermore, the apartment has a 45 sqm roof terrace for sole use.\nThe apartment is due to their excellent condition and best room layout meet high standards.\nThe highest demands on environment, interior design and equipment, the dream of a symbiosis between lifestyle and living, made work and life come true.\nThe house is in an economical and technical condition.\nA parking space and a basement room round off this particularly attractive housing offer.\nFacilities for daily needs are within walking distance. Good transport links are also available.\nA solid property at an attractive price!\n\nIf you are interested, we will gladly send you more photos.', '- 2 Komfortbäder mit hochwertiger\n  Badkeramik und formschönen Armaturen\n- moderne Markeneinbauküche mit Eßbereich\n- Ankleidezimmer\n- zwei große Dachterrassen\n- Repräsentative Raumgestaltung\n- Haus in Haus Charakter\n- Parkettböden, Granitböden\n- Lüftungsanlage (Frischluft)\n- Hauswirtschaftsraum\n- hochwertige Baumaterialien nach den  neuesten\n  Bestimmungen\n- hochwertige Einbauten\n- Alarmsicherung\n- Gegensprechanlage\n- Großes Ankleidezimmer\n- besonderes Ambiente\n- individuelle Architektenplanung\n- Solaranlage auf dem Dach\n- Panoramafenster\n- aufwendiges Beleuchtungskonzept\n- attraktive Grünruhiglage\n- Fußbodenheizung\n- großzügiger Wohneßbereich\n- unverbauter Grünblick\n- attraktive Gartennutzung\n- modernste Haustechnik \n- niedriger Energiewert von 32 kWh\n- Keller\n- Carport 15.000,- Euro\n- sehr guter Infrastruktur\n\n\n\n- 2 comfort bathrooms with high quality\n   Bathroom ceramics and shapely fittings\n- modern brand kitchen with dining area\n- Dressing room\n- two large roof terraces\n- Representative interior design\n- House in house character\n- parquet floors, granite floors\n- ventilation system (fresh air)\n- utility room\n- high quality construction materials according to the latest\n   provisions\n- high quality fittings\n- alarm protection\n- Intercom\n- Large dressing room\n- special ambience\n- individual architect planning\n- Solar system on the roof\n- panoramic windows\n- elaborate lighting concept\n- attractive greenery\n- underfloor heating\n- spacious living area\n- unobstructed green view\n- attractive garden use\n- most modern building services\n- low energy value of 32 kWh\n- Basement, cellar\n- Carport\n- very good infrastructure', 'Die Wohnlage ist ruhig gelegen zwischen einer Grünruhiglage und dem Alexanderplatz\n\n- Nur 15 Minuten von Berlin´s Mitte\n- öffentliche Verkehrsmittel sind in 2 Minuten Fußweg erreichbar  \n- nahe Volkspark Prenzlauer Berg\n- Kinder- und familienfreundliche Infrastruktur   \n- nahe ""Der Weiße See"" \n- nahe Kolwitzplatz\n- gute Infrastruktur \n- Hervorragende Nahverkehrsanbindungen \n- Diverse Einkaufsmöglichkeiten für den täglichen Bedarf in unmittelbarer Nähe\n\n\n\nThe residential area is in a quiet location between a greenery and the Alexanderplatz\n\n- Only 15 minutes from Berlin\'s Mitte\n- near Volkspark Prenslauer Berg\n- Child and family friendly infrastructure\n- near ""The White Lake""\n- near Kolwitzplatz\n- good infrastructure\n- Excellent public transport connections\n- Various shops for daily needs in the immediate vicinity', 'Sie haben auch eine Immobilie zu verkaufen ?\n\nWir könnten genau für Ihre Immobilie den richtigen Käufer haben, fragen Sie bei uns an !\n\nTel. 030-2640470 oder info@glatzer-immobilien-berlin.de']";;480;;;;;1;;;;
2020-05-11 12:21:33.797673;Berlin;;ONE_YEAR_FREE;18615738;n;y;https://pictures.immobilienscout24.de/listings/d4f5e7f2-031c-4194-b458-c2caa3408aed-1360057800.jpg/ORIG/resize/118x118%3E/extent/118x118/format/jpg/quality/80;9;11.37;2,4 MBit/s;telekom_layer_magenta_m_hybrid2;über Hybrid;1951;;WITH_HYBRID;;11.37;116920754;no_information;n;false;MagentaZuhause M Hybrid (2);n;Berlin;y;7;2;no_information;;5.8;57.42;Berlin;14197;fully_renovated;sophisticated;;false;16 MBit/s;no_information;no_information;n;https://padlock.link/mmh2sa;https://padlock.link/mmhy2;no_information;raised_ground_floor;14197;2;;n;2,active;true;Deutschland;top;50 MBit/s;wohnung_kauf;n;;web,email,bank,music,dl-ul,game,sd,mltstr,hd;true;009.0d3652ca-2c38-4227-9ad8-6183ac8aaeca;320000;profile0;2;true;n;showqualicontactform;n;n;Wilmersdorf_Wilmersdorf;2689533b-066a-4c03-a374-8b80ee1f9f81;2;Berlin;/expose/116920754;['Schweren Herzens trenne ich mich, wegen Umzugs, von meinem kleinen Juwel in Wilmersdorf/ Schmargendort.\n  \nDie Hochparterrewohnung liegt nahe dem Rüdesheimer Platz, in einer ruhigen Seitenstraße in bester Lage, grün und doch fußläufig zu zwei U-Bahnstationen und mehreren Busstationen sowie einer S-Bahnstation der Ringbahn. Das Gebäudeensemble ist ein Wiederaufbau aus dem Jahre 1951 im Stile des Vorgängerbaus, was den Charme ausmacht. Die Wohnung verfügt über zwei etwa gleich große Zimmer, ein Bad mit Wanne und eine Küche, in die auch eine kleine Essecke passt. Ein Zimmer hat einen geräumigen, sonnigen, überdachten  Balkon, auf dem ich bereits im Februar regelmäßig die Sonne genossen habe. Die Wohnung ist vor kurzem komplett renoviert worden: die Wände gespachtelt und gestrichen, die Böden abgezogen, Bad und Küche gefliest, Kabel unter Putz gelegt etc. Ich habe dort fast ein Jahr zehnt gelebt und mich wirklich sehr wohl gefühlt. Die Wohnung ist ruhig, sonnig, gut angebunden und doch ist man gleich im Grünen. Auch die Nachbarschaft im Haus selbst und im gesamten Kiez ist sehr herzlich und hilfsbereit, was man sonst eher selten in Berlin hat.\n', 'ruhige grüne Seitenstraße in bester Lage in Wilmersorf'];;;2020;;;;;10 MBit/s;50 MBit/s;;
2020-05-11 12:21:34.213536;Berlin;district_heating;ONE_YEAR_FREE;16924112;n;y;https://pictures.immobilienscout24.de/listings/83abe1ae-6be2-4b6d-b05d-d128cd772c85-1363698784.jpg/ORIG/resize/118x118%3E/extent/118x118/format/jpg/quality/80;8;11.13;40 MBit/s;telekom_layer_magenta_l;über VDSL;1959;true;REGULAR;disabled;11.13;117407715;district_heating;y;false;MagentaZuhause L;y;Berlin;n;7;2;no_information;energy_consumption;5.02;74.4;Berlin;12249;well_kept;normal;D;false;100 MBit/s;no_information;no_information;n;https://padlock.link/ioml;https://padlock.link/ml;no_information;no_information;12249;3;107;n;2,active;true;Deutschland;standard;100 MBit/s;wohnung_kauf;n;;web,email,bank,music,dl-ul,game,sd,mltstr,hd,fast-ul-dl;true;009.06041d57-de1b-4a48-987b-3b0882138407;315000;profile0;3;true;y;;n;n;Lankwitz_Steglitz;117407715;3;Berlin;/expose/117407715;['+++   Link zum 360° -Rundgang: https://app.immoviewer.com/portal/tour/1691894?accessKey=5e6e   +++ \n\nAuf rund 74 m² vereint diese vorteilhaft geschnittene Eigentumswohnung eine ruhige und grüne Lage mit gleichzeitig guter Anbindung an die Innenstadt. Die vorherrschende urbane Infrastruktur erleichtert und verkürzt Besorgungsgänge im Alltag. \n\nEin Balkon mit Blick ins Grüne und ein schöner Gemeinschaftsgarten sorgen für ein idyllisches Wohnumfeld. Ein gepflegter Zustand, die Erdgeschosslage und freundlich gestaltete Räume machen die Immobilie in erster Linie für Senioren und Familien interessant. \n\nNeben dem Wohn- und Esszimmer verfügt die 3-Zimmer-Wohnung über 2 Schlafzimmer. Eine Wohnküche samt vollständiger Einbauküche und Waschmaschinenanschluss sowie ein Tageslichtbad mit Eckbadewanne vervollständigen den Grundriss. \n\nWeiteren Stauraum bieten ein geräumiger Schuhschrank sowie ein Abstellraum im Flur und ein großer Einbauschrank im Schlafzimmer. Außerdem steht Ihnen ein Keller zur Verfügung - ein weiterer kann für rund 30 € im Monat angemietet werden. \n\nAbgerundet wird das ansprechende Angebot durch einen komfortablen Hausreinigungs- und Winterdienst sowie eine Anwohnerparkstraße. Zudem besteht die Möglichkeit, einen Stellplatz für 30 € pro Monat anzumieten.\n\nDas monatliche Hausgeld beläuft sich auf ca. 332 €. \n\nObjektnr.: 1021639', '+ Terrasse mit Blick ins Grün \n+ Einbauwohnküche mit Sitzgelegenheit\n+ WMA in Küche\n+ Tageslichtbad mit Eckwanne \n+ Hausreinigungs- und Winterdienst \n+ Anwohnerparkstraße \n+ Anmietung eines 2. Kellerraums möglich\n+ Bodenbeläge: Stein in Flur/Küche, Fliesen im Bad, sonst Laminat\n+ Stellplatz-Anmietung möglich (31 €/Monat)\n+ Ruhige, naturnahe Wohnlage \n+ Mtl. Hausgeld: 332 €\n+ Warmwasser über Strom\n\n+ Baujahr laut Energieausweis: 1959\n+ Art des Energieausweises: Verbrauchsausweis\n+ Endenergieverbrauch in kWh/(m²*a): 107,3\n+ Energieeffizienzklasse: D\n+ Wesentlicher Energieträger: Fernwärme', 'Naturnahes Großstadtleben: In Berlin-Lankwitz genießen Sie nicht nur auf Ihrer Terrasse und in dem Gemeinschaftsgarten Ruhe, viel Freiraum und eine reizvolle Naturlandschaft - auch die naturnahe Umgebung im Süden der Hauptstadt bietet einen unglaublichen Erholungswert. Die Nähe zu Wiesen und Wäldern des schönen Brandenburgs und dem Gemeindepark Lankwitz inklusive Streichelzoo in Ihrer direkten Nachbarschaft schaffen zusammen mit der kinder- und seniorengerechten Nachbarschaft beste Wohnbedingungen! \n\nVerschiedene Geschäfte des täglichen Bedarfs sind sowohl im Ortsteil selbst als auch in Berlin-Lichterfelde und Mariendorf schnell zu erreichen. So befindet sich im näheren Umkreis ein ca. 5 Gehminuten entfernter Supermarkt. Eine nur ca. 650 m entfernte Kita sowie eine rund 13 Gehminuten entfernte Grundschule unterstreichen zusammen mit einigen Spielplätzen in der Umgebung die Familienfreundlichkeit. Zudem bietet der Gemeindepark mehrere Sportplätze und einen Minigolfplatz. \n\nDarüber hinaus überzeugt die Wohnlage durch eine ideale Verkehrsanbindung. Innerhalb von nur 5 Gehminuten erreichen Sie die Bushaltestelle “Am Gemeindepark”, wodurch Sie bspw. die S-Bahn-Station “Lankwitz” in nur rund 6 Minuten erreichen. Von hier besteht mit den Linien S1, S25 und S26 ein direkter Anschluss an den Bahnhof “Friedrichstraße”, der so in nur ca. 19 Minuten erreicht werden kann. Auch die Bundesstraßen 1, 96 und 101 sowie die Autobahn 100 befinden sich in komfortabler Reichweite und binden hervorragend an das Straßennetz an. Zudem kann der Flughafen Schönefeld in nur etwa 27 Minuten mit dem Auto erreicht werden. Ebenso befindet sich die Polizeistation Berlin-Südwest nur etwa 450 m von der Immobilie entfernt.', 'Vereinbaren Sie noch heute einen Besichtigungstermin!\n_____________________________________________________\n\nAlle Angaben sind ohne Gewähr und basieren ausschließlich auf Informationen, die uns von unserem Auftraggeber zur Verfügung gestellt wurden. Wir übernehmen keine Gewähr für die Vollständigkeit, Richtigkeit und Aktualität der Angaben.\n    '];;;;;4;;;;;;
2020-05-11 12:21:34.566775;Berlin;district_heating;;179106;n;y;https://pictures.immobilienscout24.de/listings/e56f430a-8bfa-4e1b-9388-615c720ec521-1363646432.jpg/ORIG/resize/118x118%3E/extent/118x118/format/jpg/quality/80;7;10.77;;;;1997;;;;10.77;117397953;district_heating;y;true;;y;Berlin;y;8;5;no_information;energy_consumption;5.67;74;Berlin;10179;well_kept;no_information;;false;;underground_garage;no_information;y;;;no_information;ground_floor;10179;3;87;n;2,active;;Deutschland;standard;;wohnung_kauf;n;;;false;001.179106;459000;profile0;3;true;y;;n;n;Mitte_Mitte;J13132D1;3;Berlin;/expose/117397953;['Helles 2-Zimmer-Appartement in Top Mitte-Lage am Spittelmarkt. Es handelt sich um einen Neubau aus dem Jahr 1997 mit gepflegten Innenhof-Anlagen, welche über den Hauswart mit Kameraüberwachung gesichert wird. Die möblierte Wohnung erstreckt sich über 74,3 m² und besitzt eine Einbauküche mit Geräten. Die große Terrasse im zweiten Innenhof schließt direkt an die begrünte Gartenanlage an. Das Badezimmer ist weiß gefliest und verfügt über eine Badewanne. Ein Kellerraum gehört zum Appartement dazu. Ein Tiefgaragenstellplatz kann für ca. 30.000 EUR dazu erworben werden. Das Mobeliar können Sie für einen schnellen Einzug anfragen. Eine Besichtigung über uns lohnt sich!\n\nBright 2 room apartment in top central location at the Spittelmarkt. It is a new building from the year 1997 with well-kept inner courtyard facilities, which is secured by the caretaker with camera surveillance. The furnished apartment extends over 74,3 m² and has a fitted kitchen with appliances. The large terrace in the second inner courtyard is directly connected to the green garden. The bathroom is tiled white and has a bathtub. A cellar room belongs to the apartment. An underground parking space can be acquired for 30.000 EUR.\nA visit above us is worthwhile!', 'Aufzug, Balkon/Terrasse, Einbauküche, Erdgeschoss, Fernwärme, Garten/ -mitbenutzung, Gartenterrasse, Gepflegt, Leerstand, Keller, Neubau, Parkett, Terrassenwohnung, Tiefgarage, unvermietet', 'Diese Straße befindet sich in bestechender Lage nahe Spittelmarkt in Berlin-Mitte. Die hervorragende Infrastruktur und die Zentralität ermöglichen beste Mobilität innerhalb Berlins. Die Einkaufsmöglichkeiten lassen keine Wünsche offen, alle Waren des täglichen Bedarfs können in fußläufiger Nähe eingekauft werden. Zum Shoppen und Flanieren laden der nahegelegene Gendarmenmarkt sowie der Alexanderplatz ein. Natürlich sind auch die anderen Zentren der Stadt, wie der Potsdamer Platz oder der Hackesche Markt, schnell und unproblematisch erreichbar. Die unmittelbare Nähe zur Spree kann als absolutes Highlight bezeichnet werden. Die Verkehrsanbindungen sind hervorragend. In fußläufiger Nähe fahren diverse Buslinien sowie die U-Bahn.\nThis street is located in an impressive location near Spittelmarkt in Berlin-Mitte. The excellent infrastructure and the centrality allow best mobility within Berlin. The shopping facilities leave nothing to be desired, all goods for daily needs can be purchased within walking distance. The nearby Gendarmenmarkt and Alexanderplatz invite you to shop and stroll. Of course, the other centres of the city, such as Potsdamer Platz or Hackescher Markt, can also be reached quickly and easily. The immediate proximity to the Spree can be described as an absolute highlight. The transport connections are excellent. Various bus lines as well as the underground are within walking distance.', 'Sie möchten Ihre Immobilie verkaufen? Wir sind Ihr Partner für einen erfolgreichen Verkauf. \n1.Unsere Experten verfügen über tiefgehende Kenntnis des bestehenden Immobilienmarktes und entwickeln gerne eine individuelle Verkaufsstrategie für Sie. Wir bewerten Ihre Immobilie unverbindlich, kostenfrei und marktgerecht.\n 2.Wir sind für Sie da und begleiten Sie von der kostenlosen Beratung bis hin zum Notartermin, immer getreu unserer Philosophie: kompetent, zuverlässig und diskret. \n3.Unser nationales und internationales Netzwerk sowie interne Synergien ermöglichen Ihnen den Zugang zu potenziellen Käufern aus aller Welt und somit einen erfolgreichen Abschluss. \nProfitieren Sie von unserem Know-How, rund 25 Jahren Erfahrung und Standorten in den besten Lagen Berlins. Gerne beraten wir Sie kostenlos in unserem Büro, per Telefon oder E-Mail!  \nEnergieausweis vorhanden:\nja'];;369;;666;;;;;;;
2020-05-11 12:21:35.263257;Berlin;district_heating;ONE_YEAR_FREE;16924112;n;y;https://pictures.immobilienscout24.de/listings/23cabab8-efcc-4439-93f4-56428fabd157-1363697163.jpg/ORIG/resize/118x118%3E/extent/118x118/format/jpg/quality/80;8;11.13;40 MBit/s;telekom_layer_magenta_l;über VDSL;1959;true;REGULAR;disabled;11.13;117407620;district_heating;y;false;MagentaZuhause L;y;Berlin;n;7;2;no_information;energy_consumption;5.02;74.64;Berlin;12249;well_kept;normal;D;false;100 MBit/s;no_information;no_information;n;https://padlock.link/ioml;https://padlock.link/ml;no_information;no_information;12249;3;107;n;2,active;true;Deutschland;standard;100 MBit/s;wohnung_kauf;n;;web,email,bank,music,dl-ul,game,sd,mltstr,hd,fast-ul-dl;true;009.06041d57-de1b-4a48-987b-3b0882138407;315000;profile0;3;true;y;;n;n;Lankwitz_Steglitz;117407620;3;Berlin;/expose/117407620;['+++   Link zum 360° -Rundgang: https://app.immoviewer.com/portal/tour/1691894?accessKey=5e6e   +++ \n\nAuf rund 74 m² vereint diese vorteilhaft geschnittene Eigentumswohnung eine ruhige und grüne Lage mit gleichzeitig guter Anbindung an die Innenstadt. Die vorherrschende urbane Infrastruktur erleichtert und verkürzt Besorgungsgänge im Alltag. \n\nEin Balkon mit Blick ins Grüne und ein schöner Gemeinschaftsgarten sorgen für ein idyllisches Wohnumfeld. Ein gepflegter Zustand, die Erdgeschosslage und freundlich gestaltete Räume machen die Immobilie in erster Linie für Senioren und Familien interessant. \n\nNeben dem Wohn- und Esszimmer verfügt die 3-Zimmer-Wohnung über 2 Schlafzimmer. Eine Wohnküche samt vollständiger Einbauküche und Waschmaschinenanschluss sowie ein Tageslichtbad mit Eckbadewanne vervollständigen den Grundriss. \n\nWeiteren Stauraum bieten ein geräumiger Schuhschrank sowie ein Abstellraum im Flur und ein großer Einbauschrank im Schlafzimmer. Außerdem steht Ihnen ein Keller zur Verfügung - ein weiterer kann für rund 30 € im Monat angemietet werden. \n\nAbgerundet wird das ansprechende Angebot durch einen komfortablen Hausreinigungs- und Winterdienst sowie eine Anwohnerparkstraße. Zudem besteht die Möglichkeit, einen Stellplatz für 30 € pro Monat anzumieten.\n\nDas monatliche Hausgeld beläuft sich auf ca. 332 €. \n\nObjektnr.: 1021639', '+ Terrasse mit Blick ins Grün \n+ Einbauwohnküche mit Sitzgelegenheit\n+ WMA in Küche\n+ Tageslichtbad mit Eckwanne \n+ Hausreinigungs- und Winterdienst \n+ Anwohnerparkstraße \n+ Anmietung eines 2. Kellerraums möglich\n+ Bodenbeläge: Stein in Flur/Küche, Fliesen im Bad, sonst Laminat\n+ Stellplatz-Anmietung möglich (31 €/Monat)\n+ Ruhige, naturnahe Wohnlage \n+ Mtl. Hausgeld: 332 €\n+ Warmwasser über Strom\n\n+ Baujahr laut Energieausweis: 1959\n+ Art des Energieausweises: Verbrauchsausweis\n+ Endenergieverbrauch in kWh/(m²*a): 107,3\n+ Energieeffizienzklasse: D\n+ Wesentlicher Energieträger: Fernwärme', 'Naturnahes Großstadtleben: In Berlin-Lankwitz genießen Sie nicht nur auf Ihrer Terrasse und in dem Gemeinschaftsgarten Ruhe, viel Freiraum und eine reizvolle Naturlandschaft - auch die naturnahe Umgebung im Süden der Hauptstadt bietet einen unglaublichen Erholungswert. Die Nähe zu Wiesen und Wäldern des schönen Brandenburgs und dem Gemeindepark Lankwitz inklusive Streichelzoo in Ihrer direkten Nachbarschaft schaffen zusammen mit der kinder- und seniorengerechten Nachbarschaft beste Wohnbedingungen! \n\nVerschiedene Geschäfte des täglichen Bedarfs sind sowohl im Ortsteil selbst als auch in Berlin-Lichterfelde und Mariendorf schnell zu erreichen. So befindet sich im näheren Umkreis ein ca. 5 Gehminuten entfernter Supermarkt. Eine nur ca. 650 m entfernte Kita sowie eine rund 13 Gehminuten entfernte Grundschule unterstreichen zusammen mit einigen Spielplätzen in der Umgebung die Familienfreundlichkeit. Zudem bietet der Gemeindepark mehrere Sportplätze und einen Minigolfplatz. \n\nDarüber hinaus überzeugt die Wohnlage durch eine ideale Verkehrsanbindung. Innerhalb von nur 5 Gehminuten erreichen Sie die Bushaltestelle “Am Gemeindepark”, wodurch Sie bspw. die S-Bahn-Station “Lankwitz” in nur rund 6 Minuten erreichen. Von hier besteht mit den Linien S1, S25 und S26 ein direkter Anschluss an den Bahnhof “Friedrichstraße”, der so in nur ca. 19 Minuten erreicht werden kann. Auch die Bundesstraßen 1, 96 und 101 sowie die Autobahn 100 befinden sich in komfortabler Reichweite und binden hervorragend an das Straßennetz an. Zudem kann der Flughafen Schönefeld in nur etwa 27 Minuten mit dem Auto erreicht werden. Ebenso befindet sich die Polizeistation Berlin-Südwest nur etwa 450 m von der Immobilie entfernt.', 'Vereinbaren Sie noch heute einen Besichtigungstermin!\n_____________________________________________________\n\nAlle Angaben sind ohne Gewähr und basieren ausschließlich auf Informationen, die uns von unserem Auftraggeber zur Verfügung gestellt wurden. Wir übernehmen keine Gewähr für die Vollständigkeit, Richtigkeit und Aktualität der Angaben.\n    '];;;;;4;;;;;;
