timestamp;obj_regio1;obj_heatingType;obj_telekomTvOffer;obj_cId;obj_newlyConst;obj_balcony;obj_picture;obj_picturecount;obj_pricetrend;obj_telekomUploadSpeed;obj_telekomTrackingGroup;obj_usableArea;obj_telekomInternetTechnology;obj_yearConstructed;obj_telekomInternetType;obj_pricetrendbuy;obj_scoutId;obj_firingTypes;obj_hasKitchen;obj_ExclusiveExpose;obj_telekomInternetProductName;obj_courtage;geo_bln;obj_cellar;obj_purchasePriceRange;obj_yearConstructedRange;obj_rentSubsidy;obj_houseNumber;obj_energyType;obj_pricetrendrent;obj_livingSpace;geo_krs;obj_zipCode;obj_condition;obj_interiorQual;obj_energyEfficiencyClass;ga_cd_cxp_historicallisting;obj_telekomDownloadSpeed;obj_parkingSpace;obj_street;obj_lift;obj_telekomInternetUrlMobile;obj_telekomInternetUrl;obj_streetPlain;obj_typeOfFlat;geo_plz;obj_noRooms;obj_assistedLiving;obj_lastRefurbish;obj_groupnumber;obj_ityp;obj_telekomHdTelephone;geo_land;ga_cd_via;obj_telekomInternet;obj_immotype;obj_rented;obj_floor;obj_telekomInternetServices;obj_telekomInternetProductAvailable;obj_cwId;obj_purchasePrice;ga_cd_application_requirements;obj_numberOfFloors;obj_noRoomsRange;ga_cd_maillead_default_shown;obj_garden;evt_count_pm_sig;obj_barrierFree;obj_international;obj_regio3;obj_objectnumber;obj_livingSpaceRange;obj_regio2;URL;beschreibung;ga_cd_developer_virtualreality;ga_cd_via_qualified;obj_galleryAd;obj_project_id;obj_nbp;obj_thermalChar;obj_noParkSpaces;obj_telekomHybridUploadSpeed;obj_telekomHybridDownloadSpeed
2020-05-11 12:22:21.732399;Berlin;self_contained_central_heating;ONE_YEAR_FREE;1145741;n;y;https://pictures.immobilienscout24.de/listings/029e4060-06dc-4fad-beb4-933a581f5d8c-1363202249.jpg/ORIG/resize/118x118%3E/extent/118x118/format/jpg/quality/80;32;11.35;40 MBit/s;telekom_layer_magenta_l;86.99;über VDSL;1902;REGULAR;11.35;117321839;natural_gas_light;y;false;MagentaZuhause L;n;Berlin;y;9;1;186;37;energy_consumption;7.54;79.57;Berlin;10249;first_time_use;sophisticated;NO_INFORMATION;false;100 MBit/s;no_information;"Petersburger Stra&szlig;e";y;https://padlock.link/ioml;https://padlock.link/ml;Petersburger_Straße;roof_storey;10249;2;n;2020;2044;2,active;true;Deutschland;top;100 MBit/s;wohnung_kauf;n;5;web,email,bank,music,dl-ul,game,sd,mltstr,hd,fast-ul-dl;true;001.1145741;599000;profile0;5;2;true;n;showqualicontactform;n;n;Friedrichshain_Friedrichshain;2044.00220;3;Berlin;/expose/117321839;['Vielen Dank für Ihr Interesse an unserem Angebot. \n\nDas Wohn- und Geschäftshaus befindet sich im Bezirk Friedrichshain/Kreuzberg. Das Dachgeschoss wird derzeit ausgebaut, so dass 312,90 m² neuer Wohnraum entsteht. Hier lebt man mitten in Szenebezirk Friedrichshain und kann über den Dächern einen atemberaubenden Blick auf den Berliner Fernsehturm genießen. \n\nAlle Räume sind nach Fertigstellung lichtdurchflutet. Zwei Klimaanlagen sorgen für angenehme Raumtemperatur an heißen Tagen, die moderne Gasetagenheizung für wohlige Wärme im Winter. Alle Wohnräume werden mit hochwertigem Echtholz in einem warmen Braunton belegt.  Auf insgesamt 14,84 m² Terrassenfläche kann eine kleine grüne Oase zum Entspannen entstehen. Die neuen Aufzüge bringen Sie bequem in Ihr neues schönes und besonderes Zuhause. \n\nDie Fläche im begrünten Innenhof wird gemäß Freianlagenkonzept gestaltet. Dort entstehen ein Kinderspielplatz sowie Müll- und Fahrradstellplätze. \n\nIm Erdgeschoss befinden sich Gewerbeeinheiten. Diese sind an eine Änderungsschneiderei und an einen Kostümverleih vermietet. Alle anderen Einheiten werden als Wohnraum genutzt. \nDas Objekt wurde um die Jahrhundertwende erbaut und ist ein typischer Altbau. Die Fassade und die Treppenhäuser befinden sich noch im ursprünglichen unsanierten Zustand. Die Fassade und der Hausflur erhalten nach Fertigstellung der Baumaßnahmen einen neuen Anstrich. \n\nDas Miethaus wurde in diesem Jahr nach dem Wohnungseigentumsgesetz aufgeteilt. Die WEG besteht aus 25 Wohnungen. \n\nWährend der Bauphase ist es möglich die Raumaufteilung und die Ausstattung zu beeinflussen. Sofern baulich umsetzbar, werden die Wünsche des Käufers selbstverständlich berücksichtigt.', '- Zwei-Zimmer-Wohnung\n- großes Wohnzimmer 35,35 m²\n- Gasetagenheizung\n- Fußbodenheizung\n- Parkett in allen Räumen außer Bad\n- gefliestes Wannenbad mit Dusche\n- Einbauküche mit Geräten\n- 2 Klimageräte\n- eine hofseitige Terrasse mit 10,12 m²\n- eine straßenseitig Terrasse mit 4,72 m²\n- Abstellraum\n- Aufzug\n- Rauchwarnmelder', 'Das Gebäude liegt mitten im Herzen von Berlin im Szeneviertel mit viel Gastronomie und kleinen Geschäften in der Nähe. Hier pulsiert das Leben. Der Bezirk Friedrichshain ist im Wandel, er wird kontinuierlich erneuert und verschönert.  \n\nInnerhalb von einem ca. fünf bis zehn minütigem Fußweg ist der Volkspark Friedrichshain zu erreichen. Nach ca. 30 min. erreicht man ebenfalls fußläufig die Spree, die direkt hinter dem S-Bahnhof Warschauer Straße und der East-Side-Gallery liegt. Dort befindet sich die Mercedes-Benz Arena, diverse Veranstaltungen sorgen für kulturelle Erlebnisse. \n\nDie Tram-Haltestelle der M10 liegt direkt gegenüber des Wohn- und Geschäftsgebäudes. Andere Verkehrsverbindungen sind innerhalb von 5 - 10 Minuten (U-Bahnhof Frankfurter Tor) zu erreichen. \n\nDie Karl-Marx-Allee ist ebenfalls fußläufig erreichbar. Sie lädt zu einem Einkaufsbummel ein. Wer es lieber geballter mag, begibt sich ins ca. 2 km entfernte Ringcenter. In diesem Einkaufszentrum bieten ca. 100 Fachgeschäfte die unterschiedlichsten Waren an. \n\nAuf dem geräumigen Mittelsteifen der Petersburger Straße, stehen öffentliche Parkplätze zur Verfügung. Derzeit erfolgt noch keine Parkraumbewirtschaftung.', 'Sofern Sie Fragen haben oder einen Beratungstermin wünschen, freuen wir uns über Ihren Anruf oder eine E-Mail von Ihnen. \n\nGern kann das Objekt nach Terminvereinbarung besichtigt werden. \n\nACHTUNG: Da der Fußboden hergestellt wird, sind Besichtigungen aufgrund der Trocknungszeit zwischen 08.05.2020 und 08.06.2020 nicht möglich. \n\nWeitervermittlung über Makler nicht möglich. \n\nAlle Angaben beruhen auf Informationen Dritter, daher ist eine Haftung ausgeschlossen.'];;;;;;;;;
2020-05-11 12:22:22.185421;Berlin;central_heating;ONE_YEAR_FREE;17610703;n;y;https://pictures.immobilienscout24.de/listings/66523cd4-25ef-43aa-b51e-3e9b98048761-1364498827.jpg/ORIG/resize/118x118%3E/extent/118x118/format/jpg/quality/80;15;7.75;40 MBit/s;telekom_layer_magenta_l;;über VDSL;1970;REGULAR;7.75;117324205;district_heating;n;false;MagentaZuhause L;y;Berlin;y;4;2;144;6-8;;3.57;40.8;Berlin;14193;need_of_renovation;normal;;false;100 MBit/s;no_information;Hubertusallee;y;https://padlock.link/ioml;https://padlock.link/ml;Hubertusallee;apartment;14193;1;n;;;2,active;true;Deutschland;top;100 MBit/s;wohnung_kauf;y;1;web,email,bank,music,dl-ul,game,sd,mltstr,hd,fast-ul-dl;true;009.eb808053-c275-4395-8fce-dc755606f8bd;165000;profile0;12;1;true;n;;n;n;Grunewald_Wilmersdorf;117324205;1;Berlin;/expose/117324205;['Die Eigentumswohnung befindet sich in zentraler Lage, direkt am Kurfürstendamm und in unmittelbarer Nähe zur S-Bahnhof Hallensee. Die Ein-Zimmer Wohnung befindet sich im 1. Obergeschoss des 12-stöckigen Wohngebäudes und eignet sich perfekt als Kapitaleinlage sowie für den Eigenbedarf. Die Wohneinheit besteht aus einem Flur, einem kleinen Küchenbereich und angrenzenden Duschbad mit Fenster. Das Wohnzimmer ist durch die großen Kunststofffenster und dem Balkon sehr hell. \n\nEs besteht unteranderem das Potential die Wohnung durch Entfernung einiger Wände zur Umstrukturierung zu einem großen offenen Wohnbereich mit einer offenen Küche.\n\nDie Wohnung wird in einem renovierungsbedürftigen Zustand verkauft. Es wird noch eine malermäßige Renovierung im Duschbad stattfinden.', '•\tWohn-/Schlafzimmer \n•\tSeparate, kleine Küchenbereich\n•\tBad mit Fenster\n•\tFlur mit Abstellnische\n\nIn der Wohnung werden noch folgende Renovierungsarbeiten vorgenommen:\n- Badrenovierung\n- Küche wird angestrichen und neue Fliesen', 'Die Wohnung liegt an der Grenze zwischen zwei Ortsteilen, nämlich Grunewald und dem beliebten, wachsenden Wilmersdorf. Der in zentraler Lage gelegene Halenseebezirk gehört dank seiner guten Verkehrsanbindung und der perfekten Infrastruktur zu den begehrtesten Wohngebieten der City West. Der Kurfürstendamm ist nur wenige Schritte entfernt und lädt mit seinen Boutiquen, Restaurants und Cafés zum Bummeln ein. Supermärkte und Geschäfte für den täglichen Einkauf befinden sich in unmittelbarer Nähe. Der S-Bahnhof Halensee, der U-Bahnhof Adenauer Platz und zahlreiche Buslinien am Kurfürstendamm oder an der Westfälischen Straße bieten eine hervorragende Anbindung an andere Teile Berlins. Die Flughäfen Tegel und Schönefeld sind in zwanzig Minuten zu erreichen und die Anbindung an die Stadtautobahn ist nur wenige Meter entfernt.', 'Gerne vereinbaren wir einen Besichtigungstermin mit Ihnen vor Ort. Bitte senden Sie uns hierfür Ihre Kontaktdaten inklusive Emailadresse und Telefonnummer über das Kontaktformular zu oder auf dem telefonischen Wege unter: +49 176 34954367.\n\nDie in diesem Exposé angegebenen Wohn- und Nutzflächen und Informationen zum Objekt beruhen auf Angaben Dritter. Für die Richtigkeit der Angaben übernehmen wir keine Gewähr. Irrtum und Zwischenverkauf/Zwischenvermietung vorbehalten.'];true;;;;;;;;
2020-05-11 12:22:22.562469;Berlin;self_contained_central_heating;ONE_YEAR_FREE;1145741;n;y;https://pictures.immobilienscout24.de/listings/ad5874cd-9c36-4cbc-9e82-757357f8a4d1-1363113002.jpg/ORIG/resize/118x118%3E/extent/118x118/format/jpg/quality/80;13;11.35;40 MBit/s;telekom_layer_magenta_l;333.7;über VDSL;1902;REGULAR;11.35;117305248;gas;y;false;MagentaZuhause L;n;Berlin;y;11;1;702;37;energy_consumption;7.53;314.27;Berlin;10249;mint_condition;sophisticated;NO_INFORMATION;false;100 MBit/s;no_information;"Petersburger Stra&szlig;e";y;https://padlock.link/ioml;https://padlock.link/ml;Petersburger_Straße;roof_storey;10249;10;n;2020;;2,active;true;Deutschland;premium;100 MBit/s;wohnung_kauf;n;5;web,email,bank,music,dl-ul,game,sd,mltstr,hd,fast-ul-dl;true;001.1145741;2190000;profile0;5;5;true;n;showqualicontactform;n;n;Friedrichshain_Friedrichshain;2044.000000;7;Berlin;/expose/117305248;['Vielen Dank für Ihr Interesse an unserem Angebot. \n\nDas Wohn- und Geschäftshaus befindet sich im Bezirk Friedrichshain/Kreuzberg. Das Dachgeschoss wird derzeit ausgebaut, so dass 314,27 m² neuer Wohnraum entsteht. Hier lebt man mitten in Szenebezirk Friedrichshain und kann über den Dächern einen atemberaubenden Blick auf den Berliner Fernsehturm genießen. \n\nNur ca. 60 m² Wohnfläche liegen straßenseitig, die anderen Flächen liegen im hinteren Bereich und verteilen sich auf den Seitenflügel bzw. auf das Quergebäude. Alle Räume sind nach Fertigstellung lichtdurchflutet. Eine Klimaanlage sorgt für angenehme Raumtemperatur an heißen Tagen, die moderne Gasetagenheizung für wohlige Wärme im Winter. Alle Wohnräume werden mit hochwertigem Echtholz in einem warmen Braunton belegt.  Auf insgesamt 32,76 m² Terrassenfläche kann eine kleine grüne Oase zum Entspannen entstehen. Die neuen Aufzüge bringen Sie bequem in Ihr neues schönes und besonderes Zuhause. \n\nDie Fläche im begrünten Innenhof wird gemäß Freianlagenkonzept gestaltet. Dort entstehen ein Kinderspielplatz sowie Müll- und Fahrradstellplätze. \nIm Erdgeschoss befinden sich Gewerbeeinheiten. Diese sind an eine Änderungsschneiderei und an einen Kostümverleih vermietet. Alle anderen Einheiten werden als Wohnraum genutzt. \nDas Objekt wurde um die Jahrhundertwende erbaut und ist ein typischer Altbau. Die Fassade und die Treppenhäuser befinden sich noch im ursprünglichen unsanierten Zustand. Die Fassade erhält nach Fertigstellung der Baumaßnahmen einen neuen Anstrich. \n\nDas Miethaus wird derzeit nach dem Wohnungseigentumsgesetz aufgeteilt. Nach Teilung besteht die WEG aus 25 Wohnungen. \n\nWährend der Bauphase ist es möglich die Raumaufteilung und die Ausstattung zu beeinflussen, soweit diese noch nicht erbaut / installiert sind. Sofern baulich umsetzbar, werden die Wünsche des Käufers selbstverständlich berücksichtigt.\n\nVoraussichtliche Fertigstellung Oktober 2020.', '- 11 Zimmer \n- Gasetagenheizung\n- Fußbodenheizung\n- Parkett in allen Räumen außer Bad\n- geflieste Wannenbäder mit Duschen\n- Wohnküche\n- Einbauküche mit Geräten\n- Klimaanlage\n- 5 Terrassen\n- Abstellräume\n- Aufzug\n- Rauchwarnmelder', 'Das Gebäude liegt mitten im Herzen von Berlin im Szeneviertel mit viel Gastronomie und kleinen Geschäften in der Nähe. Hier pulsiert das Leben. Der Bezirk Friedrichshain ist im Wandel, der kontinuierlich erneuert und verschönert wird.  \nDas Gebäude liegt mitten im Herzen von Berlin im Szeneviertel mit viel Gastronomie und kleinen Geschäften in der Nähe. Hier pulsiert das Leben. Der Bezirk Friedrichshain ist im Wandel, er wird kontinuierlich erneuert und verschönert.  \n\nInnerhalb von einem ca. fünf bis zehn minütigem Fußweg ist der Volkspark Friedrichshain zu erreichen. Nach ca. 30 min. erreicht man ebenfalls fußläufig die Spree, die direkt hinter dem S-Bahnhof Warschauer Straße und der East-Side-Gallery liegt. Dort befindet sich die Mercedes-Benz Arena, diverse Veranstaltungen sorgen für kulturelle Erlebnisse. \n\nDie Tram-Haltestelle der M10 liegt direkt gegenüber des Wohn- und Geschäftsgebäudes. Andere Verkehrsverbindungen sind innerhalb von 5 - 10 Minuten (U-Bahnhof Frankfurter Tor) zu erreichen. \n\nDie Karl-Marx-Allee ist ebenfalls fußläufig erreichbar. Sie lädt zu einem Einkaufsbummel ein. Wer es lieber geballter mag, begibt sich ins ca. 2 km entfernte Ringcenter. In diesem Einkaufszentrum bieten ca. 100 Fachgeschäfte die unterschiedlichsten Waren an. \n\nAuf dem geräumigen Mittelsteifen der Petersburger Straße, stehen öffentliche Parkplätze zur Verfügung. Derzeit erfolgt noch keine Parkraumbewirtschaftung.', 'Sofern Sie Fragen haben oder einen Beratungstermin wünschen, freuen wir uns über Ihren Anruf oder eine E-Mail von Ihnen. \n\nGern kann das Objekt nach Terminvereinbarung besichtigt werden. \n\nACHTUNG: Da der Fußboden hergestellt wird, sind Besichtigungen aufgrund der Trocknungszeit zwischen 08.05.2020 und 08.06.2020 nicht möglich. \n\nWeitervermittlung über Makler nicht möglich. \n\nAlle Angaben beruhen auf Informationen Dritter, daher ist eine Haftung ausgeschlossen.'];;true;;;;;;;
2020-05-11 12:22:22.895146;Berlin;central_heating;ONE_YEAR_FREE;18627115;n;y;https://pictures.immobilienscout24.de/listings/3ce71390-78a1-4851-a1dd-89a99546cf4c-1363143005.jpg/ORIG/resize/118x118%3E/extent/118x118/format/jpg/quality/80;13;10.18;40 MBit/s;telekom_layer_magenta_l;;über VDSL;1974;REGULAR;10.18;117308936;oil;y;false;MagentaZuhause L;n;Berlin;y;3;3;139;00;;5.21;31;Berlin;12203;refurbished;normal;;false;100 MBit/s;no_information;W _Linsestr;y;https://padlock.link/ioml;https://padlock.link/ml;W__Linsestr;roof_storey;12203;1;n;2010;;2,active;true;Deutschland;standard;100 MBit/s;wohnung_kauf;y;2;web,email,bank,music,dl-ul,game,sd,mltstr,hd,fast-ul-dl;true;009.f38606ca-ef5a-4911-b4c2-924b5072bc67;135900;profile0;2;1;true;n;showqualicontactform;n;n;Lichterfelde_Steglitz;85d902e3-e925-4bd5-888c-61cf0e2b2e7e;1;Berlin;/expose/117308936;['Keine Makleranfragen bitte . Parkett .Bei dieser ansprechenden Immobilie handelt es sich um eine Dachgeschosswohnung im zweiten Stock, die durch eine gehobene Innenausstattung besticht. Das ein schönes Zimmer bietet viel Raum zur persönlichen Entfaltung und individueller Einrichtung. Die entsprechende Etage lässt sich bequem über einen Fahrstuhl erreichen. Bei der Heizungsart des Objekts, das sich in einem 1974 erbauten Haus befindet, handelt es sich um eine Zentralheizung. TG oder Stellplatz ggf anmietbar , Fahrstuhl bis TG fahrend ! Ein aktueller Energieausweis liegt zur Besichtigung vor. Das monatliche Hausgeld beträgt 139,00\xa0€. Den Balkon können Sie an sonnigen Tagen zum zweiten Wohnzimmer machen. Ihnen steht außerdem ein Kellerraum zur Verfügung. Zur Innenausstattung gehört auch eine Einbauküche. Derzeit ist die Wohnung zu einem monatlichen Mietpreis von 535,00\xa0€ möbliert vermietet.umfangreiche EBK ! schöner Westbalkon . Dicht zur  TU Dahlem . Sie können die Eigentumswohnung provisionsfrei von privat erwerben.', 'Parkett, umfangreiche EBK , Bad schön mit Dusche .super West Balkon, Fahrstuhl , sehr ruhig und grün, gute Parkplatzmöglichkeiten ', 'Nähe Drakestr. Beste Lage Lichterfelde West '];;;;;;;;;
2020-05-11 12:22:23.251413;Berlin;district_heating;;15372281;y;y;https://pictures.immobilienscout24.de/listings/a3260b2f-dc3f-44d2-bc16-2574fa974169-1363124771.jpg/ORIG/resize/118x118%3E/extent/118x118/format/jpg/quality/80;4;10.71;;;;;2020;;10.71;117308252;no_information;n;false;;n;Berlin;y;9;9;;9E;;5.2;91.82;Berlin;12437;first_time_use;sophisticated;;false;;no_information;Eichbuschallee;y;;;Eichbuschallee;no_information;12437;3;n;;;2,active;;Deutschland;top;;wohnung_kauf;n;2;;false;001.15320047;509000;profile0;4;3;true;n;;n;n;Plänterwald_Treptow;EBA/9E/06;4;Berlin;/expose/117308252;"['Das Neubauprojekt ""Wohnen am Plänterwald"" überzeugt durch seine neoklassizistische Architektur und die gehobene Ausstattung der 62 Wohnungen. Durchdachte und vielseitige Grundrisse mit Größen von rund 53 bis 123 m² bzw. von 2 bis 4 Zimmern sind die ideal geeignet für Familien, Paare oder Singles. Die Wohnungen im Gartengeschoss verfügen über große Terrassen und Privatgärten. In den oberen Etagen ermöglicht die aufwendige, teilweise gestaffelte Architektur ebenfalls große Balkone oder Terrassen für jede Wohnung.\n\nIn Treptow ergänzen sich Natur und modernes Leben zu einer spannenden Verbindung, ohne dass man auf die Vorzüge des pulsierenden Metropolenlebens verzichten muss.\n\nDie gut geschnittene 3-Zimmer-Wohnung überzeugt durch ihren praktischen Grundriss mit großem offenem Wohnküchenbereich und Zugang zum Südwest-Balkon. Die Wohnung lässt keine Wünsche offen: ein Arbeits- oder Kinderzimmer, zwei ansprechende Badezimmer, ein praktischer Abstellraum und ein gemütlicher Schlafbereich bieten gehobenen Wohnkomfort.', '- Echtholzparkett in den Wohn- und Schlafräumen\n- energiesparende Fußbodenheizung\n- Feinsteinzeug in den Bädern\n- Sanitärobjekte und Armaturen von Markenherstellern\n- Elektrische Rollläden an allen Fenstern\n- Großzügiger Balkon\n- 3-Fach-Verglasung der z.T. bodentiefen Fenster\n- KfW-55 Energie-Effizienzhaus (EnEV 2016)\n- Aufzug in alle Etagen\n- Abgeschlossener Müllraum\n- Fahrradabstellplätze für jede Wohnung\n- Tiefgaragenstellätze (Ladestationen möglich)\n', 'Auf der einen Seite viel Grün und entspannende Ruhe. Auf der anderen Seite ist man ruckzuck im Zentrum Berlins - ob mit dem Fahrrad, dem Auto oder den öffentlichen Verkehrsmitteln. Die S-Bahnhöfe Plänterwald und Baumschulenweg sind fußläufig in wenigen Minuten zu erreichen. Doch das Hinsetzen in der Bahn lohnt kaum, denn innerhalb von zwei Stationen befindet man sich im quirligen Kiezleben von Friedrichshain, Neukölln oder Kreuzberg.\n\nPlänterwald: 50 Meter zu Fuß\nSpreeufer: 500 Meter zu Fuß\nTreptower Park: 5 Min mit dem Fahrrad\nMediaspree: 10 Min mit dem Fahrrad\nBahnhof Ostkreuz: zwei Stationen mit den öffentlichen Verkehrsmitteln\nAlexanderplatz: 23 Min mit den öffentlichen Verkehrsmitteln\nFriedrichstraße: 27 Min mit den öffentlichen Verkehrsmitteln\nHauptbahnhof: 30 Min mit den öffentlichen Verkehrsmitteln\nKurfürstendamm: 40 Min mit den öffentlichen Verkehrsmitteln\nFlughafen Tegel: 30 Min mit dem Auto\nFlughafen BER: 22 Min mit dem Auto', 'Der Verkauf erfolgt für den Käufer provisionsfrei!\n\nBeratungstermine in unserem Info-Pavillon vor Ort sind nach individueller Vereinbarung weiterhin möglich!\n\nAngaben nach EnEV: Energieausweis befindet sich in der Erstellung.\n\nÄnderungen und Irrtümer vorbehalten. Das Bild- und Planmaterial dient zum Teil der vorläufigen Illustration des Vorhabens. Insbesondere die Visualisierungen o. ä. sind unverbindlich und zeigen teilweise Sonderausstattungen und Einrichtungen, die als Möblierungsvorschläge zu verstehen sind.\n']";;;disabled;86973;true;;;;
2020-05-11 12:22:23.609588;Berlin;district_heating;ONE_YEAR_FREE;15832933;n;y;https://pictures.immobilienscout24.de/listings/21077e71-9ea7-4fc1-87de-a8a26f8c03c3-1363110899.jpg/ORIG/resize/118x118%3E/extent/118x118/format/jpg/quality/80;9;11.24;40 MBit/s;telekom_layer_magenta_l;;über VDSL;1960;REGULAR;11.24;117304994;district_heating;n;false;MagentaZuhause L;y;Berlin;n;4;2;191.56;56;energy_consumption;6.2;43;Berlin;10717;well_kept;no_information;E;false;100 MBit/s;no_information;"Pfalzburger Stra&szlig;e";y;https://padlock.link/ioml;https://padlock.link/ml;Pfalzburger_Straße;apartment;10717;1;n;;;2,active;true;Deutschland;premium;100 MBit/s;wohnung_kauf;n;1;web,email,bank,music,dl-ul,game,sd,mltstr,hd,fast-ul-dl;true;001.15612808;193500;profile0;5;1;true;n;showqualicontactform;n;n;Wilmersdorf_Wilmersdorf;56_10;2;Berlin;/expose/117304994;['Das Haus in der Pfalzburger Straße 56 wurde 1960 erbaut. Die zum Verkauf stehende Wohnung verfügt über einen Südbalkon und ist bezugsfrei. Großflächige Fenster und die Ausrichtung sorgen für viel Licht. Der zweckdienliche und moderne Schnitt nutzt die  Wohnfläche optimal aus. Der Einheit wird ein Keller zugeordnet. Der Zugang zur Wohnung erfolgt über ein Laubengang, ein Aufzug hält der Etage. Verkäuferseits wurde die Fassadenrückseite kürzlich instandgesetzt. Die Beheizung erfolgt per Fernwärme.', 'Südbalkon, praktischer Schnitt, Aufzug', 'Die Pfalzburger Straße 56 befindet sich 2 Kilometer vom Kurfürstendamm entfernt. Das Stadtviertel ist bekannt für seine gewachsenen Strukturen, gute Altbausubstanz und vor allem auch für seine üppige Kunst- und Kulturlandschaft. Zahlreiche Sehenswürdigkeiten, Parks, Geschäfte und Freizeitaktivitäten machen es auch für Touristen zu einem beliebten Ziel. Der U-Bhf Hohenzollerdamm mit der Linie U3 und die Straßenbahnlinie M19 sind in 5 Gehminuten und die Bushaltestelle Güntzelstraße/Uhlandstraße in 3 Gehminuten erreicht. Der bekannte Preußenpark, auch „Thaipark“ genannt, befinden sich in fußläufiger Entfernung. Er lockt nicht nur Erholungssuchende, sondern bietet auch kulinarische Genüsse. Ringsherum um die Pfalzburger Straße gibt es mehrere Bildungs- und Sportangebote, sowie Arztpraxen. Schnell erreicht sind auch gemütliche Cafés und Restaurants.', 'Dieses Kaufangebot ist provisionspflichtig. Dem Erwerber wird bei Abschluss eines Kaufvertrages eine Provision in Höhe von 3,57 % des beurkundeten Kaufpreises inkl. der gesetzlichen MwSt. berechnet. Abweichungen sind nur in Form einer gesonderten, schriftlichen Vereinbarung gültig. Die Neo Res Immobilien GmbH ist Rechnungsstellerin und Empfängerin der Provision. Irrtum und Zwischenverkauf sind vorbehalten. Alle Informationen und Unterlagen sind uns von Seiten des Verkäufers übermittelt und werden ohne Haftung für Vollständigkeit oder Fehlinformationen von uns weitergeleitet. Hinsichtlich weiterer Dienstleistungen in Zusammenhang mit dem Erwerb, wie beispielsweise Finanzierungen oder entsprechende Versicherungen unterstützen wir Sie gerne. Es ist uns leider nicht gestattet, Sie zu steuerrelevanten Aspekten zu beraten. Hierzu wenden Sie sich bitte an Ihren Steuerberater, beziehungsweise werden wir auch in diesem Zusammenhang gerne vermittelnd tätig. Es gelten unsere AGB. Bitte informieren Sie sich über deren Inhalt auf unserer Homepage www.neo-res.de.'];;true;disabled;;;157;;;
