2020-05-11 12:45:31.459817;Berlin;central_heating;ONE_YEAR_FREE;17228770;n;y;https://pictures.immobilienscout24.de/listings/ae62a062-9d1f-420f-8be5-6860fc182e4a-1363480577.jpg/ORIG/resize/118x118%3E/extent/118x118/format/jpg/quality/80;6;11.37;10 MBit/s;telekom_layer_magenta_m;;über VDSL;1910;REGULAR;11.37;113896710;;gas;y;false;MagentaZuhause M;y;Berlin;n;9;1;no_information;energy_consumption;7.78;130;Berlin;10245;mint_condition;no_information;;false;50 MBit/s;no_information;no_information;y;https://padlock.link/iomm;https://padlock.link/mm;no_information;apartment;10245;4;128.4;n;2,active;true;Deutschland;standard;50 MBit/s;wohnung_kauf;n;3;web,email,bank,music,dl-ul,game,sd,mltstr,hd,fast-ul-dl;true;002.01007994385;650000;profile0;5;4;true;y;;n;n;Friedrichshain_Friedrichshain;#01008;6;Berlin;/expose/113896710;['Die Ausstattung Ihrer Wohnung lässt nahezu keinen Wunsch offen und weist u.a. folgende Ausstattungsmerkmale auf:\n\n+ Gartennutzung\n+ Balkon mit Blick ins Grüne\n+ Parkettfußboden\n+ verspachtelte Wände\n+ ideale Raumaufteilung\n+ Stuckapplikationen\n+ 2. Obergeschoss\n+ Altbauelemente (aufwändig verzierte Altbautüren z.T. Flügeltüren, Altbaudoppelkastenfenster,...)\n+ hohe Decken\n+ verspachtelte Wände\n+ Einbauküche\n+ Badezimmer mit Dusche, Wanne und Fenster\n+ vier separate Zimmer\n+ Keller', 'Gut gelegen und trotzdem idyllisch - diese Wohnung bietet eine Top Lage im Szene Bezirk Friedrichshain mit vielen Entspannungsmöglichkeiten. Unweit der Warschauer Straße ist diese Wohnung ideal und zentral gelegen. In wenigen Minuten ist der U-Bahnhof Frankfurter Tor und die Straßenbahnlinie M10 zu erreichen, die eine direkte Anbindung in alle Teile Berlins schaffen. Der Boxhagener Platz ist keine 10 Minuten entfernt. Zudem befinden sich in der unmittelbaren Umgebung viele Restaurants, Cafés und Shops. Die neu eröffnete East Side Mall bietet zusätzliche Einkaufsmöglichkeiten und ist schnell mit der Straßenbahn zu erreichen.', 'Alle Angaben stammen vom Verkäufer. Wir übernehmen hierfür keine Haftung.\n\nIhren Besichtigungstermin können Sie selbstverständlich individuell nach Ihren Wünschen mit uns vereinbaren. Zur Beantwortung Ihrer Fragen können Sie uns jederzeit kontaktieren.\n\nZusätzlich zu der o.g. Nachweisprovision fällt eine Vermittlungsprovision an, wenn es der Maklerfirma gelingt im Interesse des Kunden in Verhandlung mit dem Verkäufer den Verkaufspreis zu reduzieren. Die Vermittlungsprovision beträgt 20 % zzgl. MwSt. auf die Differenz zwischen dem Beurkundungspreis und dem ursprünglichen Verkaufspreis. \n\nSie möchten Ihre Immobilie verkaufen?\n\nWir stehen Ihnen gerne bei allen Fragen und Anliegen beratend beiseite und treten dafür ein, dass vor allem\nSie profitieren. Nutzen Sie die positive Marktlage und unser geschultes Team, um den Höchstpreis zu erzielen. Gerne unterstützen wir Sie bei all Ihren Fragen und Anliegen rund um Ihre Immobilie. Ganz individuell gehen wir auf Ihre persönlichen Bedürfnisse ein, um Ihnen eine ehrliche und kompetente Beratung zu gewährleisten, denn Ihre Zufriedenheit ist unser Ziel.\n\nIhr IMMODO-Team'];430;;;disabled;;;
2020-05-11 12:45:31.821460;Berlin;self_contained_central_heating;ONE_YEAR_FREE;15754699;n;n;https://pictures.immobilienscout24.de/listings/c65a19db-82f7-4560-8fcb-5f451de6ab0b-1359848929.jpg/ORIG/resize/118x118%3E/extent/118x118/format/jpg/quality/80;16;10.81;40 MBit/s;telekom_layer_magenta_l;;über VDSL;1908;REGULAR;10.81;113865628;;natural_gas_heavy;n;false;MagentaZuhause L;y;Berlin;n;7;1;77;energy_consumption;6.01;55;Berlin;12159;mint_condition;no_information;;false;100 MBit/s;no_information;"Hauptstra&szlig;e";n;https://padlock.link/ioml;https://padlock.link/ml;Hauptstraße;apartment;12159;2;148;n;2,active;true;Deutschland;top;100 MBit/s;wohnung_kauf;n;2;web,email,bank,music,dl-ul,game,sd,mltstr,hd,fast-ul-dl;true;001.15650116;309000;profile0;5;2;true;n;;n;n;Friedenau_Schöneberg;6086;2;Berlin;/expose/113865628;['Die hochwertig eingerichtete Altbauwohnung befindet sich im Seitenflügel eines gepflegten Mehrfamilienhauses aus der Jahrhundertwende. Sie liegt auf der 2. Etage und verfügt über 2 Zimmer, eine Küche mit Sitzgelegenheit und ein gefliestes, voll ausgestattetes Duschbad. \nDer Wohnbereich ist mit einer modernen, selbst angefertigten Hochbetteben ausgestattet.\nBereits beim Betreten der möblierten Wohnung, empfängt Sie der Altbaucharme und eine mit hochwertigen Möbeln eingerichtete, gemütliche Wohnatmosphäre.\nDas 1908 errichtete Eckgebäude besteht aus einem Vorderhaus, einem Hinterhaus, sowie einem Seitenflügel.\n\nKontaktieren Sie uns gern telefonisch oder per Mail.\nWir freuen uns, Ihnen die tolle  Wohnungn persönlich zu präsentieren.\n\n', 'In diesem schönen Stadtteil Friedenau, zwischen Schöneberg mit seinen beliebten Einkaufsstraßen wie der Akazienstraße und der berühmten Shoppingmeile Schlossstraße, im angrenzenden Steglitz, ist diese Wohnung hervorragend gelegen. \nDie Gegend verfügt nicht nur über diverse Cafés und Restaurants, sondern auch über attraktive Grünanlagen wie der Perelsplatz und die Ceciliengärten. Der U- und S-Bahnhof Innsbrucker Platz (ca. 10 Minuten entfernt) und die Stadtautobahn (ca. 3-5 Minuten entfernt) bieten die optimale Verkehrslage.\n'];245;1;;disabled;;;
2020-05-11 12:45:32.262507;Berlin;;ONE_YEAR_FREE;16728507;n;y;https://pictures.immobilienscout24.de/listings/25060ebc-9b15-4f3f-8651-16069d4e2e38-1324727451.jpg/ORIG/resize/118x118%3E/extent/118x118/format/jpg/quality/80;4;12.7;40 MBit/s;telekom_layer_magenta_l;64;über VDSL;1910;REGULAR;12.7;113861195;;no_information;n;false;MagentaZuhause L;y;Berlin;y;6;1;no_information;;7.58;64;Berlin;10559;need_of_renovation;normal;;false;100 MBit/s;no_information;no_information;n;https://padlock.link/ioml;https://padlock.link/ml;no_information;apartment;10559;3;;n;2,active;true;Deutschland;top;100 MBit/s;wohnung_kauf;y;2;web,email,bank,music,dl-ul,game,sd,mltstr,hd,fast-ul-dl;true;002.01007540282;285000;profile0;5;3;true;n;showqualicontactform;n;n;Tiergarten_Tiergarten;4VGU66;3;Berlin;/expose/113861195;"['Ein hochwertig renoviertes und zum Teil ausgebautes Mehrfamilienhaus beherbergt die vermietete 3 Zimmer-Wohnung im 2. OG.\n\nBei dieser Immobilie handelt es sich um ein Verifizierungsobjekt. Hierbei erhalten Sie nach einer kurzen telefonischen Verifikation Ihrer Anfrage, Zugriff auf alle relevanten Informationen (vollständige Adresse, Bilder, Mieterliste, Grundrisse, etc.) im Dokumenten Center des Inserates.\n\n############################################################\n\nSolide vermietet und perfekt als Kapitalanlage geeignet - mit einer Schutzfrist bis 2028. Im Vergleich zu bezugsfreien Wohnungen in der Umgebung, bietet dieses Apartment daher einen besonders attraktiven Preis. Eigenbedarf in ferner Zukunft ist ebenfalls möglich.\n\nDer Flur ermöglicht den Zugang klassisch zu allen drei Wohnräumen. Der Balkon mit Südwest-Ausrichtung ist jeweils über Schlaf- und Wohnzimmer begehbar. Alle Räume sind mit Altbau-typischen Dielenböden ausgestattet, wobei das Duschbad mit Fenster natürlich durchgehend gefliest ist.\n\nDie Wohnung an sich ist leicht renovierungsbedürftig, das schöne Haus und das Gemeinschaftseigentum generell befinden sich dagegen in einem außergewöhnlich guten Zustand. In den letzten drei Jahren sind hier etliche Sanierungs- und Aufwertungsarbeiten erfolgt. Diese reichen vom Fassadenanstrich über eine optimierte Hof- und Gartengestaltung bis hin zum neuen Dach.', '++ 64 m²\n++ 3 Zimmer\n++ Beliebte Lage im StephanKiez\n++ Vermietet (mit Sperrfrist)\n++ Dielenfußboden\n++ Altbauarchitektur\n++ Gefliestes Duschbad mit Fenster\n++ Balkon mit südwestlicher Ausrichtung\n++ Doppelkastenfenster', 'Moabit gehört zum Bezirk Mitte und liegt wie es der Name des Bezirkes schon sagt ""mitten in Berlin"". Dort findet man den Reichstag, das Brandenburger Tor und verschiedene Bundesministerien. \nAuch der Hauptbahnhof als Fernbahnanschluss ist nicht weit entfernt. Die Anbindung an den öffentlichen Nahverkehr ist mit dem U-Bahnhof Birkenstraße (U9), \ndem S-Bahnhof Beusselstraße (S41, S42, S46) und verschiedenen Buslinien nahezu ideal. Ein vielfältiges gastronomisches Angebot und verschiedene Einkaufsmöglichkeiten sind in der nahe \ngelegenen Turmstraße oder auch in der Stromstraße vorhanden und lassen nahezu keine Wünsche offen. Die bekannte Arminius-Markthalle ist zum Beispiel nur fünf Gehminuten entfernt.', '\nKontaktieren Sie uns und vereinbaren Sie einen Beratungstermin mit Ihrem persönlichen WunderAgenten!\n\n*************\n\nWunderAgent – Mein Partner rund um Immobilien.\n\nVon der möblierten 1-Zimmer-Wohnung bis zum Mehrfamilienhaus, wir betreuen Ihre Immobilie.\n\n*************\n\nHinweis: Das vorliegende Exposé wurde nach Angaben des Auftraggebers gefertigt und dient lediglich zur Orientierung im Vorfeld einer Besichtigung. Sämtliche Angaben zu Ausstattung und Details wurden seitens des Auftraggebers getätigt. WunderAgent übernimmt keine Gewähr für die Richtigkeit der gemachten Angaben - dies gilt insbesondere für die korrekte Ermittlung der Wohnfläche. Bei der Inaugenscheinnahme der Immobilie durch WunderAgent werden sämtliche Angaben auf Plausibilität geprüft. Im Zweifel empfehlen wir Ihnen vor Abschluss eines Kauf- oder Mietvertrages eine detaillierte Ermittlung der angegebenen Wohnfläche. Gerne beraten wir Sie hierzu im persönlichen Gespräch. Das vorliegende Exposé wird nicht Bestandteil eines Kauf- oder Mietvertrages - es erfüllt lediglich Vorab-Informationszwecke im Vorfeld einer Besichtigung. Zugesicherte Eigenschaften (z.B. korrekte Wohnfläche) sollten im Kauf- oder Mietvertrag direkt mit dem Verkäufer/Vermieter vertraglich geregelt werden.\n']";;;;disabled;;;
2020-05-11 12:45:32.595232;Berlin;;;17174552;n;y;https://pictures.immobilienscout24.de/listings/946acc76-e517-472d-b1a8-ef287db843c5-1325356554.jpg/ORIG/resize/118x118%3E/extent/118x118/format/jpg/quality/80;2;11.24;;;155.79;;1892;;11.24;113880110;;no_information;n;true;;y;Berlin;y;11;1;no_information;;6.16;162;Berlin;10717;first_time_use;sophisticated;;false;;no_information;no_information;y;;;no_information;roof_storey;10717;4;;n;2,active;;Deutschland;standard;;wohnung_kauf;n;5;;false;002.01007947300;1940000;profile0;5;4;true;n;showqualicontactform;n;n;Wilmersdorf_Wilmersdorf;499482;7;Berlin;/expose/113880110;['Hier haben Sie es förmlich bis ganz nach oben geschafft: in ein Penthouse der gehobenen Extraklasse. In der 4-Zimmer-Dachgeschosswohnung erwartet Sie eine große Wohnküche und ein wunderschöner Wohnbereich mit Zugang zu zwei Terrassen und einer Dachterrasse. Des Weiteren stehen zwei Kinderzimmer zur Verfügung sowie ein Schlafzimmer mit angrenzendem Master-Bad. Vier Zimmer, die großzügig geschnitten und mit Licht erfüllt sind. Vier Zimmer, in denen Familien ihr perfektes Glück finden können.', '-    2 Terrassen\r\n-    1 On-Top-Dachterrasse\r\n-    Wohnbereich offener Küche\r\n-    3 Schlafzimmer\r\n-    2 Badezimmer', 'Die traumhafte Penthouse-Wohnung befindet sich in nächster Nähe des Boulevards Kurfürstendamm mit dem Europacenter, dem Bikini Berlin und vielen edlen Boutiquen sowie der Tauentzienstraße mit dem traditionsreichen KaDeWe. Auch der Prager Platz mit seiner Einkaufspassage liegt praktisch vor der Tür und erfüllt mit zahlreichen Supermärkten, Restaurants, Fitness-Club und optimaler Anbindung an das öffentliche Nahverkehrsnetz Berlins, all Ihre täglichen Wünsche.', 'KONTAKT:\r\n\r\nWeitere Details zum Objekt erhalten Sie in einem individuellen Beratungstermin. \r\n\r\nWir freuen uns über Ihre Kontaktaufnahme:\r\n\r\nBEST PLACE Immobilien GmbH & Co. KG\r\nUnter den Linden 39\r\n10117 Berlin\r\n\r\nTel (+49) 30 4435196 0\r\nFax (+49) 30 4435196 22\r\n\r\ninfo@bestplace-immobilien.de\r\nwww.bestplace-immobilien.de'];;1;;disabled;;;
2020-05-11 12:45:32.957342;Berlin;self_contained_central_heating;ONE_YEAR_FREE;16649341;n;y;https://pictures.immobilienscout24.de/listings/b613d0e4-f70f-4d2c-91d9-0c6e14ad5a27-1326756833.jpg/ORIG/resize/118x118%3E/extent/118x118/format/jpg/quality/80;9;10.81;40 MBit/s;telekom_layer_magenta_l;;über VDSL;1910;REGULAR;10.81;113879418;;no_information;n;false;MagentaZuhause L;y;Berlin;n;6;1;no_information;;6.01;60;Berlin;12161;no_information;no_information;;false;100 MBit/s;no_information;no_information;n;https://padlock.link/ioml;https://padlock.link/ml;no_information;apartment;12161;2;;n;2,active;true;Deutschland;top;100 MBit/s;wohnung_kauf;y;1;web,email,bank,music,dl-ul,game,sd,mltstr,hd,fast-ul-dl;true;001.16215413;279000;profile0;;2;true;n;;n;n;Friedenau_Schöneberg;5359;2;Berlin;/expose/113879418;"['Das Mehrfamilienhaus wurde 1910 erbaut, steht unter Denkmalschutz und ist aufgeteilt in ein Vorderhaus mit Seitenflügel.\n\nStraßenseitig gibt es kleine Vorgärten, der Innenhof ist ebenfalls sehr grün, fast alle Wohnungen haben einen Balkon. \n\nDiese Wohnung wird mit Erlaubnis des Eigentümers seit 2004 als Praxis genutzt.\n\nBeheizung erfolgt über eine Gasetagenheizung.\n\nGebäude wurde 2018 in Eigentumswohnungen aufgeteilt. Die Wohnung ist seit 01.01.2001 zuverlässig vermietet. Nach Verkauf der Wohnung besteht eine 10-jährige Kündigungsschutzfrist für die aktuellen Mieter.\n\nBruttokaltmiete: € 311,62\nHausgeld: € 136,00', '- 3 Zimmer\n- Bad mit WC\n- Balkon\n- Abstellraum\n- Flur\n\nDiese Wohnung wird seit 2004 mit Genehmigung als Praxis genutzt. \nIm Grundriss Wohnen 3 sind alle Anschlüsse für eine Küche vorhanden.', 'Eine gefragte Lage von Berlin-Friedenau! Gute Wohnqualität und bei allen beliebt!\n\nDie Wohnung befindet sich im Herzen Friedenaus - mit Schulen, Kitas, Spielplätzen und den kleinen geheimnisvollen Ecken in einem der gefragtesten und beliebtesten Kiezen.\n\nZum Friedrich-Wilhelm-Platz mit der U-9 oder zum Rüdesheimer Platz mit der U-3 gelangt man in wenigen Minuten zu Fuß. \nEbenso ist eine der Haupteinkaufsstraßen Berlins, die Schloßstraße, nur wenige hundert Meter entfernt. Dort stehen\ndas ""Forum Steglitz"", das Einkaufscenter ""Das Schloß"" und der ""Boulevard Berlin"" für Shopping Erlebnisse zur Auswahl. \n\nFerner ist die Auffahrt zum Berliner Stadtring nur einige Minuten entfernt. ', 'Alle Angaben beruhen auf den Auskünften des Eigentümers, wir übernehmen dafür keine Gewähr. Zwischenverkauf / Änderung / Irrtum vorbehalten.\n\nBei Anfragen bitten wir um Ihre vollständigen  Kontaktdaten.\n\nGerne zeigen wir Ihnen das Objekt und freuen uns auf einen persönlichen Termin mit Ihnen.\n\nIhre\nIsabella v. Massenbach\nvon Massenbach Immobilien GmbH\n030 91566035 oder 0177 3600836\n\nWeitere interessante Angebote finden Sie auch im Internet unter www.massenbach-immobilien.de\n\nSie wollen Ihre Immobilie verkaufen ?\n\nWir suchen im Stadtgebiet von Berlin Immobilien (freie Eigentumswohnungen, Mehrfamilienhäuser und Einfamilienhäuser), auch zum eigenen Ankauf. Sprechen Sie uns gerne an oder vereinbaren Sie einen persönlichen Termin mit uns: 030-91566035']";136.88;;;disabled;;;
2020-05-11 12:45:33.644198;Berlin;central_heating;ONE_YEAR_FREE;16123617;n;y;https://pictures.immobilienscout24.de/listings/4b771f66-0540-4e59-be38-73b0c874a95d-1367162461.jpg/ORIG/resize/118x118%3E/extent/118x118/format/jpg/quality/80;11;12.7;40 MBit/s;telekom_layer_magenta_l;;über VDSL;2000;REGULAR;12.7;113852478;1;district_heating;y;true;MagentaZuhause L;y;Berlin;y;9;5;no_information;energy_consumption;7.58;86.35;Berlin;10787;well_kept;sophisticated;D;false;100 MBit/s;underground_garage;no_information;y;https://padlock.link/ioml;https://padlock.link/ml;no_information;apartment;10787;2;113;n;2,active;true;Deutschland;schaufenster;100 MBit/s;wohnung_kauf;n;3;web,email,bank,music,dl-ul,game,sd,mltstr,hd,fast-ul-dl;true;002.01006554579;650000;profile0;5;2;true;n;showqualicontactform;y;n;Tiergarten_Tiergarten;DC-BER4109_2;4;Berlin;/expose/113852478;['Die hier zum Verkauf stehende Immobilie liegt im dritten Obergeschoss eines im Jahre 2000, sehr hochwertig erbauten Wohnensembles und verfügt über ca. 86 m² Wohnfläche. Die Eigentumswohnung, die Sie komfortabel mit dem Aufzug erreichen, teilt sich in zwei Zimmer auf. \n\nBeim Betreten der Wohnung fällt sofort die durchdachte Raumaufteilung auf. Über den Eingangsbereich erreichen Sie das Herzstück der Wohnung: das großzügige Wohnzimmer mit der westlich ausgerichteten Loggia, die im Spätsommer zum Verweilen einlädt. Vom Wohnzimmer erreichen Sie zudem das Schlafzimmer mitsamt Tageslichtbad en suite.\n\nVom Eingangsbereich gelangen Sie auch in die separate Küche mit abgetrenntem Hauswirtschaftsraum sowie auch zum Gäste-WC.\n\nDank der überwiegend bodentiefen Holzfenster mit Isolierverglasung werden traumhaft helle Räume geschaffen. Der Parkettboden mit Fußbodenheizung unterstreicht dabei das exklusive Wohngefühl und sorgt stets für ein angenehmes Klima. Der 24h Concierge-Service und die Alarmanlage stellen zudem höchste Sicherheits- und Komfortbedürfnisse sicher. Auf Wunsch besteht die Möglichkeit einen Tiefgaragenstellplatz zu erwerben.', '• 2 Zimmer\n• 1 Schlafzimmer \n• Einbauküche mit Geräten von Imperial und Gaggenau\n• Tageslicht-Vollbadezimmer mit Doppelwaschtisch\n• Gäste-WC\n• Hauswirtschaftsraum \n• Parkettfußboden mit Fußbodenheizung \n• Gespachtelte Wände\n• Deckenhöhe ca. 3,10 Meter\n• Großteils bodentiefe Holzfenster mit Isolierverglasung und Faltrollos\n• Loggia\n• Videogegensprechanlage \n• 3-Punkt-Sicherheitstür und Alarmanlage\n• Barrierefrei\n• Personenaufzug \n• Kellerabteil mit separatem Fahrradabstellraum\n• 24h-Concierge Service\n• Tiefgaragenstellplatz mit Stromanschluss optional zu erwerben € 35.000,-', 'Tiergarten ist ein zentral gelegener Ortsteil des City-Bezirks Mitte. Seinen Namen verdankt Tiergarten seinem großen Stadtpark, der vom S-Bahnhof Tiergarten bis zum Brandenburger Tor reicht und auch als „Grünes Herz Berlins“ bezeichnet wird.\nDas Wohnen und Leben in Tiergarten erfreut sich höchster Beliebtheit, weil sich hier im Grünen Geschichte, Politik und Kultur auf höchstem Niveau treffen: Neben dem Bundestag im ehemaligen Reichstagsgebäude residieren in Tiergarten auch der Bundepräsident im Schloss Bellevue, die Bundekanzlerin in ihrem Bundeskanzleramt und viele Botschaften. Einen Steinwurf vom Botschaftsviertel entfernt pulsiert das Leben am berühmten Potsdamer Platz, der neben dem Sony Center und dem Bahntower die Spielbank Berlin, ein großes Einkaufscenter, noble Hotels und das Theater am Potsdamer Platz beherbergt. Für Naturliebhaber bietet sich ein Besuch im Berliner Zoo  und im Aquarium an, das Joggen im Großen Tierpark oder sogar die Teilnahme am weltbekannten Berlin-Marathon, der an der Siegessäule vorbei traditionell am Brandenburger Tor endet.\nDie unmittelbare Nähe zum Berliner Hauptbahnhof und zum berühmten Bahnhof Zoo, die vorhandenen U- und S-Bahnverbindungen sowie verschiedene Buslinien und die fußläufige Entfernung zur gesamten City West mit dem Kurfürstendamm und dem KaDeWe lassen die Hot Spots Berlins, aber auch alle anderen Gegenden der Stadt schnell und problemlos erreichen.'];671.17;;true;disabled;;;
2020-05-11 12:45:33.979632;Berlin;;ONE_YEAR_FREE;16273579;n;y;https://pictures.immobilienscout24.de/listings/f2c4246c-f38c-46a1-b131-7a5a6dcb7422-1324847997.jpg/ORIG/resize/118x118%3E/extent/118x118/format/jpg/quality/80;15;10.18;40 MBit/s;telekom_layer_magenta_l;;über VDSL;1909;REGULAR;10.18;113869735;;gas;n;false;MagentaZuhause L;y;Berlin;n;4;1;no_information;energy_consumption;5.21;50.2;Berlin;12207;no_information;no_information;;false;100 MBit/s;no_information;no_information;n;https://padlock.link/ioml;https://padlock.link/ml;no_information;apartment;12207;2;179;n;2,active;true;Deutschland;standard;100 MBit/s;wohnung_kauf;y;;web,email,bank,music,dl-ul,game,sd,mltstr,hd,fast-ul-dl;true;001.15952887;159000;profile0;;2;true;n;;n;n;Lichterfelde_Steglitz;415-01;2;Berlin;/expose/113869735;['Diese Wohnung befindet sich in der Lichterfelder Müllerstraße - in einer ruhigen und grünen Wohngegend in der Nähe des Ostpreußendamm. Der Altbau aus dem Jahre 1909 ist gut erhalten, die Fassade wurde vor kurzem erneuert.\n\nDie  50 m² große 2-Zimmer-Wohnung befindet sich im Hochparterre des Vorderhauses. Sie verfügt über Wohnzimmer, Schlafzimmer, Küche, Bad und Loggia.', 'Alle Zimmer sowie Küche und Bad verfügen über Fenster und sind somit natürlich belichtet und belüftet.\n\nIm Rahmen einer Erneuerung sind die Fenster als moderne, Wärme-dämmende Fenster ausgelegt. Die Fassade ist vor kurzem erneuert worden, das Dach wurde vor einigen Jahren neu eingedeckt.', 'Die Müllerstraße in Lichterfelde ist eine ruhige und grüne Straße Nebenstraße in einer angenehmen Wohnlage. Die Nachbarschaft ist von Stadtvillen und Einfamilienhäusern geprägt. Am nahe gelegenen Ostpreußendamm sind befinden sich diverse Cafes, Restaurants und Läden des täglichen Bedarfs. Die S-Bahn-Station Osdorfer Straße ist zu Fuß in nur wenigen Minuten erreichbar.', 'Mit dem Mieter ist eine Bruttokaltmiete von € 4,86 pro m², entsprechend einer monatlichen Miete von € 243,97 vereinbart. Wir haben die Bruttokaltmiete auf der Basis der tatsächlichen Betriebskosten nettoisiert. So ergibt sich eine Nettokaltmiete von € 3,40 pro m², entsprechend einer monatlichen Miete von € 170,59. \n\nBitte beachten Sie, dass es sich um eine vermietete Wohnung handelt. Daher veröffentlichen wir hier keine Bilder vom Inneren der Wohnung. Eine Besichtigung ist nach Abstimmung mit dem Mieter möglich.\n\nAlle Angaben beruhen auf den Auskünften des Eigentümers, wir übernehmen dafür keine Gewähr. Zwischenverkauf / Änderung / Irrtum vorbehalten.'];123.86;;;;;;
