2020-05-11 12:31:43.412711;Berlin;central_heating;;16480061;n;y;https://pictures.immobilienscout24.de/listings/59f06435-bb26-45a6-a86f-051b530b9513-1356071660.jpg/ORIG/resize/118x118%3E/extent/118x118/format/jpg/quality/80;13;11.35;53;1900;11.35;116424327;;gas;n;false;n;Berlin;y;6;1;171;28;energy_required;7.53;53;Berlin;10245;well_kept;normal;;false;no_information;"Corinthstra&szlig;e";n;Corinthstraße;ground_floor;10245;2;129;n;;2,active;Deutschland;top;wohnung_kauf;n;0;true;002.01007331745;295000;profile0;4;2;true;y;showqualicontactform;n;n;Friedrichshain_Friedrichshain;TBC28W30;2;Berlin;/expose/116424327;['Das Wohn- und Geschäftshaus aus dem Jahre 1900 bildet ein Eckhaus an der Corinthstraße und Bossestraße und hat drei Hauseingänge: Corinthstraße 28, Corinthstraße 30 und Bossest.8.\n\nDas Haus ist 2019 in eine Eigentümergemeinschaft aufgeteilt worden. Es können hier noch Balkone hofseitig entstehen, Aufzüge erbaut werden und das Dachgeschoss soll ausgebaut werden und dadurch erhält das Objekt ein neues Dach!\n\nEs handelt sich hier um eine 2-Zimmer-Wohnung mit Küche und Duschbad mit Fenster im Erdgeschoss  im Hinterhaus der Corinthstr. 28. Die Wohnung, welche ruhig zum Hinterhof liegt, ist in einem sehr gepflegten Zustand. \nEine der Wohnung zugeordnete Sondernutzungsfläche ermöglicht eine Terrassen -oder Gartennutzung direkt vor der Wohnung.\nLaut Teilungserklärung kann man auch die Fenster zu bodentiefen Terrassentüren umbauen. \n\nDie Wohnung wird zum 1.08.2020 bezugsfrei.', '- Laminat\n- Duschbad\n- gepflegtes Treppenhaus\n- hohe Decken\n- ruhiger begrünter Hof \n- Terrasse im Hof  im Sondernutzungsrecht\n- Nähe East Side Mall', 'Willkommen in der Oberbaumcity!\r\rDie vermietete Eigentumswohnung befindet sich in einer ruhigen Seitenstraße nahe der Spree in un-mittelbarer Nähe zur Mediaspree, Mercedes-Benz Arena und der East Side Gallery. \r\rÖffentliche Verkehrsmittel wie S-und U-Bahn sowie Bus und Tram befinden sich einerseits auf der Warschauer Straße, andererseits bei der Station Ostkreuz, welche fußläufig in ca. 10 Minuten erreichbar sind. Anbindung zum Fernverkehr erhält man schnell am ca. 2,6 km entfernten Ostbahnhof. \r\rDer Szenebezirk Friedrichshain, ist bekannt für seine reichhaltige und multi-kulturelle Auswahl an Restaurants, Cafe´s und Bars, in und um den Boxhagener Platz im Simon-Dach-Kiez, welcher ebenfalls nur wenige Gehminuten entfernt ist. \r\rGeschäfte des täglichen Bedarfs sowie Apotheken, Kitas und Schulen sind ebenfalls in unmittelbarer Nähe zahlreich vorhanden.', 'Weitere Angebote finden Sie unter: homeestate.de oder auf unserer Projektseite unter: bosse8.de\r\rGerne stehen wir Ihnen für Rückfragen zur Verfügung.\r\rFeel free to contact us also in English- we are happy to inform you concerning this apartment.\rVous pouvez également nous contactez en Français- nous serons ravie de vous informer.\r'];ONE_YEAR_FREE;40 MBit/s;telekom_layer_magenta_l;über VDSL;;REGULAR;;MagentaZuhause L;100 MBit/s;https://padlock.link/ioml;https://padlock.link/ml;;true;100 MBit/s;web,email,bank,music,dl-ul,game,sd,mltstr,hd,fast-ul-dl;;
2020-05-11 12:31:43.788461;Berlin;district_heating;true;15402574;n;y;https://pictures.immobilienscout24.de/listings/2ee3d6c2-7571-4b8c-8177-ed67fff59c46-1356767570.jpg/ORIG/resize/118x118%3E/extent/118x118/format/jpg/quality/80;22;11.3;;1900;11.3;116417862;;district_heating;y;false;y;Berlin;y;7;1;219.97;no_information;energy_consumption;5.73;67;Berlin;10585;well_kept;no_information;C;false;no_information;no_information;n;no_information;apartment;10585;2;77.8;n;2004;2,active;Deutschland;premium;wohnung_kauf;n;1;true;001.15350375;349000;profile0;5;2;true;n;showqualicontactform;n;n;Charlottenburg_Charlottenburg;Se b;3;Berlin;/expose/116417862;['Zimmeranzahl: 2\nWohnzimmer: mit Balkon\nBad: mit Dusche und Bidet, italienischer Marmor und Granit\nBalkon: Ja, zum Osten\nEBK: ja, sehr hochwertig\nBoden: hochwertige Jatoba-Massivholzdielen\nHeizung: Fernwärme. Baujahr Wärmeerzeuger 1990\nKeller: ja\nBezugsfrei: sofort', 'Wir befinden uns hier in Alt-Charlottenburg, dem Ursprung des heutigen beliebten Ortsteils. Alles, was es zum Leben braucht, ist hier auf kurzem Weg zu erreichen. Zum Schloss Charlottenburg und seinem beliebten Park sind es ca. 1.000 Meter. Zahlreiche Museen liegen nur wenige Radminuten entfernt, zum Tiergarten und zum Lietzensee sind es mit dem Fahrrad nur wenige Minuten. Die Verkehrsanbindung ist ideal. Die U7-Haltestelle Richard-Wagner-Platz ist nur paar Minuten entfernt. Der S-Bahnhof Charlottenburg ist ebenfalls nur zwei Stationen mit der U7 entfernt.\nIn der Nähe befinden sich zwei Edekas und ein Rewe, das Rathaus sowie das Schloss Charlottenburg sind ebenfalls fußläufig erreichbar.', 'Ganz wichtig bei der Anfrage: Teilen Sie uns Ihre vollständigen Kontaktdaten: Vor- und Nachnamen, Adresse, Mail und Telefonnummer mit.\n\nSeit einigen Jahren gilt in Deutschland das Geldwäschegesetz. Nach diesem Gesetz ist jedes Immobilienbüro verpflichtet, bei Kontaktaufnahme die Identität des Kunden festzuhalten. \n\nDieses Kaufangebot ist provisionspflichtig. Dem Erwerber wird bei Abschluss eines Kaufvertrages eine Käuferprovision in Höhe von 7,14 % des beurkundeten Kaufpreises inkl. der gesetzlichen MwSt. berechnet. \n\nDie in diesem Exposé gemachten Angaben beruhen auf Auskünften des Eigentümers oder vorgelegten Plänen und Berechnungen. Wir übernehmen daher keine Haftung, für die hier gemachten Angaben, insbesondere für Flächenangaben, Grundrisse, Lageskizzen sowie wann was und wie im Hause renoviert und saniert wurde, da wir das nicht persönlich überwachen konnten. Dieses Angebot ist freibleibend, ein Zwischenverkauf bleibt vorbehalten.\n\nHinsichtlich weiterer Dienstleistungen in Zusammenhang mit dem Erwerb, wie Finanzierungen unterstützen wir Sie gerne. Es ist uns leider nicht gestattet, Sie zu steuerrelevanten Aspekten zu beraten. Hierzu wenden Sie sich bitte an Ihren Steuerberater. Wir stehen Ihnen gerne für Fragen zur Verfügung.'];ONE_YEAR_FREE;2,4 MBit/s;telekom_layer_magenta_m_hybrid2;über Hybrid;;WITH_HYBRID;disabled;MagentaZuhause M Hybrid (2);16 MBit/s;https://padlock.link/mmh2sa;https://padlock.link/mmhy2;;true;50 MBit/s;web,email,bank,music,dl-ul,game,sd,mltstr,hd;10 MBit/s;50 MBit/s
2020-05-11 12:31:44.198619;Berlin;central_heating;;97549;n;y;https://pictures.immobilienscout24.de/listings/b0988c08-8248-4161-b747-7d108c0c4645-1355917220.jpg/ORIG/resize/118x118%3E/extent/118x118/format/jpg/quality/80;8;11.73;;1907;11.73;116416047;;oil;n;false;y;Berlin;y;8;1;;3;energy_consumption;5.75;113;Berlin;12169;no_information;no_information;C;false;no_information;"Althoffstra&szlig;e";n;Althoffstraße;raised_ground_floor;12169;3.5;86.9;n;;2,active;Deutschland;top;wohnung_kauf;y;;true;001.97549;499000;profile0;4;3;true;n;showqualicontactform;n;n;Steglitz_Steglitz;Althoff3_5;5;Berlin;/expose/116416047;"['- Altbau Baujahr ca. 1907', '- Loggia\n- Bad mit Fenster\n- Hochparterre', 'Ruhige Seitenstraße nahe Althoffplatz. Der U- und S-Bahnhof Rathaus Steglitz sowie diverse Buslinien sind fußläufig erreichbar. Nur wenige hundert Meter entfernt befindet sich der Hermann-Ehlers-Platz mit einem Wochenmarkt, die Einkaufsmeile Schloßstraße mit diversen Einkaufszentren und Läden aller Art sowie das Schloßparktheater + zwei Kinos.  Im direkten Umfeld befinden sich u.a. das Gymnasium Steglitz, die neue Grundschule in der Plantagenstraße  und der Kindergarten ""Blumenstadt"".', 'Die monatliche Nettokaltmiete beträgt 624,50 €.\n\nEs besteht kein 10-jähriger Kündigungsschutz.']";ONE_YEAR_FREE;40 MBit/s;telekom_layer_magenta_l;über VDSL;;REGULAR;;MagentaZuhause L;100 MBit/s;https://padlock.link/ioml;https://padlock.link/ml;4;true;100 MBit/s;web,email,bank,music,dl-ul,game,sd,mltstr,hd,fast-ul-dl;;
2020-05-11 12:31:44.576143;Berlin;district_heating;true;858659;n;y;https://pictures.immobilienscout24.de/listings/47fa7c12-a9d3-40f6-920c-6fd565daf997-1363283530.jpg/ORIG/resize/118x118%3E/extent/118x118/format/jpg/quality/80;14;11.3;;1900;11.3;116417237;;no_information;y;false;y;Berlin;y;11;1;453;72;energy_required;5.73;152.19;Berlin;10625;no_information;no_information;;false;no_information;Leibnizstr.;y;Leibnizstr.;roof_storey;10625;3;85.3;n;2013;2,active;Deutschland;premium;wohnung_kauf;n;6;true;001.858659;1980000;profile0;6;3;true;n;showqualicontactform;n;n;Charlottenburg_Charlottenburg;LeibnizDG12;7;Berlin;/expose/116417237;['Zahlreicher Fassadenschmuck ziert diesen Gründerzeitaltbau der Jahrhundertwende. Horizontaler Bossenstuck, Balkone mit schmiedeeisernen Brüstungen und profilierte Holzfenster mit Sprossenaufteilung erschaffen ein abwechslungsreiches und dennoch harmonisches Fassadenbild. Über ein prachtvolles, säulenflankiertes Portal betreten Sie die Spiegelallee des Jugendstilfoyers. \rDie historischen und überaus erhaltenswerten Elemente wurden aufwendig aufgearbeitet. Dort, wo die historische Bausubstanz nicht zu erhalten war oder technische Notwendigkeiten es erforderten, wurde die alte Substanz durch rekonstruktive Elemente nach historischem Vorbild authentisch ersetzt. Gemeinsam mit Architekten und Baufachleuten wurde ein harmonisches Fassaden- und Farbkonzept entwickelt, das diesen Altbau von außen und innen wieder wie neu erscheinen lässt. \rZusätzlich zur optischen Präsentation des Gebäudes wurden vielfältige Maßnahmen auch zur technischen und werterhaltenden Erneuerung getroffen. Dieser Altbau vereint zeitlosen Altbaucharme mit zeitgemäßer Haustechnik.\rAuszüge aus der Baubeschreibung:\r\rÜberarbeitung von Fassaden und Fenstern nach historischem Vorbild\rneue Hofgestaltung\rneue Briefkasten-/Klingelanlage\rneue Schließanlage\rÜberarbeitung der Treppenhäuser, Wohnungstüren und der Hauseingangstür\rneuer Aufzug\rNeuinstallation von Kaltwasser- und Warmwasserleitungen aus Edelstahl/Kunststoff\rIsolierung der Warmwasserleitungen\rErneuerung der Abwasserleitungen\rHolzschutzgutachten und Maßnahmen (präventiv und reparativ)\rneue Heizungsstränge\rneue Elektroverteilung\rAbschluss der Sanierungsmaßnahmen am Gemeinschaftseigentum 2011', 'Wohnzimmer Kurfürstendamm: Da die Lebensqualität besonders eng mit dem Faktor Wohnlage verknüpft ist, lohnt es sich, bei diesem Objektstandort etwas genauer hinzusehen: An diesem Mikrostandort im Herzen der City-West stehen Ihnen weit mehr als die so oft und lieblos beschriebenen „Möglichkeiten des täglichen Bedarfs“ in unmittelbarer Umgebung zur Auswahl.  Schließlich wollen Sie nicht nur Ihren Bedarf decken, sondern das Leben in vollen Zügen genießen. Entlang des Boulevards Kurfürstendamm in Richtung Osten entdecken Sie die ganze Vielfalt der Metropole von den Flagshipstores aller bedeutenden, internationalen Modelabels bis Kultur und Genuss. Und in Richtung Westen gelangen Sie nach nur 2,9 km in den Bezirk Grunewald. Die Auswahl an Restaurants in der unmittelbaren Umgebung ist gigantisch. Beinahe alle Geschmacksrichtungen der internationalen Küche sind vertreten. Ob asiatisch, spanisch, japanisch, italienisch, deftig oder exotisch: hier treffen Sie auf gastronomische Einrichtungen der Spitzenklasse von urig gemütlich bis kultig und von modern bis mondän.', 'Qualität bis ins Detail. Der Einsatz der verbauten Materialien und die fachliche Umsetzung der Um- und Neubaumaßnahmen weisen in dieser Wohnung einen sehr hohen Standard aus, der auch den höchsten Ansprüchen an modernen Wohnkomfort gerecht wird und diese sogar übertrifft. Alle Wohnräume und die Küche sind mit massiven, alten belgischen Landhausdielen ausgestattet. In den beiden großen Bädern und im Hauswirtschaftsraum wurden großformatige graue Fliesen verlegt. Neue Isolierglasfenster, glatt gespachtelte  Wände, eine sehr hochwertige, durchdachte Elektroinstallation, eine Gaggenau Einbauküche mit Kochinsel sind weitere Belege für den hohen Ausstattungsstandard dieser Dachwohnung.\rDarüber hinaus punktet diese Wohnung mit einem Kamin, einer Sauna und einer 10 m² großen Panorama-Terrasse sowie vielen kleinen Finessen wie z.B. einen in den Badspiegel integrierten Fernseher, Einbauschränken, freigelegten Deckenbalken, geschmackvollen Heizkörperverkleidungen, einem festinstallierten Kohlensäurebereiter in der Küche und einem Ankleidezimmer mit Einbauschränken.\rNutzeroptimierte Grundrisse, gut dimensionierte Raumgrößen, 2 Schlafzimmer und 2 Vollbäder und 2 Terrassen mit West- und Ostausrichtung machen diese Wohnung denkbar für die unterschiedlichsten Nutzungskonzepte.\rStilvolle Objekte von namhaften Markenherstellern, Edelstahlarmaturen, Feinsteinzeugfliesen und Handtuchheizkörper prägen die stilsicheren Bäder in diesem Objekt.\rSämtliche Installationsleitungen für Sanitär, Heizung, Elektro und Telekommunikation wurden komplett erneuert.\rDiverse getroffene Maßnahmen zur energetischen Verbesserung an dem Gebäude, Fenstern und der Heizungsanlage tragen zur Verbesserung  der Energiebilanz und der Verbrauchswerte bei (siehe Energieausweis).\rDie Wohnung verfügt über einen Keller und ist mit einem Aufzug erschlossen.\rDie in dieser Präsentation abgebildeten Fotos sind aktuelle Originalaufnahmen.\r\rAusstattung:\rneue Leitungen (Kalt- und Warmwasser, Abwasser)\rneue Elektroverteilung\rneue Heizungsverteilung\rHeizkörperverkleidung (Holz)\rHolzkassettentüren (neu)\rAlte belgische Landhausdielen (Eiche)\rglatt gespachtelte Wände\rneue Bäder mit Premium-Objekten\rSauna\rKamin\rneue Fenster\rGaggenau-Einbauküche mit Kochinsel\rintegrierter Kohlensäureaufbereiter (Grohe blue)\r2 Schlafzimmer\r1 Ankleidezimmer mit Einbauschränken\r2 Vollbäder\rHauswirtschaftsraum\r10 m² Hofterrasse (Ostausrichtung)\r4 m² Straßenterrasse (Westausrichtung)\rPremium Schaltersystem\rSONOS Soundsystem\rBodentank (Wohnzimmer)\renergetisch optimierte Bauweise\rAufzug\rKeller\rFernwärme\rsaniertes Gemeinschaftseigentum (2011)\rBaujahr  Wohnung 2012/20'];ONE_YEAR_FREE;40 MBit/s;telekom_layer_magenta_l;über VDSL;;REGULAR;disabled;MagentaZuhause L;100 MBit/s;https://padlock.link/ioml;https://padlock.link/ml;1;true;100 MBit/s;web,email,bank,music,dl-ul,game,sd,mltstr,hd,fast-ul-dl;;
2020-05-11 12:31:44.905652;Berlin;floor_heating;;1011756;y;y;https://pictures.immobilienscout24.de/listings/a57f9caf-7a49-4290-bd87-5c4a30054bdf-1360666607.jpg/ORIG/resize/118x118%3E/extent/118x118/format/jpg/quality/80;16;12.19;;2019;12.19;116424433;2;district_heating;n;false;y;Berlin;y;11;9;453;no_information;energy_required;7.48;126;Berlin;10785;mint_condition;no_information;B;false;garage;no_information;n;no_information;penthouse;10785;3;66;n;;2,active;Deutschland;top;wohnung_kauf;n;5;true;001.1011756;1195000;profile0;5;3;true;n;showqualicontactform;n;n;Kreuzberg_Kreuzberg;I-00TCBH-W-02HVVU;6;Berlin;/expose/116424433;['Der « Gleis Park » wurde von der Bauwens Unternehmensgruppe konstruiert und gebaut. Das Architekturbüro KSP Jürgen Engel erstellte den modernen Gebäudekomplex und steht mit diesem ihren weiteren Projekten, wie dem Upper West oder dem HumboldtHafenEins, in nichts nach. Das hier angebotene Penthouse besticht durch eine hochwertige Ausstattung wie Fußbodenheizung, Echtholzparkett und einer Deckenhöhe mit bis zu ca. 2,80 m. Beim Betreten gelangen Sie zunächst in die Diele, welche Sie geradezu in den lichtdurchfluteten Wohnbereich führt. Bevor Sie in diesen weiter eintreten begegnet Ihnen auf Ihrer Rechten der Küchenbereich. Vom Wohnbereich aus erreichen Sie über den Flur zwei weitere Schlaf- oder Arbeitszimmer, ein Duschbad, ein Gäste-WC sowie einen Hauswirtschaftsraum. Über eine Treppe gelangen Sie zu einem Abstellraum sowie auf die Aufdachterrasse, von welcher Sie einen wunderbaren Blick genießen können. \r\n\r\nAusstattung:\r\n\r\n● Deckenhöhe bis zu ca. 2,80 m\r\n● Klimaanlage\r\n● Fußbodenheizung\r\n● Echtholzparkett\r\n● Aufdachterrasse mit Westausrichtung und Panoramablick\r\n● Balkon mit Westausrichtung\r\n● Ausstattung namhafter Hersteller (Keramag, Hansgrohe,\r\n  Gira, Hoppe, Bauwerk)\r\n● Sonnenschutzverglasung auf der Westfassade\r\n● großzügiges Entrée & repräsentativ gestaltetes\r\n  Treppenhaus\r\n● Abstellraum, HWR sowie Keller\r\n● zwei Tiefgaragenstellplätze (Comfort) zzgl. je 45.000 €\r\n● liebevoll gestaltete Landschafts- und Außenanlagen\r\n● vss. Fertigstellung Gesamtkomplex: Q1-2020', 'Abstellkammer\nunverbaut\nParkett\nZentralheizung\nVollunterkellert', 'Eine hervorragende Komposition einer ruhigen, naturnahen und dennoch zentralen Lage. Die liebevolle Landschafts- und Außenplanung lässt den Gleis Park mit der Umgebung verwachsen und ein Park-Gefühl entstehen.\r\nIn direkter Nähe des Gleis Parks befinden sich mehrere Grundschulen, Spielplätze und weitere Grünanlagen, wie z. B. der Mendelssohn-Bartholdy-Park oder der 2013 neu eröffnete Park am Gleisdreieck, welcher eine Vielfalt an Nutzungsmöglichkeiten bietet. Der belebte Potsdamer Platz ist innerhalb einer U-Bahnstation oder eines 10-minütigen Fußweges zu erreichen. Das vielseitige Angebot an guten Restaurants, charmanten Cafés, schönen Läden und Galerien schafft eine lebendige und urbane Atmosphäre.', 'Die Courtage in Höhe von 7,14 % inkl. der gesetzlichen Mehrwertsteuer auf den Kaufpreis ist mit dem Zustandekommen des Kaufvertrages (notarieller Vertragsabschluss) verdient und fällig. Die vermittelnde und/oder nachweisende Engel & Völkers Berlin Mitte GmbH (Lizenznehmer der Engel & Völkers Residential GmbH ) und ggf. deren Beauftragter, erhalten einen unmittelbaren Zahlungsanspruch gegenüber dem Käufer (Vertrag zugunsten Dritter, § 328 BGB).\r\nHinweise: \r\nAlle Angaben sind ohne Gewähr und basieren ausschließlich auf Informationen, die uns von unserem Auftraggeber übermittelt wurden. Wir übernehmen keine Gewähr für die Vollständigkeit, Richtigkeit und Aktualität dieser Angaben. Zwischenvermietung bleibt vorbehalten. Sollte das von uns nachgewiesene Objekt bereits bekannt sein, teilen Sie uns dieses bitte unverzüglich mit. Die Weitergabe dieses Exposés an Dritte ohne unsere Zustimmung löst gegebenenfalls Courtage- bzw. Schadensersatzansprüche aus. Im übrigen gelten die allgemeinen Geschäftsbedingungen für die Rechtsbeziehung zwischen Ihnen und Engel & Völkers Büro Berlin Mitte GmbH. Wir stehen Ihnen mit weiteren Informationen zum Objekt und zum Eigentümer sowie für Besichtigungen gern zur Verfügung.'];ONE_YEAR_FREE;40 MBit/s;telekom_layer_magenta_l;über Glasfaser;;REGULAR;;MagentaZuhause L;100 MBit/s;https://padlock.link/ioml;https://padlock.link/ml;;true;100 MBit/s;web,email,bank,music,dl-ul,game,sd,mltstr,hd,fast-ul-dl;;
2020-05-11 12:31:45.263515;Berlin;central_heating;;16936458;n;n;https://pictures.immobilienscout24.de/listings/7f28c94d-5c03-44fe-9fb3-aba1f66973e0-1366741182.jpg/ORIG/resize/118x118%3E/extent/118x118/format/jpg/quality/80;13;8.81;;1900;8.81;116418234;;;y;false;y;Berlin;y;7;1;318;28;energy_consumption;3.97;82.37;Berlin;12587;modernized;sophisticated;D;false;no_information;"Bruno-Wille-Stra&szlig;e";n;Bruno-Wille-Straße;apartment;12587;3;105;n;1995;2,active;Deutschland;top;wohnung_kauf;n;2;true;009.db1e3be7-077e-467d-acff-ceca0098b947;398500;profile0;4;3;true;n;showqualicontactform;n;n;Friedrichshagen_Köpenick;116418234;4;Berlin;/expose/116418234;['Die helle 3-Zimmer-Wohnung mit einer Wohnfläche von ca. 82,37 m², befindet sich im 2. Obergeschoss eines wunderschönen Gebäudes aus dem Jahre 1900. \n\nEine grundlegende Sanierung des Hauses mit Erneuerung der kompletten Haustechnik, des Daches, der Fassade sowie der Fenster erfolgte im Jahr 1995.\n\nDie lichtdurchflutete Wohnung mit ihrer Ost-West-Ausrichtung besticht durch den großzügigen Wohnraum mit offener Küche und einem herrlichen Wintergarten. Von hier genießen Sie einen wunderbaren Blick über die Nachbarschaft. Die offene und gut ausgestattete Küche verfügt mit ihrem großen Fenster ebenfalls über einen großartigen Ausblick. \nDas ausgerichtete Esszimmer mit Westausrichtung bietet viele individuelle Gestaltungsmöglichkeiten, sei es als zweites Schlafzimmer oder auch als Kinder-/Arbeitszimmer. \nDas ca. 18 m² große Schlafzimmer bietet genügend Platz für ein Doppelbett und Schrankwand. \nHohe Ansprüche werden auch im liebevoll und modern sanierten Bad mit Badewanne erfüllt.\n\nDie Wohnung ist mit hochwertigem Fischgrät Parkettboden und Fliesen ausgestattet, welche der Wohnung ihren imposanten Charme verleihen. Die Außenjalousien im Schlaf- und Esszimmer, Fensterbänke aus Marmor, hochwertiges Eichenparkett mit 1,9 cm Stärke, ein geräumiger Keller und die Möglichkeit der Übernahme eines gemieteten Stellplatzes runden dieses attraktive Angebot ab. \n\nAls Besonderheit besteht die Möglichkeit eine Gewerbeeinheit im Souterrain, die zurzeit als Wohnküche genutzt wird, zu erwerben. Diese Einheit hat eine Größe von ca. 45,65 m² und einen Kaufpreis von € 98.000,- zzgl. Courtage', 'Die Bruno-Wille-Straße liegt im überaus beliebten Friedrichshagen, einem Ortsteil von Berlin-Köpenick. \n\nDie einstige Villenkolonie mit ihren vielen herrschaftlichen Altbauten ist heute auch als „Künstlerdorf“ bekannt. Neben zahlreichen Ateliers und Galerien lassen sich im Sommer auch Konzerte und Filme im nahe gelegenen Naturtheater im Kurpark genießen. \nEbenfalls fußläufig erreichen Sie die Flaniermeile und Einkaufsstraße „Bölschestraße“. Hier finden sich hervorragende Einkaufsmöglichkeiten sowie tolle Cafés und Restaurants. \n\nMit seinen insgesamt sechs Schulen im gesamten Ortsteil und über 10 Kindergärten in direkter Umgebung ist auch für die Betreuung und Bildung der Kleinen gesorgt.\n \nDank der zentralen aber ruhigen Lage erreichen Sie bequem mit dem Bus, der Tram oder der S-Bahn all Ihre Ziele in und um Berlin in kürzester Zeit. Auch mit dem Auto sind Sie hier gut angebunden.\n\nDer nahe Müggelsee mit seinen angrenzenden Wäldern bietet beste Voraussetzungen für schöne Stunden und Erholung in freier Natur. Genießen Sie die freie Zeit doch im Strandbad, bei einem Bootsausflug oder bei einem ausgiebigen Spaziergang an der frischen Luft.\n\nHier vereinen sich eine ruhige und naturnahe Wohnlage harmonisch mit dem lebendigen und interessanten Treiben in der nahe gelegenen Flaniermeile.', 'Alle Angaben sind ohne Gewähr und basieren ausschließlich auf Informationen, die uns von unserem Auftraggeber übermittelt wurden. \nWir übernehmen keine Gewähr für die Vollständigkeit, Richtigkeit und Aktualität dieser Angaben.\n\n\nSollte das von uns nachgewiesene Objekt bereits bekannt sein, teilen Sie uns dieses bitte unverzüglich mit.'];ONE_YEAR_FREE;40 MBit/s;telekom_layer_magenta_l;über VDSL;;REGULAR;disabled;MagentaZuhause L;100 MBit/s;https://padlock.link/ioml;https://padlock.link/ml;;true;100 MBit/s;web,email,bank,music,dl-ul,game,sd,mltstr,hd,fast-ul-dl;;
2020-05-11 12:31:45.595848;Berlin;district_heating;;174667;n;n;https://pictures.immobilienscout24.de/listings/137154d5-6ef1-423a-84ce-42b4ac320e69-1356067237.jpg/ORIG/resize/118x118%3E/extent/118x118/format/jpg/quality/80;2;10.62;;1900;10.62;116422541;;natural_gas_heavy;n;false;y;Berlin;y;5;1;225.64;no_information;energy_consumption;5.96;83.36;Berlin;13187;no_information;no_information;;false;no_information;no_information;n;no_information;apartment;13187;3;208;n;;2,active;Deutschland;standard;wohnung_kauf;y;2;true;001.174667;210000;profile0;;3;true;n;showqualicontactform;n;n;Pankow_Pankow;17055108;4;Berlin;/expose/116422541;['Im Jahr 1900 erbaut, beherbergt dieser charmante Altbau heute 18 Wohn- und Gewerbeeinheiten. 1996/1997 wurde das gesamte Objekt kernsaniert inkl. eines Ausbau des Dachgeschosses. Die angebotene Wohnung bietet 3 Zimmer verteilt auf ca. 83 m² Wohnfläche mit einer funktionalen Raumaufteilung. In der Küche ist Platz für eine Küchenzeile und einen kleinen Esstisch. Das Bad ist in klassischem Weiß gefliest und verfügt über eine Wanne und ein großes Fenster. \r\n\r\nDie Wohnung ist derzeit vermietet und erzielt monatliche Mieteinnahmen in Höhe von 620,00 Euro warm. Für den Eingentümer wird ein Wohngeld in Höhe von 225,64 Euro monatlich fällig. Somit ist die Immobilie eine attraktive Geldanlage.', 'Der Bezirk Pankow bietet bevorzugte Wohnlagen mit charmantem Ambiente. Die Mischung aus Villenvierteln, Gründerzeithäusern und dem mittelalterlichen Dorfkern verleihen Pankow einen Flair, dem man sich nicht entziehen kann. Zahlreiche Sport- und Freizeiteinrichtungen, Restaurants und Parks machen das Leben in Pankow attraktiv. Die Busse der Linien 150 und 250 sind fußläufig schnell zu erreichen und mit der Straßenbahnlinie M1 ist der Hackeschen Markt nur wenige Minuten entfernt. Mit dem Auto gelangen Sie in ca. 5 Minuten auf den Stadtring. Sämtliche Versorgungseinrichtungen des täglichen Bedarfs sind ebenfalls fußläufig zu erreichen. Die meisten im 3 Minuten entfernten Rathaus-Center Pankow.'];ONE_YEAR_FREE;40 MBit/s;telekom_layer_magenta_l;über VDSL;;REGULAR;;MagentaZuhause L;100 MBit/s;https://padlock.link/ioml;https://padlock.link/ml;;true;100 MBit/s;web,email,bank,music,dl-ul,game,sd,mltstr,hd,fast-ul-dl;;
