2020-05-11 12:33:30.706040;Berlin;central_heating;ONE_YEAR_FREE;16225148;n;n;https://pictures.immobilienscout24.de/listings/d3a7b6b1-784e-469d-9141-8f34d121caf4-1356736595.jpg/ORIG/resize/118x118%3E/extent/118x118/format/jpg/quality/80;7;7.89;40 MBit/s;telekom_layer_magenta_l;über VDSL;1975;REGULAR;disabled;7.89;116127620;oil;n;false;MagentaZuhause L;y;Berlin;n;3;3;76;no_information;energy_consumption;3.38;37;Berlin;10711;no_information;no_information;F;false;100 MBit/s;no_information;no_information;y;https://padlock.link/ioml;https://padlock.link/ml;no_information;apartment;10711;1;177;n;2,active;true;Deutschland;standard;100 MBit/s;wohnung_kauf;n;6;web,email,bank,music,dl-ul,game,sd,mltstr,hd,fast-ul-dl;true;001.15930480;149999;profile0;6;1;true;n;showqualicontactform;n;n;Grunewald_Wilmersdorf;768;1;Berlin;/expose/116127620;['Bei der hier angebotenen Wohnung handelt es sich um eine gemütliches, helles ein Zimmer  Apartement, in der 6. Etage, in einer zentraler Lage, unmittelbar am Kurfürstendamm.\n\nAngrenzend an den Flur im Eingangsbereich befindet sich das Badezimmer des Apartments, die Küche erreichen Sie vom Wohnraum aus. Des Weiteren verfügt die Wohnung über einen Südost Balkon, von dem Sie einen Blick über den Westen Berlins haben.\nDas Mikroapartment ist mit Laminat ausgestattet und verfügt über eine Einbauküche. Die derzeitigen Mieter dieser Wohnung verfügen über einen unbefristeten Mietvertrag.\nDie Größe und der Grundriss sind ideal für einen Single und/oder Pendler, die ein Standbein in Berlin besitzen wollen.', '\nDiese interessante Wohnung liegt perfekt zwischen zwei Ortsteilen, nämlich Grunewald und dem beliebten Wilmersdorf. Wilmersdorf ist einer der beliebtesten, gewachsenen Stadtteile des alten Westberlins. Der in zentraler Lage gelegene Halenseebezirk gehört dank seiner guten Verkehrsanbindung und der perfekten Infrastruktur zu den begehrtesten Wohngebieten der City West. Der Bezirk Grunewald bietet mit seinem vielfältigem Angebot für Freizeit und Erholung den perfekten Kontrast zum bunten Vergnügungsangebot am Kurfürstendamm. Der beliebte Kurfürstendamm ist direkt fußläufig zu erreichen. Er lädt mit seinem vielfältigen Angebot an Boutiquen, Cafés und Restaurants zum bummeln ein. Supermärkte und Einkaufsmöglichkeiten für den täglichen Bedarf finden sich in unmittelbarer Nähe. Der S-Bahnhof Halensee, der U-Bahnhof Adenauer Platz und zahlreiche Buslinien am Kurfürstendamm oder an der Westfälischen Straße bieten eine hervorragende Anbindung an andere Teile Berlins. Die Flughäfen Tegel und Schönefeld sind in zwanzig Minuten zu erreichen und die Anbindung an die Stadtautobahn ist nur wenige Meter entfernt.'];;;;;
2020-05-11 12:33:31.133429;Berlin;central_heating;ONE_YEAR_FREE;213082;n;y;https://pictures.immobilienscout24.de/listings/40bfa3f7-632b-4ab4-84d1-4b12915a2efa-1354132869.jpg/ORIG/resize/118x118%3E/extent/118x118/format/jpg/quality/80;6;12.78;40 MBit/s;telekom_layer_magenta_l;über VDSL;1900;REGULAR;;12.78;116141793;district_heating;n;false;MagentaZuhause L;n;Berlin;n;7;1;465.34;no_information;energy_consumption;7.25;102.3;Berlin;10559;well_kept;normal;;false;100 MBit/s;no_information;no_information;n;https://padlock.link/ioml;https://padlock.link/ml;no_information;apartment;10559;3;69.8;n;2,active;true;Deutschland;standard;100 MBit/s;wohnung_kauf;y;4;web,email,bank,music,dl-ul,game,sd,mltstr,hd,fast-ul-dl;true;001.213082;373995;profile0;5;3;true;n;;n;n;Tiergarten_Tiergarten;rwi7594;5;Berlin;/expose/116141793;['Das Haus ist ein prächtiger, gepflegter Jugendstilaltbau aus dem Jahre 1900. Es besitzt 5 Geschosse und besteht aus einem Vorderhaus, Seitenflügel und Quergebäude.', 'Diese Maisonette-Wohnung befindet sich im Vorderhaus, und erstreckt sich über das 4. OG und das Dachgeschoss darüber. \r\rIm 4. OG befindet sich ein Zimmer mit Balkon zur Straße, ein weiteres Zimmer mit Blick auf den Hinterhof und ein Bad mit Fenster. Über die innenliegende Wendeltreppe erreicht man das Dachgeschoss. Hier befindet sich ein weiteres Zimmer mit Atrium, die Küche mit Fenster und auch ein Gäste-WC.\r\rWie Wohnung ist seit 2011 vermietet, und wird daher als Kapitalanlage angeboten. Weitere Details gerne auf Anfrage. ', 'Berlin-Tiergarten - In einer ruhigen Seitenstraße liegt dieses schöne Objekt. Dieser Bereich ist bekannt für seine Gründerzeitbauten. In diesem Gebiet gibt es bestimmten Milieuschutz, sodass dieser Anblick auch noch lange erhalten bleibt. Die Anbindungen sind gut. Auf der Perlebergerstraße fährt ein Bus und die nächste U-Bahn ist die Station Birkenstraße oder Turmstraße. Der Fritz-Schloß-Park lädt zum spazieren gehen ein. Von hier aus kommt man schnell ins Zentrum Berlins, sowie zur Universität und auch zur Autobahn.', 'Der Erwerb dieser Wohnung ist für den Käufer provisionsfrei. Alle Angaben sind ohne Gewähr und nach den Unterlagen des Eigentümers erstellt. Irrtümer und Änderungen vorbehalten. Bei aller Sorgfalt können wir keine Garantie dafür übernehmen, dass alle Angaben richtig sind, und das Objekt im Augenblick des Zugangs der Offerte noch verfügbar ist. \r\rBei Anfragen bitten wir um vollständige Absenderangaben. \r\rGerne zeigen wir Ihnen das Objekt, und freuen uns auf einen persönlichen Termin mit Ihnen. \r\rSie erreichen uns wie folgt:\rRüdiger Wilkanowski Immobilien\rin Kooperation mit:\r\rRoman Seidl Immobilien\rTelefon: 0173 / 2187927\rFax: 030 / 85605613\r\rGerne zeigen wir Ihnen das Objekt, und freuen uns auf einen persönlichen Termin mit Ihnen. \r\rWeitere interessante Angebote finden Sie auch im Internet unter www.wilkanowski-immobilien.de.\r\rSie wollen Ihre Immobilie verkaufen ?\r \rWir suchen im Stadtgebiet von Berlin Immobilien (freie Eigentumswohnungen, Mehrfamilienhäuser und Einfamilienhäuser). Sprechen sie uns gerne an oder vereinbaren Sie einen persönlichen Termin mit uns: 030-85605612.'];2001;;;;
2020-05-11 12:33:31.582034;Berlin;district_heating;ONE_YEAR_FREE;17228770;n;n;https://pictures.immobilienscout24.de/listings/960469d7-4268-418b-af63-75d1008dc136-1354106302.jpg/ORIG/resize/118x118%3E/extent/118x118/format/jpg/quality/80;4;11.37;40 MBit/s;telekom_layer_magenta_l;über VDSL;1965;REGULAR;disabled;11.37;116139665;no_information;y;false;MagentaZuhause L;y;Berlin;n;5;2;114;no_information;energy_consumption;5.8;45;Berlin;10777;mint_condition;no_information;;false;100 MBit/s;no_information;no_information;y;https://padlock.link/ioml;https://padlock.link/ml;no_information;apartment;10777;1;98.21;n;2,active;true;Deutschland;standard;100 MBit/s;wohnung_kauf;n;1;web,email,bank,music,dl-ul,game,sd,mltstr,hd,fast-ul-dl;true;002.01007994385;230000;profile0;7;1;true;n;;n;n;Wilmersdorf_Wilmersdorf;#01105;2;Berlin;/expose/116139665;"['Die Ausstattung Ihrer Wohnung lässt nahezu keinen Wunsch offen und weist u.a. folgende Ausstattungsmerkmale auf:\n\n+ hochwertig sanierte Wohnung\n+ Südwest Ausrichtung \n+ lichtdurchflutet \n+ Saniertes Badezimmer mit bodentiefer Dusche, Handtuchhalterheizung, Waschmachinenstellplatz und modernen fliesen\n+ Voll ausgestattete Marken Küche inkl. Elektrogeräte\n+ großzügiger Wohnbereich  \n+ praktische Garderobennische \n+ Fußbodenheizung \n+ Parkett\n+ Wohnung wird möbliert verkauft\n+ Spots im Eingangsbereich\n+ offene Raumaufteilung\n+ verspachtelte Wände\n+ ISO-Kunststofffenster\n+ Fahrradkeller', ""Zentral zwischen dem pulsierenden Ku'damm und dem ruhigen Wilmersdorf befindet sich die Wohnung. Innerhalb weniger Gehminuten haben sie die Möglichkeit entlang der Weltberühmt Flaniermeile zu schlendern und Einzukaufen. Geht man in die andere Richtung, erreicht man in kürzester Zeit den Viktoria Luise Platz, an den man entspannt seinen Tag genießen kann, und in einem der vielen cafés oder Restaurants sich gut gehen zu lassen. Durch die Zentrale Lage der Wohnung erreicht man ganz Berlin in kürzester Zeit, opfert aber nicht seine Ruhe. Viele weitere prächtige Plätze sind gleich um die Ecke, darunter der Winterfeldplatz, der Bayrische Platz und der Nollendorfplatz.\nUnweit von der Wohnung befindet sich der U-Bhf Spichernstraße, von den sie mit der U2, U3 und U9 nach ganz Berlin kommen. \nDiverse Einkaufsmöglichkeiten sind in der Umgebung. An freien Tagen besteht die Möglichkeit, den nahe gelegenen Ku’damm oder das berühmte KaDeWe zu besuchen. Unzählige Freizeit Aktivitäten stehen Ihnen hier in der Gegend zur verfügung. Es gibt unter Anderem Sportplätze, Kinos, Museen, unzählige Restaurants und cafés, Parks, und mehrere Theater in Ihrer Nähe."", 'Alle Angaben stammen vom Verkäufer. Wir übernehmen hierfür keine Haftung.\n\nIhren Besichtigungstermin können Sie selbstverständlich individuell nach Ihren Wünschen mit uns vereinbaren. Zur Beantwortung Ihrer Fragen können Sie uns jederzeit kontaktieren.\n\nSie möchten Ihre Immobilie verkaufen?\n\nWir stehen Ihnen gerne bei allen Fragen und Anliegen beratend beiseite und treten dafür ein, dass vor allem\nSie profitieren. Nutzen Sie die positive Marktlage und unser geschultes Team, um den Höchstpreis zu erzielen. Gerne unterstützen wir Sie bei all Ihren Fragen und Anliegen rund um Ihre Immobilie. Ganz individuell gehen wir auf Ihre persönlichen Bedürfnisse ein, um Ihnen eine ehrliche und kompetente Beratung zu gewährleisten, denn Ihre Zufriedenheit ist unser Ziel.\n\nIhr IMMODO-Team']";;;;;
2020-05-11 12:33:31.900174;Berlin;floor_heating;ONE_YEAR_FREE;15474925;n;y;https://pictures.immobilienscout24.de/listings/ddd12100-5bce-45f8-b973-ea5d308dd0f4-1354112090.png/ORIG/resize/118x118%3E/extent/118x118/format/jpg/quality/80;20;11.3;40 MBit/s;telekom_layer_magenta_l;über VDSL;2005;REGULAR;;11.3;116140254;gas;y;false;MagentaZuhause L;y;Berlin;y;11;6;719.94;no_information;energy_consumption;5.73;197.93;Berlin;14055;no_information;no_information;C;false;100 MBit/s;garage;no_information;y;https://padlock.link/ioml;https://padlock.link/ml;no_information;no_information;14055;4;78;n;2,active;true;Deutschland;top;100 MBit/s;wohnung_kauf;n;1;web,email,bank,music,dl-ul,game,sd,mltstr,hd,fast-ul-dl;true;001.15417560;1290000;profile0;2;4;true;n;;n;n;Charlottenburg_Charlottenburg;VK-19321_i;7;Berlin;/expose/116140254;['Eine Traumwohnung.  \n\nDas architektonisch sehr ansprechende Mehrfamilienhaus befindet sich auf einem schönen, etwas höher gelegten Grundstück und besteht aus vier Wohneinheiten, vier Garagen, sowie ausreichend Hobby- und Abstellräumen.\n\nDie 4- bis 5-Zimmer-Wohnung verteilt sich auf ca. 198m² im ersten Obergeschoss sowie dem Dachgeschoss und ist bequem mit einem gläsernen Fahrstuhl zu erreichen. \n\nDurch hohe Decken, bodentiefe Fenster sowie eine sehr durchdachte Grundrissgestaltung wurde ein großzügiges Wohngefühl geschaffen, welches ein hohes Maß an Wohnqualität bietet und lichtdurchflutete Wohnbereiche ermöglicht.\n\nIm ersten Obergeschoss gelangt man durch das Entrée in den großen Wohn-/Essbereich mit offener Küche.  Die voll ausgestattete und hochwertige Einbauküche mit Markeneinbaugeräte ist großartig geplant und lässt keine Wünsche offen. Der Wohn-/Essbereich bietet genügend Raum für einen Essbereich, einen etwas separierten Wohnbereich und direkten Zugang zum sonnigen Balkon. \n\nWeiterhin befinden sich auf dieser Ebene ein geräumiges Schlafzimmer, ein modernes Badezimmer en-suite mit einer Badewanne und begehbaren Dusche sowie ein Ankleideraum.  Ein separates WC bzw. Gäste-WC steht ebenfalls zur Verfügung.\n\nEine modere Holztreppe verbindet die untere Ebene mit der oberen Ebene, wo sich der sogenannte  „Chillroom“ befindet. Dieser hat eine Wohnfläche von ca. 52 m² und direkten Zugang zu einer traumhaften Loggia, welche sich über die gesamte Länge des Raumes erstreckt.  Ein Abstellraum, ein praktischer Stauraum und ein Duschbad befinden sich ebenfalls auf dieser Ebene.\n\nDie komplette Wohnung ist mit edlem Parkett ausgelegt und die Bäder sind geschmackvoll gefliest. Elektrische Rolläden und eine Fußbodenheizung vollenden die Ausstattung.\n\nEin einzigartiges Angebot:  Modern, großzügig, komfortabel, hochwertig ausgestattet und einfach praktisch geplant.', 'Westend ist ein begehrter Berliner Ortsteil im Bezirk Charlottenburg-Wilmersdorf, wurde einst als Villenkolonie geplant und ist nur ca. 200m vom Grunewald entfernt.  Eine Berliner Bestlage.  Im Grünen und doch zentral!\n\nGanz in der Nähe des Grunewalds gelegen, ist zudem der Kurfürstendamm nicht weit entfernt. Das Olympiastadion, zwei Krankenhäuser, renommierte Schulen, Sportzentren und -vereine, der International Club Berlin und auch der Teufelsberg liegen in unmittelbarer Umgebung. \n\nAuf der nahe gelegenen Reichsstraße bieten viele kleine Geschäfte, Cafes und Restaurants Einkaufsmöglichkeiten und Ausgehmöglichkeiten.\n\nMit dem PKW sind die Autobahn und die Bundesstraßen  schnell erreicht, und auch mit den öffentlichen Verkehrsmitteln ist per Bus, U- und S-Bahn eine sehr gute Anbindung gegeben.  Der Flughafen Berlin-Tegel, der Flughafen Berlin-Schönefeld, die Hauptbahnhöfe Bahnhof Zoo oder Spandau sowie auch Potsdam sind somit gut erreichbar.'];;;;33.8;1
2020-05-11 12:33:32.199877;Berlin;central_heating;;14544073;n;y;https://pictures.immobilienscout24.de/listings/dc9d92ec-0175-483c-89d8-12b575fec0e1-1354105250.jpg/ORIG/resize/118x118%3E/extent/118x118/format/jpg/quality/80;1;11.37;;;;2010;;;11.37;116139301;district_heating;y;false;;y;Berlin;y;10;7;;.;energy_required;5.8;95.38;Berlin;10707;fully_renovated;luxury;;false;;underground_garage;"Konstanzer Stra&szlig;e";y;;;Konstanzer_Straße;apartment;10707;3;62.5;n;2,active;;Deutschland;standard;;wohnung_kauf;n;1;;;002.01000690340;857500;profile0;;3;true;n;showqualicontactform;n;n;Wilmersdorf_Wilmersdorf;391+;4;Berlin;/expose/116139301;['Das Wohnhaus befindet sich nahe der Zähringerstraße.\n\nDie Wohnung ist im Vorderhaus 1. Obergeschoss.\n\nDiverse Einkaufsmöglichkeiten sind vorhanden.', '- offene Einbauküche\n- Parkett\n- Wannen- und Duschbad\n- Gäste-WC\n- Balkon\n- Kellerraum', '- ca. 5 Minuten mit dem PKW zum Kurfürstendamm\n\n- der U-Bahnhof Konstanzer Straße ist in ca. 10 Gehminuten erreichbar'];;;;;1
2020-05-11 12:33:32.562069;Berlin;;ONE_YEAR_FREE;18052783;n;y;https://pictures.immobilienscout24.de/listings/2e2cb6a7-447f-4472-a272-df3f9d0ea854-1355291413.jpg/ORIG/resize/118x118%3E/extent/118x118/format/jpg/quality/80;8;12.24;40 MBit/s;telekom_layer_magenta_l;über VDSL;1901;REGULAR;;12.24;116142968;no_information;n;false;MagentaZuhause L;n;Berlin;n;5;1;123.66;76;energy_required;6.53;52.93;Berlin;12159;no_information;no_information;;false;100 MBit/s;no_information;"Fregestra&szlig;e";n;https://padlock.link/ioml;https://padlock.link/ml;Fregestraße;apartment;12159;2;133;n;2,active;true;Deutschland;top;100 MBit/s;wohnung_kauf;y;1;web,email,bank,music,dl-ul,game,sd,mltstr,hd,fast-ul-dl;true;002.01008679649;236000;profile0;5;2;true;n;showqualicontactform;n;n;Schöneberg_Schöneberg;499028;2;Berlin;/expose/116142968;"['Der herrschaftliche Altbau FREGE 76 umfasst insgesamt 20 Wohneinheiten. Diese setzen sich aus 2-, 4- und 5-Zimmer-Wohnungen zusammen und verteilen sich auf das Vorder- und Gartenhaus. Die Wohnungen verfügen zum Großteil über einen Balkon oder eine Terrasse. Die Lage des Wohnhauses und der Schnitt der Wohnungen machen das FREGE 76 zu einem idealen Heim für Singles, Paare und Familien.', 'Die Fregestraße in begehrter Wohnlage in Berlin-Friedenau ist ein echter Ruhepol inmitten der lebendigen Stadt. Der beschauliche Eindruck, den die kleine und ruhige Straße ausstrahlt, wird durch viele elegante Altbauten verstärkt. Aber auch der umliegende Kiez macht es leicht, bei einem Spaziergang durch die kleinen Sträßchen, ob Richtung Ceciliengärten oder Friedrich-Wilhelm-Platz, abzuschalten. \r\n\r\n-    Optimale Lage in Berlin Friedenau\r\n-    5 Gehminuten zum S-Bahnhof Friedenau (S1)\r\n-    9 Gehminuten zum U-Bahnhof Friedrich-Wilhelm-Platz (U9)\r\n-    6 Minuten mit dem Fahrrad oder 9 Minuten mit dem Bus M48/ M85 bis zur Schloßstraße\r\n-    3 Gehminuten bis Wochenmarkt am Breslauer Platz\r\n-    15 Minuten mit dem Bus bis zum Botanischen Garten \r\n-    10 Minuten mit dem Fahrrad zum Shoppingcenter ""Das Schloss"" und 15 Minuten zu KaDeWe und Ku\'damm\r\n-    Eine Vielzahl an Restaurants, Cafés und Bars in unmittelbarer Nähe\r\n-    Supermärkte sind fußläufig zu erreichen, zum Beispiel Edeka, Rewe, LPG Biomarkt oder Netto']";14;;;;
2020-05-11 12:33:32.895502;Berlin;no_information;ONE_YEAR_FREE;5782002;n;n;https://pictures.immobilienscout24.de/listings/9a8fec42-a4df-40e4-b068-a878b5853da9-1354135023.jpg/ORIG/resize/118x118%3E/extent/118x118/format/jpg/quality/80;8;16.54;40 MBit/s;telekom_layer_magenta_l;über VDSL;1905;REGULAR;;16.54;116141856;;y;false;MagentaZuhause L;y;Berlin;y;7;1;145;no_information;;8.84;62;Berlin;12047;refurbished;sophisticated;;false;100 MBit/s;no_information;no_information;n;https://padlock.link/ioml;https://padlock.link/ml;no_information;raised_ground_floor;12047;2;;n;2,active;true;Deutschland;top;100 MBit/s;wohnung_kauf;n;0;web,email,bank,music,dl-ul,game,sd,mltstr,hd,fast-ul-dl;true;001.5782002;385000;profile0;5;2;true;n;showqualicontactform;n;n;Neukölln_Neukölln;260;3;Berlin;/expose/116141856;"['Airy one bedroom apartment on mezzanine floor with wooden floors and high ceilings. The apartment consists of a large living space with an open plan kitchen, a bedroom, that is separated from the living room by sliding doors (the bedroom also has a large built in closet) and a mosaic tiled en-suite bathroom including a walk in rain shower and is also suitable for handicapped persons. It can be taken over completely furnished if interested. The apartment is located in a traditional building and is facing a quiet yard. It was refurbished in 2010.', 'Living room, open plan kitchen with dish washer and washing machine, handicapped accessible bathroom with walk in shower.', ""Berlin's Neukölln district lays in the south of the city center. Great restaurants and exciting bars make this one of the most vibrant area of the city. A lot of canals and parks surrounds it, and for shoppers the area is well known for its wide range of unique boutiques and vintage shops. The bi-weekly Turkish Market and Paul Linck Ufer are just around the corner and there are several grocery stores within a couple minutes' walk. The apartment is literally steps away from some great bars, restaurants, clubs, cultural  institutions, galleries and historical sites. You can reach subway station Schoenleinstrasse (U8) within a 5 minute walk. Alexanderplatz and Potsdamer Platz are both 10 minutes underground train ride away.""]";;;2010;62;
2020-05-11 12:33:33.237983;Berlin;central_heating;ONE_YEAR_FREE;213082;n;n;https://pictures.immobilienscout24.de/listings/911b49c5-8def-4d9b-868d-5d722498fe4a-1354151335.png/ORIG/resize/118x118%3E/extent/118x118/format/jpg/quality/80;5;12.78;40 MBit/s;telekom_layer_magenta_l;über VDSL;1919;REGULAR;;12.78;116143536;gas;n;false;MagentaZuhause L;y;Berlin;n;5;1;188.26;no_information;energy_consumption;7.25;58.7;Berlin;10555;well_kept;normal;;false;100 MBit/s;no_information;no_information;n;https://padlock.link/ioml;https://padlock.link/ml;no_information;apartment;10555;2;129;n;2,active;true;Deutschland;standard;100 MBit/s;wohnung_kauf;y;1;web,email,bank,music,dl-ul,game,sd,mltstr,hd,fast-ul-dl;true;001.213082;219000;profile0;6;2;true;n;;n;n;Tiergarten_Tiergarten;rwi7596;2;Berlin;/expose/116143536;['Es handelt sich bei diesem Objekt um einen Altbau aus dem Jahre 1919 in einem, für diese Zeit typischen, Mix aus Wohnungen und Gewerbe. So findet man hier ein Vorderhaus mit 2 Seitenflügeln und einem Hinterhaus, die den 1. Innenhof umschließen. Hier gibt es Wohnungen und im EG Gewerbeflächen. Errichtet wurden ein Erdgeschoss, 4 Obergeschosse und ein teilweise ausgebautes Dach mit Terrassen. An der Straßenseite des Vorderhauses gibt es Balkone, die anderen Gebäudeteile haben zumeist einen französischen Balkon. \r\rDanach folgt ein 2. Hof und dahinter ein ehemaliges Fabrikgebäude das gewerblich genutzt wird. Dieses ist bereits vollständig verkauft. ', 'Diese vermietete Wohnung befindet sich im 1. OG des rechten Seitenflügels. Sie verfügt neben einem großen Durchgangszimmer mit Fenster zum Innenhof noch über ein weiteres Zimmer mit Südausrichtung und französischem Balkon. \r\rDie Küche mit Fenster und einem weiteren französischen Balkon zum Innenhof und das Duschbad erreicht man über den Flur. \r\rDie Wohnung wird vermietet als Kapitalanlage angeboten. Weitere Details auf Anfrage. ', 'Berlin-Tiergarten-Mitte - Unterhalb der Turmstraße zwischen Spree und Ottopark gelegen. Von hier aus gelangt man schnell in die Innenstadt, zur Universität und auch zum Reichstag. \rDie Straße Alt-Moabit ist die nach der Turmstraße zweitwichtigste und wohl lebendigste Geschäftsstraße Moabits. Die zentrale Lage bietet zwar keine Ruhe wie in ländlicher Abgeschiedenheit, aber durch diese sind zum Beispiel sämtliche Einkäufe fußläufig zu erledigen, und auch Busse und die U-Bahnlinie U9 schnell erreicht. Die größtenteils sanierten hübschen Jugendstilbauten in der Umgebung bieten eine sehr angenehme Wohnlage, und das Bundestagsufer in der Nähe einen tollen Spreeblick zur Naherholung.', 'Der Käufer hat bei Abschluss des Kaufvertrages eine Provision in Höhe von 7,14 % inkl. Mehrwertsteuer vom Kaufpreis an uns zu zahlen. Verdient und fällig bei Beurkundung. Alle Angaben sind ohne Gewähr und nach den Unterlagen des Eigentümers erstellt. Irrtümer und Änderungen vorbehalten. Bei aller Sorgfalt können wir keine Garantie dafür übernehmen, dass alle Angaben richtig sind, und das Objekt im Augenblick des Zugangs der Offerte noch verfügbar ist. \r\rBei Anfragen bitten wir um vollständige Absenderangaben. \r\rGerne zeigen wir Ihnen das Objekt, und freuen uns auf einen persönlichen Termin mit Ihnen. \r\rSie erreichen uns wie folgt:\rRüdiger Wilkanowski Immobilien\rin Kooperation mit:\r\rRoman Seidl Immobilien\rTelefon: 0173 / 2187927\rFax: 030 / 85605613\r\rGerne zeigen wir Ihnen das Objekt, und freuen uns auf einen persönlichen Termin mit Ihnen. \r\rWeitere interessante Angebote finden Sie auch im Internet unter www.wilkanowski-immobilien.de.\r\rSie wollen Ihre Immobilie verkaufen ?\r \rWir suchen im Stadtgebiet von Berlin Immobilien (freie Eigentumswohnungen, Mehrfamilienhäuser und Einfamilienhäuser). Sprechen sie uns gerne an oder vereinbaren Sie einen persönlichen Termin mit uns: 030-85605612.'];2001;;;;
