2020-05-11 12:22:23.938091;Berlin;central_heating;ONE_YEAR_FREE;241868;n;y;https://pictures.immobilienscout24.de/listings/1468ec19-44ce-408b-903d-d4a6fe3c2706-1363128355.jpg/ORIG/resize/118x118%3E/extent/118x118/format/jpg/quality/80;10;9.92;40 MBit/s;telekom_layer_magenta_l;;über VDSL;1996;REGULAR;9.92;117309270;gas;y;true;MagentaZuhause L;y;Berlin;n;5;5;180;no_information;energy_consumption;5.71;55.05;Berlin;13156;well_kept;normal;C;false;100 MBit/s;underground_garage;no_information;y;https://padlock.link/ioml;https://padlock.link/ml;no_information;apartment;13156;2;n;;21;2,active;true;Deutschland;top;100 MBit/s;wohnung_kauf;y;;web,email,bank,music,dl-ul,game,sd,mltstr,hd,fast-ul-dl;true;001.241868;225000;profile0;4;2;true;n;;n;n;Niederschönhausen_Pankow;2937;2;Berlin;/expose/117309270;"['Die hier angebotene vermietete Eigentumswohnung befindet sich in einer Wohnanlage mit mehreren Stadthäusern, die von einer hübschen parkähnlichen Grünanlage umgeben sind. Die Zweizimmerwohnung mit einem großen Eckbalkon liegt im zweiten Obergeschoss eines sehr gepflegten Hauses, die bequem mit einem Aufzug erreichbar ist. Über einen kleinen Flur mit Einbauschrank gelangt man rechts in ein raumhoch gefliestes Marmor-Wannenbad mit Waschmaschinenanschluss und links in das Schlafzimmer. Das an den Flur angrenzende Wohnzimmer mit Eckbalkon und offener Küche wirkt durch die drei Fenster und das große Balkonfenster sehr hell und freundlich. Zwischen Küchen- und dem Wohnbereich ist Platz für einen mittelgroßen Esstisch. Zur Eigentumswohnung gehört ein Keller sowie ein Tiefgaragenstellplatz, der derzeit separat vermietet wird.\n\nWichtige Information:\nMit dem Inkrafttreten des Gesetzes zur Mietenbegrenzung im Wohnungswesen in Berlin vom 23.02.2020 darf der Mietenwert zum Stichtag am 18.06.2019 nicht überschritten werden. Des Weiteren gilt eine Mietentabelle (inkl. Zulagen), an deren Werte die Entgegennahme der Miete ab dem 23.11.2020 anzupassen ist. Diese Verordnung gilt bis zum 22.02.2025.', '- vermietete Zweizimmer-Eigentumswohnung im 2.OG\n- großer Eckbalkon\n- offene Küche mit Einbauküche und Fenster\n- Marmor-Wannenbad mit Waschmaschienenanschluss\n- Aufzug\n- Parkettböden\n- Tiefgaragen-Stellplatz', 'Pankow setzt sich aus den historisch gewachsenen Bezirken Pankow, Prenzlauer Berg und Weißensee zusammen und ist auf Grund der Sozialstruktur, der schönen Bauwerke, der vielen Parkanlagen und der guten Verkehrsanbindung  einer der beliebtesten Bezirke Berlins.\nDas Zentrum von Pankow bildet der Pankower Anger und die Breite Straße, mit dem heutigen ältesten Baudenkmal Pankows - der alten Pfarrkirche. Daneben befinden sich das Rathaus, zahlreiche Geschäfte des täglichen Bedarfs, ein großes Einkaufszentrum und gemütliche Cafés und Restaurants.\nNur wenige Gehminuten vom Zentrum Pankows entfernt befindet sich das denkmalgeschützte Schloss Schönhausen mit einem weitläufigen Park, der an das Sommerbad Pankow angrenzt. Auch zahlreiche andere Sportstätten und Parkanlagen laden zum Relaxen ein.\nVon der Waldemarstraße fußläufig erreichbar sind mehrere Kitas, eine Grundschule und ein Gymnasium. Zwei Supermärkte befinden sich in unmittelbarer Nähe.\nZum Bahnhof Friedrichstraße gelangt man entweder mit der Straßenbahn oder S-Bahn in maximal 30 Minuten. Die Autobahn 100 ist ca. 8 Kilometer entfernt, über die das wald- und seenreiche Land  Brandenburg und die Ostsee schnell zu erreichen sind.', 'Berliner Volksbank Immobilien - Ihr Partner beim Immobilienkauf und -verkauf.\n\nGerne stellen wir Ihnen ein ausführliches Exposé inkl. genauer Anschrift dieser Immobilie zur Verfügung. Bitte nutzen Sie hierfür das Kontaktfeld auf dieser Seite. Ihre vollständigen Kontaktdaten (Name, Anschrift, Telefonnummer und Email-Adresse) werden ausschließlich für den Versand von Immobilienangeboten gespeichert. \n\nAuf Grund von gesetzlichen Vorgaben sind telefonische Auskünfte zur genauen Immobilien-Anschrift nicht möglich; Besichtigungstermine können daher erst nach Exposé-Erhalt abstimmt werden.\n\nEinen Überblick unserer Angebote finden Sie auf unserer Website: www.bvbi.de \n\nAls Tochterunternehmen einer genossenschaftlichen Universalbank sind wir mit ganzheitlicher Beratung  vertraut. So erhalten Sie alle Dienste rund um Ihre Traumimmobilie aus einer Hand – von den Finanzierungslösungen der Berliner Volksbank bis zu den Dienstleistern starker und renommierter Partner wie der R+V Versicherung und der Bausparkasse Schwäbisch Hall.']";;;;;;90;1;;
2020-05-11 12:22:24.259143;Berlin;self_contained_central_heating;;15474925;n;n;https://pictures.immobilienscout24.de/listings/d52025e8-6111-45f1-b2e1-b971ea786d44-1363150394.jpg/ORIG/resize/118x118%3E/extent/118x118/format/jpg/quality/80;22;10.81;;;;;1893;;10.81;117313754;natural_gas_heavy;n;false;;y;Berlin;y;5;1;215;no_information;energy_consumption;6.01;65.15;Berlin;12159;no_information;no_information;;false;;no_information;no_information;n;;;no_information;ground_floor;12159;2;n;;;2,active;;Deutschland;top;;wohnung_kauf;y;0;;;001.15417560;245000;profile0;4;2;true;n;;n;n;Friedenau_Schöneberg;VK-19105_WE01_AE;3;Berlin;/expose/117313754;['Das Wohnhaus wurde 1893 erbaut, ist in ein Vorderhaus und in einen Seitenflügel aufgeteilt und besteht aus 15 Wohneinheiten.\n\nDie Wohnung befindet sich im Vorderhaus des Erdgeschosses, verfügt über ca. 65,15 m² und ein Sondernutzungsrecht für zwei Gartenanteile, straßenseitig und im Hof - und das mitten im Herzen von Berlin.\n\nDer Grundriss ist gut aufgeteilt in Flur, Bad, Küche sowie zwei Zimmer.\n\nDas repräsentative Haus hat eine wunderschöne Klinker-/Stuckfassade. \n\nDie Wohnungen im Haus werden mit Nachtspeicheröfen beheizt.  Es sind aber neue Leitungen verlegt worden, so dass in der Wohnung eine Gasetagenheizung eingebaut werden könnte.\n\nDie Wohnung ist zuverlässig vermietet.', 'Die Immobilie befindet sich im beliebten Berliner Stadtteil Friedenau in einer ruhigen Seitenstraße.\n\nDer Stadtteil Friedenau wurde ursprünglich in der Kaiserzeit als Landhauskolonie angelegt. Heute überzeugt er durch sanierte Altbauten mit repräsentativen Fassaden und mit ihren kleine, grünen Vorgärten. Das Zentrum von Friedenau bildet der Friedrich-Wilhelm-Platz.\n \nHervorragende Einkaufsmöglichkeiten und eine gastronomische Vielfalt bietet die nur sechs Gehminuten entfernte Schloßstraße, die als kleine Schwester vom Kurfürstendamm bekannt und beliebt ist.\n\nDie unmittelbare Umgebung bietet in allen Bereichen eine komplette Versorgungsfunktion. Schulen, Kitas, Dienstleistungs- sowie Gesundheitseinrichtungen sind in einer Vielzahl vorhanden.  \n\nFür Erholungs- und Freizeitangebote dienen der Volkspark Wilmersdorf und der Rudolph-Wilde Park, welche in wenigen Minuten sowohl mit dem Fahrrad oder auch zu Fuß zu erreichen sind.\n\nAuch eine gute Anbindung an den öffentlichen Personalverkehr ist durch den U-Bhf. Friedrich-Wilhelm Platz gegeben.\n\nWer mit dem Auto fährt, kann mithilfe der A103 viele Orte Berlins schnell erreichen.'];;;;;;109.4;;;
2020-05-11 12:22:24.590823;Berlin;self_contained_central_heating;ONE_YEAR_FREE;16373664;n;y;https://pictures.immobilienscout24.de/listings/e1d50ecc-5d9c-492a-81af-ea173b45457c-1360137987.jpeg/ORIG/resize/118x118%3E/extent/118x118/format/jpg/quality/80;31;10.76;40 MBit/s;telekom_layer_magenta_l;8;über VDSL;;REGULAR;10.76;116927644;natural_gas_heavy;n;false;MagentaZuhause L;y;Berlin;y;6;;333;no_information;;6.07;94;Berlin;13595;well_kept;no_information;;false;100 MBit/s;no_information;no_information;n;https://padlock.link/ioml;https://padlock.link/ml;no_information;apartment;13595;4;n;;;2,active;true;Deutschland;top;100 MBit/s;wohnung_kauf;y;2;web,email,bank,music,dl-ul,game,sd,mltstr,hd,fast-ul-dl;true;002.01007242417;296777;profile0;;4;true;n;showqualicontactform;n;n;Spandau_Spandau;116927644;4;Berlin;/expose/116927644;['Diese gemütliche Wohnung mit einer geschickten Raumaufteilung wird Ihnen gefallen. \nVom geraden Flur erreichen Sie alle Räume. Hier ist auch Platz für eine Garderobe und einen Schuhschrank. \nDie Küche bietet ausreichend Raum für die Zubereitung der Mahlzeiten und eine Eßecke. Bequem lagern Sie in der Vorratskammer in der Küche Ihre Vorräte. Das Fenster in Südausrichtung sorgt für viel Licht.\n\nDas geflieste Badezimmer mit WC ist gemütlich und mit einer Dusche und WC ausgestattet.\nDas helle Kinder - oder Arbeitszimmer in Südausrichtung befindet sich nebenan.\n\nGegenüber vom Kinderzimmer befindet sich das Elternschlafzimmer mit Balkon. \n\nDas große Wohnzimmer mit Balkon Nebenan sowie weiteres Arbeits- oder Kinderzimmer runden diese Wohnung ab.', 'Bad mit Dusche\n Balkon\n Speisekammer\n Böden: Fliesenboden, Linoleum, Teppichboden\n Kunststofffenster\n Zustand: gepflegt', 'Diese Wohnung befindet sich in einer städtischen Lage mit viel Grün. \nFlächenmäßig der viertgrößte Berliner Bezirk, besticht Spandau durch seine Vielzahl an Grünflächen, Wäldern und Gewässern!\nHauptsehenswürdigkeiten sind die Zitadelle, die St. Nikolai Kirche, die historische Altstadt, das Luftwaffenmuseum und die Sternwarte. \nUmgeben von Wald- und Wasserflächen ermöglicht der Berliner Stadtteil Spandau, viele Möglichkeiten der Freizeitgestaltung. \nSchulen, Kindergärten, Ärzte, Schwimmhallen und eine Supermarkt (290 m) sind bequem auf kurzen Wegen zu erreichen. Die gute Anbindung des ÖPNV mit den Bushaltestellen in der Umgebung bringt Sie schnell zu den Spandauer Arcaden oder zum S- und U-Bahnhof Rathaus Spandau. In nur acht Gehminuten sind Sie bereits im benachbarten Südpark und am Grimnitzsee. In 15 bis 20 Gehminuten gelangt man zum Pichelssee, Scharfe Lanke und Stößensee. Spazieren, Rudern, Angeln und Segeln ist möglich. Hier präsentiert sich ein ideales und vielfältiges Naherholungsgebiet.', 'Besichtigungen finden nach Vereinbarung mit dem Mieter statt.\n\nIch bitte Sie um vorherige Anmeldung. \n\nDanke.\n\n\n\nAlle hier gemachten Angaben beruhen auf Auskünften des Verkäufers, für die keine Haftung übernommen wird. \n\n\n\nDer Makler-Vertrag mit Tobias Schmidt Immobilien kommt durch schriftliche Vereinbarung oder durch die Inanspruchnahme unserer Maklertätigkeit auf der Basis des Objekt-Exposés und seiner Bedingungen zustande. \n\nDie Käufercourtage in Höhe von 7,14 %% auf den Kaufpreis einschließlich gesetzlicher Mehrwertsteuer ist bei notariellem Vertragsabschluss verdient und fällig. \n\n\nIch freue mich auf Ihre Kontaktaufnahme! \n\nSchmidt Immobilien \n\nTelefon: 06237 / 917 11 60'];;;;;;;;;
2020-05-11 12:22:24.992459;Berlin;;ONE_YEAR_FREE;16728507;n;y;https://pictures.immobilienscout24.de/listings/0f3a6f7b-285c-4533-a315-6fdd2c197c8f-1363139094.jpg/ORIG/resize/118x118%3E/extent/118x118/format/jpg/quality/80;6;10.2;40 MBit/s;telekom_layer_magenta_l;1;über VDSL;;REGULAR;10.2;117312264;no_information;n;false;MagentaZuhause L;y;Berlin;y;4;;220;no_information;;6.17;76.32;Berlin;13055;well_kept;normal;;false;100 MBit/s;no_information;no_information;n;https://padlock.link/ioml;https://padlock.link/ml;no_information;ground_floor;13055;3;n;;;2,active;true;Deutschland;top;100 MBit/s;wohnung_kauf;y;0;web,email,bank,music,dl-ul,game,sd,mltstr,hd,fast-ul-dl;true;002.01007540282;199000;profile0;4;3;true;n;showqualicontactform;n;n;Alt_Hohenschönhausen_Hohenschönhausen;NX7CVE;3;Berlin;/expose/117312264;['Die angebotene Kapitalanlage befindet sich im Erdgeschoss eines gepflegten Mehrfamilienhauses im Berliner Stadtteil Alt-Hohenschönhausen.\n\nWichtig: Alle relevanten Informationen (vollständige Adresse, Bilder, Objektunterlagen, Zahlen und Daten, etc.) erhalten Sie direkt nach Kontaktaufnahme mit uns in unserem Dokumenten Center des Inserates.\n\n###############################################################\n\nDie ideal geschnittene Wohnung ist aufgeteilt auf zwei Schlafzimmer, ein Wohnzimmer mit Zugang zum Wintergarten, eine Küche und ein Tageslichtbad mit Badewanne. In dieser vermieteten Wohnung sind alle Räume  über den zentralen Flur separat begehbar und können so ideal genutzt werden. Viele Fenster lassen reichlich Tageslicht in die Wohnung und versprechen eine angenehme Wohnatmosphäre. Abstellmöglichkeiten bietet ein eigener Abteil im Keller.', '++ Kapitalanlage \n++ Sehr gutes Mietverhältnis\n++ Wintergarten\n++ Bad mit Wanne\n++ Gepflegte Wohnanlage\n++ Großer Innenhof', 'Die angebotene Immobilie befindet sich im Ortsteil Alt-Hohenschönhausen im Berliner Bezirk Lichtenberg. Lichtenberg ist ein aufstrebender Stadtteil mit jungen Familien, die in die Gegend um die Rummelsburger Bucht ziehen, und Kreativen, die in charmanten alten Industriegebäuden den Traum leben. Die Bewohner dieses ehemaligen Arbeiterviertels sind herzhaft und bodenständig - echte Berliner Charaktere.\n\nLichtenberg wuchs im späten 19. Jahrhundert schnell, zog neue Industrien an und schuf einen Bauboom für die Arbeiter und ihre Familien. Die Stadt weist nicht nur noch viele Spuren dieser industriellen Entwicklung auf, sondern auch Orte aus den verschiedenen Epochen Lichtenbergs - von Berlins einziger verbliebener Lehmbauweise im ehemaligen Falkenberger Dorf bis zum charmanten Schloss Friedrichsfelde, modernistischer Architektur und der Stasi Komplex und Untersuchungsgefängnis.', '\nKontaktieren Sie uns und vereinbaren Sie einen Beratungstermin mit Ihrem persönlichen WunderAgenten! \n\n************* \n\nWunderAgent – Mein Partner rund um Immobilien. \n\nVon der möblierten 1-Zimmer-Wohnung bis zum Mehrfamilienhaus, wir betreuen Ihre Immobilie. \n\n************* \n\nHinweis: Das vorliegende Exposé wurde nach Angaben des Auftraggebers gefertigt und dient lediglich zur Orientierung im Vorfeld einer Besichtigung. Sämtliche Angaben zu Ausstattung und Details wurden seitens des Auftraggebers getätigt. WunderAgent übernimmt keine Gewähr für die Richtigkeit der gemachten Angaben - dies gilt insbesondere für die korrekte Ermittlung der Wohnfläche. Bei der Inaugenscheinnahme der Immobilie durch WunderAgent werden sämtliche Angaben auf Plausibilität geprüft. Im Zweifel empfehlen wir Ihnen vor Abschluss eines Kauf- oder Mietvertrages eine detaillierte Ermittlung der angegebenen Wohnfläche. Gerne beraten wir Sie hierzu im persönlichen Gespräch. Das vorliegende Exposé wird nicht Bestandteil eines Kauf- oder Mietvertrages - es erfüllt lediglich Vorab-Informationszwecke im Vorfeld einer Besichtigung. Zugesicherte Eigenschaften (z.B. korrekte Wohnfläche) sollten im Kauf- oder Mietvertrag direkt mit dem Verkäufer/Vermieter vertraglich geregelt werden.\n'];;;disabled;;;;;;
2020-05-11 12:22:25.443619;Berlin;district_heating;;15372281;y;y;https://pictures.immobilienscout24.de/listings/b7b238e6-afec-4f0f-b7a7-1bc1ca9c2e85-1363124522.jpg/ORIG/resize/118x118%3E/extent/118x118/format/jpg/quality/80;4;10.71;;;;;2020;;10.71;117308170;no_information;n;false;;n;Berlin;y;6;9;;9E;;5.2;55.16;Berlin;12437;first_time_use;sophisticated;;false;;no_information;Eichbuschallee;y;;;Eichbuschallee;no_information;12437;2;n;;;2,active;;Deutschland;top;;wohnung_kauf;n;;;false;001.15320047;289000;profile0;4;2;true;y;;y;n;Plänterwald_Treptow;EBA/9E/02;2;Berlin;/expose/117308170;"['Das Neubauprojekt ""Wohnen am Plänterwald"" überzeugt durch seine neoklassizistische Architektur und die gehobene Ausstattung der 62 Wohnungen. Durchdachte und vielseitige Grundrisse mit Größen von rund 53 bis 123 m² bzw. von 2 bis 4 Zimmern sind die ideal geeignet für Familien, Paare oder Singles. Die Wohnungen im Gartengeschoss verfügen über große Terrassen und Privatgärten. In den oberen Etagen ermöglicht die aufwendige, teilweise gestaffelte Architektur ebenfalls große Balkone oder Terrassen für jede Wohnung.\n\nIn Treptow ergänzen sich Natur und modernes Leben zu einer spannenden Verbindung, ohne dass man auf die Vorzüge des pulsierenden Metropolenlebens verzichten muss.\n\nFür Singles und Paare - mit Freunden gemeinsam den Abend entspannt auf einer der beiden Terrassen ausklingen lassen. Die Wohnung bietet zudem ein modern gestaltetes Duschbad mit Handtuchheizkörper, einen Hauswirtschaftsraum mit Waschmaschinenanschluss sowie ein geräumiges Schlafzimmer.\n', '- Echtholzparkett in den Wohn- und Schlafräumen\n- energiesparende Fußbodenheizung\n- Feinsteinzeug in den Bädern\n- Sanitärobjekte und Armaturen von Markenherstellern\n- Elektrische Rollläden an allen Fenstern\n- 3-Fach-Verglasung der z.T. bodentiefen Fenster\n- Gartenwohnung mit Privatgarten\n- KfW-55 Energie-Effizienzhaus (EnEV 2016)\n- Aufzug in alle Etagen\n- Abgeschlossener Müllraum\n- Fahrradabstellplätze für jede Wohnung\n- Tiefgaragenstellätze (Ladestationen möglich)\n', 'Auf der einen Seite viel Grün und entspannende Ruhe. Auf der anderen Seite ist man ruckzuck im Zentrum Berlins - ob mit dem Fahrrad, dem Auto oder den öffentlichen Verkehrsmitteln. Die S-Bahnhöfe Plänterwald und Baumschulenweg sind fußläufig in wenigen Minuten zu erreichen. Doch das Hinsetzen in der Bahn lohnt kaum, denn innerhalb von zwei Stationen befindet man sich im quirligen Kiezleben von Friedrichshain, Neukölln oder Kreuzberg.\n\nPlänterwald: 50 Meter zu Fuß\nSpreeufer: 500 Meter zu Fuß\nTreptower Park: 5 Min mit dem Fahrrad\nMediaspree: 10 Min mit dem Fahrrad\nBahnhof Ostkreuz: zwei Stationen mit den öffentlichen Verkehrsmitteln\nAlexanderplatz: 23 Min mit den öffentlichen Verkehrsmitteln\nFriedrichstraße: 27 Min mit den öffentlichen Verkehrsmitteln\nHauptbahnhof: 30 Min mit den öffentlichen Verkehrsmitteln\nKurfürstendamm: 40 Min mit den öffentlichen Verkehrsmitteln\nFlughafen Tegel: 30 Min mit dem Auto\nFlughafen BER: 22 Min mit dem Auto', 'Der Verkauf erfolgt für den Käufer provisionsfrei!\n\nBeratungstermine in unserem Info-Pavillon vor Ort sind nach individueller Vereinbarung weiterhin möglich!\n\nAngaben nach EnEV: Energieausweis befindet sich in der Erstellung.\n\nÄnderungen und Irrtümer vorbehalten. Das Bild- und Planmaterial dient zum Teil der vorläufigen Illustration des Vorhabens. Insbesondere die Visualisierungen o. ä. sind unverbindlich und zeigen teilweise Sonderausstattungen und Einrichtungen, die als Möblierungsvorschläge zu verstehen sind.\n']";;;disabled;86973;true;;;;
2020-05-11 12:22:25.794946;Berlin;self_contained_central_heating;ONE_YEAR_FREE;1145741;n;y;https://pictures.immobilienscout24.de/listings/9ec0de6f-979c-4d11-a67d-938a788f9b75-1363218890.jpg/ORIG/resize/118x118%3E/extent/118x118/format/jpg/quality/80;29;11.35;40 MBit/s;telekom_layer_magenta_l;75.88;über VDSL;1902;REGULAR;11.35;117324214;gas;y;false;MagentaZuhause L;n;Berlin;y;9;1;161;37;energy_consumption;7.54;70.59;Berlin;10249;first_time_use;sophisticated;NO_INFORMATION;false;100 MBit/s;no_information;"Petersburger Stra&szlig;e";y;https://padlock.link/ioml;https://padlock.link/ml;Petersburger_Straße;roof_storey;10249;2;n;2020;2044;2,active;true;Deutschland;standard;100 MBit/s;wohnung_kauf;n;5;web,email,bank,music,dl-ul,game,sd,mltstr,hd,fast-ul-dl;true;001.1145741;527000;profile0;5;2;true;n;showqualicontactform;y;n;Friedrichshain_Friedrichshain;2044.00250;3;Berlin;/expose/117324214;['Vielen Dank für Ihr Interesse an unserem Angebot. \n\nDas Wohn- und Geschäftshaus befindet sich im Bezirk Friedrichshain/Kreuzberg. Das Dachgeschoss wird derzeit ausgebaut, so dass 312,90 m² neuer Wohnraum entsteht. Hier lebt man mitten in Szenebezirk Friedrichshain und kann über den Dächern einen atemberaubenden Blick auf den Berliner Fernsehturm genießen. \n\nAlle Räume sind nach Fertigstellung lichtdurchflutet. Zwei Klimaanlagen sorgen für angenehme Raumtemperatur an heißen Tagen, die moderne Gasetagenheizung für wohlige Wärme im Winter. Alle Wohnräume werden mit hochwertigem Echtholz in einem warmen Braunton belegt.  Auf insgesamt 14,84 m² Terrassenfläche kann eine kleine grüne Oase zum Entspannen entstehen. Die neuen Aufzüge bringen Sie bequem in Ihr neues schönes und besonderes Zuhause. \n\nDie Fläche im begrünten Innenhof wird gemäß Freianlagenkonzept gestaltet. Dort entstehen ein Kinderspielplatz sowie Müll- und Fahrradstellplätze. \n\nIm Erdgeschoss befinden sich Gewerbeeinheiten. Diese sind an eine Änderungsschneiderei und an einen Kostümverleih vermietet. Alle anderen Einheiten werden als Wohnraum genutzt. \nDas Objekt wurde um die Jahrhundertwende erbaut und ist ein typischer Altbau. Die Fassade und die Treppenhäuser befinden sich noch im ursprünglichen unsanierten Zustand. Die Fassade und der Hausflur erhalten nach Fertigstellung der Baumaßnahmen einen neuen Anstrich. \n\nDas Miethaus wurde in diesem Jahr nach dem Wohnungseigentumsgesetz aufgeteilt. Die WEG besteht aus 25 Wohnungen. \n\nWährend der Bauphase ist es möglich die Raumaufteilung und die Ausstattung zu beeinflussen. Sofern baulich umsetzbar, werden die Wünsche des Käufers selbstverständlich berücksichtigt.', '- 2 Zimmer \n- Gasetagenheizung\n- Fußbodenheizung\n- Parkett in allen Räumen außer Bad\n- gefliestes Wannenbad mit Dusche\n- Einbauküche mit Geräten\n- 2 Klimageräte\n- Terrasse 10,58 m²\n- Aufzug\n- Rauchwarnmelder', 'Das Gebäude liegt mitten im Herzen von Berlin im Szeneviertel mit viel Gastronomie und kleinen Geschäften in der Nähe. Hier pulsiert das Leben. Der Bezirk Friedrichshain ist im Wandel, er wird kontinuierlich erneuert und verschönert.  \n\nInnerhalb von einem ca. fünf bis zehn minütigem Fußweg ist der Volkspark Friedrichshain zu erreichen. Nach ca. 30 min. erreicht man ebenfalls fußläufig die Spree, die direkt hinter dem S-Bahnhof Warschauer Straße und der East-Side-Gallery liegt. Dort befindet sich die Mercedes-Benz Arena, diverse Veranstaltungen sorgen für kulturelle Erlebnisse. \n\nDie Tram-Haltestelle der M10 liegt direkt gegenüber des Wohn- und Geschäftsgebäudes. Andere Verkehrsverbindungen sind innerhalb von 5 - 10 Minuten (U-Bahnhof Frankfurter Tor) zu erreichen. \n\nDie Karl-Marx-Allee ist ebenfalls fußläufig erreichbar. Sie lädt zu einem Einkaufsbummel ein. Wer es lieber geballter mag, begibt sich ins ca. 2 km entfernte Ringcenter. In diesem Einkaufszentrum bieten ca. 100 Fachgeschäfte die unterschiedlichsten Waren an. \n\nAuf dem geräumigen Mittelsteifen der Petersburger Straße, stehen öffentliche Parkplätze zur Verfügung. Derzeit erfolgt noch keine Parkraumbewirtschaftung.', 'Sofern Sie Fragen haben oder einen Beratungstermin wünschen, freuen wir uns über Ihren Anruf oder eine E-Mail von Ihnen. \n\nGern kann das Objekt nach Terminvereinbarung besichtigt werden. \n\nACHTUNG: Da der Fußboden hergestellt wird, sind Besichtigungen aufgrund der Trocknungszeit zwischen 08.05.2020 und 08.06.2020 nicht möglich. \n\nGern kann das Objekt nach Terminvereinbarung besichtigt werden. \n\nWeitervermittlung über Makler nicht möglich. \n\nAlle Angaben beruhen auf Informationen Dritter, daher ist eine Haftung ausgeschlossen.'];;;;;;;;;
