2020-05-11 12:31:05.818393;Berlin;central_heating;ONE_YEAR_FREE;1466430;n;y;https://pictures.immobilienscout24.de/listings/4a3fb1b1-b3c8-4b2a-94da-7a0cafc8928e-1357026906.jpg/ORIG/resize/118x118%3E/extent/118x118/format/jpg/quality/80;10;9.97;40 MBit/s;telekom_layer_magenta_l;über VDSL;1928;REGULAR;;9.97;116552457;gas;y;false;MagentaZuhause L;y;Berlin;y;7;1;4a;energy_consumption;5.62;65;Berlin;14199;modernized;sophisticated;D;false;100 MBit/s;no_information;"Kirchstra&szlig;e";n;https://padlock.link/ioml;https://padlock.link/ml;Kirchstraße;raised_ground_floor;14199;2;126;n;2,active;true;Deutschland;top;100 MBit/s;wohnung_kauf;n;web,email,bank,music,dl-ul,game,sd,mltstr,hd,fast-ul-dl;true;001.1466430;339000;profile0;2;true;n;showqualicontactform;n;n;Schmargendorf_Wilmersdorf;116552457;3;Berlin;/expose/116552457;['Diese sehr gut geschnittene 2-Zimmerwohnung liegt im Hochparterre eines im Jahr 1928 erbauten Mehrfamilienhauses mit insgesamt 49 Wohneinheiten.', 'Die Wohnung wurde im Jahr 2014 vollständig saniert.\nDie elektrische Anlage wurde erneuert, die Dielenfußböden in den Zimmern und im Flur wurden abgezogen und lackiert.\nBad - und Küchenfußböden sind gefliest.\nDie Wände der Küche sind in den Arbeitsbereichen gefliest.\nIm Bad sind Duschbereich, Handwaschbecken - und WC-Bereich bis Türrahmenhöhe gefliest.\nWände und Decken im Wohn - und Schlafbereich sowie im Flur sind gespachtelt, geschliffen und gestrichen.\nDie Wohnung verfügt über eine moderne zweizeilige Einbauküche mit E-Backofen, Ceran-Kochfeld, Geschirrspüler, Dunstabzugshaube, Kühl-Gefrierkombination, Apothekerschrank und Mikrowelle. Ein Anschluss für eine Waschmaschine ist vorhanden.\nDas Bad ist mit einer modernen Dusche mit Verglasung, sowie einem breiten Handwaschbecken mit Unterbauschränken und einem Handtuchheizkörper ausgestattet. Die Decke im Bad ist abgehängt, die Beleuchtung erfolgt über Downlights.\nDer Balkon ist nach Süden ausgerichtet und daher sehr sonnig.\nFenster und Balkontür sind mit elektrisch betriebenen Außenjalousien mit Zeitschaltuhren ausgestattet.', 'Die Kirchstraße ist eine ruhige Nebenstraße der Breite Straße im Zentrum von Berlin-Schmargendorf.\nEinkaufsmöglichkeiten (Einzelhandel und Supermärkte) befinden sich in unmittelbarer Umgebung.\nFußweg zum ÖPNV ca. 4 Minuten.\nSportstätten und Sportvereine befinden sich in der Umgebung und sind fußläufig erreichbar.', 'Das monatliche Wohngeld einschließlich aller Nebenkosten beträgt derzeit € 233,00.'];;233;0;4;;;;65;;;;2014
2020-05-11 12:31:06.228199;Berlin;no_information;ONE_YEAR_FREE;15681940;n;n;https://pictures.immobilienscout24.de/listings/5eb1afaa-bee7-4bb5-9e0b-4d78f5506d05-1356780357.jpg/ORIG/resize/118x118%3E/extent/118x118/format/jpg/quality/80;18;12.19;40 MBit/s;telekom_layer_magenta_l;über VDSL;1892;REGULAR;;12.19;116551879;;y;false;MagentaZuhause L;y;Berlin;y;10;1;no_information;;7.44;132.4;Berlin;10967;no_information;no_information;;false;100 MBit/s;no_information;no_information;n;https://padlock.link/ioml;https://padlock.link/ml;no_information;apartment;10967;3;;n;2,active;true;Deutschland;standard;100 MBit/s;wohnung_kauf;n;web,email,bank,music,dl-ul,game,sd,mltstr,hd,fast-ul-dl;true;002.01002869861;890000;profile0;3;true;n;showqualicontactform;n;n;Kreuzberg_Kreuzberg;116551879;6;Berlin;/expose/116551879;['Die lichtdurchflutete Dachgeschosswohnung ist im 5.OG (ohne Fahrstuhl) eines gepflegten Mehrfamilienhauses gelegen, welches Bestandteil eines denkmal- geschützten Bauensembles ist. Über einen kleinen Flur mit Platz für Garderobe und Stauraum, gelangt man in das großzügige Wohnzimmer, das nicht nur durch seine Helligkeit wegen des Oberlichts und der breiten Fensterfront besticht, sondern auch durch die wunderschön restaurierten Balken, welche in nahezu allen Räumen vorzufinden sind. Vom Wohnzimmer gehen Schlafzimmer, Kinderzimmer, eine offene Küche und ein kleiner Flur mit Zugang zum hellgefliesten Badezimmer (mit Badewanne) und dem Dachboden ab. Das Schlaf- und Kinderzimmer besitzen neben Oberlichtern auch Luken ähnliche Fenster, die diesem denkmalgeschützten Objekt seinen Charme verleihen. Der Fußboden ist mit parkettähnlichem Laminat versehen, Küche und Badezimmer sind hellgefliest. Aufgrund einiger nicht tragender Wände, besteht die Möglichkeit, Räume umzugestalten und nach Belieben zu versetzen oder gar zu entfernen. Ein Keller ist der Wohnung zugeordnet. Die Wasser- und Wärmeaufbereitung erfolgt über eine Gasetagenheizung. Das monatliche Wohngeld beträgt 317,11 Euro', '- Einbauküche mit Elektrogeräten', 'Die wunderschöne Immobilie befindet im angesagten „Kreuzberger Graefekiez“ und besticht durch ihre einzigartige Lage direkt am Landwehrkanal. Die Umgebung ist nicht nur von klassischen Mietshäusern aus der Gründerzeit geprägt, sondern auch von der bunten und kreativen Kulturszene. Hier gibt es zahlreiche Orte für Theater und Konzertveranstaltungen, literarische Treffpunkte, Galerien und vieles mehr. Angesagt ist der legendäre Kiez vor allem wegen seinen unzähligen Straßencafés, Wochenmärkte, Bars und Restaurants. Auch die Erholung im Grünen kommt nicht zu kurz. Beliebte Parks sind zum Beispiel der Görlitzer Park, der Volkspark Hasenheide oder der Treptower Park, die man in wenigen Minuten auch mit dem Fahrrad gut erreichen kann. Die Infrastruktur ist als sehr gut zu bewerten- Kitas, Schulen, Ärzte und Geschäfte des täglichen Bedarfs befinden sich in unmittelbarer Umgebung. Die Anbindung an die öffentlichen Verkehrsmittel ist durch nahe gelegenen U-Bahnhöfe, wie z.B Schönleinstrasse U8,  Prinzenstraße (U1, U3) und Kottbusser Tor (U1, U3 U8) und Busverbindungen ausgezeichnet.', 'Besichtigung oder Fragen: \nFrau Schirmer 0177- 36 36 992'];;317.11;5;5;;;8080;;;;;
2020-05-11 12:31:06.530650;Berlin;central_heating;ONE_YEAR_FREE;4338188;n;n;https://pictures.immobilienscout24.de/listings/701b3e15-e9e3-41b5-808e-a4add39635d2-1356843920.jpg/ORIG/resize/118x118%3E/extent/118x118/format/jpg/quality/80;6;10.77;40 MBit/s;telekom_layer_magenta_l;über VDSL;1959;REGULAR;disabled;10.77;116557501;no_information;n;false;MagentaZuhause L;y;Berlin;n;7;2;no_information;energy_consumption;5.67;48;Berlin;10115;no_information;no_information;;false;100 MBit/s;no_information;no_information;n;https://padlock.link/ioml;https://padlock.link/ml;no_information;no_information;10115;2;101;n;2,active;true;Deutschland;standard;100 MBit/s;wohnung_kauf;n;web,email,bank,music,dl-ul,game,sd,mltstr,hd,fast-ul-dl;true;001.4338188;340000;profile0;2;true;n;showqualicontactform;n;n;Mitte_Mitte;98679;2;Berlin;/expose/116557501;"['Sie suchen eine hervorragende Kapitalanlage in Berlin-Mitte?\nDann ist dieses Angebot genau das richtige für Sie!\n\nVerkauft wird eine vermietete Eigentumswohnung mit 48m². Im Jahre 1959 wurde dieses Mehrfamilienhaus in Massivbauweise errichtet.\nIm Jahr 1998/1999 wurde das Objekt aufwendig saniert (grundsaniert von A-Z). Die Wohnung befindet sich im 1. OG des Mehrfamilienhauses. \nSie ist äußerst gepflegt und sehr sonnig (Süd-West-Ausrichtung). Das Gemeinschaftseigentum mit 68 Wohnungen ist in einem sehr guten Zustand. \n2014 wurden einige Modernisierungen realisiert (z.B. neue Einbauküchen, Fußböden, Türen). Es können auch zwei Wohnungen mit jeweils 48m² \nerworben werden.\n\nNettokaltmiete: € 600,00 /mtl.\n\nAuf einen Blick:\n- Ruhig\n- 1998/1999 Grundsanierung Wohnanlage \n- 2014 Modernisierung\n- Einbauküche\n- Kellerabteil\n- Gute Investitionsrücklage\n\nDaten zum Energiewert:\nEnergiewert: 101,00 kWh/(m²a); Energieeffizienzklasse: D; Gebäudeart: Mehrfamilienhaus\nAusweistyp: Energieverbrauch; Energieträger: Fernwärme/Gas\n \nHabe ich Ihr Interesse geweckt? Dann rufen Sie mich am besten noch heute an und vereinbaren Sie einen Besichtigungstermin!\nIch freue mich, von Ihnen zu hören! ImmoSky Deutschland GmbH', 'Berlin-Mitte ist ein Berliner Ortsteil im gleichnamigen Bezirk und umfasst einen Teil der historischen Stadtteile von Berlin. In ihm liegt das östliche Zentrum der deutschen Hauptstadt mit den ehemaligen Stadtkernen von Alt-Berlin und Alt-Kölln, dem Brandenburger Tor, der Straße Unter den Linden, der Humboldt-Universität, der Museumsinsel und dem Fernsehturm. In Mitte befinden sich zahlreiche Einrichtungen des Bundes, der Berliner Senat im Roten Rathaus und das Abgeordnetenhaus von Berlin im Preußischen Landtag sowie zahlreiche Botschaften.\n\nDas Objekt liegt östlich der Chausseestraße zwischen dem historischen Dorotheenstädtischen Friedhof (mit Gräbern von Brecht, Hegel, Mann u.a.) und dem ehemaligen Stadion der Weltjugend.\n\n']";;;1;;;;;;;;;
2020-05-11 12:31:07.119912;Berlin;floor_heating;ONE_YEAR_FREE;18348193;n;y;https://pictures.immobilienscout24.de/listings/65e1c738-dbbd-4297-b585-ecb84723b38f-1355998055.jpg/ORIG/resize/118x118%3E/extent/118x118/format/jpg/quality/80;4;12.19;40 MBit/s;telekom_layer_magenta_l;über VDSL;;REGULAR;disabled;12.19;116421615;;n;true;MagentaZuhause L;n;Berlin;y;7;;15;;7.48;48.19;Berlin;10967;first_time_use;sophisticated;;false;100 MBit/s;no_information;"Jahnstra&szlig;e";y;https://padlock.link/ioml;https://padlock.link/ml;Jahnstraße;apartment;10967;2;;n;2,active;true;Deutschland;schaufenster;100 MBit/s;wohnung_kauf;n;web,email,bank,music,dl-ul,game,sd,mltstr,hd,fast-ul-dl;true;002.01009147972;373000;profile0;2;true;n;showqualicontactform;n;n;Kreuzberg_Kreuzberg;82227 2.18;2;Berlin;/expose/116421615;['Die Jahnstraße im Kreuzberger Gräfekiez. Hier, hinter dem Altbau Nr. 15, entsteht in einem berlintypischen Hinterhof BUWOG XBERG LIVING.\n \nEin modernes Fassadenkonzept und eine authentische Designsprache verleihen diesem Neubauprojekt seine Einzigartigkeit. Hochwertig von Hand gefertigter Besenstrich in leichten Grautönen changiert mit hell abgesetzten Bändern. Mit seiner unverwechselbaren Architektur ruht das Gebäude inmitten einer gekonnt bepflanzten Hofanlage. Wohnoase trifft Szenebezirk.\n\nEcht Kreuzberg. Echt BUWOG XBERG LIVING.', 'Allgemeine Highlights:\n• Fußbodenheizung\n• Eichenholz-Parkett in allen Wohnräumen\n• Größtenteils raumhohe Fenster\n• Alle Fenster mit Mehrfachverglasung und außenliegendem Sonnenschutz\n• Raumhöhen bis 2,65m\n• Hochwertige Badausstattung von Villeroy & Boch mit stilvollen Keramikfliesen und Handtuchheizkörper\n• Video-Gegensprechanlage\n• Aufzug\n• Überdachte Fahrradabstellplätze\n• Kellerabteile\n\nWeitere Ausstattungsmerkmale dieser Wohnung:\n• Ca. 22 m² großer Wohn-/Ess-/Kochbereich\n• Ca. 12 m² großes Schlafzimmer\n• Modernes Duschbad mit Waschmaschinenanschluss\n• Ost-Balkon', 'Die Lage von BUWOG XBERG LIVING ist Berlin pur. Willkommen im Herzen Kreuzbergs: Rauer Charme, authentische Gastronomie und ein Leben, das Tag & Nacht pulsiert – dafür ist Kreuzberg weltberühmt. Hier, zwischen Böcklerpark und Paul-Lincke-Ufer, Hermannplatz und Volkspark Hasenheide trifft das Beste von Kreuzberg aufeinander. Der Kiez rund um die Jahnstraße steht mit seinem Facettenreichtum für viele Menschen für: „The real Berlin“.\n\nKurze Wege\n\nMit dem ÖPNV U8/U7 (Hermannplatz/Südstern/Schönleinstraße) und U1 (Prinzenstraße), Bus M29, 171, 194, M41:\n• Alexanderplatz ca. 17 Min\n• Hauptbahnhof ca. 28 Min\n• Friedrichstraße ca. 25 Min\n\nMit dem PKW:\n• A100 ca. 10 Min\n• Flughafen Tegel ca. 30 Min (PKW)\n• Flughafen BER ca. 25 Min (PKW)', 'Wir sind für Sie da\nUnser Vertriebsteam ist auch aus dem sicheren Home-Office weiterhin für Sie erreichbar. Kommen Sie gerne auf uns zu für Ihren individuellen Beratungstermin.  Die Showrooms sind derzeit geschlossen – aber per Telefon und E-Mail stehen wir Ihnen gern zur Verfügung. Auch Reservierungen von Wohnungen sind unverändert möglich.\nJetzt Termin vereinbaren!'];;;2;;;;;;;82227;true;
2020-05-11 12:31:07.739966;Berlin;gas_heating;ONE_YEAR_FREE;33013;n;y;https://pictures.immobilienscout24.de/listings/c0448fcc-06dc-4cde-8936-572ce606adf6-1359922699.jpg/ORIG/resize/118x118%3E/extent/118x118/format/jpg/quality/80;11;12.24;40 MBit/s;telekom_layer_magenta_l;über VDSL;1955;REGULAR;disabled;12.24;116551009;gas;n;true;MagentaZuhause L;y;Berlin;y;6;2;no_information;energy_consumption;6.53;50;Berlin;10825;first_time_use_after_refurbishment;no_information;D;false;100 MBit/s;no_information;no_information;n;https://padlock.link/ioml;https://padlock.link/ml;no_information;apartment;10825;2;107;n;2,active;true;Deutschland;schaufenster;100 MBit/s;wohnung_kauf;n;web,email,bank,music,dl-ul,game,sd,mltstr,hd,fast-ul-dl;true;001.33013;254000;profile0;2;true;n;showqualicontactform;n;n;Schöneberg_Schöneberg;185839;2;Berlin;/expose/116551009;['- 1955 errichtete Wohnanlage  mit 8 Aufgängen und insges. 149 Wohnungen\n\n- gepflegte Grünanlagen zwischen den Gebäuden\n\n- Gaszentralheizung \n\n- Kellerabteil\n\n- 360°-Tour: https://my.matterport.com/show/?m=d9gHKNLN2D9', '- Erstbezug nach Sanierung\n\n- Elektrik, Vinyl in Holzoptik und Fliesen sowie Bad neu, Wände und Decken gestrichen\n\n- Balkon \n\n- Kunststoff-Isolierglasfenster\n\n- Küche mit Fliesenspiegel und allen notwändigen Anschlüssen\n\n- Tageslichtbad mit bodengleicher Dusche', '- kleine Anliegerstraße \n\n- zentrale Lage\n\n- sehr gute Verkehrsanbindung durch Bus, Bahn und den nahen Anschluss an die Stadtautobahn (A100)\n\n- jeweils 300 m zum U-Bahnhof Rathaus Schöneberg und U-/ S-Bahnhof Innsbrucker Platz (U4)\n\n- zahlreiche Einkaufsmöglichkeiten, Ärzte, Kitas und Schulen in direkter Nähe\n\n- nahe Volkspark Wilmersdorf', 'Die Provision in Höhe von 7,14% des Kaufpreises (inkl.19% MwSt.) wird vom Käufer getragen und ist verdient und zahlbar an die BBI Immobilien GmbH bei Kaufvertragsabschluss.\n\n\nWAS IST IHRE IMMOBILE WIRKLICH WERT?\nWir bieten eine kostenlose Einschätzung Ihrer eigenen Immobilie durch unsere Experten.\nAuf Wunsch sorgen wir für einen seriösen und zeitnahen Verkauf.\nSie erreichen uns auch am Wochenende unter: 030-3277340.\nUnser Büro am Kurfürstendamm ist 7 Tage in der Woche für Sie geöffnet.\n\n\nWeitere interessante, sowohl provisionspflichtige als auch provisionsfreie Angebote von Bauträgern, von Eigentumswohnungen über Einfamilienhäuser und Villen (Nutzung privat und gewerblich) bis hin zu renditeträchtigen Miethäusern für Investoren finden Sie unter www.bbi-immobilien.de'];true;166;1;5;;;3;;true;;;
2020-05-11 12:31:08.171666;Berlin;central_heating;ONE_YEAR_FREE;17610703;n;y;https://pictures.immobilienscout24.de/listings/5e84a9f9-3f61-4c12-a59a-556b743bcca3-1360122267.jpg/ORIG/resize/118x118%3E/extent/118x118/format/jpg/quality/80;11;12.1;40 MBit/s;telekom_layer_magenta_l;über VDSL;1920;REGULAR;;12.1;116555546;gas;y;false;MagentaZuhause L;y;Berlin;y;7;1;1;energy_consumption;7.07;63.3;Berlin;10825;well_kept;normal;NO_INFORMATION;false;100 MBit/s;no_information;"Heylstra&szlig;e";y;https://padlock.link/ioml;https://padlock.link/ml;Heylstraße;apartment;10825;2;99.4;n;2,active;true;Deutschland;top;100 MBit/s;wohnung_kauf;n;web,email,bank,music,dl-ul,game,sd,mltstr,hd,fast-ul-dl;true;009.eb808053-c275-4395-8fce-dc755606f8bd;340000;profile0;2;true;n;;n;n;Schöneberg_Schöneberg;116555546;3;Berlin;/expose/116555546;['Schöne und voll möblierte Wohnung mit sonnigem Balkon im Herzen von Schöneberg.\n\nDie inserierte Wohnung befindet sich in einem TOP Altbaugebäude aus dem Jahr 1920 in einer ruhigen Lage im Südwesten Schönebergs. Die Raumaufteilung dieser 1A Wohnung ist so geschnitten, dass die Fläche optimalen Platz bietet.\n\nDie Zwei-Zimmerwohnung mit ca. 63 m² im 3. Obergeschoss besteht aus einem geräumigen Wohnzimmer mit sonnigem Balkon, einem schönen Schlafzimmer, einer vollständig renovierten Küche und einem Badezimmer mit luxuriöser Badewanne. Zudem bietet die Wohnung große Fenster, hohe Decken und einen Parkettboden.\n\nDie Küche ist neu und verfügt über einen Elektroherd mit Ofen, einen großen Kühlschrank, eine Waschmaschine und einen Essbereich für 2 Personen.\n\nDie Einrichtungsmöbeln sind im Kaufpreis enthalten.', '- Wohnzimmer mit zwei Fenstern\n- Schlafzimmer mit Fenster\n- separate Küche mit Fenster\n- Badezimmer (gefliest) mit einem Fenster\n- Bodenbelag besteht aus Holzdielen', 'Mitten im pulsierenden Trendbezirk Schöneberg, liegt in ruhiger Lage, unweit des Schöneberger Rathauses, die Koburger Straße. Fußläufig sind nicht nur gepflegte Grünflächen und Parks erreichbar, auch die Verkehrsanbindung ist in alle Richtungen ausserordentlich gut. Der öffentliche Nahverkehr erschließt mit den S-Bahnhöfen Schöneberg und Innsbrucker Platz, sowie dem U-Bahnhof Rathaus Schöneberg und zahlreichen Busanbindungen genauso optimal die Lage, wie auch die schnell erreichbaren Autobahnauffahrten zur A100 und A103.\nAuch für den täglichen Bedarf ist mit der nahliegenden Kaiser-Wilhelm-Passage, diversen Restaurants und der kulinarisch vielfältigen Läden entlang der Potsdamer Straße, für jedes Bedürfnis gesorgt. Für einen ausgiebigeren Einkauf bietet sich die nicht unweit entfernt liegende Schlossstraße mit diversen Läden und Passagen an.', 'Gerne vereinbaren wir einen Besichtigungstermin mit Ihnen vor Ort. Bitte senden Sie uns hierfür Ihre Kontaktdaten inklusive Emailadresse und Telefonnummer über das Kontaktformular zu oder auf dem telefonischen Wege unter: +49 176 34954367.\n\n\nDie in diesem Exposé angegebenen Wohn- und\nNutzflächen und Informationen zum Objekt beruhen auf\nAngaben Dritter. Für die Richtigkeit der Angaben\nübernehmen wir keine Gewähr. Irrtum und\nZwischenverkauf/Zwischenvermietung vorbehalten.'];true;174;3;;;;;;;;;
2020-05-11 12:31:08.569480;Berlin;central_heating;ONE_YEAR_FREE;5448142;n;y;https://pictures.immobilienscout24.de/listings/40c78493-0859-4e5c-ba84-4011dcf02bdd-1314490862.jpg/ORIG/resize/118x118%3E/extent/118x118/format/jpg/quality/80;14;9.67;40 MBit/s;telekom_layer_magenta_l;über VDSL;;REGULAR;;9.67;111807787;natural_gas_heavy;y;false;MagentaZuhause L;n;Berlin;y;6;;no_information;energy_consumption;5.22;57;Berlin;13507;fully_renovated;sophisticated;;false;100 MBit/s;no_information;no_information;n;https://padlock.link/ioml;https://padlock.link/ml;no_information;roof_storey;13507;2.5;97;n;2,active;true;Deutschland;standard;100 MBit/s;wohnung_kauf;y;web,email,bank,music,dl-ul,game,sd,mltstr,hd,fast-ul-dl;true;001.5448142;270000;profile0;2;true;n;showqualicontactform;n;n;Tegel_Reinickendorf;111807787;2;Berlin;/expose/111807787;['Wichtig, bitte beachten:\n\nAG Berlin kippt Mietendeckel\nBundesrecht vor Landesrecht\nn-tv.de/ratgeber/\n\n\nProvisionsfrei!!!\nVerkaufe sehr schöne DG Wohnung (2 Zimmer + Kammer) im sanierten Altbau mit Terasse und offener Küche in zentraler Lage in Tegel/ Reinickendorf.\nU + S-Bahn, Bus, Spielplätze, sowie diverse Einkaufsmöglichkeiten und Restaurants fußläufig erreichbar. Trotzdem ruhig gelegen.\nAutobahnanschluss 3 min entfernt.\nEin individueller Mieterkeller ist im Gebäude vorhanden.', 'Parkett, Fliesen, EBK, Oberlichter, Badewanne', 'Den Naherholungsort Tegeler See erreicht man ebenfalls zu Fuß in ca. 10 Minuten.\nDurch den Ausbau (Fertigstellung 2019/2020) des neuen Tegel Shopping Centers wird sich die Attraktivität der Wohnung noch weiter erhöhen', 'Die Wohnung ist an einen zuverlässigen Mieter seit 2016 vermietet.\nIst Rendite 2,8 %.\nGute Wertsteigerungsmöglichkeit durch Fertigstellung des neuen Tegel Shopping Centers und durch den sehr gerfragten Standort Berlin.'];;125;5;5;;;;;;;;2015
