timestamp;obj_regio1;obj_heatingType;obj_telekomTvOffer;obj_cId;obj_newlyConst;obj_balcony;obj_picture;obj_picturecount;obj_pricetrend;obj_telekomUploadSpeed;obj_telekomTrackingGroup;obj_telekomInternetTechnology;obj_yearConstructed;obj_telekomInternetType;obj_galleryAd;obj_pricetrendbuy;obj_scoutId;obj_firingTypes;obj_hasKitchen;obj_ExclusiveExpose;obj_telekomInternetProductName;obj_courtage;geo_bln;obj_cellar;obj_purchasePriceRange;obj_yearConstructedRange;obj_houseNumber;obj_energyType;obj_pricetrendrent;obj_livingSpace;geo_krs;obj_zipCode;obj_condition;obj_interiorQual;obj_energyEfficiencyClass;ga_cd_cxp_historicallisting;obj_telekomDownloadSpeed;obj_parkingSpace;obj_street;obj_lift;obj_telekomInternetUrlMobile;obj_telekomInternetUrl;obj_streetPlain;obj_typeOfFlat;geo_plz;obj_noRooms;obj_thermalChar;obj_assistedLiving;obj_ityp;obj_telekomHdTelephone;geo_land;ga_cd_via;obj_telekomInternet;obj_immotype;obj_rented;obj_telekomInternetServices;obj_telekomInternetProductAvailable;obj_cwId;obj_purchasePrice;ga_cd_application_requirements;obj_noRoomsRange;ga_cd_maillead_default_shown;obj_garden;evt_count_pm_sig;obj_barrierFree;obj_international;obj_regio3;obj_objectnumber;obj_livingSpaceRange;obj_regio2;URL;beschreibung;ga_cd_developer_virtualreality;obj_rentSubsidy;obj_floor;obj_numberOfFloors;ga_cd_customer_group;obj_noParkSpaces;obj_groupnumber;obj_usableArea;ga_cd_via_qualified;obj_project_id;obj_nbp;obj_lastRefurbish
2020-05-11 12:31:00.041414;Berlin;central_heating;ONE_YEAR_FREE;16225148;n;n;https://pictures.immobilienscout24.de/listings/b025e9d5-4a83-49a3-8a95-f88fe8540a7b-1358304256.jpg/ORIG/resize/118x118%3E/extent/118x118/format/jpg/quality/80;13;11.48;40 MBit/s;telekom_layer_magenta_l;über VDSL;1996;REGULAR;disabled;11.48;116555053;district_heating;n;false;MagentaZuhause L;y;Berlin;n;6;5;no_information;energy_consumption;7.14;85.3;Berlin;10243;no_information;no_information;C;false;100 MBit/s;no_information;no_information;n;https://padlock.link/ioml;https://padlock.link/ml;no_information;apartment;10243;3;88;n;2,active;true;Deutschland;standard;100 MBit/s;wohnung_kauf;n;web,email,bank,music,dl-ul,game,sd,mltstr,hd,fast-ul-dl;true;001.15930480;279000;profile0;3;true;n;showqualicontactform;n;n;Friedrichshain_Friedrichshain;785;4;Berlin;/expose/116555053;['Das sehr gepflegte Mehrfamilienhaus liegt im Zentrum von Friedrichshain. Es wurde 1996 erbaut, ständig modernisiert und besteht aus 49 Einheiten. \n\nDie vermiete Wohnung liegt in der 4. Etage und ist hervorragend über einen modernen Aufzug zu erreichen. \n\nDie gesamte Wohnfläche erstreckt sich über 85,3 qm und besticht durch eine große Fensterfront mit bodentiefen Fenstern und durchgängigem großen Balkon. Die ganze Fensterfront ist mit Jalousien ausgestattet.\n\nDie Jahresnettokaltmiete beträgt seit 2018 € 9.028,20. \nDer Mietvertrag ist aus 2003.\n\nDie gesamte Wohneinheit ist dadurch lichtdurchflutet. Vom Wohn-/ Essbereich führen gleich zwei Terrassentüren auf den großzügigen Außenbereich. \nDes weiteren gelangt man aus dem benachbarten Masterbedroom auch durch eine zweiflügelige bodentiefe Fenstertür auf den Balkon. Er bietet vielfältige Gestaltungsmöglichkeiten, welche das derzeitige Mieterehepaar sehr schön nutzt.\n\n\nDie durchgängige Küche bietet eine Verbindung zwischen dem Wohnbereich und dem Flur, von welchem noch das zweite individuell zu nutzende Zimmer abgeht. Die Küche ist vollausgestattet. Das Badezimmer ist mit einem Doppelwaschbecken und einer Duschwannenkombination sehr funktionell ausgestattet, die hellen freundlichen Fliesen runden den Raum ab. Der gesamte Wohnbereich ist mit schönem Holzlaminat ausgelegt und Küche und Bad sind mit hellen Bodenfliesen ausgelegt. \n\nDie Wohnung ist seit 2003 an ein sehr kooperatives Ehepaar vermietet. Sie pflegen die Wohnung sehr und sind für jeden Anleger ein Gewinn.\n', '- Ein Parkplatz kann für 100,-€ im Monat angemietet werden.\n- Keller\n- Balkon 18 qm\n- Fahrstuhl\n- Laminatfußboden\n- Jalousien rundum\n', 'Der Bezirk Friedrichshain ist einer der dynamischen und entwicklungsstarken Stadtteile im Osten von Berlin. \n\nEs wurde in Friedrichshain viel Liebe in die Restaurierung von Altbauten und in die Entstehung eines sympathischen Kiezgefühls gesteckt. Diverse neue Parkanlagen und viele neue Cafés, Restaurants, Boutiquen und Einkaufmöglichkeiten bieten für alle eine lebendige und attraktive Wohnkultur. \nAlt und Jung haben hier eine tolle Lebensqualität. \n\nDie Hildegard-Jadamowitz-Straße lehnt sich an die klassische Moderne der 1920iger Jahre an und ist eine ruhige Seitenstraße der Frankfurter Allee. Vor der Tür liegt der kleine Park Weberwiese, der zum Entspannen einlädt. Eine Bushaltestelle sowie die U-Bahn Linie U5 sind fußläufig in wenigen Minuten zu erreichen.\n'];;;;;;;;;;;;
2020-05-11 12:31:00.371436;Berlin;self_contained_central_heating;ONE_YEAR_FREE;17689537;n;n;https://pictures.immobilienscout24.de/listings/b8099cdd-b20e-4b71-9c9e-18959dc82e6d-1356851242.jpg/ORIG/resize/118x118%3E/extent/118x118/format/jpg/quality/80;15;11.48;10 MBit/s;telekom_layer_magenta_m;über VDSL;1902;REGULAR;;11.48;116559082;gas;n;false;MagentaZuhause M;n;Berlin;n;7;1;13;energy_required;7.14;71.03;Berlin;10247;well_kept;no_information;;false;50 MBit/s;no_information;Dolziger Str.;n;https://padlock.link/iomm;https://padlock.link/mm;Dolziger_Str.;apartment;10247;2;207.4;n;2,active;true;Deutschland;top;50 MBit/s;wohnung_kauf;n;web,email,bank,music,dl-ul,game,sd,mltstr,hd,fast-ul-dl;true;009.d41f4c69-eb7b-4709-b891-42c728a6b026;345000;profile0;2;true;n;showqualicontactform;n;n;Friedrichshain_Friedrichshain;ANG001_DS13_WE18.DU;3;Berlin;/expose/116559082;['CHARMANTER ALTBAU MIT EINER VIELZAHL VON KLASSISCHEN ALTBAUELEMENTEN!\n\nBei dieser Immobilie (Denkmalschutz) handelt es sich um einen wunderschönen und gepflegten Altbau bestehend aus einem Vorderhaus, einem Seitenflügel sowie einem Quergebäude. Auf diese Immobilie verteilen sich insgesamt 21 Einheiten. Das gesamte Gebäude ist voll unterkellert.\nDie wunderschöne Außenfassade mit teils noch vorhandenen Stuckelementen, die geschmackvollen Treppenaufgänge mit altbautypischen Eingangstüren versprühen den klassichen Altbaucharme. Hier kommen Sie gern nach Hause.', 'BESONDERE WOHNUNG IM KLASSISCHEN ALTBAU - GEPFLEGT UND INTERESSANT GESCHNITTEN!\n\nInteressante, praktisch geschnittene und gepflegte Altbauwohnung mit Laminatfußboden, gefliestem Wannenbad, separatem Raum für die Waschmaschine sowie separater und gefliester Küche mit Fenster. Die Zimmer sind ausreichend groß dimensioniert und alle separat zu begehen.\nEine perfekte Wohnung in einem beliebten Kiez, die auch für eine Wohngemeinschaft nutzbar wäre.', 'SAMARITERKIEZ - ABSOLUT GEFRAGTE LAGE - RUHIG UND DENNOCH ZENTRAL!\n\nDie Immobilie befindet sich in einer ruhigen und unaufgeregten Seitentraße der Samariterstraße im nördlichen Samariterkiez. Diverse Restaurants, Cafés, Bars und Clubs befinden sich in direkter Wohnumgebung. Ebenso sind Einkaufsmöglichkeiten in ausreichender Zahl vorhanden. Natürlich dürfen auch Kindergärten und Schulen nicht fehlen. Die Anbindung an den öffentlichen Nahverkehr ist ebenso als sehr gut zu bezeichnen. Den U-Bahnhof Samariterstraße sowie den U-/S-Bahnhof Frankfurter Allee erreichen Sie fußläufig innerhalb kürzester Zeit (ca. 5 Minuten). Und wenn Sie Erholung von stressigen Großstadtalltag brauchen, dann nutzen Sie die vielen Parks (Blankensteinpark, Forckenbeckplatz, Stadtpark Lichtenberg, ...) und die grünen Straßenzüge im Samariterkiez. \nEs erwartet Sie eine fantastische Infrastruktur in einer sehr gefragten Wohnlage!', 'Wir freuen uns von Ihnen zu hören und stehen für weitere Fragen und einen Besichtigungstermin selbstverständlich gern zur Verfügung!'];true;185.05;1;5;;;;;;;;
2020-05-11 12:31:00.688230;Berlin;district_heating;ONE_YEAR_FREE;15485505;n;y;https://pictures.immobilienscout24.de/listings/335007f6-e702-44f1-b71b-83de6be813e4-1356808969.jpg/ORIG/resize/118x118%3E/extent/118x118/format/jpg/quality/80;9;11.28;40 MBit/s;telekom_layer_magenta_l;über VDSL;1956;REGULAR;disabled;11.28;113861074;district_heating;n;true;MagentaZuhause L;y;Berlin;y;5;2;no_information;energy_consumption;6.36;53;Berlin;10789;well_kept;normal;E;false;100 MBit/s;no_information;no_information;n;https://padlock.link/ioml;https://padlock.link/ml;no_information;apartment;10789;2;149;n;2,active;true;Deutschland;standard;100 MBit/s;wohnung_kauf;y;web,email,bank,music,dl-ul,game,sd,mltstr,hd,fast-ul-dl;true;002.01002710613;215000;profile0;2;true;n;showqualicontactform;n;n;Wilmersdorf_Wilmersdorf;DKAB19619;2;Berlin;/expose/113861074;"['Die zum Verkauf stehende Wohnung befindet sich einem 1956 errichteten Wohnhaus mit drei Aufgängen. \nDie Wohnung befindet sich in einem sehr gepflegten Zustand. \nIn den Wohnbereichen wurde ansprechendes Laminat verlegt.\nDie Küche ist ausgestattet mit einer Einbauküche inklusive Kühlschrank, auch die Waschmachine findet dort ihren Platz.\nDas Tageslichtbad ist modern gefließt mit einer bequemen Eckbadewanne.\nAn das Wohnzimmer schließt sich der nach Süden ausgerichtete Balkon an.\nEin bereits bestehender Mietvertrag für einen PKW- Stellplatz auf dem Hof kann übernommen werden.\nDas Gebäude wird mit Fernwärme zentral beheizt. Zur Wohnung gehört ein Kellerabstellraum.\n\nDie Wohnung ist vermietet. Der Mietvertrag datiert vom 01.05.2008 . Die aktuelle Bruttokaltmiete beträgt  € 475,-monatlich. Darüber hinaus entrichtet die Mieter € 40,- Heizkosten.', ""Die zum Verkauf stehende Wohnung befindet sich in einer der besten und gefragtesten Wohnlagen von Berlin in unmittelbarer Nähe zum Kurfürstendamm und zur Tauentzienstraße mit allen erdenklichen Annehmlichkeiten und Shopping-Möglichkeiten. Egal ob KaDeWe, Europa-Center oder Bikini-Haus, alles liegt vor der Haustür.\nUnzählige Restaurants und Café's sorgen für das leibliche Wohl.\nDiverse Bushaltestellen und die U-Bahnhöfe Augsburger Straße und Wittenbergplatz  sind die direkte Verbindung zum Nahverkehrsnetz.\nIn dieser Lage kann man die City West in ihrer ganzen Pracht erleben und spüren."", 'WIR SIND IHR PARTNER RUND UM DIE IMMOBILIE.\n\nWAS IST IHRE IMMOBILIE WERT?\nWir bieten Eigentümern eine fachkundige und individuelle Beratung und Bewertung ihrer Immobilien in Berlin, Potsdam und Umland – professionell, unverbindlich, kostenfrei. Sprechen Sie uns an.\n\nIMMOBILIENVERKAUF\nWir vermitteln mit fundierter Marktwerteinschätzung und verkäuferischem Sachverstand Wohn- und Geschäftsimmobilien, Häuser, Grundstücke und Eigentumswohnungen.\n\nFür Ihr persönliches Informationsgespräch erreichen Sie uns unter 030 – 270 17 68 88.\n\nMit Ihrer Anfrage werden Ihre Kontaktdaten an uns übermittelt. Um Ihr Anliegen zu bearbeiten, werden Ihre Daten durch uns erfasst und digital gespeichert. Weitere Informationen zum Thema Datenschutz finden Sie auf unserer Homepage.\n\nMitglied im Immobilienverband Deutschland - IVD']";;195;;2;;;;;;;;
2020-05-11 12:31:01.161615;Berlin;no_information;ONE_YEAR_FREE;456215;n;y;https://pictures.immobilienscout24.de/listings/f4791f89-76a3-4eca-89db-0b5f68f334bf-1356858071.jpg/ORIG/resize/118x118%3E/extent/118x118/format/jpg/quality/80;21;10.99;40 MBit/s;telekom_layer_magenta_l;über VDSL;;REGULAR;;10.99;116559752;;y;false;MagentaZuhause L;y;Berlin;y;7;;no_information;;5.59;102;Berlin;13585;modernized;normal;;false;100 MBit/s;no_information;no_information;n;https://padlock.link/ioml;https://padlock.link/ml;no_information;roof_storey;13585;4;;n;2,active;true;Deutschland;standard;100 MBit/s;wohnung_kauf;n;web,email,bank,music,dl-ul,game,sd,mltstr,hd,fast-ul-dl;true;001.456215;358000;profile0;4;true;n;showqualicontactform;n;n;Spandau_Spandau;Span - ETW - Fhs 63;5;Berlin;/expose/116559752;['Vielen Dank für Ihr Interesse an dem Objekt, das im Alleinauftrag angeboten wird. \n\nDie Wohnung im 4. OG mit Terrasse und Fernblick steht ab sofort zum Verkauf und ist nach Absprache bezugsfrei. Das Haus wurde um ca. 1908 erbaut, das Dach wird in Kürze erneuert.\n\nDie Wohnung verfügt über 4 Zimmer, das monatliche Wohngeld beträgt 258€, inklusive Instandhaltungsrücklage. Zur Wohnung gehört ein trockener Keller, Größe etwa 17 qm. Der Bodenrichtwert für das Grundstück 2019 liegt (noch) bei 850€ / qm.\n\n***Bitte habe Sie dafür Verständnis, dass ein Versand des Exposés nur nach Angabe Ihrer Kontaktdaten erfolgen kann.***', 'Das Bad befindet sich links des Eingangs und wurde neu gefliest. Insbesondere wurden großformatige Bodenfliesen im Verband verlegt. Die Fliesen der an den Wandoberflächen wurden bis tlw. „Unterkante Decke“ verlegt, so dass sämtliche Spritzwasser-Bereiche geschützt sind. Im Zuge der Modernisierung wurden ebenso sämtlich Rohr - und Elektroleitungen erneuert. \n\nDie geflieste Einbauküche ist ein Produkt aus heimischer Produktion. Das heißt, dass die\nKorpi  / Korpusse (Möbel ohne Fronten) belassen werden könnten, da sich diese in einem guten Zustand befinden. Ein Auswechseln der Fronten und der Arbeitsplatte erscheint möglich, wobei nicht erforderlich, somit ließen sich erhebliche Kosten einsparen. Technische Situation in Absprache mit einem Tischler.\n\nIm Anschluss an das Bad befindet sich Zimmer 1, das als Kinder-, Gäste-, oder Arbeitszimmer genutzt werden kann. Ebenso wurde hier ein modernes Kunstofffenster eingebaut. Der Boden ist mit „Click - Laminat“ ausgelegt, es befindet sich ein Wandheizkörper unterhalb in der ersichtlichen Nische, so dass dieser platzsparend untergebracht werden konnte. \n\nDurch die Größe des Schlafzimmers ist es überhaupt kein Problem Betten im Format Kingsize / Queensize samt Beistelltische dort unterzubringen. Ein größerer Einbauschrank, vom Tischler auf Maß gefertigt, ist vorhanden, dieser kann aus praktischen Erwägungen in der Wohnung verbleiben. \n\nDas in Richtung Ost und West ausgerichtet ist verfügt über den Zugang zur großzügigen Dachterrasse. Vorteil: Im Hochsommer von unmittelbarer Sonneneinwirkung verschont, bleibt es lt. Aussage des Eigentümers angenehm kühl. Auch durch die Unterstützung der eigens installierten Klimaanlage.\n\nKinderzimmer. Dies befindet sich auf der Westseite direkt neben dem Wohnzimmer. Ersichtlich ist der Abstand zum Nachbargebäude, was auch hier für eine ausreichende Ausleuchtung des Zimmers sorgt. Neue Kunstoffenster mit Heizkörper unter der Fensterbrüstung und Vinylboden sind Bestandteil dieses letzten Zimmers. Steckdosen befinden sich oberhalb der Sockelleisten. Ideal als Kinder- / Gäste- und oder Arbeitszimmer.\n\nDer Blick von der Dachterrasse geht in Richtung Westen. Durch eine vom Schlosser hergestellte, massive Sonnenschutzkonstruktion, die sich mit Lamellen im Hochsommer abdecken lässt, genießt man den unverbaubaren Blick. Die Terrasse verfügt über eine Größe\n\nZur Disposition - Bestandteil des Angebotes - steht ein trockener Keller mit ca. 17 qm\nFläche. Durch das vorhandene Fenster lässt sich dieser belüften, damit kein Schimmel\nentsteht. Ideal für die Einrichtung einer Werkstatt. Mehrere Steckdosen und / oder Kabelauslässe sorgen für eine entsprechend helle Ausleuchtung.', 'Die Wohnung befindet sich unweit der Havel. Es befinden sich folgende Öffentliche Verkehrsmittel im Umfeld, die problemlos zu Fuß erreichbar sind.  \n\nU 7, Altstadt Spandau\nS - Bahn, Rathaus Spandau\nRegionalbahn\nBuslinien 130, 134, 137, 337, 671, M37, M45', 'Wer ein „saubere und unkomplizierte“ Immobilie innerhalb einer gepflegten Wohnanlage erwerben möchte, die von einer engagierter Eigentümergemeinschaft und „rührigem“ Hausverwalter „in Schuss“ gehalten wird, sollte sich eine Besichtigung nicht entgehen lassen. Hervorzuheben ist der hochtransparente Wirtschaftsplan. \n\nBei Kaufabsicht ist ein Kapitalnachweis und / oder eine Finanzierungsbestätigung einer deutschen Bank mit Kontaktdaten Ansprechpartner zu erbringen. Für diesen Fall liegen die letzten 3 Protokolle der Eigentümerversammlung, Abrechnungen, sowie ein aktueller Grundbuchauszug vor. \n\nDie in dieser Beschreibung gemachten Angaben beruhen auf Auskünften des Eigentümers. Somit kann unsererseits keine Haftung für die hier gemachten Angaben und Daten übernommen werden. \n\nEin Zwischenverkauf bleibt vorbehalten.'];;258;4;4;home_builder;;;;;;;
2020-05-11 12:31:01.499807;Berlin;gas_heating;ONE_YEAR_FREE;18052783;n;y;https://pictures.immobilienscout24.de/listings/be8dd131-e1fc-47a6-892b-05873d47b227-1364135641.jpg/ORIG/resize/118x118%3E/extent/118x118/format/jpg/quality/80;8;9.64;40 MBit/s;telekom_layer_magenta_l;über VDSL;1993;REGULAR;;9.64;116551366;no_information;y;false;MagentaZuhause L;n;Berlin;y;6;5;no_information;energy_consumption;4.62;59.48;Berlin;12307;no_information;no_information;;false;100 MBit/s;no_information;no_information;n;https://padlock.link/ioml;https://padlock.link/ml;no_information;apartment;12307;2;119.9;n;2,active;true;Deutschland;top;100 MBit/s;wohnung_kauf;y;web,email,bank,music,dl-ul,game,sd,mltstr,hd,fast-ul-dl;true;002.01008679649;253000;profile0;2;true;n;showqualicontactform;n;n;Lichtenrade_Tempelhof;499080;2;Berlin;/expose/116551366;"['""Raus aus der Stadt, ab ins Grüne"" - dieser Traum vieler wird mit einer Wohnung im Evergreen in Lichtenrade erfüllt. Hier stehen elf Wohneinheiten, die sich über vier Geschosse verteilen, zum Verkauf. Alle Wohnungen verfügen über zwei bis drei Zimmer und Wohnflächen zwischen ca. 59 m² und 83 m². Zur ruhigen Gartenseite hin sind auch die Balkone und Loggien ausgerichtet, die jedem Bewohner im Evergreen einen schönen, sonnigen Freiblick garantieren.', 'Sehr gepflegte, vermietete Wohnung im Herzen von Lichtenrade\r\n\r\n-    Zwei voneinander getrennte Zimmer mit hellem Laminat ausgestattet\r\n-    Vom Wohnzimmer abgehend ein Sonnenbalkon mit Blick zum Garten\r\n-    Gespachtelte Wände\r\n-    Innenliegendes Bad mit Dusche und Wanne\r\n-    Einbauküche\r\n-    Keller\r\n-    Garage kann käuflich erworben werden\r\n', 'Gelegen im malerischen Süden Berlins, direkt an der Grenze zu Brandenburg, ist Lichtenrade historisch ländlich geprägt. Die Straßen sind von schönem, altem Baumbestand gesäumt und die lockere Bebauung mit Elementen der späten Gründerzeit, sowie auch vielen Einfamilienhäusern mit Gartenanlage, verstärken den Eindruck dörflicher Idylle.\r\n\r\n-    2 min. Gehweg zum S-Bahnhof Lichtenrade\r\n-    20 min. mit der S-Bahn zum Potsdamer Platz\r\n-    30 min. mit dem ÖPNV zum Hauptbahnhof\r\n-    15 min. mit dem Auto zum Flughafen Schönefeld\r\n-    Direkt an der Diedersdorfer Heide gelegen\r\n-    Restaurants, Cafés und Bars fußläufig zu erreichen\r\n-    Einkaufsmöglichkeiten in unmittelbarer Umgebung, zum Beispiel Rewe, Bäcker, Netto, Aldi']";;275.99;1;3;;1;5;;;;;
2020-05-11 12:31:01.957861;Berlin;central_heating;ONE_YEAR_FREE;15126861;n;n;https://pictures.immobilienscout24.de/listings/602a441c-b600-4bda-9104-d705fd49fe93-1356823967.jpg/ORIG/resize/118x118%3E/extent/118x118/format/jpg/quality/80;24;13.14;40 MBit/s;telekom_layer_magenta_l;über VDSL;1968;REGULAR;;13.14;116555361;oil;y;true;MagentaZuhause L;y;Berlin;y;6;2;no_information;energy_consumption;6.09;60;Berlin;12347;well_kept;normal;E;false;100 MBit/s;garage;no_information;y;https://padlock.link/ioml;https://padlock.link/ml;no_information;raised_ground_floor;12347;2;137;n;2,active;true;Deutschland;top;100 MBit/s;wohnung_kauf;n;web,email,bank,music,dl-ul,game,sd,mltstr,hd,fast-ul-dl;true;001.15093612;295000;profile0;2;true;n;showqualicontactform;n;n;Britz_Neukölln;5614_B;2;Berlin;/expose/116555361;['Verkauf Zwei-Zimmer-Eigentumswohnung mit Balkon und Garage\n\nEs handelt sich um eine sanierte und helle Zwei-Zimmer-Eigentumswohnung mit großem Südbalkon. Die Wohnung ist bezugsfrei und befindet sich im Hochparterre eines gepflegten Mehrfamilienhauses. \n\nDas Wohnhaus mit seinen insgesamt sechzehn Wohneinheiten wurde ca. 1968 in Massivbauweise errichtet. Die Wohnung ist vollständig saniert und in einem guten Zustand.\n\nSie teilt sich in ein helles Wohnzimmer mit Zugang zum großen Südbalkon, ein weiteres Zimmer, eine Küche mit funktioneller Einbauküche, ein Badezimmer mit Badewanne sowie einen Flur auf.\nDie Wohnfläche der Wohnung beträgt ca. 60,00 qm.\n\nDirekt unter der Wohnung gehört ein beheizbarer Garagenstellplatz in einer Doppelgarage zur Wohnung.\nDie Nutzfläche der Garage beträgt ca. 20,00 qm.\n\nDas monatliche Hausgeld beträgt derzeit ca. 212,00 €.\n\nFür diese Wohneinheit steht ein separater Kellerraum mit ca. 6 m² Nutzfläche sowie die Nutzungsmöglichkeit an einem gemeinschaftlichen Fahrradkeller zur Verfügung. \n\nLaut Auskunft des Verkäufers sind zur Stunde keine Modernisierungs- und Instandhaltungsmaßnahmen geplant.', '- sehr gepflegte und gut geschnittene Eigentumswohnung\n- Massivbauweise\n- Personenaufzug\n- helle zwei-Zimmer-Wohnung mit vielen Fensterflächen\n- Badezimmer mit Badewanne\n- funktionelle Einbauküche\n- Küche und Badezimmer tagesbelichtet\n- großer Südbalkon\n- separater Kellerraum\n- gemeinschaftlicher Fahrradkeller\n- große Garage unter der Wohnung\n- Straße befestigt und asphaltiert', 'Britz ist ein Berliner Ortsteil im Bezirk Neukölln mit ca. 43.000 Einwohnern, der baugeschichtlich bekannt geworden ist durch die Sendeanlage des Deutschlandradios, die Großsiedlung Britz, (Fritz-Reuter-Stadt) mit der Hufeisensiedlung, der Krugpfuhlsiedlung sowie der Großwohnsiedlung Britz-Buckow-Rudow, die seit 2002 den eigenen Berliner Ortsteil Gropiusstadt bildet.\n\nBei der Bildung von Groß-Berlin kam Berlin-Britz im Jahr 1920 als Landgemeinde des Kreises Teltow zum Bezirk Neukölln.\n\nSehenswert im Ortsteil sind unter anderem die Dorfkirche Britz, eine Feldsteinkirche aus der Zeit um 1250, der Gutshof Britz des ehemaligen Rittergutes, das Schloss Britz mit Gutspark, die Britzer Mühle, der Britzer Garten, die Ideal-Siedlung nördlich der mittleren Hannemannstraße und die Großsiedlung Britz, die in industrieller Fertigung als eines der ersten Projekte des sozialen Wohnungsbaus erstellt wurde und mit fünf weiteren „Siedlungen der Berliner Moderne“ im Juli 2008 in die UNESCO-Liste als Weltkulturerbe aufgenommen wurde.\n\nDie zum Verkauf stehende Immobilie befindet sich unweit des Britzer Damms.\n\nDer Ortsteil Britz ist durch verschiedene Bus- und U-Bahnlinien hervorragend an den öffentlichen Nahverkehr angeschlossen. Die Buslinien M44 sowie 170 halten in unmittelbarer Nähe. Der U-Bahnhof Blaschkoallee (U7) ist nicht weit entfernt. Die U7 bietet Umsteigemöglichkeiten zu anderen U-Bahnlinien und zur Ringbahn S41, 42. Den Autobahnanschluss A100/ A113 erreichen Sie in wenigen Minuten für eine schnelle Verbindung in alle Teile Berlins oder das Berliner Umland.\n\nIn der nahen Umgebung und fußläufig zu erreichen befinden sich sehr gute Einkaufsmöglichkeiten für die Dinge des täglichen Lebens, Cafés, Restaurants, Ärzte und Apotheken, diverse Schulen und Kitas sowie Spiel- und Sportplätze.', 'Bitte haben Sie dafür Verständnis, dass wir Informationen zur Immobilie nur an Interessenten geben, die uns ihre vollständige Anschrift mitgeteilt haben. Vielen Dank. Ihre Daten werden selbstverständlich vertraulich behandelt und nicht an Dritte weitergegeben.\n\nInnenbesichtigungen\nVor Absprache eines Innenbesichtigungstermins möchten wir Sie freundlichst bitten, eine diskrete Außenbesichtigung der Immobilie vorzunehmen, um sich Ihren persönlichen Eindruck von der Lage, dem Wohnumfeld und der Umgebung zu verschaffen.\nSollte Ihnen das Wohnumfeld zusagen, dann vereinbaren Sie bitte mit uns einen Innenbesichtigungstermin.\n\nHinweis\nWir bieten Ihnen diese Immobilie zu unseren Allgemeinen Geschäftsbedingungen an.\n\nCourtage\nDie Courtage in Höhe von 7,14 % des Kaufpreises (inklusive 19% MwSt.) wird vom Käufer getragen und ist verdient und zahlbar an die EMA IMMOBILIEN GMBH nach Beurkundung des notariellen Kaufvertrages.\n\nWir freuen uns über Ihren Anruf oder Ihre Anfrage.\n\nSie möchten Ihre Immobilie verkaufen? \nUnsere Beratung zum Immobilienverkauf ist kostenfrei. Wir freuen uns auf Ihre Anfrage.\nwww.ema-immobilienwert.de'];;212;;4;;1;25;26;;;;
