timestamp;obj_regio1;obj_telekomTvOffer;obj_cId;obj_newlyConst;obj_balcony;obj_picture;obj_picturecount;obj_pricetrend;obj_telekomUploadSpeed;obj_telekomTrackingGroup;obj_usableArea;obj_telekomInternetTechnology;obj_yearConstructed;obj_telekomInternetType;obj_pricetrendbuy;obj_scoutId;obj_firingTypes;obj_hasKitchen;obj_ExclusiveExpose;obj_telekomInternetProductName;obj_courtage;geo_bln;obj_cellar;obj_purchasePriceRange;obj_yearConstructedRange;obj_rentSubsidy;obj_houseNumber;obj_energyType;obj_pricetrendrent;obj_livingSpace;geo_krs;obj_zipCode;obj_condition;obj_interiorQual;obj_energyEfficiencyClass;ga_cd_cxp_historicallisting;obj_telekomDownloadSpeed;obj_parkingSpace;obj_street;obj_lift;obj_telekomInternetUrlMobile;obj_telekomInternetUrl;obj_streetPlain;obj_typeOfFlat;geo_plz;obj_noRooms;obj_thermalChar;obj_assistedLiving;obj_ityp;obj_telekomHdTelephone;geo_land;ga_cd_via;obj_telekomInternet;obj_immotype;obj_rented;obj_telekomInternetServices;obj_telekomInternetProductAvailable;obj_cwId;obj_purchasePrice;ga_cd_application_requirements;obj_numberOfFloors;obj_noRoomsRange;ga_cd_maillead_default_shown;obj_garden;evt_count_pm_sig;obj_barrierFree;obj_international;obj_regio3;obj_objectnumber;obj_livingSpaceRange;obj_regio2;URL;beschreibung;obj_heatingType;obj_lastRefurbish;obj_groupnumber;obj_galleryAd;obj_noParkSpaces;obj_floor;obj_telekomHybridUploadSpeed;obj_telekomHybridDownloadSpeed
2020-05-11 12:42:43.803229;Berlin;ONE_YEAR_FREE;17657688;n;n;https://pictures.immobilienscout24.de/listings/d6bb509b-b332-40c8-8a7f-69c529c7c510-1333540903.jpg/ORIG/resize/118x118%3E/extent/118x118/format/jpg/quality/80;16;9.96;40 MBit/s;telekom_layer_magenta_l;10;über VDSL;1905;REGULAR;9.96;114455008;gas;y;true;MagentaZuhause L;y;Berlin;y;7;1;220;no_information;energy_consumption;4.45;98;Berlin;12527;well_kept;sophisticated;D;false;100 MBit/s;no_information;no_information;n;https://padlock.link/ioml;https://padlock.link/ml;no_information;ground_floor;12527;3;123;n;2,active;true;Deutschland;standard;100 MBit/s;wohnung_kauf;n;web,email,bank,music,dl-ul,game,sd,mltstr,hd,fast-ul-dl;true;002.01008357166;395000;profile0;2;3;true;y;showqualicontactform;n;n;Grünau_Köpenick;43130102-02051;4;Berlin;/expose/114455008;"['Die Wohnung befindet sich in einem massiv erbauten Mehrfamilienhaus. Das Haus und die Wohnung wurden komplett modernisiert. Zu der Wohnung gehört eine Gartenbenutzung.', 'Die Ausstattung ist sehr hochwertig . Die Einbauküche mit Kochinsel läßt jedem Hobbykoch das Herz höher schlagen. Die Wohnräume sind mit Echtholzparkett (Stabparkett) ausgestattet. Im Flur wurde Mamorboden verbaut. Die Keramik und Fliesen im Bad sind von der Firma Villeroy und Boch.', 'Die gewässerreiche Naturlandschaft, die Waldnähe und die unmittelbare Nähe zur ""Dahme"" verwandeln die Wohngegend in ein Naherholungsgebiet.\r\nDennoch ist die Anbindung an die öffentlichen Verkehrsmittel gegeben und Einkaufsmöglichkeiten des täglichen Bedarfs befinden sich in der Nachbarschaft.']";;;;;;;;
2020-05-11 12:42:44.406296;Berlin;ONE_YEAR_FREE;444428;n;y;https://pictures.immobilienscout24.de/listings/b76da188-2930-4d62-bc88-18fd54c86042-1364448333.jpg/ORIG/resize/118x118%3E/extent/118x118/format/jpg/quality/80;18;7.89;40 MBit/s;telekom_layer_magenta_l;;über VDSL;1984;REGULAR;7.89;114438802;oil;y;false;MagentaZuhause L;y;Berlin;y;9;4;538;no_information;energy_required;3.38;123.37;Berlin;14193;modernized;sophisticated;;false;100 MBit/s;no_information;no_information;n;https://padlock.link/ioml;https://padlock.link/ml;no_information;maisonette;14193;3;122;n;2,active;true;Deutschland;top;100 MBit/s;wohnung_kauf;n;web,email,bank,music,dl-ul,game,sd,mltstr,hd,fast-ul-dl;true;001.444428;690000;profile0;;3;true;y;;n;n;Grunewald_Wilmersdorf;123,37;6;Berlin;/expose/114438802;['Die 3 Zimmer-Maisonette-Wohnung befindet sich auf einem ca. 9.827 m² großen Parkgrundstück innerhalb einer Wohnanlage mit 9 Häusern im Villenviertel von Berlin-Grunewald.', 'Eine Wohn-Nutzfläche von ca. 123,37 m² verteilt sich über zwei Ebenen, auf das Erd-und tagesbelichtete Untergeschoss. Auf der Erdgeschossebene betreten Sie die Räume mit dem Blick vom Entrée aus in den Garten. Vom lichtdurchfluteten Wohnraum aus haben Sie Zugang zu einer großen Sonnenterrasse und in den Garten. Eine voll ausgestattete Küche , ein Schlafraum und ein Duschbad vervollständigen den oberen Wohnbereich. Über eine interne Treppe gelangen Sie in das , im Souterrain gelegene große Schlafzimmer mit Ankleide und Wannenbad (Hobbyraum). Sämtliche Räumlichkeiten sind mit Eichenparkett im Fischgrätenmuster verlegt, alle Fenster bieten den Blick ins Grüne und sind mit elektrischen Jalousien gesichert.', 'Die Wohnung  befindet sich  im Villenviertel von Berlin-Grunewald. Die „Villenkolonie Grunewald“, 1889 von dem damaligen Reichskanzler Bismarck gegründet, hinterlässt jenen Mythos, der den Wohnlagen westlich des Kurfürstendamms bis heute anhaftet. Hochherrschaftliche Villen und großzügige Parks prägen den diskreten Charme des Viertels, das neben viel Grün auch mehrere Seen zu bieten hat, Halensee, Dianasee, Herthasee, Hubertussee, Hundekehlesee, Koenigssee oder Grunewaldsee. \n\nDas Roseneck mit seinen hochwertigen Geschäften, medizinischen Versorgungen und Restaurants liegt ebenso in unmittelbarer Entfernung wie die Seenkette.  Bis zum Kurfürstendamm werden weniger als fünf Autominuten benötigt. \n\nAlle „kulturellen Einrichtungen“ der Stadt können binnen kürzester Zeit mit den öffentlichen Verkehrsmitteln erreicht werden. Die Verkehrsanbindung an alle städtischen Ziele , wie Flughäfen und Bahnhöfe sind sowohl über die Stadtautobahn als auch über die AVUS gewährleistet.'];no_information;2015;2409;;;;;
2020-05-11 12:42:44.823176;Berlin;ONE_YEAR_FREE;15424723;n;y;https://pictures.immobilienscout24.de/listings/c1d629af-6ec6-46ce-9f3f-47f4fab295f4-1339661919.jpg/ORIG/resize/118x118%3E/extent/118x118/format/jpg/quality/80;10;8.95;40 MBit/s;telekom_layer_magenta_l;;über VDSL;1998;REGULAR;8.95;114430456;district_heating;y;false;MagentaZuhause L;y;Berlin;y;4;5;206.34;no_information;energy_required;5.33;48.39;Berlin;12559;well_kept;normal;;false;100 MBit/s;underground_garage;no_information;y;https://padlock.link/ioml;https://padlock.link/ml;no_information;apartment;12559;1.5;94;n;2,active;true;Deutschland;top;100 MBit/s;wohnung_kauf;y;web,email,bank,music,dl-ul,game,sd,mltstr,hd,fast-ul-dl;true;001.15372524;155331.9;profile0;4;1;true;y;showqualicontactform;y;n;Köpenick_Köpenick;1034;2;Berlin;/expose/114430456;['Das im Jahr 1998 erbaute Wohnensemble befindet sich unweit von der beliebten Köpenicker Altstadt. Die Wohnung selbst befindet sich inmitten einer sehr ruhigen Wohnanlage in grüner Umgebung. Die Bausubstanz der Immobilie befindet sich augenscheinlich in einem sehr guten Zustand. \n\nDie Wohnung ist nach Süd-Westen ausgerichtet und bietet über den Balkon einen wunderschönen Blick ins Grüne. Die Wohnräume sind mit Parkett ausgestattet, Bad und Küche sind gefliest. Die vorhandene Einbauküche befindet sich in einem gepflegten Zustand und ist im Kaufpreis bereits enthalten.\n\nDie Wohnanlage wird über Privatstraßen nur von Anwohnern befahren. Die Zimmer der hier angebotenen Wohnung liegen beide von der Straße abgewandt. Die Wohnung ist deshalb besonders ruhig gelegen.\n\nDer Aufzug ist barrierefrei erreichbar und hält in jeder Etage. Auch der Keller ist mit dem Aufzug erreichbar. Die Wohnung eignet sich deshalb nicht nur für junge Singles/Studenten, sondern auch besonders gut für Senioren, die altersgerecht wohnen möchten.\n\nAuf Wunsch kann ein Tiefgaragenstellplatz in direkter Nähe zur Wohnung miterworben werden.\n', '- Holzfenster mit Isolierverglasung\n- Parkett im Wohn- und Schlafzimmer sowie im Flur\n- Zentralheizung (Fernwärme)\n- Moderne Konvektorenheizkörper\n- Innenliegendes Bad mit Badewanne\n- Balkon mit Südwestausrichtung\n- Kabelanschluss\n- Abstellraum im Keller\n- Fahrradabstellbereich im Innenhof\n', 'Treptow-Köpenick ist Berlins größter, wasser- und waldreichste Stadtteil, doch gleichzeitig auch der am wenigsten besiedelte. Durch die hohe Lebensqualität wird Köpenick vor allem bei Familien immer beliebter. Wohnen in Köpenick bedeutet Ruhe, Idylle, Natur und trotzdem eine gute Anbindung an das lebendige Treiben im Herzen der Hauptstadt. Anwohner und Touristen können hier Berlins größtes Waldgebiet, sein einziges Wasserschloss sowie den größten See der Hauptstadt genießen. Auch die historische Alststadt Köpenicks ist eine Sehenswürdigkeit. Sie gehört zu den ältesten Siedlungen Berlins. Vom Allendeviertel aus erreicht man die Köpenicker Altstadt in wenigen Minuten und auch mit den öffentlichen Verkehrsmitteln ist man gut an die Berliner Innenstadt angebunden (S47, Bus 165 und 169, Tram 60, 61 und 63).', 'Gerne lassen wir Ihnen für diese Immobilie bei Vorlage einer Kontaktformularanfrage mit Ihrem Vor- und Nachnamen, Ihrer Wohnanschrift, Ihrer Telefonnummer sowie Email-Adresse, ein ausführliches Exposé mit ergänzenden Angaben (z. B. Grundriss, zusätzliche Fotos und zusätzliche Informationen) zukommen. Unsere Exposés enthalten zudem die Anschrift der Immobilie, damit es ihnen möglich ist, sich zunächst einen Eindruck von der konkreten Lage zu verschaffen. Es gelten unsere Allgemeinen Geschäftsbedingungen. Diese, unser Impressum, eine Ausfertigung unserer Widerrufsbelehrung nebst Widerrufsformular sowie unsere Datenschutzerklärung finden Sie auf unserer Internetseite: www.estate-moments.de. Dieses Verkaufsangebot ist an Kaufinteressenten gerichtet. Bei Zustandekommen eines notariellen Kaufvertrags entsteht unser Anspruch auf Zahlung der genannten Provision somit gegenüber dem Käufer. Darüber hinhaus sind vom Käufer auch die Grunderwerbssteuer (in Berlin 6 % und in Brandenburg 6,5 % des Kaufpreises) sowie die Notar- und Grundbuchgebühren (ca. 2 % des Kaufpreises) zu bezahlen. \n\nLaut Verordnung Nr. 524/2013 der Europäischen Union (EU) sind wir als Immobilienmakler verpflichtet, auf unserer Internetseite im Impressum und bei Verkaufs- oder Vermietungsangeboten einen Hinweis auf die Online-Streitschlichtungsstelle aufzunehmen, die unter der folgenden Adresse zu finden ist: ec.europa.eu/consumers/odr.'];central_heating;1111;;disabled;1;1;;
2020-05-11 12:42:45.143177;Berlin;;16048948;n;n;https://pictures.immobilienscout24.de/listings/89f971e5-9ec8-4df8-98ac-ace76836955f-1333505462.jpg/ORIG/resize/118x118%3E/extent/118x118/format/jpg/quality/80;2;10.66;;;;;1978;;10.66;114452570;;y;false;;y;Berlin;y;9;3;;no_information;;5.91;90;Berlin;10119;no_information;no_information;;false;;no_information;no_information;n;;;no_information;no_information;10119;3;;n;2,active;;Deutschland;top;;wohnung_kauf;y;;false;001.15850880;660000;profile0;5;3;true;n;showqualicontactform;n;n;Mitte_Mitte;114452570;4;Berlin;/expose/114452570;['Diese helle Wohnung bietet auf ca 50 qm höchste Wohnqualität. Die geräumige, mit Liebe zum\nDetail, renovierte Wohnung liegt in der Hochparterre. Die Küche ist separat abgetrennt und hat ein\ngroßes Fenster sowie große, moderne beige Fließen. Auch das Badezimmer verfügt über ein Fenster, eine\nkomfortable Dusche, komplett mit hochwertigen Fliesen gefliest. Die Zimmer sind großzügig\ngeschnitten, sehr hell, modern und einladend.\nIm Flur und in der Küche gibt es in die Wand montierte Coupe-Schränke die viel Platz einsparen\nund das Gesamtbild hervorragend ergänzen.\nDie Wohnung ist frisch saniert, komplett möbliert. \nMieteinnahmen 1100 EUR monatlich\nHausgeld 165 Euro'];no_information;;;;;2;;
2020-05-11 12:42:45.456595;Berlin;ONE_YEAR_FREE;5359196;n;y;https://pictures.immobilienscout24.de/listings/c4b8f0e6-d9b4-452e-9e7f-4e2c747f5a10-1350983111.jpg/ORIG/resize/118x118%3E/extent/118x118/format/jpg/quality/80;1;11.24;40 MBit/s;telekom_layer_magenta_l;;über VDSL;2014;REGULAR;11.24;114453146;district_heating;y;false;MagentaZuhause L;y;Berlin;y;11;8;800;no_information;energy_required;6.2;200;Berlin;10719;mint_condition;luxury;;false;100 MBit/s;underground_garage;no_information;y;https://padlock.link/ioml;https://padlock.link/ml;no_information;apartment;10719;4;51.3;n;2,active;true;Deutschland;standard;100 MBit/s;wohnung_kauf;n;web,email,bank,music,dl-ul,game,sd,mltstr,hd,fast-ul-dl;true;001.5359196;1700000;profile0;;4;true;n;showqualicontactform;n;n;Wilmersdorf_Wilmersdorf;5454#VCJmox;7;Berlin;/expose/114453146;['Die 4 Zimmer Wohnung befindet sich im 2. Obergeschoss (Fahrstuhl vorhanden) eines repräsentativen Mehrfamilienhauses aus dem Jahr 2014.  Die Ausstattung ist hoch- und neuwertig.\nDie repräsentativen Räume sind großzügig geschnitten und hell. \nEin PKW-Stellplatz in der TG ist ebenfalls käuflich für 60.000,-€ erwerbbar und dem Kaufpreis hinzuzurechnen.', '- Aufzug\n- Balkon\n- Fernheizung\n- Moderne und hochwertig ausgestattetes Bad\n- Moderne Einbauküche mit Elektrogeräten von Miele\n- Gäste-WC\n- Parkettböden und geflieste Bäder\n- Kellerabteil\n- Stellplatz in der TG (60.000,-€)', 'Die Wohnung befindet sich im Berliner Stadtteil Charlottenburg-Wilmersdorf, unweit des Kurfürstendamm gelegen.\nExtravagante Einzelhandelsgeschäfte sowie ein umfangreiches Angebot an Gastronomie macht diese Lage so attraktiv. Auch die Einkaufsmöglichkeiten lassen keine Wünsche offen. Alle Waren des täglichen Bedarfs können in unmittelbarer Nähe eingekauft werden. \nZum Shopen und Flanieren laden die Einkaufsmeile am Kurfürstendamm sowie das KaDeWe (Kaufhaus des Westens) ein. Das KaDeWe  ist in wenigen Minuten zu Fuß erreichbar. \nDie Verkehrsanbindungen an den öffentlichen Nahverkehr sind sehr gut.', 'Sollten Sie hier Ihre Immobilie nicht gefunden haben, senden Sie uns gerne eine E-Mail mit Ihren Suchkriterien. Gern stellen wir Ihnen diesbezügliche Angebote vor.\n\nDie Angaben in diesem Exposé beruhen auf die uns erteilten Informationen des Auftraggebers. Alle Angaben aus diesem Exposé stammen vom Verkäufer. Der Immobilienmakler hat insbesondere die Wohnflächenangabe des Verkäufers nicht überprüft und keine eigene Wohnflächenberechnung erstellt. Wir bemühen uns, möglichst vollständige und richtige Angaben zu erhalten und an Sie weiterzuleiten. Wir übernehmen jedoch keine Haftung für die Angaben im Exposé.\n\nAufgrund der Makler- und Bauträgerverordnung sind wir verpflichtet, auf die Nachweis/-Vermittlungsprovision zu verweisen. Sie beträgt derzeit 7,14 % inkl. der gesetzlich gültigen Mehrwertsteuer vom tatsächlich erzielten Kaufpreis und ist fällig und zahlbar vom Käufer an die Heydukowski & Co. GbR bei Abschluss des notariellen Kaufvertrages oder eines wirtschaftlichen im Wesentlichen identischen Abschlusses.\n\nDer Provisionsanspruch ist im Sinne von § 652 Abs. 1 BGB mit Abschluss des wirksamen Hauptvertrags fällig, wenn der Hauptvertrag auf unserer vertragsgemäßen Nachweis-/ Vermittlungstätigkeit beruht. Der Kunde ist verpflichtet, uns unverzüglich mitzuteilen, wann, zu welchem Entgelt und mit welchen Beteiligten der Hauptvertrag geschlossen wurde. Die Auskunftsverpflichtung wird nicht dadurch berührt, dass der Hauptvertrag unter einer aufschiebenden Bedingung steht und diese noch nicht eingetreten ist.\n\nKennt der Kunde bei Abschluss des Maklervertrages die Vertragsgelegenheit betreffend das angebotene Vertragsobjekt sowie die Vertragsbereitschaft des anderen Vertragsteils des Hauptvertrages (Vorkenntnis) oder erlangt er diese Kenntnis während der Laufzeit des Maklervertrages von dritter Seite, so hat er uns dies unverzüglich mitzuteilen.\n\nEine Weitergabe dieser ausschließlich für Sie bestimmten Unterlagen an Dritte löst bei deren Kauf die Provisionspflicht des Empfängers aus.'];district_heating;;;disabled;1;2;;
2020-05-11 12:42:45.887908;Berlin;ONE_YEAR_FREE;17579682;n;y;https://pictures.immobilienscout24.de/listings/30a83622-5a2f-4c7a-81cf-4dc7ce2cd9a5-1290090965.jpg/ORIG/resize/118x118%3E/extent/118x118/format/jpg/quality/80;11;9.52;2,4 MBit/s;telekom_layer_magenta_m_hybrid2;;über Hybrid;2007;WITH_HYBRID;9.52;111162686;district_heating:bio_energy;y;false;MagentaZuhause M Hybrid (2);y;Berlin;y;10;7;429;no_information;energy_consumption;4.81;131.07;Berlin;14195;mint_condition;no_information;D;false;16 MBit/s;underground_garage;no_information;y;https://padlock.link/mmh2sa;https://padlock.link/mmhy2;no_information;ground_floor;14195;4;129.5;n;2,active;true;Deutschland;top;50 MBit/s;wohnung_kauf;n;web,email,bank,music,dl-ul,game,sd,mltstr,hd;true;002.01008304369;799000;profile0;3;4;true;y;showqualicontactform;y;n;Dahlem_Zehlendorf;43090104-00094;6;Berlin;/expose/111162686;['Die neuwertige Eigentumswohnung ist Bestandteil einer Eigentümergemeinschaft, welche aus insgesamt 8 Wohneinheiten besteht. Das Bauvorhaben wurde im Jahre 2007 fertig gestellt und befindet sich dementsprechend in einem sehr guten Gesamtzustand.\r\n\r\nDie Wohnung selbst wurde ausschließlich mit hochwertigen Elementen ausgestattet und befindet sich ebenfalls in einem Top-Zustand. Die Wohnung zeichnet sich durch einen großzügigen Grundriss aus und bietet einer bis zu 4-köpfigen Familie ausreichend Platz.\r\n\r\nDie Wohnung liegt im Erdgeschoss, der Tiefgaragen-Stellplatz sowie der Keller sind über einen Aufzug miteinander verbunden, ein barrierefreies Wohnen ist somit gewährleistet. Die gesamte Wohnung ist mit elektrischen Rollläden ausgestattet. Das Schlafzimmer verfügt zusätzlich über eine Klimaanlage.\r\n\r\nRaumaufteilung: \r\nEingangsbereich mit einer großzügigen Diele von der alle Zimmer abgehen, großzügiges Wohnzimmer inkl. direktem Zugang zur großzügigen Sonnenterrasse, große Einbauküche mit hochwertigen Einbaugeräten, Gäste-WC, Schlafzimmer, Arbeitszimmer, Speisezimmer (die beiden letzt genannten können selbstverständlich auch als Kinderzimmer verwendet werden), großes Duschbad mit WMA-Anschluß (Badewanne jederzeit möglich)', 'Der Bezirk Dahlem zählt wohl zu den beliebtesten Wohnbezirken Berlins und bedarf keiner weiteren Beschreibung. Aufgrund der diversen Neubauten in den letzten Jahren ist die Infrastruktur rund um den U-Bhf. Oskar-Helene-Heim nahezu als perfekt zu bezeichnen. Sowohl Einkaufsmöglichkeiten, Anbindung öffentliche Verkehrsmittel, zahlreiche Schulen, Ärztezentren und der nahe gelegene Grunewald verbinden alle Annehmlichkeiten des täglichen Lebens..... und das alles fußläufig.', 'Aufgrund der gebotenen Diskretion würden wir Sie über weitere Informationen, Bilder, etc. zu unserem Angebot gerne persönlich informieren. Wir freuen uns auf Ihre Kontaktaufnahme.\r\n\r\n\r\nAlle Informationen, Bilder und Dateien im Exposé beruhen auf den Informationen und übergebenen Unterlagen der Verkäufer bzw. Dritter. Eine Haftung für die Angaben im Exposé kann deshalb durch uns nicht übernommen werden. Unsere Angebote sind freibleibend und unverbindlich. Zwischenverkauf und Preisänderungen bleiben ausdrücklich vorbehalten. \r\n\r\nBesichtigungen sind nur nach Terminabsprache und im Beisein mit einem unserer Immobilienberatern möglich.\r\n\r\nWir möchten Sie informieren, dass wir ausschließlich Anfragen mit vollständig ausgefülltem Kontaktfeld (Name, Adresse, Telefonnummer und E-Mail) bearbeiten. Anschließend übersenden wir Ihnen unser ausführliches Web-Exposé zur geschätzten Kenntnisnahme.\r\n\r\nJetzt attraktive Finanzierungskonditionen sichern! Die Spezialisten der Postbank erstellen Ihnen gern ein maßgeschneidertes Angebot. Sprechen Sie uns an!'];central_heating;;;;1;;10 MBit/s;50 MBit/s
2020-05-11 12:42:46.397403;Berlin;ONE_YEAR_FREE;16357034;n;y;https://pictures.immobilienscout24.de/listings/f7e14bf2-4288-4176-96a4-c462aff1adc6-1333601218.jpg/ORIG/resize/118x118%3E/extent/118x118/format/jpg/quality/80;14;11.35;40 MBit/s;telekom_layer_magenta_l;84.59;über VDSL;1900;REGULAR;11.35;114458741;gas;n;false;MagentaZuhause L;y;Berlin;y;6;1;168.38;no_information;energy_consumption;7.53;84.59;Berlin;10247;no_information;normal;;false;100 MBit/s;no_information;no_information;n;https://padlock.link/ioml;https://padlock.link/ml;no_information;apartment;10247;3;102;n;2,active;true;Deutschland;top;100 MBit/s;wohnung_kauf;y;web,email,bank,music,dl-ul,game,sd,mltstr,hd,fast-ul-dl;true;002.01007230141;299000;profile0;5;3;true;n;showqualicontactform;n;n;Friedrichshain_Friedrichshain;ETW 09 B63;4;Berlin;/expose/114458741;['BÄNSCHSTR. === LAGE, LAGE, LAGE===\n\n++3-ZIMMERWOHNUNG IM 3.OG DES VORDERHAUSES, SCHÖNER JAHRHUNDERTWENDEBAU+++ \nbeliebteste Friedrichshain-Lage, Straße mit Mittelinsel, Ruhiglage, sehr grüner Innenhof, BALKON MIT AUSBLICK', 'GUTE RAUMAUSNUTZUNG, Lage an ruhiger Straße, Balkon, BESTLAGE IM HAUS, 3.OG Vorderhaus,', 'Zwischen Forckenbeckplatz und  Samariterplatz, ruhige Anwohnerstraße, eine der schönsten Straßen im Friedrichshain, Stuckmiethaus, WE im 3.OG, sehr begrünter Innenhof, U-Bahn Samariterstraße 3 Fußminuten, sehr ruhige Lage,', '== BESICHTIGUNG KURZFRISTIG MÖGLICH ==\n\nGutes Verhältnis Zimmeranzahl zur Quadratmeterzahl.....\n\nSolide Geldanlage, in einer der nachgefragtesten Viertel Berlins....., mehr Stadt geht nicht.\n\nDie Miete setzt sich wie folgt zusammen:\n\nMiete:    € 373,77\nNK:        € 131,89\nGesamt: € 505,66\n \nDas gesamte Wohngeld beträgt € 168,38 inkl. Instandhaltungsrücklage.\n\nDer Mieter genießt einen 10-jährigen Kündigungsausschluss. (Kündigungsschutzklausel-Verordnung vom 13. August 2013,GVBl)\n\nWeitergehende Informationen erhalten Sie von Herrn Hickstein unter Tel. 0172-3174800 oder per Email unter vollständiger Angabe Ihrer Kontaktdaten.\n\nBitte senden Sie eine Kontakt-Email mit Ihren Daten.'];self_contained_central_heating;1997;7007;disabled;;3;;
2020-05-11 12:42:46.710851;Berlin;ONE_YEAR_FREE;18267813;n;n;https://pictures.immobilienscout24.de/listings/a186e719-f4ff-46c6-90bf-8b1d27748616-1333458902.jpg/ORIG/resize/118x118%3E/extent/118x118/format/jpg/quality/80;9;12.1;40 MBit/s;telekom_layer_magenta_l;;über VDSL;1900;REGULAR;12.1;114448818;no_information;n;false;MagentaZuhause L;n;Berlin;n;3;1;;4;energy_consumption;7.07;34.82;Berlin;10823;no_information;no_information;;false;100 MBit/s;no_information;"Merseburger Stra&szlig;e";n;https://padlock.link/ioml;https://padlock.link/ml;Merseburger_Straße;apartment;10823;1;112;n;2,active;true;Deutschland;standard;100 MBit/s;wohnung_kauf;y;web,email,bank,music,dl-ul,game,sd,mltstr,hd,fast-ul-dl;true;002.01009069705;142750;profile0;6;1;true;n;showqualicontactform;n;n;Schöneberg_Schöneberg;3c6bb707-1d02-4287-8b90-db254fd52135;1;Berlin;/expose/114448818;['__Das Gebäude__\n\nDas schmuck-sanierte Gebäude in der Merseburger Straße 4 wurde um 1900 als klassisches Berliner Mietwohnhaus mit Vorderhaus, erstem und zweitem Seitenflügel sowie Gartenhaus errichtet. Von 2007 bis 2008 wurde das Haus aufwändig modernisiert und restauriert - stilgebende Altbau-Elemente wie die stuckverzierte Fassade, Deckenstuck, attraktive Zimmertüren sowie Parkett- und Dielenböden wurden selbstverständlich detailgetreu erhalten. Zeitgemäße Annehmlichkeiten wie ein Aufzug, neue Balkone und eine erneuerte Haustechnik sorgen für hochwertigen Wohnkomfort in begehrter Lage. \n\n__Die Wohnung__\n\nHier investiert man in die Zukunft: Mitten im Akazienkiez bietet diese vermietete Single-Wohnung ihrem Bewohner ein begehrenswertes Zuhause. Neben dem zum Verweilen einladenden Wohn- und Schlafzimmer verfügt die Wohnung über ein kompaktes Bad und eine helle Küche. Die Altbauelemente verleihen der Wohnung zusätzlichen Charme. In Verbindung mit der attraktiven Lage ergibt das eine aussichtsreiche Kapitalanlage. \n\n__Die Lage__\n\nSchöneberg steht sowohl für bunte Vielfalt als auch für bürgerliches Ambiente. Viele Straßenzüge besitzen noch die alten, liebevoll restaurierten Gründerzeitfassaden - so auch die Merseburger Straße, die ruhig im begehrten Akazienkiez liegt. Hier findet man alles, was man zum Glücklichsein braucht: Kleine, individuelle Geschäfte, den Bäcker- und Gemüseladen an der Ecke, sowie schicke Cafés und Restaurants aller Art. Mit dem U-Bahnhof Eisenacher Straße und diversen Buslinien ganz in der Nähe genießt man zudem eine erstklassige Verkehrsanbindung. ', 'Historischer Altbau von 1900             \n\nBereits vermietet\n\nViel Tageslicht\n\nHohe Wände\n\nAttraktive Lage\n\nKündigung auf Eigenbedarf erst 10 Jahre nach Erwerb der Immobilie möglich', 'Schöneberg steht sowohl für bunte Vielfalt als auch für bürgerliches Ambiente. Viele Straßenzüge besitzen noch die alten, liebevoll restaurierten Gründerzeitfassaden - so auch die Merseburger Straße, die ruhig im begehrten Akazienkiez liegt. Hier findet man alles, was man zum Glücklichsein braucht: Kleine, individuelle Geschäfte, den Bäcker- und Gemüseladen an der Ecke, sowie schicke Cafés und Restaurants aller Art. Mittwochs und samstags trifft man sich auf Berlins bekanntestem Wochenmarkt am Winterfeldtplatz. Mit dem U-Bahnhof Eisenacher Straße und diversen Buslinien ganz in der Nähe genießt man zudem eine erstklassige Verkehrsanbindung. Und wer Sehnsucht nach etwas Grün hat, ist im nahen Volkspark Schöneberg gut aufgehoben. ', 'Traumwohnung gefunden? Dann nutzen Sie jetzt die EverEstate Immobilienfinanzierung in Zusammenarbeit mit unserem Partner ZIEGERT Immobilien und profitieren Sie von jahrelanger Expertise in Verbindung mit kompetenter Beratung. Kontaktieren Sie uns unter +49 (0) 30 / 700 1797 59 oder auf www.everestate.de/immobilienfinanzierung-mit-everestate und erhalten Sie auf Ihre Bedürfnisse zugeschnittene Angebote.'];central_heating;;;;;1;;
