2020-05-11 12:12:32.966035;Berlin;no_information;ONE_YEAR_FREE;;15474925;n;n;https://pictures.immobilienscout24.de/listings/53d5b554-3844-45d2-bd79-f783f3c067e1-1367414453.png/ORIG/resize/118x118%3E/extent/118x118/format/jpg/quality/80;20;10.87;40 MBit/s;telekom_layer_magenta_l;;über VDSL;1910;REGULAR;10.87;118074627;;natural_gas_heavy;n;false;MagentaZuhause L;y;Berlin;n;6;1;;19..;;5.63;57.94;Berlin;12161;no_information;no_information;false;100 MBit/s;no_information;Rheingaustr.;n;https://padlock.link/ioml;https://padlock.link/ml;Rheingaustr.;no_information;12161;2;n;2,active;true;Deutschland;schaufenster;100 MBit/s;wohnung_kauf;;n;;web,email,bank,music,dl-ul,game,sd,mltstr,hd,fast-ul-dl;true;001.15417560;299000;profile0;;2;true;n;;n;n;Friedenau_Schöneberg;VK-19171_WE14_AF;2;Berlin;/expose/118074627;['Das Mehrfamilienhaus wurde 1910 erbaut, steht unter Denkmalschutz und ist in ein Vorderhaus mit einem Seitenflügel aufgeteilt. \n\nDie Wohnung befindet sich im Erdgeschoss des Seitenflügels des 4-geschossigen Gebäudes, verfügt über ca. 57,94 m², die auf einen Eingangsbereich, ein Wohnzimmer mit Abstellraum, ein Schlafzimmer, eine Küche und ein Badezimmer aufgeteilt sind.  \n\nVom Flur aus sind alle Räume der 2-Zimmerwohnung bequem zu erreichen. \n\nDieser Einheit ist ein Sondernutzungsrecht für einen kleinen Gartenanteil zugehörig.\n\nDie Wohnung ist bezugsfrei und kann nach Ihren Wünschen gestaltet werden!', 'Die Immobilie befindet sich im beliebten Berliner Stadtteil Friedenau in einer ruhigen Seitenstraße.\n\nDer Stadtteil Friedenau wurde ursprünglich in der Kaiserzeit als Landhauskolonie angelegt. Heute überzeugt er durch sanierte Altbauten mit repräsentativen Fassaden und mit ihren kleine, grünen Vorgärten. Das Zentrum von Friedenau bildet der Friedrich-Wilhelm-Platz.\n \nHervorragende Einkaufsmöglichkeiten und eine gastronomische Vielfalt bietet die nur sechs Gehminuten entfernte Schloßstraße, die als kleine Schwester vom Kurfürstendamm bekannt und beliebt ist.\n\nDie unmittelbare Umgebung bietet in allen Bereichen eine komplette Versorgungsfunktion. Schulen, Kitas, Dienstleistungs- sowie Gesundheitseinrichtungen sind in einer Vielzahl vorhanden.  \n\nFür Erholungs- und Freizeitangebote dienen der Volkspark Wilmersdorf und der Rudolph-Wilde Park, welche in wenigen Minuten sowohl mit dem Fahrrad oder auch zu Fuß zu erreichen sind.\n\nAuch eine gute Anbindung an den öffentlichen Personalverkehr ist durch den U-Bhf. Friedrich-Wilhelm Platz gegeben.\n\nWer mit dem Auto fährt, kann mithilfe der A103 viele Orte Berlins schnell erreichen.'];;;;;;;;true
2020-05-11 12:12:33.281655;Berlin;no_information;ONE_YEAR_FREE;;15746577;n;n;https://pictures.immobilienscout24.de/listings/3e08c2ea-2566-4966-b5e6-dd7fa9514bec-1367683743.jpg/ORIG/resize/118x118%3E/extent/118x118/format/jpg/quality/80;5;10.66;40 MBit/s;telekom_layer_magenta_l;;über VDSL;;REGULAR;10.66;115350764;;;y;false;MagentaZuhause L;y;Berlin;n;11;;;no_information;;5.91;147;Berlin;10187;no_information;no_information;false;100 MBit/s;no_information;no_information;y;https://padlock.link/ioml;https://padlock.link/ml;no_information;no_information;10187;6;n;2,active;true;Deutschland;standard;100 MBit/s;wohnung_kauf;;n;16;web,email,bank,music,dl-ul,game,sd,mltstr,hd,fast-ul-dl;true;002.01002783912;1180000;profile0;;5;true;n;showqualicontactform;n;n;Mitte_Mitte;115350764;6;Berlin;/expose/115350764;['Manchmal genügt ein Blick, um zu wissen: Das ist es - der Himmel über Berlin!\u2028\n\nDafür ist dieses Hochhaus direkt am Hackeschen Markt bei seinen Bewohnern und Besuchern bekannt. \nUnsere Duplex-Wohnung im 16/17 Stock mit ihrer Ausrichtung nach Südwest ist ein mehr als gelungenes Beispiel, wie man mit guter Architektur und eigenem Stil die Verbindung zwei ehemals eigenständiger Wohnungen realisieren kann.', 'Fahrstuhl\nEinbauküche', 'Bitte prüfen Sie nach der Anfrage nach dem Expose auch Ihren Spam-Ordner.'];;;;;;;;
2020-05-11 12:12:33.602123;Berlin;central_heating;ONE_YEAR_FREE;;15474925;n;n;https://pictures.immobilienscout24.de/listings/972cd65a-9612-4ea7-972b-c1c518c07cce-1367415128.png/ORIG/resize/118x118%3E/extent/118x118/format/jpg/quality/80;22;11.48;40 MBit/s;telekom_layer_magenta_l;;über VDSL;1900;REGULAR;11.48;118074711;;natural_gas_heavy;n;false;MagentaZuhause L;n;Berlin;y;7;1;181.14;28.;energy_consumption;7.14;57.06;Berlin;10245;no_information;no_information;false;100 MBit/s;no_information;Corinthstr.;y;https://padlock.link/ioml;https://padlock.link/ml;Corinthstr.;apartment;10245;2;n;2,active;true;Deutschland;schaufenster;100 MBit/s;wohnung_kauf;;n;2;web,email,bank,music,dl-ul,game,sd,mltstr,hd,fast-ul-dl;true;001.15417560;309675;profile0;4;2;true;n;;n;n;Friedrichshain_Friedrichshain;VK-19236_WE25_IN_G;2;Berlin;/expose/118074711;['Das um die Jahrhundertwende erbaute Wohn- und Geschäftshaus ist in ein Vorderhaus, einen Seitenflügel und in ein Hinterhaus aufgeteilt.  \n\nDie vermietete 2-Zimmerwohnung befindet sich im 2.OG des Seitenflügels eines 4-geschossigen, gepflegten Wohnhauses und hat eine Wohnfläche von etwa 57,06 m².\n\nAuf der rechten Seite vom Flur befindet sich sowohl das Badezimmer als auch die Küche. Ebenfalls auf der rechten Seite ist das Schlafzimmer gelegen. Geradezu vom Eingangsbereich gelangt man in das Wohnzimmer.\n\nDer Wohnung ist ein Keller zugeteilt und wird bald einem neu errichteten Außenfahrstuhl angeschlossen sein. Sämtliche Errichtungskosten werden vom Verkäufer getragen. \n\nEs besteht weiterhin die Option, im Hofbereich zukünftig Balkone sowie einen Fahrstuhl anzusetzen.\n\nDas Gebäude wurde 2017 in Eigentumseinheiten aufgeteilt. \n\nDie Wohnung ist bezugsfrei!', 'Die Immobilie befindet sich im beliebten Berliner Stadtteil Friedrichshain.\n\nViele Geschäfte des täglichen Bedarfs sowie Apotheken, Kitas und Schulen sind in unmittelbarer Nähe vorhanden und lassen nichts zu wünschen übrig.\n\nGute Erholungsmöglichkeiten und viel Grün bietet der Treptower Park .\n\nEine gute Auswahl an Restaurants, Bars und netten Cafés findet man im fußläufig erreichbaren Szeneviertel rund um den Boxhagener Platz und im Simon-Dach-Kiez. Auch bekannte Hotspots wie die weltbekannte East-Side-Gallery oder das angrenzende Kreuzberg bieten viele attraktive Ausgehmöglichkeiten.\n\nDie öffentlichen Nahverkehrsanbindungen sind mit dem S-Bahnhof Berlin-Ostkreuz, Rummelsburg oder Treptower Park sowie verschiedenen Buslinien nur wenige Fußminuten entfernt.'];;;129.8;;;;;true
2020-05-11 12:12:34.003010;Berlin;heat_pump;ONE_YEAR_FREE;10 MBit/s;4962873;y;y;https://pictures.immobilienscout24.de/listings/d72a931d-6f80-4f74-bc4e-7d162437c6e2-1356333531.jpg/ORIG/resize/118x118%3E/extent/118x118/format/jpg/quality/80;3;9.68;2,4 MBit/s;telekom_layer_magenta_m_hybrid2;;über Hybrid;2021;WITH_HYBRID;9.68;116462503;;geothermal;n;false;MagentaZuhause M Hybrid (2);y;Berlin;n;4;9;;no_information;;5.4;53.85;Berlin;13158;first_time_use;sophisticated;false;16 MBit/s;no_information;no_information;y;https://padlock.link/mmh2sa;https://padlock.link/mmhy2;no_information;ground_floor;13158;2;n;2,active;true;Deutschland;top;50 MBit/s;wohnung_kauf;50 MBit/s;n;0;web,email,bank,music,dl-ul,game,sd,mltstr,hd;true;001.4962873;172325;profile0;4;2;true;y;showqualicontactform;n;n;Rosenthal_Pankow;172-to;2;Berlin;/expose/116462503;['Auf einem grosszügigem Grundstück in Pankow-Wilhelmsruh entsteht im Rahmen einer Baugruppe diese Wohnung. Sie ist Bestandteil eines kleinen Gebäudeensembles.  Die Wohnräume werden sehr hell und lichtdurchflutet geplant.  Es handelt sich  um ein ökologisches  Bauprojekt welches \nim KfW40 Standard (förderfähig) als Niedrigenergiehaus geplant ist.', 'Die Wohnung wird spezifisch für den Standort im Grünen in architektonisch anspruchsvoller Qualität geplant. \nEs entstehen  moderne Wohnräume mit Zugang zu einem kleinen Privatgarten.\nDie konkrete Austattung wird mit den Bauherren gemeinsam entwickelt.', 'In einer sehr ruhigen Anliegerstrasse von Pankow-Wilhelmsruh entsteht dieses Baugruppenprojekt. In wenigen Minuten erreicht man die Schönholzer Heide, auch der Bürgerpark liegt nicht sehr weit weg.\nEinkaufsmöglichkeiten, Arztpraxen, Kitas und Schulen befinden sich in unmittelbarer Umgebung.\nEs besteht eine gute Anbindung an den öffentlichen Nahverkehr.', 'Alle Angaben entsprechen der 1.Planungsphase.\nWeitere Informationen erfolgen bei einem persönlichem Termin .\n\n\nEinwilligung in die Verarbeitung personenbezogener Daten:\nIch habe bei der Kontaktaufnahme im Kontaktformular zur Expose´Anfrage personenbezogene Daten mitgeteilt.\nIch bin damit einverstanden dass diese Daten für die weitere Abwicklung in Bezug auf das Objekt, Vereinbarung von  Besichtigungen, Versendung von objektbezogenen Unterlagen, Vorbereitung von Verträgen erhoben, gespeichert, übermittelt und genutzt werden.\nDiese Einwilligung erteile ich freiwillig. Ich kann diese Einwilligung jederzeit mit Wirkung für die Zukunft und ohne Angabe von Gründen widerrufen. Der Widerruf kann persönlich, telefonisch, schriftlich oder per Mail erklärt werden. Es entstehen dabei keine weiteren Kosten als die Kosten der Übermittlung wie das Porto.'];;;;;2;87231;true;
2020-05-11 12:12:34.357441;Berlin;self_contained_central_heating;ONE_YEAR_FREE;;15474925;n;y;https://pictures.immobilienscout24.de/listings/2e90a98b-79c9-4e45-9638-a0f2ab65baba-1367415622.png/ORIG/resize/118x118%3E/extent/118x118/format/jpg/quality/80;32;11.3;40 MBit/s;telekom_layer_magenta_l;;über VDSL;1933;REGULAR;11.3;118074770;;natural_gas_light;n;false;MagentaZuhause L;n;Berlin;n;9;1;226.79;27.;energy_required;5.73;112;Berlin;10789;no_information;no_information;false;100 MBit/s;no_information;"N&uuml;rnberger Stra&szlig;e";n;https://padlock.link/ioml;https://padlock.link/ml;Nürnberger_Straße;apartment;10789;3;n;2,active;true;Deutschland;schaufenster;100 MBit/s;wohnung_kauf;;n;2;web,email,bank,music,dl-ul,game,sd,mltstr,hd,fast-ul-dl;true;001.15417560;703240;profile0;5;3;true;n;;n;n;Charlottenburg_Charlottenburg;VK-19209_WE07_IN_RC;5;Berlin;/expose/118074770;['Das 1933 erbaute Wohn- und Geschäftshaus ist in ein Vorderhaus und einen Seitenflügel aufgeteilt.  Die gut geschnittene Wohnung befindet sich im 2. Obergeschoss des Vorderhauses und überzeugt auf ca. 112 m² Wohnfläche durch ihren komfortablen Schnitt. \n\nVom Eingangsbereich aus befinden sich auf der rechten Seite die Küche, das Badezimmer sowie eines der drei großen Zimmer - hofseitig ausgerichtet. In süd-östlicher Ausrichtung sind zwei weitere, geräumige Zimmer mit einem Durchgang gelegen, wodurch ein großzügiges Altbaugefühl vermittelt wird.  Der Balkon ist zur Straße ausgerichtet und bietet einen sonnigen Platz zum Frühstücken oder um den Tag bei einem Glas Wein ausklingen zu lassen.\n\nEs besteht weiterhin die Option, im Hofbereich zukünftig Balkone sowie einen Fahrstuhl anzusetzen.\n\nDas Gebäude wurde 2019 in Eigentumseinheiten aufgeteilt.\n\nDie Wohnung ist bezugsfrei!', 'Die exklusive Lage in der Nähe des Kurfürstendamm ist zentral und im Herzen der Stadt.  \n\nIn unmittelbarere Nähe befinden sich eine Vielzahl von Geschäften für den alltäglichen Bedarf, wie Apotheken, medizinische Einrichtungen, renommierte Restaurants, beliebte Cafés und trendige kleine Einzelhandelsgeschäfte. Der KuDamm und die Tauentzienstraße sind die bekanntesten Shopping-Meilen von Berlin. Das weltweit bekannte Einkaufszentrum KaDeWe ist ebenfalls in Laufweite.\n\nEin vielfältiges, internationales gastronomisches Angebot sowie die Wahl zwischen verschiedenen kleinen Delikatessgeschäften oder dem großen Supermarkt bieten eine außergewöhnliche Mischung für eine friedvolle nachbarschaftliche Lebensart von Berlinern, Zugezogenen und Touristen.\n\nAm nahe gelegenen Los-Angeles-Platz findet man ein wenig Ruhe in der begrünten Parkanlage, aber auch der weitläufige Tiergarten befindet sich in der Nähe, um Erholung im Grünen zu finden.\n\nFußläufg sind diverse Bushaltestellen und die U-Bahnhöfe „Augsburger Straße“ und „Wittenbergplatz“ zu erreichen.'];;F;172.5;;;;;true
2020-05-11 12:12:34.692126;Berlin;central_heating;ONE_YEAR_FREE;;15474925;n;n;https://pictures.immobilienscout24.de/listings/a5c4cc0d-0a66-43ca-a4a4-2d07b0718f37-1367413690.png/ORIG/resize/118x118%3E/extent/118x118/format/jpg/quality/80;25;12.78;40 MBit/s;telekom_layer_magenta_l;;über VDSL;1919;REGULAR;12.78;118074555;1;gas;y;false;MagentaZuhause L;n;Berlin;n;7;1;188.26;73a.;energy_consumption;7.25;59;Berlin;10555;no_information;no_information;false;100 MBit/s;garage;Alt-Moabit;n;https://padlock.link/ioml;https://padlock.link/ml;Alt-Moabit;apartment;10555;2;n;2,active;true;Deutschland;schaufenster;100 MBit/s;wohnung_kauf;;n;3;web,email,bank,music,dl-ul,game,sd,mltstr,hd,fast-ul-dl;true;001.15417560;309675;profile0;5;2;true;n;;n;n;Tiergarten_Tiergarten;VK-19262_WE43_IN_I;2;Berlin;/expose/118074555;['Das 1919 erbaute Gebäude ist in ein Vorderhaus, ein Hinterhaus sowie zwei Seitenflügel aufgeteilt. Im hinteren Bereich des Grundstücks befindet sich ein Fabrikgebäude. Alle Einheiten des Gebäudes verteilen sich auf insgesamt vier Geschosse zuzüglich des Dachgeschosses.  \n\nDie Wohnung ist im 3. Obergeschoss des Hinterhauses gelegen und überzeugt auf einer Wohnfläche von ca. 59 m². Die Wohnfläche verteilt sich auf 2 Zimmer nebst einer Küche inklusive einer Einbauküche und einem Wannenbad. \n\nDie Wohnung ist mit einem altbautypischen Dielenboden ausgestattet. Auch sind Stuckelemente an der Decke vorhanden, welche ebenfalls zu dem Charme der Wohnung beitragen. \n\nEs besteht weiterhin die Option, im Hofbereich zukünftig Balkone sowie einen Fahrstuhl anzusetzen.\n\nAuch stehen 2 Garagenstellplätze im Hinterhaus zum Verkauf, die bei Bedarf jeweils zu einem Preis von 40.393 EUR erworben werden können.  Die Garagen sind aktuell vermietet. Der jeweilige Mietvertrag könnte sodann wegen Eigenbedarfs gekündigt werden. \n\nDas Gebäude wurde 2019 in Eigentumswohnungen aufgeteilt. \n\nDie Wohnung ist bezugsfrei!', 'NÄHE SCHULTHEISS-QUARTIER UND SPREE!\n\nDie Immobilie befindet sich in einer sehr beliebten Lage von Berlin-Moabit. Hier wird eine schöne und lebhafte Kiezatmosphäre mit viel hauptstädtischer Urbanität harmonisch vereint. Moabit ist ein Ortsteil des Bezirks Mitte und liegt somit im Herzen der Hauptstadt.\n\nDas Bundesratsufer, die Gotzkowskybrücke und der Hansaplatz, wo bereits der beliebte Tiergarten angrenzt, befinden sich in unmittelbarer Umgebung. Die Nähe zum Regierungsviertel, zur West-Berliner City um den Kurfürstendamm sowie die Nähe zum Hauptbahnhof zeichnen die Lage zudem aus. Weitere Bezugspunkte sind die Technische Universität, die Deutsche Oper, der Zoologische Garten und natürlich die wunderschönen Uferpromenaden, die sowohl zur Universität als auch zum Schloss Charlottenburg führen.\n\nKleine Traditionsgeschäfte, individuelle Cafés und Restaurants tragen zu der Beliebtheit des Viertels und zu der Wohnqualität der Kiezbewohner bei. Sonstige Geschäfte des täglichen Bedarfs sind hier ebenfalls allumfassend vertreten.\n\nZentrale U-Bahn-Linien und diverse Busse garantieren eine schnelle und flexible Anbindung an den ÖPNV. Auch ist die Stadtautobahn innerhalb weniger Minuten mit dem PKW erreicht.'];;;129;;;;;true
2020-05-11 12:12:35.146307;Berlin;central_heating;;;15474925;n;y;https://pictures.immobilienscout24.de/listings/ac38bed5-d714-4793-819c-4c597e2a9278-1367414723.png/ORIG/resize/118x118%3E/extent/118x118/format/jpg/quality/80;19;11.73;;;;;1890;;11.73;118074665;;oil;y;false;;n;Berlin;y;9;1;386.04;10.;energy_consumption;5.75;136.28;Berlin;12165;no_information;no_information;false;;no_information;Wrangelstr.;n;;;Wrangelstr.;roof_storey;12165;3;n;2,active;;Deutschland;schaufenster;;wohnung_kauf;;n;4;;false;001.15417560;651455;profile0;4;3;true;n;;n;n;Steglitz_Steglitz;VK-18088_WE10_KB;6;Berlin;/expose/118074665;['Die großzügig geschnittene Wohnung befindet sich im Dachgeschoss eines ca. 1890 erbauten Mehrfamilienhaus., welches unter Denkmalschutz steht.\n\nVom geräumigen Eingangsbereich aus, der außerdem noch eine separate Abstellkammer hat, befindet man sich auch gleich in dem großzügig geschnittenen Wohnraum mit Zugang zur südwestlich ausgerichteten Terrasse.\n\nVom Eingangsbereich aus befindet sich auf der rechten Seite die Küche. Ausgestattet ist diese mit einer Einbauküche und einem Fenster. Neben der Küche befindet sich ein kleiner Flur. Von dem aus gehen die beiden anderen lichtdurchfluteten Zimmer ab mit nordöstlicher Ausrichtung.  \n\nDas innenliegende Badezimmer befindet sich gegenüber der Küche und ist ebenfalls von dem kleinen Flur neben der Küche aus begehbar.  Ausgestattet ist dieses mit einer Badewanne zum Relaxen und Entspannen und auch mit einer separaten Dusche. \n\nEs besteht ein Sondernutzungsrecht für Dachflächen zum Ausbau bzw. Erweiterung.\n\nLaut Teilungserklärung besteht die Möglichkeit, einen Aufzug ans Gebäude anzusetzen. Darüber hinaus sind die Sondereigentümer der Dachgeschosseinheiten berechtigt, die Dachgeschosseinheiten aus-/umzubauen, Dachterrassen zu errichten, die Raumhöhen zu ändern oder auch einen Kamin einzubauen, vorbehaltlich einer öffentlich-rechtlichen Genehmigung.\n\nDie Wohnung verfügt über einen Keller und ist bezugsfrei.', 'Der klassische Altbau liegt Nahe der Schloßstraße im Herzen von Berlin-Steglitz.\n\nDie Schlossstraße ist ist als Einkaufsmeile die kleine Schwester vom Charlottenburger Kurfürstendamm und bietet mit neu errichteten Einkaufszentren als auch mit kleinen individuellen Einzelhandelsgeschäften für jeden Geschmack etwas. Das Schlosspark Theater und der Botanische Garten befinden sich in unmittelbarer Nähe.\n\nDer Bezirk Steglitz ist gut bürgerlich, familienfreundlich und hat einen beliebten Kiez-Flair.\n\nÜber den U- und S-Bahnhof Steglitz ist die Anbindung an den öffentlichen Personennahverkehr ausgezeichnet.\n\nÜber die Autobahnanbindung erreicht man zügig die anderen Berliner Stadtbezirke wie auch Brandenburg.'];;D;108;;;;;true
2020-05-11 12:12:35.518285;Berlin;district_heating;ONE_YEAR_FREE;;18492745;n;y;https://pictures.immobilienscout24.de/listings/bf126bec-57fd-4e3c-9dd9-54e294752223-1367402083.jpg/ORIG/resize/118x118%3E/extent/118x118/format/jpg/quality/80;1;11;40 MBit/s;telekom_layer_magenta_l;;über VDSL;2000;REGULAR;11;118072554;1;district_heating;y;false;MagentaZuhause L;n;Berlin;y;7;5;;no_information;energy_consumption;6.41;88;Berlin;13127;well_kept;normal;false;100 MBit/s;underground_garage;no_information;y;https://padlock.link/ioml;https://padlock.link/ml;no_information;no_information;13127;3;n;2,active;true;Deutschland;standard;100 MBit/s;wohnung_kauf;;y;2;web,email,bank,music,dl-ul,game,sd,mltstr,hd,fast-ul-dl;true;002.01009366216;339000;profile0;4;3;true;n;showqualicontactform;y;n;Französisch_Buchholz_Pankow;118072554;4;Berlin;/expose/118072554;['Modernes Stadthaus mit kinder- und familienfreundlicher Infrastruktur, hoher Wohlfühlfaktor, Wohnen im Grünen Gürtel Berlins', 'Gepflegte 3-Zimmer- Wohnung West-Ausrichtung, mit Bad. Bodentiefe Fenster, Abstellraum im Flur.  Einbauküche. Mit Tiefgarage.', 'Hervorragende Wohnlage. Sehr gute BVG-Anbindung mit Bus und Tram. Schule, Kindertagesstätte und viele Supermärkte in unmittelbarer Nähe. A 114 in 3 Min erreichbar. Pankow, Schönauer Allee und Alexanderplatz innerhalb von 30-40 min erreichbar.', 'Gute Mietrendite über 2,5 %. \nHinweis: Wir bieten Ihnen in Corona-Zeiten eine individuelle Besichtigung mit den aktuellen Beschränkungen an.'];;;80;;;;;
2020-05-11 12:12:35.899644;Berlin;heat_pump;ONE_YEAR_FREE;10 MBit/s;4962873;y;y;https://pictures.immobilienscout24.de/listings/14f4dc08-5096-4546-b901-1ba74dc81832-1367407611.png/ORIG/resize/118x118%3E/extent/118x118/format/jpg/quality/80;6;9.33;2,4 MBit/s;telekom_layer_magenta_m_hybrid2;;über Hybrid;2020;WITH_HYBRID;9.33;115405793;;geothermal;n;false;MagentaZuhause M Hybrid (2);y;Berlin;n;9;9;;no_information;;5.79;112.3;Berlin;13158;first_time_use;sophisticated;false;16 MBit/s;no_information;no_information;n;https://padlock.link/mmh2sa;https://padlock.link/mmhy2;no_information;roof_storey;13158;4;n;2,active;true;Deutschland;top;50 MBit/s;wohnung_kauf;50 MBit/s;n;4;web,email,bank,music,dl-ul,game,sd,mltstr,hd;true;001.4962873;552741;profile0;4;4;true;y;showqualicontactform;n;n;Rosenthal_Pankow;WE 9 552;5;Berlin;/expose/115405793;['Auf einem grosszügigem Grundstück in Pankow-Wilhelmsruh entsteht im Rahmen einer Baugruppe diese Wohnung. Sie ist Bestandteil eines kleinen Gebäudeensembles.  Die Wohnräume werden sehr hell und lichtdurchflutet geplant.  Es handelt sich  um ein ökologisches  Bauprojekt.\nim KfW40 Standard (förderfähig) als Niedrigenergiehäuser.\nDie 85 m² sind reine Wohnfläche ohne Terrasse.', 'Die Wohnung wird spezifisch für den Standort im Grünen in architektonisch anspruchsvoller Qualität geplant. \nEs entstehen lichtdurchflutete moderne Wohnräume mit bodentiefen Fensterlementen und Balkon oder Terrasse.\nDie DG Wohnung bietet einen herrlichen Ausblick in die grüne Umgebung und auf einen See. Eine umlaufende Terrasse verleiht da besondere Flair dieser Wohnung.\nDie konkrete Austattung und Grundrissgestaltung wird mit den Bauherren gemeinsam entwicklet.', 'In einer sehr ruhigen Anliegerstrasse von Pankow-Wilhelmsruh entsteht dieses Baugruppenprojekt. In wenigen Minuten erreicht man die Schönholzer Heide, auch der Bürgerpark liegt nicht sehr weit weg.\nEinkaufsmöglichkeiten, Arztpraxen, Kitas und Schulen befinden sich in unmittelbarer Umgebung.\nEs besteht eine gute Anbindung an den öffentlichen Nahverkehr.', 'Alle Angaben entsprechen der 1.Planungsphase.\nWeitere Informationen erfolgen bei persönlichem Termin zur Präsentation durch die Architektin.\n\n\nEinwilligung in die Verarbeitung personenbezogener Daten:\nIch habe bei der Kontaktaufnahme im Kontaktformular zur Expose´Anfrage personenbezogene Daten mitgeteilt.\nIch bin damit einverstanden dass diese Daten für die weitere Abwicklung in Bezug auf das Objekt, Vereinbarung von  Besichtigungen, Versendung von objektbezogenen Unterlagen, Vorbereitung von Verträgen erhoben, gespeichert, übermittelt und genutzt werden.\nDiese Einwilligung erteile ich freiwillig. Ich kann diese Einwilligung jederzeit mit Wirkung für die Zukunft und ohne Angabe von Gründen widerrufen. Der Widerruf kann persönlich, telefonisch, schriftlich oder per Mail erklärt werden. Es entstehen dabei keine weiteren Kosten als die Kosten der Übermittlung wie das Porto.'];;;;;2;87231;true;
2020-05-11 12:12:36.221430;Berlin;;;;18533450;n;y;https://pictures.immobilienscout24.de/listings/38c80e01-fbc9-4c8c-81ea-e937a89e6d41-1367481709.jpg/ORIG/resize/118x118%3E/extent/118x118/format/jpg/quality/80;5;7.89;;;;;1915;;7.89;118072349;;no_information;y;false;;;Berlin;y;10;1;;no_information;no_information;3.38;177;Berlin;14193;no_information;no_information;false;;no_information;no_information;n;;;no_information;apartment;14193;5.5;n;2,active;;Deutschland;top;;wohnung_kauf;;n;1;;false;002.01009418979;920000;profile0;;5;true;n;showqualicontactform;n;n;Grunewald_Wilmersdorf;752919;7;Berlin;/expose/118072349;['Eigentumswohnung, Baujahr: ca. 1915, Aufteilungsplan: 7,9, 1. Etage, Wohnfläche: 177m², Zimmer: 5,5, Küche, Bad, Loggia, Keller, 2 zusammengelegte Wohnungen, keine Miteigentumsanteile angegeben', 'Die Versteigerung findet am zuständigen Amtsgericht statt. Der ausgewiesene Kaufpreis ist der Verkehrswert. Dieser wurde vom Gericht aufgrund eines vom amtlich bestellten Sachverständigen erstellten Gutachtens festgesetzt.\nEin Zuschlag ist gegebenenfalls schon ab 50% (bei Zweitterminen auch darunter) des Verkehrswertes möglich. Zudem entfallen für Sie die Makler- und Notarkosten, die je nach Bundesland bis zu 8,5% ausmachen können.\nDies ist eine von bundesweit über 80.000 Immobilien, die wir in unserem monatlich erscheinenden Versteigerungskalender schon ab 99,--€ für 3 Monate veröffentlichen. Zudem erhalten Sie bei uns einen Onlinezugang, mit dem Sie bis zu einem Jahr im Voraus Zwangsversteigerungsangebote sehen, die uns schon bekannt sind. Damit haben Sie zusätzlich die Chance bereits im Vorfeld einer Versteigerung mit dem Gläubiger in Kontakt zu treten. Eventuell können Sie die Immobilie auch vor der Versteigerung kaufen und haben damit Ihr Ziel noch schneller erreicht.\nBei weiteren Fragen rufen Sie uns gerne an. Wir sind telefonisch für Sie von Montags bis freitags von 9.00 - 20.00 Uhr und samstags von 10.00 - 16.00 Uhr unter 02102-711711 erreichbar.\nSeit über 30 Jahren sind wir der führende Informationsdienst für Zwangsversteigerungen. Unser Know How, die Daten bundesweit komplett zu recherchieren, kommt unseren Kunden zu Gute, da keine Versteigerung verpasst wird. Sie finden alle Versteigerungstermine und die relevanten Daten zu den einzelnen Häusern, Mehrfamilienhäusern, Wohnungen, Grundstücken sowie Gewerbeobjekten und landwirtschaftlichen Immobilien. Die Daten und die ggf. vorliegenden Exposés oder amtlichen / von Gerichten zur Verfügung gestellten Gutachten wurden von uns nicht auf Richtigkeit geprüft. Eine Haftung ist deshalb ausgeschlossen. Irrtum oder Zwischenverkauf vorbehalten.\nEin Energieausweis liegt z.Z. nicht vor und ist im Zuge des Erwerbs in der Zwangsversteigerung nicht erforderlich.'];disabled;;;;;;;
