timestamp;obj_regio1;obj_heatingType;obj_telekomTvOffer;obj_cId;obj_newlyConst;obj_balcony;obj_picture;obj_picturecount;obj_pricetrend;obj_telekomUploadSpeed;obj_telekomTrackingGroup;obj_telekomInternetTechnology;obj_yearConstructed;ga_cd_developer_virtualreality;obj_telekomInternetType;obj_galleryAd;obj_pricetrendbuy;obj_scoutId;obj_firingTypes;obj_hasKitchen;obj_ExclusiveExpose;obj_telekomInternetProductName;obj_courtage;geo_bln;obj_cellar;obj_purchasePriceRange;obj_yearConstructedRange;obj_houseNumber;obj_energyType;obj_pricetrendrent;obj_livingSpace;geo_krs;obj_zipCode;obj_condition;obj_interiorQual;obj_energyEfficiencyClass;ga_cd_cxp_historicallisting;obj_telekomDownloadSpeed;obj_parkingSpace;obj_street;obj_lift;obj_telekomInternetUrlMobile;obj_telekomInternetUrl;obj_streetPlain;obj_typeOfFlat;geo_plz;obj_noRooms;obj_thermalChar;obj_assistedLiving;obj_ityp;obj_telekomHdTelephone;geo_land;ga_cd_via;obj_telekomInternet;obj_immotype;obj_rented;obj_floor;obj_telekomInternetServices;obj_telekomInternetProductAvailable;obj_cwId;obj_purchasePrice;ga_cd_application_requirements;obj_noRoomsRange;ga_cd_maillead_default_shown;obj_garden;evt_count_pm_sig;obj_barrierFree;obj_international;obj_regio3;obj_objectnumber;obj_livingSpaceRange;obj_regio2;URL;beschreibung;obj_usableArea;obj_rentSubsidy;obj_lastRefurbish;obj_groupnumber;obj_numberOfFloors;ga_cd_via_qualified;obj_noParkSpaces;obj_telekomHybridUploadSpeed;obj_telekomHybridDownloadSpeed;obj_project_id;obj_nbp
2020-05-11 12:21:31.587579;Berlin;central_heating;ONE_YEAR_FREE;371061;n;y;https://pictures.immobilienscout24.de/listings/663ca889-e9f9-4409-adbb-3dc112750539-1363664862.jpg/ORIG/resize/118x118%3E/extent/118x118/format/jpg/quality/80;32;9.68;40 MBit/s;telekom_layer_magenta_l;über VDSL;1994;true;REGULAR;disabled;9.68;117401992;district_heating;y;false;MagentaZuhause L;y;Berlin;y;7;5;21;energy_required;5.44;104.19;Berlin;13158;well_kept;normal;C;false;100 MBit/s;no_information;"Garibaldistra&szlig;e";n;https://padlock.link/ioml;https://padlock.link/ml;Garibaldistraße;apartment;13158;3;93;n;2,active;true;Deutschland;top;100 MBit/s;wohnung_kauf;n;3;web,email,bank,music,dl-ul,game,sd,mltstr,hd,fast-ul-dl;true;001.371061;390000;profile0;3;true;n;showqualicontactform;n;n;Rosenthal_Pankow;GB_13_3OG1;5;Berlin;/expose/117401992;['Das Objekt Garibaldistraße 21/ Hielscherstraße 13 liegt in einer der idyllischen grünen Umgebung in Berlin-Wilhelmsruh und vereint Urbanität und Nähe zur Natur.\r\n\r\nDas Haus wurde ca. 1994 erbaut und verfügt über insgesamt 15 Wohnungen sowie drei Gewerbeeinheiten.\r\n\r\nDas Objekt sowie die Wohnungen befinden sich in einem guten Zustand.\r\n\r\nZum Verkauf stehen aktuell 5 bezugsfreie Wohnungen mit Wohnungsgrößen von ca. 78 qm bis ca. 104 qm.\r\n\r\nDiese Wohnungen verfügen jeweils über einen Balkon und eine Einbauküche (gebraucht).', 'Wohnungshighlights:\r\n\r\nLoggia\r\nGroßer Wohnbereich\r\nLaminat/Linoleum\r\nFenster mit Doppelverglasung \r\nEinbauküche (gebraucht), Herd, Spülmaschine\r\nEinbauschränke\r\nBadezimmer mit Wanne und Waschmaschinenanschluss\r\nAbstellraum\r\nKeller', 'Das Objekt Garibaldistraße 21, inmitten einer idyllischen grünen Umgebung gelegen, bietet vielfältige Erholungsmöglichkeiten.\n\nNur 500 Meter entfernt befindet sich der ca. 35 Hektar große Volkspark Schönholzer Heide mit hügeliger Wald- und Heidelandschaft, Spielplatz, Wanderwegen und Fußballplatz.\n\nAlle Geschäfte des täglichen Bedarfs, wie Supermärkte (Edeka und Norma), Bäckerei, Restaurants sowie Friseure, Ärzte und Banken sind zu Fuss erreichbar.\n\nAuch Kitas und Schulen finden Sie in unmittelbarer Nähe.\n\nDie Umgebung bietet Anschluss an den öffentlichen Berliner Nahverkehr: S-Bhf. Berlin-Wilhelmsruh (S2, S25) sowie diverse Buslinien (122, 155), sind in wenigen Gehminuten zu erreichen.'];;;;;;;;;;;
2020-05-11 12:21:31.959603;Berlin;central_heating;ONE_YEAR_FREE;16115878;n;y;https://pictures.immobilienscout24.de/listings/1d7405bc-cc39-4160-b88c-decf1e67b370-1363703368.jpg/ORIG/resize/118x118%3E/extent/118x118/format/jpg/quality/80;14;10.15;40 MBit/s;telekom_layer_magenta_l;über VDSL;1998;;REGULAR;;10.15;117408137;gas;y;false;MagentaZuhause L;y;Berlin;n;7;5;no_information;energy_consumption;4.6;80;Berlin;13591;modernized;sophisticated;C;false;100 MBit/s;no_information;no_information;n;https://padlock.link/ioml;https://padlock.link/ml;no_information;maisonette;13591;4;98.86;n;2,active;true;Deutschland;top;100 MBit/s;wohnung_kauf;n;;web,email,bank,music,dl-ul,game,sd,mltstr,hd,fast-ul-dl;true;001.1252850;379000;profile0;4;true;n;;n;n;Staaken_Spandau;1698 (1/1643);3;Berlin;/expose/117408137;['Das in 1998 massiv erstellte Doppelhaushälfte verfügt über ca. 80m² Wohnfläche aufgeteilt in 3 Etagen: 4 Zimmer, 1 Badezimmer mit   Dusche und Whirlpool-Badewanne und  Gäste WC. Im Erdgeschoss, 1 Obergeschoss und Dachgeschoss (außer Dachfenster) wurden die Iso-Fenster mit Rollläden versehen. Das Haus (inkl. Warmwasser) wird mit Gas (Viessmann Gas-Brennwerttherme) beheizt. Das Dachgeschoss ist großzügig geschnitten.  Im 1.Obergeschoss befinden sich 2 geräumige Zimmer, (Schlaf und Kinderzimmer/Arbeitszimmer), ein gefliestes Masterbad: WC, Wanne, Dusche, Handwaschbecken und auch Fenster sind vorhanden. Über  eine solide Holztreppe gelangt man ins Erdgeschoss. Das Erdgeschoß verfügt über eine geflieste, offene Küche die mit allen modernen E- Geräten: Backofen, Ceranfeld, Dunstabzugshaube (1 Jahr alt) und Kühlschrank bestückt ist. Ein geflieste Gäste WC mit Handwaschbecken ist  in der Erdgeschossebene integriert. Der Wohnzimmer/Küchenbereich hat eine außergewöhnliche Größe von ca. 30m² Wohnfläche  ist über ein Fensterfront mit  Blick in den pflegeleichten zauberhaften Garten nach Süden ausgerichtet.  Vom Wohnzimmerbereich gelangt man auf eine ca. 10m² mit  Natursteinplatten verlegte Terrasse. Eine Sonnenmarkise leistet an heißen Sommertagen ihre Dienste. Der Garten ist mit wertvollen Gehölzen, liebevoll und pflegeleicht angelegt. Die Terrasse und der Garten sind mit Strom vernetzt. Das gesamte Erdgeschoss und die Sanitärräume sind mit Fliesen verlegt, Obergeschoss mit hochwertigem Laminat ausgelegt. Bei diesem Angebot handelt es sich um eine Doppelhaushälfte in den gefragtesten Berliner Wohnlandschaft im Bezirk Spandau. Das Haus zeichnet sich durch seinen gut durchdachten Grundriss aus. Ein Carport befindet sich direkt am Haus. Der Endenergieverbraucht dieses Gebäudes beträgt 98,86 kWh/(m*a). Das monatliche Wohngeld des Hauses für eine dreiköpfige Familie beträgt nur ca. 190€. Alle Medien sind vorhanden. Ein Gartenholzhaus und 2Geräteschuppen sind vorhanden. Das Objekt ist saniert, renoviert und bezugsfrei.  Die Lage des Hauses ist absolut ruhig. Das Stein auf Stein erstellte Haus befindet sich in sehr gutem und gepflegten Zustand. In der näheren Umgebung befinden sich sämtliche Einkaufsmöglichkeiten und Dienstleistungen, die man für den täglichen Bedarf benötigt. Auch Schulen, Apotheke, Kitas und andere (öffentliche) Einrichtungen sind fußläufig erreichbar. Große Auswahl an Restaurants in allen Geschmacksrichtungen in unmittelbarer Nähe.', '•\tModernisierung / Sanierung \n•\tDachbodenausbau \n•\tDachdämmung \n•\tFassadendämmung\n•\tIso-Fenster inkl. Rollläden\n•\tRenovierung Juni 2019\n•\tZustand-sehr gut\n•\tKFZ-Stellplatz\n•\tBadezimmer (Dusche und Badewanne)\n•\tBadezimmer: Fußbodenzeizung zusätzlich\n•\tGas-Heizungsanlage (Viessmann Gas-Brennwerttherme)\n•      Gäste WC \n•\tBushaltestelle vor der Tür\n•\tWohngeld nur 190€\n\nEine gute Bonität wird von dem Eigentümer gewünscht\n', 'Das angebotene Einfamilienhaus liegt im Berliner Stadtbezirk Spandau. Die Bushaltestelle, Regionalbahn sowie Schulen und Kindergärten erreicht man zu Fuß in wenigen Minuten. In  Gehminuten erreichen Sie alle Einkaufsmöglichkeiten. In unmittelbarer Nähe befindet sich die Bushaltestelle mit direktem Anschluss an das öffentliche S- und U-Bahnnetz sowie den Fernbahnhof. Mit der S- oder U-Bahn ist man in ca. 20 Minuten in der alten City West und in ca. 30 Minuten an den Hackeschen Höfen und am Alexanderplatz. Infrastruktur (im Umkreis von 5 km alles vorhanden): Apotheke, Lebensmittel-Discount, Allgemeinmediziner, Kindergarten, Grundschule, Hauptschule, Realschule, Gymnasium, Öffentliche Verkehrsmittel.', 'Alle Angaben haben wir nach bestem Wissen gemacht. Da Diese jedoch teilweise auf Informationen Dritter beruhen, kann der Makler für die Richtigkeit keine Gewähr übernehmen. Eine Weitergabe des Angebotes bedarf unserer ausdrücklichen Zustimmung. Das Objekt gilt als unbekannt, sofern nicht innerhalb von fünf Werktagen Einspruch mit Quellenangabe eingelegt wird. Alle Gespräche sind über unser Büro zuführen. Bei Zuwiderhandlung behalten wir uns Schadenersatz bis zur Höhe der Provisionsansprüche ausdrücklich vor. Zwischenverkauf ist nicht ausgeschlossen.'];15;190;2019;7;3;;;;;;
2020-05-11 12:21:32.272689;Berlin;self_contained_central_heating;ONE_YEAR_FREE;37030;n;y;https://pictures.immobilienscout24.de/listings/da792ee5-2bd2-44ea-bc8c-8a95e10af5b7-1365986064.jpg/ORIG/resize/118x118%3E/extent/118x118/format/jpg/quality/80;15;10.95;40 MBit/s;telekom_layer_magenta_l;über VDSL;1900;;REGULAR;disabled;10.95;117302744;gas;n;true;MagentaZuhause L;y;Berlin;y;11;1;77;energy_consumption;6.54;195.39;Berlin;10437;modernized;no_information;;false;100 MBit/s;no_information;"Kopenhagener Stra&szlig;e";n;https://padlock.link/ioml;https://padlock.link/ml;Kopenhagener_Straße;roof_storey;10437;4;118.6;n;2,active;true;Deutschland;schaufenster;100 MBit/s;wohnung_kauf;n;5;web,email,bank,music,dl-ul,game,sd,mltstr,hd,fast-ul-dl;true;001.37030;1250000;profile0;4;true;n;showqualicontactform;n;n;Prenzlauer_Berg_Prenzlauer_Berg;36962;7;Berlin;/expose/117302744;"['Auf einer Wohnfläche von 196 Quadratmeter erwarten Sie vier lichtdurchflutete Zimmer, die mit Liebe bis ins letzte Detail konzipiert wurden. Das exklusive Interieur besticht durch ein gelungenes Miteinander von moderner Leichtigkeit und liebevoll freigelegten Backsteinwänden. In der lichtdurchfluteten Designer-Wohnküche lädt ein edler Küchentresen zum gemeinsamen Get-Together ein. Die angrenzende Dachterrasse verleiht zudem ein frisches, sonniges Ambiente. Einen warmen Kontrast setzt das dunkle Eichenparkett samt integrierter Fußbodenheizung. An kühlen Tagen spenden zwei gusseiserne Kamine eine extra Portion Gemütlichkeit und sorgen für ein angenehmes Raumgefühl.\r\n\r\nHell, charmant und elegant reiht sich das fünfgeschossige Wohnensemble von 1901 in die repräsentative Altbausubstanz der Kopenhagener Straße ein. Die aufwendig sanierte, prunkvolle Fassade bezaubert mit historischem Charme der Jahrhundertwende. Auch das wunderschöne Treppenhaus mit seinen floralen Fliesenmotiven bereitet den Bewohnern des Hauses einen anmutigen Empfang.\r\n\r\nSie interessieren sich für diese Immobilie, haben Fragen zur Finanzierung oder wünschen einen Besichtigungstermin? Das ZIEGERT-Team steht Ihnen immer gern zur Verfügung!\r\n', '+ stilvoll ausgebautes Penthouse (Fertigstellung 2016)\r\n\n+ 57 Quadratmeter großer Wohn- & Essbereich mit Designerküche + Kamin\r\n\n+ liebevoll freigelegtes Mauerwerk im Wohnbereich\r\n\n+ zwei große Süd-Terrassen\r\n\n+ Eichenparkett mit integrierter Fußboden- & Sockelheizung\n\n\r\n+ 27 Quadratmeter großes Master-Bad mit Platz für Sauna\r\n\n+ Deckenhöhen von 2,80 m bis 3,26 m\r\n\n+ Baugenehmigung für Aufzug liegt vor', 'Nach wie vor ist der Prenzlauer Berg der mit Abstand beliebteste Stadtteil Berlins. Das liegt wohl vor allem an der wunderbaren Mischung aus familiärer Kiez-Atmosphäre, herrlichen Gründerzeitbauten und der reichen Auswahl individueller Shops, Boutiquen, Galerien, Bars, Cafés und Restaurants. Die begehrten Wochenmärkte auf dem Kollwitz- und Helmholtzplatz und der angesagte Flohmarkt am Mauerpark bezaubern mit regionalen Produkten und Handgemachtem. Hinzu kommt das freundliche Nachbarschaftsgefüge aus jungen Familien, Studenten, Kreativen und Menschen, die einen kosmopolitischen und zugleich gelassenen Lifestyle schätzen. \n\nAn der Grenze zu Pankow – nur drei Gehminuten vom S-/ U-Bahnhof Schönhauser Allee entfernt – liegt das familienfreundliche Skandinavischen Viertel. Von hier aus erreicht man alle ""Prenzlberger"" Hotspots und Berliner Sehnsuchtsorte bequem mit dem Fahrrad oder zu Fuß, sodass ein Auto in dieser ideal angebundenen Wohngegend kein must-have ist.', '++++++++++++++++++++++++++++++++++++++++++++\r\n\r\nUnser Verkaufsbüro in der Schlüterstraße 54 hat wieder geöffnet. Besuchen Sie uns Dienstags, Mittwochs oder Donnerstags zwischen 14 und 18 Uhr. Unsere Berater freuen sich auf Sie!\r\n\r\n++++++++++++++++++++++++++++++++++++++++++++\r\n\r\nSie wollen sich vergrößern oder verändern? Zögern Sie nicht und fragen Sie unsere Experten, welchen Wert Ihre Immobilie aktuell hat.\r\n\r\n++++++++++++++++++++++++++++++++++++++++++++']";;;2015;964;5;true;;;;;
2020-05-11 12:21:32.629363;Berlin;;ONE_YEAR_FREE;16924112;n;y;https://pictures.immobilienscout24.de/listings/faf2d04d-80eb-484f-bc2a-6933693830a5-1363560970.jpg/ORIG/resize/118x118%3E/extent/118x118/format/jpg/quality/80;7;12.41;40 MBit/s;telekom_layer_magenta_l;über VDSL;1960;true;REGULAR;disabled;12.41;117384355;gas;y;false;MagentaZuhause L;y;Berlin;y;6;2;no_information;energy_consumption;6.33;65.12;Berlin;12101;no_information;simple;E;false;100 MBit/s;no_information;no_information;n;https://padlock.link/ioml;https://padlock.link/ml;no_information;no_information;12101;3;134;n;2,active;true;Deutschland;standard;100 MBit/s;wohnung_kauf;n;;web,email,bank,music,dl-ul,game,sd,mltstr,hd,fast-ul-dl;true;009.06041d57-de1b-4a48-987b-3b0882138407;275000;profile0;3;true;n;;n;n;Tempelhof_Tempelhof;117384355;3;Berlin;/expose/117384355;['+++   Link zum 360°-Rundgang: https://app.immoviewer.com/portal/tour/1691131?accessKey=5e2d   +++\n\nSüdlich des Berliner Zentrums im Stadtteil Tempelhof steht diese attraktive Eigentumswohnung mit Balkon und einer großzügigen Wohnfläche von ca. 65 m² zum Verkauf, die noch bis Ende 2020 zu einer Jahresnettokaltmiete von 9.600 € vermietet ist und danach sowohl für die Einrichtung einer gemütlichen Privatwohnung als auch für eine Neuvermietung infrage kommt. \n\nDie Wohnung befindet sich im Erdgeschoss eines Mehrfamilienhauses aus dem Jahr 1957 und eignet sich aufgrund der vorteilhaften Raumaufteilung hervorragend für Singles, Paare oder Familien mit Kind. Nach einem Umbau und einer vollständigen Renovierung war das Apartment bisher 2-mal vermietet. Ferner wurde in der Wohnung ein spezielles LAN-Netzwerk mit 3 Anschlüssen in Wohnzimmer, Büro und Küche verlegt. \n\nDie Immobilie wird über einen Flur betreten, der sich zu einem praktischen Essbereich mit moderner Einbauküche hin öffnet. Letztere inklusive Elektrogeräte sowie die komplette Möblierung in der Wohnung sind im Verkaufspreis inbegriffen. Von hier aus sind der große, helle Wohnraum mit Zugang zu einem mit witterungsbeständigem Holzboden ausgestatteten Balkon, ein Schlafzimmer und ein Büro sowie ein Tageslicht-Duschbad zu erreichen. Für zusätzlichen Stauraum sorgt zudem ein eigenes Kellerabteil.\n\nIn Flur und Küche sind beigefarbene, geschliffene Feinsteinzeugfliesen verlegt. Im Schlaf- und Arbeitszimmer liegt ein komfortabler Teppichboden, während das Wohnzimmer mit hochwertigem Laminat (inkl. Trittschalldämmung) und Hochflorteppich versehen ist. Boden und Wände des Badezimmers sind gefliest. 3 der 4 Innentüren der Wohnung bestehen zudem aus Ganzglas.\n\nObjektnr.: 1021636', '+ Noch bis Ende 2020 vermietet, danach Eigennutzungsoption\n+ Aktuelle Jahresnettokaltmiete: 9.600 €\n+ Helle Zimmer und guter Schnitt\n+ Einbauküche und Möbel (im Preis enthalten)\n+ Tageslichtbad\n+ Eigenes Kellerabteil\n+ Urbane Lage mit idealer Infrastruktur\n+ Hervorragende ÖPNV-Anbindung\n+ Ca. 25 min ins Stadtzentrum mit der U-Bahn\n\n\n+ Baujahr laut Energieausweis: 1957\n+ Art des Energieausweises: Verbrauchsausweis\n+ Endenergiebedarf/verbrauch in kWh/(m²*a): 134,8\n+ Energieeffizienzklasse: E\n+ Wesentlicher Energieträger: Erdgas E', 'Im südlichen Berliner Stadtteil Tempelhof profitiert die Erdgeschosswohnung von einer urbanen Lage mit hervorragender Infrastruktur, sodass nicht nur alle Anlaufstellen des täglichen Bedarfs, sondern auch Erholungsgebiete wie der Viktoriapark innerhalb kürzester Zeit zu erreichen sind. Ebenso besteht von hier aus eine sehr gute Anbindung an den öffentlichen Nahverkehr.\n\nNeben einem Supermarkt in unmittelbarer Nähe gewährleisten mehrere Apotheken, Ärzte und eine Klinik, eine Postfiliale, Banken und viele andere Dienstleister sowie Cafés und Restaurants in maximal 10 Gehminuten Entfernung eine umfassende Versorgung. Auch der weitläufige Viktoriapark und viele verschiedene Sport- und Kulturangebote können in der Umgebung problemlos zu Fuß oder mit dem Fahrrad besucht werden.\n\nJeweils ca. 3 Gehminuten benötigen Sie bis zu den Bushaltestellen “Bayernring” und “Badener Ring”, die neben dem U-Bahnhof “Platz der Luftbrücke” in knapp 7 Gehminuten Entfernung für eine ideale Anbindung an den öffentlichen Nahverkehr sorgen, sodass eine Fahrt ins Stadtzentrum nur etwa 25 Minuten in Anspruch nimmt. Mit dem Auto können Sie darüber hinaus über die B96 problemlos auf das Straßenverkehrsnetz auffahren.', 'Vereinbaren Sie noch heute einen Besichtigungstermin!\n_____________________________________________________\n\nAlle Angaben sind ohne Gewähr und basieren ausschließlich auf Informationen, die uns von unserem Auftraggeber zur Verfügung gestellt wurden. Wir übernehmen keine Gewähr für die Vollständigkeit, Richtigkeit und Aktualität der Angaben.\n    '];;;;;9;;;;;;
2020-05-11 12:21:32.971199;Berlin;district_heating;ONE_YEAR_FREE;17687312;y;y;https://pictures.immobilienscout24.de/listings/3ae014ee-efba-4cb4-a1c8-1b830d74922d-1363701914.jpg/ORIG/resize/118x118%3E/extent/118x118/format/jpg/quality/80;8;11.3;40 MBit/s;telekom_layer_magenta_l;über VDSL;2019;;REGULAR;;11.3;117398569;district_heating;n;false;MagentaZuhause L;y;Berlin;y;11;9;no_information;;5.76;188;Berlin;10585;no_information;sophisticated;;false;100 MBit/s;no_information;no_information;y;https://padlock.link/ioml;https://padlock.link/ml;no_information;roof_storey;10585;5;;n;2,active;true;Deutschland;standard;100 MBit/s;wohnung_kauf;n;6;web,email,bank,music,dl-ul,game,sd,mltstr,hd,fast-ul-dl;true;009.9b07c9c6-a113-4f97-8df1-96a2073db349;1465000;profile0;5;true;n;showqualicontactform;n;n;Charlottenburg_Charlottenburg;117398569;7;Berlin;/expose/117398569;['Bei der hier zu verkaufenden Dachgeschosswohnung handelt es sich um einen Neubau aus dem Jahr 2018/2019. Nach Abtragung des alten Dachgeschosses wurde ein komplett neues Dach errichtet, sodass die Dachgeschosswohnung inklusive Dachterrasse entstehen konnte. \nIm gleichen Zuge wurde der gesamte Gründerzeitaltbau aus dem Jahr 1903 hochwertig saniert. \nDie großdimensionierte, offene Wohn-, Küchen- und Esslandschaft mit ihren ca. 60 qm ist Ausdruck des urbanen und zeitgemäßen Wohngefühls und der zentrale Bereich der hellen Wohnung. Von hieraus gelangen sie auf die 22 qm große Dachterrasse sowie über die Flure in die jeweiligen 4 Schlafzimmer und 3 Bäder. Die großzüge Dachgeschosswohnung ist sehr gut konzipiert, sodass die vielen Abstellflächen einen guten Stauraum bieten. Die Dachschrägen sind äußerst steil gehalten, um das Raumvolumen möglichst groß zu halten.\nAuf Grund der neuen Dachstatik konnte auf raumstörende Stützpfeiler und Säulen verzichtet werden.', '- Datendosen in allen Räumen\n- Rauchmelder\n- Fußbodenheizung\n- Hauswirtschaftsraum mit Waschmaschinenanschluss\n- Ebenerdige Duschen\n- Echtholzdielen\n- Schallschutzfendter (Schallschutzklasse 4)\n- Bangkirai Terrassendielen\n- Premium Schaltersystem BERKER R1\n- BUS-System (vorinstalliert)\n- Video-Gegensprechanlage\n- Keller\n- Saniertes Gemeinschaftseigentum', 'Die Dachgeschosswohnung befindet sich zwischen dem erholsamen Lietzensee und dem Schloss Charlottenburg. Die Wohnung ist fußläufig zur Fußgängerzone Wilmersdorfer Straße mit den Wilmersdorfer Arcaden und seinen vielen Geschäften. Die Umgebung bietet ihnen abwechslungsreiche Restaurants und eine ausgeprägte Gastro-Szene auf der Kantstraße oder dem ebenfalls fußläufigen Savignyplatz.\nDer Stadtteil Charlottenburg hat kulturell gesehen die Deutsche Oper, das Kantkino und die Villa Oppenheim, welche sich in unmittelbarer Nähe befinden genauso wie das Stadtbad Charlottenburg.  \nUnbeirrt von diesem Trubel entfaltet sich in den Seitenstraßen mit ihren großbürgerlichen Bauten eine ruhige Atmosphäre.'];;423;2019;;6;;;;;;
