2020-05-11 12:45:34.369717;Berlin;floor_heating;ONE_YEAR_FREE;16483024;n;y;https://pictures.immobilienscout24.de/listings/ebd9e717-4790-49ed-80cf-a94282886751-1324944287.jpg/ORIG/resize/118x118%3E/extent/118x118/format/jpg/quality/80;22;10.7;40 MBit/s;telekom_layer_magenta_l;;über Glasfaser;2018;REGULAR;10.7;113875428;1;natural_gas_light;n;true;MagentaZuhause L;n;Berlin;n;10;9;10;;5.51;145;Berlin;10318;first_time_use;sophisticated;;false;100 MBit/s;underground_garage;Am Carlsgarten;y;https://padlock.link/ioml;https://padlock.link/ml;Am_Carlsgarten;penthouse;10318;3;;n;2,active;true;Deutschland;schaufenster;100 MBit/s;wohnung_kauf;n;6;web,email,bank,music,dl-ul,game,sd,mltstr,hd,fast-ul-dl;true;002.01007276490;949000;profile0;6;3;true;n;showqualicontactform;n;n;Karlshorst_Lichtenberg;4013090-19_C;6;Berlin;/expose/113875428;['+ Video-Beratung: alle Informationen auch kontaktlos +\n\nGern informieren wir Sie zu diesem Projekt auch kontaktlos aber persönlich und umfassend per Videokonferenz. Setzen Sie sich dazu bitte telefonisch oder per Mail mit Ihrem/r Ansprechpartner/in in Kontakt und vereinbaren Sie einen Termin\n\nAuf einem rund 13.500 m² parkähnlichen Grundstück erweitert die HELMA Wohnungsbau GmbH im Berliner Ortsteil Karlshorst ihr Angebot mit dem Bau von 95 Eigentumswohnungen. \n\nDie luxuriösen Penthouse Wohnungen mit Dachterrasse sind das absolute Highlight des Bauprojektes. Die nur noch zwei verfügbaren Penthouse Wohnungen verfügen über 3- bis 4-Zimmer und bieten eine großzügige Wohnfläche von ca. 145 m² bis ca. 181 m². \n\nNeben der modernen, luxuriösen Ausstattung bieten die Wohnungen auf der jeweils obersten Etage von der Dachterrasse aus einen unvergleichbaren Ausblick über das Berliner Wohngebiet Carlsgarten. Ebenso eignen sich diese äußerst hochwertigen Dachgeschosswohnungen auch perfekt als Anlageimmobilien bzw. Kapitalanlage. Durch die begehrte Lage sowie die gehobene Ausstattung sind Sie mit einer Penthouse Wohnung in Berlin auf der sicheren Seite.', '+ KfW-Effizienzhaus 70\n+ Klinkerfassade\n+ Kontrollierte Wohnraumlüftung mit Wärmerückgewinnung\n+ Holzfenster (Holzart Meranti) mit 3-Scheiben-Isolierglas\n+ Fußbodenheizung\n+ 2-Schicht-Parkett\n+ Multimediale Anschlussdosen\n+ Kabel-TV und Satellitenanlage (ASTRA und Hotbird)\n+ Video-Gegensprechanlage mit Farbdisplay\n+ Waschmaschinenanschluss in jeder Wohnung\n+ Mindestens eine Terrasse/ein Balkon in Südlage (teilweise zusätzlich in Westlage)\n+ Aufzugsanlage in Edelstahl von der Tiefgarage in das Dachgeschoss\n+ Erhöhter Schallschutz (nach DIN 4109-Bbl. 2)\n+ Sämtliche Wohnungen sind barrierefrei zugänglich\n+ Zentrales BHKW mit Stromerzeugung zum Eigenverbrauch der Gebäude\n+ Weitläufiges, parkähnliches Grundstück', 'Besonders die Lage des Wohngebietes Carlsgarten ist attraktiv. Es ist innerstädtisch, aber dennoch ruhig gelegen. Das gesamte Areal mit seinem parkähnlichen Charakter und einem sehr alten Baumbestand grenzt unmittelbar an die Trabrennbahn Karlshorst. In direkter Nachbarschaft befindet sich der Volkspark Wuhlheide, der mit seinen zahlreichen Wander- und Radwegen und dem Sommerbad Wuhlheide viele Freizeitmöglichkeiten bietet. \n\nTrotzdem sind es nur wenige Minuten zum S-Bahnhof Karlshorst mit den Anschlüssen an die S-Bahn, Tram und Regionalbahn. Sehr bequem und einfach erreichen Sie die Geschäfte des täglichen Bedarfs, Bioläden, Drogerien, eine Vielzahl weiterer Einzelhändler, gemütliche Cafés oder Restaurants jeder Art. Selbst Apotheken und Ärzte sind fußläufig erreichbar. \n\nNeben Kindergärten, zwei Grundschulen und einem Gymnasium findet man außerdem zahlreiche Sport-, Freizeit- und Kulturangebote, nicht zu vergessen der Pferdesportpark Berlin-Karlshorst. Besonders beliebt ist die Freilichtbühne Wuhlheide mit zahlreichen Konzerten und Veranstaltungen. Das Theater, ein Fußballstadion, der Tierpark, ein Kletterpark und Abenteuerspielplätze bieten viel Abwechslung. \n\nSie haben Fragen zu unseren Penthouse Wohnungen oder wollen Luxusimmobilien in Berlin kaufen? Gerne informieren wir sie unverbindlich zu allen Details!', '* Der Kauf ist provisionsfrei - direkt vom Bauträger *\n\nDie HELMA Wohnungsbau GmbH erschließt eigene Grundstücke, entwickelt ein modernes Bebauungskonzept und bietet Eigentumsobjekte in hochwertiger Massivbauqualität als Komplettpaket zu Kauf an. Als erfahrener Bauträger können wir das Potenzial kleiner bis großer Flächen erkennen und ideal für viele nutzbar machen. Das macht vieles einfacher - für Sie! \n\nUnsere selbstständigen Vermittlungsvertreter Frau Uta Hunold, Herr Gernot Lüdke und Herr Robert Walter beraten Sie gern.\n\nDie Finanzierungsspezialisten der HELMA Hausbau Finanz GmbH unterbreiten Ihnen gern Ihr ganz persönliches Finanzierungsangebot.\n\nDas dargestellte Bild- und Planmaterial dient allein der Veranschaulichung und ist unverbindlich. Die Abbildungen zeigen zum Teil Sonderausstattungen/Eigenleistungen.'];;7;;disabled;;77980;true
2020-05-11 12:45:34.823155;Berlin;district_heating;ONE_YEAR_FREE;97549;n;y;https://pictures.immobilienscout24.de/listings/626357e3-d25d-44bc-a0f3-b0be2349281e-1325092168.jpg/ORIG/resize/118x118%3E/extent/118x118/format/jpg/quality/80;8;10.81;40 MBit/s;telekom_layer_magenta_l;;über VDSL;1914;REGULAR;10.81;113885730;;district_heating;n;false;MagentaZuhause L;y;Berlin;y;6;1;9;energy_consumption;6.01;54.5;Berlin;12159;no_information;no_information;E;false;100 MBit/s;no_information;"Fregestra&szlig;e";n;https://padlock.link/ioml;https://padlock.link/ml;Fregestraße;apartment;12159;2;141.3;n;2,active;true;Deutschland;top;100 MBit/s;wohnung_kauf;y;1;web,email,bank,music,dl-ul,game,sd,mltstr,hd,fast-ul-dl;true;001.97549;259000;profile0;;2;true;n;showqualicontactform;n;n;Friedenau_Schöneberg;Frege9_12;2;Berlin;/expose/113885730;['- Balkon\n- Dielen\n- Bad mit Wanne und Fenster\n- Gartenhaus\n- 1. Obergeschoss', 'Das Haus befindet sich in einer erstklassigen, ruhigen und dennoch zentralen Wohngegend von Berlin-Friedenau.\n\nDie Rheinstraße mit ihren zahlreichen Einkaufsmöglichkeiten und schönen Restaurants sowie das S-Café am S-Bahnhof Friedenau (S1) und den Breslauer Platz ist fußläufig gut zu erreichen.', 'Die monatliche Nettokaltmiete beträgt 469,78 €.'];;0;;;;;
2020-05-11 12:45:35.173915;Berlin;self_contained_central_heating;ONE_YEAR_FREE;18414478;n;y;https://pictures.immobilienscout24.de/listings/a323a856-31d4-45c0-9be9-cce962d14ea0-1352555456.jpg/ORIG/resize/118x118%3E/extent/118x118/format/jpg/quality/80;7;11.24;40 MBit/s;telekom_layer_magenta_l;;über VDSL;1960;REGULAR;11.24;113898964;;no_information;y;false;MagentaZuhause L;y;Berlin;y;5;2;no_information;;6.2;66.92;Berlin;10713;well_kept;normal;;false;100 MBit/s;no_information;no_information;n;https://padlock.link/ioml;https://padlock.link/ml;no_information;apartment;10713;2.5;;n;2,active;true;Deutschland;standard;100 MBit/s;wohnung_kauf;y;2;web,email,bank,music,dl-ul,game,sd,mltstr,hd,fast-ul-dl;true;002.01009254332;225000;profile0;5;2;true;n;showqualicontactform;n;n;Wilmersdorf_Wilmersdorf;15;3;Berlin;/expose/113898964;['Die ehemalige 2,5- und nun großzügige 2-Zimmer-Wohnung befindet sich im 2. OG eines sehr gepflegten Altbaus aus dem Jahr 1960. Über eine großzügige Diele erreicht man bequem alle Zimmer. Zum weitläufigen Innenhof gelegen, befinden sich die Küche inklusive Einbauküche und pflegeleichtem PVC-Belag und das Schlafzimmer, ausgelegt mit Teppich. Das Wohnzimmer mit Balkon ist zur Kahlstraße hin gelegen und ist aufgrund der vor Jahren geöffneten Wand sehr gemütlich. Auch im Wohnbereich finden wir einen sehr gepflegten Teppichboden. Der ursprüngliche und originale Dielenboden befindet sich jeweils unter Terppich, PVC-Belag und Laminat (in der Diele). Den Charakter eines Altbaus unterstreichen zudem die originalen Doppelkastenfenster und die angenehme Deckenhöhe von knapp 3 Metern. \r\nDas Badezimmer ist gefliest und verfügt über eine Badewanne. Zudem wurden vor ca. 4 Jahren die Stränge für Wasser und Abwasser erneuert.\r\n\r\nBei diesem Objekt besteht KEINE Möglichkeit einer Eigennutzung. Innenaufnahmen liegen aufgrund der Privatsphäre der MIeter nicht vor.', '- Teppichboden in Wohn- und Schlafzimmer\r\n- Laminat in der Diele\r\n- PVC-Belag in der Küche\r\n- gefliestes Badezimmer\r\n- Dielenboden vorhanden, befindet sich unter den aktuellen Böden\r\n- Balkon zur Kahlstraße (Westausrichtung)\r\n- Holzdoppelkastenfenster\r\n- Deckenhöhe von ca. 3 m\r\n- Wannenbad\r\n- Einbauküche', 'Wilmersdorf steht für den alten Westen: gutbürgerlich, wohlhabend und konservativ. Nach der Wiedervereinigung verlagerte sich das zentrale Leben Berlins eher in den ehem. Osten. Berlin-Mitte, Prenzlauer Berg und Friedrichshain wurden zu den Trendbezirken. Vor einigen Jahren begann mit dem Bau des Waldorf Astoria und den Veränderungen um den Kudamm eine Wiederbelebung des Westens. Nun hat sich das Lebensgefühl dieses Stadtteils durch die Eröffnung des neuen Upper-West, das Kaufhaus Bikini Berlin noch einmal völlig verändert. Dieses neue Flair verbindet sich hervorragend mit der Flaniermeile Kurfürstendamm und dem bekannten Kaufhaus KaDeWe. Mit dem Kurfürstendamm verläuft eine der bekanntesten Flanier- und Shoppingmeilen Deutschlands direkt durch diesen Stadtteil. Schöne Boutiquen, nette Bars, Einkaufsmöglichkeiten über den täglichen Bedarf hinaus, einem großen kulturellen Angebot und ein vielfältiges Gastronomieangebot bilden den besonderen Charme von Wilmersdorf. Aufgrund der steigenden Nachfrage für die begehrten Straßen dieses Stadtteils haben sich die Miet- und Kaufpreisentwicklungen in den vergangenen Jahren in gleicher Weise entwickelt. So sind die Wohnungskaufpreise durchschnittlich rund 5% pro Jahr gestiegen. Noch deutlicher wird die Nachfrage bei der Mietentwicklung. Hier sind die Mieten pro Jahr um fast 9% gestiegen. Mit einer ähnlichen Entwicklung ist in diesem beliebten Stadtteil wohl auch in Zukunft zu rechnen. '];;;;;;;
2020-05-11 12:45:35.582201;Berlin;self_contained_central_heating;ONE_YEAR_FREE;16649341;n;n;https://pictures.immobilienscout24.de/listings/a71221ed-1d7b-4362-ab72-e81492264c76-1326758758.jpg/ORIG/resize/118x118%3E/extent/118x118/format/jpg/quality/80;9;10.81;40 MBit/s;telekom_layer_magenta_l;;über VDSL;1910;REGULAR;10.81;113879435;;no_information;n;false;MagentaZuhause L;y;Berlin;n;6;1;no_information;;6.01;57.94;Berlin;12161;need_of_renovation;no_information;;false;100 MBit/s;no_information;no_information;n;https://padlock.link/ioml;https://padlock.link/ml;no_information;ground_floor;12161;2;;n;2,active;true;Deutschland;top;100 MBit/s;wohnung_kauf;n;0;web,email,bank,music,dl-ul,game,sd,mltstr,hd,fast-ul-dl;true;001.16215413;299000;profile0;;2;true;n;;n;n;Friedenau_Schöneberg;5357;2;Berlin;/expose/113879435;"['Das Mehrfamilienhaus wurde 1910 erbaut, steht unter Denkmalschutz und ist aufgeteilt in ein Vorderhaus mit Seitenflügel.\n\nStraßenseitig gibt es kleine Vorgärten, der Innenhof ist ebenfalls sehr grün, fast alle Wohnungen haben einen Balkon. \n\nDiese Wohnung ist renovierungsbedürftig und kann zu einem echten Kleinod gemacht werden. \n\nBeheizung erfolgt über eine Gasetagenheizung.\n\nGebäude wurde 2018 in Eigentumswohnungen aufgeteilt. \n\nHausgeld: € 133,00', '- 2 Zimmer\n- Bad mit Badewanne\n- Küche\n- Abstellraum\n- Flur\n\nZu dieser Wohnung gehört ein Sondernutzungsrecht für einen kleinen Gartenanteil.', 'Eine gefragte Lage von Berlin-Friedenau! Gute Wohnqualität und bei allen beliebt!\n\nDie Wohnung befindet sich im Herzen Friedenaus - mit Schulen, Kitas, Spielplätzen und den kleinen geheimnisvollen Ecken in einem der gefragtesten und beliebtesten Kiezen.\n\nZum Friedrich-Wilhelm-Platz mit der U-9 oder zum Rüdesheimer Platz mit der U-3 gelangt man in wenigen Minuten zu Fuß. \nEbenso ist eine der Haupteinkaufsstraßen Berlins, die Schloßstraße, nur wenige hundert Meter entfernt. Dort stehen\ndas ""Forum Steglitz"", das Einkaufscenter ""Das Schloß"" und der ""Boulevard Berlin"" für Shopping Erlebnisse zur Auswahl. \n\nFerner ist die Auffahrt zum Berliner Stadtring nur einige Minuten entfernt. ', 'Alle Angaben beruhen auf den Auskünften des Eigentümers, wir übernehmen dafür keine Gewähr. Zwischenverkauf / Änderung / Irrtum vorbehalten.\n\nBei Anfragen bitten wir um Ihre vollständigen  Kontaktdaten.\n\nGerne zeigen wir Ihnen das Objekt und freuen uns auf einen persönlichen Termin mit Ihnen.\n\nIhre\nIsabella v. Massenbach\nvon Massenbach Immobilien GmbH\n030 91566035 oder 0177 3600836\n\nWeitere interessante Angebote finden Sie auch im Internet unter www.massenbach-immobilien.de\n\nSie wollen Ihre Immobilie verkaufen ?\n\nWir suchen im Stadtgebiet von Berlin Immobilien (freie Eigentumswohnungen, Mehrfamilienhäuser und Einfamilienhäuser), auch zum eigenen Ankauf. Sprechen Sie uns gerne an oder vereinbaren Sie einen persönlichen Termin mit uns: 030-91566035']";133;;;disabled;;;
2020-05-11 12:45:35.905233;Berlin;self_contained_central_heating;ONE_YEAR_FREE;16649341;n;y;https://pictures.immobilienscout24.de/listings/b799c5a4-1c0c-4c02-853b-d9950161761c-1326756724.jpg/ORIG/resize/118x118%3E/extent/118x118/format/jpg/quality/80;6;10.81;40 MBit/s;telekom_layer_magenta_l;;über VDSL;1910;REGULAR;10.81;113879407;;no_information;n;false;MagentaZuhause L;y;Berlin;n;7;1;no_information;;6.01;84;Berlin;12161;no_information;no_information;;false;100 MBit/s;no_information;no_information;n;https://padlock.link/ioml;https://padlock.link/ml;no_information;apartment;12161;3;;n;2,active;true;Deutschland;top;100 MBit/s;wohnung_kauf;y;3;web,email,bank,music,dl-ul,game,sd,mltstr,hd,fast-ul-dl;true;001.16215413;379000;profile0;;3;true;n;;n;n;Friedenau_Schöneberg;5353;4;Berlin;/expose/113879407;"['Das Mehrfamilienhaus wurde 1910 erbaut, steht unter Denkmalschutz und ist aufgeteilt in ein Vorderhaus mit Seitenflügel.\n\nStraßenseitig gibt es kleine Vorgärten, der Innenhof ist ebenfalls sehr grün, fast alle Wohnungen haben einen Balkon. \n\nBeheizung erfolgt über eine Gasetagenheizung.\n\nGebäude wurde 2018 in Eigentumswohnungen aufgeteilt. Die Wohnung ist seit  01.12.2008 zuverlässig vermietet. Nach Verkauf der Wohnung besteht eine 10-jährige Kündigungsschutzfrist für die aktuellen Mieter.\n\nBruttokaltmiete: € 407,75\nHausgeld: € 186,69', '- 3 Zimmer\n- Bad mit Badewanne\n- Loggia\n- Küche\n- Abstellraum\n- Flur\n- Keller', 'Eine gefragte Lage von Berlin-Friedenau! Gute Wohnqualität und bei allen beliebt!\n\nDie Wohnung befindet sich im Herzen Friedenaus - mit Schulen, Kitas, Spielplätzen und den kleinen geheimnisvollen Ecken in einem der gefragtesten und beliebtesten Kiezen.\n\nZum Friedrich-Wilhelm-Platz (U9) oder zum Rüdesheimer Platz (U3) gelangt man in wenigen Minuten zu Fuß. \nEbenso ist eine der Haupteinkaufsstraßen Berlins, die Schloßstraße, nur wenige hundert Meter entfernt. Dort stehen\ndas ""Forum Steglitz"", das Einkaufscenter ""Das Schloß"" und der ""Boulevard Berlin"" für Shopping Erlebnisse zur Auswahl. \n\nFerner ist die Auffahrt zum Berliner Stadtring nur einige Minuten entfernt. ', 'Alle Angaben beruhen auf den Auskünften des Eigentümers, wir übernehmen dafür keine Gewähr. Zwischenverkauf / Änderung / Irrtum vorbehalten.\n\nBei Anfragen bitten wir um Ihre vollständigen  Kontaktdaten.\n\nGerne zeigen wir Ihnen das Objekt und freuen uns auf einen persönlichen Termin mit Ihnen.\n\nIhre\nIsabella v. Massenbach\nvon Massenbach Immobilien GmbH\n030 91566035 oder 0177 3600836\n\nWeitere interessante Angebote finden Sie auch im Internet unter www.massenbach-immobilien.de\n\nSie wollen Ihre Immobilie verkaufen ?\n\nWir suchen im Stadtgebiet von Berlin Immobilien (freie Eigentumswohnungen, Mehrfamilienhäuser und Einfamilienhäuser), auch zum eigenen Ankauf. Sprechen Sie uns gerne an oder vereinbaren Sie einen persönlichen Termin mit uns: 030-91566035']";186.69;;;disabled;;;
2020-05-11 12:45:36.329985;Berlin;central_heating;ONE_YEAR_FREE;185949;n;y;https://pictures.immobilienscout24.de/listings/5b2fa8c0-bb83-43f7-bdfa-8e5921d91fcf-1363299108.jpg/ORIG/resize/118x118%3E/extent/118x118/format/jpg/quality/80;15;11.35;40 MBit/s;telekom_layer_magenta_l;;über VDSL;1996;REGULAR;11.35;113897129;;no_information;n;true;MagentaZuhause L;n;Berlin;y;8;5;103;energy_consumption;7.53;88.23;Berlin;10245;well_kept;no_information;B;false;100 MBit/s;no_information;Boxhagener Strasse;y;https://padlock.link/ioml;https://padlock.link/ml;Boxhagener_Strasse;apartment;10245;2;71;n;2,active;true;Deutschland;standard;100 MBit/s;wohnung_kauf;y;5;web,email,bank,music,dl-ul,game,sd,mltstr,hd,fast-ul-dl;true;001.185949;433500;profile0;6;2;true;n;showqualicontactform;n;n;Friedrichshain_Friedrichshain;16719560;4;Berlin;/expose/113897129;"['Das Wohnhaus in der Boxhagener Straße 102-103/Ecke Kreutziger Straße befindet sich in einer sehr guten und zentralen Lage im begehrten Boxhagener Kiez. Die Fassade erstrahlt in einem neuen und modernen Farbkonzept. Durch stetige Modernisierungen sowohl im Haus- als auch im Gartenbereich bieten die 2- bis 5-Zimmer-Wohnungen eine hohe Wohn- und Lebensqualität. Auf rund 68 bis 127 Quadratmetern gibt es passende Entfaltungsmöglichkeiten für unterschiedliche Lebensstile.\r\n\r\nDer ansprechende Gesamteindruck setzt sich im Gebäudeinneren fort: Die Hauseingangstüren und Treppenhäuser wurden ebenfalls entlang eines harmonischen Farbkonzepts gestaltet. Nicht nur der gute Erhaltungszustand des Objekts, auch weitere Vorzüge wie der barrierearme Zugang dank Fahrstühlen stellen die Zukunftsfähigkeit der Eigentumswohnungen in der Boxhagener Straße sicher. Die Aufzüge in jedem der drei Treppenaufgänge wurden hinsichtlich Boden- und Wandbelägen, Deckenverkleidungen inklusive Beleuchtung umfassend modernisiert.\r\n\r\nDie vermieteten Wohnungen in der Boxhagener Straße überzeugen mit einem besonders hellen und freundlichen Raumgefühl. Die Fußböden in den Wohnbereichen und Schlafzimmern sind in stilvoller Holzoptik gehalten. Die Bäder wurden in der Regel mit einem Wannen- und Duschbad ausgestattet. Viele Wohnungen verfügen zudem über ein separates Gäste-WC und kleine Abstellkammern. Für eine optimierte Energiebilanz und Wärmeschutz sorgen die Isolierglasfenster im gesamten Objekt. Alle Wohnungen ab dem zweiten Stock sind mit Balkonen ausgestattet und schaffen Raum für entspannte Stunden.\r\n\r\n\r\nFinden Sie Ihre Eigentumswohnung bequem mit der Accentro APP, aus einer großen Auswahl an vielen Berliner Standorten! Jetzt im App Store.\r\nACCENTRO App für iOS: https://goo.gl/71G54P und ACCENTRO App für Android: https://goo.gl/5itxrF', 'Willkommen in Friedrichshain – Taktgeber für Trends, Kreativität und Wandel in der Hauptstadt. Früher ein Arbeiter- und Industrieviertel, avancierte das Quartier zu einem der attraktivsten Wohnlagen Berlins. Heute ist es eine bevorzugte Wohngegend für Familien, erfolgreiche Kreative, Start-ups und all jene, die diese spannende Mischung aus Lebens- und Wohnqualität mit authentischem Kiezflair schätzen. Jährlich gibt es rund 2.000 Zuzügler, die ihr Zuhause in Friedrichshain finden. Damit hat Friedrichshain einen höheren Zuzug als Kreuzberg, mit dem es den gemeinsamen Verwaltungsbezirk bildet und das zuletzt jährlich um ca. 600 Einwohner gewachsen ist.\r\n\r\nMittendrin liegt das Objekt in der Boxhagener Straße 102-103. Hier wohnen Sie zentral mit allen Vorzügen bestens aufgestellter ÖPNV-Verbindungen, einer breiten lokalen Nahversorgung, zahlreichen Cafés und dennoch viel Grün im urbanen Raum. Sie genießen hier den Luxus kurzer Wege, egal ob es um den Biomarkt, den Bäcker, die nächste Grünanlage, den Spielplatz oder die Kita geht.\r\n\r\nNicht nur Kultur, auch Natur zum Durchatmen gibt es in unmittelbarer Umgebung, so zum Beispiel in der Grünanlage Traveplatz, aber natürlich auch am ""Boxi"" selbst. Die große Grünanlage am Boxhagener Platz ist der ideale Ort zum Entspannen und Verweilen zwischen schattigen Bäumen, Bänken und viel Grün. Am Samstag findet sich hier mit dem Wochenmarkt ein wahres Einkaufsparadies für Frisches und Leckeres aller Art von Gemüse, Fleisch und Fisch, Obst bis hin zu Blumen. Außerdem können sich die Kleinen auf einem spannenden Abenteuerspielplatz austoben. Ein Gymnasium liegt etwa 400 Meter entfernt. Neben der idealen Verkehrsinfrastruktur sind der hohe Freizeitwert und die Lebensqualität zentrale Faktoren, die das Leben in Friedrichshain so attraktiv gestalten.']";200.45;8490;;disabled;;;
