2020-05-11 12:32:29.273112;Berlin;central_heating;ONE_YEAR_FREE;15741874;n;y;https://pictures.immobilienscout24.de/listings/be72a055-58e1-448c-b0b2-4e4333df1a56-1357503155.jpg/ORIG/resize/118x118%3E/extent/118x118/format/jpg/quality/80;19;11.48;40 MBit/s;telekom_layer_magenta_l;über VDSL;1900;REGULAR;11.48;116326086;gas;n;true;MagentaZuhause L;y;Berlin;n;8;1;280.79;no_information;energy_consumption;7.14;98.07;Berlin;10243;well_kept;normal;C;false;100 MBit/s;no_information;no_information;n;https://padlock.link/ioml;https://padlock.link/ml;no_information;roof_storey;10243;3;95.09;n;2,active;true;Deutschland;top;100 MBit/s;wohnung_kauf;y;4;web,email,bank,music,dl-ul,game,sd,mltstr,hd,fast-ul-dl;true;002.01002949789;470736;profile0;6;3;true;n;showqualicontactform;n;n;Friedrichshain_Friedrichshain;6606#MPKbf4;4;Berlin;/expose/116326086;['Bei dem hier präsentierten Objekt in der Warschauer Straße 10 handelt es sich um einen klassischen Altbau aus der Gründerzeit im beliebten Szenebezirk Berlin-Friedrichshain unweit des Frankfurter Tors und Boxhagener Platzes.\n\nDas um 1900 erbaute und über die Jahre liebevoll instandgehaltene Mehrfamilienhaus verfügt auf insgesamt 6 Etagen über 2 Gewerbe- und 11 Wohneinheiten, von denen eine Vielzahl der zur Straße gewandten Einheiten über Balkone mit Blick auf die Warschauer Straße verfügen. Das Dachgeschoss wurde bereits vor einigen Jahren zu Wohnzwecken ausgebaut, ein Fahrstuhl ist nicht vorhanden. Das Objekt ist mit einer Gas-Zentralheizung ausgestattet.\n\nDie Fassade des Mehrfamilienhauses sowie das gesamte Gemeinschaftseigentum werden im Laufe des Frühjahrs noch umfassenden Sanierungsarbeiten unterzogen. Im Hinterhof des Objektes entsteht zudem ein repräsentativer Neubau sowie eine Begrünung der Hoffläche welche dem Projekt den letzten Schliff verleihen. So spannen wir einen nahtlosen Bogen zwischen klassischem Altbauflair und zeitgenössischer Architektur angepasst an die Bedürfnisse des modernen Lebens. Die ersten Arbeiten hierzu sind in vollem Gange.\n\nDirekt an der Verbindungsstraße der angrenzenden Bezirke Prenzlauer Berg im Nordwesten und Kreuzberg im Südwesten gelegen, könnte das hier präsentierte Objekt nicht zentraler sein und bietet eine willkommene Mischung aus Ruhe vom stressigen Alltag und Nähe zum Trubel der Großstadt.\n\n---\n\nThe object presented here at Warschauer Straße 10 is a classic old building from the Wilhelminian period in the popular trendy district of Berlin-Friedrichshain near the Frankfurt Gate and Boxhagener Platz.\n\nThe multi-family house, built around 1900 and lovingly maintained over the years, has a total of 6 commercial and 11 residential units on 6 floors, of which a large number of the units facing the street have balconies with a view of Warschauer Strasse. The attic was expanded a few years ago for residential purposes, there is no elevator. The property is equipped with gas central heating.\n\nThe facade of the apartment building and the entire community property will undergo extensive renovation work in the spring. In the back yard of the property there is also a representative new building and a green area of the courtyard which give the project the finishing touch. In this way we span a seamless arc between classic old building flair and contemporary architecture adapted to the needs of modern life. The first work on this is in full swing.\n\nLocated directly on the connecting road between the neighboring districts of Prenzlauer Berg in the northwest and Kreuzberg in the southwest, the property presented here could not be more central and offers a welcome mix of tranquility from everyday stress and closeness to the hustle and bustle of the big city.', 'Wohnfläche: 98,07 m2\nKaufpreis: 470.736,00 €\nHausgeld: 280,79 €\nNKM: 735,00 €\nLage: DG rechts\nEtagenzahl gesamt: 6\nStatus: aktuell vermietet\nZimmer: 3\nBalkon/Terrasse: ja\nEinbauküche: nein\nKeller: ja\nBodenbelag: originaler Dielenboden\nFenster: Kunststofffenster\nTüren: Holztüren\nDeckenhöhe: 3,20 Meter\nFahrstuhl: nein\nHeizung: Zentralheizung (Gas)\nEnergieausweis: consumption pass\nEnergiekennwert: 95,09 kWh/ (m².a) inkl. Warmwasser/Heizung\n\n---\n\nLiving area: 98,07 m2\nPurchase price: € 470.736,00\nHouse money: ca. € 280,79\nNet rent: € 735,00\nLocation: top floor right\nStoreys: 6\nStatus: tenanted\nRooms: 3\nBalcony/terrace: yes\nFitted kitchen: no\nBasement: yes\nFlooring: original wooden floorboards\nWindows: plastic windows\nDoors: wooden doors\nCeiling height: 3,20 meters\nElevator: no\nHeating: central heating (gas)\nEnergy certificate: consumption pass\nEnergy performance: 95,09 kWh/ (m².a) incl. warm water/heating', 'Die Warschauer Straße im allseits beliebten und sehr dynamischen Bezirk Berlin-Friedrichshain ist eine der Hauptschlagadern im Osten der Hauptstadt und begeistert durch ein abwechslungsreiches Angebot an unzähligen Restaurants, Szenekneipen und kleineren Geschäften.\n\nDas nähere Umfeld des Objekts bietet die perfekte Möglichkeit für ausgelassene Sommerabende oder spontane Einkaufsbummel. Auch der regelmäßig stattfindende Wochen- und Flohmarkt am nahegelegenen Boxhagener Platz, dem insgeheimen Zentrum des Viertels, begeistert an den Wochenenden die Bewohner des Kiezes und hält neben stets frischen Lebensmitteln der Region auch immer die ein oder andere Überraschung bereit. \n\nAuch für das perfekte Familienglück bietet die Warschauer Straße und der Kiez rund um den Boxhagener Platz den perfekten Schaffensort. Unzählige Kindertagesstätten, Grundschulen, Oberschulen und Gymnasien befinden sich in unmittelbarer Umgebung des Objekts und auch Läden zur Deckung des täglichen Bedarfs wie Supermärkte, Drogerien oder Einkaufszentren sind stets nur einen Schritt weit Ihres neuen Zuhauses entfernt.\nMit der perfekten Anbindung an den öffentlichen Personennahverkehr könnte das hier angebotene Objekt nicht idealer gelegen sein. Zusätzlich zu der Bundesstraße B96a verkehren direkt vor der Haustür die Tram M10, mehrere Busse als auch die U-Bahnlinie U5, welche innerhalb von 3 Minuten fußläufig zu erreichen ist und im 5-Minuten-Takt zwischen dem Alexanderplatz und Hönow, bzw. dem Tierpark Berlin pendelt.\n\n---\n\nWarschauer Straße in the popular and very dynamic district of Berlin-Friedrichshain is one of the main arteries in the east of the capital and inspires with a varied range of restaurants, trendy bars and smaller shops.\n\nThe closer surroundings of the property offer the perfect opportunity for exuberant summer evenings or spontaneous shopping trips. The regular weekly and flea market at nearby Boxhagener Platz, the secret center of the district, delights the residents of the neighborhood on weekends and always has one or two surprises in store in addition to fresh local food.\n\nWarschauer Straße and the Kiez around Boxhagener Platz also offer the perfect place for creating perfect family happiness. Countless daycare centers, elementary schools, high schools and high schools are in the immediate vicinity of the property and also shops for daily needs such as supermarkets, drugstores or shopping centers are always just a step away from your new home.\n\nWith the perfect connection to local public transport, the property offered here could not be more ideally located. In addition to the B96a federal road, the M10 tram, several buses and the U5 subway line run right outside the front door, which can be reached on foot in 3 minutes and every 5 minutes between Alexanderplatz and Hönow, or the zoo Berlin commutes.', 'ACHTUNG: Die hier angebotene Wohnung ist aktuell vermietet. Eine Eigenbedarfskündigung (§ 577a Abs. 1 BGB) durch den neuen Erwerber und damit Vermieter darf frühestens nach zehn Jahren erfolgen. Nähere Regelungen sind im Gesetzestext nachzulesen.\n\nATTENTION: The apartment offered here is currently rented. The new purchaser and thus the landlord may terminate their own requirements (Section 577a (1) BGB) after ten years at the earliest. More detailed regulations can be found in the legal text.\n\n---\n\nHINWEIS: Leider liegen uns von der hier angebotenen Wohnung keine Bilder vor. Der Mieter hat sich gewünscht von der Veröffentlichung von Bildern Abstand zu nehmen. Diesen Wunsch respektieren wir gerne. Die Wohnung ist in liebevoll gepflegtem Zustand, eine Besichtigung lohnt sich!\n\nREMARK: Unfortunately, we do not possess images of the unit offered here. The tenant wished to step back from the publication of pictures and we gladly respect his wish. The apartment is very well maintained and meets all quality standards of the present time. A viewing is worth it!\n\n---\n\nBESICHTIGUNG: Für ein persönliches Gespräch und zur individuellen Abstimmung eines Besichtigungstermins stehen wir Ihnen gerne unter 030 27581533 persönlich zur Verfügung.\n\nVIEWING: For a personal viewing and to individually coordinate an appointment, we are happy to assist you at 030 27581533.'];;;;;;;;;;
2020-05-11 12:32:29.616428;Berlin;central_heating;ONE_YEAR_FREE;18492745;n;y;https://pictures.immobilienscout24.de/listings/4043a286-be0c-4e2b-9ff4-a340d6dabceb-1363102815.jpg/ORIG/resize/118x118%3E/extent/118x118/format/jpg/quality/80;6;11.3;40 MBit/s;telekom_layer_magenta_l;über VDSL;1950;REGULAR;11.3;116297994;natural_gas_light;y;false;MagentaZuhause L;y;Berlin;n;5;1;160;no_information;;5.73;41.59;Berlin;14057;well_kept;normal;;false;100 MBit/s;no_information;no_information;y;https://padlock.link/ioml;https://padlock.link/ml;no_information;apartment;14057;1;;n;2,active;true;Deutschland;standard;100 MBit/s;wohnung_kauf;n;5;web,email,bank,music,dl-ul,game,sd,mltstr,hd,fast-ul-dl;true;002.01009366216;222000;profile0;5;1;true;n;showqualicontactform;n;n;Charlottenburg_Charlottenburg;FI-10172;2;Berlin;/expose/116297994;[];;;;;;;1;2018;;
2020-05-11 12:32:30.070865;Berlin;central_heating;ONE_YEAR_FREE;18253633;n;y;https://pictures.immobilienscout24.de/listings/ed8dc2da-b074-4d10-90fb-c463b5c464a7-1355222135.jpg/ORIG/resize/118x118%3E/extent/118x118/format/jpg/quality/80;5;12.24;40 MBit/s;telekom_layer_magenta_l;über VDSL;1955;REGULAR;12.24;116325555;gas;n;false;MagentaZuhause L;y;Berlin;y;5;2;202;no_information;energy_consumption;6.53;55.65;Berlin;10783;no_information;no_information;;false;100 MBit/s;no_information;no_information;n;https://padlock.link/ioml;https://padlock.link/ml;no_information;apartment;10783;2.5;154.2;n;2,active;true;Deutschland;top;100 MBit/s;wohnung_kauf;y;2;web,email,bank,music,dl-ul,game,sd,mltstr,hd,fast-ul-dl;true;002.01009048957;235000;profile0;;2;true;n;showqualicontactform;n;n;Schöneberg_Schöneberg;SGB156;2;Berlin;/expose/116325555;"['Das Haus wurde im Jahre 1954 errichtet und erstreckt sich über 6 Etagen. Es ist gepflegt und in einem guten Zustand. Die Beheizung erfolgt über eine Gaszentralheizung. Die Nachbarschaftsstruktur ist sehr angenehm und solide.\n', 'Die Wohnung befindet sich im 2.OG des Hauses und verfügt über 3 Zimmer, eine Küche, ein Badezimmer, einen Flur und einen kleinen Balkon. Die Wohnräume sind hell und optimal geschnitten. Ein Keller gehört zur Ausstattung der Wohnung.', 'Bis heute ist Schöneberg mit seiner zentralen Lage und guten Verkehrsanbindung, der kulturellen Vielfalt und den vielen Grünanlagen ein beliebtes Wohnviertel. Das KaDeWe und der Winterfeldtmarkt sowie die vielen kleinen Geschäfte der Goltzstraße laden zum Einkaufsbummel ein. Seit den 70er Jahren sind von uns in Schöneberg rund 3.500 Altbauwohnungen um- fassend saniert und modernisiert worden. Ein besonderes Augenmerk wurde auf ein mieterorientiertes Wohnumfeld mit vielen Grünflächen in den Innenhöfen und attraktiven Spielplätzen für Kinder und Jugendliche gelegt. Ein besonderes Highlight ist der aus 40 ausrangierten alten Balkonen bestehende 14 m hohe Kletterfelsen auf dem Spielplatz in der Alvenslebenstraße. Betreut durch den Deutschen Alpenverein e.V. werden hier kleine und große Kletterer in die Welt des Hobbybergsteigens eingeführt.\nDie Steinmetzstr. Geht direkt von der Bülowstr. Ab. Deutschlandweit bekannt wurde die Straße durch die ARD-Vorabendserie Praxis Bülowbogen mit Günter Pfitzmann. Mit Berlin, Bülowstraße 80a ist sie auch titelgebender Schauplatz eines historischen Jugendromans von Gabriele Beyerlein, der im Berlin des ausgehenden 19. Jahrhunderts spielt.\nEntlang der Bülowstraße verkehrt die dort oberirdisch geführte Stammstrecke (heute die Linie U2) der Berliner U-Bahn. An der Kreuzung zur Potsdamer Straße liegt der Hochbahnhof Bülowstraße, der 1902 im Jugendstil vom Architekten Bruno Möhring entworfen wurde. Am Bülowbogen liegt der (gleichzeitig auch zu Ehren Bülows benannte) Dennewitzplatz. Dort wurde die Hochbahnstrecke durch ein Mietshaus geführt; unter der Durchfahrt befanden sich die Akademischen Bierhallen, ein seinerzeit populäres Bierlokal. Bei den Luftangriffen auf Berlin im November 1943 wurde diese Bebauung zerstört und die Reste später zu einem großen Teil abgerissen. Unterhalb des U-Bahnviadukts befindet sich ein Zugang zu einer Kleingartenkolonie, die 2013 in den Westpark einbezogen wurde und einen Zugang für Fußgänger und Radfahrer ermöglicht. Der Westpark wurde am 31. Mai 2013 als zweiter Teil des Parks am Gleisdreieck eröffnet.', 'Der Nachweis und/ oder der Nachweis über die Vermittlung ist für den Erwerber provisionspflichtig und beträgt den im Exposé angegebenen Preis oder Prozentsatz vom Kaufpreis, zahlbar bei Abschluss des Kaufvertrages. Die Grunderwerbssteuer, Notar- und Grundbuchkosten sind vom Käufer zu tragen. Wir weisen darauf hin, dass dieser Angebotspreis fallen oder bei erheblicher Nachfrage nach Objekten der hier angebotenen Art auch steigen kann. \n\nAlle gemachten Angaben zu Objekten sind ohne Gewähr und basieren ausschließlich auf Informationen, die uns von unserem Auftraggeber oder von Dritten übermittelt wurden. Wir übernehmen keine Gewähr für die Richtigkeit, die Vollständigkeit, sowie die Aktualität dieser Angaben. Irrtum, Änderung und Zwischenverkauf vorbehalten. Eine definitive Bindung zwischen Verkäufer und Käufer kommt erst zustande, wenn ein wirksamer Kaufvertrag vor einem Notar beurkundet wurde. Bis dahin sind jegliche Kaufbemühungen der Kaufinteressenten für den Verkäufer freibleibend und unverbindlich. Bitte beachten Sie unsere AGB. Das Exposé dient als Vorabinformation, Rechtsgrundlage ist allein der notariell beurkundete Kaufvertrag. Die Weitergabe dieses Angebots an Dritte darf nur mit unserer Zustimmung erfolgen. Sollte Ihnen dieses Angebot bereits bekannt sein, so bitten wir um schriftliche Bekanntgabe unter Nennung des Anbieters innerhalb von 5 Tagen nach Erhalt des Angebots.\n\nSämtliche durch uns erstellten Daten, Fotos und Textbeiträge sind urheberrechtlich geschützt. Die Vervielfältigung von Informationen oder Daten, insbesondere die Verwendung von Texten, Textteilen, Bildmaterial bedarf der vorherigen schriftlichen Einwilligung durch uns. Unberechtigte Verwendungen ziehen eine Nutzungsberechnung nach sich und werden zur Anzeige gebracht.']";;;;;;;;;;
2020-05-11 12:32:30.395913;Berlin;central_heating;ONE_YEAR_FREE;15688089;n;y;https://pictures.immobilienscout24.de/listings/7400cb6b-9eb4-4473-ad9a-e4d1755138f6-1355127169.jpeg/ORIG/resize/118x118%3E/extent/118x118/format/jpg/quality/80;13;11.3;40 MBit/s;telekom_layer_magenta_l;über VDSL;1970;REGULAR;11.3;116303670;natural_gas_light;y;false;MagentaZuhause L;y;Berlin;y;7;2;332;no_information;energy_consumption;5.73;83;Berlin;14055;fully_renovated;sophisticated;;false;100 MBit/s;garage;no_information;y;https://padlock.link/ioml;https://padlock.link/ml;no_information;apartment;14055;3;125.1;n;2,active;true;Deutschland;standard;100 MBit/s;wohnung_kauf;n;1;web,email,bank,music,dl-ul,game,sd,mltstr,hd,fast-ul-dl;true;002.01002864719;349000;profile0;15;3;true;y;showqualicontactform;n;n;Charlottenburg_Charlottenburg;TZI83GL;4;Berlin;/expose/116303670;['Die gutgeschnittene, lichtdurchflutete 3 Zimmerwohnung befindet sich auf der ersten Etage eines Mehrfamilienhauses. Die Wohnung empfängt Sie\nmit einem geräumigen Flurbereich und übergeht in einen offenen Küchenbereich.\nDie Wohnung verfügt über zwei Schlafzimmer, und ein gemütliches, helles Wohnzimmer mit Balkon. Der Blick vom Balkon wandert über die\nweitläufigen Gartenanlagen.\nGroße Fensterflächen laufen entlang der gesamten Breite des Wohnzimmers. Der dahinter liegende Balkon bietet viel Platz und einen Blick ins\nGrüne über die weitläufigen Gartenanlagen. Die südwestliche Ausrichtung sorgt für sehr helle, lichtdurchflutete Räume.\nDie Wohnung wurde Sommer 2018 komplett saniert.', 'Sanierung:\n- neue Fenster und Türen \n- neue Böden (Laminat & Fließen)\n- neue Heizkörper \n- neues Badezimmer mit neuer Regendusche\n- Wände & Decken glatt gespachtelt \n- Malerarbeiten\n- Elektrokabel unter Putz verlegt\n- Neue Küche \n- Balkon (Westausrichtung) neuer Bodenbelag \n- Parkplätze reichlich vorhanden\n\nEin Garagenstellplatz kann separat für 20.000€ erworben werden.\n\nGehen Sie den ersten Schritt und vereinbaren\nSie kurzfristig einen unverbindlichen Besichtigungstermin.', 'Mitten in der Natur und dennoch in der Stadt.\nDas beliebte Westend ist eine überaus gefragte und exklusive Wohnlage im Bezirk Charlottenburg.\nEin Traum für Menschen die beides schätzen: das impulsive Berliner Stadtleben sowie die Ruhe und Geborgenheit der grünen Umgebung.\nDie Glockenturmstraße ist eine verkehrsberuhigte Anliegerstraße mit optimaler Infrastruktur und guter Verkehrsanbindung.\nDie Umgebung bietet zahlreiche Freizeitmöglichkeiten wie Wasser- und Reitsport, Fahrradfahren, Laufen, Schwimmen, Schlittschuhlaufen. Die in unmittelbarer Nähe liegenden Havelseen tragen zur außergewöhnlichen Attraktivität dieser Lage bei und bieten Wassersportbegeisterten viele Möglichkeiten zur Entfaltung ihrer Hobbys. An heißen Sommertagen sorgen verschiedene Badestellen für erfrischende Abkühlung.\nJedoch kann sich neben dem hohen Freizeitwert und exponierter Lage auch die Infrastruktur sehen lassen.\nFür das Alltägliche Leben finden sich Schulen, Kindergärten, Ärzte, Einkaufsmöglichkeiten und Institutionen des täglichen Bedarfs im nahen Umkreis.\nWer sich nach dem pulsierenden Großstadtleben sehnt, Kultur und Unterhaltung genießen möchte, dem erschließt sich nur wenige Auto- oder SBahnminuten\nnah – zwischen Deutsche Oper und Kurfürstendamm ein einmaliges Angebot. Das internationale Messegelände am ICC ist in wenigen Minuten Fahrt erreichbar.\nEinzigartige Lagevorteile:\n+ mitten in der Natur und frischen Luft\n+ Ausblick über Wälder und Havelseen\n+ Auf dem Grundstück befinden sich zahlreiche parkähnliche Erholungs- Anlagen und Spielmöglichkeiten für Kinder\n+ Attraktion Teufelsberg: Rodeln, Drachen steigen, Aussichtspunkt über Berlin, Picknick und mehr\n+ S - Bahn Station Pichelsberg (500 m entfernt)\n+ Bus M49 Stößenseebrücke (350 m), Bus 218\n+ Liegeplätze und Häfen für Boote/Yachten\n+ N Messedamm am ICC (4,3 km)\n+ City West Zentrum Kurfürstendamm (6 km)\n+ Olympiastadion (1,7 m)\n+ Horst Köber Sportzentrum (600 m)\n+ Eissporthalle Charlottenburg (500 m)\n+ Reitsport-Anlagen (800 m)\n+ Waldbühne (650 m)\n+ grenzt am Eliten Villenviertel Grunewald', 'Die von uns gemachten Angebote sind ausschließlich für den Empfänger bestimmt. Bei Weitergabe - auch auszugsweise - an Dritte ohne unsere Zustimmung haftet der Weitergebende für die volle Courtage, wenn ein Vertrag zustande kommt. Das Angebot basiert auf Angaben Dritter (Eigentümer, Behörden etc.). Für die Richtigkeit und Vollständigkeit wird keine Haftung übernommen. Die Courtage ist mit Vertragsabschluss verdient und fällig und ist vom Käufer an TZ Immobilien zu entrichten. Gerichtsstand für Vollkaufleute ist in Berlin.'];;disabled;;;;;1;2018;;
2020-05-11 12:32:30.786152;Berlin;wood_pellet_heating;;18594345;y;y;https://pictures.immobilienscout24.de/listings/fbdcfaa3-ae7c-4e62-91f1-de0b827ee906-1363886770.jpeg/ORIG/resize/118x118%3E/extent/118x118/format/jpg/quality/80;8;10.4;;;;2020;;10.4;116170897;pellet_heating;n;false;;y;Berlin;y;8;9;;41;;5.04;110;Berlin;12621;first_time_use;sophisticated;;false;;outside;"Grottkauer Stra&szlig;e";n;;;Grottkauer_Straße;terraced_flat;12621;4;;n;2,active;;Deutschland;premium;;wohnung_kauf;n;0;;false;009.f71ecffd-9e8f-4c1a-87cc-0eb0ec12a95c;495000;profile0;2;4;true;y;showqualicontactform;y;n;Kaulsdorf_Hellersdorf;116170897;5;Berlin;/expose/116170897;['Die Gartenwohnung erstreckt sich über das gesamte Erdgeschoss in einer modernen Stadtvilla mit nur 3 Wohneinheiten. \n\nDie Wohnung hat einen großzügigen Wohn- und Essbereich sowie 3 Schlafzimmer. Die Ausstattung beinhaltet ebenfalls ein komfortables Masterbad und eine Gäste-WC.\nEine gemütliche Gartenterraase und ein Keller/ Hobbyraum sind zusätzlich Bestandteil der Wohnung. Der Gartenanteil der Wohnung beträgt ca. 200 m².\n\n\nFertigstellung im November 2020', 'Hochwertige Ausstattung inklusive Sonderleistungen.', 'Kaulsdorf liegt im östlichen Teil von Berlin . Sie sind umgeben von Einfamilienhaussiedlungen und Naherholungsgebieten. Einkaufsmöglichkeiten, Kitas, Schulen und das Unfallkrankenhaus Marzahn befinden sich in unmittelbarer Nähe. Unweit vom Haus befinden sich die U-Bahn Station Gärten der Welt der Linie U5  mit der sie in 20 min. in der Berliner City sind.', 'Bitte haben Sie Verständnis dafür, dass nur Anfragen mit vollständiger Adresse und Rückrufnummer bearbeitet werden können.'];;;;;;;1;;true;135
