2020-05-11 12:21:35.792746;Berlin;central_heating;ONE_YEAR_FREE;16115878;n;y;https://pictures.immobilienscout24.de/listings/b8f4a6e5-5154-4823-a33f-96d0839a341d-1363709818.jpg/ORIG/resize/118x118%3E/extent/118x118/format/jpg/quality/80;10;12.24;40 MBit/s;telekom_layer_magenta_l;über VDSL;1938;;REGULAR;;12.24;117408859;district_heating;n;false;MagentaZuhause L;y;Berlin;n;4;1;no_information;;6.53;63;Berlin;12157;no_information;no_information;;false;100 MBit/s;no_information;no_information;n;https://padlock.link/ioml;https://padlock.link/ml;no_information;apartment;12157;3;;n;2,active;true;Deutschland;top;100 MBit/s;wohnung_kauf;n;1;web,email,bank,music,dl-ul,game,sd,mltstr,hd,fast-ul-dl;true;001.1252850;170000;profile0;3;true;n;;n;n;Schöneberg_Schöneberg;1699 (1/1644);3;Berlin;/expose/117408859;['Die Etagenwohnung befindet sich im Hochparterre, eines im Jahre 1938 errichteten Mehrfamilienhauses direkt in Berlin Schöneberg und hat eine Wohnfläche von ca. 63m². Die gut lichtdurchflutete Wohnung verfügt über 3 Wohnräume, Küche, Flur, Badezimmer und einen Balkon mit Blick auf eine grüne Parkanlage. Dort findet man einen ruhigen Platz, um die Natur zu genießen. Die Küche sowie das Bad sind gefliest. Die Wohnung ist mit einer Einbauküche inkl. Elektrogeräten ausgestattet. Alle Räume haben eine außergewöhnliche Deckenhöhe von ca. 2,65m. Die Wohnung wurde mit Holz-Doppelrahmenfenster ausgestattet. Die Außenfassade wurde im Jahr 1995 gedämmt, das Dach ca. 2006 saniert. Eine moderne Gegensprechanlage sowie ein großer Kellerraum sind vorhanden. Der Kellerbereich ist absolut trocken und ordentlich. Die Wohneinheit wird mit Fernwärme beheizt (Warmwasser, Heizung). Der Balkon hat eine gute Größe und liegt zur Gartenseite, absolut ruhig. Die Wohnräume sind mit Laminat ausgelegt. Alle sichtbaren Steigleitungen (auch im Kellerbereich), Heizkörper und Heizungs-Ventile machen einen soliden Eindruck. Die Wohnung ist seit 2009 vermietet. Es bestehen keine Mietrückstände. Die jetzige Bruttomiete beläuft sich auf ca. 556€uro. Die letzte Mieterhöhung erfolgte April 2019. Die Immobilie unterliegt dem Denkmalschutz und einem Erbbaurechtsvertrag, welcher 2004 für weitere 99 Jahre abgeschlossen wurde. Bei dem Verkauf handelt es sich um eine vermiete und sehr gepflegte Wohnung. Die Bushaltestelle ist fast direkt vor Tür. Einkaufsmöglichkeiten sind zu Fuß gut erreichbar. Die Entfernung zur S-Bahn, U-Bahn, Schulen, Kita und Einkaufsmöglichkeiten sind fußläufig in wenigen Gehminuten erreichbar. \n\nEine gute Bonität wird von dem Eigentümer gewünscht.\n\n', '*saniert (Fassade und Dach Dämmung)\n* Holz-Doppelrahmenfenster\n*Heizung: Fernwärme\n*renoviert und modernisiert \n*Einbauküche \n*Badezimmer mit Badewanne und Fenster\n* Grünanlage und Balkon \n*Keller ist vorhanden\n*solide Bauweise\n*gute Verkehrsanbindung\n*S-Bahn Friedenau -7 Gehminuten\n*alle Einkaufsmöglichkeiten fußläufig erreichbar\n\nWir bitten vorab:\n1) Formular :Formular-Einholung der Einwilligung zur sofortigen Tätigkeit\nund \n2) Formular EINWILLIGUNG ZUR  SPEICHERUNG DER DATEN EU-Datenschutz-Grundverordnung (EU-DSGVO)\n\n\n\n', 'Der Bezirk Tempelhof-Schöneberg gehört zu den begehrtesten, westlichen Bezirken von Berlin, der die neben einer zentralen Lage auch See-, Fluss- und Parkanlagen bieten. In der Umgebung befinden sich sämtliche Einkaufsmöglichkeiten und Dienstleistungen, die man für den täglichen Bedarf benötigt. Über die Bundesautobahn A 103, welche weniger als 4 km entfern liegt, erreicht man sehr gut den Berliner Ring (A 100). Tempelhof-Schöneberg hat mehrere S-Bahnanschlüsse, welche sich in unmittelbarer Nähe befinden.  Eine große Auswahl an Restaurants für alle Geschmacksrichtungen befinden sich in unmittelbarer Nähe. In wenigen Gehminuten erreichen Sie alle Einkaufsmöglichkeiten. In unmittelbarer Nähe befindet sich die Bushaltestelle mit direktem Anschluss an das öffentliche S- und U-Bahnnetz sowie den Fernbahnhof.', 'Die Maklercourtage beträgt für den Käufer vom Courtage-Satz von 7,14 % inkl. MwSt. beurkundeten Kaufpreis und ist verdient und fällig bei Abschluss des notariellen Kaufvertrages. \n\nAlle Angaben haben wir nach bestem Wissen gemacht. Da Diese jedoch teilweise auf Informationen Dritter beruhen, kann der Makler für die Richtigkeit keine Gewähr übernehmen. Eine Weitergabe des Angebotes bedarf unserer ausdrücklichen Zustimmung. Das Objekt gilt als unbekannt, sofern nicht innerhalb von fünf Werktagen Einspruch mit Quellenangabe eingelegt wird. Alle Gespräche sind über unser Büro zuführen. Bei Zuwiderhandlung behalten wir uns Schadenersatz bis zur Höhe der Provisionsansprüche ausdrücklich vor. Zwischenverkauf ist nicht ausgeschlossen.\n \nWeitere Informationen: \n\nBesichtigung: Nach Vereinbarung\n'];8;;;7;;;;;;;
2020-05-11 12:21:36.126875;Berlin;district_heating;ONE_YEAR_FREE;237210;n;n;https://pictures.immobilienscout24.de/listings/aeb14488-a54f-4f63-939e-1060e87d3724-1363660600.jpg/ORIG/resize/118x118%3E/extent/118x118/format/jpg/quality/80;10;11.37;40 MBit/s;telekom_layer_magenta_l;über VDSL;1962;;REGULAR;;11.37;117401054;district_heating;n;false;MagentaZuhause L;y;Berlin;n;7;2;no_information;energy_consumption;5.8;88.2;Berlin;10713;first_time_use_after_refurbishment;no_information;NO_INFORMATION;false;100 MBit/s;no_information;no_information;y;https://padlock.link/ioml;https://padlock.link/ml;no_information;apartment;10713;4;103;n;2,active;true;Deutschland;top;100 MBit/s;wohnung_kauf;n;2;web,email,bank,music,dl-ul,game,sd,mltstr,hd,fast-ul-dl;true;001.237210;358000;profile0;4;true;n;showqualicontactform;n;n;Wilmersdorf_Wilmersdorf;117401054;4;Berlin;/expose/117401054;['Hell und freundlich erwartet Sie ein besonderes Ambiente auf zwei Ebenen. Durch großzügige Fensterelemente sind Luft, Licht und Sonne wesentliche Faktoren, die der Wohnung ein angenehmes Raumklima verleihen und somit eine ideale Belichtung gewähren. Der ideale Grundriss und die sehr schönen Sichtachsen zwischen den Zimmern machen die Wohnung zu einer wahren Besonderheit. Die Ausstattung innerhalb der Räume bedarf einer Anpassung an die individuellen Ansprüche für einen zeitgemäßen Wohnzustand.\nDie Einheit besteht zur Zeit noch aus zwei Einheiten, die übernander liegen, diese müssen noch zusammen gelegt werden', '- 2 gefließte Bäder\n- 2 Küchen\n- Panoramafenster\n- 2 große Sonnenbalkone\n- Laminatboden\n- unverbauter Grünblick\n- attraktive Gartenbegrünung\n- sehr guter Infrastruktur', 'Der Ortsteil Wilmersdorf gehört zum Bezirk Charlottenburg-Wilmersdorf, dem renommierten Citybezirk des Westens mit großbürgerlicher Geschichte, historisch gewachsenen Institutionen wie dem Kurfürstendamm und beeindruckender Altbau-Architektur. Sein vielfältiges Stadtbild und die zentrale Lage geben Wilmersdorf einen unverwechselbaren Charakter, der sich insbesondere über den hier praktizierten urbanen Lifestyle definiert. Belebende Faktoren wie Einkaufsstraßen, Restaurants und Cafés kommen hier mit beruhigenden Faktoren wie dem Volkspark Wilmersdorf zusammen und schaffen einen facettenreichen Mix. Charlottenburg-Wilmersdorf grenzt im Süden an Steglitz-Zehlendorf, im Osten an Tempelhof-Schöneberg sowie im Norden an Mitte und erfreut sich somit in jeder Hinsicht guter, schnell erreichbarer Nachbarschaft', 'Sie haben auch eine Immobilie zu verkaufen ?\n\nWir könnten genau für Ihre Immobilie den richtigen Käufer haben, fragen Sie bei uns an !\n\nTel. 030-2640470 oder info@glatzer-immobilien-berlin.de'];;440;;;;;1;;;;
2020-05-11 12:21:36.630123;Berlin;central_heating;ONE_YEAR_FREE;15688089;n;y;https://pictures.immobilienscout24.de/listings/bbc90e31-5ec5-4310-abd8-04473864c31c-1363684162.jpeg/ORIG/resize/118x118%3E/extent/118x118/format/jpg/quality/80;13;11.3;40 MBit/s;telekom_layer_magenta_l;über VDSL;1970;;REGULAR;disabled;11.3;117406127;natural_gas_light;y;false;MagentaZuhause L;y;Berlin;y;7;2;no_information;energy_consumption;5.73;83;Berlin;14055;fully_renovated;sophisticated;;false;100 MBit/s;garage;no_information;y;https://padlock.link/ioml;https://padlock.link/ml;no_information;apartment;14055;3;125.1;n;2,active;true;Deutschland;standard;100 MBit/s;wohnung_kauf;n;1;web,email,bank,music,dl-ul,game,sd,mltstr,hd,fast-ul-dl;true;002.01002864719;349000;profile0;3;true;y;showqualicontactform;n;n;Charlottenburg_Charlottenburg;Westend3Z;4;Berlin;/expose/117406127;['Die gutgeschnittene, lichtdurchflutete 3 Zimmerwohnung befindet sich auf der ersten Etage eines Mehrfamilienhauses. Die Wohnung empfängt Sie\nmit einem geräumigen Flurbereich und übergeht in einen offenen Küchenbereich.\nDie Wohnung verfügt über zwei Schlafzimmer, und ein gemütliches, helles Wohnzimmer mit Balkon. Der Blick vom Balkon wandert über die\nweitläufigen Gartenanlagen.\nGroße Fensterflächen laufen entlang der gesamten Breite des Wohnzimmers. Der dahinter liegende Balkon bietet viel Platz und einen Blick ins\nGrüne über die weitläufigen Gartenanlagen. Die südwestliche Ausrichtung sorgt für sehr helle, lichtdurchflutete Räume.\nDie Wohnung wurde Sommer 2018 komplett saniert.', 'Sanierung:\n- neue Fenster und Türen \n- neue Böden (Laminat & Fließen)\n- neue Heizkörper \n- neues Badezimmer mit neuer Regendusche\n- Wände & Decken glatt gespachtelt \n- Malerarbeiten\n- Elektrokabel unter Putz verlegt\n- Neue Küche \n- Balkon (Westausrichtung) neuer Bodenbelag \n- Parkplätze reichlich vorhanden\n\nEin Garagenstellplatz kann separat für ca. 20.000€ erworben werden, ist aber nicht zwingend notwendig, da es genug Parkplätze in der Straße vor dem Haus gibt.\n\nGehen Sie den ersten Schritt und vereinbaren\nSie kurzfristig einen unverbindlichen Besichtigungstermin.', 'Mitten in der Natur und dennoch in der Stadt.\nDas beliebte Westend ist eine überaus gefragte und exklusive Wohnlage im Bezirk Charlottenburg.\nEin Traum für Menschen die beides schätzen: das impulsive Berliner Stadtleben sowie die Ruhe und Geborgenheit der grünen Umgebung.\nDie Glockenturmstraße ist eine verkehrsberuhigte Anliegerstraße mit optimaler Infrastruktur und guter Verkehrsanbindung.\nDie Umgebung bietet zahlreiche Freizeitmöglichkeiten wie Wasser- und Reitsport, Fahrradfahren, Laufen, Schwimmen, Schlittschuhlaufen. Die in unmittelbarer Nähe liegenden Havelseen tragen zur außergewöhnlichen Attraktivität dieser Lage bei und bieten Wassersportbegeisterten viele Möglichkeiten zur Entfaltung ihrer Hobbys. An heißen Sommertagen sorgen verschiedene Badestellen für erfrischende Abkühlung.\nJedoch kann sich neben dem hohen Freizeitwert und exponierter Lage auch die Infrastruktur sehen lassen.\nFür das Alltägliche Leben finden sich Schulen, Kindergärten, Ärzte, Einkaufsmöglichkeiten und Institutionen des täglichen Bedarfs im nahen Umkreis.\nWer sich nach dem pulsierenden Großstadtleben sehnt, Kultur und Unterhaltung genießen möchte, dem erschließt sich nur wenige Auto- oder SBahnminuten\nnah – zwischen Deutsche Oper und Kurfürstendamm ein einmaliges Angebot. Das internationale Messegelände am ICC ist in wenigen Minuten Fahrt erreichbar.\nEinzigartige Lagevorteile:\n+ mitten in der Natur und frischen Luft\n+ Ausblick über Wälder und Havelseen\n+ Auf dem Grundstück befinden sich zahlreiche parkähnliche Erholungs- Anlagen und Spielmöglichkeiten für Kinder\n+ Attraktion Teufelsberg: Rodeln, Drachen steigen, Aussichtspunkt über Berlin, Picknick und mehr\n+ S - Bahn Station Pichelsberg (500 m entfernt)\n+ Bus M49 Stößenseebrücke (350 m), Bus 218\n+ Liegeplätze und Häfen für Boote/Yachten\n+ N Messedamm am ICC (4,3 km)\n+ City West Zentrum Kurfürstendamm (6 km)\n+ Olympiastadion (1,7 m)\n+ Horst Köber Sportzentrum (600 m)\n+ Eissporthalle Charlottenburg (500 m)\n+ Reitsport-Anlagen (800 m)\n+ Waldbühne (650 m)\n+ grenzt am Eliten Villenviertel Grunewald', 'Die von uns gemachten Angebote sind ausschließlich für den Empfänger bestimmt. Bei Weitergabe - auch auszugsweise - an Dritte ohne unsere Zustimmung haftet der Weitergebende für die volle Courtage, wenn ein Vertrag zustande kommt. Das Angebot basiert auf Angaben Dritter (Eigentümer, Behörden etc.). Für die Richtigkeit und Vollständigkeit wird keine Haftung übernommen. Die Courtage ist mit Vertragsabschluss verdient und fällig und ist vom Käufer an TZ Immobilien zu entrichten. Gerichtsstand für Vollkaufleute ist in Berlin.'];;332;2018;;15;;1;;;;
2020-05-11 12:21:37.076372;Berlin;central_heating;ONE_YEAR_FREE;16404314;n;n;https://pictures.immobilienscout24.de/listings/e4ad4c2b-7900-4879-994c-2c9652f195e2-1363575699.jpeg/ORIG/resize/118x118%3E/extent/118x118/format/jpg/quality/80;8;11.14;40 MBit/s;telekom_layer_magenta_l;über VDSL;2000;;REGULAR;;11.14;117386928;no_information;y;false;MagentaZuhause L;n;Berlin;y;5;5;143;energy_consumption;6.17;40;Berlin;10409;well_kept;normal;NO_INFORMATION;false;100 MBit/s;no_information;"Erich-Weinert-Stra&szlig;e";y;https://padlock.link/ioml;https://padlock.link/ml;Erich-Weinert-Straße;apartment;10409;2;;n;2,active;true;Deutschland;standard;100 MBit/s;wohnung_kauf;n;3;web,email,bank,music,dl-ul,game,sd,mltstr,hd,fast-ul-dl;true;001.15725829;250000;profile0;2;true;n;showqualicontactform;y;n;Prenzlauer_Berg_Prenzlauer_Berg;08744;1;Berlin;/expose/117386928;['Sehr schöne 2-Zimmerwohnung\n\nMitten im Herzen vom Prenzlauer Berg befindet sich diese sehr schöne 2-Zimmerwohnung. \n\nDie Wohnung ist behindertengerecht und hat sehr breite Türen.', 'Die Wohnung wird ohne Möbel (bis auf Küche) verkauft.', 'Prenlzlauer Berg. \nIm direkten Umfeld sind Supermärkte, Baumärkte, Sportanlagen usw.', 'Die Wohnung ist vermietet, der Mieter ist sehr angenehm.'];38;227;2015;;5;;;;;;
2020-05-11 12:21:37.445682;Berlin;central_heating;ONE_YEAR_FREE;16115878;n;y;https://pictures.immobilienscout24.de/listings/0efaa607-09eb-4692-a890-4643752cb486-1363691581.jpg/ORIG/resize/118x118%3E/extent/118x118/format/jpg/quality/80;22;9.62;5 MBit/s;telekom_layer_magenta_m;über VDSL;1981;;REGULAR;;9.62;117407005;oil;y;false;MagentaZuhause M;y;Berlin;y;8;4;no_information;energy_consumption;3.87;105;Berlin;14089;well_kept;normal;D;false;25 MBit/s;no_information;no_information;n;https://padlock.link/iomm;https://padlock.link/mm;no_information;roof_storey;14089;4;103.8;n;2,active;true;Deutschland;premium;25 MBit/s;wohnung_kauf;n;;web,email,bank,music,dl-ul,game,sd,mltstr,hd;true;001.1252850;460000;profile0;4;true;n;;n;n;Kladow_Spandau;1692 (1/1636);5;Berlin;/expose/117407005;"['In einer der begehrtesten Ecken in Berlin, umgeben von Wald und Wasser, findet man auf einem  454 m² großen, ruhigen Grundstück ein energetisch gut geplantes Reihenendhaus. Die Lage des Hauses ist absolut ruhig. Das voll unterkellerte Haus verfügt über 4 Zimmer. Im Erdgeschoss befinden sich Wohnzimmer, Küche, Diele und Gäste-WC mit Fenster. Die Küche ist mit einer Einbauküche inkl. Elektrogeräten ausgestattet. Der Empfangsbereich wurde großzügig geplant und verfügt zusätzlich über eine Abstellkammer. Flur, Küche und Sanitärräume sind gefliest. Der Wohnzimmerbereich hat außergewöhnliche ca. 32m² Wohnfläche und ist mit hochwertigem Laminat ausgelegt. Ein Kaminanschluss ist vorhanden und kann jeder Zeit in Anspruch genommen werden. Das Wohn- und Esszimmer ist wie alle anderen Räume des Hauses gut belichtet und bietet zusätzlich einen wunderschönen Blick in den Garten, welcher zu jeder Jahreszeit sehenswert ist. Vom Wohnzimmer aus gelangt man auf die ca. 30m² große Süd-West ausgerichtete und geflieste Terrasse. Eine Sonnenmarkise leistet an heißen Sommertagen ihre Dienste. Der Garten ist mit wertvollen Gehölzen, liebevoll und pflegeleicht angelegt. Vom Erdgeschoss ins Obergeschoss gelangt man über eine massive Echtholztreppe. Ins Untergeschoss über eine massive Betontreppe. Das Obergeschoss teilt sich in 3 Zimmer, Badezimmer und Flur. Das Badezimmer im Obergeschoss ist modern gefliest und verfügt über eine Dusche; auch hier ist ein Fenster vorhanden. Die Fläche ist sehr gut aufgeteilt und belichtet. Das Untergeschoss ist teilweise beheizt, belichtet und gefliest. Hier findet man den Heizungsraum (Öl-Viessmann-Heizungsanlage) sowie ein Hobbyraum/Gästezimmer. Das Haus wurde mit Holz-Iso-Fenstern ausgestattet, die mit teilweise elektrogesteuerten Rollläden (Zeitschaltuhr) versehen sind. Ein Gartenhaus/Geräteschuppen und ein PKW- Stellplatz sind vorhanden. Die Immobilie ist sehr gut durchdacht geplant, verklickert und auch gut isoliert. Das Haus befindet sich in einem sehr guten und gepflegten Allgemeinzustand. Den bekannten Kladower Yachthafen, Golfplatz, Groß Glienicker See wie auch Einkaufs- und Versorgungsmöglichkeiten jeglichen Bedarfs erreicht man in wenigen Fahrrad- oder Gehminuten. Der Endenergieverbraucht dieses Gebäudes beträgt 103,8 kWh/(m*a). Das Hausgeld inkl. Betriebs- und Heizkosten beläuft sich auf ca. 277,-€ monatlich.\n\n', '\nZusammenfassung:\n\n•\tBaujahr 1981\n•\tGrundstück ca. 454m²\n•\tZimmer 5 \n•\tKamin-Anschluss\n•\tBadezimmer (Dusche)\n•\tGäste WC\n•\tHeizung Öl 3000 L/ Bj 2000\n•\tEnEV. KWh 103,8 kWh/(m*a)\n•\tAusgaben/ Wohngeld 277€\n•\tmassive Echtholztreppe\n•\tmassive Betontreppe\n•\tEinbauküche inkl. E-Geräte\n\n\n', 'Der südlich von Gatow gelegene Ortsteil Kladow ist Einfamilienhausgebiet mit altem Ortskern. Kladow ist, insbesondere wegen der Fährverbindung nach Wannsee beliebtes Ausflugsziel der Berliner, was Anfang des 20.Jahrhunderts zur Errichtung vieler Landhäuser und Villen und mehrerer gastronomischer Betriebe führte. Die heutigen Einfamilienhäuser sind architektonisch wie preislich oftmals von hohem Niveau. Wasser und Wald liegen direkt vor der Haustür. Zu dem traumhaft schöne Naturschutzgebiet gehören der Sacrower See, der Groß Glienicker See und ausgedehnte Wälder. Eine 18-Loch-Golfanlage sowie der Kladower Hafen mit einer neuen „Marina“ mit anmietbaren Bootsliegeplätzen zeichnen den Ort aus. Die nahe gelegene Ritterfeldschule ist schnell zu erreichen. Im Gegensatz zu Gatow bietet Kladow mit dem „ Cladow-Center“ am Eichelmatenweg sowie dem Einzelhandelsangebot im Ortskern gute Nahversorgungsmöglichkeiten. Auf dem ehemaligen Flugplatz Gatow befinden sich eine Kita, ein Gymnasium und eine Grundschule.  15 Minuten zum Groß-Glienicker See.', 'Alle Angaben haben wir nach bestem Wissen gemacht. Da Diese jedoch teilweise auf Informationen Dritter beruhen, kann der Makler für die Richtigkeit keine Gewähr übernehmen. Eine Weitergabe des Angebotes bedarf unserer ausdrücklichen Zustimmung. Das Objekt gilt als unbekannt, sofern nicht innerhalb von fünf Werktagen Einspruch mit Quellenangabe eingelegt wird. Alle Gespräche sind über unser Büro zuführen. Bei Zuwiderhandlung behalten wir uns Schadenersatz bis zur Höhe der Provisionsansprüche ausdrücklich vor. Zwischenverkauf ist nicht ausgeschlossen.\nDie Maklercourtage beträgt für Sie 7,14% vom beurkundeten Kaufpreis inkl. der gesetzlichen MwSt. und ist verdient und fällig bei Abschluss des notariellen Kaufvertrages.']";;;2010;7;3;true;;;;;
2020-05-11 12:21:37.780956;Berlin;district_heating;;362872;y;y;https://pictures.immobilienscout24.de/listings/469ea366-7649-46c9-9b82-0fe4178c87af-1363686645.jpg/ORIG/resize/118x118%3E/extent/118x118/format/jpg/quality/80;15;18.35;;;;2019;;;disabled;;94738912;district_heating;n;true;;y;Berlin;n;11;9;no_information;;;122.5;Berlin;10969;no_information;no_information;;false;;no_information;no_information;y;;;no_information;penthouse;10969;3;;n;2,active;;Deutschland;schaufenster;;wohnung_kauf;n;;;false;001.362872;1535000;profile0;3;true;n;showqualicontactform;n;n;Kreuzberg_Kreuzberg;2445;6;Berlin;/expose/94738912;"['Wer auf der Suche nach außergewöhnlicher Architektur ist, der wird hier fündig. Aus der Feder der Architekten Gewers & Pudwill entsteht ein Unikat, das Seinesgleichen sucht. Als Bindeglied zwischen dem Ensemble aus saniertem Altbau und modernem Neubau wird das zweiseitig verglaste Penthouse über dem Altbau schweben. Die raumhohe, durchgängige Verglasung zur Dachterrasse eröffnet einen weiten Blick auf den gegenüberliegenden Park und die Friedrichstraße und unterstützt das offene Raumgefühl als charakteristisches Gestaltungsmerkmal. Kommunikatives Zentrum der Wohnung ist der beidseitig verglaste, großzügige Wohn-/Ess-/Küchenbereich, dessen offene Gestaltung sich in allen anderen Räumen durch den Einsatz von Schiebetüren fortsetzt. Zugleich ist die Ausstattung edel und bietet einen ansprechenden Komfort.\n\nMaximaler Wohnkomfort:\n- zweiseitig verglastes Penthouse\n- große Dachterrasse (W-Ausrichtung)\n- offener und großzügiger Wohn-/Ess-/Küchenbereich\n- lichtdurchflutetes Ambiente\n- Tageslichtbad mit freistehender Badewanne und Dusche \n- separates Gäste-WC \n- Ankleide \n\nArchitektur und Ausstattung \n- außergewöhnliche Architektur\n- hochwertiger Bau- und Ausstattungsstandard\n- Designlinie Gewers Pudewill\n- Eichendielen \n- Bodentiefe Fenster\n- Fußbodenheizung \n- Bäder mit Markenausstattung \n- Video-Gegensprechanlage\n- Kellerraum\n- begrünter Innenhof mit Spielfläche\n- Kinderwagen- und Fahrradabstellräume \n- Tiefgaragenstellplatz (optional), Elektrostellplatz möglich\n- barrierefreie Liftanbindung von der Tiefgarage in alle Etagen\n\nZum Projekt ++NeuHouse++\nAußergewöhnliche Architektur mit komfortablem Wohngefühl: Das ist NeuHouse. Das Ensemble aus denkmalgeschütztem Alt- und modernem Neubau bietet eine Vielzahl unterschiedlicher Wohnungstypen mit ausreichend Platz zur Entfaltung: von ein bis fünf Zimmer über Terrassen- und Maisonettewohnungen bis hin zu Penthouses mit Ausblick über die Stadt. Ein modernes Refugium im Herzen der Hauptstadt. Energieausweis liegt noch nicht vor. Baufertigstellung ca. Frühjahr 2020. \n +++ www.neuhouse-berlin.de +++', 'Inmitten des Kunst- und Kreativquartiers gelegen, trifft das Ensemble aus Baudenkmal und Neubau auf kulturelle Vielfalt und auf ein familienfreundliches Umfeld in der ""Südlichen Friedrichstadt"". Das zwischen dem Checkpoint Charlie, dem Jüdischem Museum und dem Mehringplatz gelegene Objekt befindet sich in einer verkehrsruhigen Lage mit Blick auf den Besselpark und vereint so urbanes Flair mit Ruhe und Geborgenheit. Die bekannte Friedrichstraße liegt nur 300m vom NeuHouse entfernt und bietet neben erlesenen Restaurants auch vielfältige Shoppingmöglichkeiten.\nÜber den U-Bahnhof Kochstraße sowie mit den Bussen 248 und M29 gelangt man schnell von A nach B und zu vielen weiteren Hotspots der Hauptstadt.']";;;;;6;;;;;58836;true
