2020-05-11 12:50:02.968962;Berlin;central_heating;ONE_YEAR_FREE;215196;n;y;https://pictures.immobilienscout24.de/listings/0472d1a9-85ae-491e-8687-f6e90281b405-1351154811.jpg/ORIG/resize/118x118%3E/extent/118x118/format/jpg/quality/80;9;12.41;40 MBit/s;telekom_layer_magenta_l;über VDSL;1991;REGULAR;12.41;111353294;natural_gas_light;y;false;MagentaZuhause L;y;Berlin;y;5;5;296;no_information;energy_consumption;6.33;71.79;Berlin;12099;well_kept;normal;false;100 MBit/s;no_information;no_information;y;https://padlock.link/ioml;https://padlock.link/ml;no_information;terraced_flat;12099;2;156.7;n;2,active;true;Deutschland;standard;100 MBit/s;wohnung_kauf;y;1;web,email,bank,music,dl-ul,game,sd,mltstr,hd,fast-ul-dl;true;001.215196;225000;profile0;6;2;true;y;n;n;Tempelhof_Tempelhof;O967;3;Berlin;/expose/111353294;['Bei dem zu verkaufenden Objekt handelt es sich um eine vermietete Eigentumswohnung, welche im Erdgeschoss eines 1991 erbauten\nMehrfamilienhauses gelegen ist. Die Wohnung umfasst 2 lichtdurchflutete Zimmer, Einbauküche und einer großzügigen nach Süden ausgerichteten Terrasse. Der Zugang zur Sonnenterasse ist vom Wohnzimmer möglich.  Die Wohnung ist seit dem 01.08.2016 unbefristet vermietet und die monatliche Nettokaltmiete beträgt seitdem (500,00 €).\nBeheizt wird das Wohnhaus mittels einer zentralen\nGasheizung mit Warmwasseraufbereitung. Die\nWohnung sowie das gesamte Wohnensemble\nhinterlassen beim Betrachter einen sehr gepflegten Eindruck.', '- 2 Zimmer\n- Einbauküche mit allen E-Geräten\n- innenliegendes Wannenbad\n- Abstellkammer innerhalb der Wohnung\n- Terrasse\n- Fahrstuhl bis in den Keller\n- Kellerabteil\n- begrünter Innenhof', 'Der Ortsteil Tempelhof liegt im südlichen Teil Berlins.\nSchöne Altbauten aus der Gründerzeit und\ngroßangelegte Parks zeichnen die Gegend ab. Die\nWohnung befindet sich in einer ruhigen Seitenstraße\nvom Tempelhofer Damm gelegen. In direkter\nNachbarschaft der Wohnung finden sich alle Läden des\ntäglichen Bedarfs, Schulen, Ärzte Bäcker, Kitas usw..\nDas Stadtbad Tempelhof und die Stadtbibliothek\nbefinden sich in unmittelbarer Nähe zur Wohnung. Das\nBürgeramt Tempelhof ist fußläufig in einigen Minuten\nerreichbar. Das stadtbekannte Tempelhofer Feld liegt in unmittelbarer Nähe und lädt zu verschiedenen\nFreizeitaktivitäten ein.', '*** Eine Kapitalanlage die sich jetzt erst recht lohnt! Da der Stadtbezirk Tempelhof immer mehr an Aktravität gewinnt, steigen auch immer mehr Immobilienpreise!***'];;showqualicontactform;E;;;;;
2020-05-11 12:50:03.286524;Berlin;central_heating;ONE_YEAR_FREE;11435877;n;y;https://pictures.immobilienscout24.de/listings/1b80bc2c-c1ab-4490-ad8b-8124df33de49-1349620148.jpg/ORIG/resize/118x118%3E/extent/118x118/format/jpg/quality/80;7;7.89;10 MBit/s;telekom_layer_magenta_m;über VDSL;1972;REGULAR;7.89;111314659;oil;y;false;MagentaZuhause M;y;Berlin;y;7;3;482;no_information;energy_consumption;3.38;79;Berlin;14193;no_information;no_information;false;50 MBit/s;garage;no_information;n;https://padlock.link/iomm;https://padlock.link/mm;no_information;roof_storey;14193;2;212.2;n;2,active;true;Deutschland;top;50 MBit/s;wohnung_kauf;n;;web,email,bank,music,dl-ul,game,sd,mltstr,hd,fast-ul-dl;true;001.11435877;399000;profile0;;2;true;n;n;n;Grunewald_Wilmersdorf;19178003B;3;Berlin;/expose/111314659;['Die hier angebotene Dachgeschosswohnung befindet sich in einer sehr gepflegten Wohnanlage ca. aus dem Jahre 1972.\nBeim Betreten der Wohnung erreichen Sie den hellen Wohn- und Essbereich, welcher mit großzügigen Fensterfronten versehen ist. Die angrenzende Terrasse gewährt Ruhe und einen angenehmen Blick auf das umgebende Grün. \n\nAusgehend vom unteren Bereich gelangen Sie über einige Stufen zunächst auf eine offene Ebene, welche sich noch wunderbar nutzen lässt. Geradewegs ist der funktionale Küchenbereich gelegen. Ein weiterer Vorteil der Wohnung liegt darin, dass diese ein Gäste-WC mit Fenster beherbergt.\n\nDer Schlafbereich en-suite rundet das gemütliche Wohnen gelungen ab. Ein weiteres kleines Highlight liefert der unmittelbar an das Schlafzimmer angrenzende Balkon, der Platz für Entspannung schafft und Ihnen die grüne Idylle des Ortsteils Grunewald nochmals verdeutlicht. \n\nDas Wannenbad ist ebenfalls tagesbelichtet und bietet einen Blick auf den Balkon in die grünen Baumwipfel.\n\nDie Wohnung ist mit Parkettboden versehen.\n\nErgänzend sind eine Garage und ein Keller vorhanden.\n\nDie Wohnung ist zurzeit vermietet, wird aber zum 30.09.2020 freigezogen.', 'Die zum Verkauf stehende Wohnung befindet sich in begehrter Lage in der einzigartigen Villenkolonie Grunewald, welche Ende des 19. Jahrhunderts entstanden ist. In all den Jahrzehnten siedelten sich hier viele berühmte Bewohner an. Hierzu zählten Maler, Dichter, Schriftsteller, Schauspieler, Komponisten, Großindustrielle und auch Generäle. Der Grunewald selbst ist eine Oase für Spaziergänger, Radfahrer und auch Hunde zugleich. Wunderbar kann man sich auch an den kleinen Grunewaldseen erholen und vergisst  fast, dass man sich in der Hauptstadtmetropole Berlin befindet. \n\nEinkaufsmöglichkeiten für den täglichen Bedarf  sind am beliebten Roseneck oder auch in Schmargendorf vorhanden. Kulinarisch kommt man hier ebenfalls nicht zu kurz. \n\nDie Anbindung zu öffentlichen Verkehrsmitteln, Flughäfen  und der Autobahn sind als optimal zu bezeichnen. Besonders hervorzuheben sei auch die perfekte Busanbindung entlang dem Kudamm bis hin zum KaDeWe in nur ca. 15 bis 20 Minuten.', 'GELDWÄSCHE: Als Immobilienmaklerunternehmen ist die von Poll Immobilien GmbH nach § 2 Abs. 1 Nr. 14 und § 10 Abs. 3 Geldwäschegesetz (GwG) dazu verpflichtet, bei der Begründung einer Geschäftsbeziehung die Identität des Vertragspartners festzustellen und zu überprüfen. Hierzu ist es erforderlich, dass wir nach § 11 GwG die relevanten Daten Ihres Personalausweises festhalten (wenn Sie als natürliche Person handeln) – beispielsweise mittels einer Kopie. Bei einer juristischen Person benötigen wir eine Kopie des Handelsregisterauszugs, aus welchem der wirtschaftlich Berechtigte hervorgeht. Das Geldwäschegesetz sieht vor, dass der Makler die Kopien bzw. Unterlagen fünf Jahre aufbewahren muss.\nPROVISIONSHINWEIS: Mit der Anfrage bei und durch Inanspruchnahme der Dienstleistung der Firma von Poll Immobilien GmbH, wird ein Maklervertrag geschlossen. Sofern es durch die Tätigkeit der Firma VON POLL IMMOBILIEN GmbH zu einem wirksamen Hauptvertrag mit der Eigentümerseite kommt, hat der Interessent bei Abschluss\n- eines MIETVERTRAGS keine Provision/Maklercourtage an die von Poll Immobilien GmbH zu zahlen.\n- eines KAUFVERTRAGS die ortsübliche Provision/Maklercourtage an die von Poll Immobilien GmbH gegen Rechnung zu zahlen. \nHAFTUNG: Wir weisen darauf hin, dass die von uns weitergegebenen Objektinformationen, Unterlagen, Pläne etc. vom Verkäufer bzw. Vermieter stammen. Eine Haftung für die Richtigkeit oder Vollständigkeit der Angaben übernehmen wir daher nicht. Es obliegt daher unseren Kunden, die darin enthaltenen Objektinformationen und Angaben auf ihre Richtigkeit hin zu überprüfen. Alle Immobilienangebote sind freibleibend und vorbehaltlich Irrtümer, Zwischenverkauf- und Vermietung oder sonstiger Zwischenverwertung.\n\nUNSER SERVICE FÜR SIE ALS EIGENTÜMER: \nPlanen Sie den Verkauf oder die Vermietung Ihrer Immobilie, so ist es für Sie wichtig, deren Marktwert zu kennen. Lassen Sie kostenfrei und unverbindlich den aktuellen Wert Ihrer Immobilie professionell durch einen unserer Immobilienspezialisten einschätzen. Unser bundesweites und internationales Netzwerk ermöglicht es uns, Verkäufer bzw. Vermieter und Interessenten bestmöglich zusammenzuführen.'];;showqualicontactform;G;;;disabled;;1
2020-05-11 12:50:03.596594;Berlin;central_heating;ONE_YEAR_FREE;1903091;n;n;https://pictures.immobilienscout24.de/listings/4853df4f-09af-4142-8103-af64877db05d-1356777057.jpg/ORIG/resize/118x118%3E/extent/118x118/format/jpg/quality/80;7;12.01;40 MBit/s;telekom_layer_magenta_l;über VDSL;1874;REGULAR;12.01;111351651;gas;n;false;MagentaZuhause L;n;Berlin;n;6;1;225;no_information;energy_required;7.88;61.06;Berlin;10997;no_information;no_information;false;100 MBit/s;no_information;no_information;y;https://padlock.link/ioml;https://padlock.link/ml;no_information;apartment;10997;2;213;n;2,active;true;Deutschland;top;100 MBit/s;wohnung_kauf;y;2;web,email,bank,music,dl-ul,game,sd,mltstr,hd,fast-ul-dl;true;001.1903091;254000;profile0;5;2;true;n;n;n;Kreuzberg_Kreuzberg;05;3;Berlin;/expose/111351651;['In zentraler Kiez-Lage in Kreuzberg bieten wir 11 Wohnungen in exklusiver Vermarktung zum Kauf an. Der Stuckaltbau im über die Stadtgrenzen hinaus beliebten Wrangelkiez wird grundlegend überarbeitet. Neben dem Anbau eines Aufzugs erhalten diverse Wohnungen Balkone, die jeweils an die Küchen angeschlossen werden. Hier werden die Fenster durch Fenstertüren ersetzt. Fassaden und Treppenhaus werden ebenfalls saniert. Sie erwerben eine zukunftssichere, ausgesprochen charmante und solide Immobilie. Heizung und Warmwasserversorgung sind zentral. Der Hof wird mit Fahrradstellplätzen und einer Pergola ausgestattet und teilweise entsiegelt. Jede Wohnung bekommt einen der im Gemeinschaftseigentum verbleibenden Keller zugewiesen. Die vermieteten Einheiten werden im jetzigen, sehr soliden Zustand und ohne bauliche Veränderungen verkauft. Die freien Wohnungen werden hochwertig modernisiert, das Dachgeschoss wird zu einer großzügigen und geräumigen Wohnung mit zwei Terrassen ausgebaut. Wir freuen uns auf Ihren Anruf!', 'Kreuzberg zwischen Görlitzer Park, Landwehrkanal und Spree. Sie investieren in einer der exponiertesten Lagen Berlins. Kreuzberg ist gelebte multikulturelle Identität. Ein junger internationaler Mix bevölkert die Kieze und beherrscht das Wirtschaftsleben. Immobilien in Kreuzberg gehören zu den werthaltigsten Anlagen in Berlin. Der Bezirk bietet ein ausgesprochen lebendiges Umfeld. Das Leben spielt sich auf den Straßen und in der vielfältigen Kultur- und Kneipenlandschaft ab. Die Lage führt vorbei an Spätis, dutzenden internationalen Snacks, kleinen kulturellen Spielstätten und Musikbars. Im unmittelbaren Umfeld liegen beliebte Treffpunkte, wie das Badeschiff und die hippen Locations entlang des Landwehrkanals und der Spree. Am Schlesischen Tor haben Sie Anschluss an die U1 und die U3. In nur einer Station über die Warschauer Brücke erreichen Sie S-Bahnhof Warschauer Straße mit weiteren Verbindungen. Kreuzberg wird zum Fahrradbezirk umgebaut. In Zukunft werden Sie immer mehr Ziele in Berlin auf gesicherten Fahrradspuren erreichen.'];;showqualicontactform;;;;;;
2020-05-11 12:50:03.917761;Berlin;central_heating;ONE_YEAR_FREE;15333187;n;y;https://pictures.immobilienscout24.de/listings/78dc0e23-cbca-4c11-94ce-e710b462a867-1291929394.jpg/ORIG/resize/118x118%3E/extent/118x118/format/jpg/quality/80;20;12.24;40 MBit/s;telekom_layer_magenta_l;über VDSL;1918;REGULAR;12.24;111306106;oil;n;false;MagentaZuhause L;y;Berlin;n;9;1;339.79;3;energy_consumption;6.53;148.75;Berlin;10823;no_information;no_information;false;100 MBit/s;no_information;Klixstr.;n;https://padlock.link/ioml;https://padlock.link/ml;Klixstr.;apartment;10823;4.5;125.8;n;2,active;true;Deutschland;top;100 MBit/s;wohnung_kauf;y;2;web,email,bank,music,dl-ul,game,sd,mltstr,hd,fast-ul-dl;true;001.15281088;669000;profile0;5;4;true;n;n;n;Schöneberg_Schöneberg;5719;6;Berlin;/expose/111306106;['Das Haus wurde um die Jahrhundertwende erbaut und verfügt über 24 Wohneinheiten. Die Wohnung befindet sich im 2. Obergeschoss des Vorderhauses und ist seit 1984 vermietet. Es handelt sich um eine sehr schöne klassische Berliner Altbauwohnung.', 'Leider liegen uns auf Grund des vermieteten Zustands keine Informationen zu genauen Ausstattungsdetails vor.\nAlternativ können Sie sich auch gerne direkt ein Bild vor Ort machen.', 'Zentral, familiär und im besten Sinn des Wortes großstädtisch. \nWohnungen im Schöneberger Kiez sind begehrt, weil hier auf kleinem Raum all´ das zusammen kommt, was Berlin so beliebt macht.\nWeitläufige Parkanlagen, ein vielfältiges kulturelles und bezahlbares gastronomisches\nAngebot und Menschen, die das Motto „Leben und leben lassen“ beherzigen\nund entsprechend friedlich zusammen leben.\n\nHier finden Sie direkt vor der Haustür alles, was urbanes Leben ausmacht,\ndazu gehört auch der Winterfeldtmarkt, der Mittwoch und Samstag kulinarische\nsowie handwerkliche Angebote für Sie bereithält.\n\n', 'Für weitere Informationen oder Terminvereinbarungen steht Ihnen das Team der MAKSIM gerne telefonisch oder per E-Mail zur Verfügung.\n\nEine Gewähr für die Richtigkeit kann durch die Firma Maksim Immobiliengesellschaft mbH nicht übernommen werden.'];;;;;;;;
2020-05-11 12:50:04.235525;Berlin;district_heating;ONE_YEAR_FREE;15333187;n;y;https://pictures.immobilienscout24.de/listings/488e32a5-76f4-4ac8-ab65-68319311f8d6-1291949439.jpg/ORIG/resize/118x118%3E/extent/118x118/format/jpg/quality/80;18;11.3;40 MBit/s;telekom_layer_magenta_l;über VDSL;1900;REGULAR;11.3;111307847;district_heating;n;false;MagentaZuhause L;y;Berlin;n;8;1;351.35;24;energy_consumption;5.73;113.65;Berlin;14057;no_information;no_information;false;100 MBit/s;no_information;"Wundtstra&szlig;e";n;https://padlock.link/ioml;https://padlock.link/ml;Wundtstraße;apartment;14057;3;137;n;2,active;true;Deutschland;top;100 MBit/s;wohnung_kauf;y;3;web,email,bank,music,dl-ul,game,sd,mltstr,hd,fast-ul-dl;true;001.15281088;499000;profile0;;3;true;n;n;n;Charlottenburg_Charlottenburg;5723;5;Berlin;/expose/111307847;['Das Anno 1900 errichtete Haus, bestehend aus Vorderhaus und einem Seitenflügel, beherbergt 17 Wohneinheiten. \nDie Wohnung befindet sich im 3. Obergeschoss und ist seit 2007 vermietet.', 'Leider liegen uns auf Grund des vermieteten Zustands keine genauen Informationen zu Ausstattungsdetails vor, wir organisieren für sie aber gern einen Besichtigungstermin.', 'Im Gegensatz zur touristisch überlaufenen „Mitte“ Berlins finden Sie in diesem Bezirk noch viel von dem, was in dieser boomenden Metropole immer seltener wird. Ruhige Wohnlagen mit viel Grün, das im besten Fall auch noch von einem kleinen, glitzernden Stadtsee gesäumt wird. Wohnszenarien, die das Auge erfreuen und den Geist erfrischen. Willkommen in der Großstadt-Idylle.\n', 'Für weitere Informationen oder Terminvereinbarungen steht Ihnen das Team der MAKSIM gerne telefonisch oder per E-Mail zur Verfügung.\nEine Gewähr für die Richtigkeit kann durch die Firma Maksim Immobiliengesellschaft mbH nicht übernommen werden.'];;;;;;;;
2020-05-11 12:50:04.586161;Berlin;central_heating;ONE_YEAR_FREE;15333187;n;y;https://pictures.immobilienscout24.de/listings/efc6135a-945c-4cc4-adf2-3d96b8dca3e9-1310781460.jpg/ORIG/resize/118x118%3E/extent/118x118/format/jpg/quality/80;7;10.62;40 MBit/s;telekom_layer_magenta_l;über VDSL;1905;REGULAR;10.62;111307840;gas;n;false;MagentaZuhause L;y;Berlin;n;8;1;373;60;energy_required;5.96;106.47;Berlin;13187;no_information;no_information;false;100 MBit/s;no_information;Wolfshagener Str.;n;https://padlock.link/ioml;https://padlock.link/ml;Wolfshagener_Str.;apartment;13187;3;102;n;2,active;true;Deutschland;top;100 MBit/s;wohnung_kauf;y;3;web,email,bank,music,dl-ul,game,sd,mltstr,hd,fast-ul-dl;true;001.15281088;479000;profile0;4;3;true;n;n;n;Pankow_Pankow;5721;5;Berlin;/expose/111307840;"['Das Haus, ein 4 geschossiges Eckgebäude, wurde ca. 1905 erbaut.\nDas Gebäude verfügt über 13 Wohn- und Gewerbeeinheiten mit einer Größe von 99 -201 m². Die Beheizung erfolgt über eine Gaszentralheizung. \nDie Wohnung befindet sich im 4. Obergeschoss und ist seit 1998 vermietet.\n\n', 'Leider liegen uns auf Grund des vermieteten Zustands keine genauen Informationen zu Ausstattungsdetails vor, wir organisieren für sie aber gern einen Besichtigungstermin.\n\n\n', 'Die Ossietskystrasse ist mitten im Herzen von Pankow gelegen. Viele Geschäfte, Cafés und Restaurants befinden sich in unmittelbarer Nähe. Mehrere Parks, wie zum Beispiel der Schlosspark, mit dem ""Schloss Schönhausen"" und der Bürgerpark laden zum spazieren und erholen ein. Die Anbindung an den öffentlichen Nahverkehr mit, Tram, U- & S- Bahn ist hervorragend, so dass sie schnell in alle anderen Bezirke von Berlin gelangen.\n', 'Für weitere Informationen oder Terminvereinbarungen steht Ihnen das Team der MAKSIM gerne telefonisch oder per E-Mail zur Verfügung.\n\nEine Gewähr für die Richtigkeit kann durch die Firma Maksim Immobiliengesellschaft mbH nicht übernommen werden.']";;;;;;;;
2020-05-11 12:50:04.938984;Berlin;;;16273579;n;y;https://pictures.immobilienscout24.de/listings/ccdb2c0d-adec-4c30-9a66-84c7c3fa6422-1292023804.jpg/ORIG/resize/118x118%3E/extent/118x118/format/jpg/quality/80;17;11.48;;;;1910;;11.48;111313437;gas;n;false;;y;Berlin;n;9;1;467.41;no_information;energy_required;7.14;149.48;Berlin;10245;no_information;no_information;false;;no_information;no_information;n;;;no_information;apartment;10245;6;192;n;2,active;;Deutschland;standard;;wohnung_kauf;y;;;;001.15952887;569000;profile0;;5;true;n;n;n;Friedrichshain_Friedrichshain;359;6;Berlin;/expose/111313437;"['Die Wohnung mit insgesamt 6 Zimmern besteht aus zwei zusammengelegten Einheiten in Souterrain und Erdgeschoss im Vorderhaus.\n\nDa der Mietvertrag des heute hier wohnenden Mieters erst nach der Aufteilung in Wohnungsteileigentum abgeschlossen worden ist, besteht die Möglichkeit, kurzfristig Eigenbedarf geltend zu machen.', 'Der begrünte Hof mit Baumbestand wurde liebevoll angelegt, ebenso die Treppenhäuser, deren traditionelle Holzgeländer und Eingangstüren erhalten wurden. In den großzügig geschnittenen Wohnungen finden sich noch Stuckverzierungen.\n\nDie gesamte Knorrpromenade ist geprägt von gut erhaltenen und sanierten Stilaltbauten der vorletzten Jahrhundertwende mit ihren markanten, teils verzierten bzw. begrünten Fassaden, den einladenden Hauseingängen und kleinen Terrassengärten sowie dem Baumbestand, welcher der ruhigen Seitenstraße einen Allee-Charakter verleiht.', 'Die Knorrpromenade ist eine ruhige Seitenstraße im Herzen des Stadtteils Friedrichshain in der Nähe des begrünten Boxhagener Platzes, einem der beliebtesten Viertel ganz Berlins. Die gesamte Straße ""Knorrpomenade"" besteht aus wunderschönen Altbauten mit aufwändig gestalteten Fassaden. Das Gebäude Knorrpromenade 8 aus dem Jahre 1900 fällt durch die helle, mit Efeu umrankte Fassade besonders angenehm auf.\n\nNicht weniger als 20 Cafés und Restaurants für jeden Geschmack sind direkt um den Boxhagener Platz gruppiert. Ebenso sind Bankfilialen und Apotheken in unmittelbarer Nähe. Eine der größten Einkaufspassagen Berlins, in denen sich zahlreiche Geschäfte mit Waren des täglichen Bedarfs aneinanderreihen, das Plaza Frankfurter Allee, ist in ca. zwölf Minuten zu Fuß erreichbar, weitere Ladenpassagen befinden sich im jeweils 15 Minuten entfernten Ring Center und im Bahnhof Ostkreuz, der als S- und Fernbahnhof einen zentralen Verkehrsknotenpunkt Berlins darstellt. Noch schneller gelangt man zu einer der zahlreichen Bushaltestellen und U-Bahnstationen südlich und nördlich des Boxhagener Viertels. In der Nachbarschaft befinden sind auch mehrere Kinos, Clubs, Diskotheken und andere Entertainmentangebote sowie Kindertagesstätten bzw. Kinderfreizeiteinrichtungen.', 'Mit dem Mieter ist eine Nettokaltmiete von € 7,17 pro m², entsprechend einer monatlichen Miete von € 1071,77, vereinbart. Die monatlichen Vorauszahlungen auf die Betriebskosten belaufen sich auf € 298,50, das Wohngeld beträgt € 467,41. \n\nBitte beachten Sie, dass es sich um eine vermietete Wohnung handelt. Daher veröffentlichen wir hier keine Bilder vom Inneren der Wohnung. Eine Besichtigung ist nach Abstimmung mit dem Mieter möglich.\n\nAlle Angaben beruhen auf den Auskünften des Eigentümers, wir übernehmen dafür keine Gewähr. Zwischenverkauf / Änderung / Irrtum vorbehalten.']";;;;;;;;
2020-05-11 12:50:05.438756;Berlin;central_heating;ONE_YEAR_FREE;174667;n;y;https://pictures.immobilienscout24.de/listings/350710c6-5cb3-4079-a8fb-cd7be8202d3b-1292432028.jpg/ORIG/resize/118x118%3E/extent/118x118/format/jpg/quality/80;6;10.62;40 MBit/s;telekom_layer_magenta_l;über VDSL;1908;REGULAR;10.62;111267809;gas;n;false;MagentaZuhause L;y;Berlin;y;6;1;218;no_information;energy_consumption;5.96;63.99;Berlin;13189;no_information;no_information;false;100 MBit/s;no_information;no_information;n;https://padlock.link/ioml;https://padlock.link/ml;no_information;roof_storey;13189;2;128;n;2,active;true;Deutschland;standard;100 MBit/s;wohnung_kauf;y;4;web,email,bank,music,dl-ul,game,sd,mltstr,hd,fast-ul-dl;true;001.174667;256000;profile0;4;2;true;n;n;n;Pankow_Pankow;90627;3;Berlin;/expose/111267809;['Die helle 2-Zimmer Dachgeschosswohnung liegt im 4. Obergeschoss eines Wohn-Ensemble aus dem Jahr 1908. 1998 – 1999 wurde das Haus saniert. Im Zuge der Sanierung erhielt der Grundriss einen modernen und funktionalen Charakter. Die 63,99 m²  Wohnfläche bestechen durch eine ideale Raumaufteilung, in der fast jedes Zimmer vom Flur abgeht und ein eigenes Fenster besitzt. Wohn- und Schlafzimmer sind mit hochwertigem Parkettboden versehen. Die kleine aber feine Küche mit Zugang zum Balkon bietet ausreichend Platz für eine moderne Küchenzeile. Das tagesbelichtete Badezimmer mit Wannenbad ist in einem klassischen schwarz weiß Muster gefliest. Der Balkon mit Blick auf den ruhigen Innenhof lädt zu gemütlichen Sommerabenden ein. Die Heizung und das Warmwasser sind Zentral im Keller untergebracht. \r\n\r\nDie Wohnung wird als Kapitalanlage verkauft und erzielt derzeit eine monatliche Nettokaltmiete von 552,36 €. Die monatliche Bruttowarmmiete beträgt 687,36 € und das monatliche Wohngeld 218,00 €.', 'Das Kissingenviertel, benannt nach der gleichnamigen Kissingenstraße, liegt wenige Kilometer nordöstlich der Berliner Mitte im Bezirk Pankow und gehört zu den grünsten Bezirken Berlins. Ausgedehnte Grünflächen wie die Schönholzer Heide, der Brosepark, der Bürgerpark und natürlich der weitläufige Schlosspark am Schloss Niederschönhausen macht das Viertel nicht nur für Familien attraktiv. Die Wohnanlage befindet sich nur 2 Busstation vom S-/U-Bahnhof Pankow entfernt. Sie benötigen ca. 8 Minuten Fahrtweg mit dem 255er zum S+U Bahnhof. Einkaufsmöglichkeiten, Apotheken und Ärzte  befinden sich in unmittelbarer Nähe. Auch das Einkaufscentrum Neumann Forum ist nur wenige Gehminuten entfernt.'];;showqualicontactform;D;300;;;;
2020-05-11 12:50:05.765737;Berlin;gas_heating;ONE_YEAR_FREE;17336565;n;n;https://pictures.immobilienscout24.de/listings/6910f57a-580c-46c1-bec8-8bee03e92633-1292155876.jpg/ORIG/resize/118x118%3E/extent/118x118/format/jpg/quality/80;1;11.37;40 MBit/s;telekom_layer_magenta_l;über VDSL;1900;REGULAR;11.37;111325555;local_heating;y;true;MagentaZuhause L;y;Berlin;y;9;1;355;no_information;energy_consumption;5.8;119;Berlin;10711;well_kept;sophisticated;false;100 MBit/s;no_information;no_information;n;https://padlock.link/ioml;https://padlock.link/ml;no_information;apartment;10711;3;123.1;n;2,active;true;Deutschland;standard;100 MBit/s;wohnung_kauf;n;2;web,email,bank,music,dl-ul,game,sd,mltstr,hd,fast-ul-dl;true;002.01008088872;710000;profile0;5;3;true;n;n;n;Wilmersdorf_Wilmersdorf;823;5;Berlin;/expose/111325555;['Bei dem angebotenen Objekt handelt es sich um eine stuckverzierte 3-Zimmer-Altbau-Wohnung, gelegen im 2. Obergeschoss des Vorderhauses eines sehr gepflegten fünfgeschossigen Altbaus.\nDie Wohnung verfügt über einen Wohn- und Essbereich mit Balkon, ein Schlafzimmer, ein Masterbad, ein weiteres Zimmer, eine Küche sowie ein Gäste-Bad mit Dusche. Die Wohnung befindet sich in einem gepflegten Gesamtzustand.', '- stuckverzierte Decken\n- Parkett und Dielen\n- Balkon in Ost-Ausrichtung\n- Einbauküche\n- Fahrradabstellplätze im Hofbereich\n- kein Aufzug', 'Der Bezirk Wilmersdorf-Charlottenburg gehört zu den gefragtesten und begehrtesten Lagen von Berlin. Die Wohnung liegt nur wenige Meter zum Kurfürstendamm mit seinen luxuriösen Geschäften, edlen Boutiquen, Flagship-Stores der internationalen Top-Designer, Juwelierfachgeschäften, Cafés und Restaurants oder Theatern und Kultureinrichtungen. Auch das weltbekannte Kaufhaus des Westens ist schnell erreichbar. Der S-Bahnhof Halensee ist wenige Gehminuten entfernt, auch zahlreiche Buslinien verkehren auf dem Kurfürstendamm. Die Stadtautobahn A 100 ist in wenigen Minuten mit dem Auto zu erreichen.'];;showqualicontactform;;;;;;
