2020-05-11 12:42:47.123860;Berlin;ONE_YEAR_FREE;16921323;n;y;https://pictures.immobilienscout24.de/listings/1527dd57-63fc-449b-8d1e-75f3f68dc924-1333439230.jpg/ORIG/resize/118x118%3E/extent/118x118/format/jpg/quality/80;17;11.35;40 MBit/s;telekom_layer_magenta_l;;über VDSL;1900;REGULAR;11.35;114447173;gas;n;false;MagentaZuhause L;y;Berlin;n;4;1;134.79;28/30;energy_consumption;7.53;38.66;Berlin;10245;well_kept;normal;;false;100 MBit/s;no_information;Corinthstr.;n;https://padlock.link/ioml;https://padlock.link/ml;Corinthstr.;ground_floor;10245;2;129.8;n;2,active;true;Deutschland;top;100 MBit/s;wohnung_kauf;n;web,email,bank,music,dl-ul,game,sd,mltstr,hd,fast-ul-dl;true;009.c282bcb0-d517-4793-83c4-cd4999b68120;185000;profile0;4;2;true;y;showqualicontactform;n;n;Friedrichshain_Friedrichshain;HA-122-WE20-D;1;Berlin;/expose/114447173;"['Das schlichte und aktuell etwas schmucklose Altbauensemble ist ein Eckgebäude mit Balkonen zur Straße und einem großen Innenhof. Das Objekt hat insgesamt 3 Eingangsbereiche.\n\nDie kleine 2 Zimmer Wohnung befindet sich im Erdgeschoß des Seitenflügels, sie ist in einem gepflegten Zustand allerdings auch etwas dunkel. Das Bad hat kein Fenster und der Fußbodenbelag ist Linolium. Optional kann auch auch die Sondernutzungsfläche vor der Wohnung angeschlossen werden. \n\nAktuell sind vorübergehend einige Fahrräder in den Räumen eingelagert, die Mieter haben jedoch keinen Zugang.\n\nDas Dachgeschoss soll vollständig neu ausgebaut werden und erhält Aufzüge. Die Fassade soll ebenfalls komplett neu gestaltet werden. Die Kosten hierfür trägt der Erwerber des DG.\n\n--------\n\nThe simple and currently somewhat unadorned ensemble of old buildings is a corner building with balconies facing the street and a large inner courtyard. The property has a total of 3 entrance areas.\n\nThe small 2 room apartment is located on the ground floor of the side wing, but in a well-kept condition it is also somewhat dark. The bathroom has no window and the floor covering is linolium. Optionally also the special use area can be attached before the dwelling. \n\nThe attic floor is to be completely rebuilt and will be equipped with elevators. The facade will also be completely redesigned. The costs for this will be borne by the purchaser of the DG.', 'Das Mehrfamilienhaus, in dem sich die angebotene Wohnung befindet, wurde vor kurzem nach WEG aufgeteilt, daher ist die Instandhaltungsrücklage noch gering.\n\nSobald alle Wohnungen in diesem Haus verkauft wurden, gibt es keine überwiegenden Mehrheitseigner. Die neue Gemeinschaft von Eigentümern findet sich gerade frisch zusammen.\n\nDer Verkauf der Einheiten erfolgt im IST-Zustand.\n\n--------\n\nThe apartment building in which the offered apartment is located has recently been divided into flats, so the maintenance reserve is still low.\n\nOnce all the apartments in this house have been sold, there are no predominant majority owners. The new community of owners is just getting together.\n\nThe units are sold in the ACTUAL state.', 'Der Rudolfkiez liegt am südlichen Ende von Friedrichshain, die Oberbaumcity,  Mediaspree und Stralau mit der Rummelsburger Bucht und dem Treptower Park grenzen diesen Anfang des 20. Jahrhunderts enstandenen Bezirk ein. \n\nDie Simon-Dach-Straße, Revaler Straße, East-Side-Gallery und das angenzende Kreuzberg sind die bekannten Hotspots in der Nähe mit vielen Bars, Clubs und Restaurants und fußläufig erreichbar. \n\nDie öffentlichen Nahverkehrsanbindungen mit den Knotenpunkten\nWarschauer Straße und Ostkreuz sowie die B96 sind ein Garant für Mobilität. Einkaufsmöglichkeiten, Kitas und Schulen sind ebenso in unmittelbarer Nähe.\n\n--------\n\nThe Rudolfkiez is situated at the southern end of Friedrichshain, the Oberbaumcity, Mediaspree and Stralau with the Rummelsburger Bucht and the Treptower Park border this district, which was founded at the beginning of the 20th century. \n\nThe Simon-Dach-Straße, Revaler Straße, East-Side-Gallery and the pleasant Kreuzberg are the well-known hotspots nearby with many bars, clubs and restaurants and within walking distance. \n\nThe public transport connections with the junctions\nWarschauer Strasse and Ostkreuz as well as the B96 are a guarantee for mobility. Shopping facilities, day-care centres and schools are also in the immediate vicinity.', ""Als wirtschaftliches Unternehmen sind wir selbstverständlich auf die Zahlung einer Provision angewiesen.\n\nEs gilt ein vom Käufer an uns zu entrichtendes Vermittlungs- bzw. Nachweishonorar (Maklercourtage) bei Abschluss des Kaufvertrages in Höhe von 7,14 % (inkl. gesetzl. MwSt.) auf den tatsächlichen Kaufpreis als vereinbart. Unsere Angebote sind nur für den Empfänger selbst bestimmt. Bei einer Weitergabe an Dritte haftet der Angebotsempfänger für unsere Courtage. Die Inhalte unserer Angebote beruhen auf den Angaben des Verkäufers bzw. anderer fremder Dritter und nicht auf unseren Ermittlungen und erfolgen deshalb ohne Gewähr für deren Richtigkeit. Unsere Angebote erfolgen freibleibend und unverbindlich. Zwischenverkauf bleibt vorbehalten.\n\n--------\n\nAs an economic enterprise, we are naturally dependent on the payment of a commission.\n\nA brokerage or proof fee (broker's commission) to be paid to us by the buyer on conclusion of the purchase contract in the amount of 7.14% (incl. statutory VAT) on the actual purchase price is deemed to have been agreed. Our offers are only intended for the recipient himself. The offeree is liable for our brokerage fee in the event that the offer is passed on to third parties. The contents of our offers are based on the information provided by the seller or other third parties and not on our investigations and are therefore without guarantee for their accuracy. Our offers are subject to confirmation and non-binding. Subject to prior sale.""]";central_heating;;;;;;;
2020-05-11 12:42:47.500070;Berlin;ONE_YEAR_FREE;5925570;n;n;https://pictures.immobilienscout24.de/listings/79e81efd-f332-477f-a1cf-c78cafe54ad0-1333496781.jpg/ORIG/resize/118x118%3E/extent/118x118/format/jpg/quality/80;10;10.95;40 MBit/s;telekom_layer_magenta_l;41;über VDSL;1906;REGULAR;10.95;114452023;gas;n;false;MagentaZuhause L;y;Berlin;n;6;1;171.56;no_information;energy_required;6.54;41;Berlin;10435;no_information;no_information;;false;100 MBit/s;no_information;no_information;n;https://padlock.link/ioml;https://padlock.link/ml;no_information;ground_floor;10435;1;105.2;n;2,active;true;Deutschland;top;100 MBit/s;wohnung_kauf;n;web,email,bank,music,dl-ul,game,sd,mltstr,hd,fast-ul-dl;true;001.5925570;295000;profile0;5;1;true;n;showqualicontactform;n;n;Prenzlauer_Berg_Prenzlauer_Berg;BQ970;2;Berlin;/expose/114452023;['Die alte Schokoladenfabrik wurde um 1900 erbaut. Im Zuge einer umfassenden Sanierung in den Jahren 2008/2009 wurde das ehemalige Fabrikgebäude mit Klinkerfassade und Stahlsteindecke in Eigentumswohnungen umgewandelt. Seit der Sanierung wurde das Gemeinschaftseigentum instandgehalten. \n\nDie hier angebotene Wohnung wirkt durch den klaren und offenen Grundriss, die imposante Deckenhöhe und die großflächigen Fabrikfensterfronten wie ein Loft. Auf circa 41 m² finden Sie ein großes Wohn- und Schlafzimmer mit offener Einbauküche und ein Tageslichtbad mit Dusche. Der hochwertige Parkettboden mit Fußbodenheizung trägt zur gemütlichen Atmosphäre dieser Stadtwohnung bei. Die Einbauküche mit Granitarbeitsplatte liegt zwischen Badezimmer und Eingangstür und gliedert sich so schön in der Raum ein. Das moderne Badezimmer verfügt über Dusche, Waschbecken und Toilette. Zusätzlich gehört ein Kellerabteil zur Wohnung.\n\nDie Wohnung lässt sich ohne Probleme eine Zweizimmerwohnung machen: der große Wohnraum bietet die Möglichkeit ein separates Schlafzimmer abzutrennen.', '- ca. 41 m² \n- Open-space\n- Hohe Decken\n- Einbauküche mit Granitarbeitsplatte  \n- Großformatige Fabrikfenster \n- Hochwertiges Parkett            \n- Fußbodenheizung \n- Umfangreiche Sanierung: 2008/2009\n- Umbau zur Zweizimmerwohnung möglich\n- Kellerabteil', 'In begehrter Prenzlauer Berg/Mitte Lage findet man dieses helle Studioapartment. Die Schwedterstraße verbindet den Mauerpark mit dem Senefelder Platz und liegt somit mitten im Kiez von Prenzlauer Berg und Mitte. Die zahlreichen Einkaufsmöglichkeiten und die Nähe zu Kindertagesstätten, Spielplätzen und Schulen, aber auch die umfangreichen Angebote und vielen Möglichkeiten, die Freizeit optimal zu gestalten, kennzeichnen die hohe Lebensqualität in diesem Kiez. \n\nDie Anbindung an die öffentlichen Verkehrsmittel sind ideal, die U-Bahnstation Senefelder Platz und Eberswalder Straße  (U2) sowie die Tramlinie M10 sind fußläufig in wenigen Minuten erreichbar.'];central_heating;;;;;;;
2020-05-11 12:42:48.055580;Berlin;ONE_YEAR_FREE;17579758;n;y;https://pictures.immobilienscout24.de/listings/8686a2bc-e921-4574-a25f-0ef51d1e6048-1333515840.jpg/ORIG/resize/118x118%3E/extent/118x118/format/jpg/quality/80;7;11.24;40 MBit/s;telekom_layer_magenta_l;7;über VDSL;1998;REGULAR;11.24;114452564;;y;false;MagentaZuhause L;y;Berlin;y;5;5;85;78;;5.59;64.3;Berlin;12357;fully_renovated;no_information;;false;100 MBit/s;outside;Distelfinkweg;n;https://padlock.link/ioml;https://padlock.link/ml;Distelfinkweg;roof_storey;12357;2;;n;2,active;true;Deutschland;standard;100 MBit/s;wohnung_kauf;y;web,email,bank,music,dl-ul,game,sd,mltstr,hd,fast-ul-dl;true;002.01008289135;218900;profile0;3;2;true;n;showqualicontactform;n;n;Buckow_Neukölln;WE5;3;Berlin;/expose/114452564;['Die hochwertige Zweiraumwohnung liegt im Dachgeschoss eines kleinen Mehrfamilienhauses. \n\nIn diesem Haus befinden sich nur sechs Wohneinheiten. \n\nDie Wohnung befindet sich in einem ausgezeichnetem Zustand. \n\nVon der Dachterrasse hat man einen schönen Blick in den grünen Garten. \n\nDie monatliche Nettokaltmiete beträgt 610,00 EURO. \nDas Mietverhältnis besteht seit 09/10.', '- schöne Dachterrasse \n- hochwertige Fließen \n- schönes Parkett \n- Deckenspots \n- Wände auf Q3 \n- Einbauküche'];no_information;;;;;3;;
2020-05-11 12:42:48.504696;Berlin;ONE_YEAR_FREE;15424723;n;y;https://pictures.immobilienscout24.de/listings/17724d53-220e-4f2f-911f-8b82e6c3f24e-1351422875.jpg/ORIG/resize/118x118%3E/extent/118x118/format/jpg/quality/80;9;8.95;40 MBit/s;telekom_layer_magenta_l;;über VDSL;1998;REGULAR;8.95;114430483;district_heating;y;false;MagentaZuhause L;y;Berlin;y;4;5;206.34;no_information;energy_required;5.33;48.39;Berlin;12559;well_kept;normal;;false;100 MBit/s;underground_garage;no_information;y;https://padlock.link/ioml;https://padlock.link/ml;no_information;terraced_flat;12559;1.5;94;n;2,active;true;Deutschland;top;100 MBit/s;wohnung_kauf;y;web,email,bank,music,dl-ul,game,sd,mltstr,hd,fast-ul-dl;true;001.15372524;157920.77;profile0;4;1;true;y;showqualicontactform;y;n;Köpenick_Köpenick;1033;2;Berlin;/expose/114430483;['Das im Jahr 1998 erbaute Wohnensemble befindet sich unweit von der beliebten Köpenicker Altstadt. Die Wohnung selbst befindet sich inmitten einer sehr ruhigen Wohnanlage in grüner Umgebung. Die Bausubstanz der Immobilie befindet sich augenscheinlich in einem sehr guten Zustand. \n\nDie Wohnung ist nach Süd-Westen ausgerichtet und bietet durch die Terrasse einen wunderschönen Blick ins Grüne. Die Wohnräume sind mit Parkett ausgestattet, Bad und Küche sind gefliest. Die vorhandene Einbauküche befindet sich in einem gepflegten Zustand und ist im Kaufpreis bereits enthalten.\n\nDie Wohnanlage wird über Privatstraßen nur von Anwohnern befahren. Die Zimmer der hier angebotenen Wohnung liegen beide von der Straße abgewandt. Die Wohnung ist deshalb besonders ruhig gelegen.\n\nDer Aufzug ist barrierefrei erreichbar und hält in jeder Etage. Auch der Keller ist mit dem Aufzug erreichbar. Die Wohnung eignet sich deshalb nicht nur für junge Singles/Studenten, sondern auch besonders gut für Senioren, die altersgerecht wohnen möchten.\n\nAuf Wunsch kann ein Tiefgaragenstellplatz in direkter Nähe zur Wohnung miterworben werden.', '- Holzfenster mit Isolierverglasung\n- Parkett im Wohn- und Schlafzimmer sowie im Flur\n- Zentralheizung (Fernwärme)\n- Moderne Konvektorenheizkörper\n- Innenliegendes Bad mit Badewanne\n- Terrasse mit Südwestausrichtung\n- Kabelanschluss\n- Abstellraum im Keller\n- Fahrradabstellbereich im Innenhof\n', 'Treptow-Köpenick ist Berlins größter, wasser- und waldreichste Stadtteil, doch gleichzeitig auch der am wenigsten besiedelte. Durch die hohe Lebensqualität wird Köpenick vor allem bei Familien immer beliebter. Wohnen in Köpenick bedeutet Ruhe, Idylle, Natur und trotzdem eine gute Anbindung an das lebendige Treiben im Herzen der Hauptstadt. Anwohner und Touristen können hier Berlins größtes Waldgebiet, sein einziges Wasserschloss sowie den größten See der Hauptstadt genießen. Auch die historische Alststadt Köpenicks ist eine Sehenswürdigkeit. Sie gehört zu den ältesten Siedlungen Berlins. Vom Allendeviertel aus erreicht man die Köpenicker Altstadt in wenigen Minuten und auch mit den öffentlichen Verkehrsmitteln ist man gut an die Berliner Innenstadt angebunden (S47, Bus 165 und 169, Tram 60, 61 und 63).', 'Gerne lassen wir Ihnen für diese Immobilie bei Vorlage einer Kontaktformularanfrage mit Ihrem Vor- und Nachnamen, Ihrer Wohnanschrift, Ihrer Telefonnummer sowie Email-Adresse, ein ausführliches Exposé mit ergänzenden Angaben (z. B. Grundriss, zusätzliche Fotos und zusätzliche Informationen) zukommen. Unsere Exposés enthalten zudem die Anschrift der Immobilie, damit es ihnen möglich ist, sich zunächst einen Eindruck von der konkreten Lage zu verschaffen. Es gelten unsere Allgemeinen Geschäftsbedingungen. Diese, unser Impressum, eine Ausfertigung unserer Widerrufsbelehrung nebst Widerrufsformular sowie unsere Datenschutzerklärung finden Sie auf unserer Internetseite: www.estate-moments.de. Dieses Verkaufsangebot ist an Kaufinteressenten gerichtet. Bei Zustandekommen eines notariellen Kaufvertrags entsteht unser Anspruch auf Zahlung der genannten Provision somit gegenüber dem Käufer. Darüber hinhaus sind vom Käufer auch die Grunderwerbssteuer (in Berlin 6 % und in Brandenburg 6,5 % des Kaufpreises) sowie die Notar- und Grundbuchgebühren (ca. 2 % des Kaufpreises) zu bezahlen. \n\nLaut Verordnung Nr. 524/2013 der Europäischen Union (EU) sind wir als Immobilienmakler verpflichtet, auf unserer Internetseite im Impressum und bei Verkaufs- oder Vermietungsangeboten einen Hinweis auf die Online-Streitschlichtungsstelle aufzunehmen, die unter der folgenden Adresse zu finden ist: ec.europa.eu/consumers/odr.'];central_heating;1111;;disabled;1;;;
2020-05-11 12:42:49.510027;Berlin;ONE_YEAR_FREE;5398072;n;y;https://pictures.immobilienscout24.de/listings/a1a5423a-196f-4bf4-9af2-b69761e939be-1333225491.jpg/ORIG/resize/118x118%3E/extent/118x118/format/jpg/quality/80;12;11.24;40 MBit/s;telekom_layer_magenta_l;;über VDSL;2012;REGULAR;11.24;114433747;district_heating;y;false;MagentaZuhause L;y;Berlin;y;10;8;;no_information;energy_consumption;6.2;111;Berlin;10717;mint_condition;luxury;;false;100 MBit/s;no_information;no_information;y;https://padlock.link/ioml;https://padlock.link/ml;no_information;ground_floor;10717;3;53;n;2,active;true;Deutschland;standard;100 MBit/s;wohnung_kauf;n;web,email,bank,music,dl-ul,game,sd,mltstr,hd,fast-ul-dl;true;001.5398072;775000;profile0;6;3;true;n;showqualicontactform;n;n;Wilmersdorf_Wilmersdorf;12SB19104;5;Berlin;/expose/114433747;['Diese Neubauwohnung lässt keine Wünsche offen, denn auf 103 Quadratmetern reiner Wohnfläche genießen Sie ein großzügiges Wohnambiente mit hochwertigen Materialien, einer perfekten Verarbeitung und schönen Details.\r\nEs empfängt Sie das repräsentierte Entrée und nach nur wenigen Stufen betreten Sie diesen Wohntraum im erhöht liegenden Gartengeschoss.\r\n\r\nDas Herzstück dieser 3-Zimmer-Komfortwohnung bildet der Wohn-/Essbereich, denn dieser besteht aus dem Wohnzimmer und dem daneben liegenden Esszimmer mit offener Küche.\r\nBodentiefe Terrassentüren, ein hochwertiger Parkettboden und die Verbindung zum Esszimmer sorgen in dem knapp 30 Quadratmeter umfassenden Raum für ein angenehmes Wohngefühl.\r\n\r\nDie anschließende 11 Quadratmeter große Terrasse bietet ausreichend Platz für eine Sitzgruppe.\r\n\r\nEin weiteres Highlight ist die Marken-Einbauküche, denn während zur Ausstattung Miele-Elektrogeräte, eine leistungsstarke Dunstabzugshaube, Naturstein-Arbeitsplatten und reichlich Stauraum gehören, fallen beim Design die Griffe und kassettierten Schranktüren auf.\r\nEs schließt der gemütliche Essbereich am Fenster an.  \r\n\r\nZur anderen Seite liegen die beiden Zimmer angenehm ruhig.\r\nSie eignen sich mit 22,92 und 12,62 Quadratmetern ideal als Schlaf-, Gäste- oder Arbeitszimmer. Beide Zimmer haben jeweils einen Zugang zur hofseitig gelegenen zweiten Terrasse, die am Nachmittag ein ruhiger Ort zum Verweilen ist.\r\nDas Wohnangebot runden die beiden Badezimmer ab - es gibt ein Gäste-WC und ein großes Badezimmer. Auch in diesen Bereichen sorgen ausgesuchte Fliesen, große Spiegel, Markenarmaturen und Naturstein für ein besonderes Wohlfühlambiente.\r\n\r\nZu den weiteren Ausstattungsmerkmalen gehören die Fußbodenheizung in der gesamten Wohnung, Dreifachisolierverglasung, elektrischer Sonnenschutz an den Fenstern und Türen, Wandflächen in Glattputz, Video-Gegensprechanlage und eine Raumhöhe von fast 2,90 Meter. \r\n\r\nDarüber hinaus bringt Sie der Lift in die Tiefgarage. Diese erstklassig konzipierte Wohnung entspricht höchsten Ansprüchen in einer besonderen Wohnlage.   \r\n\r\n\r\n\r\n\r\n', 'Auf einem knapp 14.000 Quadratmeter großen Grundstück in der Württembergischen Straße Ecke Düsseldorfer Straße entstanden mit den Rosengärten die wohl vornehmste Wohnadresse in Westberliner 1-A-Lage, denn der berühmte Kurfürstendamm liegt nur zwei Gehminuten entfernt. Sie wohnen hier äußerst ruhig in einer spektakulären Gartenanlage mit circa 39 verschiedenen Rosenarten und einem repräsentativem klassischem Springbrunnen. \r\n\r\nDas Wohnumfeld charakterisieren herrschaftliche Altbauten, hohe Bäume, der Preußen Park, der Antikmarkt am Park und einige wenige Neubauten. Dieses Quartier hat eine lange Geschichte mit prominenten Bewohnern, die sowohl die Nähe zu den wichtigen Kulturinstitutionen der Hauptstadt als auch dem Grunewald schätzen. Es ist ein authentischer Kiez mit besonderem Flair, denn in der Pariser Straße gibt es zahlreiche kleine Geschäfte, Galerien und Cafés. An den Wochenenden ist der nahe gelegene Ludwigkirchplatz ein beliebter Treffpunkt. Die öffentliche Infrastruktur einschließlich der ÖPNV-Anbindung ist sehr gut: U-Bahn und Busstationen sind zu Fuß erreichbar. Im Umkreis von circa einem Kilometer finden Sie Kindergärten, Grund- und Oberschulen. Darüber hinaus muss die ärztliche Versorgung in der näheren Umgebung als sehr gut bewertet werden.\r\n\r\n'];;;;;;;;
2020-05-11 12:42:50.109591;Berlin;ONE_YEAR_FREE;16728507;n;n;https://pictures.immobilienscout24.de/listings/ed9fb6da-3a9b-404c-a8f3-a54ce230526a-1333233345.jpg/ORIG/resize/118x118%3E/extent/118x118/format/jpg/quality/80;3;12.1;40 MBit/s;telekom_layer_magenta_l;;über VDSL;1955;REGULAR;12.1;114434215;no_information;n;false;MagentaZuhause L;n;Berlin;y;4;2;122.5;no_information;;7.07;35;Berlin;12159;well_kept;normal;;false;100 MBit/s;no_information;no_information;n;https://padlock.link/ioml;https://padlock.link/ml;no_information;apartment;12159;1;;n;2,active;true;Deutschland;top;100 MBit/s;wohnung_kauf;y;web,email,bank,music,dl-ul,game,sd,mltstr,hd,fast-ul-dl;true;002.01007540282;160000;profile0;5;1;true;n;showqualicontactform;n;n;Schöneberg_Schöneberg;373S9M;1;Berlin;/expose/114434215;['Die Kapitalanlage befindet sich unweit der Steglitzer Schloßstraße in einem sehr gepflegten Mehrfamilienhaus. \n\nBei dieser Immobilie handelt es sich um ein Verifizierungsobjekt. Hierbei erhalten Sie nach einer kurzen telefonischen Verifikation Ihrer Anfrage, Zugriff auf alle relevanten Informationen (vollständige Adresse, Bilder, Mieterliste, Grundrisse, etc.) im Dokumenten Center des Inserates.\n\n############################################################\n\nDiese gepflegte Wohnung befindet sich im 3. OG und  weist eine Wohnfläche von ca. 35 m² auf .  Das große Zimmer ist  gut geschnitten und eignet sich perfekt, um sowohl Wohn- als auch Schlafzimmer ideal miteinander zu verbinden.  Die Küche sowie das Badezimmer sind gefliest, das Badezimmer ist zudem mit einer Badewanne ausgestattet. Zusätzlichen Stauraum bietet eine Abstellkammer. \nDa die Wohnung bereits seit Jahren zuverlässig vermietet ist, eignet sie sich perfekt als langfristige Kapitalanlage.', '++ Provisionsfrei\n++ Gepflegte Wohnanlage\n++ Sehr gute Lage nahe Haupteinkaufsstraße\n++ Zuverlässig vermietet\n++ Badewanne', 'In unmittelbarer Umgebung befinden sich diverse Einkaufsmöglichkeiten, wie Supermärkte, Drogerien, Bäcker, Apotheken und vieles mehr. Die Steglitzer Schlossstraße\nlädt vor allem zum Bummeln und Flanieren ein. Gute Verkehrsanbindungen mit Bus und S-Bahn sind ebenfalls gegeben. Den S-Bahnhof Rathaus Steglitz erreichen Sie in ca. 10 Fußminuten. Hier hat auch die U-Bahnlinie U9 ihren Ausgangspunkt und von hier aus gelangen Sie in nur wenigen Minuten in die Berliner Innenstadt oder in das Brandenburger Umland mit seinen hervorragenden Freizeitmöglichkieten.', '\nKontaktieren Sie uns und vereinbaren Sie einen Beratungstermin mit Ihrem persönlichen WunderAgenten!\n\n*************\n\nWunderAgent – Mein Partner rund um Immobilien.\n\nVon der möblierten 1-Zimmer-Wohnung bis zum Mehrfamilienhaus, wir betreuen Ihre Immobilie.\n\n*************\n\nHinweis: Das vorliegende Exposé wurde nach Angaben des Auftraggebers gefertigt und dient lediglich zur Orientierung im Vorfeld einer Besichtigung. Sämtliche Angaben zu Ausstattung und Details wurden seitens des Auftraggebers getätigt. WunderAgent übernimmt keine Gewähr für die Richtigkeit der gemachten Angaben - dies gilt insbesondere für die korrekte Ermittlung der Wohnfläche. Bei der Inaugenscheinnahme der Immobilie durch WunderAgent werden sämtliche Angaben auf Plausibilität geprüft. Im Zweifel empfehlen wir Ihnen vor Abschluss eines Kauf- oder Mietvertrages eine detaillierte Ermittlung der angegebenen Wohnfläche. Gerne beraten wir Sie hierzu im persönlichen Gespräch. Das vorliegende Exposé wird nicht Bestandteil eines Kauf- oder Mietvertrages - es erfüllt lediglich Vorab-Informationszwecke im Vorfeld einer Besichtigung. Zugesicherte Eigenschaften (z.B. korrekte Wohnfläche) sollten im Kauf- oder Mietvertrag direkt mit dem Verkäufer/Vermieter vertraglich geregelt werden.\n'];;;;disabled;;3;;
