2020-05-11 12:32:32.570215;Berlin;gas_heating;ONE_YEAR_FREE;18253633;n;y;https://pictures.immobilienscout24.de/listings/06fb801a-3b05-4676-ba9d-29d1aa9f5b73-1355200214.jpg/ORIG/resize/118x118%3E/extent/118x118/format/jpg/quality/80;10;11.48;40 MBit/s;telekom_layer_magenta_l;über VDSL;1900;REGULAR;11.48;116324043;gas;n;false;MagentaZuhause L;y;Berlin;y;5;1;202;no_information;energy_consumption;7.14;40;Berlin;10249;well_kept;no_information;;false;100 MBit/s;no_information;no_information;y;https://padlock.link/ioml;https://padlock.link/ml;no_information;apartment;10249;1;111;n;2,active;true;Deutschland;top;100 MBit/s;wohnung_kauf;n;2;web,email,bank,music,dl-ul,game,sd,mltstr,hd,fast-ul-dl;true;002.01009048957;239000;profile0;5;1;true;n;showqualicontactform;n;n;Friedrichshain_Friedrichshain;SGB3215;1;Berlin;/expose/116324043;['Bei dieser 1 Zi.Wohnung handelt es sich um eine noch vermietete Altbau-Wohnung im Hinterhaus (2.OG) der Ebertystr. 32 in Berlin. Die durch einen hinteren Hauseingang mit separaten Treppenhaus zugängliche 40 m² große Wohnung besteht aus einem großzügigen Wohn-/Schlafraum, einer separaten Küche, einem geräumigen Badezimmer/WC mit Badewanne und einem Balkon. Diese optimal zugeschnittene 1 Zi. Wohnung befindet sich in einem guten Zustand und wird zum 01.03.2020 bezugsfrei. \n\nDie Beheizung erfolgt über eine Gasetagenheizung. Die Heizungsanlage und Wasserleitungen/Anschlüsse, sowie die zentralisierte Elektroanlage wurden im Zuge der Haussanierung in den 90er Jahren vollständig modernisiert und stetig gewartet. Bauliche Mängel oder ein akuter Sanierungs-Bedarf sind nicht festzustellen. Gleiches gilt auch für das im Jahr 1910 erbaute Wohn- und Geschäftshaus, für welches bereits ein Energieausweis ausgestellt wurde. Hierbei ist zu erwähnen, dass das Treppenhaus des Quergebäudes und die Kellerzugänge gerade frisch saniert wurden.', 'Die Wohnung befindet sich im 2. Stock des Hauses und verfügt über 1 Zimmer, eine Küche, ein Badezimmer, einen Flur und einen Balkon. Die Wohnräume sind hell und optimal geschnitten. Ein Keller gehört zur Ausstattung der Wohnung.', 'Die Wohnung liegt im Nordkiez (Teile des Kiezes werden auch als Samariterviertel bezeichnet) ist ein Viertel im Berliner Stadtteil Friedrichshain und damit im Bezirk Friedrichshain-Kreuzberg. Das Gebiet befindet sich ca. 3,5 km vom Alexanderplatz entfernt im östlichen Randgebiet des Berliner Stadtzentrums.\n\nDer Nordkiez beginnt nördlich der Frankfurter Allee und wird im Westen von der Petersburger Straße, im Norden durch das Gebiet des ehemaligen Zentralvieh- und Schlachthofs und im Osten von den S-Bahn-Strecken begrenzt.', 'Der Nachweis und/ oder der Nachweis über die Vermittlung ist für den Erwerber provisionspflichtig und beträgt den im Exposé angegebenen Preis oder Prozentsatz vom Kaufpreis, zahlbar bei Abschluss des Kaufvertrages. Die Grunderwerbssteuer, Notar- und Grundbuchkosten sind vom Käufer zu tragen. Wir weisen darauf hin, dass dieser Angebotspreis fallen oder bei erheblicher Nachfrage nach Objekten der hier angebotenen Art auch steigen kann. \n\nAlle gemachten Angaben zu Objekten sind ohne Gewähr und basieren ausschließlich auf Informationen, die uns von unserem Auftraggeber oder von Dritten übermittelt wurden. Wir übernehmen keine Gewähr für die Richtigkeit, die Vollständigkeit, sowie die Aktualität dieser Angaben. Irrtum, Änderung und Zwischenverkauf vorbehalten. Eine definitive Bindung zwischen Verkäufer und Käufer kommt erst zustande, wenn ein wirksamer Kaufvertrag vor einem Notar beurkundet wurde. Bis dahin sind jegliche Kaufbemühungen der Kaufinteressenten für den Verkäufer freibleibend und unverbindlich. Bitte beachten Sie unsere AGB. Das Exposé dient als Vorabinformation, Rechtsgrundlage ist allein der notariell beurkundete Kaufvertrag. Die Weitergabe dieses Angebots an Dritte darf nur mit unserer Zustimmung erfolgen. Sollte Ihnen dieses Angebot bereits bekannt sein, so bitten wir um schriftliche Bekanntgabe unter Nennung des Anbieters innerhalb von 5 Tagen nach Erhalt des Angebots.\n\nSämtliche durch uns erstellten Daten, Fotos und Textbeiträge sind urheberrechtlich geschützt. Die Vervielfältigung von Informationen oder Daten, insbesondere die Verwendung von Texten, Textteilen, Bildmaterial bedarf der vorherigen schriftlichen Einwilligung durch uns. Unberechtigte Verwendungen ziehen eine Nutzungsberechnung nach sich und werden zur Anzeige gebracht.\n\nUNSER SERVICE FÜR SIE ALS EIGENTÜMER: \nPlanen Sie den Verkauf Ihrer Immobilie, so ist es für Sie wichtig, deren Marktwert zu kennen. Lassen Sie kostenfrei und unverbindlich den aktuellen Wert Ihrer Immobilie professionell durch uns einschätzen. Unser bundesweites Netzwerk ermöglicht es uns, Verkäufer und Interessenten bestmöglich zusammenzuführen.'];;;;;;;;1994;;
2020-05-11 12:32:32.894290;Berlin;district_heating;ONE_YEAR_FREE;231672;n;y;https://pictures.immobilienscout24.de/listings/a186c16a-5e06-4497-9cc3-e79f7ea4b30b-1367866619.jpg/ORIG/resize/118x118%3E/extent/118x118/format/jpg/quality/80;9;11.24;40 MBit/s;telekom_layer_magenta_l;über VDSL;1912;REGULAR;11.24;116323228;steam_district_heating;n;false;MagentaZuhause L;y;Berlin;n;10;1;663.94;no_information;energy_consumption;6.2;170;Berlin;10707;negotiable;no_information;;false;100 MBit/s;no_information;no_information;y;https://padlock.link/ioml;https://padlock.link/ml;no_information;apartment;10707;4;145.3;n;2,active;true;Deutschland;top;100 MBit/s;wohnung_kauf;n;4;web,email,bank,music,dl-ul,game,sd,mltstr,hd,fast-ul-dl;true;001.231672;890000;profile0;;4;true;n;;n;n;Wilmersdorf_Wilmersdorf;371410;7;Berlin;/expose/116323228;['Es handelt sich hierbei um einen wunderschönen und sehr repräsentativen Altbau, welcher sich in ein Vorder-/ Gartenhaus, mit 28 Einheiten aufteilt.', 'Diese Wohnung befindet sich im 4. OG, des Vorderhauses. Sie besteht derzeit aus vier Zimmer, ein Gäste-WC, ein Wannenbad, eine Küche, eine Kammer und ein Balkon. Sie muss vom zukünftigen Erwerber saniert werden. Hier eröffnen sich natürlich auch viele Möglichkeiten. Der Grundriss könnte verändert werden und somit eine 5 Zimmerwohnung entstehen.', 'Dias Haus befindet sich in der Düsseldorfer Str., ca. 400 m vom Oliver Platz und ca. 700 m vom Kurfürsten Damm entfernt. Die ruhige und doch sehr zentrale Lage zeichnen dieses Objekt aus.\r\n\r\n\r\nDer Bezirk Wilmersdorf gehört zu einer der besten Wohngegenden in Berlin.', 'Hier können Sie sich schon einmal ein Bild dieser Immobilie verschaffen. Einfach den Link kopieren und in den Browser einfügen.\r\n\r\nhttps://www.youtube.com/watch?v=FT2JTRxoTk4'];;disabled;;209;;;;;;170
2020-05-11 12:32:33.332319;Berlin;central_heating;ONE_YEAR_FREE;164338;n;y;https://pictures.immobilienscout24.de/listings/197fb48a-7ca3-4727-8625-1fe465f8468e-1357034123.jpg/ORIG/resize/118x118%3E/extent/118x118/format/jpg/quality/80;9;11.37;40 MBit/s;telekom_layer_magenta_l;über VDSL;1991;REGULAR;11.37;116325604;gas;n;false;MagentaZuhause L;y;Berlin;n;10;5;;no_information;energy_required;5.8;144;Berlin;10713;well_kept;simple;;false;100 MBit/s;no_information;no_information;y;https://padlock.link/ioml;https://padlock.link/ml;no_information;apartment;10713;3.5;113;n;2,active;true;Deutschland;top;100 MBit/s;wohnung_kauf;n;;web,email,bank,music,dl-ul,game,sd,mltstr,hd,fast-ul-dl;true;001.164338;799000;profile0;;3;true;n;showqualicontactform;n;n;Wilmersdorf_Wilmersdorf;AIB12828;6;Berlin;/expose/116325604;"['Es handelt sich um eine 3,5-Zimmer-Dachmaisonette-Wohnung mit ca. 144 qm großzügiger Wohnfläche, gelegen im Dachgeschoß und Galeriegeschoß, welche im Jahre 1991 auf einem stilvollen Altbau aus dem Jahre 1912 errichtet wurde. \r\rDie Wohnung verfügt in der Dachgeschoßebene über eine großzügige Diele, ein modernes Badezimmer, ein modernes Kinderzimmer, ein kleines Kinder-/Arbeitszimmer, eine stilvolle Küche, ein großzügiges Wohn- und Speisezimmer mit Zugang zur großen Rooftop-Terrasse mit einem 360° Weitblick. Die Galerieebene verfügt zudem über ein modernes Badezimmer sowie ein erstklassiges Schlafzimmer mit Zugang zum Übergang zur Terrasse.\r\rDie Wohnung befindet sich in einem technisch einwandfreien Gesamtzustand. Es besteht leichter Modernisierungsbedarf bei der Innenausstattung und normaler Modernisierungsbedarf bei Küche & Bädern. Das Wohnzimmer wurde 2001 vollständig modernisiert. \rZu den besonderen Ausstattungsmerkmalen gehören: eine 75 qm-Dachterrasse, Parkettfußböden sowie eine Einbauküche.\r\rDie Wohnflächenberechnung verteilt sich wie folgt: \r-100 qm Wohnfläche im Dachgeschoß, \r-25 qm Wohnfläche im Galeriegeschoß \r-19 qm anrechenbare Wohnfläche der Dachterrasse ( 25 % von 75 qm Dachterrasse ) \r\rEin Aufzug bis ins Dachgeschoss mit halber Treppe ist vorhanden. Ein Stellplatz könnte eventuell für 40 € gemietet werden.\rDie Heizungs- & Warmwasserversorgung erfolgt über Fernwärme. Das aktuelle Hausgeld beträgt monatlich ca. 540,-€. \rDer Energieverbrauch beträgt 113 kWh/(qm∙a).\rWeitere Details teilen wir Ihnen gerne auf Anfrage mit.', 'Eine erstklassige Adresse in begehrter Lage von Wilmersdorf gelegen.', 'Unser Service für Eigentümer\rWir stehen Ihnen bei dem Verkauf Ihrer Immobilie vom Anfang bis zum fertigen Abschluss diskret und kompetent zur Verfügung. \rJeder Schritt erfolgt nach Absprache mit Ihnen. \rSie entscheiden über die Verkaufsstrategie Ihres Objektes, ob diskret und ""off-market"" oder eine qualifizierte Vermarktung in Print- sowie Onlinemedien. \rWir verfügen immer über den richtigen Käufer. \rZudem bewerten wir Ihre Immobilie kostenfrei, entsprechend dem aktuellen Marktwert.\rGerne beraten wir Sie kostenlos persönlich in unserem Büro, per Telefon oder per E-Mail!\rWir freuen uns von Ihnen zu hören!\rwww.immo-boerse.com']";;;;;;;;;;
2020-05-11 12:32:33.743201;Berlin;central_heating;ONE_YEAR_FREE;18039072;y;y;https://pictures.immobilienscout24.de/listings/d126966c-aef9-4845-9552-b48610a14c25-1355238704.jpg/ORIG/resize/118x118%3E/extent/118x118/format/jpg/quality/80;16;10.37;40 MBit/s;telekom_layer_magenta_l;über VDSL;2019;REGULAR;10.37;116327062;no_information;n;false;MagentaZuhause L;y;Berlin;n;9;9;;no_information;;4.78;96.59;Berlin;12209;mint_condition;no_information;;false;100 MBit/s;outside;no_information;y;https://padlock.link/ioml;https://padlock.link/ml;no_information;apartment;12209;4;;n;2,active;true;Deutschland;standard;100 MBit/s;wohnung_kauf;n;1;web,email,bank,music,dl-ul,game,sd,mltstr,hd,fast-ul-dl;true;002.01008716389;705894;profile0;4;4;true;n;showqualicontactform;n;n;Lichterfelde_Steglitz;19001_3;4;Berlin;/expose/116327062;['LEBEN IN BERLIN - LICHTERFELDE + EIN RUHIGES “FLECKCHEN” IN EINER \nAUFREGENDEN STADT\n\nBerlin ist nicht gleich Berlin. Berlin ist Hauptstadt. Berlin ist Trend. Berlin ist Dynamik. Berlin ist aber auch geliebtes Zuhause. Wer will, findet ein passendes Domizil: Zum Beispiel im „Parkside Living Berlin“ im beschaulichen Bezirk Lichterfelde Steglitz. Das grüne Lichterfelde präsentiert sich lebendig, kinder- und familienfreundlich und innovativ. Wer aufmerksam um sich blickt, kann sich hier seinen Wohntraum eingebettet in eine seit Jahren gewachsenen Umgebungsbebauung bestehend aus Ein-, Zweifamilienhäuser und Stadtvillen aus der Gründerzeit erfüllen.\n\nDas als Neubau zu errichtende Wohnensemble bestehend aus einem Mehrfamilienhaus mit 6 Wohnungen, Wohnungsgrößen von 75,46 - 172,01 m² und im rückwärtigen Grundstücksbereich entstehende 2 Stadthäuser als Doppelhaus mit je 191,43 m², wird hier auf einem über 1200 m² großem wunderschönen und in der Umgebung eingebetteten Grundstück erbaut. Das Objekt wird als Energieeffizienzhaus nach EnEV 2016 errichtet.  \n\nDie zukünftigen Eigentümer genießen viel Grün und natürlichen Freiraum, denn hier entwickelt sich eine ganz besondere Wohnatmosphäre, die einladend, behaglich, familienfreundlich und modern zugleich ist. \n\nMit intelligenten Grundrissen und exklusiver Ausstattung entsteht hier an diesem soliden Standort mitten in Lichterfelde ein exklusives Unikat, was seines Gleichen hier am Standort sucht. Anspruchsvolle Architektur, hochwertige Materialien, Fahrstuhl in der Stadtvilla, barrierefreie Gestaltung und eine perfekte Süd- / Westausrichtung aller Terrassen und Balkone, runden dieses Angebot perfekt ab. Lassen Sie sich in unserer ausführlichen Bau- und Ausstattungsbeschreibung informieren und inspirieren. \n\n„Parkside Living Berlin“ Das ist exklusives Wohnen auf eine besondere Art!', 'Design, Funktionalität und deutsche Markenqualität für Genießer.\nÜberzeugende innere und äußere Werte für das besondere Wohngefühl!\n\n- großzügiger Wohn- und Essbereich teilweise mit offener Küche\n- umfangreiche Auswahl an edlen Feinsteinzeug Fliesen, Format bis 60 x 60 cm, \n  Materialwert: 40 €/m²\n- große Auswahl verschiedener Parkettdesigns, Materialwert: 60 €/m² \n- Fußbodenheizung in allen Räumen separat regelbar\n- großzügige Balkone und Terrassen mit Süd- / Westausrichtung\n- 2 Stadthäuser und 2 Wohneinheiten mit eigenem Gartenanteil\n- Design Badarmaturen von Steinberg Serie 170 und Badobjekte von Geberit\n  Keramag Serie Icon\n- separate Gäste WCs´\n- großzügige Raumhöhe       \n- alle Fenster und Türen aus Holz \n- großflächige dreifach Verglasung, teilweise bodentiefe Fenster\n- elektrische Jalousien / Rollläden\n- Elektroinstallation von Marktführer Busch & Jaeger\n- Barrierefreiheit und exklusiver Wohnkomfort im Mehrfamilienhaus mit Aufzug\n- Sicherheit durch Videosprechanlage und Schließsystem\n- elektrisches Einfahrtstor mit Fernbedienung\n- eigener PKW Stellplatz auf dem Grundstück mit Ladestation Vorbereitung (alles\n   im Kaufpreis bereits enthalten)\n\n(Detailinformationen erhalten Sie in der ausführlichen Bau- & Ausstattungsbeschreibung, die Sie gerne abfordern können!)', 'STILVOLLE ARCHITEKTUR - TOLLE UMGEBUNG - WOHNEN IM GRÜNEN\n \nEtwas ganz Besonderes entsteht in dem sehr grünen Stadtteil Berlin-Lichterfelde.  \nLichterfelde ist ein Berliner Ortsteil vom Bezirk Steglitz Zehlendorf und grenzt an Dahlem, Steglitz, Zehlendorf und Lankwitz an. Die sogenannte Villenkolonie Lichterfelde entstand in der zweiten Hälfte des 19. Jahrhunderts und teilt sich in die Ortslagen Lichterfelde West, Ost und Süd auf, was aus der Zuordnung zu den jeweiligen Bahnhöfen resultiert. Auf Grund seiner besonderen Lage und der besonderen Infrastruktur, zählt Lichterfelde schon seit Jahren zu den beliebtesten und bevorzugten Wohngegenden Berlins. \n\nDer Bezirk zeichnet sich insbesondere durch Seine Wertstabilität und sein Wertpotential als Toplage aus. Lichterfelde West ist als eines der ältesten Villenviertel Berlins bekannt. Herrschaftliche Villen im Stil des Historismus, große Gärten, wunderschöne Alleen und gepflasterte Straßen prägen den Ortsteil. Weiterhin befindet sich in unmittelbarer Nähe der Otto Lilienthal Park, welcher zu herrlichen Spaziergängen einlädt. Von Ihrem neuen Wohndomizil aus erreichen Sie den Bus in 200m Entfernung, die S-Bahnstation Lichterfelde Süd in 10 Minuten, diverse Einkaufsmöglichkeiten zu Fuß oder mit dem Fahrrad.\nIn wenigen Autominuten gelangt man zur Lankwitzer Straße mit zahlreichen Einkaufsmöglichkeiten am Bahnhof Lichterfelde Ost, sowie die Flanier- & Einkaufsmeile Schlossstraße in Berlin Steglitz mit zahlreichen Geschäften, sowie Restaurants und direktem Stadtautobahnanschluss. \n\nDer Kurfürstendamm und der Alexanderplatz, die Flughäfen und Fernbahnhöfe sind mit dem Auto oder der S-Bahn schnell erreichbar. Die gesamte Infrastruktur wie Schulen, Kitas, Ärzte, Supermärkte, Bäcker, Cafes, Restaurants, Theater, Fitnessclub haben sich über Jahre etabliert und befinden sich in unmittelbarer Nähe. Dieser Standort ist mit allen seinen Vorteilen wirklich brillant und deshalb zum Wohnen auch seit Jahrzehnten so beliebt.', 'Baubeginn: 2. Quartal 2020\nFertigstellung: 1. Quartal 2021\n\nDas Objekt wird als Energieeffizienzhaus nach EnEV 2016 und nach den Vorgaben der MaBV (Makler- & Bauträgerverordnung) errichtet. Sie zahlen somit gemäß Kaufvertrag den Gesamtaufpreis in 7 Kaufpreiszahlungsschritten aufgeteilt und immer nur das, was bereits am Objekt schon fertiggestellt wurde. Über den Baufortschritt erhalten Sie einen bebilderten Bautenstandsbericht vor jeder Kaufpreisrate.\n\nJede Wohnung verfügt über einen eigenen Stellplatz auf dem Grundstück, der mit einem Ladesäulenanschluss vorbereitet wird und der mit einem Wert von 20.000 € / Stellplatz bereits im Kaufpreis enthalten ist.\n\nSollten Sie Unterstützung bei einer für Sie passenden Finanzierung benötigen, dann sprechen Sie uns gerne an, unser Finanzierungsexperte sucht ihnen neutral aus über 600 Banken die mit den besten Konditionen und Rahmenbedingungen kostenfrei für Sie raus und erstellt das perfekte Finanzierungskonzept für Sie. \n\nDie Bilder im Exposé sind Visualisierungen, dienen nur zum Zweck der Darstellung, woraus kein Rechtsanspruch jeglicher Art entsteht! \nVertragsbindend ist nur der Kaufvertrag, sowie die Bau- & Ausstattungsbeschreibung.'];;;;;;;8;;;
2020-05-11 12:32:34.268809;Berlin;gas_heating;ONE_YEAR_FREE;18253633;n;n;https://pictures.immobilienscout24.de/listings/59d4e6bf-4c9c-4f83-8029-a0033b81a478-1355190839.jpg/ORIG/resize/118x118%3E/extent/118x118/format/jpg/quality/80;4;16.54;40 MBit/s;telekom_layer_magenta_l;über VDSL;1906;REGULAR;16.54;116323091;natural_gas_heavy;n;false;MagentaZuhause L;y;Berlin;n;3;1;109;no_information;energy_consumption;8.84;33.02;Berlin;12051;no_information;no_information;;false;100 MBit/s;no_information;no_information;n;https://padlock.link/ioml;https://padlock.link/ml;no_information;ground_floor;12051;1;157;n;2,active;true;Deutschland;top;100 MBit/s;wohnung_kauf;y;0;web,email,bank,music,dl-ul,game,sd,mltstr,hd,fast-ul-dl;true;002.01009048957;145000;profile0;4;1;true;n;showqualicontactform;n;n;Neukölln_Neukölln;B-EDS93;1;Berlin;/expose/116323091;['Die ruhige und schön geschnittene Immobilie, liegt in einem sanierten (ca. 2012) Altbaus aus dem Jahre 1906.', 'Die Wohnung befindet sich in einem renovierungsbedürftigem Zustand', 'Die Edmundstraße ist eine ruhig gelegene, kleine Seitenstraße, in einem reinen Wohngebiet des aufstrebenden Bezirks Neukölln. \nTrotz der gemütlichen Atmosphäre im kleinen Kiez, findet sich der S/U-Bahnhof Neukölln in nur 300m Entfernung. Alle Geschäfte des täglichen Bedarfs sind ebenso fussläufig erreichbar, wie eine große Auswahl an Bars und Restaurants. Als große Einkaufsmeile lädt die Karl-Marx-Str. zum bummeln ein.  \nDer barocke Körnerpark mit seinem kleinen Café, bietet unerwartete Eindrücke, die zum Verweilen einladen. Nur 1km westlich der Wohnung, das beliebte Tempelhofer Feld, mit seinem hohen Freizeitwert für sportlich Aktive und Freiluftfans.', 'Der Nachweis und/ oder der Nachweis über die Vermittlung ist für den Erwerber provisionspflichtig und beträgt den im Exposé angegebenen Preis oder Prozentsatz vom Kaufpreis, zahlbar bei Abschluss des Kaufvertrages an Immo-Rocket Berlin GmbH. Die Grunderwerbssteuer, Notar- und Grundbuchkosten sind vom Käufer zu tragen. Wir weisen darauf hin, dass dieser Angebotspreis fallen oder bei erheblicher Nachfrage nach Objekten der hier angebotenen Art auch steigen kann. \n\nAlle gemachten Angaben zu Objekten sind ohne Gewähr und basieren ausschließlich auf Informationen, die uns von unserem Auftraggeber oder von Dritten übermittelt wurden. Wir übernehmen keine Gewähr für die Richtigkeit, die Vollständigkeit, sowie die Aktualität dieser Angaben. Irrtum, Änderung und Zwischenverkauf vorbehalten. Eine definitive Bindung zwischen Verkäufer und Käufer kommt erst zustande, wenn ein wirksamer Kaufvertrag vor einem Notar beurkundet wurde. Bis dahin sind jegliche Kaufbemühungen der Kaufinteressenten für den Verkäufer freibleibend und unverbindlich. Bitte beachten Sie unsere AGB. Das Exposé dient als Vorabinformation, Rechtsgrundlage ist allein der notariell beurkundete Kaufvertrag. Die Weitergabe dieses Angebots an Dritte darf nur mit unserer Zustimmung erfolgen. Sollte Ihnen dieses Angebot bereits bekannt sein, so bitten wir um schriftliche Bekanntgabe unter Nennung des Anbieters innerhalb von 5 Tagen nach Erhalt des Angebots. \n\nSämtliche durch uns erstellten Daten, Fotos und Textbeiträge sind urheberrechtlich geschützt. Die Vervielfältigung von Informationen oder Daten, insbesondere die Verwendung von Texten, Textteilen, Bildmaterial bedarf der vorherigen schriftlichen Einwilligung durch uns. Unberechtigte Verwendungen ziehen eine Nutzungsberechnung nach sich und werden zur Anzeige gebracht.'];;;;;;;;;;
2020-05-11 12:32:34.636390;Berlin;central_heating;ONE_YEAR_FREE;634094;n;y;https://pictures.immobilienscout24.de/listings/40c69d37-fd7b-41bc-8905-d7e3ec7316ea-1355187164.jpg/ORIG/resize/118x118%3E/extent/118x118/format/jpg/quality/80;8;10.64;40 MBit/s;telekom_layer_magenta_l;über VDSL;2016;REGULAR;10.64;116322814;gas;n;false;MagentaZuhause L;y;Berlin;y;8;9;;no_information;energy_required;6.15;82.25;Berlin;13088;first_time_use_after_refurbishment;sophisticated;;false;100 MBit/s;underground_garage;no_information;y;https://padlock.link/ioml;https://padlock.link/ml;no_information;ground_floor;13088;3.5;33.3;n;2,active;true;Deutschland;standard;100 MBit/s;wohnung_kauf;n;;web,email,bank,music,dl-ul,game,sd,mltstr,hd,fast-ul-dl;true;001.634094;466000;profile0;5;3;true;y;showqualicontactform;n;n;Weißensee_Weißensee;MM-1653687;4;Berlin;/expose/116322814;"['Kernsanierung eines Gründerzeitaltbaus von 1902 auf der Berliner Allee sowie Errichtung eines Neubaus im begrünten Innenhof.\n\nLichtdurchflutete Eigentumswohnungen in Berlin-Weißensee ab SOFORT zu VERKAUFEN.\n\nDie Treppenaufgänge, die Fassade sowie der Hof des Mehrfamilienhauses werden umfassend saniert, geplante Fertigstellung ist Frühling 2020.\n\nInsgesamt entstehen 19 Eigentumswohnungen mit flexiblen und offenen Grundrissen, wovon bereits 13 Einheiten verkauft wurden.\n\nBalkone, Terrassen sowie Gärten sorgen für viel Licht und Luft und schaffen ein angenehmes und entspanntes Wohngefühl.\n\nDer Innenhof wird im Zuge der Sanierung neu begrünt und verfügt über einen Spielplatz für die Hausgemeinschaft.', ""RUHIGE Garten-Wohnung im komplett neu begrünten Innenhof mit ca. 82 m² und einer 15 m² großen Terrasse.\nDer EIGENE Garten ist ca. 31,40 m² groß.\n\nDie Wohnung besteht aus drei Räumen, einem ca. 30 m² großen Wohn-Essbereich, zwei Schlafzimmern, zwei Bädern, einer ca. 15 m² großen Terrasse und dem eigenen Garten. \n\nAlle Wohnungen werden geschmackvoll und mit hochwertigen Materialien ausgestattet. \n\nDie Einheiten sind entweder mit Parkett oder wunderschönen Altbaudielen ausgelegt.\n\nBäder sowie WC's werden stilvoll gefliest und können individuell gestaltet werden.\n\nWand und Deckenflächen werden gespachtelt und weiss gestrichen, auch hier können Sie auf Wunsch ihr Farbkonzept einbringen.\n\nIn jedem Zimmer sind ausreichend Steckdosen geplant, diese werden gern nach Ihrem Wunsch eingebunden.\n\nAlle Wohnräume verfügen über einen TV-Anschluss.\n\nDer Küchen sind offen gestaltet und in den Wohnbereich integriert.\n\nIndividuelle Wünsche sowie Sonderaustattungen sind während der Bauphase selbstverständlich möglich. \n\nAlle Wohnungen werden bequem mit dem Aufzug erreichbar sein und verfügen über einen oder mehrere Tiefgaragenstellplätze. Ein Tiefgaragenstellplatz ist für 39.000 € erwerbbar.\n\nDie Vermittlung erfolgt EXKLUSIV sowie provisionspflichitg für den Käufer über Lion Immobilien GmbH\n\nwww.lion-immobilien.de\noffice@lion-immobilien.de\n\nTel. 030 - 20 23 81 18"", 'Die Anbindung an das öffentliche Nahverkehrsnetz ist gegeben.\n\nDer Weisse See ist nur wenige Gehminuten entfernt.\n\nIm Umfeld befinden sich u.a. eine Vielzahl an gastronomischen Einrichtungen sowie Einkaufsmöglichkeiten des täglichen Bedarfs.', 'verfügbare Einheiten:\n\n- WE 01 mit ca. 107 m² - 3 Zimmer - 539.000 €\n- WE 03 mit ca.   85 m² - 3 Zimmer - 466.000 €\n- WE 04 mit ca. 111 m² - 4 Zimmer - 621.000 €\n- WE 14 mit ca. 105 m² - 3 Zimmer - 532.000 €\n- WE 17 mit ca. 104 m² - 3 Zimmer - 599.000 €\n- WE 18 mit ca. 144 m² - 5 Zimmer - 756.000 €']";;;;3;;;1;;;112
