2020-05-11 12:31:02.684147;Berlin;gas_heating;ONE_YEAR_FREE;18052783;n;y;https://pictures.immobilienscout24.de/listings/ce393db8-3900-4635-a239-b08dfab6a31f-1364135728.jpg/ORIG/resize/118x118%3E/extent/118x118/format/jpg/quality/80;8;9.64;40 MBit/s;telekom_layer_magenta_l;über VDSL;1993;REGULAR;;9.64;116551374;no_information;y;false;MagentaZuhause L;n;Berlin;y;6;5;no_information;energy_consumption;4.62;59.48;Berlin;12307;no_information;no_information;;false;100 MBit/s;no_information;no_information;n;https://padlock.link/ioml;https://padlock.link/ml;no_information;apartment;12307;2;119.9;n;2,active;true;Deutschland;premium;100 MBit/s;wohnung_kauf;y;web,email,bank,music,dl-ul,game,sd,mltstr,hd,fast-ul-dl;true;002.01008679649;258000;profile0;2;true;n;showqualicontactform;n;n;Lichtenrade_Tempelhof;499083;2;Berlin;/expose/116551374;"['""Raus aus der Stadt, ab ins Grüne"" - dieser Traum vieler wird mit einer Wohnung im Evergreen in Lichtenrade erfüllt. Hier stehen elf Wohneinheiten, die sich über vier Geschosse verteilen, zum Verkauf. Alle Wohnungen verfügen über zwei bis drei Zimmer und Wohnflächen zwischen ca. 59 m² und 83 m². Zur ruhigen Gartenseite hin sind auch die Balkone und Loggien ausgerichtet, die jedem Bewohner im Evergreen einen schönen, sonnigen Freiblick garantieren.', 'Sehr gepflegte und vermietete Eigentumswohnung sucht neuen Eigentümer\r\n\r\n-    Zwei voneinander getrennte Zimmer mit hellem Laminat ausgestattet\r\n-    Vom Wohnzimmer abgehend ein Sonnenbalkon mit Blick zum Garten\r\n-    Innenliegendes Bad mit Dusche und Wanne\r\n-    Einbauküche\r\n-    Keller\r\n-    Garage kann käuflich erworben werden\r\n', 'Gelegen im malerischen Süden Berlins, direkt an der Grenze zu Brandenburg, ist Lichtenrade historisch ländlich geprägt. Die Straßen sind von schönem, altem Baumbestand gesäumt und die lockere Bebauung mit Elementen der späten Gründerzeit, sowie auch vielen Einfamilienhäusern mit Gartenanlage, verstärken den Eindruck dörflicher Idylle.\r\n\r\n-    2 min. Gehweg zum S-Bahnhof Lichtenrade\r\n-    20 min. mit der S-Bahn zum Potsdamer Platz\r\n-    30 min. mit dem ÖPNV zum Hauptbahnhof\r\n-    15 min. mit dem Auto zum Flughafen Schönefeld\r\n-    Direkt an der Diedersdorfer Heide gelegen\r\n-    Restaurants, Cafés und Bars fußläufig zu erreichen\r\n-    Einkaufsmöglichkeiten in unmittelbarer Umgebung, zum Beispiel Rewe, Bäcker, Netto, Aldi']";;275.99;2;3;;1;8;;true;;;
2020-05-11 12:31:03.009561;Berlin;floor_heating;ONE_YEAR_FREE;18348193;n;y;https://pictures.immobilienscout24.de/listings/7c9f8f5c-6b9d-42d1-8e89-608821927d94-1358873973.jpg/ORIG/resize/118x118%3E/extent/118x118/format/jpg/quality/80;5;12.19;40 MBit/s;telekom_layer_magenta_l;über VDSL;;REGULAR;disabled;12.19;116421477;;n;true;MagentaZuhause L;n;Berlin;y;9;;15;;7.48;76.62;Berlin;10967;first_time_use;sophisticated;;false;100 MBit/s;no_information;"Jahnstra&szlig;e";y;https://padlock.link/ioml;https://padlock.link/ml;Jahnstraße;apartment;10967;3;;n;2,active;true;Deutschland;schaufenster;100 MBit/s;wohnung_kauf;n;web,email,bank,music,dl-ul,game,sd,mltstr,hd,fast-ul-dl;true;002.01009147972;631000;profile0;3;true;n;showqualicontactform;n;n;Kreuzberg_Kreuzberg;82227 5.33;3;Berlin;/expose/116421477;['Die Jahnstraße im Kreuzberger Gräfekiez. Hier, hinter dem Altbau Nr. 15, entsteht in einem berlintypischen Hinterhof BUWOG XBERG LIVING.\n \nEin modernes Fassadenkonzept und eine authentische Designsprache verleihen diesem Neubauprojekt seine Einzigartigkeit. Hochwertig von Hand gefertigter Besenstrich in leichten Grautönen changiert mit hell abgesetzten Bändern. Mit seiner unverwechselbaren Architektur ruht das Gebäude inmitten einer gekonnt bepflanzten Hofanlage. Wohnoase trifft Szenebezirk.\n\nEcht Kreuzberg. Echt BUWOG XBERG LIVING.', 'Allgemeine Highlights:\n• Fußbodenheizung\n• Eichenholz-Parkett in allen Wohnräumen\n• Größtenteils raumhohe Fenster\n• Alle Fenster mit Mehrfachverglasung und außenliegendem Sonnenschutz\n• Raumhöhen bis 2,65m\n• Hochwertige Badausstattung von Villeroy & Boch mit stilvollen Keramikfliesen und Handtuchheizkörper\n• Video-Gegensprechanlage\n• Aufzug\n• Überdachte Fahrradabstellplätze\n• Kellerabteile\n\nWeitere Ausstattungsmerkmale dieser Wohnung:\n• Ca. 36 m² großer, offener Wohn-/Ess-/Kochbereich\n• Modernes Bad mit Badewanne und Dusche\n• Gäste-WC\n• Hauswirtschaftsraum\n• West-Balkon', 'Die Lage von BUWOG XBERG LIVING ist Berlin pur. Willkommen im Herzen Kreuzbergs: Rauer Charme, authentische Gastronomie und ein Leben, das Tag & Nacht pulsiert – dafür ist Kreuzberg weltberühmt. Hier, zwischen Böcklerpark und Paul-Lincke-Ufer, Hermannplatz und Volkspark Hasenheide trifft das Beste von Kreuzberg aufeinander. Der Kiez rund um die Jahnstraße steht mit seinem Facettenreichtum für viele Menschen für: „The real Berlin“.\n\nKurze Wege\n\nMit dem ÖPNV U8/U7 (Hermannplatz/Südstern/Schönleinstraße) und U1 (Prinzenstraße), Bus M29, 171, 194, M41:\n• Alexanderplatz ca. 17 Min\n• Hauptbahnhof ca. 28 Min\n• Friedrichstraße ca. 25 Min\n\nMit dem PKW:\n• A100 ca. 10 Min\n• Flughafen Tegel ca. 30 Min (PKW)\n• Flughafen BER ca. 25 Min (PKW)', 'Wir sind für Sie da\nUnser Vertriebsteam ist auch aus dem sicheren Home-Office weiterhin für Sie erreichbar. Kommen Sie gerne auf uns zu für Ihren individuellen Beratungstermin.  Die Showrooms sind derzeit geschlossen – aber per Telefon und E-Mail stehen wir Ihnen gern zur Verfügung. Auch Reservierungen von Wohnungen sind unverändert möglich.\nJetzt Termin vereinbaren!'];;;5;;;;;;;82227;true;
2020-05-11 12:31:03.328146;Berlin;central_heating;ONE_YEAR_FREE;4005610;n;y;https://pictures.immobilienscout24.de/listings/9f52d9cb-c95e-4e73-8846-5bbe9200f0d8-1356807225.jpg/ORIG/resize/118x118%3E/extent/118x118/format/jpg/quality/80;20;11.73;40 MBit/s;telekom_layer_magenta_l;über VDSL;1971;REGULAR;;11.73;116553916;gas;y;false;MagentaZuhause L;y;Berlin;y;7;3;11;energy_consumption;5.75;56.77;Berlin;12163;first_time_use_after_refurbishment;sophisticated;E;false;100 MBit/s;underground_garage;Deitmer Str.;n;https://padlock.link/ioml;https://padlock.link/ml;Deitmer_Str.;roof_storey;12163;2;159;n;2,active;true;Deutschland;top;100 MBit/s;wohnung_kauf;n;web,email,bank,music,dl-ul,game,sd,mltstr,hd,fast-ul-dl;true;001.4005610;329000;profile0;2;true;n;showqualicontactform;n;n;Steglitz_Steglitz;116553916;2;Berlin;/expose/116553916;['Dier hier angebotene Wohnung wurde 2019 geschmackvoll sanieert und modernisiert. Sie befindet sich im 5.OG (oberste Etage) eines gepflegten Mehrfamilienhauses nur 50 m von der Schloßstraße entfernt. Vom Wohnzimmer gelangt man auf den Südbalkon von dem man über die Dächer der umliegenden Häuser gucken kann. Das Duschbad ist hell gefliest und die Einbauküche vollständig eingerichtet. Das Haus verfügt über einen Fahrsdtuhl und zur Wohnung gehört ein Stellplatz in der Tiefgarage.', '-Zentrale Lage in Steglitz\n-2 Zimmer\n-Südbalkon\n-Tiefgaragenstellplatz\n.Vollständig modernisiert.\n-Einbauküche', 'Die Wohnung befindet sich in einer Sackgasse unmittelbar an der Steglitzer Schloßstraße. In der Schloßstraße befinden sich sämtliche Geschäfte des täglichen Lebens sowie diverse Buslinien und die U-Bahn. Die Berliner Stadtautobahn sichert auch die schnelle Anbindung an die City-West.', 'weitere Angebote finden Sie auf unserer Homepage www.henkelundpartner.de'];;252;5;5;;1;;60;;;;2019
2020-05-11 12:31:03.650852;Berlin;central_heating;ONE_YEAR_FREE;241868;n;y;https://pictures.immobilienscout24.de/listings/e6290ffe-4cb6-41b5-b11f-23174f2833ee-1356799246.jpg/ORIG/resize/118x118%3E/extent/118x118/format/jpg/quality/80;11;12.19;40 MBit/s;telekom_layer_magenta_l;über VDSL;2010;REGULAR;;12.19;116553260;district_heating;y;true;MagentaZuhause L;y;Berlin;n;9;7;no_information;energy_consumption;7.44;126.5;Berlin;10999;mint_condition;sophisticated;B;false;100 MBit/s;no_information;no_information;y;https://padlock.link/ioml;https://padlock.link/ml;no_information;apartment;10999;4;66;n;2,active;true;Deutschland;top;100 MBit/s;wohnung_kauf;n;web,email,bank,music,dl-ul,game,sd,mltstr,hd,fast-ul-dl;true;001.241868;750000;profile0;4;true;n;;n;n;Kreuzberg_Kreuzberg;2895;6;Berlin;/expose/116553260;"['Die schicke Eigentumswohnung verfügt insgesamt über 4 Zimmer und wird zur Zeit als Praxis genutzt.\n\nIn allen vier Räumen wurde Parkett verlegt und bis auf eins der Zimmer, verfügen alle über bodentiefe Fenster. Das größte der vier Zimmer besitzt zudem noch einen großen Balkon. Die gesamte Wohnung ist hell und freundlich. \n\nDie Küche bietet Raum für eine moderne Gestaltung, alle Anschlüsse sind vorhanden. Ursprünglich war sie mit dem großen Wohnraum verbunden. Um die Küche vom Wohnbereich räumlich abzugrenzen, wurde hier nachträglich eine Leichtbauwand eingezogen, die sich jederzeit einfach entfernen lässt.\n\nDes Weiteren befinden sich in der Wohnung noch ein großes geräumiges Bad mit Fenster und Wanne und ein separates Gäste-WC mit Dusche. Die Wohnung ist groß und sehr schön geschnitten und eignet sich für Familien ebenso wie für Alleinstehende, die viel Raum benötigen.\n\nÜberzeugen Sie sich selber, wir laden Sie herzlich zu einem Besichtigungstermin ein!', '- 4-Zimmer-Wohnung\n- ca. 126,5 m² Wohnfläche\n- Küche mit allen Anschlüssen (EBK ist Mietereigentum)\n- Bad und Gäste-WC\n- bodentiefe Fenster u. großer Balkon \n- Parkett in allen Zimmern und Natursteinfliesen in Bad und Küche\n- Fußbodenheizung\n- bisherige Nutzung als Ergotherapie Praxis\n- Fahrstuhl, barrierefrei', 'Kreuzberg ist weit über die Stadt- und Landesgrenzen hinaus bekannt. Der Szene-Kieze ist facettenreich, kreativ, lebendig, bunt, international, alternativ und trendig.  Die Immobilie befindet sich in der Reichenberger Straße, sie ist eine der beliebtesten und die längste Straße in Kreuzberg. Sie durchquert das heutige Kreuzberg auf zwei Kilometer Länge von Westen nach Osten und bildet eine geradlinige Verbindung vom Elisabeth-Ufer am Luisenstädtischen Kanal bis zum Görlitzer Ufer am Landwehrkanal. \n\nHeute ist die Reichenberger Straße, mit breiten Gehwegen, wenig Verkehr und vielen Bäumen prädestiniert für Restaurants, hippen Cafés und Bars. Einmal jährlich findet hier auch das Reichenberger Kiezfest statt. Parallel zur Reichenberger liegt das Paul-Lincke-Ufer und auf der anderen Seite des Landwehrkanals ist das Maybachufer. Hier lädt wöchentlich der Markt zu kulinarischen und internationalen Spezialitäten ein.\n\nDie U-Bahn Stationen Görlitzer Bahnhof, Kottbusser Tor und Schönleinstraße sind fußläufig zu erreichen.', 'Berliner Volksbank Immobilien - Ihr Partner beim Immobilienkauf und -verkauf.\n\nGerne stellen wir Ihnen ein ausführliches Exposé inkl. genauer Anschrift dieser Immobilie zur Verfügung. Bitte nutzen Sie hierfür das Kontaktfeld auf dieser Seite. Ihre vollständigen Kontaktdaten (Name, Anschrift, Telefonnummer und Email-Adresse) werden ausschließlich für den Versand von Immobilienangeboten gespeichert. \n\nAuf Grund von gesetzlichen Vorgaben sind telefonische Auskünfte zur genauen Immobilien-Anschrift nicht möglich; Besichtigungstermine können daher erst nach Exposé-Erhalt abstimmt werden.\n\nEinen Überblick unserer Angebote finden Sie auf unserer Website: www.bvbi.de \n\nAls Tochterunternehmen einer genossenschaftlichen Universalbank sind wir mit ganzheitlicher Beratung  vertraut. So erhalten Sie alle Dienste rund um Ihre Traumimmobilie aus einer Hand – von den Finanzierungslösungen der Berliner Volksbank bis zu den Dienstleistern starker und renommierter Partner wie der R+V Versicherung und der Bausparkasse Schwäbisch Hall.']";;535.14;2;;;;23;;;;;
2020-05-11 12:31:04.241462;Berlin;gas_heating;ONE_YEAR_FREE;18052783;n;y;https://pictures.immobilienscout24.de/listings/585293ee-9cb2-4a2d-8c43-66b6afeb0250-1364135909.jpg/ORIG/resize/118x118%3E/extent/118x118/format/jpg/quality/80;12;9.64;40 MBit/s;telekom_layer_magenta_l;über VDSL;1993;REGULAR;;9.64;116554370;no_information;n;false;MagentaZuhause L;n;Berlin;y;7;5;no_information;energy_consumption;4.62;83.42;Berlin;12307;no_information;no_information;;false;100 MBit/s;no_information;no_information;n;https://padlock.link/ioml;https://padlock.link/ml;no_information;roof_storey;12307;3;119.9;n;2,active;true;Deutschland;premium;100 MBit/s;wohnung_kauf;n;web,email,bank,music,dl-ul,game,sd,mltstr,hd,fast-ul-dl;true;002.01008679649;375000;profile0;3;true;n;showqualicontactform;n;n;Lichtenrade_Tempelhof;499085;4;Berlin;/expose/116554370;"['""Raus aus der Stadt, ab ins Grüne"" - dieser Traum vieler wird mit einer Wohnung im Evergreen in Lichtenrade erfüllt. Hier stehen elf Wohneinheiten, die sich über vier Geschosse verteilen, zum Verkauf. Alle Wohnungen verfügen über zwei bis drei Zimmer und Wohnflächen zwischen ca. 59 m² und 83 m². Zur ruhigen Gartenseite hin sind auch die Balkone und Loggien ausgerichtet, die jedem Bewohner im Evergreen einen schönen, sonnigen Freiblick garantieren.', 'Traumhafte Dachgeschoss-Wohnung mit zwei Terrassen\r\n\r\n-    Drei voneinander getrennte Zimmer \r\n-    Vom Wohnzimmer abgehend eine umlaufende Sonnenterrasse mit Bilck zum Garten\r\n-    Schlafzimmer mit Terrasse\r\n-    Wohnküche mit Terrasse\r\n-    Innenliegendes Bad mit Dusche und Wanne\r\n-    Keller\r\n-    Garage kann käuflich erworben werden\r\n', 'Gelegen im malerischen Süden Berlins, direkt an der Grenze zu Brandenburg, ist Lichtenrade historisch ländlich geprägt. Die Straßen sind von schönem, altem Baumbestand gesäumt und die lockere Bebauung mit Elementen der späten Gründerzeit, sowie auch vielen Einfamilienhäusern mit Gartenanlage, verstärken den Eindruck dörflicher Idylle.\r\n\r\n-    2 min. Gehweg zum S-Bahnhof Lichtenrade\r\n-    20 min. mit der S-Bahn zum Potsdamer Platz\r\n-    30 min. mit dem ÖPNV zum Hauptbahnhof\r\n-    15 min. mit dem Auto zum Flughafen Schönefeld\r\n-    Direkt an der Diedersdorfer Heide gelegen\r\n-    Restaurants, Cafés und Bars fußläufig zu erreichen\r\n-    Einkaufsmöglichkeiten in unmittelbarer Umgebung, zum Beispiel Rewe, Bäcker, Netto, Aldi']";;377.5;;3;;1;10;;true;;;
2020-05-11 12:31:04.713788;Berlin;no_information;ONE_YEAR_FREE;715014;n;y;https://pictures.immobilienscout24.de/listings/6cc8326a-f86f-4c56-840c-181a2d7a5a6c-1356841885.jpeg/ORIG/resize/118x118%3E/extent/118x118/format/jpg/quality/80;6;11.44;40 MBit/s;telekom_layer_magenta_l;über VDSL;;REGULAR;;11.44;116556691;gas;y;false;MagentaZuhause L;y;Berlin;n;8;;no_information;energy_consumption;5.62;154.87;Berlin;12109;well_kept;no_information;NO_INFORMATION;false;100 MBit/s;underground_garage;no_information;n;https://padlock.link/ioml;https://padlock.link/ml;no_information;no_information;12109;4;144;n;2,active;true;Deutschland;top;100 MBit/s;wohnung_kauf;n;web,email,bank,music,dl-ul,game,sd,mltstr,hd,fast-ul-dl;true;001.715014;498000;profile0;4;true;n;showqualicontactform;n;n;Mariendorf_Tempelhof;116556691;7;Berlin;/expose/116556691;['Die Wohnung liegt im 2. OG. eines Mehrfamilienhaus', 'Das Mehrfamilienhaus -  aus dem Jahre 1972 - befindet sich in einem sehr gepflegten, grundlegend sanierten Zustand. Die Wohnung liegt im 2.OG (oberste Etage) und hat zwei Balkone mit Blick in den ruhigen Garten. Die Wohnung verfügt über 4 Zimmer plus Galerie, eine hochwertige Einbauküche mit Einbauschränken in hellem Design, Küchenplatten in Granit und allen gängigen Elektrogeräten (Herd, Kühl/Gefrierkombination, Geschirrspüler, Mikrowelle) sowie zwei geflieste Badezimmer eines mit Dusche und das andere mit einem Whirlpool. Die Bäder haben beide Fenster. Der Fußboden ist  mit Teppich ausgestattet. Die Wohnung verfügt ferner über einen zugehörigen Keller und zwei  Tiefgaragenstellplätze. \n\nIn 2017 wurde für das gesamte Objekt eine neue Gaszentralheizung mit Brennwerttechnik eingebaut. Der vorliegende Energieausweis weist noch den Status mit der nunmehr ausgebauten Ölheizung und einem höherem Verbrauch aus.\n\n \n\nFür eine Besichtigung und weitere Informationen rufen Sie bitte Frau Haßelbarth direkt unter 017676893370 an.', 'Das Objekt liegt in ein beliebten und ruhigen Wohngebiet um Süden Berlins mit viel fußläufiger Naherholungsfläche wie den Britzer Garten, Kleingartenkolonien und trotzdem gut durch die Autobahnauffahrt mit der Innenstadt Berlins sowie dem Umland verbunden.', 'Hinweis\nDieses Exposé wurde anhand der uns zur Verfügung gestellten Unterlagen erstellt. Trotz aller Sorgfalt, kann für die Richtigkeit und Vollständigkeit der vorstehenden Angaben keine Gewähr übernommen werden. Ein Besichtigungstermin kann jederzeit mit unserem Büro vereinbart werden. \n\nWiderrufsrecht für Verbraucher \nhttp://www.friedrichimmobilien.de/widerrufsrecht-widerrufsbelehrung-fur-verbraucher/ \n\nGeschäftsbedingungen \nUnsere Maklerprovision beträgt 7,14 % des Kaufpreises inkl. Umsatzsteuer sofern nicht anders vereinbart. Die Provision ist bei Kaufvertragsabschluss vom Käufer an uns zu bezahlen. Bei Vorkaufsrechten, Ankaufsrechten, Erbbaurechten, Miete oder Pacht gelten die ortsüblichen Provisionssätze. Der Empfänger geht bei Annahme unseres Angebots einen Maklervertrag mit uns ein. Angebote und Mitteilungen sind nur für den Empfänger bestimmt, bei Weitergabe an Dritte haftet der Empfänger für unsere Provision. Unsere Angebote erfolgen freibleibend und ohne Gewähr, Zwischenverwertung bleibt vorbehalten. Sondervereinbarungen und Nebenabreden sind erst mit der Schriftform wirksam.'];;746;2;;;2;;;;;;
2020-05-11 12:31:05.021041;Berlin;gas_heating;ONE_YEAR_FREE;18052783;n;y;https://pictures.immobilienscout24.de/listings/ad7ff4f1-22cb-4a14-98eb-c74aa5809093-1364135527.jpg/ORIG/resize/118x118%3E/extent/118x118/format/jpg/quality/80;12;9.64;40 MBit/s;telekom_layer_magenta_l;über VDSL;1993;REGULAR;;9.64;116551357;no_information;y;false;MagentaZuhause L;n;Berlin;y;7;5;no_information;energy_consumption;4.62;72.94;Berlin;12307;no_information;no_information;;false;100 MBit/s;garage;no_information;n;https://padlock.link/ioml;https://padlock.link/ml;no_information;apartment;12307;2;119.9;n;2,active;true;Deutschland;top;100 MBit/s;wohnung_kauf;n;web,email,bank,music,dl-ul,game,sd,mltstr,hd,fast-ul-dl;true;002.01008679649;375000;profile0;2;true;n;showqualicontactform;n;n;Lichtenrade_Tempelhof;499079;3;Berlin;/expose/116551357;"['""Raus aus der Stadt, ab ins Grüne"" - dieser Traum vieler wird mit einer Wohnung im Evergreen in Lichtenrade erfüllt. Hier stehen elf Wohneinheiten, die sich über vier Geschosse verteilen, zum Verkauf. Alle Wohnungen verfügen über zwei bis drei Zimmer und Wohnflächen zwischen ca. 59 m² und 83 m². Zur ruhigen Gartenseite hin sind auch die Balkone und Loggien ausgerichtet, die jedem Bewohner im Evergreen einen schönen, sonnigen Freiblick garantieren.', 'Wohnfreundlicher Grundriss\r\n\r\n-    Zwei voneinander getrennte Zimmer mit hellem Laminat ausgestattet\r\n-    Vom Wohnzimmer abgehend ein Sonnenbalkon mit Blick zum Garten\r\n-    Innenliegendes Bad mit Dusche und Wanne\r\n-    Wohnküche mit Einbauküche\r\n-    Keller\r\n-    Garage kann käuflich erworben werden\r\n', 'Gelegen im malerischen Süden Berlins, direkt an der Grenze zu Brandenburg, ist Lichtenrade historisch ländlich geprägt. Die Straßen sind von schönem, altem Baumbestand gesäumt und die lockere Bebauung mit Elementen der späten Gründerzeit, sowie auch vielen Einfamilienhäusern mit Gartenanlage, verstärken den Eindruck dörflicher Idylle.\r\n\r\n-   2 min. Gehweg zum S-Bahnhof Lichtenrade\r\n-   20 min. mit der S-Bahn zum Potsdamer Platz\r\n-   30 min. mit dem ÖPNV zum Hauptbahnhof\r\n-   15 min. mit dem Auto zum Flughafen Schönefeld\r\n-   Direkt an der Diedersdorfer Heide gelegen\r\n-   Restaurants, Cafés und Bars fußläufig zu erreichen\r\n-   Einkaufsmöglichkeiten in unmittelbarer Umgebung, zum Beispiel Rewe, Bäcker, Netto, Aldi']";;333.06;1;3;;1;4;;;;;
2020-05-11 12:31:05.454155;Berlin;central_heating;ONE_YEAR_FREE;118951;n;y;https://pictures.immobilienscout24.de/listings/a23b3dc8-d9e1-4762-a437-d65f7e41ffee-1356830970.jpg/ORIG/resize/118x118%3E/extent/118x118/format/jpg/quality/80;10;10.62;40 MBit/s;telekom_layer_magenta_l;über VDSL;1918;REGULAR;;10.62;116555899;gas;y;false;MagentaZuhause L;y;Berlin;y;5;1;no_information;energy_consumption;5.96;41.7;Berlin;10439;refurbished;sophisticated;NO_INFORMATION;false;100 MBit/s;no_information;no_information;y;https://padlock.link/ioml;https://padlock.link/ml;no_information;other;10439;1;94.39;n;2,active;true;Deutschland;premium;100 MBit/s;wohnung_kauf;y;web,email,bank,music,dl-ul,game,sd,mltstr,hd,fast-ul-dl;true;001.118951;209000;profile0;1;true;n;showqualicontactform;n;n;Pankow_Pankow;116555899;2;Berlin;/expose/116555899;"['Wir bieten an in Kooperation mit Immobilienkontor, Norbert Schmidt:\nGroßzügige 1 Zimmer Eigentumswohnung in Altbauperle mit Balkon.\nDie Wohnung liegt in einem vor rund 22 Jahren Jahren von Grund auf sanierten, klassischen Berliner Mehrfamilienhaus im 1. OG.\nDas schöne Jugendstilhaus liegt in einer ausgesprochen ruhigen Seitenstraße.\nErbaut wurde das Haus um 1918  und wurde im Jahre 1998  umfangreich saniert\nschönes Treppenhaus /Aufzug\ntolle Fassade\nansprechender Innenhof\n\nKAUFPREIS 209.000,00 € VB\n\n\nALLE ANGABEN SIND ANGABEN DES EIGENTÜMERS BZW. DRITTER; SOMIT IST DAS ANGEBOT FREIBLEIBEND UND OHNE GEWÄHR,\nIRRTUM UND ZWISCHENVERMITTLUNG VORBEHALTEN.', '1 Zimmer\nKüche mit EBK\nBad mit Wanne\nDiele\nBalkon\nAufzug\nDeckenhöhe ca. 3,20 m\nLaminat-bzw. Steinzeugböden\nteilweise Stuck\nschöner, heller Raum\nDer Wohnungseingang besteht aus einer stilsicheren, verzierten Holztür über die man in die  Diele gelangt. Hier ist genügend Platz für Garderobe. Von hier aus gelangt man in das geräumige Bad mit Badewanne.\nVom herrschaftlichen Raum geht ums Eck die Küche ab mit wertigen Einbaumöbeln und Geräten. Ein geräumiger Balkon ist ebenfalls vorhanden.\nDie Wohnung verfügt über ansprechende Laminat-bzw. Fliesenböden.\nDas moderne Bad ist türhoch gefliest und mit wertiger Keramik und Armaturen versehen.', 'MITTEN IM KIEZ UND DENNOCH RUHIG!! \nVEKEHRSBERUHIGTE LAGE\nBESTE INFRASRUKTUR\nALLES FUSSLÄUFIG ZU ERREICHEN\nDas Objekt befindet sich am Übergang des Prenzlauer Berges zu Pankow. Hier lebt es sich ruhig im Kiez rund um den Eschengraben. Der Trubel des Szenebezirks findet in Spaziergang-Nähe statt und nicht direkt vor der Haustür. Somit kann man sich das Beste sowohl vom Prenzlauer Berg, Cafe`s, Restaurants, Geschäfte als auch von Pankow mit seinen vielen Freizeitmöglichkeiten und Familientreffpunkten heraussuchen.  Ideal ist dieser Kiez auch mit der U2 an der Schönhauser Allee, drei Tramlinien und der S-Bahn an der Bornholmer Brücke vernetzt. Schulen und Kitas wie das Schmetterlingshaus gleich um die Ecke vervollständigen die ausgezeichnete Infrastruktur.', 'BITTE GEBEN SIE IHRE VOLLSTÄNDIGEN KONTAKTDATEN AN.\nDATENSCHUTZHINWEISE FINDEN SIE UNTER\nwww.sajdok.de\nWir beraten und begleiten Sie individuell, Ihren Bedürfnissen entsprechend ob Sie eine Immobilie veräußern oder erwerben wollen, ein Objekt vermieten, oder eine Wohnung mieten wollen; wir bieten die Komplettabwicklung der Vermarktung bzw. des Erwerbs einer Immobilie an. \nUnser Tätigkeitsfeld umfasst schwerpunktmäßig Berlin und Brandenburg seit 1996. \nUnsere Angebotspalette beinhaltet Eigentumswohnungen, Mietwohnungen, Einfamilienhäuser, Mehrfamilienhäuser, Kapitalanlagen, Grundstücke, Gewerbe. Marketing-Kompetenz am Puls der Zeit = Immobilienmanagement Wir helfen Ihnen gern bei der Kaufpreisfindung und der Finanzierung Wertermittlung + Standortanalyse + Zielgruppenfindung + Verhinderung Wohnungstourismus + Exposè + Medienwerbung + Objektwerbung + Fleyerwerbung + Marketingkonzept + Vertragsverhandlungen + Notarbegleitung + Moderation + Beantwortung, Recherche, Beschaffung wie: Nachbarschaft, Infrastruktur, Bonität, Baulastenverzeichnis, Wegerechte, Altlasten, Vorkaufsrecht, Eigenbedarf, Grundbuch, Teilungserklärung, Verwaltervertrag WEG, Sondernutzungsrecht, Gemeinschaftseigentum, Protokolle Eigentümerversammlung, Energiepass, Sanierungsgebiet, Wohnungsübergaben- und Abnahmen etc??.. \nRufen Sie uns an: 0172-200 79 59 E-Mail: b.sajdok-immobilien@web.de - erreichbar täglich 9-20.00 Uhr auch an den Wochenenden - Besichtigungen täglich nach Vereinbarung - sämtliche Werbemaßnahmen (Exposè, Anzeigen, Web, Objektwerbung etc.) - Vertragsvermittlung - Betreuung und Service']";;111.15;1;5;;;2;;true;;;1998
