2020-05-11 12:25:50.565871;Berlin;central_heating;ONE_YEAR_FREE;4005610;n;n;https://pictures.immobilienscout24.de/listings/a4b729e6-3f1d-4994-b59c-6bbcfb055980-1360656294.jpg/ORIG/resize/118x118%3E/extent/118x118/format/jpg/quality/80;22;11.12;40 MBit/s;telekom_layer_magenta_l;260;über VDSL;1930;REGULAR;11.12;116972790;;y;false;MagentaZuhause L;y;Berlin;y;11;1;no_information;;6.13;262;Berlin;14057;mint_condition;sophisticated;false;100 MBit/s;underground_garage;no_information;y;https://padlock.link/ioml;https://padlock.link/ml;no_information;apartment;14057;6;;n;;2,active;true;Deutschland;top;100 MBit/s;wohnung_kauf;n;1;web,email,bank,music,dl-ul,game,sd,mltstr,hd,fast-ul-dl;true;001.4005610;1790000;profile0;4;5;true;n;showqualicontactform;n;n;Charlottenburg_Charlottenburg;116972790;7;Berlin;/expose/116972790;['Diese exklusive Altbauohnung befindet sich direkt am Lietzenseeufer im ersten Obergeschoss eines stilvollen Altbaus. Sie wurde in den letzten Jahren hochwertig und geschmackvoll modernisiert. Es wurde darauf geachtet den Altbaucharakter zu erhalten. Die Wohnung verfügt über 6 gutgeschnittene Zimmer, 2 Bäder und eine hochwertige Einbauküche. Die Großzügigkeit der Wohnung überzeugt ebenso wie die familienfreundliche Raumaufteilung. Ein Stellplatz in der Tiefgarage kann angemietet werden und ein Fahrstuhl runden dieses seltene Angebot ab.', '-1A-Lage\n-Altbauwohnung\n-Blick auf den Lietzensee\n-Garage\n-Fahrstuhl\n-Eiche Parkett\n-2 Bäder\n-Einbauküche\n-6 Zimmer\n-Großzügige Diele\n-Hochwertige Ausstattung', 'Die hier angebotene Wohnung liegt in einer der absolut begehrtesten Wohngegenden Berlins. Der Bereich um den Lietzensee und im besonderen mit unverbaubarem Blick auf den Lietzensee sind sehr begehrt und daher auch ein ganz besonderes Invest. Die Lage ist sehr zentral und trotzdem absolut ruhig und idyllisch gelegen. Sämtliche Einkaufsmöglichkeiten sind fußläufig erreichbar. Die Anbindung an die öffentlichen Verkehrsmittel sind hervorragen. Ob Sie die Seele am Lietzensee oder dem Grunewald baumeln lassen wollen oder am Kurfürstendamm oder der Wilmersdorfer Straße flanieren wollen. Alles ist in wenigen Autominuten erreichbar.', 'weitere Angebote finden Sie auf unserer Homepage www.henkelundpartner.de'];;;932.25;;;1;;;
2020-05-11 12:25:51.227045;Berlin;central_heating;ONE_YEAR_FREE;15349709;n;n;https://pictures.immobilienscout24.de/listings/c238c5b1-1b29-44d0-b569-7cbe30c13ce9-1360710209.jpg/ORIG/resize/118x118%3E/extent/118x118/format/jpg/quality/80;15;10.95;40 MBit/s;telekom_layer_magenta_l;;über VDSL;1888;REGULAR;10.95;116976394;gas;n;false;MagentaZuhause L;y;Berlin;y;5;1;34;;6.54;35;Berlin;10437;modernized;normal;false;100 MBit/s;no_information;Pappelallee;n;https://padlock.link/ioml;https://padlock.link/ml;Pappelallee;apartment;10437;1;;n;;2,active;true;Deutschland;top;100 MBit/s;wohnung_kauf;n;1;web,email,bank,music,dl-ul,game,sd,mltstr,hd,fast-ul-dl;true;001.15297510;219000;profile0;5;1;true;n;showqualicontactform;n;n;Prenzlauer_Berg_Prenzlauer_Berg;Pappelallee WE05;1;Berlin;/expose/116976394;"['Das gründerzeitliche Miethaus entstand in den Jahren 1886 bis 1888 und gehört als Denkmal zum Ensembleschutz einer historischen Mietshausgruppe, die hier in typischer Blockrandbebauung entstand. Das Haus verfügt über ein Vorderhaus und zwei Seitenflügel mit insgesamt fünf Obergeschossen und gewerblich genutzten Einheiten im Erdgeschoss des Vorderhauses. Die modernisierte Liegenschaft wird zentral beheizt und befindet sich in gutem Erhaltungszustand. Die historische Fassade besteht aus Klinkermauerwerk mit Bossenputz und ansprechendem gründerzeitlichem Dekor. Die Treppenhäuser sind in gepflegtem Zustand. Der ordentlich gestaltete Innenhof bietet Stellplätze für Fahrräder.', 'Die im 1. Obergeschoss des Seitenflügels gelegene Wohnung bietet circa 35 m² Wohnfläche, die sich in ein geräumiges Zimmer mit Kochnische, ein gut geschnittenes Duschbad, einen Flur und eine Abstellkammer unterteilen. Küche und Bad sind gefliest, das Zimmer verfügt über einen Dielenboden. Die Ausrichtung zum Innenhof bietet eine absolut ruhige Wohnlage im Herzen eines beliebten und belebten Stadtviertels. Die Wohnung verfügt über altbautypische Raumhöhe und Isolierglasfenster aus Holz. Die Warmwasseraufbereitung erfolgt über einen in der Abstellkammer befindlichen Boiler. Die schöne und gepflegte Wohnung wird komplett möbliert verkauft und steht ab sofort zur Vermietung oder zum Eigennutzen bereit. ', 'Gelegen im Helmholtz-Kiez befindet sich die Liegenschaft im Herzen von Berlin / Prenzlauer Berg und damit in einem der beliebtesten Wohnviertel der Stadt. Der Helmholtzplatz, sowie die S- und U-Bahnstationen Schönhauser Allee und Eberswalder Straße sind in wenigen Gehminuten bequem zu erreichen, eine Haltestelle der Straßenbahn befindet sich in wenigen Metern Entfernung.\r\nDie Pappelallee selbst trifft hier auf die Stargarder Straße, die für ihre zahlreichen Cafés und kleinen Geschäfte bekannt ist und ganz dem belebten und beliebten Kiez-Ambiente entspricht, für das der Prenzlauer Berg so berühmt ist.', 'Allgemeine Hinweise:\r\nAlle Angaben sind ohne Gewähr und basieren ausschließlich auf Informationen, die uns von unserem Auftraggeber übermittelt wurden. Wir übernehmen keine Gewähr für die Vollständigkeit, Richtigkeit und Aktualität dieser Angaben. Irrtum und Zwischenverkauf vorbehalten. Die Grunderwerbsteuer, Notar- und Grundbuchkosten sind vom Käufer zu tragen. Auf Wunsch stehen wir Ihnen mit weiteren Informationen zum Objekt und zum Eigentümer gerne zur Verfügung. Die Besichtigung kann jederzeit nach Vereinbarung mit einem unserer Mitarbeiter/Beauftragten erfolgen.\r\n\r\nCourtage :\r\nDer Maklervertrag mit uns kommt entweder durch schriftliche Vereinbarung oder auch durch die Inanspruchnahme unserer Maklertätigkeit auf der Basis des Objekt-Exposés und seiner Bedingungen zu Stande. Sollte das von uns nachgewiesene Objekt bereits bekannt sein, teilen Sie uns dieses bitte unverzüglich mit. Die Courtage in Höhe von 7,14 % des Gesamtaufwandes (Kaufpreis zzgl. evtl. Kostenanteil an die WEG gemäß Kaufvertrag) ist mit notariellem Vertragsabschluss fällig und vom Käufer an Vandenberg Immoconsult GmbH zu zahlen. Ein ggf. bestehendes Mietervorkaufsrecht steht der Fälligkeit der Courtage nicht entgegen. Bei Inanspruchnahme des Vorkaufsrechts und damit Eintritt des Mieters in den Kaufvertrag hat der Mieter die Courtage zu zahlen.\r\n\r\nWiderrufsrecht Maklervertrag:\r\nSie haben das Recht, binnen vierzehn Tagen ohne Angabe von Gründen diesen Vertrag zu widerrufen. Die Widerrufsfrist beträgt vierzehn Tage ab dem Tag des Vertragsabschlusses.\r\nUm Ihr Widerrufsrecht auszuüben, müssen Sie uns, der Vandenberg Immoconsult GmbH, Kurfürstendamm 104, 10711 Berlin, Tel.: 030 – 233 203 980, Fax: 030 – 233 203 989, E-Mail: info@vandenberg-berlin.com, mittels einer eindeutigen Erklärung (z.B. ein mit der Post versandter Brief, Telefax oder E-Mail) über Ihren Entschluss, den Vertrag zu widerrufen, informieren.\r\nZur Wahrung der Widerrufsfrist reicht es aus, dass Sie die Mitteilung über die Ausübung des Widerrufsrechts vor Ablauf der Widerrufsfrist absenden.\r\n\r\nFolgen des Widerrufs Maklervertrag:\r\nWenn Sie diesen Vertrag widerrufen, haben wir Ihnen alle Zahlungen, die wir von Ihnen erhalten haben, unverzüglich und spätestens binnen vierzehn Tagen ab dem Tag zurückzuzahlen, an dem die Mitteilung über Ihren Widerruf dieses Vertrags bei uns eingegangen ist. Für diese Rückzahlung verwenden wir dasselbe Zahlungsmittel, das Sie bei der ursprünglichen Transaktion eingesetzt haben, es sei denn, mit Ihnen wurde ausdrücklich etwas anderes vereinbart; in keinem Fall werden Ihnen wegen dieser Rückzahlung Entgelte berechnet.\r\nHaben Sie verlangt, dass die Dienstleistung während der Widerrufsfrist beginnen soll, so haben Sie uns einen angemessenen Betrag zu zahlen, der dem Anteil der bis zu dem Zeitpunkt, zu dem Sie uns von der Ausübung des Widerrufsrechts hinsichtlich dieses Vertrags unterrichten, bereits erbrachten Dienstleistungen im Vergleich zum Gesamtumfang der im Vertrag vorgesehenen Dienstleistungen entspricht.']";;disabled;110;;;;;;
2020-05-11 12:25:51.652177;Berlin;self_contained_central_heating;ONE_YEAR_FREE;18236579;n;y;https://pictures.immobilienscout24.de/listings/dbe1ed1a-73c3-4bb4-8470-f16821244705-1360548033.jpg/ORIG/resize/118x118%3E/extent/118x118/format/jpg/quality/80;5;10.09;40 MBit/s;telekom_layer_magenta_l;;über VDSL;1928;REGULAR;10.09;116963387;gas;n;false;MagentaZuhause L;y;Berlin;y;10;1;no_information;energy_consumption;4.59;131;Berlin;14129;refurbished;no_information;false;100 MBit/s;no_information;no_information;y;https://padlock.link/ioml;https://padlock.link/ml;no_information;apartment;14129;4;118;n;;2,active;true;Deutschland;top;100 MBit/s;wohnung_kauf;n;;web,email,bank,music,dl-ul,game,sd,mltstr,hd,fast-ul-dl;true;002.01008557000;865000;profile0;;4;true;n;showqualicontactform;n;n;Zehlendorf_Zehlendorf;1002;6;Berlin;/expose/116963387;['Diese schöne helle 4-Zimmer-Wohnung, befindet sich im zweite Obergeschoss eines Mehrfamilienhauses in Berlin Zehlendorf. Die modernisierte Wohnung mit praktischem Grundriss erstreckt sich über eine Fläche von 131 Quadratmetern und verfügt über 4 Zimmer, ein Badezimmer mit Fenster, eine Gästetoilette und einen West ausgerichtete Balkon.\nDer Sonnenbalkon biete Platz für einen Tisch und 4 Stuhle.\nEin 6 m² große Keller bietet zusätzlich Stauraum.\n\nWeiteres auf Anfrage!', '- Altbau\n- 4 Zimmer\n- Parkettboden\n- Bad mit Badewanne und Fenster\n- Gäste-WC\n- Balkon\n- Keller', 'Das Wohngebäude befindet sich im zentrale Lage des schönen Stadtteils Zehlendorf, in einer ruhigen Straße.\nGeschäfte des täglichen Bedarfs sowie, viele Cafés, Restaurants und Bars und ein Wochenmarkt sind in wenigen Gehminuten erreichbar.\n\nDie Lage ist Verkehrsgünstig!\nIn nur wenigen Gehminuten sind zwei Buslinien zu erreichen.', 'Da die Wohnung noch bewohnt wird, bitten wir um Verständnis, dass keine private Fotos veröffentlicht werden dürfen.\n\nWeitere attraktive Angebote finden Sie unter: www.Redmck.com\n\nSie wollen Ihre Immobilie verkaufen?\nWir bewerten Ihre Immobilien Kostenlos!\nGerne kümmern wir uns professionell und engagiert um den Verkauf Ihres Objektes.\nWir beraten Sie bei der Bewertung Ihrer Immobilie und der Kaufpreisfindung. \nWir Vermarkten, nach wünsch, Ihre Immobilien in die Bekannteste deutsche Portale und in die Social Media Netzwerke. \nSelbstverständlich begleiten wir Sie während des Verkaufs bis zur Übergabe des Objektes.'];;;468;;;;;;
2020-05-11 12:25:52.098272;Berlin;central_heating;ONE_YEAR_FREE;15349709;n;y;https://pictures.immobilienscout24.de/listings/f243a8cf-a017-42ca-98e8-266a3fd0703c-1367676761.jpg/ORIG/resize/118x118%3E/extent/118x118/format/jpg/quality/80;17;12.1;40 MBit/s;telekom_layer_magenta_l;;über VDSL;1900;REGULAR;12.1;116976403;natural_gas_heavy;y;false;MagentaZuhause L;y;Berlin;n;5;1;15;energy_consumption;7.07;45.74;Berlin;10829;no_information;no_information;false;100 MBit/s;no_information;"Hohenfriedbergstra&szlig;e";n;https://padlock.link/ioml;https://padlock.link/ml;Hohenfriedbergstraße;half_basement;10829;1.5;120;n;;2,active;true;Deutschland;top;100 MBit/s;wohnung_kauf;n;0;web,email,bank,music,dl-ul,game,sd,mltstr,hd,fast-ul-dl;true;001.15297510;237000;profile0;5;1;true;n;showqualicontactform;n;n;Schöneberg_Schöneberg;Hohenfriedberg WE 01;2;Berlin;/expose/116976403;"['Das Mehrfamilienhaus aus den Anfängen des 20. Jahrhunderts verfügt über insgesamt 28 Wohneinheiten, die durch zwei Vorderhausaufgänge erschlossen werden. Auf der Gebäuderückseite erstreckt sich ein gepflegter Innenhof mit Gemeinschaftsflächen. Beide Vorderhäuser verfügen über einen Aufzug. Das Gebäude ist komplett unterkellert, die Dächer sind bereits zu Wohnungen ausgebaut. Beheizung und Warmwasseraufbereitung erfolgen über eine Gas-Zentralheizung. Das modernisierte Gebäude befindet sich in gutem und gepflegtem Zustand.', 'Die im Souterrain des Seitenflügels gelegene Teileigentumseinheit verfügt über einen separaten hofseitigen Eingang, vor dem eine kleine Terrasse angelegt ist. Die großen Fensterflächen sorgen hier für maximale Belichtung. Die ideal aufgeteilte Fläche von insgesamt 45,74 m² bietet einen komfortablen Wohn- und Küchenbereich, der über eine hochwertige Einbauküche mit kompletten Elektrogeräten verfügt. Dahinter schließt sich ein Schlafbereich mit Einbauschränken an, der Zugang zum elegant und modern ausgestatteten Duschbad bietet, das über eine ebenerdige Dusche verfügt. Die erstklassig ausgebaute Einheit bietet technische Feinheiten, wie eine ferngesteuerte Türöffnung und eine Überwachungskamera, sowie eine Fußbodenheizung. Die Einheit ist vortrefflich gestaltet und steht mit kompletter Möblierung zum Verkauf. Sie kann als Zweitwohnung oder Ferienwohnung zur Vermietung oder zum Eigennutzen genutzt werden, steht aber auch für eine gewerbliche Nutzung zur Verfügung.', 'Berlin Schöneberg gehört zu den beliebtesten Stadtvierteln der Hauptstadt mit einer gewachsenen Einzelhandelsstruktur, guter Gastronomie und hervorragender Verkehrsanbindung in den einzelnen Kiezen. Die Hohenfriedbergstraße befindet sich in einem reinen Wohnviertel. Als verkehrsberuhigte Seitenstraße liegt sie zwischen Kolonnenstraße und Monumentenstraße und befindet sich damit in unmittelbarer Nähe zum S-Bahnhof Julius-Leber-Brücke. Umgeben vom bekannten Crelle-Kiez, der Schöneberger Insel und in fußläufiger bzw. bequemer Fahrraddistanz vom Park am Gleisdreieck wohnt man hier im Herzen der Berliner Innenstadt und in attraktiver Umgebung. ', 'Bei der Einheit handelt es sich um ein Teileigentum. Damit wäre eine gewerbliche Nutzung, aber auch eine Umwandlung in ein Wohneigentum möglich. Der Antrag zur Umwandlung in Wohneigentum obliegt dem neuen Eigentümer.\r\n\r\n\r\n_______\r\n\r\n\r\nAllgemeine Hinweise:\r\nAlle Angaben sind ohne Gewähr und basieren ausschließlich auf Informationen, die uns von unserem Auftraggeber übermittelt wurden. Wir übernehmen keine Gewähr für die Vollständigkeit, Richtigkeit und Aktualität dieser Angaben. Irrtum und Zwischenverkauf vorbehalten. Die Grunderwerbsteuer, Notar- und Grundbuchkosten sind vom Käufer zu tragen. Auf Wunsch stehen wir Ihnen mit weiteren Informationen zum Objekt und zum Eigentümer gerne zur Verfügung. Die Besichtigung kann jederzeit nach Vereinbarung mit einem unserer Mitarbeiter/Beauftragten erfolgen.\r\n\r\nCourtage :\r\nDer Maklervertrag mit uns kommt entweder durch schriftliche Vereinbarung oder auch durch die Inanspruchnahme unserer Maklertätigkeit auf der Basis des Objekt-Exposés und seiner Bedingungen zu Stande. Sollte das von uns nachgewiesene Objekt bereits bekannt sein, teilen Sie uns dieses bitte unverzüglich mit. Die Courtage in Höhe von 7,14 % des Gesamtaufwandes (Kaufpreis zzgl. evtl. Kostenanteil an die WEG gemäß Kaufvertrag) ist mit notariellem Vertragsabschluss fällig und vom Käufer an Vandenberg Immoconsult GmbH zu zahlen. Ein ggf. bestehendes Mietervorkaufsrecht steht der Fälligkeit der Courtage nicht entgegen. Bei Inanspruchnahme des Vorkaufsrechts und damit Eintritt des Mieters in den Kaufvertrag hat der Mieter die Courtage zu zahlen.\r\n\r\nWiderrufsrecht Maklervertrag:\r\nSie haben das Recht, binnen vierzehn Tagen ohne Angabe von Gründen diesen Vertrag zu widerrufen.  Die Widerrufsfrist beträgt vierzehn Tage ab dem Tag des Vertragsabschlusses.\r\nUm Ihr Widerrufsrecht auszuüben, müssen Sie uns, der Vandenberg Immoconsult GmbH, Kurfürstendamm 104, 10711 Berlin, Tel.: 030 – 233 203 980, Fax: 030 – 233 203 989, E-Mail: info@vandenberg-berlin.com, mittels einer eindeutigen Erklärung (z.B. ein mit der Post versandter Brief, Telefax oder E-Mail) über Ihren Entschluss, den Vertrag zu widerrufen, informieren. \r\nZur Wahrung der Widerrufsfrist reicht es aus, dass Sie die Mitteilung über die Ausübung des Widerrufsrechts vor Ablauf der Widerrufsfrist absenden.\r\n\r\nFolgen des Widerrufs Maklervertrag:\r\nWenn Sie diesen Vertrag widerrufen, haben wir Ihnen alle Zahlungen, die wir von Ihnen erhalten haben, unverzüglich und spätestens binnen vierzehn Tagen ab dem Tag zurückzuzahlen, an dem die Mitteilung über Ihren Widerruf dieses Vertrags bei uns eingegangen ist. Für diese Rückzahlung verwenden wir dasselbe Zahlungsmittel, das Sie bei der ursprünglichen Transaktion eingesetzt haben, es sei denn, mit Ihnen wurde ausdrücklich etwas anderes vereinbart; in keinem Fall werden Ihnen wegen dieser Rückzahlung Entgelte berechnet.\r\nHaben Sie verlangt, dass die Dienstleistung während der Widerrufsfrist beginnen soll, so haben Sie uns einen angemessenen Betrag zu zahlen, der dem Anteil der bis zu dem Zeitpunkt, zu dem Sie uns von der Ausübung des Widerrufsrechts hinsichtlich dieses Vertrags unterrichten, bereits erbrachten Dienstleistungen im Vergleich zum Gesamtumfang der im Vertrag vorgesehenen Dienstleistungen entspricht.\r\n']";;disabled;156.01;;D;;;;
2020-05-11 12:25:52.439894;Berlin;central_heating;ONE_YEAR_FREE;16655424;n;y;https://pictures.immobilienscout24.de/listings/7adcc159-c7ef-4921-9c6c-0df95c170eee-1359338380.jpg/ORIG/resize/118x118%3E/extent/118x118/format/jpg/quality/80;9;14.32;40 MBit/s;telekom_layer_magenta_l;70;über VDSL;1963;REGULAR;14.32;116850100;oil;n;false;MagentaZuhause L;y;Berlin;y;7;2;11;energy_consumption;8.36;67;Berlin;13351;no_information;luxury;false;100 MBit/s;no_information;"Guineastra&szlig;e";y;https://padlock.link/ioml;https://padlock.link/ml;Guineastraße;apartment;13351;2;132.9;n;2020;2,active;true;Deutschland;standard;100 MBit/s;wohnung_kauf;n;5;web,email,bank,music,dl-ul,game,sd,mltstr,hd,fast-ul-dl;true;002.01007482943;329000;profile0;5;2;true;n;showqualicontactform;n;n;Wedding_Wedding;116850100;3;Berlin;/expose/116850100;['Sie erreichen die gepflegte Eigentumswohnung in der fünften Etage mit dem Fahrstuhl. Die Wohnung ist gerade vollständig kernsaniert worden, das heißt die gesamte Elektroinstallation, das neue Duschbad, der Abstellraum mit Waschmaschinen- und Trockneranschluss, die Küche und sämtliche Bodenbeläge, Wände und Decken sind erneuert worden. \n\nIm Bad und in der Küche sind hochwertige, großflächige Fliesen gelegt worden. Im Bad wurde eine fast ebenerdige Dusche mit Glasabtrennung eingesetzt und der Handtuchheizkörper darf selbstverständlich auch nicht fehlen.\n\nDie Wände und Decken wurden gespachtelt und weiß gestrichen und im Bad und Flur sind Spotlights eingesetzt worden. Der Flur und die beiden weiteren Räume sind mit hellem Parkett ausgestattet worden. Vom großen Wohnzimmer aus gehen Sie auf den Süd- Balkon, eine Markise schützt vor zu großer Sonneneinstrahlung.', '- Neue Böden\n- Neue Elektrik\n- Neues Sanitär\n- Neue Wände\n- Fahrstuhl\n- Südbalkon', 'Die hier angebotene Eigentumswohnung befindet sich im Berliner Stadtbezirk Mitte, im Ortsteil Wedding in einer zentralen, verkehrsgünstigen, aber ruhigen Seitenstraße des afrikanischen Viertels. Unweit davon befinden sich die technische Fachhochschule sowie das Virchow-Klinikum. Zur Freizeitgestaltung laden das nah gelegene Nordufer und der Volkspark Rehberge mit dem Strandbad Plötzensee ein. Die Gegend erfreut sich einer zunehmenden Nachfrage und Beliebtheit. In den letzten Jahren hat sich hier eine freundliche und angenehme Restaurant– und Bar Szene entwickelt. Mit den öffentlichen Verkehrsmitteln sind die City-West und auch die City-Ost in wenigen Minuten zu erreichen. Einkaufs-, Sport- und Freizeitmöglichkeiten, Restaurants, Schulen und öffentliche Einrichtungen befinden sich in zum Teil fußläufiger Entfernung. Alle Besorgungen des täglichen Bedarfs können auch ohne Fahrzeug problemlos erledigt werden.', 'Der Makler-Vertrag mit uns und/oder unserem Beauftragten kommt durch schriftliche Vereinbarung oder durch die Inanspruchnahme unserer Maklertätigkeit auf der Basis des Objekt-Exposés und seiner Bedingungen zustande. Die Käufercourtage in Höhe von 7,14 % auf den Kaufpreis einschließlich gesetzlicher Mehrwertsteuer ist bei notariellem Vertragsabschluss verdient und fällig. \n\nDie Höhe der Bruttocourtage unterliegt einer Anpassung bei Steuersatzänderung.\n\nAlle Angaben sind ohne Gewähr und basieren ausschließlich auf Informationen, die uns von unserem Auftraggeber übermittelt wurden. Wir übernehmen keine Gewähr für die Vollständigkeit, Richtigkeit und Aktualität dieser Angaben. Sollte das von uns nachgewiesene Objekt bereits bekannt sein, teilen Sie uns dieses bitte unverzüglich mit. Die Weitergabe dieses Exposees an Dritte ohne unsere Zustimmung löst gegebenenfalls Courtage- bzw. Schadensersatzansprüche aus. Im Übrigen gelten die allgemeinen Geschäftsbedingungen.'];;;245;;;;;;
2020-05-11 12:25:52.962049;Berlin;central_heating;ONE_YEAR_FREE;16357866;n;y;https://pictures.immobilienscout24.de/listings/bdcaf8e7-678f-45e0-b8bc-325c7b7ff627-1360680889.jpg/ORIG/resize/118x118%3E/extent/118x118/format/jpg/quality/80;8;10.76;40 MBit/s;telekom_layer_magenta_l;;über VDSL;1950;REGULAR;10.76;116974863;no_information;n;false;MagentaZuhause L;y;Berlin;n;3;1;no_information;;6.07;55.34;Berlin;13585;no_information;no_information;false;100 MBit/s;no_information;no_information;n;https://padlock.link/ioml;https://padlock.link/ml;no_information;apartment;13585;2;;n;;2,active;true;Deutschland;premium;100 MBit/s;wohnung_kauf;y;1;web,email,bank,music,dl-ul,game,sd,mltstr,hd,fast-ul-dl;true;001.16004349;124000;profile0;;2;true;n;showqualicontactform;n;n;Spandau_Spandau;NEU0501M;2;Berlin;/expose/116974863;['Wir bieten Ihnen hier eine im Vorderhaus und 1. Obergeschoss befindliche 2-Zimmer-Eigentumswohnung zum Kauf und zur Kapitalanlage an. Die Wohnung ist seit dem 01.07.2010 an zuverlässige Mieter vermietet. Die rund 55 m² große Wohnfläche verteilt sich auf das Wohnzimmer mit Zugang zum Balkon, das Schlafzimmer, die Küche, das Badezimmer mit Fenster, einen kleinen Hauswirtschaftsraum bzw. einer kleinen Abstellkammer sowie den Flur. Ein Kellerraum ist der Wohnung zugeordnet.', 'Der Energieausweis ist angefordert und kann demnächst gerne nachgereicht werden.', 'Im Westen Berlins gelegen, wo Havel und Spree zusammenfließen, bietet Spandau viel Wasser, Grün und Natur. Zwei historische Festungsanlagen, die Zitadelle Spandau und viele weitere Sehenswürdigkeiten runden das kulturelle und historische Angebot hervorragend ab. Historische Gebäude und alte Fachwerkhäuser findet man auch in der Spandauer Altstadt, die mit ihren zahlreichen Geschäften in verkehrsberuhigter Fußgängerzone zum Bummeln und Shoppen einlädt. Für eine Pause oder Stärkung kann man in eines der vielen Restaurants oder Cafés einkehren.', 'Für einen Besichtigungstermin und alle Informationen zur betreffenden Immobilie nutzen Sie einfach das oben stehende Kontaktformular. Wir senden Ihnen umgehend eine E-Mail über die Sie sofort einen Online-Zugang zu den vollständigen Objektunterlagen und die Kontaktdaten des Maklers erhalten. Alternativ registrieren Sie sich gerne direkt kostenfrei unter www.realbest.de.\n\nAlle Angaben in diesem Exposé wurden nach bestem Wissen erstellt, erheben jedoch keinen Anspruch auf Richtigkeit und Vollständigkeit. Die Grundrisse sind nicht maßstabsgerecht und dienen lediglich der Veranschaulichung. Das vorliegende Exposé ist als unverbindliche Information zu verstehen und kann nicht als Rechtsgrundlage herangezogen werden. Rechtskräftig ist ausschließlich der notariell abgeschlossene Kaufvertrag.'];true;disabled;;;;;;;
