timestamp;obj_regio1;obj_heatingType;obj_telekomTvOffer;obj_cId;obj_newlyConst;obj_balcony;obj_picture;obj_picturecount;obj_pricetrend;obj_telekomUploadSpeed;obj_telekomTrackingGroup;obj_usableArea;obj_telekomInternetTechnology;obj_yearConstructed;obj_telekomInternetType;obj_pricetrendbuy;obj_scoutId;obj_firingTypes;obj_hasKitchen;obj_ExclusiveExpose;obj_telekomInternetProductName;obj_courtage;geo_bln;obj_cellar;obj_purchasePriceRange;obj_yearConstructedRange;obj_houseNumber;obj_energyType;obj_pricetrendrent;obj_livingSpace;geo_krs;obj_zipCode;obj_condition;obj_interiorQual;ga_cd_cxp_historicallisting;obj_telekomDownloadSpeed;obj_parkingSpace;obj_street;obj_lift;obj_telekomInternetUrlMobile;obj_telekomInternetUrl;obj_streetPlain;obj_typeOfFlat;geo_plz;obj_noRooms;obj_thermalChar;obj_assistedLiving;obj_lastRefurbish;obj_ityp;obj_telekomHdTelephone;geo_land;ga_cd_via;obj_telekomInternet;obj_immotype;obj_rented;obj_floor;obj_telekomInternetServices;obj_telekomInternetProductAvailable;obj_cwId;obj_purchasePrice;ga_cd_application_requirements;obj_numberOfFloors;obj_noRoomsRange;ga_cd_maillead_default_shown;obj_garden;evt_count_pm_sig;obj_barrierFree;obj_international;obj_regio3;obj_objectnumber;obj_livingSpaceRange;obj_regio2;URL;beschreibung;ga_cd_via_qualified;obj_galleryAd;obj_rentSubsidy;obj_groupnumber;obj_energyEfficiencyClass;obj_noParkSpaces;ga_cd_developer_virtualreality;obj_telekomHybridUploadSpeed;obj_telekomHybridDownloadSpeed
2020-05-11 12:25:48.316265;Berlin;district_heating;ONE_YEAR_FREE;15314142;n;y;https://pictures.immobilienscout24.de/listings/50bc6d67-0cde-4b34-903a-28fca352fff9-1360752289.jpg/ORIG/resize/118x118%3E/extent/118x118/format/jpg/quality/80;17;10.95;40 MBit/s;telekom_layer_magenta_l;44;über VDSL;1904;REGULAR;10.95;116963415;district_heating;n;false;MagentaZuhause L;y;Berlin;y;4;1;0;energy_consumption;6.54;42.51;Berlin;10437;need_of_renovation;simple;false;100 MBit/s;no_information;"Gleimstra&szlig;e";n;https://padlock.link/ioml;https://padlock.link/ml;Gleimstraße;apartment;10437;1;94;n;2008;2,active;true;Deutschland;standard;100 MBit/s;wohnung_kauf;n;3;web,email,bank,music,dl-ul,game,sd,mltstr,hd,fast-ul-dl;true;001.12313477;179000;profile0;5;1;true;n;showqualicontactform;n;n;Prenzlauer_Berg_Prenzlauer_Berg;Fa-35 WE;2;Berlin;/expose/116963415;['Absolute Gelegenheite ! Mit viel Potenial ! \nUnsaniertes Juwel...sofort frei !  \n\nDas klassische gute erhaltene Altbau-Wohnhaus mit typischer Gründerzeit-Fassade wurde im Jahr 1904 errichtet. Der fünfgeschossige, unterkellerte sanierte Altau besteht aus einen sonnigen Vorderhaus und einen ruhigen Gartenhaus.\n\nDiese unsanierte und charmante Eigentumswohnung, wie sie hier angeboten wird, ist eine absolute Rarität.\nBESICHTIGUNG: kontakt@ibf.immobilienkontor.de oder 0160-94778887 oder 0160-6532121 !\n\nBitte haben Sie Verständnis dafür, dass wir Ihre Anfrage nur in schriftlicher Form (bevorzugt per E-Mail) unter Angabe des vollständigen Namens und Ihrer Adresse, bearbeiten können.\n\nBesichtigungshotline: 0160 - 6532121', 'Die nicht sanierte angebotene ruhige und nicht vermietet helle 1 Zimmer-Altbauwohnung verfügt ingesamt über 1 großzügiges Wohnzimmer ca. 23 qm mit Zugang zum Balkon, eine Küche 9 qm, ein Bad mit Fenste und Flur.\n Die charmante Wohnung besticht durch klassischen original Altbau-Charme: \nmassive Holzböden und Dielen, hohe Decken (3,50m), schwere Holztüren, teilw. Holzfenster und Türen, Gegensprechanlage, trockener Keller und vieles mehr....eine schöne Altbauwohnung. \n\nDie Wohnung ist sofort frei! Das Haus wird über Fernwärme beheizt und die Warmwasserversorgung erfolgt zentral. \nBesichtigungshotline: 0160 65 32121 ( Montag bis Sonntag erreichbar! ) - gerne Samstag und Sonntag!\n\nFAZIT: Top-charmate Altbauwohnung\nbegehrter Kiezlage. Schnell ansehen und zugreifen - sonst weg! \n\n\n- großzügiger Grundriss\n- großer Balkon\n- Holzdielen\n- exklusive Lage direkt am Park \n- Kellerraum\n\nHier können Sie Ihre persönlichen und induvidulen Wünsche umsetzen. Gerne beraten wir Sie bei der Sanierung der Wohnung mit unseren langjährigen Erfahrungen.', 'Direkt am Park / Platz mit freien Blick ins Grüne! \n\nDer Prenzlauer Berg ist the best place to be in Berlin. Besonders in der Schönhauser Allee machen zahlreiche trendige Cafés, Kneipen, Restaurants, Bars, Galerien sowie Theater den Stadtteil zum Touristenmagneten. \n\nDas multikulturelle Flair zieht hier viele internationale Bewohner an.\nDiese Immobilie befindet sich im Prenzlauer Berg (ca. 160.000 Einwohner), einem Ortsteil im Berliner Bezirk Pankow.\n\nMit einer der größten Zuwachsraten zählt der Bezirk Pankow zu einem der beliebtesten Wohngegenden in Berlin. Die gutbürgerliche Wohngegend in der Mitte von Berlin lädt mit seinen ausgedehnten Grünflächen, seinem reichen Kulturangebot und seinen vielfältigen kulinarischen Höhepunkten zum Wohnen und Verweilen ein.\n\nDer Prenzlauer Berg verfügt über eine gut ausgebaute Infrastruktur mit vielfältigen Einrichtungen des täglichen Bedarfs wie verschiedenen Einrichtungen zur medizinischen Versorgung, kleine und größere Einkaufsmöglichkeiten, Grund- und Oberschulen, mehreren Kindertagesstätten, Kinos, Bars, Clubs und vieles mehr.\n\nWeiterhin besteht eine sehr gute Anbindung an den öffentlichen Nahverkehr. So können Sie fußläufig in nur 5 Minuten den S-Bahnhof  Schönhauser Allee sowie diverse Buslinien erreichen.\n\nBitte haben Sie Verständnis dafür, dass wir Ihre Anfrage nur in schriftlicher Form (bevorzugt per E-Mail) unter Angabe des vollständigen Namens und Ihrer Adresse, bearbeiten können.\n\nBesichtigungshotline: 0160 - 65 32121', 'Endlich meins! Einziehen und wohlfühlen !\n\nBitte haben Sie Verständnis dafür, dass wir Ihre Anfrage nur in schriftlicher Form (bevorzugt per E-Mail) unter Angabe des vollständigen Namens und Ihrer Adresse, bearbeiten können.\n\nEine Besichtigung ist nach vorheriger Absprache mit uns möglich.\n\nFinanzierung: Gerne sind wir bei der Finanzierung dieses Objektes behilflich.\n\nHinweis: Die Angaben zum Objekt erfolgen auf Basis der Information der Verkäufer. Eine Gewähr für die Vollständigkeit und Richtigkeit der Angaben kann nicht übernommen werden.\n\nDas Exposé ist nicht für Dritte bestimmt!\n\nBESICHTIGUNG: kontakt@ibf.immobilienkontor.de oder 0160-94778887 oder 0160-6532121 !\n\nGerne informieren wir Sie über weitere Details oder lassen Sie sich bei einer Besichtigung von der einmaligen Lage am Park und der schönen Wohnung mit interessanten Umfeld verzaubern! \n\nWenn Sie es wünschen, vermitteln wir Ihnen gerne die passende Finanzierung und Handerker. Dann haben Sie alles aus einer Hand und können unseren Service voll nutzen. Rufen Sie uns an!'];;;;;;;;;
2020-05-11 12:25:48.644396;Berlin;self_contained_central_heating;;595431;n;y;https://pictures.immobilienscout24.de/listings/da8bf816-2d73-433c-b0b0-536c8857145b-1363845440.jpg/ORIG/resize/118x118%3E/extent/118x118/format/jpg/quality/80;10;12.7;;;;;1920;;12.7;116977052;gas;n;false;;y;Berlin;n;9;1;.;;7.56;88;Berlin;10553;first_time_use;luxury;false;;no_information;"Sickingenstra&szlig;e";y;;;Sickingenstraße;roof_storey;10553;3;;n;2020;2,active;;Deutschland;premium;;wohnung_kauf;n;5;;;001.595431;527340;profile0;5;3;true;n;showqualicontactform;n;n;Tiergarten_Tiergarten;WE41;4;Berlin;/expose/116977052;['Die angebotene 3 Zimmer Wohnung befindet sich im 5. Obergeschoss im Gartenhaus des Gebäudes mit Fahrstuhl. Die gesamte Wohnfläche umfasst ca. 88 m² und imponiert durch eine optimale Wohnraumaufteilung, welcher der Dachgeschosswohnung schon damit einzigartigen Charakter verleiht. Der attraktive Grundriss bietet neben einem großräumigen Wohn- und Essbereich, ein wunderschönes Duschbad, zwei Schlafzimmer sowie eine schicke helle Terrasse. Bei der Farbgestaltung können Sie mitwirken und Ihre individuellen Wünsche miteinfließen lassen!', 'Die komplette Wohnung wird mit einem hochwertigen Parkettfußboden mit Fußbodenheizung ausgestattet. Die bodentiefen Fenster, die einen direkten Zugang zur Terrasse ermöglichen sorgen für lichtdurchflutete Räume, ebenso sorgen hohe Decken für eine gemütliche Wohnatmosphäre. Hier können Sie es sich nach einem anstrengenden Tag gemütlich machen.\n\nAusstattungsmerkmale:\n* 5.OG = DG mit Fahrstuhl\n* 3 Zimmer\n* Hochwertiges Duschbad mit Dachflächenfenster\n* Terrasse\n* Echtholzparkett/Fliesenboden\n* Gespachtelte Wände\n* Holzfenster\n* Fußbodenheizung\nuvm.', 'Die Wohnung befindet sich im begehrten Viertel im Berliner Ortsteil Moabit und damit im Bezirk Mitte. Die schönen Gründerzeit Altbauten, welche dort gebaut wurden sind überwiegend renoviert und sehr gepflegt. Die Verkehrsanbindungen sind durch den nahegelegenen S-Bahnhof „Beusselstraße“ (Ring-Bahn), welcher in nur wenigen Minuten fußläufig zu erreichen ist, gegeben. Von dort aus ist der Potsdamer Platz, die Friedrichstraße oder der Alexanderplatz ebenfalls problemlos zu erreichen. Moabit ist ein beliebtes Zentrum multikultureller Lebensqualität mit Märkten, Einzelhandel und einer Restaurant und Café-Kultur.', 'Weitere Angaben können bei einem Besichtigungstermin vor Ort gerne abgeklärt werden. Der Energieausweis liegt zur Besichtigung vor.\n\nAlle Angaben basieren auf den Auskünften und Informationen des Eigentümers. Die Haftung für die Richtigkeit und Vollständigkeit wir nicht übernommen. Alle Angaben sind ohne Gewähr. Alle Visualisierungen sind unverbindlich.\n\nHaben Sie noch Fragen oder möchten Sie ein Exposé? Wir freuen uns auf Ihren Anruf oder eine individuelle Terminvereinbarung. Ihr IVF-Team ist gerne für Sie da!'];true;disabled;200;1;;;;;
2020-05-11 12:25:49.104887;Berlin;central_heating;ONE_YEAR_FREE;8874474;n;y;https://pictures.immobilienscout24.de/listings/202f35fb-5405-4ec0-9d85-e8032696eda6-1360557236.jpg/ORIG/resize/118x118%3E/extent/118x118/format/jpg/quality/80;9;12.1;40 MBit/s;telekom_layer_magenta_l;;über VDSL;1956;REGULAR;12.1;116964256;gas;y;false;MagentaZuhause L;y;Berlin;y;4;2;40;;7.07;49.32;Berlin;10779;need_of_renovation;no_information;false;100 MBit/s;no_information;Martin-Luther-Str.;n;https://padlock.link/ioml;https://padlock.link/ml;Martin-Luther-Str.;apartment;10779;2;;n;;2,active;true;Deutschland;standard;100 MBit/s;wohnung_kauf;y;3;web,email,bank,music,dl-ul,game,sd,mltstr,hd,fast-ul-dl;true;001.8874474;184999;profile0;;2;true;n;;n;n;Schöneberg_Schöneberg;KA-MA-40k01;2;Berlin;/expose/116964256;['Dieses Mehrfamilienhaus wurde in den 60´ern erbaut und befindet sich in einem guten Zustand. Das Haus besteht aus insesamt 15 Wohn - und Gewerbeeinheiten.', 'Diese charmante Wohnung ist rund 50 m² groß und erstreckt sich über 2 gut geschnittene Räume. Die Fenster wurdem vor ca. 8 Jahren erneuert und sind schallgeschützt. Außerdem gehört noch ein schöner Süd-Balkon zu dieser Wohneinheit mit einem guten Ausblick.\n\nDie Wohnung ist aktuell vermietet und wird als Anlage angeboten !', 'Berlin-Schöneberg. Die beliebte Wohnlage direkt am Winterfeldtplatz besticht durch eine ganz besondere Atmosphäre. Die grüne Citylage mit extravaganten Einzelhandelsgeschäften sowie einem umfangreichen Angebot an internationaler Gastronomie macht dieses Umfeld im Herzen von Schöneberg so attraktiv.'];;disabled;134;;;;;;
2020-05-11 12:25:49.442666;Berlin;central_heating;ONE_YEAR_FREE;15474925;n;y;https://pictures.immobilienscout24.de/listings/77c2a2aa-008b-4ae3-ae6e-8975ff683831-1360628113.png/ORIG/resize/118x118%3E/extent/118x118/format/jpg/quality/80;26;10.5;40 MBit/s;telekom_layer_magenta_l;;über VDSL;1999;REGULAR;10.5;116970284;natural_gas_light;y;false;MagentaZuhause L;y;Berlin;y;6;5;no_information;energy_consumption;6.67;68;Berlin;13086;no_information;no_information;false;100 MBit/s;no_information;no_information;y;https://padlock.link/ioml;https://padlock.link/ml;no_information;no_information;13086;2;115;n;;2,active;true;Deutschland;top;100 MBit/s;wohnung_kauf;n;6;web,email,bank,music,dl-ul,game,sd,mltstr,hd,fast-ul-dl;true;001.15417560;278000;profile0;6;2;true;n;;n;n;Weißensee_Weißensee;VK-19132c;3;Berlin;/expose/116970284;['Das 6-geschossige Gebäude wurde 1999 erbaut und ist mit einem bequemen Fahrstuhl ausgestattet.\n\nDie Wohnung ist im Dachgeschoss gelegen und besticht durch eine gute Raumaufteilung.\n\nVom Flur aus, in welchem sich ein praktischer, sehr großer Einbauschrank befindet, befindet sich gleich rechts das Badezimmer, welches mit einer  Badewanne und Handtuchwärmer ausgestattet ist, und Platz für eine Waschmaschine bietet. \n\nDaneben liegt das Wohnzimmer, das Zugang zu einer nach Westen ausgerichteten Terrasse hat.  Die Terrasse bietet einen herrlichen Blick über die Dächer der Nachbarhäuser hinweg, um nicht nur an Sommertagen die Abendsonne genießen zu können. \n\nIn Reichweite der Terrasse befindet sich die Küche, die 2009 mit einer hochwertigen Einbauküche und Elektrogeräten ausgestattet wurde. Sie bietet ausreichend Stauraum und Arbeitsfläche. Der Geschirrspüler wurde erst 2018 erneuert.\n\nGegenüber des Wohnzimmers auf der anderen Seite des Flurs befindet sich das geräumige Schlafzimmer, das trotz Dachschräge genügend Fläche für Kleiderschrank und ein großzügiges Bett aufweist. \n\nDie Wohnräume sind mit Teppichböden ausgestattet. Bad und Küche sind gefliest. Die Wände sind tapeziert, die Holzfenster sind 2-fach verglast. Die Wohnung ist mit einer Ringheizung ausgestattet. Diese hat nahezu den Effekt einer Fußbodenheizung. Ebenso zur Ausstattung gehört eine Klimaanlage.\n\nFür eine schnelle Internetverbindung sorgt eine 50 Mbit-Leitung. \n\nDie Fassade des Hauses hat 2017 einen neuen Farbanstrich erhalten. Das Dach wurde ebenfalls kürzlich neu gedeckt, ein Flachdach wurde mit neuer Dachpappe versehen. \n\n2018 wurde die Zentralheizung erneuert. \n\nFahrradkeller, Wäsche- und Trockenraum sowie ein Kellerabteil runden das Angebot ab.\n\nIm Untergeschoss des Gebäudes befindet sich eine Tiefgarage. Es besteht die Möglichkeit, einen Tiefgaragenplatz separat anzumieten. \n\nDie Wohnung ist bezugsfrei!', 'Weißensee ist ein Ortsteil im Bezirk Pankow von Berlin. Namensgeber ist der Weiße See, der heute ein beliebtes Ziel für Ausflügler ist. \n\nDen alten Ortskern bildet die Berliner Allee mit interessanten Gründerzeitbauten. Der Zentralplatz ist der Antonplatz, der in den 2000er und 2010er Jahren neu strukturiert, bebaut und neu begrünt wurde. Ende der 1990er und Anfang der 2000er Jahre wurden umfangreiche Wohnungsbauprojekte in Weißensee realisiert. \n\nHeute präsentiert sich Weißensee mit einer hervorragenden Infrastruktur. Einkaufsmöglichkeiten für den täglichen Bedarf sind in der Nähe fußläufig  zu erreichen, ebenso eine größere Auswahl an Geschäften, Cafés und Restaurants, wovon viele sich den Alt-Berliner Charme erhalten haben. \n\nDie ärztliche Versorgung ist durch mehrere Arztpraxen und Apotheken sowie die Parkklinik Weißensee gesichert. \n\nEine sehr gute Anbindung an den ÖPNV ist verfügbar durch die Straßenbahnlinie M4 und  M13 , sowie die Buslinien 225, 158 und M12. \n\nIn ca. 15 Minuten mit dem Auto ist in südlicher Richtung der Alexanderplatz zu erreichen. Der Berliner Allee nach Norden folgend, ist der Autobahnanschluss der A10 gelegen und auch das Berliner Umland gut erreichbar.'];;;208;;D;;;;
2020-05-11 12:25:49.864982;Berlin;central_heating;ONE_YEAR_FREE;17053294;n;y;https://pictures.immobilienscout24.de/listings/33127d89-27e2-4fcd-9c56-2ce9d0beb606-1360638560.jpg/ORIG/resize/118x118%3E/extent/118x118/format/jpg/quality/80;12;10.95;40 MBit/s;telekom_layer_magenta_l;;über VDSL;1900;REGULAR;10.95;116971145;;n;false;MagentaZuhause L;y;Berlin;y;7;1;no_information;energy_consumption;6.54;43;Berlin;10405;first_time_use_after_refurbishment;sophisticated;false;100 MBit/s;no_information;no_information;y;https://padlock.link/ioml;https://padlock.link/ml;no_information;apartment;10405;1;65;n;2019;2,active;true;Deutschland;standard;100 MBit/s;wohnung_kauf;n;5;web,email,bank,music,dl-ul,game,sd,mltstr,hd,fast-ul-dl;true;009.ac1dfa0b-218e-4ee8-80be-5d05a0d821f2;320000;profile0;4;1;true;n;showqualicontactform;n;n;Prenzlauer_Berg_Prenzlauer_Berg;116971145;2;Berlin;/expose/116971145;['Imagefilm: https://www.youtube.com/watch?v=JX2UrOvWMD4\n\n(Die Wohnung ist nur virtuell eingerichtet, sie ist frisch saniert und leer)\n\nDie hier angebotene traumhafte Altbauwohnung wurde hochwertig und aufwendig saniert. Die Wohnung befindet sich ebenfalls in einem komplett kernsanierten Altbau. Sowohl Stränge, als auch Fassade, Balkone, Treppenhäuser, Keller, Heizung und alle Flächen im gemeinschaftlichen Eigentum wurden erneuert. Bei der Wohnung handelt es sich um eine sinnvoll aufgeteilte 1-Zimmer Wohnung. Der Flur bietet ausreichend Platz für eine Garderobe, oder Einbauschrank. Das Duschbad ist innenliegend und verfügt über eine moderne Entlüftung. Aufgrund der Aufteilung verfügt die Wohnung über einen sehr großen Raum, der je nach Bedürfnissen und Wünschen als Wohn-Ess- und Schlafbereich gestaltet werden kann. Die Küche wäre auch groß genug, um hier sowohl Küchenzeile, als auch Sitzmöglichkeiten unterzubringen. Die Küche ist mit einer Schiebetür mit dem Wohnbereich verbunden. Zusätzlich verfügt diese Wohnung über einen Balkon, welcher direkt vom Wohnbereich zugänglich ist. \n\nIm Gebäude gibt es 30 Wohneinheiten und zwei Gewerbeeinheiten. Im Erdgeschoss hat sich dieses Jahr eine Praxis für Allgemeinmedizin angesiedelt. Der begrünte Innenhof bietet ausreichend Abstellmöglichkeiten für die Fahrräder im Haus, ansonsten verfügen alle Wohnungen über einen Keller.', 'Eichenparkett \nBalkon\nFahrstuhl\nHolzfenster mit Isolierverglasung\nGegensprechanlage\nKeller\nDuschbad\nKlasse B – 65 kWh Energiebedarf\nGas-Zentralheizung\nSchiebetür zur Küche\nBegrünter Innenhof mit Fahrradabstellmöglichkeiten', 'Als Winsviertel wird das Gebiet zwischen der Danziger Straße, der Greifswalder Straße, der Mollstraße und der Prenzlauer Allee bezeichnet. Kern des Viertels ist die namensgebende und anliegende Winsstraße. Angrenzende Wohnquartiere sind der Ernst-Thälmann-Park, das Bötzowviertel und der Kollwitzkiez. Im Süden grenzt das Viertel zudem an die Ortsteile Mitte und Friedrichshain. Prenzlauer Berg, ein Stadtteil mit Charme, der umfangreiche Ausgehmöglichkeiten bietet.  Der Stadtteil ist mit dem S-Bahn-Ring, einer U-Bahn-Linie (U2), neun Straßenbahnlinien und einigen Buslinien sehr gut an den öffentlichen Personennahverkehr angebunden.  Im Sommer lädt der naheliegende Park zum Seelebaumeln ein. Prenzlauer Berg ist der bevölkerungsreichste Ortsteil der Stadt. Sanierte Jugendstilhäuser, extravagante Neubauten, dazwischen die so beliebten engen Straßen mit ihren Cafés, Restaurants, Boutiquen und Galerien – das macht das Leben im Zentrum der Metropole aus! Das Winsviertel gilt zu Recht als eines der beliebtesten in Berlin.'];;;;;;;;;
2020-05-11 12:25:50.192962;Berlin;self_contained_central_heating;ONE_YEAR_FREE;1145741;n;y;https://pictures.immobilienscout24.de/listings/c8dfce78-2970-4d31-a493-588b1f204285-1360896720.jpg/ORIG/resize/118x118%3E/extent/118x118/format/jpg/quality/80;18;11.35;40 MBit/s;telekom_layer_magenta_l;148.64;über VDSL;1902;REGULAR;11.35;116976237;gas;y;false;MagentaZuhause L;n;Berlin;y;10;1;37;energy_consumption;7.54;143.35;Berlin;10249;first_time_use;sophisticated;false;100 MBit/s;no_information;"Petersburger Stra&szlig;e";y;https://padlock.link/ioml;https://padlock.link/ml;Petersburger_Straße;roof_storey;10249;5;;n;2020;2,active;true;Deutschland;standard;100 MBit/s;wohnung_kauf;n;5;web,email,bank,music,dl-ul,game,sd,mltstr,hd,fast-ul-dl;true;001.1145741;975000;profile0;5;5;true;n;showqualicontactform;n;n;Friedrichshain_Friedrichshain;2044.00240/250;6;Berlin;/expose/116976237;['Vielen Dank für Ihr Interesse an unserem Angebot. \n\nDas Wohn- und Geschäftshaus befindet sich im Bezirk Friedrichshain/Kreuzberg. Das Dachgeschoss wird derzeit ausgebaut, so dass 314,27 m² neuer Wohnraum entsteht. Hier lebt man mitten in Szenebezirk Friedrichshain und kann über den Dächern einen atemberaubenden Blick auf den Berliner Fernsehturm genießen. \n\nDie DG-Wohnung befindet sich im ruhigen Seitenflügel bzw. im Quergebäude, so dass keine Flächen straßenseitig vorhanden sind. Alle Räume sind nach Fertigstellung lichtdurchflutet. Eine Klimaanlage sorgt für angenehme Raumtemperatur an heißen Tagen, die moderne Gasetagenheizung für wohlige Wärme im Winter. Alle Wohnräume werden mit hochwertigem Echtholz in einem warmen Braunton belegt.  Auf 10,58 m² Terrassenfläche kann eine kleine grüne Oase zum Entspannen entstehen. Die neuen Aufzüge bringen Sie bequem in Ihr neues schönes und besonderes Zuhause. \n\nDie Fläche im begrünten Innenhof wird gemäß Freianlagenkonzept gestaltet. Dort entstehen ein Kinderspielplatz sowie Müll- und Fahrradstellplätze. \n\nIm Erdgeschoss befinden sich Gewerbeeinheiten. Diese sind an eine Änderungsschneiderei und an einen Kostümverleih vermietet. Alle anderen Einheiten werden als Wohnraum genutzt. \nDas Objekt wurde um die Jahrhundertwende erbaut und ist ein typischer Altbau. Die Fassade und die Treppenhäuser befinden sich noch im ursprünglichen unsanierten Zustand. Die Fassade und die Hausflure erhalten nach Fertigstellung der Baumaßnahmen einen neuen Anstrich. \n\nDas Miethaus wurde nach dem Wohnungseigentumsgesetz in 25 Einheiten (23 Wohnungen, davon 4 Dachgeschosswohnungen und 2 Gewerbeeinheiten), aufgeteilt. \n\nWährend der Bauphase ist es möglich die Raumaufteilung und die Ausstattung zu beeinflussen, sofern die Bauteile noch nicht gestellt bzw. installiert sind. Sollte es baulich umsetzbar sein, werden die Wünsche des Käufers selbstverständlich berücksichtigt.', '- 5 Zimmer\n- Gasetagenheizung\n- Fußbodenheizung\n- Parkett in allen Räumen außer Bad\n- 2 geflieste Wannenbäder mit Dusche\n- 1 offene Wohnküche\n- Einbauküche mit Geräten\n- Klimaanlage (4 Klimageräte)\n- hofseitige Dachterrasse 10,58 m²\n- Abstellraum\n- Aufzug\n- Rauchwarnmelder', 'Das Gebäude liegt mitten im Herzen von Berlin im Szeneviertel mit viel Gastronomie und kleinen Geschäften in der Nähe. Hier pulsiert das Leben. Der Bezirk Friedrichshain ist im Wandel, er wird kontinuierlich erneuert und verschönert.  \n\nInnerhalb von einem ca. fünf bis zehn minütigem Fußweg ist der Volkspark Friedrichshain zu erreichen. Nach ca. 30 min. erreicht man ebenfalls fußläufig die Spree, die direkt hinter dem S-Bahnhof Warschauer Straße und der East-Side-Gallery liegt. Dort befindet sich die Mercedes-Benz Arena, diverse Veranstaltungen sorgen für kulturelle Erlebnisse. \n\nDie Tram-Haltestelle der M10 liegt direkt gegenüber des Wohn- und Geschäftsgebäudes. Andere Verkehrsverbindungen sind innerhalb von 5 - 10 Minuten (U-Bahnhof Frankfurter Tor) zu erreichen. \n\nDie Karl-Marx-Allee ist ebenfalls fußläufig erreichbar. Sie lädt zu einem Einkaufsbummel ein. Wer es lieber geballter mag, begibt sich ins ca. 2 km entfernte Ringcenter. In diesem Einkaufszentrum bieten ca. 100 Fachgeschäfte die unterschiedlichsten Waren an. \n\nAuf dem geräumigen Mittelsteifen der Petersburger Straße, stehen öffentliche Parkplätze zur Verfügung. Derzeit erfolgt noch keine Parkraumbewirtschaftung.', 'Sofern Sie Fragen haben oder einen Beratungstermin wünschen, freuen wir uns über Ihren Anruf oder eine E-Mail von Ihnen. \n\nGern kann das Objekt nach Terminvereinbarung besichtigt werden. \n\nACHTUNG: Da der Fußboden hergestellt wird, sind Besichtigungen aufgrund der Trocknungszeit zwischen 08.05.2020 und 08.06.2020 nicht möglich. \n\nWeitervermittlung über Makler nicht möglich. \n\nAlle Angaben beruhen auf Informationen Dritter, daher ist eine Haftung ausgeschlossen.'];;;323;2044;NO_INFORMATION;;;;
