2020-05-11 12:21:38.116699;Berlin;district_heating;;362872;y;y;https://pictures.immobilienscout24.de/listings/a0f94229-8d9d-4657-888c-eba300b5fd85-1361938912.jpg/ORIG/resize/118x118%3E/extent/118x118/format/jpg/quality/80;13;12.01;;;;2019;;;disabled;12.01;117095168;district_heating;n;true;;y;Berlin;n;10;9;no_information;;7.88;93.9;Berlin;10969;no_information;no_information;;false;;no_information;no_information;y;;;no_information;no_information;10969;3.5;;n;2,active;;Deutschland;schaufenster;;wohnung_kauf;n;5;;false;001.362872;816930;profile0;3;true;n;showqualicontactform;n;n;Kreuzberg_Kreuzberg;2446/3Zi;4;Berlin;/expose/117095168;"['Die erstklassig ausgestatte Wohnung aus der Feder des renommierten Architektenduos Gewers & Pudewill befindet sich im 5. Obergeschoss des Neubauprojekts ++NeuHouse++. Auf rund 94 qm Wohnfläche erstreckt sich ein komfortables Zuhause mit offenem Grundriss, lichtdurchflutetem Ambiente und modernem Charakter. \n\nMaximaler Wohnkomfort:\n- ideal für Singles & Paare\n- offener und großzügiger Wohn-/Ess-/Küchenbereich\n- Wannenbad mit Markenausstattung\n- große Fensterfronten\n- Barrierefreie Liftanbindung von der Tiefgarage in alle Etagen\nArchitektur und Ausstattung \n- außergewöhnliche Architektur\n- hochwertiger Bau- und Ausstattungsstandard\n- Designlinie Gewers Pudewill\n- Eichendielen \n- teilweise bodentiefe Fenster\n- Fußbodenheizung \n- Bäder mit Markenausstattung \n- Video-Gegensprechanlage\n- Sonnenschutz\n- Kellerraum\n- begrünter Innenhof mit Spielfläche\n- Kinderwagen- und Fahrradabstellräume \n- Tiefgaragenstellplatz (optional), Elektrostellplatz möglich\n\nZum Projekt ++NeuHouse++\nAußergewöhnliche Architektur mit komfortablem Wohngefühl: Das ist NeuHouse. Das Ensemble aus denkmalgeschütztem Alt- und modernem Neubau bietet eine Vielzahl unterschiedlicher Wohnungstypen mit ausreichend Platz zur Entfaltung: von ein bis fünf Zimmer über Terrassen- und Maisonettewohnungen bis hin zu Penthouses mit Ausblick über die Stadt. Ein modernes Refugium im Herzen der Hauptstadt. Energieausweis liegt noch nicht vor. Baufertigstellung ca. Frühjahr 2020. \n +++ www.neuhouse-berlin.de +++\n\nAufgrund des aktuellen Baufortschritts ist die Bemusterung der Wohnung bereits abgeschlossen.\n\n+++ Besichtigungstermine via Video-Chat +++\nAufgrund der aktuellen Situation bieten wir Ihnen Besichtigungstermine über einen Video-Chat mit Ihrem Immobilienberater an, welcher Sie durch die Immobilie führt und Ihnen bei allen Fragen beratend zur Seite steht.  Bei Rückfragen oder zur Vereinbarung eines individuellen Besichtigungstermins rufen Sie uns gerne an oder kontaktieren Sie uns per E-Mail.  \n', 'Inmitten des Kunst- und Kreativquartiers gelegen, trifft das Ensemble aus Baudenkmal und Neubau auf kulturelle Vielfalt und auf ein familienfreundliches Umfeld in der ""Südlichen Friedrichstadt"". Das zwischen dem Checkpoint Charlie, dem Jüdischem Museum und dem Mehringplatz gelegene Objekt befindet sich in einer verkehrsruhigen Lage mit Blick auf den Besselpark und vereint so urbanes Flair mit Ruhe und Geborgenheit. Die bekannte Friedrichstraße liegt nur 300m vom NeuHouse entfernt und bietet neben erlesenen Restaurants auch vielfältige Shoppingmöglichkeiten.\nÜber den U-Bahnhof Kochstraße sowie mit den Bussen 248 und M29 gelangt man schnell von A nach B und zu vielen weiteren Hotspots der Hauptstadt.']";;;;;6;;;;;58836;true
2020-05-11 12:21:38.457024;Berlin;central_heating;ONE_YEAR_FREE;17024945;n;n;https://pictures.immobilienscout24.de/listings/174d15a3-499d-44b9-94d8-1aede0e08ea7-1365727874.jpg/ORIG/resize/118x118%3E/extent/118x118/format/jpg/quality/80;5;14.43;40 MBit/s;telekom_layer_magenta_l;über VDSL;1974;;REGULAR;;14.43;117396042;oil;n;false;MagentaZuhause L;y;Berlin;n;5;3;no_information;energy_consumption;7.95;70;Berlin;13359;well_kept;no_information;D;false;100 MBit/s;no_information;no_information;n;https://padlock.link/ioml;https://padlock.link/ml;no_information;apartment;13359;3;103.4;n;2,active;true;Deutschland;top;100 MBit/s;wohnung_kauf;y;3;web,email,bank,music,dl-ul,game,sd,mltstr,hd,fast-ul-dl;true;009.41fe44a0-01b3-4062-8cf6-e75596b3d91d;230000;profile0;3;true;n;showqualicontactform;n;n;Wedding_Wedding;Ri20-064;3;Berlin;/expose/117396042;['DIESES OBJEKT IST EINE KAPITALANLAGE. DIE ANGEBOTENE WOHNUNG WIRD VERMIETET VERKAUFT.\n\n\n\nDie gut geschnittene 3 Zimmerwohnung befindet sich im dritten Obergeschoss eines  gepflegten Wohnhauses mit Fahrstuhl.\n\n\n\nDie Wohnung verfügt über einen Balkon mit Blick in den Innenhof mit Grünanlage und  ist seit 1978 an ein und den selben Mieter vermietet.\n\n\n\n\n\n\n\nWir freuen uns über Ihre Kontaktaufnahme. Für diese benötigen wir lediglich Ihren Namen und Ihre E-Mail Adresse. Alle weiteren Angaben erfolgen freiwillig, sind aber zur weiteren Bearbeitung und für eine eventuelle Besichtigung zwingend notwendig (Name, vollständige Adresse, Telefonnummer)..', 'Die Wohnung befindet sich im dritten Obergeschoss eines gut instand gehaltenen Wohnhauses mit 23 Wohneinheiten.\n\nSie betreten die Wohnung über einen geräumigen Flurbereich.\n\nVom Flur aus gelangen Sie in die Küche, ins Badezimmer und in die drei Zimmer. Alle Räume verfügen über große Fenster, die in den 90er Jahren erneuert wurden.\n\nDer helle Wohnraum bietet viel Platz und hat einen direkten Zugang zum Balkon mit  Blick in den grünen Innenhof.\n\nDas geflieste Badezimmer ist mit einer Badewanne ausgestattet und verfügt über ein Fenster.\n\nZur Wohnung gehört ein Kellerraum für zusätzlichen Stauplatz.\n\nDie Wohnung ist seit 1978 an einen solventen, älteren Herren vermietet.\n\nMietvertrag von 1978:\n- Nettokaltmiete derzeit 391,67-€\n- Bruttowarmmiete derzeit: 565,05€\n\nHausgeld: 307,-€\n\nDavon nicht umlegbar (inkl. Zuführung zur Rücklage): 133,-€\n\nAus Diskretionsgründen und Rücksicht auf den Mieter veröffentlichen wir keine Innen-Fotos  der Wohnung. Wir bitten um Ihr Verständnis.', 'Die Eigentumswohnung befindet sich im Herzen von Berlin-Wedding im ruhigen Teil vom Soldiner Kiez, ca. 900m von der Bornholmer Brücke.\n\n\n\nDie Wohnung ist sehr zentral gelegen. \n\n\n\n\nSie haben hier die bestmögliche Infrastruktur und erreichen alle Einkaufsmöglichkeiten des täglichen Bedarfs, Banken, Supermärkte, Apotheken, Ärzte, Restaurants und Cafes in nur wenigen Gehminuten. \nDiverse Schulen und Kitas befinden sich in unmittelbarer Umgebung.\n\n\n\nDie S-Bahn Linien S1, S2, S8, S25, S26, sowie die Trambahnen 50 und M13 oder die Buslinien 255 und M27 verfügen über optimale Verbindungen in das gesamte Stadtgebiet und ins Berliner Umland.\n\n\n\nNaherholung finden Sie im beliebten Mauerpark der zum ausgiebigen Spaziergang oder zum Joggen einlädt. \n\n\nDas Kindermuseum Labyrinth ist ebenfalls zu Fuß erreichbar. Das Schwimmbad an der Seestraße ist bequem mit der Tram zu erreichen.', 'Herzlich Willkommen bei ERA RIMO Immobilien in Berlin!\n\nIhre ERste Adresse, wenn Sie in Berlin Tempelhof-Schöneberg ein Haus oder eine Eigentumswohnung verkaufen oder kaufen möchten. Nutzen Sie unsere lokale Fachkompetenz, bankenunabhängige Finanzierungsberatung und profitieren Sie vom Know-how, das wir als Partner eines der größten Maklernetzwerke weltweit im Bereich der Immobilienvermarktung bieten können:\n- Es gibt 45  ERA Büros bundesweit, 5 in Berlin und 3000 weltweit\n- Sie erhalten von uns eine ServiceGarantie\n- Ihre Immobilie wird optimal präsentiert, um im Angebotswettbewerb konkurrenzfähig zu sein\n- Die zeitaufwändigen Besichtigungen werden von unseren geschulten Mitarbeitern für Sie \nübernommen\n- Die kostenintensive Werbung finanzieren wir für Sie\n- Die Bonität der Interessenten wird von uns geprüft\n- Wir erstellen Ihren Energieausweis\n- Sie erhalten eine laufende Berichterstattung\n- Wir achten auf Ihre Belange und Sicherheit rund um den Vertragsabschluss\n- Ihre Immobilie wird von uns von ihrer Schokoladenseite präsentiert\n- In unserer ERA Immobilienzeitschrift wird ihr Objekt überregional dargestellt\n- Wir bieten Ihnen eine ERA Garantie\nFür die fachlich versierte und marktkonforme Bewertung und den erfolgreichen Verkauf Ihrer Immobilien sind Sie bei uns in den besten Händen: Wir erstellen ein ERA Verkaufswertgutachten für Ihr Objekt, für Sie kostenlos und unverbindlich.\nRechtshinweis:\nAlle Informationen in diesem Exposé stammen vom Eigentümer und/oder Hausverwaltung oder sind offenkundig. Ihre Richtigkeit und Vollständigkeit wurde von uns nicht, allenfalls auf Plausibilität überprüft. Das Objekt wird- wie bei gebrauchten Immobilien üblich- im gegenwärtigen dem Käufer durch Besichtigung bekannten Zustand verkauft. (Gewährleistungsausschluss). Zwischenverkauf nicht ausgeschlossen.'];;307;;;;;;;;;
2020-05-11 12:21:38.779948;Berlin;central_heating;ONE_YEAR_FREE;5394580;n;y;https://pictures.immobilienscout24.de/listings/a219a6e9-b97f-4663-b509-3b89a0e711d9-1366639156.jpg/ORIG/resize/118x118%3E/extent/118x118/format/jpg/quality/80;13;10.87;40 MBit/s;telekom_layer_magenta_l;über VDSL;1954;;REGULAR;disabled;10.87;117385610;gas;n;false;MagentaZuhause L;n;Berlin;n;7;2;21A;energy_consumption;5.63;56.6;Berlin;12161;fully_renovated;no_information;F;false;100 MBit/s;no_information;"Wilhelmsh&ouml;her Str.";n;https://padlock.link/ioml;https://padlock.link/ml;Wilhelmshöher_Str.;apartment;12161;2;161.7;n;2,active;true;Deutschland;top;100 MBit/s;wohnung_kauf;n;3;web,email,bank,music,dl-ul,game,sd,mltstr,hd,fast-ul-dl;true;001.5394580;325000;profile0;2;true;n;showqualicontactform;n;n;Friedenau_Schöneberg;178715;2;Berlin;/expose/117385610;['Die attraktive, helle Wohnung befindet sich im 3. OG eines sehr ruhig gelegenen Mehrfamilienhauses und präsentiert sich mit guten, zeitgemäßen Ausstattungsstandards. Die 2-Zimmerwohnung verfügt über ein sonniges Wohnzimmer mit Südostbalkon, ein Schlafzimmer, eine Küche, ein Wannenbad mit Fenster, eine Diele mit Abstellraum und einen Kellerraum mit einer Gesamtwohnfläche von 56,60 m². Der Balkon ist direkt vom Wohnzimmer zugänglich und lädt zum erholsamen Verweilen ein. Die Wohnung ist im gesamten Wohnbereich mit Parkett ausgestattet und durch große, moderne im Jahr 2019 eingebauten Fenster und einen sehr guten Grundriss lichtdurchflutet und praktisch aufgeteilt.  Alle Räumlichkeiten sind getrennt und bequem vom Flur aus zu erreichen. Die Beheizung erfolgt über eine Zentralheizung. Die Wohnung ist in einem sehr gepflegten Zustand. Das freundliche und familiäre Umfeld sorgt für eine idyllische Wohnatmosphäre.', 'Balkon, Parkett\n\nBemerkungen:\nNeue IKEA-Einbauküche, neue moderne Fenster eingebaut im 2019, seit 2016 neue Elektroinstalation, Putzwände statt Tapete', 'Die Immobilie befindet sich im bürgerlichen und sehr begehrten Bezirk Schöneberg angrenzend zum Bezirk Steglitz, in einer gefragten Lage von Friedenau, in einer Seitenstraße zwischen Friedrich-Wilhelm-Platz und Südwestkorso. Der Ortsteil ist zentral gelegen und hauptsächlich von ruhigen Wohnstraßen, Stadtvillen sowie Miethäusern mit zahlreichen Straßenbäumen geprägt. Hier haben Sie die optimale Infrastruktur, die Einkaufsmöglichkeiten für den täglichen Bedarf und die Einrichtungen für die medizinische Versorgung sind fußläufig erreichbar. Vor Ort finden Sie Bäckereien, Supermärkte, Bioläden, Drogerien, Boutiquen, Banken, Schulen und Kitas. Sie wohnen hier unweit vom: Schiller-Platz (120m), Friedrich-Wilhelm-Platz(300m), Schloss Straße (800m), der Einkaufsmeile im Süden Berlins, sowie malerischen Rüdesheimer-Platz (700m). Dank der exzellenten Verkehrsanbindungen erreichen Sie in kurzer Zeit mit der U9 vom Friedrich-Wilhelm-Platz, mit U3 vom Rüdesheimer-Platz, oder mit S41, S42 und U9 vom Bundesplatz, der Buslinie 246 nicht nur das Zentrum, sondern auch die anderen Bezirke Berlins.\nInfrastruktur (im Umkreis von 5 km):\nApotheke, Lebensmittel-Discount, Allgemeinmediziner, Kindergarten, Grundschule, Hauptschule, Realschule, Gymnasium, Gesamtschule, Öffentliche Verkehrsmittel', 'Heizungsart: Zentralheizung\nEnergieträger: Gas\n\nDie Wohnung wird PROVISIONSFREI vom PRIVAT verkauft. \nMakleranfragen sind unerwünscht!\n\nMakleranfragen nicht erwünscht.'];;255;;;4;;;;;;
2020-05-11 12:21:39.399323;Berlin;central_heating;ONE_YEAR_FREE;17089495;n;y;https://pictures.immobilienscout24.de/listings/811564a9-d788-40a0-be29-e80a2b1933e2-1363672893.jpg/ORIG/resize/118x118%3E/extent/118x118/format/jpg/quality/80;12;11.73;40 MBit/s;telekom_layer_magenta_l;über VDSL;1931;;REGULAR;disabled;11.73;117403702;no_information;n;true;MagentaZuhause L;y;Berlin;y;5;1;no_information;;5.75;66.28;Berlin;12169;need_of_renovation;no_information;;false;100 MBit/s;no_information;no_information;n;https://padlock.link/ioml;https://padlock.link/ml;no_information;ground_floor;12169;3;;n;2,active;true;Deutschland;premium;100 MBit/s;wohnung_kauf;n;;web,email,bank,music,dl-ul,game,sd,mltstr,hd,fast-ul-dl;true;002.01007866969;239000;profile0;3;true;n;showqualicontactform;n;n;Steglitz_Steglitz;04663;3;Berlin;/expose/117403702;"['Diese schöne 3-Zimmer-Wohnung liegt im Hochparterre eines ca. 1931 fertig gestellten Mehrfamilienhauses. Das Haus ist Teil der ""ersten rauchlosen Siedlung"" in Berlin-Steglitz, die aufgrund ihres sehr gelungenen Architekturkonzepts heute unter Denkmalschutz steht. \r\n\r\nDie Wohnung verfügt über ein großzügiges Wohnzimmer mit Zugang zu einem charmanten Balkon sowie zwei weitere, sehr gut geschnittene Zimmer, die sich ideal als Schlaf- bzw. Kinderzimmer eignen. Weiterhin bietet die Wohnung ein tagesbelichtetes Wannenbad und eine großzügige Küche. Alle Räume der Wohnung sind durch einen geräumigen Flur verbunden und wunderbar hell.\r\n\r\nInsgesamt lässt sich der Zustand der Wohnung als renovierungsbedürftig bezeichnen. Das aktuelle Wohngeld beläuft sich auf monatlich 261,00 € wovon ca. 43,96 € auf die Instandhaltungsrücklage entfallen.', '+ Hochparterre \r\n+ erste ""rauchlose Siedlung"" aus den 1930er Jahren\r\n+ 3 Zimmer verteilt auf 66,28 m² \r\n+ gelegen in einer Sackgasse\r\n+ Wohnzimmer mit angrenzendem Balkon \r\n+ zugehöriger, großer Kellerraum', 'Das Objekt liegt im Süden Berlins im Bezirk Steglitz–Zehlendorf (ca. 308.697 Einwohner) im Ortsteil Steglitz.\r\n\r\nGeschäfte des täglichen Bedarfs sowie Gastronomieeinrichtungen befinden sich in fußläufiger Entfernung. Die beliebte Einkaufsmeile Schloßstraße ist mit weiteren zahlreichen Geschäften nur 1,5 km entfernt.\r\n\r\nDer S-Bahnhof Südende (S25 und S26) und diverse Buslinien sind in wenigen Minuten fußläufig erreichbar. Über die Berliner Stadtautobahn erreichen Sie mit dem Auto bequem die Berliner Mitte sowie den äußeren Berliner Ring.\r\n\r\nDer Stadtteil verfügt mit diversen Grün- und Sportflächen sowie dem Volkspark über vielfältige Freizeitmöglichkeiten.\r\n\r\nSchulen, Kindertagesstätten und ärztliche Versorgung sind im näheren Umfeld vorhanden.', 'Bitte haben Sie Verständnis dafür, dass wir Ihre Anfrage nur in schriftlicher Form (bevorzugt per E-Mail) unter Angabe des vollständigen Namens und Ihrer Adresse, bearbeiten können.\n\nEine Besichtigung ist nach vorheriger Absprache mit uns möglich.\n\nFinanzierung: Gerne sind wir bei der Finanzierung dieses Objektes behilflich.\n\nHinweis: Die Angaben zum Objekt erfolgen auf Basis der Information der Verkäufer. Eine Gewähr für die Vollständigkeit und Richtigkeit der Angaben kann nicht übernommen werden.\n\nDas Exposé ist nicht für Dritte bestimmt!\n\nWeitere aktuelle Immobilienangebote finden Sie unter www.bsk-immobilien.de\r\nVERBRAUCHERINFO\r\n1. Maklerleistung ist der Nachweis der Gelegenheit zum Abschluss eines Vertrages bzw. Vermittlung eines Vertrages über eine Immobilie gegen die Courtagezahlungspflicht des Kunden\r\n2. Unternehmer,Anschrift,Beschwerdeadressat\r\nLBSi NordWest,Himmelreichallee 40,48149 Münster,Tel:0251/4124774,Fax:0251/4124799,eMail:info@lbsi-nordwest.de\r\nGF:Roland Hustert,Helmut Steinkamp\r\n3. Es besteht ein Widerrufsrecht\r\n4. Weitere Infos: verbraucherinfo.lbsi-nordwest.de']";;261;;;4;true;;;;;
2020-05-11 12:21:39.713275;Berlin;district_heating;ONE_YEAR_FREE;18272766;n;n;https://pictures.immobilienscout24.de/listings/5b3eb3fb-a7fb-4f66-94de-88cd21b92ef1-1363653618.jpg/ORIG/resize/118x118%3E/extent/118x118/format/jpg/quality/80;9;14.43;40 MBit/s;telekom_layer_magenta_l;über VDSL;1918;;REGULAR;;14.43;117399633;district_heating;y;true;MagentaZuhause L;y;Berlin;n;9;1;no_information;energy_consumption;7.95;120;Berlin;13353;no_information;no_information;C;false;100 MBit/s;no_information;no_information;n;https://padlock.link/ioml;https://padlock.link/ml;no_information;loft;13353;2;81.3;n;2,active;true;Deutschland;standard;100 MBit/s;wohnung_kauf;n;;web,email,bank,music,dl-ul,game,sd,mltstr,hd,fast-ul-dl;true;002.01009082072;630000;profile0;2;true;n;showqualicontactform;n;n;Wedding_Wedding;KBN1939;5;Berlin;/expose/117399633;"['360°Rundgang möglich!!!\n\nBeeindruckend und äußerst exklusiv ist die passende Bezeichnung für das liebevoll mit Naturmaterialien gestaltete Künstlerloft. Insbesondere Individualisten, Kreative oder Freiberufler können sich auf 120 m² Licht durchfluteter Fläche verwirklichen. Über das Hof-Areal erlangt man Zutritt auf das in der ersten Etage gelegene Wohn oder Arbeitsrefugium.  \nDer gusseiserne Treppenlauf sowie die massiv gemauerte Treppe lassen die Handwerkskunst der im Jahr 1906 errichteten Gewerbeimmobilie erahnen. Der Eintritt in das im Jahr 2012 fertiggestellte Loft erfolgt über die maximal gesicherte Hauseingangstür.\nDie außergewöhnliche Wärme und trotz der Raumgröße gemütliche und einladende Atmosphäre des Lofts entsteht durch die massive Landhaus Eichendiele und den Pastell farbigen raffiniert abgestuften Lehm-anstrich.\nFür besonders angenehme Lichtverhältnisse sorgen die bodentiefen doppelverglasten mit Tages- und Abendjalousien versehenen Fenster. Die im Dach eingelassenen elektrisch einstellbaren Oberlichter sowie die in der Decke eingelassenen Lichtspots bieten optimale Lichtachsen in diesem Liebhaberobjekt.\nDas großzügige Raumgefühl wird durch die angepasste Deckenhöhe des leicht geneigten Flachdaches von 2,60m auf 3,16m im Wohnbereich ausgelöst. Diese ungewöhnliche Immobilie erlaubt modernen Life Style durch den ineinander übergehenden Wohn- Essbereich. Gesundes, zeitgemäßes Kochen wird gewährleistet durch einen Miele Dampfgarer, sowie die Kühl- Gefrierkombination mit zwei biofresh Fächern.\nEin intimeres Raumgefühl lässt sich durch das Schließen der Schiebetür, die Wohn- und Schlafbereich trennt, erwirken. Ins Auge fällt die Farbharmonie des Schlafbereichs, die durch den Naturputz in zartem Mauve im Zusammenspiel mit den hellen Einbauelementen entsteht.\nRaffiniert wird hier Wohngefühl erhalten, indem der Boden mit einer Holz imitierenden Fliese belegt wurde. Die begehbare Walk-in Dusche, mit nur acht edlen Fliesen versehen, schmälert in nichts die Größe des Bades, da sie nur durch eine Glasscheibe abgetrennt ist.\nGanz frech und im Kontrast zum Rest erstrahlt das Gäste WC mit Dusche in pink-rot im Pop Art Stil.\nAls Marktexperten empfehlen wir bei dieser einzigartigen Liegenschaft besondere Aufmerksamkeit, da diese Immobilie in Ihrer Gesamtstruktur aus Lage, Wohnfläche und Qualität in einem außergewöhnlich guten Preis-Leistungsverhältnis steht.\nUm einen persönlichen Besichtigungstermin zu vereinbaren, steht Ihnen das KENSINGTON Team Berlin Nord gerne persönlich zur Verfügung.', 'AUSSTATTUNGSDETAILS:\n\n- ca. 2,60m bis 3,16m lichtdurchflutete Raumhöhe\n- große Fensterflächen mit Tages- und Abendjalousien\n- Wohnbereich / Eichendielen \n- Einbauküche u.a. mit Miele Einbaugeräten\n- Klimaanlage in d. Küche\n- Badewanne und extra Dusche\n- Gäste WC / Dusche\n- Sicherung / Wohn-Eingangstür\n- Kellerabteil\n- Hausgeld mtl. 352€\n- Fernwärme\n- Gewerbliche Nutzung z.Zt. noch möglich\n- KFZ Stellplatz Übernahme möglich', 'Laut „Time Out“-Magazin\nBerliner Wedding auf Platz 4 der coolsten Stadtteile der Welt!\n\nDer ""Multikulti-Ortsteil"" Wedding ist bekannt für seine kulturelle Vielfalt und gehört zu dem Bezirk Mitte. Wer den Wedding besucht oder gar hier wohnt, erlebt ein ursprüngliches Berlin. Der Stadtteil verfügt über besonders viel Grün und hat damit einen hohen Erholungswert. Aber nicht nur die Parks locken immer mehr Menschen in den ehemaligen Arbeiterbezirk, auch die kreative Kunstszene hat sich zu einem Anziehungspunkt entwickelt. Die Authentizität wird durch den Charme des gewachsenen und lebendigen Wohnviertels, in dem man urige Berliner Eckkneipen als auch angesagte Cafés findet gewahrt. Bei aller Beständigkeit ist hier ein deutlicher Wandel spürbar, der alte Strukturen reizvoll ergänzt, statt sie zu zerstören. Es ist ein aufstrebender, lebendiger Teil der Stadt, der immer mehr Menschen anzieht.\nIn einer kleinen Seitenstraße zur Seestraße im Brüsseler Kiez oder dem sogenannten Belgischen Viertel befindet sich die ehemalige Gewerbeeinheit mit dem im Hof eingebetteten Loft. \nDie unzähligen Gastronomischen Einrichtungen und sehr beliebten Cafés bieten den Anwohnern eine enorme Bandbreite im kulinarischen Sinne. Einrichtungen des täglichen Bedarfs, wie Schulen, Kindergärten, Fitnesscenter, Banken und Arztpraxen sind direkt in der unmittelbaren Müllerstraße erreichbar.\nDie Anbindung des öffentlichen Nahverkehrs regelt die U-Bahnstation Seestraße der Linie U6, sowie die Buslinien 106, 120, N6, N20 und N26. Alternativ stehen die Tramlinien 50 und M13 zur Verfügung. Mit dem Auto gelangt man innerhalb weniger Minuten auf die A100.\n\nSehenswürdigkeiten\n\nKurfürstendamm, weltberühmter Boulevard der Stadt 12 km / 20 min\nFriedrichstraße, Shoppingmeile mit Revuetheater            5 km  / 15 min\nBrandenburger Tor, Symbol der Hauptstadt          7 km  / 20 min\nMuseumsinsel          6 km\nGendarmenmarkt  8 km\nPotsdamer Platz  6 km\nKaDeWe          7 km\n\nVerkehrsanbindungen\n\nHauptbahnhof Europaplatz          4 km / 12 min\nFlughafen BER         33 km / 40 min\nFlughafen TXL           5 km / 13 min', 'Unsere Angebote sind freibleibend und unverbindlich. Die Angaben basieren auf Aussagen des Verkäufers. Irrtum sowie Zwischenverkauf bleiben ausdrücklich vorbehalten. Der Makler-Vertrag mit uns und/oder unserem Beauftragten kommt durch schriftliche Vereinbarung oder durch die Inanspruchnahme unserer Maklertätigkeit auf der Basis des Objekt-Exposés und seiner Bedingungen zustande. Die Käufercourtage in Höhe von 7,14%  auf den Kaufpreis, einschließlich gesetzlicher Mehrwertsteuer, ist mit wirksamen notariellem Kaufvertrag verdient und fällig.\nWir bitten um Verständnis, dass wir Detailinformationen nur liefern, sofern Sie uns Ihre kompletten Adress- und Kontaktdaten übermittelt haben.\nWeitere interessante Objekte finden Sie auf unserer Firmenhomepage: www.kensington-berlin.com sowie auf www.kensington-international.com\nEigentümern bieten wir eine kostenlose Einwertung Ihrer Immobilie an.']";;352;;;;;;;;;
