2020-05-11 12:32:31.128653;Berlin;central_heating;ONE_YEAR_FREE;15741874;n;y;https://pictures.immobilienscout24.de/listings/b9efe85f-640f-4129-8507-80432b61df32-1357504121.jpg/ORIG/resize/118x118%3E/extent/118x118/format/jpg/quality/80;20;11.48;40 MBit/s;telekom_layer_magenta_l;über VDSL;1900;REGULAR;11.48;116324466;gas;n;true;MagentaZuhause L;y;Berlin;n;8;1;255.48;no_information;energy_consumption;7.14;94.34;Berlin;10243;well_kept;normal;C;false;100 MBit/s;no_information;no_information;n;https://padlock.link/ioml;https://padlock.link/ml;no_information;apartment;10243;3;95.09;n;2,active;true;Deutschland;top;100 MBit/s;wohnung_kauf;y;4;web,email,bank,music,dl-ul,game,sd,mltstr,hd,fast-ul-dl;true;002.01002949789;415096;profile0;6;3;true;n;showqualicontactform;n;n;Friedrichshain_Friedrichshain;6603#MPKbf4;4;Berlin;/expose/116324466;['Bei dem hier präsentierten Objekt in der Warschauer Straße 10 handelt es sich um einen klassischen Altbau aus der Gründerzeit im beliebten Szenebezirk Berlin-Friedrichshain unweit des Frankfurter Tors und Boxhagener Platzes.\n\nDas um 1900 erbaute und über die Jahre liebevoll instandgehaltene Mehrfamilienhaus verfügt auf insgesamt 6 Etagen über 2 Gewerbe- und 11 Wohneinheiten, von denen eine Vielzahl der zur Straße gewandten Einheiten über Balkone mit Blick auf die Warschauer Straße verfügen. Das Dachgeschoss wurde bereits vor einigen Jahren zu Wohnzwecken ausgebaut, ein Fahrstuhl ist nicht vorhanden. Das Objekt ist mit einer Gas-Zentralheizung ausgestattet.\n\nDie Fassade des Mehrfamilienhauses sowie das gesamte Gemeinschaftseigentum werden im Laufe des Frühjahrs noch umfassenden Sanierungsarbeiten unterzogen. Im Hinterhof des Objektes entsteht zudem ein repräsentativer Neubau sowie eine Begrünung der Hoffläche welche dem Projekt den letzten Schliff verleihen. So spannen wir einen nahtlosen Bogen zwischen klassischem Altbauflair und zeitgenössischer Architektur angepasst an die Bedürfnisse des modernen Lebens. Die ersten Arbeiten hierzu sind in vollem Gange.\n\nDirekt an der Verbindungsstraße der angrenzenden Bezirke Prenzlauer Berg im Nordwesten und Kreuzberg im Südwesten gelegen, könnte das hier präsentierte Objekt nicht zentraler sein und bietet eine willkommene Mischung aus Ruhe vom stressigen Alltag und Nähe zum Trubel der Großstadt.\n\n---\n\nThe object presented here at Warschauer Straße 10 is a classic old building from the Wilhelminian period in the popular trendy district of Berlin-Friedrichshain near the Frankfurt Gate and Boxhagener Platz.\n\nThe multi-family house, built around 1900 and lovingly maintained over the years, has a total of 6 commercial and 11 residential units on 6 floors, of which a large number of the units facing the street have balconies with a view of Warschauer Strasse. The attic was expanded a few years ago for residential purposes, there is no elevator. The property is equipped with gas central heating.\n\nThe facade of the apartment building and the entire community property will undergo extensive renovation work in the spring. In the back yard of the property there is also a representative new building and a green area of the courtyard which give the project the finishing touch. In this way we span a seamless arc between classic old building flair and contemporary architecture adapted to the needs of modern life. The first work on this is in full swing.\n\nLocated directly on the connecting road between the neighboring districts of Prenzlauer Berg in the northwest and Kreuzberg in the southwest, the property presented here could not be more central and offers a welcome mix of tranquility from everyday stress and closeness to the hustle and bustle of the big city.', 'Wohnfläche: 94,34m2\nKaufpreis: 415.096,00 €\nHausgeld: 255,48 €\nNKM: 450,00 €\nLage: 2. OG links\nEtagenzahl gesamt: 6\nStatus: aktuell vermietet\nZimmer: 3\nBalkon: 2 Balkone\nEinbauküche: nein\nKeller: ja\nBodenbelag: originaler Dielenboden\nFenster: Kunststofffenster\nTüren: Holztüren\nDeckenhöhe: 3,20 Meter\nFahrstuhl: nein\nHeizung: Zentralheizung (Gas)\nEnergieausweis: consumption pass\nEnergiekennwert: 95,09 kWh/ (m².a) inkl. Warmwasser/Heizung\n\n---\n\nLiving area: 94,34 m2\nPurchase price: € 415.096,00\nHouse money: ca. € 255,48\nNet rent: € 450,00\nLocation: 2nd floor left\nStoreys: 6\nStatus: tenanted\nRooms: 3\nBalcony: 2 balconies\nFitted kitchen: no\nBasement: yes\nFlooring: original wooden floorboards\nWindows: plastic windows\nDoors: wooden doors\nCeiling height: 3,20 meters\nElevator: no\nHeating: central heating (gas)\nEnergy certificate: consumption pass\nEnergy performance: 95,09 kWh/ (m².a) incl. warm water/heating', 'Die Warschauer Straße im allseits beliebten und sehr dynamischen Bezirk Berlin-Friedrichshain ist eine der Hauptschlagadern im Osten der Hauptstadt und begeistert durch ein abwechslungsreiches Angebot an unzähligen Restaurants, Szenekneipen und kleineren Geschäften.\n\nDas nähere Umfeld des Objekts bietet die perfekte Möglichkeit für ausgelassene Sommerabende oder spontane Einkaufsbummel. Auch der regelmäßig stattfindende Wochen- und Flohmarkt am nahegelegenen Boxhagener Platz, dem insgeheimen Zentrum des Viertels, begeistert an den Wochenenden die Bewohner des Kiezes und hält neben stets frischen Lebensmitteln der Region auch immer die ein oder andere Überraschung bereit. \n\nAuch für das perfekte Familienglück bietet die Warschauer Straße und der Kiez rund um den Boxhagener Platz den perfekten Schaffensort. Unzählige Kindertagesstätten, Grundschulen, Oberschulen und Gymnasien befinden sich in unmittelbarer Umgebung des Objekts und auch Läden zur Deckung des täglichen Bedarfs wie Supermärkte, Drogerien oder Einkaufszentren sind stets nur einen Schritt weit Ihres neuen Zuhauses entfernt.\nMit der perfekten Anbindung an den öffentlichen Personennahverkehr könnte das hier angebotene Objekt nicht idealer gelegen sein. Zusätzlich zu der Bundesstraße B96a verkehren direkt vor der Haustür die Tram M10, mehrere Busse als auch die U-Bahnlinie U5, welche innerhalb von 3 Minuten fußläufig zu erreichen ist und im 5-Minuten-Takt zwischen dem Alexanderplatz und Hönow, bzw. dem Tierpark Berlin pendelt.\n\n---\n\nWarschauer Straße in the popular and very dynamic district of Berlin-Friedrichshain is one of the main arteries in the east of the capital and inspires with a varied range of restaurants, trendy bars and smaller shops.\n\nThe closer surroundings of the property offer the perfect opportunity for exuberant summer evenings or spontaneous shopping trips. The regular weekly and flea market at nearby Boxhagener Platz, the secret center of the district, delights the residents of the neighborhood on weekends and always has one or two surprises in store in addition to fresh local food.\n\nWarschauer Straße and the Kiez around Boxhagener Platz also offer the perfect place for creating perfect family happiness. Countless daycare centers, elementary schools, high schools and high schools are in the immediate vicinity of the property and also shops for daily needs such as supermarkets, drugstores or shopping centers are always just a step away from your new home.\n\nWith the perfect connection to local public transport, the property offered here could not be more ideally located. In addition to the B96a federal road, the M10 tram, several buses and the U5 subway line run right outside the front door, which can be reached on foot in 3 minutes and every 5 minutes between Alexanderplatz and Hönow, or the zoo Berlin commutes.', 'ACHTUNG: Die hier angebotene Wohnung ist aktuell vermietet. Eine Eigenbedarfskündigung (§ 577a Abs. 1 BGB) durch den neuen Erwerber und damit Vermieter darf frühestens nach zehn Jahren erfolgen. Nähere Regelungen sind im Gesetzestext nachzulesen.\n\nATTENTION: The apartment offered here is currently rented. The new purchaser and thus the landlord may terminate their own requirements (Section 577a (1) BGB) after ten years at the earliest. More detailed regulations can be found in the legal text.\n\n---\n\nHINWEIS: Leider liegen uns von der hier angebotenen Wohnung keine Bilder vor. Der Mieter hat sich gewünscht von der Veröffentlichung von Bildern Abstand zu nehmen. Diesen Wunsch respektieren wir gerne. Die Wohnung ist in liebevoll gepflegtem Zustand, eine Besichtigung lohnt sich!\n\nREMARK: Unfortunately, we do not possess images of the unit offered here. The tenant wished to step back from the publication of pictures and we gladly respect his wish. The apartment is very well maintained and meets all quality standards of the present time. A viewing is worth it!\n\n---\n\nBESICHTIGUNG: Für ein persönliches Gespräch und zur individuellen Abstimmung eines Besichtigungstermins stehen wir Ihnen gerne unter 030 27581533 persönlich zur Verfügung.\n\nVIEWING: For a personal viewing and to individually coordinate an appointment, we are happy to assist you at 030 27581533.'];;;;;;;;;;
2020-05-11 12:32:31.475733;Berlin;;ONE_YEAR_FREE;13057385;n;n;https://pictures.immobilienscout24.de/listings/ed5e8557-a487-4eeb-adcb-8dc423d8706b-1356685254.jpg/ORIG/resize/118x118%3E/extent/118x118/format/jpg/quality/80;12;12.41;40 MBit/s;telekom_layer_magenta_l;über VDSL;1928;REGULAR;12.41;116327192;no_information;n;false;MagentaZuhause L;y;Berlin;n;5;1;192;64;no_information;6.33;70.27;Berlin;12103;no_information;no_information;;false;100 MBit/s;no_information;"Borussiastra&szlig;e";n;https://padlock.link/ioml;https://padlock.link/ml;Borussiastraße;apartment;12103;2.5;;n;2,active;true;Deutschland;top;100 MBit/s;wohnung_kauf;n;2;web,email,bank,music,dl-ul,game,sd,mltstr,hd,fast-ul-dl;true;001.13057385;220000;profile0;;2;true;n;showqualicontactform;n;n;Tempelhof_Tempelhof;9249;3;Berlin;/expose/116327192;"['Die helle Altbauwohnung liegt im 2.OG  des Quergebäudes eines um 1928 errichteten Altbaus. \n\nDie ca.70,27 m² Wohnfläche verteilen sich auf  2,5 Zimmer, Küche, Bad, Flur, Abstellkammer und Balkon. Die Zimmer sind vom Flur aus begehbar. In den Zimmern befinden sich Dielenböde, welche im Zusammenspiel mit den hohen Decken und den Kassettentüren den Charme längst vergangener Zeiten  ausstrahlt. Vom Wohnzimmer erreicht man den Süd-Balkon. Dieser ist zur Straßenfront ausgerichtet.   Das Schlafzimmer ist nach Norden ausgerichtet. Das kleine und schmale Badezimmer ist mit einer Dusche und einem Fenster ausgestattet.  In der Küche ist genug Platz für einen kleinen Küchentisch. Auch eine Speisekammer befindet sich in der Küche, direkt neben dem Badezimmer .\n\nDie Wohnung ist seit dem  01.02.2008 vermietet.\n\nDas Mehrfamilienhaus ist seit 2001 in Wohnungseigentum aufgeteilt. \n\nDie Kaltmiete beträgt  428,65 Euro\nNebenkosten  103,00 Euro\nWarmmiete:  531,65 Euro\n\nDas Wohngeld beträgt: 192,00  Euro monatlich. \n\nDie Instandhaltungsrücklage betrug zum 31.12.2019 24.663,98 Euro.\n', '- 2,5 Zimmer\n\n- Balkon\n\n- zuverlässiger langjähriger Mieter\n\n- Dielenboden\n\n- gepflegtes Gemeinschaftseigentum', 'In dem gepflegten Wohnviertel in Tempelhof wohnen Sie unweit des quirligen großstädtischen Geschehens in erholsamer Ruhe. \nDie mit altem Baumbestand begrünten Anwohnerstraßen prägen meist imposante Mehrfamilienhäuser aus dem frühen 20. Jahrhundert. \nEin Naherholungsgebiet liegt mit dem Bose-, Francke-, Lehne- sowie Alter Park in direkter Nachbarschaft und lädt zu ausgiebigen Spaziergängen ein.\nAm nahen Tempelhofer Damm befinden sich zahlreiche Geschäfte für den täglichen und sonstigen Bedarf. Karstadt, Fielmann, die Post, ein Fotoshop, Friseure u.v.m. finden sie entlang des T-Damms. Der Tempelhofer Hafen befindet sich nur eine U-Bahnstation entfernt. In diesem Shopping-Zentrum haben sich viele bekannte Modegeschäfte (H&M, C&A, etc.) niedergelassen. Auch ein Media-Markt sowie ein großes Edeka-Center haben dort die Türen geöffnet.\nIn fußläufiger Entfernung haben Sie einen Lidl, Netto, Kaiser\'s und Penny vor Ort. Verschiedene Möbelhäuser (Ikea, Möbel Kraft) sind in wenigen Autominuten erreichbar.\nDie Anbindung an den öffentlichen Nahverkehr wird durch die nahe gelegene U-Bahnstation (Linie 6) „Alt Tempelhof“ und die Ringbahn Tempelhof gewährleistet. Durch diese gelangen Sie schnell ins Stadtzentrum oder in den Süden der Stadt. Durch die zahlreichen Buslinien auf dem Tempelhofer Damm erhalten Sie weitere Anbindungspunkte u.a. zum großen Bahnhof ""Südkreuz"".\nMit dem Auto sind Sie durch die B96 optimal Richtung Norden und Süden Berlins angebunden. In wenigen Minuten befinden Sie sich im Stadtzentrum oder am Stadtrand-ganz wonach Ihnen ist. Durch die nahe Auffahrt auf die Stadtautobahn 100 erreichen Sie weite Teile der Stadt und den Flughafen Schönefeld.', 'Liebe Kunden, unser Immobilienbüro erreichen Sie wie folgt:\nMontag bis Freitag von 10 bis 18 Uhr unter Tel.: 030 89 40 89 87\nGerne vereinbaren wir einen Besichtigungstermin mit Ihnen und stehen für Fragen zur Verfügung.\n\nWeitere Immobilienangebote finden Sie unter:\nwww.goldschwarz.de\n\nDie Informationen zu unseren Immobilienangeboten erhalten wir vom Eigentümer bzw. den in den Inseraten genannten Stellen. Für deren Richtigkeit übernehmen wir keine Haftung.Sämtliche Angebote sind freibleibend, ein Zwischenverkauf bleibt vorbehalten. Verbindliche Zusagen bedürfen zu ihrer Wirksamkeit der Schriftform.']";;;;;;;;;;
2020-05-11 12:32:31.912694;Berlin;central_heating;ONE_YEAR_FREE;634094;n;y;https://pictures.immobilienscout24.de/listings/d7a84dbf-dc91-4d8d-8457-b6837c623872-1355187615.jpg/ORIG/resize/118x118%3E/extent/118x118/format/jpg/quality/80;8;10.64;40 MBit/s;telekom_layer_magenta_l;über VDSL;1902;REGULAR;10.64;116322850;gas;n;false;MagentaZuhause L;y;Berlin;y;9;1;;no_information;energy_required;6.15;105.4;Berlin;13088;first_time_use_after_refurbishment;sophisticated;;false;100 MBit/s;underground_garage;no_information;y;https://padlock.link/ioml;https://padlock.link/ml;no_information;apartment;13088;4;76.9;n;2,active;true;Deutschland;standard;100 MBit/s;wohnung_kauf;n;3;web,email,bank,music,dl-ul,game,sd,mltstr,hd,fast-ul-dl;true;001.634094;532775;profile0;5;4;true;y;showqualicontactform;n;n;Weißensee_Weißensee;MM-1653688;5;Berlin;/expose/116322850;"['Kernsanierung eines Gründerzeitaltbaus von 1902 auf der Berliner Allee sowie Errichtung eines Neubaus im begrünten Innenhof.\n\nLichtdurchflutete Eigentumswohnungen in Berlin-Weißensee ab SOFORT zu VERKAUFEN.\n\nDie Treppenaufgänge, die Fassade sowie der Hof des Mehrfamilienhauses werden umfassend saniert, geplante Fertigstellung ist Frühling 2020.\n\nInsgesamt entstehen 19 Eigentumswohnungen mit flexiblen und offenen Grundrissen, wovon bereits 13 Einheiten verkauft wurden.\n\nBalkone, Terrassen sowie Gärten sorgen für viel Licht und Luft und schaffen ein angenehmes und entspanntes Wohngefühl.\n\nDer Innenhof wird im Zuge der Sanierung neu begrünt und verfügt über einen Spielplatz für die Hausgemeinschaft.', ""Helle 4-Zi-Altbau-Wohnung mit ca. 105 m². Die Wohnung besteht aus vier Räumen, einem großen Wohn-Essbereich, drei Schlafzimmern, drei Bädern, einer Abstellkammer und einem großen Balkon.\n\nAlle Wohnungen werden geschmackvoll und mit hochwertigen Materialien ausgestattet. \n\nDie Einheiten sind entweder mit Parkett oder wunderschönen Altbaudielen ausgelegt.\n\nBäder sowie WC's werden stilvoll gefliest und können individuell gestaltet werden.\n\nWand und Deckenflächen werden gespachtelt und weiss gestrichen, auch hier können Sie auf Wunsch ihr Farbkonzept einbringen.\n\nIn jedem Zimmer sind ausreichend Steckdosen geplant, diese werden gern nach Ihrem Wunsch eingebunden.\n\nAlle Wohnräume verfügen über einen TV-Anschluss.\n\nDer Küchen sind offen gestaltet und in den Wohnbereich integriert.\n\nIndividuelle Wünsche sowie Sonderaustattungen sind während der Bauphase selbstverständlich möglich. \n\nAlle Wohnungen werden bequem mit dem Aufzug erreichbar sein und verfügen über einen oder mehrere Tiefgaragenstellplätze. Ein Tiefgaragenstellplatz ist für 39.000 € erwerbbar.\n\nDie Vermittlung erfolgt EXKLUSIV sowie provisionspflichitg für den Käufer über Lion Immobilien GmbH\n\nwww.lion-immobilien.de\noffice@lion-immobilien.de\n\nTel. 030 - 20 23 81 18"", 'Die Anbindung an das öffentliche Nahverkehrsnetz ist gegeben.\n\nDer Weisse See ist nur wenige Gehminuten entfernt.\n\nIm Umfeld befinden sich u.a. eine Vielzahl an gastronomischen Einrichtungen sowie Einkaufsmöglichkeiten des täglichen Bedarfs.', 'verfügbare Einheiten:\n\n- WE 01 mit ca. 107 m² - 3 Zimmer - 539.000 €\n- WE 03 mit ca.   85 m² - 3 Zimmer - 466.000 €\n- WE 04 mit ca. 111 m² - 4 Zimmer - 621.000 €\n- WE 14 mit ca. 105 m² - 3 Zimmer - 532.000 €\n- WE 17 mit ca. 104 m² - 3 Zimmer - 599.000 €\n- WE 18 mit ca. 144 m² - 5 Zimmer - 756.000 €']";;;;3;;;1;;;107
2020-05-11 12:32:32.225197;Berlin;central_heating;ONE_YEAR_FREE;433573;n;y;https://pictures.immobilienscout24.de/listings/de5e63cc-a837-4d82-9b8b-728943c9e0ab-1365676170.jpg/ORIG/resize/118x118%3E/extent/118x118/format/jpg/quality/80;11;10.99;40 MBit/s;telekom_layer_magenta_l;über VDSL;1911;REGULAR;10.99;116323945;gas;y;true;MagentaZuhause L;y;Berlin;n;6;1;;no_information;energy_consumption;5.59;84.57;Berlin;13595;well_kept;no_information;D;false;100 MBit/s;no_information;no_information;n;https://padlock.link/ioml;https://padlock.link/ml;no_information;roof_storey;13595;3;109;n;2,active;true;Deutschland;top;100 MBit/s;wohnung_kauf;y;;web,email,bank,music,dl-ul,game,sd,mltstr,hd,fast-ul-dl;true;001.433573;269000;profile0;4;3;true;n;showqualicontactform;n;n;Spandau_Spandau;150/1116;4;Berlin;/expose/116323945;"['Bei dem zum Verkauf stehenden Objekt handelt es sich um eine vermietete 3-Zimmer-Dachgeschosswohnung. Die Wohnung befindet sich in einem viergeschossigen Mehrfamilienhaus, das ca. 1911 errichtet wurde. Das Haus besteht aus einem Vorderhaus und einem Seitenflügel, die über original erhaltene Stilelemente verfügen. Die Dachgeschosswohnung wurde im Rahmen der Haussanierung 1991 fertig gestellt und bietet auf einer Wohnfläche von ca. 85 m² drei Wohnräume, eine Küche und ein gefliestes Tageslichtbad mit zwei Waschbecken, Dusche und Badewanne. Im Flur, von dem man in alle Zimmer gelangt, befindet sich ein separater Abstellraum. In den Zimmern und im Flur wurde Laminatboden verlegt, in der Küche und im Badezimmer ist der Boden gefliest. Die Küche besteht aus einer Einbauküche mit einem Esstisch und einem Sideboard. Alle Räumlichkeiten sind besonders gut belichtet. Im Flur sorgt eine große Lichtkuppel für eine angenehme Beleuchtung der Wohnung. Die Sonnenterrasse betritt man über die Küche, von dort hat man einen schönen Blick in den Garten der Wohnanlage. Beheizt wird die Wohnung über eine Gaszentralheizung, diese wurde 2007 erneuert. 2008 erfolgte eine Dachsanierung. 2010 wurde die Fassade neu gestrichen und das Treppenhaus renoviert. Das Wohnhaus ist mit einer Gegensprechanlage ausgestattet. Die Gemeinschaftsanteile sind in einem sehr guten Zustand. Das Haus ist umgeben von Grünflächen und einem gut erhaltenen Baumbestand auf den Straßen, die der Wohnung einen schönen Ausblick bieten. Die Wohnung ist aktuell mit einer jährlichen Nettokaltmiete in Höhe von 7.500,00 Euro unbefristet vermietet.', '- Tageslichtbad mit Dusche und Badewanne \n- Küche mit Einbauküche\n- Sonnenterrasse \n- separater Abstellraum\n- große Lichtkuppel', 'Berlin, als Hauptstadt Deutschlands, ist nicht nur das politische Zentrum, sondern gehört längst auch zu den dynamischen Wirtschaftsregionen in Europa. Zahlreiche Neuansiedlungen haben Berlin zu einem starken Wirtschaftsstandort gemacht. Mit einer gut ausgebauten Infrastruktur, einer exzellenten Wissenschafts- und Forschungslandschaft bietet die Hauptstadt und ihr Umland Unternehmen optimale Standortbedingungen. Das Objekt befindet sich im beliebten Stadtteil Berlin-Spandau. Dieser Bezirk zeichnet sich durch viele Grün- und Wasserflächen aus und bietet Familien und Naturliebhabern viele Möglichkeiten für Sport, Freizeit und Erholung. Die Wohngegend bietet nicht nur durch die nahe gelegene Spandauer Altstadt eine gut ausgebaute Infrastruktur. Gleich in der Nachbarschaft befinden sich fußläufig alle nötigen Einkaufsmöglichkeiten, wie Supermärkte, Drogerien und Apotheken, aber auch Schulen, Kindergärten und Freizeitmöglichkeiten. Der benachbaarte Südpark als auch die nahe liegenden Tiefenwerder Wiesen laden zum Joggen, Schlendern und Erholen ein.\nDas örtliche Schwimmbad ist weniger als 5 Gehminuten entfernt und mit diversen Buslinien erreicht man den S-Bahnhof Spandau: Von dort aus bestehen Anschlüsse in die Berliner Innenstadt und zum Regional- und Fernverkehr.Der Anschluss zur Stadtautobahn ist über die Heerstraße nur ca. 10 Fahrminuten entfernt.', 'Alle Angaben in diesem Exposé (Objektbeschreibung, Abmessungen, Preisangaben etc.) beruhen auf Angaben des Verkäufers (oder eines Dritten). Die DKB Grund GmbH überprüfte diese Angaben lediglich auf Plausibilität und übernimmt hierfür keine weitergehende Haftung.\n \nDie DKB Grund haftet bei Vorsatz und grober Fahrlässigkeit. Im Falle einfacher Fahrlässigkeit haftet die DKB Grund nur bei Verletzung wesentlicher Rechte und Pflichten, die sich nach dem Inhalt und Zweck des Maklervertrages ergeben; in diesem Fall ist die Haftung der DKB Grund auf den vorhersehbaren, vertragstypischen Schaden begrenzt. Diese Haftungsbeschränkungen gelten nicht für Schäden aus der Verletzung des Lebens, des Körpers oder der Gesundheit oder soweit eine Garantie übernommen wurde. Soweit die Schadensersatzhaftung der DKB Grund gegenüber ausgeschlossen oder beschränkt ist, gilt dies auch für eine persönliche Schadensersatzhaftung ihrer Arbeitnehmer, Mitarbeiter und Vertreter.\n \nDer DKB Grund GmbH ist es gestattet, auch für den Verkäufer provisionspflichtig tätig zu werden.\n\nEinfach mit den besten Banken finanzieren! Unsere Zusammenarbeit mit am Markt führenden Bankpartnern ermöglicht die Auswahl des optimalen Finanzierungsangebotes für Ihre Immobilie zu Top-Konditionen']";;;;;;;;1991;;
