timestamp;obj_regio1;obj_heatingType;ga_cd_via_qualified;obj_cId;obj_newlyConst;obj_balcony;obj_picture;obj_picturecount;obj_pricetrend;obj_usableArea;obj_yearConstructed;obj_pricetrendbuy;obj_scoutId;obj_noParkSpaces;obj_firingTypes;obj_hasKitchen;obj_ExclusiveExpose;obj_courtage;geo_bln;obj_cellar;obj_purchasePriceRange;obj_yearConstructedRange;obj_rentSubsidy;obj_houseNumber;obj_energyType;obj_pricetrendrent;obj_livingSpace;geo_krs;obj_zipCode;obj_condition;obj_interiorQual;obj_energyEfficiencyClass;ga_cd_cxp_historicallisting;obj_parkingSpace;obj_street;obj_lift;obj_streetPlain;obj_typeOfFlat;geo_plz;obj_noRooms;obj_thermalChar;obj_assistedLiving;obj_lastRefurbish;obj_ityp;geo_land;ga_cd_via;obj_immotype;obj_rented;obj_floor;obj_telekomInternetProductAvailable;obj_cwId;obj_purchasePrice;ga_cd_application_requirements;obj_numberOfFloors;obj_noRoomsRange;ga_cd_maillead_default_shown;obj_garden;evt_count_pm_sig;obj_barrierFree;obj_international;obj_regio3;obj_objectnumber;obj_livingSpaceRange;obj_regio2;URL;beschreibung;obj_telekomTvOffer;obj_telekomUploadSpeed;obj_telekomTrackingGroup;obj_telekomInternetTechnology;ga_cd_developer_virtualreality;obj_telekomInternetType;obj_galleryAd;obj_telekomInternetProductName;obj_telekomDownloadSpeed;obj_telekomInternetUrlMobile;obj_telekomInternetUrl;obj_groupnumber;obj_telekomHdTelephone;obj_telekomInternet;obj_telekomInternetServices;obj_telekomHybridUploadSpeed;obj_telekomHybridDownloadSpeed
2020-05-11 12:31:41.154999;Berlin;district_heating;true;8022274;n;y;https://pictures.immobilienscout24.de/listings/b87be621-611f-41b7-ae02-0fcc68b021a4-1356033773.jpg/ORIG/resize/118x118%3E/extent/118x118/format/jpg/quality/80;11;10.77;131.3;2018;10.77;116422825;1;district_heating;n;false;y;Berlin;y;11;9;590.85;no_information;energy_required;5.67;131.3;Berlin;10117;first_time_use;luxury;B;false;underground_garage;no_information;y;no_information;penthouse;10117;3;62.5;n;2019;2,active;Deutschland;premium;wohnung_kauf;n;5;false;001.8022274;2109000;profile0;5;3;true;n;showqualicontactform;y;n;Mitte_Mitte;116422826;6;Berlin;/expose/116422825;['- Unsere weiteren spannenden Immobilienangebote im GLINT mit Wohnflächen von ca. 27,5 - ca. 600 m² erhalten Sie gerne auf Anfrage. -\n\nEntdecken Sie unweit vom Brandenburger Tor und Gendarmenmarkt ein außergewöhnliches Wohnensemble, das Vergangenheit und Zukunft verbindet - herzlich Willkommen im GLINT.\n\nVier typische Gründerzeithäuser, erbaut Ende des 19. Jahrhunderts mit Erkern sowie einem reich verzierten Turm als Krönung der Architektur erzählen von Aufbruch und vom Wohnen in der Beletage. \n\nDiesem historischen Ensemble wird nun neues Leben eingehaucht und in das 21. Jahrhundert mit viel Liebe zum Detail transformiert- Der Altbau wird durch einen Neubau harmonisch ergänzt. Bauzeitliche Details werden erhalten und neu interpretiert. Eine grüne Hof-Oase und eine gemütliche Kamin-Lounge werden zu Orte der Begegnung. Ein zukunftsweisendes Mobilitätskonzept mit E-Bikes und Elektro-Tankstellen sowie ein Smart-Home System sorgen für ein modernes Wohnerlebnis.', 'GLINT zeichnet sich durch einen außergewöhnlichen Anspruch an Material und Haptik aus. \n\nHistorische Klinkersteine treffen an den Hoffassaden in spannungsvollem Bezug auf grau geschlämmte Ziegel des Neubaus. Dunkle Holzfenster und dunkle Räuchereiche-Dielen bringen Wertigkeit und zeitlose Klasse in die Wohnungen. Dies hat auch einen funktionalen Nutzen, denn die Eichendiele, die durch das Räuchern ihren tiefbraunen, eleganten Farbton erhält, wird dadurch noch robuster. Im Altbau werden Holzfenster nach historischem Vorbild eingesetzt. \n\nIm Neubau sind die Holzfenster großformatig. In vielen Wohnungen sorgen deckenhohe, gläserne Flügeltüren für räumliche Öffnung und Sichtbezüge. In den Bädern überraschen goldenes Metall und mattes Schwarz: Die Designarmaturen von VOLA stammen aus Dänemark und setzen in Messing ein besonderes Highlight. Insbesondere auf der mattschwarzen Badkeramik aus Italien, die von Valdama stammt. Und so sind es wieder einmal viele liebevolle Details, die aus etwas Besonderem etwas Außergewöhnliches machen.', 'Einzigartige Lage - für Genießer\n\nStellen Sie sich vor, Sie leben in einer der spannendsten Metropolen Europas. Sie wohnen mitten im lebendigen Zentrum und zugleich in vornehmer Distanz zum Trubel der Stadt – aber trotzdem hören Sie morgens keinen Verkehrslärm, sondern das Zwitschern der Vögel im grünen Innenhof. Sie starten den Tag mit Ihrer Morgenlektüre im Kaffee Einstein und genießen gepflegte Wiener Kaffeekultur. Anschließend treffen Sie Freunde im Hotel Adlon oder gehen mit Ihrem Dackel im Großen Tiergarten spazieren.\n\nZum Lunch gönnen Sie sich eine Pasta im Bocca di Bacco und machen einige Besorgungen in den Galeries Lafayette, dem französischen Luxus-Kaufhaus. Danach schlendern Sie gemütlich über den Gendarmenmarkt und erfreuen sich seiner majestätischen Bauwerke: dem Konzerthaus, dem Französischen Dom und Deutschen Dom. Und all das erreichen Sie bequem zu Fuß – in weniger als zehn Minuten! Das ist eine Lebensqualität, die Ihnen wahrscheinlich kein anderer Ort bieten kann.', 'Wann möchten Sie sich Ihre ersten persönlichen Eindrücke vor Ort verschaffen?\n\nWir laden Sie herzlich in unseren GLINT Apartmentstore in der Taubenstraße 51 ,10117 Berlin ein.\n\nDamit wir uns ausreichend Zeit für Sie und Ihren persönlichen Wünschen nehmen können, stimmen Sie gerne vorher den Termin mit uns ab.\n\nSa: 13:00 bis 17:00 Uhr\n\nWann sehen wir uns im GLINT?'];;;;;;;;;;;;;;;;;
2020-05-11 12:31:41.525471;Berlin;district_heating;true;37030;n;n;https://pictures.immobilienscout24.de/listings/b6f1a4d4-adab-40df-ad23-0bcc145e5015-1357269991.jpg/ORIG/resize/118x118%3E/extent/118x118/format/jpg/quality/80;8;12.01;;1886;12.01;116427242;;no_information;n;true;y;Berlin;n;5;1;;34;energy_required;7.88;29.11;Berlin;10999;no_information;no_information;;false;no_information;"Lausitzer Stra&szlig;e";n;Lausitzer_Straße;apartment;10999;1;126;n;;2,active;Deutschland;schaufenster;wohnung_kauf;n;2;true;001.37030;229000;profile0;5;1;true;n;showqualicontactform;n;n;Kreuzberg_Kreuzberg;36299;1;Berlin;/expose/116427242;"['In dieser durchdachten 1-Zimmer-Altbauwohnungen können Sie auf 29 qm viel erreichen. Durch den abgetrennter Küchenbereich, eine praktische Abstellkammer und das quadratische Duschbad lässt es sich kompakt und trotzdem gemütlich leben. Außerdem haben Sie die Chance Ihren eigenen Stil zu verwirklichen, denn bei der Gestaltung haben Sie freie Hand. \r\n\r\nNur wenige Meter vom Landwehrkanal enfernt erwartet Sie dieses denkmalgeschützte Gründerzeitensemble, welches aus Vorderhaus und Gartenhaus besteht und mit seiner wunderschönen Stuckfassade bezaubert. Es steht Ihnen eine breite Auswahl an 1- bis 4-Zimmer-Wohnungen zur Verfügung, die zum Teil mit Altbau-Elementen wie Flügeltüren oder Kachelöfen aufwarten. \r\n\r\nErholung bieten zukünftig die beiden Gartenhöfe, die von namhaften Landschaftsarchitekten gestaltet werden. Außerdem wird das Lausitzer Quartier in weiteren Bauabschnitten durch einen Neubau ergänzt; eine Backsteinremise und eine Fabrikremise werden zu Townhouses umgewandelt. Genießen Sie in Ihrem neuen Zuhause ein nachbarschaftliches Miteinander ganz nach Kreuzberger Geschmack.\r\n\r\nSie interessieren sich für diese Wohnung, haben Fragen zur Finanzierung oder wünschen einen Besichtigungstermin? Das ZIEGERT-Team steht Ihnen immer gern zur Verfügung!', '+ Stuckfassaden mit Altbaudetails\r\n\r\n+ Aufzug im Gartenhaus/Treppenhaus 1\r\n\r\n+ Musterwohnung im Vorderhaus\r\n\r\n+ tagesbelichtetes Wannen- und Duschbad\r\n\r\n+ Kassettendoppelfenster\r\n\r\n+ Flügeltüren \r\n\r\n+ Fernwärme\r\n\r\n+ Verkauf der Wohnungen im Ist-Zustand\r\n\r\n+ Kellerflächen werden zum Verkauf angeboten\r\n\r\n+ 2 Gewerbeeinheiten im Vorderhaus\r\n\r\n+ landschaftlich geplante Gartenhöfe\r\n\r\n+ Vorderhaus und Gartenhaus\r\n', '""Ich bin kein Berliner, ich bin Kreuzberger."" Berlin-Kreuzberg steht für ein ganz bestimmtes Lebensgefühl: kreativ, tolerant und vielfältig. Es gibt quasi alles, außer einer Sperrstunde. Besonders das baumgesäumte Maybach- und Paul-Linke-Ufer bezaubern mit prachtvollen Altbauten, einladenden Liegewiesen, gemütlichen Cafés und Restaurants, charmanten Kiezläden sowie bunten Floh- und Wochenmärkten. \r\n\r\nNur einen Steinwurf entfernt, befindet sich das Lausitzer Quartier - in einer ruhigen Seitenstraße vom quirligen Kreuzberger Treiben. Und falls man doch mal seinen Kiez verlassen möchte, sind die U-Bahnhöfe Kottbusser Tor (U1, U3, U8) und Görlitzer Bahnhof (U1, U3) in zehn Gehminuten erreichbar. Mit einem Bio-Supermarkt vor der Haustür, zahlreichen Kitas, Grundschulen, Gymnasien und Sportvereinen in der nahen Umgebung können sich hier auch Familien gut aufgeboben fühlen.', '+++++++++++++++++++++++++++++++++++++++++++++\r\n\r\nBei Ziegert steht der Mensch im Mittelpunkt. Wir nehmen unsere gesellschaftliche Verantwortung selbstverständlich auch in dieser herausfordernden Zeit sehr ernst. Die Gesundheit unserer Kunden, Mitarbeiter und Partner hat für uns oberste Priorität. Aufgrund der aktuellen Situation werden daher unsere Showrooms vorübergehend geschlossen. Dennoch sind unsere ImmobilienberaterInnen weiterhin bestmöglich für Sie da. Wir freuen uns auf den Kontakt mit Ihnen per E-Mail, Telefon oder Videochat.\r\n\r\n++++++++++++++++++++++++++++++++++++++++++++\r\n\r\nEinige Wohnungsinnenaufnahmen stammen nicht zwangsläufig aus der hier angebotenen Wohnung oder spiegeln den aktuellen Zustand wieder. Gerne zeigen wir Ihnen die Wohnung vor Ort. \r\n\r\n++++++++++++++++++++++++++++++++++++++++++++\r\n\r\nDas ZIEGERT-Finanzierungsteam hilft Ihnen dabei, Ihre Träume zu leben. Wir zeigen Ihnen gern, wie man zum Beispiel den eigenen Mietzins in Eigentum verwandeln kann. Entdecken Sie Ihre Möglichkeiten und kontaktieren Sie uns unter +49 (0) 30 880 353 - 39 oder auf www.kaufen-statt-mieten.berlin.\r\n\r\n++++++++++++++++++++++++++++++++++++++++++++']";ONE_YEAR_FREE;40 MBit/s;telekom_layer_magenta_l;über VDSL;true;REGULAR;disabled;MagentaZuhause L;100 MBit/s;https://padlock.link/ioml;https://padlock.link/ml;113;true;100 MBit/s;web,email,bank,music,dl-ul,game,sd,mltstr,hd,fast-ul-dl;;
2020-05-11 12:31:41.845345;Berlin;central_heating;;4677501;n;y;https://pictures.immobilienscout24.de/listings/750805d1-057a-4fab-9c31-54535222de7f-787810444.jpg/ORIG/resize/118x118%3E/extent/118x118/format/jpg/quality/80;14;10.77;94;1997;10.77;73451510;;gas;y;false;y;Berlin;y;10;5;430;11;energy_consumption;5.67;94;Berlin;10119;refurbished;luxury;;false;no_information;"Veteranenstra&szlig;e ";y;Veteranenstraße_;roof_storey;10119;4;130.6;n;2010;2,active;Deutschland;standard;wohnung_kauf;n;5;true;001.4677501;790000;profile0;5;4;true;n;showqualicontactform;n;n;Mitte_Mitte;73451510;4;Berlin;/expose/73451510;"['Die sanierte Dachgeschosswohnung befindet sich im 5. OG des Vorderhauses eines sanierten Altbaus und ist bequem über einen Fahrstuhl zu erreichen. Auf 94 m2 verteilen sich Wohn-Esszimmer, 2 Schlafzimmer, Arbeitszimmer, 2 Badezimmer und ein Balkon. \n\nThis renovated top-floor apartment is located on the 5th floor of a turn-of-the-century building and can conveniently be reached by lift. A large living-kitchen, 2 bedrooms, a study, two bathrooms and a balcony are spread over 94 m2.', 'Beide Bäder haben Deckenfenster und WC; ein Bad hat eine Badewanne mit Duschmöglichkeit, das andere eine Duschkabine. Eine Einbauküche ist vorhanden. Die Wohnung hat Zentralheizung, Parkettböden und einen Balkon mit Blick zum Fernsehturm. \r\n\r\nBoth bathrooms have skylights and toilets; one bathroom features a bathtub with shower-option, the other a shower cabin. Furthermore there is a fitted kitchen. The flat has central heating, wooden parquet flooring and a balcony with view of the TV-tower.', 'Die Wohnung befindet sich in zentraler, jedoch ruhiger, City-Lage in Berlin-Mitte. Der Weinbergspark ist gleich um die Ecke. Das Scheunenviertel sowie die Kastanienallee mit vielen Läden und Restaurants sind fußläufig erreichbar. In unmittelbarer Umgebung gibt es alles für den täglichen Bedarf. \n\nThe apartment is located in a central, yet quiet area of Berlin-Mitte. A park (Weinbergspark) is located just around the corner. Shops and restaurants in Mitte and around Kastanienallee are only a few minutes walk. In the surrounding neighbourhood you can find everything you need. \n\nNächste Haltestellen: U8 Rosenthaler Platz, Tram 12 Veteranenstraße und M1 Zionskirchplatz\n\nNearest stop: U8 Rosenthaler Platz, Tram 12 Veteranenstraße und M1 Zionskirchplatz', 'Die Wohnung ist noch bis Juni 2020 vermietet und kann danach bezugsfrei übergeben werden. Das Mobiliar kann bei Bedarf mit übernommen werden.\n\nThe flat is currently rented out until June 2020 and can be handed over vacant from July 2020. The furniture can be included if desired.']";ONE_YEAR_FREE;40 MBit/s;telekom_layer_magenta_l;über VDSL;;REGULAR;;MagentaZuhause L;100 MBit/s;https://padlock.link/ioml;https://padlock.link/ml;;true;100 MBit/s;web,email,bank,music,dl-ul,game,sd,mltstr,hd,fast-ul-dl;;
2020-05-11 12:31:42.177106;Berlin;central_heating;;43448;n;y;https://pictures.immobilienscout24.de/listings/4b44ad1f-06dc-4b19-a6cc-27706ea658f5-1344205224.jpg/ORIG/resize/118x118%3E/extent/118x118/format/jpg/quality/80;10;11.14;;1900;11.14;115204322;;natural_gas_heavy;y;false;y;Berlin;y;10;1;;42;energy_consumption;6.17;140;Berlin;10437;well_kept;sophisticated;D;false;no_information;"Schliemannstra&szlig;e";n;Schliemannstraße;apartment;10437;4;119;n;;2,active;Deutschland;top;wohnung_kauf;y;4;true;001.43448;999500;profile0;5;4;true;n;showqualicontactform;n;n;Prenzlauer_Berg_Prenzlauer_Berg;115204322;6;Berlin;/expose/115204322;"['Diese 4 Zimmer Wohnung liegt im 4. Obergeschoss eines 6 geschossigen Mehrfamilienhauses mit insgesamt 22 Wohneinheiten.\n\nDie ca 140m² Wohnfläche teilen sich in 3 Schlafräume, wobei 2 der Schlafräume einen Zugang zu einem 2. Balkon haben, den Wohnbreich mit weiterem angrenzendem Balkon, die Küche mit Einbauküche, ein Badezimmer mit Badewanne, Abstellraum und eine separates Gäste WC.', 'Die Wohnung liegt in Berliners beliebtem Szeneviertel Prenzlauer Berg. \n\nDiese helle Etagenwohnung befindet sich im Herzen von Prenzlauer Berg in der Schliemannstraße , einen Katzensprung vom Kollwitzplatz als auch Helmholzplatz entfernt.\n\nU-Bahn, Bus, Tram-Station sind leicht zu erreichen.\n\nUnzählige Bars, Clubs, Restaurants, exzellente Einkaufsmöglichkeiten sowie die kulturelle Vielschichtigkeit verleihen dem Prenzlauer Berg sein einzigartiges Flair.\n\nAlle Belange des täglichen Lebens werden hier umfangreich bedient; Einkaufsmöglichkeiten, Ärzte, Schulen, Kindergärten, Universitäten stehen ausreichend zur Verfügung und die Anbindung an öffentliche Verkehrsmittel ist hervorragend.', 'Anschauen lohnt sich!\nLassen Sie sich von uns beraten! Grundrisse und weiter Informationen erhalten Sie von uns auf Anfrage.\nUnsere telefonische Erreichbarkeit:\nmontags bis mittwochs 9:30 bis 19:00 Uhr.\ndonnerstags 9.30 bis 18:00 Uhr\nfreitags und samstags 10:00 bis 17:00 Uhr\n\nReservieren Sie am besten heute noch einen persönlichen Besichtigungstermin!']";ONE_YEAR_FREE;2,4 MBit/s;telekom_layer_magenta_m_hybrid2;über Hybrid;;WITH_HYBRID;;MagentaZuhause M Hybrid (2);16 MBit/s;https://padlock.link/mmh2sa;https://padlock.link/mmhy2;;true;50 MBit/s;web,email,bank,music,dl-ul,game,sd,mltstr,hd;10 MBit/s;50 MBit/s
2020-05-11 12:31:42.580673;Berlin;central_heating;;4338188;n;y;https://pictures.immobilienscout24.de/listings/d23a299b-550a-46ee-8899-4893abc0cba8-1367249849.jpg/ORIG/resize/118x118%3E/extent/118x118/format/jpg/quality/80;8;12.72;;1986;12.72;116423991;1;no_information;n;false;y;Berlin;n;7;4;;no_information;energy_consumption;4.79;100;Berlin;13051;no_information;no_information;;false;outside;no_information;n;no_information;no_information;13051;4;66;n;;2,active;Deutschland;standard;wohnung_kauf;n;8;true;001.4338188;350000;profile0;;4;true;n;showqualicontactform;n;n;Neu_Hohenschönhausen_Hohenschönhausen;95269;4;Berlin;/expose/116423991;['Diese Traumwohnung befindet sich im 8. OG eines sehr gepflegten Mehrfamilienhauses mit 169 Einheiten und bietet einen perfekten Grundriss um seinen Lebensalltag in vollen Zügen genießen zu können.\nHier wurden eine 3-Raum sowie eine 1-Raum Wohnung charmant zusammengelegt und ergeben jetzt einen Wohntraum von 100m². Dadurch besitzt die Wohnung zwei separate Eingänge, zwei Bäder, eine moderne  Küche, ein Ess- und Wohnzimmer sowie zwei Schlafzimmer und ein Balkon mit einer freien Sicht bis zum Hochhaus der Charité. \n\nZur Wohnung gehören ein Kellerraum, ein Abstellraum auf Ihrer Etage und einen Trockenraum zur gemeinsamen Nutzung!\n\nAußerdem haben Sie die Möglichkeit einen eigenen Parkplatz zu erwerben, der Ihnen die Parkplatzsuche am wohlverdienten Feierabend erspart.\n\nDie Wohnung ist aktuell vom Eigentümer bewohnt, bezugsfrei wäre sie ca. Mai 2020.\n\nDer Verbrauchsausweis gibt den Wert 66 kWh (m²a) an, daraus ergibt sich der Endenergiekennwert B. Wesentlicher Energieträger ist Fernwärme.\n\nGerne stehe ich Ihnen für eine Besichtigung oder bei Fragen zu Verfügung\nPatric Henschel Immosky Deutschland GmbH.', 'Diese Wohnung liegt in einer zentralen und ruhigen Gegend, perfekt für Spaziergänge. Aufgrund der sehr guten Lage haben Sie hier exzellente Verkehrsanbindungen zum Stadtzentrum und zur Autobahn sowie viele kleine Geschäfte und kulinarische Highlights. Alles was das Herz begehrt! \nDiverse Kitas, Schulen, Einkaufsmöglichkeiten sind in Ihrer Nähe. Eine hervorragende Anbindung an den öffentlichen Personennahverkehr macht Hohenschönhausen zu einer Traum-Wohngegend.'];ONE_YEAR_FREE;2,4 MBit/s;telekom_layer_magenta_m_hybrid2;über Hybrid;;WITH_HYBRID;disabled;MagentaZuhause M Hybrid (2);16 MBit/s;https://padlock.link/mmh2sa;https://padlock.link/mmhy2;;true;50 MBit/s;web,email,bank,music,dl-ul,game,sd,mltstr,hd;10 MBit/s;50 MBit/s
2020-05-11 12:31:43.000094;Berlin;central_heating;;11435877;n;y;https://pictures.immobilienscout24.de/listings/a843cd4b-7d8a-43fe-9eb0-1347aa4f4c84-1356089534.jpg/ORIG/resize/118x118%3E/extent/118x118/format/jpg/quality/80;7;7.89;;1978;7.89;116426059;;oil;y;false;y;Berlin;y;7;3;271;no_information;energy_consumption;3.38;67;Berlin;14193;no_information;no_information;D;false;no_information;no_information;n;no_information;apartment;14193;2;125.5;n;;2,active;Deutschland;top;wohnung_kauf;y;;false;001.11435877;350000;profile0;;2;true;n;showqualicontactform;n;n;Grunewald_Wilmersdorf;19178018;3;Berlin;/expose/116426059;"['Die hier angebotene charmante Wohnung befindet sich in einem Wohnhaus ca. aus dem Jahre 1978. Über ein sehr weitläufiges Grundstück haben Sie direkten Seezugang, wo Sie erholsame Stunden verleben können.\n\nBeim Betreten der Wohnung werden Sie von der einladenden Diele in Empfang genommen von welcher alle Räume zu betreten sind. Sehr charmant und freundlich gestaltet sich der Wohnbereich. Hier ist geschickt eine Anbauwand mit Regalen und Schränken sowie einer Kaminattrappe integriert worden. Abgehend vom Wohnzimmer befindet sich eine gemütliche Loggia. \n\nDie Wohnung verfügt darüber hinaus über ein hochwertig verarbeitetes Badezimmer. Die integrierten Downlights sorgen für ein angenehmes Licht. Das Bad ist mit einer Wanne versehen.\n\nZwischen dem Wohn- und Schlafzimmer ist die Küche gelegen. Durch das Fenster ist dieser Raum – wie auch die übrigen Zimmer – überaus lichtdurchflutet und hell. Funktionale Einbauten bieten genügend Möglichkeiten es sich gut gehen zu lassen. \n\nEbenso definiert sich der Schlafbereich als gemütlicher Rückzugsort. \n\nAlle Räumlichkeiten sind mit Fliesen versehen; das Schlafzimmer mit einem Teppich.\n\nEin Keller ist selbstverständlich.', 'Die zum Verkauf stehende Wohnung befindet sich in begehrter Lage in der einzigartigen Villenkolonie Grunewald, welche Ende des 19. Jahrhunderts entstanden ist. In all den Jahrzehnten siedelten sich hier viele berühmte Bewohner an. Hierzu zählten Maler, Dichter, Schriftsteller, Schauspieler, Komponisten, Großindustrielle und auch Generäle. Der Grunewald selbst ist eine Oase für Spaziergänger, Radfahrer und auch Hunde zugleich. Wunderbar kann man sich auch an den kleinen Grunewaldseen erholen und vergisst  fast, dass man sich in der Hauptstadtmetropole Berlin befindet. \nEinkaufsmöglichkeiten für den täglichen Bedarf  sind u.a. am Hagenplatz sowie auch am beliebten Roseneck als auch am S-Bahnhof Grunewald vorhanden. Auch kulinarisch kommt man hier nicht zu kurz. \n\nDie Anbindung zu öffentlichen Verkehrsmitteln, Flughäfen  und der Autobahn sind als optimal zu bezeichnen. Besonders hervorzuheben sei auch die perfekte Busanbindung entlang dem Kudamm bis hin zum KaDeWe in nur ca. 15 bis 20 Minuten.', 'GELDWÄSCHE: Als Immobilienmaklerunternehmen ist die von Poll Immobilien GmbH nach § 2 Abs. 1 Nr. 14 und § 10 Abs. 3 Geldwäschegesetz (GwG) dazu verpflichtet, bei der Begründung einer Geschäftsbeziehung die Identität des Vertragspartners festzustellen und zu überprüfen. Hierzu ist es erforderlich, dass wir nach § 11 GwG die relevanten Daten Ihres Personalausweises festhalten (wenn Sie als natürliche Person handeln) – beispielsweise mittels einer Kopie. Bei einer juristischen Person benötigen wir eine Kopie des Handelsregisterauszugs, aus welchem der wirtschaftlich Berechtigte hervorgeht. Das Geldwäschegesetz sieht vor, dass der Makler die Kopien bzw. Unterlagen fünf Jahre aufbewahren muss.\nPROVISIONSHINWEIS: Mit der Anfrage bei und durch Inanspruchnahme der Dienstleistung der Firma von Poll Immobilien GmbH, wird ein Maklervertrag geschlossen. Sofern es durch die Tätigkeit der Firma VON POLL IMMOBILIEN GmbH zu einem wirksamen Hauptvertrag mit der Eigentümerseite kommt, hat der Interessent bei Abschluss\n- eines MIETVERTRAGS keine Provision/Maklercourtage an die von Poll Immobilien GmbH zu zahlen.\n- eines KAUFVERTRAGS die ortsübliche Provision/Maklercourtage an die von Poll Immobilien GmbH gegen Rechnung zu zahlen. \nHAFTUNG: Wir weisen darauf hin, dass die von uns weitergegebenen Objektinformationen, Unterlagen, Pläne etc. vom Verkäufer bzw. Vermieter stammen. Eine Haftung für die Richtigkeit oder Vollständigkeit der Angaben übernehmen wir daher nicht. Es obliegt daher unseren Kunden, die darin enthaltenen Objektinformationen und Angaben auf ihre Richtigkeit hin zu überprüfen. Alle Immobilienangebote sind freibleibend und vorbehaltlich Irrtümer, Zwischenverkauf- und Vermietung oder sonstiger Zwischenverwertung.\n\nUNSER SERVICE FÜR SIE ALS EIGENTÜMER: \nPlanen Sie den Verkauf oder die Vermietung Ihrer Immobilie, so ist es für Sie wichtig, deren Marktwert zu kennen. Lassen Sie kostenfrei und unverbindlich den aktuellen Wert Ihrer Immobilie professionell durch einen unserer Immobilienspezialisten einschätzen. Unser bundesweites und internationales Netzwerk ermöglicht es uns, Verkäufer bzw. Vermieter und Interessenten bestmöglich zusammenzuführen.']";;;;;;;disabled;;;;;;;;;;
