timestamp;obj_regio1;obj_heatingType;obj_telekomTvOffer;obj_cId;obj_newlyConst;obj_balcony;obj_picture;obj_picturecount;obj_pricetrend;obj_telekomUploadSpeed;obj_telekomTrackingGroup;obj_telekomInternetTechnology;obj_yearConstructed;obj_telekomInternetType;obj_pricetrendbuy;obj_scoutId;obj_firingTypes;obj_hasKitchen;obj_ExclusiveExpose;obj_telekomInternetProductName;obj_courtage;geo_bln;obj_cellar;obj_purchasePriceRange;obj_yearConstructedRange;obj_rentSubsidy;obj_houseNumber;obj_energyType;obj_pricetrendrent;obj_livingSpace;geo_krs;obj_zipCode;obj_condition;obj_interiorQual;obj_energyEfficiencyClass;ga_cd_cxp_historicallisting;obj_telekomDownloadSpeed;obj_parkingSpace;obj_street;obj_lift;obj_telekomInternetUrlMobile;obj_telekomInternetUrl;obj_streetPlain;obj_typeOfFlat;geo_plz;obj_noRooms;obj_thermalChar;obj_assistedLiving;obj_ityp;obj_telekomHdTelephone;geo_land;ga_cd_via;obj_telekomInternet;obj_immotype;obj_rented;obj_floor;obj_telekomInternetServices;obj_telekomInternetProductAvailable;obj_cwId;obj_purchasePrice;ga_cd_application_requirements;obj_numberOfFloors;obj_noRoomsRange;ga_cd_maillead_default_shown;obj_garden;evt_count_pm_sig;obj_barrierFree;obj_international;obj_regio3;obj_objectnumber;obj_livingSpaceRange;obj_regio2;URL;beschreibung;obj_telekomHybridUploadSpeed;obj_galleryAd;obj_project_id;obj_groupnumber;obj_telekomHybridDownloadSpeed;obj_nbp;obj_noParkSpaces;obj_lastRefurbish;ga_cd_via_qualified;obj_usableArea
2020-05-11 12:32:28.160662;Berlin;central_heating;ONE_YEAR_FREE;15741874;n;y;https://pictures.immobilienscout24.de/listings/1df1c1a8-33ef-48aa-ac4e-f80cb0a7f6ce-1357954720.jpg/ORIG/resize/118x118%3E/extent/118x118/format/jpg/quality/80;20;11.48;40 MBit/s;telekom_layer_magenta_l;über VDSL;1900;REGULAR;11.48;116324716;gas;n;true;MagentaZuhause L;y;Berlin;n;9;1;255.48;no_information;energy_consumption;7.14;114.08;Berlin;10243;well_kept;normal;C;false;100 MBit/s;no_information;no_information;n;https://padlock.link/ioml;https://padlock.link/ml;no_information;apartment;10243;3;95.09;n;2,active;true;Deutschland;top;100 MBit/s;wohnung_kauf;y;4;web,email,bank,music,dl-ul,game,sd,mltstr,hd,fast-ul-dl;true;002.01002949789;501952;profile0;6;3;true;n;showqualicontactform;n;n;Friedrichshain_Friedrichshain;6604#MPKbf4;5;Berlin;/expose/116324716;['Bei dem hier präsentierten Objekt in der Warschauer Straße 10 handelt es sich um einen klassischen Altbau aus der Gründerzeit im beliebten Szenebezirk Berlin-Friedrichshain unweit des Frankfurter Tors und Boxhagener Platzes.\n\nDas um 1900 erbaute und über die Jahre liebevoll instandgehaltene Mehrfamilienhaus verfügt auf insgesamt 6 Etagen über 2 Gewerbe- und 11 Wohneinheiten, von denen eine Vielzahl der zur Straße gewandten Einheiten über Balkone mit Blick auf die Warschauer Straße verfügen. Das Dachgeschoss wurde bereits vor einigen Jahren zu Wohnzwecken ausgebaut, ein Fahrstuhl ist nicht vorhanden. Das Objekt ist mit einer Gas-Zentralheizung ausgestattet.\n\nDie Fassade des Mehrfamilienhauses sowie das gesamte Gemeinschaftseigentum werden im Laufe des Frühjahrs noch umfassenden Sanierungsarbeiten unterzogen. Im Hinterhof des Objektes entsteht zudem ein repräsentativer Neubau sowie eine Begrünung der Hoffläche welche dem Projekt den letzten Schliff verleihen. So spannen wir einen nahtlosen Bogen zwischen klassischem Altbauflair und zeitgenössischer Architektur angepasst an die Bedürfnisse des modernen Lebens. Die ersten Arbeiten hierzu sind in vollem Gange.\n\nDirekt an der Verbindungsstraße der angrenzenden Bezirke Prenzlauer Berg im Nordwesten und Kreuzberg im Südwesten gelegen, könnte das hier präsentierte Objekt nicht zentraler sein und bietet eine willkommene Mischung aus Ruhe vom stressigen Alltag und Nähe zum Trubel der Großstadt.\n\n---\n\nThe object presented here at Warschauer Straße 10 is a classic old building from the Wilhelminian period in the popular trendy district of Berlin-Friedrichshain near the Frankfurt Gate and Boxhagener Platz.\n\nThe multi-family house, built around 1900 and lovingly maintained over the years, has a total of 6 commercial and 11 residential units on 6 floors, of which a large number of the units facing the street have balconies with a view of Warschauer Strasse. The attic was expanded a few years ago for residential purposes, there is no elevator. The property is equipped with gas central heating.\n\nThe facade of the apartment building and the entire community property will undergo extensive renovation work in the spring. In the back yard of the property there is also a representative new building and a green area of the courtyard which give the project the finishing touch. In this way we span a seamless arc between classic old building flair and contemporary architecture adapted to the needs of modern life. The first work on this is in full swing.\n\nLocated directly on the connecting road between the neighboring districts of Prenzlauer Berg in the northwest and Kreuzberg in the southwest, the property presented here could not be more central and offers a welcome mix of tranquility from everyday stress and closeness to the hustle and bustle of the big city.', 'Wohnfläche: 114,08 m2\nKaufpreis: 501.952,00 €\nHausgeld: 255,48 €\nNKM: 458,55 €\nLage: 2. OG rechts\nEtagenzahl gesamt: 6\nStatus: aktuell vermietet\nZimmer: 3\nBalkon: 2 Balkone\nEinbauküche: nein\nKeller: ja\nBodenbelag: originaler Dielenboden\nFenster: Kunststofffenster\nTüren: Holztüren\nDeckenhöhe: 3,20 Meter\nFahrstuhl: nein\nHeizung: Zentralheizung (Gas)\nEnergieausweis: consumption pass\nEnergiekennwert: 95,09 kWh/ (m².a) inkl. Warmwasser/Heizung\n\n---\n\nLiving area: 114,08 m2\nPurchase price: € 501.952,00\nHouse money: ca. € 255,48\nNet rent: € 458,55\nLocation: 2nd floor rechts\nStoreys: 6\nStatus: tenanted\nRooms: 3\nBalcony: 2 balconies\nFitted kitchen: no\nBasement: yes\nFlooring: original wooden floorboards\nWindows: plastic windows\nDoors: wooden doors\nCeiling height: 3,20 meters\nElevator: no\nHeating: central heating (gas)\nEnergy certificate: consumption pass\nEnergy performance: 95,09 kWh/ (m².a) incl. warm water/heating', 'Die Warschauer Straße im allseits beliebten und sehr dynamischen Bezirk Berlin-Friedrichshain ist eine der Hauptschlagadern im Osten der Hauptstadt und begeistert durch ein abwechslungsreiches Angebot an unzähligen Restaurants, Szenekneipen und kleineren Geschäften.\n\nDas nähere Umfeld des Objekts bietet die perfekte Möglichkeit für ausgelassene Sommerabende oder spontane Einkaufsbummel. Auch der regelmäßig stattfindende Wochen- und Flohmarkt am nahegelegenen Boxhagener Platz, dem insgeheimen Zentrum des Viertels, begeistert an den Wochenenden die Bewohner des Kiezes und hält neben stets frischen Lebensmitteln der Region auch immer die ein oder andere Überraschung bereit. \n\nAuch für das perfekte Familienglück bietet die Warschauer Straße und der Kiez rund um den Boxhagener Platz den perfekten Schaffensort. Unzählige Kindertagesstätten, Grundschulen, Oberschulen und Gymnasien befinden sich in unmittelbarer Umgebung des Objekts und auch Läden zur Deckung des täglichen Bedarfs wie Supermärkte, Drogerien oder Einkaufszentren sind stets nur einen Schritt weit Ihres neuen Zuhauses entfernt.\nMit der perfekten Anbindung an den öffentlichen Personennahverkehr könnte das hier angebotene Objekt nicht idealer gelegen sein. Zusätzlich zu der Bundesstraße B96a verkehren direkt vor der Haustür die Tram M10, mehrere Busse als auch die U-Bahnlinie U5, welche innerhalb von 3 Minuten fußläufig zu erreichen ist und im 5-Minuten-Takt zwischen dem Alexanderplatz und Hönow, bzw. dem Tierpark Berlin pendelt.\n\n---\n\nWarschauer Straße in the popular and very dynamic district of Berlin-Friedrichshain is one of the main arteries in the east of the capital and inspires with a varied range of restaurants, trendy bars and smaller shops.\n\nThe closer surroundings of the property offer the perfect opportunity for exuberant summer evenings or spontaneous shopping trips. The regular weekly and flea market at nearby Boxhagener Platz, the secret center of the district, delights the residents of the neighborhood on weekends and always has one or two surprises in store in addition to fresh local food.\n\nWarschauer Straße and the Kiez around Boxhagener Platz also offer the perfect place for creating perfect family happiness. Countless daycare centers, elementary schools, high schools and high schools are in the immediate vicinity of the property and also shops for daily needs such as supermarkets, drugstores or shopping centers are always just a step away from your new home.\n\nWith the perfect connection to local public transport, the property offered here could not be more ideally located. In addition to the B96a federal road, the M10 tram, several buses and the U5 subway line run right outside the front door, which can be reached on foot in 3 minutes and every 5 minutes between Alexanderplatz and Hönow, or the zoo Berlin commutes.', 'ACHTUNG: Die hier angebotene Wohnung ist aktuell vermietet. Eine Eigenbedarfskündigung (§ 577a Abs. 1 BGB) durch den neuen Erwerber und damit Vermieter darf frühestens nach zehn Jahren erfolgen. Nähere Regelungen sind im Gesetzestext nachzulesen.\n\nATTENTION: The apartment offered here is currently rented. The new purchaser and thus the landlord may terminate their own requirements (Section 577a (1) BGB) after ten years at the earliest. More detailed regulations can be found in the legal text.\n\n---\n\nHINWEIS: Leider liegen uns von der hier angebotenen Wohnung keine Bilder vor. Der Mieter hat sich gewünscht von der Veröffentlichung von Bildern Abstand zu nehmen. Diesen Wunsch respektieren wir gerne. Die Wohnung ist in liebevoll gepflegtem Zustand, eine Besichtigung lohnt sich!\n\nREMARK: Unfortunately, we do not possess images of the unit offered here. The tenant wished to step back from the publication of pictures and we gladly respect his wish. The apartment is very well maintained and meets all quality standards of the present time. A viewing is worth it!\n\n---\n\nBESICHTIGUNG: Für ein persönliches Gespräch und zur individuellen Abstimmung eines Besichtigungstermins stehen wir Ihnen gerne unter 030 27581533 persönlich zur Verfügung.\n\nVIEWING: For a personal viewing and to individually coordinate an appointment, we are happy to assist you at 030 27581533.'];;;;;;;;;;
2020-05-11 12:32:28.637473;Berlin;;ONE_YEAR_FREE;17089495;y;y;https://pictures.immobilienscout24.de/listings/cbb76c84-6d90-45f9-9702-af632bb77598-1355219708.jpg/ORIG/resize/118x118%3E/extent/118x118/format/jpg/quality/80;8;9.13;2,4 MBit/s;telekom_layer_magenta_m_hybrid2;über Hybrid;2021;WITH_HYBRID;9.13;116325386;no_information;n;true;MagentaZuhause M Hybrid (2);n;Berlin;y;7;9;;no_information;;5;76.47;Berlin;12557;no_information;no_information;;false;16 MBit/s;no_information;no_information;y;https://padlock.link/mmh2sa;https://padlock.link/mmhy2;no_information;apartment;12557;3;;n;2,active;true;Deutschland;standard;50 MBit/s;wohnung_kauf;n;2;web,email,bank,music,dl-ul,game,sd,mltstr,hd;true;002.01007866969;386173.5;profile0;6;3;true;n;showqualicontactform;n;n;Köpenick_Köpenick;04474-06;3;Berlin;/expose/116325386;['Der elegante Neubau liegt in der ruhigen Pohlestraße, welche nur wenige Gehminuten von der berühmten Köpenicker Altstadt entfernt liegt. Direkt um die Ecke befindet sich die Tram-Haltestelle Pablo-Neruda-Straße, von der Sie in wenigen Minuten zum S-Bahnhof Spindlersfeld gelangen. \r\n\r\nDas Objekt selbst besticht durch seine zeitlos moderne Architektur und seine außergewöhnliche Außenfassade mit beweglichen Sonnenschutzelementen.\r\n\r\nOb für Familien, Paare oder Singles – die insgesamt 16 geräumigen und hellen 2–4 Zimmer-Wohnungen mit Wohnflächen von 37 qm bis 104 qm, bieten für jeden immer das Richtige. Ein Drittel der Wohnungen sind barrierefrei.\r\n\r\nZu fast jeder Wohnung gehören Balkon oder Terrasse und eine hochwertige Ausstattung wie zum Beispiel Dielenparkett, 3-fache Verglasung, Fußbodenheizung und elektrische Rollläden, um nur ein paar Details zu nennen.', 'Die modernen Wohnungen erhalten eine hochwertige Ausstattung und viele gefragte Details. Sonderwünsche realisieren wir selbstverständlich gerne für Sie. Sprechen Sie uns einfach an.\r\n\r\nInnen\r\n- Dielenparkett\r\n- Fußbodenheizung\r\n- Bodentiefe Dusche, Badewanne\r\n- Hochwertige Bodenbeläge und Armaturen\r\n- 3-fache Isolierverglasung\r\n- 1/3 der Wohnungen sind barrierefrei\r\n- Aufzug\r\n\r\nAußen\r\n- Verschiebbarer Sonnenschutz an der Außenverkleidung\r\n- Gemeinschaftskeller für Fahrräder und Kinderwagen\r\n- Geräumige Kellerabteile\r\n- Fahrradständer\r\n- Spielplatz\r\n- Elektrisch betriebene Rollläden', 'Köpenick, im Südosten Berlins gelegen, gehört zum Bezirk Treptow-Köpenick und bietet neben der perfekten Anbindung an die City, alles was man für ein entspanntes Leben benötigt: Wasser, Parks, die wunderschöne Altstadt, beste Infrastruktur und unendliche Möglichkeiten für Wassersportler, Jogger und Radfahrer. Hier fühlt sich einfach die ganze Familie zu Hause.\r\n\r\n- Den Alex oder auch den Ku‘damm erreicht man mit Tram und S-Bahn in rund 40 Minuten.\r\n- Viele Parks laden in unmittelbarer Nähe zur Pohlestraße zum Entspannen ein.\r\n- Die Altstadt bietet viele Cafés, Restaurants, Bars und Einkaufsmöglichkeiten aller Art – alles fußläufig erreichbar.\r\n- Die Freizeit gestaltet sich vielfältig im grünen Köpenick:\r\nob familiäre Spaziergänge oder sportliche Aktivitäten auf dem Wasser.\r\n- Das Wasser ist hier wirklich überall, denn der Bezirk hat die größte Wasser- und Waldfläche Berlins.', 'VERBRAUCHERINFO\r\n1. Maklerleistung ist der Nachweis der Gelegenheit zum Abschluss eines Vertrages bzw. Vermittlung eines Vertrages über eine Immobilie gegen die Courtagezahlungspflicht des Kunden\r\n2. Unternehmer,Anschrift,Beschwerdeadressat\r\nLBSi NordWest,Himmelreichallee 40,48149 Münster,Tel:0251/4124774,Fax:0251/4124799,eMail:info@lbsi-nordwest.de\r\nGF:Roland Hustert,Helmut Steinkamp\r\n3. Es besteht ein Widerrufsrecht\r\n4. Weitere Infos: verbraucherinfo.lbsi-nordwest.de'];10 MBit/s;disabled;90410;8651;50 MBit/s;true;;;;
2020-05-11 12:32:28.949208;Berlin;district_heating;ONE_YEAR_FREE;18253633;n;n;https://pictures.immobilienscout24.de/listings/665830ce-ac28-46ae-b106-43b73394f1bb-1355197660.jpg/ORIG/resize/118x118%3E/extent/118x118/format/jpg/quality/80;5;11.48;40 MBit/s;telekom_layer_magenta_l;über VDSL;1990;REGULAR;11.48;116323794;no_information;n;false;MagentaZuhause L;y;Berlin;y;4;4;133;no_information;energy_consumption;7.14;32.34;Berlin;10247;well_kept;no_information;B;false;100 MBit/s;no_information;no_information;n;https://padlock.link/ioml;https://padlock.link/ml;no_information;apartment;10247;1;63;n;2,active;true;Deutschland;top;100 MBit/s;wohnung_kauf;n;2;web,email,bank,music,dl-ul,game,sd,mltstr,hd,fast-ul-dl;true;002.01009048957;189000;profile0;5;1;true;n;showqualicontactform;n;n;Friedrichshain_Friedrichshain;SGB430;1;Berlin;/expose/116323794;['Das schöne Neubaugebäude besteht aus einem fünfgeschossiges Mehrfamilienhaus, das aus 3 Aufgängen besteht mit insgesamt 41 Wohneinheiten und macht einen gepflegten Eindruck. Das angebotene Apartment mit 32,34 m² Wohnfläche befindet sich im 2. Obergeschoss. ', 'Die Wohnung befindet sich in einem frisch renovierten Zustand und verfügt über eine neue Einbauküche.\nDie Warmwasserversorgung und Heizung erfolgt über die Fernwärme. \nDie Kunststofffenster sind doppelverglast und halten die Wohnung im geschlossenem Zustand angenehm ruhig. Der Wohnung ist ein Kellerraum zugeordnet.\n\nAusstattung Wohn- & Schlafzimmer:\nStandard Laminatfußboden\nWände mit Raufaser tapeziert und mit Wandfarbe gestrichen\n3 Doppelkunststofffenster Doppelverglasung Ostausrichtung\nKabelanschluss, Telefonanschluss\n\nAusstattung Badezimmer:\nStandard Fliesenboden\nWände ca. 2m hoher Fliesenspiegel, Rest mit Raufaser tapeziert und mit Wandfarbe gestrichen\nBadewanne, WC, Waschbecken\n\nAusstattung Flur:\nStandard Laminatfußboden\nWände mit Raufaser tapeziert und mit Wandfarbe gestrichen', 'Zwischen Kreuzberg, Mitte, Pankow und Lichtenberg gelegen, erlebt der dicht besiedelte Ortsteil Friedrichshain nach aufwändigen Sanierungsarbeiten ein Comeback, das seinesgleichen sucht. Aus den einstigen kommunistischen Hochburgen, wie Simon-Dach-Kiez und Boxhagener Platz, wurden attraktive Wohn- und Ausgehviertel, die den Geist der damaligen Zeit bewahrten und mit modernem Zeitgeist mixten. Von der Landsberger Allee bis zum Spreeufer weht heute ein charmanter Ost-West-Wind durch die belebten Straßenzüge, der den Friedrichshain binnen weniger Jahre zu einer der beliebtesten Wohnquartiere der Stadt machte.\nFamilienfreundlich, lebendig, abwechslungsreich! Friedrichshain bietet viel Wohnqualität für Jung und Alt und ist gerade hier am Samariterkiez reich an Möglichkeiten für ein entspanntes, schönes und facettenreiches Leben. Hier locken viele Bars, Restaurants und originelle Läden ein lebensfrohes Publikum - nicht nur aus der Nachbarschaft. Das kleine Grün für die Seele findet man nicht nur in den von Bäumen gesäumten Straßen und kleinen Parks des Samariterkiezes, auch der 49 Hektar große Volkspark Friedrichshain ist in nur ein paar Minuten erreicht. Wer hier einmal sein Zuhause gefunden hat, der will nicht mehr weg!', 'Der Nachweis und/ oder der Nachweis über die Vermittlung ist für den Erwerber provisionspflichtig und beträgt den im Exposé angegebenen Preis, zahlbar bei Abschluss des Kaufvertrages. Die Grunderwerbssteuer, Notar- und Grundbuchkosten sind vom Käufer zu tragen. Wir weisen darauf hin, dass dieser Angebotspreis fallen oder bei erheblicher Nachfrage nach Objekten der hier angebotenen Art auch steigen kann. \n\nAlle gemachten Angaben zu Objekten sind ohne Gewähr und basieren ausschließlich auf Informationen, die uns von unserem Auftraggeber oder von Dritten übermittelt wurden. Wir übernehmen keine Gewähr für die Richtigkeit, die Vollständigkeit, sowie die Aktualität dieser Angaben. Irrtum, Änderung und Zwischenverkauf vorbehalten. Anderweitiger Verkauf bleibt zwischenzeitlich vorbehalten. Eine definitive Bindung zwischen Verkäufer und Käufer kommt erst zustande, wenn ein wirksamer Kaufvertrag vor einem Notar beurkundet wurde. Bis dahin sind jegliche Kaufbemühungen der Kaufinteressenten für den Verkäufer freibleibend und unverbindlich. Bitte beachten Sie unsere AGB. Das Exposé dient als Vorabinformation, Rechtsgrundlage ist allein der notariell beurkundete Kaufvertrag. Die Weitergabe dieses Angebots an Dritte darf nur mit unserer Zustimmung erfolgen. Sollte Ihnen dieses Angebot bereits bekannt sein, so bitten wir um schriftliche Bekanntgabe unter Nennung des Anbieters innerhalb von 5 Tagen nach Erhalt des Angebots. \n\nSämtliche durch uns erstellten Daten, Fotos und Textbeiträge sind urheberrechtlich geschützt. Die Vervielfältigung von Informationen oder Daten, insbesondere die Verwendung von Texten, Textteilen, Bildmaterial bedarf der vorherigen schriftlichen Einwilligung durch uns. Unberechtigte Verwendungen ziehen eine Nutzungsberechnung nach sich und werden zur Anzeige gebracht.\n\nUNSER SERVICE FÜR SIE ALS EIGENTÜMER: \nPlanen Sie den Verkauf Ihrer Immobilie, so ist es für Sie wichtig, deren Marktwert zu kennen. Lassen Sie kostenfrei und unverbindlich den aktuellen Wert Ihrer Immobilie professionell durch uns einschätzen. Unser bundesweites Netzwerk ermöglicht es uns, Verkäufer und Interessenten bestmöglich zusammenzuführen.'];;;;;;;;;;
