timestamp;obj_regio1;obj_heatingType;obj_telekomTvOffer;obj_telekomHybridUploadSpeed;obj_cId;obj_newlyConst;obj_balcony;obj_picture;obj_picturecount;obj_pricetrend;obj_telekomUploadSpeed;obj_telekomTrackingGroup;obj_usableArea;obj_telekomInternetTechnology;obj_yearConstructed;obj_telekomInternetType;obj_pricetrendbuy;obj_scoutId;obj_noParkSpaces;obj_firingTypes;obj_hasKitchen;obj_ExclusiveExpose;obj_telekomInternetProductName;obj_courtage;geo_bln;obj_cellar;obj_purchasePriceRange;obj_yearConstructedRange;obj_rentSubsidy;obj_houseNumber;obj_energyType;obj_pricetrendrent;obj_livingSpace;geo_krs;obj_zipCode;obj_condition;obj_interiorQual;ga_cd_cxp_historicallisting;obj_telekomDownloadSpeed;obj_parkingSpace;obj_street;obj_lift;obj_telekomInternetUrlMobile;obj_telekomInternetUrl;obj_streetPlain;obj_typeOfFlat;geo_plz;obj_noRooms;obj_assistedLiving;obj_ityp;obj_telekomHdTelephone;geo_land;ga_cd_via;obj_telekomInternet;obj_immotype;obj_telekomHybridDownloadSpeed;obj_rented;obj_floor;obj_telekomInternetServices;obj_telekomInternetProductAvailable;obj_cwId;obj_purchasePrice;ga_cd_application_requirements;obj_numberOfFloors;obj_noRoomsRange;ga_cd_maillead_default_shown;obj_garden;evt_count_pm_sig;obj_barrierFree;obj_international;obj_regio3;obj_objectnumber;obj_livingSpaceRange;obj_regio2;URL;beschreibung;obj_galleryAd;obj_energyEfficiencyClass;obj_thermalChar;obj_lastRefurbish;obj_groupnumber;obj_project_id;obj_nbp;ga_cd_via_qualified
2020-05-11 12:12:30.471551;Berlin;central_heating;ONE_YEAR_FREE;10 MBit/s;5220835;n;y;https://pictures.immobilienscout24.de/listings/efe02f00-3cce-4cb8-84e7-28ae46bda813-1367166836.jpg/ORIG/resize/118x118%3E/extent/118x118/format/jpg/quality/80;48;9.73;2,4 MBit/s;telekom_layer_magenta_m_hybrid2;200;über Hybrid;1903;WITH_HYBRID;9.73;118007337;1;natural_gas_heavy;y;false;MagentaZuhause M Hybrid (2);y;Berlin;y;11;1;489;33;no_information;3.79;167;Berlin;14195;no_information;sophisticated;false;16 MBit/s;outside;Ehrenbergstr.;y;https://padlock.link/mmh2sa;https://padlock.link/mmhy2;Ehrenbergstr.;roof_storey;14195;3.5;n;2,active;true;Deutschland;top;50 MBit/s;wohnung_kauf;50 MBit/s;n;4;web,email,bank,music,dl-ul,game,sd,mltstr,hd;true;001.5220835;1450000;profile0;4;3;true;n;showqualicontactform;n;n;Dahlem_Zehlendorf;118007337;7;Berlin;/expose/118007337;['Das Haus wurde 1903 erbaut und zwischenzeitlich komplett modernisiert und verfügt über eine Gas-Zentralheizung. Das aus 13 Wohneinheiten bestehende Gebäude befindet sich in einem besonders gepflegten Zustand. Ein Fahrstuhl, exklusiv für die beiden Dachgeschosse, befindet sich auf der Rückseite des Hauses. Zur Wohnung gehören ein Kellerraum sowie ein PKW-Stellplatz auf dem Hof.', 'Das lichtdurchflutete Dachgeschoss wurde 2001 neu ausgebaut und befindet sich auf der rechten Hälfte des Gebäudes. Es umfasst eine großzügige Wohnfläche von ca. 164 m² (Dachschrägen nicht eingerechnet). Die Fläche verteilt sich auf zwei Ebenen. \nIn der Hauptebene befinden sich der einladende Eingangsbereich, der großzügige Wohn-/ Essbereich und eine offene, hochwertige Küche mit Kochinsel. Vom Wohnbereich gelangt man auf die 30 m² große ganztags-sonnige Terrasse. Ebenfalls in der Hauptebene befinden sich das Schlafzimmer und ein helles, exklusives Bad mit Dusche, Badewanne und Fußbodenheizung. \nDie Galerieebene hat eine Wohnfläche von ca. 20 m². Die elegante Holz-Wendel-Treppe, über die man von der unteren Ebene in die Galerieebene gelangt,\nsorgt für einen stilvollen, fließenden Übergang der beiden Geschosse. Ein weiteres Wohlbefinden wird durch das helle Buchenparkett in den Wohnebenen erreicht, die Deckenhöhe ist im offenen Bereich bis zu 6,5 m. \nIm Wohnbereich befindet sich ein gut funktionstüchtiger gusseiserner Ofen.\n\nAlle Fenster sind aus Holz und verfügen jeweils über ein Fliegengitter. Die Fenster im Schlafbereich sind zusätzlich gegen UV-Einstrahlung geschützt. Alle Fensterbänke sind aus Marmor. An heißen Tagen sorgt eine Klimaanlage für entsprechende Abkühlung. Außerdem verfügt die Wohnung über dezent versteckte und praktische Einbauschränke. \nDie Wohnung befindet sich in einem sehr guten Zustand.', 'Die Ehrenberg Straße liegt in zentraler Lage von Dahlem, direkt hinter dem Correns Platz, zwischen der Habelschwerdter Allee und der Thielallee. Das Bild dieser ruhigen Straße ist geprägt durch schönen Baumbestand, Altbauvillen und Altbau-Mehrfamilienhäuser. Die Nähe zur Freien Universität Berlin sowie auch die Einkaufsmöglichkeiten an den nah gelegenen S-Bahnhöfen Lichterfelde-West und Zehlendorf und der U-Bahn Thielallee verleiht diesem Standort eine attraktive Note. \nDie Berliner City und auch das südwestliche Umland sind mit dem Pkw und den öffentlichen Verkehrsmitteln (U-Bahn, S-Bahn und Bus) gut zu erreichen.', 'Bezugsfrei Ende 2021 - ist aber noch verhandelbar !!!!'];;;;;;;;
2020-05-11 12:12:30.832596;Berlin;central_heating;;;216206;n;y;https://pictures.immobilienscout24.de/listings/ab407c37-a1c4-47b5-b744-3a2a6c2e8515-1330946959.jpg/ORIG/resize/118x118%3E/extent/118x118/format/jpg/quality/80;13;11.37;;;6;;1956;;11.37;114283334;;district_heating;n;false;;y;Berlin;y;7;2;;no_information;energy_required;7.75;57.4;Berlin;10247;first_time_use;sophisticated;false;;no_information;no_information;n;;;no_information;roof_storey;10247;2;n;2,active;;Deutschland;standard;;wohnung_kauf;;n;5;;;001.216206;349000;profile0;5;2;true;n;showqualicontactform;n;n;Friedrichshain_Friedrichshain;114283334 G;2;Berlin;/expose/114283334;['Der in den 1950er Jahren errichtete Altbau liegt in einer ruhigen Wohnstraße nahe dem belebten Boxhagener Platz und wurde umfassend saniert. \n\nDas Dachgeschoß, welches einen tollen Ausblick über Berlin ermöglicht, ist ausgebaut und kann leer oder vermietet übergeben werden. \n\nInsgesamt haben wir 33 Wohneinheiten, 29 Einheiten als Bestand und 4 Einheiten neu (Dachgeschoß), welche über 3 Hauseingänge erschlossen werden. \n\nZu den ausgeführten Sanierungsarbeiten zählen unter anderem alle Stränge, Treppenhäuser, sowie die Fassade.\n\nVereinbaren Sie einen Termin mit uns und überzeugen Sie sich selbst von dem schönen Haus, sowie der tollen Umgebung.', 'Diese schön sanierte Dachgeschosswohnung bietet drei Zimmer und eine Terrasse, die mit einem tollen Blick über Berlin lockt. \n\nViel Lichteinfall und weiß gestrichene sowie verputzte Wände erzeugen ein offenes und freies Raumgefühl.\n\nEin in das Wohnzimmer integrierter Küchenbereich rundet das Paket ab und macht diese Wohnung zu einem Ort zum wohlfühlen.\n\n\n- Etagenwohnung\n- Dachgeschoss\n- 3 Zimmer\n- Terrasse\n- hochwertige Materialien\n- kein Aufzug', 'Sehr zentrale ruhige Lage nahe der Boxhagener Straße im Simon - Dach - Kiez. Nur wenige Gehminuten zur U-Bahn Samariterstraße, sowie zu Restaurants/Bars.', 'Für Rückfragen erreichen Sie uns auch unter der Rufnummer 0172-3261193.'];disabled;D;114;2018;;;;
2020-05-11 12:12:31.270848;Berlin;central_heating;;;16048948;n;y;https://pictures.immobilienscout24.de/listings/32860822-9135-43bc-8935-4acc07dba0bb-1367389656.jpg/ORIG/resize/118x118%3E/extent/118x118/format/jpg/quality/80;4;10.77;;;;;;;10.77;118069914;;;y;false;;y;Berlin;y;6;;230;"&uuml;";;5.67;48;Berlin;10117;well_kept;normal;false;;no_information;Leipziger Str.;y;;;Leipziger_Str.;apartment;10117;2;n;2,active;;Deutschland;top;;wohnung_kauf;;n;7;;;001.15850880;280000;profile0;;2;true;n;showqualicontactform;y;n;Mitte_Mitte;118069914;2;Berlin;/expose/118069914;['Die 2-Zimmerwohnung befindet sich im bekannten Haus in der Leipziger Strasse. Vom Balkon hat man einen großartigen Ausblick über Berlin!\n\n2 Zimmer \nLaminatboden\nOffene Küche\nFahrstuhl\n\nBilder und die genaue Adresse erhalten Sie nach der Anfrage im Expose. Eine Besichtigung kann kurzfristig ausgemacht werden.', '• atemberaubender Blick über Berliner Skyline mit Museumsinsel, Rathaus und Fernsehturm\n• großer Balkon mit Süd-Ostausrichtung und Weitblick\n• spannende DDR-Architektur aus den 70er Jahren\n• Lage mitten in Mitte - einen Steinwurf vom Gendarmenmarkt\n• Aufzug und Empfang mit Portier', 'Die Leipziger Straße ist eine der berühmtesten Straßen in Berlin. Fussläufig erreicht man die Friedrichstraße, Gendarmenmarkt, Spittelmarkt, ganz in der Nähe ist auch die Chinesische Botschaft. Super Anbindung zwischen Osten und Westen!\n\nZentraler geht es einfach nicht!'];;;;2010;;;;
2020-05-11 12:12:31.631266;Berlin;gas_heating;ONE_YEAR_FREE;;17425585;n;y;https://pictures.immobilienscout24.de/listings/c16571f4-8bd2-4de7-91fb-a7b0ea213b8d-1367394007.jpg/ORIG/resize/118x118%3E/extent/118x118/format/jpg/quality/80;15;12.78;40 MBit/s;telekom_layer_magenta_l;;über VDSL;1910;REGULAR;12.78;118071472;;no_information;n;true;MagentaZuhause L;n;Berlin;y;6;1;175;2;energy_consumption;7.25;75;Berlin;10559;need_of_renovation;no_information;false;100 MBit/s;no_information;"Salzwedeler Stra&szlig;e";n;https://padlock.link/ioml;https://padlock.link/ml;Salzwedeler_Straße;apartment;10559;3;n;2,active;true;Deutschland;top;100 MBit/s;wohnung_kauf;;y;2;web,email,bank,music,dl-ul,game,sd,mltstr,hd,fast-ul-dl;true;002.01008164665;296800;profile0;4;3;true;n;showqualicontactform;n;n;Tiergarten_Tiergarten;10559SA2/04;3;Berlin;/expose/118071472;"['Diese wunderbare Wohnung ist derzeit noch an eine betagte, sehr freundliche Dame vermietet und hat eine Sperrfrist von 9 Jahren. Drei Zimmer, ca. 75 m², charmanter Altbau, Südwest-Balkon. Soweit der Ist-Zustand.\nDie Zukunft bietet dagegen freie Optionen: keine Sperrfrist mehr und – je nach Freiwerden der Wohnung – eine Selbstnutzung oder Neuvermietung oder was sich für Sie an interessanten Ideen ergibt.\nUnd die Gegenwart? Die bietet Ihnen jetzt die einmalige Chance, eine top gepflegte Altbauwohnung in einem der angesagtesten Bezirke von Berlin zu einem noch kleinen Preis zu erwerben. In Moabit, am Stephankiez!\n\nDie Altbauwohnung an sich ist natürlich stark renovierungsbedürftig, das schöne Haus und das Gemeinschaftseigentum generell befinden sich dagegen in einem außergewöhnlich guten Zustand. In den letzten Jahren sind hier etliche Sanierungs- und Aufwertungsarbeiten erfolgt – vom Fassadenanstrich über eine optimierte Hof- und Gartengestaltung bis hin zum neuen Dach.', 'Die 3-Zimmer-Altbauwohnung liegt im 2. OG eines im Jahre 1910 erbauten Mehrfamilienhauses mit insgesamt 17 Wohnungen und verfügt über viele originale Ausstattungsdetails:\n\n- Dielenboden\n- Doppelkastenfenster\n- angenehmer Weitblick\n- Ost-Westausrichtung\n- gefliestes Duschbad mit Fenster\n- renovierungsbedürftig\n- gut erhaltenes Treppenhaus\n- herrliche Altbauarchitektur', 'Dieses balkonreiche Mehrfamilienhaus liegt im begehrten Stephankiez nahe dem S- und U-Bahnhof Westhafen in einer ruhigen Seitenstraße. Die Ringbahn ist zu Fuß in unter 5 Minuten, der Hauptbahnhof in ca. 15 Minuten zu erreichen.  Die Stadtautobahn ist ebenfalls nur 5 Minuten mit dem Auto entfernt. Das neue Shoppingcenter ""Schultheissquartier"" verfügt über alle Geschäfte des täglichen Bedarfs und ist auch nur einen kurzen Spaziergang entfernt, wie auch die vielen kleinen Läden um die Ecke. Ein entspanntes Wohnumfeld, eine gute Infrastruktur, geliebt von Jung und Alt – willkommen auf der echten ""Insel"" Moabit, sie ist komplett umgeben von der Spree, Kanälen und 25 Brücken. ', 'Die Wohnung ist aktuell vermietet und es besteht eine Frist bis 2026, in der der Mieter nicht gekündigt werden darf. Der Mieter ist sehr freundlich und zahlt pünktlich seine Miete.\n\nBei diesem Angebot handelt es sich um eine Immobilie aus dem Firmenverbund.\n\n\nWeitere Angebote finden Sie unter: www.immokey.com']";;;35;;1;;;
2020-05-11 12:12:31.957790;Berlin;;ONE_YEAR_FREE;;15867627;n;n;https://pictures.immobilienscout24.de/listings/81b57e04-ce03-4e65-83fe-eaeb37176616-1317707421.jpg/ORIG/resize/118x118%3E/extent/118x118/format/jpg/quality/80;10;11.14;40 MBit/s;telekom_layer_magenta_l;;über VDSL;1900;REGULAR;11.14;113363982;;district_heating;y;true;MagentaZuhause L;n;Berlin;y;6;1;135;56;;6.83;47;Berlin;14057;well_kept;normal;false;100 MBit/s;no_information;"Suarezstra&szlig;e";n;https://padlock.link/ioml;https://padlock.link/ml;Suarezstraße;ground_floor;14057;2;n;2,active;true;Deutschland;schaufenster;100 MBit/s;wohnung_kauf;;n;;web,email,bank,music,dl-ul,game,sd,mltstr,hd,fast-ul-dl;true;002.01004615301;260000;profile0;5;2;true;n;showqualicontactform;y;n;Charlottenburg_Charlottenburg;AJS19052;2;Berlin;/expose/113363982;['ALT UND NEU IN EINZIGARTIGER VERBINDUNG - SUAREZ KOMBINIERT MODERNE WOHNANSPRÜCHE MIT DEM FLAIR VERGANGENER ZEITEN \n\nEin Spiegel des Stadtteils Berlin - Charlottenburg in einem anspruchsvoll gestalteten Ensemble. \n\nSUAREZ besteht aus zwei Gebäuden, einem Altbau zur Straße und dem Atelierhaus, einem sich harmonisch in den Charakter des Viertels einfügenden Neubau. Verbunden werden beide Objekte durch einen attraktiv gestalteten Gartenhof mit viel Grün, Sitzgelegenheiten und Spielmöglichkeiten für Kinder. Das 6 geschossige Wohnensemble SUAREZ bietet insgesamt 26 Eigentumswohnungen mit 8 PKW Tiefgaragen- Stellplätze. Beide Objekte – Alt- und Neubau – beeindrucken mit der hohen Qualität der Eigentumswohnungen, die hier, abgestimmt auf moderne Wohnansprüche, realisiert werden. \n\nIn den sechs Etagen des Altbaus liegen 15 Wohnungen mit 45 bis 145 Quadratmetern im Ist-Zustand mit viel Gestaltungsspielraum für individuelle Wohnideen zum Verkauf. Vorhandene historische Baubestandteile des Gemeinschaftseigentums werden sorgfältig erhalten und mit großem Aufwand in die Gegenwart transformiert.', 'DIE WICHTIGSTEN FAKTEN IM ÜBERBLICK\n\n+ 2 Zimmerwohnung mit ca. 47 m² \n+ Verkauf im Ist-Zustand\n+ Historische Stuck- und Altbauelemente\n+ Deckenhöhe zwischen 3,00 m und 3,20 m \n+ Helle und großzügige Räume\n+ Eigener Zugang\n+ Ideale Süd-Ausrichtung \n+ Neue Fenster gemäß EnEV\n+ Beliebte Wohngegend \n+ Ideale Anbindung an den ÖPNV\n\nAUFWENDIGE REVITALISIERUNG DES GEMEINSCHAFTSEIGENTUMS\n\n+ Neugestaltung der Fassade \n+ Neugestaltung der Treppenhäuser \n+ Modernisierung der Haustechnik (Fernwärme) \n+ Modernisierung der Hauselektrik mit Videogegensprechanlage \n+ Attraktive Neugestaltung des Innenhofs durch Landschaftsarchitekten \n+ Personenaufzug (Vorderhaus)\n', 'BERLIN VON SEINER BESTEN SEITE\n\nDie hohe Lebensqualität der Hauptstadt, ihre Vielfalt und Offenheit, ziehen Menschen aus aller Welt an. Und die ungebrochene Dynamik der Wirtschaft bietet die besten Chancen, um auf Dauer erfolgreich zu bleiben. Die Hauptstadt schafft dabei den Spagat zwischen ihrer industriellen Vergangenheit und der digitalen Zukunft. Eine Mischung, die Berlin für Talente aus aller Welt attraktiv macht. \n\nDer Stadtteil Charlottenburg, in dem SUAREZ liegt, spiegelt diesen Charme Berlins wider. Hier ist der Prunk vergangener Zeiten stets präsent. Zahlreiche Altbauten und viel Grün prägen das Straßenbild und verleihen dem schicken Viertel mit seinen Cafés und Salons ein französisches Flair. Eines der vielen Highlights des Stadtteils ist das Schloss Charlottenburg, das nördlich der Suarezstraße liegt. Der dazu gehörige Schlosspark ist eine grüne Oase mitten in der Stadt und der älteste Park Berlins. Ein malerisches Ziel für eine erholsame Auszeit – wenn man nicht das Glück hat, wie in SUAREZ in direkter Nähe des Lietzensees zu wohnen.', 'Die Wohnung wird provisionsfrei angeboten.\n\nReservierungen sind nach Besichtigung gegen eine Gebühr möglich. Weitere Informationen dazu erhalten Sie nach Besichtigung. \n\nWenn Sie Interesse an einer Besichtigung haben, bitten wir um Mitteilung. Besichtigungstermine werden grundsätzlich individuell stattfinden.\n\nDer Energieausweis befindet sich derzeit in der Erstellung und wird allen potentiellen Interessenten nach Erhalt versandt.'];disabled;;;;;84794;true;
2020-05-11 12:12:32.271844;Berlin;;;;18533450;n;y;https://pictures.immobilienscout24.de/listings/433f6bbe-9e52-4e96-b9bf-43614c7687c4-1367481691.jpg/ORIG/resize/118x118%3E/extent/118x118/format/jpg/quality/80;4;11.3;;;;;1968;;11.3;118072462;;no_information;y;false;;;Berlin;n;7;2;;no_information;no_information;5.73;83;Berlin;10627;no_information;no_information;false;;no_information;no_information;n;;;no_information;apartment;10627;3;n;2,active;;Deutschland;top;;wohnung_kauf;;n;2;;false;002.01009418979;320000;profile0;;3;true;n;showqualicontactform;n;n;Charlottenburg_Charlottenburg;757264;4;Berlin;/expose/118072462;"[""Eigentumswohnung, Baujahr: ca. 1968, Aufteilungsplan: 220, Miteigentumsanteil: 0.582%, 2. Etage, Wohnfläche: 83m², Zimmer: 3, Küche, Bad, Gäste WC('s), Balkon"", 'Die Versteigerung findet am zuständigen Amtsgericht statt. Der ausgewiesene Kaufpreis ist der Verkehrswert. Dieser wurde vom Gericht aufgrund eines vom amtlich bestellten Sachverständigen erstellten Gutachtens festgesetzt.\nEin Zuschlag ist gegebenenfalls schon ab 50% (bei Zweitterminen auch darunter) des Verkehrswertes möglich. Zudem entfallen für Sie die Makler- und Notarkosten, die je nach Bundesland bis zu 8,5% ausmachen können.\nDies ist eine von bundesweit über 80.000 Immobilien, die wir in unserem monatlich erscheinenden Versteigerungskalender schon ab 99,--€ für 3 Monate veröffentlichen. Zudem erhalten Sie bei uns einen Onlinezugang, mit dem Sie bis zu einem Jahr im Voraus Zwangsversteigerungsangebote sehen, die uns schon bekannt sind. Damit haben Sie zusätzlich die Chance bereits im Vorfeld einer Versteigerung mit dem Gläubiger in Kontakt zu treten. Eventuell können Sie die Immobilie auch vor der Versteigerung kaufen und haben damit Ihr Ziel noch schneller erreicht.\nBei weiteren Fragen rufen Sie uns gerne an. Wir sind telefonisch für Sie von Montags bis freitags von 9.00 - 20.00 Uhr und samstags von 10.00 - 16.00 Uhr unter 02102-711711 erreichbar.\nSeit über 30 Jahren sind wir der führende Informationsdienst für Zwangsversteigerungen. Unser Know How, die Daten bundesweit komplett zu recherchieren, kommt unseren Kunden zu Gute, da keine Versteigerung verpasst wird. Sie finden alle Versteigerungstermine und die relevanten Daten zu den einzelnen Häusern, Mehrfamilienhäusern, Wohnungen, Grundstücken sowie Gewerbeobjekten und landwirtschaftlichen Immobilien. Die Daten und die ggf. vorliegenden Exposés oder amtlichen / von Gerichten zur Verfügung gestellten Gutachten wurden von uns nicht auf Richtigkeit geprüft. Eine Haftung ist deshalb ausgeschlossen. Irrtum oder Zwischenverkauf vorbehalten.\nEin Energieausweis liegt z.Z. nicht vor und ist im Zuge des Erwerbs in der Zwangsversteigerung nicht erforderlich.']";disabled;;;;;;;
2020-05-11 12:12:32.644231;Berlin;;ONE_YEAR_FREE;;15867627;y;y;https://pictures.immobilienscout24.de/listings/1cc44526-b6fd-454c-b77e-24233caf458d-1317709868.jpg/ORIG/resize/118x118%3E/extent/118x118/format/jpg/quality/80;12;11.12;40 MBit/s;telekom_layer_magenta_l;;über VDSL;2021;REGULAR;11.12;113364139;;district_heating;n;true;MagentaZuhause L;n;Berlin;y;9;9;220;56;;6.14;73.4;Berlin;14057;first_time_use;luxury;false;100 MBit/s;no_information;"Suarezstra&szlig;e";y;https://padlock.link/ioml;https://padlock.link/ml;Suarezstraße;apartment;14057;2;n;2,active;true;Deutschland;schaufenster;100 MBit/s;wohnung_kauf;;n;1;web,email,bank,music,dl-ul,game,sd,mltstr,hd,fast-ul-dl;true;002.01004615301;630000;profile0;6;2;true;n;showqualicontactform;y;n;Charlottenburg_Charlottenburg;AJS19033;3;Berlin;/expose/113364139;['ALT UND NEU IN EINZIGARTIGER VERBINDUNG - SUAREZ KOMBINIERT MODERNE WOHNANSPRÜCHE MIT DEM FLAIR VERGANGENER ZEITEN \n\nEin Spiegel des Stadtteils Berlin- Charlottenburg in einem anspruchsvoll gestalteten Ensemble. \n\nSUAREZ besteht aus zwei Gebäuden, einem Altbau zur Straße und dem Atelierhaus, einem sich harmonisch in den Charakter des Viertels einfügenden Neubau. Verbunden werden beide Objekte durch einen attraktiv gestalteten Gartenhof mit viel Grün, Sitzgelegenheiten und Spielmöglichkeiten für Kinder. Das 6 geschossige Wohnensemble SUAREZ bietet insgesamt 26 Eigentumswohnungen mit 8 PKW Tiefgaragen- Stellplätze. Beide Objekte – Alt- und Neubau – beeindrucken mit der hohen Qualität der Eigentumswohnungen, die hier, abgestimmt auf moderne Wohnansprüche, realisiert werden. \n\nIn den sechs Etagen des Neubaus befinden sich 11 Wohnungen mit 73 bis 178 Quadratmetern, die auf 2 bis 4 Zimmer aufgeteilt sind. Die Deckenhöhen des Neubaus liegen zwischen 2,80 bis 3,00 m. \n\nVorhandene historische Baubestandteile des Gemeinschaftseigentums werden sorgfältig erhalten und mit großem Aufwand in die Gegenwart transformiert.', 'DIE WICHTIGSTEN FAKTEN IM ÜBERBLICK\n\n+ 2-3 Zimmerwohnung mit ca. 73 m² \n+ Barrierefreie Erschließung\n+ Deckenhöhe zwischen 2,80 m und 3,00 m \n+ Helle und großzügige Räume\n+ Bodentiefe Fenster\n+ Gäste-WC und Hauswirtschaftsraum\n+ Handtuchheizkörper in den Badezimmern\n+ Bodengleiche Dusche\n+ Geräumiger Balkon / Loggia mit Südausrichtung\n+ Eichenholzböden und Fußbodenheizung \n+ Markenbäder mit edlen Feinsteinzeugfliesen \n+ Außenliegender Sonnenschutz\n+ Optional gegen Aufpreis mit Klimatisierung\n+ Ideale Süd-Ausrichtung \n+ Beliebte Wohngegend \n+ Ideale Anbindung an den ÖPNV\n\nNEUBAU - ATELIERHAUS\n\n+ Moderne Architektur von Wiegand/Hoffmann Architekten \n+ Repräsentatives Entrée\n+ 11 Premium-Wohneinheiten \n+ 2 bis 4 Zimmer, ca. 73 m² bis 178 m² \n+ Alle Wohneinheiten mit Südausrichtung \n+ Tiefgarage mit 8 PKW-Stellplätzen \n+ Großzügiger Hof mit Privatgärten \n+ Freiwillige bautechnische Prüfung durch TÜV Nord\n\nAUFWENDIGE REVITALISIERUNG DES GEMEINSCHAFTSEIGENTUMS\n\n+ Neugestaltung der Fassade \n+ Neugestaltung der Treppenhäuser\n+ Aufarbeitung der historische Stuck- und Altbauelemente \n+ Modernisierung der Haustechnik (Fernwärme) \n+ Modernisierung der Hauselektrik mit Videogegensprechanlage \n+ Neue Fenster im Altbau gemäß EnEV \n+ Attraktive Neugestaltung des Innenhofs durch Landschaftsarchitekten \n+ Innenliegender Personenaufzug \n', 'BERLIN VON SEINER BESTEN SEITE\n\nDie hohe Lebensqualität der Hauptstadt, ihre Vielfalt und Offenheit, ziehen Menschen aus aller Welt an. Und die ungebrochene Dynamik der Wirtschaft bietet die besten Chancen, um auf Dauer erfolgreich zu bleiben. Die Hauptstadt schafft dabei den Spagat zwischen ihrer industriellen Vergangenheit und der digitalen Zukunft. Eine Mischung, die Berlin für Talente aus aller Welt attraktiv macht. \n\nDer Stadtteil Charlottenburg, in dem SUAREZ liegt, spiegelt diesen Charme Berlins wider. Hier ist der Prunk vergangener Zeiten stets präsent. Zahlreiche Altbauten und viel Grün prägen das Straßenbild und verleihen dem schicken Viertel mit seinen Cafés und Salons ein französisches Flair. Eines der vielen Highlights des Stadtteils ist das Schloss Charlottenburg, das nördlich der Suarezstraße liegt. Der dazu gehörige Schlosspark ist eine grüne Oase mitten in der Stadt und der älteste Park Berlins. Ein malerisches Ziel für eine erholsame Auszeit – wenn man nicht das Glück hat, wie in SUAREZ in direkter Nähe des Lietzensees zu wohnen.', 'Die Wohnung wird provisionsfrei angeboten.\n\nReservierungen sind nach Besichtigung gegen eine Gebühr möglich. Weitere Informationen dazu erhalten Sie nach Besichtigung. \n\nWenn Sie Interesse an einer Besichtigung haben, bitten wir um Mitteilung. Besichtigungstermine werden grundsätzlich individuell stattfinden.\n\nDer Energieausweis befindet sich derzeit in der Erstellung und wird allen potentiellen Interessenten nach Erhalt versandt.'];disabled;;;;;84794;true;
