2020-05-11 12:31:46.011469;Berlin;central_heating;true;179106;n;n;https://pictures.immobilienscout24.de/listings/1aadfcf3-4aa2-4511-99e0-ee08c930252b-1356091504.jpg/ORIG/resize/118x118%3E/extent/118x118/format/jpg/quality/80;10;12.78;;1919;12.78;116426189;;no_information;n;true;y;Berlin;n;6;1;171.43;no_information;;7.25;52.46;Berlin;10555;no_information;no_information;;false;no_information;no_information;n;no_information;no_information;10555;2;;n;;2,active;Deutschland;schaufenster;wohnung_kauf;n;2;true;001.179106;269000;profile0;4;2;true;n;;n;n;Tiergarten_Tiergarten;M340;2;Berlin;/expose/116426189;['Diese Eigentumswohnung befindet sich im 2. OG des sehr ruhig gelegenen Gartenhauses. Der eindrucksvolle Altbau aus dem Jahr 1919 präsentiert sich in einem guten Zustand. In dieser Wohnung erwartet Sie ein klassischer Grundriss. Die Wohnfläche von ca. 52 m² verteilt sich auf 2 Zimmer, Küche und Bad. Eine kleine Abstellkammer sorgt für zusätzlichen Stauraum. Ein sehr schöner Dielenboden sowie Stuckelemente zeichnen diese Wohnung aus. Die Einheit bietet enorm viel Potential. Durch einige Renovierungsarbeiten erwecken Sie hier den besonderen Altbaucharme. Es besteht gem. Teilungserklärung die Möglichkeit, einen Fahrstuhl sowie einen Balkon im Hofbereich anzubauen, um somit eine Wertsteigerung zu erzielen. Die Wohnung eignet sich besonders für Pärchen, die gerne zentral gelegen wohnen möchten.\n\nThis apartment is located on the 2nd floor of the very quiet garden house. The impressive old building from the year 1919 presents itself in a good condition. In this apartment a classical floor plan is waiting for you. The living space of approx. 52 m² is divided into 2 rooms, kitchen and bathroom. A small storage room provides additional storage space. A very beautiful floorboard as well as stucco elements distinguish this apartment. The unit offers enormous potential. Through some renovation work you will awaken the special charm of the old building. According to the declaration of partition, there is the possibility to add an elevator and a balcony in the courtyard area, in order to achieve an increase in value. The apartment is ideal for couples.', 'Altbau, Aufzug mgl., Dielen, Gaszentralheizung, Leerstand, Selbstnutzung, unvermietet', 'Das Gebäude befindet sich in guter Lage des Ortsteils Moabit. Umgeben vom wunderschönen Spreebogen, dem Westfälischen Viertel sowie dem Großen Tiergarten und Kleinen Tiergarten präsentiert sich dieses Objekt in einer gefragten Wohngegend. Die Straßenzüge, meist geprägt von wunderschönen Altbauten, laden zum Spazieren und Verweilen ein. Die hier vorhandenen Cafés und Restaurants bieten ein tolles gastronomisches Angebot. Nicht weit entfernt bieten Ihnen der Ökomarkt sowie die Arminiusmarkthalle frische Lebensmittel. Die stets lebendige Turmstraße mit ihrem ebenfalls sehr breiten Angebot an Gastronomie sowie das neu erbaute Schultheiss Quartier befinden sich in direkter Nähe. Die Anbindung ist sehr gut. Diverse Buslinien, die U-Bahn sowie die S-Bahn verkehren im direkten Umfeld.\nThe building is in a good location in Moabit. Surrounded by the beautiful Spreebogen, the Westphalian quarter as well as the large Tiergarten and the small Tiergarten this object presents itself in a sought-after residential area. The streets, mostly characterized by beautiful old buildings, invite you to stroll and linger. The cafés and restaurants available here offer a great gastronomic offer. Not far away the Ökomarkt and the Arminiusmarkthalle offer fresh food. The always lively Turmstraße with its wide range of gastronomy as well as the newly built Schultheiss Quartier are in the immediate vicinity. The connection is very good. Various bus lines, the underground as well as the S-Bahn run in the immediate vicinity.\n\n', 'Sie möchten Ihre Immobilie verkaufen? Wir sind Ihr Partner für einen erfolgreichen Verkauf. \n1.Unsere Experten verfügen über tiefgehende Kenntnis des bestehenden Immobilienmarktes und entwickeln gerne eine individuelle Verkaufsstrategie für Sie. Wir bewerten Ihre Immobilie unverbindlich, kostenfrei und marktgerecht.\n 2.Wir sind für Sie da und begleiten Sie von der kostenlosen Beratung bis hin zum Notartermin, immer getreu unserer Philosophie: kompetent, zuverlässig und diskret. \n3.Unser nationales und internationales Netzwerk sowie interne Synergien ermöglichen Ihnen den Zugang zu potenziellen Käufern aus aller Welt und somit einen erfolgreichen Abschluss. \nProfitieren Sie von unserem Know-How, rund 25 Jahren Erfahrung und Standorten in den besten Lagen Berlins. Gerne beraten wir Sie kostenlos in unserem Büro, per Telefon oder E-Mail!  \nEnergieausweis vorhanden:\nnein'];ONE_YEAR_FREE;40 MBit/s;telekom_layer_magenta_l;über VDSL;;REGULAR;;MagentaZuhause L;100 MBit/s;https://padlock.link/ioml;https://padlock.link/ml;666;true;100 MBit/s;web,email,bank,music,dl-ul,game,sd,mltstr,hd,fast-ul-dl;;
2020-05-11 12:31:46.322300;Berlin;central_heating;;54130;n;y;https://pictures.immobilienscout24.de/listings/160a7e89-6def-4058-8ee3-d76567a97713-1356049395.jpg/ORIG/resize/118x118%3E/extent/118x118/format/jpg/quality/80;7;11.48;75;1903;11.48;116423369;;gas;n;false;n;Berlin;y;5;1;320.17;no_information;energy_consumption;7.14;74.17;Berlin;10247;well_kept;no_information;;false;no_information;no_information;y;no_information;apartment;10247;2;112;n;;2,active;Deutschland;standard;wohnung_kauf;y;4;false;001.54130;230000;profile0;5;2;true;n;showqualicontactform;n;n;Friedrichshain_Friedrichshain;94;3;Berlin;/expose/116423369;['Das Mehrfamilienhaus mit 28 Wohnungen ist in Vorderhaus und 2 Seitenflügel aufgeteilt.\nDas Dachgeschoss ist ausgebaut. Ein Aufzug befindet sich im Hof und kann vom Vorderhaus genutzt werden.\nDie zu verkaufende Wohnung befindet sich im 4.OG rechts und hat einen Balkon in östlicher Ausrichtung.\nDas Haus wird über eine zentrale Heizungsanlage mit Warmwasseraufbereitung beheizt.\nDas innenliegende Wannenbad bietet Platz für eine Waschmaschine.\nEin Abstellraum ist vorhanden.\nDie Wohnung ist an eine Wohngemeinschaft vermietet.\nDie Nettokaltmiete beträgt 450,73 € im Monat.', '2 Zimmer, Küche, Bad, Abstellraum\n1 Wohnraum mmit Balkon in Richtung Osten\n1 Schlafzimmer in Richtung Westen\nInnenliegendes Bad\nAbstellraum\nKellerraum', 'Die Wohnung befindet sich im Samariterviertel mit der Samariterkirche im Zentrum.\nDer größte Teil der Wohnungen ist inzwischen modernisiert und instand gesetzt.\nFriedrichshain ist als Wohnquartier bei jungen Leuten und Studenten außerordentlich beliebt.  Als Gewerbestandort ist Friedrichshain ebenfalls beliebt.\n\nDie Anbindung an die öffentlichen Verkehrsmittel ist gut. Die U-Bahnlinie U 5 Station Samariterstraße bringt Sie in wenigen Minuten zum Alexanderplatz. Die Anbindung zur Ringbahn Station Storkower Straße ist gut.\nDas Mehrfamilienhaus stammt aus der Jahrhundertwende und wurde 1996 saniert.'];;;;;;;;;;;;;;;;;
2020-05-11 12:31:46.694008;Berlin;central_heating;;462306;n;n;https://pictures.immobilienscout24.de/listings/02ce4a6e-cb5f-46db-a8c4-ecea9260ea17-1363537205.jpg/ORIG/resize/118x118%3E/extent/118x118/format/jpg/quality/80;7;10.37;;1907;10.37;116414336;;oil;y;false;y;Berlin;y;6;1;235;no_information;energy_required;4.8;65.18;Berlin;12203;fully_renovated;no_information;E;false;no_information;no_information;n;no_information;no_information;12203;2;154;n;;2,active;Deutschland;top;wohnung_kauf;n;3;true;001.462306;258000;profile0;;2;true;n;;n;n;Lichterfelde_Steglitz;0-5408;3;Berlin;/expose/116414336;['Das imposante Eckgebäude versprüht dank der eindrucksvollen Fassadengestaltung mit üppiger Stuckornamentik den historischen, repräsentativen Altbauglanz wider. Mit ausgebautem Dachgeschoss gehen von drei Aufgängen 29 Wohnungen und drei Gewerbeeinheiten ab (gut 50 % Eigennutzer). Bestandteil des Kaufangebotes ist ein Kellerraum (Teileigentum mit separatem Grundbuch). Die Entrées und Treppenaufgänge sind ansprechend renoviert. Auch die restlichen Gemeinschaftsflächen weisen einen augenscheinlich ordentlichen Pflege- und Instandhaltungszustand auf. Die bezugsfreie Wohnung überzeugt mit funktionalem Grundriss, vorteilhaften Raumproportionen und sofort nutzbarem, gepflegten Zustand. Beide großzügig geschnittenen Wohnräume und auch die Küche mit voll funktionstüchtigen Einbauten, Elektrogeräten sowie kleinem Essbereich, bieten einen hervorragenden Wohnkomfort. Wahrscheinlich Ende der 80er Jahre erfolgte eine umfangreiche Grundrenovierung und Neuausstattung (ursprüngliche Decken- und Fußbodenflächen abgedeckt). Das tagesbelichtete Bad verfügt über ein Stufenpodest mit eingelassener Wanne. Vom Flur mit praktischem Hängeboden gehen Küche, Bad und Schlafzimmer mit französischem Balkon südöstlich zum ruhigen Hofareal ab und sind mit Holz-Iso-Fenstern ausgestattet. Zwei klassische Doppelkastenfenster belichten den geradlinig geschnittenen Wohnraum (ca. 21,4 m²) nach Nord-West. Die zweiseitige Ausrichtung, die raumgreifende Deckenhöhe (abgehangen noch ca. 3,15 m) und die Lage im dritten Stock bieten beste Lichtverhältnisse und ein behagliches Raumgefühl. Optional komplette Übernahme der Möbel und des Hausstandes möglich. Weitere Details übersenden wir Ihnen gern in unserem ausführlichen Exposé.\n\nAnbieter-Objektnummer: 4535', 'Beliebte, gutbürgerliche Wohnlage nahe des Bezirkszentrums rund um Rathaus Steglitz und Schloßstraße. Das alltagsfreundliche Umfeld gefällt mit kurzen Wegen zur eigenen Nahversorgung und zum ÖPNV. Vier Buslinien, u. a. mit direkter U- und S-Bahnanbindung, nur eine Minute entfernt. Supermarkt und Einzelhandel fußläufig bequem erreichbar im Dreh. Dank der nahen Stadtautobahn sind Sie auch mit dem PKW bestens unterwegs. Somit komfortabler Transfer zur City-West am Kudamm, zu den Flughäfen und in weiter entfernte Stadtbezirke. Die schnell erreichbare Bezirksmagistrale und Einkaufsmeile Schloßstraße offenbart ein Höchstmaß an Shopping- und Unterhaltungspotenzial sowie gastronomische und kulturelle Vielfalt. Keine zehn Fahrradminuten zum Campus der FU Berlin in Dahlem. Das gute Naherholungspotenzial durch diverse Grünanlagen wie Bäkepark und der Uferpromenade des Teltowkanals rundet das ansprechende Lageprofil ab. Weitere Details übersenden wir Ihnen gern in unserem ausführlichen Exposé.\n'];ONE_YEAR_FREE;40 MBit/s;telekom_layer_magenta_l;über VDSL;;REGULAR;disabled;MagentaZuhause L;100 MBit/s;https://padlock.link/ioml;https://padlock.link/ml;;true;100 MBit/s;web,email,bank,music,dl-ul,game,sd,mltstr,hd,fast-ul-dl;;
2020-05-11 12:31:47.102850;Berlin;central_heating;;16480061;n;n;https://pictures.immobilienscout24.de/listings/30aa0d33-d697-4987-872f-3b879c64d1a6-1356044123.jpg/ORIG/resize/118x118%3E/extent/118x118/format/jpg/quality/80;11;11.35;60;1900;11.35;116423220;;gas;n;false;n;Berlin;n;7;1;181;28;energy_required;7.53;60;Berlin;10245;well_kept;normal;;false;no_information;Corinthstr.;n;Corinthstr.;apartment;10245;2;129;n;;2,active;Deutschland;top;wohnung_kauf;n;2;true;002.01007331745;315000;profile0;4;2;true;n;showqualicontactform;n;n;Friedrichshain_Friedrichshain;TBC28W25;2;Berlin;/expose/116423220;['Das Wohn- und Geschäftshaus aus dem Jahre 1900 bildet ein Eckhaus an der Corinthstraße und Bossestraße und hat drei Hauseingänge: Corinthstraße 28, Corinthstraße 30 und Bossestraße 8.\r\rDer Gebäudekomplex bildet eine in sich geschlossene Wohnanlage mit einem Seitenflügel und Hinterhausbereich.\rDas Haus ist 2019 in eine Eigentümergemeinschaft aufgeteilt worden. Die Zukunft lässt noch Bauvorhaben zu. Es können hier noch Balkone hofseitig entstehen, Aufzüge erbaut werden und das Dachgeschoss soll komplett ausgebaut werden, wodurch das Objekt ein komplett neues Dach erhält!\r\rEs handelt sich hier um eine zwei Zimmerwohnung mit Küche und Duschbad mit Fenster,  im 2. OG im Seitenflügel der Corinthstr. 28.', '- Dielenboden\r- Duschbad\r- gepflegtes Treppenhaus\r- Hohe Decken\r- ruhiger begrünter Hof \r- Nähe East Side Mall', 'Willkommen in der Oberbaumcity!\r\rDie vermietete Eigentumswohnung befindet sich in einer ruhigen Seitenstraße nahe der Spree in un-mittelbarer Nähe zur Mediaspree, Mercedes-Benz Arena und der East Side Gallery. \r\rÖffentliche Verkehrsmittel wie S-und U-Bahn sowie Bus und Tram befinden sich einerseits auf der Warschauer Straße, andererseits bei der Station Ostkreuz, welche fußläufig in ca. 10 Minuten erreichbar sind. Anbindung zum Fernverkehr erhält man schnell am ca. 2,6 km entfernten Ostbahnhof. \r\rDer Szenebezirk Friedrichshain, ist bekannt für seine reichhaltige und multi-kulturelle Auswahl an Restaurants, Cafe´s und Bars, in und um den Boxhagener Platz im Simon-Dach-Kiez, welcher ebenfalls nur wenige Gehminuten entfernt ist. \r\rGeschäfte des täglichen Bedarfs sowie Apotheken, Kitas und Schulen sind ebenfalls in unmittelbarer Nähe zahlreich vorhanden.', 'Weitere Angebote finden Sie unter: homeestate.de oder auf unserer Projektseite unter: bosse8.de\r\rGerne stehen wir Ihnen für Rückfragen zur Verfügung.\r\rFeel free to contact us also in English- we are happy to inform you concerning this apartment.\rVous pouvez également nous contactez en Francais- nous serons ravie de vous informer.'];ONE_YEAR_FREE;40 MBit/s;telekom_layer_magenta_l;über VDSL;;REGULAR;;MagentaZuhause L;100 MBit/s;https://padlock.link/ioml;https://padlock.link/ml;;true;100 MBit/s;web,email,bank,music,dl-ul,game,sd,mltstr,hd,fast-ul-dl;;
2020-05-11 12:31:47.453044;Berlin;central_heating;;11435877;n;y;https://pictures.immobilienscout24.de/listings/e3dc75ee-7d86-455d-9ddb-9e443416899c-1355925423.jpg/ORIG/resize/118x118%3E/extent/118x118/format/jpg/quality/80;8;7.89;;1976;7.89;116416576;;oil;y;false;y;Berlin;n;9;3;316.11;no_information;;3.38;92.48;Berlin;14193;mint_condition;sophisticated;;false;no_information;no_information;n;no_information;apartment;14193;3;;n;2008;2,active;Deutschland;top;wohnung_kauf;n;1;true;001.11435877;519000;profile0;2;3;true;n;showqualicontactform;n;n;Grunewald_Wilmersdorf;20213008;4;Berlin;/expose/116416576;['Diese helle, sehr gepflegte Eigentumswohnung liegt in einer zweigeschossigen Wohnanlage in einer ruhigen Seitenstraße in Berlin Grunewald. Das Haus wird von einem sorgfältig gepflegten Grundstück umgeben, an dessen Umrandung Bäume und Sträucher einen grünen Rahmen bilden.\n\nBeim Betreten der Wohnung befindet man sich in einem sehr großzügigen offenen Flur von ca.14m².\n\nAuf der rechten Seite ist sowohl das kleine Gäste-WC sowie auch das etwas größere Wannenbad gelegen.\n\nZur linken Seite erreicht man die Küche, welche mit einer gepflegten wertigen Einbauküche ausgestattet ist.\n\nDer offene helle Wohnbereich mit seinen über 30m² bietet einen der zwei direkten Zugänge zum Balkon mit offenen Blick in die gepflegte Nachbarschaft.\n\nZwei weitere angenehm geschnittene Zimmer sind gekonnt von den anderen Bereichen getrennt und bieten somit viel Privatsphäre.\n\nDas Badezimmer selbst besticht durch Funktionalität und Ästhetik zugleich. Es verfügt über eine Badewanne mit integrierter Dusche. Das gesamte Bad ist mit weißen Wand- und grauen Bodenfliesen klassisch modern gestaltet.\n\nDiese Wohnung ist sofort bezugsfertig und lädt ein, um sich gleich rundum wohl zu fühlen.\n\nZur Wohnung gehört die Nutzung eines Kellers, sowie einer Gemeinschaftssauna.', '- Gepflegter wertiger Holzboden von 2008 in allen Zimmern und Flur / Diele\n\n- Beide Bäder in 2008\n\n- Elektrik von 2008\n\n- Gepflegte wertige Einbauküche von 2008\n\n- Großer Balkon mit zwei Zugängen und freier Sicht', 'Diese offen geschnittene Wohnung befindet sich in einer ruhigen Seitenstraße der Koenigsallee in Berlin-Grunewald. \n\nIn all den Jahrzehnten siedelten sich hier viele berühmte Bewohner an. Hierzu zählten Maler, Dichter, Schriftsteller, Schauspieler, Komponisten, Großindustrielle und auch Generäle.\n \nDer Grunewald selbst ist eine Oase für Spaziergänger, Radfahrer und auch Hunde zugleich. Wunderbar kann man sich auch an den kleinen Grunewaldseen erholen und vergisst fasst, dass man sich in der Hauptstadtmetropole Berlin befindet.\n\nEinkaufsmöglichkeiten für den täglichen Bedarf sind sowohl am Hagenplatz, am beliebten Roseneck und ebenfalls in Schmargendorf  vorhanden. Auch die Vielfalt im gastronomischen Bereich ist gegeben. \n\nDie Anbindung zu öffentlichen Verkehrsmitteln, Flughäfen und der Autobahn sind als ideal zu bezeichnen.', 'Unser Service für Sie als Eigentümer: Wir bewerten gern kostenfrei Ihre Immobilie entsprechend dem aktuellen Marktwert, entwickeln eine Ihrem Objekt angepasste Verkaufsstrategie und stehen Ihnen bis zum erfolgreichen Verkauf zur Verfügung. VON POLL IMMOBILIEN steht als Maklerunternehmen mit seinen Mitarbeitern und Kollegen für die Werte Seriosität, Zuverlässigkeit und Diskretion. Unser bundesweites und internationales Netzwerk ermöglicht es uns, Verkäufer bzw. Vermieter und Interessenten bestmöglich zusammenzuführen. Wir können Ihnen bereits in den ersten Gesprächen mitteilen, wie viele vorgemerkte Suchinteressenten wir haben. Kommen Sie einfach bei uns vorbei, rufen Sie uns an oder senden Sie uns eine E-Mail – wir freuen uns, Sie kennen zu lernen.\n\nWir weisen darauf hin, dass die von uns weitergegebenen Objektinformationen, Unterlagen, Pläne etc. vom Veräußerer bzw. Vermieter stammen. Eine Haftung für die Richtigkeit oder Vollständigkeit der Angaben übernehmen wir daher nicht. Es obliegt daher unseren Kunden, die darin enthaltenen Objektinformationen und Angaben auf ihre Richtigkeit hin zu überprüfen.\n\nWir bitten Sie um Verständnis, dass wir die vollständigen Angaben zur Immobilie nur übermitteln können.\n\nZum Zeitpunkt der Anzeigenerstellung lag der Energieausweis noch nicht vor.'];ONE_YEAR_FREE;40 MBit/s;telekom_layer_magenta_l;über VDSL;;REGULAR;disabled;MagentaZuhause L;100 MBit/s;https://padlock.link/ioml;https://padlock.link/ml;;true;100 MBit/s;web,email,bank,music,dl-ul,game,sd,mltstr,hd,fast-ul-dl;;
2020-05-11 12:31:47.766157;Berlin;self_contained_central_heating;;1230634;n;y;https://pictures.immobilienscout24.de/listings/f46229dd-1f4e-40eb-a3af-8b74c3e2767a-1356041152.jpg/ORIG/resize/118x118%3E/extent/118x118/format/jpg/quality/80;9;12.19;;1900;12.19;116423118;;natural_gas_light;n;false;y;Berlin;n;10;1;250;no_information;energy_required;7.44;100;Berlin;10999;no_information;no_information;;false;no_information;no_information;n;no_information;apartment;10999;3;157.5;n;;2,active;Deutschland;standard;wohnung_kauf;n;4;true;001.1230634;950000;profile0;5;3;true;n;showqualicontactform;n;n;Kreuzberg_Kreuzberg;5486;4;Berlin;/expose/116423118;['Zum Verkauf steht eine ca. 100m² große 3-Zimmerwohnung mit Süd-West-Balkon in der vierten Etage des Vorderhauses eines Berliner Altbaus direkt am Paul-Lincke-Ufer. Zwei Zimmer sowie der Balkon sind zum Landwehrkanal ausgerichtet, das dritte Zimmer, Küche und Bad zeigen zur Hofseite. Die Wohnung ist noch bis zum 31.03.2020 vermietet und wird anschließend frei für Eigennutzer. Besichtigungen können nach Beendigung des Mietverhältnisses durchgeführt werden. Alle Einheiten werden über eine Gas-Etagenheizung beheizt. Eine Wohnungseigentümergemeinschaft (WEG) ist in Gründung. Das hier kalkulierte Wohngeld i.H.v. 2,50 € pro Quadtratmeter Wohnfläche ist eine Schätzung, die auf Erfahrungen von vergleichbaren Wohnungen beruht.\r\nDie 1A-Lage am Paul-Lincke-Ufer ist äußerst begehrt. Sowohl Kreuzberger als auch zahlreiche Besucher verbringen ihre Zeit gern in den zwei stadtbekannten Parks (im Görlitzer Park und Viktoriapark) und am Landwehrkanal. Vom 66 Meter hohen Kreuzberg im Viktoriapark hat der Stadtteil seinen Namen. Der Landwehrkanal bietet schattige Wege zum Spazierengehen, Radfahren und Verweilen. Die Gastroszene in Kreuzberg ist so vielfältig wie seine Einwohner. Märkte, Cafés, Restaurants und Bars bieten die verschiedensten kulinarischen Erlebnisse. Auf den vielen unterschiedlichen Wochenmärkten lässt sich zum Beispiel super der Wocheneinkauf erledigen. Ein Highlight in Kreuzberg ist außerdem die Markthalle Neun, die fußläufig zu erreichen ist. Die U-Bahnstationen Schönleinstraße (U8), Görlitzer Bahnhof (U1, U3) und Kottbusser Tor (U1, U3, U8) befinden sich in fußläufiger Umgebung. \r\nWir bieten weitere Wohnungen verschiedener Größen in diesem Gebäude an. Bitte zögern Sie nicht uns anzusprechen. Kontaktieren Sie uns entweder via E-Mail: info@berlinmaegleren.de oder rufen Sie Ihre Ansprechperson Simone Sczepanski direkt mobil an: 0175 18 16 529'];ONE_YEAR_FREE;40 MBit/s;telekom_layer_magenta_l;über VDSL;;REGULAR;;MagentaZuhause L;100 MBit/s;https://padlock.link/ioml;https://padlock.link/ml;;true;100 MBit/s;web,email,bank,music,dl-ul,game,sd,mltstr,hd,fast-ul-dl;;
2020-05-11 12:31:48.117265;Berlin;district_heating;;37030;n;n;https://pictures.immobilienscout24.de/listings/3fa60319-4ee5-43b9-9463-9b5dc8e224d3-1357269706.jpg/ORIG/resize/118x118%3E/extent/118x118/format/jpg/quality/80;8;12.19;;1886;12.19;116427225;;no_information;n;true;y;Berlin;n;5;1;;34;energy_required;7.44;29.04;Berlin;10999;no_information;no_information;;false;no_information;"Lausitzer Stra&szlig;e";n;Lausitzer_Straße;apartment;10999;1;126;n;;2,active;Deutschland;standard;wohnung_kauf;n;1;true;001.37030;224000;profile0;5;1;true;n;showqualicontactform;n;n;Kreuzberg_Kreuzberg;36298;1;Berlin;/expose/116427225;"['In dieser durchdachten 1-Zimmer-Altbauwohnung können Sie auf ca. 29 qm viel erreichen. Durch den abgetrennter Küchenbereich, eine praktische Abstellkammer und das quadratische Duschbad lässt es sich kompakt und trotzdem gemütlich leben. Außerdem haben Sie die Chance Ihren eigenen Stil zu verwirklichen, denn bei der Gestaltung haben Sie freie Hand. \r\n\r\nNur wenige Meter vom Landwehrkanal enfernt erwartet Sie dieses denkmalgeschützte Gründerzeitensemble, welches aus Vorderhaus und Gartenhaus besteht und mit seiner wunderschönen Stuckfassade bezaubert. Es steht Ihnen eine breite Auswahl an 1- bis 4-Zimmer-Wohnungen zur Verfügung, die zum Teil mit Altbau-Elementen wie Flügeltüren oder Kachelöfen aufwarten. \r\n\r\nErholung bieten zukünftig die beiden Gartenhöfe, die von namhaften Landschaftsarchitekten gestaltet werden. Außerdem wird das Lausitzer Quartier in weiteren Bauabschnitten durch einen Neubau ergänzt; eine Backsteinremise und eine Fabrikremise werden zu Townhouses umgewandelt. Genießen Sie in Ihrem neuen Zuhause ein nachbarschaftliches Miteinander ganz nach Kreuzberger Geschmack.\r\n\r\nSie interessieren sich für diese Wohnung, haben Fragen zur Finanzierung oder wünschen einen Besichtigungstermin? Das ZIEGERT-Team steht Ihnen immer gern zur Verfügung!', '+ Stuckfassaden mit Altbaudetails\r\n\r\n+ Aufzug im Gartenhaus/Treppenhaus 1\r\n\r\n+ Musterwohnung im Vorderhaus\r\n\r\n+ tagesbelichtetes Wannen- und Duschbad\r\n\r\n+ Kassettendoppelfenster\r\n\r\n+ Flügeltüren \r\n\r\n+ Fernwärme\r\n\r\n+ Verkauf der Wohnungen im Ist-Zustand\r\n\r\n+ Kellerflächen werden zum Verkauf angeboten\r\n\r\n+ 2 Gewerbeeinheiten im Vorderhaus\r\n\r\n+ landschaftlich geplante Gartenhöfe\r\n\r\n+ Vorderhaus und Gartenhaus\r\n', '""Ich bin kein Berliner, ich bin Kreuzberger."" Berlin-Kreuzberg steht für ein ganz bestimmtes Lebensgefühl: kreativ, tolerant und vielfältig. Es gibt quasi alles, außer einer Sperrstunde. Besonders das baumgesäumte Maybach- und Paul-Linke-Ufer bezaubern mit prachtvollen Altbauten, einladenden Liegewiesen, gemütlichen Cafés und Restaurants, charmanten Kiezläden sowie bunten Floh- und Wochenmärkten. \r\n\r\nNur einen Steinwurf entfernt, befindet sich das Lausitzer Quartier - in einer ruhigen Seitenstraße vom quirligen Kreuzberger Treiben. Und falls man doch mal seinen Kiez verlassen möchte, sind die U-Bahnhöfe Kottbusser Tor (U1, U3, U8) und Görlitzer Bahnhof (U1, U3) in zehn Gehminuten erreichbar. Mit einem Bio-Supermarkt vor der Haustür, zahlreichen Kitas, Grundschulen, Gymnasien und Sportvereinen in der nahen Umgebung können sich hier auch Familien gut aufgeboben fühlen.', '+++++++++++++++++++++++++++++++++++++++++++++\r\n\r\nBei Ziegert steht der Mensch im Mittelpunkt. Wir nehmen unsere gesellschaftliche Verantwortung selbstverständlich auch in dieser herausfordernden Zeit sehr ernst. Die Gesundheit unserer Kunden, Mitarbeiter und Partner hat für uns oberste Priorität. Aufgrund der aktuellen Situation werden daher unsere Showrooms vorübergehend geschlossen. Dennoch sind unsere ImmobilienberaterInnen weiterhin bestmöglich für Sie da. Wir freuen uns auf den Kontakt mit Ihnen per E-Mail, Telefon oder Videochat.\r\n\r\n++++++++++++++++++++++++++++++++++++++++++++\r\n\r\nEinige Wohnungsinnenaufnahmen stammen nicht zwangsläufig aus der hier angebotenen Wohnung oder spiegeln den aktuellen Zustand wieder. Gerne zeigen wir Ihnen die Wohnung vor Ort. \r\n\r\n++++++++++++++++++++++++++++++++++++++++++++\r\n\r\nDas ZIEGERT-Finanzierungsteam hilft Ihnen dabei, Ihre Träume zu leben. Wir zeigen Ihnen gern, wie man zum Beispiel den eigenen Mietzins in Eigentum verwandeln kann. Entdecken Sie Ihre Möglichkeiten und kontaktieren Sie uns unter +49 (0) 30 880 353 - 39 oder auf www.kaufen-statt-mieten.berlin.\r\n\r\n++++++++++++++++++++++++++++++++++++++++++++']";ONE_YEAR_FREE;40 MBit/s;telekom_layer_magenta_l;über VDSL;true;REGULAR;disabled;MagentaZuhause L;100 MBit/s;https://padlock.link/ioml;https://padlock.link/ml;113;true;100 MBit/s;web,email,bank,music,dl-ul,game,sd,mltstr,hd,fast-ul-dl;;
