2020-05-30 19:39:23.815856;Berlin;ONE_YEAR_FREE;210901;n;y;https://pictures.immobilienscout24.de/listings/8c96f188-43f3-4511-88c9-c0a1faf527e8-1363070030.jpg/ORIG/resize/118x118%3E/extent/118x118/format/jpg/quality/80;9;10.7;40 MBit/s;telekom_layer_magenta_l;über VDSL;1938;REGULAR;;10.7;117116255;gas;y;false;MagentaZuhause L;y;Berlin;y;5;1;no_information;5.58;55;Berlin;10318;no_information;sophisticated;false;100 MBit/s;no_information;no_information;n;https://padlock.link/ioml;https://padlock.link/ml;no_information;no_information;10318;2;n;2,active;true;Deutschland;top;100 MBit/s;wohnung_kauf;n;1;;web,email,bank,music,dl-ul,game,sd,mltstr,hd,fast-ul-dl;true;001.210901;220000;profile0;3;2;true;n;showqualicontactform;n;n;Karlshorst_Lichtenberg;W-02IFOX;2;Berlin;/expose/117116255;['Hereinspaziert! Entdecken Sie diese interessante Immobilie bei einer virtuellen Besichtigung bequem von zu Hause aus. Wir senden Ihnen gern das Exposé mit einem Link für den 3D-Rundgang.\nDiese hochwertige Zwei-Zimmer-Wohnung befindet sich im ersten Obergeschoss eines 1938 erbauten Mehrfamilienhauses, welches im Jahre 2002 komplett saniert wurde. Ausgestattet mit edlem Parkett und Feinsteinzeugfliesen präsentiert sich die ca. 55 m² große Wohnung modern, jedoch ohne ihren Altbau-Charme verloren zu haben. Beim Eintreten empfängt eine geräumige Diele, die als Raumverteiler fungiert. Linker Hand befindet sich die im Jahre 2017 renovierte und mit neuen Einbaumöbeln und -geräten ausgestattete Küche. Auch das danebenliegende Bad wurde renoviert und wirkt durch die natürliche Tagesbelichtung und die Glaswände der Dusche hell und einladend. Das großzügige Wohnzimmer verfügt über einen nach Westen ausgerichteten Balkon, auf welchem sich die Nachmittagssonne genießen lässt. Das Schlafzimmer ist auf die Hofseite, nach Osten, ausgerichtet und bietet viel Platz und Ruhe zum Entspannen. Ein der Wohnung zugeordneter Kellerraum bietet Stauraum für dies und das.', 'Art Energieverbrauchsausweis \n · Energieverbrauch 108 kWh/(m²*a) \n · Energieeffizienzklasse D  \n · Befeuerungsart Gas\n · Baujahr 1938', 'Umringt von Altbauten und ehrwürdigen Stadtvillen liegt der Dreigeschosser mitten im schönen Prinzenviertel. Verschiedenste Einkaufsmöglichkeiten, Cafés und Restaurants sind in wenigen Minuten zu Fuß zu erreichen. Auch Kitas und Schulen befinden sich in unmittelbarer Nähe. Zur S-Bahn-Station Karlshorst sind es fußläufig ca. 15 Minuten, zur Tramhaltestelle noch weniger. Karlshorst ist ein Ortsteil von Berlin unweit vom Zentrum. Als Villenvorort gegründet macht ihn seine zentrale Lage und die unmittelbare Nähe zum Stadtzentrum zu einem der beliebtesten Wohngegenden der Stadt. Die Infrastruktur ist bestens ausgebildet und es gibt eine Vielzahl von Freizeit- und Erholungsstätten. Über den S- und Regionalbahnhof Berlin-Karlshorst erreicht man direkt die Friedrichstraße und den Potsdamer Platz in der Berliner City bzw. den Flughafen Schönefeld.', 'Sie möchten Ihre Immobilie verkaufen? Wir sind Ihnen dabei gern behilflich - engagiert, diskret und für Sie kostenlos! \nNutzen Sie unseren Rundumservice: von der Einschätzung, über das Finden eines bonitätsgeprüften Käufers, die Begleitung zum Notar bis zur endgültigen Übergabe. \nWir sind für Sie da und freuen uns auf Ihren Anruf. \nENGEL&VÖLKERS Berlin-Köpenick Tel: +49 30 65 48 49 50 \nDie Courtage in Höhe von 7,14 % inkl. der gesetzlichen Mehrwertsteuer auf den Kaufpreis ist mit dem Zustandekommen des Kaufvertrages (notarieller Vertragsabschluß) verdient, fällig und vom Käufer zu zahlen. Die Höhe der Bruttocourtage unterliegt einer Anpassung bei Steuersatzänderung. Die Vermittelnden und/oder Nachweisende Engel & Völkers Frohnau - Köpenick GmbH (Lizenznehmer der Engel & Völkers Immobilien GmbH ) und ggf. deren Beauftragter, erhalten einen unmittelbaren Zahlungsanspruch gegenüber dem Käufer. Alle Angaben sind ohne Gewähr und basieren ausschließlich auf Informationen, die uns von unserem Auftraggeber zur Verfügung gestellt wurden. Wir übernehmen keine Gewähr für die Vollständigkeit, Richtigkeit und Aktualität dieser Angaben. Die Grunderwerbsteuer, Notar- und Grundbuchkosten sind vom Käufer zu tragen. Im Übrigen gelten unsere Allgemeinen Geschäftsbedingungen. Irrtum und Zwischenverkauf vorbehalten.'];240;energy_consumption;108;central_heating;240;0;2017;;;;5;;;
2020-05-30 19:39:24.191598;Berlin;ONE_YEAR_FREE;1903091;n;n;https://pictures.immobilienscout24.de/listings/9ed0653a-c54f-4226-876b-2a08c9e8d9bf-1371463542.jpg/ORIG/resize/118x118%3E/extent/118x118/format/jpg/quality/80;6;12.01;40 MBit/s;telekom_layer_magenta_l;über VDSL;1899;REGULAR;;12.01;117119268;gas;n;false;MagentaZuhause L;y;Berlin;y;8;1;no_information;7.88;75.5;Berlin;10997;no_information;no_information;false;100 MBit/s;no_information;no_information;n;https://padlock.link/ioml;https://padlock.link/ml;no_information;roof_storey;10997;2;n;2,active;true;Deutschland;top;100 MBit/s;wohnung_kauf;n;5;;web,email,bank,music,dl-ul,game,sd,mltstr,hd,fast-ul-dl;true;001.1903091;455000;profile0;5;2;true;n;showqualicontactform;n;n;Kreuzberg_Kreuzberg;6581;3;Berlin;/expose/117119268;['Lassen Sie Ihre Blicke schweifen! Vom Fernsehturm bis in den Treptower Park. Das Dachgeschoss liegt in einem der angesagtesten Kieze Kreuzbergs zwischen der Arena Berlin und dem U-Bahnhof Schlesisches Tor. Die zwei gleich großen Räume umschließen den zentralen Küchen- und Badbereich und den beheizten Wintergarten, der sich fast vollständig öffnen lässt und so zur Loggia wird. Die Ausrichtung der Wohnung ist nach Nord-Ost in Richtung Spreeufer. Die schöne Fensterfront ist durchlaufend und der Wintergarten ist von allen Räumen aus begehbar. Viel Glas und Licht, schöne Ausblicke, eine gute Raumhöhe und große Räume gehören zu den Qualitäten dieses Dachgeschosses. Der Fußboden ist ein Echtholzparkett, welches gerade neu versiegelt wurde. Auch die Fensterfront, Wände und Decken wurden überarbeitet, so dass nur Ihre Möblierung fehlt. Das Anwesen umfasst ein Vorderhaus, ein Quergebäude, zwei Seitenflügel und ein schönes ehemaliges Fabrikgebäude im zweiten Hof. Die Gemeinschaft besteht seit 1998/1999. In diesen Jahren fand auch der Dachausbau und einige grundlegende Sanierungen statt. Ein Aufzug ist im Vorderhaus nicht vorhanden. Zögern Sie nicht, einen Besichtigungstermin mit uns zu vereinbaren.', 'Die Straßenzüge rund um das Schlesische Tor gelten nicht nur als begehrtes Szenequartier. Die Lage ist geprägt durch seine intakten Altbauquartiere, viel Grün und die Nähe zum Wasser. Der Bezirk bietet ein ausgesprochen lebendiges Umfeld. Das Leben spielt sich auf den Straßen und in der vielfältigen Kultur- und Kneipenlandschaft ab und führt vorbei an Spätis, dutzenden internationalen Snacks, kleinen kulturellen Spielstätten und Musikbars. Im unmittelbaren Umfeld liegen beliebte Treffpunkte, wie das Badeschiff und die hippen Locations entlang des Landwehrkanals und der Spree sowie der Görlitzer Park. Auf der anderen Spreeseite befinden sich das Mediaspree-Quartier, die Mercedes Benz Arena und weitere Wirtschaftsmagnete. Am Schlesischen Tor haben Sie Anschluss an die U1 und die U3. In nur einer Station über die Warschauer Brücke erreichen Sie den S-Bahnhof Warschauer Straße mit weiteren Verbindungen. Kreuzberg wird zum Fahrradbezirk umgebaut. In Zukunft werden Sie immer mehr Ziele in Berlin auf gesicherten Fahrradspuren erreichen.'];195;energy_required;125;central_heating;;;;D;;;;;;
2020-05-30 19:39:24.523775;Berlin;ONE_YEAR_FREE;164338;n;y;https://pictures.immobilienscout24.de/listings/ff4cb6e3-98fb-437e-86f4-26d6d0346996-1362091447.jpg/ORIG/resize/118x118%3E/extent/118x118/format/jpg/quality/80;7;11.37;40 MBit/s;telekom_layer_magenta_l;über VDSL;1905;REGULAR;;11.37;117109798;district_heating;y;false;MagentaZuhause L;y;Berlin;y;11;1;no_information;5.8;230;Berlin;10707;refurbished;sophisticated;false;100 MBit/s;no_information;no_information;n;https://padlock.link/ioml;https://padlock.link/ml;no_information;apartment;10707;5;n;2,active;true;Deutschland;top;100 MBit/s;wohnung_kauf;n;4;;web,email,bank,music,dl-ul,game,sd,mltstr,hd,fast-ul-dl;true;001.164338;2500000;profile0;6;5;true;n;showqualicontactform;n;n;Wilmersdorf_Wilmersdorf;AIB12868;7;Berlin;/expose/117109798;"['Es handelt sich um eine herrschaftliche 5-Zimmer-Designer-Wohnung mit ca. 230 qm repräsentativer & stilvoller Wohnfläche, gelegen im 4 Obergeschoss eines herrschaftlichen Gründerzeit-Altbaus aus dem Jahre 1905, welcher in den Jahren 2013-2015 sehr aufwendig saniert und modernisiert wurde.\r\rDie Wohnung verfügt über einen großzügigen Empfang, ein modernes Gäste-WC, ein herrschaftliches Wohnzimmer, ein großes Speisezimmer mit offener Küche, ein geräumiges Kinder-/ Arbeitszimmer, ein großes Schlafzimmer mit Zugang zum exklusiven Designer-Bad, ein großzügiges Kinderzimmer mit Zugang zum Südbalkon, ein exklusives Designer-Badezimmer, sowie einen Hauswirtschaftsraum.\r\rDie Wohnung wurde für über 300.000,- € sehr hochwertig ausgestattet und befindet sich in einem hervorragenden Gesamtzustand.\rZu den besonderen Ausstattungsmerkmalen gehören: hochwertige Parkettböden, stuckverzierte Decken mit ca. 3,70 m Deckenhöhe, zwei exklusive Designer-Bäder mit Fußbodenheizung, modernes Gäste-WC, glatt gespachtelte Wände.\r\rDas Haus verfügt über einen Aufzug sowie einen lichtdurchfluteten und begrünten Innenhof mit einem kleinen Teich. Die Heizungsversorgung erfolgt über eine moderne Fernwärmeheizung, die Warmwasserversorgung erfolgt dezentral. Der Energieverbrauchskennwert des Gebäudes beträgt 102 kWh/(qm∙a).\r\rZu der Wohnung gehört ein Kellerraum. Die Wohnung ist sofort bezugsfrei. ', 'Eine ausgezeichnete Adresse in sehr begehrter Lage von Berlin-Wilmersdorf – nur wenige Gehminuten zum Kurfürstendamm, zwischen Ludwigkirchplatz und Olivaer Platz!', 'Unser Service für Eigentümer\rWir stehen Ihnen bei dem Verkauf Ihrer Immobilie vom Anfang bis zum fertigen Abschluss diskret und kompetent zur Verfügung. \rJeder Schritt erfolgt nach Absprache mit Ihnen. \rSie entscheiden über die Verkaufsstrategie Ihres Objektes, ob diskret und ""off-market"" oder eine qualifizierte Vermarktung in Print- sowie Onlinemedien. \rWir verfügen immer über den richtigen Käufer. \rZudem bewerten wir Ihre Immobilie kostenfrei, entsprechend dem aktuellen Marktwert.\rGerne beraten wir Sie kostenlos persönlich in unserem Büro, per Telefon oder per E-Mail!\rWir freuen uns von Ihnen zu hören!\rwww.immo-boerse.com']";;energy_consumption;102;district_heating;;;2015;;;;;;;
2020-05-30 19:39:24.900070;Berlin;ONE_YEAR_FREE;17689537;n;n;https://pictures.immobilienscout24.de/listings/823449ae-eafb-4830-b233-4399075ff9c0-1361997987.jpg/ORIG/resize/118x118%3E/extent/118x118/format/jpg/quality/80;16;11.12;2,4 MBit/s;telekom_layer_magenta_m_hybrid2;über Hybrid;1890;WITH_HYBRID;;11.12;117100436;district_heating;n;false;MagentaZuhause M Hybrid (2);y;Berlin;n;6;1;109;6.13;53.77;Berlin;14057;well_kept;no_information;false;16 MBit/s;no_information;Kaiserdamm;y;https://padlock.link/mmh2sa;https://padlock.link/mmhy2;Kaiserdamm;apartment;14057;2;n;2,active;true;Deutschland;top;50 MBit/s;wohnung_kauf;n;1;;web,email,bank,music,dl-ul,game,sd,mltstr,hd;true;009.d41f4c69-eb7b-4709-b891-42c728a6b026;300000;profile0;7;2;true;n;showqualicontactform;n;n;Charlottenburg_Charlottenburg;FIR003_KD109_WE9;2;Berlin;/expose/117100436;"['ÜBER DEN DÄCHERN VOM KAISERDAMM\n\nDer repräsentative Altbau aus der Gründerzeit befindet sich direkt gegenüber vom Witzlebenplatz mit einem einzigartigen Blick auf den Lietzensee. Das Gebäude erstreckt sich über 6 Etagen, wobei das Dachgeschoss bereits ausgebaut ist. Die Immobilie verfügt über 5 Gewerbe- und 33 Wohneinheiten. Neben dem innen liegendem Lichthof verfügt das Haus über einen weiteren großzügigen und gepflegten Innenhof mit Fahrradabstellmöglichkeiten und einem Zugang zur Witzlebenstraße. Das gesamte Gebäude ist unterkellert und bietet somit weiteren Stauraum.', 'HELLE 2 ZIMMERWOHNUNG IN EINER TOP LAGE\n\nWas Sie erwartet:\n\n*Fischgrätenparkett \n*hohe Decken\n*helle Zimmer\n*Wohnküche', 'GRÜN, GRÜNER, LIETZENSEE\n\nWarum noch in den Urlaub fahren, wenn man die perfekten Erholungsmöglichkeiten direkt vor der Haustür hat? Abgesehen vom Lietzensee und dem Witzlebenplatz befindet sich ebenfalls der Lietzenseepark unmittelbar vor der Immobilie. Genießen Sie bei einem sonnigen Spaziergang die grüne Umgebung und finden Sie in den zahlreichen Cafés und Restaurants Erholung vom Großstadttrubel. Nicht nur Supermärkte, sondern auch die öffentlichen Verkehrsmittel, wie die U-Bahn Station ""Sophie-Charlotte-Platz"" (U2) und verschiedene Busanbindungen, sind in wenigen Gehminuten zu erreichen. Die in ca. 2 min. zu erreichende Stadtautobahn (A100), bietet Ihnen die Möglichkeit schnell von A nach B zu gelangen und somit problemlos das Berliner Umland zu erreichen.', 'Wir freuen uns von Ihnen zu hören und stehen für weitere Fragen und einen Besichtigungstermin selbstverständlich gern zur Verfügung!']";161.55;energy_required;164.6;central_heating;;;;;;;;10 MBit/s;50 MBit/s;
2020-05-30 19:39:25.287734;Berlin;ONE_YEAR_FREE;17689537;n;n;https://pictures.immobilienscout24.de/listings/8ded57bd-26d9-408a-8c6f-91528e7a817e-1362003935.jpg/ORIG/resize/118x118%3E/extent/118x118/format/jpg/quality/80;14;10.81;40 MBit/s;telekom_layer_magenta_l;über VDSL;1918;REGULAR;;10.81;117102019;gas;n;false;MagentaZuhause L;n;Berlin;n;5;1;50;6.01;45.44;Berlin;12161;well_kept;no_information;false;100 MBit/s;no_information;"Rheinstra&szlig;e";n;https://padlock.link/ioml;https://padlock.link/ml;Rheinstraße;apartment;12161;1;n;2,active;true;Deutschland;top;100 MBit/s;wohnung_kauf;n;2;;web,email,bank,music,dl-ul,game,sd,mltstr,hd,fast-ul-dl;true;009.d41f4c69-eb7b-4709-b891-42c728a6b026;240000;profile0;4;1;true;n;showqualicontactform;n;n;Friedenau_Schöneberg;EBO010_RS50_WE21.1;2;Berlin;/expose/117102019;['REPRÄSENTATIVER ALTBAU IN EINER ATTRAKTIVEN LAGE\n\nDieser repräsentative und gepflegte Altbau aus dem Jahre 1918 umfasst insgesamt 27 Wohn- und 3 Gewerbeeinheiten. Des Weiteren bietet Ihnen diese Immobilie einen großzügigen und begrünten Hinterhof mit Fahrradabstellmöglichkeiten.', 'HELLE 1 ZIMMERWOHNUNG IN EINER TOP LAGE\n\nFolgende Ausstattungsmerkmale sind vorhanden:\n\n*helle Wohnung\n*top geschnitten\n*Dielen\n*Wannenbad\n*große Küche', 'ALLES, WAS DAS HERZ BEGEHRT \n\nFriedenau bildet den perfekten Übergang zwischen den dicht bebauten Innenstadtbezirken und den suburbanen Villen- und Eigenheimvororten. Der perfekte Ort für alle, die die Ruhe schätzen und trotzdem die Nähe zum Stadtzentrum nicht missen möchten. \n\nDas unmittelbare Umfeld dieser Immobilie bietet Ihnen ein eine nahezu perfekte Infrastruktur und bildet somit eine ideale Grundlage für Ihre Zukunft in der Rheinstraße. Ob eine Runde shoppen in der 5 min. entfernten Schlossstraße oder ein netter Abend am Rüdesheimer Platz mit einem Glas Wein. Diese und noch viele weitere Freizeitangebote machen diesen Ortsteil zu einem ganz Besonderen. \n\nAuch das Bildungsangebot kommt hier nicht zu kurz. Diverse Schulen und die Freie Universität sind unweit von der Immobilie vorzufinden. \nZu allen Anlaufstellen gelangen Sie in kürzester Zeit sowohl mit U- und S-Bahn, also auch mit Bussen.', 'Wir freuen uns von Ihnen zu hören und stehen für weitere Fragen und einen Besichtigungstermin selbstverständlich gern zur Verfügung!'];162.55;energy_required;307;central_heating;;;;;;;;;;
2020-05-30 19:39:25.876744;Berlin;;15474925;n;y;https://pictures.immobilienscout24.de/listings/125aab7d-cac0-47b4-a70b-08864e23f625-1362123974.png/ORIG/resize/118x118%3E/extent/118x118/format/jpg/quality/80;18;12.25;;;;1980;;;12.25;117121592;oil;n;false;;y;Berlin;y;5;3;76,;6.83;86.37;Berlin;12103;no_information;no_information;false;;outside;Borussiastr.;y;;;Borussiastr.;apartment;12103;3;n;2,active;;Deutschland;top;;wohnung_kauf;n;3;;;;001.15417560;249000;profile0;4;3;true;y;;n;n;Tempelhof_Tempelhof;VK-19496_WE07b;4;Berlin;/expose/117121592;"['Die Wohnung befindet sich im 3. OG eines Mehrfamilienhauses, ist bequem mit dem Fahrstuhl zu erreichen und verfügt über ca. 86,37 m², die sich über drei Zimmer verteilen. \n\nDie Küche, das Bad und ein Schlafzimmer sind nördlich zum Hof ausgerichtet.  Das Wohnzimmer, das zweite Schlafzimmer und die Loggia, die von beiden Zimmern zugänglich ist, sind südlich zur Straße ausgerichtet.  Die Loggia lädt an warmen Sommertagen zum Erholen und Entspannen ein.\n\nAbgerundet wird das Angebot durch einen Keller.\n\nBei Bedarf kann die Sondernutzung eines PKW-Stellplatzes zu einem Preis von 10.000 EUR erworben werden.\n\nEs handelt sich um ein Erbbaugrundstück.  Die Wohnung ist öffentlich gefördert, so dass bis zum 31.12.2029 eine Mietpreisbindung gegeben ist.  Die Miete kann im Rahmen der gesetzlichen Vorgaben erhöht werden, da der Mietendeckel bei öffentlich geförderten Wohnung nicht anwendbar ist.\n\nIn dem Hausgeld sind die Kosten für die Erbpacht enthalten.\n\nDie Wohnung ist bezugsfrei!', 'Die Immobilie befindet sich in einer sehr begehrten Wohngegend in Tempelhof zwischen dem Tempelhofer Feld und dem Tempelhofer Hafen.\n\nDer Tempelhofer Damm ist fußläufig zu erreichen. Es befinden sich dort diverse Einkaufsmöglichkeiten, kleinere Geschäfte, Cafes und Restaurants, Banken und Arztpraxen.  In der näheren Umgebung befindet sich weiterhin Karstadt und das Einkaufszentrum „Tempelhofer Hafen“.   Direkt am Wasser gelegen bietet der ""Tempelhofer Hafen"" mit diversen Cafes und Restaurants ein kleines Urlaubsfeeling.\n\nDie öffentlichen Verkehrsmittel sind zügig zu erreichen, diverse Buslinien stehen zur Verfügung, die U-/S-Bahn Tempelhof und die U-Alt Tempelhof befinden sich ganz in der Nähe. Über die A100 ergibt sich mit dem PKW eine hervorragende Anbindung in südliche und in nördliche Richtung sowie ins Umland.']";552.57;energy_consumption;132.5;oil_heating;;1;;E;;;;;;
2020-05-30 19:39:26.245138;Berlin;ONE_YEAR_FREE;17689537;n;n;https://pictures.immobilienscout24.de/listings/a0ce2c68-2c24-40fd-af48-145035caa3b5-1363804857.jpg/ORIG/resize/118x118%3E/extent/118x118/format/jpg/quality/80;13;10.95;40 MBit/s;telekom_layer_magenta_l;über VDSL;1906;REGULAR;;10.95;117108524;district_heating;n;false;MagentaZuhause L;n;Berlin;n;7;1;103;6.54;52.08;Berlin;10439;well_kept;no_information;false;100 MBit/s;no_information;"Sch&ouml;nhauser Allee";y;https://padlock.link/ioml;https://padlock.link/ml;Schönhauser_Allee;apartment;10439;2;n;2,active;true;Deutschland;top;100 MBit/s;wohnung_kauf;n;4;;web,email,bank,music,dl-ul,game,sd,mltstr,hd,fast-ul-dl;true;009.d41f4c69-eb7b-4709-b891-42c728a6b026;325000;profile0;5;2;true;n;showqualicontactform;n;n;Prenzlauer_Berg_Prenzlauer_Berg;SAG004_SA103_WE29;2;Berlin;/expose/117108524;"['ANSPRECHENDER UND INTERESSANTER ALTBAU!\n\nDer sehr gepflegte und ansprechende Altbau besteht aus 2 größeren Gewerbeeinheiten sowie 35 Wohnungen, die sich über das Vorderhaus, 2 Seitenflügel und 2 Gartenhäuser erstrecken. Alle Gebäudeteile sind unterkellert. Die Innenhöfe sind geschmackvoll gestaltet und als gepflegt zu bezeichnen. Das Dachgeschoss ist bereits ausgebaut. Außerdem verfügen fast alle Gebäudeteile über Aufzüge.', 'PERFEKT GESCHNITTEN - HELL - KLASSISCHE ALTBAUWOHNUNG!\n\nRenovierte, helle und praktisch geschnittene Wohnung in gutem Zustand mit Dielenboden, modern gefliestem Wannenbad mit Fenster sowie separater und ausreichend großer Küche mit Fenster. Die Wohnung ist äußerst praktisch geschnitten und verfügt über separate Zimmer, welche ausreichend groß demensioniert sind.   \nEine schöne 2-Zimmerwohnung in einer sehr gefragten Lage im quirligen Prenzlauer Berg!', 'MITTEN IM LEBEN - ATTRAKTIVE LAGE IN BERLIN - PRENZLAUER BERG!\n\nAbsolut reizvolle und sehr gefragte Lage in Prenzlauer Berg! Das Wohnumfeld zeichnet sich unter anderem durch eine Vielzahl von Restaurants, Bars, Cafés, Clubs sowie Einkaufsmöglichkeiten aus. Kleinere Läden und Geschäfte zum ""Schmökern"" in den Seitenstraßen, aber auch größere Einkauszentren (z. B. die ""Schönhauser-Allee-Arcaden"") zeigen die Vielfältigkeit dieser Wohnlage. Selbstverständlich sind auch Kitas, Schulen, Bibliotheken, kulturelle Einrichtungen, kleine Galerien und Ärzte in unmittelbarer Wohnumgebung vorhanden. Viele kleine (Arnimplatz und Humannplatz) und größere Parks (Mauerpark) stehen Ihnen als ""grüne Inseln"" im bewegten Großstatdtalltag zur Verfügung. Die Anbindung an die öffentlichen Verkehrsmittel ist hervorragend. Der S-/U-Bahnhof Schönhauser Allee (Ringbanh, U 2 sowie diverse Tram- und Buslinien) ist in Kürze fußläufig erreichbar.', 'Wir freuen uns von Ihnen zu hören und stehen für weitere Fragen und einen Besichtigungstermin selbstverständlich gern zur Verfügung!']";172.32;energy_required;365;district_heating;;;;;;true;;;;
2020-05-30 19:39:26.596087;Berlin;ONE_YEAR_FREE;17689537;n;n;https://pictures.immobilienscout24.de/listings/259fb0e7-9e81-4a3a-a9c9-9e3a668d2029-1362004634.jpg/ORIG/resize/118x118%3E/extent/118x118/format/jpg/quality/80;15;10.81;40 MBit/s;telekom_layer_magenta_l;über VDSL;1918;REGULAR;;10.81;117102328;gas;n;false;MagentaZuhause L;n;Berlin;n;6;1;50;6.01;58.57;Berlin;12161;well_kept;no_information;false;100 MBit/s;no_information;"Rheinstra&szlig;e";n;https://padlock.link/ioml;https://padlock.link/ml;Rheinstraße;apartment;12161;2;n;2,active;true;Deutschland;top;100 MBit/s;wohnung_kauf;n;4;;web,email,bank,music,dl-ul,game,sd,mltstr,hd,fast-ul-dl;true;009.d41f4c69-eb7b-4709-b891-42c728a6b026;299000;profile0;4;2;true;n;showqualicontactform;n;n;Friedenau_Schöneberg;EBO010_RS50_WE26.1;2;Berlin;/expose/117102328;['REPRÄSENTATIVER ALTBAU IN EINER ATTRAKTIVEN LAGE\n\nDieser repräsentative und gepflegte Altbau aus dem Jahre 1918 umfasst insgesamt 27 Wohn- und 3 Gewerbeeinheiten. Des Weiteren bietet Ihnen diese Immobilie einen großzügigen und begrünten Hinterhof mit Fahrradabstellmöglichkeiten.', 'TOP GESCHNITTENE 2 ZIMMERWOHNUNG \n\nFolgende Ausstattungsmerkmale sind vorhanden:\n\n*helle Wohnung\n*top Zustand\n*gut geschnitten\n*Dielen\n*Doppelkastenfenster', 'ALLES, WAS DAS HERZ BEGEHRT \n\nFriedenau bildet den perfekten Übergang zwischen den dicht bebauten Innenstadtbezirken und den suburbanen Villen- und Eigenheimvororten. Der perfekte Ort für alle, die die Ruhe schätzen und trotzdem die Nähe zum Stadtzentrum nicht missen möchten. \n\nDas unmittelbare Umfeld dieser Immobilie bietet Ihnen ein eine nahezu perfekte Infrastruktur und bildet somit eine ideale Grundlage für Ihre Zukunft in der Rheinstraße. Ob eine Runde shoppen in der 5 min. entfernten Schlossstraße oder ein netter Abend am Rüdesheimer Platz mit einem Glas Wein. Diese und noch viele weitere Freizeitangebote machen diesen Ortsteil zu einem ganz Besonderen. \n\nAuch das Bildungsangebot kommt hier nicht zu kurz. Diverse Schulen und die Freie Universität sind unweit von der Immobilie vorzufinden. \nZu allen Anlaufstellen gelangen Sie in kürzester Zeit sowohl mit U- und S-Bahn, also auch mit Bussen.', 'Wir freuen uns von Ihnen zu hören und stehen für weitere Fragen und einen Besichtigungstermin selbstverständlich gern zur Verfügung!'];200.1;energy_required;307;central_heating;;;;;;;;;;
