timestamp;obj_regio1;obj_telekomTvOffer;obj_cId;obj_newlyConst;obj_balcony;obj_picture;obj_picturecount;obj_pricetrend;obj_telekomUploadSpeed;obj_telekomTrackingGroup;obj_telekomInternetTechnology;obj_yearConstructed;obj_telekomInternetType;obj_project_id;obj_pricetrendbuy;obj_scoutId;obj_firingTypes;obj_hasKitchen;obj_ExclusiveExpose;obj_telekomInternetProductName;obj_courtage;geo_bln;obj_cellar;obj_purchasePriceRange;obj_yearConstructedRange;obj_houseNumber;obj_pricetrendrent;obj_livingSpace;geo_krs;obj_zipCode;obj_condition;obj_interiorQual;ga_cd_cxp_historicallisting;obj_telekomDownloadSpeed;obj_parkingSpace;obj_street;obj_lift;obj_telekomInternetUrlMobile;obj_telekomInternetUrl;obj_streetPlain;obj_typeOfFlat;geo_plz;obj_noRooms;obj_assistedLiving;obj_ityp;obj_telekomHdTelephone;geo_land;ga_cd_via;obj_telekomInternet;obj_immotype;obj_rented;obj_floor;obj_nbp;obj_telekomInternetServices;obj_telekomInternetProductAvailable;obj_cwId;obj_purchasePrice;ga_cd_application_requirements;obj_numberOfFloors;obj_noRoomsRange;ga_cd_maillead_default_shown;obj_garden;evt_count_pm_sig;obj_barrierFree;obj_international;obj_regio3;obj_objectnumber;obj_livingSpaceRange;obj_regio2;URL;beschreibung;obj_rentSubsidy;obj_energyType;obj_thermalChar;obj_heatingType;obj_groupnumber;obj_noParkSpaces;obj_lastRefurbish;obj_energyEfficiencyClass;ga_cd_via_qualified;ga_cd_developer_virtualreality;obj_usableArea;obj_telekomHybridUploadSpeed;obj_telekomHybridDownloadSpeed;obj_galleryAd
2020-05-30 19:39:20.289420;Berlin;ONE_YEAR_FREE;14564385;y;y;https://pictures.immobilienscout24.de/listings/06e18990-fe08-4eb1-b3f2-65c8aacca2e9-1361996728.jpg/ORIG/resize/118x118%3E/extent/118x118/format/jpg/quality/80;23;10.07;40 MBit/s;telekom_layer_magenta_l;über VDSL;2020;REGULAR;90480;10.07;112335644;no_information;n;false;MagentaZuhause L;y;Berlin;n;8;9;no_information;6.01;70.59;Berlin;12489;first_time_use;no_information;false;100 MBit/s;no_information;no_information;y;https://padlock.link/ioml;https://padlock.link/ml;no_information;roof_storey;12489;2;n;2,active;true;Deutschland;top;100 MBit/s;wohnung_kauf;n;5;true;web,email,bank,music,dl-ul,game,sd,mltstr,hd,fast-ul-dl;true;002.01000719412;407657;profile0;5;2;true;n;showqualicontactform;n;n;Adlershof_Treptow;N-118;3;Berlin;/expose/112335644;['Der Neubau des Mehrfamilienhauses Waldstraße 14 erfolgt als Lückenbebauung und fügt sich mit den beiden angrenzenden Bestandsgebäuden zu einem harmonischen Gesamtbild. \n\nAuf einer Grundstücksgröße von 525 qm entstehen insgesamt 12 Wohneinheiten verteilt auf 5 Etagen, über eine Gesamtwohnfläche von ca. 1090 qm.\n\nDabei ist für jede Obergeschoss-Wohnung ein Balkon mit ca. vier bzw. sechs Quadratmeter in Südostausrichtung geplant. \n\nDie Erdgeschosswohnungen verfügen über eine Gartenterrasse und die Dachgeschosswohnungen über Zugang zu je zwei großzügigen, bis zu 20 qm großen Dachterrassen. Dabei fällt der Blick in den grünen Innenhof, der neben einem hauseigenen Spielplatz auch Fahrradstellplätze bietet. \n\nUm den Mietern den Zugang zu den oberen Geschossen zu erleichtern, ist ein Personenaufzug geplant, welcher vom Erdgeschoss bis in das Dachgeschoss', '+ Parkett\n+ Feinsteinzeug Markenfabrikat\n+ geräuscharmer und barrierefreier Aufzug \n+ qualitativ hochwertige Badarmaturen\n+ bodengleiche Rainshower Duschen\n+ dreifachverglaste Fenster\n+ Außenverschattung\n+ einbruchssichere Wohnungstüren mit Mehrfachverriegelung \n+ glatt gespachtelte Wände\n+ Innentüren mit innenliegenden Türfangbänder \n+ große Balkone bzw. Terrassen\n+ teils Hauswirtschaftsraum mit Waschmaschinenanschluss', 'Das ca. 515 qm große Grundstück Waldstraße 14 befindet sich im Bezirk Treptow-Köpenick westlich des Treptower Zentrums. Die angrenzenden Gebäude sind viergeschossige Gründerzeitgebäude mit Dachgeschossen als Berliner Mansarddächer. \n\nDas Gebiet zeichnet sich durch ca. 3,5 m tiefe Vorgärten vor allen Gebäuden aus. \n\nIn Adlershof wohnen rund 17.000 Menschen, überwiegend im alten Ortskern. \n\nDer Technologiepark und der Uni-Campus liegen am ehemaligen Flugplatz, dem heutigen Park. \n\nAm wichtigsten Wissenschafts-, Wirtschafts- und Medienstandort Berlins erwarten Sie zehn außeruniversitäre Forschungseinrichtungen, sechs Institute der Humboldt-Universität und rund 1.100 technologieorientierte Firmen. \nZudem kommt eine sehr gute Anbindung in das Stadtzentrum von Berlin.'];;;;;;;;;;;;;;
2020-05-30 19:39:20.717567;Berlin;ONE_YEAR_FREE;17689537;n;y;https://pictures.immobilienscout24.de/listings/13b56189-8172-44d2-94c6-05f45299546d-1362001942.jpg/ORIG/resize/118x118%3E/extent/118x118/format/jpg/quality/80;17;10.09;40 MBit/s;telekom_layer_magenta_l;über VDSL;1939;REGULAR;;10.09;117101364;oil;n;false;MagentaZuhause L;n;Berlin;n;6;1;48;4.59;68.85;Berlin;14167;well_kept;no_information;false;100 MBit/s;no_information;"Kilstetter Stra&szlig;e";n;https://padlock.link/ioml;https://padlock.link/ml;Kilstetter_Straße;apartment;14167;2.5;n;2,active;true;Deutschland;top;100 MBit/s;wohnung_kauf;n;3;;web,email,bank,music,dl-ul,game,sd,mltstr,hd,fast-ul-dl;true;009.d41f4c69-eb7b-4709-b891-42c728a6b026;299000;profile0;5;2;true;n;showqualicontactform;n;n;Zehlendorf_Zehlendorf;IVO002_KIL48_WE18;3;Berlin;/expose/117101364;['LEBEN IM GRÜNEN ZEHLENDORF\n\nDas 5-geschossige Wohngebäude aus dem Jahre 1939 verläuft parallel zur Sundgauer Straße im schönen Zehlendorf. Insgesamt beherbergt dieses Objekt 38 Wohneinheiten und ist vollständig unterkellert.', 'TOP GESCHNITTENE 2,5 ZIMMERWOHNUNG MIT BALKON\n\nDiese Wohnung befindet sich in einem gepflegten Zustand. Sie zeichnet sich vor allem durch folgende Ausstattungsmerkmale aus:\n\n* Gut geschnitten\n* Balkon mit Südostausrichtung\n* Einbauküche\n* gefliestes Wannenbad\n* Holzfußböden \n* hell', 'WOHNEN IN GRÜNEN ZEHLENDORF\n\nZehlendorf ist ein Berliner Ortsteil im Bezirk Steglitz-Zehlendorf. Er zählt zu den wohlhabenderen Gebieten Berlins und bietet für Familien die perfekte Basis. Nicht nur Einkaufsmöglichkeiten und öffentliche Verkehrsmittel sondern auch div. Kindergärten, Schulen usw. befinden sich in direkter Umgebung. Darüber hinaus befindet sich das Zentrum von Zehlendorf nur eine Haltestelle von der Kilstetter Straße entfernt und läd somit zu gemütlichen Stadtspaziergängen ein.', 'Wir freuen uns von Ihnen zu hören und stehen für weitere Fragen und einen Besichtigungstermin selbstverständlich gern zur Verfügung!'];283;energy_required;165;;;;;;;;;;;
2020-05-30 19:39:21.119627;Berlin;ONE_YEAR_FREE;97549;n;y;https://pictures.immobilienscout24.de/listings/7d9ae7e4-21c6-4863-9cde-a9a1911999ee-1362003599.jpg/ORIG/resize/118x118%3E/extent/118x118/format/jpg/quality/80;3;10.81;40 MBit/s;telekom_layer_magenta_l;über VDSL;1910;REGULAR;;10.81;117101926;gas;n;false;MagentaZuhause L;y;Berlin;y;6;1;19;6.01;58.96;Berlin;12161;no_information;no_information;false;100 MBit/s;no_information;"Rheingaustra&szlig;e";n;https://padlock.link/ioml;https://padlock.link/ml;Rheingaustraße;apartment;12161;2;n;2,active;true;Deutschland;top;100 MBit/s;wohnung_kauf;y;2;;web,email,bank,music,dl-ul,game,sd,mltstr,hd,fast-ul-dl;true;001.97549;259000;profile0;;2;true;n;showqualicontactform;n;n;Friedenau_Schöneberg;Rheingau19_20;2;Berlin;/expose/117101926;['Der denkmalgeschützte Altbau hat 4 Geschosse.\nDerzeit sind 25 Wohnungen in dem Objekt.', '- Süd-Balkon\n- 2. Obergeschoss\n- vermietet\n- Gartenhaus', 'Das Mehrfamilienhaus wurde ca. 1910 in gutbürgerlicher Lage in  Berlin-Schöneberg, Ortsteil Friedenau, an der Grenze zu Wilmersdorf erbaut. \n\nDie beiden U-Bahnhöfe „Friedrich-Wilhelm-Platz“ und „Rüdesheimer Platz“ sind bequem zu Fuß erreichbar.\nIm Umfeld gibt es zahlreiche Geschäfte und Einkaufsmöglichkeiten, Ärzte, Schulen, Kitas, diverse Restaurants und Cafés.\n\nUnweit befinden sich  das „Kleine Theater am Südwestkorso“, das „Zimmertheater Steglitz, das Kino „Cinema“, sowie das Kino „Titania Palast“ nahe der Schloßstraße.', 'Die monatliche Bruttomiete beträgt 253,87 €.'];;;;self_contained_central_heating;0;;;;;;;;;
2020-05-30 19:39:21.585657;Berlin;ONE_YEAR_FREE;17946136;n;y;https://pictures.immobilienscout24.de/listings/396a9e24-866a-4d5c-adfc-9df00c541491-1361799563.jpg/ORIG/resize/118x118%3E/extent/118x118/format/jpg/quality/80;23;10.09;40 MBit/s;telekom_layer_magenta_l;über VDSL;1975;REGULAR;;10.09;117073921;oil;y;false;MagentaZuhause L;y;Berlin;n;9;3;no_information;4.59;160;Berlin;14169;refurbished;sophisticated;false;100 MBit/s;garage;no_information;n;https://padlock.link/ioml;https://padlock.link/ml;no_information;roof_storey;14169;5;n;2,active;true;Deutschland;top;100 MBit/s;wohnung_kauf;n;3;;web,email,bank,music,dl-ul,game,sd,mltstr,hd,fast-ul-dl;true;002.01008662528;699000;profile0;3;5;true;y;showqualicontactform;n;n;Zehlendorf_Zehlendorf;117073921;7;Berlin;/expose/117073921;['Die angebotene wunderschöne sanierte Dachgeschosswohnung befindet sich im 3. Obergeschoss des gepflegten Neubaus aus dem Jahre 1975. \n\nDie Wohnung besteht aus drei Schlafzimmern, einem großen Wohnzimmer, einem großzügigen  Esszimmer, einem en-suite Badezimmer mit Tageslicht, einem Gäste-WC, einer Küche, einer wunderschönen großen Terrasse und einem Hobbyraum. \n\nDie Wohnfläche beträgt ca. 130m² zzgl. ca. 30m² Hobbyraum zzgl. ca. 55m² Terrassenfläche. \n\nDie großzügige Terrasse erreichen Sie sowohl von der Küche aus, als auch von dem Wohnzimmer. Die Terrasse ist Richtung Süden ausgerichtet und Sie haben von Morgens bis Abends Sonne. \nZur Terrasse gehört noch eine elektrische Außenjalousie.\n\nDas helle Wohnzimmer verfügt zudem noch über einen offenen Kamin und eine große Fensterfront, die viel Licht in das Wohnzimmer lässt. \n\nDie Küche ist mit einer Einbauküche ausgestattet, welche im Kaufpreis enthalten ist. \n\nIn 2015 wurden die Frisch- und Abwasserstränge in der Wohnung erneuert. \n\nZur Wohnung gehört des weiteren ein ca. 30m² großer Hobbyraum, der sowohl ein Badezimmer mit Dusche, als auch eine Küchenecke beinhaltet. \n\nSowohl die Wohnung, als auch der Hobbyraum sind momentan bewohnt, sind jedoch nach Absprache bezugsfrei zu übergeben. \n\nZusätzlich zur Wohnung können Sie 2 Garagenstellplätze zu je 20.000,00 € Kaufpreis erwerben.\n\nDie gepflegte Eigentumsanlage besteht aus 26 Einheiten und wird größtenteils von den Eigentümern selbst bewohnt.', '- sanierte Dachgeschosswohnung\n- Terrasse (ca. 55m²)\n- Esszimmer\n- Wohnzimmer mit offenem Kamin\n- Einbauküche vorhanden\n- en-suite Badezimmer mit Dusche\n- Gäste-WC\n- Kunststoff-Iso-Fenster\n- Hobbyraum (ca. 30m²)\n- 2 Garagenstellplätze vorhanden (je 20.000€) \n- gepflegte Wohnanlage\n- Fahrradabstellraum\n- Waschraum\n- Garten nutzbar', 'Das angebotene Objekt befindet sich im schönen familienfreundlichen Zehlendorf in Zehlendorf-Mitte. \n\nIn wenigen Minuten erreichen Sie sowohl Einkaufsmöglichkeiten und Dienstleister des täglichen Bedarfs, als auch Apotheken und Ärzte.\n\nCafés, Bars und Restaurants sind in unmittelbarer Umgebung erreichbar.  \n\nKindergärten und Schulen sind ebenfalls in ausreichender Anzahl vorhanden. \n\nDie Anbindung an den öffentlichen Nahverkehr ist sehr gut. Sowohl Busse als auch der S-Bhf Zehlendorf (S1) und der S-Bhf Sundgauer Str. (S1) erreichen Sie in wenigen Gehminuten.\n\nIn knapp 5 Kilometern erreichen SIe das Steglitzer Zentrum mit dem Rathaus Steglitz und der bekannten Schloßstraße mit ihren zahlreichen Einkaufsmöglichkeiten und Shopping-Centern.', 'Alle Angaben sind ohne Gewähr und beruhen ausschließlich auf Informationen, die uns vom Verkäufer übermittelt wurden. Wir übernehmen keine Gewähr für die Vollständigkeit und Richtigkeit der Angaben. \nSollte das von uns angebotene Objekt Ihnen bereits bekannt sein, teilen Sie uns dies bitte unverzüglich mit. \nDie Weitergabe des Exposés an Dritte ohne unsere Zustimmung kann ggf. Courtage- bzw. Schadensersatzansprüche nach sich ziehen.'];562;energy_consumption;216;central_heating;;2;2015;;;;;;;
2020-05-30 19:39:22.084851;Berlin;ONE_YEAR_FREE;213082;n;y;https://pictures.immobilienscout24.de/listings/3d21761a-f4db-4dfe-b4b4-c06f966ca573-1362008501.jpg/ORIG/resize/118x118%3E/extent/118x118/format/jpg/quality/80;7;10.18;40 MBit/s;telekom_layer_magenta_l;über VDSL;1910;REGULAR;;10.18;117103809;gas;n;false;MagentaZuhause L;y;Berlin;y;6;1;29;5.21;74.28;Berlin;12207;well_kept;normal;false;100 MBit/s;no_information;"M&uuml;llerstr.";n;https://padlock.link/ioml;https://padlock.link/ml;Müllerstr.;apartment;12207;3;n;2,active;true;Deutschland;standard;100 MBit/s;wohnung_kauf;n;2;;web,email,bank,music,dl-ul,game,sd,mltstr,hd,fast-ul-dl;true;001.213082;298995;profile0;4;3;true;n;;n;n;Lichterfelde_Steglitz;rwi7644;3;Berlin;/expose/117103809;['Das Haus ist ein schöner Altbau in ruhiger Lage. Er wurde 1910 gebaut mit einer Hochparterre zwei Obergeschossen. Das Dach darüber ist, Stand September 2019, nicht ausgebaut. In dem Haus gibt es ausschließlich Wohnungen die sich über die Etagen in einem Vorderhaus und einem kurzen Seitenflügel verteilen. \r\rDie Ausrichtung des Hauses ist West-Ost. Zur Straße und Hof hin gibt es Balkone mit unterschiedlicher Ausrichtung. Der Hinterhof ist weitläufig und grün. ', 'Diese Wohnung ist befindet sich im 2. OG des Vorderhauses, hat 2 Zimmer und einen Balkon mit Ost-Ausrichtung. \r\rDie Zimmer zeigen zum grünen Innenhof und eines der beiden hat den erwähnten Balkon. Schöne Holzdielen und ein paar Stuckelemente sind in der Wohnung vorhanden. Das Vollbad und die Küche haben jeweils ein Fenster. \r\rDer Schnitt ist aktuell etwas eigenwillig. Daher haben wir einen unverbindlichen Vorschlag zur Umgestaltung entworfen, so dass hier 3 Zimmer entstehen würden. Hier würde ein Zimmer verlegt werden, und der große Raum zu einer großzügigen Wohnküche umgestaltet werden. Bitte beachten Sie, dass etwaige Kosten für Renovierung oder Umbauten NICHT im Kaufpreis enthalten sind. \r\rWeitere Details auf Anfrage. ', 'Das befindet sich in einer guten Lage in Lichterfelde in der Nähe der Grenze zu Brandenburg. Die Gegend ist durch recht lockere Bebauung gekennzeichnet. \r\rDas Haus selbst liegt in einer ruhigen Straße. Restaurants, Supermärkte, Friseur, Apotheke etc. sind aber fußläufig am nahen Ostpreußendamm erreichbar. Auch die Anbindung an den Nahverkehr ist durch die schnelle Erreichbar verschiedener Buslinien gegeben. Auch die S-Bahn-Haltestelle Osdorfer Str. ist nicht weit. Nahe Parks, der Teltowkanal oder die bekannte TV-Asahi-Kirschblütenallee (s.u.) bieten Entspannung von dem Stress des Alltags. ', 'Der Käufer hat bei Abschluss des Kaufvertrages eine Provision in Höhe von 7,14 % inkl. Mehrwertsteuer vom Kaufpreis an uns zu zahlen. Verdient und fällig bei Beurkundung. Alle Angaben sind ohne Gewähr und nach den Unterlagen des Eigentümers erstellt. Irrtümer und Änderungen vorbehalten. Bei aller Sorgfalt können wir keine Garantie dafür übernehmen, dass alle Angaben richtig sind, und das Objekt im Augenblick des Zugangs der Offerte noch verfügbar ist. \r\rBei Anfragen bitten wir um vollständige Absenderangaben. \r\rGerne zeigen wir Ihnen das Objekt, und freuen uns auf einen persönlichen Termin mit Ihnen. \r\rSie erreichen uns wie folgt:\rRüdiger Wilkanowski Immobilien\rIn Kooperation mit:\r\rJohannes Rudert Immobilien\rTelefon: 0174-9542360\rFax: 030 / 85605613\r\rGerne zeigen wir Ihnen das Objekt, und freuen uns auf einen persönlichen Termin mit Ihnen. \r\rWeitere interessante Angebote finden Sie auch im Internet unter www.wilkanowski-immobilien.de.\r\rSie wollen Ihre Immobilie verkaufen ?\r \rWir suchen im Stadtgebiet von Berlin Immobilien (freie Eigentumswohnungen, Mehrfamilienhäuser und Einfamilienhäuser). Sprechen sie uns gerne an oder vereinbaren Sie einen persönlichen Termin mit uns: 030-85605612.'];166.75;energy_consumption;179;self_contained_central_heating;2001;;;F;;;;;;
2020-05-30 19:39:22.433262;Berlin;;1011756;n;n;https://pictures.immobilienscout24.de/listings/917de26a-edbf-4746-bbfa-e63f23c52e40-1362119197.jpg/ORIG/resize/118x118%3E/extent/118x118/format/jpg/quality/80;11;11.24;;;;1909;;;11.24;117120421;no_information;n;false;;y;Berlin;n;8;1;no_information;6.2;110;Berlin;10717;no_information;no_information;false;;no_information;no_information;n;;;no_information;roof_storey;10717;4;n;2,active;;Deutschland;top;;wohnung_kauf;n;5;;;;001.1011756;450000;profile0;5;4;true;n;showqualicontactform;n;n;Wilmersdorf_Wilmersdorf;I-00TFOU-W-02HFQA;5;Berlin;/expose/117120421;['Der hier angebotene Dachgeschossrohling bietet Ihnen auf ca. 110 m² viel Platz zur Umsetzung Ihrer persönlichen, individuellen Gestaltungskonzepte um Ihr eigenes Wohnidyll zu kreieren. Möglich ist beispielsweise eine Grundriss-Variante mit Dachterrasse und vier Zimmern oder ein weitläufiger Ausbau mit Loft-Charakter. Dank einer schönen Ausrichtung zum parkähnlichen Innenhof wird dieses Objekt eine wahre Oase der Ruhe. Der Kiez besticht durch seine lebendige Nachbarschaft, welche reich an Spezialitätengeschäften, Boutiquen, Cafés und Restaurants ist. Zudem finden sich ein Wochenmarkt, verschiedene Grund- und weiterführende Schulen sowie klassische und bilinguale Kindergärten.', 'Im schönen Bezirk Wilmersdorf in zentraler Lage der Berliner Innenstadt liegt der begehrte Güntzelkiez. In einer grünen und ruhigen Wohngegend präsentiert sich hier ein ausgesprochen ansprechendes Wohnobjekt. Das im Jahr 1909 fertiggestellte Gebäude reiht sich unaufdringlich in die Umgebung aus klassischen Bürgerhäusern mit reich verzierten Stuckfassaden und schönem Baumbestand ein.', 'Die Courtage in Höhe von 7,14 % inkl. der gesetzlichen Mehrwertsteuer auf den Kaufpreis ist mit dem Zustandekommen des Kaufvertrages (notarieller Vertragsabschluss) verdient und fällig. Die vermittelnde und/oder nachweisende Engel & Völkers Berlin Mitte GmbH (Lizenznehmer der Engel & Völkers Residential GmbH ) und ggf. deren Beauftragter, erhalten einen unmittelbaren Zahlungsanspruch gegenüber dem Käufer (Vertrag zugunsten Dritter, § 328 BGB).\r\nHinweise: \r\nAlle Angaben sind ohne Gewähr und basieren ausschließlich auf Informationen, die uns von unserem Auftraggeber übermittelt wurden. Wir übernehmen keine Gewähr für die Vollständigkeit, Richtigkeit und Aktualität dieser Angaben. Zwischenvermietung bleibt vorbehalten. Sollte das von uns nachgewiesene Objekt bereits bekannt sein, teilen Sie uns dieses bitte unverzüglich mit. Die Weitergabe dieses Exposés an Dritte ohne unsere Zustimmung löst gegebenenfalls Courtage- bzw. Schadensersatzansprüche aus. Im übrigen gelten die allgemeinen Geschäftsbedingungen für die Rechtsbeziehung zwischen Ihnen und Engel & Völkers Büro Berlin Mitte GmbH. Wir stehen Ihnen mit weiteren Informationen zum Objekt und zum Eigentümer sowie für Besichtigungen gern zur Verfügung.'];350;;;;;;2012;;;;;;;
2020-05-30 19:39:22.785941;Berlin;ONE_YEAR_FREE;17532864;n;y;https://pictures.immobilienscout24.de/listings/27562f52-f0b7-44d1-92d1-e58c0dbac586-1362408907.png/ORIG/resize/118x118%3E/extent/118x118/format/jpg/quality/80;22;10.99;40 MBit/s;telekom_layer_magenta_l;über VDSL;1890;REGULAR;;10.99;117099778;natural_gas_light;y;false;MagentaZuhause L;y;Berlin;y;8;1;38;6.55;99;Berlin;12459;no_information;no_information;false;100 MBit/s;no_information;"Firlstra&szlig;e";n;https://padlock.link/ioml;https://padlock.link/ml;Firlstraße;apartment;12459;4;n;2,active;true;Deutschland;premium;100 MBit/s;wohnung_kauf;y;2;;web,email,bank,music,dl-ul,game,sd,mltstr,hd,fast-ul-dl;true;009.d53f6f16-60ab-4c52-9aaa-3b9f9fcb1cfc;429000;profile0;4;4;true;n;showqualicontactform;n;n;Oberschöneweide_Köpenick;117099778;4;Berlin;/expose/117099778;"['Diese sehr schöne Vier-Zimmer-Eigentumswohnung mit Balkon befindet sich im zweiten Obergeschoss, im Vorderhaus des um die Jahrhundertwende errichteten Altbaus. Alle Zimmer, bis auf die Küche und das Badezimmer, sind mit warmen Holzdielenböden verlegt und sorgen für ein angenehmes Wohngefühl. Der Balkon ist vom Wohnzimmer aus begehbar und gewährt den nordöstlichen Blick ins Grüne, in Richtung Wuhlheide, sowie südwestlich in Richtung Spreeufer. Das helle Badezimmer ist neben einer Toilette und einer Dusche auch mit zwei separaten Waschbecken, hochwertigen Fliesen, Armaturen sowie indirekten Beleuchtungselementen ausgestattet. Die großzügige Küche ist ebenfalls sehr modern eingerichtet und wie das Badezimmer voll verfliest. Ein trockener Kellerraum gehört dieser Wohnung ebenfalls an. Der Innenhof ist wie das gesamte Haus sehr gepflegt und für die Bewohner zur gemeinschaftlichen Nutzung vorgesehen.\r\n\r\nDie Wohnung ist seit April 2019 unbefristet vermietet. Die im Mietvertrag vereinbarte Nettokaltmiete erhöht sich frühestens nach Ablauf eines Jahres gemäß den nachfolgenden Staffeln: \r\n\r\nvom 01.04.2019 bis zum 31.03.2021 beträgt die Nettokaltmiete 1.200 Euro. \r\nvom 01.04.2021 bis zum 31.03.2023 beträgt die Nettokaltmiete 1.230 Euro. \r\nvom 01.04.2023 bis zum 31.03.2025 beträgt die Nettokaltmiete 1.265 Euro. \r\nvom 01.04.2025 bis zum 31.03.2027 beträgt die Nettokaltmiete 1.305 Euro. \r\nvom 01.04.2027 bis zum 31.03.2029 beträgt die Nettokaltmiete 1.350 Euro. \r\n', 'Wir bitten um Ihr Verständnis, dass wir aus Diskretionsgründen und Rücksicht auf die Privatsphäre der Mieter keine aktuellen Innenaufnahmen veröffentlichen können. Näheres zur Ausstattung der angebotenen Eigentumswohnung erhalten Sie selbstverständlich auf Anfrage. Vereinbaren Sie am Besten gleich einen persönlichen Beratungstermin.', 'Dieser Berliner Altbau aus dem Erbauungsjahr 1890 befindet sich im aufstrebenden Berliner Stadtteil „Oberschöneweide“ und gehört zum Bezirk Treptow-Köpenick. Im Jahr 2008 wurde das Haus zuletzt modernisiert. \r\n\r\nNaherholung bietet nicht nur die fast direkte Wasserlage an der Spree, sondern auch die Nähe zum Spreepark Berlin der unmittelbar an den Treptower Park angrenzt sowie die ""Parkbühne Wuhlheide"" die nur 15 Gehminuten von der Wohnung entfernt liegt. Alle Parks bieten neben viel Grünfläche auch verschiedene Freizeitaktivitäten.\r\n\r\nEine gute Infrastruktur sowohl durch den Nahverkehr, dem Autobahnanschluss zur B96a und A113 als auch durch den Flughafen Schönefeld bietet maximale Flexibilität. Schulen, Kitas, Supermärkte und Freizeiteinrichtungen ergänzen fußläufig den alltäglichen Bedarf.']";270.86;energy_consumption;106;;;;;D;true;;;;;
2020-05-30 19:39:23.131204;Berlin;ONE_YEAR_FREE;17610703;n;n;https://pictures.immobilienscout24.de/listings/58299b17-1b99-4b81-a44f-a9def34ae227-1364499073.jpg/ORIG/resize/118x118%3E/extent/118x118/format/jpg/quality/80;14;12.7;40 MBit/s;telekom_layer_magenta_l;über VDSL;1901;REGULAR;;12.7;117116717;gas;n;false;MagentaZuhause L;y;Berlin;y;3;1;36;7.58;34.29;Berlin;10553;need_of_renovation;normal;false;100 MBit/s;no_information;"Beusselstra&szlig;e";n;https://padlock.link/ioml;https://padlock.link/ml;Beusselstraße;apartment;10553;1;n;2,active;true;Deutschland;top;100 MBit/s;wohnung_kauf;y;1;;web,email,bank,music,dl-ul,game,sd,mltstr,hd,fast-ul-dl;true;009.eb808053-c275-4395-8fce-dc755606f8bd;125000;profile0;4;1;true;n;;n;n;Tiergarten_Tiergarten;117116717;1;Berlin;/expose/117116717;"['Ein klassisches Altbaugebäude aus dem 20. Jahrhundert in dem Sie eine Ein-Zimmerwohnung mit ca. 35 qm im\n1. Obergeschoss erwerben könnt. Die Wohnung ist kompakt und dennoch hat es durch den gut geschnittenen Wohnungsschnitt genug Platz. Die\nWohneinheit besteht aus einem Flur,\nSchlaf/Wohnzimmer, Bad und einer separaten großen Küche.\nDie Wohnung befindet sich im 1. Innenhof in dem Seitenflügel rechts des Gebäudes mit Blick auf den 2. Gartenhof.\n\nDie Wohnung wird in einem Renovierungsbedürftigen Zustand verkauft.', '- Schlaf/Wohnzimmer mit zwei Fenstern\n- separate Küche mit Fenster\n- Badezimmer (gefliest) mit einem kleinen Fenster\n- Bodenbelag besteht aus Dielen', 'Die hier angebotene Immobilie befindet sich in Moabit, ein beliebter und zentraler Berliner Ortsteil, in dem man die unterschiedlichsten Facetten der Hauptstadt hautnah erleben kann. Geschäfte des täglichen Bedarfs und ein vielfältiges gastronomisches Angebot sind fußläufig erreichbar und lassen fast nichts zu wünschen übrig.\n\nFreizeit- und Erholungsmöglichkeiten findet man am nahegelegenen Spreeufer mit seinen vielen Sandstrand-Cafés oder auch im Tiergarten - bekannt als Berlins ""Grüne Lunge"".\n\nDie Anbindungen an den öffentlichen Nahverkehr sind nahezu ideal. Mehrere Buslinien befinden sich praktisch vor der Haustür. Der U-Bahnhof Turmstraße (U9) ist etwa 600 Meter entfernt. Von hier aus sind es lediglich 2 Stationen bis zum Zoologischen Garten.', 'Die in diesem Exposé angegebenen Wohn- und Nutzflächen und Informationen zum Objekt beruhen auf Angaben Dritter. Für die Richtigkeit der Angaben übernehmen wir keine Gewähr. Irrtum und Zwischenverkauf/Zwischenvermietung vorbehalten.']";173;energy_consumption;99;central_heating;;;2001;;;true;;;;
