2020-05-30 20:01:51.140877;Berlin;no_information;ONE_YEAR_FREE;17673554;n;n;https://pictures.immobilienscout24.de/listings/1056f317-e358-4add-a52b-dffc2f48bdd3-1288482322.png/ORIG/resize/118x118%3E/extent/118x118/format/jpg/quality/80;11;11.14;40 MBit/s;telekom_layer_magenta_l;über VDSL;1958;REGULAR;11.14;110815588;;y;false;MagentaZuhause L;y;Berlin;y;4;2;84;6.17;37;Berlin;10409;no_information;normal;false;100 MBit/s;no_information;storkowerstr;n;https://padlock.link/ioml;https://padlock.link/ml;storkowerstr;apartment;10409;2;n;2,active;true;Deutschland;standard;100 MBit/s;wohnung_kauf;n;web,email,bank,music,dl-ul,game,sd,mltstr,hd,fast-ul-dl;true;002.01008367155;165000;profile0;2;true;n;n;n;Prenzlauer_Berg_Prenzlauer_Berg;Z4417;1;Berlin;/expose/110815588;['Wir bieten eine kleine aber feine renovierte 38 qm Wohnung in Storkower str 84 zwischen Prenz und F´hain, 3 Min. zu Fuß vom Volkspark Friedrichshain.\nDie 2 OG Wohnung befindet sich in der ruhige grüne Hinterhof, hat 2 Zimmern, eine Küche, eine Toilette mit Küche, und eine kleine Abstellraum/Speicher.\nDie Wohnung, wie das Gebäude ist komplett renoviert, und wird vollmöbliert verkauft.\n\nWohnung n. 140 in Grundriss', 'Die 2 OG Wohnung befindet sich in der ruhige grüne Hinterhof, hat 2 Zimmern, eine Küche, eine Toilette mit Dusche, und eine kleine Abstellraum/Speicher.\nDie Wohnung, wie das Gebäude ist komplett renoviert.', 'Die von uns angebotene Wohnung liegt in der Storkowerstr 84, die Bushaltstelle 200 ist 30m weit an die Ecke mit Kniproderstr, das Metrotram M10 wie das Volkspark Friedrichshain befinden sich 3 Minuten zum Fuß. \nDie S-Bahn Greifswalderstr ist 5 Minuten zu Fuß entfernt.', 'Wohnung n. 140 in Grundriss'];;;2;;4;showqualicontactform;;energy_consumption;81;NO_INFORMATION;;237.51;;;;
2020-05-30 20:01:51.537129;Berlin;central_heating;ONE_YEAR_FREE;17444792;n;n;https://pictures.immobilienscout24.de/listings/d91fc4e7-f0c5-4db0-8a38-db35e1d894f1-1283268134.jpg/ORIG/resize/118x118%3E/extent/118x118/format/jpg/quality/80;16;12.1;40 MBit/s;telekom_layer_magenta_l;über VDSL;1974;REGULAR;12.1;110628009;oil;n;false;MagentaZuhause L;y;Berlin;y;5;3;17;7.07;60;Berlin;12157;no_information;normal;false;100 MBit/s;outside;Rembrandtstr.;y;https://padlock.link/ioml;https://padlock.link/ml;Rembrandtstr.;apartment;12157;2;n;2,active;true;Deutschland;standard;100 MBit/s;wohnung_kauf;y;web,email,bank,music,dl-ul,game,sd,mltstr,hd,fast-ul-dl;true;009.b21ae1a5-68f4-4c83-bd24-1d34050521e5;229229.23;profile0;2;true;n;n;n;Schöneberg_Schöneberg;110628009;2;Berlin;/expose/110628009;"['Vermietete Eigentumswohnung als Kapitalanlage.\n\nDie Eigentumswohnung mit einer Größe von ca. 60,00\nm² befindet sich im 1. Obergeschoss links in der \nRembrandtstr. 17 in 12157 Berlin-Schöneberg.\n\nDie Wohnung bietet zwei Zimmer, eine Küche, ein Bad, einen Korridor mit Abstellbereich, einen Balkon zur Hofseite, einen Kellerraum und einen Kfz-Stellplatz\nim Freien.\n\nDie Nettokaltmiete beträgt derzeit 368,00€ mtl. bei einer Betriebs- und Heizkostenvorauszahlung i.H.v. \nderzeit wohl 170,00€ mtl..\n\nMit der jetzigen Nettokaltmiete i.H.v. 6,14€ je Quadratmeter/Wohnfläche befinden wir uns mit Blick auf die Berliner Mietspiegeltabelle 2019 (Stichtag: 01.09.2018) weit entfernt sowohl vom Oberwert von 9,11€ als auch vom Mittelwert von 8,00€. Der Unterwert beträgt 5,70€.\n\nUnd da nun in 2019 offenbar eine brauchbare Verwaltung des Gemeinschaftseigentumes gefunden wurde, beinhaltet das letzte Eigentümerversammlungsprotokoll eine aktuelle Istzustandsaufnahme. Darauf basierend sind folgende Aussagen möglich: Das Instandshaltungsrücklagenguthaben (Stand: 09.12.2019) ist ausreichend dimensioniert für die geplanten Investitionen in 2020, z.B. Dachreparatur; wobei für weitere Investitionen auch auf staatliche Förderungsmöglichkeiten zugegriffen werden. Jedoch auch für eine zukünftig vorzunehmende Fahrstuhlsanierung ist das jetzige Guthaben ausreichend.\n\nWenn die aktuellen Instandhaltungsrücklagenzuführungen für die nächsten Jahre beibehalten werden, wird auch die gesetzlich verlangte und spätestens in 2024 durchzuführende ""Heizkesselerneuerung"" aus Guthaben bestritten.\n\nDas Gesamtobjekt beinhaltet 15 Wohneinheiten.\n\nFür weiterführende Informationen kontaktieren Sie mich bitte.', 'Schöneberg gehört zu den facettenreichsten innerstädtischen Ortsteilen Berlins.\n\nAufgrund seiner zentralen Lage und der Vielfältigkeit \nsind Wohnungen stark nachgefragt, trotz unmittelbarer\nNähe zu den Verkehrsadern (Autobahnen) Berlins.\n\nDie Wohnung befindet sich ca. 100 m vom Dürerplatz\nund dem S-Bahnhof-Friedenau entfernt sowie unweit des Innsbrucker Platzes, der Kaisereiche und der\nHaupt-, Rhein- und Schloßstrasse.\n\nDamit sind diverse Einkaufsmöglichkeiten für Dinge\ndes täglichen Lebens und Bedarfes in unmittelbarer Nähe der Wohnung gegeben, z.B. Edeka, ein\n""Tante-Emma-Laden"", Bäckerei, Cafés, Zeitungskioske, Apotheken, ein Blumenladen ebenso\nwie Restaurants, ein ""Call-A-Pizza""-Laden, ein\nKosmetik- und Eisenwarenladen und eine Fahrschule.\n\nAußerdem befinden sich natürlich auch Briefkästen, Bushaltestellen, die Autobahn, eine Kita und die\n1. Friedenauer Gemeinschaftsschule in der Nähe.', 'Ich bitte um Verständnis, dass ich aus rechtlichen\nGründen Anfragen nur in schriftlicher Form (bevorzugt\nper E-Mail) mit Angabe Ihres vollständigen Namens,\nIhrer Adresse und Rufnummer bearbeiten und\nbeantworten kann.\n\nDas Exposé ist nicht für Dritte bestimmt, sondern nur\nfür den Empfänger selbst!\nBei einer Weitergabe an Dritte haftet der\nAngebotsempfänger für meine Courtage.\n\nFINANZIERUNG: Gerne bin ich Ihnen auch bei der\nFinanzierung dieses Objektes behilflich.\n\nDas Angebot wird im Alleinauftrag vertrieben.\n\nAlle Angaben sind ohne Gewähr und basieren ausschließlich auf Informationen, die mir von meinem\nAuftraggeber bzw. anderer fremder Dritter zur\nVerfügung gestellt wurden.\n\nIch übernehme keine Haftung und Gewähr für die\nVollständigkeit, Richtigkeit und Aktualität dieser\nAngaben.\n\nIrrtum und Zwischenverkauf bleiben ausdrücklich\nvorbehalten.\n\nDer Maklervertrag mit mir kommt durch schriftliche\nVereinbarung oder durch die Inanspruchnahme meiner\nMaklertätigkeit auf der Basis des Objekt-Exposés und\nseiner Bedingungen zustande.\n\nDie Käufercourtage in Höhe von 7,14% auf den\nKaufpreis, einschließlich gesetzlicher Mehrwertsteuer,\nist mit wirksamen notariellen Kaufvertrag verdient und\nfällig.\nDie Höhe der Bruttocourtage unterliegt einer Anpassung\nbei Steuersatzänderung.\nIch erhalte einen unmittelbaren Zahlungsanspruch\ngegenüber dem Käufer.\nGrunderwerbssteuer, Notar- und Gerichtskosten trägt\nder Käufer.']";;;1;;5;showqualicontactform;;energy_consumption;140.36;E;;170;;;;1
2020-05-30 20:01:51.998823;Berlin;district_heating;ONE_YEAR_FREE;15617671;n;y;https://pictures.immobilienscout24.de/listings/8ba42e17-4f98-4d2c-bb34-fc01e0d4e354-1289170447.jpg/ORIG/resize/118x118%3E/extent/118x118/format/jpg/quality/80;11;12.7;40 MBit/s;telekom_layer_magenta_l;über VDSL;2017;REGULAR;12.7;111087349;district_heating;n;false;MagentaZuhause L;y;Berlin;y;11;9;1;7.56;120;Berlin;10555;first_time_use;luxury;false;100 MBit/s;underground_garage;"Bachstra&szlig;e";y;https://padlock.link/ioml;https://padlock.link/ml;Bachstraße;apartment;10555;4;n;2,active;true;Deutschland;premium;100 MBit/s;wohnung_kauf;n;web,email,bank,music,dl-ul,game,sd,mltstr,hd,fast-ul-dl;true;001.15535816;1490000;profile0;4;true;y;y;n;Tiergarten_Tiergarten;10555;5;Berlin;/expose/111087349;['Im Tiergarten wartet eine wahre Traumimmobilie auf Sie!!! https://www.oasis-berlin.com/seiten/index.php\n\nHaben Sie schon eine Wohnung besichtigen können die all die nachfolgenden Dinge in sich vereinigt hat?\n\n\n•\tBeste Sportbedingungen. Wenn Sie gerne laufen oder spazieren gehen, sind sie in einer Minute mitten im Tiergarten und können von dort die größte Parkanlage Berlins erkunden. Oder Sie beginnen Ihren Lauf bzw. Spaziergang direkt vor dem Gebäude und laufen an der Spree entlang vorbei am Bundespräsidialamt, der schwangeren Auster, dem Bundkanzleramt, dem Reichstag bis zum Bode Museum. \n\n•\tTolles Wohnumfeld. Sie wohnen unmittelbar am westfälischen Viertel, das mit seinem gepflegten Altbaubestand zum Verweilen einlädt. Auf der anderen Seite finden Sie das Hansaviertel, dass nicht nur von Touristen, sondern auch von Architekten aus der ganzen Welt besichtigt wird.\n\n•\tEinmalige Architektur. Die Architektur des Gebäudes ist nicht nur modern, sondern sehr hochwertig. Neben riesigen Fensterflächen sind auch die Zwischenräume aus schwarzem Glas gestaltet. Das verleiht, dem Gebäude eine besondere Leichtigkeit. \n\n•\tRepräsentativer Eingangsbereich. Von einem Eingangsbereich zu sprechen ist untertrieben. Es handelt sich vielmehr um eine Lobby wie Sie sie nur aus sehr exklusiven Hotels kennen werden. Dort wird sich auch ein Concierge Service befinden.\n\n•\tGemeinschaftsgarten. Es wird ein großer Gemeinschaftsgarten mit Sitzmöglichkeiten für die Bewohner angelegt. Eingefriedet ist das Ensemble mit einem geschmackvollen Zaun.\n\n•\tEinmalige Gemeinschaftseinrichtungen: Neben einer Sonnenterrasse direkt an der Spree, gibt es darunter auch noch eine Garage für Kanu. Diese können Sie direkt davor zu Wasser lassen und die Spree erkunden. Weiterhin wartet eine große Gemeinschaftsterrasse als Dachterrasse auf sie. Sie wird nicht nur mit Sitzgarnituren, sondern auch mit Pflanzen ausgestattet werden. Ein besonderes Highlight sind auch die Hochbeete die mit Kräutern angelegt werden und von den Bewohnern als Kräutergarten genutzt werden können. \n\n•\tStartklar für das Alter der Elektroelektrizität. In der Tiefgarage gibt es auch Ladestationen für Ihr Elektromobil. \n\n•\tUmfassender Service. Ein Concierge Service ist für Sie von den frühen Morgenstunden bis zum Abend verfügbar. Daher müssen Sie sich nie mehr Sorgen machen, wer Ihre Pakete annimmt oder den Handwerker, wenn Sie es wünschen, in die Wohnung lässt. Die Kosten halten sich dabei im Rahmen, da diese auf eine große Anzahl von Miteigentümern umgelegt werden.\n\n•\tEinmaliger Ausblick. Sie schauen aus den bodentiefen Fenstern nicht nur auf die Spree, sondern über alle umliegenden Gebäude. Von ihrem verglasten Balkon haben Sie einen unverbaubaren Blick auf die Spree und schauen von oben auf den vor Ihnen liegenden Tiergarten. Eines der wohl bekanntesten Wahrzeichen der Stadt die Siegessäule können Sie von oben betrachten. \n\n•\tZeitnaher Einzug. Wenn man eine solch schöne und einzigartige Wohnung gefunden hat, soll der Einzug so schnell wie möglich stattfinden. Spätestens im Juni 2020, wird dieser Wunsch Realität. Sie müssen somit nicht mehr sehr lange warten, können aber beispielsweise noch in Ruhe ihre alte Wohnung kündigen.', 'Hochwertigste Ausstattung. In der Wohnung sind wie bei der Fassade nur hochwertige Materialien verbaut. Neben Fenstern aus Aluminium, können sie auch ihre Badausstattung sowie den Bodenbelag in den Wohnräumen mitbestimmen. Egal für welche Ausstattung sie sich entscheiden, sie entscheiden sich immer für Qualität und namhafte Hersteller. \n\nBei den Grundrissen wurde nicht nur wenig Fläche für Flure verschwendet, Sie sind zudem sehr zweckmäßig und vermitteln ein sehr schönes Raumgefühl.', 'Zentralste Lage. Die Wohnung befindet sich in unmittelbarer Nähe (ca. 150 m) des S-Bahnhofs Tiergarten. Von dort sind Sie mit der S-Bahn (hier verkehren die S-Bahnen im Minutentakt Richtung Osten und Westen) in einer Station am Bahnhof Zoo und in zwei Stationen am Hauptbahnhof bzw. drei Stationen am S-Bahnhof Friedrichstraße. Vom U-Bahnhof Hansaplatz trennen Sie auch nur ca. 150 m. Zentraler geht es nicht.', 'Wenn Sie auch der Meinung sind, dass diese Wohnung von der Lage, Architektur, Ausstattung, Umgebung, den Gemeinschaftsangeboten und dem Ausblick her einmalig ist, dann zögern sie nicht mich anzurufen oder mir eine E-Mail zu schreiben. Gerne lasse ich ihnen weitere Informationen zukommen oder wir vereinbaren einen Besichtigungstermin.'];;;12;;14;showqualicontactform;;energy_consumption;67.9;NO_INFORMATION;10555;;;;true;
2020-05-30 20:01:52.341085;Berlin;central_heating;ONE_YEAR_FREE;15437494;n;y;https://pictures.immobilienscout24.de/listings/42b6ebc1-180f-45e0-8cc4-417a9a6ad14b-1341739609.jpg/ORIG/resize/118x118%3E/extent/118x118/format/jpg/quality/80;18;10.77;40 MBit/s;telekom_layer_magenta_l;über VDSL;1969;REGULAR;10.77;110668285;district_heating;n;true;MagentaZuhause L;n;Berlin;n;7;2;9;5.67;74.02;Berlin;10178;need_of_renovation;no_information;false;100 MBit/s;no_information;"Rochstra&szlig;e";y;https://padlock.link/ioml;https://padlock.link/ml;Rochstraße;apartment;10178;3;n;2,active;true;Deutschland;standard;100 MBit/s;wohnung_kauf;n;web,email,bank,music,dl-ul,game,sd,mltstr,hd,fast-ul-dl;true;002.01000793336;399000;profile0;3;true;n;n;n;Mitte_Mitte;5586;3;Berlin;/expose/110668285;['Die 24-geschossige, moderne Wohnanlage liegt in der Rochstraße 9, die unmittelbar an den Hackeschen Markt und die berühmte Museumsinsel angrenzt. Das gepflegte Wohnhaus wurde umfassend optisch und technisch saniert und verfügt über 4 Aufzüge.\r\n\r\nBequem erreichen Sie innerhalb weniger Minuten nicht nur öffentliche Verkehrsmittel sondern auch die Highlights der Hauptstadt, zahlreiche Shopping-Möglichkeiten, die Spree und den Monbijoupark.', 'Die renovierungsbedürftige Eigentumswohnung liegt im 6. OG und verfügt über 3 Zimmer, ein Bad mit Badewanne, einen sonnigen Balkon und Blick zum Fernsehturm.\r\n', 'Zentraler als in der Rochstraße können Sie kaum wohnen:\r\nDie ganze urbane Vielfalt breitet sich zu Ihren Füßen aus: Hackesche Höfe, Oranienburger Straße, Alexanderplatz, Unter den Linden sowie historische Schätze der Weltkultur, wie die Museumsinsel mit Bodemuseum und Pergamonmuseum, der Berliner Dom und das Deutsche Historische Museum.\r\n\r\nIm Bezirk Mitte - verdichtet sich alles, was Berlin zur Hauptstadt macht - von Regierung und Parlament über Wissenschaft und Kultur bis zur Gastronomie. Kein Wunder, dass Mitte ein begehrtes Pflaster ist.  \r\n\r\nWer sich hier Immobilienbesitz sichert, investiert in einen Standort mit glänzenden Zukunftsperspektiven.\r\n\r\nDer Verkauf des Objektes erfolgt provisionsfrei !'];;;6;;24;;disabled;energy_consumption;103;;55;231.55;;;;
2020-05-30 20:01:52.713299;Berlin;central_heating;ONE_YEAR_FREE;18052783;n;y;https://pictures.immobilienscout24.de/listings/ca249ac2-3e8a-4f08-a491-efa0e54da9c3-1371673189.jpg/ORIG/resize/118x118%3E/extent/118x118/format/jpg/quality/80;8;11.35;40 MBit/s;telekom_layer_magenta_l;über VDSL;1904;REGULAR;11.35;110929085;natural_gas_light;n;false;MagentaZuhause L;n;Berlin;y;6;1;2b;7.53;54.14;Berlin;10247;well_kept;normal;false;100 MBit/s;no_information;"Pettenkofer Stra&szlig;e";n;https://padlock.link/ioml;https://padlock.link/ml;Pettenkofer_Straße;ground_floor;10247;2;n;2,active;true;Deutschland;top;100 MBit/s;wohnung_kauf;y;web,email,bank,music,dl-ul,game,sd,mltstr,hd,fast-ul-dl;true;002.01008679649;264000;profile0;2;true;y;n;n;Friedrichshain_Friedrichshain;498127;2;Berlin;/expose/110929085;['INVESTIEREN UND LEBEN IM TRENDVIERTEL\r\nDer schöne Altbau aus dem Jahr 1904 besteht aus 41 Wohn- und drei Gewerbeeinheiten, die sich im Vorderhaus und den Seitenflu¨geln auf insgesamt 5 Geschosse verteilen. Die gut geschnittenen 1 – 4- Zimmer-Wohnungen sind ca. 29 – 123 m² groß und teilweise mit Balkon oder Loggia ausgestattet. Zu fast allen Einheiten gehört ein Kellerraum. Die Wohnungen werden provisionsfrei verkauft.', 'Die sanierte Wohnung verfügt über folgende Ausstattung:\r\n\r\n- Gartenzugang\r\n- Laminatboden\r\n- Duschbad\r\n- offene Küche\r\n- Keller', 'Junge und urbane Lebensqualität sind hier zu Hause. Alles, was Ihr Herz begehrt, finden Sie im direkten\r\nUmkreis Friedrichshain ist das Viertel der jungen Leute.  Seit der Wende erlebt der Szenekiez einen Boom und\r\nmit einem Durchschnittsalter von etwa 37 Jahren ist er der Bezirk mit der jüngsten Bevölkerung überhaupt.\r\nDer Bezirk verändert sich stetig: Große Unternehmen wie Universal, Coca-Cola und BASF sind schon seit\r\nlängerem nahe der Oberbaumbrücke angesiedelt, und in den letzten Jahren zieht es die junge Kreativszene\r\nund viele Start-ups nach Friedrichshain – aber auch das neue, schicke Viertel rund um den Mercedes-Platz an\r\nder Spree mit East Side Mall, Kinowelt bringt neue Impulse in den Bezirk.\r\nFriedrichshain hat sich zu dem Vergnügungsviertel der Hauptstadt entwickelt: Ob Restaurants, Bars, Cafés,\r\nClubs – hier wird Vielfalt ohne Ende geboten. So zum Beispiel das Berghain, das RAW-Areal oder der\r\nHolzmarkt – die beliebtesten Clubs Berlins, und berühmt weit über die Stadtgrenzen hinaus.\r\nWer es etwas ruhiger angehen will, kann es sich am Forckenbeckplatz, im Blankensteinpark oder im Stadtpark Lichtenberg gut gehen lassen. Auch die Anbindung der Pettenkoferstraße an die öffentlichen Verkehrsmittel ist bestens. So lässt sich beispielsweise die U- und S-Bahn-Station Frankfurter Allee gut zu Fuß erreichen.'];;;0;;4;showqualicontactform;;energy_required;215.3;;1;175.95;;;;
2020-05-30 20:01:53.136398;Berlin;central_heating;ONE_YEAR_FREE;15333187;n;y;https://pictures.immobilienscout24.de/listings/14ae464c-cc92-4a17-ae16-f6e8b2e26103-1287884204.jpg/ORIG/resize/118x118%3E/extent/118x118/format/jpg/quality/80;7;10.47;40 MBit/s;telekom_layer_magenta_l;über VDSL;1905;REGULAR;10.47;110966009;gas;n;false;MagentaZuhause L;y;Berlin;n;9;1;9;6.36;153.35;Berlin;13187;no_information;no_information;false;100 MBit/s;no_information;Ossietskystr.;y;https://padlock.link/ioml;https://padlock.link/ml;Ossietskystr.;apartment;13187;5;n;2,active;true;Deutschland;top;100 MBit/s;wohnung_kauf;y;web,email,bank,music,dl-ul,game,sd,mltstr,hd,fast-ul-dl;true;001.15281088;689000;profile0;5;true;n;n;n;Pankow_Pankow;5713;7;Berlin;/expose/110966009;"['Das Haus, ein 4 geschossiges Eckgebäude, wurde ca. 1905 erbaut.\nDas Gebäude verfügt über 13 Wohn- und Gewerbeeinheiten mit einer Größe von 99 -201 m². Die Beheizung erfolgt über eine Gaszentralheizung. \nEin Aufzug ist vorhanden.\n\n', 'Leider liegen uns auf Grund des vermieteten Zustands keine genauen Informationen zu Ausstattungsdetails vor, wir organisieren für sie aber gern einen Besichtigungstermin.\n\n\n', 'Die Ossietskystrasse ist mitten im Herzen von Pankow gelegen. Viele Geschäfte, Cafés und Restaurants befinden sich in unmittelbarer Nähe. Mehrere Parks, wie zum Beispiel der Schlosspark, mit dem ""Schloss Schönhausen"" und der Bürgerpark laden zum spazieren und erholen ein. Die Anbindung an den öffentlichen Nahverkehr mit, Tram, U- & S- Bahn ist hervorragend, so dass sie schnell in alle anderen Bezirke von Berlin gelangen.\n', 'Für weitere Informationen oder Terminvereinbarungen steht Ihnen das Team der MAKSIM gerne telefonisch oder per E-Mail zur Verfügung.\n\nEine Gewähr für die Richtigkeit kann durch die Firma Maksim Immobiliengesellschaft mbH nicht übernommen werden.']";;;3;;4;;;energy_required;102;;;288.93;;;;
2020-05-30 20:01:53.498886;Berlin;gas_heating;ONE_YEAR_FREE;15775007;n;n;https://pictures.immobilienscout24.de/listings/8674a5d0-1a60-485f-88fb-e9ce6c60d26a-1285617144.jpg/ORIG/resize/118x118%3E/extent/118x118/format/jpg/quality/80;3;11.37;40 MBit/s;telekom_layer_magenta_l;über VDSL;;REGULAR;11.37;110792938;gas;n;false;MagentaZuhause L;y;Berlin;n;11;;no_information;5.8;220;Berlin;14193;no_information;luxury;false;100 MBit/s;no_information;no_information;n;https://padlock.link/ioml;https://padlock.link/ml;no_information;no_information;14193;4;n;2,active;true;Deutschland;standard;100 MBit/s;wohnung_kauf;n;web,email,bank,music,dl-ul,game,sd,mltstr,hd,fast-ul-dl;true;001.15667404;1799000;profile0;4;true;n;n;n;Wilmersdorf_Wilmersdorf;110792938;7;Berlin;/expose/110792938;['EXPOSE AUF ANFRAGE !', 'Durch einen eigenen Eingang gelangt man in die Wohnung im 1. Obergeschoss. Im Eingangsbereich wird man von viel Platz und einem einladenden Ambiente empfangen. Vom Flur aus gelangt man in den herrlichen und großzügigen Wohnbereich mit angrenzender Terrasse mit Seeblick.\n\nVom Flur  führt eine zweite Tür in eine großzügige Küche und ein Gäste-WC. Im hinteren Teil der Wohnung befinden sich ein Elternschlafzimmer und ein geräumiges Badezimmer, ausgestattet mit Doppelwaschbecken und eine Badewanne.\n\nIm großzügigen Erdgeschoss  befinden sich u.a. ein Kinderzimmer mit Zugang zum Garten und See, 2 Abstellräume, ein großes Badezimmer  und ein Hauswirtschaftsraum. Die Wohnung ist mit Holzparkett ausgelegt, verfügt über 4 Terrassen und eine Alarmanlage. \nNeben der erstklassigen Ausstattung und dem stimmigen Flair lädt die Lage am See zur Entspannung ein.', 'Leben in Berlin-Grunewald, bedeutet ruhiges und grünes Wohnen bei gleichzeitiger Anbindung an die Stadt. Öffentliche Verkehrsmittel sowie Einkaufsmöglichkeiten befinden sich in unmittelbarer Nähe.', 'Südwest Immobilien ist auf die Vermittlung von hochwertigen Villen, Einfamilienhäusern, Grundstücken sowie Eigentumswohnungen spezialisiert.\n\n\nIn den letzten Jahren ist es uns durch stetige Marktbeobachtung gelungen, den schnell wachsenden Berliner Markt zu erschließen und ein breites Spektrum an Anlageimmobilien anbieten zu können. Unser Kundenklientel besteht vor allem aus Privatpersonen, u.a. auch Personen des öffentlichen Lebens.\n\n\nDa wir international aufgestellt sind, können wir auch französisch, englisch-sprechende und vor allem russische Kunden individuell ansprechen und betreuen.\n\n\nVertrieb ist für uns mehr als nur Verkaufen. Wir sind es gewohnt, unsere Kunden individuell anzusprechen und partnerschaftlich langfristig mit ihnen zusammenzuarbeiten. Im Vordergrund steht für uns stets die Suche nach dem Mehrwert für beide Partner.'];;;;;;;;;;;;;;;;
2020-05-30 20:01:53.884189;Berlin;self_contained_central_heating;ONE_YEAR_FREE;97549;n;n;https://pictures.immobilienscout24.de/listings/644bdba7-db38-4278-8a9d-0b6911d2ae41-1288816999.jpg/ORIG/resize/118x118%3E/extent/118x118/format/jpg/quality/80;7;10.47;40 MBit/s;telekom_layer_magenta_l;über VDSL;1905;REGULAR;10.47;111063113;gas;n;false;MagentaZuhause L;y;Berlin;n;10;1;9;6.36;178;Berlin;13187;no_information;no_information;false;100 MBit/s;no_information;"Ossietzkystra&szlig;e";y;https://padlock.link/ioml;https://padlock.link/ml;Ossietzkystraße;apartment;13187;5;n;2,active;true;Deutschland;top;100 MBit/s;wohnung_kauf;y;web,email,bank,music,dl-ul,game,sd,mltstr,hd,fast-ul-dl;true;001.97549;799000;profile0;5;true;n;n;n;Pankow_Pankow;Ossietzky9-6;7;Berlin;/expose/111063113;['Der Altbau wurde ca. 1905 erbaut.\n\nDie Wärmeversorgung erfolgt mit Gasetagenheizungen.', '- Stuck\n- Parkett\n- Erker\n- 2. Obergeschoss mit Aufzug\n- Bad mit Fenster\n- vermietet', 'Die S-Bahn- und U-Bahn-Station „Pankow“ ist zu Fuß erreichbar.\n\nIm Umfeld gibt es diverse Geschäfte sowie Restaurants und Cafés.\nUnweit befinden sich die Volkshochschule Pankow, ein Krankenhaus, der Schlosspark mit dem Sommerbad Pankow sowie der Bürgerpark Pankow.', 'Die monatliche Nettokaltmiete beträgt ca. 796,95 €.'];;;2;;;showqualicontactform;;energy_required;102;D;0;;;;;
2020-05-30 20:01:54.287981;Berlin;self_contained_central_heating;ONE_YEAR_FREE;97549;n;y;https://pictures.immobilienscout24.de/listings/d0dc8b28-bdc8-4a81-b6a5-e3013c98862c-1289132187.jpg/ORIG/resize/118x118%3E/extent/118x118/format/jpg/quality/80;6;10.47;40 MBit/s;telekom_layer_magenta_l;über VDSL;1905;REGULAR;10.47;111084220;gas;n;false;MagentaZuhause L;y;Berlin;n;8;1;60;6.36;106.47;Berlin;13187;no_information;no_information;false;100 MBit/s;no_information;"Wolfshagener Stra&szlig;e";n;https://padlock.link/ioml;https://padlock.link/ml;Wolfshagener_Straße;apartment;13187;3;n;2,active;true;Deutschland;top;100 MBit/s;wohnung_kauf;y;web,email,bank,music,dl-ul,game,sd,mltstr,hd,fast-ul-dl;true;001.97549;479000;profile0;3;true;n;n;n;Pankow_Pankow;Wolfshagener60-13;5;Berlin;/expose/111084220;['Der Altbau wurde ca. 1905 erbaut.\n\nDie Wärmeversorgung erfolgt mit Gasetagenheizungen.', '- Stuck\n- Dielen\n- Loggia, Erker\n- 3. Obergeschoss\n- Altbaufenster\n- Bad mit Wanne\n- vermietet', 'Die S-Bahn- und U-Bahn-Station „Pankow“ ist zu Fuß erreichbar.\n\nIm Umfeld gibt es diverse Geschäfte sowie Restaurants und Cafés.\nUnweit befinden sich die Volkshochschule Pankow, ein Krankenhaus, der Schlosspark mit dem Sommerbad Pankow sowie der Bürgerpark Pankow.', 'Die monatliche Nettokaltmiete beträgt ca. 611,86 €.'];;;3;;;showqualicontactform;;energy_required;118.4;D;0;;;;;
