2020-05-30 19:32:55.391039;Berlin;true;ONE_YEAR_FREE;16123617;n;y;https://pictures.immobilienscout24.de/listings/528f5d36-eed9-4869-9bed-84ba5bbabf3d-1367459806.jpg/ORIG/resize/118x118%3E/extent/118x118/format/jpg/quality/80;10;11.3;40 MBit/s;telekom_layer_magenta_l;;über Glasfaser;2018;REGULAR;11.3;118079331;district_heating;n;true;MagentaZuhause L;y;Berlin;y;11;9;310;no_information;energy_required;5.76;101.61;Berlin;10629;first_time_use;sophisticated;B;false;100 MBit/s;underground_garage;no_information;y;https://padlock.link/ioml;https://padlock.link/ml;no_information;apartment;10629;3;52;n;2,active;true;Deutschland;schaufenster;100 MBit/s;wohnung_kauf;n;5;web,email,bank,music,dl-ul,game,sd,mltstr,hd,fast-ul-dl;true;002.01006554579;1250000;profile0;6;3;true;y;showqualicontactform;n;n;Charlottenburg_Charlottenburg;DC-BER6082;5;Berlin;/expose/118079331;"[""Der Neubau aus dem Jahr 2017 (Fertigstellung im Mai 2018) wurde von dem renommierten Architektenbüro Patzschke & Partner entwickelt und befindet sich in einer der beliebtesten Seitenstraßen am Ku'damm. Die sehr lichtdurchflutete, helle und moderne Wohnung liegt im 5. Obergeschoss und ist bequem über einen Aufzug erreichbar. Insgesamt verteilen sich drei Zimmer auf eine Wohnfläche von ca. 102 Quadratmetern. Das Highlight ist, neben der sehr begehrten Lage, der großzügige Wohn-/Essbereich mit angrenzender Terrasse mit West-Ausrichtung. In diesen Wohnbereich gelangen Sie über eine große Flügeltür. Ein weiterer Balkon mit Ost-Ausrichtung ist im ruhigen Innenhof gelegen und wird über ein Schlafzimmer erschlossen. Das tagesbelichtete Vollbad, mit ebenerdiger Dusche, ist großzügig geschnitten und mit hochwertigen Armaturen und Fliesen ausgestattet. Ein zweites, sehr schönes Zimmer komplettiert dieses exklusive Wohnangebot. Dieser Wohnbereich ist nach Osten zum Innenhof ausgerichtet, so dass Sie bereits in der Früh den Sonnenschein genießen und in ruhiger Atmosphäre schlafen können. Ein weiteres Gästebad, ebenfalls mit ebenerdiger Dusche, sowie angrenzendem Hauswirtschaftsbereich für Waschmaschine etc. runden die Funktionalität der Wohnung ab.\n\nBarrierefrei gelangen Sie bereits vom Hauseingang in die Wohnung und zum Tiefgaragenstellplatz, der Ihnen ebenfalls zur Verfügung steht sowie ein Kellerabteil. Ebenso befinden sich dort abgeschlossene, jeweils getrennte, großzügige Räume für Fahrrad, Kinderwagen, Abfallentsorgungsraum etc.."", '• 3 Zimmer, davon 2 Schlafzimmer\n• 2 Badezimmer, darunter ein Vollbad und ein Duschbad mit Armaturen der Firma Hansgrohe\n• Im Duschbad befindet sich eine separate Nische für die Waschmaschine und den Trockner\n• Eichenparkett mit schwellenlosem Zugang zu den Zimmern \n• Fußbodenheizung \n• Gespachtelte Wände\n• Deckenhöhe ca. 2,90 Meter\n• Isolierglasfenster mit Dreifachverglasung\n• Elektrische Außenjalousien im Ostflügel und Sonnenschutzjalousien im Wohn- und Küchenbereich\n• 1 Balkon und 1 Terrasse\n• hochwertige Haustechnik (Videogegensprechanlage, Lüftungsanlage, aufwendige Elektroinstallation in allen Räumen, schnelles Internet) \n• 3-Punkt-Sicherheitstür\n• Personenaufzug\n• Keller\n• Fahrradabstellraum\n• Tiefgaragenstellplatz', 'Längst auch unter dem Namen City West bekannt, verbindet der Bezirk Charlottenburg höchste Wohnqualität mit Internationalität, weltstädtischer Eleganz und Kultur. Moderne Bauten wie der Upper West-Turm am Breitscheidplatz oder auch das Bikinihaus am Zoo ergänzen sich vorzüglich mit hochwertigsten, teilweise noch aus der Gründerzeit stammenden Altbauten und unzähligen Sehenswürdigkeiten.\n\nOb ein Einkaufsbummel in der Wilmersdorfer Straße oder ein Spaziergang auf dem weltberühmten Kürfürstendamm, der von der Tauentzienstraße mit dem weltbekannten Warenhaus KaDeWe bis zum Rathenauplatz führt und direkt an den erholsamen Grunewald angrenzt, ob ein Besuch in der Deutschen Oper, im Berggruen Museum, im neugestalteten Großkino Zoopalast oder des Schlosses Charlottenburg mit seinem der Öffentlichkeit zugänglichen Park – Charlottenburg bietet Lebens- und Erlebnisqualität auf allerhöchstem Niveau. \n\nWohnen in Charlottenburg bedeutet, gewachsene Geschichte mit Moderne zu verbinden - das Bohème-Leben des Savignyplatzes mit seinen Künstlerkneipen genauso zu genießen wie die 1 A Lage des Fasanenplatzes, die Seitenstraßen des Ku’damms und die Nähe zur Verkehrsstation Bahnhof Zoo sowie zum Messegelände, das in der Nachbarschaft des Zentralen Omnibusbahnhofs (ZOB) und des Lietzenseeparks nicht nur dem Berliner Funkturm Heimat bietet, sondern auch vielen internationalen Ausstellungen und Messen.']";floor_heating;disabled;;1;;;
2020-05-30 19:32:55.716076;Berlin;true;ONE_YEAR_FREE;15526961;n;y;https://pictures.immobilienscout24.de/listings/0bd5d61f-68f5-4fb2-be83-1fd47d879915-1367461008.jpg/ORIG/resize/118x118%3E/extent/118x118/format/jpg/quality/80;10;10.14;40 MBit/s;telekom_layer_magenta_l;6;über VDSL;1956;REGULAR;10.14;118079380;oil;y;false;MagentaZuhause L;y;Berlin;y;8;2;290;no_information;no_information;5.19;79;Berlin;14193;well_kept;normal;;false;100 MBit/s;no_information;no_information;n;https://padlock.link/ioml;https://padlock.link/ml;no_information;apartment;14193;3;;n;2,active;true;Deutschland;premium;100 MBit/s;wohnung_kauf;n;;web,email,bank,music,dl-ul,game,sd,mltstr,hd,fast-ul-dl;true;002.01000613463;410800;profile0;3;3;true;n;showqualicontactform;n;n;Schmargendorf_Wilmersdorf;S1;3;Berlin;/expose/118079380;['Die Wohnung liegt im Hoch-Parterre eines 1956 errichteten Neubaus. Die Ausrichtung des Balkons ist optimal zur Sonnenseite angelegt. Auch der Wohnungsschnitt ist perfekt, da alle Räume vom Flur aus zu begehen sind. Für die freundliche Atmosphäre wurden großangelegte Fenster verbaut, die für die entsprechende Helligkeit in den Zimmern sorgen. Natürlich liegen zur Sicherheit auch die passenden elektr. Jalousien vor - weitere Pluspunkte sind u.a. der eingebaute Tresor im Kammerbereich sowie die Sicherheitsschließanlage. Das geflieste Duschbad ist hell ausgestattet, die ebenso freundliche Einbauküche bietet alle wichtigen Gerätschaften.', '* Parkett im Eingangsbereich sowie im 1. Zimmer\n* Gefliestes Bad (freundlich, hell) inkl. sep. Fußbodenheizung\n* Geflieste Küche mit Schränken\n* Ceranfeld-Herd, Backofen, Geschirrspüler, Waschmaschine\n* elektrische (programmierbare) Jalousien in jedem Zimmer\n* abschl. Holz-Isolier-Fenster (einbruchhemmend, Lärmschutz)\n* Fliegengitter für Fenster\n* Rauchmelder\n* Tresor in der Kammer\n* DSL-Versorgung und Kabel- sowie SAT-Fernsehen gegeben\n* Elektroanschluss im Keller über Wohnungsanschluss\n* Öl-Zentralheizung\n* Balkon\n* keine gepl. Instandsetzungen, kein Instandhaltungsrückstau', 'Die Eigentumswohnung liegt zurückgesetzt an einer leisen Seitenstraße im renommierten Villen- und Botschaftsviertel in “Schmargendorf”. Von hier aus sind es nur wenige Gehminuten zum Ku´damm. Die Autobahn ist in ca. 2 min. ebenso gut erreichbar - gleichwohl ist die gepflegte Wohnanlage samt Umgebung ruhig und begrünt angelegt. Der angrenzende Ortsteil Grunewald zählt zu den wohlhabendsten Gebieten Berlins, wobei der Grunewald selbst den entsprechenden Ausgleich zum Alltag bietet. Die öffentlichen Verkehrsmittel wie Bus und S-Bahn sind genauso fußläufig gut gelegen wie die wichtigsten Einkaufsmöglichkeiten.', 'Besichtigungen können nach Absprache auch nachmittags und am Wochenende stattfinden.\n\nDie Liegenschaft befindet sich im qualifizierten Alleinauftrag!'];oil_heating;;;;2006;;
2020-05-30 19:32:56.107404;Berlin;true;ONE_YEAR_FREE;33013;n;y;https://pictures.immobilienscout24.de/listings/d3fc1c1b-897d-4689-b4ed-48467edaabf9-1367445195.jpg/ORIG/resize/118x118%3E/extent/118x118/format/jpg/quality/80;23;12.24;40 MBit/s;telekom_layer_magenta_l;;über VDSL;1974;REGULAR;12.24;118077927;oil;y;true;MagentaZuhause L;y;Berlin;y;7;3;356;no_information;energy_consumption;6.53;77;Berlin;12157;well_kept;no_information;;false;100 MBit/s;no_information;no_information;y;https://padlock.link/ioml;https://padlock.link/ml;no_information;raised_ground_floor;12157;3;140.36;n;2,active;true;Deutschland;schaufenster;100 MBit/s;wohnung_kauf;n;1;web,email,bank,music,dl-ul,game,sd,mltstr,hd,fast-ul-dl;true;001.33013;339000;profile0;6;3;true;n;showqualicontactform;n;n;Schöneberg_Schöneberg;184962;3;Berlin;/expose/118077927;"['- gepflegtes, 6-geschossiges Wohngebäude\n\n- großer Innenhof mit Spielplatz  \n\n- im Zuge der Lärmsanierungsmaßnahme BAB 100/A103 werden der WEG Schallschutzmaßnahmen in Höhe von 75 % finanziert, die restliche Summe wird der Instandhaltungsrücklage entnommen\n\n- z. B. werden neue Schallschutzfenster eingesetzt und im Wohn- und Kinderzimmer eine Lüftung (Silence-Modus) eingebracht; der Beschluss ist bereits erfolgt und die Umsetzung der Maßnahmen für Frühjahr/Sommer 2020 geplant\n\n- Kellerabteil\n\n- Gemeinschaftsparkplatz für die Bewohner zur freien Nutzung', '- großzügiger Balkon\n\n- Wohnzimmer und die beiden Flure sind mit Industrie- (Designer-) Vinylfliesen ausgelegt\n\n- Einbauküche mit modernen Geräten, z. B. Induktionsherd\n\n- geräumiges, gefliestes Bad mit Dusche und Waschmaschinenanschluss', '- im Friedenauer Künstlerviertel\n\n- zentrale Lage mit optimaler Verkehrsanbindung durch Bus, Bahn und die nahe Stadtautobahn\n\n- am S-Bahnhof Friedenau\n\n- Einkaufgsmöglichkeiten zu Fuß erreichbar\n\n- Walther-Schreiber-Platz mit der beginnenden Einkaufsmeile ""Schloßstr."" erreicht man in ca. 1 km\n\n- Kitas und mehrere Schulen in direkter Nachbarschaft\n\n- sehr gute Infrastruktur', 'Die Provision in Höhe von 7,14% des Kaufpreises (inkl.19% MwSt.) wird vom Käufer getragen und ist verdient und zahlbar an die BBI Immobilien GmbH bei Kaufvertragsabschluss.\n\n\nWAS IST IHRE IMMOBILE WIRKLICH WERT?\nWir bieten eine kostenlose Einschätzung Ihrer eigenen Immobilie durch unsere Experten.\nAuf Wunsch sorgen wir für einen seriösen und zeitnahen Verkauf.\nSie erreichen uns auch am Wochenende unter: 030-3277340.\nUnser Büro am Kurfürstendamm ist 7 Tage in der Woche für Sie geöffnet.\n\n\nWeitere interessante, sowohl provisionspflichtige als auch provisionsfreie Angebote von Bauträgern, von Eigentumswohnungen über Einfamilienhäuser und Villen (Nutzung privat und gewerblich) bis hin zu renditeträchtigen Miethäusern für Investoren finden Sie unter www.bbi-immobilien.de']";;disabled;3;;;true;
2020-05-30 19:32:56.562999;Berlin;;ONE_YEAR_FREE;17082982;n;y;https://pictures.immobilienscout24.de/listings/42170ade-20d5-4547-b82d-cf23cc4b5c0f-1367453951.jpg/ORIG/resize/118x118%3E/extent/118x118/format/jpg/quality/80;8;10.77;40 MBit/s;telekom_layer_magenta_l;43;über VDSL;1910;REGULAR;10.77;118077674;gas;y;false;MagentaZuhause L;y;Berlin;y;5;1;208.5;5;energy_required;5.67;43;Berlin;10115;fully_renovated;sophisticated;;false;100 MBit/s;no_information;Schlegelstr;y;https://padlock.link/ioml;https://padlock.link/ml;Schlegelstr;apartment;10115;1.5;177;n;2,active;true;Deutschland;top;100 MBit/s;wohnung_kauf;n;2;web,email,bank,music,dl-ul,game,sd,mltstr,hd,fast-ul-dl;true;009.71bed616-c25f-4bea-af6b-e9d6fa655595;245000;profile0;;1;true;n;showqualicontactform;n;n;Mitte_Mitte;118077674;2;Berlin;/expose/118077674;['Das Häuser-Ensemble in dem sich die Wohnung befindet, wurde unlängst vollständig saniert und befindet sich dadurch in einem guten Zustand.\n\u2028\nDie bezaubernde Wohnung befindet sich genau so in einem sehr guten Zustand und ist möbiliert. \u2028 Man kann den Wohnungseingang durch das Treppenhaus erreichen, oder alternativ bequem mit dem Fahrstuhl. Die charmante Wohnung ist sehr hell und ruhig.', 'Die Wohnung wurde vor ca 4 Jahre komplett renoviert. \nDie Wohnung hat eine Einbauküche und ein modernes Bad mit Badewanne. Der Balkonbereich zum Innenhof ist äußerst ruhig gelegen.', 'Die Schlegelstraße ist umgeben von der Invaliden-, Tor- und der Chausseestraße, die in ihrem Verlauf zur Friedrichsstraße wird - einer der Hauptflaniermeilen der Stadt: Austern schlürfen in der Galeries Lafayette oder ein saftiges Schnitzel bei Sterneköchin Sarah Wiener schlemmen – alles ist fußläufig zu erreichen. Man findet immer Restaurants, Bars und Einkaufsmöglichkeiten, die zu Fuß leicht erreichbar sind. Rund um den Rosenthaler Platz und die Oranienburger Straße findet sich ein breites Angebot an Kultur und Unterhaltung. Trendige Cafés und exklusive Modeläden säumen die Straßen in der Umgebung.'];stove_heating;;;;2016;;
2020-05-30 19:32:56.901803;Berlin;;ONE_YEAR_FREE;213674;y;y;https://pictures.immobilienscout24.de/listings/fa4341a1-184d-4762-8e95-4fcbb5f56a3f-1367472383.jpg/ORIG/resize/118x118%3E/extent/118x118/format/jpg/quality/80;11;12.41;40 MBit/s;telekom_layer_magenta_l;;über VDSL;2020;REGULAR;12.41;118080658;district_heating;y;false;MagentaZuhause L;y;Berlin;y;7;9;170;no_information;energy_required;6.36;66.51;Berlin;12105;first_time_use;sophisticated;B;false;100 MBit/s;no_information;no_information;n;https://padlock.link/ioml;https://padlock.link/ml;no_information;no_information;12105;3;55.3;n;2,active;true;Deutschland;standard;100 MBit/s;wohnung_kauf;n;4;web,email,bank,music,dl-ul,game,sd,mltstr,hd,fast-ul-dl;true;001.213674;395000;profile0;;3;true;n;showqualicontactform;n;n;Tempelhof_Tempelhof;2358/G1/Eh2;3;Berlin;/expose/118080658;['Die sonnige Dachgeschosswohnung befindet sich in einer frisch renovierten, für die dreißiger Jahre typischen Bauweise errichteten Wohnanlage, in Massivbauweise. Die charmanten, farbenfrohen Gebäude aus dem Jahr 1925 befinden sich in sehr gutem Zustand und verfügen im Altbaubereich über Fernwärmeanschluss und großem sonnigem und kinderfreundlichem Innenhof.\nDas Gemeinschaftseigentum wurde zwischen 2014 und 2016 umfänglich modernisiert und Instand gesetzt. Die Fassadenflächen sind mit einem Vollwärmeschutzsystem versehen. Die Fenster der Schallschutzklasse 3 wurden verbaut.\nDie Treppenhäuser im klassischen 30er Jahre Look sind ansprechend renoviert und werden nach Fertigstellung des Dachgeschosses malertechnisch nochmals überarbeitet.\n\nDie Wohnung ist sehr gut geschnitten und verfügt über einen mittig liegenden Wohnessbereich mit Küchenzeile und Balkon und zwei separat liegenden Zimmern und eignet sich bestens für Singles, WGs und Familien.', '- 2 Schlafzimmer + Wohn-Essbereich \n- Großzügige Deckenhöhen von 2,80 bis 3,00 m \n- 3-fach isolierte Fenster\n- Echtholzparkettfußboden \n- Fußbodenheizung mit Fernwärmeanschluss \n- mit Terrasse\n- Landschaftlich gestaltete Innenhofgärten\n\n\n- 2 bedrooms\n- Ceiling heights of 2.80 to 3.00 m \n- Floor-to-ceiling windows for light flooded rooms \n- Triple-glazed windows \n- Solid wood parquet floor\n- Underfloor heating using district heating \n- with terrace\n- Landscaped inner courtyards', 'Tempelhof ist ein grüner und familienfreundlicher Bezirk in Berlin mit vielen Parks und dem Tempelhofer Hafen. Das Eckgebäude mit Südost-Ausrichtung befindet sich in zentraler Berliner Lage. Dieses grüne Viertel liegt nur 15 Minuten von der geschäftigen Friedrichstraße entfernt, die direkt über die U-Bahn-Linie U6 erreicht werden kann. In weniger als 5 Minuten erreichen Sie zu Fuß den Tempelhofer Hafen. Hier befindet sich neben einem schönen, direkt am Fluss gelegenen Einkaufszentrum auch der Kanalhafen. Der Tempelhofer Damm liegt ganz in der Nähe, dort haben sich Karstadt und weitere, große Einzelhändler niedergelassen. Am Tempelhofer Feld, dem größten und beliebtesten Park Berlins kann zahlreichen sportlichen Aktivitäten nachgegangen werden, einschließlich Inlineskating und Windskaten.', 'Ohne Aufzug über dem 3. Obergeschoss'];;;;;;;
2020-05-30 19:32:57.282502;Berlin;;ONE_YEAR_FREE;1011756;n;n;https://pictures.immobilienscout24.de/listings/1fd60660-8c71-4b0d-b25e-4e8582ca359d-1367430752.jpg/ORIG/resize/118x118%3E/extent/118x118/format/jpg/quality/80;6;11.37;40 MBit/s;telekom_layer_magenta_l;;über VDSL;1900;REGULAR;11.37;114987015;district_heating;y;false;MagentaZuhause L;y;Berlin;y;7;1;288;no_information;energy_consumption;5.8;62;Berlin;10713;no_information;no_information;C;false;100 MBit/s;no_information;no_information;n;https://padlock.link/ioml;https://padlock.link/ml;no_information;apartment;10713;2;98.2;n;2,active;true;Deutschland;top;100 MBit/s;wohnung_kauf;n;3;web,email,bank,music,dl-ul,game,sd,mltstr,hd,fast-ul-dl;true;001.1011756;310000;profile0;6;2;true;n;showqualicontactform;n;n;Wilmersdorf_Wilmersdorf;I-00SSRN-W-02GGAM;3;Berlin;/expose/114987015;['Die Wohnung erstreckt sich über ca. 62m² und besticht mit einem klar strukturierten Grundriss mit zwei Zimmern, einer Einbauküche und einem tagesbelichtetem Duschbad. Durch den klassischen Dielenboden, einer Deckenhöhe von bis zu 3,35 m und vereinzelten Stuckelementen wird der historische Charakter des im Jahre 1900 erbauten Hauses deutlich erkennbar. Diese kompakt geschnittene Wohnung in zentraler Wilmersdorfer Lage eignet sich hervorragend für Paare oder Singles.\r\n\r\nAusstattung:\r\n\r\n• Dielenboden\r\n• doppelt verglaste Fenster mit Holzrahmen\r\n• Einbauküche\r\n• tagesbelichtetes Wannenbad\r\n• Kellerabteil', 'Fliesen\nDielenboden', 'Die Wohnung liegt angenehm ruhig, aber dennoch zentral, im Ortsteil Wilmersdorf. Die Lage zwischen dem Heidelberger Platz und dem Volkspark Wilmersdorf bietet neben Erholung und Naturgenuss im Park ein reichhaltiges Angebot an interessanten Geschäften und kleinen Läden. Hier kann man fußläufig alle Bedürfnisse des täglichen Lebens erledigen. Die vielfältigen Cafés und Restaurants sorgen für ein lebendiges Treiben. \r\n\r\nDer berühmte Ku’damm befindet sich in ebenfalls in der Nähe und lockt mit vielen Shopping- und Ausgehmöglichkeiten.\r\n\r\nDie sehr gute Anbindung an das öffentliche Nahverkehrsnetz macht die Wohnung zu einem idealen Stadtwohnsitz. In nur wenigen Gehminuten erreichen Sie den S- und U-Bahnhof Heidelberger Platz, die U-Bahnhöfe Bundesplatz und Blissestraße sowie diverse Buslinien.', 'Die Courtage in Höhe von 7,14 % inkl. der gesetzlichen Mehrwertsteuer auf den Kaufpreis ist mit dem Zustandekommen des Kaufvertrages (notarieller Vertragsabschluss) verdient und fällig. Die vermittelnde und/oder nachweisende Engel & Völkers Berlin Mitte GmbH (Lizenznehmer der Engel & Völkers Residential GmbH ) und ggf. deren Beauftragter, erhalten einen unmittelbaren Zahlungsanspruch gegenüber dem Käufer (Vertrag zugunsten Dritter, § 328 BGB).\r\nHinweise: \r\nAlle Angaben sind ohne Gewähr und basieren ausschließlich auf Informationen, die uns von unserem Auftraggeber übermittelt wurden. Wir übernehmen keine Gewähr für die Vollständigkeit, Richtigkeit und Aktualität dieser Angaben. Zwischenvermietung bleibt vorbehalten. Sollte das von uns nachgewiesene Objekt bereits bekannt sein, teilen Sie uns dieses bitte unverzüglich mit. Die Weitergabe dieses Exposés an Dritte ohne unsere Zustimmung löst gegebenenfalls Courtage- bzw. Schadensersatzansprüche aus. Im übrigen gelten die allgemeinen Geschäftsbedingungen für die Rechtsbeziehung zwischen Ihnen und Engel & Völkers Büro Berlin Mitte GmbH. Wir stehen Ihnen mit weiteren Informationen zum Objekt und zum Eigentümer sowie für Besichtigungen gern zur Verfügung.'];central_heating;;;;;;
2020-05-30 19:32:57.604502;Berlin;;ONE_YEAR_FREE;174522;n;n;https://pictures.immobilienscout24.de/listings/dd040134-5549-44b5-a4ef-d1c6e27cd666-1367432385.jpg/ORIG/resize/118x118%3E/extent/118x118/format/jpg/quality/80;12;10.3;40 MBit/s;telekom_layer_magenta_l;;über VDSL;;REGULAR;10.3;118076655;;n;true;MagentaZuhause L;y;Berlin;n;5;;;no_information;;4.2;55;Berlin;14167;no_information;no_information;;false;100 MBit/s;no_information;no_information;n;https://padlock.link/ioml;https://padlock.link/ml;no_information;apartment;14167;2;;n;2,active;true;Deutschland;top;100 MBit/s;wohnung_kauf;n;;web,email,bank,music,dl-ul,game,sd,mltstr,hd,fast-ul-dl;true;001.174522;249000;profile0;;2;true;n;showqualicontactform;n;n;Zehlendorf_Zehlendorf;118076655;2;Berlin;/expose/118076655;['Diese Wohnung bietet ein lichtdurchflutetes und freundliches Ambiente in gepflegtem Zustand. In den beiden Zimmern sorgen große originale Doppelkastenfenster für eine starke Tageshelligkeit. Die Einbauküche verfügt über eine Glastür zum verglasten Balkon.\nDort kann an einem Tisch wie in einem Wintergarten gesessen werden. Die Küche ist so geräumig, dass sie ebenfalls Platz für einen kleinen Esstisch bietet. Beachtenswert ist der noch erhaltene originale Terrazzoboden. Diesen soliden Bodenbelag gibt es auch im Badezimmer, das u.a. mit einem Fenster und einer Wanne brilliert. Die Wärmeversorgung dieser angenehmen Wohnung obliegt einer Gasetagenheizung. Positiv ist außerdem der ca. 16 m2 große verschlossene Kellerraum, der sich gut als Hobbyraum eignet. \nMit dem Schlafzimmer und Bad in der Morgensonne sowie der Küche und dem Wohnzimmer in der Nachmittagssonne ist diese Wohnung optimal ausgerichtet. Anregend tagesbelichtete Raumstimmungen und ein praktisches Umfeld für schnelle Einkäufe und zum Herausgehen in die Natur – diese Wohnung und ihr Standort bilden eine sehr attraktive Einheit.\n\nEin Energieausweis ist nicht vorhanden.', 'Sie möchten den Marktwert Ihrer Immobilie wissen oder Ihre Immobilie verkaufen? Wir sind seit 1995 erfolgreich im Verkauf von Immobilien in Berlin, Potsdam und Umgebung tätig. Unsere exzellenten Eigentümerbewertungen sprechen für sich.\n\n•\tOftmals haben wir schon den richtigen Käufer für Ihre Immobilie in unserer Kartei\n•\tWir sind Bellevue Best Property Agent und Mitglied in den Verbänden IVD & FIABCI\n•\tWir benötigen keinen schriftlichen Alleinauftrag\n•\tKosten entstehen Ihnen bei uns keine\n•\tUnsere Spezialisten stehen Ihnen gerne für ein erstes – für Sie unverbindliches - Gespräch zur Verfügung\n\nWir freuen uns über Ihre Kontaktaufnahme unter einkauf@immoberlin.de oder (030) 895 72 20.\nBitte besuchen Sie auch unsere Website: \nhttps://www.immoberlin.de'];no_information;disabled;;;;;
2020-05-30 19:32:57.943731;Berlin;;ONE_YEAR_FREE;17131063;n;y;https://pictures.immobilienscout24.de/listings/5e900383-53d8-4b68-9e5f-1701405af8f2-1367427354.jpg/ORIG/resize/118x118%3E/extent/118x118/format/jpg/quality/80;6;9.14;40 MBit/s;telekom_layer_magenta_l;90;über VDSL;;REGULAR;9.14;118075023;;y;false;MagentaZuhause L;y;Berlin;y;9;;;32;;3.8;80;Berlin;13505;no_information;luxury;;false;100 MBit/s;outside;"Friedericke Stra&szlig;e";n;https://padlock.link/ioml;https://padlock.link/ml;Friedericke_Straße;raised_ground_floor;13505;3;;n;2,active;true;Deutschland;top;100 MBit/s;wohnung_kauf;n;2;web,email,bank,music,dl-ul,game,sd,mltstr,hd,fast-ul-dl;true;002.01007820983;552000;profile0;;3;true;y;showqualicontactform;n;n;Konradshöhe_Reinickendorf;06052020;3;Berlin;/expose/118075023;['Angeboten wird in einem zu errichtenden Neubau eine Eigentumswohnung mit 80 Wohn / Nutzfläche und zusätzlich 18 qm Kellerraum + PKW PKW Stellplatz auf dem Grundstück mit Anschluss für Elektro PKW', 'KFW 55 Ausführung\nMassivbauweise\nTondachziegel\nDreifachverglasung\nRollläden / Raffstore in allen Fenstern\nSchallschutzfenster\nNatursteinfensterbänke\nFußbodenheizung mit digitaler Raumregelung\nKühlfunktion\nbodentiefe Dusche\nSchornstein\nKüche\nSchiebetüren zur Terrasse / Balkon\ngroßer Balkon oder Terrasse\nfarbige Fenster und Terrassentüren\nKeller in WU Ausführung\nprivater Kellerraum\nGemeinschaftskeller\nhochwertige Bodenbeläge in allen Räumen\nWände mit Malerflies\n\nBezug 2021', '13505 Berlin Tegel, Friedericke Straße 32, Konradshöhe', 'NEWE Massivhaus\nBeilsteiner Straße 99a\n12681 Berlin \n\nwww.NEWE-Massivhaus.de\n\nBaufinanzierunsservice'];no_information;;;1;;;home_builder
