2020-05-30 19:35:04.347176;Berlin;central_heating;ONE_YEAR_FREE;16505685;n;y;https://pictures.immobilienscout24.de/listings/1e866ca9-7ca2-41b0-91a5-8add1ae1d74a-1366224777.jpg/ORIG/resize/118x118%3E/extent/118x118/format/jpg/quality/80;19;11.73;40 MBit/s;telekom_layer_magenta_l;über VDSL;1926;REGULAR;11.73;117869869;oil;n;false;MagentaZuhause L;n;Berlin;y;6;1;211.8;10;energy_consumption;5.75;62.76;Berlin;12157;no_information;no_information;F;false;100 MBit/s;no_information;Menckenstr.;n;https://padlock.link/ioml;https://padlock.link/ml;Menckenstr.;raised_ground_floor;12157;2;199;n;2,active;true;Deutschland;standard;100 MBit/s;wohnung_kauf;n;;web,email,bank,music,dl-ul,game,sd,mltstr,hd,fast-ul-dl;true;001.16119439;279000;profile0;;2;true;n;showqualicontactform;n;n;Steglitz_Steglitz;20132-MEN10-1;3;Berlin;/expose/117869869;['Auf das Gebäudeensemble verteilen sich insgesamt 34x 2-Zimmer-Wohnungen und 20x 3-Zimmer-Wohnungen - jeweils immer mit Balkon.Die hellen Wohnungen verfügen über eine Wohnfläche von ca. 58 m² bis 76 m² und weisen einen durchgesteckten, praktisch geschnittenen Grundriss auf. Für Familien und Individualisten bietet es sich an, Wohnungen zusammenzulegen. Ausgewählte Altbauelemente verleihen Schlaf-, Wohn- und Kinderzimmern einen besonderen Charme. Vorwiegend Holz-Doppelkastenfenster mit Messinggriffen sowie Dielenböden sorgen für eine wohnliche Atmosphäre. In den Küchen finden sich teilweise gegossene Terrazzoböden wieder.\n\nAktuell stehen 13 Leereinheiten zum sofortigen oder baldigen Selbstbezug zur Verfügung.\n\n» Altbau, Baujahr ca. 1926\n» 34x 2-Zimmer-Wohnungen (ca. 58 m² bis 70 m² Wohnfläche)\n» 20x 3-Zimmer-Wohnungen (ca. 72 m² bis 76 m² Wohnfläche)\n» historische Altbaudetails: teilweise Holz Doppelkastenfenster, Dielenböden, Messing-Fenster- und Türgriffe,  \n   Terrazzoboden\n» Zusammenlegungen von Wohnungen möglich\n» alle Wohnungen mit Balkon\n» Garten mit Apfelbäumen', 'Zum Verkauf steht eine gut geschnittene 2-Zimmer-Altbauwohnung mit Balkon, die sich im Hochparterre befindet. Die Wohnung besticht durch eine gute Raumaufteilung sowie dem exklusiv nutzbaren Garten, der durch das neue Sondernutzungsrecht angelegt wird.\n\n» Verkauf im Ist-Zustand\n» Tageslichtbad mit Badewanne\n» Balkon\n» Holz-Doppelkastenfenster\n» teilweise Dielenfußboden\n» Terrazzoboden in der Küche', 'Das Altbau-Objekt aus dem Jahr 1926 liegt ruhig und dennoch zentral in der Lothar-Bucher-Straße 5-5a / Menckenstraße 9-11. Die unmittelbare Nachbarschaft ist geprägt von Gründerzeitaltbauten sowie Gebäudeensembles aus den 30er-Jahren. Schlicht und mit baujahrtypischen Stilelementen präsentiert sich die Fassade des Vorderhauses, die von einem kleinen Vorgarten eingerahmt wird. Nichts deutet auf das Kleinod hin, das sich im grünen Innenhof des Objektes befindet. Leuchtende Magnolien, duftende Apfelbäume - im Sommer bietet der weitläufige Garten viel Platz zur Erholung für alle Bewohner des Hauses.\n\nDas Objekt liegt im ruhigen Bismarckviertel in Berlin-Steglitz - unweit entfernt befindet sich die belebte Schloßstraße sowie der S-Bahnhof Feuerbachstraße. Der Bezirk hat sich in den vergangenen Jahren zu einer äußerst beliebten Wohngegend entwickelt. Gepflegte Parks und zahlreiche Grünanlagen sowie von Bäumen gesäumte Straßenzüge sorgen für ein nahezu kleinstädtisches Flair. Das eher bürgerliche Bismarckviertel ist als Wohngegend bei jungen Menschen und Familien mit Kindern sehr gefragt. Auch ältere Menschen schätzen die Mischung aus Beschaulichkeit und nahe gelegenen Einkaufsmöglichkeiten.\n\n» Einkaufsmeile Schloßstraße 15-minütiger Fußweg\n» S-Bahnhof „Feuerbachstraße“ in Gehdistanz (S1, M76, X76, 181, N81)\n» Mit der S-Bahn in ca. 35 Minuten zum Alexanderplatz und in ca. 30 Minuten zum Hauptbahnhof\n» Flughafen Tegel (TXL) und Schönefeld (SXF/BER) in maximal 30 Minuten Fahrzeit erreichen', 'Die FORTIS Group hat sich als Bestandshalter und -entwickler auf Wohnimmobilien im Mehrfamiliensegment in zentralen Lagen von Berlin und Potsdam spezialisiert. Der Fokus des Unternehmens liegt dabei stets auf der wertsteigernden und behutsamen Entwicklung der Immobilien. Ziel ist es, die vorwiegend historischen Altbauten zu erhalten und die Wohnqualität nachhaltig zu erhöhen.'];;;;;;true;;;
2020-05-30 19:35:04.827507;Berlin;;ONE_YEAR_FREE;9255274;y;n;https://pictures.immobilienscout24.de/listings/82640025-b69d-4c28-83de-3e69ca8d6333-1356180649.jpg/ORIG/resize/118x118%3E/extent/118x118/format/jpg/quality/80;8;11.48;10 MBit/s;telekom_layer_magenta_m;über VDSL;2019;REGULAR;11.48;116448208;district_heating;n;true;MagentaZuhause M;n;Berlin;n;5;9;;7;energy_required;7.11;30.14;Berlin;10243;first_time_use;no_information;B;false;50 MBit/s;no_information;"Bossestra&szlig;e";y;https://padlock.link/iomm;https://padlock.link/mm;Bossestraße;apartment;10243;1;58.3;n;2,active;true;Deutschland;schaufenster;50 MBit/s;wohnung_kauf;n;5;web,email,bank,music,dl-ul,game,sd,mltstr,hd,fast-ul-dl;true;001.9255274;208900;profile0;1;1;true;n;showqualicontactform;n;n;Friedrichshain_Friedrichshain;BOS_WE45;1;Berlin;/expose/116448208;['Alternative Läden, gemütliche Cafés, angesagte Kneipen: Mit seinem einzigartigen Flair zieht Friedrichshain bereits seit Jahren Studierende, Künstler und junge Berufstätige an. In der Bossestraße 7 entsteht nun ein hochwertiger Neubau mit modernen Wohnungen, die genau den Bedürfnissen der jungen Zielgruppe entsprechen: BOSSE & SPREE. Die außergewöhnliche Fassade des sechsstöckigen Gebäudes zieht mit ihren kunstvoll arrangierten Fenstern die Blicke. Der KfW-55-Neubau umfasst möblierte, barrierefreie Apartments und gemütliche Eigentumswohnungen, teilweise ebenfalls barrierefrei. Über das Erdgeschoss und das erste Obergeschoss erstrecken sich Maisonettes mit kleinem Garten, Balkon und Loggia. Auch die restlichen Wohnungen und Apartments sind jeweils mit Balkon oder Loggia versehen.\n\nDas Objekt im Überblick:\n\n- KfW-55-Neubau\n- 55 barrierefreie, möblierte Apartments\n- 29 Eigentumswohnungen, u.a. Maisonettes\n- 1 bis 2 Zimmer, Wohnflächen von 28 bis 65 m²\n- Mit Garten, Balkon oder Loggia\n- Hochwertige Ausstattung mit Echtholzparkett, Fußbodenheizung und Markenprodukte im Sanitärbereich\n- Ansprechende Architektur mit kunstvoll positionierten Fenstern zur Straße und bodentiefe Fenster mit Blick auf die Gärten\n- Extensiv begrüntes Dach\n\nLernen Sie BOSSE & SPREE näher kennen!\nWeitere Informationen finden Sie auf unserer Webseite unter www.bosse-spree.de. Gerne vereinbaren wir auch einen individuellen Termin und informieren Sie in einem persönlichen Gespräch – kommen Sie einfach auf uns zu, wir freuen uns auf Sie!\n', '- Kompakter Wohnungsschnitt mit durchdachter Raumaufteilung\n- Barrierefreier Grundriss\n- Wohnraum mit integrierter Küchenzeile und Loggia\n- Badezimmer mit bodengleicher Dusche\n- Hauswirtschaftsraum mit Waschmaschinenanschluss ss ', 'Bunt, alternativ und vielfältig: Die lebenswerte Umgebung von BOSSE & SPREE in Friedrichshain hat viel zu bieten. Zahlreiche kleine Läden und gemütliche Cafés warten darauf, entdeckt zu werden. Im Volkspark Friedrichshain, am Rummelsburger See oder im Treptower Park können Sie sich eine Pause vom Alltag gönnen und das gesellige Zusammensein mit Freunden genießen.\nDank komfortabler Verkehrsanbindung sind Sie im Handumdrehen in der Stadt – und auch die Berliner Hochschulen sind gut mit den öffentlichen Verkehrsmitteln erreichbar. Mit der Warschauer Straße, dem Ostkreuz und dem Treptower Park befinden sich gleich drei S-Bahnhöfe im Umkreis von nur einem Kilometer, zudem mehrere Tram- sowie eine Bushaltestelle.\n', 'Provisionsfrei direkt vom Projektentwickler und Bauträger. \nÄnderungen und Irrtümer vorbehalten.\n'];;;disabled;;;;78309;true;
2020-05-30 19:35:05.301700;Berlin;;ONE_YEAR_FREE;9255274;y;n;https://pictures.immobilienscout24.de/listings/62c85bbe-228a-45ad-b32e-c40db60ed8e0-1356180620.jpg/ORIG/resize/118x118%3E/extent/118x118/format/jpg/quality/80;7;11.48;10 MBit/s;telekom_layer_magenta_m;über VDSL;2019;REGULAR;11.48;116448193;district_heating;n;true;MagentaZuhause M;n;Berlin;n;5;9;;7;energy_required;7.11;30.51;Berlin;10243;first_time_use;no_information;B;false;50 MBit/s;underground_garage;"Bossestra&szlig;e";y;https://padlock.link/iomm;https://padlock.link/mm;Bossestraße;apartment;10243;1;58.3;n;2,active;true;Deutschland;schaufenster;50 MBit/s;wohnung_kauf;n;5;web,email,bank,music,dl-ul,game,sd,mltstr,hd,fast-ul-dl;true;001.9255274;211900;profile0;1;1;true;n;showqualicontactform;n;n;Friedrichshain_Friedrichshain;BOS_WE51;1;Berlin;/expose/116448193;['Alternative Läden, gemütliche Cafés, angesagte Kneipen: Mit seinem einzigartigen Flair zieht Friedrichshain bereits seit Jahren Studierende, Künstler und junge Berufstätige an. In der Bossestraße 7 entsteht nun ein hochwertiger Neubau mit modernen Wohnungen, die genau den Bedürfnissen der jungen Zielgruppe entsprechen: BOSSE & SPREE. Die außergewöhnliche Fassade des sechsstöckigen Gebäudes zieht mit ihren kunstvoll arrangierten Fenstern die Blicke. Der KfW-55-Neubau umfasst möblierte, barrierefreie Apartments und gemütliche Eigentumswohnungen, teilweise ebenfalls barrierefrei. Über das Erdgeschoss und das erste Obergeschoss erstrecken sich Maisonettes mit kleinem Garten, Balkon und Loggia. Auch die restlichen Wohnungen und Apartments sind jeweils mit Balkon oder Loggia versehen.\n\nDas Objekt im Überblick:\n\n- KfW-55-Neubau\n- 55 barrierefreie, möblierte Apartments\n- 29 Eigentumswohnungen, u.a. Maisonettes\n- 1 bis 2 Zimmer, Wohnflächen von 28 bis 65 m²\n- Mit Garten, Balkon oder Loggia\n- Hochwertige Ausstattung mit Echtholzparkett, Fußbodenheizung und Markenprodukte im Sanitärbereich\n- Ansprechende Architektur mit kunstvoll positionierten Fenstern zur Straße und bodentiefe Fenster mit Blick auf die Gärten\n- Extensiv begrüntes Dach\n\nLernen Sie BOSSE & SPREE näher kennen!\nWeitere Informationen finden Sie auf unserer Webseite unter www.bosse-spree.de. Gerne vereinbaren wir auch einen individuellen Termin und informieren Sie in einem persönlichen Gespräch – kommen Sie einfach auf uns zu, wir freuen uns auf Sie!\n', '- Kompakter Wohnungsschnitt mit durchdachter Raumaufteilung\n- Barrierefreier Grundriss\n- Wohnraum mit integrierter Küchenzeile und Loggia\n- Badezimmer mit bodengleicher Dusche\n- Hauswirtschaftsraum mit Waschmaschinenanschluss ', 'Bunt, alternativ und vielfältig: Die lebenswerte Umgebung von BOSSE & SPREE in Friedrichshain hat viel zu bieten. Zahlreiche kleine Läden und gemütliche Cafés warten darauf, entdeckt zu werden. Im Volkspark Friedrichshain, am Rummelsburger See oder im Treptower Park können Sie sich eine Pause vom Alltag gönnen und das gesellige Zusammensein mit Freunden genießen.\nDank komfortabler Verkehrsanbindung sind Sie im Handumdrehen in der Stadt – und auch die Berliner Hochschulen sind gut mit den öffentlichen Verkehrsmitteln erreichbar. Mit der Warschauer Straße, dem Ostkreuz und dem Treptower Park befinden sich gleich drei S-Bahnhöfe im Umkreis von nur einem Kilometer, zudem mehrere Tram- sowie eine Bushaltestelle.\n', 'Provisionsfrei direkt vom Projektentwickler und Bauträger. \nÄnderungen und Irrtümer vorbehalten.\n'];;;disabled;1;;;78309;true;
2020-05-30 19:35:05.765838;Berlin;central_heating;ONE_YEAR_FREE;1230634;n;y;https://pictures.immobilienscout24.de/listings/7942356e-60f9-447b-85b7-2319534f72b2-1372147934.jpg/ORIG/resize/118x118%3E/extent/118x118/format/jpg/quality/80;14;12.19;40 MBit/s;telekom_layer_magenta_l;über VDSL;1965;REGULAR;12.19;117864351;gas;y;false;MagentaZuhause L;y;Berlin;y;6;2;228;no_information;energy_consumption;7.44;51.15;Berlin;10961;no_information;no_information;;false;100 MBit/s;no_information;no_information;y;https://padlock.link/ioml;https://padlock.link/ml;no_information;apartment;10961;2;178.3;n;2,active;true;Deutschland;standard;100 MBit/s;wohnung_kauf;n;2;web,email,bank,music,dl-ul,game,sd,mltstr,hd,fast-ul-dl;true;001.1230634;275000;profile0;7;2;true;n;showqualicontactform;n;n;Kreuzberg_Kreuzberg;5545;2;Berlin;/expose/117864351;"['Angeboten wird eine bezugsfreie 2-Zimmerwohnung in der 2.Etage eines Wohnhauses aus dem Jahre 1956. Die Wohnung verfügt über eine Wohnfläche von ca. 51m² und ist auch bequem mit dem Aufzug zu erreichen. Beide Zimmer haben jeweils einen Zugang zum großzügien Balkon, der gen West ausgerichtet ist. Küche und Bad, beides mit Fenster, zeigen zur Hofseite. Das kompakte Badezimmer ist mit neutralen, weißen Fliesen versehen und mit einer Badewanne ausgestattet. Die Beheizung der Wohnung erfolgt über eine Gas-Zentralheizung. Auch ein Kellerabteil steht dem neuen Eigentümer zur Verfügung. \r\nDas Wohnhaus ist nur 100 Meter von der bekannten und beliebten Bergmannstraße entfernt. In dem attraktiven Kreuzberger Kiez erwartet Sie ein lebhaftes, von Kunst und Kultur erfülltes Umfeld, das keine Wünsche offen lässt. In unmittelbarer Nähe gibt es unzählige Restaurants und Cafés - vom Feinschmecker-Tempel bis zur Alt-Berliner Eckkneipe ist hier alles vorhanden. Dinge des täglichen Bedarfs sind bequem erhältlich. Auch der bekannte Chamissoplatz, die Marheineke-Markthalle sowie der schöne Victoria-Park mit seinem Wasserfall befinden sich in unmittelbarer Nachbarschaft. Das Ufer des Landwehrkanals mit seinen Liegewiesen und Flaniermöglichkeiten bietet im Sommer ein einmaliges Erlebnis. Das Tempelhofer Feld ist nur ca. 1km entfernt. Die Anbindung an die öffentlichen Verkehrsmittel ist ausgezeichnet. Zum nächsten U-Bahnhof ""Gneisenaustraße"" (U7) sind es nur ca. 350m. Verschiedene Bushaltestellen sind ebenfalls in wenigen Gehminuten zu erreichen. Mit dem Fahrrad ist man in wenigen Minuten am Potsdamer Platz und in Berlin-Mitte. \r\nBei Interesse an diesem Angebot senden Sie uns gern vorab eine Anfrage über das Internetportal oder per Mail an info@berlinmaegleren.de. Sie erhalten dann zunächst das Exposé von Ihrer Ansprechperson Simone Sczepanski per Mail sowie einen Vorschlag zur Besichtigung (falls gewünscht). Für Fragen vorab erreichen Sie Frau Sczepanski auch mobil unter 0175 18 16 529']";;;;;;true;;;
2020-05-30 19:35:06.111283;Berlin;combined_heat_and_power_plant;ONE_YEAR_FREE;16005073;y;y;https://pictures.immobilienscout24.de/listings/787f4a57-eab9-4e66-aec6-3025dc004d6d-1366109939.jpg/ORIG/resize/118x118%3E/extent/118x118/format/jpg/quality/80;19;10.14;40 MBit/s;telekom_layer_magenta_l;über VDSL;2020;REGULAR;10.14;117852201;combined_heat_and_power_fossil_fuels;n;false;MagentaZuhause L;y;Berlin;y;8;9;204;17;energy_required;5.23;54;Berlin;14199;mint_condition;sophisticated;B;false;100 MBit/s;no_information;Reichenhaller Str.;y;https://padlock.link/ioml;https://padlock.link/ml;Reichenhaller_Str.;roof_storey;14199;2;65.4;n;2,active;true;Deutschland;premium;100 MBit/s;wohnung_kauf;n;6;web,email,bank,music,dl-ul,game,sd,mltstr,hd,fast-ul-dl;true;001.15847990;439000;profile0;6;2;true;y;showqualicontactform;y;n;Schmargendorf_Wilmersdorf;117852201;2;Berlin;/expose/117852201;['Exklusives Wohnen \n\nMit großen Schritten geht es, in dem in bester Lage zwischen Ku’damm und Grunewald entstehenden Maximilians Quartier, der Fertigstellung entgegen. Die ersten Übergaben an die zukünftigen Bewohner sind bereits erfolgt. Das Wohnquartier, welches geprägt sein wird von idyllischer Ruhe und gleichzeitig kurzen Wegen in die City West, verbindet klassische Architekturelemente, angelehnt an die eleganten Wohnhöfe der wilhelminischen Kaiserzeit, mit einer modernen und zukunftsorientierten Lebensweise. Innovative Mobilitäts- und Energiekonzepte in Form von elektronischen Ladestationen an jedem Stellplatz im Quartier Teil D und einer eigenen Carsharing-Flotte sowie energieeffiziente Blockheizkraftwerke für die quartiersbestimmte Strom- und Wärmeerzeugung sind das Vorzeigemodell für eine nachhaltige Lebensweise.', 'Eine Ausstattung, die keine Wünsche offen lässt\n\n• Westbalkon mit Panoramablick\n• Wärme- und Warmwasserversorgung über ein eigenes Blockheizkraftwerk (BHKW), welches auch den Quartierstrom erzeugt\n• Parkettboden mit Fußbodenheizung\n• hochwertige Fliesenböden in Küchen und Bädern \n• Elektrisch betriebener außen liegender Sonnenschutz\n• Gärtnerisch gestaltete Außenanlagen \n• Innenhöfe sind mit W-LAN-Hotspots ausgestattet\n• Lademöglichkeit für Elektromobilität an jedem Pkw-Stellplatz\n• Fahrradstellplätze in der Tiefgarage und in den Außenanlagen\n• Deckenhöhe im Dachgeschoss 3,15 Meter\n• separater Hauswirtschaftsraum\n• eigenes Kellerabteil\n• Fahrstuhl von der Tiefgarage bis ins Dachgeschoss', 'Zwischen Kudamm und Grunewald sagt alles!\n\nArbeiten in der City und auf kurzem Weg zurück in ein grünes Zuhause, ein kurzer Lauf im Grunewald und danach wieder Kultur oder Shopping in der City – das Maximilians Quartier im schönen Berliner Ortsteil Schmargendorf bietet genau das. Auf halbem Weg zwischen Kurfürstendamm und dem Forst Grunewald entsteht ein einzigartiger Rückzugsort mit kurzen Wegen in die City und ins schöne Berliner Umland. Gärten, Parkanlagen, vielfältige Sportangebote sowie kleine Geschäfte für den täglichen Bedarf und ein Wochenmarkt prägen das direkte Wohnumfeld.\n\nÜber den S- und U-Bahnhof Heidelberger Platz besteht eine hervorragende Nahverkehrsanbindung. Außerdem macht eine Reihe von Buslinien hier Station. Wer mit dem Auto unterwegs ist, erreicht im  Handumdrehen die Anschlussstellen zur Stadtautobahn A 100.', 'Terminvereinbarung\n\nFür eine unverbindliche Besichtigung stehen wir Ihnen jederzeit gern zur Verfügung. Bitte lassen Sie uns hierfür einfach einige Terminvorschläge zukommen. Gern übersende ich Ihnen auch weitere Unterlagen.\n\nProvisionspflichtiges Angebot\n\nDie hier angebotene Wohnung ist provisionspflichtig. Nach notarieller Beurkundung ist vom Erwerber eine Provision an den Vermittler in Höhe von 7,14 % (inkl. MwSt.) vom Gesamtkaufpreis zu entrichten.\n\nHaftungsausschluss\n\nAlle in diesem Angebot enthaltenen Angaben, Abmessungen und Preisangaben beruhen auf Angaben des Verkäufers oder eines Dritten. Der Makler übernimmt hierfür keine Haftung. \n\nMakleralleinauftrag \n\nDie angebotene Immobilie wird im Alleinauftrag veräußert.'];true;;;;;;;;7
2020-05-30 19:35:06.459436;Berlin;central_heating;ONE_YEAR_FREE;97838;n;n;https://pictures.immobilienscout24.de/listings/dca72f06-84c6-439d-9807-c507177f6e30-1366201499.jpg/ORIG/resize/118x118%3E/extent/118x118/format/jpg/quality/80;17;10.22;40 MBit/s;telekom_layer_magenta_l;über VDSL;1900;REGULAR;10.22;117863760;natural_gas_heavy;y;false;MagentaZuhause L;y;Berlin;y;4;1;148.11;23;energy_consumption;5.61;55.82;Berlin;12489;no_information;normal;;false;100 MBit/s;no_information;"Radickestra&szlig;e";n;https://padlock.link/ioml;https://padlock.link/ml;Radickestraße;roof_storey;12489;2;101.6;n;2,active;true;Deutschland;standard;100 MBit/s;wohnung_kauf;y;4;web,email,bank,music,dl-ul,game,sd,mltstr,hd,fast-ul-dl;true;001.97838;160000;profile0;4;2;true;n;showqualicontactform;n;n;Adlershof_Treptow;2529+10155;2;Berlin;/expose/117863760;['Das Wohn- und Geschäftshaus  wurde im Jahr 1997 aufwendig saniert und modernisiert und das Dachgeschoss zu Wohnungen ausgebaut. Es sind 15 Wohnungen mit 1- bis 3-Zimmern sowie 3 Gewerbeeinheiten im Erdgeschoss und im Souterrain entstanden.  Im Hofbereich des ca. 966 m² großen Grundstücks befinden sich 4 Halbgaragen und diverse Fahrradabstellplätze. Die liebevolle Restaurierung des beeindruckenden Eckhauses passt sich harmonisch in das Gesamtbild des Straßenzuges ein. Alle Wohnungen wurden mit Küchenzeilen incl. elektrischer Geräte  ausgestattet. Die Bäder wurden raumhoch gefliest und sind ausgestattet mit WC, Waschbecken, Wanne bzw. Dusche. Moderne  Isolierglasfenster wurden eingebaut und die Fassade erneuert und gedämmt. Kellerräume sind vorhanden.', 'Die gesamte Wohnung ist mit Teppichboden ausgestattet. Die Decken und Wände sind mit Raufasertapete versehen. \n\nDie Küche ist sehr geräumig und verfügt über eine Einbauküche mit elektrischen Geräten - Elektroherd, Kühlschrank, Umlufthaube, Spülmaschine.  \n \nDas Wohnzimmer hat eine Fläche von ca. 20 m² und das Schlafzimmer von ca. 12 m². \n\nDas Bad verfügt über eine Badewanne mit Waschbecken und WC, sowie ein Fenster.\n\nEin großzügiger Flur mit Platz als Abstellfläche darf natürlich auch nicht fehlen.  \n\nDie Wohnung hat einen Kabel- und Telefonanschluss.\n\nZusätzlich verfügt die Wohnung über einen Keller.', 'Die Nähe zur City wird durch die optimale Verkehrsanbindung durch S-Bahn und Straßenbahn gegeben. In nur 15 Minuten kann man mit der S-Bahn am Alexanderplatz sein. Die Autobahn ist nur ca. 5 Autominuten entfernt.\nDie Radickestraße ist eine ruhige Seitenstraße in Nähe der Dörpfeldstraße, welche ca. 10 Minuten fussläufig vom S-Bahnhof Adlershof entfernt ist.  Mehrere Supermärkte, gastronomische Einrichtungen und zahlreiche Einzelhandelsgeschäfte sind in der nahe gelegenen Einkaufsmeile Dörpfeldstraße vorhanden. \n\nDer Standort des Hauses in verkehrsgünstiger und vielversprechender Lage, erhält seine Attraktivität nicht zuletzt durch das nahe Wissenschafts- und Wirtschaftszentrum Berlin-Adlershof.', 'Die Wohnung ist unbefristet vermietet und bietet sich als Anlageobjekt an.\n\nDieses Angebot ist freibleibend, unverbindlich und ohne Gewähr. Irrtum und Auslassung bleiben vorbehalten. Alle Angaben beruhen auf Information des Eigentümers. Für die Richtigkeit und Vollständigkeit übernehmen wir keine Gewähr.'];;;;;1997;;;;
