2020-05-30 19:32:52.958818;Berlin;;ONE_YEAR_FREE;174522;n;y;https://pictures.immobilienscout24.de/listings/54efbef0-9c05-4d9b-b812-de3a5275e18c-1367429002.jpg/ORIG/resize/118x118%3E/extent/118x118/format/jpg/quality/80;10;10.14;40 MBit/s;telekom_layer_magenta_l;;über VDSL;1954;REGULAR;10.14;118076296;oil;y;true;MagentaZuhause L;y;Berlin;y;11;2;;no_information;energy_consumption;5.19;225;Berlin;14199;no_information;no_information;F;false;100 MBit/s;no_information;no_information;n;https://padlock.link/ioml;https://padlock.link/ml;no_information;apartment;14199;8;169;n;2,active;true;Deutschland;top;100 MBit/s;wohnung_kauf;n;;web,email,bank,music,dl-ul,game,sd,mltstr,hd,fast-ul-dl;true;001.174522;1100000;profile0;;5;true;n;showqualicontactform;n;n;Schmargendorf_Wilmersdorf;118076296;7;Berlin;/expose/118076296;['Auf der Suche nach einer sehr raumkomfortablen Architektur ist diese Wohnung ein echter Glücksfund. Die Großzügigkeit basiert auf der Fusion zweier Wohnungen, die sich über zwei Etagen erstrecken. Jeder Maisonette ist ein eigenes Grundbuchblatt zugeordnet. Denkbar ist so eine einfache Teilung.\nSehr familien- und gastfreundlich ist die große Wohneinbauküche nebst Gäste-WC im 3. Obergeschoss. Diese beeindruckende Küche eignet sich perfekt, um bequem für viele Leute zu kochen, noch dazu auf kommunikative Weise an einer modernen Kochinsel mit Dunstabzug. Auch der robuste Fliesenboden ist optimal gewählt.\n \nZur anderen Seite befindet sich ein anregend belichtetes, ebenfalls ca. 3,05 Meter hohes Zimmer, das zurzeit als Fitnessraum dient.\nDie obere Etage ist über zwei interne Wendeltreppen oder das Treppenhaus zugänglich. Einen Lift gibt es aktuell nicht, ist aber denkbar. \nNeben den sechs Zimmern stehen ein Bad mit Sprinz-Duschkabine und ein taghelles Bad mit Durability-Wanne zur Verfügung. Alle Zimmer und auch die zeitgemäßen Bäder präsentieren sich mit einem sehr sympathischen Ambiente. Vor allem die Atmosphäre auf den großen Sonnenterrassen ist äußerst angenehm. Installiert sind u.a. Fußbodenheizungen. \nDer Einbau eines Kamins ist vorbereitet. Dieser imposanten Wohnung sind zwei Kellerräume zugeordnet.\nWegen einer bereits beschlossenen und bezahlten Sanierung sind Umgestaltungs- und Ausstattungswünsche denkbar, wie z.B. größere Wandöffnungen und spezielle Designs. Auf diesem Wege lässt sich ein maßgeschneiderter Grundriss realisieren – eine Topgelegenheit für individuelle Ideen.', 'Sie möchten den Marktwert Ihrer Immobilie wissen oder Ihre Immobilie verkaufen? Wir sind seit 1995 erfolgreich im Verkauf von Immobilien in Berlin, Potsdam und Umgebung tätig. Unsere exzellenten Eigentümerbewertungen sprechen für sich.\n\n•\tOftmals haben wir schon den richtigen Käufer für Ihre Immobilie in unserer Kartei\n•\tWir sind Bellevue Best Property Agent und Mitglied in den Verbänden IVD & FIABCI\n•\tWir benötigen keinen schriftlichen Alleinauftrag\n•\tKosten entstehen Ihnen bei uns keine\n•\tUnsere Spezialisten stehen Ihnen gerne für ein erstes – für Sie unverbindliches - Gespräch zur Verfügung\n\nWir freuen uns über Ihre Kontaktaufnahme unter einkauf@immoberlin.de oder (030) 895 72 20.\nBitte besuchen Sie auch unsere Website: \nhttps://www.immoberlin.de'];central_heating;disabled;;;;;
2020-05-30 19:32:53.311347;Berlin;true;ONE_YEAR_FREE;185949;n;y;https://pictures.immobilienscout24.de/listings/5d65aa07-d607-4897-bfa3-74970ffc4cf2-1371653971.jpg/ORIG/resize/118x118%3E/extent/118x118/format/jpg/quality/80;15;16.54;40 MBit/s;telekom_layer_magenta_l;;über VDSL;1977;REGULAR;16.54;118076777;no_information;n;true;MagentaZuhause L;n;Berlin;y;6;3;280.7;40;energy_consumption;8.84;73.32;Berlin;12053;well_kept;no_information;D;false;100 MBit/s;no_information;"Kopfstra&szlig;e";y;https://padlock.link/ioml;https://padlock.link/ml;Kopfstraße;apartment;12053;3;105.3;n;2,active;true;Deutschland;schaufenster;100 MBit/s;wohnung_kauf;y;3;web,email,bank,music,dl-ul,game,sd,mltstr,hd,fast-ul-dl;true;001.185949;276900;profile0;4;3;true;n;showqualicontactform;n;n;Neukölln_Neukölln;16722060;3;Berlin;/expose/118076777;['Integriert in eine Häuserzeile mit klassischen Altbauten ruht in der Kopfstraße 40 ein schlicht gehaltenes Gebäude aus jüngerer Zeit. Die Linien seiner Nachbarhäuser führt es gelungen fort und beweist damit, dass es auch in der zweiten Hälfte des 20. Jahrhunderts möglich war, moderne Architektur proportioniert und taktvoll in historischen Bestand einzugliedern. Dabei steht es stilistisch durchaus für seine Zeit: etwa durch die partielle Klinkerfassade oder die schwarzen Biberschindeln unterhalb des Dachs und fügt sich somit ästhetisch in das Gesamtbild ein.\r\n\r\nDas Haus beherbergt zehn Wohnungen auf fünf Etagen, die über das Treppenhaus oder einen Aufzug zu erreichen sind. Alle Wohnungen verfügen über drei Zimmer mit ca. 73 bis 83 Quadratmetern Wohnfläche. Die Bäder sind mehrheitlich mit einer Badewanne ausgestattet.\r\n\r\nAlle oberen Etagenwohnungen erfreuen sich an einem Balkon zur Hofseite. Die beiden Erdgeschosswohnungen öffnen sich mit einer Terrasse zum Garten und verfügen über ein entsprechendes Sondernutzungsrecht. Die Bewohner können von dort aus lange Sonnenstunden genießen, denn die Rückseite des Hauses ist nach Süden ausgerichtet. Damit auch die Jüngsten hiervon profitieren, wurde im Hof ein kleiner Spielplatz angelegt.\r\n\r\nNahezu alle Wohnungen sind vermietet Ein Teil der Wohnungen ist saniert. Sie wurden mit Laminat und modernen Bodenfliesen ausgelegt, die Wannenbäder zeitgemäß aufgewertet sowie neue Türen und Fenster eingesetzt.\r\n\r\nZu allen Einheiten gehört ein Kellerabteil. Der gemeinschaftlichen Nutzung steht zudem ein Fahhradkeller zur Verfügung. Das Gebäude wird über Fernwärme beheizt.\r\n\r\nWohnbeispiel: https://youtu.be/zadZ8VLzkME \r\n\r\nACCENTRO App für iOS https://goo.gl/KvMJTa und für Android https://goo.gl/ACqL6H', 'Neukölln hat im vergangenen Jahrzehnt einen veritablen Aufstieg zum angesagten Berliner Trendbezirk vollzogen. Mitte, Prenzlauer Berg und Kreuzberg waren seinerzeit weithin erschlossen und schienen erschöpft, als die Potenziale von Neukölln in den Fokus der Szene- und Ausgehkultur rückten und bald darauf weithin erkannt wurden. Von Kreuzberg ausgehend wurde das Nachtleben erobert und die Unterschiede zum Nachbarbezirk immer weiter verwischt. Es wuchs zusammen, was heute immer weniger voneinander zu unterscheiden ist. So entstand auch die Fusion der Bezirksnamen -Kreuzkölln-, die wiedergibt, was hier seither passiert. Ein Trend der sich dynamisch ausweitet. \r\nMittlerweile liegt über dem Kiez der feine Duft von Biobäckern und Kaffeeröstereien über Designerläden und Fairtrade Geschäften. Doch auch das Kiez-Leben hat sich gehalten. Berliner Schnauze und orientalische Lebendigkeit erhöhen vielmehr den authentischen Reiz einer Gegend, die es so wohl kein zweites Mal gibt. Neukölln ist längst ein angesagter Hotspot, was den Stellenwert als attraktiven Wohnkiez enorm gesteigert hat. Diese Entwicklung scheint dabei kein Ende zu nehmen, zumal der Bezirk weiterhin Potenziale birgt. \r\n\r\nIn der Kopfstraße 20 bietet sich nun die Gelegenheit in diese fortschreitende Entwicklung zu investieren oder sich selbst mitten in diesem aufstrebenden Kiez niederzulassen. Die Infrastruktur der Umgebung lässt keine Wünsche offen und bietet alles, was den Alltag in einer Metropole nicht nur bunt und vielfältig, sondern lebenswert macht: Kitas, Schulen und zahllose Spielplätze, Schwimmbäder, Sport- und Freizeitanlagen, Bioläden, Lebensmittelmärkte und Shopping Malls. Außerdem ist die Seitenstraßenlage des Hauses ein wahrer Bonus. Bequem profitiert man von allen Annehmlichkeiten der angrenzenden Hermannstraße mit Geschäften, U- und S-Bahnhöfen und Bushaltestellen. Doch aus ihrem Trubel lässt es sich komfortabel in die ruhige Kopfstraße zurückziehen.'];central_heating;disabled;2053;;;;
2020-05-30 19:32:53.774709;Berlin;;ONE_YEAR_FREE;213674;y;y;https://pictures.immobilienscout24.de/listings/e4587c4e-c60e-4fc1-8790-76968f6de691-1367472159.jpg/ORIG/resize/118x118%3E/extent/118x118/format/jpg/quality/80;10;12.41;40 MBit/s;telekom_layer_magenta_l;;über VDSL;2020;REGULAR;12.41;118080634;district_heating;y;false;MagentaZuhause L;y;Berlin;y;7;9;170;no_information;energy_required;6.36;65.83;Berlin;12105;first_time_use;sophisticated;B;false;100 MBit/s;no_information;no_information;n;https://padlock.link/ioml;https://padlock.link/ml;no_information;no_information;12105;3;55.3;n;2,active;true;Deutschland;standard;100 MBit/s;wohnung_kauf;n;4;web,email,bank,music,dl-ul,game,sd,mltstr,hd,fast-ul-dl;true;001.213674;395000;profile0;;3;true;n;showqualicontactform;n;n;Tempelhof_Tempelhof;2358/G1/Eh1;3;Berlin;/expose/118080634;['Die sonnige Dachgeschosswohnung befindet sich in einer frisch renovierten, für die dreißiger Jahre typischen Bauweise errichteten Wohnanlage, in Massivbauweise. Die charmanten, farbenfrohen Gebäude aus dem Jahr 1925 befinden sich in sehr gutem Zustand und verfügen im Altbaubereich über Fernwärmeanschluss und großem sonnigem und kinderfreundlichem Innenhof.\nDas Gemeinschaftseigentum wurde zwischen 2014 und 2016 umfänglich modernisiert und Instand gesetzt. Die Fassadenflächen sind mit einem Vollwärmeschutzsystem versehen. Die Fenster der Schallschutzklasse 3 wurden verbaut.\nDie Treppenhäuser im klassischen 30er Jahre Look sind ansprechend renoviert und werden nach Fertigstellung des Dachgeschosses malertechnisch nochmals überarbeitet.\n\nDie Wohnung ist sehr gut geschnitten und verfügt über einen mittig liegenden Wohnessbereich mit Küchenzeile und Balkon und zwei separat liegenden Zimmern und eignet sich bestens für Singles, WGs und Familien.', '- 2 Schlafzimmer + Wohn-Essbereich \n- Großzügige Deckenhöhen von 2,80 bis 3,00 m \n- 3-fach isolierte Fenster\n- Echtholzparkettfußboden \n- Fußbodenheizung mit Fernwärmeanschluss \n- mit Terrasse\n- Landschaftlich gestaltete Innenhofgärten\n\n\n- 2 bedrooms\n- Ceiling heights of 2.80 to 3.00 m \n- Floor-to-ceiling windows for light flooded rooms \n- Triple-glazed windows \n- Solid wood parquet floor\n- Underfloor heating using district heating \n- with terrace\n- Landscaped inner courtyards', 'Tempelhof ist ein grüner und familienfreundlicher Bezirk in Berlin mit vielen Parks und dem Tempelhofer Hafen. Das Eckgebäude mit Südost-Ausrichtung befindet sich in zentraler Berliner Lage. Dieses grüne Viertel liegt nur 15 Minuten von der geschäftigen Friedrichstraße entfernt, die direkt über die U-Bahn-Linie U6 erreicht werden kann. In weniger als 5 Minuten erreichen Sie zu Fuß den Tempelhofer Hafen. Hier befindet sich neben einem schönen, direkt am Fluss gelegenen Einkaufszentrum auch der Kanalhafen. Der Tempelhofer Damm liegt ganz in der Nähe, dort haben sich Karstadt und weitere, große Einzelhändler niedergelassen. Am Tempelhofer Feld, dem größten und beliebtesten Park Berlins kann zahlreichen sportlichen Aktivitäten nachgegangen werden, einschließlich Inlineskating und Windskaten.', 'Ohne Aufzug über dem 3. Obergeschoss'];;;;;;;
2020-05-30 19:32:54.109540;Berlin;;ONE_YEAR_FREE;76007;n;n;https://pictures.immobilienscout24.de/listings/1429ff1d-9e43-486d-9a5c-e07f0a286106-1367709555.jpg/ORIG/resize/118x118%3E/extent/118x118/format/jpg/quality/80;10;11.3;40 MBit/s;telekom_layer_magenta_l;;über VDSL;1958;REGULAR;11.3;118080290;district_heating;n;true;MagentaZuhause L;y;Berlin;n;6;2;343.9;no_information;energy_consumption;5.73;68;Berlin;10627;well_kept;no_information;F;false;100 MBit/s;no_information;no_information;n;https://padlock.link/ioml;https://padlock.link/ml;no_information;ground_floor;10627;2;166.4;n;2,active;true;Deutschland;standard;100 MBit/s;wohnung_kauf;n;0;web,email,bank,music,dl-ul,game,sd,mltstr,hd,fast-ul-dl;true;001.76007;290000;profile0;;2;true;n;showqualicontactform;n;n;Charlottenburg_Charlottenburg;69426;3;Berlin;/expose/118080290;['Die zum Verkauf stehende Eigentumswohnung befindet sich im Erdgeschoss eines 1960 erbauten Mehrfamilienhauses das zwischen der Bismarckstraße und der Kantstraße in Charlottenburg liegt. \r\n\r\nDie gepflegte Wohnung verfügt über 2 Zimmer, eine Küche, ein Bad mit Wanne und Waschmaschinenanschluss, einen geräumigen Flur sowie eine Abstellnische. Die Küche und das Bad sind tagesbelichtet und haben jeweils einen gefliesten Fußboden. Im Wohn- und Schlafzimmer sowie im Flur wurde Laminat verlegt. Die genaue Raumaufteilung entnehmen Sie bitte dem beigefügten Grundriss.\r\nDie Wohnung sollte vor einem Einzug renoviert werden.\r\n\r\nDie Beheizung ist zentral über die Fernwärme gewährleistet. Die Warmwasseraufbereitung erfolgt über einen Durchlauferhitzer. \r\n\r\nDes Weiteren gehört ein Kellerabteil zur Wohneinheit. \r\n\r\nDas monatliche Wohngeld beträgt 343,90 EUR inkl. Heizkosten.\r\n', 'Das Objekt befindet sich im Stadtbezirk Charlottenburg, nahe dem Sophie-Charlotte-Platz und liegt fußläufig zur Kantstraße entfernt. Der Lietzenseepark ist ebenso wenige Minuten entfernt wie auch die beliebte Wilmersdorfer Straße.\r\n\r\nCharlottenburg ist eines der Dienstleistungs- und Vergnügungszentren der City-West und lässt seine Bewohner das angenehme und lebendige Flair deutlich spüren. Kulturelle Anlagen, der Schloßpark Charlottenburg, die Deutsche Oper, die Technische Universität und der Kurfürstendamm sind sowohl fußläufig als auch mit öffentlichen Verkehrsmitteln gut und schnell zu erreichen. Der U-Bahnhof Sophie-Charlotte-Platz der Linie U7 befindet sich in unmittelbarer Nähe an der Bismarckstraße und in der Kaiser-Friedrich-Straße verkehren diverse Buslinien. \r\n\r\nDie Infrastruktur ist hier als sehr gut zu bezeichnen. Zahlreiche Cafés, Restaurants, Bars und trendige Shoppingläden unterstreichen den lebendigen Lebensstil der hier wohnenden Bevölkerung. Sportanlagen wie das Olympiastadion, die Waldbühne, der Schlosspark mit dem Schloss Charlottenburg und der Volkspark Jungfernheide garantieren einen hohen Freizeitwert. Auch der Zoologische Garten und die Ausflugsziele in der westlichen City sind gut erreichbar. \r\n\r\nEine perfekte Verkehrsanbindung und Infrastruktur zeichnen den Standort aus. Das Gebäude liegt nur wenige Meter vom Rathaus und der technischen Universität entfernt. Fußläufig in ca. 10 Minuten sind der Kurfürstendamm zum Shoppen, der Tegeler See zum Erholen sowie auch das Downtown zum Arbeiten erreichbar.'];central_heating;;;;;;
2020-05-30 19:32:54.459288;Berlin;;ONE_YEAR_FREE;469777;n;y;https://pictures.immobilienscout24.de/listings/26011d9e-76b4-4651-a320-a131fd8c2b4e-1367447964.jpg/ORIG/resize/118x118%3E/extent/118x118/format/jpg/quality/80;6;11.14;40 MBit/s;telekom_layer_magenta_l;39.33;über VDSL;1900;REGULAR;11.14;118077706;natural_gas_light;n;false;MagentaZuhause L;n;Berlin;n;5;1;160;85;energy_consumption;6.17;39.33;Berlin;10437;well_kept;no_information;D;false;100 MBit/s;no_information;"Dunckerstra&szlig;e";n;https://padlock.link/ioml;https://padlock.link/ml;Dunckerstraße;apartment;10437;1;107;n;2,active;true;Deutschland;standard;100 MBit/s;wohnung_kauf;y;1;web,email,bank,music,dl-ul,game,sd,mltstr,hd,fast-ul-dl;true;001.469777;225000;profile0;4;1;true;n;showqualicontactform;n;n;Prenzlauer_Berg_Prenzlauer_Berg;122-Sfl.;1;Berlin;/expose/118077706;['Die hier angebotene, aktuell vermietete 1 Zimmer Wohnung befindet sich in einem prunkvollen Altbau aus dem Jahre 1900, welcher seitdem sehr gut gepflegt und instand gehalten wurde.\nDie gesamte Immobile besteht aus einem Vorderhaus, einem Seitenflügel und einem Quergebäude, mit jeweils 5 Geschossen (Erdgeschoss, 1. bis 4. Obergeschoss und Dachgeschoss).\nDurch den einladenden Eingangsbereich gelangen Sie über das Vorderhaus direkt zum Hof. Durch den Hausflur zum Seitenflügel begrüßt Sie im 1.OG die von den Geräuschen der Straße abgeschirmte Wohnung.\nBei dem Energieausweis für dieses mit Erdgas beheizte Gebäude handelt es sich um einen Verbrauchsausweis.\nDas Grundstück befindet sich in einem Gebiet, das der Senat von Berlin zum Milieuschutzgebiet im Sinne von § 172 BauGB erklärt hat.\n.', 'Das Zimmer, sowie das Bad und die Abstellkammer sind über den zentralen Flur erreichbar, welcher sich direkt am Wohnungseingang befindet.\nVom Zimmer aus gelangen Sie in die Küche sowie zu den Balkonen.\nZusammenfassung der Wohnung:\n\uf0d8 1 Zimmer auf insgesamt ca. 39,33 Quadratmetern\n\uf0d8 praktischer Grundriss\n\uf0d8 Küche\n\uf0d8 gefliestes Wannenbad\n\uf0d8 1 Balkon\n\uf0d8 Bestandsdielung\n\uf0d8 altbautypische Decken\n\uf0d8 Abstellkammer', 'Diese 1 Zimmer Wohnung befindet sich in bester Lage im Berliner Stadtteil Prenzlauer Berg - und zwar in dem sehr beliebten Helmholtzviertel. Eingebettet in eine angenehme Nachbarschaft, die von Altbauten geprägt ist, überzeugt der Standort durch Zentrumsnähe und eine ideale Verkehrsanbindung.\nDer Prenzlauer Berg bietet seit vielen Jahren nationalen und auch internationalen Künstlern ein kreatives Umfeld. Genießen Sie unterschiedlichste Sonntags-Darbietungen im Mauerpark oder verfolgen Sie Sportevents und Konzerte in der Max-Schmeling-Halle, die Sie von Ihrem neuen Zuhause in wenigen Gehminuten erreicht haben. Auf der Schönhauser Allee findet sich zudem alles, was das Shopping-Herz begehrt und falls nicht, begeben Sie sich in die U2 und steigen 20 Minuten später am KaDeWe wieder aus, um sich dort, oder auf dem Ku’damm, weitere Wünsche erfüllen zu können.\nNur wenige Gehminuten von der Wohnung entfernt verkehren verschiedene Buslinien und die Straßenbahn. Auch die nächsten U- und S-Bahnstationen sind nicht weit entfernt (z.B. Eberswalder Straße). Autofahrer gelangen über die Schönhauser Allee und die Prenzlauer Allee schnell in die Innenstadt. Zudem besteht über die Bundesstraßen B96A und B109 eine direkte Verkehrsanbindung an den Berliner Ring. Dank dieses guten Straßenverkehrsnetzes ist der Flughafen Berlin-Tegel in weniger als 30 Autominuten zu erreichen.', 'Die Wohnung ist aktuell vermietet. Das Objekt wurde im Jahr 1998 -1999 aufgeteilt, wobei der Mietvertrag am Anfang des Jahres 2000 geschlossen wurde. Demnach sind die Mieter nicht gesetzlich nach §557a Abs. 1 BGB vor einer Eigenbedarfskündigung geschützt.\nAlle Angaben beruhen auf den uns vom Eigentümer zur Verfügung gestellten Informationen. Eine Haftung für die Richtigkeit bzw. Vollständigkeit können wir nicht übernehmen. Irrtum und Zwischenverkauf vorbehalten. Es gelten unsere AGB.\n\nGerne begleiten wir Sie vor Ort in Berlin-Prenzlauer Berg nach Terminvereinbarung bei einer Besichtigung der Eigentumswohnung.\n\nDie Wohnung wird Provisionsfrei für den Käufer verkauft.'];central_heating;disabled;100;;;;
2020-05-30 19:32:55.051430;Berlin;true;ONE_YEAR_FREE;185949;n;n;https://pictures.immobilienscout24.de/listings/59771727-3d7b-45f7-861e-c5a18f460b80-1371647335.jpg/ORIG/resize/118x118%3E/extent/118x118/format/jpg/quality/80;15;10.62;40 MBit/s;telekom_layer_magenta_l;;über VDSL;1910;REGULAR;10.62;118076503;no_information;n;true;MagentaZuhause L;n;Berlin;n;7;1;265.03;20;energy_consumption;5.96;62.97;Berlin;13189;first_time_use_after_refurbishment;no_information;;false;100 MBit/s;no_information;"Binzstra&szlig;e";y;https://padlock.link/ioml;https://padlock.link/ml;Binzstraße;apartment;13189;2;82.2;n;2,active;true;Deutschland;schaufenster;100 MBit/s;wohnung_kauf;n;2;web,email,bank,music,dl-ul,game,sd,mltstr,hd,fast-ul-dl;true;001.185949;356200;profile0;4;2;true;n;showqualicontactform;n;n;Pankow_Pankow;16719369;3;Berlin;/expose/118076503;"['Südöstlich des Florakiezes im Kissingenviertel, zwischen Berliner Straße und Neumannstraße, befindet sich der charmante Altbau in der Binzstraße 20 in einer ruhigen, von Bäumen gesäumten Wohnstraße. Das gepflegte Mehrfamilienhaus wurde um 1910 erbaut und besteht aus einem Vorder- und einem Gartenhaus sowie einem gemeinsamen Innenhof. \r\n\r\nDen Wohnungen im Erdgeschoss sind jeweils eigene Terrassen mit kleinen Gärten zugeordnet. Der Altbau empfängt seine Bewohner mit einer hellen und freundlichen Fassade mit roten Akzenten. Alle Stilelemente im Treppenhaus wurden liebevoll saniert und die Details gekonnt herausgearbeitet. Stuckbilder an den Wänden im Eingangsbereich und geschwungene Handläufe erinnern an die Geschichte des Hauses und führen über elegante Türstöcke und Kassetten-Eingangstüren zu den Wohnungen. Alle Wohnungen sind über jeweils einen Aufzug am Vorderhaus und Hinterhaus erreichbar.\r\n\r\nVom Erdgeschoss bis zum dritten Obergeschoss bieten praktisch geschnittene 2- bis 3-Zimmerwohnungen mit einer Wohnfläche von 63 bis 97 Quadratmeter ein gemütliches Zuhause. Ein Großteil der Wohnungen ist mit einer Loggia oder einem Balkon ausgestattet. Die Wohnungen sind optimal geschnitten, sodass separat zugängliche und geräumige Zimmer viel Raum zum Einrichten geben. In allen Wohnungen gehen Zimmer, Bäder und Küchen direkt vom Flur ab. Die Bäder haben Tageslicht, die Küchen bieten ausreichend Platz zum Kochen und geselligen Beisammensein. \r\n\r\nDie Wohnungen sind laufend instandgesetzt worden. Isolierglasfenster, Heizkörper sowie Elektro- und Versorgungsleitungen sind erneuert worden, sodass ein zeitgemäßer Standard in den meisten der Wohnungen vorzufinden ist.\r\n\r\nUmgebungsfilm: https://youtu.be/5JfZE5F4jys\r\nWohnbeispiel: https://youtu.be/w5A-4yWso-c\r\n\r\nACCENTRO App für iOS https://goo.gl/KvMJTa und für Android https://goo.gl/ACqL6H', 'Pankow liegt im nördlichen Berlin und gehört mit Prenzlauer Berg und Weißensee zum Bezirk Pankow. Noch heute zeugt der grüne Ortsteil mit seinen zauberhaften Straßenzügen von einer Geschichte herrschaftlicher Sommerdomizile in großen Parkanlagen. Die Menschen in Pankow schätzen die Beschaulichkeit und Ruhe genauso wie die unmittelbare Nähe zum quirligen Prenzlauer Berg.\r\n\r\nFür jeden Geschmack bietet Pankow zahlreiche Erlebnismöglichkeiten. Einkaufen auf dem ältesten Berliner Wochenmarkt am alten Pankower Dorfanger, Spazieren im einzigen Naturschutzgebiet mit vielfältiger Vogelwelt inmitten einer Großstadt – ""Insel der Ruhe"" rund um den Faulen See oder eine Wandertour an der Panke, dem Namensgeber des Bezirks. Auf dem Weg entlang des kleinen Flusses streift man mehrere schöne Parkanlagen: den von Lenné gestalteten Bürgerpark oder den Schlosspark mit dem Schloss Schönhausen. Das Haus, einst Sommerresidenz von Königin Elisabeth Christine, Gattin von Friedrich dem Großen, war zu DDR-Zeiten Gästehaus und Amtssitz des Präsidenten der DDR. Das Schloss wurde liebevoll saniert und gibt als Museum interessante Einblicke in seine wechselvolle Geschichte.\r\n\r\nVom Schlosspark Schönhausen aus zweigt der Radfernweg Berlin-Usedom ab, welcher über 337 Kilometer lang ist und durch teilweise unberührte Naturlandschaften führt. Wer neben ruhiger und erholsamer Natur dynamische und pulsierende Kultur sucht, findet sie im Prenzlauer Berg in der Kulturbrauerei, im Prater oder in einem der unzähligen Cafés.\r\n\r\nNahe der Binzstraße lädt der Florakiez mit der lebendigen Florastraße zum Einkaufen und Verweilen ein. Kleine Spezialitätengeschäfte, besondere Boutiquen mit Ateliercharakter und gemütliche Restaurants bieten Bewohnern und Besuchern von Pankow eine große Vielfalt an Design und kulinarischen Genüssen. Der Florakiez belebt mit seinen Cafés, regelmäßigen Straßenfesten und Flohmärkten eine auf besondere Weise und macht Pankow so reizvoll.']";central_heating;disabled;9700;;;;
