timestamp;obj_regio1;ga_cd_via_qualified;obj_telekomTvOffer;obj_cId;obj_newlyConst;obj_balcony;obj_picture;obj_picturecount;obj_pricetrend;obj_telekomUploadSpeed;obj_telekomTrackingGroup;obj_usableArea;obj_telekomInternetTechnology;obj_yearConstructed;obj_telekomInternetType;obj_pricetrendbuy;obj_scoutId;obj_firingTypes;obj_hasKitchen;obj_ExclusiveExpose;obj_telekomInternetProductName;obj_courtage;geo_bln;obj_cellar;obj_purchasePriceRange;obj_yearConstructedRange;obj_rentSubsidy;obj_houseNumber;obj_energyType;obj_pricetrendrent;obj_livingSpace;geo_krs;obj_zipCode;obj_condition;obj_interiorQual;obj_energyEfficiencyClass;ga_cd_cxp_historicallisting;obj_telekomDownloadSpeed;obj_parkingSpace;obj_street;obj_lift;obj_telekomInternetUrlMobile;obj_telekomInternetUrl;obj_streetPlain;obj_typeOfFlat;geo_plz;obj_noRooms;obj_thermalChar;obj_assistedLiving;obj_ityp;obj_telekomHdTelephone;geo_land;ga_cd_via;obj_telekomInternet;obj_immotype;obj_rented;obj_floor;obj_telekomInternetServices;obj_telekomInternetProductAvailable;obj_cwId;obj_purchasePrice;ga_cd_application_requirements;obj_numberOfFloors;obj_noRoomsRange;ga_cd_maillead_default_shown;obj_garden;evt_count_pm_sig;obj_barrierFree;obj_international;obj_regio3;obj_objectnumber;obj_livingSpaceRange;obj_regio2;URL;beschreibung;obj_heatingType;obj_galleryAd;obj_groupnumber;obj_noParkSpaces;obj_lastRefurbish;ga_cd_developer_virtualreality;ga_cd_customer_group
2020-05-30 19:32:50.282096;Berlin;true;ONE_YEAR_FREE;16379494;n;n;https://pictures.immobilienscout24.de/listings/02be4388-da3d-4618-8446-94f229fbd6e9-1367433828.jpg/ORIG/resize/118x118%3E/extent/118x118/format/jpg/quality/80;5;11.48;40 MBit/s;telekom_layer_magenta_l;42.64;über VDSL;1994;REGULAR;11.48;118076849;gas;n;false;MagentaZuhause L;y;Berlin;y;5;5;169;no_information;energy_consumption;7.14;42.64;Berlin;10247;no_information;no_information;E;false;100 MBit/s;no_information;no_information;n;https://padlock.link/ioml;https://padlock.link/ml;no_information;apartment;10247;1;151.5;n;2,active;true;Deutschland;premium;100 MBit/s;wohnung_kauf;y;2;web,email,bank,music,dl-ul,game,sd,mltstr,hd,fast-ul-dl;true;001.16021515;220000;profile0;5;1;true;n;showqualicontactform;n;n;Friedrichshain_Friedrichshain;1083;2;Berlin;/expose/118076849;"['Bei der angebotenen Immobilie handelt es sich um ein ca. 43 m² großes 1-Zimmer-Apartment im begehrten Stadtteil Berlin-Friedrichshain. Die Einheit befindet sich im Hinterhaus im zweiten Obergeschoss eines im Jahre 1994 errichteten Jugendstilhauses und besticht durch ihre exklusive, wie zentrale Lage. \n\nSie verfügt über einen großen und hellen Wohnbereich, einer gemütlichen separierten Küche, einem Bad mit Tageslichtfenster sowie einem Flur für Garderobe und Abstellmöglichkeiten der täglichen Einkäufe. Weiterhin ist der Wohnung ein Kellerabteil zugeordnet. Die Nutzung des Innenhofes ist selbstverständlich.  \n\nBeim Kauf der Wohnung würde man insgesamt 186,01/10.000stel erwerben. Die Wohnung ist derzeit noch vermietet, wird aber in absehbarer Zeit frei gezogen. \n\nSind Sie neugierig und haben Interesse an der Immobilie? Dann schicken wir Ihnen auf Wunsch gerne das vollständige Exposé inkl. genauer Objektanschrift zu.', 'Friedrichshain ist ein Ortsteil im Bezirk Friedrichshain-Kreuzberg, gehört zu den Szenevierteln Berlins und wartet mit einem lebendigen Nacht- und Kulturleben auf, das über die Stadtgrenzen hinaus populär ist. Friedrichshain liegt im ehemaligen Ostteil Berlins und ist ein zentraler Stadtteil. Die Spree bildet die südliche, die Ringbahn die östliche Grenze.\n\nSchon Ende der 1990er Jahre entwickelte sich die Gegend um die Simon-Dach-Straße zum Kneipenviertel mit vielen kleinen Läden, die eher junges Publikum aus der ganzen Stadt und Touristen anziehen. Insbesondere die vielen Kneipen mit ihren zahlreichen Sitzplätzen auf den breiten Gehsteigen sind bei einigen Anwohnern nicht nur auf Gegenliebe gestoßen. Heute ist der größte Teil der Altbauten saniert und der Bezirk befindet sich im fortschreitenden Gentrifizierungsprozess, weil die aufgrund der Gaststätten, Läden und Ateliers steigende Attraktivität den Ortsteil auch für Investoren und neue Bewohner interessant gemacht hat. Der Bezirk ist aber nach wie vor durch ein alternativ-studentisches Milieu geprägt. \n\nMit aktuell etwa 130.000 Einwohnern gehört Friedrichshain zu einem der bevölkerungsreichsten Berliner Ortsteile. Der Stadtteil ist gut an den öffentlichen Nahverkehr angebunden. Im Süden verläuft die Stadtbahn, im Osten die Ringbahn, und des Weiteren zwei U-Bahnlinien (die U5 zentral in West-Ost-Richtung, die U1 von der Warschauer Straße bis nach Kreuzberg und Charlottenburg). Der ebenfalls in Friedrichshain gelegene S-Bahnhof Ostkreuz ist mit etwa 100.000 Nutzern täglich einer der größten Umsteigebahnhöfe Deutschlands. Außerdem gibt es Straßenbahnen, als wichtigste Linie die M10 von Warschauer Straße bis zum Nordbahnhof in Mitte über Prenzlauer Berg.', 'Das Unternehmen homepoint wurde im Jahr 2004 als klassisches Maklerhaus gegründet und hat sich nach kontinuierlichem Wachstum und stetiger Weiterentwicklung als leistungsstarker Partner auf dem Berliner Immobilienmarkt etabliert. \n\nMit der breiten Leistungsbereitschaft der gesamten homepoint Unternehmensgruppe unterstützen und beraten Sie unsere qualifizierten Mitarbeiter in nahezu allen immobilienrelevanten Fragestellungen.\n\n""Gemeinsam MEHRWERTE für unsere Kunden SCHAFFEN."" - R. Besir, Inhaber\n\nUnser Anspruch ist eine umfassende Beratung, offene Kommunikation, Fairness und Transparenz. Dies führt zu individuellen Lösungen und optimalen Ergebnissen bei der Vermittlung von Immobilien. Als Gütesiegel für Fachkompetenz und Professionalität stehen unsere Mitgliedschaften im IVD, BFVI, unsere DEKRA Zertifizierung im Bereich Immobilienbewertung sowie die Eintragung als Ausbildungsbetrieb der IHK Berlin.\n\nDurch unser Mehr an Wissen schaffen wir für unsere Kunden ein Mehr an Wert und Vertrauen. Erfahrung und  außerordentliches Engagement bilden hierfür die Grundlage.\n\nUnsere Serviceleistungen im Kurzüberblick:\n\n- Fundierte Verkehrswertermittlung (durch DEKRA zertifizierte Sachverständige) inkl. Marktanalyse \n- Fachgerechte Aufbereitung Ihrer Objektunterlagen  \n- Entwicklung einer individuell angepassten Vermarktungsstrategie\n- Erstellung eines aussagekräftigen Exposés mit professionellen Bildern und 360° Rundgängen\n- Zielgruppenorientiertes Marketing Ihres Immobilienangebots, regional und überregional\n- Online-Bieterverfahren \n- Vorselektion und Bonitätsprüfung potentieller Kaufinteressenten\n- Interessenten- und Besichtigungsmanagement\n- Finanzierungsvermittlung durch zertifizierte Kooperationspartner\n- Vertragsmanagement und notarielle Beurkundung\n- Übergabeabwicklung und After-Sales\n\nWir sind von der vertraulichen Erstberatung bis zur Übergabe jederzeit zuverlässig und kompetent an Ihrer Seite und stehen Ihnen gerne mit Rat und Tat zur Seite. Erst wenn Sie am Ende zufrieden sind, dann sind wir es auch.\n\nKontaktieren Sie uns unter info@homepoint-living.de oder setzen Sie sich auch gerne direkt mit den jeweiligen Fachabteilungen Immobilienbewertung, Verkauf, Vermietung, Bauprojektmanagement und Vertrieb in Verbindung. Nähere Informationen finden Sie unter www.homepoint-living.de\n\nUnser Versprechen bei einer Zusammenarbeit:\n\nDiskretion I Professionalität I Transparenz']";;;;;;;
2020-05-30 19:32:50.668475;Berlin;true;ONE_YEAR_FREE;185949;n;n;https://pictures.immobilienscout24.de/listings/5f2d87c0-da2f-4644-8728-db857317ab0b-1371654583.jpg/ORIG/resize/118x118%3E/extent/118x118/format/jpg/quality/80;15;12.78;40 MBit/s;telekom_layer_magenta_l;;über VDSL;1910;REGULAR;12.78;118076701;no_information;n;true;MagentaZuhause L;n;Berlin;y;5;1;166.69;2;energy_consumption;7.25;50.64;Berlin;10553;well_kept;no_information;E;false;100 MBit/s;no_information;"Erasmusstra&szlig;e";n;https://padlock.link/ioml;https://padlock.link/ml;Erasmusstraße;apartment;10553;2;136;n;2,active;true;Deutschland;schaufenster;100 MBit/s;wohnung_kauf;y;4;web,email,bank,music,dl-ul,game,sd,mltstr,hd,fast-ul-dl;true;001.185949;222900;profile0;5;2;true;n;showqualicontactform;n;n;Tiergarten_Tiergarten;16718563;2;Berlin;/expose/118076701;"['Zwei Wohn- und Geschäftshäuser, verbunden zu einem großzügigen Ensemble mit einem begrünten Innenhof, insgesamt 65 Wohneinheiten mit unterschiedlichen Grundrissen und elf Gewerbeeinheiten: Herzlich willkommen in den Erasmushöfen in Berlin-Moabit. \r\n\r\nDie Erasmushöfe, die sich aus den Häusern in Erasmusstraße 1 und 2 zusammenfügen, bieten mannigfaltige Grundrisslösungen. Geeignet für unterschiedliche Lebens- oder auch Arbeitsmodelle. Die verschiedenen Immobilien in einer zentralen Wohnlage in Berlins Mitte eignen sich daher sowohl für Singles, Studenten, Kreative, Rentner, Paare als auch Familien oder auch als Standort für das eigene kleine Unternehmen. \r\n\r\nDie beiden Wohnhäuser stammen bereits aus den Jahren 1910 (Erasmusstraße 2) beziehungsweise 1918. Nach umfangreichen Restaurierungsarbeiten im Inneren wie im Äußeren erstrahlen die beiden, keinem Denkmalschutz unterliegenden Altbauten in neuem Glanz. Die Innenhoffassade glänzt in schlichtem Weiß, während die Straßenfassade ein wenig dunkler ist. Die Gebäudeaußenwände sind durch Wärmedämmverbundsystem mit Anstrich und Putz gedämmt. \r\n\r\nDer überwiegende Teil der Wohnungen ist mit Balkonen oder Terrassen und Dachterrassen ausgestattet. \r\n\r\nDie Erasmushöfe bilden ein wunderbares Ensemble zweier Wohn- und Geschäftsimmobilien. Sie verbinden urbane Wohnqualität mit Wohlfühlatmosphäre in den eigenen vier Wänden für verschiedene Lebenskonzepte. Während Singles oft kleineren Wohngrößen von rund 30 bis 50 Quadratmetern Vorzug erteilen, finden Paaren und Familien in den unterschiedlichen Wohnungen der Erasmushöfe mit nachgefragten Immobiliengrößen bis zu 116 Quadratmetern und mehreren Zimmern entsprechende Wohnträume. \r\n\r\nObjektseite: www.wohnung-kaufen-moabit.de\r\n\r\nDrohnenfilm: https://youtu.be/phooeILrE6o\r\nWohnbeispiel Erasmusstraße 1: https://youtu.be/5EORtXlZlH4 \r\nWohnbeispiel Erasmusstraße 2: https://youtu.be/XnFpfsTMet8 \r\n\r\nACCENTRO App für iOS https://goo.gl/KvMJTa und für Android https://goo.gl/ACqL6H', 'So vielfältig die Grundrisse der Wohnimmobilien in den Erasmushöfen sind, so bunt gestaltet sich das Leben im Umfeld. Die Erasmushöfe befinden sich in der verkehrsarmen Erasmusstraße an der Ecke zur Beusselstraße nahe zur Turmstraße. Mitten in einem multikulturellen Umfeld im Ortsteil Moabit, der zur Gänze von Wasser umgeben ist und doch in der zentralen Stadtmitte liegt. Die ""Insellage"" erreicht man zu Fuß über 25 Brücken und gutem Personennahverkehr in Bussen oder Straßenbahnen. \r\n\r\nDie Wohnungen der Erasmushöfe befinden sich in einer ruhigen Innenstadtlage. In nächster Umgebung gibt es viele Nahversorger, Einzelhandel, soziale Infrastruktur, gastronomische sowie kulturelle Einrichtungen. \r\nDer Stadtteil Moabit mit kiezigen Quartieren ist multikulturell geprägt und spiegelt das weltoffene, kreative Lebensgefühl in Berlin wider. Während die angrenzende Turm- und Beusselstraße die Versorgung mit Dingen des täglichen Bedarfs sowie eine Angebotsvielfalt im Textil- und Modebereich sicherstellen, gibt es auch eine interessante Kultur- und Bildungslandschaft zu entdecken. \r\n\r\nDie innerstädtischen Moabiter sind in verschiedenen Vereinen, Initiativen und sozialen Einrichtungen vernetzt. Die Kulturfabrik Moabit birgt ein Kino, Fabriktheater, den Slaughterhouse Club und lädt zu diversen Veranstaltungen. Man vergnügt sich bei Shopping-Touren im Einkaufszentrum der ehemaligen Schultheiss-Brauerei, trinkt Kaffeespezialitäten im Stadtschlosscafé oder der Kurt-Tucholsky-Bibliothek im Beusselkiez. \r\n\r\nDie Erasmushöfe sind eingebettet in eine gute Sozial- und Infrastruktur mit Kitas, Schulen und Gastronomie, eingebunden in ein nachbarschaftliches Netzwerk sowie in den lokalen wie gesamtstädtischen öffentlichen Verkehr. Das Wohnensemble zu Beginn der altbaulich gesäumten Erasmusstraße eignet sich für Singles, Paare, Senioren, Familien, Berliner und alle, die es noch werden wollen.']";central_heating;disabled;1011;;;;
2020-05-30 19:32:50.984154;Berlin;;;174522;n;y;https://pictures.immobilienscout24.de/listings/25385069-abc3-4ed9-956e-ab0624a414d6-1367437691.jpg/ORIG/resize/118x118%3E/extent/118x118/format/jpg/quality/80;7;9.64;;;;;1997;;9.64;118077147;natural_gas_heavy;y;true;;y;Berlin;n;7;5;;no_information;energy_consumption;3.52;89;Berlin;13503;no_information;no_information;;false;;outside;no_information;n;;;no_information;apartment;13503;3;117.3;n;2,active;;Deutschland;top;;wohnung_kauf;n;;;false;001.174522;397000;profile0;;3;true;n;showqualicontactform;n;n;Heiligensee_Reinickendorf;118077147;4;Berlin;/expose/118077147;['Genießen Sie das Privileg, in eine komfortable, lichtdurchflutete und gerade fertig sanierte Wohnung einziehen zu können. Die stimmungsvolle Architektur zeichnet sich durch große Fenster-/Türfronten aus. Der Wohn-, Koch- und Essbereich ist mit seinen großzügigen Verglasungen exzellent in den Süden und Westen ausgerichtet. Die neue Einbauküchenzeile wird von einem eigenen Fenster in Höhe der Arbeitsplatte effektiv tagesbelichtet. Sie ist u.a. mit einem Ceranherd, einer Umlufthaube, Spülmaschine und Kühl/Gefrierkombination ausgestattet. Das klare Raumambiente beruht auf den neuen weißen Feinsteinzeugfliesen sowie Fußbodenheizungen. Auch im Schlafzimmer gibt es vor dem bodentiefen Fenster keinen Heizkörper. Diese effiziente Art der Wärmeimmission wird auch auf der unteren Etage sowie in den beiden Bädern angewandt. Die Quelle ist eine energiesparende Gaszentralheizung, die auch für die Warmwasseraufbereitung zuständig ist. Das größere Badezimmer im Erdgeschoss brilliert mit einer aparten neuen Gestaltung inklusive Handtuchheizung, Waschmaschinen- und Trockneranschluss. Insbesondere das runde Fenster, Fliesendesign und die Eckwanne präsentieren sich geschmackvoll. Das ebenfalls neue Bad im Untergeschoss ist auch taghell und mit einer Dusche ausgestattet. Erstaunlich sind zudem auf dieser Etage die Größe des Fensters und die Tageslichtintensität in dem Zimmer dank der Abböschung in Südlage. Neben diesem wohnlichen Zimmer steht eine Ankleidekammer zur Verfügung. An jedem Fenster gibt es elektrische Rollläden. Inklusive der neu verputzten Wände wird ein Topzustand geboten. Ein Fahrradkeller und Trockenraum der Wohnungsgemeinschaft dürfen mitgenutzt werden.    Für den eigenen Pkw-Stellplatz sind 27.000,- € extra zu zahlen.\nSichern Sie sich eine erquickend sonnenhelle, frische und erstklassig positionierte Wohnung in sehr harmonischer Lage.', 'Sie möchten den Marktwert Ihrer Immobilie wissen oder Ihre Immobilie verkaufen? Wir sind seit 1995 erfolgreich im Verkauf von Immobilien in Berlin, Potsdam und Umgebung tätig. Unsere exzellenten Eigentümerbewertungen sprechen für sich.\n\n•\tOftmals haben wir schon den richtigen Käufer für Ihre Immobilie in unserer Kartei\n•\tWir sind Bellevue Best Property Agent und Mitglied in den Verbänden IVD & FIABCI\n•\tWir benötigen keinen schriftlichen Alleinauftrag\n•\tKosten entstehen Ihnen bei uns keine\n•\tUnsere Spezialisten stehen Ihnen gerne für ein erstes – für Sie unverbindliches - Gespräch zur Verfügung\n\nWir freuen uns über Ihre Kontaktaufnahme unter einkauf@immoberlin.de oder (030) 895 72 20.\nBitte besuchen Sie auch unsere Website: \nhttps://www.immoberlin.de'];self_contained_central_heating;disabled;;1;;;
2020-05-30 19:32:51.469042;Berlin;;ONE_YEAR_FREE;15349709;n;n;https://pictures.immobilienscout24.de/listings/b3ea1912-7c03-4256-9079-376860d59234-1368812916.jpg/ORIG/resize/118x118%3E/extent/118x118/format/jpg/quality/80;7;10.77;40 MBit/s;telekom_layer_magenta_l;;über VDSL;1910;REGULAR;10.77;118080146;no_information;n;false;MagentaZuhause L;n;Berlin;n;8;1;234;5;energy_required;5.67;73.15;Berlin;10115;well_kept;no_information;;false;100 MBit/s;no_information;"Schlegelstra&szlig;e";y;https://padlock.link/ioml;https://padlock.link/ml;Schlegelstraße;apartment;10115;3;177;n;2,active;true;Deutschland;standard;100 MBit/s;wohnung_kauf;y;1;web,email,bank,music,dl-ul,game,sd,mltstr,hd,fast-ul-dl;true;001.15297510;442500;profile0;;3;true;n;showqualicontactform;n;n;Mitte_Mitte;Schlegel WE 25;3;Berlin;/expose/118080146;['Die 1910 erbaute Schlegelstraße 5 besteht aus drei Häusern, mit insgesamt 42 Wohneinheiten und begrünten Innenhöfen. 2014 wurde die Fassade aufwendig instand gesetzt und durch fein abgesetzte Putztechnik in Sockel- und Regelgeschoss gegliedert. Auch die Treppenhäuser erstrahlen seitdem in neuem Glanz. \r\n\r\nHier trifft Alt-Berliner Tradition auf Moderne.', '- WE 25\r\n- 1. OG\r\n- 3 Zimmer\r\n- ca. 73 m²\r\n- Aufzug\r\n- 2017 renoviert\r\n- vermietet', 'Die Schlegelstraße ist umgeben von der Invaliden-, Tor- und der Chausseestraße, die in ihrem Verlauf zur Friedrichsstraße wird - einer der Hauptflaniermeilen der Stadt: alles fußläufig zu erreichen.', 'Allgemeine Hinweise:\r\nAlle Angaben sind ohne Gewähr und basieren ausschließlich auf Informationen, die uns von unserem Auftraggeber übermittelt wurden. Wir übernehmen keine Gewähr für die Vollständigkeit, Richtigkeit und Aktualität dieser Angaben. Irrtum und Zwischenverkauf vorbehalten. Die Grunderwerbsteuer, Notar- und Grundbuchkosten sind vom Käufer zu tragen. Auf Wunsch stehen wir Ihnen mit weiteren Informationen zum Objekt und zum Eigentümer gerne zur Verfügung. Die Besichtigung kann jederzeit nach Vereinbarung mit einem unserer Mitarbeiter/Beauftragten erfolgen.'];;disabled;;;;;
2020-05-30 19:32:52.062417;Berlin;;ONE_YEAR_FREE;17069422;n;y;https://pictures.immobilienscout24.de/listings/e46a73b7-5cd5-4201-8fef-7061c43435be-1367474193.jpg/ORIG/resize/118x118%3E/extent/118x118/format/jpg/quality/80;1;11.3;40 MBit/s;telekom_layer_magenta_l;;über VDSL;1930;REGULAR;11.3;118078641;no_information;n;false;MagentaZuhause L;y;Berlin;y;10;1;;no_information;energy_required;5.73;112;Berlin;10789;fully_renovated;sophisticated;NO_INFORMATION;false;100 MBit/s;no_information;no_information;y;https://padlock.link/ioml;https://padlock.link/ml;no_information;apartment;10789;3;;n;2,active;true;Deutschland;standard;100 MBit/s;wohnung_kauf;n;2;web,email,bank,music,dl-ul,game,sd,mltstr,hd,fast-ul-dl;true;002.01007821175;760000;profile0;5;3;true;n;;n;n;Charlottenburg_Charlottenburg;NRR1;5;Berlin;/expose/118078641;['Hier wird eine schöne Altbauwohnung, unweit vom Kurfürstendamm und KaDeWe entfernt, zum Erwerb angeboten. Schon beim Betreten dieser Wohnung, werden Sie von der großzügigen Raumaufteilung begeistert sein. Ansprechender Grundriss und eine hochwertige Ausstattung sorgen für ein wunderschönes Wohlgefühl in der ganzen Wohnung und können noch nach Ihren Wünschen gestaltet werden.\n\nDas Badezimmer verfügt über Fliesenboden und Fliesenwände im Nassbereich. Die ebenerdige Dusche lässt jedes Wellness-Herz höher schlagen und die übrigen Wohnräume verfügen über einen Altbaudielenboden. \nDie Wohnung ist bequem mit dem Aufzug erreichbar.', '- Altbaucharme mit moderner Badaustattung\n\n- Altbaudielenboden,\n\n- Altbautüren\n\n- Großes Badezimmer mit Fenster\n\n- Balkon\n\n- Ebenerdige Dusche\n\n- Aufzug  \n\n- Top Lage nahe Kurfürstendamm und KaDeWe', 'Das Gebäude liegt in einer der schönsten Lagen von Berlin-Charlottenburg, unweit vom Kurfürstendamm und KaDeWe entfernt. Hier schöpfen Sie in jeder Hinsicht aus dem vollen Repertoire einer Großstadt: Shopping- und Einkaufsmeilen, Beeindruckende Architektur, Cafés, Bars, Restaurants, Theater, Konzerte, Kinos - alles ist zu Fuß erreichbar.\nAuch was Einkaufen, ärztliche Versorgung, Bildung und Betreuung angeht befinden Sie sich in dieser wirklich glücklichen Lage, stets unter einer Vielzahl von Möglichkeiten wählen zu können. Ärzte, Kindergärten und Schulen machen die ausgezeichnete Infrastruktur des Standortes perfekt.'];gas_heating;;;;;;
2020-05-30 19:32:52.638347;Berlin;;ONE_YEAR_FREE;920142;n;n;https://pictures.immobilienscout24.de/listings/3c5aadc2-b693-4013-b06b-cb024b34c8c0-1367457714.jpg/ORIG/resize/118x118%3E/extent/118x118/format/jpg/quality/80;23;11.48;40 MBit/s;telekom_layer_magenta_l;;über VDSL;;REGULAR;11.48;118078612;;n;false;MagentaZuhause L;y;Berlin;n;4;;;no_information;;7.14;40;Berlin;10247;no_information;no_information;;false;100 MBit/s;no_information;no_information;n;https://padlock.link/ioml;https://padlock.link/ml;no_information;no_information;10247;1;;n;2,active;true;Deutschland;standard;100 MBit/s;wohnung_kauf;n;;web,email,bank,music,dl-ul,game,sd,mltstr,hd,fast-ul-dl;true;001.920142;165000;profile0;;1;true;n;showqualicontactform;n;n;Friedrichshain_Friedrichshain;118078612;1;Berlin;/expose/118078612;['Bei diesem Angebot handelt es sich um eine ca. 40 qm große Eigentumswohnung in bester Friedrichshainlage in 10247 Berlin, Weichselstraße.\nDas Objekt wird von uns im Maklerallein- und Festauftrag angeboten.\nDas sorgfältig restaurierte Anwesen besteht aus Vorderhaus (Foto), Seitenflügel, Innenhof/Mitte, Gartenhaus sowie Innenhof/hinten.\nDie Eigentumswohnung, die Gegenstand des Verkaufes ist, befindet sich in der Weichselstraße im Gartenhaus. Sie besteht aus einem Flur, einem relativ großen, kompletten Bad sowie einem ca. 28 qm großen Raum mit offener, kleiner, optisch getrennter Küchennische (Fotos). Die Wohnung ist bezugsfrei und wurde aktuell komplett saniert. Dabei wurde die schöne Original-Holzaußentür sowie die ebenfalls ansehnlichen Holzkastenfenster erhalten. Die Fenster im Bad und in der Küchennische wurden erneuert (Kunststofffenster). Die schönen Original-Kastenfenster im Wohnbereich wurden restauriert.\nDie komplette Elektrik wurde erneuert. Ab neuem Steigeleitungsanschluss, Zählerschrank incl. Sicherungsautomaten und FI-Schutzschalter wurden alle Leitungen (Nym nach VDE) erneuert.\nDeckenleuchtenanschluss im großen Raum sowie 13 Steckdosen, TV-Kabelanschluss etc., im Bad mehrere Steckdosen, in der Decke integrierte LED-Leuchten, im Flur neben Steckdose auch Telefonfestnetzanschlussdose sowie Wechselsprechanlage und elektrischer Türöffner etc..\nDie Flurbeleuchtung besteht ebenfalls aus in der Decke integrierten LED-Leuchten.\nDas Bad mit großer Wanne (integrierte Dusche), Waschbecken, WC, Waschmaschinenplatz etc. wurde komplett erneuert (Fotos).\nDie Deckenhöhe dieser über die zahlreichen Fenster gut belichteten Wohnung beträgt 2,766 m. Die Wohnatmosphäre ist angenehm und freundlich.', 'Zu der Wohnung gehört ein solide abgetrennter (Metalllochplattensystem) ca. 2,72 m x 2,04 m großer, eigener Kellerraum.\nIm Keller ist sowohl der sehr gute Gebäudesubstanzzustand als auch die professionelle und aufwändige, abgeschlossene Gesamtsanierung des Anwesens deutlich sichtbar.\nTreppenhaus (Fotos), Innenhöfe mit Fahrradständer sowie die Vorderhauseingangssituation sind solide, ansehnlich und funktional.\n\nEnergieausweis:\nVerbrauchsausweis, Endenergieverbrauchskennwert 138 kWh/(m2a), schweres Erdgas, Baujahr 1910\n\nDer Kaufpreis für diese sofort beziehbare Eigentumswohnung in bester Berlin Friedrichshain- Lage beträgt 165.000,-- EUR. Das Wohngeld/lnstandhaltungsrücklage für die Eigentumswohnung beträgt 145,-- EUR monatlich.\n\nDie Maklercourtage beträgt 7,14% incl. MwSt. und ist vom Käufer zu tragen. Besichtigungstermine sind ausdrücklich und ausschließlich über unser Büro zu vereinbaren.\n\nELSNER HAUS UND HOF IMMOBILIEN GmbH\nTel.: 03322-400075/7 Fax: 03322-400076'];no_information;;;;;;
