2020-05-30 19:45:44.408763;Berlin;central_heating;ONE_YEAR_FREE;16936458;n;n;https://pictures.immobilienscout24.de/listings/25084329-8f0d-436b-8e07-c2639f8d9e3d-1355959193.jpg/ORIG/resize/118x118%3E/extent/118x118/format/jpg/quality/80;12;8.81;40 MBit/s;telekom_layer_magenta_l;über VDSL;1900;REGULAR;8.81;116418234;;;y;false;MagentaZuhause L;y;Berlin;y;7;1;318;28;energy_consumption;3.97;82.37;Berlin;12587;modernized;sophisticated;false;100 MBit/s;no_information;"Bruno-Wille-Stra&szlig;e";n;https://padlock.link/ioml;https://padlock.link/ml;Bruno-Wille-Straße;apartment;12587;3;105;n;2,active;true;Deutschland;top;100 MBit/s;wohnung_kauf;n;2;web,email,bank,music,dl-ul,game,sd,mltstr,hd,fast-ul-dl;true;009.db1e3be7-077e-467d-acff-ceca0098b947;398500;profile0;4;3;true;n;n;n;Friedrichshagen_Köpenick;116418234;4;Berlin;/expose/116418234;['Die helle 3-Zimmer-Wohnung mit einer Wohnfläche von ca. 82,37 m², befindet sich im 2. Obergeschoss eines wunderschönen Gebäudes aus dem Jahre 1900. \n\nEine grundlegende Sanierung des Hauses mit Erneuerung der kompletten Haustechnik, des Daches, der Fassade sowie der Fenster erfolgte im Jahr 1995.\n\nDie lichtdurchflutete Wohnung mit ihrer Ost-West-Ausrichtung besticht durch den großzügigen Wohnraum mit offener Küche und einem herrlichen Wintergarten. Von hier genießen Sie einen wunderbaren Blick über die Nachbarschaft. Die offene und gut ausgestattete Küche verfügt mit ihrem großen Fenster ebenfalls über einen großartigen Ausblick. \nDas ausgerichtete Esszimmer mit Westausrichtung bietet viele individuelle Gestaltungsmöglichkeiten, sei es als zweites Schlafzimmer oder auch als Kinder-/Arbeitszimmer. \nDas ca. 18 m² große Schlafzimmer bietet genügend Platz für ein Doppelbett und Schrankwand. \nHohe Ansprüche werden auch im liebevoll und modern sanierten Bad mit Badewanne erfüllt.\n\nDie Wohnung ist mit hochwertigem Fischgrät Parkettboden und Fliesen ausgestattet, welche der Wohnung ihren imposanten Charme verleihen. Die Außenjalousien im Schlaf- und Esszimmer, Fensterbänke aus Marmor, hochwertiges Eichenparkett mit 1,9 cm Stärke, ein geräumiger Keller und die Möglichkeit der Übernahme eines gemieteten Stellplatzes runden dieses attraktive Angebot ab. \n\nAls Besonderheit besteht die Möglichkeit eine Gewerbeeinheit im Souterrain, die zurzeit als Wohnküche genutzt wird, zu erwerben. Diese Einheit hat eine Größe von ca. 45,65 m² und einen Kaufpreis von € 98.000,- zzgl. Courtage', 'Die Bruno-Wille-Straße liegt im überaus beliebten Friedrichshagen, einem Ortsteil von Berlin-Köpenick. \n\nDie einstige Villenkolonie mit ihren vielen herrschaftlichen Altbauten ist heute auch als „Künstlerdorf“ bekannt. Neben zahlreichen Ateliers und Galerien lassen sich im Sommer auch Konzerte und Filme im nahe gelegenen Naturtheater im Kurpark genießen. \nEbenfalls fußläufig erreichen Sie die Flaniermeile und Einkaufsstraße „Bölschestraße“. Hier finden sich hervorragende Einkaufsmöglichkeiten sowie tolle Cafés und Restaurants. \n\nMit seinen insgesamt sechs Schulen im gesamten Ortsteil und über 10 Kindergärten in direkter Umgebung ist auch für die Betreuung und Bildung der Kleinen gesorgt.\n \nDank der zentralen aber ruhigen Lage erreichen Sie bequem mit dem Bus, der Tram oder der S-Bahn all Ihre Ziele in und um Berlin in kürzester Zeit. Auch mit dem Auto sind Sie hier gut angebunden.\n\nDer nahe Müggelsee mit seinen angrenzenden Wäldern bietet beste Voraussetzungen für schöne Stunden und Erholung in freier Natur. Genießen Sie die freie Zeit doch im Strandbad, bei einem Bootsausflug oder bei einem ausgiebigen Spaziergang an der frischen Luft.\n\nHier vereinen sich eine ruhige und naturnahe Wohnlage harmonisch mit dem lebendigen und interessanten Treiben in der nahe gelegenen Flaniermeile.', 'Alle Angaben sind ohne Gewähr und basieren ausschließlich auf Informationen, die uns von unserem Auftraggeber übermittelt wurden. \nWir übernehmen keine Gewähr für die Vollständigkeit, Richtigkeit und Aktualität dieser Angaben.\n\n\nSollte das von uns nachgewiesene Objekt bereits bekannt sein, teilen Sie uns dieses bitte unverzüglich mit.'];;;disabled;;showqualicontactform;1995;;D;;
2020-05-30 19:45:44.882409;Berlin;central_heating;ONE_YEAR_FREE;16480061;n;n;https://pictures.immobilienscout24.de/listings/30aa0d33-d697-4987-872f-3b879c64d1a6-1356044123.jpg/ORIG/resize/118x118%3E/extent/118x118/format/jpg/quality/80;11;11.35;40 MBit/s;telekom_layer_magenta_l;über VDSL;1900;REGULAR;11.35;116423220;;gas;n;false;MagentaZuhause L;n;Berlin;n;7;1;181;28;energy_required;7.53;60;Berlin;10245;well_kept;normal;false;100 MBit/s;no_information;Corinthstr.;n;https://padlock.link/ioml;https://padlock.link/ml;Corinthstr.;apartment;10245;2;129;n;2,active;true;Deutschland;top;100 MBit/s;wohnung_kauf;n;2;web,email,bank,music,dl-ul,game,sd,mltstr,hd,fast-ul-dl;true;002.01007331745;315000;profile0;4;2;true;n;n;n;Friedrichshain_Friedrichshain;TBC28W25;2;Berlin;/expose/116423220;['Das Wohn- und Geschäftshaus aus dem Jahre 1900 bildet ein Eckhaus an der Corinthstraße und Bossestraße und hat drei Hauseingänge: Corinthstraße 28, Corinthstraße 30 und Bossestraße 8.\r\rDer Gebäudekomplex bildet eine in sich geschlossene Wohnanlage mit einem Seitenflügel und Hinterhausbereich.\rDas Haus ist 2019 in eine Eigentümergemeinschaft aufgeteilt worden. Die Zukunft lässt noch Bauvorhaben zu. Es können hier noch Balkone hofseitig entstehen, Aufzüge erbaut werden und das Dachgeschoss soll komplett ausgebaut werden, wodurch das Objekt ein komplett neues Dach erhält!\r\rEs handelt sich hier um eine zwei Zimmerwohnung mit Küche und Duschbad mit Fenster,  im 2. OG im Seitenflügel der Corinthstr. 28.', '- Dielenboden\r- Duschbad\r- gepflegtes Treppenhaus\r- Hohe Decken\r- ruhiger begrünter Hof \r- Nähe East Side Mall', 'Willkommen in der Oberbaumcity!\r\rDie vermietete Eigentumswohnung befindet sich in einer ruhigen Seitenstraße nahe der Spree in un-mittelbarer Nähe zur Mediaspree, Mercedes-Benz Arena und der East Side Gallery. \r\rÖffentliche Verkehrsmittel wie S-und U-Bahn sowie Bus und Tram befinden sich einerseits auf der Warschauer Straße, andererseits bei der Station Ostkreuz, welche fußläufig in ca. 10 Minuten erreichbar sind. Anbindung zum Fernverkehr erhält man schnell am ca. 2,6 km entfernten Ostbahnhof. \r\rDer Szenebezirk Friedrichshain, ist bekannt für seine reichhaltige und multi-kulturelle Auswahl an Restaurants, Cafe´s und Bars, in und um den Boxhagener Platz im Simon-Dach-Kiez, welcher ebenfalls nur wenige Gehminuten entfernt ist. \r\rGeschäfte des täglichen Bedarfs sowie Apotheken, Kitas und Schulen sind ebenfalls in unmittelbarer Nähe zahlreich vorhanden.', 'Weitere Angebote finden Sie unter: homeestate.de oder auf unserer Projektseite unter: bosse8.de\r\rGerne stehen wir Ihnen für Rückfragen zur Verfügung.\r\rFeel free to contact us also in English- we are happy to inform you concerning this apartment.\rVous pouvez également nous contactez en Francais- nous serons ravie de vous informer.'];;;;;showqualicontactform;;60;;;
2020-05-30 19:45:45.236280;Berlin;central_heating;ONE_YEAR_FREE;16480061;n;y;https://pictures.immobilienscout24.de/listings/59f06435-bb26-45a6-a86f-051b530b9513-1356071660.jpg/ORIG/resize/118x118%3E/extent/118x118/format/jpg/quality/80;13;11.35;40 MBit/s;telekom_layer_magenta_l;über VDSL;1900;REGULAR;11.35;116424327;;gas;n;false;MagentaZuhause L;n;Berlin;y;6;1;171;28;energy_required;7.53;53;Berlin;10245;well_kept;normal;false;100 MBit/s;no_information;"Corinthstra&szlig;e";n;https://padlock.link/ioml;https://padlock.link/ml;Corinthstraße;ground_floor;10245;2;129;n;2,active;true;Deutschland;top;100 MBit/s;wohnung_kauf;n;0;web,email,bank,music,dl-ul,game,sd,mltstr,hd,fast-ul-dl;true;002.01007331745;295000;profile0;4;2;true;y;n;n;Friedrichshain_Friedrichshain;TBC28W30;2;Berlin;/expose/116424327;['Das Wohn- und Geschäftshaus aus dem Jahre 1900 bildet ein Eckhaus an der Corinthstraße und Bossestraße und hat drei Hauseingänge: Corinthstraße 28, Corinthstraße 30 und Bossest.8.\n\nDas Haus ist 2019 in eine Eigentümergemeinschaft aufgeteilt worden. Es können hier noch Balkone hofseitig entstehen, Aufzüge erbaut werden und das Dachgeschoss soll ausgebaut werden und dadurch erhält das Objekt ein neues Dach!\n\nEs handelt sich hier um eine 2-Zimmer-Wohnung mit Küche und Duschbad mit Fenster im Erdgeschoss  im Hinterhaus der Corinthstr. 28. Die Wohnung, welche ruhig zum Hinterhof liegt, ist in einem sehr gepflegten Zustand. \nEine der Wohnung zugeordnete Sondernutzungsfläche ermöglicht eine Terrassen -oder Gartennutzung direkt vor der Wohnung.\nLaut Teilungserklärung kann man auch die Fenster zu bodentiefen Terrassentüren umbauen. \n\nDie Wohnung wird zum 1.08.2020 bezugsfrei.', '- Laminat\n- Duschbad\n- gepflegtes Treppenhaus\n- hohe Decken\n- ruhiger begrünter Hof \n- Terrasse im Hof  im Sondernutzungsrecht\n- Nähe East Side Mall', 'Willkommen in der Oberbaumcity!\r\rDie vermietete Eigentumswohnung befindet sich in einer ruhigen Seitenstraße nahe der Spree in un-mittelbarer Nähe zur Mediaspree, Mercedes-Benz Arena und der East Side Gallery. \r\rÖffentliche Verkehrsmittel wie S-und U-Bahn sowie Bus und Tram befinden sich einerseits auf der Warschauer Straße, andererseits bei der Station Ostkreuz, welche fußläufig in ca. 10 Minuten erreichbar sind. Anbindung zum Fernverkehr erhält man schnell am ca. 2,6 km entfernten Ostbahnhof. \r\rDer Szenebezirk Friedrichshain, ist bekannt für seine reichhaltige und multi-kulturelle Auswahl an Restaurants, Cafe´s und Bars, in und um den Boxhagener Platz im Simon-Dach-Kiez, welcher ebenfalls nur wenige Gehminuten entfernt ist. \r\rGeschäfte des täglichen Bedarfs sowie Apotheken, Kitas und Schulen sind ebenfalls in unmittelbarer Nähe zahlreich vorhanden.', 'Weitere Angebote finden Sie unter: homeestate.de oder auf unserer Projektseite unter: bosse8.de\r\rGerne stehen wir Ihnen für Rückfragen zur Verfügung.\r\rFeel free to contact us also in English- we are happy to inform you concerning this apartment.\rVous pouvez également nous contactez en Français- nous serons ravie de vous informer.\r'];;;;;showqualicontactform;;53;;;
2020-05-30 19:45:45.613727;Berlin;district_heating;ONE_YEAR_FREE;17476763;n;n;https://pictures.immobilienscout24.de/listings/3dbc8226-5d65-417c-9f7f-a369dbf0eb6d-1356108015.jpg/ORIG/resize/118x118%3E/extent/118x118/format/jpg/quality/80;7;12.24;40 MBit/s;telekom_layer_magenta_l;über VDSL;1900;REGULAR;12.24;116429818;;district_heating;n;false;MagentaZuhause L;y;Berlin;n;6;1;260;no_information;energy_consumption;6.53;64;Berlin;10827;mint_condition;no_information;false;100 MBit/s;no_information;no_information;n;https://padlock.link/ioml;https://padlock.link/ml;no_information;apartment;10827;2;115;n;2,active;true;Deutschland;top;100 MBit/s;wohnung_kauf;n;3;web,email,bank,music,dl-ul,game,sd,mltstr,hd,fast-ul-dl;true;009.2f31766d-95e4-4ffa-a307-2f0bd139b84e;299000;profile0;6;2;true;n;n;n;Schöneberg_Schöneberg;116429818;3;Berlin;/expose/116429818;['✓ Altbaucharme\n✓ hohe Decken\n✓ Alle Räume sind tageslichtdurchflutet\n✓ Zentrale Lage\n✓ frei werdend\n✓ Lebensqualität pur\n✓ Einbauküche', '✓ Nähe Rathaus Schöneberg \n✓ Exzellente Lage, verkehrsgünstig\n✓ kurze Wege zu den öffentlichen Verkehrsmittel\n✓ kulturelle Vielfältigkeit\n✓ Wochenmärkte in der Nähe\n✓ Kulinarische Hochburg um die Ecke in der Hauptstraße', 'Die Angaben sind ohne Gewähr und basieren auf Informationen, die uns vom Eigentümer zur Verfügung gestellt wurden. Wir übernehmen keine Gewähr für die Vollständigkeit, Richtigkeit und Aktualität dieser Angaben.'];;;;1;showqualicontactform;;;NO_INFORMATION;;
2020-05-30 19:45:45.963412;Berlin;district_heating;ONE_YEAR_FREE;15402574;n;y;https://pictures.immobilienscout24.de/listings/2ee3d6c2-7571-4b8c-8177-ed67fff59c46-1356767570.jpg/ORIG/resize/118x118%3E/extent/118x118/format/jpg/quality/80;22;11.3;2,4 MBit/s;telekom_layer_magenta_m_hybrid2;über Hybrid;1900;WITH_HYBRID;11.3;116417862;;district_heating;y;false;MagentaZuhause M Hybrid (2);y;Berlin;y;7;1;219.97;no_information;energy_consumption;5.73;67;Berlin;10585;well_kept;no_information;false;16 MBit/s;no_information;no_information;n;https://padlock.link/mmh2sa;https://padlock.link/mmhy2;no_information;apartment;10585;2;77.8;n;2,active;true;Deutschland;top;50 MBit/s;wohnung_kauf;n;1;web,email,bank,music,dl-ul,game,sd,mltstr,hd;true;001.15350375;349000;profile0;5;2;true;n;n;n;Charlottenburg_Charlottenburg;Se b;3;Berlin;/expose/116417862;['Zimmeranzahl: 2\nWohnzimmer: mit Balkon\nBad: mit Dusche und Bidet, italienischer Marmor und Granit\nBalkon: Ja, zum Osten\nEBK: ja, sehr hochwertig\nBoden: hochwertige Jatoba-Massivholzdielen\nHeizung: Fernwärme. Baujahr Wärmeerzeuger 1990\nKeller: ja\nBezugsfrei: sofort', 'Wir befinden uns hier in Alt-Charlottenburg, dem Ursprung des heutigen beliebten Ortsteils. Alles, was es zum Leben braucht, ist hier auf kurzem Weg zu erreichen. Zum Schloss Charlottenburg und seinem beliebten Park sind es ca. 1.000 Meter. Zahlreiche Museen liegen nur wenige Radminuten entfernt, zum Tiergarten und zum Lietzensee sind es mit dem Fahrrad nur wenige Minuten. Die Verkehrsanbindung ist ideal. Die U7-Haltestelle Richard-Wagner-Platz ist nur paar Minuten entfernt. Der S-Bahnhof Charlottenburg ist ebenfalls nur zwei Stationen mit der U7 entfernt.\nIn der Nähe befinden sich zwei Edekas und ein Rewe, das Rathaus sowie das Schloss Charlottenburg sind ebenfalls fußläufig erreichbar.', 'Ganz wichtig bei der Anfrage: Teilen Sie uns Ihre vollständigen Kontaktdaten: Vor- und Nachnamen, Adresse, Mail und Telefonnummer mit.\n\nSeit einigen Jahren gilt in Deutschland das Geldwäschegesetz. Nach diesem Gesetz ist jedes Immobilienbüro verpflichtet, bei Kontaktaufnahme die Identität des Kunden festzuhalten. \n\nDieses Kaufangebot ist provisionspflichtig. Dem Erwerber wird bei Abschluss eines Kaufvertrages eine Käuferprovision in Höhe von 7,14 % des beurkundeten Kaufpreises inkl. der gesetzlichen MwSt. berechnet. \n\nDie in diesem Exposé gemachten Angaben beruhen auf Auskünften des Eigentümers oder vorgelegten Plänen und Berechnungen. Wir übernehmen daher keine Haftung, für die hier gemachten Angaben, insbesondere für Flächenangaben, Grundrisse, Lageskizzen sowie wann was und wie im Hause renoviert und saniert wurde, da wir das nicht persönlich überwachen konnten. Dieses Angebot ist freibleibend, ein Zwischenverkauf bleibt vorbehalten.\n\nHinsichtlich weiterer Dienstleistungen in Zusammenhang mit dem Erwerb, wie Finanzierungen unterstützen wir Sie gerne. Es ist uns leider nicht gestattet, Sie zu steuerrelevanten Aspekten zu beraten. Hierzu wenden Sie sich bitte an Ihren Steuerberater. Wir stehen Ihnen gerne für Fragen zur Verfügung.'];;;disabled;;showqualicontactform;2004;;C;10 MBit/s;50 MBit/s
2020-05-30 19:45:46.318600;Berlin;district_heating;ONE_YEAR_FREE;37030;n;n;https://pictures.immobilienscout24.de/listings/3fa60319-4ee5-43b9-9463-9b5dc8e224d3-1357269706.jpg/ORIG/resize/118x118%3E/extent/118x118/format/jpg/quality/80;8;12.19;40 MBit/s;telekom_layer_magenta_l;über VDSL;1886;REGULAR;12.19;116427225;;no_information;n;true;MagentaZuhause L;y;Berlin;n;5;1;;34;energy_required;7.44;29.04;Berlin;10999;no_information;no_information;false;100 MBit/s;no_information;"Lausitzer Stra&szlig;e";n;https://padlock.link/ioml;https://padlock.link/ml;Lausitzer_Straße;apartment;10999;1;126;n;2,active;true;Deutschland;standard;100 MBit/s;wohnung_kauf;n;1;web,email,bank,music,dl-ul,game,sd,mltstr,hd,fast-ul-dl;true;001.37030;224000;profile0;5;1;true;n;n;n;Kreuzberg_Kreuzberg;36298;1;Berlin;/expose/116427225;"['In dieser durchdachten 1-Zimmer-Altbauwohnung können Sie auf ca. 29 qm viel erreichen. Durch den abgetrennter Küchenbereich, eine praktische Abstellkammer und das quadratische Duschbad lässt es sich kompakt und trotzdem gemütlich leben. Außerdem haben Sie die Chance Ihren eigenen Stil zu verwirklichen, denn bei der Gestaltung haben Sie freie Hand. \r\n\r\nNur wenige Meter vom Landwehrkanal enfernt erwartet Sie dieses denkmalgeschützte Gründerzeitensemble, welches aus Vorderhaus und Gartenhaus besteht und mit seiner wunderschönen Stuckfassade bezaubert. Es steht Ihnen eine breite Auswahl an 1- bis 4-Zimmer-Wohnungen zur Verfügung, die zum Teil mit Altbau-Elementen wie Flügeltüren oder Kachelöfen aufwarten. \r\n\r\nErholung bieten zukünftig die beiden Gartenhöfe, die von namhaften Landschaftsarchitekten gestaltet werden. Außerdem wird das Lausitzer Quartier in weiteren Bauabschnitten durch einen Neubau ergänzt; eine Backsteinremise und eine Fabrikremise werden zu Townhouses umgewandelt. Genießen Sie in Ihrem neuen Zuhause ein nachbarschaftliches Miteinander ganz nach Kreuzberger Geschmack.\r\n\r\nSie interessieren sich für diese Wohnung, haben Fragen zur Finanzierung oder wünschen einen Besichtigungstermin? Das ZIEGERT-Team steht Ihnen immer gern zur Verfügung!', '+ Stuckfassaden mit Altbaudetails\r\n\r\n+ Aufzug im Gartenhaus/Treppenhaus 1\r\n\r\n+ Musterwohnung im Vorderhaus\r\n\r\n+ tagesbelichtetes Wannen- und Duschbad\r\n\r\n+ Kassettendoppelfenster\r\n\r\n+ Flügeltüren \r\n\r\n+ Fernwärme\r\n\r\n+ Verkauf der Wohnungen im Ist-Zustand\r\n\r\n+ Kellerflächen werden zum Verkauf angeboten\r\n\r\n+ 2 Gewerbeeinheiten im Vorderhaus\r\n\r\n+ landschaftlich geplante Gartenhöfe\r\n\r\n+ Vorderhaus und Gartenhaus\r\n', '""Ich bin kein Berliner, ich bin Kreuzberger."" Berlin-Kreuzberg steht für ein ganz bestimmtes Lebensgefühl: kreativ, tolerant und vielfältig. Es gibt quasi alles, außer einer Sperrstunde. Besonders das baumgesäumte Maybach- und Paul-Linke-Ufer bezaubern mit prachtvollen Altbauten, einladenden Liegewiesen, gemütlichen Cafés und Restaurants, charmanten Kiezläden sowie bunten Floh- und Wochenmärkten. \r\n\r\nNur einen Steinwurf entfernt, befindet sich das Lausitzer Quartier - in einer ruhigen Seitenstraße vom quirligen Kreuzberger Treiben. Und falls man doch mal seinen Kiez verlassen möchte, sind die U-Bahnhöfe Kottbusser Tor (U1, U3, U8) und Görlitzer Bahnhof (U1, U3) in zehn Gehminuten erreichbar. Mit einem Bio-Supermarkt vor der Haustür, zahlreichen Kitas, Grundschulen, Gymnasien und Sportvereinen in der nahen Umgebung können sich hier auch Familien gut aufgeboben fühlen.', '+++++++++++++++++++++++++++++++++++++++++++++\r\n\r\nBei Ziegert steht der Mensch im Mittelpunkt. Wir nehmen unsere gesellschaftliche Verantwortung selbstverständlich auch in dieser herausfordernden Zeit sehr ernst. Die Gesundheit unserer Kunden, Mitarbeiter und Partner hat für uns oberste Priorität. Aufgrund der aktuellen Situation werden daher unsere Showrooms vorübergehend geschlossen. Dennoch sind unsere ImmobilienberaterInnen weiterhin bestmöglich für Sie da. Wir freuen uns auf den Kontakt mit Ihnen per E-Mail, Telefon oder Videochat.\r\n\r\n++++++++++++++++++++++++++++++++++++++++++++\r\n\r\nEinige Wohnungsinnenaufnahmen stammen nicht zwangsläufig aus der hier angebotenen Wohnung oder spiegeln den aktuellen Zustand wieder. Gerne zeigen wir Ihnen die Wohnung vor Ort. \r\n\r\n++++++++++++++++++++++++++++++++++++++++++++\r\n\r\nDas ZIEGERT-Finanzierungsteam hilft Ihnen dabei, Ihre Träume zu leben. Wir zeigen Ihnen gern, wie man zum Beispiel den eigenen Mietzins in Eigentum verwandeln kann. Entdecken Sie Ihre Möglichkeiten und kontaktieren Sie uns unter +49 (0) 30 880 353 - 39 oder auf www.kaufen-statt-mieten.berlin.\r\n\r\n++++++++++++++++++++++++++++++++++++++++++++']";;true;disabled;113;showqualicontactform;;;;;
