2020-05-30 19:35:06.818575;Berlin;central_heating;ONE_YEAR_FREE;76007;n;y;https://pictures.immobilienscout24.de/listings/6620a727-efe8-4231-b5ba-de7e68517c11-1370328101.jpg/ORIG/resize/118x118%3E/extent/118x118/format/jpg/quality/80;18;11.3;40 MBit/s;telekom_layer_magenta_l;über VDSL;1905;REGULAR;11.3;117852177;district_heating;y;true;MagentaZuhause L;y;Berlin;n;8;1;335;no_information;energy_consumption;5.76;100;Berlin;10589;first_time_use;no_information;D;false;100 MBit/s;no_information;no_information;n;https://padlock.link/ioml;https://padlock.link/ml;no_information;apartment;10589;3;128;n;2,active;true;Deutschland;top;100 MBit/s;wohnung_kauf;n;;web,email,bank,music,dl-ul,game,sd,mltstr,hd,fast-ul-dl;true;001.76007;459000;profile0;;3;true;n;showqualicontactform;n;n;Charlottenburg_Charlottenburg;70110;4;Berlin;/expose/117852177;['Bitte vervollständigen Sie das Anfrageformular mit Ihrem Namen und Ihrer Adresse, um ein vollständiges Exposé mit Lagebezeichnung zu erhalten und einen Besichtigungstermin zu vereinbaren. Vielen Dank! \r\n\r\nDie hier angebotene 3-Zimmer-Eigentumswohnung befindet sich im 1. Obergeschoss eines klassischen Berliner Altbaus, der im Jahre 2002 kernsaniert wurde. Die vorhandene Elektrik ist ca. 6-7 Jahre alt. Die Wohnung selbst wurde in 2020 frisch saniert und hier zum Erstbezug angeboten.\r\nSie betreten die Beletage-Wohnung in eine schöne Diele, von welcher zwei sonnige, nach Süden zu einer ruhigen und wenig befahrenen Straße ausgerichtete Zimmer mit großen altbautypischen Fenstern und einer Flügeltür begehbar sind. Vom Wohnzimmer aus gelangen Sie auf den Balkon, auf dem dem zwei Personen Platz finden. Über einen länglichen Flur gelangen Sie in den hinteren Privatbereich der Wohnung, wo sich das zum sehr ruhigen Hof ausgerichtete Schlafzimmer en Suite zum sanierten Wannen-Badezimmer mit Fenster befindet. Auch die geräumige Wohnküche befindet sich hier und verfügt über ein Fenster in Hofausrichtung. Die Genaue Raumaufteilung können Sie dem beigefügten Grundriss entnehmen.\r\n\r\nDie gesamte Wohnung inklusive der Küche ist mit neuwertige Dielen verlegt, das Bad ist hochwertig gefliest und mit passenden Armaturen ausgestattet. Hohe Decken, schöne Holz-Kassettentüren und Deckenstuck geben dieser schönen Immobilie zudem noch den beliebten Altbau-Charme.\r\nEin eigenes Kellerabteil gehört ebenfalls zur Wohnung.\r\n\r\nDas monatliche zu zahlende Wohngeld beläuft sich auf 335 EUR inkl. Heizkosten u. Instandhaltungsrücklage. Diese betrug zum 31.12.2019 insgesamt für alle Eigentümer 50.739,06 EUR.\r\nFür einen persönlichen Besichtigungstermin vor Ort stehen wir Ihnen gerne zur Verfügung. Sie können jedoch vorab die Immobilie durch eine virtuelle 360°-Tour besichtigen. Den Link dazu finden Sie nachdem Sie das Exposé heruntergeladen haben.', 'Berlin ist eine lebendige Stadt, die für alle etwas zu bieten hat. Einerseits ein unentwegt pulsierendes Großstadtleben mit Shopping und vielfältigem Kulturgenuss, andererseits erholsame Ruhe und Entspannung in den zahllosen Parkanlagen oder den umliegenden Naherholungsgebieten. \r\n\r\nDie angebotene Eigentumswohnung befindet sich im Stadtbezirk Charlottenburg/Wilmersdorf. Er stellt die City-West dar und gehört zu den gefragtesten Wohnlagen. Man findet hier viele Kulturstätten wie z.B. das Theater des Westens, die Deutsche Oper, die Staatsoper (Schillertheater), mehrere Museen, die Waldbühne und das Olympiastadion. Mit dem Schlosspark liegt eine grüne Oase nur wenige Gehminuten von der Wohnung entfernt. Eine große Anzahl von Kinos, gehobene Restaurants, zahllose Kneipen und Bars sowie viele Geschäfte befinden sich im näheren Umfeld und sind schnell und gut erreichbar. \r\n\r\nEinkaufsmöglichkeiten sind vielfältig vorhanden. Schulen, Kitas und medizinische Einrichtungen stehen ausreichend zur Verfügung. Charlottenburg ist durch seine guten Verkehrsanbindungen mit zahlreichen Buslinien sowie U- und S-Bahnlinien vollerschlossen. Die Immobilie liegt zwischen Mierendorffplatz und Goslarer Platz. Die optimale Verkehrsanbindung bietet den Bewohnern des Hauses eine uneingeschränkte Mobilität. In nur ca. 550 Metern Entfernung befindet sich der U- und Bus-Bahnhof Mierendorffplatz. Die Stadtautobahn ist nur etwa einen Kilometer entfernt und in ca. 10 Autominuten erreicht man den Flughafen Tegel.'];;;;;;;;;9101
2020-05-30 19:35:07.224619;Berlin;central_heating;ONE_YEAR_FREE;4936797;n;y;https://pictures.immobilienscout24.de/listings/9e2ba0cc-ded0-4ea8-8dbe-25f629e1d69c-1366104957.png/ORIG/resize/118x118%3E/extent/118x118/format/jpg/quality/80;5;12.19;40 MBit/s;telekom_layer_magenta_l;über VDSL;1900;REGULAR;12.19;117851027;gas;n;false;MagentaZuhause L;y;Berlin;n;9;1;;no_information;energy_consumption;7.48;65;Berlin;10961;first_time_use;sophisticated;E;false;100 MBit/s;no_information;no_information;y;https://padlock.link/ioml;https://padlock.link/ml;no_information;roof_storey;10961;1.5;155;n;2,active;true;Deutschland;top;100 MBit/s;wohnung_kauf;n;5;web,email,bank,music,dl-ul,game,sd,mltstr,hd,fast-ul-dl;true;001.4936797;596180;profile0;;1;true;n;showqualicontactform;n;n;Kreuzberg_Kreuzberg;BB25;3;Berlin;/expose/117851027;['Sanierter Altbau aus der Gründerzeit. Dachgeschoss ist bereits teilausgebaut, es kann nach Baubeschreibung und Kundenwunsch kurzfristig fertiggestellt werden. Es ist mit weiteren Ausbaukosten von ca. € 65.000,- zurechnen.', 'Bäder werden mit hochwertigen Fliesen, Wohnräume mit Parkett ausgestattet.\nSanitärobjekte sind Markenfabrikate.', 'Das Haus liegt nahe dem Südstern in einer ruhigen Nebenstrasse.', 'Bitte nur schriftliche Anfragen unter Angabe der vollständigen Anschrift. Sie geben Ihr Einverständnis, dass Sie der zuständige Mitarbeiter anrufen darf.'];;;;;;;;;111
2020-05-30 19:35:07.603575;Berlin;self_contained_central_heating;ONE_YEAR_FREE;17076257;n;y;https://pictures.immobilienscout24.de/listings/58e21d24-167d-4006-a885-575da3013a16-1366185639.jpg/ORIG/resize/118x118%3E/extent/118x118/format/jpg/quality/80;13;12.78;40 MBit/s;telekom_layer_magenta_l;über VDSL;1905;REGULAR;12.78;109664530;gas;y;false;MagentaZuhause L;y;Berlin;n;8;1;330.74;130;energy_required;7.25;93.36;Berlin;10559;first_time_use_after_refurbishment;normal;;false;100 MBit/s;no_information;"Quitzowstra&szlig;e";n;https://padlock.link/ioml;https://padlock.link/ml;Quitzowstraße;apartment;10559;3;98.8;n;2,active;true;Deutschland;standard;100 MBit/s;wohnung_kauf;n;3;web,email,bank,music,dl-ul,game,sd,mltstr,hd,fast-ul-dl;true;002.01007851690;420000;profile0;4;3;true;n;showqualicontactform;n;n;Tiergarten_Tiergarten;QUI130-08;4;Berlin;/expose/109664530;"['In dem Berliner Altbau von 1905 bieten wir Ihnen exklusiv diese frisch renovierte 3-Zimmer-Wohnung an.', 'WE 08:\n\n● 3.OG Vorderhaus\n● Balkon mit Blick über den Westhafen\n● Frisch renoviert\n● teilweise Altbaudetails \n● Einbauküche\n● Duschbad\n● Gäste-WC', 'Geschäfte des täglichen Bedarf sind fußläufig zu erreichen. Das Schultheiss Quartier mit seinem diversen Angebot ist nur 15 Geh-Minuten entfernt. Der Fritz-Schloß-Park sowie der Park am Nordufer befinden sich in unmittelbarer Nähe und laden zum Verweilen ein.\n\nÖPNV - Anbindung:\nS41/S41/ U9 - Westhafen - fußläufig in 9 Min. zu erreichen\nN9 ""Westhafen""\nBUS 123, M27 - ""Quitzowstraße"" fußläufig in 5 Min zu erreichen', 'Wenden Sie sich an unser mehrsprachiges Team für mehr Informationen, Besichtigungen und das Exposé.\nBitte beachten Sie unsere AGBs und Widerrufsbelehrung.\n\nDer Vertriebspartner ist YS real estate GmbH.']";;;disabled;;2020;;;;12345
2020-05-30 19:35:07.960188;Berlin;central_heating;ONE_YEAR_FREE;16505685;n;y;https://pictures.immobilienscout24.de/listings/12c78e8f-93bd-490e-9b51-e9e8e4437a70-1366099479.jpg/ORIG/resize/118x118%3E/extent/118x118/format/jpg/quality/80;13;11.37;40 MBit/s;telekom_layer_magenta_l;über VDSL;1912;REGULAR;11.37;117849894;gas;n;false;MagentaZuhause L;n;Berlin;y;8;1;220;4;energy_consumption;5.8;75;Berlin;14197;no_information;no_information;E;false;100 MBit/s;no_information;"Johannisbergerstra&szlig;e";n;https://padlock.link/ioml;https://padlock.link/ml;Johannisbergerstraße;apartment;14197;2;142;n;2,active;true;Deutschland;standard;100 MBit/s;wohnung_kauf;n;;web,email,bank,music,dl-ul,game,sd,mltstr,hd,fast-ul-dl;true;001.16119439;450000;profile0;;2;true;n;showqualicontactform;n;n;Wilmersdorf_Wilmersdorf;20108-JOH4-7;3;Berlin;/expose/117849894;['Wie ein hübsches Juwel aus der Gründerzeit wartet es auf neue Bewohner, die es aufwecken. Unterteilt in Vorderhaus und Seitenflügel bietet es\n\n» unterschiedlichste Wohnungsschnitte von 56 bis 155 m² Größe\n» variabel ist die Anzahl der Räume\n» 2- bis 5-Zimmer-Wohnungen\n» Verkauf im Ist-Zustand\n\nArchitektonisch bleibt es im Innern stilgetreu:\n\n» Stuckverzierte Decken\n» originale Flügeltüren und\n» historisches Holzparkett\n» Fast alle Wohneinheiten verfügen über zwei Balkone oder eine Terrass\n\nDie anstehenden Modernisierungen werden durch die WEG behutsam umgesetzt: Balkone, die Sanierung der Fassade, ein Aufzug am Vorderhaus für den Komfort und Videogegensprechanlagen für die Sicherheit.', 'Diese helle 2-Zimmer-Altbauwohnung besticht durch einen hervorragend geschnittenen Grundriss, ihren gut erhaltenen Dielenfußboden sowie teilweise verlegtes Fischgrätenparkett. Die geräumige Küche sowie das charmante Tageslichtbad stellen eines der Highlights dieser Wohnung dar. \n\n» Verkauf im Ist-Zustand\n» Gaszentralheizung\n» Dielenfuböden sowie Fischgrätenparkett\n» Holz-Doppelkastenfenster\n» Tageslichtbad mit Badewanne', 'Wie ein hübsches Juwel aus der Gründerzeit wartet es auf neue Bewohner, die es aufwecken. Unterteilt in Vorderhaus und Seitenflügel bietet es\n\n» unterschiedlichste Wohnungsschnitte von 56 bis 155 m² Größe\n» variabel ist die Anzahl der Räume\n» 2- bis 5-Zimmer-Wohnungen\n» Verkauf im Ist-Zustand\n\nArchitektonisch bleibt es im Innern stilgetreu:\n\n» Stuckverzierte Decken\n» originale Flügeltüren und\n» historisches Holzparkett\n» Fast alle Wohneinheiten verfügen über zwei Balkone oder eine Terrass\n\nDie anstehenden Modernisierungen werden durch die WEG behutsam umgesetzt: Balkone, die Sanierung der Fassade, ein Aufzug am Vorderhaus für den Komfort und Videogegensprechanlagen für die Sicherheit.', 'Die FORTIS Group hat sich als Bestandshalter und -entwickler auf Wohnimmobilien im Mehrfamiliensegment in zentralen Lagen von Berlin und Potsdam spezialisiert. Der Fokus des Unternehmens liegt dabei stets auf der wertsteigernden und behutsamen Entwicklung der Immobilien. Ziel ist es, die vorwiegend historischen Altbauten zu erhalten und die Wohnqualität nachhaltig zu erhöhen.'];;;;;;true;;;
2020-05-30 19:35:08.339960;Berlin;district_heating;ONE_YEAR_FREE;4254239;n;y;https://pictures.immobilienscout24.de/listings/8f1dae69-7ab6-478b-8d38-971a6e620088-1371644874.jpg/ORIG/resize/118x118%3E/extent/118x118/format/jpg/quality/80;3;10.77;40 MBit/s;telekom_layer_magenta_l;über VDSL;2010;REGULAR;10.77;117863250;district_heating;y;true;MagentaZuhause L;y;Berlin;y;11;7;660;no_information;;5.67;249;Berlin;10119;refurbished;luxury;;false;100 MBit/s;underground_garage;no_information;y;https://padlock.link/ioml;https://padlock.link/ml;no_information;penthouse;10119;4;;n;2,active;true;Deutschland;premium;100 MBit/s;wohnung_kauf;n;5;web,email,bank,music,dl-ul,game,sd,mltstr,hd,fast-ul-dl;true;001.4254239;3825000;profile0;5;4;true;n;showqualicontactform;y;n;Mitte_Mitte;117863250;7;Berlin;/expose/117863250;"['Auf Grund der Exklusivität dieses Objekts und auch auf Wunsch der Eigentümer, freuen wir uns über ein persönliches Gespräch mit Ihnen.\n\nSie erreichen uns unter: +49 171 45 12 340\u202c', 'Diese exklusive Wohnung liegt im pulsierenden Zentrum der aktuell spannendsten Hauptstadt Europas – im Herzen von Berlin Mitte. Umgeben von einem lebendigen, jungen Großstadtleben mit Galerien, Designern, Künstlern, Architekten, einem vielfältigen und angesagten kulinarischen Angebot, zahlreichen Cafés, Restaurants, Boutiquen und einer hervorragenden Infrastruktur.', 'Besichtigungen dieser ""Besonderheit"", sind nach Vereinbarung gerne jederzeit möglich..\n\nWir freuen uns, Sie durch dieses sehr schöne Penthouse führen zu dürfen.']";true;;;2;;;;;3
2020-05-30 19:35:08.825726;Berlin;;ONE_YEAR_FREE;15349709;n;y;https://pictures.immobilienscout24.de/listings/cb0f2a07-9562-412c-823d-1ece2a44774b-1368813860.jpg/ORIG/resize/118x118%3E/extent/118x118/format/jpg/quality/80;10;11.37;40 MBit/s;telekom_layer_magenta_l;über VDSL;1905;REGULAR;11.37;117865298;no_information;n;false;MagentaZuhause L;n;Berlin;y;5;1;187;4;energy_consumption;5.8;54.85;Berlin;10715;well_kept;no_information;E;false;100 MBit/s;no_information;"Bruchsaler Stra&szlig;e";y;https://padlock.link/ioml;https://padlock.link/ml;Bruchsaler_Straße;apartment;10715;2;131;n;2,active;true;Deutschland;standard;100 MBit/s;wohnung_kauf;y;2;web,email,bank,music,dl-ul,game,sd,mltstr,hd,fast-ul-dl;true;001.15297510;232000;profile0;;2;true;n;showqualicontactform;n;n;Wilmersdorf_Wilmersdorf;Bruchsaler WE 15;2;Berlin;/expose/117865298;['Das Wohnhaus in der Bruchsaler Straße 4 ist ein Altbau-Klassiker aus dem Jahr 1905. Es wartet mit allem\r\nauf, was Altbau-Freunde lieben: Hohen Decken, Doppelfenstern mit verzierten Holzrahmen, schicken Balkonen\r\nund einem wunderschönen Treppenhaus. Der Wohnkomfort wird zusätzlich durch Aufzüge in jedem Treppenhaus erhöht. Die Fassade, sowie die Treppenhäuser und der Innenhof wurden 2015/2016 instand gesetzt. Im Zuge dessen wurden auch die Aufzüge eingebaut.\r\nDie im 2. Obergeschoss gelegene 2-Zimmer-Wohnung befindet sich im Vorderhaus des Objektes und hält einen vom  Wohnzimmer begehbaren, nach Osten ausgerichteten Balkon bereit.', '- WE 15\r\n- 2. OG\r\n- 2 Zimmer\r\n- ca. 55 m²\r\n- Balkon\r\n- Aufzug\r\n- vermietet', 'In der Gegend um die Bruchsaler Straße finden Sie alles, was man zum Leben braucht. Die umliegenden Universitäten, Berufsbildungszentren, Schulen und Kitas lassen sich schnell und bequem erreichen.\r\nWenige Gehminuten führen zum Volkspark Wilmersdorf, der zu allerlei Freizeitaktivitäten einlädt. Supermärkte, Apotheken, Blumenläden, Schreibwarenläden, Banken, eine Post-Filiale und vieles mehr finden Anwohner in den Seitenstraßen rund um den nahegelegenen Bundesplatz. Entdecken Sie auch den nahegelegenen Bezirk Schöneberg oder tauchen ein in den Trubel am Kurfürstendamm.\r\nDen U/S-Bahnhof Bundesplatz erreichen Sie in wenigen Gehminuten. Am Innsbrucker Platz fahren Sie bequem auf die Berliner Stadtautobahn.', 'Allgemeine Hinweise:\r\nAlle Angaben sind ohne Gewähr und basieren ausschließlich auf Informationen, die uns von unserem Auftraggeber übermittelt wurden. Wir übernehmen keine Gewähr für die Vollständigkeit, Richtigkeit und Aktualität dieser Angaben. Irrtum und Zwischenverkauf vorbehalten. Die Grunderwerbsteuer, Notar- und Grundbuchkosten sind vom Käufer zu tragen. Auf Wunsch stehen wir Ihnen mit weiteren Informationen zum Objekt und zum Eigentümer gerne zur Verfügung. Die Besichtigung kann jederzeit nach Vereinbarung mit einem unserer Mitarbeiter/Beauftragten erfolgen.'];;;disabled;;;;;;
2020-05-30 19:35:09.148999;Berlin;central_heating;ONE_YEAR_FREE;169083;n;y;https://pictures.immobilienscout24.de/listings/12038430-61a0-45f0-81a1-19292bd67f74-1366196810.jpg/ORIG/resize/118x118%3E/extent/118x118/format/jpg/quality/80;4;10.14;40 MBit/s;telekom_layer_magenta_l;über VDSL;1958;REGULAR;10.14;117862879;oil;n;false;MagentaZuhause L;y;Berlin;n;4;2;224;no_information;energy_consumption;5.19;42.14;Berlin;14199;no_information;no_information;;false;100 MBit/s;no_information;no_information;n;https://padlock.link/ioml;https://padlock.link/ml;no_information;no_information;14199;1;160;n;2,active;true;Deutschland;standard;100 MBit/s;wohnung_kauf;y;1;web,email,bank,music,dl-ul,game,sd,mltstr,hd,fast-ul-dl;true;001.169083;195000;profile0;;1;true;y;showqualicontactform;n;n;Schmargendorf_Wilmersdorf;117862879;2;Berlin;/expose/117862879;['Bei dem Angebot handelt es sich um eine vermietete Eigentumswohnung in Berlin Schmargendorf. Die Wohnung befindet sich im 1. OG eines 1958 erbauten Mehrfamilienhauses. \n\nDie Wohnung verfügt über eine Loggia mit Süd/West Ausrichtung.\n\nWohnung 1 OG: \n\nWohnfläche ca.: \t\t42,14 m²\nZimmer: \t\t\t1\nLoggia:\t\t\t\t🗸\nKeller: \t\t\t\t🗸\nMiete p.m.:\t\t\t€ 513,49\nHausgeld: \t\t\t€ 224,00', 'Die Wohnungen liegen im begehrten Stadtteil Schmargendorf.\nDer Charakter Schmargendorfs wird durch Mietshäuser, \nkleiner Mehrfamilienhäuser und Einfamilienhäuser als auch durch prächtige Villen geprägt.\nGeschäfte des alltäglichen Bedarf befinden sich in unmittelbarer Umgebung.'];;;;;;;;;
