2020-05-30 19:45:41.553441;Berlin;central_heating;ONE_YEAR_FREE;4677501;n;y;https://pictures.immobilienscout24.de/listings/750805d1-057a-4fab-9c31-54535222de7f-787810444.jpg/ORIG/resize/118x118%3E/extent/118x118/format/jpg/quality/80;14;10.77;40 MBit/s;telekom_layer_magenta_l;über VDSL;1997;REGULAR;10.77;73451510;;gas;y;false;MagentaZuhause L;y;Berlin;y;9;5;430;11;energy_consumption;5.67;94;Berlin;10119;refurbished;luxury;false;100 MBit/s;no_information;"Veteranenstra&szlig;e ";y;https://padlock.link/ioml;https://padlock.link/ml;Veteranenstraße_;roof_storey;10119;4;130.6;n;2,active;true;Deutschland;standard;100 MBit/s;wohnung_kauf;n;5;web,email,bank,music,dl-ul,game,sd,mltstr,hd,fast-ul-dl;true;001.4677501;720000;profile0;5;4;true;n;n;n;Mitte_Mitte;73451510;4;Berlin;/expose/73451510;"['Die sanierte Dachgeschosswohnung befindet sich im 5. OG des Vorderhauses eines sanierten Altbaus und ist bequem über einen Fahrstuhl zu erreichen. Auf 94 m2 verteilen sich Wohn-Esszimmer, 2 Schlafzimmer, Arbeitszimmer, 2 Badezimmer und ein Balkon. \n\nThis renovated top-floor apartment is located on the 5th floor of a turn-of-the-century building and can conveniently be reached by lift. A large living-kitchen, 2 bedrooms, a study, two bathrooms and a balcony are spread over 94 m2.', 'Beide Bäder haben Deckenfenster und WC; ein Bad hat eine Badewanne mit Duschmöglichkeit, das andere eine Duschkabine. Eine Einbauküche ist vorhanden. Die Wohnung hat Zentralheizung, Parkettböden und einen Balkon mit Blick zum Fernsehturm. \r\n\r\nBoth bathrooms have skylights and toilets; one bathroom features a bathtub with shower-option, the other a shower cabin. Furthermore there is a fitted kitchen. The flat has central heating, wooden parquet flooring and a balcony with view of the TV-tower.', 'Die Wohnung befindet sich in zentraler, jedoch ruhiger, City-Lage in Berlin-Mitte. Der Weinbergspark ist gleich um die Ecke. Das Scheunenviertel sowie die Kastanienallee mit vielen Läden und Restaurants sind fußläufig erreichbar. In unmittelbarer Umgebung gibt es alles für den täglichen Bedarf. \n\nThe apartment is located in a central, yet quiet area of Berlin-Mitte. A park (Weinbergspark) is located just around the corner. Shops and restaurants in Mitte and around Kastanienallee are only a few minutes walk. In the surrounding neighbourhood you can find everything you need. \n\nNächste Haltestellen: U8 Rosenthaler Platz, Tram 12 Veteranenstraße und M1 Zionskirchplatz\n\nNearest stop: U8 Rosenthaler Platz, Tram 12 Veteranenstraße und M1 Zionskirchplatz', 'Die Wohnung ist noch bis Juni 2020 vermietet und kann danach bezugsfrei übergeben werden. Das Mobiliar kann bei Bedarf mit übernommen werden.\n\nThe flat is currently rented out until June 2020 and can be handed over vacant from July 2020. The furniture can be included if desired.']";;;;;showqualicontactform;2010;94;;;
2020-05-30 19:45:41.906388;Berlin;;;16924112;n;n;https://pictures.immobilienscout24.de/listings/d0ce8dee-69b0-4cd1-8206-e90a8cc6d395-1356170802.jpeg/ORIG/resize/118x118%3E/extent/118x118/format/jpg/quality/80;15;11.37;;;;1973;;11.37;116445190;;gas:oil;y;false;;y;Berlin;n;7;3;;no_information;energy_consumption;5.8;83.58;Berlin;10717;modernized;normal;false;;no_information;no_information;n;;;no_information;no_information;10717;3;200;n;2,active;;Deutschland;standard;;wohnung_kauf;n;1;;false;009.06041d57-de1b-4a48-987b-3b0882138407;365000;profile0;6;3;true;n;n;n;Wilmersdorf_Wilmersdorf;116445190;4;Berlin;/expose/116445190;"['+++   Link zum 360°-Rundgang: https://app.immoviewer.com/portal/tour/1541550?accessKey=5d8c   +++\n\nIn verkehrsgünstiger Wohnlage von Berlin-Wilmersdorf ganz in der Nähe des Bayerischen Viertels präsentiert sich diese geräumige und individuell geschnittene Maisonette-Wohnung, die nur darauf wartet, von Ihnen zu Ihrem neuen Lebensmittelpunkt gemacht zu werden. Auf einer Fläche von rund 83 m² verteilt auf 3 Wohnebenen bieten sich hier 3 helle und freundliche Zimmer sowie gleich 3 schöne Wintergärten.\n\nDie Eigentumswohnung befindet sich im 1. Obergeschoss eines 1973 errichteten Mehrfamilienhauses und eignet sich sowohl für Eigennutzer als auch für Kapitalanleger. Sie ist derzeit zu einer Jahresnettokaltmiete in Höhe von 12.120 € unbefristet vermietet und kurzfristig kündbar. \n\nDie modernisierte Wohnung wird über eine Zwischenebene betreten, auf der ein Badezimmer mit Dusche und ein Gäste-WC liegen. Eine Treppe führt Sie hinunter in den Wohnbereich. Dort erwartet Sie ein geräumiges Wohnzimmer, das mit Holzparkett ausgestattet ist. Ein Wintergarten mit großen Fenstern ist von hier aus erreichbar und erweitert den Wohnraum. Nebenan befindet sich die Küche inkl. Einbauküche, in der eine gemütliche Sitzecke Platz findet. Auf der oberen Ebene liegen 2 Schlafzimmer. Die jeweils von dort zugänglichen Wintergärten bieten nicht nur zusätzliche Staufläche, sondern garantieren dank isolierverglaster Fensterfronten eine angenehme Nachtruhe.\n\nDie Immobilie besticht durch einen schönen Schnitt mit guter Aufteilung und hohem Lichteinfall. Darüber hinaus genießen Sie in dem Wohnhaus die Vorzüge eines Wellnessbereichs inkl. Pool und Sauna auf dem Dach, der viel zusätzlichen Komfort verspricht. \n\nNutzen Sie die Gelegenheit und machen Sie diese ansprechende Wohnung zu Ihrem neuen Zuhause in gefragter Berliner Lage oder vermieten Sie die Immobilie und profitieren Sie von einem attraktiven Anlageobjekt! \n\nObjektnr.: 19024', '+ Gepflegte Maisonette-Wohnung\n+ Vorteilhafte Raumaufteilung\n+ Eigennutzung oder Kapitalanlage (kurzfristig kündbar)\n+ Kleine Wintergärten vor allen Wohnräumen\n+ Fliesen, Laminat und Holzparkett\n+ Badezimmer mit Dusche; Gäste-WC\n+ Einbauküche\n+ Wellnessbereich mit Pool u. Sauna im Haus\n+ Sehr gute Lage und Anbindung\n+ Nur ca. 5 Min. bis zum Kurfürstendamm\n\n+ Baujahr laut Energieausweis: 1968\n+ Art des Energieausweises: Bedarfsausweis\n+ Endenergiebedarf/verbrauch: 175 kWh/(m²*a)\n+ Energieeffizienzklasse: F\n+ Wesentlicher Energieträger: Gas', 'Die Eigentumswohnung befindet sich in sehr guter Lage im Berliner Bezirk Charlottenburg-Wilmersdorf, nahe dem Bayerischen Viertel. Eine gute Infrastruktur und eine exzellente Verkehrsanbindung machen die Gegend zu einer attraktiven Wohnlage. In der unmittelbaren Umgebung reihen sich Supermärkte, verschiedene Geschäfte und Dienstleister sowie Cafés und Restaurants aneinander - ein Lebensmittelhändler liegt bspw. nur ca. 150 m entfernt. Kindergärten und Schulen sind ebenfalls schnell erreichbar.\n\nAnschluss an den öffentlichen Personennahverkehr bietet der U-Bahnhof “Berliner Straße” (U7,  U9), der nur rund 200 m entfernt liegt. Eine Bushaltestelle ist nach rund 400 m erreicht. Der beliebte Kurfürstendamm liegt sowohl mit dem ÖPNV als auch mit dem Auto nur etwa 5 Minuten entfernt, bis zum Alexanderplatz sind es mit S- und U-Bahn weniger als eine halbe Stunde und der Zoologische Garten ist in etwa 10 Minuten mit der U-Bahn erreicht.', 'Vereinbaren Sie noch heute einen Besichtigungstermin!\n_____________________________________________________\n\nAlle Angaben sind ohne Gewähr und basieren ausschließlich auf Informationen, die uns von unserem Auftraggeber zur Verfügung gestellt wurden. Wir übernehmen keine Gewähr für die Vollständigkeit, Richtigkeit und Aktualität der Angaben.\n    ']";;true;disabled;;;;;F;;
2020-05-30 19:45:42.270469;Berlin;district_heating;;8022274;n;y;https://pictures.immobilienscout24.de/listings/b87be621-611f-41b7-ae02-0fcc68b021a4-1356033773.jpg/ORIG/resize/118x118%3E/extent/118x118/format/jpg/quality/80;11;10.77;;;;2018;;10.77;116422825;1;district_heating;n;false;;y;Berlin;y;11;9;590.85;no_information;energy_required;5.67;131.3;Berlin;10117;first_time_use;luxury;false;;underground_garage;no_information;y;;;no_information;penthouse;10117;3;62.5;n;2,active;;Deutschland;premium;;wohnung_kauf;n;5;;false;001.8022274;2109000;profile0;5;3;true;n;y;n;Mitte_Mitte;116422826;6;Berlin;/expose/116422825;['- Unsere weiteren spannenden Immobilienangebote im GLINT mit Wohnflächen von ca. 27,5 - ca. 600 m² erhalten Sie gerne auf Anfrage. -\n\nEntdecken Sie unweit vom Brandenburger Tor und Gendarmenmarkt ein außergewöhnliches Wohnensemble, das Vergangenheit und Zukunft verbindet - herzlich Willkommen im GLINT.\n\nVier typische Gründerzeithäuser, erbaut Ende des 19. Jahrhunderts mit Erkern sowie einem reich verzierten Turm als Krönung der Architektur erzählen von Aufbruch und vom Wohnen in der Beletage. \n\nDiesem historischen Ensemble wird nun neues Leben eingehaucht und in das 21. Jahrhundert mit viel Liebe zum Detail transformiert- Der Altbau wird durch einen Neubau harmonisch ergänzt. Bauzeitliche Details werden erhalten und neu interpretiert. Eine grüne Hof-Oase und eine gemütliche Kamin-Lounge werden zu Orte der Begegnung. Ein zukunftsweisendes Mobilitätskonzept mit E-Bikes und Elektro-Tankstellen sowie ein Smart-Home System sorgen für ein modernes Wohnerlebnis.', 'GLINT zeichnet sich durch einen außergewöhnlichen Anspruch an Material und Haptik aus. \n\nHistorische Klinkersteine treffen an den Hoffassaden in spannungsvollem Bezug auf grau geschlämmte Ziegel des Neubaus. Dunkle Holzfenster und dunkle Räuchereiche-Dielen bringen Wertigkeit und zeitlose Klasse in die Wohnungen. Dies hat auch einen funktionalen Nutzen, denn die Eichendiele, die durch das Räuchern ihren tiefbraunen, eleganten Farbton erhält, wird dadurch noch robuster. Im Altbau werden Holzfenster nach historischem Vorbild eingesetzt. \n\nIm Neubau sind die Holzfenster großformatig. In vielen Wohnungen sorgen deckenhohe, gläserne Flügeltüren für räumliche Öffnung und Sichtbezüge. In den Bädern überraschen goldenes Metall und mattes Schwarz: Die Designarmaturen von VOLA stammen aus Dänemark und setzen in Messing ein besonderes Highlight. Insbesondere auf der mattschwarzen Badkeramik aus Italien, die von Valdama stammt. Und so sind es wieder einmal viele liebevolle Details, die aus etwas Besonderem etwas Außergewöhnliches machen.', 'Einzigartige Lage - für Genießer\n\nStellen Sie sich vor, Sie leben in einer der spannendsten Metropolen Europas. Sie wohnen mitten im lebendigen Zentrum und zugleich in vornehmer Distanz zum Trubel der Stadt – aber trotzdem hören Sie morgens keinen Verkehrslärm, sondern das Zwitschern der Vögel im grünen Innenhof. Sie starten den Tag mit Ihrer Morgenlektüre im Kaffee Einstein und genießen gepflegte Wiener Kaffeekultur. Anschließend treffen Sie Freunde im Hotel Adlon oder gehen mit Ihrem Dackel im Großen Tiergarten spazieren.\n\nZum Lunch gönnen Sie sich eine Pasta im Bocca di Bacco und machen einige Besorgungen in den Galeries Lafayette, dem französischen Luxus-Kaufhaus. Danach schlendern Sie gemütlich über den Gendarmenmarkt und erfreuen sich seiner majestätischen Bauwerke: dem Konzerthaus, dem Französischen Dom und Deutschen Dom. Und all das erreichen Sie bequem zu Fuß – in weniger als zehn Minuten! Das ist eine Lebensqualität, die Ihnen wahrscheinlich kein anderer Ort bieten kann.', 'Wann möchten Sie sich Ihre ersten persönlichen Eindrücke vor Ort verschaffen?\n\nWir laden Sie herzlich in unseren GLINT Apartmentstore in der Taubenstraße 51 ,10117 Berlin ein.\n\nDamit wir uns ausreichend Zeit für Sie und Ihren persönlichen Wünschen nehmen können, stimmen Sie gerne vorher den Termin mit uns ab.\n\nSa: 13:00 bis 17:00 Uhr\n\nWann sehen wir uns im GLINT?'];true;;;;showqualicontactform;2019;131.3;B;;
2020-05-30 19:45:42.614071;Berlin;self_contained_central_heating;ONE_YEAR_FREE;1230634;n;y;https://pictures.immobilienscout24.de/listings/f46229dd-1f4e-40eb-a3af-8b74c3e2767a-1356041152.jpg/ORIG/resize/118x118%3E/extent/118x118/format/jpg/quality/80;9;12.19;40 MBit/s;telekom_layer_magenta_l;über VDSL;1900;REGULAR;12.19;116423118;;natural_gas_light;n;false;MagentaZuhause L;y;Berlin;n;10;1;250;no_information;energy_required;7.44;100;Berlin;10999;no_information;no_information;false;100 MBit/s;no_information;no_information;n;https://padlock.link/ioml;https://padlock.link/ml;no_information;apartment;10999;3;157.5;n;2,active;true;Deutschland;standard;100 MBit/s;wohnung_kauf;n;4;web,email,bank,music,dl-ul,game,sd,mltstr,hd,fast-ul-dl;true;001.1230634;950000;profile0;5;3;true;n;n;n;Kreuzberg_Kreuzberg;5486;4;Berlin;/expose/116423118;['Zum Verkauf steht eine ca. 100m² große 3-Zimmerwohnung mit Süd-West-Balkon in der vierten Etage des Vorderhauses eines Berliner Altbaus direkt am Paul-Lincke-Ufer. Zwei Zimmer sowie der Balkon sind zum Landwehrkanal ausgerichtet, das dritte Zimmer, Küche und Bad zeigen zur Hofseite. Die Wohnung ist noch bis zum 31.03.2020 vermietet und wird anschließend frei für Eigennutzer. Besichtigungen können nach Beendigung des Mietverhältnisses durchgeführt werden. Alle Einheiten werden über eine Gas-Etagenheizung beheizt. Eine Wohnungseigentümergemeinschaft (WEG) ist in Gründung. Das hier kalkulierte Wohngeld i.H.v. 2,50 € pro Quadtratmeter Wohnfläche ist eine Schätzung, die auf Erfahrungen von vergleichbaren Wohnungen beruht.\r\nDie 1A-Lage am Paul-Lincke-Ufer ist äußerst begehrt. Sowohl Kreuzberger als auch zahlreiche Besucher verbringen ihre Zeit gern in den zwei stadtbekannten Parks (im Görlitzer Park und Viktoriapark) und am Landwehrkanal. Vom 66 Meter hohen Kreuzberg im Viktoriapark hat der Stadtteil seinen Namen. Der Landwehrkanal bietet schattige Wege zum Spazierengehen, Radfahren und Verweilen. Die Gastroszene in Kreuzberg ist so vielfältig wie seine Einwohner. Märkte, Cafés, Restaurants und Bars bieten die verschiedensten kulinarischen Erlebnisse. Auf den vielen unterschiedlichen Wochenmärkten lässt sich zum Beispiel super der Wocheneinkauf erledigen. Ein Highlight in Kreuzberg ist außerdem die Markthalle Neun, die fußläufig zu erreichen ist. Die U-Bahnstationen Schönleinstraße (U8), Görlitzer Bahnhof (U1, U3) und Kottbusser Tor (U1, U3, U8) befinden sich in fußläufiger Umgebung. \r\nWir bieten weitere Wohnungen verschiedener Größen in diesem Gebäude an. Bitte zögern Sie nicht uns anzusprechen. Kontaktieren Sie uns entweder via E-Mail: info@berlinmaegleren.de oder rufen Sie Ihre Ansprechperson Simone Sczepanski direkt mobil an: 0175 18 16 529'];;;;;showqualicontactform;;;;;
2020-05-30 19:45:42.948654;Berlin;central_heating;ONE_YEAR_FREE;4338188;n;y;https://pictures.immobilienscout24.de/listings/d23a299b-550a-46ee-8899-4893abc0cba8-1367249849.jpg/ORIG/resize/118x118%3E/extent/118x118/format/jpg/quality/80;6;12.72;2,4 MBit/s;telekom_layer_magenta_m_hybrid2;über Hybrid;1986;WITH_HYBRID;12.72;116423991;1;no_information;n;false;MagentaZuhause M Hybrid (2);y;Berlin;n;7;4;;no_information;energy_consumption;4.79;100;Berlin;13051;no_information;no_information;false;16 MBit/s;outside;no_information;n;https://padlock.link/mmh2sa;https://padlock.link/mmhy2;no_information;no_information;13051;4;66;n;2,active;true;Deutschland;standard;50 MBit/s;wohnung_kauf;n;8;web,email,bank,music,dl-ul,game,sd,mltstr,hd;true;001.4338188;335000;profile0;;4;true;n;n;n;Neu_Hohenschönhausen_Hohenschönhausen;95269;4;Berlin;/expose/116423991;['Diese Traumwohnung befindet sich im 8. OG eines sehr gepflegten Mehrfamilienhauses mit 169 Einheiten und bietet einen perfekten Grundriss um seinen Lebensalltag in vollen Zügen genießen zu können.\nHier wurden eine 3-Raum sowie eine 1-Raum Wohnung charmant zusammengelegt und ergeben jetzt einen Wohntraum von 100m². Dadurch besitzt die Wohnung zwei separate Eingänge, zwei Bäder, eine moderne  Küche, ein Ess- und Wohnzimmer sowie zwei Schlafzimmer und ein Balkon mit einer freien Sicht bis zum Hochhaus der Charité. \n\nZur Wohnung gehören ein Kellerraum, ein Abstellraum auf Ihrer Etage und einen Trockenraum zur gemeinsamen Nutzung!\n\nAußerdem haben Sie die Möglichkeit einen eigenen Parkplatz zu erwerben, der Ihnen die Parkplatzsuche am wohlverdienten Feierabend erspart.\n\nDie Wohnung ist aktuell vom Eigentümer bewohnt, bezugsfrei wäre sie ca. Mai 2020.\n\nDer Verbrauchsausweis gibt den Wert 66 kWh (m²a) an, daraus ergibt sich der Endenergiekennwert B. Wesentlicher Energieträger ist Fernwärme.\n\nGerne stehe ich Ihnen für eine Besichtigung oder bei Fragen zu Verfügung\nPatric Henschel Immosky Deutschland GmbH.', 'Diese Wohnung liegt in einer zentralen und ruhigen Gegend, perfekt für Spaziergänge. Aufgrund der sehr guten Lage haben Sie hier exzellente Verkehrsanbindungen zum Stadtzentrum und zur Autobahn sowie viele kleine Geschäfte und kulinarische Highlights. Alles was das Herz begehrt! \nDiverse Kitas, Schulen, Einkaufsmöglichkeiten sind in Ihrer Nähe. Eine hervorragende Anbindung an den öffentlichen Personennahverkehr macht Hohenschönhausen zu einer Traum-Wohngegend.'];;;disabled;;showqualicontactform;;;;10 MBit/s;50 MBit/s
2020-05-30 19:45:43.328700;Berlin;central_heating;;54130;n;y;https://pictures.immobilienscout24.de/listings/160a7e89-6def-4058-8ee3-d76567a97713-1356049395.jpg/ORIG/resize/118x118%3E/extent/118x118/format/jpg/quality/80;7;11.48;;;;1903;;11.48;116423369;;gas;n;false;;n;Berlin;y;5;1;320.17;no_information;energy_consumption;7.14;74.17;Berlin;10247;well_kept;no_information;false;;no_information;no_information;y;;;no_information;apartment;10247;2;112;n;2,active;;Deutschland;standard;;wohnung_kauf;y;4;;false;001.54130;230000;profile0;5;2;true;n;n;n;Friedrichshain_Friedrichshain;94;3;Berlin;/expose/116423369;['Das Mehrfamilienhaus mit 28 Wohnungen ist in Vorderhaus und 2 Seitenflügel aufgeteilt.\nDas Dachgeschoss ist ausgebaut. Ein Aufzug befindet sich im Hof und kann vom Vorderhaus genutzt werden.\nDie zu verkaufende Wohnung befindet sich im 4.OG rechts und hat einen Balkon in östlicher Ausrichtung.\nDas Haus wird über eine zentrale Heizungsanlage mit Warmwasseraufbereitung beheizt.\nDas innenliegende Wannenbad bietet Platz für eine Waschmaschine.\nEin Abstellraum ist vorhanden.\nDie Wohnung ist an eine Wohngemeinschaft vermietet.\nDie Nettokaltmiete beträgt 450,73 € im Monat.', '2 Zimmer, Küche, Bad, Abstellraum\n1 Wohnraum mmit Balkon in Richtung Osten\n1 Schlafzimmer in Richtung Westen\nInnenliegendes Bad\nAbstellraum\nKellerraum', 'Die Wohnung befindet sich im Samariterviertel mit der Samariterkirche im Zentrum.\nDer größte Teil der Wohnungen ist inzwischen modernisiert und instand gesetzt.\nFriedrichshain ist als Wohnquartier bei jungen Leuten und Studenten außerordentlich beliebt.  Als Gewerbestandort ist Friedrichshain ebenfalls beliebt.\n\nDie Anbindung an die öffentlichen Verkehrsmittel ist gut. Die U-Bahnlinie U 5 Station Samariterstraße bringt Sie in wenigen Minuten zum Alexanderplatz. Die Anbindung zur Ringbahn Station Storkower Straße ist gut.\nDas Mehrfamilienhaus stammt aus der Jahrhundertwende und wurde 1996 saniert.'];;;;;showqualicontactform;;75;;;
2020-05-30 19:45:43.681844;Berlin;central_heating;ONE_YEAR_FREE;43448;n;y;https://pictures.immobilienscout24.de/listings/4b44ad1f-06dc-4b19-a6cc-27706ea658f5-1344205224.jpg/ORIG/resize/118x118%3E/extent/118x118/format/jpg/quality/80;10;11.14;2,4 MBit/s;telekom_layer_magenta_m_hybrid2;über Hybrid;1900;WITH_HYBRID;11.14;115204322;;natural_gas_heavy;y;false;MagentaZuhause M Hybrid (2);y;Berlin;y;10;1;;42;energy_consumption;6.17;140;Berlin;10437;well_kept;sophisticated;false;16 MBit/s;no_information;"Schliemannstra&szlig;e";n;https://padlock.link/mmh2sa;https://padlock.link/mmhy2;Schliemannstraße;apartment;10437;4;119;n;2,active;true;Deutschland;top;50 MBit/s;wohnung_kauf;y;4;web,email,bank,music,dl-ul,game,sd,mltstr,hd;true;001.43448;999500;profile0;5;4;true;n;n;n;Prenzlauer_Berg_Prenzlauer_Berg;115204322;6;Berlin;/expose/115204322;"['Diese 4 Zimmer Wohnung liegt im 4. Obergeschoss eines 6 geschossigen Mehrfamilienhauses mit insgesamt 22 Wohneinheiten.\n\nDie ca 140m² Wohnfläche teilen sich in 3 Schlafräume, wobei 2 der Schlafräume einen Zugang zu einem 2. Balkon haben, den Wohnbreich mit weiterem angrenzendem Balkon, die Küche mit Einbauküche, ein Badezimmer mit Badewanne, Abstellraum und eine separates Gäste WC.', 'Die Wohnung liegt in Berliners beliebtem Szeneviertel Prenzlauer Berg. \n\nDiese helle Etagenwohnung befindet sich im Herzen von Prenzlauer Berg in der Schliemannstraße , einen Katzensprung vom Kollwitzplatz als auch Helmholzplatz entfernt.\n\nU-Bahn, Bus, Tram-Station sind leicht zu erreichen.\n\nUnzählige Bars, Clubs, Restaurants, exzellente Einkaufsmöglichkeiten sowie die kulturelle Vielschichtigkeit verleihen dem Prenzlauer Berg sein einzigartiges Flair.\n\nAlle Belange des täglichen Lebens werden hier umfangreich bedient; Einkaufsmöglichkeiten, Ärzte, Schulen, Kindergärten, Universitäten stehen ausreichend zur Verfügung und die Anbindung an öffentliche Verkehrsmittel ist hervorragend.', 'Anschauen lohnt sich!\nLassen Sie sich von uns beraten! Grundrisse und weiter Informationen erhalten Sie von uns auf Anfrage.\nUnsere telefonische Erreichbarkeit:\nmontags bis mittwochs 9:30 bis 19:00 Uhr.\ndonnerstags 9.30 bis 18:00 Uhr\nfreitags und samstags 10:00 bis 17:00 Uhr\n\nReservieren Sie am besten heute noch einen persönlichen Besichtigungstermin!']";;;;;showqualicontactform;;;D;10 MBit/s;50 MBit/s
2020-05-30 19:45:44.022183;Berlin;central_heating;ONE_YEAR_FREE;524594;n;y;https://pictures.immobilienscout24.de/listings/bb89a609-3e38-4009-88d5-f5f92b98b5a4-1352859976.jpg/ORIG/resize/118x118%3E/extent/118x118/format/jpg/quality/80;10;10.8;40 MBit/s;telekom_layer_magenta_l;über VDSL;;REGULAR;10.8;115992849;;gas;y;false;MagentaZuhause L;y;Berlin;y;5;;285;28;energy_consumption;6;60.53;Berlin;12437;no_information;no_information;false;100 MBit/s;no_information;"Scheiblerstra&szlig;e";n;https://padlock.link/ioml;https://padlock.link/ml;Scheiblerstraße;no_information;12437;2;97;n;2,active;true;Deutschland;standard;100 MBit/s;wohnung_kauf;n;3;web,email,bank,music,dl-ul,game,sd,mltstr,hd,fast-ul-dl;true;001.524594;240000;profile0;5;2;true;n;n;n;Baumschulenweg_Treptow;115992849;2;Berlin;/expose/115992849;['Bezugsfreie 2-Zimmer-Küche-Bad-Wohnung in saniertem Altbau mit Südwest-Balkon. Die Wohnung liegt in einer kleinen Seitenstraße dennoch zentral nahe der S-Bahn Station Baumschulenweg.', 'Bei der Wohnung stimmt alles. Das Wohnzimmer ist der größte Raum mit Balkon und Süd-West-Ausrichtung. Das Schlafzimmer geht zum ruhigen Garten.\n\nDas Bad mit Wanne, Waschbecken und Toilette hat Platz für die Waschmaschine und hat ein Fenster.\n\nDie Küche ist mit einer Einbauküche ausgestattet und hat Platz für einen Essplatz.\n\nZur Wohnung gehört ein Keller', 'Nähe Plänterwald, Spreenähe, S-Bahn \nEinkaufsmöglichkeiten fußläufig erreichbar\n\nDer Treptower Park ist fußläufig zu erreichen. Einkaufsmöglichkeiten des täglichen Bedarfs sind in unmittelbarer Nähe vorhanden. Das Park-Center Treptow bietet weitere Einkaufsmöglichkeiten. Zum Alexanderplatz sind es ca. 20 Minuten. Für die Freizeitgestaltung stehen eine Schwimmhalle, Tennis- und Sportplätze, in unmittelbarer Nähe zur Verfügung.'];;;;;showqualicontactform;;;;;
