timestamp;obj_regio1;obj_heatingType;obj_cId;obj_newlyConst;obj_balcony;obj_picture;obj_picturecount;obj_pricetrend;obj_yearConstructed;obj_galleryAd;obj_project_id;obj_pricetrendbuy;obj_scoutId;obj_firingTypes;obj_hasKitchen;obj_ExclusiveExpose;obj_courtage;geo_bln;obj_cellar;obj_purchasePriceRange;obj_yearConstructedRange;obj_houseNumber;obj_pricetrendrent;obj_livingSpace;geo_krs;obj_zipCode;obj_condition;obj_interiorQual;ga_cd_cxp_historicallisting;obj_parkingSpace;obj_street;obj_lift;obj_streetPlain;obj_typeOfFlat;geo_plz;obj_noRooms;obj_assistedLiving;obj_ityp;geo_land;ga_cd_via;obj_immotype;obj_rented;obj_floor;obj_nbp;obj_telekomInternetProductAvailable;obj_cwId;obj_purchasePrice;ga_cd_application_requirements;obj_numberOfFloors;obj_noRoomsRange;ga_cd_maillead_default_shown;obj_garden;obj_barrierFree;obj_international;obj_regio3;obj_objectnumber;obj_livingSpaceRange;obj_regio2;URL;beschreibung;obj_telekomTvOffer;obj_telekomUploadSpeed;obj_telekomTrackingGroup;obj_usableArea;obj_telekomInternetTechnology;obj_telekomInternetType;obj_noParkSpaces;obj_telekomInternetProductName;obj_rentSubsidy;obj_energyType;obj_energyEfficiencyClass;obj_telekomDownloadSpeed;obj_telekomInternetUrlMobile;obj_telekomInternetUrl;obj_thermalChar;obj_groupnumber;obj_telekomHdTelephone;obj_telekomInternet;obj_telekomInternetServices;evt_count_pm_sig;ga_cd_customer_group;obj_telekomHybridUploadSpeed;obj_telekomHybridDownloadSpeed;obj_lastRefurbish;ga_cd_via_qualified
2020-05-30 19:38:25.841190;Berlin;district_heating;15372281;y;y;https://pictures.immobilienscout24.de/listings/2852db7e-b5bc-4eab-aa57-1a5a765bc219-1363126270.jpg/ORIG/resize/118x118%3E/extent/118x118/format/jpg/quality/80;4;10.71;2020;disabled;86973;10.71;117308630;no_information;n;false;n;Berlin;y;8;9;9C;5.2;84.95;Berlin;12437;no_information;sophisticated;false;no_information;Eichbuschallee;y;Eichbuschallee;no_information;12437;3;n;2,active;Deutschland;top;wohnung_kauf;n;1;true;false;001.15320047;469000;profile0;5;3;true;n;n;n;Plänterwald_Treptow;EBA/9C/37;4;Berlin;/expose/117308630;"['Das Neubauprojekt ""Wohnen am Plänterwald"" überzeugt durch seine neoklassizistische Architektur und die gehobene Ausstattung der 62 Wohnungen. Durchdachte und vielseitige Grundrisse mit Größen von rund 53 bis 123 m² bzw. von 2 bis 4 Zimmern sind die ideal geeignet für Familien, Paare oder Singles. Die Wohnungen im Gartengeschoss verfügen über große Terrassen und Privatgärten. In den oberen Etagen ermöglicht die aufwendige, teilweise gestaffelte Architektur ebenfalls große Balkone oder Terrassen für jede Wohnung.\n\nIn Treptow ergänzen sich Natur und modernes Leben zu einer spannenden Verbindung, ohne dass man auf die Vorzüge des pulsierenden Metropolenlebens verzichten muss.\n\nAuf dem schönen Balkon, zugänglich vom Wohn-/Essbereich und Schlafzimmer, genießt man laue Sommerabende. Die Wohnung überzeugt mit einer optimalen Raumaufteilung sowie einem ansprechenden Badezimmer mit großer Dusche und Badewanne. Ein separater Hauswirtschaftraum, der vom Kochbereich begehbar ist, rundet den gehobenen Wohnkomfort ab.\n', '- Echtholzparkett in den Wohn- und Schlafräumen\n- energiesparende Fußbodenheizung\n- Feinsteinzeug in den Bädern\n- Sanitärobjekte und Armaturen von Markenherstellern\n- Elektrische Rollläden an allen Fenstern\n- 3-Fach-Verglasung der z.T. bodentiefen Fenster\n- Barrierefreie Komfortwohnung\n- KfW-55 Energie-Effizienzhaus (EnEV 2016)\n- Aufzug in alle Etagen\n- Abgeschlossener Müllraum\n- Fahrradabstellplätze für jede Wohnung\n- Tiefgaragenstellätze (Ladestationen möglich)\n', 'Auf der einen Seite viel Grün und entspannende Ruhe. Auf der anderen Seite ist man ruckzuck im Zentrum Berlins - ob mit dem Fahrrad, dem Auto oder den öffentlichen Verkehrsmitteln. Die S-Bahnhöfe Plänterwald und Baumschulenweg sind fußläufig in wenigen Minuten zu erreichen. Doch das Hinsetzen in der Bahn lohnt kaum, denn innerhalb von zwei Stationen befindet man sich im quirligen Kiezleben von Friedrichshain, Neukölln oder Kreuzberg.\n\nPlänterwald: 50 Meter zu Fuß\nSpreeufer: 500 Meter zu Fuß\nTreptower Park: 5 Min mit dem Fahrrad\nMediaspree: 10 Min mit dem Fahrrad\nBahnhof Ostkreuz: zwei Stationen mit den öffentlichen Verkehrsmitteln\nAlexanderplatz: 23 Min mit den öffentlichen Verkehrsmitteln\nFriedrichstraße: 27 Min mit den öffentlichen Verkehrsmitteln\nHauptbahnhof: 30 Min mit den öffentlichen Verkehrsmitteln\nKurfürstendamm: 40 Min mit den öffentlichen Verkehrsmitteln\nFlughafen Tegel: 30 Min mit dem Auto\nFlughafen BER: 22 Min mit dem Auto', 'Der Verkauf erfolgt für den Käufer provisionsfrei!\n\nBeratungstermine in unserem Info-Pavillon vor Ort sind nach individueller Vereinbarung weiterhin möglich!\n\nAngaben nach EnEV: Energieausweis befindet sich in der Erstellung.\n\nÄnderungen und Irrtümer vorbehalten. Das Bild- und Planmaterial dient zum Teil der vorläufigen Illustration des Vorhabens. Insbesondere die Visualisierungen o. ä. sind unverbindlich und zeigen teilweise Sonderausstattungen und Einrichtungen, die als Möblierungsvorschläge zu verstehen sind.\n']";;;;;;;;;;;;;;;;;;;;;;;;;
2020-05-30 19:38:26.360513;Berlin;central_heating;210901;n;y;https://pictures.immobilienscout24.de/listings/6ebc4a04-6188-4d34-92f1-3da228ae423b-1363091234.jpg/ORIG/resize/118x118%3E/extent/118x118/format/jpg/quality/80;10;10.27;1997;;;10.27;117302025;gas;y;false;y;Berlin;y;6;5;no_information;5.43;101;Berlin;12621;well_kept;normal;false;underground_garage;no_information;n;no_information;ground_floor;12621;4;n;2,active;Deutschland;top;wohnung_kauf;y;1;;true;001.210901;299000;profile0;4;4;true;y;n;n;Kaulsdorf_Hellersdorf;W-02IHND;5;Berlin;/expose/117302025;['Die vermietete Eigentumswohnung befindet sich in einer attraktiven Stadtvilla, in ruhiger Siedlungslage von Kaulsdorf. Im Erdgeschoß gelegen ist die Vierzimmerwohnung schon seit dem Jahr 2006 an eine Familie zu einer Nettokaltmiete von 689,58 € pro Monat vermietet und bietet neben einer Sonnenterrasse zusätzlich eine gemeinsame Gartennutzung auf einem ca. 1.033 m² großen Grundstück. Durch das hell gestaltete Treppenhaus gelangt man über wenige Stufen in die großzügige Diele, die einen Einblick in die freundliche Wohnung mit viel Platz für Garderobe und Abstellmöglichkeiten bietet. Von hier gehen drei Zimmer, die Küche, das Badezimmer mit Wanne und Dusche und das Gäste-WC auf einer Wohnfläche von ca. 101 m² ab, wobei die Einbauküche Eigentum der Mieter ist. Zwei gleichgroße Zimmer mit jeweils ca. 13 m² Wohnfläche liegen nebeneinander und ermöglichen einen Ausblick zur Straße hin. Das große Wohnzimmer ist vom Schlafzimmer mittels einer Durchgangstür getrennt und nach Süden sowie zur Terrasse ausgerichtet. Von der Terrasse führt eine Rampe direkt in den Garten und ermöglicht so einen unkomplizierten Zugang zu diesem. Die doppelverglasten Kunststofffenster sind in allen Räumen mit mechanischen Außenjalousien versehen und bieten Sicherheit und Sichtschutz. Für die Mieter stehen zusätzlich im Untergeschoß ein separates Kellerabteil, eine gemeinschaftliche Waschküche und ein großer gemeinschaftlicher Fahrradraum zur Verfügung. Darüber hinaus gehört zu dieser Wohnung ein Stellplatz in der Tiefgarage.', 'Art Energieverbrauchsausweis \n · Energieverbrauchskennwert 122,20 kWh/(m²*a)  \n · Energieeffizienzklasse D  \n · Befeuerungsart Gas \n · Baujahr 1997', 'Diese Stadtvilla wurde 1997 in massiver Bauweise mit fünf Wohneinheiten auf einem gut geschnittenen Grundstück in Kaulsdorf-Nord erbaut. Neben den Kellerräumen befindet sich im Untergeschoß eine Tiefgarage mit 4 Stellplätzen. Im gesamten Haus und auf dem Grundstück fällt der hohe Pflegestandard auf, der darauf zurückzuführen ist, dass alle weiteren vier Wohnungen von den Eigentümern selbst genutzt und verwaltet werden. In einem separaten Kellerraum befindet sich der Anschluss für die Erdgasheizung. Der Garten ist Gemeinschaftseigentum und kann von allen Bewohnern genutzt werden. Der Berliner Stadtteil Kaulsdorf liegt nördlich von Köpenick am östlichen Rand Berlins. Dank der Nähe zum Müggelsee, zur Köpenicker Altstadt, zur Wuhlheide und zur Rennbahn Hoppegarten zählt Kaulsdorf zu den beliebtesten Wohngegenden in Berlin. Gleich um die Ecke befindet sich das beliebte Wernerbad. Hier können die Bewohner relaxen und sportlichen Aktivitäten nachgehen. Infrastrukturell ist die Lage durch Schulen, Banken, Apotheken, vielfältige Einkaufsmöglichkeiten des täglichen Bedarfs und Restaurants gut erschlossen. Die Nähe zu zwei S-Bahnhöfen (Mahlsdorf und Kaulsdorf) zu Bus- und Straßenbahnlinien und zur B1 bieten eine schnelle Verbindung in die Berliner City und ins Berliner Umland.', 'Sie möchten Ihre Immobilie verkaufen? Wir sind Ihnen dabei gern behilflich - engagiert, diskret und für Sie kostenlos! \nNutzen Sie unseren Rundumservice: von der Einschätzung, über das Finden eines bonitätsgeprüften Käufers, die Begleitung zum Notar bis zur endgültigen Übergabe. \nWir sind für Sie da und freuen uns auf Ihren Anruf. \nENGEL&VÖLKERS Berlin-Köpenick Tel: +49 30 65 48 49 50 \nDie Courtage in Höhe von 7,14 % inkl. der gesetzlichen Mehrwertsteuer auf den Kaufpreis ist mit dem Zustandekommen des Kaufvertrages (notarieller Vertragsabschluß) verdient, fällig und vom Käufer zu zahlen. Die Höhe der Bruttocourtage unterliegt einer Anpassung bei Steuersatzänderung. Die Vermittelnden und/oder Nachweisende Engel & Völkers Frohnau - Köpenick GmbH (Lizenznehmer der Engel & Völkers Immobilien GmbH ) und ggf. deren Beauftragter, erhalten einen unmittelbaren Zahlungsanspruch gegenüber dem Käufer. Alle Angaben sind ohne Gewähr und basieren ausschließlich auf Informationen, die uns von unserem Auftraggeber zur Verfügung gestellt wurden. Wir übernehmen keine Gewähr für die Vollständigkeit, Richtigkeit und Aktualität dieser Angaben. Die Grunderwerbsteuer, Notar- und Grundbuchkosten sind vom Käufer zu tragen. Im Übrigen gelten unsere Allgemeinen Geschäftsbedingungen. Irrtum und Zwischenverkauf vorbehalten.'];ONE_YEAR_FREE;40 MBit/s;telekom_layer_magenta_l;16;über VDSL;REGULAR;1;MagentaZuhause L;279;energy_consumption;D;100 MBit/s;https://padlock.link/ioml;https://padlock.link/ml;122.2;240;true;100 MBit/s;web,email,bank,music,dl-ul,game,sd,mltstr,hd,fast-ul-dl;showqualicontactform;;;;;
2020-05-30 19:38:26.721570;Berlin;self_contained_central_heating;456215;n;y;https://pictures.immobilienscout24.de/listings/a5d818b4-f69a-45da-bf35-df59dd418f26-1363110028.jpg/ORIG/resize/118x118%3E/extent/118x118/format/jpg/quality/80;19;14.32;1965;;;14.32;117303538;;y;false;y;Berlin;y;7;2;no_information;8.36;80;Berlin;13349;modernized;normal;false;outside;no_information;y;no_information;apartment;13349;4;n;2,active;Deutschland;top;wohnung_kauf;n;3;;true;001.456215;328000;profile0;5;4;true;n;n;n;Wedding_Wedding;ETW - MS - Lüp01;3;Berlin;/expose/117303538;['Vielen Dank für Ihr Interesse an dem Objekt, das im Alleinauftrag angeboten wird. \n\nDie Wohnung im 3. OG mit Ostbalkon und tlw. Fernblick steht ab sofort zum Verkauf und ist bezugsfrei. Das Haus wurde 1965 erbaut, Dach und Fassade wurden kürzlich erneuert.\n\nDie Wohnung wird derzeit beräumt.\n\nDas Objekt verfügt über 4 Zimmer, das monatliche Wohngeld beträgt 317€, inklusive Instandhaltungsrücklage. \n\nZur Wohnung gehört ein privater Stellplatz, im Preis enthalten ein trockener Keller, Größe etwa 10 qm. Pro Hauseingang befindet sich ein Fahrstuhl. \n\nDer Bodenrichtwert / Grundstück 2020 liegt (noch) bei 1.000€ / qm.', 'Die Eingangstür / Wohnung ist mir einer Sicherheitsvorrichtung (zusätzliches Schloss) versehen, des Weiteren befindet sich einen Gegensprechanlage direkt daneben. \n\nDie Bodenbelagsarbeiten wurden im Eingangsbereich mit Parkett ausgeführt, die Wandflächen mit Schwedenvlies tapeziert. \n\nDie ersichtliche Einbauküche - u.U. müssen nur die Fronten gewechselt werden - ist ausgestattet mit Gaskochstelle, Kühlschrank, Geschirrspüler und weiteren Küchenmöbeln, ist im Preis enthalten. \n\nDas Bad wurde vor einigen Jahren neu gefliest und verfügt über eine Echtglas - Duschabtrennung, sowie über einen Waschtisch aus Naturstein. Das Bad, sowie die Möbel befinden sich ein einem sehr guten Zustand. \n\nDie Böden in den Zimmern - bis auf den Eingangsbereich mit Essplatz - wurden mit Teppichböden ausgelegt, ausgenommen Bad und Küche, diese sind gefliest. \n\nIm Prinzip müssten in der Wohnung nur Malerarbeiten an Wand und Deckenflächen ausgeführt werden und die Wohnung kann bezogen werden. \n\nMalerarbeiten im Bereich des Balkons können ebenfalls durchgeführt werden.', 'Die Wohnung befindet sich unweit (Sichtweite) des Kurt Schumacher Platzes, dort befinden sich die folgende Öffentliche Verkehrsmittel, die problemlos zu Fuß erreichbar sind.  \n\nU Bahn (U 6)\nBuslinien 122, 125, 128, 221, M21, N6, X 21', 'Wer ein „saubere und unkomplizierte“ Immobilie innerhalb einer gepflegten Wohnanlage erwerben möchte, die von einer engagierter Eigentümergemeinschaft und „rührigem“ Hausverwalter „in Schuss“ gehalten wird, sollte sich eine Besichtigung nicht entgehen lassen. Hervorzuheben ist der hochtransparente Wirtschaftsplan. \n\nBei Kaufabsicht ist ein Kapitalnachweis und / oder eine Finanzierungsbestätigung einer deutschen Bank mit Kontaktdaten Ansprechpartner zu erbringen. Für diesen Fall liegen die letzten 3 Protokolle der Eigentümerversammlung, Abrechnungen, sowie ein aktueller Grundbuchauszug vor. \n\nDie in dieser Beschreibung gemachten Angaben beruhen auf Auskünften des Eigentümers. Somit kann unsererseits keine Haftung für die hier gemachten Angaben und Daten übernommen werden. \n\n***Bitte habe Sie dafür Verständnis, dass ein Versand des Exposés nur nach Angabe Ihrer Kontaktdaten erfolgen kann.***'];ONE_YEAR_FREE;2,4 MBit/s;telekom_layer_magenta_m_hybrid2;80;über Hybrid;WITH_HYBRID;1;MagentaZuhause M Hybrid (2);317;;;16 MBit/s;https://padlock.link/mmh2sa;https://padlock.link/mmhy2;;;true;50 MBit/s;web,email,bank,music,dl-ul,game,sd,mltstr,hd;showqualicontactform;home_builder;10 MBit/s;50 MBit/s;;
2020-05-30 19:38:27.173397;Berlin;self_contained_central_heating;18373328;n;y;https://pictures.immobilienscout24.de/listings/5e6596fe-637b-4985-87f7-326a515dff22-1363073727.jpg/ORIG/resize/118x118%3E/extent/118x118/format/jpg/quality/80;19;16.53;1911;;;16.53;117299198;gas;y;false;y;Berlin;y;5;1;no_information;9.26;50;Berlin;12043;refurbished;sophisticated;false;no_information;no_information;n;no_information;apartment;12043;1;n;2,active;Deutschland;top;wohnung_kauf;n;1;;true;002.01009196231;230000;profile0;5;1;true;n;n;n;Neukölln_Neukölln;117299198;2;Berlin;/expose/117299198;"['Exklusives Wohnen in gefragter Lage - so präsentiert sich diese möblierte und vollständig sanierte 1-Zimmer-Wohnung mit durchdachtem Grundriss. \n\nDie charmante Wohnung befindet sich im Hinterhaus eines im Jahre 1911 errichteten Mehrfamilienhauses. Dort erwartet Sie ein heller Wohnraum, ein frisch saniertes Badezimmer sowie einen Abstellraum, welcher als Ankleidezimmer genutzt werden kann. Ein weiteres Highlight der Eigentumswohnung ist der großzügige Balkon.\n\nIm Wohnzimmer, im Ankleidezimmer sowie im Flur profitieren Sie von einem hochwertigen Fußboden, der in Kombination mit den hohen Decken und den großen Fenstern den typischen Altbaucharme unterstreicht und ein angenehmes Wohngefühl erzeugt. \n\nDie Eigentumswohnung wurde im Jahr 2018 vollständig saniert und eignet sich ebenfalls als rentable Anlage.  Zum jetzigen Zeitpunkt ist die Immobilie bis zum 31.08.2020 vermietet. Im Anschluss steht die Wohnung zur Selbstnutzung oder Weitervermietung zur Verfügung. Das monatliche Hausgeld beträgt 140,- €. \n\nBei Bedarf unterstützen wir Sie vollumfänglich bei der Verwaltung und Vermietung Ihrer Eigentumswohnung. Wir informieren Sie gerne in einem persönlichem Gespräch über die Möglichkeiten und Konditionen unseres Services. Die verkaufsrelevanten Unterlagen können wir Ihnen jederzeit zur Verfügung stellen. \n\nWir freuen uns auf Ihre Rückmeldung!\n\nGrand Urban Immobilien Group GUIG GmbH \nwww.Grand-Urban.de\nsales@grand-urban.de', '+ Keller\n+ Hausgeld: 140,- €\n+ Neue Einbauküche\n+ Sehr gute Infrastruktur\n+ Geschmackvoll möbliert\n+ Lichtdurchflutete Räume\n+ Top-Lage im Trendbezirk\n+ Bezugsfrei ab: 01.09.2020\n+ Als Anlage oder zur Selbstnutzung\n+ Badezimmer mit Dusche und Fenster\n+ Instandhaltungsrücklage; ca. 49.000,-€\n+ Vollständig sanierte Eigentumswohnung', 'Neukölln ist der achte Verwaltungsbezirk von Berlin und hat 329.767 Einwohner. Nach dem Bezirk Friedrichshain-Kreuzberg und dem Bezirk Mitte ist er der am dichtesten besiedelte Bezirk in Berlin. Neukölln wurde nach dem gleichnamigen Ortsteil benannt, der den nördlichen Teil des Bezirks ausmacht.\n\nIn der Auflistung der angesagtesten Szenekieze der Welt steht Neukölln auf Platz 7. Gar nicht so überraschend, so multinational und lebendig wie der Stadtteil ist. Der Ausgleich zwischen Job und Freizeit funktioniert hier wie sonst nirgendwo in der Stadt. Zwischen Kreativen, jungen Familien, Karrierekletterern, Neu- und Altberlinern fühlt man die Dynamik, den sichtbaren Wandel neben dem alltäglichen Treiben. Besonders entlang der Karl-Marx-Straße: Das Karstadt am Hermannplatz soll bald wieder glänzen wie in den Goldenen Zwanzigern. In der Alten Post werden gerade neue Coworking-Flächen gebaut und gegenüber ist ein modernes Büro- und Geschäftshaus geplant. Neukölln hat Zukunft, werden Sie ein Teil davon!\n\nDie angebotene Eigentumswohnung ist in einer sehr beliebten und schönen Gegend von Neukölln. In direkter Nähe ist das Kiehlufer und auch die Sonnenalle und mehere Busverbindungen sowie der U-Bhf, die Verbindungen sind schnell erreichbar. Schulen, Ärzte und Einkaufsmöglichkeiten sind in unmittelbarer Umgebung vorhanden.', 'Alle Angaben sind ohne Gewähr und basieren ausschließlich auf Informationen, die uns von unserem Auftraggeber übermittelt wurden. Wir übernehmen keine Gewähr für die Vollständigkeit, Richtigkeit und Aktualität dieser Angaben. Zwischenvermietung bleibt vorbehalten.']";ONE_YEAR_FREE;40 MBit/s;telekom_layer_magenta_l;2;über VDSL;REGULAR;;MagentaZuhause L;140;energy_required;D;100 MBit/s;https://padlock.link/ioml;https://padlock.link/ml;105;;true;100 MBit/s;web,email,bank,music,dl-ul,game,sd,mltstr,hd,fast-ul-dl;showqualicontactform;;;;2018;
2020-05-30 19:38:27.532078;Berlin;self_contained_central_heating;1145741;n;y;https://pictures.immobilienscout24.de/listings/ad5874cd-9c36-4cbc-9e82-757357f8a4d1-1363113002.jpg/ORIG/resize/118x118%3E/extent/118x118/format/jpg/quality/80;13;11.35;1902;;;11.35;117305248;gas;y;false;n;Berlin;y;11;1;37;7.53;314.27;Berlin;10249;mint_condition;sophisticated;false;no_information;"Petersburger Stra&szlig;e";y;Petersburger_Straße;roof_storey;10249;10;n;2,active;Deutschland;standard;wohnung_kauf;n;5;;true;001.1145741;2190000;profile0;5;5;true;n;n;n;Friedrichshain_Friedrichshain;2044.000000;7;Berlin;/expose/117305248;['Vielen Dank für Ihr Interesse an unserem Angebot. \n\nDas Wohn- und Geschäftshaus befindet sich im Bezirk Friedrichshain/Kreuzberg. Das Dachgeschoss wird derzeit ausgebaut, so dass 314,27 m² neuer Wohnraum entsteht. Hier lebt man mitten in Szenebezirk Friedrichshain und kann über den Dächern einen atemberaubenden Blick auf den Berliner Fernsehturm genießen. \n\nNur ca. 60 m² Wohnfläche liegen straßenseitig, die anderen Flächen liegen im hinteren Bereich und verteilen sich auf den Seitenflügel bzw. auf das Quergebäude. Alle Räume sind nach Fertigstellung lichtdurchflutet. Eine Klimaanlage sorgt für angenehme Raumtemperatur an heißen Tagen, die moderne Gasetagenheizung für wohlige Wärme im Winter. Alle Wohnräume werden mit hochwertigem Echtholz in einem warmen Braunton belegt.  Auf insgesamt 32,76 m² Terrassenfläche kann eine kleine grüne Oase zum Entspannen entstehen. Die neuen Aufzüge bringen Sie bequem in Ihr neues schönes und besonderes Zuhause. \n\nDie Fläche im begrünten Innenhof wird gemäß Freianlagenkonzept gestaltet. Dort entstehen ein Kinderspielplatz sowie Müll- und Fahrradstellplätze. \nIm Erdgeschoss befinden sich Gewerbeeinheiten. Diese sind an eine Änderungsschneiderei und an einen Kostümverleih vermietet. Alle anderen Einheiten werden als Wohnraum genutzt. \nDas Objekt wurde um die Jahrhundertwende erbaut und ist ein typischer Altbau. Die Fassade und die Treppenhäuser befinden sich noch im ursprünglichen unsanierten Zustand. Die Fassade erhält nach Fertigstellung der Baumaßnahmen einen neuen Anstrich. \n\nDas Miethaus wird derzeit nach dem Wohnungseigentumsgesetz aufgeteilt. Nach Teilung besteht die WEG aus 25 Wohnungen. \n\nWährend der Bauphase ist es möglich die Raumaufteilung und die Ausstattung zu beeinflussen, soweit diese noch nicht erbaut / installiert sind. Sofern baulich umsetzbar, werden die Wünsche des Käufers selbstverständlich berücksichtigt.\n\nVoraussichtliche Fertigstellung Oktober 2020.', '- 11 Zimmer \n- Gasetagenheizung\n- Fußbodenheizung\n- Parkett in allen Räumen außer Bad\n- geflieste Wannenbäder mit Duschen\n- Wohnküche\n- Einbauküche mit Geräten\n- Klimaanlage\n- 5 Terrassen\n- Abstellräume\n- Aufzug\n- Rauchwarnmelder', 'Das Gebäude liegt mitten im Herzen von Berlin im Szeneviertel mit viel Gastronomie und kleinen Geschäften in der Nähe. Hier pulsiert das Leben. Der Bezirk Friedrichshain ist im Wandel, der kontinuierlich erneuert und verschönert wird.  \nDas Gebäude liegt mitten im Herzen von Berlin im Szeneviertel mit viel Gastronomie und kleinen Geschäften in der Nähe. Hier pulsiert das Leben. Der Bezirk Friedrichshain ist im Wandel, er wird kontinuierlich erneuert und verschönert.  \n\nInnerhalb von einem ca. fünf bis zehn minütigem Fußweg ist der Volkspark Friedrichshain zu erreichen. Nach ca. 30 min. erreicht man ebenfalls fußläufig die Spree, die direkt hinter dem S-Bahnhof Warschauer Straße und der East-Side-Gallery liegt. Dort befindet sich die Mercedes-Benz Arena, diverse Veranstaltungen sorgen für kulturelle Erlebnisse. \n\nDie Tram-Haltestelle der M10 liegt direkt gegenüber des Wohn- und Geschäftsgebäudes. Andere Verkehrsverbindungen sind innerhalb von 5 - 10 Minuten (U-Bahnhof Frankfurter Tor) zu erreichen. \n\nDie Karl-Marx-Allee ist ebenfalls fußläufig erreichbar. Sie lädt zu einem Einkaufsbummel ein. Wer es lieber geballter mag, begibt sich ins ca. 2 km entfernte Ringcenter. In diesem Einkaufszentrum bieten ca. 100 Fachgeschäfte die unterschiedlichsten Waren an. \n\nAuf dem geräumigen Mittelsteifen der Petersburger Straße, stehen öffentliche Parkplätze zur Verfügung. Derzeit erfolgt noch keine Parkraumbewirtschaftung.', 'Sofern Sie Fragen haben oder einen Beratungstermin wünschen, freuen wir uns über Ihren Anruf oder eine E-Mail von Ihnen. \n\nGern kann das Objekt nach Terminvereinbarung besichtigt werden. \n\nACHTUNG: Da der Fußboden hergestellt wird, sind Besichtigungen aufgrund der Trocknungszeit zwischen 08.05.2020 und 08.06.2020 nicht möglich. \n\nWeitervermittlung über Makler nicht möglich. \n\nAlle Angaben beruhen auf Informationen Dritter, daher ist eine Haftung ausgeschlossen.'];ONE_YEAR_FREE;40 MBit/s;telekom_layer_magenta_l;333.7;über VDSL;REGULAR;;MagentaZuhause L;702;energy_consumption;NO_INFORMATION;100 MBit/s;https://padlock.link/ioml;https://padlock.link/ml;;;true;100 MBit/s;web,email,bank,music,dl-ul,game,sd,mltstr,hd,fast-ul-dl;showqualicontactform;;;;2020;
