timestamp;obj_regio1;obj_heatingType;obj_telekomTvOffer;obj_cId;obj_newlyConst;obj_balcony;obj_picture;obj_picturecount;obj_pricetrend;obj_telekomUploadSpeed;obj_telekomTrackingGroup;obj_telekomInternetTechnology;obj_yearConstructed;obj_telekomInternetType;obj_pricetrendbuy;obj_scoutId;obj_firingTypes;obj_hasKitchen;obj_ExclusiveExpose;obj_telekomInternetProductName;obj_courtage;geo_bln;obj_cellar;obj_purchasePriceRange;obj_yearConstructedRange;obj_rentSubsidy;obj_houseNumber;obj_energyType;obj_pricetrendrent;obj_livingSpace;geo_krs;obj_zipCode;obj_condition;obj_interiorQual;obj_energyEfficiencyClass;ga_cd_cxp_historicallisting;obj_telekomDownloadSpeed;obj_parkingSpace;obj_street;obj_lift;obj_telekomInternetUrlMobile;obj_telekomInternetUrl;obj_streetPlain;obj_typeOfFlat;geo_plz;obj_noRooms;obj_thermalChar;obj_assistedLiving;obj_ityp;obj_telekomHdTelephone;geo_land;ga_cd_via;obj_telekomInternet;obj_immotype;obj_rented;obj_floor;obj_telekomInternetServices;obj_telekomInternetProductAvailable;obj_cwId;obj_purchasePrice;ga_cd_application_requirements;obj_numberOfFloors;obj_noRoomsRange;ga_cd_maillead_default_shown;obj_garden;evt_count_pm_sig;obj_barrierFree;obj_international;obj_regio3;obj_objectnumber;obj_livingSpaceRange;obj_regio2;URL;beschreibung;ga_cd_via_qualified;obj_usableArea;obj_galleryAd;obj_noParkSpaces;obj_lastRefurbish;ga_cd_developer_virtualreality;obj_project_id;obj_nbp;obj_groupnumber
2020-05-30 19:35:01.096864;Berlin;central_heating;ONE_YEAR_FREE;15409896;n;n;https://pictures.immobilienscout24.de/listings/e78a2292-b60c-40bc-8194-a1be52c698ac-1366108849.jpg/ORIG/resize/118x118%3E/extent/118x118/format/jpg/quality/80;19;10.77;40 MBit/s;telekom_layer_magenta_l;über VDSL;1986;REGULAR;10.77;117851833;natural_gas_light;y;false;MagentaZuhause L;y;Berlin;y;6;4;203;16;energy_consumption;5.67;59.81;Berlin;10115;well_kept;normal;C;false;100 MBit/s;no_information;"Novalisstra&szlig;e";n;https://padlock.link/ioml;https://padlock.link/ml;Novalisstraße;apartment;10115;3;84;n;2,active;true;Deutschland;standard;100 MBit/s;wohnung_kauf;y;3;web,email,bank,music,dl-ul,game,sd,mltstr,hd,fast-ul-dl;true;001.15357697;299000;profile0;5;3;true;n;showqualicontactform;n;n;Mitte_Mitte;nova16.032;2;Berlin;/expose/117851833;['Das Objekt Torstraße 221/ Novalisstraße 17/ 16 wurde 1996 in Wohnungseigentum aufgeteilt. Die Eigentümergemeinschaft besteht aus 37 Wohnungen + einer Gewerbefläche im EG, welche zu gastronomischen Zwecken genutzt wird.\nEinen sehr gepflegten Zustand findet man schon beim Betreten des Treppenhauses vor: Natursteintreppen mit Edelstahltreppengeländer, ein gärtnerisch angelegter Innenhof.\nDie Beheizung der Wohnungen erfolgt gaszentral, ebenso die Warmwasserversorgung. Die Eigentümergemeinschaft ist zahlungsfähig, größere Instandhaltungen stehen nicht an.', 'Die Wohnung befindet sich in der dritten Etage des Hauses. Ein Aufzug ist nicht vorhanden. Alle Zimmer sind voneinander getrennt und keine Durchgangszimmer. Genau genommen handelt es sich um eine 2,5-Zimmerwohnung, da die Fläche des einen Zimmers mit 9,99 m² als halbes Zimmer zählt. Alle Zimmer und der Flur sind mit Laminatfußboden ausgestattet. Das Duschbad ist gefliest, ebenso Boden und Wandflächen der Küche. In der Küche ist eine Durchreiche zum benachbarten Zimmer eingebaut.\nBei allen Fenstern handelt es sich um Kunststoffisolierglasfenster mit Dreh-/ Kippvorrichtung.\nDie Küche ist mitvermietet, gehört insofern zum Eigentum des Vermieters.\n\nEin Mietverhältnis mit zwei Personen begann am 01.08.2016 und ist auf unbestimmte Zeit abgeschlossen. Es handelt sich um ein Standardmietverhältnis ohne Staffel oder Indexmiete, welches zu folgenden Konditionen abgeschlossen wurde:\n\nNettokaltmiete: 711,00 €\nBetriebskosten-Vz: 103,00 €\nHeizkosten-Vz: 85,00 €\nGesamtmiete: 899,00 €\n\nAufgrund von Vorauszahlungsanpassungen beträgt die aktuelle Zahlmiete ca. 868 €.\n\nDas Mietverhältnis ist NICHT gekündigt, ein Verkauf erfolgt ausdrücklich im vermieteten Zustand.\n\nDie hierin veröffentlichten Fotos geben den Stand aus 08/2016 wieder, kurz vor der Vermietung an die jetzt in der Wohnung wohnenden Mieter.', 'Fußläufig vom U-Bahnhof Oranienburger Tor befindet sich das Grundstück Torstraße/ Novalisstraße. Selbstverständlich findet man in der Nachbarschaft alles, was man von einem Leben mitten in der City erwarten kann: Einkaufsmöglichkeiten des täglichen Bedarfs, Cafés und Restaurants sowie Freizeiteinrichtungen und eine ausgezeichnete Verkehrsanbindung.'];;;;;;;;;
2020-05-30 19:35:01.476776;Berlin;district_heating;ONE_YEAR_FREE;17689537;n;y;https://pictures.immobilienscout24.de/listings/d2454bc8-ba12-45b3-8990-d066bbd2b35d-1366120918.jpg/ORIG/resize/118x118%3E/extent/118x118/format/jpg/quality/80;15;11.14;40 MBit/s;telekom_layer_magenta_l;über VDSL;1937;REGULAR;11.14;117854399;district_heating;n;false;MagentaZuhause L;n;Berlin;y;9;1;356;67;energy_consumption;6.17;99.08;Berlin;10407;well_kept;normal;;false;100 MBit/s;no_information;"John-Schehr-Stra&szlig;e";n;https://padlock.link/ioml;https://padlock.link/ml;John-Schehr-Straße;apartment;10407;4;84.5;n;2,active;true;Deutschland;schaufenster;100 MBit/s;wohnung_kauf;n;3;web,email,bank,music,dl-ul,game,sd,mltstr,hd,fast-ul-dl;true;009.d41f4c69-eb7b-4709-b891-42c728a6b026;599000;profile0;3;4;true;n;showqualicontactform;n;n;Prenzlauer_Berg_Prenzlauer_Berg;ELV001_JSS67_B114_4Z;4;Berlin;/expose/117854399;['CHARMANTES WOHNQUARTIER AUS DEN 30ER JAHREN!\n\nInmitten einer grünen Oase befindet sich dieses entzückende Wohnquartier aus dem Jahre 1937. Hier treffen gartenstädtische Elemente und Großstadtarchitektur aufeinander. Das Wohnquartier umfasst rund 542 Wohn- und 8 Gewerbeeinheiten und bietet ausreichend Fahrradabstellmöglichkeiten. Das Gemeinschaftseigentum befindet sich in einem sehr gepflegten Zustand und wurde zuletzt im Jahre 2008/2009 instand gesetzt.', 'GROßZÜGIG | SÜDBALKONE | TOP GEPFLEGT!\n\nDiese Wohnung liegt im 3.OG und befindet sich in einem gepflegten Zustand. Sie zeichnet sich vor allem durch folgende Ausstattungsmerkmale aus:\n\n* 2 Balkone\n* Laminatfußboden\n* Gefliestes Tageslichtbad mit Badewanne \n* Gäste WC\n* Großzügig\n* Wohnküche\n* Parkähnliches Wohnen\n\nEs besteht die Möglichkeit einer Grundrissveränderung. Die Kosten für den Umbau müssen vom Käufer getragen werden. Diese Variante dient als Veranschaulichung einer Grundrissoptimierung.', 'PARKÄHNLICHES WOHNEN IN PRENZLAUER BERG!\n\nDas großzügige Wohnquartier liegt im Szenebezirk Prenzlauer Berg zwischen Kniprodestraße, Anton-Saefkow-Straße, John-Schehr-Straße, Werner-Kube-Straße sowie Rudolf-Schwarz-Straße. Der angesagte und umliegende Bötzow- und Winskiez lädt förmlich zum Ausgehen ein. Egal ob zum Frühstück, Mittagessen oder einem Glas Wein am Abend – Diese beiden Kieze haben definitiv einiges zu bieten! Familien sind hier bestens aufgehoben - vom Kindergarten bis hin zur Schule bietet der Kiez alles was man sich wünscht.\n\nDas Objekt ist hervorragend an das öffentliche Verkehrsnetz angebunden. Die S-Bahn Ring-Station (S 41/42) „Greifswalder Straße“ ist fußläufig erreichbar. Hinzu kommt die Bus/Tram-Station (200/M10) „Kniprodestraße/Danziger Straße“. Von dort aus gelangen Sie direkt zum belebten Alexanderplatz, Hauptbahnhof, Mauerpark als auch zur Warschauer Straße. Somit ist jedes Ziel in Prenzlauer Berg und Umgebung in kurzer Zeit zu erreichen. \n\nNeben der eigenen Parkanlage haben Sie noch drei weitere Erholungsmöglichkeiten in unmittelbarer Nähe. Der Ernst-Thälmann-Park und Anton-Saefkow-Park befinden sich direkt um das Wohnquartier herum und sind somit schnell zu erreichen. Der begehrte und großzügige Volkspark Friedrichshain ist ca. 0,3 km vom Wohnquartier entfernt.', 'Wir freuen uns von Ihnen zu hören und stehen für weitere Fragen und einen Besichtigungstermin selbstverständlich gern zur Verfügung!'];true;;;;;;;;
2020-05-30 19:35:01.848250;Berlin;central_heating;ONE_YEAR_FREE;17548492;n;y;https://pictures.immobilienscout24.de/listings/288f2a68-f548-4320-ac36-5dfe6cf870c5-1366117741.jpg/ORIG/resize/118x118%3E/extent/118x118/format/jpg/quality/80;9;10.3;40 MBit/s;telekom_layer_magenta_l;über VDSL;1969;REGULAR;10.3;117853833;oil;y;false;MagentaZuhause L;y;Berlin;y;6;2;;00;energy_consumption;4.2;72;Berlin;14169;fully_renovated;sophisticated;D;false;100 MBit/s;no_information;Berliner Str .;n;https://padlock.link/ioml;https://padlock.link/ml;Berliner_Str_.;no_information;14169;2;122;n;2,active;true;Deutschland;standard;100 MBit/s;wohnung_kauf;n;3;web,email,bank,music,dl-ul,game,sd,mltstr,hd,fast-ul-dl;true;009.79053bd2-257b-48d1-99d8-ca6c338aa68e;285000;profile0;3;2;true;n;showqualicontactform;n;n;Zehlendorf_Zehlendorf;20001;3;Berlin;/expose/117853833;['Hier können Sie sofort einziehen. Hochwertige Umbaumaßnahmen machen diese Wohnung zu einem Ort an dem man sich rundum wohl fühlt. Eichenparkett, indirekte Beleuchtung, modernes Badezimmer mit Doppelwaschbecken, Dusche und Badewanne, praktische Einbauschränke, hochwertige Einbauküche, Schallschutzfenster, großzügiger Sonnenbalkon mit Panoramatüren und vieles weitere mehr. 72 m² Wohnfläche verteilen sich auf Eingangsbereich, Bad, Wohnküche, Schlafzimmer, Balkon. Das Gemeinschaftseigentum befindet sich in einem guten gepflegten Zustand ohne Sanierungsstau.', 'Das 1969 erbaute Mehrfamilienhaus befindet sich in Berlin Zehlendorf Mitte.\nZahlreiche Parks, der Schlachtensee, der Wannsee oder auch der Grunewald sind in wenigen Minuten erreichbar. Geschäfte des täglichen Bedarfs sind vor Ort. Der S-Bahnhof Sundgauer Str. bietet Ihnen eine optimale Anbindung an die Berliner\nInnenstadt.'];;6;;;;;;;
2020-05-30 19:35:02.202889;Berlin;central_heating;ONE_YEAR_FREE;524594;n;y;https://pictures.immobilienscout24.de/listings/4ca6f1cf-1225-4c57-95dc-57ccd636b740-1358269660.jpg/ORIG/resize/118x118%3E/extent/118x118/format/jpg/quality/80;7;10.62;40 MBit/s;telekom_layer_magenta_l;über VDSL;1930;REGULAR;10.62;116750911;natural_gas_heavy;n;false;MagentaZuhause L;y;Berlin;y;6;1;224;10;energy_consumption;5.96;66.4;Berlin;13187;modernized;normal;;false;100 MBit/s;no_information;"Pradelstra&szlig;e";n;https://padlock.link/ioml;https://padlock.link/ml;Pradelstraße;apartment;13187;3;64;n;2,active;true;Deutschland;standard;100 MBit/s;wohnung_kauf;y;1;web,email,bank,music,dl-ul,game,sd,mltstr,hd,fast-ul-dl;true;001.524594;260000;profile0;4;3;true;y;showqualicontactform;n;n;Pankow_Pankow;116750911;3;Berlin;/expose/116750911;['3-Zimmer-Wohnung mit Balkon in ruhiger Seitenstraße im Florakiez.', 'Die Wohnung hat einen Dielenfußboden und ist an allen Fenstern mit Rollos ausgestattet. \nDas Wannenbad ist mit einem Fenster belichtet und belüftet. Die Wohnung hat einen Balkon, der vom Wohnzimmer aus zu betreten ist.', 'Die Wohnung liegt in einer ruhigen Seitenstrasse im Florakiez. Der S-Bahnhof Wollankstraße und der U-und S- Bahnhof Pankow sind nur wenige Minuten entfernt. Sämtliche Versorgungseinrichtungen des täglichen Bedarfs sind fußläufig erreichbar,  ebenso wie Freizeiteinrichtungen und der Bürgerpark Pankow.'];;66.4;;;;;;;
2020-05-30 19:35:02.724139;Berlin;no_information;ONE_YEAR_FREE;15349709;n;y;https://pictures.immobilienscout24.de/listings/1c78e211-5108-41c2-b13c-1aa98ffd7f4b-1366179735.jpg/ORIG/resize/118x118%3E/extent/118x118/format/jpg/quality/80;15;10.87;40 MBit/s;telekom_layer_magenta_l;über VDSL;1910;REGULAR;10.87;117861756;geothermal;n;false;MagentaZuhause L;n;Berlin;y;7;1;143.77;48;;5.63;63.35;Berlin;12161;no_information;no_information;;false;100 MBit/s;no_information;"Stubenrauchstra&szlig;e";n;https://padlock.link/ioml;https://padlock.link/ml;Stubenrauchstraße;apartment;12161;2;;n;2,active;true;Deutschland;standard;100 MBit/s;wohnung_kauf;y;3;web,email,bank,music,dl-ul,game,sd,mltstr,hd,fast-ul-dl;true;001.15297510;310000;profile0;4;2;true;n;showqualicontactform;n;n;Friedenau_Schöneberg;SRS48 WE17;3;Berlin;/expose/117861756;['Nicht nur als „point de vue“ zur einmündenden Eschenstrasse zieht die Stubenrauchstraße 48 die Aufmerksamkeit auf sich. Das 1910 erbaute denkmalgeschützte Haus ist ein außergewöhnlicher Zeitzeuge der Berliner Architekturgeschichte und hält für Altbauliebhaber eine seltene Gelegenheit bereit, sich die eigenen vier Wände in stark nachgefragter Wohnlage zu sichern. Das Gebäude ist stilistisch der Reformarchitektur, zeitlich der Vormoderne zugeordnet: Traditionelle Bauformen und regionale Materialien finden wieder Einzug im Wohnungsbau und das Fenster wird zum eigenständigen Gestaltungselement. Die Detailverliebtheit setzt sich im Inneren des Hauses fort. Ein roter Treppenläufer empfängt Bewohner und Besucher und bildet einen farblichen Kontrast zum wandvertäfelten Foyer in Blaugrau und Weiß. Sprossenbesetzte Oberlichter und Türluken wechseln sich mit fein gegliederten Kassettentüren und gedrechselten Treppengeländern ab. Holzornamente und Deckenmalereien im ländlichen Stil verzaubern den Betrachter und schaffen ein einladendes Ambiente. Stilgerechte Lampen in Bronze finden ihr Gegenstück in bauzeitlichen Klingel- und Türbeschlägen und ein Oberlicht im Zentrum der mehrläufigen Treppe lässt viel Licht auf vier Etagen einfallen.\nDas denkmalgeschützte Haus ist in 17 Eigentumswohnungen und eine gewerbliche Souterrain-Einheit aufgeteilt und bietet auf schön geschnittenen 46 bis 98 m² in 1-, 2- und 3-Zimmer-Wohnungen ein stilvolles Leben. In den großzügigen Zimmern finden sich zahlreiche bauzeitliche Elemente wie z.B. Stuckdecken, Kassettentüren und Dielenböden. Große Fenster lassen viel Licht in das Innere.\n\nDie zukünftige Eigentümergemeinschaft wird folgende Maßnahmen am Gemeinschaftseigentum umsetzen: Fassade, Balkone und Hauseingangstür werden denkmalgerecht instand gesetzt und neu gestrichen, die Außen- und Grünanlagen mit altem Baumbestand werden neu gestaltet.*\n\nWillkommen im „Point de vue“.', '- WE 17\n- 3. OG\n- 2 Zimmer\n- ca. 63 m²\n- Balkon\n- Kellerabteil\n- vermietet', 'Fast vergisst man, dass das urbane Berlin hinter der nächsten Straßenecke wartet, so unaufgeregt und gelassen ist Friedenau, ein Stadtteil im Bezirk Tempelhof-Schöneberg. Die Kombination aus lebendiger Leichtigkeit im Alltag und feinsinniger Kultur im Detail erklärt die Beliebtheit des Viertels. Die Kulisse des ehemaligen Villenvororts wird durch eine hohe Dichte denkmalgeschützter Häuser in verschiedensten Bauweisen geformt.\nDas Leben im Viertel gestaltet sich durch vielfältige Angebote abwechslungsreich. Der Breslauer Platz ist ein Treffpunkt für Jung und Alt. Hier findet der Wochenmarkt an drei Tagen statt. In den umliegenden Cafés und Bistros vergisst man gerne die Zeit und schaut den vorbeiziehenden Passanten zu. Die Hauptstraße, eine Verlängerung der Steglitzer Schloßstraße bietet sowohl Einkaufsmöglichkeiten für den täglichen Bedarf, wie auch Geschäfte und Boutiquen. Wem es hier zu trubelig ist, kann ebenso auf dem Südwestkorso seine Erledigungen tätigen und zwischendurch eine der kleinen Galerien oder Buchhandlungen besuchen. Im Park am Rüdesheimer Platz mit Weinbrunnen kann die Seele baumeln und der Geist neue, kreative Gedanken fassen.\nDie Infrastruktur des Viertels ist ideal: Die Verkehrsanbindung ist in alle Richtungen sehr gut, egal ob mit dem Auto, Fahrrad oder mit öffentlichen Verkehrsmitteln. Hervorragende Schulen, Sportgelegenheiten und eine hohe Dichte an Ärzten machen Friedenau zu einem begehrten Wohnort.\n\nIn Friedenau lebt es sich idyllisch und kultiviert, zurückgezogen und zugleich gesellig - mit den unzähligen Möglichkeiten der Hauptstadt Berlin vor der Tür.', 'Grundrissänderungen und Modernisierungen sind grundsätzlich genehmigungspflichtig und mit der zuständigen Behörde abzustimmen. Die Wohnungen werden im Ist-Zustand verkauft.\n\n*Hinweis: Alle geplanten Maßnahmen sind abhängig von behördlichen Genehmigungen und können\naufgrund öffentlich-rechtlicher Auflagen geändert werden oder gänzlich entfallen. Die Umsetzung\nder Maßnahmen erfolgt gemäß Kaufvertragsregelungen.'];;;disabled;;;;;;
2020-05-30 19:35:03.049758;Berlin;;ONE_YEAR_FREE;386275;n;y;https://pictures.immobilienscout24.de/listings/888d3069-327b-48b2-8af8-dc69c3058bd6-1366127414.jpg/ORIG/resize/118x118%3E/extent/118x118/format/jpg/quality/80;18;11.37;40 MBit/s;telekom_layer_magenta_l;über VDSL;1906;REGULAR;11.37;117854620;oil;y;false;MagentaZuhause L;y;Berlin;n;11;1;;no_information;energy_required;5.8;141;Berlin;10717;well_kept;sophisticated;F;false;100 MBit/s;no_information;no_information;y;https://padlock.link/ioml;https://padlock.link/ml;no_information;apartment;10717;5;174.6;n;2,active;true;Deutschland;schaufenster;100 MBit/s;wohnung_kauf;n;;web,email,bank,music,dl-ul,game,sd,mltstr,hd,fast-ul-dl;true;001.386275;1050000;profile0;6;5;true;n;showqualicontactform;n;n;Wilmersdorf_Wilmersdorf;64531;6;Berlin;/expose/117854620;"['So viele träumen davon und wir können sie hier anbieten: eine gepflegte 5 Zimmer Altbauwohnung mit Stuck, Parkett und Balkon mit dem typischen Berliner Flair und gehobener Ausstattung in bester Wilmersdorfer Lage! Schon das Vestibül und das Treppenhaus verheißen nur das Beste. Mit 141 qm, zwei Bädern mit Tageslicht, großen Altbaufenstern und Südausrichtung präsentiert sich die Wohnung in der 3. Etage hell und großzügig. Die Küche mit Einbauküche bietet ausreichend Platz für einen großen gemütlichen Esstisch. Der Balkon bietet eine besonders schöne Aussicht auf die Häuser des Kiezes. Von den Bädern ist eines mit einer Wanne ausgestattet und eines mit einer Dusche. \nVom Flur gelangt man zu drei Zimmern und der gemütlichen Wohnküche und dem Duschbad. Von der Wohnküche geht es in ein weiteres Zimmer mit direktem Zugang zum Wannenbad. \nViele schöne kleine Details schaffen die besondere Atmosphäre: Original-Türklinken, verglaste Türen, der stilvolle Fahrstuhl. Ein Kellerverschlag bietet zusätzliche Staufläche. Ein Garagenplatz in der Nähe rundet das Angebot ab. Eine Kernsanierung erfolgte 1998. Dabei wurden Bodenbeläge, Wandverkleidungen, Treppenhaus, Bäder und WCs (Fliesen und Sanitärobjekte), Heizung (Brenner, ggf. Kessel), Strom, Ab(Wasser), Heizungsleitungen und Heizkörper komplett modernisiert, teilweise Fenster (Rahmen und Isolierverglasung) und Wärmedämmung. \nHaben wir Ihr Interesse geweckt, dann melden Sie sich unter 030 - 80 19 70 93.', '- Toplage\n- wunderschöne Altbauwohnung mit Stuck\n- Originalparkett\n- Garagenplatz in der Nähe\n- Balkon mit herrlicher Aussicht\n- großzügiger Grundriss', 'Willkommen im ""Güntzelkiez"": schon fast City und trotzdem ""Wohnen mit Grün"". Das Viertel ist geprägt durch mehrere gut erhaltene Straßenzüge der Gründerzeit und die Schmuckplätze Hohenzollernplatz und Nikolsburger Platz. Wilmersdorf ist traditionell gut situiert. Es ist besonders bekannt für seine exklusiven Geschäfte und die restaurierten Häuser aus der Vorkriegszeit. Schon Marlene Dietrich, Erich Kästner und Hildegard Knef wussten den Charme Wilmersdorf zu schätzen und lebten hier. Zahlreiche Einkaufsmöglichkeiten, sowohl für den täglichen Bedarf als auch für gehobene Ansprüche stehen zur Verfügung. Der Ku\'damm und die City West sind quasi um die Ecke. (u.a. auch Europa-Center, KaDeWe, Bikini Berlin). Die Wohnlage eröffnet Ihnen ein reichliches  und breit gefächertes Angebot an  Freizeitmöglichkeiten, vielfältige Gastronomie und ein reges Kulturleben. Das Haus der Berliner Festspiele und das Kabarettzelt ""Bar Jeder Vernunft"" befinden sich an einem von viel Grün geprägten Platz. Im Preußenpark, der auch ""Thai-Park"" genannt wird, ziehen südostasiatische Imbisse Feinschmecker mit ausgefallenen Snacks und Gerichten an. Theater, Kinos und der berühmte Berliner Zoo sind nicht weit entfernt. Die Anbindung an den ÖPNV sowie an das  Straßenverkehrsnetz / Stadtautobahn ist ideal. Eine Besonderheit in Wilmersdorf sind die aufwendig gestalteten U-Bahnhöfe aus der Kaiserzeit an der Linie U3 zwischen den Stationen Hohenzollernplatz und Rüdesheimer Platz.']";true;;disabled;;;;;;
2020-05-30 19:35:03.380171;Berlin;central_heating;ONE_YEAR_FREE;17923121;n;y;https://pictures.immobilienscout24.de/listings/c1015e29-c07c-41d4-b462-a7edbb484fde-1371876480.jpg/ORIG/resize/118x118%3E/extent/118x118/format/jpg/quality/80;11;11.13;40 MBit/s;telekom_layer_magenta_l;über VDSL;2016;REGULAR;11.13;117862231;gas;y;true;MagentaZuhause L;y;Berlin;y;9;9;280;no_information;energy_required;5.02;117;Berlin;12247;mint_condition;sophisticated;;false;100 MBit/s;outside;no_information;n;https://padlock.link/ioml;https://padlock.link/ml;no_information;roof_storey;12247;3;118.6;n;2,active;true;Deutschland;top;100 MBit/s;wohnung_kauf;n;;web,email,bank,music,dl-ul,game,sd,mltstr,hd,fast-ul-dl;true;002.01008634380;595000;profile0;4;3;true;y;showqualicontactform;n;n;Lankwitz_Steglitz;43080107-01096;5;Berlin;/expose/117862231;['Es handelt sich hierbei um eine seltene, sonnendurchflutete und außerordentlich geschmackvoll renovierte Dachgeschosswohnung aus dem Jahre 2016. Das gesamte Gebäude, welches seinen Ursprung um 1900 hatte, wurde 2015/16 vollständig saniert und durch die Dachgeschosswohnung erweitert.\r\nDie Wohnung selbst befindet sich ebenfalls in einem tadellosen Gesamtzustand und bedarf keinerlei Arbeiten.\r\nSie besitzt zwei hochwertige  ausgestattete Bäder, eine  sich hervorragend in den Raum integrierte Einbauküche mit angeschlossenem Speisebereich und Zugang zur Terrasse.\r\nDurch das offene Raumkonzept und die großen Fensterfronten verfügt sie über einen traumhaften Blick in verschiedene Himmelrichtungen. Das großzügige Raumgefühl wird durch eine Deckenhöhe von bis zu ca. 3,80 m zusätzlich unterstützt. Die Möglichkeit eines Kaminofens sowie der zur Verfügung stehende Gemeinschaftsgarten und ein eigener PKW-Stellplatz vervollständigen dieses seltene Angebot.\r\nAlles in allem eine Wohnung welche keine Wünsche offen lässt.\r\nÜberzeugen Sie sich selbst!', 'Diese erstklassige Dachgeschosswohnung befindet sich im Herzen von Lankwitz zwischen Lankwitz Kirche und Alt-Lankwitz. Sämtliche Einrichtungen des täglichen Bedarfs, ÖPNV sowie Kitas und Schuen befinden sich im direkten Umfeld der Immobilie.\r\nFür ausgedehnte Spaziergänge lädt der nahe gelegene Teltowkanal  mit seinen hervorragend ausgebauten Uferwegen ein.', 'Um unsere Vermittlungsaktivitäten ausführen zu dürfen, wurden wir mittels eines qualifizierten Alleinauftrages vom Eigentümer beauftragt.\r\nWeiterführende Informationen übersenden wir Ihnen gerne per Exposé und stehen Ihnen darüber hinaus auch tel. zur Verfügung.\r\n\r\nHINWEIS: Alle Informationen, Bilder und Dateien im Exposé beruhen auf den Informationen und übergebenen Unterlagen der Verkäufer bzw. Dritter. Eine Haftung für die Angaben im Exposé kann deshalb durch uns nicht übernommen werden. Unsere Angebote sind freibleibend und unverbindlich. Zwischenverkauf und Preisänderungen bleiben ausdrücklich vorbehalten.'];;;;1;2016;;;;
2020-05-30 19:35:03.717437;Berlin;self_contained_central_heating;;7321021;n;n;https://pictures.immobilienscout24.de/listings/0d8d958f-a65e-468b-acbb-f3c2f1fbf938-1366135626.jpg/ORIG/resize/118x118%3E/extent/118x118/format/jpg/quality/80;16;11.14;;;;1898;;11.14;117856623;gas;y;false;;y;Berlin;y;6;1;130;no_information;;6.17;40;Berlin;10405;refurbished;luxury;;false;;no_information;no_information;n;;;no_information;apartment;10405;2;;n;2,active;;Deutschland;top;;wohnung_kauf;n;0;;false;001.7321021;290000;profile0;4;2;true;n;showqualicontactform;n;n;Prenzlauer_Berg_Prenzlauer_Berg;117856623;1;Berlin;/expose/117856623;['Dieses frisch sanierte Apartment befindet sich im EG eines wunderschönen Altbaus in bester „Prenzlberg-Lage“. Die Wohnung wurde frisch saniert und verfügt neben einem Schlafzimmer inkl. Einbauschrank und einer sehr hochwertigen, offenen Wohnküche über eine neue Gasetagenheizung (Fußbodenheizung), einen direkt unter der Wohnung liegenden Kellerraum und ein neues Duschbad mit Marmorfliesen. \nIm Zuge der Sanierung wurden alle Wände verspachtelt und gestrichen, komplett neuer Parkettboden mit Fußbodenheizung verlegt, ein neues Duschbad mit ital. Marmorfliesen hergestellt, eine sehr hochwertige Einbauküche aus massiver Räuchereiche und italienischem Marmor mit modernen Markengeräten(Bosch, Siemens) installiert, das Schlafzimmer mit einem funktionalen und stylischen Einbauschrank ausgestattet sowie sämtliche Stränge und Leitungen erneuert. Diese Wohnung eignet sich hervorragend für Pärchen und Singles ohne Kinder oder die möblierte Vermietung. Auch eine gewerbliche Nutzung ist möglich. \nDas Gebäude ist ein Einzeldenkmal und befindet sich in einem gepflegten Zustand. Die Sonderumlage (ca. 6.600 €) für eine geplante Strangsanierung wurde bereits bezahlt und ist eingepreist.  Die Fenster der Wohnung sind zum hellen, ruhigen Innenhof ausgerichtet und vor den Fenstern der Wohnung befindet sich eine Grünfläche mit Büschen und kleinen Bäumen, was eine sehr private und grüne Situation ergibt, wie auf den Bildern zu sehen ist.', 'Der wichtigste Faktor beim Kauf einer Immobilie ist die Lage und diese könnte in diesem Fall nicht besser sein. Diese Wohnung liegt mitten im angesagtesten Bezirk Berlins, in Prenzlauer Berg. Das Soho House ist 2 Tram Stationen entfernt, die Torstaße und der Kollwitzkiez sind „um die Ecke“ und eine Tramhaltstelle befindet sich direkt vor dem Haus. Dieser Kiez gehört zu den buntesten Gegenden Berlins. Hier finden Sie beliebte und ausgefallene Restaurants, Bars, Galerien, Shops in direkter Umgebung. Eine absolute TOP Lage.'];;;;;2019;;;;
