timestamp;obj_regio1;obj_heatingType;obj_telekomTvOffer;obj_cId;obj_newlyConst;obj_balcony;obj_picture;obj_picturecount;obj_pricetrend;obj_telekomUploadSpeed;obj_telekomTrackingGroup;obj_telekomInternetTechnology;obj_yearConstructed;obj_telekomInternetType;obj_pricetrendbuy;obj_scoutId;obj_hasKitchen;obj_ExclusiveExpose;obj_telekomInternetProductName;obj_courtage;geo_bln;obj_cellar;obj_purchasePriceRange;obj_yearConstructedRange;obj_houseNumber;obj_pricetrendrent;obj_livingSpace;geo_krs;obj_zipCode;obj_condition;obj_interiorQual;ga_cd_cxp_historicallisting;obj_telekomDownloadSpeed;obj_parkingSpace;obj_street;obj_lift;obj_telekomInternetUrlMobile;obj_telekomInternetUrl;obj_streetPlain;obj_typeOfFlat;geo_plz;obj_noRooms;obj_assistedLiving;obj_ityp;obj_telekomHdTelephone;geo_land;ga_cd_via;obj_telekomInternet;obj_immotype;obj_rented;obj_telekomInternetServices;obj_telekomInternetProductAvailable;obj_cwId;obj_purchasePrice;ga_cd_application_requirements;obj_noRoomsRange;ga_cd_maillead_default_shown;obj_garden;obj_barrierFree;obj_international;obj_regio3;obj_objectnumber;obj_livingSpaceRange;obj_regio2;URL;beschreibung;obj_firingTypes;obj_rentSubsidy;obj_energyType;obj_energyEfficiencyClass;obj_thermalChar;obj_groupnumber;obj_floor;obj_numberOfFloors;evt_count_pm_sig;obj_usableArea;obj_galleryAd;obj_lastRefurbish;ga_cd_developer_virtualreality;ga_cd_via_qualified
2020-05-30 19:33:44.904891;Berlin;no_information;ONE_YEAR_FREE;18332233;n;y;https://pictures.immobilienscout24.de/listings/177862a0-e290-4c7b-be96-887c7efb49d0-1366989569.jpeg/ORIG/resize/118x118%3E/extent/118x118/format/jpg/quality/80;3;10.29;40 MBit/s;telekom_layer_magenta_l;über VDSL;1993;REGULAR;10.29;117995665;y;false;MagentaZuhause L;y;Berlin;n;7;5;no_information;4.11;81;Berlin;12527;no_information;no_information;false;100 MBit/s;no_information;no_information;n;https://padlock.link/ioml;https://padlock.link/ml;no_information;ground_floor;12527;3;n;2,active;true;Deutschland;top;100 MBit/s;wohnung_kauf;n;web,email,bank,music,dl-ul,game,sd,mltstr,hd,fast-ul-dl;true;002.01009150487;314000;profile0;3;true;y;n;n;Grünau_Köpenick;117995665;4;Berlin;/expose/117995665;['Diese wunderschöne und lichtdurchflutete Wohnung verfügt über eine Terrasse und einen Garten. Ebenso gehört zu der Wohnung ein PKW-Stellplatz und ein Bootsliegeplatz. Sie befindet sich direkt am Wasser.', 'Schmöckwitz gehört zum Berliner Bezirk Treptow-Köpenick. Das ehemalige Fischerdorf liegt umschlossen von Wald und Wasser und ist heute ein beliebtes Naherholungsziel. Die Vorteile dieses Standortes sind ganz klar der Blick auf den Seddiner See, die Nähe vom Stadtzentrum\nBerlin (mit dem Auto 20 min) und die vorhandene gute Infrastruktur. Straßenbahn und Bus sind in wenigen Minuten zu erreichen. Dennoch erwartet Sie hier eine ruhige Wohnlage, da keine Hauptverkehrsstraßen den Standort tangieren.', 'Sie möchten den Wert Ihrer Immobilie oder Ihres Grundstücks wissen?\nSie möchten den Verkaufshorizont selbst bestimmen?\nSie möchten unkompliziert und stressfrei verkaufen? \n\nIhre Objektunterlagen sind nicht vollständig? Sie sollten bei der Vermarktung Ihrer Immobilie weder auf Glück noch auf Hoffnung setzen! \n\nBerlin First! Wir wissen wie es geht! Ihr starker und kompetenter Partner an Ihrer Seite.\n\n- Kostenfreie Wertermittlung mit Preisstrategie-Analyse\n- Diskreter Immobilienverkauf mit unserem Secret-Service \n- Kostenlose Prüfung Ihrer Immobilienunterlagen\n- Beschaffung fehlender Dokumente, die für den Immobilienverkauf von hoher Bedeutung sind \n- Sie müssen sich um nichts kümmern!\n\nInformieren Sie sich auf unserer Webseite unter http://www.berlin-first.de oder nehmen Sie telefonisch unter 030-54-86-06-90 Kontakt zu unserer Bewertungs-Hotline auf.'];;;;;;;;;;;;;;
2020-05-30 19:33:45.252624;Berlin;central_heating;ONE_YEAR_FREE;700568;n;y;https://pictures.immobilienscout24.de/listings/74af2375-63d0-4ca7-b4ce-7b93bab09aa7-1366962322.jpg/ORIG/resize/118x118%3E/extent/118x118/format/jpg/quality/80;8;12.24;40 MBit/s;telekom_layer_magenta_l;über VDSL;2004;REGULAR;12.24;118003524;y;false;MagentaZuhause L;y;Berlin;y;8;6;1;6.53;100.47;Berlin;10829;well_kept;normal;false;100 MBit/s;no_information;Gotenstrasse;y;https://padlock.link/ioml;https://padlock.link/ml;Gotenstrasse;apartment;10829;3.5;n;2,active;true;Deutschland;standard;100 MBit/s;wohnung_kauf;y;web,email,bank,music,dl-ul,game,sd,mltstr,hd,fast-ul-dl;true;001.700568;469000;profile0;3;true;n;n;n;Schöneberg_Schöneberg;118003524;4;Berlin;/expose/118003524;"['In einer sehr gepflegten, großen Altbauanlage aus der Jahrhundertwende gelegen, liegt die erst seit 2018 vermietete, geräumige und wirklich schön geschnittene Altbauwohnung, die wir hiermit zur Kapitalanlage anbieten.\n\nDas charmante Eckhaus, welches im Jahre 2000 in Wohneigentum mit 36 Einheiten umgewandelt wurde - besteht aus drei Aufgängen mit jeweils einem Aufzug.\n\nDer Aufzug zur angebotenen Wohnung, hält ein halbes Podest oberhalb der Wohnung; sie ist altersgerecht nutzbar - im EG ist der Aufzug ohne Stufen erreichbar.  \n\nDas Haus steht als Baudenkmal unter Denkmalschutz! \n\nKein Instandhaltungsrückstau - hohe Rücklagen.', 'Angeboten werden 3 helle und geräumige Zimmer, eines davon mit einem Balkon zur ruhigen Gotenstraße, mit einer geräumigen Einbauküche, mit Platz für einen kleineren Eßplatz und einem halben Zimmer. Dieses und das Wannenbad verfügen über Fenster zum Innenhof.\n\nDIE WOHNUNG IST VERMIETET - die Mieter nutzen einen Kellerverschlag.\n\nAltbaucharme mit Stuck und Dielenboden.', 'Das große, helle Eckhaus Gotenstrasse/Cheruskerstrasse ist mit seinem Turm bereits von der Schöneberger Kolonnenbrücke aus sichtbar; beide Straßen sind keine Durchfahrtstrassen - daher geht es dort noch verkehrsberuhigt zu. \n\nDie ruhige aber zentrale Lage mit der Anbindung an die S-Bahn und die nahe Regionalbahn machen dieses Angebot so interessant.', 'Die Wohnung ist vermietet - die Wohnung wird ausschließlich als Kapitalanlage angeboten. \n\nVon Makleranfragen oder direkter Kontaktaufnahme beim Mieter oder Verkäufer bitten wir abzusehen - das Objekt wird von uns im Alleinauftrag angeboten !\n\nHaben wir Interesse geweckt ?, \ndann schicken Sie uns bitte Ihre Kontaktanfrage mit Ihren Kontaktdaten; Sie erhalten dann ein ausführliches Expose. \n\nErst im darauffolgenden Schritt vereinbaren wir die  Besichtigungstermine mit den Mietern.']";oil;298;energy_consumption;NO_INFORMATION;91;4;1;5;showqualicontactform;;;;;
2020-05-30 19:33:45.594887;Berlin;no_information;ONE_YEAR_FREE;18332233;n;y;https://pictures.immobilienscout24.de/listings/e7f9733a-2de5-49d5-868d-62b624680304-1366988373.jpeg/ORIG/resize/118x118%3E/extent/118x118/format/jpg/quality/80;4;10.29;40 MBit/s;telekom_layer_magenta_l;über VDSL;1993;REGULAR;10.29;117996011;y;false;MagentaZuhause L;y;Berlin;n;7;5;no_information;4.11;88;Berlin;12527;no_information;no_information;false;100 MBit/s;no_information;no_information;n;https://padlock.link/ioml;https://padlock.link/ml;no_information;roof_storey;12527;3;n;2,active;true;Deutschland;top;100 MBit/s;wohnung_kauf;n;web,email,bank,music,dl-ul,game,sd,mltstr,hd,fast-ul-dl;true;002.01009150487;347000;profile0;3;true;n;n;n;Grünau_Köpenick;117996011;4;Berlin;/expose/117996011;['Diese wunderschöne und lichtdurchflutete Wohnung befindet sich im Dachgeschoss. Ebenso gehört zu der Wohnung ein PKW-Stellplatz und ein Bootsliegeplatz. Sie befindet sich direkt am Wasser.', 'Schmöckwitz gehört zum Berliner Bezirk Treptow-Köpenick. Das ehemalige Fischerdorf liegt umschlossen von Wald und Wasser und ist heute ein beliebtes Naherholungsziel. Die Vorteile dieses Standortes sind ganz klar der Blick auf den Seddiner See, die Nähe vom Stadtzentrum\nBerlin (mit dem Auto 20 min) und die vorhandene gute Infrastruktur. Straßenbahn und Bus sind in wenigen Minuten zu erreichen. Dennoch erwartet Sie hier eine ruhige Wohnlage, da keine Hauptverkehrsstraßen den Standort tangieren.', 'Sie möchten den Wert Ihrer Immobilie oder Ihres Grundstücks wissen?\nSie möchten den Verkaufshorizont selbst bestimmen?\nSie möchten unkompliziert und stressfrei verkaufen? \n\nIhre Objektunterlagen sind nicht vollständig? Sie sollten bei der Vermarktung Ihrer Immobilie weder auf Glück noch auf Hoffnung setzen! \n\nBerlin First! Wir wissen wie es geht! Ihr starker und kompetenter Partner an Ihrer Seite.\n\n- Kostenfreie Wertermittlung mit Preisstrategie-Analyse\n- Diskreter Immobilienverkauf mit unserem Secret-Service \n- Kostenlose Prüfung Ihrer Immobilienunterlagen\n- Beschaffung fehlender Dokumente, die für den Immobilienverkauf von hoher Bedeutung sind \n- Sie müssen sich um nichts kümmern!\n\nInformieren Sie sich auf unserer Webseite unter http://www.berlin-first.de oder nehmen Sie telefonisch unter 030-54-86-06-90 Kontakt zu unserer Bewertungs-Hotline auf.'];;;;;;;;;;;;;;
2020-05-30 19:33:45.943649;Berlin;central_heating;ONE_YEAR_FREE;164338;y;y;https://pictures.immobilienscout24.de/listings/a491ea17-94b4-49c0-a5a7-eb06027cd747-1366950752.jpg/ORIG/resize/118x118%3E/extent/118x118/format/jpg/quality/80;10;10.62;40 MBit/s;telekom_layer_magenta_l;über VDSL;2019;REGULAR;10.62;118003418;n;false;MagentaZuhause L;y;Berlin;y;7;9;no_information;5.93;56;Berlin;13187;mint_condition;sophisticated;false;100 MBit/s;no_information;no_information;n;https://padlock.link/ioml;https://padlock.link/ml;no_information;apartment;13187;2;n;2,active;true;Deutschland;top;100 MBit/s;wohnung_kauf;n;web,email,bank,music,dl-ul,game,sd,mltstr,hd,fast-ul-dl;true;001.164338;395000;profile0;2;true;n;n;n;Pankow_Pankow;AIB12872;2;Berlin;/expose/118003418;"['Es handelt sich um eine exklusive 2-Zi.-Architekten-Wohnung mit ca. 56 qm exklusiver und moderner Wohnfläche, gelegen im 3. Obergeschoss eines Neubaus aus dem Jahre 2019.\r\rDie Wohnung verfügt über 52,20 qm Nettowohnfläche ohne Terrasse. Die 8,59 qm Terrassenfläche sind zu 50 % in die Wohnflächenberechnung angerechnet worden. Somit verfügt die Wohnung über 56,50 qm Wohnfläche.\r\rDie Wohnung befindet sich in einem erstklassigen und modernen Zustand. \r\rDie Wohnung verfügt über einen offenen Eingangsbereich, ein exklusives Wohn- & Speisezimmer mit offener Küche und mit Zugang zum großzügigen Sonnenbalkon, ein modernes Badezimmer sowie ein erstklassiges Schlafzimmer.\rZu den besonderen Ausstattungsmerkmalen gehören: hochwertige Gesamtausstattung, Parkettböden, Fußbodenheizung, bodentiefe Fenster, Sonnenbalkon.\rDie Wohnung kann auch teilgewerblich genutzt werden.\rDas Haus verfügt über einen Aufzug.\rDie Wohnung ist nach Absprache bezugsfrei.', 'Eine gefragte Adresse in zentraler Lage von Berlin-Pankow – dicht Schlosspark Schönhausen! Öffentliche Verkehrsmittel, Einkaufsmöglichkeiten sowie mehrere Kindergärten befinden sich unmittelbarer Nähe. ', 'Unser Service für Eigentümer\rWir stehen Ihnen bei dem Verkauf Ihrer Immobilie vom Anfang bis zum fertigen Abschluss diskret und kompetent zur Verfügung. \rJeder Schritt erfolgt nach Absprache mit Ihnen. \rSie entscheiden über die Verkaufsstrategie Ihres Objektes, ob diskret und ""off-market"" oder eine qualifizierte Vermarktung in Print- sowie Onlinemedien. \rWir verfügen immer über den richtigen Käufer. \rZudem bewerten wir Ihre Immobilie kostenfrei, entsprechend dem aktuellen Marktwert.\rGerne beraten wir Sie kostenlos persönlich in unserem Büro, per Telefon oder per E-Mail!\rWir freuen uns von Ihnen zu hören!\rwww.immo-boerse.com']";no_information;;;;;;;4;showqualicontactform;;;;;
2020-05-30 19:33:46.273783;Berlin;central_heating;;5394580;n;y;https://pictures.immobilienscout24.de/listings/1af5543e-1740-4913-9f85-1389741962d7-1367380340.jpg/ORIG/resize/118x118%3E/extent/118x118/format/jpg/quality/80;19;14.43;;;;1957;;14.43;118007126;y;false;;n;Berlin;y;7;2;-;7.95;57.54;Berlin;13349;first_time_use_after_refurbishment;no_information;false;;no_information;Belfaster Str.;n;;;Belfaster_Str.;roof_storey;13349;2;n;2,active;;Deutschland;standard;;wohnung_kauf;n;;;001.5394580;306000;profile0;2;true;n;n;n;Wedding_Wedding;179732;2;Berlin;/expose/118007126;['Erstbezug in die unvermietete helle und freundliche 2-Zimmer-Wohnung im 3. Obergeschoß von 3 Etagen. Sofort beziehbar, vollständig saniert, neu möbliert und voll ausgestattet zur sofortigen Vermietung an zum Beispiel Geschäftsleute. \nGut geschnitten mit großem Süd-West-Balkon inmitten einer parkähnlichen Anlage. \nL-förmige Einbauküche mit Markengeräten.\nKeller und Fahrradkeller, abgeschlossener Gemeinschaftsparkplatz. \nSehr gepflegtes Haus, die meisten Wohnungen sind im Eigentum.\n\nSanierung: \n•Elektrik: alle Leitungen, Schalter und Steckdosen, Downlights, Zähler-und Verteilerkasten neu\n•Sanitär: \n Strangsanierung: Zu- und Abwasser vom Hausanschluss in die Etagen\n in der Wohnung: alle Kalt-, Warm -und Abwasserleitungen neu\n Gastherme zur Warmwasserbereitung neu. \n•Küche und Bad: alle Einbauten, Geräte, Keramik, Armaturen neu\n•Abgehangene Gipskartondecke mit energiesparenden LED- Downlights in allen Räumen. \nDimmbar in Wohn- und Schlafzimmer\n•Alle Fußböden neu. Wohn und Schlafzimmer:  Buchenparkett. \nFlur, Küche, Bad, Abstellraum: keramische Fliesen. \nBalkon: massiv Akazie auf Kunststoffroste. \n•Wände: Alle Wände neu gespachtelt und gemalt. Im Bad Fliesen raumhoch, in der Küche Fliesenspiegel.\n•Heizkörper in Bad, Küche und Wohnzimmer neu\n•TV/Telefon/Internet Strangsanierung und in der Wohnung neu, nach neuestem Standard\n•Alle Türdrücker neu\n•Innenjalousie und Gardinen in Wohn- und Schlafzimmer\n\nEs wurde darauf Wert gelegt, bei der Sanierung nur hochwertige Materialien und Geräte zu verwenden: Villeroy und Boch, Grohe, Bauknecht, Bosch, Braun, Miele, Buderus, Junkers, Gira, Hager. Buche Parkett auf Trittschaldämmung. Ich bin Architekt und habe die Sanierung selbst überwacht', 'Balkon, Keller, Duschbad, Einbauküche, Parkett, Fliesen\n\nBemerkungen:\nBad:\nGroßes Fenster mit mattiertem Glas. Begehbare Dusche bodengleich mit Glasabtrennung, Kopfbrause und Massage-Handbrause und Thermostat. Handtuchheizkörper. Waschtisch und WC in Vorsatzschale, Abgehangene Decke mit 3 LEDs. \nSchminkspiegel, Handtücher, Mülleimer, WC-Bürste, Handtuchhalter und WC Rollenhalter, Uhr, Steckdosen. \n\nKüche:\nL- Küche mit großem Fenster. Tisch mit 2 Barhockern. Abgehangene Decke mit 3 LEDs. Flächenheizkörper. Einbauküche: Unterschränke und Oberschränke. Gas Kochfeld mit 4 Flammen, Schwarz-Hartglas, automatische Zündung. Dunstabzugshaube mit Kohlefilter.  Heißluftbackofen mit 10 Funktionen. Armatur mit herausziehbarer Spülbrause. Kühl-Gefrier-Kombi Edelstahl. Geschirrspüler Silence plus 45 cm vollintegriert. Waschmaschine 7kg.\nToaster, Kaffeemaschine, Wasserkocher, Geschirr  und Gläser, Bestecke, Töpfe, Handtücher usw. \n\nWohnzimmer:\nGeräumiges und helles Wohnzimmer nach Süd-West und Zugang zum Balkon. Parkettboden Buche auf Trittschalldämmung. Abgehangene Decke mit 8 LEDs dimmbar. Schallschutzwand (RW ca. 24 dB) zum Nachbarn. Stahlregale, Glas-Sofa-Tisch, Schreibtisch, Leuchten, Teppich, Big-Sofa mit Sofakissen, Jalousien und Gardinen. Kabelanschluss.\n\nSchlafzimmer:\nGeräumiges Schlafzimmer nach Nord-Ost. Parkettboden Buche auf Trittschalldämmung. Ab-gehangene Decke mit 4 LEDs dimmbar. Boxspringbett 180cm, je 2 x Federbett und Kissen, je 2 x Allergiebett und Kissen, Nachttische, Leuchten, Teppichvorleger, Kleiderschrank, Jalousien und Gardinen.Kabelanschluss. \n\nFlur und Abstellraum:\nFliesenboden. Abgehangene Decke mit 3 LEDs. Großer Wandspiegel. Abstellraum mit Regalen und Kleiderstange. Im Abstellraum Gastherme. Staubsauger, Bodenwischer, Wäschetrockner. \n\nBalkon:\nGeräumiger, sonniger Balkon nach Süd-West. Fußboden massiv Akazie auf Kunststoffroste. Wasserablauf.', 'Zentral gelegen und doch ruhig in grüner, parkähnliche Anlage im Bezirk Mitte, Stadtteil Wedding.\nIn unmittelbarer Nähe zahlreiche Einkaufsmöglichkeiten, Cafés, Restaurants, Einkaufscenter, Banken. \nIn 4 Minuten zu Fuß zur U-Bahn-Station Afrikanische Str., und von dort mit der U- Bahn 12 Minuten in die City, U-Bahn Friedrichstr., oder in 8 Minuten mit der U-Bahn nach Alt-Tegel zum Tegeler See mit Seepromenade und Dampferanlegestelle\nFußläufig ist der Erholungspark Rehberge mit vielfältigen Sport- und Freizeitmöglichkeiten und dem Strandbad Plötzensee und in 10 Minuten mit dem Fahrrad zum Flughafensee.\nZukunftsfähig: auf dem Gelände des Flughafens Tegel, der im Oktober 2020 geschlossen wird, entsteht ein Forschungs- und Innovationspark mit Universitäten und Instituten. \nMit dem Auto ca. 5 Minuten zum Anschluss an die Stadtautobahn\n\nSONSTIGES:\nDie elektrische Anlage ist komplett neu. Schalter und Steckdosen Gira Fläche. Stromsparende LED-Downlights. Zähler- und Sicherungskasten zukunftssicher gemäß Stromnetz Berlin GmbH. Die Anlage ist überprüft und abgenommen vom Meisterbetrieb.\nGastherme vom Schornsteinfeger abgenommen.\nEigener verschließbarer Kellerraum mit Fenster und gemeinschaftlich genutzter Fahrradkeller,  abgeschlossener Gemeinschaftsparkplatz. \nBaujahr: 1957. \nDie Zentralheizungsanlage wurde 2015 erneuert und auf Erdgas umgestellt. \nKabel und Internetanschluss wurde 2016 erneuert\nWohngeld zurzeit 214,- €.\nProvisionsfrei direkt vom Eigentümer.\nFlächenberechnung: \nNach DIN 277:  Nutzfläche = 60.74 m²\nNach Wohnflächenverordnung, Balkon 50% = 57.54 m²\nInfrastruktur (im Umkreis von 5 km):\nApotheke, Lebensmittel-Discount, Allgemeinmediziner, Kindergarten, Grundschule, Hauptschule, Realschule, Gymnasium, Öffentliche Verkehrsmittel', 'Heizungsart: Zentralheizung\nEnergieträger: Gas\n\nMakleranfragen nicht erwünscht.'];gas;214;energy_required;;135.3;;3;3;showqualicontactform;60.74;disabled;;;
2020-05-30 19:33:46.793497;Berlin;no_information;ONE_YEAR_FREE;18332233;n;y;https://pictures.immobilienscout24.de/listings/c669ced7-db99-4127-a4b6-4dbd20e712ba-1366988909.jpg/ORIG/resize/118x118%3E/extent/118x118/format/jpg/quality/80;3;10.29;40 MBit/s;telekom_layer_magenta_l;über VDSL;1993;REGULAR;10.29;117995748;y;false;MagentaZuhause L;y;Berlin;n;7;5;no_information;4.11;85;Berlin;12527;no_information;no_information;false;100 MBit/s;no_information;no_information;n;https://padlock.link/ioml;https://padlock.link/ml;no_information;apartment;12527;3;n;2,active;true;Deutschland;top;100 MBit/s;wohnung_kauf;n;web,email,bank,music,dl-ul,game,sd,mltstr,hd,fast-ul-dl;true;002.01009150487;319000;profile0;3;true;n;n;n;Grünau_Köpenick;117995748;4;Berlin;/expose/117995748;['Diese wunderschöne und lichtdurchflutete Wohnung befindet sich im 1. OG. Ebenso gehört zu der Wohnung ein PKW-Stellplatz und ein Bootsliegeplatz. Sie befindet sich direkt am Wasser.', 'Schmöckwitz gehört zum Berliner Bezirk Treptow-Köpenick. Das ehemalige Fischerdorf liegt umschlossen von Wald und Wasser und ist heute ein beliebtes Naherholungsziel. Die Vorteile dieses Standortes sind ganz klar der Blick auf den Seddiner See, die Nähe vom Stadtzentrum\nBerlin (mit dem Auto 20 min) und die vorhandene gute Infrastruktur. Straßenbahn und Bus sind in wenigen Minuten zu erreichen. Dennoch erwartet Sie hier eine ruhige Wohnlage, da keine Hauptverkehrsstraßen den Standort tangieren.', 'Sie möchten den Wert Ihrer Immobilie oder Ihres Grundstücks wissen?\nSie möchten den Verkaufshorizont selbst bestimmen?\nSie möchten unkompliziert und stressfrei verkaufen? \n\nIhre Objektunterlagen sind nicht vollständig? Sie sollten bei der Vermarktung Ihrer Immobilie weder auf Glück noch auf Hoffnung setzen! \n\nBerlin First! Wir wissen wie es geht! Ihr starker und kompetenter Partner an Ihrer Seite.\n\n- Kostenfreie Wertermittlung mit Preisstrategie-Analyse\n- Diskreter Immobilienverkauf mit unserem Secret-Service \n- Kostenlose Prüfung Ihrer Immobilienunterlagen\n- Beschaffung fehlender Dokumente, die für den Immobilienverkauf von hoher Bedeutung sind \n- Sie müssen sich um nichts kümmern!\n\nInformieren Sie sich auf unserer Webseite unter http://www.berlin-first.de oder nehmen Sie telefonisch unter 030-54-86-06-90 Kontakt zu unserer Bewertungs-Hotline auf.'];;;;;;;1;;;;;;;
2020-05-30 19:33:47.143666;Berlin;central_heating;ONE_YEAR_FREE;285466;n;y;https://pictures.immobilienscout24.de/listings/fef6ff38-d8c2-4e45-b859-a23708d827a1-1366974950.jpg/ORIG/resize/118x118%3E/extent/118x118/format/jpg/quality/80;10;11.44;40 MBit/s;telekom_layer_magenta_l;über VDSL;1958;REGULAR;11.44;118006191;n;false;MagentaZuhause L;y;Berlin;y;3;2;52;5.62;41.69;Berlin;12105;no_information;no_information;false;100 MBit/s;no_information;"Rathausstra&szlig;e";n;https://padlock.link/ioml;https://padlock.link/ml;Rathausstraße;apartment;12105;1;n;2,active;true;Deutschland;standard;100 MBit/s;wohnung_kauf;y;web,email,bank,music,dl-ul,game,sd,mltstr,hd,fast-ul-dl;true;001.285466;128900;profile0;1;true;n;n;n;Mariendorf_Tempelhof;118006191;2;Berlin;/expose/118006191;['Die Wohnung ist sowohl als Kapitalanlage als auch ggf. für einen Eigennutzer geeignet. Das Haus ist seit langem in Wohneigentum aufgeteilt, es besteht kein Kündigungsschutz oder Vorkaufsrecht für den Mieter.\n\nDas Haus ist in einem ausgesprochen guten Gesamtzustand, die Instandhaltung wurde regelmäßig und fortwährend durchgeführt.\n\nBad 2013 vollständig modernisiert, Fenster und Balkontür in 2004 erneuert, Fußboden von der Vormieterin mit Laminat ausgelegt.', 'Kaltmiete: 300,17 €\nNebenkosten:111,78 €\nHausgeld: ca. 170,26 €\nNicht umlagefähigen Kosten pro Monat ca. 60,00 € (ca. 720,00 €/Jahr)', 'Das Haus liegt in der Nähe vom Volkspark Mariendorf. In unmittelbarer Umgebung finden sich auch vielfältige Einkaufsmöglichkeiten, Schulen und Kindergärten, sowie öffentliche Verkehrsmittel, wie z.B. die U6 & U-Bahnhof Alt-Mariendorf.', 'Bei Interesse an unserem Objekt erreichen Sie mich unter meiner e Mail Adresse:\ntaskulak@millennium-immobilien.de \noder unter meiner Mobilnummer:\n+49162-2107245\n\nMit freundlichen Grüßen \n\nMillennium Immobilien\nVolkan Taskulak'];oil;170.26;energy_consumption;;133;;2;4;showqualicontactform;;;;;
2020-05-30 19:33:47.472618;Berlin;district_heating;ONE_YEAR_FREE;18027065;n;y;https://pictures.immobilienscout24.de/listings/492ce723-094c-4a6b-8f85-bd99ddf8b58b-1358941650.jpg/ORIG/resize/118x118%3E/extent/118x118/format/jpg/quality/80;7;11.3;40 MBit/s;telekom_layer_magenta_l;über VDSL;1904;REGULAR;11.3;116810850;y;false;MagentaZuhause L;n;Berlin;y;11;1;no_information;5.73;370;Berlin;10629;refurbished;luxury;false;100 MBit/s;no_information;no_information;y;https://padlock.link/ioml;https://padlock.link/ml;no_information;apartment;10629;10;n;2,active;true;Deutschland;standard;100 MBit/s;wohnung_kauf;n;web,email,bank,music,dl-ul,game,sd,mltstr,hd,fast-ul-dl;true;009.9233d0ff-ce69-47de-ab6b-2b67a0fbd406;5400000;profile0;5;true;n;n;n;Charlottenburg_Charlottenburg;116810850;7;Berlin;/expose/116810850;['Experimentieren Sie die Exklusivität eines vollständig renovierten Altbau-Vollgeschoßes in der besten Lage von Berlin-Charlottenburg:  eine ruhige Einbahn- & Seitenstraße, eine Gehminute vom Kürfurstendamm, dem Großen Boulevard des Berliner Westens, entfernt.\n\nBei der Renovierung wurden in jedem Aspekt und in jedem kleinen Detail die höchstmöglichen Qualitätsstandards angewandt. Von der bereits großen klassischen Fassade im wilhelminischen Stil bis hin zum Kunstwerk im Deckenstuck oder der marmorierten Lobby bietet die Immobilie die einzige Möglichkeit, ein vollwertiges Wohnhaus der Spitzenklasse in Berlin zu erwerben. Sehen Sie sich die Bilder unten an, um die großen, hell erleuchteten Räume sowie die Eigenschaften der Böden, der Ausstattung und der Geräte zu sehen. Es handelt sich hier um Visualisierungen der Dsigner Collecccion Alexandra.', 'Königliche Deckenhöhen', 'Kleine Einbahnstrasse nahe Meyerinckplatz', 'Turnkey Renderings for Visualization'];no_information;;;;;;2;6;showqualicontactform;370;;2015;;
