timestamp;obj_regio1;obj_heatingType;ga_cd_via_qualified;obj_telekomTvOffer;obj_cId;obj_newlyConst;obj_balcony;obj_picture;obj_picturecount;obj_pricetrend;obj_telekomUploadSpeed;obj_telekomTrackingGroup;obj_telekomInternetTechnology;obj_yearConstructed;obj_telekomInternetType;obj_pricetrendbuy;obj_scoutId;obj_firingTypes;obj_hasKitchen;obj_ExclusiveExpose;obj_telekomInternetProductName;obj_courtage;geo_bln;obj_cellar;obj_purchasePriceRange;obj_yearConstructedRange;obj_rentSubsidy;obj_houseNumber;obj_energyType;obj_pricetrendrent;obj_livingSpace;geo_krs;obj_zipCode;obj_condition;obj_interiorQual;ga_cd_cxp_historicallisting;obj_telekomDownloadSpeed;obj_parkingSpace;obj_street;obj_lift;obj_telekomInternetUrlMobile;obj_telekomInternetUrl;obj_streetPlain;obj_typeOfFlat;geo_plz;obj_noRooms;obj_thermalChar;obj_assistedLiving;obj_groupnumber;obj_ityp;obj_telekomHdTelephone;geo_land;ga_cd_via;obj_telekomInternet;obj_immotype;obj_rented;obj_floor;obj_telekomInternetServices;obj_telekomInternetProductAvailable;obj_cwId;obj_purchasePrice;ga_cd_application_requirements;obj_numberOfFloors;obj_noRoomsRange;ga_cd_maillead_default_shown;obj_garden;evt_count_pm_sig;obj_barrierFree;obj_international;obj_regio3;obj_objectnumber;obj_livingSpaceRange;obj_regio2;URL;beschreibung;obj_usableArea;obj_energyEfficiencyClass;obj_noParkSpaces;obj_galleryAd;obj_telekomHybridUploadSpeed;obj_telekomHybridDownloadSpeed;ga_cd_developer_virtualreality;obj_project_id;obj_lastRefurbish;obj_nbp
2020-05-30 19:48:05.708628;Berlin;district_heating;true;ONE_YEAR_FREE;76007;n;y;https://pictures.immobilienscout24.de/listings/5c2c8685-a6db-4b20-991b-b3484457d137-1369910737.jpg/ORIG/resize/118x118%3E/extent/118x118/format/jpg/quality/80;12;12.78;40 MBit/s;telekom_layer_magenta_l;über VDSL;2013;REGULAR;12.78;115945459;district_heating;y;true;MagentaZuhause L;y;Berlin;y;8;8;293.45;no_information;energy_required;7.25;81;Berlin;10785;mint_condition;no_information;false;100 MBit/s;no_information;no_information;y;https://padlock.link/ioml;https://padlock.link/ml;no_information;ground_floor;10785;3;46;n;9101;2,active;true;Deutschland;premium;100 MBit/s;wohnung_kauf;n;1;web,email,bank,music,dl-ul,game,sd,mltstr,hd,fast-ul-dl;true;001.76007;450000;profile0;7;3;true;n;showqualicontactform;n;n;Tiergarten_Tiergarten;68573;4;Berlin;/expose/115945459;"['Bitte vervollständigen Sie das Anfrageformular mit Ihrem Namen, um ein ausführliches Exposé mit Lagebezeichnung zu erhalten und ggf. einen Besichtigungstermin zu vereinbaren. Herzlichen Dank!\r\n\r\nDie hier exklusiv von uns zum Kauf angebotene Eigentumswohnung befindet sich in einem modernen, ca. im Jahr 2013 errichteten Wohnensemble.\r\nDas Mehrfamilienhaus wurde nach dem aktuellen Standard der Energieeinsparungsverordnung erbaut. Es verfügt über eine bemerkenswert hochwertige Ausstattung, so dass Sie lange Freude an Ihren eigenen vier Wänden haben.\r\n\r\nDie Echtholz-Parkettböden schaffen ein angenehmes Raumklima und ein wohliges Gefühl im gesamten Wohnraum. Das Bad mit Fußbodenheizung ist mit einer bodentiefen Dusche und Badewanne sowie hochwertiger Sanitärkeramik ausgestattet. Holzfenster mit Dreifachverglasung lassen die Wohnräume mit reichlich Licht durchfluten. Die Wohnfläche von ca. 81 m² teilen sich auf in einen großzügigen Wohn- und Essbereich mit offener Küche, zwei weitere Zimmer, eine Diele sowie ein Bad. Die genaue Raumaufteilung entnehmen Sie bitte dem beigefügten Grundriss.\r\n\r\nDie Wohnung verfügt als ""Gartenwohnung"" über eine abgeschlossene große Terrasse und Gartenfläche, wo Kinder unbeschwert und sicher spielen können.\r\nEinbruchsicherheit und Brandschutz sorgen dafür, dass Sie sich zuhause ganztägig rundum wohl und sicher fühlen:\r\nNur die Bewohner und Ihre Gäste haben Zutritt zum Quartier. Videogegensprechanlagen, Türspione, abschließbare Fensteroliven und Rollläden geben zusätzliche Sicherheit.\r\n\r\nDie Heizung und auch die Warmwasserversorgung der gesamten Anlage werden über Fernwärme gewährleistet. \r\nDas monatlich zu zahlende Wohngeld beläuft sich auf ca. 293,45 EUR inklusive Heizkosten und Instandhaltungsrücklage.', 'Die Liegenschaft befindet sich im Herzen von Berlin-Mitte, im Ortsteil Tiergarten, in der Nähe vom Potsdamer Platz. Der Bezirk, der alles hat - internationales Flair, Kulturangebote, Shoppingmeilen und Plätze zum Genießen. Kinos, zahlreiche gute Restaurants und Hotels, mehrere Theater und Museen zeigen den Stellenwert dieses Bezirkes. Die Immobilie befindet sich im begehrten und zentral gelegenen Lützowviertel, wenige Minuten entfernt befinden sich das wieder entstandene Botschaftsviertel und der wunderschöne Tiergarten-Süd sowie Philharmonie, Kulturforum und Sony Center. Schulen und Kindertagesstätten sind ebenfalls in der Nähe. Verschiedene U-Bahnstationen sowie die S-Bahn sind in wenigen Minuten zu Fuß zu erreichen. Busverbindungen sind ebenfalls fußläufig erreichbar und bringen Sie in alle Richtungen. In wenigen Minuten sind Sie in der Friedrichstraße, am Potsdamer Platz, am Kurfürstendamm und am Zoologischen Garten. Eine ruhige und dennoch sehr zentrale Lage.']";;;;;;;;;;
2020-05-30 19:48:06.180170;Berlin;district_heating;true;;18052783;n;n;https://pictures.immobilienscout24.de/listings/bd70d271-65d3-4f39-9ba2-5c2a6ef1e399-1367205519.jpg/ORIG/resize/118x118%3E/extent/118x118/format/jpg/quality/80;12;11.37;;;;1953;;11.37;115964251;no_information;n;false;;n;Berlin;y;6;2;163.85;28,28a;energy_required;5.8;57;Berlin;10707;first_time_use_after_refurbishment;no_information;false;;no_information;"Konstanzer Stra&szlig;e 54/ Z&auml;hringer Stra&szlig;e";n;;;Konstanzer_Straße_54/_Zähringer_Straße;ground_floor;10707;2;81.8;n;3;2,active;;Deutschland;premium;;wohnung_kauf;n;;;;002.01008679649;296500;profile0;6;2;true;n;showqualicontactform;n;n;Wilmersdorf_Wilmersdorf;497892;2;Berlin;/expose/115964251;"['Die sonnige im Erdgeschoss gelegene 2-Zimmer-Wohnung hat einen idealen Grundriss; geräumiges Wohnzimmer, ein Schlafzimmer, separate Küche und Fensterbad. Unser Projekt UP WEST ist ein Eckhaus aus dem Jahr 1953 und befindet sich in Wilmerdorf der City West.\r\n\r\nIn diesem Projekt wurde das Dachgeschoss neu ausgebaut und die Bestandswohnungen saniert.', 'Effizient geschnittene 2-Zimmer Wohnung im Erdgeschoss\r\n\r\n-    Top Saniert\r\n-    Moderner Ausbaustand\r\n-    Tagesbelichtetes Wannenbad\r\n-    Türsprechanlage\r\n-    Tiefgarage optional\r\n-    Exzellente Lage in Seitenstraße vom Kurfürstendamm Naherholungsgebiete nicht weit entfernt\r\n-    Provisionsfrei', 'Einkaufs- und Ausgehmeile, Forschungszentrum, Kulturstandort, Wohnquartier und Handelszentrum – die City West vereint eine Vielzahl an Nutzungen. Früher als Neuer Westen ein Synonym für die ""Goldenen Zwanziger Jahre"" ist die City West heute ein mindestens genauso bedeutendes Pendant zu Mitte. Faszinierende Bauprojekte der letzten Jahre wie das Bikini-Haus mit dem Zoo-Palast, das Upper West oder das Zoofenster, in dem das Luxushotel Waldorf Astoria zu finden ist, prägen heute das neue Stadtbild der City West. Wer hier wohnt, ist immer am Puls der Zeit.\r\nWer vor oder nach der Arbeit gerne noch eine Runde joggen geht, hat den Preußenpark direkt vor der Haustür.\r\nVor allem in den Sommermonaten verwandelt sich dieses kleine Idyll in den Thaipark, wo Liebhaber der thailändischen Küche auf ihre Kosten kommen.\r\n\r\nDie Mikrolage um die Konstanzer Straße punktet durch ihre exzellente Anbindung. \r\n-    Bushaltestelle direkt vor der Tür\r\n-    7 min Fußweg zum Kurfürstendamm\r\n-    300 m zur U-Bahn-Station ""Konstanzer Str.""\r\n-    250 m zum Preußenpark\r\n-    10 Minuten mit der U-Bahn zum S+U-Bahnhof Zoologischer Garten\r\n-    15 Minuten zum Hauptbahnhof\r\n-    30 Minuten zum Flughafen Tegel']";57;C;;;;;;;;
2020-05-30 19:48:06.551581;Berlin;central_heating;;ONE_YEAR_FREE;5284893;n;y;https://pictures.immobilienscout24.de/listings/20a5e42f-db6c-4700-9c40-9574536dd33f-1352603347.jpg/ORIG/resize/118x118%3E/extent/118x118/format/jpg/quality/80;12;9.68;40 MBit/s;telekom_layer_magenta_l;über VDSL;1996;REGULAR;9.68;115964052;natural_gas_light;n;false;MagentaZuhause L;y;Berlin;n;8;5;264;8;energy_consumption;5.44;88;Berlin;13158;no_information;no_information;false;100 MBit/s;outside;An der Vogelweide;n;https://padlock.link/ioml;https://padlock.link/ml;An_der_Vogelweide;roof_storey;13158;3;89.7;n;1;2,active;true;Deutschland;top;100 MBit/s;wohnung_kauf;y;3;web,email,bank,music,dl-ul,game,sd,mltstr,hd,fast-ul-dl;true;001.5284893;410000;profile0;3;3;true;n;showqualicontactform;n;n;Rosenthal_Pankow;AnderVogelweide;4;Berlin;/expose/115964052;['Ihre neue Wohnung, im Dachgeschoss einer im Jahre 1996 errichteten aus 88 Wohnungen bestehenden Wohnanlage besticht durch ihre hervorragende Aufteilung und der Südausrichtung von Terrasse und Wohnzimmer.\nDie Wohnung ist äußerst gepflegt und sehr gut vermietet.'];;;1;;;;;;;
2020-05-30 19:48:06.931529;Berlin;central_heating;true;ONE_YEAR_FREE;362872;n;n;https://pictures.immobilienscout24.de/listings/c50ce933-b944-46ad-a6e8-f9203ae3bbaf-1353341629.jpg/ORIG/resize/118x118%3E/extent/118x118/format/jpg/quality/80;11;11.73;40 MBit/s;telekom_layer_magenta_l;über VDSL;1958;REGULAR;11.73;115917923;oil;n;true;MagentaZuhause L;y;Berlin;y;4;2;176.5;no_information;energy_consumption;5.75;46.4;Berlin;12167;well_kept;no_information;false;100 MBit/s;no_information;no_information;n;https://padlock.link/ioml;https://padlock.link/ml;no_information;no_information;12167;2;148.32;n;;2,active;true;Deutschland;premium;100 MBit/s;wohnung_kauf;y;;web,email,bank,music,dl-ul,game,sd,mltstr,hd,fast-ul-dl;true;001.362872;179011;profile0;;2;true;n;showqualicontactform;n;n;Steglitz_Steglitz;3617/WE2;2;Berlin;/expose/115917923;"['Das 4-geschossige Wohn- und Geschäftshaus aus den 60er-Jahren in Berlin-Steglitz präsentiert sich in einem gepflegten Zustand. Die 2015 erneuerte Fassade prägt den Charakter des Mehrfamilienhauses. Zum Verkauf stehen eine Gewerbeeinheit sowie sechs Wohneinheiten, welche mit praktisch geschnittenen Grundrissen für Singles sowie Paare als auch junge Familien geeignet sind. \n\nDie renovierte, im Hochparterre gelegene Wohnung verteil sich auf ca. 46 m² Wohnfläche und profitiert von einem kompakten Tageslichtbad sowie von zwei hellen Wohn- und Schlafzimmern. \n\nDie Wohnung ist seit dem 01.03.2019 vermietet. Die monatliche Nettokaltmiete beträgt 603,02 Euro. Die Anmeldung von Eigenbedarf sollte unter Berücksichtigung der gesetzlichen Auflagen und unter Einhaltung der vertraglich vereinbarten Kündigungsfrist möglich sein. Ob die Voraussetzungen im Einzelfall vorliegen, ist von dem Käufer in eigener Verantwortung zu prüfen. Für den Mieter besteht kein gesetzliches Vorkaufsrecht.\n', 'gepflegtes Wohn- und Geschäftshaus\nvermietete Wohnung\nruhiger Innenhof\nTageslichtbad mit Wanne\nLaminatboden\nvermietet seit 01.03.2019\nkein gesetzliches Vorkaufsrecht\nkeine Sperrfrist ', ""Die Birkbuschstraße blickt als eine der ältesten Straßen des Ortsteils Steglitz auf eine lange Historie zurück und ist heute eine wichtige Verbindungsachse vom Rathaus Steglitz zur südlichen Siemensstraße in Lankwitz. Weiter nördlich des Rathauses mündet die Birkbuschstraße in der populären Schloßstraße – der wohl wichtigsten Shopping- und Flaniermeile Berlins nach dem Ku'damm. Das Projekt ++Kurze1++ liegt nur rd. 800 m entfernt und verfügt mit der Buslinie 186 über eine direkte Verbindung zu vielen modernen Shopping-Centern, Kaufhäusern und einem stetig wachsenden kulinarischen Angebot. Anwohner schätzen neben der sehr guten Anbindung zu den Zentren Berlins – sei es über die nahegelegene Stadtautobahn oder die gute S- und U-Bahn-Anbindung am nahegelegenen Rathaus – vor allem die gute Infrastruktur und die hohe Dichte an Grünflächen. So laden in unmittelbarer Nachbarschaft der Bäkepark und der Stadtpark Steglitz zu ausgedehnten Spaziergängen ein und bieten mit mehreren Spielplätzen ein familienfreundliches Umfeld. Der Uni Campus der FU Berlin, der Charité Campus Benjamin Franklin und generell die hohe Lebensqualität des Bezirks Steglitz-Zehlendorf machen die Lage auch zunehmend für junge Leute attraktiv. ""]";;E;;disabled;;;;;;
2020-05-30 19:48:07.263016;Berlin;no_information;;ONE_YEAR_FREE;43448;n;n;https://pictures.immobilienscout24.de/listings/2052106b-f14d-413a-9044-b7baf0258ab6-1352627999.jpg/ORIG/resize/118x118%3E/extent/118x118/format/jpg/quality/80;8;12.78;2,4 MBit/s;telekom_layer_magenta_m_hybrid2;über Hybrid;1910;WITH_HYBRID;12.78;115966390;district_heating;n;false;MagentaZuhause M Hybrid (2);y;Berlin;y;6;1;;39;energy_consumption;7.25;81;Berlin;10553;refurbished;normal;false;16 MBit/s;no_information;"Rostockerstra&szlig;e";n;https://padlock.link/mmh2sa;https://padlock.link/mmhy2;Rostockerstraße;apartment;10553;3;75;n;;2,active;true;Deutschland;top;50 MBit/s;wohnung_kauf;y;4;web,email,bank,music,dl-ul,game,sd,mltstr,hd;true;001.43448;291600;profile0;;3;true;n;showqualicontactform;n;n;Tiergarten_Tiergarten;115966390;4;Berlin;/expose/115966390;['Die hier Angebotene 3 Zimmer Wohnung befindet sich im 4. OG eines 5 Stöckigen Wohnhauses.\nSie befindet sich im Vorderhaus und ist teilsaniert.\nDie Wohnung ist aktuell vermietet mit einer Nettokaltmiete von 5744 p.a.', 'eine gute Verkehrsanbindung ist mit dem S-Bhf. Beusselstraße gegeben der in ca. 6 Minuten (550 Meter) zu Fuß zu erreichen.\nVon dort besteht Anschluss an S41, S42, S46 und Buslinien 106, 123, N26 und TXL.\nCafés, Restaurants und Einkaufsmöglich-keiten sind vor der Haustür.\nSchulen, Spielplätze und Ärzte befinden sich in direkter Umgebung.', 'Anschauen lohnt sich!\nLassen Sie sich von uns beraten! Grundrisse und weiter Informationen erhalten Sie von uns auf Anfrage.\nReservieren Sie am besten heute noch einen persönlichen Besichtigungstermin!'];;C;;;10 MBit/s;50 MBit/s;;;;
2020-05-30 19:48:07.623274;Berlin;no_information;;ONE_YEAR_FREE;5398072;n;y;https://pictures.immobilienscout24.de/listings/78c91358-e336-4f3b-bba4-b768c18e1855-1366008054.jpg/ORIG/resize/118x118%3E/extent/118x118/format/jpg/quality/80;9;11.37;40 MBit/s;telekom_layer_magenta_l;über VDSL;;REGULAR;11.37;115948189;no_information;y;false;MagentaZuhause L;y;Berlin;y;6;;297;no_information;;5.8;68.6;Berlin;14197;well_kept;normal;false;100 MBit/s;no_information;no_information;n;https://padlock.link/ioml;https://padlock.link/ml;no_information;apartment;14197;2;;n;;2,active;true;Deutschland;standard;100 MBit/s;wohnung_kauf;n;2;web,email,bank,music,dl-ul,game,sd,mltstr,hd,fast-ul-dl;true;001.5398072;297500;profile0;4;2;true;n;showqualicontactform;n;n;Wilmersdorf_Wilmersdorf;12SB19227;3;Berlin;/expose/115948189;['Diese weitläufige 2-Zimmer-Wohnung mit 68,6 Quadratmeter Wohnfläche und Balkon befindet sich im ersten Obergeschoss eines gepflegten Mehrfamilienhaus aus den 1970er Jahre.\r\nArchitektonisch überrascht das Gebäude mit einer außergewöhnlichen Form, denn auf dem Eckgrundstück schließt das Gebäude seitlich an ein älteres Wohnhaus an, während zur anderen Seite eine Auffahrt zu den rückseitig angeordneten Garagen führt.\r\nHelle Fassaden, große Fenster und ein Flachdach sorgen für den gewünschten modernen Look der Zeit.\r\nEin schmaler Vorgarten trennt das Gebäude vom Bürgersteig und der Straße. Auf der Rückseite sorgt der Blick in den begrünte Innenhof des Blocks für eine entspannende Idylle.\r\nAuch die offerierte Wohnung zeigt zum ruhigen Hof. Über wenige Stufen erreichen Sie die 2-Zimmer-Wohnung. Sie zeichnet ein funktionaler Grundriss aus, denn idealerweise gehen alle Zimmer einzeln vom Flur ab. \r\nDas Herzstück bildet der Living Room.\r\nBodentiefe breite Fenster geben den Blick auf die Umgebung frei. Größe und Schnitt des Raumes lassen es zu, dass Sie sowohl einen Essbereich als auch einen gemütlichen Sofabereich einrichten können.\r\nUnd auf dem anschließenden Balkon lässt es sich vom Alltag entspannen.\r\nNeben dem Living Room befindet sich das angenehm proportionierte Schlafzimmer mit Blick ins Grüne.\r\nDas Wohnangebot runden das Badezimmer und die Küche ab. \r\nZur Ausstattung gehört die im modernen Stil gehaltene Einbauküche. Sie verfügt über Ceran-Kochfeld, Backofen, Spüle und reichlich Stauraum. Bei der Küche sorgen helle Fliesen, Parkett und das Fenster für einen wohnlichen Eindruck. Das Badezimmer verfügt über eine Badewanne, ein Handwaschbecken und hellen Fliesen in Standardausführung.\r\nZur Wohnung gehört ein Kellerabteil und ein Stellplatz. Insgesamt haben Sie bei diesem Objekt eine ungewöhnlich großzügige 2-Zimmer-Wohnung, die sowohl als Erst- als auch Zweitwohnsitz geeignet ist.\r\n\r\n', 'Die Bushaltestelle gleich vor dem Haus, einen großen Supermarkt vis-á-vis und fußläufig zur Haupteinkaufsstraße von Schmargendorf gelegen, bietet die Lage den idealen Ausgangspunkt für die City-West und kurze Wege bei der Erledigung der täglichen Dinge.\r\nMit dem eigenen Auto oder den öffentlichen Verkehrsmitteln erreichen Sie schnell die Innenstadtbezirke aber ebenso sind es nur wenige Fahrminuten bis zur Freien Universität, nach Dahlem Dorf und auch in den Grunewald.\r\nDas unmittelbare Wohnfeld prägen Mehrfamilienhaus aus unterschiedlichen Epoche, denn während die ältesten Gebäude aus der Gründerzeit stammen, entsteht mit dem Maximilians Quartier in der Nachbarschaft das neueste Wohnprojekt der Groth Gruppe. \r\nDas gehobene Neubauquartier wird die Lage nachhaltig aufwerten. \r\n\r\nVom angebotenen Objekt sind es sechs Autominuten bis zum Kurfürstendamm. Bis zum Potsdamer Platz brauchen Sie gut 15 Minuten mit dem Auto und bis zum Alexanderplatz circa 25 Minuten. Ebenfalls gut zu erreichen ist die beliebte Schloßstraße in Steglitz, wo Sie neben zahlreichen Geschäften, Shopping-Center und Kaufhäusern auch Fitnessclubs und Kinos haben. Im Kleinformat finden Sie auch alles fast vor der Haustür. Entlang der Einkaufsstraße von Schmargendorf haben Sie familiengeführte Einzelhändler und auch Marken wie Blume 2000, DM, Deutsche Bank, Sparkasse sowie auch Bio-Bäcker, eine Eisdiele, Apotheke und weitere Geschäfte. Ferner gibt es zahlreiche Ärzte. \r\n\r\nIn Schmargendorf vollzieht sich der Übergang vom städtischen Wohnen im nördlich gelegenen Charlottenburg-Wilmersdorf und dem südlich angrenzenden Villenviertel Dahlem. Es ist eine ruhige und gepflegte Wohnlage, die alle Altersgruppen anspricht. Neben der schnellen Erreichbarkeit der Hot-Spots der Hauptstadt, sind Sie von hier schnell im Grunewald. Eine Radtour zum Grunewaldsee oder nach Dahlem-Dorf bietet eine schöne Abwechslung zum Alltag. Ebenso ist die Nähe zur Freien Universität ein weiterer Pluspunkt dieser Wohnlage. \r\n\r\n'];;;1;;;;;;;
2020-05-30 19:48:07.964483;Berlin;self_contained_central_heating;;ONE_YEAR_FREE;18052783;n;n;https://pictures.immobilienscout24.de/listings/d3118f25-dc1b-4135-8a44-2459e0e2d0c8-1369126733.jpg/ORIG/resize/118x118%3E/extent/118x118/format/jpg/quality/80;10;14.46;40 MBit/s;telekom_layer_magenta_l;über VDSL;1900;REGULAR;14.46;113806413;no_information;n;false;MagentaZuhause L;n;Berlin;y;7;1;177.07;3a;energy_required;8.67;73.03;Berlin;13349;no_information;no_information;false;100 MBit/s;no_information;"Ofener Stra&szlig;e";n;https://padlock.link/ioml;https://padlock.link/ml;Ofener_Straße;apartment;13349;2;143.4;n;18;2,active;true;Deutschland;standard;100 MBit/s;wohnung_kauf;n;1;web,email,bank,music,dl-ul,game,sd,mltstr,hd,fast-ul-dl;true;002.01008679649;310000;profile0;4;2;true;n;showqualicontactform;n;n;Wedding_Wedding;498486;3;Berlin;/expose/113806413;"['Die 49 Wohneinheiten dieses schönen, fünfgeschossigen Altbau-Eckhauses sind zwischen ca. 28 m² und 76 m² groß, verfügen über ein bis vier Zimmer und liegen entweder im Vorderhaus oder im Seitenflügel. Die Wohnungen sind mit einem Kellerabteil und größtenteils mit einem Balkon ausgestattet.\r\nDes Weiteren liegen im Erdgeschoss insgesamt vier vermietete Gewerbeeinheiten, die ebenfalls zum Verkauf stehen.', 'Easy living \r\n\r\nDas ""Schillereck"" liegt im Englischen Viertel der Hauptstadt und damit nur wenige Gehminuten von der Müllerstraße entfernt. Da findet man alle Dinge des täglichen Bedarfs: Super- und Biomärkte, Drogerien, Apotheken, Banken, Ärzte uvm. In der Genter Straße gibt es mittwochs und samstags einen Wochenmarkt, wo man sich günstig mit Gemüse, Obst, Brot etc. versorgen kann. \r\nKindergärten, Kitas und Schulen findet man ebenfalls in der unmittelbaren Nachbarschaft.\r\nIn drei Minuten läuft man zur U-Bahn-Station Rehberge., von dort erreicht man mit der U6 in 13 Minuten die Friedrichstr., Unter den Linden und die Humboldt-Universität. Vom U-Bahnhof Leopoldplatz fährt außerdem die U9, diese bringt einen in neun Minuten in die City West.\r\n\r\nCentral living\r\n\r\nMit seiner Lage im Wedding punktet das ""Schillereck"" – der Ortsteil gehört zum Bezirk Mitte und wie der Name schon sagt: hier ist man mittendrin! So liegt zum Beispiel der für seine vielen Restaurants, Bars und Cafés bekannte Sprengelkiez nur wenige Blöcke entfernt, so dass man zu Fuß in 15 min vor Ort ist. Was kulinarische Genüsse angeht, kann der Sprengelkiez locker mit den bekannten ""Fresskiezen"" in Neukölln, Friedrichshain oder Kreuzberg mithalten. Ob tamilisch, koreanisch, mexikanisch oder gluten-free: Foodies finden hier ihr Glück!\r\n\r\nHappy living\r\n\r\nWer seine Freizeit gerne mit Aktivitäten draußen verbringt, lebt im ""Schillereck"" genau richtig: Der Volkspark Rehberge liegt in perfekter Laufdistanz und hier kann man herrlich seine Runden im Grünen drehen. \r\nShoppingfreunde werden entweder schon um die Ecke auf der Müllerstraße fündig oder sind mit der U-Bahn in 13 Minuten an der Friedrichstraße. \r\nDie Anbindungen von der Glasgower Straße und die kurzen Distanzen sind ideal, so dass man auch ganz schnell am Plötzensee ist, falls man dort im Freibad am Nachmittag noch Freunde treffen will. Den Abend ausklingen lassen kann man im Wedding auch an vielen Ecken. Entweder man besucht eine der authentisch Alt...']";;;;;;;true;;;
2020-05-30 19:48:08.309899;Berlin;heat_pump;;;15899186;n;y;https://pictures.immobilienscout24.de/listings/148d52e5-32fa-4559-95dd-456c667f1c6b-1215339339.jpg/ORIG/resize/118x118%3E/extent/118x118/format/jpg/quality/80;11;14.35;;;;2017;;;105271367;geothermal;y;false;;y;Berlin;y;5;9;;15;;;37.51;Berlin;13597;first_time_use;sophisticated;false;;no_information;"Altst&auml;dter Ring";y;;;Altstädter_Ring;apartment;13597;1;;n;;2,active;;Deutschland;top;;wohnung_kauf;n;2;;false;002.01005033525;225000;profile0;6;1;true;y;showqualicontactform;y;n;Spandau_Spandau;WE19-Verkauf;1;Berlin;/expose/105271367;['Bei diesem Wohnhaus handelt es sich um einen exklusiven Neubau, welcher im Mai 2018 fertiggestellt wurde. Es sind 45 hochwertige Eigentumswohnungen entstanden. Zur Auswahl stehen Ihnen großzügig geschnittene 1-bis 2-Zimmerapartmens mit ca. 20m² bis ca. 45m² sowie 3 bis4-Zimmer Penthouses als Maisonetten mit ca. 68m² bis ca. 73m², Hohe Türen, große Fenster mit entspannendem Blick ins Grüne und Sonnenlicht durchflutete, offene Räume erwarten Sie. Die Wohnungen sind nach Süd/Osten und Westen ausgerichtet und verfügen überwiegend über einen eigenen Balkon oder eine Terrasse zum gemütlichen Verweilen an der frischen Luft. Die Ausstattung in Ihrer Wohnung ist edel: In den Bäder befinden sich hochwertige Fliesen. Toiletten, Waschbecken, Bodentiefe Duschwannen namhafter Hersteller, die verchromten Armaturen von der Firma Grohe. Ganz nach Ihren Vorlieben haben Sie die Wahl zwischen zahlreichen Designs. Die Wohnräume ohne Fliesenbelag sind mit hellem Eichenparkett ausgestattet. Jeder Wohnraum verfügt über eine angenehme Fußbodenheizung, die Bäder zusätzlich über Handtuchheizkörper. Zu den Altstadt Studios gehört für alle Parteien ein gemeinsamer Garten im Innenhof sowie zu jeder Wohnung ein eigener Keller. Und nicht nur Ihr Bedürfnis nach einem komfortablen Zuhause wird in diesem Objekt bedient. Auch KfW-55 energieeffizientes, grünes Wohnen ist bei uns Programm.', 'Der Altstädter Ring bietet als Wohnort ein perfektes Rundum-Paket: beste Verkehrsanbindung ins Berliner Zentrum bei gleichzeitigem Altstadtflair und wohltuender Naturnähe. Die zahlreichen Einkaufsmöglichkeiten, Cafés, Restaurants, Märkte und kulturellen Angebote verleihen der Spandauer Altstadt einen lebendigen urbanen Charme.\nNeben kleineren Läden in der Altstadt gibt es ganz in der Nähe die Spandauer Arcaden, ein Einkaufszentrum mit vielfältigen Shopping-Möglichkeiten. Gleichzeitig sind es aber nur wenige Gehminuten bis ans Havelufer, wo man bei einem Spaziergang ausspannen kann. Mit dem S- und U-Bahnhof Rathaus Spandau in unmittelbarer Nähe ist zudem eine praktische Anbindung zur Uni, zum Job sowie zu den Sehenswürdigkeiten und Hotspots der City gewährleistet. Diese besondere Mischung macht die Moritzstraße in Spandau zum per fekten Wohnort für alle, die auf nichts verzichten wollen. Ob Studentenwohnung oder Eigenheim für Singles, viele Menschen wünschen sich heutzutage eine Wohnsituation, die beides bietet: Großstadtleben und Wohnidylle. Was den Kiez um die Moritzstraße neben der guten Infrastruktur so besonders macht, ist der Traditions- und Geschichtsreichtum der Umgebung.\nOb es das historische Stadtbild ist oder die nahegelegene Zitadelle mitsamt integrierter Arbeitsateliers von Künstlern, Handwerkern und Instrumentenbauern, überall spürt man das kulturelle, traditionsbewusste Leben.', 'Schauen Sie sich unser Video an.\n\nEbenfalls stehen noch weitere Wohnungen zum Verkauf zur Verfügung.\n\nFragen Sie uns einfach!'];37.51;;;;;;;88643;2018;true
