2020-05-30 19:38:27.878702;Berlin;central_heating;18492745;n;y;https://pictures.immobilienscout24.de/listings/ac76303e-e473-40ef-af61-5afca09e40b6-1371447665.jpg/ORIG/resize/118x118%3E/extent/118x118/format/jpg/quality/80;18;12.01;1980;;;12.01;117304215;geothermal;n;false;y;Berlin;y;8;3;no_information;7.88;82.28;Berlin;10969;no_information;normal;false;no_information;no_information;y;no_information;apartment;10969;3;n;2,active;Deutschland;standard;wohnung_kauf;n;4;;true;002.01009366216;430000;profile0;5;3;true;n;y;n;Kreuzberg_Kreuzberg;FI-10170;4;Berlin;/expose/117304215;['Zum Verkauf steht eine sehr gut geschnittene Eigentumswohnung in herausragender Wohnlage von\r\nBerlin im angesagten Szenebezirk Kreuzberg. U- + S-Bahn befinden sich im nahen Umfeld. Der\r\nStandort kann mit Recht im innerstädtischen Bereich zu den besten Wohnadressen gezählt werden.\r\n„Hier zu wohnen“ bedeutet den Puls einer Metropole zu spüren.\r\nDas Wohnhaus wurde 1982 im geförderten Wohnungsbau errichtet, die Mittel sind bereits\r\nabgelöst, die Nachfrist läuft zum 31.12.2023 ab. Das Treppenhaus wurde 2013 überarbeitet.\r\nSie gelangen über einen innenliegenden Fahrstuhl zu Ihrer Wohnung. Die Wohnung hat ca.\r\n82m², die sich über 3 Zimmer verteilen. \r\n\r\nZu der Wohnung gehört ein Keller. Die Wohnung wird im Ist-Zustand verkauft.\r\nDas Haus wird mit Fernwärme beheizt. \r\n', 'Die Wohnungen befinden sich in unmittelbarer Nähe zum Jüdischen Museum. Desweiteren\r\nbefinden sich die Theatermanufaktur und das Hebbeltheater, sowie mehrere Museen, z.B. das\r\nHaus am Checkpoint Charlie und die Berlinsche Galerie in fußläufiger Entfernung. Das Tempodrom und der international bekannte Martin-Gropius-Bau, als zentraler Ausstellungsort, machen diese Umgebung zur reizvollen Adresse im kulturellen Bereich.\r\nDesweiteren erreichen Sie binnen 10 Minuten Fußweg die Friedrichstraße. Auch die stadtbekannte Bergmannstraße mit der populären Marheinekehalle (Markthalle) ist mit dem Fahrrad in\r\n10 Minuten erradelt.\r\nZum Spazieren oder joggen lädt der nahe Landwehrkanal ein, laufen Sie zum Urbanhafen\r\nmit seinen großen Wiesen und dann zurück durch den Böckler-Park.\r\nViele Cafés und Restaurant befinden sich rund um das Objekt, sodaß für jeden Geschmack etwas dabei ist. \r\n', 'Sie wollen besichtigen?\r\n\r\nDas ermöglichen wir gerne - mit Gesichtsmaske und mind. 1,50 Meter Abstand.'];ONE_YEAR_FREE;40 MBit/s;telekom_layer_magenta_l;;über VDSL;REGULAR;;MagentaZuhause L;305.58;energy_consumption;;100 MBit/s;https://padlock.link/ioml;https://padlock.link/ml;122;;true;100 MBit/s;web,email,bank,music,dl-ul,game,sd,mltstr,hd,fast-ul-dl;showqualicontactform;;;;;
2020-05-30 19:38:28.455061;Berlin;central_heating;2999742;n;n;https://pictures.immobilienscout24.de/listings/0eaf6df1-7aed-4de6-bf11-799d246f820f-1363039158.jpg/ORIG/resize/118x118%3E/extent/118x118/format/jpg/quality/80;19;16.53;1930;;;16.53;117295023;district_heating;n;false;y;Berlin;y;4;1;130;9.26;48.06;Berlin;12049;need_of_renovation;normal;false;no_information;Kienitzer Str.;n;Kienitzer_Str.;ground_floor;12049;2;n;2,active;Deutschland;top;wohnung_kauf;n;0;;true;001.2999742;185000;profile0;5;2;true;n;n;n;Neukölln_Neukölln;Kienitzer Str. 130,,;2;Berlin;/expose/117295023;['Es handelt sich hierbei um eine 2 Zimmerwohnung in der Kienitzer Str. 130 in 12049 Berlin.\n\nDie Wohnung muss vollständig saniert werden aber dafür kann man seine eigenen Vorstellungen verwirklichen.\n\nDas Haus macht einen sehr gepflegten Eindruck und der große Hinterhof ist fast im gesamten für die Gemeinschaft nutzbar. Die Heizungsanlage ist laut Energieausweis aus dem Jahre 2006. Die Eigentümergemeinschaft besteht aus 109 Einheiten.\n\nInstandhaltungsrücklage per 31.12.2019 = 398.937,43 €', '- 2 Zimmer, Küche sowie Flur wahrscheinlich versehen mit Dielen\n- gefliestes Badezimmer mit Badewanne \n- Isofenster\n- Jalousien\n- Wechselsprechanlage\n- Kabelanschluss\n- Telefonanschluss\n- Keller', 'Kienitzer Str. 130\n\n- 2 min zum Herrfurthplatz\n- 1 min Fußweg zum ehemaligen Flugfeld Tempelhof\n- ideale Anbindung an den öffentlichen Nahverkehr (U-Bahnhof Leinestr.)\n- in 4 Minuten zur Autobahn\n- Freizeitmöglichkeiten jeglicher Art sind gegeben\n- Einkaufsmöglichkeiten für den täglichen Bedarf fußläufig erreichbar\n- später auch ideal für die Vermietung von möbliertes Wohnen', 'Falls wir Ihr Interesse geweckt haben sollten, würden wir uns freuen, Ihnen die Einheit mit weiteren Informationen oder auch einen Besichtigungstermin vorzustellen.\n\nErreichbar sind wir unter der Rufnummer 030-948 50 998 oder direkt mit dem Ansprechpartner Herrn Luck, Rufnummer 0176 32223 598.\n\nDie Informationen sind Informationen des Verkäufers. Trotz gewissenhafter Erstellung des Exposés können Irrtümer vorkommen. Wir möchten Sie darauf hinweisen, dass wir eine Haftung ausdrücklich ausschließen.\n\nWir freuen uns über Ihre Kontaktaufnahme!\n\n++++ Gern verkaufen wir auch Ihre Immobilie ++++ Sprechen Sie uns einfach an ++++'];ONE_YEAR_FREE;40 MBit/s;telekom_layer_magenta_l;;über VDSL;REGULAR;;MagentaZuhause L;210.49;energy_consumption;;100 MBit/s;https://padlock.link/ioml;https://padlock.link/ml;151;1;true;100 MBit/s;web,email,bank,music,dl-ul,game,sd,mltstr,hd,fast-ul-dl;;;;;2020;
2020-05-30 19:38:28.931160;Berlin;self_contained_central_heating;16373664;n;y;https://pictures.immobilienscout24.de/listings/e1d50ecc-5d9c-492a-81af-ea173b45457c-1360137987.jpeg/ORIG/resize/118x118%3E/extent/118x118/format/jpg/quality/80;31;10.76;;;;10.76;116927644;natural_gas_heavy;n;false;y;Berlin;y;6;;no_information;6.07;94;Berlin;13595;well_kept;no_information;false;no_information;no_information;n;no_information;apartment;13595;4;n;2,active;Deutschland;top;wohnung_kauf;y;2;;true;002.01007242417;296777;profile0;;4;true;n;n;n;Spandau_Spandau;116927644;4;Berlin;/expose/116927644;['Diese gemütliche Wohnung mit einer geschickten Raumaufteilung wird Ihnen gefallen. \nVom geraden Flur erreichen Sie alle Räume. Hier ist auch Platz für eine Garderobe und einen Schuhschrank. \nDie Küche bietet ausreichend Raum für die Zubereitung der Mahlzeiten und eine Eßecke. Bequem lagern Sie in der Vorratskammer in der Küche Ihre Vorräte. Das Fenster in Südausrichtung sorgt für viel Licht.\n\nDas geflieste Badezimmer mit WC ist gemütlich und mit einer Dusche und WC ausgestattet.\nDas helle Kinder - oder Arbeitszimmer in Südausrichtung befindet sich nebenan.\n\nGegenüber vom Kinderzimmer befindet sich das Elternschlafzimmer mit Balkon. \n\nDas große Wohnzimmer mit Balkon Nebenan sowie weiteres Arbeits- oder Kinderzimmer runden diese Wohnung ab.', 'Bad mit Dusche\n Balkon\n Speisekammer\n Böden: Fliesenboden, Linoleum, Teppichboden\n Kunststofffenster\n Zustand: gepflegt', 'Diese Wohnung befindet sich in einer städtischen Lage mit viel Grün. \nFlächenmäßig der viertgrößte Berliner Bezirk, besticht Spandau durch seine Vielzahl an Grünflächen, Wäldern und Gewässern!\nHauptsehenswürdigkeiten sind die Zitadelle, die St. Nikolai Kirche, die historische Altstadt, das Luftwaffenmuseum und die Sternwarte. \nUmgeben von Wald- und Wasserflächen ermöglicht der Berliner Stadtteil Spandau, viele Möglichkeiten der Freizeitgestaltung. \nSchulen, Kindergärten, Ärzte, Schwimmhallen und eine Supermarkt (290 m) sind bequem auf kurzen Wegen zu erreichen. Die gute Anbindung des ÖPNV mit den Bushaltestellen in der Umgebung bringt Sie schnell zu den Spandauer Arcaden oder zum S- und U-Bahnhof Rathaus Spandau. In nur acht Gehminuten sind Sie bereits im benachbarten Südpark und am Grimnitzsee. In 15 bis 20 Gehminuten gelangt man zum Pichelssee, Scharfe Lanke und Stößensee. Spazieren, Rudern, Angeln und Segeln ist möglich. Hier präsentiert sich ein ideales und vielfältiges Naherholungsgebiet.', 'Besichtigungen finden nach Vereinbarung mit dem Mieter statt.\n\nIch bitte Sie um vorherige Anmeldung. \n\nDanke.\n\n\n\nAlle hier gemachten Angaben beruhen auf Auskünften des Verkäufers, für die keine Haftung übernommen wird. \n\n\n\nDer Makler-Vertrag mit Tobias Schmidt Immobilien kommt durch schriftliche Vereinbarung oder durch die Inanspruchnahme unserer Maklertätigkeit auf der Basis des Objekt-Exposés und seiner Bedingungen zustande. \n\nDie Käufercourtage in Höhe von 7,14 %% auf den Kaufpreis einschließlich gesetzlicher Mehrwertsteuer ist bei notariellem Vertragsabschluss verdient und fällig. \n\n\nIch freue mich auf Ihre Kontaktaufnahme! \n\nSchmidt Immobilien \n\nTelefon: 06237 / 917 11 60'];ONE_YEAR_FREE;40 MBit/s;telekom_layer_magenta_l;8;über VDSL;REGULAR;;MagentaZuhause L;333;;;100 MBit/s;https://padlock.link/ioml;https://padlock.link/ml;;;true;100 MBit/s;web,email,bank,music,dl-ul,game,sd,mltstr,hd,fast-ul-dl;showqualicontactform;;;;;
2020-05-30 19:38:29.802173;Berlin;central_heating;16640094;n;n;https://pictures.immobilienscout24.de/listings/cae5b1fc-43f4-4308-a3a9-6e19ba394ad3-1363074011.jpg/ORIG/resize/118x118%3E/extent/118x118/format/jpg/quality/80;16;14.32;1920;;;14.32;117299510;gas;y;false;y;Berlin;y;6;1;34;8.36;59.16;Berlin;13353;fully_renovated;sophisticated;false;no_information;"Br&uuml;sseler Str.";n;Brüsseler_Str.;apartment;13353;3;n;2,active;Deutschland;standard;wohnung_kauf;n;4;;true;001.16144842;285000;profile0;;3;true;n;n;n;Wedding_Wedding;ETW - 430;2;Berlin;/expose/117299510;['Diese hübsche Wohnung befindet sich im Hinterhaus im 4. Obergeschoss eines Altbauhauses aus dem Jahre 1920.  Diese gut geschnittene Wohnung ist in einem renovierten Zustand und mit Holzlaminatboden ausgestattet. Sie gelangen direkt in den großzügigen Wohn- &  Essbereich mit Zugang zur offenen Küche mit Einbauküche und Elektrogeräten. Des weiteren gibt zwei Schlafzimmer und ein modernes Badezimmer mit begehbarer Dusche. Ein Kellerraum bietet zusätzlichen Stauraum. Sämtliche Elektrogeräte, sowie alle Möbel und der Fernseher sind im Preis enthalten und die Wohnung ist ab sofort bezugsfrei. Eine komfortable Wohnung in die man theoretisch sofort einziehen kann!', '- Renovierter Zustand\n- Offene Einbauküche mit Elektrogeräten\n- Modernes Badezimmer mit begehbarer Dusche\n- Holzlaminat-Fußboden\n- Möbel und Elektrogeräte sind im Preis enthalten', 'Die Wohnung befindet sich in der Brüsseler Str. 34 in einer beliebten Kiezlage Weddings leicht nördlich des Berliner Schifffahrtskanal. Im Süden liegen die Ortsteile Moabit und Tiergarten, südöstlich liegt das Herz der Stadt, der Bezirk Mitte. Nicht nur deswegen hat diese Lage auch viel Potenzial zum Wachstum. Die Wohnung befindet in einer international geprägten Gegend mit überwiegend Mehrfamilienhäusern aus der Gründerzeit. Der nahe gelegene Volkspark Rehberge mit dem Plötzensee im Westen sowie der riesige Tiergarten im Süden bietet Ihnen genügend Raum für erholsame Spaziergänge und sportliche Aktivitäten. Es gibt eine große Auswahl an internationalen Läden, Cafés und Restaurants. Eine Vielzahl an Einkaufsmöglichkeiten für den täglichen Bedarf befinden sich in unmittelbarer Nähe. Die Anbindung an die öffentlichen Verkehrsmittel ist hervorragend. Der U-Bhf Amrumer Straße und diverse Buslinien sind in wenigen Gehminuten zu erreichen.'];ONE_YEAR_FREE;40 MBit/s;telekom_layer_magenta_l;;über VDSL;REGULAR;0;MagentaZuhause L;264;energy_consumption;F;100 MBit/s;https://padlock.link/ioml;https://padlock.link/ml;158;;true;100 MBit/s;web,email,bank,music,dl-ul,game,sd,mltstr,hd,fast-ul-dl;showqualicontactform;;;;;
2020-05-30 19:38:30.164987;Berlin;district_heating;15372281;y;y;https://pictures.immobilienscout24.de/listings/d7e08ca5-c71d-4852-ba9a-6806294b411b-1363125381.jpg/ORIG/resize/118x118%3E/extent/118x118/format/jpg/quality/80;4;10.71;2020;disabled;86973;10.71;117308417;no_information;n;false;n;Berlin;y;9;9;9D;5.2;96.56;Berlin;12437;first_time_use;sophisticated;false;no_information;Eichbuschallee;y;Eichbuschallee;no_information;12437;4;n;2,active;Deutschland;standard;wohnung_kauf;n;;true;false;001.15320047;545000;profile0;5;4;true;n;n;n;Plänterwald_Treptow;EBA/9D/25;4;Berlin;/expose/117308417;"['Das Neubauprojekt ""Wohnen am Plänterwald"" überzeugt durch seine neoklassizistische Architektur und die gehobene Ausstattung der 62 Wohnungen. Durchdachte und vielseitige Grundrisse mit Größen von rund 53 bis 123 m² bzw. von 2 bis 4 Zimmern sind die ideal geeignet für Familien, Paare oder Singles. Die Wohnungen im Gartengeschoss verfügen über große Terrassen und Privatgärten. In den oberen Etagen ermöglicht die aufwendige, teilweise gestaffelte Architektur ebenfalls große Balkone oder Terrassen für jede Wohnung.\n\nIn Treptow ergänzen sich Natur und modernes Leben zu einer spannenden Verbindung, ohne dass man auf die Vorzüge des pulsierenden Metropolenlebens verzichten muss.\n\nAn alles ist gedacht worden: ein gemütliches Wohn-/Esszimmer mit großem Süd-Balkon, ein moderner Küchenbereich, drei helle Schlafzimmer, ein ansprechendes Wannenbad und ein separates Duschbad sowie ein Hauswirtschaftsraum. Alle Zimmer bieten dabei weitreichende Ausblicke auf viel Grün.\n', '- Echtholzparkett in den Wohn- und Schlafräumen\n- energiesparende Fußbodenheizung\n- Feinsteinzeug in den Bädern\n- Sanitärobjekte und Armaturen von Markenherstellern\n- Elektrische Rollläden an allen Fenstern\n- 3-Fach-Verglasung der z.T. bodentiefen Fenster\n- Großzügiger Balkon\n- KfW-55 Energie-Effizienzhaus (EnEV 2016)\n- Aufzug in alle Etagen\n- Abgeschlossener Müllraum\n- Fahrradabstellplätze für jede Wohnung\n- Tiefgaragenstellätze (Ladestationen möglich)\n', 'Auf der einen Seite viel Grün und entspannende Ruhe. Auf der anderen Seite ist man ruckzuck im Zentrum Berlins - ob mit dem Fahrrad, dem Auto oder den öffentlichen Verkehrsmitteln. Die S-Bahnhöfe Plänterwald und Baumschulenweg sind fußläufig in wenigen Minuten zu erreichen. Doch das Hinsetzen in der Bahn lohnt kaum, denn innerhalb von zwei Stationen befindet man sich im quirligen Kiezleben von Friedrichshain, Neukölln oder Kreuzberg.\n\nPlänterwald: 50 Meter zu Fuß\nSpreeufer: 500 Meter zu Fuß\nTreptower Park: 5 Min mit dem Fahrrad\nMediaspree: 10 Min mit dem Fahrrad\nBahnhof Ostkreuz: zwei Stationen mit den öffentlichen Verkehrsmitteln\nAlexanderplatz: 23 Min mit den öffentlichen Verkehrsmitteln\nFriedrichstraße: 27 Min mit den öffentlichen Verkehrsmitteln\nHauptbahnhof: 30 Min mit den öffentlichen Verkehrsmitteln\nKurfürstendamm: 40 Min mit den öffentlichen Verkehrsmitteln\nFlughafen Tegel: 30 Min mit dem Auto\nFlughafen BER: 22 Min mit dem Auto', 'Der Verkauf erfolgt für den Käufer provisionsfrei!\n\nBeratungstermine in unserem Info-Pavillon vor Ort sind nach individueller Vereinbarung weiterhin möglich!\n\nAngaben nach EnEV: Energieausweis befindet sich in der Erstellung.\n\nÄnderungen und Irrtümer vorbehalten. Das Bild- und Planmaterial dient zum Teil der vorläufigen Illustration des Vorhabens. Insbesondere die Visualisierungen o. ä. sind unverbindlich und zeigen teilweise Sonderausstattungen und Einrichtungen, die als Möblierungsvorschläge zu verstehen sind.\n']";;;;;;;;;;;;;;;;;;;;;;;;;
2020-05-30 19:38:30.502696;Berlin;central_heating;4338188;n;y;https://pictures.immobilienscout24.de/listings/162f1a29-0182-4191-bf1a-2b8d8cd925bc-1363053394.jpg/ORIG/resize/118x118%3E/extent/118x118/format/jpg/quality/80;8;12.1;1974;disabled;;12.1;117296741;no_information;n;false;y;Berlin;n;7;3;no_information;7.07;77;Berlin;12157;no_information;no_information;false;no_information;no_information;y;no_information;no_information;12157;3;n;2,active;Deutschland;top;wohnung_kauf;n;;;true;001.4338188;360000;profile0;;3;true;n;n;n;Schöneberg_Schöneberg;100001;3;Berlin;/expose/117296741;['Diese einmalige Wohnung besticht durch seine Offenheit, einer sehr zentralen Lage, sowie dem sonnigen Balkon. Vom Wohnzimmer gelangen Sie in die zwei weiteren Zimmer, sowie ins Badezimmer. Der traumhafte Balkon ist über das Wohnzimmer zu betreten und lädt zum Entspannen, sowie durch die südliche Ausrichtung jederzeit zum Sonnen ein. Die Einbauküche bietet genügend Fläche zum gemeinsamen Kochen mit der Familie und Freunden.\n\nDer Energieverbrauchsausweis gibt folgende Werte an\nWesentlicher Energieträger ist: Öl\nEnergiekennwert: E Energieverbrauchswert: 140,36 kWh/(m2.a)\n\nHabe ich Ihr Interesse geweckt? Gerne vereinbare ich einen Besichtigungstermin mit Ihnen. Matthias Petersen, ImmoSky Deutschland GmbH.', 'Berlin-Steglitz bietet neben viel Grünflächen auch eine sehr gute Infrastruktur und ist ein sehr zentral liegender Bezirk in Berlin. Die lebhafte Schloßstraße, eine der wichtigsten Shopping- und Flaniermeilen in Berlin, ist in nur wenigen Minuten fußläufig erreichbar. Dort finden Sie diverse Geschäfte, Anbindungen an die öffentlichen Verkehrsmittel, Restaurants und gemütliche Cafés. \n'];ONE_YEAR_FREE;40 MBit/s;telekom_layer_magenta_l;;über VDSL;REGULAR;;MagentaZuhause L;;energy_consumption;;100 MBit/s;https://padlock.link/ioml;https://padlock.link/ml;140;;true;100 MBit/s;web,email,bank,music,dl-ul,game,sd,mltstr,hd,fast-ul-dl;showqualicontactform;;;;;
2020-05-30 19:38:30.846129;Berlin;district_heating;15832933;n;y;https://pictures.immobilienscout24.de/listings/220f683e-a760-4044-b5bc-840016d2b2ac-1363087183.jpg/ORIG/resize/118x118%3E/extent/118x118/format/jpg/quality/80;6;11.24;1960;disabled;;11.24;117301557;district_heating;n;false;y;Berlin;n;4;2;56;6.2;43;Berlin;10717;well_kept;no_information;false;no_information;"Pfalzburger Stra&szlig;e";y;Pfalzburger_Straße;apartment;10717;1;n;2,active;Deutschland;premium;wohnung_kauf;n;1;;true;001.15612808;199950;profile0;4;1;true;n;n;n;Wilmersdorf_Wilmersdorf;967;2;Berlin;/expose/117301557;['Das Haus in der Pfalzburger Straße 56 wurde 1960 erbaut. Die zum Verkauf stehende Wohnung verfügt über einen Südbalkon und ist bezugsfrei. Großflächige Fenster und die Ausrichtung sorgen für viel Licht. Der zweckdienliche und moderne Schnitt nutzt die  Wohnfläche optimal aus. Die Wohnung verfügt zudem über ein Tageslichtbad. Der Einheit wird ein Keller zugeordnet. Der Zugang zur Wohnung erfolgt über ein Laubengang, ein Aufzug hält der Etage. Verkäuferseits wurde die Fassadenrückseite kürzlich instandgesetzt. Die Beheizung erfolgt per Fernwärme.', 'Südbalkon, Tageslichtbad, praktischer Schnitt, Aufzug', 'Die Pfalzburger Straße 56 befindet sich 2 Kilometer vom Kurfürstendamm entfernt. Das Stadtviertel ist bekannt für seine gewachsenen Strukturen, gute Altbausubstanz und vor allem auch für seine üppige Kunst- und Kulturlandschaft. Zahlreiche Sehenswürdigkeiten, Parks, Geschäfte und Freizeitaktivitäten machen es auch für Touristen zu einem beliebten Ziel. Der U-Bhf Hohenzollerdamm mit der Linie U3 und die Straßenbahnlinie M19 sind in 5 Gehminuten und die Bushaltestelle Güntzelstraße/Uhlandstraße in 3 Gehminuten erreicht. Der bekannte Preußenpark, auch „Thaipark“ genannt, befinden sich in fußläufiger Entfernung. Er lockt nicht nur Erholungssuchende, sondern bietet auch kulinarische Genüsse. Ringsherum um die Pfalzburger Straße gibt es mehrere Bildungs- und Sportangebote, sowie Arztpraxen. Schnell erreicht sind auch gemütliche Cafés und Restaurants.', 'Dieses Kaufangebot ist provisionspflichtig. Dem Erwerber wird bei Abschluss eines Kaufvertrages eine Provision in Höhe von 3,57 % des beurkundeten Kaufpreises inkl. der gesetzlichen MwSt. berechnet. Abweichungen sind nur in Form einer gesonderten, schriftlichen Vereinbarung gültig. Die Neo Res Immobilien GmbH ist Rechnungsstellerin und Empfängerin der Provision. Irrtum und Zwischenverkauf sind vorbehalten. Alle Informationen und Unterlagen sind uns von Seiten des Verkäufers übermittelt und werden ohne Haftung für Vollständigkeit oder Fehlinformationen von uns weitergeleitet. Hinsichtlich weiterer Dienstleistungen in Zusammenhang mit dem Erwerb, wie beispielsweise Finanzierungen oder entsprechende Versicherungen unterstützen wir Sie gerne. Es ist uns leider nicht gestattet, Sie zu steuerrelevanten Aspekten zu beraten. Hierzu wenden Sie sich bitte an Ihren Steuerberater, beziehungsweise werden wir auch in diesem Zusammenhang gerne vermittelnd tätig. Es gelten unsere AGB. Bitte informieren Sie sich über deren Inhalt auf unserer Homepage www.neo-res.de.'];ONE_YEAR_FREE;40 MBit/s;telekom_layer_magenta_l;;über VDSL;REGULAR;;MagentaZuhause L;190.64;energy_consumption;E;100 MBit/s;https://padlock.link/ioml;https://padlock.link/ml;157;;true;100 MBit/s;web,email,bank,music,dl-ul,game,sd,mltstr,hd,fast-ul-dl;showqualicontactform;;;;;true
2020-05-30 19:38:31.256125;Berlin;self_contained_central_heating;18268340;n;n;https://pictures.immobilienscout24.de/listings/316b7b3c-aed5-430d-8b1f-3cd09215c829-1363162455.jpg/ORIG/resize/118x118%3E/extent/118x118/format/jpg/quality/80;19;12.01;;;;12.01;117314634;gas;n;false;y;Berlin;y;6;;no_information;7.88;45;Berlin;10999;refurbished;sophisticated;false;no_information;no_information;n;no_information;raised_ground_floor;10999;2;n;2,active;Deutschland;standard;wohnung_kauf;n;0;;true;002.01009016528;275000;profile0;;2;true;n;n;n;Kreuzberg_Kreuzberg;117314634;2;Berlin;/expose/117314634;"['Sehr geehrte Damen und Herren, Grüße Sie\n\nAttraktive Wohn-Geschäfts Immobilie | Eigentumswohnung mit Gewerblicher 2in1 Nutzung \nMöglichkeit, Bezugsfrei ab sofort (VB)\n\ndas OBJEKT \nim Hochparterre eines gepflegtem Kreuzberger Mehrfamilienhauses befundene 2x Zimmer Wohnung mit + Gewerblicher Nutzung, als Laden Geschäft möglich (Eingetragen im Grundbuch .!)\n \nkurzfristig SELBST Bewohnbar, Mieterfrei Übergabe auf Wunsch \n\n\nDATEN\n• Wohnung + Laden Geschäft \nGewerbliche Nutzung Möglichkeit\n• 2x Zimmer \nZimmer_1  ca 25m²  Zimmer_2 ca 10m² + Badezimmer \n• gesamt ca 45m²\n• Hochparterre ( 4xStufen )\n• 2x Eingange  ( Front & Schaufenster + Treppenhaus Türe )\n•  Teeküche \n•  gemeinsam PKW Stellplätze auf dem Innenhof \n• Gebäude Gedämmt \n• Grundriss/Flächen Änderung möglich.!\n•• Heizungsart:  Gasetagenheizung \nbei der letzten Sanierung wurden die Heizkörper und Dusche entfernt, da als Büro Vermietet \n•• aktuell beheizt mit Elektroheizung \n• Anschluss  Gasetagenheizung + Dusche/Bad jederzeit möglich.! \n\n\nAlle Wartungen durchgeführt/ NEU Saniert zB\nElektrik\nDecken Abgehangen\nWände Verputz\nBadezimmer Neu gefliest ( von Beige auf Grau ) \nAbwasser Rohre \nusw.\n\nTOP Investor Immobilie\nVerkauf im IST zustand & ☆ Mieterfrei ☆\nVermietbarkeit: sehr gut \n\nMIETEINNAHMEN:   SOL_ 2020, 2021.. \n\nMiete:  ca 850 € bis 1000 € Monatlich Netto \nGesamt: _ _   ca 10.200€ bis 12.000€  NKJM\n\n\n\n\nAdresse: \n10999 Berlin Kreuzberg \n( B-Lage ) \n\n\nKäufer Provision:  7,14% inkl. 19% MwSt.\nvom Kaufpreis und vom Käufer zu zahlen, bei Vertrag Verdient & Fällig.\n\n\nDATEN_\nKaufpreis:   275.000 € \nNutzfläche ~Wohn & Gewerbe: ca 45 m²\nKeller: Ja \nStellplatz: Ja, gemeinsam im Innenhof \nVerfügbar: JA, nach VB \nHeizungsart: Gasetagenheizung ( aktuell mit Elektroheizung, Anschluss jederzeit möglich.! )\n\n\nVerbleibe mit freundlichen Grüßen\nHerr Sahan    |  Immobilien', 'IM ALLEINAUFTRAG \nSie interessieren sich für diese Immobilie, haben Fragen zur Finanzierung oder wünschen einen Besichtigungstermin⁉️\nBitte haben Sie Verständnis dafür, dass wir Ihre Anfrage nur bei Übermittlung Ihrer\nVOLLSTÄNDIGEN Kontakt-/ Adressdaten, Mail & Tel-Mobil: ☎️ schnellstmöglich beantworten können und Ihnen erst im Rahmen unserer Exposé Zusendung die genaue Objektadresse benennen. Bei weiterem Interesse stehen wir ihnen dann selbstverständlich zur Verfügung.\n\n❌ keine Anfragen von MAKLER & Vermittlern _ NICHT erwünscht !\n• Diskretion Erwünscht und Oberstes Gebot \n*andere werden dem Verkauf ausgeschlossen.!\n• trotz sorgfältiger Überprüfung sind Fehler nicht ausgeschlossen, Angaben sind vom *dritten\ndaher Alle Angaben unverbindlich und ohne Gewähr, Irrtum und Vorverkauf vorenthalten..!\n•diese Infos, Eckdaten, Fotos sind EIGENTUM der Şahan_Immobilien, anderweitig Veröffentlichung o. Weitergabe an ,,dritte"" wird mit Höhe der Provision bestraft !\n▪mit der Bewerbung auf diese Anzeige sind Sie mit allen Punkten einverstanden.\n• Widerrufs recht besteht, innerhalb von zwei Wochen!\n• Allgemeine AGBs, Datenschutz Gesetzänderungen_  Mai.2018\n\n\n** Die hier eingestellten Flächendefinitionen sind mit größter Sorgfalt recherchiert, erheben jedoch nicht den Anspruch auf Alleingültigkeit und werden lediglich unverbindlich zu Informationszwecken zur Verfügung gestellt. Bitte beachten Sie auch unsere rechtlichen Hinweise.']";ONE_YEAR_FREE;2,4 MBit/s;telekom_layer_magenta_m_hybrid2;45;über Hybrid;WITH_HYBRID;;MagentaZuhause M Hybrid (2);152;;;16 MBit/s;https://padlock.link/mmh2sa;https://padlock.link/mmhy2;;;true;50 MBit/s;web,email,bank,music,dl-ul,game,sd,mltstr,hd;showqualicontactform;;10 MBit/s;50 MBit/s;2018;
