timestamp;obj_regio1;obj_heatingType;obj_telekomTvOffer;obj_cId;obj_newlyConst;obj_balcony;obj_picture;obj_picturecount;obj_pricetrend;obj_telekomUploadSpeed;obj_telekomTrackingGroup;obj_telekomInternetTechnology;obj_yearConstructed;obj_telekomInternetType;obj_pricetrendbuy;obj_scoutId;obj_noParkSpaces;obj_firingTypes;obj_hasKitchen;obj_ExclusiveExpose;obj_telekomInternetProductName;obj_courtage;geo_bln;obj_cellar;obj_purchasePriceRange;obj_yearConstructedRange;obj_rentSubsidy;obj_houseNumber;obj_energyType;obj_pricetrendrent;obj_livingSpace;geo_krs;obj_zipCode;obj_condition;obj_interiorQual;ga_cd_cxp_historicallisting;obj_telekomDownloadSpeed;obj_parkingSpace;obj_street;obj_lift;obj_telekomInternetUrlMobile;obj_telekomInternetUrl;obj_streetPlain;obj_typeOfFlat;geo_plz;obj_noRooms;obj_thermalChar;obj_assistedLiving;obj_ityp;obj_telekomHdTelephone;geo_land;ga_cd_via;obj_telekomInternet;obj_immotype;obj_rented;obj_floor;obj_telekomInternetServices;obj_telekomInternetProductAvailable;obj_cwId;obj_purchasePrice;ga_cd_application_requirements;obj_numberOfFloors;obj_noRoomsRange;ga_cd_maillead_default_shown;obj_garden;obj_barrierFree;obj_international;obj_regio3;obj_objectnumber;obj_livingSpaceRange;obj_regio2;URL;beschreibung;ga_cd_via_qualified;ga_cd_developer_virtualreality;obj_galleryAd;obj_groupnumber;evt_count_pm_sig;obj_lastRefurbish;obj_usableArea;obj_energyEfficiencyClass;obj_telekomHybridUploadSpeed;obj_telekomHybridDownloadSpeed
2020-05-30 19:45:39.158724;Berlin;self_contained_central_heating;ONE_YEAR_FREE;15333187;n;y;https://pictures.immobilienscout24.de/listings/07f18a98-4a58-4be0-9b9c-6d4ee2f03462-1356701775.jpg/ORIG/resize/118x118%3E/extent/118x118/format/jpg/quality/80;11;11.93;40 MBit/s;telekom_layer_magenta_l;über VDSL;1930;REGULAR;11.93;116449157;1;gas;n;false;MagentaZuhause L;y;Berlin;y;5;1;219.1;114;energy_consumption;5.87;62.6;Berlin;12487;no_information;no_information;false;100 MBit/s;outside;Sterndamm;n;https://padlock.link/ioml;https://padlock.link/ml;Sterndamm;apartment;12487;2.5;149.9;n;2,active;true;Deutschland;top;100 MBit/s;wohnung_kauf;n;1;web,email,bank,music,dl-ul,game,sd,mltstr,hd,fast-ul-dl;true;001.15281088;223482;profile0;5;2;true;n;n;n;Johannisthal_Treptow;5754;3;Berlin;/expose/116449157;['Im Jahr 1928 entstand am Sterndamm 114/116 ein viergeschossiger Wohntrakt mit Satteldach und Rundbogen-Loggien in den oberen Etagen. In den zwei Aufgängen befinden sich 26 Wohneinheiten mit einer Größe von 33,2 m²- 74,93 m² mit 1, 5 - 3,5 Zimmern. Die Dachgeschossflächen werden zu Wohnzwecken ausgebaut. Die Loggia ist nach Nord/Westen ausgerichtet und hat einen unverbaubaren Blick ins Grüne..\nDie beispielhaften Wohnungsbilder sollen lediglich die Bausubstanz und Ausstattung anzeigen. Der tatsächliche Zustand der einzelnen Wohnungen variiert. Aktuell verfügt das Objekt über 11 PKW-Stellplätze. Nach Verfügbarkeit kann zu jeder Wohnung ein Stellplatz erworben werden. Der Kaufpreis beträgt 10.000,00 € .', 'Neue Gaszentralheizung', 'Der Sterndamm ist im grünen Bezirk Treptow-Köpenick im Ortsteil Johannisthal gelegen. Er verbindet  Niederschöneweide und Johannisthal und mündet in die Stubenrauchstraße, welche über den Teltowkanal nach Rudow führt. Im direkten Umfeld finden sie hier auch noch viele Einfamilienhäuser und zur Erholung lädt sie die, in ca. einem Kilometer Entfernung gelegene, Königsheide ein. Einkaufsmöglichkeiten, Schulen, Kindergarten finden sie in der unmittelbaren Umgebung. Die Anbindung an den öffentlichen Nahverkehr ist sehr gut. Der S- und Regionalbahnhof Schöneweide und die Stadtautobahn A 113 befinden sich jeweils in ca. 2 Kilometer Entfernung und die Bushaltestelle der Linien 160 und M 11 ist ca. 150 Meter entfernt.', 'Für weitere Informationen oder Terminvereinbarungen steht Ihnen das Team der MAKSIM gerne telefonisch oder per E-Mail zur Verfügung. Eine Gewähr für die Richtigkeit kann durch die Firma Maksim Immobiliengesellschaft mbH nicht übernommen werden.'];;;;;;;;;;
2020-05-30 19:45:39.558481;Berlin;district_heating;ONE_YEAR_FREE;37030;n;n;https://pictures.immobilienscout24.de/listings/b6f1a4d4-adab-40df-ad23-0bcc145e5015-1357269991.jpg/ORIG/resize/118x118%3E/extent/118x118/format/jpg/quality/80;8;12.01;40 MBit/s;telekom_layer_magenta_l;über VDSL;1886;REGULAR;12.01;116427242;;no_information;n;true;MagentaZuhause L;y;Berlin;n;5;1;;34;energy_required;7.88;29.11;Berlin;10999;no_information;no_information;false;100 MBit/s;no_information;"Lausitzer Stra&szlig;e";n;https://padlock.link/ioml;https://padlock.link/ml;Lausitzer_Straße;apartment;10999;1;126;n;2,active;true;Deutschland;schaufenster;100 MBit/s;wohnung_kauf;n;2;web,email,bank,music,dl-ul,game,sd,mltstr,hd,fast-ul-dl;true;001.37030;229000;profile0;5;1;true;n;n;n;Kreuzberg_Kreuzberg;36299;1;Berlin;/expose/116427242;"['In dieser durchdachten 1-Zimmer-Altbauwohnungen können Sie auf 29 qm viel erreichen. Durch den abgetrennter Küchenbereich, eine praktische Abstellkammer und das quadratische Duschbad lässt es sich kompakt und trotzdem gemütlich leben. Außerdem haben Sie die Chance Ihren eigenen Stil zu verwirklichen, denn bei der Gestaltung haben Sie freie Hand. \r\n\r\nNur wenige Meter vom Landwehrkanal enfernt erwartet Sie dieses denkmalgeschützte Gründerzeitensemble, welches aus Vorderhaus und Gartenhaus besteht und mit seiner wunderschönen Stuckfassade bezaubert. Es steht Ihnen eine breite Auswahl an 1- bis 4-Zimmer-Wohnungen zur Verfügung, die zum Teil mit Altbau-Elementen wie Flügeltüren oder Kachelöfen aufwarten. \r\n\r\nErholung bieten zukünftig die beiden Gartenhöfe, die von namhaften Landschaftsarchitekten gestaltet werden. Außerdem wird das Lausitzer Quartier in weiteren Bauabschnitten durch einen Neubau ergänzt; eine Backsteinremise und eine Fabrikremise werden zu Townhouses umgewandelt. Genießen Sie in Ihrem neuen Zuhause ein nachbarschaftliches Miteinander ganz nach Kreuzberger Geschmack.\r\n\r\nSie interessieren sich für diese Wohnung, haben Fragen zur Finanzierung oder wünschen einen Besichtigungstermin? Das ZIEGERT-Team steht Ihnen immer gern zur Verfügung!', '+ Stuckfassaden mit Altbaudetails\r\n\r\n+ Aufzug im Gartenhaus/Treppenhaus 1\r\n\r\n+ Musterwohnung im Vorderhaus\r\n\r\n+ tagesbelichtetes Wannen- und Duschbad\r\n\r\n+ Kassettendoppelfenster\r\n\r\n+ Flügeltüren \r\n\r\n+ Fernwärme\r\n\r\n+ Verkauf der Wohnungen im Ist-Zustand\r\n\r\n+ Kellerflächen werden zum Verkauf angeboten\r\n\r\n+ 2 Gewerbeeinheiten im Vorderhaus\r\n\r\n+ landschaftlich geplante Gartenhöfe\r\n\r\n+ Vorderhaus und Gartenhaus\r\n', '""Ich bin kein Berliner, ich bin Kreuzberger."" Berlin-Kreuzberg steht für ein ganz bestimmtes Lebensgefühl: kreativ, tolerant und vielfältig. Es gibt quasi alles, außer einer Sperrstunde. Besonders das baumgesäumte Maybach- und Paul-Linke-Ufer bezaubern mit prachtvollen Altbauten, einladenden Liegewiesen, gemütlichen Cafés und Restaurants, charmanten Kiezläden sowie bunten Floh- und Wochenmärkten. \r\n\r\nNur einen Steinwurf entfernt, befindet sich das Lausitzer Quartier - in einer ruhigen Seitenstraße vom quirligen Kreuzberger Treiben. Und falls man doch mal seinen Kiez verlassen möchte, sind die U-Bahnhöfe Kottbusser Tor (U1, U3, U8) und Görlitzer Bahnhof (U1, U3) in zehn Gehminuten erreichbar. Mit einem Bio-Supermarkt vor der Haustür, zahlreichen Kitas, Grundschulen, Gymnasien und Sportvereinen in der nahen Umgebung können sich hier auch Familien gut aufgeboben fühlen.', '+++++++++++++++++++++++++++++++++++++++++++++\r\n\r\nBei Ziegert steht der Mensch im Mittelpunkt. Wir nehmen unsere gesellschaftliche Verantwortung selbstverständlich auch in dieser herausfordernden Zeit sehr ernst. Die Gesundheit unserer Kunden, Mitarbeiter und Partner hat für uns oberste Priorität. Aufgrund der aktuellen Situation werden daher unsere Showrooms vorübergehend geschlossen. Dennoch sind unsere ImmobilienberaterInnen weiterhin bestmöglich für Sie da. Wir freuen uns auf den Kontakt mit Ihnen per E-Mail, Telefon oder Videochat.\r\n\r\n++++++++++++++++++++++++++++++++++++++++++++\r\n\r\nEinige Wohnungsinnenaufnahmen stammen nicht zwangsläufig aus der hier angebotenen Wohnung oder spiegeln den aktuellen Zustand wieder. Gerne zeigen wir Ihnen die Wohnung vor Ort. \r\n\r\n++++++++++++++++++++++++++++++++++++++++++++\r\n\r\nDas ZIEGERT-Finanzierungsteam hilft Ihnen dabei, Ihre Träume zu leben. Wir zeigen Ihnen gern, wie man zum Beispiel den eigenen Mietzins in Eigentum verwandeln kann. Entdecken Sie Ihre Möglichkeiten und kontaktieren Sie uns unter +49 (0) 30 880 353 - 39 oder auf www.kaufen-statt-mieten.berlin.\r\n\r\n++++++++++++++++++++++++++++++++++++++++++++']";true;true;disabled;113;showqualicontactform;;;;;
2020-05-30 19:45:39.944288;Berlin;district_heating;ONE_YEAR_FREE;858659;n;y;https://pictures.immobilienscout24.de/listings/8a29afbc-cc18-4e22-a23f-024ec2eb492a-1369401874.jpg/ORIG/resize/118x118%3E/extent/118x118/format/jpg/quality/80;14;11.3;40 MBit/s;telekom_layer_magenta_l;über VDSL;1900;REGULAR;11.3;116417237;;no_information;y;false;MagentaZuhause L;y;Berlin;y;11;1;453;72;energy_required;5.73;152.19;Berlin;10625;no_information;no_information;false;100 MBit/s;no_information;Leibnizstr.;y;https://padlock.link/ioml;https://padlock.link/ml;Leibnizstr.;roof_storey;10625;3;85.3;n;2,active;true;Deutschland;top;100 MBit/s;wohnung_kauf;n;6;web,email,bank,music,dl-ul,game,sd,mltstr,hd,fast-ul-dl;true;001.858659;1980000;profile0;6;3;true;n;n;n;Charlottenburg_Charlottenburg;LeibnizDG12;7;Berlin;/expose/116417237;['Zahlreicher Fassadenschmuck ziert diesen Gründerzeitaltbau der Jahrhundertwende. Horizontaler Bossenstuck, Balkone mit schmiedeeisernen Brüstungen und profilierte Holzfenster mit Sprossenaufteilung erschaffen ein abwechslungsreiches und dennoch harmonisches Fassadenbild. Über ein prachtvolles, säulenflankiertes Portal betreten Sie die Spiegelallee des Jugendstilfoyers. \rDie historischen und überaus erhaltenswerten Elemente wurden aufwendig aufgearbeitet. Dort, wo die historische Bausubstanz nicht zu erhalten war oder technische Notwendigkeiten es erforderten, wurde die alte Substanz durch rekonstruktive Elemente nach historischem Vorbild authentisch ersetzt. Gemeinsam mit Architekten und Baufachleuten wurde ein harmonisches Fassaden- und Farbkonzept entwickelt, das diesen Altbau von außen und innen wieder wie neu erscheinen lässt. \rZusätzlich zur optischen Präsentation des Gebäudes wurden vielfältige Maßnahmen auch zur technischen und werterhaltenden Erneuerung getroffen. Dieser Altbau vereint zeitlosen Altbaucharme mit zeitgemäßer Haustechnik.\rAuszüge aus der Baubeschreibung:\r\rÜberarbeitung von Fassaden und Fenstern nach historischem Vorbild\rneue Hofgestaltung\rneue Briefkasten-/Klingelanlage\rneue Schließanlage\rÜberarbeitung der Treppenhäuser, Wohnungstüren und der Hauseingangstür\rneuer Aufzug\rNeuinstallation von Kaltwasser- und Warmwasserleitungen aus Edelstahl/Kunststoff\rIsolierung der Warmwasserleitungen\rErneuerung der Abwasserleitungen\rHolzschutzgutachten und Maßnahmen (präventiv und reparativ)\rneue Heizungsstränge\rneue Elektroverteilung\rAbschluss der Sanierungsmaßnahmen am Gemeinschaftseigentum 2011', 'Wohnzimmer Kurfürstendamm: Da die Lebensqualität besonders eng mit dem Faktor Wohnlage verknüpft ist, lohnt es sich, bei diesem Objektstandort etwas genauer hinzusehen: An diesem Mikrostandort im Herzen der City-West stehen Ihnen weit mehr als die so oft und lieblos beschriebenen „Möglichkeiten des täglichen Bedarfs“ in unmittelbarer Umgebung zur Auswahl.  Schließlich wollen Sie nicht nur Ihren Bedarf decken, sondern das Leben in vollen Zügen genießen. Entlang des Boulevards Kurfürstendamm in Richtung Osten entdecken Sie die ganze Vielfalt der Metropole von den Flagshipstores aller bedeutenden, internationalen Modelabels bis Kultur und Genuss. Und in Richtung Westen gelangen Sie nach nur 2,9 km in den Bezirk Grunewald. Die Auswahl an Restaurants in der unmittelbaren Umgebung ist gigantisch. Beinahe alle Geschmacksrichtungen der internationalen Küche sind vertreten. Ob asiatisch, spanisch, japanisch, italienisch, deftig oder exotisch: hier treffen Sie auf gastronomische Einrichtungen der Spitzenklasse von urig gemütlich bis kultig und von modern bis mondän.', 'Qualität bis ins Detail. Der Einsatz der verbauten Materialien und die fachliche Umsetzung der Um- und Neubaumaßnahmen weisen in dieser Wohnung einen sehr hohen Standard aus, der auch den höchsten Ansprüchen an modernen Wohnkomfort gerecht wird und diese sogar übertrifft. Alle Wohnräume und die Küche sind mit massiven, alten belgischen Landhausdielen ausgestattet. In den beiden großen Bädern und im Hauswirtschaftsraum wurden großformatige graue Fliesen verlegt. Neue Isolierglasfenster, glatt gespachtelte  Wände, eine sehr hochwertige, durchdachte Elektroinstallation, eine Gaggenau Einbauküche mit Kochinsel sind weitere Belege für den hohen Ausstattungsstandard dieser Dachwohnung.\rDarüber hinaus punktet diese Wohnung mit einem Kamin, einer Sauna und einer 10 m² großen Panorama-Terrasse sowie vielen kleinen Finessen wie z.B. einen in den Badspiegel integrierten Fernseher, Einbauschränken, freigelegten Deckenbalken, geschmackvollen Heizkörperverkleidungen, einem festinstallierten Kohlensäurebereiter in der Küche und einem Ankleidezimmer mit Einbauschränken.\rNutzeroptimierte Grundrisse, gut dimensionierte Raumgrößen, 2 Schlafzimmer und 2 Vollbäder und 2 Terrassen mit West- und Ostausrichtung machen diese Wohnung denkbar für die unterschiedlichsten Nutzungskonzepte.\rStilvolle Objekte von namhaften Markenherstellern, Edelstahlarmaturen, Feinsteinzeugfliesen und Handtuchheizkörper prägen die stilsicheren Bäder in diesem Objekt.\rSämtliche Installationsleitungen für Sanitär, Heizung, Elektro und Telekommunikation wurden komplett erneuert.\rDiverse getroffene Maßnahmen zur energetischen Verbesserung an dem Gebäude, Fenstern und der Heizungsanlage tragen zur Verbesserung  der Energiebilanz und der Verbrauchswerte bei (siehe Energieausweis).\rDie Wohnung verfügt über einen Keller und ist mit einem Aufzug erschlossen.\rDie in dieser Präsentation abgebildeten Fotos sind aktuelle Originalaufnahmen.\r\rAusstattung:\rneue Leitungen (Kalt- und Warmwasser, Abwasser)\rneue Elektroverteilung\rneue Heizungsverteilung\rHeizkörperverkleidung (Holz)\rHolzkassettentüren (neu)\rAlte belgische Landhausdielen (Eiche)\rglatt gespachtelte Wände\rneue Bäder mit Premium-Objekten\rSauna\rKamin\rneue Fenster\rGaggenau-Einbauküche mit Kochinsel\rintegrierter Kohlensäureaufbereiter (Grohe blue)\r2 Schlafzimmer\r1 Ankleidezimmer mit Einbauschränken\r2 Vollbäder\rHauswirtschaftsraum\r10 m² Hofterrasse (Ostausrichtung)\r4 m² Straßenterrasse (Westausrichtung)\rPremium Schaltersystem\rSONOS Soundsystem\rBodentank (Wohnzimmer)\renergetisch optimierte Bauweise\rAufzug\rKeller\rFernwärme\rsaniertes Gemeinschaftseigentum (2011)\rBaujahr  Wohnung 2012/20'];;;disabled;1;showqualicontactform;2013;;;;
2020-05-30 19:45:40.294081;Berlin;district_heating;ONE_YEAR_FREE;174667;n;n;https://pictures.immobilienscout24.de/listings/137154d5-6ef1-423a-84ce-42b4ac320e69-1356067237.jpg/ORIG/resize/118x118%3E/extent/118x118/format/jpg/quality/80;2;10.62;40 MBit/s;telekom_layer_magenta_l;über VDSL;1900;REGULAR;10.62;116422541;;natural_gas_heavy;n;false;MagentaZuhause L;y;Berlin;y;5;1;225.64;no_information;energy_consumption;5.96;83.36;Berlin;13187;no_information;no_information;false;100 MBit/s;no_information;no_information;n;https://padlock.link/ioml;https://padlock.link/ml;no_information;apartment;13187;3;208;n;2,active;true;Deutschland;top;100 MBit/s;wohnung_kauf;y;2;web,email,bank,music,dl-ul,game,sd,mltstr,hd,fast-ul-dl;true;001.174667;210000;profile0;;3;true;n;n;n;Pankow_Pankow;17055108;4;Berlin;/expose/116422541;['Im Jahr 1900 erbaut, beherbergt dieser charmante Altbau heute 18 Wohn- und Gewerbeeinheiten. 1996/1997 wurde das gesamte Objekt kernsaniert inkl. eines Ausbau des Dachgeschosses. Die angebotene Wohnung bietet 3 Zimmer verteilt auf ca. 83 m² Wohnfläche mit einer funktionalen Raumaufteilung. In der Küche ist Platz für eine Küchenzeile und einen kleinen Esstisch. Das Bad ist in klassischem Weiß gefliest und verfügt über eine Wanne und ein großes Fenster. \r\n\r\nDie Wohnung ist derzeit vermietet und erzielt monatliche Mieteinnahmen in Höhe von 620,00 Euro warm. Für den Eingentümer wird ein Wohngeld in Höhe von 225,64 Euro monatlich fällig. Somit ist die Immobilie eine attraktive Geldanlage.', 'Der Bezirk Pankow bietet bevorzugte Wohnlagen mit charmantem Ambiente. Die Mischung aus Villenvierteln, Gründerzeithäusern und dem mittelalterlichen Dorfkern verleihen Pankow einen Flair, dem man sich nicht entziehen kann. Zahlreiche Sport- und Freizeiteinrichtungen, Restaurants und Parks machen das Leben in Pankow attraktiv. Die Busse der Linien 150 und 250 sind fußläufig schnell zu erreichen und mit der Straßenbahnlinie M1 ist der Hackeschen Markt nur wenige Minuten entfernt. Mit dem Auto gelangen Sie in ca. 5 Minuten auf den Stadtring. Sämtliche Versorgungseinrichtungen des täglichen Bedarfs sind ebenfalls fußläufig zu erreichen. Die meisten im 3 Minuten entfernten Rathaus-Center Pankow.'];;;;;showqualicontactform;;;;;
2020-05-30 19:45:40.685975;Berlin;district_heating;ONE_YEAR_FREE;15349709;n;y;https://pictures.immobilienscout24.de/listings/0e2a8478-51b9-4598-8c31-67f75e208076-1356184790.jpg/ORIG/resize/118x118%3E/extent/118x118/format/jpg/quality/80;14;14.43;40 MBit/s;telekom_layer_magenta_l;über VDSL;1908;REGULAR;14.43;116449214;;district_heating;n;false;MagentaZuhause L;n;Berlin;y;7;1;246.38;8/9;energy_consumption;7.95;74.24;Berlin;13353;well_kept;no_information;false;100 MBit/s;no_information;"Br&uuml;sseler Stra&szlig;e";n;https://padlock.link/ioml;https://padlock.link/ml;Brüsseler_Straße;apartment;13353;2;106;n;2,active;true;Deutschland;top;100 MBit/s;wohnung_kauf;y;3;web,email,bank,music,dl-ul,game,sd,mltstr,hd,fast-ul-dl;true;001.15297510;315520;profile0;5;2;true;n;n;n;Wedding_Wedding;BS8 WE 25;3;Berlin;/expose/116449214;['Im südlichen Teil Weddings - im Brüsseler Kiez - befinden sich die zur Eigennutzung oder als Kapitalanlage angebotenen 40 Wohnungen. Der Altbau liegt in einer eher ruhigen Lage in der Brüsseler Straße, von der aus das pulsierende Leben Berlins schnell erreicht werden kann.\r\nDas 1908 erbaute Haus formiert sich aus Vorderhaus, Seitenflügeln und Hinterhaus, fast quadratisch um einen begrünten Innenhof. Es bietet in insgesamt drei Gewerbe- und 73 Wohneinheiten schöne Stadtwohnungen und großzügige Arbeitsräume. Die Wohnungen überzeugen durch eine attraktive und durchdachte Raumaufteilung. Die Größen im Erdgeschoss bis zum vierten Obergeschoss variieren zwischen 36 m² und 80 m². Abgesehen von einer Gewerbeeinheit im Erdgeschoss mit 4 Räumen und einer Dachgeschoss-Wohnung mit 2,5 Zimmern, handelt es sich bei den verfügbaren Einheiten ausschließlich um 1- bis 2-Zimmer-Wohnungen. Die Dachgeschosswohnungen sind großzügig gestaltet und bieten mit 76 m² bis 103 m² attraktive Wohnungsgrößen und große Dachterrassen, die in der warmen Jahreszeit zum Aufenthalt im Freien mit einem Ausblick auf die städtische Umgebung einladen. \r\nDas Haus ist ein typischer Berliner Altbau, bei dem zahlreiche bauzeitliche Elemente bewahrt worden sind. Im vorderen Treppenhaus finden sich Buntglasfenster, dekorativ verzierte Treppengeländer und Türstöcke, Stuck an den Decken sowie Kassettentüren zeigen die Schönheit und die Geschichte dieses Gebäudes.\r\n\r\nMit dem Kauf einer Eigentumswohnung in Berlin-Wedding entscheiden Sie sich für eine attraktive Anlage in einer zunehmend beliebten Lage oder für die eigenen vier Wände in einer vielfältigen und abwechslungsreichen Nachbarschaft. \r\n\r\nWillkommen im „Colours of Wedding“.', '- Einheit Nr. 25\r\n- 3.OG \r\n- 2 Zimmer \r\n- ca. 74 m² \r\n- Loggia\r\n- Kellerabteil\r\n- vermietet', 'Der zentral gelegene Wedding ist in all den Jahren ein ursprünglicher Teil Berlins geblieben, der sich nie verbogen hat. Bis heute versprüht der Ortsteil den Charme eines gewachsenen und lebendigen Wohnviertels, in dem man sowohl urige Berliner Eckkneipen als auch angesagte Cafés findet. Bei aller Beständigkeit ist hier ein deutlicher Wandel spürbar, der alte Strukturen reizvoll ergänzt, statt sie zu zerstören. Es ist ein aufstrebender, lebendiger Teil der Stadt, der immer mehr Menschen anzieht.\r\nNeben den großen grünen Parkanlagen, wie dem Volkspark Rehberge, ist der heutige Wedding vor allem bunt. Mittlerweile hat sich hier eine lebendige Kunstszene etabliert. Knapp 13.000 Studierende sind an der nur 500 Meter entfernten Beuth Hochschule für Technik Berlin eingeschrieben und verleihen dem Bezirk kulturell und wirtschaftlich eine zusätzliche Dynamik. Auch der Charité Campus Virchow-Klinikum ist weniger als einen Kilometer vom Objekt entfernt. \r\nDie Brüsseler Straße zählt zu den ruhigeren Lagen im Kiez, ist aber zugleich gut an die Hauptverkehrsadern, wie der Seestraße und der Einkaufsmeile Müllerstraße, angebunden. In nur wenigen hundert Metern Entfernung befinden sich der U-Bahnhof  und mehrere Tram- und Buslinien. In nur 10 Minuten gelangt man bis zur Friedrichstraße im historischen Zentrum Berlins. Hier wird entspanntes Wohnen mit dem Erleben des quirligen und spannenden Berlins kombiniert. Dieser Kontrast zeichnet das Leben in der Brüsseler Straße 8 und 9 aus und macht es interessant, vielfältig und lebenswert. \r\n', 'Die Wohnungen werden im Ist-Zustand verkauft.\r\nDas Objekt liegt in einem Milieuschutzgebiet.'];;;disabled;;showqualicontactform;;;;;
2020-05-30 19:45:41.202718;Berlin;self_contained_central_heating;ONE_YEAR_FREE;15333187;n;y;https://pictures.immobilienscout24.de/listings/d6c3fe76-c3df-416c-a3de-14cfd309286a-1356685915.jpg/ORIG/resize/118x118%3E/extent/118x118/format/jpg/quality/80;11;11.93;40 MBit/s;telekom_layer_magenta_l;über VDSL;1930;REGULAR;11.93;116449186;1;gas;n;false;MagentaZuhause L;y;Berlin;y;4;1;151.87;116;energy_consumption;5.87;43.39;Berlin;12487;no_information;no_information;false;100 MBit/s;outside;Sterndamm;n;https://padlock.link/ioml;https://padlock.link/ml;Sterndamm;apartment;12487;1;149.9;n;2,active;true;Deutschland;top;100 MBit/s;wohnung_kauf;n;3;web,email,bank,music,dl-ul,game,sd,mltstr,hd,fast-ul-dl;true;001.15281088;154902;profile0;5;1;true;n;n;n;Johannisthal_Treptow;5751;2;Berlin;/expose/116449186;['Im Jahr 1928 entstand am Sterndamm 114/116 ein viergeschossiger Wohntrakt mit Satteldach und Rundbogen-Loggien in den oberen Etagen. In den zwei Aufgängen befinden sich 26 Wohneinheiten mit einer Größe von 33,2 m²- 74,93 m² mit 1, 5 - 3,5 Zimmern. Die Dachgeschossflächen werden zu Wohnzwecken ausgebaut. Die Loggia ist nach Ost/Süd ausgerichtet. \nDie beispielhaften Wohnungsbilder sollen lediglich die Bausubstanz und Ausstattung anzeigen. Der tatsächliche Zustand der einzelnen Wohnungen variiert. Aktuell verfügt das Objekt über 11 PKW-Stellplätze. Nach Verfügbarkeit kann zu jeder Wohnung ein Stellplatz erworben werden. Der Kaufpreis beträgt 10.000,00 € .', 'Neue Gaszentralheizung', 'Der Sterndamm ist im grünen Bezirk Treptow-Köpenick im Ortsteil Johannisthal gelegen. Er verbindet  Niederschöneweide und Johannisthal und mündet in die Stubenrauchstraße, welche über den Teltowkanal nach Rudow führt. Im direkten Umfeld finden sie hier auch noch viele Einfamilienhäuser und zur Erholung lädt sie die, in ca. einem Kilometer Entfernung gelegene, Königsheide ein. Einkaufsmöglichkeiten, Schulen, Kindergarten finden sie in der unmittelbaren Umgebung. Die Anbindung an den öffentlichen Nahverkehr ist sehr gut. Der S- und Regionalbahnhof Schöneweide und die Stadtautobahn A 113 befinden sich jeweils in ca. 2 Kilometer Entfernung und die Bushaltestelle der Linien 160 und M 11 ist ca. 150 Meter entfernt.', 'Für weitere Informationen oder Terminvereinbarungen steht Ihnen das Team der MAKSIM gerne telefonisch oder per E-Mail zur Verfügung. Eine Gewähr für die Richtigkeit kann durch die Firma Maksim Immobiliengesellschaft mbH nicht übernommen werden.'];;;;;;;;;;
