2020-05-30 19:48:08.655573;Berlin;;;ONE_YEAR_FREE;13057385;n;n;https://pictures.immobilienscout24.de/listings/f7733a49-46c6-4668-b79d-09bb809eef8b-1368072137.jpg/ORIG/resize/118x118%3E/extent/118x118/format/jpg/quality/80;16;10.62;40 MBit/s;telekom_layer_magenta_l;über VDSL;1925;REGULAR;10.62;115947186;no_information;n;false;MagentaZuhause L;y;Berlin;n;5;1;320;1;no_information;5.96;92;Berlin;13189;no_information;no_information;false;100 MBit/s;no_information;"Hardanger Stra&szlig;e";n;https://padlock.link/ioml;https://padlock.link/ml;Hardanger_Straße;ground_floor;13189;3;;n;;2,active;true;Deutschland;top;100 MBit/s;wohnung_kauf;n;0;web,email,bank,music,dl-ul,game,sd,mltstr,hd,fast-ul-dl;true;001.13057385;249000;profile0;;3;true;n;showqualicontactform;n;n;Pankow_Pankow;9253;4;Berlin;/expose/115947186;"['Diese vermietete 3-Zimmerwohnung befindet sich im Erdgeschoss eines Mehrfamilienhauses in der Hardangerstraße. Die Wohnung befindet sich in einem gepflegten Zustand.  \n\nFast in jedem Berliner Architekturführer finden Sie diese denkmalgeschützte Wohnanlage...\n \nDie Anlage wurde in den Jahren 1999- 2000 unter den strengen Auflagen der Berliner Denkmalschutzbehörde umfangreich saniert. Diese Sanierung umfaßte neben den Erneuerungen im Bereich des Gemeinschaftseigentums (Sanitär- und Elektroleitungen, Fernwärmeheizung, Fenster, Keller, Dach, Fassade, Treppenhäuser etc.) auch die Innenrenovierung der insgesamt 91 Einheiten. \n \nDie Wärme-und Warmwasserversorgung erfolgt zentral über Fernwärme. (https://www.carre-eschengraben.de)\n\nDie Wohnung betritt man durch die Diele von der auch fast alle Räume der Wohnung zu erreichen sind.  Das Wannenbad mit Fenster und die Küche befinden sich auf der rechten Seite der Wohnung zur Straßenseite. Auf der linken Seite das großzügige Jugendzimmer. Die Einbauküche ist Eigentum des Mieters.  Gegenüber der Wohnungseingangstür befindet sich das großzügig geschnittene Wohnzimmer.  Von dort gelangt man in ein weiteres Zimmer, welches derzeit als Schlafzimmer genutzt wird. Die beiden Schlafzimmer sind in den ruhigen Hof gerichtet. Alle Wohnräume sind mit Laminat ausgestattet. Das Badezimmer und die Küche sind gefliest. Auf dem großen parkähnlichen Innenhof gibt es einen Kinderspielplatz.\n\nDie Wohnung ist seit 01.06.2012 vermietet. Die Wohnanlage wurde 1999 aufgeteilt. \n\nDie Miete setzt sich zusammen:\n\n596,53 Euro KM\n115,00 Euro BKVZ\n70,00 Euro   HKVZ\n————————————\n781,53 Euro WM\n\nDas Wohngeld liegt bei 320,- Euro monatlich. Das Hausgeld beträgt jährlich 3.840,00 Euro, davon sind 3.030,33 Euro umlagefähig. Der nicht umlagefähige Anteil beträgt 795,70 Euro im Jahr, von dene 287,70 Euro in die Instandhaltungsrücklage fließen.', '+ zuverlässiger Mieter\n\n+ zentrale verkehrsgünstige Lage\n\n+ guter Schnitt\n\n+ Keller', 'Pankow liegt im Berliner Norden gemeinsam mit den Bezirken Prenzlauer Berg und Weißensee bildet es den großen Bezirk Pankow. Der grüne Bezirk mit seinen malerischen Straßenzügen und großen Parkanlagen. Die Menschen in Pankow schätzen die bürgerliche Behaglichkeit  der urbane  Prenzlauer Berg ist nur wenige Minuten entfernt.  In der Nachbarschaft befinden sich verschiedene Einkaufsmöglichkeiten \n\nVerschiedene Restaurants, Cafés und Bars sowie ein großzügiges Freizeitangebot machen das Leben in Pankow besonders reizvoll. Entspannen können Sie in einem der zahlreichen Parks im ""Kiez"". Weitere kleine Läden, Boutiquen und Geschäfte befinden sich in der unmittelbaren Umgebung.\n\nDer S- und U-Bahnhof Pankow sowie verschiedene Tramlinien und Buslinien sind schnell zu Fuß erreicht.\n\nAuch mit dem Auto ist man zügig im Stadtzentrum aufgrund zahlreicher mehrspuriger Bundesstraßen.\n\n\n', 'Liebe Kunden, unser Immobilienbüro erreichen Sie wie folgt:\n\nMontag bis Freitag von 10 bis 18 Uhr unter Tel.: 0176 93 16 16 86\nGerne vereinbaren wir einen Besichtigungstermin mit Ihnen und stehen für Fragen zur Verfügung.\n\nWeitere Immobilienangebote in der Lage finden Sie:\n\n\n\nDie Informationen zu unseren Immobilienangeboten erhalten wir vom Eigentümer bzw. den in den Inseraten genannten Stellen. Für deren Richtigkeit übernehmen wir keine Haftung.Sämtliche Angebote sind freibleibend, ein Zwischenverkauf bleibt vorbehalten. Verbindliche Zusagen bedürfen zu ihrer Wirksamkeit der Schriftform.']";;;;;;;;;;
2020-05-30 19:48:09.021624;Berlin;central_heating;;ONE_YEAR_FREE;43448;n;n;https://pictures.immobilienscout24.de/listings/48e3642c-c3b6-43ca-b94e-663b13bdcf35-1352622966.jpg/ORIG/resize/118x118%3E/extent/118x118/format/jpg/quality/80;10;11.3;40 MBit/s;telekom_layer_magenta_l;über VDSL;1905;REGULAR;11.3;115965772;natural_gas_heavy;n;false;MagentaZuhause L;y;Berlin;y;7;1;235;22;energy_consumption;5.73;94;Berlin;14052;no_information;simple;false;100 MBit/s;no_information;Kastanienallee;n;https://padlock.link/ioml;https://padlock.link/ml;Kastanienallee;ground_floor;14052;2;60;n;;2,active;true;Deutschland;top;100 MBit/s;wohnung_kauf;y;0;web,email,bank,music,dl-ul,game,sd,mltstr,hd,fast-ul-dl;true;001.43448;379500;profile0;;2;true;n;showqualicontactform;n;n;Charlottenburg_Charlottenburg;115965772;4;Berlin;/expose/115965772;"['Diese Gewerbeeinheit befindet sich im EG eines Mehrfamilienhauses. Die Einheit ist aktuell als Büroeinheit vermietet; die Nutzung als Wohnraum ist definitiv gedacht.\nEine Einteilung in 2 oder 3 Zimmer ist möglich.\nDie Einheit besteht aus 2 Zimmern, Kammer, Abstellraum, Flur, Küche und Dusche/WC.', 'Dieses Objekt liegt im sogenannten Westend, welches zum Berliner Bezirk Charlottenburg Wilmersdorf gehört. Ursprünglich nachdem vornehmen Londoner Stadtteil benannt, haben einige Teile von Westend heute ein städtisches Ambiente mit den typischen Berliner Mietshäusern.\nZentrum und Einkaufsmeile von Westend ist die Reichsstraße und markant sind in Westend die vielen unterschiedlich strukturierten Plätze.\nObwohl Charlottenburg seinen Rang als Zentrum Berlins nach der Wende an Mitte abtreten musste, gibt es hier immer noch reichlich Anlaufpunkte, die den Stadtteil als Zentrum West etabliert haben.\nArbeiten und Wohnen zu verbinden, bietet sich hier an!', 'Lassen Sie sich von uns beraten!\nUnsere telefonische Erreichbarkeit:\nmontags bis mittwochs 9:30 bis 19:00 Uhr.\ndonnerstags 9.30 bis 18:00 Uhr\nfreitags und samstags 10:00 bis 17:00 Uhr\nReservieren Sie am besten heute noch einen persönlichen Besichtigungstermin!']";;B;;;;;;;;
2020-05-30 19:48:09.370355;Berlin;heat_pump;;;15899186;n;n;https://pictures.immobilienscout24.de/listings/388fee1d-7919-4eca-b80c-4075fef5662d-1215337607.jpg/ORIG/resize/118x118%3E/extent/118x118/format/jpg/quality/80;10;14.35;;;;2017;;;105271234;geothermal;y;false;;y;Berlin;y;4;9;;15;;;32.41;Berlin;13597;first_time_use;sophisticated;false;;no_information;"Altst&auml;dter Ring";y;;;Altstädter_Ring;apartment;13597;1;;n;;2,active;;Deutschland;top;;wohnung_kauf;n;0;;false;002.01005033525;155000;profile0;6;1;true;y;showqualicontactform;y;n;Spandau_Spandau;WE3-Verkauf;1;Berlin;/expose/105271234;['Bei diesem Wohnhaus handelt es sich um einen exklusiven Neubau, welcher im Mai 2018 fertiggestellt wurde. Es sind 45 hochwertige Eigentumswohnungen entstanden. Zur Auswahl stehen Ihnen großzügig geschnittene 1-bis 2-Zimmerapartmens mit ca. 20m² bis ca. 45m² sowie 3 bis4-Zimmer Penthouses als Maisonetten mit ca. 68m² bis ca. 73m², Hohe Türen, große Fenster mit entspannendem Blick ins Grüne und Sonnenlicht durchflutete, offene Räume erwarten Sie. Die Wohnungen sind nach Süd/Osten und Westen ausgerichtet und verfügen überwiegend über einen eigenen Balkon oder eine Terrasse zum gemütlichen Verweilen an der frischen Luft. Die Ausstattung in Ihrer Wohnung ist edel: In den Bäder befinden sich hochwertige Fliesen. Toiletten, Waschbecken, Bodentiefe Duschwannen namhafter Hersteller, die verchromten Armaturen von der Firma Grohe. Ganz nach Ihren Vorlieben haben Sie die Wahl zwischen zahlreichen Designs. Die Wohnräume ohne Fliesenbelag sind mit hellem Eichenparkett ausgestattet. Jeder Wohnraum verfügt über eine angenehme Fußbodenheizung, die Bäder zusätzlich über Handtuchheizkörper. Zu den Altstadt Studios gehört für alle Parteien ein gemeinsamer Garten im Innenhof sowie zu jeder Wohnung ein eigener Keller. Und nicht nur Ihr Bedürfnis nach einem komfortablen Zuhause wird in diesem Objekt bedient. Auch KfW-55 energieeffizientes, grünes Wohnen ist bei uns Programm.', 'Der Altstädter Ring bietet als Wohnort ein perfektes Rundum-Paket: beste Verkehrsanbindung ins Berliner Zentrum bei gleichzeitigem Altstadtflair und wohltuender Naturnähe. Die zahlreichen Einkaufsmöglichkeiten, Cafés, Restaurants, Märkte und kulturellen Angebote verleihen der Spandauer Altstadt einen lebendigen urbanen Charme.\nNeben kleineren Läden in der Altstadt gibt es ganz in der Nähe die Spandauer Arcaden, ein Einkaufszentrum mit vielfältigen Shopping-Möglichkeiten. Gleichzeitig sind es aber nur wenige Gehminuten bis ans Havelufer, wo man bei einem Spaziergang ausspannen kann. Mit dem S- und U-Bahnhof Rathaus Spandau in unmittelbarer Nähe ist zudem eine praktische Anbindung zur Uni, zum Job sowie zu den Sehenswürdigkeiten und Hotspots der City gewährleistet. Diese besondere Mischung macht die Moritzstraße in Spandau zum per fekten Wohnort für alle, die auf nichts verzichten wollen. Ob Studentenwohnung oder Eigenheim für Singles, viele Menschen wünschen sich heutzutage eine Wohnsituation, die beides bietet: Großstadtleben und Wohnidylle. Was den Kiez um die Moritzstraße neben der guten Infrastruktur so besonders macht, ist der Traditions- und Geschichtsreichtum der Umgebung.\nOb es das historische Stadtbild ist oder die nahegelegene Zitadelle mitsamt integrierter Arbeitsateliers von Künstlern, Handwerkern und Instrumentenbauern, überall spürt man das kulturelle, traditionsbewusste Leben.', 'Schauen Sie sich unser Video an.\n\nEbenfalls stehen noch weitere Wohnungen zum Verkauf zur Verfügung.\n\nFragen Sie uns einfach!'];32.41;;;;;;;88643;2018;true
2020-05-30 19:48:09.896006;Berlin;central_heating;;ONE_YEAR_FREE;179106;n;n;https://pictures.immobilienscout24.de/listings/555f54fe-c381-4c6c-a08a-e5faf11167cb-1352470282.jpg/ORIG/resize/118x118%3E/extent/118x118/format/jpg/quality/80;3;10.3;40 MBit/s;telekom_layer_magenta_l;über VDSL;1904;REGULAR;10.3;115945845;gas;y;true;MagentaZuhause L;n;Berlin;y;9;1;488;no_information;energy_consumption;4.2;98.28;Berlin;14167;mint_condition;sophisticated;false;100 MBit/s;outside;no_information;n;https://padlock.link/ioml;https://padlock.link/ml;no_information;apartment;14167;3.5;159;n;668;2,active;true;Deutschland;standard;100 MBit/s;wohnung_kauf;n;;web,email,bank,music,dl-ul,game,sd,mltstr,hd,fast-ul-dl;true;001.179106;589000;profile0;3;3;true;y;;n;n;Zehlendorf_Zehlendorf;S13679;4;Berlin;/expose/115945845;['Die hier angebotene Eigentumswohnung befindet sich im Hochparterre und Souterrain eines im Jahr 1904 errichteten Mehrfamilienhauses in traumhafter Lage von Zehlendorf. Die jetzigen Eigentümer haben die Wohnung im Jahr 2016 modernisiert, hochwertig ausgestattet und für sich individuell angepasst. Hohe Decken mit Stuck, Parkettböden, hochwertige Fliesen, sowie weitere Zimmer im Souterrain mit Ankleide sind hier nur einige Highlights. Das Umfeld ist geprägt von schönen alten Villen und Parks zum Spazieren gehen oder joggen. Fußläufig erreichen Sie den S-Bahnhof Zehlendorf sowie den Teltower Damm mit diversen Einkaufsmöglichkeiten. \n\nThe condominium offered here is on the raised ground floor and basement of a multi-family house built in 1904 in a fantastic location in Zehlendorf. In 2016, the current owners modernised the house, furnished it to a high standard and adapted it to their individual needs. High ceilings with stucco, parquet floors, high-quality tiles, as well as further rooms in the basement with dressing room are here only some highlights. The environment is characterized by beautiful old villas and parks to walk or jog. Within walking distance you can reach the S-Bahn station Zehlendorf as well as the Teltower Damm with various shopping possibilities.', 'Altbau, Bezug nach Vereinbarung, Einbauküche, Etagenwohnung, Garten/ -mitbenutzung, Gartenterrasse, Gaszentralheizung, gehobene Ausstattung, Gepflegt, Hochparterre, Keller, Maisonette, Modernisiert, Parkett, Renoviert, Selbstnutzung, Stellplatz, Souterrain, unvermietet, Strom', 'Diese Wohnlage gilt als ausgesprochen familienfreundlich: Viele gute Schulen wie z.B. die international renommierte John-F-Kennedy-Schule und Kindergärten sowie der nahe gelegene Heinrich-Laehr-Park sorgen für eine optimale Infrastruktur. Über den nahe gelegenen Teltower Damm erreichen Sie schnell das Zentrum Zehlendorfs mit seinen großzügigen Einkaufsmöglichkeiten und dem S-Bahn-Anschluss. In Gehnähe verfügen Sie über viele Geschäfte des täglichen Bedarfs. Sowohl den Schlachtensee wie auch den Grunewald erreichen Sie in wenigen Minuten. \nThis residential area is considered to be extremely family-friendly: many good schools such as the internationally renowned John F Kennedy School and kindergartens as well as the nearby Heinrich Laehr Park provide an optimal infrastructure. Via the nearby Teltower Damm you can quickly reach the centre of Zehlendorf with its generous shopping facilities and the S-Bahn connection. Within walking distance you will find many shops for your daily needs. Both the Schlachtensee and the Grunewald are just a few minutes away.', 'Sie möchten Ihre Immobilie verkaufen? Wir sind Ihr Partner für einen erfolgreichen Verkauf.\n1. Unsere Experten verfügen über tiefgehende Kenntnis des bestehenden Immobilienmarktes und entwickeln gerne eine individuelle Verkaufsstrategie für Sie. Wir bewerten Ihre Immobilie unverbindlich, kostenfrei und marktgerecht.\n2. Wir sind für Sie da und begleiten Sie von der kostenlosen Beratung bis hin zum Notartermin, immer getreu unserer Philosophie: kompetent, zuverlässig und diskret.\n3. Unser nationales und internationales Netzwerk sowie interne Synergien ermöglichen Ihnen den Zugang zu potenziellen Käufern aus aller Welt und somit einen erfolgreichen Abschluss. \nProfitieren Sie von unserem Know-How, rund 20 Jahren Erfahrung und 6 Büros in den besten Lagen Berlins. Gerne beraten wir Sie kostenlos in unserem Büro, per Telefon oder E-Mail!  \nEnergieausweis vorhanden:\nja'];;E;1;;;;;;;
2020-05-30 19:48:10.306166;Berlin;central_heating;;ONE_YEAR_FREE;213082;n;y;https://pictures.immobilienscout24.de/listings/ea8bc661-d7bc-412b-b446-270ab2a18969-1358124541.jpg/ORIG/resize/118x118%3E/extent/118x118/format/jpg/quality/80;6;12.78;40 MBit/s;telekom_layer_magenta_l;über VDSL;1919;REGULAR;12.78;115963866;gas;n;false;MagentaZuhause L;y;Berlin;y;9;1;410.37;73;energy_consumption;7.25;144.55;Berlin;10555;well_kept;normal;false;100 MBit/s;no_information;Alt-Moabit;n;https://padlock.link/ioml;https://padlock.link/ml;Alt-Moabit;apartment;10555;5;129;n;2001;2,active;true;Deutschland;standard;100 MBit/s;wohnung_kauf;y;1;web,email,bank,music,dl-ul,game,sd,mltstr,hd,fast-ul-dl;true;001.213082;668985;profile0;6;5;true;n;;n;n;Tiergarten_Tiergarten;rwi7569;6;Berlin;/expose/115963866;['Es handelt sich bei diesem Objekt um einen Altbau aus dem Jahre 1919 in einem, für diese Zeit typischen, Mix aus Wohnungen und Gewerbe. So findet man hier ein Vorderhaus mit 2 Seitenflügeln und einem Hinterhaus, die den 1. Innenhof umschließen. Hier gibt es Wohnungen und im EG Gewerbeflächen. Errichtet wurden ein Erdgeschoss, 4 Obergeschosse und ein teilweise ausgebautes Dach mit Terrassen. An der Straßenseite des Vorderhauses gibt es Balkone, die anderen Gebäudeteile haben zumeist einen französischen Balkon. \r\rDanach folgt ein 2. Hof und dahinter ein ehemaliges Fabrikgebäude das gewerblich genutzt wird. Dieses ist bereits vollständig verkauft. ', 'Diese Wohnung ist seit 2016 als Büro vermietet und befindet sich im 1. OG des Vorderhauses. Es verfügt neben einem großen Durchgangszimmer über 4 weitere Büroräume, einer Küche, 2 getrennte WCs und 2 Abstellkammern. Ein Zimmer hat einen Balkon, ein weiteres einen Erker. Diese Einheit hat den klassischen Schnitt einer Altbauwohnung, der nur im Sanitärbereich auf die Bürosituation angepasst wurde. Die typischen charakteristischen Merkmale eines Altbaus aus der Gründerzeit sind bewahrt worden. \r\rDas Büro wird vermietet als Kapitalanlage angeboten mit aktuell 3,3% Rendite, und hat einen Gewerbemietvertrag aktuell bis zum 30.11.2021. Der derzeitige Mieter ist an einer Verlängerung des Mietvertrages interessiert. Eine Nutzung zu Eigenbedarfszwecken (als Wohnung) ist nach Ablauf der Mietzeit ebenso möglich.\r\rWeitere Details auf Anfrage', 'Berlin-Tiergarten-Mitte - Unterhalb der Turmstraße zwischen Spree und Ottopark gelegen. Von hier aus gelangt man schnell in die Innenstadt, zur Universität und auch zum Reichstag. \rDie Straße Alt-Moabit ist die nach der Turmstraße zweitwichtigste und wohl lebendigste Geschäftsstraße Moabits. Die zentrale Lage bietet zwar keine Ruhe wie in ländlicher Abgeschiedenheit, aber durch diese sind zum Beispiel sämtliche Einkäufe fußläufig zu erledigen, und auch Busse und die U-Bahnlinie U9 schnell erreicht. Die größtenteils sanierten hübschen Jugendstilbauten in der Umgebung bieten eine sehr angenehme Wohnlage, und das Bundestagsufer in der Nähe einen tollen Spreeblick zur Naherholung.', 'Der Käufer hat bei Abschluss des Kaufvertrages eine Provision in Höhe von 7,14 % inkl. Mehrwertsteuer vom Kaufpreis an uns zu zahlen. Verdient und fällig bei Beurkundung. Alle Angaben sind ohne Gewähr und nach den Unterlagen des Eigentümers erstellt. Irrtümer und Änderungen vorbehalten. Bei aller Sorgfalt können wir keine Garantie dafür übernehmen, dass alle Angaben richtig sind, und das Objekt im Augenblick des Zugangs der Offerte noch verfügbar ist. \r\rBei Anfragen bitten wir um vollständige Absenderangaben. \r\rGerne zeigen wir Ihnen das Objekt, und freuen uns auf einen persönlichen Termin mit Ihnen. \r\rSie erreichen uns wie folgt:\rRüdiger Wilkanowski Immobilien\rIn Kooperation mit:\r\rJohannes Rudert Immobilien\rTelefon: 0174-9542360\rFax: 030 / 85605613\r\rGerne zeigen wir Ihnen das Objekt, und freuen uns auf einen persönlichen Termin mit Ihnen. \r\rWeitere interessante Angebote finden Sie auch im Internet unter www.wilkanowski-immobilien.de.\r\rSie wollen Ihre Immobilie verkaufen ?\r \rWir suchen im Stadtgebiet von Berlin Immobilien (freie Eigentumswohnungen, Mehrfamilienhäuser und Einfamilienhäuser). Sprechen sie uns gerne an oder vereinbaren Sie einen persönlichen Termin mit uns: 030-85605612.'];;;;;;;;;;
2020-05-30 19:48:10.656131;Berlin;gas_heating;;ONE_YEAR_FREE;17377285;n;y;https://pictures.immobilienscout24.de/listings/155dc209-f650-451c-aa76-72f05db2775d-1361385572.png/ORIG/resize/118x118%3E/extent/118x118/format/jpg/quality/80;13;10.77;40 MBit/s;telekom_layer_magenta_l;über VDSL;1917;REGULAR;10.77;115947257;gas;y;false;MagentaZuhause L;y;Berlin;y;8;1;169;no_information;energy_consumption;5.67;61.42;Berlin;10435;well_kept;no_information;false;100 MBit/s;no_information;no_information;n;https://padlock.link/ioml;https://padlock.link/ml;no_information;apartment;10435;2;98;n;;2,active;true;Deutschland;top;100 MBit/s;wohnung_kauf;n;5;web,email,bank,music,dl-ul,game,sd,mltstr,hd,fast-ul-dl;true;009.0f0298f5-eca1-4ceb-9c3a-681bbc3b60a9;410000;profile0;;2;true;n;showqualicontactform;n;n;Mitte_Mitte;WE27;3;Berlin;/expose/115947257;['Verkauf Zwei-Zimmer-Eigentumswohnung \r\n\r\nEs  handelt sich um eine helle Zwei-Zimmer-Wohnung  in einem ca. 1919 erbauten und architektonisch imposant gestalteten Mehrfamilienhaus mit 15 Wohneinheiten  inklusive Seitenflügel. \r\n\r\nDas Wohnhaus mit seiner schönen Fassade  ist in Obergeschoss, zweites, drittes, viertes sowie fünftes Obergeschoss, ausgebautes Dachgeschoss und Vollkeller aufgeteilt und in 2004 aufwendig saniert worden.\r\n\r\nDie hier angebotene Wohnung befindet sich im fünften Obergeschoss des vorderen Wohngebäudes. \r\n\r\nDie Wohnung teilt sich auf in ein großes Wohnzimmer mit Zugang zum Westbalkon, ein Bad mit Dusche, ein großzügiges Schlafzimmer, eine Diele sowie die Küche mit Einbauküche auf. \r\n\r\nDie Wohnfläche der Eigentumswohnung beträgt ca. 61,42 m². \r\n\r\nDas monatliche Hausgeld beträgt derzeit ca. 155,00 €. \r\n\r\nBesonderheit: Die Möbel können größtenteils übernommen werden. \r\n', '√ Wohnhaus vollständig saniert im Jahr 2004\r\n√ Westbalkon \r\n√ Badezimmer mit Dusche\r\n√ Parkettboden\r\n√ Küche mit Einbauküche\r\n√ Gegensprechanlage\r\n√ Zusätzlicher Kellerraum mit ca. 4 m² Nutzfläche\r\nv Große Fenster in Ostausrichtung zur Wolliner Straße + Balkon in Süd-westlicher Ausrichtung zum Innenhof\r\n√ Blick auf den berühmten Fernsehturm\r\n√ Einer der beliebtesten Kieze Berlins\r\n√ Architektur aus der Gründerzeit\r\n√ Gas-Zentralheizung mit Warmasserversorgung', 'Diese Immobilie befindet sich in begehrter Wohnlage im beliebten Berlin Bezirk, Mitte/Prenzlauer Berg zwischen dem Arkonaplatz und dem historischen Zionskirchplatz. Unweit des Objektes finden Sie zahlreiche Cafés, Bars, sowie Geschäfte des täglichen Bedarfs. vor.\r\n\r\nIn der Fürstenberger Straße finden Sie eine KITA sowie einen großen Lebensmitteleinzelhändler für den Einkauf. Fußläufig erreichen Sie die Tram Stationen Schwedter Straße und Zionskirchplatz (12, M1) sowie den U-Bahnhof Bernauer Straße und Rosenthaler Platz\r\n(U8).\r\n\r\nDarüber hinaus bietet die Nähe zum Rosenthaler Platz dem Hackeschen Markt sowie der Kastanienallee und dem Mauerpark zahlreiche Möglichkeiten zur Abendgestaltung, zum Shoppen oder flanieren.'];;;;;;;;;2002;
2020-05-30 19:48:10.992999;Berlin;no_information;;ONE_YEAR_FREE;18275726;n;n;https://pictures.immobilienscout24.de/listings/c095ad88-2548-4e9c-ab50-daf16871b7a1-1352567062.jpg/ORIG/resize/118x118%3E/extent/118x118/format/jpg/quality/80;23;16.54;40 MBit/s;telekom_layer_magenta_l;über VDSL;1900;REGULAR;16.54;115956995;;n;false;MagentaZuhause L;y;Berlin;y;3;1;173;12;;8.84;38;Berlin;12049;refurbished;no_information;false;100 MBit/s;no_information;Leinestr.;n;https://padlock.link/ioml;https://padlock.link/ml;Leinestr.;no_information;12049;1;;n;;2,active;true;Deutschland;top;100 MBit/s;wohnung_kauf;y;1;web,email,bank,music,dl-ul,game,sd,mltstr,hd,fast-ul-dl;true;009.f57d2d35-e279-4391-8108-5259798c19a4;140000;profile0;5;1;true;n;showqualicontactform;n;n;Neukölln_Neukölln;115956995;1;Berlin;/expose/115956995;['Dieses gepflegte 1-Zimmer Wohnung befindet sich im 1. Stock eines modernisierten historischen Gebäudes. Die helle Wohnung besteht aus einen großen Wohnbereich, einen Flur, eine geräumige separate Küche und ein modernes Badezimmer. Das große Wohnzimmer hat hohe Decken, klassischen Stuck und zwei große Fenster mit Blick auf den ruhigen grünen Innenhof. Vom Eingangsbereich aus kann man das Bad, die Küche und das große Wohnzimmer separat betreten. Die geräumige Küche ist mit Wand- und Bodenschränken sowie einem Elektroherd ausgestattet. Auch dieser Wohnung ist ein Kellerraum zugeordnet. \n\nAus Datenschutzgründen können wir keine Fotos der gemieteten Wohnung zeigen. Die folgenden Fotos zeigen die entsprechende Wohnung eine Etage tiefer.\n\n\nDie Wohnung befindet sich im Berlins im Stadtteil Neukölln gleich um die Hermannstr. In der Umgebung finden Sie Restaurants, Cafés, Supermarkte, Kunstboutiquen und Bars Die Verkehrsanbindung ist sehr gut und man kann die Innenstadt innerhalb von 15 Minuten über die U-Bahn-Station Leinestr erreichen.\n\n---------------------------------------------------------------------\n\nThis well-maintained tenanted studio apartment is situated on the 1st floor of a modernised period building. The bright apartment is partitioned into a large living area, hallway, spacious separate kitchen, and modern bathroom. The large living room has high ceilings, classic stucco and two large windows overlooking the quiet green courtyard. From the entrance hallway one can access the bathroom, the kitchen and the large living room separately. The spacious kitchen is fitted with wall and floor cabinets as well as a electric stove. There is a cellar compartment as- signed to this apartment as well. Due to tenancy privacy concerns we cannot show photos of the tenanted apartment, the photos below are of the equivalent apartment one floor down.\nThe apartment is located on the quiet side street of Leinestr. which is just north of the popular and busy Hermannstraße. On Hermannstr. one has access to a wide range of shopping such as Lidl Kaiser, Turkish and a wide range of department stores, boutiques, specialty shops restaurants, and cafes. The popular Tempel- hoferfeld is just a few minutes walk away and is perfect to escape the busy city life.\n\nThe transport connection is very good and one can reach Akexanderplatz within 20 minutes through the U-Bahn station Leinestr.\n\nRent:\n\nNet rent: 255,00€ BK/HK: 85,00€ Gross rent: 340,00€\n\nEnergy certificate:\nIdentification type: Consumption certificate /Domestic hot water included: No / Parameter val- ue: 121 kWh (m2 • a) Energy source: Natural gas, light / valid until 29.08.2028'];;;;;;;;;;
