2020-05-30 19:38:31.619043;Berlin;central_heating;15474925;n;y;https://pictures.immobilienscout24.de/listings/93b0b52f-36d9-4265-b44a-98e46510fde6-1363101989.png/ORIG/resize/118x118%3E/extent/118x118/format/jpg/quality/80;8;10.95;1910;;;10.95;117297438;natural_gas_light;n;false;n;Berlin;y;8;1;24;6.54;87.5;Berlin;10405;no_information;no_information;false;no_information;"Jablonskistra&szlig;e";y;Jablonskistraße;apartment;10405;3;n;2,active;Deutschland;top;wohnung_kauf;y;3;;true;001.15417560;413245;profile0;5;3;true;n;n;n;Prenzlauer_Berg_Prenzlauer_Berg;VK-17030_WE20_IN_TT;4;Berlin;/expose/117297438;['Das gepflegte 5-geschossige Mehrfamilienhaus aus dem Jahr 1910 besteht aus einem Vorder- sowie einem Hinterhaus und verfügt über einen mit Glas überdachten Innenhof.\n\nDie zum Verkauf stehende Wohnung ist im Vorderhaus gelegen und befindet sich im dritten Obergeschoss rechts. Sie ist bequem über den Aufzug erreichbar.\n\nDie Wohnung verfügt über eine Wohnfläche von ca. 87,5 m². Diese verteilt sich auf insgesamt drei Zimmer nebst einem Wannenbad und einer Küche. Ein Balkon mit einer nord-östlichen Ausrichtung lädt zu erholsamen Stunden ein.\n\nEin Keller ist der Wohnung ebenfalls zugeteilt.\n\nDie Wohnung ist seit November 1995 zuverlässig vermietet. Dem Mieter steht nach Verkauf der Wohnung eine 10-jährige Kündigungssperrfrist zu.', 'Die Immobilie befindet sich in Prenzlauer Berg, ein sehr beliebter Stadtbezirk im östlichen Zentrum von Berlin. Prenzlauer Berg ist geprägt durch Altbauten, die größtenteils aus der Zeit um die Wende zum 20.\xa0Jahrhundert (1889 bis 1905) stammen. Über 80\xa0Prozent aller Wohnungen des Gebiets entstanden vor 1948.\n\nDas Gebäude ist in einer ruhigen Seitenstraße der Prenzlauer Allee gelegen. In der Nähe befinden sich viele Parkanlagen, unter anderem der Ernst-Thälmann-Park, Kollwitzplatz, Volkspark Friedrichshain und der Mauerpark.\xa0\n\nEinkaufsmöglichkeiten für den täglichen Bedarf sind in der Nähe zu erreichen. Eine große Auswahl an Cafés und Restaurants findet man in unmittelbarer Nähe in Richtung des Kollwitzplatz.\xa0\n\xa0\nEine gute Anbindung an den ÖPNV ist durch naheliegende Tramlinien (Tramlinie M2 und M10), sowie den U-Bahnhof Eberswalder Str. und den S-Bahnhof Greifswalder Str. gegeben.'];ONE_YEAR_FREE;40 MBit/s;telekom_layer_magenta_l;;über VDSL;REGULAR;;MagentaZuhause L;287.02;energy_consumption;C;100 MBit/s;https://padlock.link/ioml;https://padlock.link/ml;86.1;;true;100 MBit/s;web,email,bank,music,dl-ul,game,sd,mltstr,hd,fast-ul-dl;;;;;;
2020-05-30 19:38:31.988022;Berlin;district_heating;179106;n;y;https://pictures.immobilienscout24.de/listings/f0f383ec-338b-4d53-976d-2fae80f507d7-1363051965.jpg/ORIG/resize/118x118%3E/extent/118x118/format/jpg/quality/80;6;11.12;1938;;;11.12;117296527;district_heating;y;true;y;Berlin;y;5;1;no_information;6.13;47;Berlin;10629;well_kept;normal;false;no_information;no_information;n;no_information;apartment;10629;2;n;2,active;Deutschland;standard;wohnung_kauf;y;1;;false;001.179106;245000;profile0;1;2;true;n;n;n;Charlottenburg_Charlottenburg;J13119;2;Berlin;/expose/117296527;"['""BITTE PRÜFEN SIE AUCH IHREN SPAM-FILTER, WENN SIE EINE IMMOBILIE BEI UNS ANFRAGEN, UM KEINE E-MAIL ZU VERPASSEN""\n\nBei diesem Objekt handelt sich um eine helle und sehr gepflegte Altbauwohnung, die sich in der ersten Etage eines Berliner Mehrfamilienhauses befindet. Die Wohnung verfügt über eine Wohnfläche von ca. 47 m², die sich auf zwei Zimmer, Flur, Wohnküche, Balkon und Badezimmer verteilen. Beide Zimmer sind geprägt durch hohe Decken und einem schönen Holzdielenboden. Abgerundet wird dieses Angebot durch den südöstlich ausgerichteten Balkon und einem zur Wohnung zugehörigen Keller. Die Wohnung wurde 2019 zuletzt renoviert. Hierbei wurde alle Wände und Decken glatt verputzt. 2010 fand eine aufwendige vollständige Modernisierung der Elektrik, sowie Wasser- und Abwasserleitungen statt. \n\nThis property is a bright and very well-kept apartment in an old building, located on the first floor of a Berlin apartment building. The apartment has a living space of approx. 47 m², which is divided into two rooms, hall, kitchen-living room, balcony and bathroom. Both rooms are characterized by high ceilings and a beautiful wooden floor. This offer is rounded off by the south-east facing balcony and a cellar shed belonging to the apartment. The apartment was last renovated in 2019. All walls and ceilings were plastered smooth. In 2010, an extensive and complete modernisation of the electrical system as well as the water and sewage pipes took place.', 'Altbau, Balkon/Terrasse, Bezug nach Vereinbarung, Dielen, Einbauküche, Etagenwohnung, Gepflegt, Hochparterre, kein Erbbaurecht, Keller, Leerstand, Modernisiert, normale Ausstattung, Selbstnutzung, Süd-West-Grundstück, vermietet zeitweise', 'Diese Wohnlage nahe des Savignyplatzes gehört zu den beliebtesten der Stadt. In einer Seitenstraße des Savigny-Kiez befinden Sie sich an einem der wichtigsten Hotspots der Hauptstadt. Die Kombination aus extravaganten Einzelhandelsgeschäften sowie einem umfangreichen Angebot an Gastronomie und kulturellen Möglichkeiten macht diese Straße im Herzen von Charlottenburg so attraktiv. Die Einkaufsmöglichkeiten lassen keine Wünsche offen, alle Waren des täglichen Bedarfs können in fußläufiger Nähe eingekauft werden. Zum Shoppen und Flanieren laden die nahegelegene Kantstraße oder der Kurfürstendamm ein. In unmittelbarer Nähe fahren diverse Buslinien sowie die S- und U-Bahn, welche beste Anbindungen ans Netz der öffentlichen Verkehrsmittel bieten. \nThis residential area near Savignyplatz is one of the most popular in the city. In a side street of the Savigny-Kiez you are at one of the most important hotspots of the capital. The combination of extravagant retail shops and a wide range of gastronomy and cultural opportunities makes this street in the heart of Charlottenburg so attractive. The shopping facilities leave nothing to be desired, all everyday goods can be purchased within walking distance. The nearby Kantstraße or Kurfürstendamm invite you to shop and stroll. Various bus lines as well as the S-Bahn and U-Bahn (suburban and underground railway) run in the immediate vicinity, offering excellent connections to the public transport network. ', 'Sie möchten Ihre Immobilie verkaufen? Wir sind Ihr Partner für einen erfolgreichen Verkauf. \n1.Unsere Experten verfügen über tiefgehende Kenntnis des bestehenden Immobilienmarktes und entwickeln gerne eine individuelle Verkaufsstrategie für Sie. Wir bewerten Ihre Immobilie unverbindlich, kostenfrei und marktgerecht.\n 2.Wir sind für Sie da und begleiten Sie von der kostenlosen Beratung bis hin zum Notartermin, immer getreu unserer Philosophie: kompetent, zuverlässig und diskret. \n3.Unser nationales und internationales Netzwerk sowie interne Synergien ermöglichen Ihnen den Zugang zu potenziellen Käufern aus aller Welt und somit einen erfolgreichen Abschluss. \nProfitieren Sie von unserem Know-How, rund 25 Jahren Erfahrung und Standorten in den besten Lagen Berlins. Gerne beraten wir Sie kostenlos in unserem Büro, per Telefon oder E-Mail!  \nEnergieausweis vorhanden:\nja']";;;;;;;;;231;;;;;;;667;;;;;;;;;
2020-05-30 19:38:32.475081;Berlin;district_heating;16295826;n;y;https://pictures.immobilienscout24.de/listings/a29b7caf-a304-41fd-960e-f5b6efdb24bd-1368909006.jpg/ORIG/resize/118x118%3E/extent/118x118/format/jpg/quality/80;10;11.49;1961;;;11.49;117301750;district_heating;n;false;y;Berlin;y;7;2;no_information;6.07;80.64;Berlin;12167;well_kept;no_information;false;outside;no_information;y;no_information;apartment;12167;4;n;2,active;Deutschland;top;wohnung_kauf;n;;;true;001.15965159;330000;profile0;;4;true;n;n;n;Steglitz_Steglitz;2272;3;Berlin;/expose/117301750;['Die Wohnung befindet sich im 4. OG des 1961 erbauten Wohnhauses. Die jeweiligen Wohnungen sind über das Treppenhaus oder auch über einen Personenaufzug gut erreichbar. Durch die Wohnungstür, welche eine Sicherheitstür ist, eingetreten befindet man sich im zentralen und äußerst großen Flur mit Garderobe und einer Nische. Von hieraus erreicht man alle Räumlichkeiten. Hierunter fallen das Badezimmer, die Küche und die 4 Wohnräume. Vom großzügigen Wohnzimmer gelangt man auf den Balkon. 1986 wurde die Wohnung einigen Maßnahmen unterzogen. \n\nZu der Wohnung gehört ein eigener Kellerraum, zusätzlich befindet sich hier noch ein Fahrradkeller. Weiter befinden sich gleich zwei eigene Kfz-Stellplätze auf dem Grundstück. Die Wohnung ist sofort bezugsfrei und als sehr gepflegt zu bezeichnen.', 'Die Wohnanlage befindet sich im südlich gelegenen Berlin Steglitz in einer ruhigen Seitenstraße, die von der bekannten und belebten Albrechtstraße nicht weit entfernt ist. Der nächstgelegene Bahnhof, der S-Bahnhof Südende (Linie S25 und 26), ist fußläufig erreichbar. Weiterhin sind Busverbindungen (u.a. Linie 181,186 u. 284) ebenfalls fußläufig erreichbar, Schulen, Kindertagesstätten, Ärzte und Läden des täglichen Bedarfs in unmittelbarer Nähe gut zu erreichen. Mit dem Auto gelangt man ideal in das Zentrum der Hauptstadt. Als Naherholungsgebiet stehen der große Stadtpark Steglitz, der Insulaner mit seinem Sommerbad und das gut erreichbare Stadtbad Leonorenstraße zur Verfügung.', 'Ausführliche Exposés werden nur bei vollständiger Adressangabe verschickt. Wir bitten um Ihr Verständnis.Weitere Immobilienangebote können Sie hier einsehen:www.wolfgang-schulz-immobilien.de'];ONE_YEAR_FREE;40 MBit/s;telekom_layer_magenta_l;;über VDSL;REGULAR;2;MagentaZuhause L;344;energy_consumption;E;100 MBit/s;https://padlock.link/ioml;https://padlock.link/ml;156;;true;100 MBit/s;web,email,bank,music,dl-ul,game,sd,mltstr,hd,fast-ul-dl;showqualicontactform;;;;;
2020-05-30 19:38:32.845406;Berlin;;246804;n;n;https://pictures.immobilienscout24.de/listings/2080b645-24d9-4a29-a3aa-53b41711906d-1371837233.jpg/ORIG/resize/118x118%3E/extent/118x118/format/jpg/quality/80;18;12.7;;;;12.7;117300701;no_information;n;false;y;Berlin;n;11;;4;7.58;257;Berlin;10785;mint_condition;no_information;false;no_information;Am Park;y;Am_Park;apartment;10785;4;n;2,active;Deutschland;top;wohnung_kauf;n;1;;true;001.246804;2950000;profile0;9;4;true;n;n;n;Tiergarten_Tiergarten;52160;7;Berlin;/expose/117300701;"['Zum Gebäudeensemble Beisheim Center am Potsdamer Platz gehören neben stilvollen Bürogebäuden und internationalen 5-Sterne-Hotels auch luxuriöse Wohnhäuser. Star-Architekt David Chipperfield hat für die Parkside Apartments eine besondere Formsprache und Ausstattung gewählt, die exklusiven Wohnansprüchen gerecht wird. Für die markante Fassade hat er Muschelkalk verwendet.\r\n\r\nDie Eigentumswohnung auf schönster Bel-Etage verdient die Bezeichnung ""Residenz"". Es erwartet Sie höchster Komfort verbunden mit modernstem High Tech wie man es von einem zeitgemäßen Smart Home erwartet. Von der nach Süd-Westen ausgerichteten, ca. 90 qm große  Wohnzimmerlandschaft schauen Sie durch bodentiefe Fenster auf das Sony-Center und den Tiergarten. Der S/W-Balkon und die große Loggia laden zum Austritt bei frischer Luft und Sonnenschein ein.\r\n\r\nBewohner und Gäste betreten das Gebäude durch eine repräsentative Eingangslobby und werden vom Concierge empfangen. Der 24 Stunden Servicedienst garantiert einen hohen Sicherheitsstandard. Diskretion ist selbstverständlich und schützt die Privatsphäre.\r\n\r\nEin besonderes Highlight ist der ""Fünf-Sterne-Plus-Hotelservice"", der es den Bewohnern erlaubt, sowohl die Serviceleistungen als auch die Infrastruktur des Hotels ""Ritz-Carlton"" zu nutzen. Ein weiterer Bonus ist die erstaunlich ruhige Lage, da es an dieser Stelle nur äußerst begrenzten Anliegerverkehr gibt.\r\n\r\nDie Wohnung wird geräumt übergeben. Die Möbel können aber gern zusätzlich erworben werden.\r\n', '+ Lift\r\n+ Fußbodenheizung \r\n+ Großer Süd-West Balkon als Loggia \r\n+ 24 h Concierge-Service\r\n+ Feinste Marmorbäder (zwei)\r\n+ 2 Tiefgaragenstellplätze\r\n+ Smarthome\r\n', 'Das Beisheim Center,mit dem The Ritz-Carlton liegen direkt am Potsdamer Platz, der mit seinen luxuriösen Wohnhäusern, Fünf-Sterne-Hotels, stilvollen Bürogebäuden und exklusiven Geschäften zum Herz des historischen Berlins gehört. Mit seiner neuen Architektur und seiner Nähe zum Regierungsviertel zählt der Potsdamer Platz zu den repräsentativsten, begehrtesten und hochpreisigsten Wohnlagen in Berlin. Wenige Meter entfernt beginnt der Tiergarten, Berlins größte Parklandschaft. Viele Sehenswürdigkeiten, kulturelle und staatliche Einrichtungen sind zu Fuß erreichbar (darunter das Botschaftsviertel, das Brandenburger Tor, der Deutsche Bundestag, das Bundeskanzleramt, die Philharmonie, die Friedrichstraße, die Staatsoper und die Museumsinsel). Das Zentrum der City West erreichen Sie in zehn bis 15 Minuten. \r\n\r\nDie nahegelegenen S- und U-Bahnstationen gewährleisten eine optimale Anbindung an den öffentlichen Nahverkehr.\r\nDas Brandenburger Tor sowie das Hotel Adlon liegen in fußläufiger Entfernung.']";ONE_YEAR_FREE;40 MBit/s;telekom_layer_magenta_l;;über VDSL;REGULAR;;MagentaZuhause L;2000;no_information;;100 MBit/s;https://padlock.link/ioml;https://padlock.link/ml;;;true;100 MBit/s;web,email,bank,music,dl-ul,game,sd,mltstr,hd,fast-ul-dl;showqualicontactform;;;;;
2020-05-30 19:38:33.185078;Berlin;district_heating;15832933;n;y;https://pictures.immobilienscout24.de/listings/21077e71-9ea7-4fc1-87de-a8a26f8c03c3-1363110899.jpg/ORIG/resize/118x118%3E/extent/118x118/format/jpg/quality/80;9;11.24;1960;disabled;;11.24;117304994;district_heating;n;false;y;Berlin;n;4;2;56;6.2;43;Berlin;10717;well_kept;no_information;false;no_information;"Pfalzburger Stra&szlig;e";y;Pfalzburger_Straße;apartment;10717;1;n;2,active;Deutschland;standard;wohnung_kauf;n;1;;true;001.15612808;193500;profile0;4;1;true;n;n;n;Wilmersdorf_Wilmersdorf;56_10;2;Berlin;/expose/117304994;['Das Haus in der Pfalzburger Straße 56 wurde 1960 erbaut. Die zum Verkauf stehende Wohnung verfügt über einen Südbalkon und ist bezugsfrei. Großflächige Fenster und die Ausrichtung sorgen für viel Licht. Der zweckdienliche und moderne Schnitt nutzt die  Wohnfläche optimal aus. Der Einheit wird ein Keller zugeordnet. Der Zugang zur Wohnung erfolgt über ein Laubengang, ein Aufzug hält der Etage. Verkäuferseits wurde die Fassadenrückseite kürzlich instandgesetzt. Die Beheizung erfolgt per Fernwärme.', 'Südbalkon, praktischer Schnitt, Aufzug', 'Die Pfalzburger Straße 56 befindet sich 2 Kilometer vom Kurfürstendamm entfernt. Das Stadtviertel ist bekannt für seine gewachsenen Strukturen, gute Altbausubstanz und vor allem auch für seine üppige Kunst- und Kulturlandschaft. Zahlreiche Sehenswürdigkeiten, Parks, Geschäfte und Freizeitaktivitäten machen es auch für Touristen zu einem beliebten Ziel. Der U-Bhf Hohenzollerdamm mit der Linie U3 und die Straßenbahnlinie M19 sind in 5 Gehminuten und die Bushaltestelle Güntzelstraße/Uhlandstraße in 3 Gehminuten erreicht. Der bekannte Preußenpark, auch „Thaipark“ genannt, befinden sich in fußläufiger Entfernung. Er lockt nicht nur Erholungssuchende, sondern bietet auch kulinarische Genüsse. Ringsherum um die Pfalzburger Straße gibt es mehrere Bildungs- und Sportangebote, sowie Arztpraxen. Schnell erreicht sind auch gemütliche Cafés und Restaurants.', 'Dieses Kaufangebot ist provisionspflichtig. Dem Erwerber wird bei Abschluss eines Kaufvertrages eine Provision in Höhe von 3,57 % des beurkundeten Kaufpreises inkl. der gesetzlichen MwSt. berechnet. Abweichungen sind nur in Form einer gesonderten, schriftlichen Vereinbarung gültig. Die Neo Res Immobilien GmbH ist Rechnungsstellerin und Empfängerin der Provision. Irrtum und Zwischenverkauf sind vorbehalten. Alle Informationen und Unterlagen sind uns von Seiten des Verkäufers übermittelt und werden ohne Haftung für Vollständigkeit oder Fehlinformationen von uns weitergeleitet. Hinsichtlich weiterer Dienstleistungen in Zusammenhang mit dem Erwerb, wie beispielsweise Finanzierungen oder entsprechende Versicherungen unterstützen wir Sie gerne. Es ist uns leider nicht gestattet, Sie zu steuerrelevanten Aspekten zu beraten. Hierzu wenden Sie sich bitte an Ihren Steuerberater, beziehungsweise werden wir auch in diesem Zusammenhang gerne vermittelnd tätig. Es gelten unsere AGB. Bitte informieren Sie sich über deren Inhalt auf unserer Homepage www.neo-res.de.'];ONE_YEAR_FREE;40 MBit/s;telekom_layer_magenta_l;;über VDSL;REGULAR;;MagentaZuhause L;190.64;energy_consumption;E;100 MBit/s;https://padlock.link/ioml;https://padlock.link/ml;157;;true;100 MBit/s;web,email,bank,music,dl-ul,game,sd,mltstr,hd,fast-ul-dl;showqualicontactform;;;;;
2020-05-30 19:38:33.575337;Berlin;self_contained_central_heating;15474925;n;n;https://pictures.immobilienscout24.de/listings/d52025e8-6111-45f1-b2e1-b971ea786d44-1363150394.jpg/ORIG/resize/118x118%3E/extent/118x118/format/jpg/quality/80;22;10.81;1893;;;10.81;117313754;natural_gas_heavy;n;false;y;Berlin;y;5;1;no_information;6.01;65.15;Berlin;12159;no_information;no_information;false;no_information;no_information;n;no_information;ground_floor;12159;2;n;2,active;Deutschland;top;wohnung_kauf;y;0;;;001.15417560;245000;profile0;4;2;true;n;n;n;Friedenau_Schöneberg;VK-19105_WE01_AE;3;Berlin;/expose/117313754;['Das Wohnhaus wurde 1893 erbaut, ist in ein Vorderhaus und in einen Seitenflügel aufgeteilt und besteht aus 15 Wohneinheiten.\n\nDie Wohnung befindet sich im Vorderhaus des Erdgeschosses, verfügt über ca. 65,15 m² und ein Sondernutzungsrecht für zwei Gartenanteile, straßenseitig und im Hof - und das mitten im Herzen von Berlin.\n\nDer Grundriss ist gut aufgeteilt in Flur, Bad, Küche sowie zwei Zimmer.\n\nDas repräsentative Haus hat eine wunderschöne Klinker-/Stuckfassade. \n\nDie Wohnungen im Haus werden mit Nachtspeicheröfen beheizt.  Es sind aber neue Leitungen verlegt worden, so dass in der Wohnung eine Gasetagenheizung eingebaut werden könnte.\n\nDie Wohnung ist zuverlässig vermietet.', 'Die Immobilie befindet sich im beliebten Berliner Stadtteil Friedenau in einer ruhigen Seitenstraße.\n\nDer Stadtteil Friedenau wurde ursprünglich in der Kaiserzeit als Landhauskolonie angelegt. Heute überzeugt er durch sanierte Altbauten mit repräsentativen Fassaden und mit ihren kleine, grünen Vorgärten. Das Zentrum von Friedenau bildet der Friedrich-Wilhelm-Platz.\n \nHervorragende Einkaufsmöglichkeiten und eine gastronomische Vielfalt bietet die nur sechs Gehminuten entfernte Schloßstraße, die als kleine Schwester vom Kurfürstendamm bekannt und beliebt ist.\n\nDie unmittelbare Umgebung bietet in allen Bereichen eine komplette Versorgungsfunktion. Schulen, Kitas, Dienstleistungs- sowie Gesundheitseinrichtungen sind in einer Vielzahl vorhanden.  \n\nFür Erholungs- und Freizeitangebote dienen der Volkspark Wilmersdorf und der Rudolph-Wilde Park, welche in wenigen Minuten sowohl mit dem Fahrrad oder auch zu Fuß zu erreichen sind.\n\nAuch eine gute Anbindung an den öffentlichen Personalverkehr ist durch den U-Bhf. Friedrich-Wilhelm Platz gegeben.\n\nWer mit dem Auto fährt, kann mithilfe der A103 viele Orte Berlins schnell erreichen.'];;;;;;;;;215;energy_consumption;;;;;109.4;;;;;;;;;;
2020-05-30 19:38:34.060248;Berlin;central_heating;241868;n;y;https://pictures.immobilienscout24.de/listings/1468ec19-44ce-408b-903d-d4a6fe3c2706-1363128355.jpg/ORIG/resize/118x118%3E/extent/118x118/format/jpg/quality/80;10;9.92;1996;;;9.92;117309270;gas;y;true;y;Berlin;n;5;5;no_information;5.71;55.05;Berlin;13156;well_kept;normal;false;underground_garage;no_information;y;no_information;apartment;13156;2;n;2,active;Deutschland;top;wohnung_kauf;y;;;true;001.241868;225000;profile0;4;2;true;n;n;n;Niederschönhausen_Pankow;2937;2;Berlin;/expose/117309270;"['Die hier angebotene vermietete Eigentumswohnung befindet sich in einer Wohnanlage mit mehreren Stadthäusern, die von einer hübschen parkähnlichen Grünanlage umgeben sind. Die Zweizimmerwohnung mit einem großen Eckbalkon liegt im zweiten Obergeschoss eines sehr gepflegten Hauses, die bequem mit einem Aufzug erreichbar ist. Über einen kleinen Flur mit Einbauschrank gelangt man rechts in ein raumhoch gefliestes Marmor-Wannenbad mit Waschmaschinenanschluss und links in das Schlafzimmer. Das an den Flur angrenzende Wohnzimmer mit Eckbalkon und offener Küche wirkt durch die drei Fenster und das große Balkonfenster sehr hell und freundlich. Zwischen Küchen- und dem Wohnbereich ist Platz für einen mittelgroßen Esstisch. Zur Eigentumswohnung gehört ein Keller sowie ein Tiefgaragenstellplatz, der derzeit separat vermietet wird.\n\nWichtige Information:\nMit dem Inkrafttreten des Gesetzes zur Mietenbegrenzung im Wohnungswesen in Berlin vom 23.02.2020 darf der Mietenwert zum Stichtag am 18.06.2019 nicht überschritten werden. Des Weiteren gilt eine Mietentabelle (inkl. Zulagen), an deren Werte die Entgegennahme der Miete ab dem 23.11.2020 anzupassen ist. Diese Verordnung gilt bis zum 22.02.2025.', '- vermietete Zweizimmer-Eigentumswohnung im 2.OG\n- großer Eckbalkon\n- offene Küche mit Einbauküche und Fenster\n- Marmor-Wannenbad mit Waschmaschienenanschluss\n- Aufzug\n- Parkettböden\n- Tiefgaragen-Stellplatz', 'Pankow setzt sich aus den historisch gewachsenen Bezirken Pankow, Prenzlauer Berg und Weißensee zusammen und ist auf Grund der Sozialstruktur, der schönen Bauwerke, der vielen Parkanlagen und der guten Verkehrsanbindung  einer der beliebtesten Bezirke Berlins.\nDas Zentrum von Pankow bildet der Pankower Anger und die Breite Straße, mit dem heutigen ältesten Baudenkmal Pankows - der alten Pfarrkirche. Daneben befinden sich das Rathaus, zahlreiche Geschäfte des täglichen Bedarfs, ein großes Einkaufszentrum und gemütliche Cafés und Restaurants.\nNur wenige Gehminuten vom Zentrum Pankows entfernt befindet sich das denkmalgeschützte Schloss Schönhausen mit einem weitläufigen Park, der an das Sommerbad Pankow angrenzt. Auch zahlreiche andere Sportstätten und Parkanlagen laden zum Relaxen ein.\nVon der Waldemarstraße fußläufig erreichbar sind mehrere Kitas, eine Grundschule und ein Gymnasium. Zwei Supermärkte befinden sich in unmittelbarer Nähe.\nZum Bahnhof Friedrichstraße gelangt man entweder mit der Straßenbahn oder S-Bahn in maximal 30 Minuten. Die Autobahn 100 ist ca. 8 Kilometer entfernt, über die das wald- und seenreiche Land  Brandenburg und die Ostsee schnell zu erreichen sind.', 'Berliner Volksbank Immobilien - Ihr Partner beim Immobilienkauf und -verkauf.\n\nGerne stellen wir Ihnen ein ausführliches Exposé inkl. genauer Anschrift dieser Immobilie zur Verfügung. Bitte nutzen Sie hierfür das Kontaktfeld auf dieser Seite. Ihre vollständigen Kontaktdaten (Name, Anschrift, Telefonnummer und Email-Adresse) werden ausschließlich für den Versand von Immobilienangeboten gespeichert. \n\nAuf Grund von gesetzlichen Vorgaben sind telefonische Auskünfte zur genauen Immobilien-Anschrift nicht möglich; Besichtigungstermine können daher erst nach Exposé-Erhalt abstimmt werden.\n\nEinen Überblick unserer Angebote finden Sie auf unserer Website: www.bvbi.de \n\nAls Tochterunternehmen einer genossenschaftlichen Universalbank sind wir mit ganzheitlicher Beratung  vertraut. So erhalten Sie alle Dienste rund um Ihre Traumimmobilie aus einer Hand – von den Finanzierungslösungen der Berliner Volksbank bis zu den Dienstleistern starker und renommierter Partner wie der R+V Versicherung und der Bausparkasse Schwäbisch Hall.']";ONE_YEAR_FREE;40 MBit/s;telekom_layer_magenta_l;;über VDSL;REGULAR;1;MagentaZuhause L;180;energy_consumption;C;100 MBit/s;https://padlock.link/ioml;https://padlock.link/ml;90;21;true;100 MBit/s;web,email,bank,music,dl-ul,game,sd,mltstr,hd,fast-ul-dl;;;;;;
