2020-05-30 19:48:11.342432;Berlin;central_heating;;ONE_YEAR_FREE;76007;n;y;https://pictures.immobilienscout24.de/listings/5c6fc8f1-e1e0-4109-8994-8561a3c39993-1371983874.jpg/ORIG/resize/118x118%3E/extent/118x118/format/jpg/quality/80;14;11.37;40 MBit/s;telekom_layer_magenta_l;über VDSL;1958;REGULAR;11.37;115945450;district_heating;y;true;MagentaZuhause L;y;Berlin;n;5;2;275.4;no_information;energy_consumption;5.8;56.67;Berlin;10717;no_information;no_information;false;100 MBit/s;no_information;no_information;y;https://padlock.link/ioml;https://padlock.link/ml;no_information;raised_ground_floor;10717;2;178.2;n;4101;2,active;true;Deutschland;standard;100 MBit/s;wohnung_kauf;n;0;web,email,bank,music,dl-ul,game,sd,mltstr,hd,fast-ul-dl;true;001.76007;245000;profile0;6;2;true;n;showqualicontactform;n;n;Wilmersdorf_Wilmersdorf;68558;2;Berlin;/expose/115945450;"['Diese schöne und bezugsfreie 2-Zimmer-Eigentumswohnung befindet sich im Hochparterre einer ca. 1958 errichteten Wohnanlage. Die Wohnung ist in einem gepflegten Zustand und verfügt über einen praktischen Grundriss. \r\n\r\nDie ca. 56,67 m² Wohnfläche verteilen sich auf einen Flur mit Einbauschrank, ein großes Wohnzimmer mit Balkon, ein Schlafzimmer sowie eine Küche und ein Badezimmer mit Fenster. Die moderne Einbauküche aus dem Jahr 2006 ist im Kaufpreis inbegriffen. Ein großer Süd-Balkon, welcher zum begrünten Innenhof gerichtet ist, lädt Sie zu gemütlichen Sonnenstunden ein. Der Wohnung ist ein eigenes Kellerabteil zur Nutzung zugeordnet. Im Innenhof befinden sich ca. 8 Pkw-Stellplätze, die von der WEG gemeinschaftlich genutzt werden und im Keller gibt es einen Fahrradraum.\r\n\r\nDie Wohnung wurde im Laufe der Jahre vom Vorbesitzer umfassend modernisiert, so wurden u.a. ca. 2010 neue Kunststoffrahmen-Fenster eingebaut, das Badezimmer ca. 2006 saniert, ca. 2011 ein hochwertiger Teppichboden in den Wohnräumen verlegt und ca. Mitte der 90er Jahre die Elektroinstallation inkl. Sicherungskasten vollständig erneuert. Alle Fenster sind mit überwiegend elektrischen Außenrollläden und zusätzlichen Sicherungen ausgestattet. Weiterhin verfügt die Wohnung über eine Funk-Alarmanlage.\r\n\r\nDas monatlich zu zahlende Wohngeld beträgt ca. 275,40 EUR inkl. Heizkosten und Instandhaltungsrücklage. Die WEG verfügt mit ca. 187.382,41 Euro über eine hohe Instandhaltungsrücklage und ist somit bestens für die Zukunft gerüstet. Ende 2017 wurde die Beheizung der Wohnanlage auf Fernwärme umgestellt.\r\n\r\nInsgesamt die perfekte 2-Zimmer-Wohnung für Menschen, die urbane Lebensqualität und angenehmes Wohnambiente kombinieren möchten. Einfach einziehen und wohlfühlen. Sie können die Immobilie gerne vorab über unsere virtuelle 360°-Tour besichtigen. Den Link dazu erhalten Sie nach dem Abruf des Exposés. Für die Vereinbarung eines persönlichen Besichtigungstermins sprechen Sie uns bitte an.\r\n', 'Das gutbürgerliche Wilmersdorf - als Teil des Stadtbezirks Charlottenburg-Wilmersdorf - zählt seit jeher zu den beliebtesten und angesehensten Wohnlagen im Westteil der Stadt. Aufgrund der zentralen Lage, der guten Sozialstruktur im Bezirk sowie der nahegelegen Erholungs- und Einkaufsmöglichkeiten bietet diese Wohnung die perfekte Adresse in der Hauptstadt.\r\n\r\nIm nahgelegenen Güntzelkiez und rund um den Prager Platz laden viele Cafés und Restaurants zum Verweilen und einem ""kleinen Päuschen"" ein. \r\n\r\nEinkaufsmöglichkeiten des täglichen Bedarfs, Fitnessstudios, verschiedene Ärzte, Kindergärten und Schulen sind im näheren Umfeld vorhanden und in Kürze zu erreichen.  Der nahe gelegene Volkspark Wilmersdorf ermöglicht Erholung im Grünen oder bietet sich für ein paar sportliche Runden an.\r\n\r\nDie Lage zeichnet sich durch eine hervorragende Verkehrsanbindung aus, der U-Bahnhof Güntzelstraße (Linie U9) liegt praktisch vor der Tür und die berühmteste Einkaufsmeile Berlins - den Kurfürstendamm - erreicht mit dem Auto in nur ca. 5 Minuten. Über die ebenfalls schnell erreichbare Auffahrt zur Stadtautobahn A100 gelangt man zügig in das gesamte Stadtgebiet und erreicht u.a. den Flughafen Tegel in ca. 15 Autominuten. \r\n\r\nEine perfekte Wohnlage für Leute, die gerne mittendrin und mit allen Annehmlichkeiten einer Großstadt vor der Tür wohnen wollen.\r\n']";;F;;;;;;;;
2020-05-30 19:48:11.707446;Berlin;central_heating;;;14544073;n;y;https://pictures.immobilienscout24.de/listings/0769fd38-ba7f-40a3-9d6e-a268b6d621d7-1352599397.jpg/ORIG/resize/118x118%3E/extent/118x118/format/jpg/quality/80;1;11.37;;;;2016;;11.37;115963901;district_heating;n;false;;n;Berlin;y;9;9;;.;energy_required;5.79;109.87;Berlin;10713;first_time_use;sophisticated;false;;underground_garage;"Mannheimer Stra&szlig;e";y;;;Mannheimer_Straße;ground_floor;10713;3;76.5;n;;2,active;;Deutschland;standard;;wohnung_kauf;n;0;;;002.01000690340;705000;profile0;;3;true;n;showqualicontactform;n;n;Wilmersdorf_Wilmersdorf;208+;5;Berlin;/expose/115963901;['Das Wohnhaus befindet sich in einer Nebenstraße der Brandenburgischen Straße.\n\nDiverse Einkaufsmöglichkeiten sind in der nahen Umgebung vorhanden.', '- Parkett\n- offene Küche\n- Wannen- und Duschbad\n- Gäste-WC\n- Terrasse\n- Kellerraum', '- mit dem Bus in wenigen Minuten zum U-Bahnhof Fehrbelliner Platz'];;NO_INFORMATION;1;;;;;;;
2020-05-30 19:48:12.115167;Berlin;central_heating;true;ONE_YEAR_FREE;999660;n;y;https://pictures.immobilienscout24.de/listings/65defcfb-35fc-43e9-b8fa-aa3e87cbffac-1352459230.jpg/ORIG/resize/118x118%3E/extent/118x118/format/jpg/quality/80;18;12.24;40 MBit/s;telekom_layer_magenta_l;über VDSL;1909;REGULAR;12.24;115944721;gas;y;false;MagentaZuhause L;y;Berlin;y;7;1;205;no_information;energy_required;6.53;61.44;Berlin;10827;modernized;sophisticated;false;100 MBit/s;no_information;no_information;n;https://padlock.link/ioml;https://padlock.link/ml;no_information;apartment;10827;2;183.6;n;2;2,active;true;Deutschland;premium;100 MBit/s;wohnung_kauf;n;2;web,email,bank,music,dl-ul,game,sd,mltstr,hd,fast-ul-dl;true;001.999660;351600;profile0;5;2;true;n;showqualicontactform;n;n;Schöneberg_Schöneberg;2960;3;Berlin;/expose/115944721;"['Nur wenige Schritte von der Akazienstraße entfernt, finden Sie diese 2-Zimmer-Wohnung. Sie liegt im 2. OG im ruhigen Gartenhaus. Typische Merkmale, wie die ca. 3,20 m Deckenhöhe und Echtholzdielen, unterstreichen den Altbaucharme. Die in den Innenhof gerichtete Loggia ist von Nachbarn kaum einsehbar und fängt im Sommer die Abendsonnen ein. \r\n\r\nIm Jahre 2017 wurde die Wohnung umfangreich renoviert und modernisiert. So wurden z.B. die Elektrik komplett erneuert, die Wände gespachtelt und gestrichen und das tagesbelichtete Duschbad samt Handtuchheizkörper neu eingebaut. Ca. im Jahre 2012 wurden die Fenster gegen hochwertige, doppelverglaste Kunststofffenster ersetzt.\r\n\r\nIn der Küche ist Platz für einen kleinen Esstisch, das geräumige Wohnzimmer misst ca. 25 m² und die Loggia ist vom ca. 15 qm großen Schlafzimmer aus zu begehen. \r\n\r\nIn der Küche wurde bei der letzten Renovierung ein alter Steinboden mit schmuckvollen Verziehrungen freigelegt. Die Einbauküche inkl. Kühl-/Gefrierkombi, Geschirrspüler, Backofen, Cerankochfeld und Dunstabzugshaube ist im Kaufpreis inbegriffen. Ebenfalls wird der große in der Küche für viel Stauraum sorgende Einbauschrank mitverkauft. Platz und Anschlüsse für eine Waschmaschine sind in der Küche vorhanden.\r\n\r\nDie Wohnanlage hat ca. in 2012 eine neue Zentralheizung für Heizung und Warmwasser erhalten. Das monatliche Wohngeld beträgt laut aktuellem Wirtschaftsplan ca. 205,00 € inkl. Heizung, Warmwasser und Rücklage.\r\n\r\nZu der Wohnung gehört ein Kellerabteil. Im Innenhof können Fahrräder abgestellt werden.\r\n\r\nSeit 2018 befindet sich das Gebäude im Erhaltungsgebiet ""Schöneberger Süden"".\r\n\r\nEine direkt an diese Wohnung angrenzende, seit 2014 vermietete 2-Zimmer-Wohnung, kann optional mit dazuerworben werden. Sprechen Sie uns bei Interesse gerne an.', 'Zusammenfassung / Highlights:\r\n- ruhige Lage im Gartenhaus\r\n- 2. OG ohne Aufzug\r\n- ca. 3 m² große nicht einsehbare Loggia\r\n- modernes Duschbad mit Fenster\r\n- Doppelverglaste Kunststofffenster\r\n- Deckenhöhe ca. 3,20 m\r\n- Fahrradabstellmöglichkeit im Innenhof\r\n- Kellerraum\r\n- beliebte und zentrale Wohnlage\r\n- viele Einkaufsmöglichkeiten in der direkten Umgebung\r\n- Schwimmbad und Heinrich-Lassen-Park vor der Tür', 'Schöneberg ist einer der beliebtesten Wohnbezirke im Zentrum von Berlin. Hier leben viele Familien, Künstler und Singles im bunten Einklang. Der Bezirk lebt von seiner Vielfalt. Es gibt viele Bio-Wochenmärkte, Cafés, Restaurants, urige Kneipen, hippe Bars sowie viele historische Wohngebäude.\r\n\r\nBesonders beliebt in Schöneberg ist das Akazienkiez, in dessen Umgebung die Wohnung liegt. Hier reihen sich kleine Geschäfte an unzählige Restaurants unterschiedlichster Geschmacksrichtungen an. Ergänzt wird der Kiez durch das Stadtbad Schöneberg, die Theodor-Heuss-Bibliothek, das Odeon-Kino und durch den Heinrich-Lassen-Park mit seinem riesigen Spielplatz.\r\n\r\nNach nur ein paar Schritten erreichen Sie die Kaiser-Wilhelm-Passage, in der Sie viele Geschäfte für den täglichen Bedarf finden, so z.B. Drogerien, Banken, Blumenläden, Bäckereien und mehrere Supermärkte. \r\n\r\nDer S-Bahnhof ""Schöneberg"" (S1, S41, S42, S46) ist nur ca. 700 m entfernt, der U-Bahnhof ""Eisenacher Str."" der Linie U7 nur ca. 650 m. Zudem fahren vor der Tür mehrere Busse in alle Richtungen der Stadt (Linien 104, 187, M48, M85, N42).', 'Weitere interessante Immobilienangebote finden Sie auf unserer Homepage www.koeppl-berlin.de\r\n\r\nDie Angaben in diesem Exposé stammen vom Verkäufer. Die Maklerfirma hat diese Angaben nicht im Einzelnen überprüft. Eine Kontrolle zur Angabe der Wohnfläche und zum Baujahr des Hauses hat nicht stattgefunden. Dieses Angebot ist freibleibend, unverbindlich, Irrtum und Zwischenverkauf vorbehalten.\r\n\r\nImmobilienmakler Dipl. Wi.-Ing. Klaus Koeppl ist Ihr persönlicher Ansprechpartner, wenn Sie eine Immobilie in Berlin und Umgebung verkaufen wollen. Lassen Sie sich kostenfrei und unverbindlich beraten.']";;F;;disabled;;;true;;2017;
2020-05-30 19:48:12.488738;Berlin;no_information;;ONE_YEAR_FREE;43448;n;y;https://pictures.immobilienscout24.de/listings/3c0277c5-38ce-474d-86cc-3590bd529b79-1352608398.jpg/ORIG/resize/118x118%3E/extent/118x118/format/jpg/quality/80;9;9.8;40 MBit/s;telekom_layer_magenta_l;über VDSL;1935;REGULAR;9.8;115964549;natural_gas_light;n;false;MagentaZuhause L;y;Berlin;y;5;1;156;121;energy_consumption;4.77;64;Berlin;13507;well_kept;normal;false;100 MBit/s;outside;"Bernauer Stra&szlig;e";n;https://padlock.link/ioml;https://padlock.link/ml;Bernauer_Straße;no_information;13507;2;87;n;;2,active;true;Deutschland;top;100 MBit/s;wohnung_kauf;y;4;web,email,bank,music,dl-ul,game,sd,mltstr,hd,fast-ul-dl;true;001.43448;219000;profile0;4;2;true;n;showqualicontactform;n;n;Tegel_Reinickendorf;115964549;3;Berlin;/expose/115964549;"['Eine Schöne und Helle Dachgeschosswohnung mit Blick ins Grüne.\nDie Wohnung ist derzeit vermietet. \n\nDie Jahresnettokaltmiete liegt aktuell bei 5.825,76\n\nDer PKW Stellplatz ist im Kaufpreis Inklusive', 'Die Wohnung liegt in Tegel.\nDer Bezirk ist umgeben von Wald und Wasser; immer mehr Leute entdecken, dass es sich lohnt in diesen ruhigen und doch verkehrstechnisch gut angebundenen Stadtteil zu investieren.\n\nTegel City, eines der größten Einkaufszentren der Stadt, bietet Spaß für die ganze Familie genauso wie die Hallen am Borsigturm.\nIn unmittelbarer Umgebung befinden sich viele Geschäfte des täglichen Bedarfs, ein Hausarztzentrum, ein Kino, und viele Restaurants und Cafés, die zum Verweilen einladen.\nDer Bus fährt nur wenige Minuten zum S-Bahnhof.', 'Anschauen lohnt sich!\nLassen Sie sich von uns beraten!\nUnsere telefonische Erreichbarkeit:\nmontags bis mittwochs 9:30 bis 19:00 Uhr.\ndonnerstags 9.30 bis 18:00 Uhr\nfreitags und samstags 10:00 bis 17:00 Uhr\nReservieren Sie am besten heute noch einen persönlichen Besichtigungstermin!']";;;1;;;;;;;
2020-05-30 19:48:12.857203;Berlin;floor_heating;;ONE_YEAR_FREE;16553840;n;y;https://pictures.immobilienscout24.de/listings/5ddb6997-5172-4248-8c15-a5a78c9d2d87-1352581140.jpg/ORIG/resize/118x118%3E/extent/118x118/format/jpg/quality/80;4;10.14;40 MBit/s;telekom_layer_magenta_l;über VDSL;1983;REGULAR;10.14;115962418;gas;y;false;MagentaZuhause L;n;Berlin;n;9;4;380;no_information;energy_consumption;5.19;110;Berlin;14195;well_kept;sophisticated;false;100 MBit/s;underground_garage;no_information;n;https://padlock.link/ioml;https://padlock.link/ml;no_information;maisonette;14195;4;154.7;n;;2,active;true;Deutschland;standard;100 MBit/s;wohnung_kauf;n;1;web,email,bank,music,dl-ul,game,sd,mltstr,hd,fast-ul-dl;true;002.01007390668;550000;profile0;;4;true;y;showqualicontactform;n;n;Schmargendorf_Wilmersdorf;115962418;5;Berlin;/expose/115962418;['Wir bieten eine wunderschöne Maisonette-Wohnung in Bestlage Grunewald im Tausch und mit Wertausgleich gegen eine Villa oder ein Mehrfamilienhaus in TOP-Lage von Berlin. \n\nGenießen Sie den Charme und die Exklusivität in Grunewald, aber auch die Nähe zur City-West. Großzügig gestaltete Räume, ein halboffener Küchen- und Wohnbereich mit Zugang auf den großzügigen Balkon, drei weitere Zimmer, zwei Bäder und ein Abstellbereich präsentieren sich in einem gepflegten Zustand.  \nHier wohnen Sie anspruchsvoll und außergewöhnlich. \n\nDas Mehrfamilienhaus wurde ca. 1983 erbaut und wird von der Eigentümergemeinschaft liebevoll gepflegt. Instandhaltungs- und Modernisierungsmaßnahmen werden regelmäßig durchgeführt.  \n\nEin Tiefgaragenstellplatz gehört zu der Wohnung.', '- Maisonette\n- Fussbodenheizung\n- großer Balkon im unteren Bereich der Wohnung\n- Badezimmer mit Badewanne im unteren Bereich\n- Badezimmer mit Dusche im oberen Bereich \n- Küche (Küchenmöbel inkl. Elektrogeräte sind vorhanden)\n- Tiefgaragenstellplatz\n- und vieles mehr', 'Berlin ist die Bundeshauptstadt\nBerlin ist ungewöhnlich außergewöhnlich\nBerlin ist sophisticated\nBerlin ist die grüne Stadt mit vielen Wäldern,\nParks und natürlich dem Wannsee\nBerlin hat den Ku‘damm und noch viel mehr\nBerlin ist Kultur - Berlin ist Szene\nBerlin ist halt Berlin\n\nBerlin hat in den letzten Jahren einen bemerkenswerten Wandel erfahren und prägt sich als Weltstadt und als angesagte Adresse.\nWunderschöne historische Bauten, kulturelle und architektonische Highlights sowie traumhafte Wohnviertel prägen das Stadtbild.\nGenießen Sie diese pulsierende und lebendige Stadt, die so viel zu bieten hat. Grunewald gehört zu den exklusivsten Wohnlagen die Berlin zu bieten hat. Luxuriöse Einfamilienhäuser, noble Villen, Sitz vieler Botschaften, Parkanlagen und natürlich der Grunewald prägen das Ortsbild. Eine ausgezeichnete Infrastruktur, hervorragende Schulen und kulturelle Einrichtungen, attraktive Sportmöglichkeiten und die Nähe zum Kurfürstendamm sind nur einige Highlights die dieses Viertel ausmachen. In Grunewald ist man sich der Exklusivität der Nachbarschaft bewußt.', 'Wir bitten um Ihr Verständnis, das alle Angaben, Daten und Flächen im Exposé und unseren Broschüren, den vorhandenen Unterlagen und Plänen entnommen sind. Maßgeblich sind die Vereinbarungen, die zwischen Verkäufer und Käufer im notariellen Kaufvertrag geregelt sind.'];;E;1;;;;;;;
2020-05-30 19:48:13.504734;Berlin;central_heating;;ONE_YEAR_FREE;97549;n;n;https://pictures.immobilienscout24.de/listings/a1d9b9c0-867d-4a34-8af1-e6bc0a472c2c-1352601585.jpg/ORIG/resize/118x118%3E/extent/118x118/format/jpg/quality/80;7;11.73;40 MBit/s;telekom_layer_magenta_l;über VDSL;1907;REGULAR;11.73;115964096;oil;n;false;MagentaZuhause L;y;Berlin;y;6;1;;3;energy_consumption;5.75;54;Berlin;12169;no_information;no_information;false;100 MBit/s;no_information;"Althoffstra&szlig;e";n;https://padlock.link/ioml;https://padlock.link/ml;Althoffstraße;half_basement;12169;2;86.9;n;2;2,active;true;Deutschland;top;100 MBit/s;wohnung_kauf;y;;web,email,bank,music,dl-ul,game,sd,mltstr,hd,fast-ul-dl;true;001.97549;269000;profile0;4;2;true;n;showqualicontactform;n;n;Steglitz_Steglitz;Althoff3-2;2;Berlin;/expose/115964096;"['Altbau Baujahr ca. 1907', '- Souterrain\n- Vorderhaus', '- ruhige Seitenstraße nahe Althoffplatz\n- U- und S-Bahnhof Rathaus Steglitz ist fußläufig erreichbar\n\nNur wenige hundert Meter entfernt befindet sich der Hermann-Ehlers-Platz mit einem Wochenmarkt, die Einkaufsmeile Schloßstraße mit diversen Einkaufszentren und Läden aller Art sowie das Schloßparktheater + zwei Kinos.  Im direkten Umfeld befinden sich u.a. das Gymnasium Steglitz, die neue Grundschule in der Plantagenstraße  und der Kindergarten ""Blumenstadt"".', 'Da die Wohnung vermietet ist, stehen hier keine Innenfotos zur Verfügung.\nEs besteht kein 10-jähriger Kündigungsschutz.\n\nDie monatliche Nettokaltmiete beträgt 490 €.']";;C;;;;;;;;
