2020-05-30 19:33:47.812599;Berlin;district_heating;ONE_YEAR_FREE;8923575;n;y;https://pictures.immobilienscout24.de/listings/5171a55d-f1cc-4eda-a7b5-262fddde821c-1366171954.jpg/ORIG/resize/118x118%3E/extent/118x118/format/jpg/quality/80;21;11.73;40 MBit/s;telekom_layer_magenta_l;über VDSL;1931;REGULAR;11.73;117853977;y;false;MagentaZuhause L;y;Berlin;y;5;1;no_information;5.75;57;Berlin;12169;modernized;sophisticated;false;100 MBit/s;no_information;no_information;n;https://padlock.link/ioml;https://padlock.link/ml;no_information;apartment;12169;2;n;2,active;true;Deutschland;standard;100 MBit/s;wohnung_kauf;n;web,email,bank,music,dl-ul,game,sd,mltstr,hd,fast-ul-dl;true;001.8923575;248000;profile0;2;true;n;n;n;Steglitz_Steglitz;133;2;Berlin;/expose/117853977;['Diese bildschöne Wohnung befindet sich in einem denkmalgeschützten Haus im 1. Obergeschoss. Das Haus ist in einer 30er Zone in Berlin Steglitz gelegen und gehört einer Wohnungseigentümergemeinschaft an. \n\nDie Wohnung ist zentral im Stadtteil Berlin-Steglitz mit einer sehr guten Verkehrsinfrastruktur gelegen. Die Buslinien: 282, 181 und 187 sind in 5 Gehminuten erreichbar, sowie die S-Bahnlinien S25 und S26 in 10 Gehminuten. Mit dem Auto ist man in wenigen Minuten auf der Stadtautobahn A100 (Auffahrt Grazer Damm).\nDer Stadtpark Steglitz und auch der Natur- Park Schöneberger Südgelände ist in naher Umgebung. Zahlreiche Ärztehäuser, Einkaufsmöglichkeiten und Restaurants sind allein durch die Nähe zur Schloßstraße gegeben.', 'Die äußerst gepflegte Eigentumswohnung bietet neben einer modernen Einbauküche und einem neuen Badezimmer einen sehr guten Schnitt. Vom Flur aus gelangt man in alle Zimmer, welche viel Stauraum bieten. Die Einbauküche mit Elektrogeräten der Marke Neff wurde im Jahr 2015 erneuert. Ebenso wurden im Zuge der Sanierung die Wasserleitungen und auch die Elektrik erneuert. Die moderne Einbauküche bietet einen Dampfgarer, einen Backofen, einen Induktionsherd mit moderner Abzugshaube und einen Apothekerschrank, sowie viel Helligkeit durch die großen Fenster. Besonders schön ist das neue moderne Wannenbad, welches im Jahr 2017 komplett saniert wurde und zusätzlich zur Badewanne eine Regendusche zum wohlfühlen, sowie einen Handtuchheizkörper bietet. Die beiden Wohnräume sind nahezu quadratisch geschnitten und bieten viel Platz sowie viel Helligkeit durch große Fensterfronten. Vom Wohnzimmer aus gelangt man auf den Sonnenbalkon. Alle Fenster wurden im Jahr 2014 erneuert. Der Wohnung ist ein etwa 12 m² großer Kellerraum zugeteilt.\n\nEin Einzug in die Wohnung ist ohne jegliche Modernisierungsmaßnahmen möglich. Die Wohnung wird unvermietet verkauft.  Der Energieausweis ist für die gesamte Wohnanlage. Die Werte für diese Wohnung wären deutlich niedriger, da für die komplette Wohnung neue Kunststofffenster eingebaut wurden.', 'Wir bieten diese Wohnung im Alleinauftrag an und stehen Ihnen für weitere Fragen jederzeit zur Verfügung. Am besten erreichen Sie uns per Mail unter herrmannberlinimmobilien@gmail.com. \n\nAufgrund der derzeitigen Vorsichtigsmaßnahmen führen wir Erstbesichtigungen ohne Kinder und mit Mundschutz durch.'];district_heating;264;energy_required;;140.3;1;1;4;showqualicontactform;16;;2017;;
2020-05-30 19:33:48.285603;Berlin;central_heating;ONE_YEAR_FREE;17432952;n;y;https://pictures.immobilienscout24.de/listings/1f3dbf74-625c-40ff-bf04-dd1ed1f3aa37-1370138780.jpg/ORIG/resize/118x118%3E/extent/118x118/format/jpg/quality/80;13;12.78;40 MBit/s;telekom_layer_magenta_l;über VDSL;1910;REGULAR;12.78;118006175;n;false;MagentaZuhause L;y;Berlin;y;5;1;13;7.25;72.15;Berlin;10555;modernized;normal;false;100 MBit/s;no_information;"Essener Stra&szlig;e";n;https://padlock.link/ioml;https://padlock.link/ml;Essener_Straße;apartment;10555;2;n;2,active;true;Deutschland;standard;100 MBit/s;wohnung_kauf;y;web,email,bank,music,dl-ul,game,sd,mltstr,hd,fast-ul-dl;true;002.01008148719;250000;profile0;2;true;n;n;n;Tiergarten_Tiergarten;Ess13Mil;3;Berlin;/expose/118006175;['•\tDas Objekt ist bereits 2006 aufgeteilt und einzelne Grundbücher für die jeweiligen Wohnungen existieren.\n•\tDas 1910 erbaute Haus wurde in großen Abständen gut instandgehalten.\n•\tSämtliche Gemeinschaftsbereiche und Treppenhäuser, sowie der Innenhof sind gepflegt und repräsentativ.\n•\t2014 erhielt das Haus eine neue Heizungsanlage\n•\tDas Dachgeschoss ist teilweise saniert 2017, ebenfalls gab es 2017 teilweise Kellersanierungen.\n•\tGrößere Instandhaltungen sind in naher Zukunft nicht geplant.', '•\tDie Wohnung liegt in einer verkehrsarmen Straße in einem Wohngebiet, das von Altbauten aus der Gründerzeit geprägt ist.\n•\tDie Böden sind überwiegend abgezogene Dielen-Böden in Flur, Wohn- und Schlafzimmer. Mit Fliesen sind die Küche, Bad und eine Kammer ausgestattet.\n•\tDie Zimmerdecken sind ca. 2,90m hoch.\n•\tDie Wohnung weist über einen guten Grundriss auf. Alle Räumlichkeiten haben eine angemessene Größe und sind vom Flur begehbar.\n•\tDie Fenster im großen Wohnbereich und ich auch in den anderen Räumlichkeiten sind sehr groß, hoch und hell und lässt den Raum mit viel Licht durchfluten.\n•\tDie Fenster sind Doppelkastenfenster aus Holz in Wohn- und Schlafzimmer. In der Küche bestehen sie aus Kunststoff und sind doppelisolierverglast.\n•\tDie Türen bestehen aus Holz und beinhalten in der Küche zwei weiß überstrichene Glasfenster.\n•\tDie ca. 10m² große Tageslicht-Küche bietet genügend Platz für eine gemütliche Sitzecke. Ein Geschirrspüler findet hier ebenfalls Platz.\n•\tDas Badezimmer wird elektrisch belüftet und bietet eine Dusche. Hier befindet sich der Anschluss für eine kleine Waschmaschine.\n•\tEin kleiner Balkon ermöglicht einen großen Schritt an die frische Luft.', 'Im wohl schönsten Wohnviertel Moabits liegt die Essener Straße. Mit der Fassade sanierter Häuser der Gründerzeit der 1920er Jahre, umgeben von gepflegten Gärten, roten Dornenbäumen und historischen Straßen, erhält dieses Gebiet seinen kulturellen Stempel. Die Essener Straße befindet sich in ruhiger Lage in Berlin mit wenig Durchgangsverkehr. Lokale Unternehmen gedeihen hier, darunter ein Bioladen direkt an der Ecke, ein netter Café-Buchladen und einige Restaurants. Hier finden Sie Supermärkte, Optiker, Friseure, Schneider, Ärzte und Apotheken aller Art sowie wichtige Büros wie das Rathaus, die sich vor Ort befinden. Die Anbindung an die öffentlichen Verkehrsmittel ist gut. Der U-Bahnhof in der Turmstraße ist zu Fuß in fast fünf Minuten zu erreichen. Wenn Sie das Wasser lieben oder in Parks spazieren gehen möchten, können Sie an der nahe gelegenen Spree spazieren gehen, an der Sie die Schwäne füttern und den Anblick der vielen umliegenden Pflanzen und Bäume genießen können.\nInfrastruktur (im Umkreis von 3 km): Zahlreiche Büros, Apotheke, Lebensmittel-Discounter, Allgemeinmediziner, Kindergärten, Grundschule, Hauptschule, Realschule, Gymnasium und Öffentliche Verkehrsmittel.', '- Die Mieter der Wohnungen wünschen keine Veröffentlichung der Fotos. \n- Für weitere Informationen/Daten/Dokumente können Sie uns gerne kontaktieren.\n- Weitere Angebote entnehmen Sie unsere Homepage (www.buyberlin.co.uk) oder stellen Sie einfach eine unverbindliche Anfrage mit Ihren Kontaktmöglichkeiten (E-Mail / Telefon) per E-Mail.\n- Alle Angaben basieren ausschließlich auf Informationen, die uns vom Auftraggeber, den zuständigen Hausverwaltungen und Berliner Ämter zur Verfügung gestellt wurden. Wir übernehmen keine Haftung für die Vollständigkeit, Richtigkeit und Aktualität dieser Angaben.\n- Die Nutzung bzw. Weitergabe sämtlicher Bilder und grafischen Darstellungen ist nicht gestattet.\n- Mit der Anfrage auf dieses Objekt erklärt der Interessent seine ausdrückliche Einwilligung für die Kontaktaufnahme per Telefon oder E-Mail durch einen unserer Mitarbeiter.\n- Gerne stehen wir Ihnen auch für Fragen und Anregungen zum Objekt zur Verfügung.'];gas;173;energy_consumption;D;101;;4;5;showqualicontactform;72.15;;;;
2020-05-30 19:33:48.686364;Berlin;self_contained_central_heating;ONE_YEAR_FREE;179106;n;y;https://pictures.immobilienscout24.de/listings/556ed346-c58e-48db-9e57-be54dc78dca3-1366983943.jpg/ORIG/resize/118x118%3E/extent/118x118/format/jpg/quality/80;16;11.48;10 MBit/s;telekom_layer_magenta_m;über VDSL;1918;REGULAR;11.48;118007553;n;true;MagentaZuhause M;y;Berlin;y;10;1;no_information;7.14;183;Berlin;10245;well_kept;simple;false;50 MBit/s;no_information;no_information;n;https://padlock.link/iomm;https://padlock.link/mm;no_information;apartment;10245;5;n;2,active;true;Deutschland;standard;50 MBit/s;wohnung_kauf;n;web,email,bank,music,dl-ul,game,sd,mltstr,hd,fast-ul-dl;true;001.179106;875000;profile0;5;true;y;n;n;Friedrichshain_Friedrichshain;J12988;7;Berlin;/expose/118007553;"['""BITTE PRÜFEN SIE AUCH IHREN SPAM-FILTER, WENN SIE EINE IMMOBILIE BEI UNS ANFRAGEN, UM KEINE E-MAIL ZU VERPASSEN""\n/""PLEASE CHECK YOUR SPAM FILTER SO YOU DO NOT MISS ANY EMALS""\n\nWohnen Sie ab sofort im Friedrichhainer Kiez an der Boxhagener Straße. Die Wohnung befindet sich im 1. Obergeschoss eines Altbaus aus dem Jahr 1918. Die großzügige Wohnfläche beträgt ca. 183 m². Die lichtdurchfluteten Räume haben eine Deckenhöhe von ca. 3,70 m. Es sind 2 Balkone vorhanden. \nSie kaufen hier 2 zusammengelegte Wohneinheiten, wie im Grundriss verzeichnet. Der Zustand gilt als Renovierungsbedürftig. Jedoch hat die Wohnung riesiges Potenzial zum Ausbau nach Ihren Wunschvorstellungen! Ideal für die Familie mit einem großen Anspruch an Wohn- & Lebensraum.\n\nFrom now on you can live in the Friedrichhainer Kiez on Boxhagener Straße. The apartment is located on the 1st floor of an old building from 1918 and has a generous living space of approx. 183 m². The rooms have a ceiling height of approx. 3.70 m and offer a lot of light. The apartment holds 2 balconies. \nYou buy two combined units, as shown in the floor plan.\n The condition is in need of renovation. However, the apartment has an uncanny potential for expansion according to your taste! \nIdeal for families with a demand for a large living space.\n\n', 'Altbau, Balkon/Terrasse, einfache Ausstattung, Etagenwohnung, Garten/ -mitbenutzung, Keller, Leerstand, Renovierungsbedürftig, unvermietet, Sanierungsbedürftig', 'Die Kombination aus hippen Cafés, Einzelhandelsgeschäften sowie einem umfangreichen Angebot an Gastronomie macht diese Lage im Herzen von Friedrichshain so attraktiv. Die Einkaufsmöglichkeiten lassen keine Wünsche offen, alle Waren des täglichen Bedarfs können in fußläufiger Nähe eingekauft werden. In fußläufiger Nähe fahren die Tram sowie die S- und U-Bahn.\nThe combination of hip cafés, retail shops and a wide range of gastronomy makes this location in the heart of Friedrichshain so attractive. The shopping facilities leave nothing to be desired, all goods for daily needs can be purchased within walking distance. The tram as well as the S- and U-Bahn (suburban railway) are within walking distance.', 'Sie möchten Ihre Immobilie verkaufen? Wir sind Ihr Partner für einen erfolgreichen Verkauf.\n1. Unsere Experten verfügen über tiefgehende Kenntnis des bestehenden Immobilienmarktes und entwickeln gerne eine individuelle Verkaufsstrategie für Sie. Wir bewerten Ihre Immobilie unverbindlich, kostenfrei und marktgerecht.\n2. Wir sind für Sie da und begleiten Sie von der kostenlosen Beratung bis hin zum Notartermin, immer getreu unserer Philosophie: kompetent, zuverlässig und diskret.\n3. Unser nationales und internationales Netzwerk sowie interne Synergien ermöglichen Ihnen den Zugang zu potenziellen Käufern aus aller Welt und somit einen erfolgreichen Abschluss. \nProfitieren Sie von unserem Know-How, rund 20 Jahren Erfahrung und 6 Büros in den besten Lagen Berlins. Gerne beraten wir Sie kostenlos in unserem Büro, per Telefon oder E-Mail!  \nEnergieausweis vorhanden:\nauf Anfrage']";no_information;;;;;666;1;4;;;;;;
2020-05-30 19:33:49.087658;Berlin;self_contained_central_heating;ONE_YEAR_FREE;17432952;n;y;https://pictures.immobilienscout24.de/listings/f903a9e9-b227-4c47-8d93-634c5c938670-1366973693.jpg/ORIG/resize/118x118%3E/extent/118x118/format/jpg/quality/80;12;11.14;40 MBit/s;telekom_layer_magenta_l;über VDSL;1912;REGULAR;11.14;118005669;n;false;MagentaZuhause L;y;Berlin;n;7;1;3;6.17;92.29;Berlin;10439;need_of_renovation;normal;false;100 MBit/s;no_information;"Driesener Stra&szlig;e";n;https://padlock.link/ioml;https://padlock.link/ml;Driesener_Straße;apartment;10439;3;n;2,active;true;Deutschland;standard;100 MBit/s;wohnung_kauf;y;web,email,bank,music,dl-ul,game,sd,mltstr,hd,fast-ul-dl;true;002.01008148719;369160;profile0;3;true;n;n;n;Prenzlauer_Berg_Prenzlauer_Berg;Driesbro12;4;Berlin;/expose/118005669;['•\tDas Objekt ist bereits 2015 aufgeteilt und einzelne Grundbücher für die jeweiligen Wohnungen existieren.\n•\tDas 1912 erbaute Haus wurde in großen Abständen gut instandgehalten.\n•\tSämtliche Gemeinschaftsbereiche und Treppenhäuser, sowie der Innenhof sind gepflegt und repräsentativ.\n•\tDie letzten Sanierungen waren vor mehr als 20 Jahren. Verschiedene Sanierungsarbeiten werden empfohlen.\n•\tDas Dachgeschoss ist nicht ausgebaut.', '•\tDie Wohnung liegt in einer verkehrsarmen Seitenstraße in einem Wohngebiet.\n•\tDas Apartment ist im 1. Obergeschoss eines Hinterhauses mit Blick auf den Hof mit Nordausrichtung gelegen. \n•\tZu erkennen sind typische Altbau-Elemente. Die Böden sind neu abgezogene Dielen-Böden, bis auf in der Küche. Die Zimmerdecken sind hoch und enden abgerundet. Die Fenster werden von Rundbögen gerahmt.\n•\tDie Wohnung weist über einen guten Grundriss auf. Alle Räumlichkeiten haben eine angemessene Größe. Das Wohnzimmer ist durch ein „Berliner“ Fenster charakterisiert, was die Historie der Bauzeit belegt. Es bedeutet, dass das Fenster nicht mittig liegt, sondern an der Seite, so wie das Bauen in Berlin es damals erforderte.\n•\tDieses besagte Fenster im großen Wohnbereich ist sehr groß, hoch und hell und lässt den Raum mit viel Licht durchfluten.\n•\tDes Weiteren liegt hier der Balkon.\n•\tDie große Tageslicht-Küche bietet genügend Platz für eine gemütliche Sitzecke. Hier befindet sich der Anschluss für die Waschmaschine. Ein Geschirrspüler findet hier ebenfalls Platz.\n•\tDas Auch das Badezimmer bietet Tageslicht. Durch das Fenster ist die beste Luftzirkulation geboten. Des Weiteren ist es mit einer Badewanne ausgestattet.', 'In absolut guter Wohnlage befindet sich diese Etagenwohnung in einem gepflegten Altbau aus dem Späthistorismus im zentral gelegenen Stadtteil Pankow, südlich am Rand zum Prenzlauer Berg. In mit Leben gefülltem Ambiente, in einer der ruhigen Seitenstraßen Prenzlauer Bergs befindet sich dieser sanierte Altbau mit gründerzeitlichem Flair. Mehrere kleine grüne Parks liegen beim Verlassen des Gebäudes in wenigen Gehminuten Entfernung. Insbesondere der beliebte Mauerpark liegt direkt hinter der alten Fußgängerbrücke. Die Szenegegend rund um die Kulturbrauerei mit ihren unzähligen Bars, Cafés und kleinen Shops ist als Publikums- und Erlebnismagnet in 10 Gehminuten erreichbar. Der S-Bahnhof „Schönhauser Allee“ der Ringbahn ist in nur wenigen Minuten fußläufig erreichbar und bietet eine Vielzahl an Shopping-Möglichkeiten. Eine direkte Anbindung an die öffentlichen Verkehrsmittel führen von dort aus in alle Stadtteile Berlins. Des Weiteren verkehren mehrere Tram-Linien in unmittelbarer Nähe mit schneller Anbindung zum Alexander Platz, zum S-B-Hof „Friedrichstraße“ und Berlin-Hbf. \nInfrastruktur (im Umkreis von 3 km): Zahlreiche Büros, Apotheke, Lebensmittel-Discounter, Allgemeinmediziner, Kindergärten, Grundschule, Hauptschule, Realschule, Gymnasium und Öffentliche Verkehrsmittel.', '- Die Mieter der Wohnungen wünschen keine Veröffentlichung der Fotos. \n- Für weitere Informationen/Daten/Dokumente können Sie uns gerne kontaktieren.\n- Weitere Angebote entnehmen Sie unsere Homepage (www.buyberlin.co.uk) oder stellen Sie einfach eine unverbindliche Anfrage mit Ihren Kontaktmöglichkeiten (E-Mail / Telefon) per E-Mail.\n- Alle Angaben basieren ausschließlich auf Informationen, die uns vom Auftraggeber, den zuständigen Hausverwaltungen und Berliner Ämter zur Verfügung gestellt wurden. Wir übernehmen keine Haftung für die Vollständigkeit, Richtigkeit und Aktualität dieser Angaben.\n- Die Nutzung bzw. Weitergabe sämtlicher Bilder und grafischen Darstellungen ist nicht gestattet.\n- Mit der Anfrage auf dieses Objekt erklärt der Interessent seine ausdrückliche Einwilligung für die Kontaktaufnahme per Telefon oder E-Mail durch einen unserer Mitarbeiter.\n- Gerne stehen wir Ihnen auch für Fragen und Anregungen zum Objekt zur Verfügung.'];gas;243.18;energy_consumption;;110;;1;5;showqualicontactform;92.29;;;;
2020-05-30 19:33:49.424746;Berlin;self_contained_central_heating;ONE_YEAR_FREE;5418748;n;y;https://pictures.immobilienscout24.de/listings/2b593409-bcb5-4b81-bcb0-2efbc149ae35-1367524073.jpg/ORIG/resize/118x118%3E/extent/118x118/format/jpg/quality/80;13;12.19;40 MBit/s;telekom_layer_magenta_l;über VDSL;1900;REGULAR;12.19;118007705;n;false;MagentaZuhause L;y;Berlin;y;7;1;no_information;7.44;67;Berlin;10965;no_information;normal;false;100 MBit/s;no_information;no_information;n;https://padlock.link/ioml;https://padlock.link/ml;no_information;apartment;10965;2;n;2,active;true;Deutschland;top;100 MBit/s;wohnung_kauf;n;web,email,bank,music,dl-ul,game,sd,mltstr,hd,fast-ul-dl;true;001.5418748;345000;profile0;2;true;n;n;n;Kreuzberg_Kreuzberg;787_11;3;Berlin;/expose/118007705;['Diese bezugsfreie 67 m² große Altbauwohnung liegt im vierten Stock eines denkmalgeschützten, fünfstöckigen Wohnhauses, dessen Fassade ihren ursprünglichen dekorativen Stuck beibehalten konnte.\r\n\r\nDer ideal geschnittene Grundriss der Wohnung bietet Ihnen optimale Wohnmöglichkeiten. Der große Küchenbereich sowie das Tageslichtbad auf der rechten Seite des bietet Ihnen freien Gestaltungsfreiraum für Ihren ganz persönlichen Küchentraum. Das Wannenbad lässt sich ebenfalls nach Ihren Wünschen renovieren.\r\n\r\nAm Ende des Flures finden Sie das große und helle Wohnzimmer mit viel Platz, um bei Bedarf einen Arbeitsbereich einzurichten. Daran schließt das Schlafzimmer an. Vom  anschließenden Balkon haben Sie einen herforragenden Blick auf den Viktoria Park.\r\n\r\nDas Gebäude/Gemeinschaftseigentum wird derzeit renoviert. Dazu gehören die Vorder- und Rückseite, die Eingangshalle, das Treppenhaus, die Kellerräume, der hintere Gemeinschaftsgarten und die Sanierung des Daches.', 'In diesem denkmalgeschützten Altbau befand sich das Zuhause des führenden SPD-Politikers und Reichstagsabgeordneten Ignaz Auer, der von 1890 bis 1900 im ersten Stock des Gebäudes lebte. Die Wohnung diente als Parteizentrum in Berlin, woran eine Bronzetafel erinnert.\r\n\r\nDie Katzbachstraße liegt direkt zwischen den beiden großen Grünflächen vom Gleisdreieck und Viktoriapark. Der sehr beliebte Bergmannkiez mit seinen vielfältigen Bars, Cafés, Geschäften und dem berühmten Lebensmittelmarkt sind zu Fuß erreichbar.\r\n\r\nDie Verkehrsinfrastruktur ist erstklassig. Der S- und U-Bahnhof in der Yorckstraße ist in nur wenigen Minuten über den Park Gleisdreieck oder über den Viktoriapark zum Mehringdamm mit den U-Bahnlinien U6 oder U7 zu erreichen. Die Stadtautobahn A100 ist ebenfalls nur wenige Autominuten entfernt.', 'Das Team von Black Label Immobilien bietet Ihnen Unterstützung in allen Bereichen rund um den Kauf einer Immobilie. Unser internationales Team spricht fließend Englisch, Deutsch, Französisch und Mandarin, zudem arbeiten wir mit einem Team aus mehrsprachigen Anwälten, Notaren und Finanzierungsberatern zusammen.\r\nUm Ihren persönlichen Ansprüchen gerecht werden zu können, bieten wir Ihnen eine große Auswahl an verschiedenen Immobilien. Senden Sie uns einfach ihre Suchkriterien inklusive:\r\n\r\n- Art der gesuchten Immobilie\r\n- Ihr Budget\r\n- Bevorzugter Standort\r\n- Suchen Sie eine Immobilie als Investment oder zum Eigenbedarf?\r\n\r\nFür Unterstützung bei der Finanzierung Ihrer Immobilie kontaktieren Sie bitte einfach unseren Finanzierungsberater. Wir können Ihnen eine Finanzierung bis zu 100% des Kaufpreises anbieten.\r\nSind Sie an einer Vermietung Ihrer neuen Immobilie interessiert? Hierfür bietet Black Label ein Verwaltungs-Paket sowohl für unmöblierte als auch möblierte Vermietungen, sowie einen kompletten Design- und Möblierungsservice, angepasst an ihre persönlichen Vorstellungen. Kontaktieren Sie uns, oder besuchen Sie uns in unserem Büro, um mehr Informationen zu erhalten.'];gas;208;;;;;4;5;showqualicontactform;;disabled;;true;
2020-05-30 19:33:49.788735;Berlin;floor_heating;;4254239;n;y;https://pictures.immobilienscout24.de/listings/9a933454-c3bd-401e-b6c6-e9988d7a042e-1366952090.jpg/ORIG/resize/118x118%3E/extent/118x118/format/jpg/quality/80;8;11.14;;;;1896;;11.14;118002423;y;true;;y;Berlin;y;11;1;no_information;6.17;162;Berlin;10407;first_time_use;luxury;false;;no_information;no_information;y;;;no_information;maisonette;10407;3;n;2,active;;Deutschland;premium;;wohnung_kauf;n;;;001.4254239;1750000;profile0;3;true;y;y;n;Prenzlauer_Berg_Prenzlauer_Berg;118002423;7;Berlin;/expose/118002423;['Diese außergewöhnliche Maisonette Wohnung hat ihr Zentrum in seinem offenen Wohn-Ess Kochbereich mit Kamin und der angrenzenden Terrasse. Die Wohnung mit großen bodentiefen Fenstern liegt ruhig im dritten Hof mit weitem Blick ins Grün der Nachbargärten und ist ausschließlich mit exklusiven und hochwertigsten Materialien ausgestattet.\n\nEine wahre Oase inmitten in der Großstadt.', 'große begrünte Terrasse\nBlick ins Grün\nbodentiefe Fenster\ndeckenhohe Schiebetüren\nSchlafzimmer mit Ankleide\nhochwertiges Eichenholzparkett\nmoderne Einbauküche von Siematic\nfreistehende Badewanne\nbodentiefe Duschen (Bisazza Fliesen)\nFokus Kamin\nGäste-WC\nAufzug\nFußbodenheizung\naufwändig begrünte Innenhöfe mit Sitzmöglichkeiten', 'Der Bezirk Prenzlauer Berg ist geprägt von seiner hohen Lebensqualität und dem charmanten Kiezcharakter, die vielfach erhaltene Gründerzeitarchitektur, eine charmante und vielseitige Infrastruktur mit kleinen Läden, Cafés, Restaurants, der beliebten Wochenmarkt am Kollwitzplatz.', 'Besichtigungstermine sind jederzeit nach Vereinbarung möglich.\n\nWir freuen uns Ihnen diese Besonderheit vorstellen zu dürfen.'];;;energy_required;NO_INFORMATION;73.7;3;5;5;showqualicontactform;;;;;true
2020-05-30 19:33:50.169651;Berlin;no_information;ONE_YEAR_FREE;97549;n;y;https://pictures.immobilienscout24.de/listings/f35c6eae-772c-4849-9114-bbf9a9dd4a2f-1366969026.jpg/ORIG/resize/118x118%3E/extent/118x118/format/jpg/quality/80;22;11.73;40 MBit/s;telekom_layer_magenta_l;über VDSL;1910;REGULAR;11.73;118005404;y;false;MagentaZuhause L;y;Berlin;y;10;1;4;5.75;173.97;Berlin;12167;need_of_renovation;no_information;false;100 MBit/s;no_information;"Stephanstra&szlig;e";n;https://padlock.link/ioml;https://padlock.link/ml;Stephanstraße;apartment;12167;6;n;2,active;true;Deutschland;top;100 MBit/s;wohnung_kauf;n;web,email,bank,music,dl-ul,game,sd,mltstr,hd,fast-ul-dl;true;001.97549;838000;profile0;5;true;n;n;n;Steglitz_Steglitz;Stephan4_5+6;7;Berlin;/expose/118005404;"['- Altbau, Baujahr ca. 1910', '- Süd-Balkon und Loggia\n- Parkett/Dielen\n- Stuck\n- Flügeltür\n- Altbaufenster/Altbautüren mit Messingbeschlägen\n- Einbauküche\n- 2. Obergeschoss', 'Der Altbau liegt in einer Seitenstraße in Berlin-Steglitz unweit vom Stadtpark Steglitz. \n\nDer S-Bahnhof und Regionalbahnhof „Südende"" (S2, S25, S26) oder diversen Buslinien in der Halskestraße sind innerhalb weniger Minuten erreichbar.', 'Hier handelt es sich um zwei nebeneinander liegende Wohnungen. \nEine Zusammenlegung zu einer 6- bis 7-Zimmer-Wohnung ist denkbar.\n\nDer Anbau eines Aufzugs ist in der Teilungserklärung genehmigt.']";gas;;energy_consumption;E;141;6;2;5;showqualicontactform;;;;;
