2020-05-24 21:21:48.027564;Berlin;district_heating;ONE_YEAR_FREE;15349709;n;n;https://pictures.immobilienscout24.de/listings/908d427a-3a56-47ab-9c11-f61ba2247faa-1332647732.jpg/ORIG/resize/118x118%3E/extent/118x118/format/jpg/quality/80;16;14.43;40 MBit/s;telekom_layer_magenta_l;über VDSL;1908;REGULAR;disabled;14.43;112597259;district_heating;n;false;MagentaZuhause L;n;Berlin;y;6;1;219.86;8/9;energy_consumption;7.95;65.08;Berlin;13353;well_kept;no_information;false;100 MBit/s;no_information;"Br&uuml;sseler Stra&szlig;e";n;https://padlock.link/ioml;https://padlock.link/ml;Brüsseler_Straße;apartment;13353;2;106;n;2,active;true;Deutschland;standard;100 MBit/s;wohnung_kauf;y;4;web,email,bank,music,dl-ul,game,sd,mltstr,hd,fast-ul-dl;true;001.15297510;253812;profile0;5;2;true;n;showqualicontactform;n;n;Wedding_Wedding;BS9 WE 68;3;Berlin;/expose/112597259;['Im südlichen Teil Weddings - im Brüsseler Kiez - befinden sich die zur Eigennutzung oder als Kapitalanlage angebotenen 40 Wohnungen. Der Altbau liegt in einer eher ruhigen Lage in der Brüsseler Straße, von der aus das pulsierende Leben Berlins schnell erreicht werden kann.\r\nDas 1908 erbaute Haus formiert sich aus Vorderhaus, Seitenflügeln und Hinterhaus, fast quadratisch um einen begrünten Innenhof. Es bietet in insgesamt drei Gewerbe- und 73 Wohneinheiten schöne Stadtwohnungen und großzügige Arbeitsräume. Die Wohnungen überzeugen durch eine attraktive und durchdachte Raumaufteilung. Die Größen im Erdgeschoss bis zum vierten Obergeschoss variieren zwischen 36 m² und 80 m². Abgesehen von einer Gewerbeeinheit im Erdgeschoss mit 4 Räumen und einer Dachgeschoss-Wohnung mit 2,5 Zimmern, handelt es sich bei den verfügbaren Einheiten ausschließlich um 1- bis 2-Zimmer-Wohnungen. Die Dachgeschosswohnungen sind großzügig gestaltet und bieten mit 76 m² bis 103 m² attraktive Wohnungsgrößen und große Dachterrassen, die in der warmen Jahreszeit zum Aufenthalt im Freien mit einem Ausblick auf die städtische Umgebung einladen. \r\nDas Haus ist ein typischer Berliner Altbau, bei dem zahlreiche bauzeitliche Elemente bewahrt worden sind. Im vorderen Treppenhaus finden sich Buntglasfenster, dekorativ verzierte Treppengeländer und Türstöcke, Stuck an den Decken sowie Kassettentüren zeigen die Schönheit und die Geschichte dieses Gebäudes.\r\n\r\nMit dem Kauf einer Eigentumswohnung in Berlin-Wedding entscheiden Sie sich für eine attraktive Anlage in einer zunehmend beliebten Lage oder für die eigenen vier Wände in einer vielfältigen und abwechslungsreichen Nachbarschaft. \r\n\r\nWillkommen im „Colours of Wedding“.', '- Einheit Nr. 68\r\n- 4.OG \r\n- 2 Zimmer \r\n- ca. 65 m² \r\n- Kellerabteil\r\n- vermietet', 'Der zentral gelegene Wedding ist in all den Jahren ein ursprünglicher Teil Berlins geblieben, der sich nie verbogen hat. Bis heute versprüht der Ortsteil den Charme eines gewachsenen und lebendigen Wohnviertels, in dem man sowohl urige Berliner Eckkneipen als auch angesagte Cafés findet. Bei aller Beständigkeit ist hier ein deutlicher Wandel spürbar, der alte Strukturen reizvoll ergänzt, statt sie zu zerstören. Es ist ein aufstrebender, lebendiger Teil der Stadt, der immer mehr Menschen anzieht.\r\nNeben den großen grünen Parkanlagen, wie dem Volkspark Rehberge, ist der heutige Wedding vor allem bunt. Mittlerweile hat sich hier eine lebendige Kunstszene etabliert. Knapp 13.000 Studierende sind an der nur 500 Meter entfernten Beuth Hochschule für Technik Berlin eingeschrieben und verleihen dem Bezirk kulturell und wirtschaftlich eine zusätzliche Dynamik. Auch der Charité Campus Virchow-Klinikum ist weniger als einen Kilometer vom Objekt entfernt. \r\nDie Brüsseler Straße zählt zu den ruhigeren Lagen im Kiez, ist aber zugleich gut an die Hauptverkehrsadern, wie der Seestraße und der Einkaufsmeile Müllerstraße, angebunden. In nur wenigen hundert Metern Entfernung befinden sich der U-Bahnhof  und mehrere Tram- und Buslinien. In nur 10 Minuten gelangt man bis zur Friedrichstraße im historischen Zentrum Berlins. Hier wird entspanntes Wohnen mit dem Erleben des quirligen und spannenden Berlins kombiniert. Dieser Kontrast zeichnet das Leben in der Brüsseler Straße 8 und 9 aus und macht es interessant, vielfältig und lebenswert. \r\n', 'Die Wohnungen werden im Ist-Zustand verkauft.\r\nDas Objekt liegt in einem Milieuschutzgebiet.'];;;;;;
2020-05-24 21:21:48.483186;Berlin;district_heating;ONE_YEAR_FREE;15349709;n;n;https://pictures.immobilienscout24.de/listings/1402b92a-ab41-42a6-89d6-7ec0c704b08a-1370731496.jpg/ORIG/resize/118x118%3E/extent/118x118/format/jpg/quality/80;8;8.81;40 MBit/s;telekom_layer_magenta_l;über VDSL;1905;REGULAR;disabled;8.81;112597244;gas;n;false;MagentaZuhause L;y;Berlin;y;8;1;322.36;30;energy_consumption;3.97;117.48;Berlin;12587;no_information;no_information;false;100 MBit/s;no_information;"B&ouml;lschestra&szlig;e";n;https://padlock.link/ioml;https://padlock.link/ml;Bölschestraße;roof_storey;12587;4;118;n;2,active;true;Deutschland;top;100 MBit/s;wohnung_kauf;y;3;web,email,bank,music,dl-ul,game,sd,mltstr,hd,fast-ul-dl;true;001.15297510;428000;profile0;3;4;true;n;showqualicontactform;n;n;Friedrichshagen_Köpenick;BOE30 WE 07;5;Berlin;/expose/112597244;['Gelegen im Zentrum von Friedrichshagen fügt sich der Altbau mit seiner eher schlichten Fassade in einem warmen Rosé perfekt in die Umgebung ein. Die Bölschestraße 30 überragt die niedrigeren Bauten zu beiden Seiten und spiegelt so das Gesamtbild der Architektur der Bölschestraße wider. Die Balkone an der Fassade setzen das im Jahr 1902/03 konstruierte Gebäude optisch ab. Die für Jugendstil typischen Elemente finden sich eher im Inneren des Hauses, an den schön verzierten Haustüren ebenso wie an den großen, unterteilten Fenstern, die viel Licht in die Wohnungen fluten lassen. Das Haupthaus enthält insgesamt 13 Wohneinheiten und ist Teil des denkmalgeschützten Ensembles Bölschestraße, das Gartenhaus enthält 2 Einheiten.\r\nAbgehend vom direkt an der Bölschestraße gelegenen Vorderhaus, zieht sich ein Seitenflügel von der Straße hinweg den Hof entlang. Der gepflegte Innenhof bietet große Grünflächen zum Entspannen, eine Remise für Fahrräder und einen Spielplatz für Kinder. Ein weiteres Juwel des Objektes ist das Gartenhaus, welches der Hof vom restlichen Gebäude trennt und so eine private Atmosphäre schafft. In der Bölschestraße 30 finden sowohl Familien, als auch Paare und Singles ihren Lebensmittelpunkt. Für Altbauliebhaber bietet das Haus Wohnungen im Vorderhaus oder Seitenflügel. \r\n\r\nAusgewählte Renovierungs- und Sanierungsarbeiten am Gemeinschaftseigentum, wie ein Neuanstrich der Fassade und die Instandsetzung des Treppenhauses, lassen das Haus im neuen Glanz erstrahlen.\r\n\r\n\r\n\r\n', '- Einheit Nr. 07\r\n- DG VH rechts\r\n- 4 Zimmer \r\n- ca. 117m² \r\n- Tageslichtbad\r\n- Gäste WC\r\n- Abstellraum\r\n- vermietet', 'Vintage-Flair, die Lebensqualität einer gewachsenen Gemeinschaft und nur wenige Schritte bis zum satten Grün am Müggelsee: Die Siedlung Friedrichshagen hat sich den Charme der heilen Welt erhalten, die seit Jahrhunderten Künstler und Erholungssuchende aus ganz Berlin anzieht. Der Ortsteil gehört zum landschaftlich schön gelegenen Köpenick, das seinen lebensechten, ländlichen Charakter in weiten Teilen bewahrt hat.\r\n\r\nNicht direkt an der quirligen Lebensader von Friedrichshagen, sondern in einer kleinen Abzweigung befindet sich unser Objekt Bölschestraße 30. Mehrere größere und kleinere Boutiquen und verschiedene Supermärkte bieten alles für den täglichen Bedarf. Restaurants wechseln sich hier mit zahlreichen Cafés und Galerien ab.\r\nIn nur zehn Minuten erreichen Sie zu Fuß den Müggelsee mit dem Strandbad Friedrichshagen. Das Ufer des Müggelsees ist nur zum Teil bebaut und bietet somit viel Platz im Grünen zum Entspannen und Flanieren.\r\nKinder wachsen hier im Einklang mit der Natur auf. In fußläufiger Entfernung von der Bölschestraße 30 befinden sich eine Grundschule und ein Gymnasium. Obwohl man in Friedrichshagen mit der Familie eher zurückgezogen lebt, kann das Zentrum von Berlin in wenigen Minuten erreicht werden. Haltestellen für Tram und Bus befinden sich in fast unmittelbarer Nähe der Eingangstür. Auch von der S-Bahnstation Friedrichshagen gelangt man innerhalb einer halben Stunde zum Berliner Hauptbahnhof.\r\n', 'Die Wohnungen werden im Ist-Zustand verkauft.'];true;;;;;
2020-05-24 21:21:48.827039;Berlin;central_heating;ONE_YEAR_FREE;16481091;n;n;https://pictures.immobilienscout24.de/listings/7daca79e-4ccd-4929-b5d9-b7a6b9492f48-1320756892.jpg/ORIG/resize/118x118%3E/extent/118x118/format/jpg/quality/80;16;11.19;40 MBit/s;telekom_layer_magenta_l;über VDSL;1899;REGULAR;;11.19;112548957;oil;n;false;MagentaZuhause L;y;Berlin;y;8;1;440.44;45;energy_consumption;5.36;105;Berlin;13509;well_kept;no_information;false;100 MBit/s;no_information;Schubartstr.;n;https://padlock.link/ioml;https://padlock.link/ml;Schubartstr.;roof_storey;13509;3;162;n;2,active;true;Deutschland;top;100 MBit/s;wohnung_kauf;n;3;web,email,bank,music,dl-ul,game,sd,mltstr,hd,fast-ul-dl;true;001.16100359;425000;profile0;3;3;true;y;showqualicontactform;n;n;Wittenau_Reinickendorf;4507;5;Berlin;/expose/112548957;['Die wunderschön dekorierte Fassade im Gründerzeitstil macht das hübsche Wohnhaus in der Schubartstraße zu einem wahren Schmuckstück. Die hier angebotene Wohnung ist mit ca. 105 m² auf drei Zimmer großzügig geschnitten und befindet sich im Dachgeschoss eines charmanten Berliner Altbaus.Derzeit wird die Wohnung Sanierungsmaßnahmen unterzogen, kann jedoch schon besichtigt werden.Aktuelle Bilder nach der Sanierung folgen.Im liebevoll angelegten Gemeinschaftsgarten lässt sich so mancher Feierabend entspannt ausklingen.', '- Die Wohnung wird noch saniert\n- Erstbezug nach Sanierung\n- beliebter Ortsteil Borsigwalde\n- gepflegter Altbau im Gründerzeitstil+\n- zentrale Ölheizung\n- Gemeinschaftsgarten\n- Bad mit Badewanne und separatem WC', 'Unmittelbar in der Näher Ihrer Immobilie befinden sich Kindergärten und Schulen, die schon fußläufig in nur wenigen Minuten zu erreichen sind. Die am nächsten gelegenen Bildungseinrichtungen sind die Evangelische Kindertagesstätte und die Benjamin-Franklin-Oberschule.Für Einkaufsmöglichkeiten des täglichen Bedarfs ist ebenfalls gesorgt. In direkter Umgebung befinden sich zwei EDEKA-Filialen und der NP-Markt. Ebenfalls nur wenige Minuten entfernt finden Sie einen Netto-Marken-Discount und SPAR-Express sowie zwei Bäckereien. Für größere Einkaufstrips bieten sich die Hallen am Borsigturm mit vielen verschiedenen Geschäften an.In nur wenigen Minuten zu Fuß gelangen Sie zur U-Bahn-Station Borsigwerke. Von hier aus können Sie mit der U-Bahn Linie U6 direkt in die Innenstadt fahren. Zum Berliner Hauptbahnhof brauchen Sie mit den öffentlichen Verkehrsmitteln lediglich 35, mit dem Auto sogar nur 20 Minuten.Für einen kulinarischen Ausflug müssen Sie sich nicht auf eine lange Fahrt einstellen, da mehrere Restaurants und Bistros nur einen Katzensprung weit entfernt sind. Beispielhaft hierfür sind das Trattoria di Ciro, Atma, oder Zadar Restaurant. Zum optimalen Tagesausklang bieten sich die gemütliche Kneipe „Zugpferd“ und die Altberliner Gaststätte „Skatklause Tegel“ an.', 'Haftungsausschluss: Alle Angaben und Darstellungen in dieser Unterlage beruhen auf Angaben des Auftraggebers und wurden mit größter Sorgfalt und so vollständig wie möglich zusammengestellt. Gleichwohl kann das Vorhandensein von Fehlern nicht ausgeschlossen werden. Die Angaben erfolgen daher ohne jede Gewähr. Diese Unterlage dient der Information und stellt kein vertragliches Angebot dar. Soweit Grundrissgraphiken, Maßangaben und Einrichtungen enthalten sind, dienen diese Einrichtungen einem Beispielcharakter und sind nicht im Kaufpreis mit inbegriffen, weiter wird auch für diese jegliche Haftung ausgeschlossen. Ebenso weisen wir darauf hin, dass die Grundrissgraphiken nicht immer maßstabsgetreu sind. Eine Haftung für zukünftige allgemeine wirtschaftliche Entwicklungen, gegenwärtige Immobilienmarkteinschätzungen und zukünftige Immobilienmarktentwicklungen, Änderungen der Gesetzeslage, der Rechtsprechung sowie generell eine Garantie für den Eintritt der in der Unterlage angenommenen, wirtschaftlichen Ergebnisse kann nicht übernommen werden. Auf den baualtersbedingten Zustand wird hingewiesen. Diese Unterlage und die darin enthaltenen Informationen sind ausschließlich für den jeweiligen Empfänger bestimmt. Die unbefugte Weitergabe an Dritte ist untersagt. Die unbefugte Weitergabe der Objektinformationen und das Anbieten des Objektes an bzw. durch andere werden zivil- und strafrechtlich verfolgt. Kaufverhandlungen sind ausschließlich über die Firma Sebastian Faber Immobilien, An der Tränke 54, in 13589 Berlin bzw. deren Beauftragten zu führen. Besichtigungen sind jederzeit, jedoch nur nach vorheriger Terminabsprache möglich. Änderungen und Zwischenverkauf vorbehalten.'];;;105;;;
2020-05-24 21:21:49.180595;Berlin;central_heating;ONE_YEAR_FREE;18267813;n;n;https://pictures.immobilienscout24.de/listings/2d81618e-49b8-4445-95f3-8afc05dcc814-1361266484.jpg/ORIG/resize/118x118%3E/extent/118x118/format/jpg/quality/80;13;11.24;40 MBit/s;telekom_layer_magenta_l;über VDSL;1904;REGULAR;;11.24;112549921;no_information;n;false;MagentaZuhause L;n;Berlin;y;5;1;;32;energy_consumption;6.2;46.92;Berlin;10709;need_of_renovation;no_information;false;100 MBit/s;no_information;"Westf&auml;lische Stra&szlig;e";n;https://padlock.link/ioml;https://padlock.link/ml;Westfälische_Straße;terraced_flat;10709;2;89.5;n;2,active;true;Deutschland;standard;100 MBit/s;wohnung_kauf;n;0;web,email,bank,music,dl-ul,game,sd,mltstr,hd,fast-ul-dl;true;002.01009069705;246330;profile0;6;2;true;n;showqualicontactform;n;n;Wilmersdorf_Wilmersdorf;a9ef030a-d8ce-4934-aff4-a5eeeb19848e;2;Berlin;/expose/112549921;['__Das Gebäude__\n\nDass der 1910 errichtete Altbau Nostalgikern das Herz erwärmen dürfte, begründet sich nicht zuletzt in den für das Projekt namensgebenden Marmor-Wänden im Vorderhaus. In Verbindung mit den Stuckelementen lassen sie das erneuerte Treppenhaus in besonderem Glanz erstrahlen. Die Wohnungen selbst ziehen ihren Charme aus für Altbauten typischen Details wie Parkettböden, hohen Decken und eleganten Stuckverzierungen. Fast jede Einheit verfügt über einen, zum Teil nachträglich angebrachten, Balkon oder eine Terrasse, von denen der Blick meist in die Gemeinschaftshöfe fällt. Diese wurden neu gepflastert und durch Fahrradstellplätze und einen Müllsammelplatz ergänzt. Außerdem stellt dort der kunstvoll verzierte Schacht des außenliegenden Fahrstuhls einen besonderen Blickfang dar. Tolle Aussichten für eine Zukunft im Eigenheim.\n\n__Die Wohnung__\n\nDas ideale Zuhause, in dieser Lage nahe dem Kurfürstendamm, zu finden, ist gewiss nicht einfach. Diese Erdgeschosswohnung, mit Blick auf den neugestalteten Innenhof, bietet allerdings beste Voraussetzungen, die eigenen vier Wände zum Lieblingsort zu machen. Zwei Zimmer, auf knapp 47 Quadratmetern, bieten genügend Platz für alles, was sich Alleinwohnende oder auch Paare wünschen. In der Küche finden Köche aller Niveaus Platz sich auszutoben und das Bad mit Badewanne leuchtet hell im Tageslicht. Da die Einheit sich im unrenovierten Zustand befindet, bleibt der Spielraum für Selbstgestaltung groß und man kann ihr seinen individuellen Touch verpassen. \n\n__Die Lage__\n\nWer Vielfältigkeit zu schätzen weiß, wird die Charlottenburger Lage von Marbelous lieben. Angefangen beim breit gefächerten Shoppingangebot auf Kurfürstendamm und Uhlandstraße, bis hin zu diversen Ausgehmöglichkeiten, kann kaum Langeweile aufkommen. Auch die Auswahl des besten Kaffees oder Lieblingsitalieners wird bei der Fülle an Restaurants und Cafés keine leichte Angelegenheit. Für wen bis jetzt noch nichts dabei war, der widmet sich vielleicht den kulturellen Highlights mit einem Theaterstück in der Schaubühne oder einem Spaziergang durch den Schlossgarten. Auch der Rest der Innenstadt ist mit der Ringbahn von der fußläufig fünf Minuten entfernten S-Bahn-Station Halensee ganz einfach zu erreichen. Und sollte der Trubel mal zu viel werden, garantieren Ausflüge an den nah gelegenen Lietzensee oder nach Grunewald die nötige Erholung.', 'Wannenbad mit Tageslicht \n\nHochwertiger Parkettboden \n\nGestaltungspotential\n\nEigene Terrasse \n\nIdeal für Singles oder Paare ', 'Wer Vielfältigkeit zu schätzen weiß, wird die Charlottenburger Lage von Marbelous lieben. Angefangen beim breit gefächerten Shoppingangebot auf Kurfürstendamm und Uhlandstraße, bis hin zu diversen Ausgehmöglichkeiten, kann kaum Langeweile aufkommen. Auch die Auswahl des besten Kaffees oder Lieblingsitalieners wird bei der Fülle an Restaurants und Cafés keine leichte Angelegenheit. Für wen bis jetzt noch nichts dabei war, der widmet sich vielleicht den kulturellen Highlights mit einem Theaterstück in der Schaubühne oder einem Spaziergang durch den Schlossgarten. Auch der Rest der Innenstadt ist mit der Ringbahn von der fußläufig fünf Minuten entfernten S-Bahn-Station Halensee ganz einfach zu erreichen. Und sollte der Trubel mal zu viel werden, garantieren Ausflüge an den nah gelegenen Lietzensee oder nach Grunewald die nötige Erholung.', 'Traumwohnung gefunden? Dann nutzen Sie jetzt die EverEstate Immobilienfinanzierung in Zusammenarbeit mit unserem Partner ZIEGERT Immobilien und profitieren Sie von jahrelanger Expertise in Verbindung mit kompetenter Beratung. Kontaktieren Sie uns unter +49 (0) 30 / 700 1797 59 oder auf www.everestate.de/immobilienfinanzierung-mit-everestate und erhalten Sie auf Ihre Bedürfnisse zugeschnittene Angebote.'];true;;46.92;;;
2020-05-24 21:21:49.543478;Berlin;district_heating;ONE_YEAR_FREE;15349709;n;y;https://pictures.immobilienscout24.de/listings/ef13a89b-d13f-486a-b0fa-190e7da0c046-1359909143.jpg/ORIG/resize/118x118%3E/extent/118x118/format/jpg/quality/80;18;11.37;40 MBit/s;telekom_layer_magenta_l;über VDSL;1962;REGULAR;disabled;11.37;112597582;district_heating;n;false;MagentaZuhause L;y;Berlin;y;8;2;295;31;energy_consumption;5.8;92.94;Berlin;10707;no_information;no_information;false;100 MBit/s;no_information;"D&uuml;sseldorfer Stra&szlig;e";y;https://padlock.link/ioml;https://padlock.link/ml;Düsseldorfer_Straße;ground_floor;10707;4;96;n;2,active;true;Deutschland;top;100 MBit/s;wohnung_kauf;n;0;web,email,bank,music,dl-ul,game,sd,mltstr,hd,fast-ul-dl;true;001.15297510;429000;profile0;5;4;true;n;showqualicontactform;n;n;Wilmersdorf_Wilmersdorf;DS31 WE 03;4;Berlin;/expose/112597582;['Die zwei Häuser in der Düsseldorfer Straße 31/31a fallen durch das kontrastreiche, moderne Erscheinungsbild auf. Eine symmetrische, klare Ansicht trifft auf eine verspielte, detailreiche Architektur und lässt die Anlage im Ganzen zeitlos und leicht wirken.\r\nDas Grundstück wird von einer geschwungenen Grundstücksmauer eingerahmt und schafft eine private, ruhige Umgebung zum innenliegenden Gemeinschaftshof. Auf diesem finden sich Flächen zum Ausruhen und Spielen sowie zahlreiche Fahrradstellplätze für die Bewohner der Anlage. Das Haus Nr. 31 ist über den hofseitigen Hauseingang begehbar und besteht aus fünf Etagen. Das Gebäude mit der Nr. 31a wurde mit neun Etagen zum Wohnen und Arbeiten erbaut und ist von der ruhigen Düsseldorfer Straße aus zugängig. Beide Häuser verfügen über je einen Aufzug und sind voll unterkellert. Eine Tiefgarage mit zwölf Stellplätzen befindet sich im Untergeschoss des Hauses 31a sowie unterhalb der Hoffläche. Die Treppenhäuser schaffen durch helle Cremefarben und Holzelementen eine einladende Atmosphäre. Das Gebäude in der Düsseldorfer Straße 31 soll planerisch erweitert werden: durch liebevolle Umgestaltung sollen die 5. Etage und ein weiteres Stockwerk (6. Etage) neu errichtet werden.*Architektonisch fließen Elemente der bestehenden Fassade in die neuen Etagen ein und die zukünftige Höhe des Gebäudes schließt optisch das Zusammenspiel mit dem Nachbargebäude der Anlage ab. Wirtschaftlich ist die Eigentümergemeinschaft in Untergemeinschaften gegliedert.\r\nDie insgesamt sehr gepflegte Anlage bietet 32 freie und vermietete Wohn- und Gewerbeeinheiten in unterschiedlicher Größe und Zimmeranzahl an. Eine Eigentumswohnung im globe ist ein Zuhause oder eine attraktive Kapitalanlage in besonderer Umgebung und exklusiver Gesellschaft.\r\n\r\nWillkommen im globe.\r\n\r\n* Vorbehaltlich behördlicher Genehmigung. Die Umsetzung obliegt dem Eigentümer des Dachgeschosses. \r\n', '- Einheit Nr. 03\r\n- EG \r\n- Aufzug\r\n- 4 Zimmer\r\n- Terrasse\r\n- ca. 93 m² \r\n- Tageslichtbad \r\n- bezugsfrei\r\n', 'Südlich vom Kurfürstendamm, zwischen Olivaer Platz und Preußenpark, befindet sich das globe an der Ecke Düsseldorfer Straße und Konstanzer Straße mitten im Zentrum der City West.\r\nDer Bezirk Charlottenburg-Wilmersdorf hat in den letzten fünf Jahren an Fahrt gewonnen und es geschafft, den alten Charme des Berliner Westens zu erhalten sowie Platz für neue Entwicklungen zu schaffen. Dadurch hat der Bezirk eine Renaissance als Wohn- und Arbeitsstandort erlebt, ohne den spezifischen Charakter zu verlieren. Durch die Fusion aus Alt und Neu erstrahlt der Bezirk im neuen Gewand, lässt aber das ursprüngliche Bild durchscheinen. Kunden des KaDeWe besuchen ebenso das Bikini Berlin und auch in anderer Richtung profitiert das weltberühmte Kaufhaus am Tauentzien von einer neuen Klientel. Neue Restaurants mit außergewöhnlichem Ambiente oder modernen Food-Trends erweitern die alteingesessenen Etablissements, zeitgenössische Galerien und Kunstsammlungen runden das bewährte kulturelle Angebot in den großen Traditionshäusern ab. \r\nCharlottenburg-Wilmersdorf hat ein vielfältiges Freizeitangebot, sehr gute Schulen, ein hervorragendes Netz an medizinischer Versorgung  und Angebote an Dingen des täglichen Bedarfs. Nicht zu vergessen ist der Grunewald mit der Havel und dem Teufelsberg als beliebte Ausflugs- und Erholungsorte.\r\n\r\nIn diesem Stadtviertel der Eleganz, Vielfalt und Lebensqualität bietet das Objekt in der Düsseldorfer Straße 31 und 31a einen idealen Ausgangsort für neue und alte Begegnungen. \r\n\r\n', '* Vorbehaltlich behördlicher Genehmigung. Die Umsetzung obliegt dem Eigentümer des Dachgeschosses.\r\n\r\nWir bieten unseren Interessenten weiterhin individuelle Besichtigungen an.\r\nWir versichern Ihnen, dass sich unsere Mitarbeiter vor Ort streng an die empfohlenen Hygienemaßnahmen halten. Sammelbesichtigungen sind selbstverständlich ausgeschlossen.\r\n\r\nSollten Sie aufgrund der aktuellen Lage vorerst von einer persönlichen Besichtigung absehen, stellen wir Ihnen auf Anfrage gerne einen virtuellen Rundgang einer vergleichbaren Leerwohnung im Projekt zur Verfügung. Eine Besichtigung per Video-Call oder Live-Chat bieten wir unseren Interessenten ebenfalls an. '];;NO_INFORMATION;;;;
