2020-05-24 21:21:49.912578;Berlin;oil_heating;;179106;n;n;https://pictures.immobilienscout24.de/listings/f33aa576-5025-4e0c-aced-1cb3a3f7ad3d-1307221968.jpg/ORIG/resize/118x118%3E/extent/118x118/format/jpg/quality/80;7;10.87;;;;1900;;;10.87;112526660;no_information;n;true;;y;Berlin;n;7;1;;no_information;;5.63;140;Berlin;12159;need_of_renovation;no_information;false;;no_information;no_information;y;;;no_information;roof_storey;12159;4;;n;2,active;;Deutschland;standard;;wohnung_kauf;n;5;;false;001.179106;389000;profile0;5;4;true;n;;n;n;Friedenau_Schöneberg;M281;6;Berlin;/expose/112526660;"['""BITTE PRÜFEN SIE AUCH IHREN SPAM-FILTER, WENN SIE EINE IMMOBILIE BEI UNS ANFRAGEN, UM KEINE E-MAIL ZU VERPASSEN""\n/""PLEASE CHECK YOUR SPAM FILTER SO YOU DO NOT MISS ANY EMALS""\n\nEs handelt sich um einen seltenen Dachgeschossrohling im Gartenhaus eines um die Jahrhundertwende gebauten Altbaus. Der Rohling muss komplett saniert und ausgebaut werden. Aktuell liegt eine Baugenehmigung NUR FÜR EINEN AUSBAU sowie innerhalb der WEG für einen Anbau eines Lifts vor. Alles weitere gilt vor Ort zu prüfen.\n\nIt is a rare blank attic floor in the garden house of an old building built around the turn of the century. The blank must be completely renovated and removed. At the moment there is a building permit ONLY FOR EXPANSION as well as within the WAY for an extension of a lift. Everything else must be checked on site.', 'Altbau, Dachgeschoss, Dachterrasse, Sanierungsbedürftig, Aufzug', 'Seit der Gründung vor mehr als 135 Jahren als Villenkolonie Friedenau ist dieser Ortsteil Schönebergs bis heute ein Ort für Künstler geblieben. Frisches Grün, Straßen und Plätze, die zum Flanieren einladen. Diese Wohnlage im Herzen Friedenaus gehört zu den beliebtesten der Stadt. Die Einkaufsmöglichkeiten und das umfangreiche Angebot an Gastronomie lassen keine Wünsche offen, alle Waren des täglichen Bedarfs können in fußläufiger Nähe eingekauft werden. Die Einkaufssituation ist als sehr gut zu bezeichnen. Mit der Steglitzer Schloßstraße befindet sich eine der beliebtesten Einkaufsmeilen des Berliner Südwestens in unmittelbarer Nähe. Die Verkehrsanbindungen sind hervorragend. \nSince it was founded more than 135 years ago as the Friedenau villa colony, this district of Schöneberg has remained a place for artists to this day. Fresh greenery, streets and squares invite you to stroll. This residential area in the heart of Friedenau is one of the most popular in the city. The shopping possibilities and the extensive offer of gastronomy leave nothing to be desired, all goods of daily use can be bought within walking distance. The shopping situation can be described as very good. The Steglitzer Schloßstraße is one of the most popular shopping streets in the southwest of Berlin. The transport connections are excellent. \n\n', 'Sie möchten Ihre Immobilie verkaufen? Wir sind Ihr Partner für einen erfolgreichen Verkauf.\n1. Unsere Experten verfügen über tiefgehende Kenntnis des bestehenden Immobilienmarktes und entwickeln gerne eine individuelle Verkaufsstrategie für Sie. Wir bewerten Ihre Immobilie unverbindlich, kostenfrei und marktgerecht.\n2. Wir sind für Sie da und begleiten Sie von der kostenlosen Beratung bis hin zum Notartermin, immer getreu unserer Philosophie: kompetent, zuverlässig und diskret.\n3. Unser nationales und internationales Netzwerk sowie interne Synergien ermöglichen Ihnen den Zugang zu potenziellen Käufern aus aller Welt und somit einen erfolgreichen Abschluss. \nProfitieren Sie von unserem Know-How, rund 20 Jahren Erfahrung und 6 Büros in den besten Lagen Berlins. Gerne beraten wir Sie kostenlos in unserem Büro, per Telefon oder E-Mail!  \nEnergieausweis vorhanden:\nauf Anfrage']";;;;668;;
2020-05-24 21:21:50.464129;Berlin;district_heating;ONE_YEAR_FREE;618639;n;n;https://pictures.immobilienscout24.de/listings/6d19b423-b77b-4c7c-95ff-67f62e5f3441-1273361971.jpg/ORIG/resize/118x118%3E/extent/118x118/format/jpg/quality/80;12;19.51;40 MBit/s;telekom_layer_magenta_l;über VDSL;1921;REGULAR;disabled;19.51;109922757;district_heating;n;false;MagentaZuhause L;n;Berlin;y;6;1;252.42;no_information;;12.08;67;Berlin;12057;well_kept;normal;false;100 MBit/s;no_information;no_information;n;https://padlock.link/ioml;https://padlock.link/ml;no_information;apartment;12057;3;;n;2,active;true;Deutschland;top;100 MBit/s;wohnung_kauf;y;2;web,email,bank,music,dl-ul,game,sd,mltstr,hd,fast-ul-dl;true;001.618639;270000;profile0;3;3;true;y;;n;n;Neukölln_Neukölln;J4AW1;3;Berlin;/expose/109922757;['Die Wohnung befindet sich in einem 3-geschossigen Altbau, der ca. 1921 errichtet wurde. Insgesamt gehören 228 Einheiten, darunter eine Gewerbeeinheit und Reihenhäuser, zu diesem Großstadtidyll. Zur Erhaltung dieser Oase wurde die Anlage unter Denkmalschutz gestellt. Die Anlage verfügt über einen ruhigen, grünen Innenhof und viele kleine Gartenparzellen.', 'Angeboten wird eine 2,5-Zimmerwohnung inklusive einem nutzbaren Garten der Gemeinschaftsfläche mit ca. 150 m². \n\nDas Objekt befindet sich im 1. Obergeschoss der gepflegten Wohnanlage. Der Grundriss ist überaus praktisch. Die Wohnung besteht aus einem großen Wohnzimmer, einem großen Schlafzimmer, einem halben Zimmer sowie einer geräumigen Küche, einem Bad, einem Flur und einem Wintergarten. Der Wohnung ist außerdem ein Keller zugeordnet.\n\nIm Flur können problemlos eine Garderobe und Schuhschränke untergebracht werden. Alle Zimmer gehen vom Flur ab. Die Holzfenster sowie der Dielenfußboden sind charakteristisch für den denkmalgeschützten Altbau. Alle Zimmer wurden im Jahr 2015/2016 renoviert. \n\nDas Badezimmer ist saniert und mit neuen Sanitärelementen ausgestattet worden. Es ist Tür hoch gefliest und mit weißen Wand- und schwarzen Bodenfliesen versehen. Der Zustand des Badezimmers insgesamt ist als sehr gepflegt zu bezeichnen.\n\nDie Küche ist mit einer mietereigenen Einbauküche ausgestattet. Der Spritzbereich an der Wand ist hell gefliest.', 'Die Wohnanlage ist an das gut ausgebaute öffentliche Nahverkehrsnetz in Neukölln per Bus sowie vor allem durch den mit wenigen Schritten zu erreichen-den S-Bahnhof Köllnische Heide angebunden. Durch die nahegelegene Anschlussstelle an die Verlängerung der Berliner Stadtautobahn (Auffahrt Grenzallee) ist eine sehr gute Anbindung in Richtung Flughafen, in die Berliner City und zum Berliner Ring gewährleistet.', 'Die Wohnung ist unbefristet vermietet.'];;;67;203;;
2020-05-24 21:21:50.938982;Berlin;central_heating;ONE_YEAR_FREE;185949;n;n;https://pictures.immobilienscout24.de/listings/aa3d3e5d-775d-431d-b65c-5aeb0f662e20-1370461148.jpg/ORIG/resize/118x118%3E/extent/118x118/format/jpg/quality/80;15;14.43;40 MBit/s;telekom_layer_magenta_l;über VDSL;1900;REGULAR;disabled;14.43;112553652;natural_gas_heavy;n;true;MagentaZuhause L;n;Berlin;n;4;1;159.67;110;energy_consumption;7.95;42.91;Berlin;13359;well_kept;no_information;false;100 MBit/s;no_information;Osloer Str.;y;https://padlock.link/ioml;https://padlock.link/ml;Osloer_Str.;apartment;13359;1;154;n;2,active;true;Deutschland;premium;100 MBit/s;wohnung_kauf;y;3;web,email,bank,music,dl-ul,game,sd,mltstr,hd,fast-ul-dl;true;001.185949;169500;profile0;5;1;true;n;showqualicontactform;n;n;Wedding_Wedding;16718456;2;Berlin;/expose/112553652;['Die Osloer Straße 110 liegt zentral in Berlin-Wedding zwischen dem U-Bahnhof Osloer Straße und dem S-Bahnhof Bornholmer Straße, dem einstigen Grenzübergang zwischen West- und Ostberlin.\r\n\r\nDer klassische Altbau in der Osloer Straße ist ein Wohn- und Geschäftshaus mit 26 Wohn- und drei Gewerbeeinheiten aus dem Jahre 1910. In Vorderhaus und Seitenflügel verteilen sich auf vier Etagen großzügig geschnittene 1- bis 5-Zimmer-Wohnungen von 43 bis 163 Quadratmeter. Es besteht die Möglichkeit zur Erweiterung des Dachausbaus um weitere 377 Quadratmeter.\r\n\r\nDas Vorderhaus erreicht man über zwei separate Treppenhäuser, in denen noch viele schöne Stuck-Elemente sowie originale Holzgeländer, Haus- und Wohnungstüren erhalten sind. Über den kleinen Innenhof mit Abstellmöglichkeiten für Fahrräder gelangt man in das ebenso geschmackvolle Treppenhaus des Seitenflügels. Auch mit Kinderwagen und Einkäufen erreicht man dank Fahrstühlen entspannt die Wohnungen in den oberen Stockwerken.\r\n\r\nDie Wohnungen im Vorderhaus verfügen über Balkone oder Erker mit großen Fensterflächen, die viel Licht in die geräumigen Zimmer lassen. Der Altbau-Charakter der Wohnungen wird durch hohe Decken sowie Holz-Kassetten-Türen und zum Teil original erhaltene Dielen unterstrichen.\r\n\r\nDie Warmwasseraufbereitung, sowie die Beheizung erfolgt über eine zentrale Gas- und Warmwasserversorgung, wobei die Heizung 2009 erneuert und das Rohrsystem modernisiert wurde. Die Fassade ist im Herbst 2018 mit einem hellen, ansprechenden Farbkonzept versehen und die straßenseitigen Balkone sowie die Doppelkastenfenster aus Holz sind überarbeitet worden.\r\n\r\nWohnbeispiel: https://youtu.be/9N_ldBZB82Q\r\nDrohnenfilm: https://youtu.be/twNDuEa2krI\r\n\r\nACCENTRO App für iOS https://goo.gl/KvMJTa und für Android https://goo.gl/ACqL6H', 'Wedding scheint auf den ersten Blick ein Bezirk der Kontraste, die sich aber beim zweiten Blick zu einem bunten Mosaik zusammenfügen. Wedding ist einer der lebendigsten Kieze Berlins mit der größten kulturellen Vielfalt. Ein vielfältiger Mix an Geschäften von diversen Supermärkten über Gemüsehändler hin zu türkischen Bäckereien und diversen Cafés und Imbissen zeigen die bunte Mischung der Bewohner. Neben dem Gesundbrunnen-Center mit über 100 Geschäften existieren in den Nebenstraßen kleine Mode-Ateliers oder auch ein Buchladen mit Café als kultureller Treffpunkt.\r\n\r\nSo vielseitig das gastronomische und Geschäftsangebot, so abwechslungsreich sind auch die Freizeitmöglichkeiten: von Fitness-Studio, Schwimmhalle über das Kindermuseum Labyrinth und einer Familien-Bücherei bis hin zu kulturellen Highlights in den Uferstudios oder dem Kino Alhambra hat der Wedding für jeden Geschmack etwas zu bieten. Alles ist in direkter Umgebung zu finden und leicht zu Fuß oder mit Tram, Bus und U-Bahn zu erreichen.\r\n\r\nFast unscheinbar zieht sich fußläufig von der Osloer Straße das Flüsschen Panke durch das Viertel und lädt an seinen Ufern mit Fuß- und Radwegen zu Spaziergängen oder Jogging ein. Nur ein wenig weiter entfernt lassen sich im nahegelegenen Volkspark Humboldthain Stunden im Grünen mitten in der Stadt verbringen oder zur warmen Jahreszeit im dortigen Sommerbad die Sonne genießen. Vom Aussichtsturm im Park hat man einen herrlichen Blick über die Stadt.\r\n  \r\nWedding – der nördlichste Teil von Berlin Mitte und in direkter Nachbarschaft zum Szene-Kiez Prenzlauer Berg – steigt in der Beliebtheitsskala. Er zieht gerade junge Menschen wegen seiner optimalen Lage, dem bunten Miteinander und den vergleichsweise noch günstigen Mieten an. Besonders attraktiv ist das Viertel auch aufgrund seiner Nähe zur Klinik-Campus der Charité und auch der renommierten Beuth Hochschule mit ihrem internationalen Studienangeboten.'];;;;4700;true;
2020-05-24 21:21:51.283412;Berlin;central_heating;;16273579;n;n;https://pictures.immobilienscout24.de/listings/5f81c0e3-e1f9-45a0-af25-3d1cc359772f-1307146491.jpg/ORIG/resize/118x118%3E/extent/118x118/format/jpg/quality/80;17;12.78;;;;1900;;;12.78;112520618;district_heating;n;false;;y;Berlin;n;5;1;280.52;no_information;energy_consumption;7.25;65.26;Berlin;10559;no_information;no_information;false;;no_information;no_information;n;;;no_information;apartment;10559;2;69.8;n;2,active;;Deutschland;standard;;wohnung_kauf;y;;;;001.15952887;219000;profile0;;2;true;n;;n;n;Tiergarten_Tiergarten;319-13;3;Berlin;/expose/112520618;['Bereits die Fassade dieses wunderbaren Gebäudes aus der Jahrhundertwende ist besonders reich verziert und aufwändig ausgestattet. Jedes Fenster ist eingerahmt, in die Fassade sind diverse Engelsfiguren und -Gesichter eingearbeitet, die Balkone sind mit dekorativen Schmiede-eisernen Gittern versehen.\n\nDer gute Erhaltungszustand eines Gebäudes aus dieser Epoche ist nur selten anzutreffen!', 'Die Stephanstraße ist eine ruhige Seitenstraße im Moabiter Stephan-Kiez. Das gesamte Umfeld ist von Altbauten gekennzeichnet. Der U-Bahnhof Birkenstraße ist nur rund 150 m entfernt, die nächste S-Bahnstation ist „Westhafen“. \nIm Umfeld befinden sich diverse Einkaufsmöglichkeiten, das Einkaufszentrum „MOA“ liegt an der Ecke Stephan- / Birkenstraße rund 100 m entfernt.', 'Mit dem Mieter ist eine Nettokaltmiete von € 4,56 pro m², entsprechend einer monatlichen Miete von € 297,38, vereinbart. ie monatlichen Vorauszahlungen für die Betriebs- und Heizkosten sind € 196,00, das Wohngeld beträgt € 280,52. \n\nBitte beachten Sie, dass es sich um eine vermietete Wohnung handelt. Daher veröffentlichen wir hier keine Bilder vom Inneren der Wohnung. Eine Besichtigung ist nach Abstimmung mit dem Mieter jederzeit möglich.\n\nAlle Angaben beruhen auf den Auskünften des Eigentümers, wir übernehmen dafür keine Gewähr. Zwischenverkauf / Änderung / Irrtum vorbehalten.'];;;;;;
2020-05-24 21:21:51.646407;Berlin;;ONE_YEAR_FREE;16273579;n;n;https://pictures.immobilienscout24.de/listings/a10c4136-0e70-459e-a8d6-fe0ab0020fc2-1308006983.jpg/ORIG/resize/118x118%3E/extent/118x118/format/jpg/quality/80;15;12.24;40 MBit/s;telekom_layer_magenta_l;über VDSL;1933;REGULAR;;12.24;112593353;no_information;n;false;MagentaZuhause L;y;Berlin;n;8;1;167.25;no_information;energy_required;6.53;77;Berlin;10789;no_information;no_information;false;100 MBit/s;no_information;no_information;n;https://padlock.link/ioml;https://padlock.link/ml;no_information;apartment;10789;2.5;172.5;n;2,active;true;Deutschland;standard;100 MBit/s;wohnung_kauf;n;2;web,email,bank,music,dl-ul,game,sd,mltstr,hd,fast-ul-dl;true;001.15952887;479000;profile0;;2;true;n;;n;n;Schöneberg_Schöneberg;391;3;Berlin;/expose/112593353;"['Die  2,5-Zimmer-Wohnung liegt im 2. OG im Seitenflügel eines modernisierten Altbaus.', 'Die Wohnung verfügt über ein neues Bad mit modernen Wandfliesen in beige und Bodenfliesen in braun sowie Objekten in weiß. Der Heizkörper im Bad ist als Handtuchhalter installiert. Der Fußboden ist mit einem Laminat ausgelegt, die Beheizung erfogt über eine moderne Gastherme mit zentraler Wandsteuerung. Die modernen Heizkörper sind im Zuge der Sanierung ebenso erneuert worden.', 'Das Haus Nürnberger Straße 27 befindet sich im Herzen der City-West. Das KaDeWe, wie auch die Tauentzienstraße, sind zu Fuß in wenigen Minuten erreichbar. Durch den nahe gelegenen U-Bhf. ""Augsburger Straße"" besteht Anbindung an das U-Bahnn-Netz. \n\nDas gesamte Umfeld ist von großzügigen Altbauten geprägt sowie zahlreichen Boutiquen, Cafés und Restaurants.', 'Alle Angaben beruhen auf den Auskünften des Eigentümers, wir übernehmen dafür keine Gewähr. Zwischenverkauf / Änderung / Irrtum vorbehalten.']";;F;;;;
2020-05-24 21:21:51.995082;Berlin;district_heating;ONE_YEAR_FREE;15349709;n;y;https://pictures.immobilienscout24.de/listings/fbc42dc8-fded-436f-9abf-30cf91827e2a-1332647303.jpg/ORIG/resize/118x118%3E/extent/118x118/format/jpg/quality/80;14;14.43;40 MBit/s;telekom_layer_magenta_l;über VDSL;1908;REGULAR;disabled;14.43;112597963;district_heating;n;false;MagentaZuhause L;n;Berlin;y;5;1;192.06;8/9;energy_consumption;7.95;55.5;Berlin;13353;no_information;no_information;false;100 MBit/s;no_information;"Br&uuml;sseler Stra&szlig;e";n;https://padlock.link/ioml;https://padlock.link/ml;Brüsseler_Straße;apartment;13353;2;106;n;2,active;true;Deutschland;standard;100 MBit/s;wohnung_kauf;y;4;web,email,bank,music,dl-ul,game,sd,mltstr,hd,fast-ul-dl;true;001.15297510;233100;profile0;5;2;true;n;showqualicontactform;n;n;Wedding_Wedding;BS8 WE 31;2;Berlin;/expose/112597963;['Im südlichen Teil Weddings - im Brüsseler Kiez - befinden sich die zur Eigennutzung oder als Kapitalanlage angebotenen 40 Wohnungen. Der Altbau liegt in einer eher ruhigen Lage in der Brüsseler Straße, von der aus das pulsierende Leben Berlins schnell erreicht werden kann.\r\nDas 1908 erbaute Haus formiert sich aus Vorderhaus, Seitenflügeln und Hinterhaus, fast quadratisch um einen begrünten Innenhof. Es bietet in insgesamt drei Gewerbe- und 73 Wohneinheiten schöne Stadtwohnungen und großzügige Arbeitsräume. Die Wohnungen überzeugen durch eine attraktive und durchdachte Raumaufteilung. Die Größen im Erdgeschoss bis zum vierten Obergeschoss variieren zwischen 36 m² und 80 m². Abgesehen von einer Gewerbeeinheit im Erdgeschoss mit 4 Räumen und einer Dachgeschoss-Wohnung mit 2,5 Zimmern, handelt es sich bei den verfügbaren Einheiten ausschließlich um 1- bis 2-Zimmer-Wohnungen. Die Dachgeschosswohnungen sind großzügig gestaltet und bieten mit 76 m² bis 103 m² attraktive Wohnungsgrößen und große Dachterrassen, die in der warmen Jahreszeit zum Aufenthalt im Freien mit einem Ausblick auf die städtische Umgebung einladen. \r\nDas Haus ist ein typischer Berliner Altbau, bei dem zahlreiche bauzeitliche Elemente bewahrt worden sind. Im vorderen Treppenhaus finden sich Buntglasfenster, dekorativ verzierte Treppengeländer und Türstöcke, Stuck an den Decken sowie Kassettentüren zeigen die Schönheit und die Geschichte dieses Gebäudes.\r\n\r\nMit dem Kauf einer Eigentumswohnung in Berlin-Wedding entscheiden Sie sich für eine attraktive Anlage in einer zunehmend beliebten Lage oder für die eigenen vier Wände in einer vielfältigen und abwechslungsreichen Nachbarschaft. \r\n\r\nWillkommen im „Colours of Wedding“.', '- Einheit Nr. 31\r\n- 4.OG \r\n- 2 Zimmer \r\n- ca. 55 m² \r\n- Loggia\r\n- Kellerabteil\r\n- vermietet', 'Der zentral gelegene Wedding ist in all den Jahren ein ursprünglicher Teil Berlins geblieben, der sich nie verbogen hat. Bis heute versprüht der Ortsteil den Charme eines gewachsenen und lebendigen Wohnviertels, in dem man sowohl urige Berliner Eckkneipen als auch angesagte Cafés findet. Bei aller Beständigkeit ist hier ein deutlicher Wandel spürbar, der alte Strukturen reizvoll ergänzt, statt sie zu zerstören. Es ist ein aufstrebender, lebendiger Teil der Stadt, der immer mehr Menschen anzieht.\r\nNeben den großen grünen Parkanlagen, wie dem Volkspark Rehberge, ist der heutige Wedding vor allem bunt. Mittlerweile hat sich hier eine lebendige Kunstszene etabliert. Knapp 13.000 Studierende sind an der nur 500 Meter entfernten Beuth Hochschule für Technik Berlin eingeschrieben und verleihen dem Bezirk kulturell und wirtschaftlich eine zusätzliche Dynamik. Auch der Charité Campus Virchow-Klinikum ist weniger als einen Kilometer vom Objekt entfernt. \r\nDie Brüsseler Straße zählt zu den ruhigeren Lagen im Kiez, ist aber zugleich gut an die Hauptverkehrsadern, wie der Seestraße und der Einkaufsmeile Müllerstraße, angebunden. In nur wenigen hundert Metern Entfernung befinden sich der U-Bahnhof  und mehrere Tram- und Buslinien. In nur 10 Minuten gelangt man bis zur Friedrichstraße im historischen Zentrum Berlins. Hier wird entspanntes Wohnen mit dem Erleben des quirligen und spannenden Berlins kombiniert. Dieser Kontrast zeichnet das Leben in der Brüsseler Straße 8 und 9 aus und macht es interessant, vielfältig und lebenswert. \r\n', 'Die Wohnungen werden im Ist-Zustand verkauft.\r\nDas Objekt liegt in einem Milieuschutzgebiet.'];;;;;;
2020-05-24 21:21:52.358053;Berlin;district_heating;ONE_YEAR_FREE;17984017;n;y;https://pictures.immobilienscout24.de/listings/48eba9ac-64e2-454e-a841-c6b3d9451f91-1307498587.jpg/ORIG/resize/118x118%3E/extent/118x118/format/jpg/quality/80;12;11.35;40 MBit/s;telekom_layer_magenta_l;über Glasfaser;2018;REGULAR;;11.35;112547445;combined_heat_and_power_fossil_fuels;y;false;MagentaZuhause L;y;Berlin;y;7;9;203;no_information;energy_required;7.53;64;Berlin;10247;mint_condition;luxury;false;100 MBit/s;underground_garage;no_information;y;https://padlock.link/ioml;https://padlock.link/ml;no_information;apartment;10247;2;48;n;2,active;true;Deutschland;top;100 MBit/s;wohnung_kauf;n;4;web,email,bank,music,dl-ul,game,sd,mltstr,hd,fast-ul-dl;true;009.4eebdd57-ba44-4752-b4dd-5eba8ebf65a6;400000;profile0;5;2;true;y;showqualicontactform;y;n;Friedrichshain_Friedrichshain;B-20191013;3;Berlin;/expose/112547445;['Planerische Meisterleistung gefällig? Hier wurde auch das kleinste Detail bedacht. Angefangen bei dem Tiefgaragenstellplatz mit zukunftsorientierter Stromversorgung bis hin zu einem geschickten Platzmanagement. Der Eigentümer hat die Wohnung perfekt auf die individuellen Gegebenheiten angepasst. 64 m2  erstrecken sich über zwei Zimmer, ein Badezimmer, ein Flur und ein Wirtschaftsraum sowie den Balkon. Die ideale Raumaufteilung bietet reichlich Platz zur freien Entfaltung. Auf dem großzügigen Sonnenbalkon lassen sich die warmen Sommertage bei einem kühlen Getränk entspannt aushalten. Bodentiefe Fenster sorgen für klare und helle Gedanken. Zusätzlich lädt die offene Gestaltungsform zum gemütlichen Miteinander ein. Zahlreiche weitere Highlights, wie der begehbare Kleiderschrank, kippbare Oberlichter, automatische Sonnenrollos oder ein geölter Eichenparkettboden sind das Tüpfelchen auf dem “i”. \n\nEin bemerkenswertes Gebäude mit eindrucksvoller Fassadenarchitektur. Stufenloser Zugang zum Fahrstuhl von überall, zwei Fahrradkeller, ein separates Kellerabteil und ein Spielplatz - hier alles selbstverständlich! Es gibt nichts, was das Objekt nicht bietet. \n\nOn Top! Die hochwertigen Designermöbel können übernommen werden. \n\nTransparenter Preis\n• Tiefgaragenstellplatz inkl. Stromanschluss für E-Auto im Wert von 35.000 € kann dazu gekauft werden\nExklusive Möbel können ebenfalls dazu gekauft werden:\n• begehbarer und maßangefertigter Kleiderschrank im Wert von 6.000 €\n• edle Küche mit Siemensgeräten im Wert von 15.000 €\n• exklusive Badausstattung von Hans Grohe mit Unterputz Duschamatur im Wert von 4.000 €', '• Eigentumswohnung über ca. 64 m2\n• zwei Zimmer und hochwertiges Bad\n• Keller und Tiefgaragenstellplatz im Wert von 35.000 € on Top \n• exklusiv designte Möbel und Küche im Wert von 25.000 € können dazu gekauft werden\n• stufenloser Zugang\n• Videoklingel mit Sprechanlage\n• geöltes Eichenparkett\n• bodentiefe Fenster \n• kippbare Oberlichter im Schlafzimmer\n• dreifacher Zugang zum Balkon\n• 2,85 Meter hohe Decken\n• elektrische Rollläden\n• bodentiefe Regendusche \n• 2,31 Meter hohe Schiebetüren\n• Hausgeld: 203 € / Monat inkl. Stellplatz', 'Berlins Bestlage! Ob Entspannung in einem der vielen umliegenden Parks, ausgedehntes Shopping in den großen Einkaufsstraßen oder das vielfältige Café- und Restaurantangebot genießen - hier kommt jeder auf seine Kosten. \nUnd trotz unmittelbarer Zentrumsnähe besticht der Ort durch die zahlreichen Grünflächen mit Ruhe und Gelassenheit. Der nah gelegenen S-Bahnhof Storkower Straße sowie verschiedene Buslinien und die Tram am Forkenbeckplatz bieten eine sehr gute Anbindung an das öffentliche Verkehrsnetz. Die Szene Berlin mit ihren angesagten Restaurants und deren Partymeilen können dadurch in wenigen Minuten erreicht werden. Eine Vielzahl von Einkaufsmöglichkeiten wie Kaufland, Rossmann, ALDI, verschiedene Geschäfte und Restaurants befinden sich fußläufig nur wenige Meter entfernt.', 'Wir haben Ihr Interesse geweckt? Zögern Sie nicht uns zu kontaktieren. Wir freuen uns Sie kennen zu lernen!'];;A;;;;1
2020-05-24 21:21:52.722202;Berlin;;;16273579;n;y;https://pictures.immobilienscout24.de/listings/e2bfb27f-ef32-4e14-9e85-ecafef2c2005-1308047402.jpg/ORIG/resize/118x118%3E/extent/118x118/format/jpg/quality/80;21;11.73;;;;1975;;;11.73;112576706;oil;n;false;;y;Berlin;n;9;3;313.86;no_information;energy_consumption;5.75;136.28;Berlin;12165;no_information;no_information;false;;no_information;no_information;n;;;no_information;roof_storey;12165;3;108;n;2,active;;Deutschland;standard;;wohnung_kauf;n;;;;001.15952887;629000;profile0;;3;true;n;;n;n;Steglitz_Steglitz;390;6;Berlin;/expose/112576706;"['Diese wunderschöne 3-Zimmer-Wohnung befindet sich in einem freistehenden, sehr exklusiven Altbau, der einem Rokkoko-Palais nachempfunden ist. Ein solches Gebäude ist in Berlin nur äußerst selten anzutreffen.', 'Bei dieser 136,28 m² großen Wohnung handelt es sich um eine moderne Dachgeschosswohnung.', 'Die Wrangelstraße ist eine ruhige Seitenstraße ohne Durchgangsverkehr, sie befindet sich in der Nähe des Steglitzer Fichtenberges. Das gesamte Umfeld ist weit überwiegend von schönen Altbauten und begrünten Grundstücken geprägt.\n\nDer U-Bahnhof ""Rathaus Steglitz"", wie auch die Einkaufsmeile Schlossstraße, ist in zwei Minuten zu Fuß erreichbar.', 'Quelle des Stadtplanausschnitts: openstreetmap.org\n\n\nAlle Angaben beruhen auf den Auskünften des Eigentümers, wir übernehmen dafür keine Gewähr. Zwischenverkauf / Änderung / Irrtum vorbehalten.']";;D;;;;
