timestamp;obj_regio1;obj_heatingType;obj_telekomTvOffer;obj_cId;obj_newlyConst;obj_balcony;obj_picture;obj_picturecount;obj_pricetrend;obj_telekomUploadSpeed;obj_telekomTrackingGroup;obj_telekomInternetTechnology;obj_yearConstructed;ga_cd_developer_virtualreality;obj_telekomInternetType;obj_galleryAd;obj_project_id;obj_pricetrendbuy;obj_scoutId;obj_noParkSpaces;obj_firingTypes;obj_hasKitchen;obj_ExclusiveExpose;obj_telekomInternetProductName;obj_courtage;geo_bln;obj_cellar;obj_purchasePriceRange;obj_yearConstructedRange;obj_houseNumber;obj_pricetrendrent;obj_livingSpace;geo_krs;obj_zipCode;obj_condition;obj_interiorQual;ga_cd_cxp_historicallisting;obj_telekomDownloadSpeed;obj_parkingSpace;obj_street;obj_lift;obj_telekomInternetUrlMobile;obj_telekomInternetUrl;obj_streetPlain;obj_typeOfFlat;geo_plz;obj_noRooms;obj_assistedLiving;obj_groupnumber;obj_ityp;obj_telekomHdTelephone;geo_land;ga_cd_via;obj_telekomInternet;obj_immotype;obj_rented;obj_floor;obj_nbp;obj_telekomInternetServices;obj_telekomInternetProductAvailable;obj_cwId;obj_purchasePrice;ga_cd_application_requirements;obj_numberOfFloors;obj_noRoomsRange;ga_cd_maillead_default_shown;obj_garden;evt_count_pm_sig;obj_barrierFree;obj_international;obj_regio3;obj_objectnumber;obj_livingSpaceRange;obj_regio2;URL;beschreibung;ga_cd_via_qualified;obj_rentSubsidy;obj_energyType;obj_energyEfficiencyClass;obj_thermalChar;obj_usableArea;obj_lastRefurbish
2020-05-24 21:07:04.312039;Berlin;central_heating;ONE_YEAR_FREE;17089495;y;y;https://pictures.immobilienscout24.de/listings/556fc3a6-a2bc-43f2-ba4e-bbec268cc601-1359314297.jpg/ORIG/resize/118x118%3E/extent/118x118/format/jpg/quality/80;9;10.14;40 MBit/s;telekom_layer_magenta_l;über VDSL;2020;true;REGULAR;disabled;79562;10.14;110180289;1;no_information;n;true;MagentaZuhause L;y;Berlin;n;7;9;no_information;4.38;95.6;Berlin;12623;no_information;no_information;false;100 MBit/s;outside;no_information;n;https://padlock.link/ioml;https://padlock.link/ml;no_information;maisonette;12623;3;n;8541;2,active;true;Deutschland;standard;100 MBit/s;wohnung_kauf;n;0;true;web,email,bank,music,dl-ul,game,sd,mltstr,hd,fast-ul-dl;true;002.01007866969;393963;profile0;3;3;true;n;showqualicontactform;n;n;Mahlsdorf_Hellersdorf;03946-01;4;Berlin;/expose/110180289;['Die hochwertigen Wohnungen liegen in einer ruhigen und begrünten Einfamilienhaussiedlung an der Grenze zwischen Kaulsdorf und Mahlsdorf.\r\n\r\nDie zwei in Massivbauweise errichteten Häuser umfassen insgesamt 8 Eigentumswohnungen verschiedener Größen (ca. 60 m² bis 96 m²) und Wohnungstypen. Jede Wohnung bietet Ihnen einen Balkon bzw. eine Terrasse mit Blick in den Gartenbereich. Zusätzlich steht Ihnen ein persönlicher PKW-Stellplatz zur Verfügung, welcher den jeweiligen Wohnungen zugeordnet ist.\r\n\r\nDas Wohnensemble teilt sich auf in vier Maisonette-Wohnungen, zwei kleinere charmante Wohnungen und zwei großzügig geschnittene Wohnungen. Die Maisonette-Wohnungen erstrecken sich über Souterrain und Erdgeschoss in beiden Häusern. Im 1. Obergeschoss von Haus 1 befinden sich die zwei kleineren Wohnungen. Die zwei großen Wohnungen befinden sich im 2. Obergeschoss von Haus 1 sowie im 1. Obergeschoss von Haus 2.\r\n\r\nDie Wohnungen bieten Ihnen eine qualitativ hochwertige Ausstattung, welche eine energiesparende Fußbodenheizung mit Einzelraumsteuerung, erstklassige Markenarmaturen und Sanitärobjekte, Parkettböden, eine moderne Video-Türsprechanlage sowie Rollläden an allen Fenstern und Türen beinhaltet.\r\n\r\nAlle Einheiten auf einen Blick finden Sie auch auf unserer Projektseite: \r\nwww.wohnen-am-wuhletal.de', '- Fertigstellung ist geplant für Herbst 2020\r\n- qualitativ hochwertiges Parkett\r\n- energiesparende Fußbodenheizung mit Einzelraumsteuerung\r\n- erstklassige Markenarmaturen und Sanitärobjekte\r\n- alle Fenster und Türen erhalten Rollläden\r\n- moderne Video-Türsprechanlage\r\n- teilweise privater Gartenanteil', 'Einen Katzensprung vom Berliner Stadtzentrum entfernt, mitten im idyllischen Wohnumfeld entsteht eine moderne Wohnoase mit Anspruch und Ausblick. 30 Minuten Autofahrt bis zum Alexanderplatz, 10 Minuten Fußweg bis zur S-Bahn-Station und 15 Minuten mit dem Rad zum nächsten Badesee – zentraler kann man in Berlin kaum leben. Denn lebenswert ist es in Kaulsdorf allemal. Wer sich dem Berliner Stadttrubel entziehen und dennoch das Berliner Partyleben genießen möchte, wird hier sein Wohnglück finden. Sie genießen die Vorteile eines Wohngebietes mit Eigenheim-Flair und Gärtnercharme, ohne Arbeit und Mühe in Gartenpflege und Haussanierung investieren zu müssen. \r\n\r\nZahlreiche Einkaufsmöglichkeiten finden Sie in der näheren Umgebung wie zum Beispiel im Spree-Center-Hellersdorf und in vielen verschiedenen Supermärkten für den alltäglichen Bedarf. Ebenso gibt es viele Freizeitangebote und - Möglichkeiten vor Ort wie den Habermannsee, das FEZ Strandbad, den Weißen See, eine Tanzschule, den TSV Karlshorst e.V. und den Biesdorf Baggersee sowie einige Restaurants. Das Angebot für die Kinderbetreuung und Bildungseinrichtungen umfasst alle Altersklassen - von Kitas, Grundschulen hin zu den verschiedenen Oberschulen.', 'Bitte haben Sie Verständnis dafür, dass wir Ihre Anfrage nur in schriftlicher Form (bevorzugt per E-Mail) unter Angabe des vollständigen Namens und Ihrer Adresse, bearbeiten können.\r\n\r\nEine Besichtigung ist nach vorheriger Absprache mit uns möglich. \r\n\r\nGerne sind wir bei der Finanzierung dieses Objektes behilflich.\r\n\r\nWeitere aktuelle Immobilienangebote finden Sie unter www.bsk-immobilien.de.\r\nVERBRAUCHERINFO\r\n1. Maklerleistung ist der Nachweis der Gelegenheit zum Abschluss eines Vertrages bzw. Vermittlung eines Vertrages über eine Immobilie gegen die Courtagezahlungspflicht des Kunden\r\n2. Unternehmer,Anschrift,Beschwerdeadressat\r\nLBSi NordWest,Himmelreichallee 40,48149 Münster,Tel:0251/4124774,Fax:0251/4124799,eMail:info@lbsi-nordwest.de\r\nGF:Roland Hustert,Helmut Steinkamp\r\n3. Es besteht ein Widerrufsrecht\r\n4. Weitere Infos: verbraucherinfo.lbsi-nordwest.de'];;;;;;;
2020-05-24 21:07:04.733089;Berlin;no_information;ONE_YEAR_FREE;23208;n;n;https://pictures.immobilienscout24.de/listings/df5c107d-4ba7-40d9-8c7f-6935838bad3b-1359701860.jpg/ORIG/resize/118x118%3E/extent/118x118/format/jpg/quality/80;11;12.78;40 MBit/s;telekom_layer_magenta_l;über VDSL;1910;;REGULAR;disabled;;12.78;116235213;;natural_gas_heavy;y;false;MagentaZuhause L;y;Berlin;y;3;1;no_information;7.25;40;Berlin;10553;no_information;no_information;false;100 MBit/s;no_information;no_information;n;https://padlock.link/ioml;https://padlock.link/ml;no_information;apartment;10553;1;n;1;2,active;true;Deutschland;premium;100 MBit/s;wohnung_kauf;y;2;;web,email,bank,music,dl-ul,game,sd,mltstr,hd,fast-ul-dl;true;001.23208;129000;profile0;5;1;true;n;;n;n;Tiergarten_Tiergarten;O-63429;1;Berlin;/expose/116235213;['Das gut gepflegte Haus befindet sich einer ruhigen Seitenstraße von Moabit und ist dennoch verkehrsgünstig gelegen. \r\n\r\nFordern Sie bitte für weitere Informationen unser ausführliches Exposé an!', '- 1 Zimmer\r\n- Küche \r\n- Badezimmer mit Dusche\r\n- Flur\r\n- Kellerraum (Sondernutzungsrecht)\r\n- Fahrradkeller (Gemeinschaftsflächen)\r\n', 'Der umliegende Kiez des Mehrfamilienhauses ist von vielfältigen Einkaufsmöglichkeiten, Restaurants sowie der Möglichkeit, an der Spree zu flanieren, geprägt.\r\n\r\nDas Wohnhaus befindet sich in einer ruhigen Seitenstraße von Moabit. Die Turmstraße mit ihren vielen Restaurants, Spätis und Einkaufsmöglichkeiten liegt in fußläufiger Nähe. Hier findet man sowohl die architektonisch ansprechende Arminiusmarkthalle - ein Paradies für Liebhaber frischer Lebensmittel -, als auch den Wochenmarkt am Mierendorffplatz. Die nachbarschaftliche Lage zur Technischen Universität, dem Tiergarten als Naherholungsgebiet und der Charlottenburger City mit dem Kurfürstendamm macht den Standort besonders attraktiv. Hier erlebt man urbanes Flair in einem gewachsenen und gutbürgerlichen Berliner Viertel. \r\n\r\nVom Wohnhaus benötigt man nur einige Minuten zu den verschiedenen Buslininen an der Turmstraße / Beusselstraße. Die U-Bahn-Stationen Turmstraße und Mierendorffplatz und die S-Bahn-Station Beusselstraße sind gute 10 Minuten entfernt. \r\n\r\nDie Stadtautobahn ist über die Auffahrt Beusselstaße in unter 10 Autominuten erreichbar. Somit ist eine gute Erreichbarkeit aller Stadtbezirke gewährleistet.', '- monatl. Nettokaltmiete: 245,00 €\r\n- monatl. Hausgeld: 140,00 €\r\n- anteilige Instandhaltungsrücklage per 31.12.2018: 1.582,93 €\r\n- Miteigentumsanteil: 189/10.000stel\r\n- Ein gültiger Energieausweis liegt vor.\r\n'];true;140;energy_consumption;E;157;;
2020-05-24 21:07:05.221984;Berlin;central_heating;ONE_YEAR_FREE;201783;n;y;https://pictures.immobilienscout24.de/listings/b7c1825c-0685-4ab6-8c6a-027ae9031ef8-1354760903.jpg/ORIG/resize/118x118%3E/extent/118x118/format/jpg/quality/80;38;11.73;40 MBit/s;telekom_layer_magenta_l;über VDSL;1995;;REGULAR;;;11.73;116233719;;district_heating;y;false;MagentaZuhause L;y;Berlin;y;8;5;1a;5.75;106.02;Berlin;12165;well_kept;normal;false;100 MBit/s;no_information;Berlinickestr.;y;https://padlock.link/ioml;https://padlock.link/ml;Berlinickestr.;apartment;12165;4;n;;2,active;true;Deutschland;top;100 MBit/s;wohnung_kauf;n;2;;web,email,bank,music,dl-ul,game,sd,mltstr,hd,fast-ul-dl;true;001.201783;498600;profile0;6;4;true;n;showqualicontactform;n;n;Steglitz_Steglitz;116233719;5;Berlin;/expose/116233719;['Die freie Wohnung im 2. OG liegt in einem 1995 erbauten Haus mit insgesamt 16 Einheiten.\nDas Haus sowie der Garten sind sehr gepflegt.\nDie Berlinickestr. ist eine kleine Anliegerstraße mit direkter Anbindung an die Stadtautobahn 103.', 'Die Wohnung verfügt über 4 Zimmer, 2 Balkone, einer davon in Südwest- Ausrichtung, ein Wannenbad sowie ein Gäste- WC.\nEine gut erhaltene Einbauküche mit neuen Geräten ist vorhanden.\nDie Wohnräume sind mit Teppichboden verlegt, Küche und Bäder sind gefliest.\nVom großen Balkon schaut man auf den Wolfensteindamm, der in die beliebte Schloßstr. übergeht. \nDie S-Bahn S1 fährt direkt am Haus vorbei.', 'Durch die zentrale Lage können Sie alle öffentlichen Verkehrsmittel fußläufig erreichen. \nU- Bahn und S- Bahn Rathaus Steglitz in 5 Minuten.\nBusse 186, 188, 283, 386 fahren direkt an der Ecke ab.\nAlle Geschäfte des täglichen Lebens, Restaurants, Theater, Shoppingmalls sind in 10 Minuten zu Fuß erreichbar.\nZentraler gehts nicht!', 'Gerne zeigen wir Ihnen die freie Wohnung.'];;325;energy_consumption;;84;106.02;
2020-05-24 21:07:05.576323;Berlin;central_heating;;15303402;n;y;https://pictures.immobilienscout24.de/listings/a13c6c6e-bb15-4757-9af5-c237b9171406-1368611427.jpg/ORIG/resize/118x118%3E/extent/118x118/format/jpg/quality/80;13;9.64;;;;1997;true;;;;9.64;116236456;;gas;n;false;;y;Berlin;y;7;5;no_information;4.62;98;Berlin;12309;well_kept;normal;false;;no_information;no_information;n;;;no_information;apartment;12309;3;n;;2,active;;Deutschland;top;;wohnung_kauf;n;2;;;;001.15251303;349000;profile0;3;3;true;n;showqualicontactform;n;n;Lichtenrade_Tempelhof;GZ812000;4;Berlin;/expose/116236456;['Hierbei handelt es sich um einen Neubau , der in 1997 erbaut wurde und bei dem in 2016/2017 das Dach und die Fassade erneurt worden sowie das Treppenhaus.', '+ BERLIN-LICHTENRADE\n+ GEPFLEGTER NEUBAU\n+ HELLES 2.OG\n+ PRAKTISCHER GRUNDRISS\n+ BALKON ZUR SONNENSEITE\n+ LAMINATBODEN IN ALLEN RÄUMEN\n+ TAGESLICHT BAD MIT WANNE & DUSCHE\n+ GÄSTE-WC VORHANDEN\n+ INKL. KELLER\n+ STELLPLÄTZE NACH VERFÜGBARKEIT OPTIONAL\n+ GAS (ZH) MIT WARMWASSERVERSORGUNG', 'Das Objekt befindet sich nahe Volkspark Lichtenrade in einer vorwiegend mit Mehrfamilienhäusern und Einfamilienhäusern bebauten Lage. Diverse Busverbindungen und Einkaufsmöglichkeiten befinden sich in unmittelbarer Umgebung.', 'Sehr geehrte Interessenten, Sie erreichen unser Immobilienbüro wie folgt:\n\nMontag - Freitag: 09.00 - 19.00 Uhr\nSamstags: 10.00 - 16.00 Uhr\nSonntags: nach Absprache'];;298;;;;;
2020-05-24 21:07:05.927842;Berlin;central_heating;ONE_YEAR_FREE;15474925;n;y;https://pictures.immobilienscout24.de/listings/9d5a8b1f-fc20-4473-8237-9fbed46db772-1354661426.png/ORIG/resize/118x118%3E/extent/118x118/format/jpg/quality/80;17;11.3;40 MBit/s;telekom_layer_magenta_l;über VDSL;1954;;REGULAR;;;11.3;116207596;;district_heating;y;false;MagentaZuhause L;y;Berlin;y;6;2;no_information;5.73;62.07;Berlin;14052;no_information;no_information;false;100 MBit/s;no_information;no_information;n;https://padlock.link/ioml;https://padlock.link/ml;no_information;raised_ground_floor;14052;3;n;;2,active;true;Deutschland;top;100 MBit/s;wohnung_kauf;n;;;web,email,bank,music,dl-ul,game,sd,mltstr,hd,fast-ul-dl;true;001.15417560;292500;profile0;;3;true;n;;n;n;Charlottenburg_Charlottenburg;VK-20053;3;Berlin;/expose/116207596;['Die Wohnanlage setzt sich aus mehreren Mehrfamilienhäusern  zusammen.\n\nDie Wohnung befindet sich im Hochparterre des 5-geschossigen Gebäudes und ist somit bequem erreichbar.\n\nDie Wohnfläche von  ca. 62 m² verteilt sich auf einen Eingangsbereich, ein Wohnzimmer mit Loggia, zwei Schlafzimmer, eine praktische Abstellkammer, eine Küche und ein Badezimmer mit Tageslicht.  \n\nDie Küche ist mit einer hellen und modernen Einbauküche ausgestattet.  Das modern gestaltete Badezimmer verfügt über eine großzügige Dusche.\n\nDie Fenster wurden mit elektronischen Rollläden versehen. Die Wohnung ist mit Laminatboden ausgestattet und befindet sich in einem sehr gepflegten Zustand.\n\nEine Loggia und ein Keller runden das Angebot ab.\n\nInventar und Möbel können nach Absprache übernommen werden.\n\nDie Wohnung ist ab den 31.12.2021 bezugsfrei.', 'Westend ist ein begehrter Berliner Ortsteil im Bezirk Charlottenburg-Wilmersdorf. Eine Berliner Bestlage. Im Grünen und doch zentral!\n\nIn naher Umgebung befindet sich das Schloss Charlottenburg mit dem herrlich angelegten Schlossgarten, derOrangerie und dem Mausoleum.\n\nAuf  der beliebten Reichsstraße bieten viele kleine Geschäfte, Cafes und Restaurants Einkaufsmöglichkeiten und Ausgehmöglichkeiten.\n\nMit dem PKW sind die Autobahn und die Bundesstraßen schnell erreicht, und auch mit den öffentlichen Verkehrsmitteln ist per Bus und durch den U-Bahnhof „Ruhleben“ und den S-Bahnhof „Westend“ eine sehr gute Anbindung gegeben.  \n\nDer Flughafen Berlin-Tegel, der Flughafen Berlin-Schönefeld, die Hauptbahnhöfe Bahnhof Zoo oder Spandau sowie auch Potsdam sind somit gut erreichbar.'];;190;energy_consumption;C;81.4;;
2020-05-24 21:07:06.289601;Berlin;central_heating;ONE_YEAR_FREE;15741874;n;y;https://pictures.immobilienscout24.de/listings/3404f69c-8794-4720-81e4-8a77b9d0d525-1361583498.jpg/ORIG/resize/118x118%3E/extent/118x118/format/jpg/quality/80;36;11.48;40 MBit/s;telekom_layer_magenta_l;über VDSL;1900;;REGULAR;;;11.48;116206100;;gas;n;true;MagentaZuhause L;y;Berlin;n;9;1;no_information;7.14;94.51;Berlin;10243;well_kept;normal;false;100 MBit/s;no_information;no_information;n;https://padlock.link/ioml;https://padlock.link/ml;no_information;apartment;10243;3;n;;2,active;true;Deutschland;premium;100 MBit/s;wohnung_kauf;n;1;;web,email,bank,music,dl-ul,game,sd,mltstr,hd,fast-ul-dl;true;002.01002949789;581952;profile0;6;3;true;n;showqualicontactform;n;n;Friedrichshain_Friedrichshain;6595#MPKbf4;4;Berlin;/expose/116206100;['KONTAKTLOSE BESICHTIGUNG: Wir bieten Ihnen die Möglichkeit der kontaktlosen Live-Besichtigung!\n\nUnd so funktioniert`s:\n\n1. Sie vereinbaren regulär einen Besichtigungstermin via Mail oder Telefon für die von Ihnen favorisierte Immobilie.\n\n2. Unsere Mitarbeiter sind schon vor der Besichtigung vor Ort und desinfizieren die Wohnung/Kontaktstellen (Türklinken, Fenstergriffe, Fensterbänke, etc).\n\n3. Bevor Sie zu Ihrer Besichtigung erscheinen, ist die Haustür sowie die Wohnungstür für Sie aufgeschlossen und frei zugänglich.\n\n4. Sie besichtigen allein, vollkommen kontaktlos auf eigene Faust ohne uns.\n\n5. Nachdem Sie die Wohnung verlassen haben, desinfizieren wir die Wohnung erneut und verschliessen wieder alle Türen.\n\n6. Alle eventuellen Fragen beziehungsweise nächsten Schritte klären wir nach der Besichtigung bei einem gemeinsamen Telefonat.\n\n---\n\nBei dem hier präsentierten Objekt in der Warschauer Straße 10 handelt es sich um einen klassischen Altbau aus der Gründerzeit im beliebten Szenebezirk Berlin-Friedrichshain unweit des Frankfurter Tors und Boxhagener Platzes.\n\nDas um 1900 erbaute und über die Jahre liebevoll instandgehaltene Mehrfamilienhaus verfügt auf insgesamt 6 Etagen über 2 Gewerbe- und 11 Wohneinheiten, von denen eine Vielzahl der zur Straße gewandten Einheiten über Balkone mit Blick auf die Warschauer Straße verfügen. Das Dachgeschoss wurde bereits vor einigen Jahren zu Wohnzwecken ausgebaut, ein Fahrstuhl ist nicht vorhanden. Das Objekt ist mit einer Gas-Zentralheizung ausgestattet.\n\nDie Fassade des Mehrfamilienhauses sowie das gesamte Gemeinschaftseigentum werden im Laufe des Frühjahrs noch umfassenden Sanierungsarbeiten unterzogen. Im Hinterhof des Objektes entsteht zudem ein repräsentativer Neubau sowie eine Begrünung der Hoffläche welche dem Projekt den letzten Schliff verleihen. So spannen wir einen nahtlosen Bogen zwischen klassischem Altbauflair und zeitgenössischer Architektur angepasst an die Bedürfnisse des modernen Lebens. Die ersten Arbeiten hierzu sind in vollem Gange.\n\nDirekt an der Verbindungsstraße der angrenzenden Bezirke Prenzlauer Berg im Nordwesten und Kreuzberg im Südwesten gelegen, könnte das hier präsentierte Objekt nicht zentraler sein und bietet eine willkommene Mischung aus Ruhe vom stressigen Alltag und Nähe zum Trubel der Großstadt.\n\n---\n\nThe object presented here at Warschauer Straße 10 is a classic old building from the Wilhelminian period in the popular trendy district of Berlin-Friedrichshain near the Frankfurt Gate and Boxhagener Platz.\n\nThe multi-family house, built around 1900 and lovingly maintained over the years, has a total of 6 commercial and 11 residential units on 6 floors, of which a large number of the units facing the street have balconies with a view of Warschauer Strasse. The attic was expanded a few years ago for residential purposes, there is no elevator. The property is equipped with gas central heating.\n\nThe facade of the apartment building and the entire community property will undergo extensive renovation work in the spring. In the back yard of the property there is also a representative new building and a green area of the courtyard which give the project the finishing touch. In this way we span a seamless arc between classic old building flair and contemporary architecture adapted to the needs of modern life. The first work on this is in full swing.\n\nLocated directly on the connecting road between the neighboring districts of Prenzlauer Berg in the northwest and Kreuzberg in the southwest, the property presented here could not be more central and offers a welcome mix of tranquility from everyday stress and closeness to the hustle and bustle of the big city.', 'Wohnfläche: 94,51 m2\nKaufpreis: 581.952,00 €\nHausgeld: 250,91 €\nLage: 1. OG links\nEtagenzahl gesamt: 6\nStatus: bezugsfrei\nZimmer: 3\nBalkon: ja\nEinbauküche: nein\nKeller: ja\nBodenbelag: aufgearbeiteter Dielenboden\nFenster: Kunststofffenster\nTüren: Holztüren\nDeckenhöhe: 3,20 Meter\nFahrstuhl: nein\nHeizung: Zentralheizung (Gas)\nEnergieausweis: consumption pass\nEnergiekennwert: 95,09 kWh/ (m².a) inkl. Warmwasser/Heizung\n\n---\n\nLiving area: 94,51 m2\nPurchase price: € 581.952,00\nHouse money: ca. € 250,91\nLocation: 1st floor left\nStoreys: 6\nStatus: vacant\nRooms: 3\nBalcony: yes\nFitted kitchen: no\nBasement: yes\nFlooring: refurbished wooden floorboards\nWindows: plastic windows\nDoors: wooden doors\nCeiling height: 3,20 meters\nElevator: no\nHeating: central heating (gas)\nEnergy certificate: consumption pass\nEnergy performance: 95,09 kWh/ (m².a) incl. warm water/heating', 'Die Warschauer Straße im allseits beliebten und sehr dynamischen Bezirk Berlin-Friedrichshain ist eine der Hauptschlagadern im Osten der Hauptstadt und begeistert durch ein abwechslungsreiches Angebot an unzähligen Restaurants, Szenekneipen und kleineren Geschäften.\n\nDas nähere Umfeld des Objekts bietet die perfekte Möglichkeit für ausgelassene Sommerabende oder spontane Einkaufsbummel. Auch der regelmäßig stattfindende Wochen- und Flohmarkt am nahegelegenen Boxhagener Platz, dem insgeheimen Zentrum des Viertels, begeistert an den Wochenenden die Bewohner des Kiezes und hält neben stets frischen Lebensmitteln der Region auch immer die ein oder andere Überraschung bereit. \n\nAuch für das perfekte Familienglück bietet die Warschauer Straße und der Kiez rund um den Boxhagener Platz den perfekten Schaffensort. Unzählige Kindertagesstätten, Grundschulen, Oberschulen und Gymnasien befinden sich in unmittelbarer Umgebung des Objekts und auch Läden zur Deckung des täglichen Bedarfs wie Supermärkte, Drogerien oder Einkaufszentren sind stets nur einen Schritt weit Ihres neuen Zuhauses entfernt.\nMit der perfekten Anbindung an den öffentlichen Personennahverkehr könnte das hier angebotene Objekt nicht idealer gelegen sein. Zusätzlich zu der Bundesstraße B96a verkehren direkt vor der Haustür die Tram M10, mehrere Busse als auch die U-Bahnlinie U5, welche innerhalb von 3 Minuten fußläufig zu erreichen ist und im 5-Minuten-Takt zwischen dem Alexanderplatz und Hönow, bzw. dem Tierpark Berlin pendelt.\n\n---\n\nWarschauer Straße in the popular and very dynamic district of Berlin-Friedrichshain is one of the main arteries in the east of the capital and inspires with a varied range of restaurants, trendy bars and smaller shops.\n\nThe closer surroundings of the property offer the perfect opportunity for exuberant summer evenings or spontaneous shopping trips. The regular weekly and flea market at nearby Boxhagener Platz, the secret center of the district, delights the residents of the neighborhood on weekends and always has one or two surprises in store in addition to fresh local food.\n\nWarschauer Straße and the Kiez around Boxhagener Platz also offer the perfect place for creating perfect family happiness. Countless daycare centers, elementary schools, high schools and high schools are in the immediate vicinity of the property and also shops for daily needs such as supermarkets, drugstores or shopping centers are always just a step away from your new home.\n\nWith the perfect connection to local public transport, the property offered here could not be more ideally located. In addition to the B96a federal road, the M10 tram, several buses and the U5 subway line run right outside the front door, which can be reached on foot in 3 minutes and every 5 minutes between Alexanderplatz and Hönow, or the zoo Berlin commutes.', 'BESICHTIGUNG: Für ein persönliches Gespräch und zur individuellen Abstimmung eines Besichtigungstermins stehen wir Ihnen gerne unter 030 27581533 persönlich zur Verfügung.\n\nVIEWING: For a personal viewing and to individually coordinate an appointment, we are happy to assist you at 030 27581533.'];true;250.91;energy_consumption;C;95.09;;
