timestamp;obj_regio1;obj_heatingType;obj_cId;obj_newlyConst;obj_balcony;obj_picture;obj_picturecount;obj_pricetrend;obj_yearConstructed;obj_project_id;obj_pricetrendbuy;obj_scoutId;obj_noParkSpaces;obj_firingTypes;obj_hasKitchen;obj_ExclusiveExpose;obj_courtage;geo_bln;obj_cellar;obj_purchasePriceRange;obj_yearConstructedRange;obj_rentSubsidy;obj_houseNumber;obj_energyType;obj_pricetrendrent;obj_livingSpace;geo_krs;obj_zipCode;obj_condition;obj_interiorQual;obj_energyEfficiencyClass;ga_cd_cxp_historicallisting;obj_parkingSpace;obj_street;obj_lift;obj_streetPlain;obj_typeOfFlat;geo_plz;obj_noRooms;obj_thermalChar;obj_assistedLiving;obj_groupnumber;obj_ityp;geo_land;ga_cd_via;obj_immotype;obj_rented;obj_floor;obj_nbp;obj_telekomInternetProductAvailable;obj_cwId;obj_purchasePrice;ga_cd_application_requirements;obj_numberOfFloors;obj_noRoomsRange;ga_cd_maillead_default_shown;obj_garden;evt_count_pm_sig;obj_barrierFree;obj_international;obj_regio3;obj_objectnumber;obj_livingSpaceRange;obj_regio2;URL;beschreibung;obj_telekomTvOffer;obj_telekomUploadSpeed;obj_telekomTrackingGroup;obj_usableArea;obj_telekomInternetTechnology;obj_telekomInternetType;obj_galleryAd;obj_telekomInternetProductName;obj_telekomDownloadSpeed;obj_telekomInternetUrlMobile;obj_telekomInternetUrl;obj_telekomHdTelephone;obj_telekomInternet;obj_telekomInternetServices;obj_lastRefurbish;ga_cd_developer_virtualreality
2020-05-24 20:39:23.650815;Berlin;combined_heat_and_power_plant;18623556;y;y;https://pictures.immobilienscout24.de/listings/836cb4e5-120e-4d22-a8ea-76da921cb28c-1370653094.jpg/ORIG/resize/118x118%3E/extent/118x118/format/jpg/quality/80;7;10.62;2021;90677;10.62;118627750;1;gas;n;false;n;Berlin;y;10;9;309;61;energy_required;5.93;123.74;Berlin;13187;first_time_use;sophisticated;B;false;no_information;"M&uuml;hlenstra&szlig;e";y;Mühlenstraße;ground_floor;13187;5;72.6;n;6109;2,active;Deutschland;top;wohnung_kauf;n;5;true;false;002.01009567510;809100;profile0;5;5;true;n;showqualicontactform;n;n;Pankow_Pankow;118627750;6;Berlin;/expose/118627750;['Hier wohnt das Leben.\n\nMitten in Berlin entsteht ein modernes Ensemble aus verschiedenen Einheiten vereint in einem Haus. \n\nSo einzigartig wie die Menschen, die darin wohnen werden. Facettenreich, individuell, unverkennbar.\n\nIn diesen Häusern avanciert die eigene Wohnung zum schönsten aller Schmuckstücke.\n\nUnd schafft ein Zuhause, inmitten einer der schönsten Bezirke der pulsierenden Großstadt.\n\nEinzigartige Menschen und einzigartige Architektur – gemeinsam ergeben sie eine neue Community in Pankow.\n\nWillkommen in Pan&Co!', 'Treten Sie ein: Die Eigentumswohnungen in der Mühlenstraße zeichnen sich insbesondere durch ihre Multifunktionsräume aus. \n\nDie gemeinschaftlichen Bereiche, in denen gekocht, gegessen und gelebt wird, bilden jeweils das Herzstück der Wohnungen. Echtholzparkett, Fußbodenheizung und bodentiefe Fenster garantieren den für einen modernen und anspruchsvollen Neubau so unabdingbaren hohen Wohnkomfort.\n\nEinige Ausstattungsmerkmale der Eigentumswohnung auf einen Blick:\n\n-\tEchtholzparkett in den Wohn- und Schlafräumen\n-\tFußbodenheizung\n-\tElektrisch betriebene Verschattung\n\nIm Gebäude:\n\n-\tAufzug\n-\tFahrradstellplätze\n-\t30 Tiefgaragenstellplätze', 'Nur acht Gehminuten vom S+U-Bahnhof Pankow entfernt, ist das Neubaugebäude in der Mühlenstraße perfekt an den Nahverkehr und somit an alle anderen Orte und Plätze in Berlin angebunden. \n\nAber – warum Pankow überhaupt verlassen? \n\nNeben einem Spielplatz gleich vor dem Haus und mehreren Parks mit weitläufigen Grünflächen in direkter Umgebung bietet Pankow alles, was die Großstadt so lebenswert macht: zahlreiche Schulen und Kitas, viele Restaurants, Cafés und Shoppingmöglichkeiten, eine hervorragende Ärzteversorgung.\n\nGut, zumindest um zur Arbeit zu kommen, muss selbst in einem besonders lebenswerten Viertel der eine oder die andere auch mal über die Stadtteilgrenzen hinaustreten. \n\nDas ist in diesem Fall aber zum Glück gar kein Problem, da man dank der guten ÖPNV-Anbindung und der zentralen Lage schnell von A nach B kommt, zum Beispiel innerhalb von 19 Minuten zum Alexanderplatz. \n\nNoch schneller ist man übrigens in Prenzlauer Berg mit seiner fantastischen Gastronomie- und Kulturlandschaft.', '+++ Sie erwerben das Objekt provisionsfrei vom Bauträger +++\n\nUnser Vertriebsteam steht Ihnen gern für Terminvereinbarungen zur Verfügung.\n\nWir freuen uns auf Sie!'];;;;;;;;;;;;;;;;
2020-05-24 20:39:24.039775;Berlin;district_heating;12418475;n;y;https://pictures.immobilienscout24.de/listings/49e68448-f623-4a73-805e-fa8bd65eed76-1371021836.jpg/ORIG/resize/118x118%3E/extent/118x118/format/jpg/quality/80;13;11.49;1964;;11.49;118714204;;district_heating;y;false;y;Berlin;y;6;2;319;no_information;energy_consumption;5.14;100.28;Berlin;12351;well_kept;no_information;NO_INFORMATION;false;no_information;no_information;y;no_information;apartment;12351;4.5;138.48;n;;2,active;Deutschland;top;wohnung_kauf;n;6;;true;001.12418475;298000;profile0;;4;true;n;showqualicontactform;n;n;Buckow_Neukölln;SU750;4;Berlin;/expose/118714204;['Die schöne Wohnung befindet sich in der 6. Etage eines sehr gepflegten Mehrfamilienhauses in guter Lage von Berlin-Gropiusstadt. Es wurde auf einem schönen Sonnengrundstück erbaut. Ein Personenaufzug ist vorhanden. Zur Wohnanlage gehört ein großer Parkplatz, der nur für die Bewohner zugänglich ist.', 'Die helle und gut geschnittene Wohnung verfügt über 4,5 Zimmer, die viel Platz und gute Stellmöglichkeiten für Möbel bieten. Vom hellen und großen Wohnzimmer gelangt man auf den schönen Balkon in Westlage, der zum Verweilen einlädt. Die anderen Zimmer bieten ebenfalls viel Platz und gute Stellflächen. Eines der Zimmer hat einen weiteren eigenen Balkon. Die Wohnung verfügt über zwei Badezimmer. Eines der Badezimmer ist mit einer Badewanne ausgestattet, das andere Badezimmer mit einer Dusche. Die Küche hat eine Einbauküche mit Induktionskochfeld und bietet ebenfalls viel Platz und gute Stellmöglichkeiten.\nDie Wohnung wird bezugsfrei übergeben.', 'Das Objekt liegt in einer ruhigen Nebenstrasse, die nur von Anliegern befahren wird. Diverse öffentliche Verkehrsmittel, Einkaufsmöglichkeiten, Schulen, Ärzte und Restaurants befinden sich in unmittelbarer Umgebung.', 'Bitte haben Sie Verständnis dafür, dass wir nur vollständig ausgefüllte Kontaktanfragen bearbeiten werden\n( Name , Anschrift , E-Mail , Telefonnummer). Irrtum und Zwischenverkauf vorbehalten. Unsere Informationen basieren auf Angaben des Verkäufers und der uns zur Verfügung gestellten Unterlagen für die wir keine Haftung übernehmen können.'];ONE_YEAR_FREE;40 MBit/s;telekom_layer_magenta_l;4;über VDSL;REGULAR;disabled;MagentaZuhause L;100 MBit/s;https://padlock.link/ioml;https://padlock.link/ml;true;100 MBit/s;web,email,bank,music,dl-ul,game,sd,mltstr,hd,fast-ul-dl;;
2020-05-24 20:39:24.428717;Berlin;central_heating;17576674;n;y;https://pictures.immobilienscout24.de/listings/68ae9ad7-c338-41fa-9370-cb285c7f83f2-1371033255.jpg/ORIG/resize/118x118%3E/extent/118x118/format/jpg/quality/80;14;11.3;1956;;11.3;118719201;;gas;n;false;n;Berlin;n;4;2;220;36;energy_consumption;5.73;42;Berlin;14057;fully_renovated;normal;;false;outside;Kaiserdamm;y;Kaiserdamm;raised_ground_floor;14057;1;223;n;;2,active;Deutschland;standard;wohnung_kauf;n;;;true;009.f22cdcd4-a268-48d7-9db8-7856769644ba;195000;profile0;;1;true;n;showqualicontactform;n;n;Charlottenburg_Charlottenburg;118719201;2;Berlin;/expose/118719201;['Diese wunderschön geschnittene 1 Zimmerwohnung ist lichtdurchflutet und strahlt im Inneren eine entspannte Ruhe aus.  Die Wohnung ist gerade frisch saniert worden. Es erwarten Sie eine zeitgemäße Einrichtung der Fußboden ist mit Laminat belegt.\n\n\nFür die Modernisierung würden nur hochwertige Materialien verwendet.\nDie Zimmer sind sehr angenehm und praktikabel geschnitten. Die Wohnzimmer und der Balkon sind nach Süden ausgerichtet. Die Küche und das Bad nach Norden. \n \nDer Blick aus den großzügigen Fenstern wandert in den Berliner Himmel, wo einem der Funkturm entgegen strahlt. \n \nDie Wohnung mit Ihren ca. 42m² liegt im Hochparterre .\n \nDas gesamte Haus wurde vor einigen Jahren in Eigentumswohnungen aufgeteilt und während dieser Zeit fortlaufend modernisiert. Im Jahr 2001 wurde auf das vorhandene Gebäude ein weiteres Geschoss gesetzt in diesem Zusammenhang wurden unter anderem die Heizungsanlage sowie die Aufzüge und der Hauseingangsbereich erneuert.\n\n\n\n\nDas Haus befindet sich in einem technisch gutem Zustand . Die modernen neuen Holzfenster haben eine Sicherheitsverglasung und einen sehr hohen Schallschutzfaktor.\nDie Wohnung kann auch gewerblich genutzt werden.', 'Ihre Wohnung mitten im Herzen von Berlin\n\nin Berlin Charlottenburg nur wenige Minuten zum Kurfürstendamm im Ortsteil Westend befindet sich das in den 50er Jahren in Anlehnung an die Bauhausarchitektur errichtete Wohnhaus. Das vornehme Villenviertel war früher bevorzugtes Wohnquartier von Filmstars der ersten Garnitur. Es bietet alle Annehmlichkeiten gehobener Wohnkultur. Der Theodor-Heuss-Platz ist seit vielen Jahren eine gute Adresse für Firmen aus den Bereichen Medien, Film und Fernsehen. Südlich vom Theodor-Heuss-Platz erstreckt sich das Messegelände. Die Messe expandiert weiter. Ideale Verkehrsanbindungen sind vorhanden nach wenigen Metern erreicht man den U-Bahnhof Theodor-Heuss-Platz. Zur Autobahnauffahrt sind es nur ca. 500 Meter.'];ONE_YEAR_FREE;40 MBit/s;telekom_layer_magenta_l;42;über VDSL;REGULAR;;MagentaZuhause L;100 MBit/s;https://padlock.link/ioml;https://padlock.link/ml;true;100 MBit/s;web,email,bank,music,dl-ul,game,sd,mltstr,hd,fast-ul-dl;2017;
2020-05-24 20:39:24.797341;Berlin;central_heating;22282;n;y;https://pictures.immobilienscout24.de/listings/52278980-f123-4b0f-b22a-712a37a4f484-1371036389.jpg/ORIG/resize/118x118%3E/extent/118x118/format/jpg/quality/80;14;7.89;1966;;7.89;118720894;;gas;n;false;y;Berlin;y;7;2;399;3A;energy_consumption;3.38;65;Berlin;14193;well_kept;no_information;;false;no_information;HAGENPLATZ;n;HAGENPLATZ;roof_storey;14193;2;203;n;;2,active;Deutschland;standard;wohnung_kauf;n;2;;true;001.22282;339000;profile0;2;2;true;y;showqualicontactform;n;n;Grunewald_Wilmersdorf;118720894;3;Berlin;/expose/118720894;['- WOHNEN AM HAGENPLATZ\n- MODERNE NEUBAUANLAGE\n- DACHGESCHOSS 2.OG\n- TERRASSE MIT GRÜNBLICK\n- PANORAMAVERGLASUNG ZUR TERRASSE\n- PARKÄHNLICHES GARTENGRUNDSTÜCK\n- SWIMMINGPOOL & GARTENNUTZUNG\n\n- EXKLUSIV VERTRIEB / ALLEINAUFTRAG\n\nINDIVIDUELLE BESICHTIGUNGEN JEDERZEIT\nGERN UNTER TEL:  0172 / 726 11 00', '- PARKETTBODEN\n- 3 METER DECKENHÖHE\n- WANNENBAD MIT FENSTER\n- EINBAUKÜCHE MIT FENSTER\n- EINBAUSCHRANK\n- VERSPIEGELTE WANDFLÄCHE', '- ERSTKLASSIGE LAGE AM HAGENPLATZ\n- GRUNEWALD & DIANASEE VOR DER TÜR\n- EINKAUFSMÖGLICHKEITEN FUSSLÄUFIG\n- S-BAHN & BUSVERBINDUNG IN DIE CITY\n- 5 MINUTEN ZUM KURFÜRSTEDAMM\n- WIENER CAFÈ VOR DER TÜR\n- SICHERHEITSSTUFE 1\n- DG - OBERSTES 2. GESCHOSS\n- RUHIG & SONNIG', 'INDIVIDUELLE BESICHTIGUNGEN JEDERZEIT UNTER TEL. 0172 / 726 11 00\n\nSERVICE FÜR EIGENTÜMER\n\nBeim Verkauf Ihrer Immobilie ist es wichtig sich auf einen erfahrenen Partner verlassen zu können der Sie vom Anfang bis zum Notartermin diskret und kompetent betreut.\nWir verfügen seit 30 Jahren über fundierte Kenntnisse des Berliner Immobilienmarktes und entwickeln gerne mit Ihnen eine individuelle Verkaufsstrategie.\nAlle einzelnen Schritte der Vermarktung werden mit Ihnen abgestimmt, um Sie mit potenziellen Käufern aus aller Welt zusammen zu bringen. \nNutzen Sie auch unseren diskreten Exklusivservice um ohne jeglichen Marktkontakt Höchstpreise zu erzielen. Gern beraten wir Sie kostenlos und würden uns freuen von Ihnen zu hören.'];ONE_YEAR_FREE;40 MBit/s;telekom_layer_magenta_l;;über VDSL;REGULAR;;MagentaZuhause L;100 MBit/s;https://padlock.link/ioml;https://padlock.link/ml;true;100 MBit/s;web,email,bank,music,dl-ul,game,sd,mltstr,hd,fast-ul-dl;;
2020-05-24 20:39:25.228403;Berlin;district_heating;17610703;n;n;https://pictures.immobilienscout24.de/listings/ff197436-91ec-41ec-accc-b6c45b3a1e99-1371033455.jpg/ORIG/resize/118x118%3E/extent/118x118/format/jpg/quality/80;3;11.14;1959;;11.14;118718149;0;no_information;n;false;y;Berlin;n;5;2;200;64;;6.17;55.45;Berlin;10409;no_information;no_information;;false;no_information;Storkower Str.;n;Storkower_Str.;apartment;10409;2.5;;n;;2,active;Deutschland;top;wohnung_kauf;n;3;;true;009.eb808053-c275-4395-8fce-dc755606f8bd;220000;profile0;4;2;true;n;;n;n;Prenzlauer_Berg_Prenzlauer_Berg;118718149;2;Berlin;/expose/118718149;['Sofort verfügbar für Eigenbedarf oder als tolle Kapitalanlage!\n\nDie Wohnung liegt in einer Wohnanlage, die in den Jahren 1958-59 gebaut wurde. Schöne helle Wohnungen verteilen sich auf mehrere Häuser mit insgesamt 4 Geschossen. Das Grundstück ist großzügig, grün und bietet mit seinen gestalteten Innenbereichen viel Raum für spielende Kinder und zur Erholung.\n\nIn den Jahren 1996-1999 wurden die Mehrfamilienhäuser umfassend modernisiert. Dazu gehört die Erneuerung der Frisch- und Abwasserleitungen, der Dächer sowie des Anschlusses an die Fernwärme. Die Fassaden sind wärmegedämmt. Bei einem Spaziergang durch die Wohnanlage zeigt sich schnell der gepflegte Zustand. Das Badezimmer ist innenliegend, gefliest und mit einer Badewanne ausgestattet. Zu der Wohnung gehört eine Kellereinheit, die zusätzlich Stauraum bietet.\n\n\nOBJECT DESCRIPTION:\n\nImmediately available for own use or fantastic investment opportunity! \n\nThe apartment is located in a residential complex built between 1958-59. Beautiful bright apartments are distributed in several houses with a total of 4 floors. The property is spacious, green and offers with its designed indoor areas a lot of space for playing children and for recreation.\n\nThe apartment buildings were extensively modernized in the years 1996-1999. This includes the renewal of the fresh water and sewage pipes, the roofs and the connection to the district heating system. The facades are thermally insulated. A stroll through the housing estate will quickly reveal its well-maintained condition. The bathroom is inside, tiled and has a bathtub. A separate cellar compartment is additionally assigned to each apartment. The apartment has a basement unit that offers plenty of storage space.', 'Die 2,5-Zimmer-Wohnung befindet sich im 3 OG des des Wohnhauses:\n- Zwei in etwa gleich große Zimmer\n- Ein weiteres kleines Arbeitszimmer / Gästezimmer / Ankleidezimmer / Esszimmer\n- Badezimmer mit Badewanne\n- Keller\n- Erneuerte Frisch- und Abwasserleitungen, Dächer und Fernwärmeanschluss\n- Wärmegedämmte Fassaden \n\nFACILITIES:\nThe 2.5-room apartment is located on the 3rd floor of the building: \n- Two rooms with approx. equal size\n- One further smaller room that can be uses as office / guestroom / dressing room / dining room\n- Bathroom with bathtub\n- Cellar\n- Renewal of the fresh water and sewage pipes, the roofs and the connection to the district heating system\n- Thermally isolated facades', 'Die Wohnanlage liegt im Prenzlauer Berg, einem beliebten, jungen und angesagten Stadtteil Berlins. Das unmittelbare Wohnumfeld ist sehr gepflegt. \n\nDie im rückwärtigen Grundstücksbereich liegende S-Bahn-Trasse ist durch die vielen Bäume und Sträucher und gute Fenster kaum hörbar. In Laufweite erreicht man viele kleine Geschäfte - typisch für diese Wohngegend. Kindergärten, Schulen sowie verschiedene Freizeiteinrichtungen findet man in unmittelbarer Umgebung. \n\nEine Querstraße weiter liegt die S-Bahn (Ringbahn) und Tram Station Greifswalder Straße, mit der man in kurzer Zeit entspannt das Zentrum erreicht. Der nahegelegene Volkspark Friedrichshain bietet Entspannung und Sportmöglichkeiten mit Freunden und der Familie.\n\nDas Berliner Stadtzentrum, der Alexanderplatz, ist nur 9 Autominuten entfernt.\n\nLOCATION:\n\nThe residential complex is located in Prenzlauer Berg, a popular, young and hip district of Berlin. The immediate living environment is very well maintained. \n\nThe S-Bahn line in the rear of the property is hardly audible due to the many trees and bushes and well isolated windows. You can reach many small shops are just a doorstep away- typical for this neighborhood. Kindergardens, schools as well as various leisure facilities can be found in the immediate vicinity. \n\nThe S-Bahn (circle line) and tram station Greifswalder Straße is located on the next crossstreet and you can reach the centre in a short time easily. Volkspark Friedrichshain is located nearby and offeres relaxation and sportactivities with friends and family.\n\nThe Berlin city centre, Alexanderplatz, is only 9 minutes away by car.', 'Der Mietvertrag ist befristet bis 30.08.2020.\n\nDie Wohnung kann nach Vereinbarung besichtigt werden.\nGerne vereinbare ich einen Besichtigungstermin für Sie! Rufen Sie mich hierzu unter der angegebenen Rufnummer an oder schicken Sie mir Ihre Anfrage direkt über Immobilienscout24.\n\n___ \n\nThe lease is limited until August 30, 2020.\n\nThe apartment can be viewed by appointment.\nI will gladly arrange a viewing appointment for you! Please call me at the mob. number given or send me your request directly via Immobilienscout24.'];ONE_YEAR_FREE;40 MBit/s;telekom_layer_magenta_l;55.45;über VDSL;REGULAR;;MagentaZuhause L;100 MBit/s;https://padlock.link/ioml;https://padlock.link/ml;true;100 MBit/s;web,email,bank,music,dl-ul,game,sd,mltstr,hd,fast-ul-dl;;true
2020-05-24 20:39:25.582472;Berlin;district_heating;15402574;n;n;https://pictures.immobilienscout24.de/listings/4e7af678-045e-4937-b16a-256de7fe2ffd-1371020513.jpg/ORIG/resize/118x118%3E/extent/118x118/format/jpg/quality/80;13;16.54;1880;;16.54;118713683;;district_heating;n;false;y;Berlin;y;10;1;675;no_information;energy_consumption;8.84;246.03;Berlin;12055;need_of_renovation;no_information;;false;no_information;no_information;y;no_information;loft;12055;10;146;n;;2,active;Deutschland;top;wohnung_kauf;n;4;;true;001.15350375;980000;profile0;5;5;true;n;showqualicontactform;y;n;Neukölln_Neukölln;B 36;7;Berlin;/expose/118713683;['Nutzfläche ca.:\t245 m² (Laut TE)\nNutzfläche ca.:\t246,03 m² (Laut Aufmaß)\nAnzahl der Zimmer:\t10\nNutzungsart:\tim Moment gewerblich. Wohnen: möglich\nBäder:\t2x \nFahrstühle:\t1x Personenaufzug & 1x Lastenaufzug direkt auf die Etage\nBoden:\tFliesen\nHeizung:\tFernwärme\nFenster:\tKunststofffenster \nDeckenhöhe:\tca. 3 m.\nZustand:\trenovierungsbedürftig\nNKM ist:\t1.725 € p.M.\nBKs-VZ:\t324 €\nHKs-VZ:\t276 €\nWarmmiete:\t2.325 €\nHausgeld:\t675 € (warm)\nBezugsfrei:\tspätestens zum Juni 2021 (notariell garantiert vom Verkäufer)', 'Das Haus befindet sich nur wenige hundert Meter vom wunderschönen Körnerpark entfernt und in unmittelbarer Nähe zum charmanten und angesagten Richardplatz. Der Richardplatz ist einer der angesagten Plätze in Neukölln mit Restaurants, kleinen Geschäften für den täglichen Bedarf, Baumbestand und schönen Bauwerken. Schulen, Kitas und Dienstleistungen aller Art befinden sich in unmittelbarer Nähe. Für die Naherholung ist der Comeniusgarten in der Richardstraße ein Geheimtipp. Die Karl-Marx-Straße mit ihren zahlreichen Geschäften für den täglichen Bedarf ist gleich um die Ecke. S-Bahnhof Sonnenallee sowie der U7- und S-Bahnhof Neukölln, wodurch das Haus sehr gut an den öffentlichen Nahverkehr angeschlossen ist. Über die naheliegende Stadtautobahn sind der Flughafen Schönefeld, sowie alle Berliner Stadtteile schnell erreichbar.', 'Ganz wichtig bei der Anfrage: Teilen Sie uns Ihre vollständigen Kontaktdaten: Vor- und Nachnamen, Adresse, Mail und Telefonnummer mit.\n\nSeit einigen Jahren gilt in Deutschland das Geldwäschegesetz. Nach diesem Gesetz ist jedes Immobilienbüro verpflichtet, bei Kontaktaufnahme die Identität des Kunden festzuhalten. \n\nDieses Kaufangebot ist provisionspflichtig. Dem Erwerber wird bei Abschluss eines Kaufvertrages eine Käuferprovision in Höhe von 7,14 % des beurkundeten Kaufpreises inkl. der gesetzlichen MwSt. berechnet. \n\nDie in diesem Exposé gemachten Angaben beruhen auf Auskünften des Eigentümers oder vorgelegten Plänen und Berechnungen. Wir übernehmen daher keine Haftung, für die hier gemachten Angaben, insbesondere für Flächenangaben, Grundrisse, Lageskizzen sowie wann was und wie im Hause renoviert und saniert wurde, da wir das nicht persönlich überwachen konnten. Dieses Angebot ist freibleibend, ein Zwischenverkauf bleibt vorbehalten.\n\nHinsichtlich weiterer Dienstleistungen in Zusammenhang mit dem Erwerb, wie Finanzierungen unterstützen wir Sie gerne. Es ist uns leider nicht gestattet, Sie zu steuerrelevanten Aspekten zu beraten. Hierzu wenden Sie sich bitte an Ihren Steuerberater. Wir stehen Ihnen gerne für Fragen zur Verfügung.'];ONE_YEAR_FREE;40 MBit/s;telekom_layer_magenta_l;246.03;über VDSL;REGULAR;disabled;MagentaZuhause L;100 MBit/s;https://padlock.link/ioml;https://padlock.link/ml;true;100 MBit/s;web,email,bank,music,dl-ul,game,sd,mltstr,hd,fast-ul-dl;;
