2020-05-24 20:39:28.650712;Berlin;central_heating;17576674;n;y;https://pictures.immobilienscout24.de/listings/38ef2fb8-7df0-447b-999d-106f0a810155-1371032668.jpg/ORIG/resize/118x118%3E/extent/118x118/format/jpg/quality/80;11;11.3;1964;;11.3;118718930;1;natural_gas_light;y;false;y;Berlin;n;3;2;140;50;energy_required;5.73;30;Berlin;10624;modernized;normal;;false;underground_garage;"Schillerstra&szlig;e";y;Schillerstraße;apartment;10624;1;151.3;n;;2,active;Deutschland;standard;wohnung_kauf;n;;;true;009.f22cdcd4-a268-48d7-9db8-7856769644ba;150000;profile0;;1;true;n;showqualicontactform;n;n;Charlottenburg_Charlottenburg;118718930;1;Berlin;/expose/118718930;['Die Wohnung\n\nBeim Eintreten in die lichtdurchflutete Wohnung wird der Besucher die Unternehmensphilosophie in jedem Winkel der circa 28 m² großen Apartments entdecken. Harmonisch – praktisch - gemütlich ist hier der Eindruck, der durch die Innenarchitektur der Apartments geschaffen wurde. Die hervorragende Standortqualität des Hauses und ein entsprechender Wohnwert verschmelzen hier zu einem harmonischen Ganzen.\nMarkenqualität in allen Bereichen der durchgeführten Modernisierungsmaßnahmen ist der Standard, die ein komfortables und sorgenfrei wohnen in den Appartements in der Schillerstraße garantiert.\n\nDie Einrichtung \n\nSie betreten die Wohnung auf buchefarbenen Fußboden aus Laminat, welche sich auf den gesamten Wohnbereichen, von der Diele über das Wohnzimmer bis in die Küche erstreckt. So wird eine ganzheitliche Wohnatmosphäre geschaffen, die ein qualitativ hochwertiges Apartment ausmacht. Wohn - und Essbereich lassen sich harmonisch miteinander durch eine ausziehbare Tischplatte verbinden.\n\nDie Küche zeitgemäß und funktionell eingerichtet unterstreicht den praktischen Charakter der gesamten Wohnung. \n\nSicherheit und Technik\n\nDie Appartements in der Schillerstraße sind in ihrer Markenqualität entsprechenden hervorragenden Standort entstanden. Diese beliebte Wohngegend welche alle Facetten für ein angenehmes Stadtleben bietet kann auch im Hinblick auf die Schattenseiten des Großstadtlebens als eine sichere gute Wohngegend bezeichnet werden.\n\nWarmwasserversorgung:\n\neine zentrale Warmwasserversorgung gewährleistet dem Benutzer ein ungestörtes Dusch – und Badevergnügen.\n\nHeizung:\ndie Beheizung der Wohnanlage erfolgt über eine umweltfreundliche und sparsame Gas-Zentralheizung.\n\nFenster:\n\nSämtliche Holzfenster verfügen über eine moderne Wärmeschutzverglasung zusätzlich sind die Fenster zur Straßenfront mit einem erhöhten Schallschutzfaktor versehen.', 'Die Technische Universität Berlin ist nur 1 km entfernt, die Humboldt Universität und die FU sind bequem über die öffentlichen Verkehrsmittel erreichbar. Zum Kurfürstendamm sind es lediglich ca. 900 m. Die Verkehrsanbindung kann als optimal bezeichnet werden, U- und S-Bahnen sind in zwei bis drei Minuten zu Fuß zu erreichen. Die Wilmersdorf Str. 80 hat sich in der jüngsten Vergangenheit wieder zu einem sehr beliebten Einkaufsziel entwickelt.\n\nDas Messegelände und das Kongresszentrum erreichen Sie in wenigen Minuten. Zum Kurfürstendamm sind es nur 900 m. Die Verkehrsanbindung kann als optimal bezeichnet werden. Die U- Bahnlinien 2 und 7 sowie diverse Busselinien sind in wenigen Minuten zu Fuß zu erreichen. Die Wilmersdorf Straße hat sich in der jüngsten Vergangenheit wieder zu einem sehr beliebten Einkaufsziel entwickelt.\n\nDer Kernbereich von Charlottenburg bildet den wichtigsten Teil der „City West“: mit dem Freizeit – und Shopping- Paradiesen an der Tauentzienstraße, am Kurfürstendamm und seinen Nebenstraße sowie in der, nur einen Katzensprung vom Objekt entfernten, Wilmersdorfer Straße. Den Dienstleistungsstandort Charlottenburg prägen das Internationale Congress Zentrum (ICC), das größte Kongress Zentrum Europas, und das Messegelände mit 160.000 m² Ausstellungsflächen.'];ONE_YEAR_FREE;40 MBit/s;telekom_layer_magenta_l;30;über VDSL;REGULAR;;MagentaZuhause L;100 MBit/s;https://padlock.link/ioml;https://padlock.link/ml;true;100 MBit/s;web,email,bank,music,dl-ul,game,sd,mltstr,hd,fast-ul-dl;;
2020-05-24 20:39:28.998316;Berlin;central_heating;4005610;n;y;https://pictures.immobilienscout24.de/listings/5e4bc803-76c7-4d53-8d65-7332931830e2-1371025063.jpeg/ORIG/resize/118x118%3E/extent/118x118/format/jpg/quality/80;20;11.73;1971;;11.73;118714893;1;gas;y;false;y;Berlin;y;7;3;252;11;energy_consumption;5.75;56.77;Berlin;12163;first_time_use_after_refurbishment;sophisticated;E;false;underground_garage;Deitmer Str.;n;Deitmer_Str.;roof_storey;12163;2;159;n;;2,active;Deutschland;top;wohnung_kauf;n;5;;true;001.4005610;329000;profile0;5;2;true;n;showqualicontactform;n;n;Steglitz_Steglitz;118714893;2;Berlin;/expose/118714893;['Dier hier angebotene Wohnung wurde 2019 geschmackvoll sanieert und modernisiert. Sie befindet sich im 5.OG (oberste Etage) eines gepflegten Mehrfamilienhauses nur 50 m von der Schloßstraße entfernt. Vom Wohnzimmer gelangt man auf den Südbalkon von dem man über die Dächer der umliegenden Häuser gucken kann. Das Duschbad ist hell gefliest und die Einbauküche vollständig eingerichtet. Das Haus verfügt über einen Fahrsdtuhl und zur Wohnung gehört ein Stellplatz in der Tiefgarage.', '-Zentrale Lage in Steglitz\n-2 Zimmer\n-Südbalkon\n-Tiefgaragenstellplatz\n.Vollständig modernisiert.\n-Einbauküche', 'Die Wohnung befindet sich in einer Sackgasse unmittelbar an der Steglitzer Schloßstraße. In der Schloßstraße befinden sich sämtliche Geschäfte des täglichen Lebens sowie diverse Buslinien und die U-Bahn. Die Berliner Stadtautobahn sichert auch die schnelle Anbindung an die City-West.', 'weitere Angebote finden Sie auf unserer Homepage www.henkelundpartner.de'];ONE_YEAR_FREE;40 MBit/s;telekom_layer_magenta_l;60;über VDSL;REGULAR;;MagentaZuhause L;100 MBit/s;https://padlock.link/ioml;https://padlock.link/ml;true;100 MBit/s;web,email,bank,music,dl-ul,game,sd,mltstr,hd,fast-ul-dl;2019;
2020-05-24 20:39:29.336591;Berlin;central_heating;1163286;n;y;https://pictures.immobilienscout24.de/listings/1d1bf247-16f4-4c81-9499-338f4bcd29b2-1371019478.jpg/ORIG/resize/118x118%3E/extent/118x118/format/jpg/quality/80;2;11.73;1890;;11.73;118713276;;oil;n;false;y;Berlin;y;6;1;320;no_information;energy_consumption;5.75;67;Berlin;12165;well_kept;normal;;false;no_information;no_information;n;no_information;roof_storey;12165;2;109;n;;2,active;Deutschland;standard;wohnung_kauf;y;4;;true;001.1163286;279000;profile0;4;2;true;n;;n;n;Steglitz_Steglitz;11871888;3;Berlin;/expose/118713276;['Weitere Angebote zu unseren Eigentumswohnungen finden Sie auf unserer Homepage: http://www.wohllebe-immobilien.de/etw.php\nDie bezugsfreie Eigentumswohnung liegt in einem Altbaugebäude aus dem Jahre ca. 1890 im 4. OG im ruhigen Vorderhaus. \nThe apartment is located in the 4. floor in a building of ca.1890.', 'Die vermietete Eigentumswohnung hat 2 Zimmer, sowie ein Wannenbad mit Fenster.  Die Terrasse ist nach Süd-Westen ausgerichtet. \nThe dwelling has 2 rooms  directed to the south-west. The bathroom has a buth tub. If you whant more information with fotos, groundplan etc. please send us your name and your mailing address.', 'Das Gebäude befindet sich in gefragter Lage Berlin Steglitz, nahe dem Botanischen Garten und der Schloßstraße. Zahlreiche Busverbindungen sind fußläufig erreichbar. In der näheren Umgebung befinden sich sämtliche Einkaufsmöglichkeiten und Dienstleistungen, die man für den täglichen Bedarf benötigt. Auch Schulen, Kitas und andere (öffentliche) Einrichtungen sind fußläufig erreichbar. \nThe building is located in Berlin Steglitz. In the near region you have schools and shopping possibilities around.'];ONE_YEAR_FREE;40 MBit/s;telekom_layer_magenta_l;;über VDSL;REGULAR;;MagentaZuhause L;100 MBit/s;https://padlock.link/ioml;https://padlock.link/ml;true;100 MBit/s;web,email,bank,music,dl-ul,game,sd,mltstr,hd,fast-ul-dl;;
2020-05-24 20:39:29.731664;Berlin;floor_heating;15644173;n;y;https://pictures.immobilienscout24.de/listings/d3857cf6-c65b-490e-a33a-1be9be8d7abd-1371030137.jpg/ORIG/resize/118x118%3E/extent/118x118/format/jpg/quality/80;10;11.48;1900;;11.48;118717479;;no_information;y;false;y;Berlin;y;9;1;299;no_information;energy_required;7.14;110;Berlin;10245;modernized;no_information;C;false;no_information;no_information;y;no_information;loft;10245;3;102.5;n;;2,active;Deutschland;top;wohnung_kauf;n;3;;true;001.15558226;699000;profile0;4;3;true;n;;n;n;Friedrichshain_Friedrichshain;GUE-10245-VS-02 (1/383);5;Berlin;/expose/118717479;['Wir bieten Ihnen ein wunderbares, charmantes Industrie-Loft zum Kauf an.\rDas Ensemble wurde 2008 kernsaniert und seitdem behutsam durch weitere Maßnahmen in den aktuellen, gründlich sanierten Zustand versetzt. 2009 wurden die Balkone installiert, 2012 das Dach und schließlich 2018 die Fassaden saniert.\rSie gelangen durch den Durchgang des Vorderhauses in den begrünten Innenhof und nach kurzer Orientierung sehen Sie es! Ein altes, saniertes Industriegebäude, das man so nicht erwartet hätte.\rBerlin ist immer für eine Überraschung gut und das ist diese besondere Immobilie auch!\rTreten Sie ein und sehen Sie selbst!', '-Loftwohnung\r-Drittes Obergeschoss\r-Aufzug \r-Keller\r-Süd-West-Balkon\r-Parkett\r-Offene Küche\r- 3 Zimmer\r-Wannenbad\r-Gäste WC\r-Begehbarer Kleiderschrank\r-Fussbodenheizung', 'Die Wohnung liegt im ruhigen Hinterhof eines Mehrfamilienhauses in Berlin-Friedrichshain.\rDer Kiez trägt den Namen RUDOLFKIEZ und zeichnet sich durch seine Ursprünglichkeit und seinen\rUr-Berliner Charme sowie seine gleichzeitige urbane Nähe zur Spree/Ostkreuz/Boxhagener Kiez/Alt-Stralau aus. Wer das echte Berlin sucht, fühlt sich hier zu Hause!', 'Bei Kontaktaufnahme per E-Mail teilen Sie uns für die Bearbeitung Ihrer Anfrage bitte Ihren vollständigen Namen, Ihre Postanschrift und Telefonnummer mit.\rAlle Angaben wurden vom Auftraggeber zur Verfügung gestellt. Angebot freibleibend. Änderungen und Irrtümer vorbehalten.'];ONE_YEAR_FREE;10 MBit/s;telekom_layer_magenta_m;120;über VDSL;REGULAR;;MagentaZuhause M;50 MBit/s;https://padlock.link/iomm;https://padlock.link/mm;true;50 MBit/s;web,email,bank,music,dl-ul,game,sd,mltstr,hd,fast-ul-dl;;
2020-05-24 20:39:30.258028;Berlin;self_contained_central_heating;15863505;n;n;https://pictures.immobilienscout24.de/listings/6a423fea-fadf-49c0-b4e2-9935e5c6fe5f-1371031331.jpg/ORIG/resize/118x118%3E/extent/118x118/format/jpg/quality/80;72;11.37;1910;;11.37;118718056;;gas;y;false;y;Berlin;y;7;1;184;no_information;energy_required;5.8;64;Berlin;10711;modernized;sophisticated;C;false;no_information;no_information;n;no_information;apartment;10711;2.5;80;n;;2,active;Deutschland;standard;wohnung_kauf;n;2;;true;001.15742392;319000;profile0;5;2;true;n;showqualicontactform;n;n;Wilmersdorf_Wilmersdorf;118718056;3;Berlin;/expose/118718056;['Eine modernisierte und hochwertig ausgestattete, möblierte 2,5  Zimmer Altbauwohnung befindet sich in einer exklusiven Wohnanlage im Herzens von Berlin am Ku`damm-Halensee. Das Gebäude wurde  im Jahr 1990 gebaut, im Jahr 2000 kern saniert und die Wohnung war im Jahr 2016 modernisiert. Das Gebäude verfügt über fast 5.000 m2 Wohnflächen, aber hat leider keinen Aufzug. \n\nDie stilvolle und komfortable Einrichtung mit Natursteinen, rosa Esche Parkett und Dielenböden, Kamin, indirektem Licht, teilweise mit schönen originalen Stuckornamenten, Doppelkasten-Fenster verleiht der Wohnung einen besonderen\nCharakter. Raumhöhe ist 3,55m. Es erwartet Sie ein moderner Mix mit einem einzigartigen Luxusambiente, gemeinsam mit den clever entworfenen Grundrissen, hohen Decken mit LED Beleuchtung & großen Fenstern bietet sich eine entspannte Wohnatmosphäre. Die perfekte\nKulisse für stilvolles Leben im Herzen Berlins.', 'Im Eingangsbereich befindet sich ein Garderobenbereich und Meisterbad mit einer luxuriösen Badewanne und hänge-WC. Weiter geht es zum ein präsentables lichtdurchflutetes Wohnzimmer mit separater Essecke, eine voll eingerichtete Küche mit Elektroherd, ein großzügiges über 30m2 Schlafzimmer mit einem geräumigen Garderobeneckschrank.', 'Ku’damm Lage gehört zu den berühmtesten Straßen der Welt und ist die Lebensader der City-West und Bummelmeile Nummer eins in Berlin: Der 3,5 Kilometer lange Boulevard mit Haupteinkaufsstraße im Berliner Bezirk Charlottenburg-Wilmersdorf, die vom Halensee im Ortsteil Grunewald bis zum Breitscheidplatz mit der Kaiser-Wilhelm-Gedächtniskirche im Ortsteil Charlottenburg führt, wo sie in die Tauentzienstraße übergeht. Am Kurfürstendamm trifft alte und neue Architektur beinahe nahtlos aufeinander. Die Wohnung befindet sich in einem sehr gepflegten Altbaugebäude in Halensee.', 'Besichtigungen nach Vereinbarung \nHelena Shatalova\n017621781474'];ONE_YEAR_FREE;40 MBit/s;telekom_layer_magenta_l;;über VDSL;REGULAR;;MagentaZuhause L;100 MBit/s;https://padlock.link/ioml;https://padlock.link/ml;true;100 MBit/s;web,email,bank,music,dl-ul,game,sd,mltstr,hd,fast-ul-dl;2008;
2020-05-24 20:39:30.813168;Berlin;central_heating;296178;n;y;https://pictures.immobilienscout24.de/listings/27323cfe-4fcd-4973-aa45-c1687ecb0932-1370375689.png/ORIG/resize/118x118%3E/extent/118x118/format/jpg/quality/80;15;10.06;2000;;10.06;118530648;;natural_gas_light;y;false;y;Berlin;n;8;5;484;no_information;energy_consumption;5.28;110.26;Berlin;13156;mint_condition;sophisticated;E;false;no_information;no_information;n;no_information;maisonette;13156;4;143.3;n;;2,active;Deutschland;standard;wohnung_kauf;n;1;;true;001.296178;489000;profile0;2;4;true;y;showqualicontactform;n;n;Niederschönhausen_Pankow;118530648;5;Berlin;/expose/118530648;['Pankow, gelegen im Norden Berlins, gehört zu den grünsten Stadtbezirken der Hauptstadt. Ausgedehnte Grünflächen wie die Schönholzer Heide, der Brosepark, der Bürgerpark und natürlich der weitläufige Park am Schloss Niederschönhausen machen das Viertel nicht nur für Familien mit Kindern attraktiv. Niederschönhausen, zeichnet sich durch eine Bebauung mit Villen und Mietshäusern aus, die vornehmlich um das Jahr 1910 bis in die zwanziger Jahre entstanden sind. Hier wohnen Sie grün und ruhig und dennoch finden Sie im unmittelbaren Umfeld alle notwendigen Einrichtungen des täglichen Lebens. Ob Kita´s, Schulen oder Einkaufsmöglichkeiten, alle Einrichtungen sind in wenigen Gehminuten bequem zu erreichen. Die öffentliche Anbindung ist ebenfalls perfekt, ob mit dem Bus oder der Tram, in einer halben Stunde ist das Stadtzentrum Berlins zu erreichen. \nIm ruhigen Gartenhaus gelegen, biete ich Ihnen eine bezaubernde Maisonette-Wohnung mit ca. 110, 26 m² Wohnfläche zum Kauf an. Im Jahr 2000 errichtet, besteht dieses Gartenhaus aus 3 Wohneinheiten. Insgesamt gehören 15 Einheiten zu der Wohneigentumsgemeinschaft, die sich auf das sanierte Vorderhaus, dem Seitenflügel und das eben erwähnte Gartenhaus aufteilen.\nIm ersten Obergeschoss des Hauses gelegen, ist diese Wohnung optimal für Jung und Alt. Betritt man die Wohnung, so eröffnet sich gleich der Blick in das ca. 40 m² große Wohnzimmer. \nDie großzügige Fensterfront gibt einen fantastischen Ausblick in den Garten frei. Grünblick pur. Gleich neben dem Wohnzimmer wurde ein Gäste- oder Arbeitszimmer angelegt, von dem es auf den ca. 7 m² großen, nach Osten ausgerichteten Balkon geht. Von diesem Raum geht es weiter in eine kleine Abstellkammer, die gleichzeitig als Kellerersatzraum dient. Der Fußboden in den beiden Wohnräumen und in der Abstellkammer wurde mit einer Bodenfliese belegt. \nBeim Gang in die obere Ebene fällt sofort die Großzügigkeit der Dachkonstruktion auf. Nicht nur durch die Einbringung von Dachflächenfenstern, sondern auch durch die angenehme Raumhöhe wirkt dieser Bereich sehr hell und transparent, perfekt für eine kleine Galerie. Oben angekommen geht es als erstes rechts in das Badezimmer. Das Tageslichtbad ist gefliest und wurde mit einer Badewanne, Handwaschbecken, einer Toilette sowie einem Struktur-Wandheizkörper ausgestattet. Gleich daneben wurde die Küche angesiedelt. Ebenfalls gefliest, verfügt sie bereits über eine komplette Einbauküche. Von hier aus genießen Sie beim Frühstück einen wunderschönen Blick in die Gärten. Danach schließen sich zwei Zimmer an, die sich gut als Kinder- und Schlafzimmer nutzen lassen. Von beiden Zimmern gelangt man auf den zum Garten, also nach Norden, ausgerichteten Balkon. Mit einer Größe von ca. 6 m² genießen Sie auch hier den Traumblick in den Garten. Die Wohnung ist unvermietet. Sie sind neugierig geworden, nicht so schlimm, dann vereinbaren Sie doch mit mir einen Besichtigungstermin. Dafür stehe ich jederzeit, gern auch an Wochenenden, zur Verfügung. Ich freue mich auf Ihren Anruf.\nBitte haben Sie Verständnis dafür, dass ein Exposé nur an Interessenten versendet wird, wenn die\nvollständigen Kontaktdaten (Vor- und Zuname, Anschrift, Telefonnummer) übermittelt werden. Ihre\nDaten werden selbstverständlich vertraulich behandelt und nicht an Dritte weitergegeben.'];ONE_YEAR_FREE;40 MBit/s;telekom_layer_magenta_l;;über VDSL;REGULAR;;MagentaZuhause L;100 MBit/s;https://padlock.link/ioml;https://padlock.link/ml;true;100 MBit/s;web,email,bank,music,dl-ul,game,sd,mltstr,hd,fast-ul-dl;;
2020-05-24 20:39:31.214652;Berlin;district_heating;17322862;n;y;https://pictures.immobilienscout24.de/listings/edc8c84e-3890-414c-9aab-b9787a910d8d-1371025424.jpg/ORIG/resize/118x118%3E/extent/118x118/format/jpg/quality/80;9;11.37;1906;;11.37;118714756;;natural_gas_heavy;y;false;n;Berlin;y;10;1;247;no_information;energy_consumption;5.8;101;Berlin;10709;first_time_use_after_refurbishment;sophisticated;E;false;no_information;no_information;y;no_information;raised_ground_floor;10709;4;;n;;2,active;Deutschland;top;wohnung_kauf;n;0;;true;009.9b5d1af4-6107-440a-8a91-6cfa013d27e3;757000;profile0;5;4;true;n;showqualicontactform;n;n;Wilmersdorf_Wilmersdorf;f408932e-2b36-446d-921d-af0ea1b19188;5;Berlin;/expose/118714756;['Die Wohnung befindet sich im Vorderhaus eines\nMehrfamilienhauses aus der vorigen Jahrhundertwende.\n\nDas Haus befindet sich in einem sehr gepflegten\nZustand und ist in 23 Wohnungen geteilt, die sich auf\nVorderhaus und Gartenhaus verteilen.\n\nDie angebotene Wohnung liegt im Hochpartere des\nVorderhauses. \n\nDie Schlafzimmer, Badezimmer und die\nWohnküche orientieren sich zum sehr ruigen und\nbegrünten Hof. \n\nDie Wohnung ist frisch renoviert.', 'Das Objekt ist frisch saniert. Wände, Decken, Türen,\nBöden, Sanitär sind neu.\n- Stuckdecken\n- LED Spots in allen Räumen\n- Deckenvouten im Bad, Entré und Flur mit indirekter\nLED Beleuchtung.\n- Hochwertiges Parket\n- Aufwendiger Fliesenpiegel im Badezimmer\n- Bidet\n- Sehr geräumige Dusche\n- Farblich abgestimmte Dekovorhänge\n- Rolläden in den beiden Schlafzimmern und der\nWohnküche.\n- Einbauküche mit allen Geräten (Kühl-Gefrierkombi,\nGeschirrspüler, Backofen, Ceranfelder)\n- Diverse Möbel gehören zur Ausstattung dazu. Die\nMöbel sind alle neu.', 'Charlottenburg-Wilmersdorf ist einer der beliebtesten,\nnatürlich gewachsenen Stadtteile des alten Westberlins.\n\nDie Wohnung befindet sich nur wenige Schritte vom\nKurfürstendamm auf Höhe des Ardenauerplatzes.\n\nDurch die zentrale Innenstadtlage können Sie bequem\nzu Fuß zahlreiche attraktive Restaurants und\nEinkaufsmöglichkeiten jeglicher Art erreichen. \nFür eine sehr gute Anbindung in andere Stadtteile Berlins sorgen\nBus, U-Bahn und S-Bahn. Die Flughäfen Tegel und\nSchönefeld sind in zwanzig Minuten zu erreichen, der\nAnschluss an die Stadt-autobahn ist nur 2 Kilometer\nentfernt.'];ONE_YEAR_FREE;40 MBit/s;telekom_layer_magenta_l;;über VDSL;REGULAR;;MagentaZuhause L;100 MBit/s;https://padlock.link/ioml;https://padlock.link/ml;true;100 MBit/s;web,email,bank,music,dl-ul,game,sd,mltstr,hd,fast-ul-dl;2020;
2020-05-24 20:39:31.569000;Berlin;combined_heat_and_power_plant;18623556;y;y;https://pictures.immobilienscout24.de/listings/4f2e8710-716f-489b-a2fd-f053dcfbb2c5-1370299659.jpg/ORIG/resize/118x118%3E/extent/118x118/format/jpg/quality/80;5;10.62;2021;90677;10.62;118559659;1;gas;n;false;n;Berlin;y;9;9;265;60;energy_required;5.93;105.61;Berlin;13187;first_time_use;sophisticated;B;false;underground_garage;"M&uuml;hlenstra&szlig;e";y;Mühlenstraße;apartment;13187;4;72.6;n;6013;2,active;Deutschland;top;wohnung_kauf;n;1;true;false;002.01009567510;685100;profile0;5;4;true;n;showqualicontactform;n;n;Pankow_Pankow;118559659;5;Berlin;/expose/118559659;['Hier wohnt das Leben.\n\nMitten in Berlin entsteht ein modernes Ensemble aus verschiedenen Einheiten vereint in einem Haus. \n\nSo einzigartig wie die Menschen, die darin wohnen werden. Facettenreich, individuell, unverkennbar.\nIn diesen Häusern avanciert die eigene Wohnung zum schönsten aller Schmuckstücke.\nUnd schafft ein Zuhause, inmitten einer der schönsten Bezirke der pulsierenden  Großstadt.\n\nEinzigartige Menschen und einzigartige Architektur – gemeinsam ergeben sie eine neue Community in Pankow.\n\nWillkommen in Pan&Co!', 'Treten Sie ein: Die Eigentumswohnungen in der Mühlenstraße zeichnen sich insbesondere durch ihre Multifunktionsräume aus. \n\nDie gemeinschaftlichen Bereiche, in denen gekocht, gegessen und gelebt wird, bilden jeweils das Herzstück der Wohnungen. \n\nEchtholzparkett, Fußbodenheizung und bodentiefe Fenster garantieren den für einen modernen und anspruchsvollen Neubau so unabdingbaren hohen Wohnkomfort.\n\nEinige Ausstattungsmerkmale der Eigentumswohnung auf einen Blick:\n\n-\tEchtholzparkett in den Wohn- und Schlafräumen\n-\tFußbodenheizung\n-\tElektrisch betriebene Verschattung\n\nIm Gebäude:\n\n-       Aufzug\n-       Fahrradstellplätze\n-\tTiefgaragenstellplätze\n-       3-fach verglaste Fenster', 'Nur acht Gehminuten vom S+U-Bahnhof Pankow entfernt, ist das Neubaugebäude in der Mühlenstraße perfekt an den Nahverkehr und somit an alle anderen Orte und Plätze in Berlin angebunden.\n\n Aber – warum Pankow überhaupt verlassen? \n\nNeben einem Spielplatz gleich vor dem Haus und mehreren Parks mit weitläufigen Grünflächen in direkter Umgebung bietet Pankow alles, was die Großstadt so lebenswert macht: zahlreiche Schulen und Kitas, viele Restaurants, Cafés und Shoppingmöglichkeiten, eine hervorragende Ärzteversorgung.\n\nGut, zumindest um zur Arbeit zu kommen, muss selbst in einem besonders lebenswerten Viertel der eine oder die andere auch mal über die Stadtteilgrenzen hinaustreten. \nDas ist in diesem Fall aber zum Glück gar kein Problem, da man dank der guten ÖPNV-Anbindung und der zentralen Lage schnell von A nach B kommt, zum Beispiel innerhalb von 19 Minuten zum Alexanderplatz. Noch schneller ist man übrigens in Prenzlauer Berg mit seiner fantastischen Gastronomie- und Kulturlandschaft.', '+++ Sie erwerben das Objekt provisionsfrei direkt vom Bauträger +++\n\nUnser Vertriebsteam steht Ihnen gern für individuelle Terminvereinbarungen zur Verfügung. \n\nWir freuen uns auf Sie!'];;;;;;;;;;;;;;;;
