timestamp;obj_regio1;ga_cd_via_qualified;obj_telekomTvOffer;obj_cId;obj_newlyConst;obj_balcony;obj_picture;obj_picturecount;obj_pricetrend;obj_telekomUploadSpeed;obj_telekomTrackingGroup;obj_telekomInternetTechnology;obj_yearConstructed;obj_telekomInternetType;obj_pricetrendbuy;obj_scoutId;obj_firingTypes;obj_hasKitchen;obj_ExclusiveExpose;obj_telekomInternetProductName;obj_courtage;geo_bln;obj_cellar;obj_purchasePriceRange;obj_yearConstructedRange;obj_rentSubsidy;obj_houseNumber;obj_energyType;obj_pricetrendrent;obj_livingSpace;geo_krs;obj_zipCode;obj_condition;obj_interiorQual;obj_energyEfficiencyClass;ga_cd_cxp_historicallisting;obj_telekomDownloadSpeed;obj_parkingSpace;obj_street;obj_lift;obj_telekomInternetUrlMobile;obj_telekomInternetUrl;obj_streetPlain;obj_typeOfFlat;geo_plz;obj_noRooms;obj_thermalChar;obj_assistedLiving;obj_lastRefurbish;obj_ityp;obj_telekomHdTelephone;geo_land;ga_cd_via;obj_telekomInternet;obj_immotype;obj_rented;obj_floor;obj_telekomInternetServices;obj_telekomInternetProductAvailable;obj_cwId;obj_purchasePrice;ga_cd_application_requirements;obj_numberOfFloors;obj_noRoomsRange;ga_cd_maillead_default_shown;obj_garden;evt_count_pm_sig;obj_barrierFree;obj_international;obj_regio3;obj_objectnumber;obj_livingSpaceRange;obj_regio2;URL;beschreibung;obj_heatingType;obj_galleryAd;obj_noParkSpaces;ga_cd_developer_virtualreality;obj_telekomHybridUploadSpeed;obj_telekomHybridDownloadSpeed;obj_groupnumber;obj_usableArea
2020-05-24 20:49:27.611589;Berlin;true;ONE_YEAR_FREE;1011756;n;y;https://pictures.immobilienscout24.de/listings/5139262f-1a31-4c7a-9a80-365b5600540b-1367906987.jpg/ORIG/resize/118x118%3E/extent/118x118/format/jpg/quality/80;19;12.78;40 MBit/s;telekom_layer_magenta_l;über VDSL;1903;REGULAR;12.78;118146539;district_heating;y;false;MagentaZuhause L;y;Berlin;n;11;1;610;no_information;energy_consumption;7.25;188;Berlin;10557;mint_condition;no_information;C;false;100 MBit/s;no_information;no_information;y;https://padlock.link/ioml;https://padlock.link/ml;no_information;apartment;10557;6;92.5;n;1997;2,active;true;Deutschland;premium;100 MBit/s;wohnung_kauf;n;2;web,email,bank,music,dl-ul,game,sd,mltstr,hd,fast-ul-dl;true;001.1011756;1100000;profile0;5;5;true;n;showqualicontactform;n;n;Tiergarten_Tiergarten;I-00THSG-W-02IIA1;7;Berlin;/expose/118146539;['1903 wurde dieser schöne Altbau errichtet. Details wie hohe Decken, Stuckelemente, originale Flügeltüren sowie schönes Parkett aus der Jahrhundertwende sind nur ein Einblick in diese besondere Gründerzeitwohnung. Die ca. 188 m² große Wohnung liegt in der zweiten Etage. Sechs Zimmer erlauben viele individuelle Gestaltungsmöglichkeiten. Der Mittelpunkt der Wohnung sind die drei nach Osten ausgerichteten Zimmer. Sie sind durch große Flügel- und Schiebetüren aus Holz verbunden und bilden einen imposanten Wohn- und Essbereich. Zusätzlich gibt es einen nach Osten ausgerichteten Balkon. Drei weitere Zimmer sind jeweils separat vom Flur aus begehbar. Dieser führt zum Wannenbad, zum Gäste-WC und im Anschluss zur großen Küche. Sie ist mit schönen Fliesen ausgelegt und beindruckt mit einer Deckenhöhe von ca. 3,6 m. Zudem bietet eine geräumige Speisekammer Stauraum für Lebensmittel. Eine weitere Besonderheit der Wohnung ist das Originalparkett in den vorderen Zimmern. In den anderen Räumen sind Dielen verlegt. Der Innenhof und das gesamte Gemeinschaftseigentum ist gepflegt und in einem sehr guten Zustand.\r\n\r\n\r\nAusstattung:\r\n\r\n● Originalparkett in den vorderen Zimmern\r\n● Echtholzdielen in den hinteren Zimmern\r\n● bis zu ca. 3,60 m hohe Decken\r\n● Stuckelemente\r\n● Flügeltüren und Schiebetüren\r\n● Holzrahmen-Doppelkastenfenster\r\n● Wannenbad mit Fenster und separates Gäste-WC\r\n● Balkon\r\n● Aufzug auf der Zwischenetage\r\n● Kellerabteil', 'Abstellkammer\nParkett\nFliesen\nDielenboden', 'Diese eindrucksvolle frühere Offizierswohnung befindet sich im Stadtteil Tiergarten-Moabit. Die Nähe zur Spree bietet viele Möglichkeiten, die Umgebung zu genießen. Die zentrale und dennoch ruhige Lage macht diese Gegend zu einem Geheimtipp unter den Wohnlagen Berlins. Attraktiv für Familien mit Kindern sind nah gelegene schöne Spielplätze und mehrere Kitas. Für Naturliebhaber und auch Sportbegeisterte lädt der Tiergarten dazu ein, auf einer der vielen Liegewiesen Platz zu nehmen oder die Weitläufigkeit zum Joggen zu nutzen. Restaurants, Bars und weitere Einkaufsoptionen für den täglichen Bedarf sowie das Schloss Bellevue, Schloss Charlottenburg mit seinem angrenzenden Park, die Siegessäule, der Carl-von-Ossietzky-Park und auch das Regierungsviertel sind mit dem Fahrrad oder zu Fuß gut zu erreichen. Eine sehr gute Anbindung an den öffentlichen Nahverkehr ermöglicht der S-Bahnhof Bellevue sowohl in die City West zum Ku’damm als auch in die Stadtmitte. Die Buslinien 245 und TXL fahren direkt auf der Straße Alt-Moabit und bringen Sie in nur wenigen Minuten zum Hauptbahnhof (S3, S5, S7, S75 sowie U55). Mit diesen Bahnlinien erreichen Sie schnell alle Teile Berlins, wie z.B. die Bahnhöfe Alexanderplatz, Friedrichstraße oder Zoologischer Garten.', 'Die Courtage in Höhe von 7,14 % inkl. der gesetzlichen Mehrwertsteuer auf den Kaufpreis ist mit dem Zustandekommen des Kaufvertrages (notarieller Vertragsabschluss) verdient und fällig. Die vermittelnde und/oder nachweisende Engel & Völkers Berlin Mitte GmbH (Lizenznehmer der Engel & Völkers Residential GmbH ) und ggf. deren Beauftragter, erhalten einen unmittelbaren Zahlungsanspruch gegenüber dem Käufer (Vertrag zugunsten Dritter, § 328 BGB).\r\nHinweise: \r\nAlle Angaben sind ohne Gewähr und basieren ausschließlich auf Informationen, die uns von unserem Auftraggeber übermittelt wurden. Wir übernehmen keine Gewähr für die Vollständigkeit, Richtigkeit und Aktualität dieser Angaben. Zwischenvermietung bleibt vorbehalten. Sollte das von uns nachgewiesene Objekt bereits bekannt sein, teilen Sie uns dieses bitte unverzüglich mit. Die Weitergabe dieses Exposés an Dritte ohne unsere Zustimmung löst gegebenenfalls Courtage- bzw. Schadensersatzansprüche aus. Im übrigen gelten die allgemeinen Geschäftsbedingungen für die Rechtsbeziehung zwischen Ihnen und Engel & Völkers Büro Berlin Mitte GmbH. Wir stehen Ihnen mit weiteren Informationen zum Objekt und zum Eigentümer sowie für Besichtigungen gern zur Verfügung.'];;;;;;;;
2020-05-24 20:49:28.000530;Berlin;;ONE_YEAR_FREE;18287839;n;y;https://pictures.immobilienscout24.de/listings/12ddebc2-1c9a-4318-bec6-6779573efdc7-1367899592.jpg/ORIG/resize/118x118%3E/extent/118x118/format/jpg/quality/80;17;10.14;40 MBit/s;telekom_layer_magenta_l;über VDSL;1928;REGULAR;10.14;118145472;gas;y;false;MagentaZuhause L;y;Berlin;y;6;1;285.98;no_information;energy_consumption;5.19;57;Berlin;14199;well_kept;no_information;F;false;100 MBit/s;no_information;no_information;n;https://padlock.link/ioml;https://padlock.link/ml;no_information;apartment;14199;2.5;165;n;;2,active;true;Deutschland;top;100 MBit/s;wohnung_kauf;n;;web,email,bank,music,dl-ul,game,sd,mltstr,hd,fast-ul-dl;true;009.1d789603-34ca-4b3e-bb9b-f5930c995597;284000;profile0;5;2;true;n;showqualicontactform;n;n;Schmargendorf_Wilmersdorf;1001;2;Berlin;/expose/118145472;['Bezugsfreie, Altersgerechte 2,5 Zimmer-Wohnung mit Balkon nahe Fehrbelliner Platz\n\nHierbei handelt es sich um eine Hochparterre Wohnung in einem 1928 erbauten Wohnhaus.\nDie hier angebotene 2,5 Zimmer-Wohnung, besticht durch seine funktionelle Raumaufteilung.\nAlle Räume sind über den Flur erreichbar. \nAuf den Balkon gelangt man durch das Wohnzimmer.\nDie Küche bietet genügend Platz für einen kleinen Esstisch und ist mit Einbaugeräten ausgestattet. \nDas Badezimmer, mit einem großen Fenster, rundet diese schöne Wohnung ab!', '* 2,5 Zimmer\n* Tageslichtbad mit Dusche\n* hohe Decken 2,85 mtr.\n* Keller\n* Balkon', 'Zwischen Wilmersdorf und Grunewald befindet sich der Stadtteil Schmargendorf, einer der gefragtesten und begehrtesten Lagen von Berlin-Wilmersdorf, unweit des Kurfürstendamms, des Grunewalds und zahlreichen Naherhohlungsmöglichkeiten. \n\nDiese Wohngegend ist geprägt von baumbeständigen breiten Straßen.\nFür eine optimale Verkehrsanbindung ist auch gesorgt. \nDer Verkehrsknotenpunkt S-Bahnhof Hohenzollerndamm (Ringbahn) befindet sich wenige Minuten fußläufig entfernt. \n\nEbenso befindet sich die Autobahnauffahrt A100, von der Sie bequem zum Flughafen Tegel, Flughafen Schönefeld, Tempelhof-Schöneberg, Mitte, Neukölln und Charlottenburg-Wilmersdorf gelangen können, wenige Minuten von der Wohnung am Hohenzollerndamm entfernt.\nGeschäfte für den täglichen Bedarf, wie beispielsweise Rewe, befinden sich in unmittelbarer Nähe.\nDie Gegend zeichnet sich außerdem mit dem nah gelegenen Naherholungsgebiet Hubertussee und den zahlreichen, sowohl öffentlichen als auch privaten Schulen aus. \nDen Grunewald und den berühmten Boule- vard Shoppingmeile Ku’damm, erreichen Sie in nur 5 Autominuten.'];central_heating;;;;;;;
2020-05-24 20:49:28.438965;Berlin;;ONE_YEAR_FREE;3248;n;y;https://pictures.immobilienscout24.de/listings/903ed222-d341-446b-bb73-517e1b34d56d-1368061905.jpeg/ORIG/resize/118x118%3E/extent/118x118/format/jpg/quality/80;14;11.13;40 MBit/s;telekom_layer_magenta_l;über VDSL;1986;REGULAR;11.13;118147636;oil;n;true;MagentaZuhause L;n;Berlin;y;7;4;318;67;energy_consumption;5.02;91;Berlin;12247;fully_renovated;no_information;F;false;100 MBit/s;underground_garage;"Leonorenstra&szlig;e";y;https://padlock.link/ioml;https://padlock.link/ml;Leonorenstraße;apartment;12247;4;164.55;n;2020;2,active;true;Deutschland;top;100 MBit/s;wohnung_kauf;n;3;web,email,bank,music,dl-ul,game,sd,mltstr,hd,fast-ul-dl;true;001.3248;398800;profile0;3;4;true;n;showqualicontactform;n;n;Lankwitz_Steglitz;B-Leonoren67-WE02;4;Berlin;/expose/118147636;"['In neuem Glanz wird demnächst diese wohlgeschnittene 4-Zimmer-Wohnung erstrahlen und Sie herzlich willkommen heißen. Sie wird komplett renoviert/modernisiert. Noch ist mit den Arbeiten nicht begonnen und Sie können Ihre Ausstattungswünsche äußern!! Geplant ist die neue Ausstattung mit Vinyl-Designboden in Holzoptik, modernen Badfliesen und weißen Wänden. Außerdem werden neue weiße Türen eingebaut und auch alle Schaltersysteme erneuert. Mit drei fast gleich großen Schlafzimmern, einem gemütlichen Wohnbereich mit Zugang zur Loggia, einer separaten Küche mit Essplatz, neuem Bad und neuem Gäste-WC sowie einem Abstellraum lässt sich hier gut einrichten und wohnen. \n\nDas im Jahr 1986 erbaute Wohn- und Geschäftshaus befindet sich in beliebter Lage in Lankwitz am Bernkastler Platz. Die Anlage umschließt einen begrünten Innenhof mit Spielplatz für die Kleinen. Eine Instandsetzung der Fassade inkl. Balkonsanierung sowie eine Renovierung der Treppenhäuser mit Erneuerung der Hauseingangstüren, Klingel- und Briefkastenanlage fand in 2020 statt.\nDie 26 Wohnungen verteilen sich auf vier Eingänge vom 1. OG bis DG. Im Erdgeschoss befinden sich Gewerbeeinheiten. Alle Wohnungen haben funktionale Grundrisse mit Balkon/Loggien. Selbstverständlich gehört zu jeder Wohnung ein Kellerabteil im Untergeschoss. In zwei Eingängen befinden sich Aufzugsanlagen. Für den Stellplatzkomfort sorgen Tiefgaragenplätze und ein Hausmeisterdienst kümmert sich um Ordnung und Sauberkeit.', '•\tbegehrte Lage am Bernkastler Platz\n•\tfreizügige 4-Zimmer-Wohnung\n•\t3. Obergeschoss/Dachgeschoss\n•\tAufzug vorhanden\n•\tca. 90,83 m² Wohnfläche\n•\tgroßzügige Raumaufteilung\n•\tLoggia\n•\tkomplett renoviert/modernisiert\n•\tneuer Vinyl-Design-Boden\n•\tweiße Wände, Raufaser\n•\tneues, modernes Bad mit Wanne\n•\tneues Gäste-WC\n•\tneue, weiße Türen\n•\tAbstellraum\n•\tKellerraum im Untergeschoss\n•\tHausgeld: ca. 318,00 €/Monat\n•\tTiefgaragen-Stellplatz für 19.800,00 €\n•\tfür den Käufer provisionsfrei\n\nGerne zeigen wir Ihnen alles bei einer Einzelbesichtigung und informieren Sie im Detail über die geplante Renovierung! Kontaktieren Sie uns jetzt!\n\nAchtung!!! Die Bilder zeigen Aufnahmen vor Renovierung!', 'In beliebter Lage in Lankwitz gegenüber dem Bernkastler Platz, einer ausgedehnten Parkanlage, und nahe dem Rathaus finden Sie dieses Wohn- und Geschäftshaus. Die Infrastruktur ist hervorragend. Einkaufsmöglichkeiten für den täglichen Bedarf, Apotheken, Ärzte, Schulen und die Anbindung an den öffentlichen Verkehr erreichen Sie fußläufig in wenigen Minuten.\n\nVom S-Bahnhof Lankwitz sind Sie in ca. 20 Minuten im Zentrum von Berlin oder in etwa fünf Minuten an der beliebten Einkaufsmeile Schloßstraße in Steglitz. Ein weiteres Highlight des Standortes ist die Nähe zum Kurfürstendamm im benachbarten Bezirk Charlottenburg-Wilmersdorf. Der Ku’damm gehört zu den berühmtesten Straßen der Welt.\n\nDer Bezirk Steglitz-Zehlendorf ist ein äußerst beliebter und attraktiver Bezirk mit vielen Sehenswürdigkeiten, Seen, Wäldern und vielfältigen kulturellen Angeboten.\nLankwitz ist ein ruhiger Ortsteil im Osten dieses Bezirks, in der man sich von dem Trubel der Großstadt erholen kann. Die Gemeinde punktet mit attraktiven und großflächigen Naherholungsgebieten, wie den als Rosengarten bezeichneten Bernkastler Platz oder die Grünanlage Bernecker Weg – Kamenzer Damm, den über 10 Hektar großen und sehr beliebten Gemeindepark. Für ausgedehnte Spaziergänge lädt ebenfalls der nahe gelegene Teltowkanal mit seinen hervorragend ausgebauten Uferwegen ein.', 'WERTGRUND-Service-Paket für SIE:\n1. Sie kaufen bei uns eine geprüfte Bestandsimmobilie  - provisionsfrei\n2. Erstellung eines persönlichen Finanzierungsplans zu günstigen Konditionen\n3. Begleitung bei der Kaufvertragsabwicklung\n4. Auch nach Kaufvertragsabschluss lassen wir Sie nicht im ""Regen"" stehen\n\nSprechen Sie uns an - wir helfen, beraten und informieren Sie gerne!']";central_heating;disabled;1;;;;;
2020-05-24 20:49:28.778790;Berlin;true;ONE_YEAR_FREE;137319;n;y;https://pictures.immobilienscout24.de/listings/f608eae9-814e-4234-b15a-44a1f66594fc-1367968080.jpg/ORIG/resize/118x118%3E/extent/118x118/format/jpg/quality/80;11;11.37;40 MBit/s;telekom_layer_magenta_l;über VDSL;1931;REGULAR;11.37;118152792;district_heating;y;false;MagentaZuhause L;n;Berlin;y;7;1;217.43;8;energy_consumption;5.8;71.76;Berlin;14197;well_kept;normal;D;false;100 MBit/s;no_information;Sodener Str.;n;https://padlock.link/ioml;https://padlock.link/ml;Sodener_Str.;ground_floor;14197;3;129;n;2009;2,active;true;Deutschland;premium;100 MBit/s;wohnung_kauf;n;;web,email,bank,music,dl-ul,game,sd,mltstr,hd,fast-ul-dl;true;001.137319;335000;profile0;;3;true;n;showqualicontactform;n;n;Wilmersdorf_Wilmersdorf;118152792;3;Berlin;/expose/118152792;"['Die Wohnung befindet sich im EG eines gepflegten Altbaus, der in den 30er Jahren errichtet wurde. \n\nVom Flur gehen die einzelnen Zimmer, Küche und Bad ab.  \n\nKüche, Bad und ein Zimmer sind zur verkehrsberuhigten Straße (30-er Zone), die beiden weiteren Zimmer zum begrünten Innenhof ausgerichtet.\n\nZur Wohnung gehört ein Kellerabteil.', '- neue Kunststofffenster \n- Jalousien an den Fenstern zur Straße\n- Bad mit bodentiefer Dusche', 'Die Wohnung befindet sich in bevorzugter Wohnlage im Berliner Ortsteil Wilmersdorf. Wer die Nähe zur City und ""grünes Wohnen"" in der Stadt schätzt ist hier gut aufgehoben.\n\nDie Infrastruktur ist als hervorragend zu bezeichnen.\nIn fußläufiger und der nahen Umgebung befinden Supermärkte, Getränkemarkt, Ärzte, Schulen und Restaurants. \n\nBushaltestelle ist in wenigen Minuten fußläufig zu errreichen.  In ca. 15 Minuten erreichen Sie die Schloßstraße und auch den Kurfürstendamm. \n\nÜber die Stadtautobahn A100 ist sowohl der Flughafen wie auch das Umland schnell erreicht.']";central_heating;;;;;;;
2020-05-24 20:49:29.143099;Berlin;;ONE_YEAR_FREE;14808584;n;y;https://pictures.immobilienscout24.de/listings/cd946541-bb42-416d-8a9d-160eacca0e2a-1367875554.jpg/ORIG/resize/118x118%3E/extent/118x118/format/jpg/quality/80;10;10.77;40 MBit/s;telekom_layer_magenta_l;über VDSL;1973;REGULAR;10.77;118141591;district_heating;n;false;MagentaZuhause L;y;Berlin;y;6;3;;no_information;;5.67;50;Berlin;10117;negotiable;no_information;;false;100 MBit/s;no_information;no_information;n;https://padlock.link/ioml;https://padlock.link/ml;no_information;apartment;10117;2;;n;;2,active;true;Deutschland;standard;100 MBit/s;wohnung_kauf;n;;web,email,bank,music,dl-ul,game,sd,mltstr,hd,fast-ul-dl;true;001.14808584;299000;profile0;;2;true;n;showqualicontactform;n;n;Mitte_Mitte;118141591;2;Berlin;/expose/118141591;"['Schöne und helle Wohnung in der 16. Etage mit fantastischer Aussicht Richtung Reichstag und über Berlin! Hier haben Sie alles im Blick.\n\nBarriererfreier Zugang mit dem Aufzug direkt bis zur Wohnung.\n\n- heller, offener Wohnbereich mit Küche und Ausgang zur Loggia\n-  Duschbad\n- große Westloggia mit toller Aussicht Richtung Westen\n- sehr gepflegtes und aufwändig renoviertes Gebäude\n\nHier  werden Sie sich wohlfühlen!\n\nZur Wohnung gehört ein Abstellraum, sowie für Fahrräder u.ä. ein Gemeinschaftsraum auf er Etage.', 'Lage\n""Mittendrin!"" beschreibt die Lage dieser attraktiven Wohnung in Berlin-Mitte.\n\nDie Anbindung an das öffentliche Verkehrsnetz ist über div. Bus- und U-Bahnlinien erstklassig.\nDer Postdammer sowie der Alexanderplatz sind in wenigen Minuten zu Fuß erreichbar.\n\nEntspanntes Shopping erwartet Sie in den luxuriösen Boutiquen der Friedrichstraße, den Einkaufscentern Potsdamer Platz Arkaden, LP 12 (Mall of Berlin) und dem Alexa am Alexanderplatz. \n\nDer Gendarmenmarkt mit dem Prädikat ""Schönster Platz in Berlin"" bietet Kulturinteressierten mit seinem Konzerthaus Veranstaltungen auf höchstem Niveau. \n\nAuch die Opernhäusern Unter den Linden und die vielen Theater sowie der Friedrichstadtpalast laden zu unterschiedlichsten kulturellen Veranstaltungen ein. \n\nDie historische Mitte Berlins mit dem Nikolaiviertel, der Museumsinsel, der Lustgarten und das Spreeufer bieten ausgezeichnete Möglichkeiten Berlin zu Fuß zu erkunden und die Zeugnisse der Zeit zu bestaunen. \n\nDie Ministerien für Justiz und Auswärtige Angelegenheiten sind von der Wohnung aus in nur wenigen Gehminuten zu erreichen. Auch Botschaften einiger Länder am Hausvogteiplatz befinden sich in unmittelbarer Umgebung. \n\nDie Leipziger Straße ist eine wichtige Verbindungsstrasse zwischen West- und Ostberlin mit vielen historischen Gebäuden. So befinden sich entlang der Straße der Bundesrat, das Bundesfinanzministerium, das Museum für Kommunikation und viele Geschäftshäuser und Hotels.']";no_information;;0;true;;;;
2020-05-24 20:49:29.494967;Berlin;;ONE_YEAR_FREE;15402574;n;y;https://pictures.immobilienscout24.de/listings/8e38ce9f-706c-4835-9fdb-6fad7b955aaa-1368121954.jpg/ORIG/resize/118x118%3E/extent/118x118/format/jpg/quality/80;18;11.3;40 MBit/s;telekom_layer_magenta_l;über VDSL;1924;REGULAR;11.3;118154953;gas;n;false;MagentaZuhause L;y;Berlin;y;7;1;205.34;no_information;energy_consumption;5.73;71.98;Berlin;14052;no_information;no_information;E;false;100 MBit/s;no_information;no_information;n;https://padlock.link/ioml;https://padlock.link/ml;no_information;apartment;14052;3;144.7;n;;2,active;true;Deutschland;top;100 MBit/s;wohnung_kauf;y;1;web,email,bank,music,dl-ul,game,sd,mltstr,hd,fast-ul-dl;true;001.15350375;329000;profile0;2;3;true;n;showqualicontactform;n;n;Charlottenburg_Charlottenburg;8312;3;Berlin;/expose/118154953;"['Bis Ende 2018 wurde im Gemeinschaftseigentum folgende Sanierungen vorgenommen: Renovierung der Treppenhäuser, neue Elektrosteigleitungen, Brandschutztüre, digitale Stromzähler, Leitungen für das Kabelfernsehen.', 'Stadtteil:\t14052 Berlin-Charlottenburg, Westend\nObjektart:\tEtagenwohnung\nBaujahr:\t1924\nEtage:\t1.OG\nWohnfläche ca.:\t71,98 m2\nAnzahl der Zimmer:\t3 \nHeizung:\tGas-Etagenheizung\nZustand:\tgepflegt\nWintergarten:\tja\nVermietet:\tja\nKündigungsfrist:\tnur 9 Monate\nKalt-Miete\t327,49 €\nHausgeld:\t205,34 €', 'Die Wohnung liegt im Berliner Ortsteil Westend, der zum sehr beliebten und gefragten Bezirk Charlottenburg-Wilmersdorf gehört. Das Haus steht an einer Seitenstraße der Reichsstraße, wo alle Geschäfte des täglichen Bedarfs, sowie Ärzte und Apotheker ansässig sind. Auf dem gegenüber liegenden idyllischen Brixplatz gibt es einen Spielplatz und nur wenige Gehminuten entfernt einen Supermarkt, Schulen, Geschäfte, Restaurants und eine sehr gute Anbindung an den öffentlichen Nahverkehr. Die Buslinie 104 befindet sich direkt vor der Haustür; S- und U-Bahnhöfe sind fußläufig erreichbar. \n\nNähe zu Olympiastadion, die Messe Berlin, das Schloss Charlottenburg, Avus und Kurfürstendamm. Von hier ist die bekannteste Einkaufs- und Flaniermeile Berlins, der Kurfürstendamm, mit dem PKW in nur 10 Minuten erreichbar – ebenso das Naherholungsgebiet Grunewald sowie der Stadtring. \nDie Wohnung zeichnet sich durch ihre sehr gute und vor allem ruhige Lage aus.', 'Ganz wichtig bei der Anfrage: Teilen Sie uns Ihre vollständigen Kontaktdaten: Vor- und Nachnamen, Adresse, Mail und Telefonnummer mit.\n\nSeit einigen Jahren gilt in Deutschland das Geldwäschegesetz. Nach diesem Gesetz ist jedes Immobilienbüro verpflichtet, bei Kontaktaufnahme die Identität des Kunden festzuhalten. \n\nDieses Kaufangebot ist provisionspflichtig. Dem Erwerber wird bei Abschluss eines Kaufvertrages eine Käuferprovision in Höhe von 7,14 % des beurkundeten Kaufpreises inkl. der gesetzlichen MwSt. berechnet. \n\nDie in diesem Exposé gemachten Angaben beruhen auf Auskünften des Eigentümers oder vorgelegten Plänen und Berechnungen. Wir übernehmen daher keine Haftung, für die hier gemachten Angaben, insbesondere für Flächenangaben, Grundrisse, Lageskizzen sowie wann was und wie im Hause renoviert und saniert wurde, da wir das nicht persönlich überwachen konnten. Dieses Angebot ist freibleibend, ein Zwischenverkauf bleibt vorbehalten.\n\nHinsichtlich weiterer Dienstleistungen in Zusammenhang mit dem Erwerb, wie Finanzierungen unterstützen wir Sie gerne. Es ist uns leider nicht gestattet, Sie zu steuerrelevanten Aspekten zu beraten. Hierzu wenden Sie sich bitte an Ihren Steuerberater. Wir stehen Ihnen gerne für Fragen zur Verfügung.\n\n\nInnenfotos\n\nDa die Wohnung vermietet ist, werden aus Rücksicht auf die Privatsphäre der Mieter keine Innenfotos im Internet veröffentlicht.']";self_contained_central_heating;disabled;;;;;;
2020-05-24 20:49:29.971264;Berlin;;ONE_YEAR_FREE;5418748;n;n;https://pictures.immobilienscout24.de/listings/63c762ad-b831-4b35-9f14-a85f4f801935-1369230412.jpg/ORIG/resize/118x118%3E/extent/118x118/format/jpg/quality/80;12;11.13;40 MBit/s;telekom_layer_magenta_l;über VDSL;1908;REGULAR;11.13;118146687;gas;y;false;MagentaZuhause L;y;Berlin;n;5;1;200;no_information;energy_required;7.51;50.8;Berlin;12435;modernized;sophisticated;E;false;100 MBit/s;no_information;no_information;n;https://padlock.link/ioml;https://padlock.link/ml;no_information;ground_floor;12435;2;149;n;2018;2,active;true;Deutschland;top;100 MBit/s;wohnung_kauf;n;;web,email,bank,music,dl-ul,game,sd,mltstr,hd,fast-ul-dl;true;001.5418748;235000;profile0;6;2;true;y;showqualicontactform;n;n;Treptow_Treptow;1972;2;Berlin;/expose/118146687;"['Dieses moderne Domizil, mit einem Schlafzimmer, ist neu renoviert und komplett eingerichtet.\r\nDie Wohnung bietet Platz für bis zu 3 Personen, mit einem Doppelbett im Schlafzimmer und einem Schlafsofa im Wohnzimmer. Es ist des Weiteren möbliert mit einem neuen Fernseher, einer voll ausgestatteten Küche und einem einladenden Essbereich. Einziehen und fertig!', 'Diese Wohnung befindet sich an der Kreuzung der Stadtteile Kreuzberg, Neukölln und Friedrichshain.\r\nEs sind nur wenige Gehminuten von zwei der besten Parks Berlins entfernt, dem Görlitzer Park und dem Treptower Park, die sich hervorragend zum Entspannen und für Aktivitäten im Freien eignen.\r\nDie Haus befindet sich in zentraler Lage und Sie können in Kürze jeden Teil des Stadtzentrums erreichen.\r\nDiese Lage bietet alles, was Sie brauchen, von Restaurants, Bars, Cafés und Supermärkten. Das Einkaufszentrum ""Park Center Treptow"" ist gleich um die Ecke. Der Flughafen Schönefeld ist nur eine kurze Fahrt entfernt.\r\n', 'Sonstige Informationen\r\n\r\nDas Team von Black Label Immobilien bietet Ihnen Unterstützung in allen Bereichen rund um den Kauf einer Immobilie. Unser internationales Team spricht fließend Englisch, Deutsch, Französisch und Mandarin, zudem arbeiten wir mit einem Team aus mehrsprachigen Anwälten, Notaren und Finanzierungsberatern zusammen.\r\nUm Ihren persönlichen Ansprüchen gerecht werden zu können, bieten wir Ihnen eine große Auswahl an verschiedenen Immobilien. \r\n\r\nSenden Sie uns einfach ihre Suchkriterien inklusive: \r\n\r\n- Art der gesuchten Immobilie\r\n- Ihr Budget\r\n- Bevorzugter Standort\r\n- Suchen Sie eine Immobilie als Investment oder zum Eigenbedarf? \r\n\r\nFür Unterstützung bei der Finanzierung Ihrer Immobilie kontaktieren Sie bitte einfach unseren Finanzierungsberater. Wir können Ihnen eine Finanzierung bis zu 100% des Kaufpreises anbieten.\r\n\r\nSind Sie an einer Vermietung Ihrer neuen Immobilie interessiert? Hierfür bietet Black Label ein Verwaltungs-Paket sowohl für unmöblierte als auch möblierte Vermietungen, sowie einen kompletten Design- und Möblierungsservice, angepasst an ihre persönlichen Vorstellungen. Kontaktieren Sie uns, oder besuchen Sie uns in unserem Büro, um mehr Informationen zu erhalten.']";gas_heating;disabled;;;;;;
