timestamp;obj_regio1;obj_heatingType;obj_telekomTvOffer;obj_cId;obj_newlyConst;obj_balcony;obj_picture;obj_picturecount;obj_pricetrend;obj_telekomUploadSpeed;obj_telekomTrackingGroup;obj_telekomInternetTechnology;obj_yearConstructed;obj_telekomInternetType;obj_pricetrendbuy;obj_scoutId;obj_firingTypes;obj_hasKitchen;obj_ExclusiveExpose;obj_telekomInternetProductName;obj_courtage;geo_bln;obj_cellar;obj_purchasePriceRange;obj_yearConstructedRange;obj_rentSubsidy;obj_houseNumber;obj_pricetrendrent;obj_livingSpace;geo_krs;obj_zipCode;obj_condition;obj_interiorQual;ga_cd_cxp_historicallisting;obj_telekomDownloadSpeed;obj_parkingSpace;obj_street;obj_lift;obj_telekomInternetUrlMobile;obj_telekomInternetUrl;obj_streetPlain;obj_typeOfFlat;geo_plz;obj_noRooms;obj_assistedLiving;obj_lastRefurbish;obj_ityp;obj_telekomHdTelephone;geo_land;ga_cd_via;obj_telekomInternet;obj_immotype;obj_rented;obj_floor;obj_telekomInternetServices;obj_telekomInternetProductAvailable;obj_cwId;obj_purchasePrice;ga_cd_application_requirements;obj_numberOfFloors;obj_noRoomsRange;ga_cd_maillead_default_shown;obj_garden;evt_count_pm_sig;obj_barrierFree;obj_international;obj_regio3;obj_objectnumber;obj_livingSpaceRange;obj_regio2;URL;beschreibung;obj_energyType;obj_thermalChar;obj_noParkSpaces;obj_galleryAd;obj_energyEfficiencyClass;obj_groupnumber;obj_usableArea;ga_cd_via_qualified
2020-05-24 21:15:07.810929;Berlin;central_heating;ONE_YEAR_FREE;18484038;n;n;https://pictures.immobilienscout24.de/listings/ff52cc9d-ba51-4dd8-94d4-c1ed2fe6db0b-1327579808.jpg/ORIG/resize/118x118%3E/extent/118x118/format/jpg/quality/80;9;11.35;10 MBit/s;telekom_layer_magenta_m;über VDSL;1900;REGULAR;11.35;114053480;natural_gas_light;n;false;MagentaZuhause M;n;Berlin;y;7;1;246;10;7.53;68.07;Berlin;10245;modernized;sophisticated;false;50 MBit/s;no_information;"B&ouml;cklinstr.";n;https://padlock.link/iomm;https://padlock.link/mm;Böcklinstr.;ground_floor;10245;3;n;2016;2,active;true;Deutschland;premium;50 MBit/s;wohnung_kauf;n;0;web,email,bank,music,dl-ul,game,sd,mltstr,hd,fast-ul-dl;true;009.1921be11-099b-46c0-95c4-7a3cd554131d;359000;profile0;4;3;true;n;showqualicontactform;n;n;Friedrichshain_Friedrichshain;df71e022-c0a9-4969-ae7a-bce18ea5a85f;3;Berlin;/expose/114053480;['Bei dieser ansprechenden Immobilie handelt es sich um eine EG-Wohnung. Durch hohe Fenster ist sie ungewöhnlich hell. \nZu der Wohnung zählen drei schöne Zimmer - gut geschnitten. Die Küche ist Mittelpunkt, da hier 4 Menschen an einem Tisch problemlos Platz haben. (Quasi Wohnküche)\n\nAlle Räume -auch das Bad mit Badewanne- haben hohe Fenster (saniert) Sanierter Altbau (Baujahr 1900) , sehr hohe Decken und wunderschöne Dielen. Beheizt wird die Wohnung durch eine Zentralheizung. Das monatliche Hausgeld beträgt 246,00\xa0€. Die Heizkosten sind inklusive,\n\nIhnen steht außerdem ein trockener Kellerraum zur Verfügung. Das Objekt kann provisionsfrei übernommen werden. \nWir als Eigentümer sind Selbstnutzer, damit wird die Whg unvermietet/leer verkauft! Nach Zahlung sind wir sofort ausgezogen.\nBerufsbedingt müssen wir nach Sardinien. Deswegen verkaufen wir.\n\nP.S.: \nAls Erdgeschosswohnung haben wir das Glück, unter uns den Heizkeller zu haben. Also niedrige Heizkosten. Tolles Raumklima im Sommer, angenehm kühl. Dazuhin ist die Wohnung hell, da die Gebäude gegenüber recht weit weg sind und dann auch noch die Sonne reflektieren.\n\n', 'Exquisiter Dielenboden, Küche und Bad gefliest jeweils mit Fliesenspiegel. Bad  ist 2016 runderneuert (neuer Lokus, Waschbecken) alle Fugen gereinigt und neu verfugt.', 'Mittendrin und trotzdem sehr ruhig. Strasse ist eine 30er Zone. Kaum Verkehr. \nFussläufig zum Simon-Dach-Kiez, Partymeile Revaler Strasse.\nMax. 8 min Fussweg zur Anbindung an S-Bahn Ostkreuz (sog. Berliner Ring), auch von dort 17min. zum Flughafen Schönefeld, Tram, Restaurants und Einkaufsmöglichkeiten in direkter Umgebung. ', 'Die Immobilie ist auch gewerblich nutzbar, gemäss Teilungserklärung.  Also für Ärzte und sonstige Freiberufler geeignet.'];;;;;;;;
2020-05-24 21:15:08.282567;Berlin;central_heating;ONE_YEAR_FREE;16921323;n;y;https://pictures.immobilienscout24.de/listings/d6178423-3116-422b-8266-3b019765dd47-1337202722.jpg/ORIG/resize/118x118%3E/extent/118x118/format/jpg/quality/80;19;10.95;40 MBit/s;telekom_layer_magenta_l;über VDSL;1938;REGULAR;10.95;114702234;district_heating;n;false;MagentaZuhause L;y;Berlin;n;6;1;243;48;6.54;66.29;Berlin;10409;well_kept;normal;false;100 MBit/s;no_information;"Ostseestra&szlig;e";n;https://padlock.link/ioml;https://padlock.link/ml;Ostseestraße;apartment;10409;3;n;;2,active;true;Deutschland;top;100 MBit/s;wohnung_kauf;y;1;web,email,bank,music,dl-ul,game,sd,mltstr,hd,fast-ul-dl;true;009.c282bcb0-d517-4793-83c4-cd4999b68120;300000;profile0;;3;true;n;showqualicontactform;n;n;Prenzlauer_Berg_Prenzlauer_Berg;HI-126;3;Berlin;/expose/114702234;"[""Das Gebäude in dem sich die Wohnung befindet ist ein schönes 30`er Jahre Bauwerk. Einen besonderen Charakter erhält dieses Gebäude durch die grünen Fensterläden. Es befindet sich in einem gepflegten, modernisierten Zustand und hat eine großen begrünten Innenhof.\n\nDie Wohnung selbst liegt im Hochparterre, man hat keine direkte Einsicht von der Straße da die Fenster ca. 2 Meter über dem Boden beginnen, sie befindet sich wie das Gebäude ebenfalls in gepflegtem Zustand. Die Räume haben einen guten Schnitt und vom Balkon blickt man gen Süden in den schönen Hof.\n\nDie Wohnung ist aktuell vermietet mit einer Nettokaltmiete in Höhe von 496,28 €. Eine Eigenbedarfskündigung könnte nach ca. 4 Jahren ausgesprochen werden.\n\n________\n\n\nThe building in which the apartment is located is a beautiful 30's building. This building gets a special character by the green shutters. It is in a well-kept, modernized condition and has a large green inner courtyard.\n\nThe apartment itself is on the mezzanine ground floor, there is no direct view from the street as the windows start about 2 meters above the ground, like the building it is also in a well-kept condition. The rooms have a good cut and from the balcony one looks to the south into the beautiful courtyard.\n\nThe apartment is currently rented with a net cold rent of 496.28 €. An own requirement notice could be pronounced after approx. 5 years."", 'Ideale Raumaufteilung\n\nAbgezogene Dielen\n\nSüdbalkon 4m²\n\nWannenbad\n\n________\n\n\nIdeal room layout\n\nWooden planks detached\n\nsouth-facing balcony 4m²\n\nbath whit bathtub', 'Das Leben ist sehr vielfältig hier, zwischen dem Einkaufstrubel im Prenzlauer Berg, Kinderlachen auf dem Spielplatz im Erich-Weinert-Park und einer himmlischen Ruhe unter den großen, schattigen Bäumen auf dem jüdischen Friedhof sind es nur wenige hundert Meter und abends lockt der Helmholtzplatz mit seinen beliebten Bars und Restaurants.\n\nEs gibt viele Kindergärten und gute Schulen. Grünanlagen und Spielplätze wurden renoviert. Der jüdische Friedhof ist zum Schmuckstück geworden und zwei Supermärkte, ein Bioladen und ein Feinkostmarkt befinden sich in unmittelbarer Nachbarschaft.\n\nDie verkehrstechnische Anbindung ist hervorragend. Mit der Tram sind Sie innerhalb von 10 Minuten am Berliner Alexanderplatz, die Ringbahn ist ganz nah und mit dem Auto gelangt man über die Prenzlauer Allee schnell in das Zentrum oder auch raus ins Grüne.\n\n________\n\n\nLife is very varied here, between the shopping bustle in Prenzlauer Berg, children laughing on the playground in Erich Weinert Park and a heavenly peace under the large, shady trees in the Jewish cemetery there are only a few hundred meters and in the evening the Helmholtzplatz with its popular bars and restaurants attracts.\n\nThere are many kindergartens and good schools. Green areas and playgrounds have been renovated. The Jewish cemetery has become a jewel and there are two supermarkets, an organic shop and a gourmet market in the immediate vicinity.\n\nThe traffic connections are excellent. With the tram you are within 10 minutes at the Berlin Alexanderplatz, the Ringbahn is very close and with the car you can reach the city centre or out into the green via the Prenzlauer Allee.', ""Als wirtschaftliches Unternehmen sind wir selbstverständlich auf die Zahlung einer Provision angewiesen.\n\nEs gilt ein vom Käufer an uns zu entrichtendes Vermittlungs- bzw. Nachweishonorar (Maklercourtage) bei Abschluss des Kaufvertrages in Höhe von 7,14 % (inkl. gesetzl. MwSt.) auf den tatsächlichen Kaufpreis als vereinbart. \n\nUnsere Angebote sind nur für den Empfänger selbst bestimmt. Bei einer Weitergabe an Dritte haftet der Angebotsempfänger für unsere Courtage. \n\nDie Inhalte unserer Angebote beruhen auf den Angaben des Verkäufers bzw. anderer fremder Dritter und nicht auf unseren Ermittlungen und erfolgen deshalb ohne Gewähr für deren Richtigkeit. \n\nUnsere Angebote erfolgen freibleibend und unverbindlich. Zwischenverkauf bleibt vorbehalten.\n\n________\n\n\nAs an economic enterprise, we are naturally dependent on the payment of a commission.\n\nA brokerage or proof fee (broker's commission) to be paid to us by the buyer on conclusion of the purchase contract in the amount of 7.14% (incl. statutory VAT) on the actual purchase price is deemed to have been agreed. \n\nOur offers are only intended for the recipient himself. The offeree is liable for our brokerage fee in the event that the offer is passed on to third parties. \n\nThe contents of our offers are based on the information provided by the seller or other third parties and not on our investigations and are therefore without guarantee for their accuracy. \n\nOur offers are subject to confirmation and non-binding. Subject to prior sale.""]";energy_consumption;84.4;;;;;;
2020-05-24 21:15:08.619964;Berlin;oil_heating;;10267174;n;y;https://pictures.immobilienscout24.de/listings/52c4ec01-7585-46d6-a1f5-54db54eb8b73-1259277839.jpg/ORIG/resize/118x118%3E/extent/118x118/format/jpg/quality/80;21;10.24;;;;1977;;10.24;108848684;oil;y;false;;y;Berlin;y;10;3;450;no_information;5.14;135;Berlin;14195;refurbished;sophisticated;false;;garage;no_information;n;;;no_information;maisonette;14195;4;n;2016;2,active;;Deutschland;top;;wohnung_kauf;n;0;;false;001.10267174;900000;profile0;2;4;true;y;showqualicontactform;n;n;Dahlem_Zehlendorf;01012019;6;Berlin;/expose/108848684;['Die hier angebotene - 4 Zimmer Maisonettewohnung - befindet sich in einer kleinen, exklusiven Wohnanlage mit 6 Wohneinheiten, die im Jahr 1977 nach Plänen des bekannten Architekten Gert Eckel errichtet wurde. Sie ist als Haus im Haus mit separatem Eingang konzipiert.\n\nDie Immobilie präsentiert sich in einem hervorragenden Zustand.\n\nSie wurde im Jahr 2016 kernsaniert.\n\nSomit entstand eine Einheit die durch ihr junges, funktionales  Wohnkonzept besticht.\n\nIm Zuge der Sanierung wurden sämtliche Medien der Wohneinheit erneuert. \nDer gesamte Fenstersatz wurde ausgetauscht. Hochwertige Aluminium-Fenster mit Sicherheitsglas und eine einbruchhemmende Eingangstür wurden eingebaut.\nDas Untergeschoss der Wohnung hat elektrische Außenjalousien\nEbenso installierten die Eigentümer eine Alarmanlage und eine Gegensprechanlage auch im Untergeschoss.\n\nDie ca. 135 m² Wohn- Nutzfläche verteilen sich über zwei Ebenen  (EG und UG + Terrassen), wobei sich das Wohnzimmer und das Büro, sowie die funktionale, offene Küche und das hochwertige Duschbad im Hochparterre befinden.\n\nAuf dieser Ebene befindet sich eine kleine Frühstücksterrasse, die vom Wohnzimmer zu betreten ist.\n \nIm Gartengeschoss sind zwei große Schlafzimmer, ein Vollbad mit separatem Waschmaschinen - und Trocknerstellplatz sowie ein Abstellraum gelegen.\n\nEine großzügige Sonnenterrasse, nach Südwest orientiert,  lädt auf dieser Ebene zum Verweilen ein.\n\nBei den hier angegebenen ca. 135 qm handelt es sich um  Wohn-/Nutzfläche.\n\nUG 55.10 m² Wohn- /Nutzfläche\nEG 58.68 m² Wohnfläche\nTerrasse 41.60 m²/ gerechnet 20,8 m²\n\nDer Garten des Hauses ist randständig mit herrlichem Baumbestand bewachsen und präsentiert sich sehr gepflegt.\n\nZur Wohnung gehört ein Stellplatz in der Garage.', 'zwei hochwertige, gefangene Bäder mit italienischen Fliesen und Villeroy & Boch  Keramik\nMaßangefertigte Einbauküche mit Miele Geräten\ngestrichene Ziegelwände\nSichtbetondecken\nDesignlaminat\nNeuer Aluminium Fenstersatz\nAußenjalousien im Untergeschoss\nSicherheitstür\nGegensprechanlage\nHochwertige Alarmanlage\nEinbauschränke im Ankleidezimmer\nGroßzügige Sonnenterrasse mit Gartenzugang nach Südwesten\nkleine Frühstücksterrasse nach Süden\nAbstellraum\nStellplatz in der Garage', 'Das kleine Mehrfamilienhaus des Architekten Gert Eckel aus dem Jahr 1977  befindet sich unweit des beliebten Messelparks in allerbester Wohnlage.\nKlassische Villen, hochwertige Einfamilienhäuser und erstklassige Wohnanlagen prägen das Umfeld.  \nHochrangige Persönlichkeiten des öffentlichen Lebens residieren in dieser exklusiven Villenlage.\nNeben umfangreichen Erholungs- und Freizeitangeboten verfügt Dahlem über eine hervorragende Infrastruktur. \nEinkaufsmöglichkeiten befinden sich rund um das Roseneck sowie im Schmargendorfer Ortszentrum als auch an der Clayallee.\nDie Berliner Innenstadt sowie Flughäfen und Bahnhöfe erreichen Sie schnell und bequem mit dem eigenen Fahrzeug oder mit den öffentlichen Verkehrsmitteln.\nDer nahe gelegene Grunewald lädt zu ausgiebigen Spaziergängen ein.', 'Alle Daten basieren auf Angaben des Eigentümers und sind ohne Gewähr.\n\nWiderrufsbelehrung für Verbraucher:\nAuf den folgenden Seiten belehren wir Sie pflichtgemäß über das gesetzlich vorgeschriebene Widerrufsrecht.\nDer leicht missverständlich formulierte Text soll Sie nicht verwirren, es entstehen Ihnen keine Kosten,\nsolange Sie keine von uns provisionspflichtig angebotene Immobilie kaufen oder mieten. Der Inhalt der Widerrufsbelehrung ist vom Gesetzgeber so verfasst und vorgeschrieben worden.\nWiderrufsbelehrung:\nSie können Ihre Vertragserklärung innerhalb von 14 Tagen ohne Angabe von Gründen in Textform\n(z.B. Brief, Fax, E-Mail) widerrufen. Die Frist beginnt nach Erhalt dieser Belehrung in Textform. Jedoch\nnicht vor Vertragsschluss und auch nicht vor Erfüllung unserer Informationspflichten gemäß Artikel\n246 § 2 in Verbindung mit § 1 Absatz 1 und 2 EGBGB.\nZur Wahrung der Widerrufsfrist genügt die rechtzeitige Absendung des Widerrufs. Der Widerruf ist zu\nrichten an:\nAue & von Zitzewitz, Teltower Damm 40 in 14167 Berlin\nTelefon: 030 2630 9988\nFax: 030 2630 9989\nE-Mail: info@a-vz-immobilien.de\nWiderrufsfolgen:\nIm Falle eines wirksamen Widerrufs sind die beiderseits empfangenen Leistungen zurück zu gewähren\nund ggf. gezogene Nutzungen (z.B. Zinsen) herauszugeben. Können Sie uns die empfangene\nLeistung ganz oder teilweise nicht oder nur in verschlechtertem Zustand zurückgewähren, müssen Sie\nuns insoweit ggf. Wertersatz leisten.\nDies kann dazu führen, dass Sie die vertraglichen Verpflichtungen für den Zeitraum bis zum Widerruf\ngleichwohl erfüllen müssen.\nVerpflichtungen zur Erstattung von Zahlungen müssen innerhalb von 30 Tagen erfüllt werden. Die\nFrist beginnt für Sie mit der Absendung Ihrer Widerrufserklärung, für uns mit deren Empfang.\nIhr Widerrufsrecht erlischt vorzeitig, wenn der Vertrag von beiden Seiten auf Ihren ausdrücklichen\nWunsch vollständig erfüllt ist, bevor Sie Ihr Widerrufsrecht ausgeübt haben.\n[ ] Sofortiger Beginn mit der Maklertätigkeit\nIch bin einverstanden und verlange ausdrücklich, dass die Firma Aue & von Zitzewitz Immobilien vor\nEnde der Widerrufsfrist mit der Maklertätigkeit beginnt.\nMir ist bekannt, dass ich bei vollständiger Vertragserfüllung mein Widerrufsrecht verliere.___\nKenntnis von Wertersatz.\nMir ist weiter bekannt, dass ich bei einem Widerruf vor vollständiger Vertragserfüllung durch die Firma\nAue & von Zitzewitz Immobilien dieser dann Wertersatz für die bis zum Widerruf erbrachten\nLeistungen schulde.\n\nDatum/ Ort: Unterschrift_____________________________ \n\nEnde der Widerrufsbelehrung.'];energy_consumption;196;1;;;;;
2020-05-24 21:15:09.027923;Berlin;district_heating;ONE_YEAR_FREE;15754699;n;n;https://pictures.immobilienscout24.de/listings/fc4721e0-b81a-4078-82b4-99722b767812-1337725387.jpg/ORIG/resize/118x118%3E/extent/118x118/format/jpg/quality/80;18;16.86;40 MBit/s;telekom_layer_magenta_l;über VDSL;1900;REGULAR;16.86;110263770;district_heating;n;false;MagentaZuhause L;y;Berlin;y;2;1;160.34;50;10.17;26.58;Berlin;10559;no_information;no_information;false;100 MBit/s;no_information;Stephanstr.;n;https://padlock.link/ioml;https://padlock.link/ml;Stephanstr.;apartment;10559;1;n;;2,active;true;Deutschland;top;100 MBit/s;wohnung_kauf;n;3;web,email,bank,music,dl-ul,game,sd,mltstr,hd,fast-ul-dl;true;001.15650116;99000;profile0;4;1;true;n;;n;n;Tiergarten_Tiergarten;6047;1;Berlin;/expose/110263770;['\nIm schönen Stephankiez liegt diese schnucklige 1-Zimmer-Wohnung. Sie befindet sich im 3. Obergeschoss, im Seitenflügel eines historischen Mehrfamilienhauses aus Gründerzeiten.\n\nNeben einem Wohn- und Schlafbereich bietet die Wohnung noch eine Küchenzeile und ein Duschbad. \n\n\nDer Prachtaltbau besticht durch eine imposante Fassade mit detailgetreuen Stuckverzierungen und klassischen Balkonen. \n\nDas Mehrfamilienhaus wurde um 1900 erbaut und regelmäßig instand gehalten. \n\nDie renovierungsbedürftige Wohnung ist vermietet und erzielt eine jährliche Nettokaltmiete von 1.744,44 Euro. \n\n ', 'Die Stephanstraße befindet sich im beliebten Stephankiez im Bezirk Moabit, unweit des beliebten Bezirk Berlin-Mitte mit \nseinen vielen Sehenswürdigkeiten und kulturellen Annehmlichkeiten.\nEinkaufsmöglichkeiten für den täglichen Bedarf und das fußläufige, \nneue Einkaufszentrum *Schultheiss Quartier* mit diversen Shops, befinden sich in nächster Nähe der Wohnung. \nAuch die Anbindung an das öffentliche Nahverkehrsnetz ist ideal. \nViele Grünflächen und die Spree laden zu ausgiebigen Spaziergängen ein. '];energy_consumption;68.9;;disabled;;;;
2020-05-24 21:15:09.399793;Berlin;;ONE_YEAR_FREE;17336565;n;n;https://pictures.immobilienscout24.de/listings/9e93194f-8270-4dd2-89ad-d321de408dca-1368411903.jpg/ORIG/resize/118x118%3E/extent/118x118/format/jpg/quality/80;12;9.97;40 MBit/s;telekom_layer_magenta_l;über VDSL;2012;REGULAR;9.97;114729474;district_heating;n;false;MagentaZuhause L;y;Berlin;n;11;8;;no_information;5.62;203;Berlin;14195;mint_condition;no_information;false;100 MBit/s;underground_garage;no_information;n;https://padlock.link/ioml;https://padlock.link/ml;no_information;roof_storey;14195;3;n;;2,active;true;Deutschland;top;100 MBit/s;wohnung_kauf;n;2;web,email,bank,music,dl-ul,game,sd,mltstr,hd,fast-ul-dl;true;002.01008088872;3400000;profile0;;3;true;n;showqualicontactform;n;n;Schmargendorf_Wilmersdorf;1034;7;Berlin;/expose/114729474;['Bei dem angebotenen Objekt handelt es sich um eine luxuriöse 3-Zimmer-Penthouse-Wohnung, gelegen im Dachgeschoss einer exklusiven Neubau-Stadtvilla aus dem Jahr 2012, welche Teil einer Wohnanlage aus insgesamt vier Stadtvillen ist. Die Wohnung verfügt über eine geräumige Diele, einen sehr großen Wohn- und Essbereich mit offener Küche und Kamin, zwei Schlafzimmer mit jeweils einem Bad en Suite, ein weiteres Bad und eine Abstellkammer. Von jedem Raum besteht der Zugang zu einer großen umlaufenden Dachterrasse. Zusätzlich befindet sich im Untergeschoss ein ca. 49 m² großer Hobbyraum. Zu der Wohnung gehören zwei Tiefgaragen-Stellplätze. Ein Aufzug führt von der Tiefgarage direkt in die Wohnung.', '- umlaufende Terrasse\n- sehr hochwertige Ausstattung\n- Parkett\n- Kamin\n- exklusive Designer-Bäder\n- Marken-Einbauküche\n- Smart Home\n- Aufzug direkt in die Wohnung\n- zusätzlicher ca. 49 m² großer Hobbyraum im Untergeschoss mit Weinkühlschrank und Waschkücke\n- 2 Tiefgaragen-Stellplätze\n- hochwertige Einrichtung im Preis inbegriffen', 'Die Wohnung befindet sich in einer der exklusivsten Villenlagen Berlins. Hervorragende Einkaufsmöglichkeiten finden sich rund um das nahe gelegene Roseneck. Kindertagesstätten und renommierte Schulen sind fußläufig erreichbar. Einen hohen Erholungswert bieten Ihnen zahlreiche Grün- und Parkanlagen sowie der nahegelegene Grunewald mit seiner Seenkette, dem bekannten Jagdschloss und dem größten Hundeauslaufgebiet Europas. Berlins nobelster Tennisclub Blau-Weiss ist direkter Hausnachbar. Von Schmargendorf aus erreichen Sie in wenigen Minuten die City-West und den Kurfürstendamm mit seinen luxuriösen Geschäften, zahlreichen Cafés und Restaurants. Darüber hinaus haben Sie hervorragende Verkehrsanbindungen an das Berliner Regierungsviertel, die Berliner Flughäfen, den Hauptbahnhof sowie nach Potsdam und das Berliner Umland mit seinen vielseitigen und abwechslungsreichen Ausflugsmöglichkeiten.'];;;2;;;;;
2020-05-24 21:15:09.815083;Berlin;district_heating;ONE_YEAR_FREE;1495;n;n;https://pictures.immobilienscout24.de/listings/ec12cde6-a21a-4adf-b14d-deb2b43d31b7-1358233631.jpg/ORIG/resize/118x118%3E/extent/118x118/format/jpg/quality/80;9;11.12;40 MBit/s;telekom_layer_magenta_l;über VDSL;1927;REGULAR;11.12;114734161;district_heating;n;false;MagentaZuhause L;y;Berlin;y;6;1;;29;6.13;59.66;Berlin;10589;fully_renovated;no_information;false;100 MBit/s;no_information;"Kamminer Stra&szlig;e";n;https://padlock.link/ioml;https://padlock.link/ml;Kamminer_Straße;apartment;10589;2;n;;2,active;true;Deutschland;standard;100 MBit/s;wohnung_kauf;n;0;web,email,bank,music,dl-ul,game,sd,mltstr,hd,fast-ul-dl;true;001.1495;259000;profile0;;2;true;n;showqualicontactform;n;n;Charlottenburg_Charlottenburg;6062_082;2;Berlin;/expose/114734161;['Die denkmalgeschützte Wohnanlage wurde im Jahr 1927 in Massivbauweise errichtet. Die Wohnanlage ist voll unterkellert und wird über das zentrale Fernwärmenetz beheizt. Auch die Warmwasserversorgung erfolgt zentral. Die gewachsene Bewohnerschaft zeichnet sich durch eine niedrige Fluktuation aus. Jung und alt wohnen hier gut beieinander.\r\rDieses Angebot ist provisionspflichtig für den Käufer:\rDie Provision beträgt 7,14 inkl. MwSt. vom Kaufpreis.\r259.000 € Kaufpreis = 18.492,60 € Provision inkl. Mehrwertsteuer', '- bezugsfrei ab 01.06.2020\r- renovierte Altbauwohnung im Hochparterre\r- Laminatfußboden\r- Holzdoppelkastenfenster\r- modern gefliestes Wannenbad mit Fenster\r- geflieste Küche mit Fenster\r- Anschluss für Waschmaschine und Geschirrspüler\r- Kabelanschluss\r- großer, begrünter Innenhof\r\r', 'Die Wohnanlage befindet sich in der Nähe Schloßpark Charlottenburg. Das Spreeufer ist in wenigen Gehminuten erreichbar.  \rEine sehr gute Verkehrsanbindung, gute Einkaufsmöglichkeiten, Schulen, Kindergärten und ärztliche Einrichtungen sind schnell erreicht. Die Verkehrsanbindung an den öffentlichen Nahverkehr, sowohl U-Bahn U 7 als auch S-Bahn und Bus, sowie an die Stadtautobahn (nur wenige Auftominuten entfernt) ist hervorragend.', '- Sonstige Kosten: Provisionspflichtig für Käufer €\r- Ausstattung: Bad mit Fenster, Erdgeschoss, Fernwärme, Küche mit Fenster, Wanne\r\rBITTE SENDEN SIE UNS EINE KONTAKTANFRAGE PER EMAIL!\r\rAlle Angaben in diesem Exposé wurden sorgfältig und so vollständig wie möglich gemacht. Gleichwohl kann das Vorhandensein von Fehlern nicht ausgeschlossen werden. Die Angaben in diesem Exposé erfolgen daher ohne jede Gewähr. Soweit die Grundrissgrafiken Maßangaben und Einrichtungen enthalten, wird auch für diese jegliche Haftung ausgeschlossen. Preisänderungen bleiben vorbehalten. \r\rUnsere Besuchs- und Telefonzeiten:\rMontag 8.00-12.00 Uhr und 13.00-15.00 Uhr\rDienstag 9.00-12.00 Uhr und 13.00-16.00 Uhr\rMittwoch nach Vereinbarung\rDonnerstag 9.00-12-00 Uhr und 13.00-18.00 Uhr\rFreitag 8.00-12.00 Uhr und 13.00-15.00 Uhr'];energy_consumption;119;;;D;4711;;
