2020-05-24 21:07:09.562893;Berlin;no_information;ONE_YEAR_FREE;97549;n;y;https://pictures.immobilienscout24.de/listings/54394d60-1dbe-4d54-977e-1a4f24e96006-1354794631.jpg/ORIG/resize/118x118%3E/extent/118x118/format/jpg/quality/80;6;11.73;40 MBit/s;telekom_layer_magenta_l;über VDSL;1910;;REGULAR;;;11.73;116236409;;gas;n;false;MagentaZuhause L;y;Berlin;y;7;1;4;5.75;89.91;Berlin;12167;no_information;no_information;false;100 MBit/s;no_information;"Stephanstra&szlig;e";n;https://padlock.link/ioml;https://padlock.link/ml;Stephanstraße;apartment;12167;3;n;0;2,active;true;Deutschland;top;100 MBit/s;wohnung_kauf;y;4;;web,email,bank,music,dl-ul,game,sd,mltstr,hd,fast-ul-dl;true;001.97549;379000;profile0;5;3;true;n;showqualicontactform;n;n;Steglitz_Steglitz;Stephan4_9;4;Berlin;/expose/116236409;"['- Altbau ca. 1910\n- der Anbau eines Aufzugs ist in der Teilungserklärung genehmigt', '- Süd-Balkon\n- Loggia\n- Altbaufenster/Altbautüren\n- 4. Obergeschoss', 'Der Altbau liegt in einer Seitenstraße in Berlin-Steglitz unweit vom Stadtpark Steglitz. \n\nDer S-Bahnhof und Regionalbahnhof „Südende"" (S2, S25, S26) oder diversen Buslinien in der Halskestraße sind innerhalb weniger Minuten erreichbar.', 'Da die Wohnung vermietet ist, stehen hier keine Innenfotos zur Verfügung.\n\nDie monatliche Bruttokaltmiete beträgt 416,30 €.']";;;energy_consumption;E;141;;
2020-05-24 21:07:09.929738;Berlin;central_heating;ONE_YEAR_FREE;15741874;n;y;https://pictures.immobilienscout24.de/listings/566df159-0b0e-4b14-bf37-a7a7103da6b5-1358900725.jpg/ORIG/resize/118x118%3E/extent/118x118/format/jpg/quality/80;32;11.48;40 MBit/s;telekom_layer_magenta_l;über VDSL;1900;;REGULAR;;;11.48;116205641;;gas;n;true;MagentaZuhause L;y;Berlin;n;7;1;no_information;7.14;54.5;Berlin;10243;well_kept;normal;false;100 MBit/s;no_information;no_information;n;https://padlock.link/ioml;https://padlock.link/ml;no_information;apartment;10243;2;n;;2,active;true;Deutschland;top;100 MBit/s;wohnung_kauf;n;4;;web,email,bank,music,dl-ul,game,sd,mltstr,hd,fast-ul-dl;true;002.01002949789;328400;profile0;6;2;true;n;showqualicontactform;n;n;Friedrichshain_Friedrichshain;6594#MPKbf4;2;Berlin;/expose/116205641;['Bei dem hier präsentierten Objekt in der Warschauer Straße 10 handelt es sich um einen klassischen Altbau aus der Gründerzeit im beliebten Szenebezirk Berlin-Friedrichshain unweit des Frankfurter Tors und Boxhagener Platzes.\n\nDas um 1900 erbaute und über die Jahre liebevoll instandgehaltene Mehrfamilienhaus verfügt auf insgesamt 6 Etagen über 2 Gewerbe- und 11 Wohneinheiten, von denen eine Vielzahl der zur Straße gewandten Einheiten über Balkone mit Blick auf die Warschauer Straße verfügen. Das Dachgeschoss wurde bereits vor einigen Jahren zu Wohnzwecken ausgebaut, ein Fahrstuhl ist nicht vorhanden. Das Objekt ist mit einer Gas-Zentralheizung ausgestattet.\n\nDie Fassade des Mehrfamilienhauses sowie das gesamte Gemeinschaftseigentum werden im Laufe des Frühjahrs noch umfassenden Sanierungsarbeiten unterzogen. Im Hinterhof des Objektes entsteht zudem ein repräsentativer Neubau sowie eine Begrünung der Hoffläche welche dem Projekt den letzten Schliff verleihen. So spannen wir einen nahtlosen Bogen zwischen klassischem Altbauflair und zeitgenössischer Architektur angepasst an die Bedürfnisse des modernen Lebens. Die ersten Arbeiten hierzu sind in vollem Gange.\n\nDirekt an der Verbindungsstraße der angrenzenden Bezirke Prenzlauer Berg im Nordwesten und Kreuzberg im Südwesten gelegen, könnte das hier präsentierte Objekt nicht zentraler sein und bietet eine willkommene Mischung aus Ruhe vom stressigen Alltag und Nähe zum Trubel der Großstadt.\n\n---\n\nThe object presented here at Warschauer Straße 10 is a classic old building from the Wilhelminian period in the popular trendy district of Berlin-Friedrichshain near the Frankfurt Gate and Boxhagener Platz.\n\nThe multi-family house, built around 1900 and lovingly maintained over the years, has a total of 6 commercial and 11 residential units on 6 floors, of which a large number of the units facing the street have balconies with a view of Warschauer Strasse. The attic was expanded a few years ago for residential purposes, there is no elevator. The property is equipped with gas central heating.\n\nThe facade of the apartment building and the entire community property will undergo extensive renovation work in the spring. In the back yard of the property there is also a representative new building and a green area of the courtyard which give the project the finishing touch. In this way we span a seamless arc between classic old building flair and contemporary architecture adapted to the needs of modern life. The first work on this is in full swing.\n\nLocated directly on the connecting road between the neighboring districts of Prenzlauer Berg in the northwest and Kreuzberg in the southwest, the property presented here could not be more central and offers a welcome mix of tranquility from everyday stress and closeness to the hustle and bustle of the big city.', 'Wohnfläche: 54,50 m2\nKaufpreis: 328.400,00 €\nHausgeld: 198,55 €\nLage: 4. OG mitte\nEtagenzahl gesamt: 6\nStatus: bezugsfrei ab 30.09.2020\nZimmer: 2\nBalkon: ja\nEinbauküche: nein\nKeller: ja\nBodenbelag: originaler Dielenboden\nFenster: Kunststofffenster\nTüren: Holztüren\nDeckenhöhe: 3,20 Meter\nFahrstuhl: nein\nHeizung: Zentralheizung (Gas)\nEnergieausweis: consumption pass\nEnergiekennwert: 95,09 kWh/ (m².a) inkl. Warmwasser/Heizung\n\n---\n\nLiving area: 54,50 m2\nPurchase price: € 328.400,00\nHouse money: ca. € 198,55\nLocation: 4th floor middle\nStoreys: 6\nStatus: vacant from 30.09.2020\nRooms: 2\nBalcony: yes\nFitted kitchen: no\nBasement: yes\nFlooring: original wooden floorboards\nWindows: plastic windows\nDoors: wooden doors\nCeiling height: 3,20 meters\nElevator: no\nHeating: central heating (gas)\nEnergy certificate: consumption pass\nEnergy performance: 95,09 kWh/ (m².a) incl. warm water/heating', 'Die Warschauer Straße im allseits beliebten und sehr dynamischen Bezirk Berlin-Friedrichshain ist eine der Hauptschlagadern im Osten der Hauptstadt und begeistert durch ein abwechslungsreiches Angebot an unzähligen Restaurants, Szenekneipen und kleineren Geschäften.\n\nDas nähere Umfeld des Objekts bietet die perfekte Möglichkeit für ausgelassene Sommerabende oder spontane Einkaufsbummel. Auch der regelmäßig stattfindende Wochen- und Flohmarkt am nahegelegenen Boxhagener Platz, dem insgeheimen Zentrum des Viertels, begeistert an den Wochenenden die Bewohner des Kiezes und hält neben stets frischen Lebensmitteln der Region auch immer die ein oder andere Überraschung bereit. \n\nAuch für das perfekte Familienglück bietet die Warschauer Straße und der Kiez rund um den Boxhagener Platz den perfekten Schaffensort. Unzählige Kindertagesstätten, Grundschulen, Oberschulen und Gymnasien befinden sich in unmittelbarer Umgebung des Objekts und auch Läden zur Deckung des täglichen Bedarfs wie Supermärkte, Drogerien oder Einkaufszentren sind stets nur einen Schritt weit Ihres neuen Zuhauses entfernt.\nMit der perfekten Anbindung an den öffentlichen Personennahverkehr könnte das hier angebotene Objekt nicht idealer gelegen sein. Zusätzlich zu der Bundesstraße B96a verkehren direkt vor der Haustür die Tram M10, mehrere Busse als auch die U-Bahnlinie U5, welche innerhalb von 3 Minuten fußläufig zu erreichen ist und im 5-Minuten-Takt zwischen dem Alexanderplatz und Hönow, bzw. dem Tierpark Berlin pendelt.\n\n---\n\nWarschauer Straße in the popular and very dynamic district of Berlin-Friedrichshain is one of the main arteries in the east of the capital and inspires with a varied range of restaurants, trendy bars and smaller shops.\n\nThe closer surroundings of the property offer the perfect opportunity for exuberant summer evenings or spontaneous shopping trips. The regular weekly and flea market at nearby Boxhagener Platz, the secret center of the district, delights the residents of the neighborhood on weekends and always has one or two surprises in store in addition to fresh local food.\n\nWarschauer Straße and the Kiez around Boxhagener Platz also offer the perfect place for creating perfect family happiness. Countless daycare centers, elementary schools, high schools and high schools are in the immediate vicinity of the property and also shops for daily needs such as supermarkets, drugstores or shopping centers are always just a step away from your new home.\n\nWith the perfect connection to local public transport, the property offered here could not be more ideally located. In addition to the B96a federal road, the M10 tram, several buses and the U5 subway line run right outside the front door, which can be reached on foot in 3 minutes and every 5 minutes between Alexanderplatz and Hönow, or the zoo Berlin commutes.', 'ACHTUNG: Das hier angebotene Objekt wird zum 30.09.2020 bezugsfrei. \n\nATTENTION: The property offered here will be vacant on September 30, 2020. \n\n---\n\nBESICHTIGUNG: Für ein persönliches Gespräch und zur individuellen Abstimmung eines Besichtigungstermins stehen wir Ihnen gerne unter 030 27581533 persönlich zur Verfügung.\n\nVIEWING: For a personal viewing and to individually coordinate an appointment, we are happy to assist you at 030 27581533.'];;198.55;energy_consumption;C;95.09;;
2020-05-24 21:07:10.268886;Berlin;central_heating;ONE_YEAR_FREE;164338;n;n;https://pictures.immobilienscout24.de/listings/0fd97258-8068-4cb6-aefe-e6b658c904b3-1356718628.jpg/ORIG/resize/118x118%3E/extent/118x118/format/jpg/quality/80;7;12.78;40 MBit/s;telekom_layer_magenta_l;über VDSL;1880;;REGULAR;;;12.78;116226467;;no_information;n;false;MagentaZuhause L;y;Berlin;n;9;1;no_information;7.23;78;Berlin;10785;first_time_use;luxury;false;100 MBit/s;no_information;no_information;n;https://padlock.link/ioml;https://padlock.link/ml;no_information;apartment;10785;3;n;;2,active;true;Deutschland;top;100 MBit/s;wohnung_kauf;n;;;web,email,bank,music,dl-ul,game,sd,mltstr,hd,fast-ul-dl;true;001.164338;650000;profile0;4;3;true;n;showqualicontactform;n;n;Tiergarten_Tiergarten;AIB12805;3;Berlin;/expose/116226467;"['Es handelt sich um eine bzw. vier repräsentative Stuck-Residenzen im 2. Obergeschoß mit modernem Fahrstuhl im einzigartigen viergeschossigen Stadtpalais, welches im Jahre 1880 vom Maurermeister Paul Garnn und Otto Krantz errichtet wurde. \r\rDie Wohnungen wären im Sommer 2020 sofort bezugsfertig. \r\rDas Objekt wird zurzeit bis Sommer 2020 sehr umfangreich modernisiert ( neues Dach, neue Leitungen, neue Fenster, neue Elektrik etc… ) \r\rDas Objekt verfügt über viele alte originale Stilelemente und Stuckverzierungen aus dem Jahre 1880.\r\rWeitere Details teilen wir Ihnen gerne auf Nachfrage mit!', 'Eine attraktive Adresse in alter Wohnlage von Mitte / Tiergarten – fast direkt am Potsdamer Platz!', 'Unser Service für Eigentümer\rWir stehen Ihnen bei dem Verkauf Ihrer Immobilie vom Anfang bis zum fertigen Abschluss diskret und kompetent zur Verfügung. \rJeder Schritt erfolgt nach Absprache mit Ihnen. \rSie entscheiden über die Verkaufsstrategie Ihres Objektes, ob diskret und ""off-market"" oder eine qualifizierte Vermarktung in Print- sowie Onlinemedien. \rWir verfügen immer über den richtigen Käufer. \rZudem bewerten wir Ihre Immobilie kostenfrei, entsprechend dem aktuellen Marktwert.\rGerne beraten wir Sie kostenlos persönlich in unserem Büro, per Telefon oder per E-Mail!\rWir freuen uns von Ihnen zu hören!\rwww.immo-boerse.com']";;;;;;;2020
2020-05-24 21:07:10.876631;Berlin;central_heating;ONE_YEAR_FREE;164338;n;n;https://pictures.immobilienscout24.de/listings/af9d680e-c1da-49d5-9e41-408ccf4f8429-1356732492.jpg/ORIG/resize/118x118%3E/extent/118x118/format/jpg/quality/80;5;12.78;40 MBit/s;telekom_layer_magenta_l;über VDSL;1880;;REGULAR;;;12.78;116226073;;no_information;n;false;MagentaZuhause L;y;Berlin;n;9;1;no_information;7.23;65;Berlin;10785;first_time_use;sophisticated;false;100 MBit/s;no_information;no_information;y;https://padlock.link/ioml;https://padlock.link/ml;no_information;apartment;10785;2;n;;2,active;true;Deutschland;top;100 MBit/s;wohnung_kauf;n;;;web,email,bank,music,dl-ul,game,sd,mltstr,hd,fast-ul-dl;true;001.164338;549000;profile0;4;2;true;n;showqualicontactform;n;n;Tiergarten_Tiergarten;AIB12773;3;Berlin;/expose/116226073;"['Es handelt sich um eine bzw. zwei repräsentative Stuck-Residenzen im 3 Obergeschoß im einzigartigen viergeschossigen Stadtpalais, welches im Jahre 1880 vom Maurermeister Paul Garnn und Otto Krantz errichtet wurde. \r\rDie Wohnungen wären im Sommer 2020 sofort bezugsfertig. \r\rDas Objekt wird zurzeit bis Sommer 2020 umfangreich modernisiert. \r\rDas Objekt verfügt über alte originale Stilelemente und Stuckverzierungen aus dem Jahre 1880.\r\rWeitere Details teilen wir Ihnen gerne auf Nachfrage mit!', 'Eine attraktive Adresse in alter Wohnlage von Mitte / Tiergarten – fast direkt am Potsdamer Platz!', 'Unser Service für Eigentümer\rWir stehen Ihnen bei dem Verkauf Ihrer Immobilie vom Anfang bis zum fertigen Abschluss diskret und kompetent zur Verfügung. \rJeder Schritt erfolgt nach Absprache mit Ihnen. \rSie entscheiden über die Verkaufsstrategie Ihres Objektes, ob diskret und ""off-market"" oder eine qualifizierte Vermarktung in Print- sowie Onlinemedien. \rWir verfügen immer über den richtigen Käufer. \rZudem bewerten wir Ihre Immobilie kostenfrei, entsprechend dem aktuellen Marktwert.\rGerne beraten wir Sie kostenlos persönlich in unserem Büro, per Telefon oder per E-Mail!\rWir freuen uns von Ihnen zu hören!\rwww.immo-boerse.com']";;;;;;;2020
2020-05-24 21:07:11.314739;Berlin;no_information;ONE_YEAR_FREE;17532864;n;n;https://pictures.immobilienscout24.de/listings/eea57462-902e-4092-8f8e-a3e1ea0b533d-1367280547.png/ORIG/resize/118x118%3E/extent/118x118/format/jpg/quality/80;15;12.24;40 MBit/s;telekom_layer_magenta_l;über VDSL;1900;true;REGULAR;;;12.24;116205137;;geothermal;n;false;MagentaZuhause L;y;Berlin;n;9;1;4;6.53;97;Berlin;10829;no_information;no_information;false;100 MBit/s;no_information;"Leuthener Stra&szlig;e";n;https://padlock.link/ioml;https://padlock.link/ml;Leuthener_Straße;apartment;10829;2;n;;2,active;true;Deutschland;top;100 MBit/s;wohnung_kauf;n;2;;web,email,bank,music,dl-ul,game,sd,mltstr,hd,fast-ul-dl;true;009.d53f6f16-60ab-4c52-9aaa-3b9f9fcb1cfc;519000;profile0;;2;true;n;showqualicontactform;n;n;Schöneberg_Schöneberg;116205137;4;Berlin;/expose/116205137;"['Die leerstehende und sanierungsbedürftige Wohnung befindet sich im 2. OG eines typisch Berliner Altbaus in Berlin-Schöneberg. Die zwei Räume sind mit wunderschönem Stuck an der Decke verziert und über eine Flügeltür miteinander verbunden. Alle Räume sind über einen langen Flur zugänglich. \r\n', 'Hier können Sie Ihrer Fantasie freien lauf lassen und alles nach Ihren Wünschen und Vorstellungen gestalten. Die Wohnung steht leer und wurde entkernt und ist somit sanierungsbedürftig. Die Fenster haben den typische Altbaucharakter aus Holzrahmen und sind zur Straße hin doppelt verglast. \r\n', 'Die Lage der Wohnung befindet sich in einer verkehrsberuhigten Straße unweit des Bahnhofes ""Südkreuz"" in Berlin-Schöneberg. Neben dem Bahnhof ist die Stadtautobahn ebenfalls in wenigen Minuten zu erreichen. \r\nDer Nah- und Fernverkehr ist in dieser Lage sehr gut ausgeprägt. Vielfältige Bars und Cafés sowie Geschäfte des alltäglichen Bedarfs sind fußläufig gut erreichbar. Der anliegende Nachbarbezirk Tempelhof bietet mit seinem Tempelhofer Feld in 10 Autominuten eine große Fläche für Aktion, Entspannung und ausgedehnte Spaziergänge. ']";;113.64;energy_consumption;;150;80;
2020-05-24 21:07:11.820995;Berlin;district_heating;;17069422;n;y;https://pictures.immobilienscout24.de/listings/90ba69c9-13c4-426c-8d63-6ea57dbe27d5-1354814237.jpeg/ORIG/resize/118x118%3E/extent/118x118/format/jpg/quality/80;1;11.3;;;;1905;;;;;11.3;116237398;;;n;false;;y;Berlin;y;8;1;19;5.73;94;Berlin;10587;well_kept;simple;false;;no_information;Einsteinufer 55/Ecke Abbestrasse;y;;;Einsteinufer_55/Ecke_Abbestrasse;apartment;10587;3;n;;2,active;;Deutschland;standard;;wohnung_kauf;n;2;;;false;002.01007821175;500000;profile0;6;3;true;y;;n;n;Charlottenburg_Charlottenburg;Etab19;4;Berlin;/expose/116237398;['Objektbeschreibung\nDie großzügige 3-Zimmerwohnung befindet sich im 2. Obergeschoss eines Mehrfamilienhauses aus dem Jahr 1905. Lichtdurchflutete Räume verleihen der Eigentumswohnung eine freundliche Atmosphäre, in der man sich gerne aufhält. Der Balkon zum Süd-Osten hat den Blick zum Landwehrufer. Die Badezimmer hat großes Fenster und ist mit einer Badewanne und Dusche ausgestattet. Hier haben Sie auch den Platz für die Waschmaschine und den Trockner.\nWenn Sie wünschen das die Wohnung nach Ihren Wünschen umgebaut wird, haben wir eine solide Baufirma direkt im Haus am Einsteinufer 57! \nWir freuen uns über Ihre Nachrichten!\n\nEine Besichtigung ist am Samstag, den 29.02.2020 um 14 Uhr-15 Uhr möglich!', 'Balkon\nFernwärmeheizung\nAufzug\nTop Lage\nTop Haus!', 'Am Einsteinufer 55/Ecke Abbestrasse 19, 10587 Berlin.\nUnweit von Ernst-Reuter-Platz.'];;360;energy_consumption;;;94;2011
2020-05-24 21:07:12.190496;Berlin;combined_heat_and_power_plant;ONE_YEAR_FREE;1312;n;n;https://pictures.immobilienscout24.de/listings/ff9d84c9-f0e9-4dfe-ba2c-ca1943cd91ad-1363329928.jpg/ORIG/resize/118x118%3E/extent/118x118/format/jpg/quality/80;9;8.54;40 MBit/s;telekom_layer_magenta_l;über VDSL;1909;;REGULAR;;;8.54;116236777;;combined_heat_and_power_fossil_fuels;y;false;MagentaZuhause L;y;Berlin;y;3;1;2;5.03;54.63;Berlin;13125;refurbished;sophisticated;false;100 MBit/s;no_information;"Zepernicker Stra&szlig;e";n;https://padlock.link/ioml;https://padlock.link/ml;Zepernicker_Straße;roof_storey;13125;1;n;315;2,active;true;Deutschland;standard;100 MBit/s;wohnung_kauf;n;3;;web,email,bank,music,dl-ul,game,sd,mltstr,hd,fast-ul-dl;true;001.1312;148500;profile0;3;1;true;n;showqualicontactform;n;n;Buch_Pankow;LPWE71_PM_d;2;Berlin;/expose/116236777;"['Historie neu erleben: Der Ludwigpark, eine 32.000 m² große Parkanlage mit sechzehn Häusern wurde ca. 1908/1909 in Berlin-Pankow (OT Buch) nach den Plänen des Stadtbaudirektors Ludwig Hoffmann errichtet. Es ist eines der besonderen Denkmäler in Berlin Buch. Die Häuser des  Ludwigparks wurden in den Jahren 2008/2009 umfangreich kernsaniert, modernisiert und in Eigentumswohnungen umgewandelt.\n\nAuszug aus der Modernisierung 2008/2009: \n\n- neue Zentralheizung\n- neue Elektroleitungen \n- neue Sanitärinstallationen \n- neue Steig- und Fallrohre \n- neuer Fußbodenaufbau \n- restaurierte Doppelkastenfenster \n- neue große, freischwebende Balkone\n- komplett sanierte Fassade \n- komplett saniertes Dach \n- komplett sanierter Keller \n- sanierte Treppenhäuser \n- neu gestaltete Parkanlagen mit Sitzgelegenheiten \n- Fahrrad Abstellräume \n- neu angelegte außen liegende Parkplätze \n- Baubegleitung und Abnahme seinerzeit durch den TÜV', 'Die im Mansardengeschoss gelegene Wohnung im Haus „Frederike"" bietet angenehmen Wohnkomfort. Die hohen Decken und Fenster vermitteln ein behagliches Raumgefühl. Das großzügige Appartement mit abgeteiltem Schlafbereich bietet ausreichend Platz, auch für 2 Personen. Eine moderne Ausstattung (Duschbad mit Waschmaschinenanschluss) und ein direkter Ausblick auf eine Parkanlage machen das Wohnen zu einem echten Erlebnis. Die Wohnung ist lichtdurchflutet, beinhaltet eine Einbauküchenzeile und liegt absolut ruhig. \n\nEin Kellerraum ist der Wohnung zugeordnet. \n\nDie Wohnung ist ab 01.08.2020 bezugsfrei!', 'Berlin Buch - die Gesundheitsstadt - heute Ortsteil von Berlins einwohnerreichstem Bezirk Pankow, bietet nicht nur attraktive Arbeitsplätze im Gesundheitsbereich, sondern auch Erholung und entspanntes Leben abseits der Großstadthektik. \n\nExzellente Forschung, maximale und spezialisierte Gesundheitsversorgung, wissensbasierte Wirtschaft und vielfältige Aus- und Weiterbildung in der Gesundheitswirtschaft sind Markenzeichen von Buch. Mit seiner klaren Ausrichtung  auf Biomedizin hat der Gesundheitsstandort ein herausragendes Innovations- und Wachstumspotential. Innerhalb der Innovationsstrategie der Hauptstadtregion ist Berlin-Buch als Zukunftsort ausgewiesen.\n\nDie Bucher schätzen die grüne und ruhige Lage ihres Ortes. Mit Kind und Kegel belagern sie im Sommer den Schlosspark, der von einem früheren Bucher Gutsherren angelegt wurde und durch den das Flüsschen Panke fließt. Die angrenzende barocke Schlosskirche ist ein Kleinod von Berlin.\n\nAuf dem denkmalgeschützten Stadtgut Berlin-Buch findet man Ateliers von Berliner Künstlern, das Restaurant ""Zum Speicher"", eine Feste-Scheune für Konzerte und Theater sowie ein kleines Hotel. In der nahe gelegenen Schlosspark-Passage lässt es sich angenehm einkaufen. Der Bucher Forst, der zum Naturpark Barnim gehört, bietet Erholung direkt vor der Haustür. Seit den 90er Jahren entwickelte sich aus dem historischen Krankenhauskomplex der weltweit anerkannte Wissenschaftsstandort Berlin-Buch mit circa 4.800 Beschäftigten. Damit ist Buch einer der wichtigsten Gesundheits-, Wissenschafts- und Technologiestandorte in Berlin-Brandenburg.\nFußläufig entfernt vom Ludwigpark ist das Bucher Zentrum und die Schlossparkpassagen mit Supermärkten (Kaufland, Rewe) und vielen Geschäften für den täglichen Bedarf. \nSiehe auch: www.buch.de\n\nInnerhalb von 21 Minuten erreicht die S-Bahn bequem den Bahnhof Friedrichstraße in Berlins Mitte.\n\nÜber die B2 oder die A10 gelangt man auch mit dem Auto schnell und bequem ins Zentrum und in die anderen Berliner Bezirke.', 'Aktuelles Hausgeld:           236,00 €/mtl.\nInstandhaltungsrücklage:     32,00 €/mtl.\n(Angaben gemäß Wirtschaftsplan 2020)\n\nFür Rückfragen und einen Besichtigungstermin stehen wir Ihnen gerne nach Vereinbarung zur Verfügung. Ihr Ansprechpartner, Peter Michalak, ist auch am Wochenende telefonisch mobil erreichbar: 0177-563 82 11.\n\nWir bitten um Verständnis, dass wir aus Diskretion keine Innenaufnahmen der Wohnung  veröffentlichen.']";;268;energy_consumption;;102.5;;2009
2020-05-24 21:07:12.538102;Berlin;central_heating;ONE_YEAR_FREE;16785385;n;n;https://pictures.immobilienscout24.de/listings/84a3a3d6-f43c-48b9-b44b-383e2625adac-1367984917.jpg/ORIG/resize/118x118%3E/extent/118x118/format/jpg/quality/80;11;11.48;40 MBit/s;telekom_layer_magenta_l;über VDSL;1952;;REGULAR;disabled;;11.48;116235422;;no_information;n;false;MagentaZuhause L;y;Berlin;n;5;2;no_information;7.14;60.15;Berlin;10243;no_information;normal;false;100 MBit/s;no_information;no_information;n;https://padlock.link/ioml;https://padlock.link/ml;no_information;apartment;10243;2;n;;2,active;true;Deutschland;top;100 MBit/s;wohnung_kauf;y;2;;web,email,bank,music,dl-ul,game,sd,mltstr,hd,fast-ul-dl;true;002.01007573808;234500;profile0;7;2;true;n;showqualicontactform;n;n;Friedrichshain_Friedrichshain;KMA_131-12;2;Berlin;/expose/116235422;['Attraktive Wohnung in einem Haus der weit über die Stadt- und Landesgrenzen bekannten Wohnhäuser der ehemaligen Stalinallee. \n\nDie Gebäude stehen unter Denkmalschutz. \n\nDiese auch als „Zuckerbäckerstil“ bezeichneten Bauten des Sozialistischen Klassizismus stammen aus den 1950er Jahren.', 'Die Wohnung ist aufgrund der U-Bahnhöfe Weberwiese, Frankfurter Tor, S-Bhf. Ostbahnhof und diverser Buslinien sehr verkehrsgünstig gelegen. \n\nDiverse Einkaufsmöglichkeiten, sowie Kultureinrichtungen (Ausstellungen, Bars, Kabarett) sind vorhanden.', 'Die Wohnung ist vermietet.\n\nDie zur Zeit gezahlte Nettokaltmiete liegt bei ca. 5.589,- Euro im Jahr.\n\nDas Hausgeld für 2020 beträgt 171,00 € im Monat, inkl. der Instandsetzungsrücklage in Höhe von 27,00 €.\n\nWeitere Informationen erhalten Sie gerne auf Anfrage, nach Bestätigung der Widerrufsbelehrung zum Maklervertrag.\n\nBitte beachten Sie, dass die Wohnung vermietet und bewohnt ist. Besichtigungen können deshalb nur in Absprache mit den Mietern erfolgen. Hinterlassen Sie uns freundlicherweise Ihre Kontaktdaten und wir informieren Sie, wann eine Innenbesichtigung möglich ist.'];;171;energy_consumption;;91;;
