2020-05-24 20:59:08.273208;Berlin;central_heating;16123617;n;y;https://pictures.immobilienscout24.de/listings/a8e64566-eebe-49dc-b254-d960914d8ed0-1362988160.jpg/ORIG/resize/118x118%3E/extent/118x118/format/jpg/quality/80;9;11.12;2018;;disabled;72409;11.12;113769273;n;true;y;Berlin;y;6;9;no_information;6.14;34.2;Berlin;10627;first_time_use;sophisticated;false;no_information;no_information;y;no_information;apartment;10627;1;n;;2,active;Deutschland;schaufenster;wohnung_kauf;n;2;true;false;002.01006554579;298000;profile0;6;1;true;y;showqualicontactform;y;n;Charlottenburg_Charlottenburg;DC-BER5292_3.10;1;Berlin;/expose/113769273;['Das neue 6-geschossige Wohnensemble CARTE BLANCHE in Berlin-Charlottenburg bietet 80 Wohneinheiten und eine Gewerbeeinheit nebst Tiefgarage. Die zwischen Schillerstraße und Rückertstraße entstehende Eckbebauung verbindet eine klassisch-elegante Formensprache mit nachgefragten Wohnformen. Dazu gehören 1- bis 2-Zimmer-Mikro-Apartments sowie 3-Zimmer-Einheiten bis hin zur Penthouse-Wohnung mit 4 Zimmern. Hier findet sich für die unterschiedlichen Ansprüche von Singles und Studenten, Paaren und Familien genau die richtige Lösung. Mit Dachgarten, der Dachterrasse und dem begrünten Innenhof entsteht zusätzlicher Freiraum zur Entfaltung, während ein Concierge-Service Zeit für die wichtigen Dinge des Lebens spart. Eine Teeküche steht für die Hausgemeinschaft im Innenhofbereich zur Verfügung.\nAuch wenn sich die Wohnungen in der Größe unterscheiden, folgt die Ausstattung überall dem gleichen modernen Standard. In den Wohnräumen und Dielen ist Echtholz-Parkett verlegt. In allen Wohnräumen sorgt eine Fußbodenheizung für behagliche Temperaturen und schafft durch den Verzicht auf Heizkörper mehr Platz und Flexibilität bei der Möblierung. Im Zusammenspiel mit dem außenliegenden, elektrisch betriebenen Sonnenschutz ist ganzjährig eine angenehme Temperierung sichergestellt. In den Bädern komplettieren Fliesen von Villeroy & Boch, Sanitärkeramik von Keramag und Armaturen von Grohe die moderne Ausstattung der Wohnungen.', '• PROVISIONSFREIES ANGEBOT für den Käufer\n• 1 - 4 Zimmer-Wohnungen mit Größen von ca. 30 m² bis ca. 125 m² \n• Erdgeschosswohnungen zum Innenhof mit Privatgarten\n• Hochwertige Armaturen\n• Parkettfußboden in der Holzart Eiche\n• Fußbodenheizung \n• Deckenhöhe ca. 2,77 - 2,87 Meter\n• Teilweise Markisen oder Markisoletten als Sonnenschutz\n• Fast jede Wohnung mit Balkon oder Terrasse und eine Gemeinschafts-Dachterrasse\n• Barrierefreie Zugänge\n• Räumlichkeiten für den Concierge-Service\n• Videogegensprechanlage \n• Personenaufzug\n• Raum zur gemeinschaftlichen Nutzung im EG mit kleiner Küche und WC\n• Keller- & Kinderwagenräume im Untergeschoss\n• 160 Fahrradstellplätze\n• Tiefgarage mit 40 PKW-Stellplätzen (optional, Preise ab 38.000 EUR), auf Wunsch mit Elektroanschluss (kostenpflichtig)', 'Heute ist Charlottenburg eines der begehrtesten Viertel Berlins. Die Mietpreise, gerade in Verbindung mit kompakten Wohnungsgrößen, sind auf hohem Niveau stabil, der Weg in die Natur ist dank des nahen Grunewalds und des Großen Tiergartens nicht weit. Mit dem Ku’damm führt einer der bekanntesten Shopping-Boulevards der Welt durch das Viertel, auf dem Touristen neben Einheimischen flanieren. Unbeirrt von diesem Trubel entfaltet sich in den Seitenstraßen mit ihren großbürgerlichen Bauten eine ruhige Atmosphäre. Rund um die Kantstraße und den Savignyplatz locken unzählige Restaurants mit kulinarischer Vielfalt. Es ist diese Mischung aus Gelassenheit und vibrierendem Leben, die den besonderen Charme von Charlottenburg ausmacht.\nFür den Berliner hat sein Kiez nichts mit Orts- oder Verwaltungsgrenzen zu tun, sondern mit einer Umgebung, in der sich alles findet, was zum Leben dazugehört – zum guten Leben, wohlgemerkt. CARTE BLANCHE hat mit seiner Lage ungleich mehr zu bieten. Nur einen Steinwurf entfernt liegen die Wilmersdorfer Straße und die Wilmersdorfer Arcaden mit ihren vielen Geschäften. Eine umfassende Revitalisierung der Wilmersdorfer Arcaden ab Mitte 2018 bringt mit Maßnahmen wie einem neuen Design- und Gastronomiekonzept den Erlebnischarakter noch stärker zur Geltung. Mehrere Restaurants in der direkten Umgebung, von der italienischen bis zur veganen Küche von Attila Hildmann, bieten genug Auswahl, um den Abend nach einem anstrengenden Arbeitstag entspannt ausklingen zu lassen.', 'Weitere Informationen sowie ein Projektfilm finden Sie unter: www.carteblanche-berlin.de\n\n+++Haftungsausschuss+++\nAlle Angaben dienen nur der Information und stellen kein vertragliches\nAngebot dar. Die in den Grundrissen und Visualisierungen abgebildeten Ausstattungsgegenstände\n(Küchen, Möbel etc.) sind nicht im Leistungsumfang enthalten. Eine Gewähr\nfür die Richtigkeit und Vollständigkeit der Informationen bzw. für die Maßstäblichkeit\nder Abbildungen wird nicht übernommen. Das Bildmaterial dient lediglich der\nvorläufigen Illustration des Vorhabens und möglicher Ausstattungsvarianten, die von\ndem angebotenen Leistungsumfang abweichen können. Jegliche Abweichung in einem\nspäteren Planungsstadium bleibt ausdrücklich vorbehalten. Maßgeblich sind allein die\nAngaben im Kaufvertrag.'];district_heating;90.75;energy_required;77;;;;;;;;C;;;;;;;;;;;
2020-05-24 20:59:08.699624;Berlin;floor_heating;15347;y;y;https://pictures.immobilienscout24.de/listings/7e915e62-c26e-4a7f-852d-598c688deac0-1362976549.jpg/ORIG/resize/118x118%3E/extent/118x118/format/jpg/quality/80;12;10.7;2020;true;disabled;75109;10.7;116237382;n;true;n;Berlin;y;8;9;31/33;5.51;115;Berlin;10318;first_time_use;sophisticated;false;underground_garage;Blockdammweg;y;Blockdammweg;terraced_flat;10318;5;n;7000200;2,active;Deutschland;premium;wohnung_kauf;n;0;true;false;001.15347;499900;profile0;3;5;true;n;showqualicontactform;n;n;Karlshorst_Lichtenberg;7000200-04.D.46;5;Berlin;/expose/116237382;['Eine Wohnung für die große Familie. Die traumhafte, neue Eigentumswohnung befindet sich im Erdgeschoss und beeindruckt mit fünf Zimmern und Terrasse.\n\nSie haben drei Kinder und brauchen vier Schlafzimmer? Kein Problem mit dieser fünf Zimmer-Wohnung kommt jeder Ihrer Kinder unter. Mit den zwei Bädern können auch alle abends rechtzeitg die Zähne putzen. Auch für die Waschmaschine haben Ihren extra Kämmerchen. Die Küche ist so groß das Sie die Kinder bekochen können während im gleichen Raum die Hausaufgaben gemacht werden. Und wenn Lisa oder Fritz noch Freunde mitbringen ist das auch kein Problem, denn am großen Esstisch findet jeder einen Platz. Die Terrasse macht alles perfekt. Großes Plus der Wohnung ist ,dass sowohl Wanne als auch eine bodengleiche Dusche vorhanden sind.', '- Terrasse\n- Abstellraum\n- 2 Bäder\n- Fußbodenheizung\n- gefliestes Bad\n- Keller\n- Fahrradkeller\n- Aufzug', 'Ihre Eigentumswohnung ist einzigartig und doch wichtiger Teil des Ganzen. Für die Parkstadt haben sich vier renommierte\nArchitekturbüros ins Zeug gelegt und sich bei ihren Planungen stark an der Rationalen Architektur orientiert. Denn die sieben\nWohnblöcke und sieben Stadtvillen spielen mit Fassadenflächen und Struktur, mit Backstein und farbigem Putz. Doch eine rationale Stadt ist unter Experten vor allem eines: eine schöne Stadt.', 'Besuchen Sie uns im Infobüro im Blockdammweg 30 in 10318 Berlin.\n\nDi – Do\t14:00 – 16:00 Uhr\nSa + So\t13:00 – 16:00 Uhr\n\nIhre und unsere Gesundheit ist uns wichtig! Für die kommende Zeit haben wir für die Vor-Ort-Beratungen viele Gesundheitsvorkehrungen getroffen und bitten um Beachtung und Verständnis. Informieren Sie sich bitte zu unseren Maßnahmen auf bonava.de/bleib-gesund'];;;;;;;;;;;;;;;;;;;;;;;
2020-05-24 20:59:09.071374;Berlin;district_heating;15349709;n;n;https://pictures.immobilienscout24.de/listings/59d2c633-116d-49a1-8bb1-c325c5df2c31-1361767973.jpg/ORIG/resize/118x118%3E/extent/118x118/format/jpg/quality/80;14;14.32;1908;;disabled;;14.32;117069415;n;false;n;Berlin;y;5;1;8/9;8.36;52.66;Berlin;13353;no_information;no_information;false;no_information;"Br&uuml;sseler Stra&szlig;e";n;Brüsseler_Straße;apartment;13353;2;n;;2,active;Deutschland;standard;wohnung_kauf;y;4;;true;001.15297510;200108;profile0;5;2;true;n;showqualicontactform;n;n;Wedding_Wedding;BS9 WE 71;2;Berlin;/expose/117069415;['Im südlichen Teil Weddings - im Brüsseler Kiez - befinden sich die zur Eigennutzung oder als Kapitalanlage angebotenen 40 Wohnungen. Der Altbau liegt in einer eher ruhigen Lage in der Brüsseler Straße, von der aus das pulsierende Leben Berlins schnell erreicht werden kann.\r\nDas 1908 erbaute Haus formiert sich aus Vorderhaus, Seitenflügeln und Hinterhaus, fast quadratisch um einen begrünten Innenhof. Es bietet in insgesamt drei Gewerbe- und 73 Wohneinheiten schöne Stadtwohnungen und großzügige Arbeitsräume. Die Wohnungen überzeugen durch eine attraktive und durchdachte Raumaufteilung. Die Größen im Erdgeschoss bis zum vierten Obergeschoss variieren zwischen 36 m² und 80 m². Abgesehen von einer Gewerbeeinheit im Erdgeschoss mit 4 Räumen und einer Dachgeschoss-Wohnung mit 2,5 Zimmern, handelt es sich bei den verfügbaren Einheiten ausschließlich um 1- bis 2-Zimmer-Wohnungen. Die Dachgeschosswohnungen sind großzügig gestaltet und bieten mit 76 m² bis 103 m² attraktive Wohnungsgrößen und große Dachterrassen, die in der warmen Jahreszeit zum Aufenthalt im Freien mit einem Ausblick auf die städtische Umgebung einladen. \r\nDas Haus ist ein typischer Berliner Altbau, bei dem zahlreiche bauzeitliche Elemente bewahrt worden sind. Im vorderen Treppenhaus finden sich Buntglasfenster, dekorativ verzierte Treppengeländer und Türstöcke, Stuck an den Decken sowie Kassettentüren zeigen die Schönheit und die Geschichte dieses Gebäudes.\r\n\r\nMit dem Kauf einer Eigentumswohnung in Berlin-Wedding entscheiden Sie sich für eine attraktive Anlage in einer zunehmend beliebten Lage oder für die eigenen vier Wände in einer vielfältigen und abwechslungsreichen Nachbarschaft. \r\n\r\nWillkommen im „Colours of Wedding“.', '- Einheit Nr. 71\r\n- 4.OG \r\n- 2 Zimmer \r\n- ca. 52 m² \r\n- Kellerabteil\r\n- vermietet', 'Der zentral gelegene Wedding ist in all den Jahren ein ursprünglicher Teil Berlins geblieben, der sich nie verbogen hat. Bis heute versprüht der Ortsteil den Charme eines gewachsenen und lebendigen Wohnviertels, in dem man sowohl urige Berliner Eckkneipen als auch angesagte Cafés findet. Bei aller Beständigkeit ist hier ein deutlicher Wandel spürbar, der alte Strukturen reizvoll ergänzt, statt sie zu zerstören. Es ist ein aufstrebender, lebendiger Teil der Stadt, der immer mehr Menschen anzieht.\r\nNeben den großen grünen Parkanlagen, wie dem Volkspark Rehberge, ist der heutige Wedding vor allem bunt. Mittlerweile hat sich hier eine lebendige Kunstszene etabliert. Knapp 13.000 Studierende sind an der nur 500 Meter entfernten Beuth Hochschule für Technik Berlin eingeschrieben und verleihen dem Bezirk kulturell und wirtschaftlich eine zusätzliche Dynamik. Auch der Charité Campus Virchow-Klinikum ist weniger als einen Kilometer vom Objekt entfernt. \r\nDie Brüsseler Straße zählt zu den ruhigeren Lagen im Kiez, ist aber zugleich gut an die Hauptverkehrsadern, wie der Seestraße und der Einkaufsmeile Müllerstraße, angebunden. In nur wenigen hundert Metern Entfernung befinden sich der U-Bahnhof  und mehrere Tram- und Buslinien. In nur 10 Minuten gelangt man bis zur Friedrichstraße im historischen Zentrum Berlins. Hier wird entspanntes Wohnen mit dem Erleben des quirligen und spannenden Berlins kombiniert. Dieser Kontrast zeichnet das Leben in der Brüsseler Straße 8 und 9 aus und macht es interessant, vielfältig und lebenswert. \r\n', 'Die Wohnungen werden im Ist-Zustand verkauft.\r\nDas Objekt liegt in einem Milieuschutzgebiet.'];geothermal;184.48;energy_consumption;106;;ONE_YEAR_FREE;40 MBit/s;telekom_layer_magenta_l;über VDSL;REGULAR;MagentaZuhause L;;100 MBit/s;https://padlock.link/ioml;https://padlock.link/ml;true;100 MBit/s;web,email,bank,music,dl-ul,game,sd,mltstr,hd,fast-ul-dl;;;;;
2020-05-24 20:59:09.578139;Berlin;central_heating;216473;n;y;https://pictures.immobilienscout24.de/listings/bdef9f90-d91c-4a38-871f-880098a02ca2-1361615893.jpg/ORIG/resize/118x118%3E/extent/118x118/format/jpg/quality/80;16;10.94;1958;;disabled;;10.94;117054104;y;false;y;Berlin;y;7;2;no_information;5.34;106;Berlin;12247;well_kept;no_information;false;garage;no_information;n;no_information;maisonette;12247;4;n;27122;2,active;Deutschland;premium;wohnung_kauf;n;1;;;001.216473;375000;profile0;3;4;true;n;showqualicontactform;n;n;Lankwitz_Steglitz;117054104;5;Berlin;/expose/117054104;"['Diese Maisonettewohnung liegt in den ersten beiden Obergeschossen einer äußerst gepflegten und vielfach von Eigentümern bewohnten Eigentumswohnanlage in Berlin-Lankwitz, nur ca. 150m entfernt vom Gemeindepark Lankwitz.\n\nEs wurden seinerzeit zwei 2-Zimmer-Wohnungen zusammengelegt und mit einer Eichen-Massivholztreppe miteinander verbunden. Somit verfügt die Wohnung praktischerweise über zwei Bäder, zwei Balkone, eine kleine und offene, zur Diele hin ausgerichteten Küche und vier vollwertige und separat begehbare Zimmer.\nFerner ist die Wohnung mit Fliesen- und Parkettboden ausgestattet.\n\nDank der überdurchschnittlichen Raumhöhe von ca. 2,65m, erhöht sich hierdurch der Wohnkomfort deutlich im Vergleich zu einem „normalen“ Neubau mit einer Deckenhöhe von ca. 2,50m.\n\nZur Ausstattung gehört eine „Dassbach“-Einbauküche mit Markengeräten von „Küppersbusch“, „Bosch“ und „Stiebel Eltron“ ein Wannenbad mit Tageslicht im zweiten und ein Gäste-WC mit Waschmaschinenanschluss und bereits vorinstalliertem Bodenanschluss unter den Fliesen für eine Dusche im ersten Obergeschoss, ebenfalls tagesbelichtet.\n\nEin weiterer Vorteil der Zusammenlegung zweier Wohnungen: Es gehören auch zwei nebeneinanderliegende Keller dazu.\n\nDie Wohnanlage selbst befindet sich in einem hervorragenden Zustand; es gibt keinen Sanierungsstau und die Heizungsanlage wurde 2018/19 erneuert (Umstellung auf Gas).', 'Abgerundet wird dieses Angebot durch die Möglichkeit, eine Einzelgarage auf dem Grundstück zu einem Preis von € 20.000,00 mit zu erwerben.']";gas;351.63;energy_consumption;113;true;;;;;;;NO_INFORMATION;;;;;;;;1;;;
2020-05-24 20:59:10.094730;Berlin;self_contained_central_heating;15393209;n;n;https://pictures.immobilienscout24.de/listings/cd44f4a1-c7b9-4436-9611-c7d3abdb2e43-1361733992.jpg/ORIG/resize/118x118%3E/extent/118x118/format/jpg/quality/80;9;10.5;1897;;disabled;;10.5;117065908;n;true;y;Berlin;y;8;1;no_information;6.67;97;Berlin;13086;well_kept;normal;false;no_information;no_information;n;no_information;apartment;13086;4;n;;2,active;Deutschland;top;wohnung_kauf;n;;;true;002.01000748941;429000;profile0;4;4;true;y;showqualicontactform;n;n;Weißensee_Weißensee;20 071 012;4;Berlin;/expose/117065908;"['Sie suchen eine lichtdurchflutete Vier-Zimmer-Wohnung nahe dem Antonplatz für Ihre Familie? - Dann haben Sie hier mit ca. 97m² Ihr neues Zuhause gefunden.\n\nDer große Eingangsbereich mit der anschließenden offenen Wohnküche und der Fensterfront zum Innenhof mit Südostausrichtung sind das Highlight dieser Wohnung. Desweiteren besteht hier die Möglichkeit des Anbaus eines Balkons.\nDer Eingangsbereich kann auch zu einem kleineren Flur und separatem Zimmer umgestaltet werden.\n\nDas Schlafzimmer mit eingebautem Schrank, das Wohnzimmer, das Kinderzimmer sowie das Bad mit Wanne und Dusche lassen ein großzügiges Wohngefühl entstehen.\nAlle Zimmer sind mit Parkett und überwiegend Schiebetüren ausgestattet. Die Fenster mit abschließbaren Griffen bieten Ihnen Sicherheit.\n\nEin Keller für Abstellzwecke steht Ihnen zur Verfügung.\n\nDiese gepflegte Anlage mit kleinem Garten besteht aus Vorderhaus und Seitenflügel mit insgesamt 17 Wohneinheiten. Sanierungs- und Modernisierungsarbeiten wurden regelmäßíg ausgeführt. Die letzte Hauptsanierung der Wohnung fand 2009 statt.\n\nDas Wohngeld beträgt 281,00 EUR - darin beinhaltet sind 71,00 EUR Instandhaltungsrücklage.', '- Parkett-Böden\n\n- Fenster Isoglas (Kunststoff) abschließbar\n\n- Schiebetüren\n\n- Einbauschrank im Schlafzimmer\n\n- Badezimmer mit Wanne, Dusche und Fenster\n\n- Gastherme inkl. Warmwasser (Therme ""Bosch- Junkers"" von 2018)', 'Der Weißenseeer Kiez bietet zahlreiche kulturelle Angebote wie die Brotfabrik, das Kino Toni am Antonplatz, das ehemalige Stummfilmkino Delphi und die Freilichtbühne Weißensee. Das ruhige Wohngebiet Weißensee erstreckt sich rund um den gleichnamigen See, der mit dem Strandbad Weißensee im Sommer zahlreiche Badegäste anzieht. Südlich des Sees liegt der Jüdische Friedhof Berlin-Weißensee mit Gedenkstätten.\n\nEine Vielzahl von Einkaufsmöglichkeiten, Restaurants und Galerien sowie Kitas und Spielplätze, Grundschulen und Gymnasien sind fußläufig zu erreichen - eine gute Anbindung an alle öffentlichen Verkehrsmittel runden das Angebot ab:\nDie in unmittelbarer Nähe abfahrende Straßenbahn bringt einen nicht nur schnell zum Prenzlauer Berg, sondern auch flott zum S-Bahn-Ring und an den nur 4 km entfernten Alexanderplatz.\nDer beliebte und bekannte Antonplatz liegt um die Ecke ca. 300 m entfernt. Von hier aus ist eine optimale Anbindung an die öffentlichen Verkehrsmittel gegeben (Tram M4, M12, M13). Bis zum S-Bahnhof Greifswalder Straße (Ringbahn) sind es nur wenige Haltestellen.', 'GELDWÄSCHE: Als Immobilienmaklerunternehmen ist die von Poll Immobilien GmbH nach § 2 Abs. 1 Nr. 14 und § 10 Abs. 3 Geldwäschegesetz (GwG) dazu verpflichtet, bei der Begründung einer Geschäftsbeziehung die Identität des Vertragspartners festzustellen und zu überprüfen. Hierzu ist es erforderlich, dass wir nach § 11 GwG die relevanten Daten Ihres Personalausweises festhalten (wenn Sie als natürliche Person handeln) – beispielsweise mittels einer Kopie. Bei einer juristischen Person benötigen wir eine Kopie des Handelsregisterauszugs, aus welchem der wirtschaftlich Berechtigte hervorgeht. Das Geldwäschegesetz sieht vor, dass der Makler die Kopien bzw. Unterlagen fünf Jahre aufbewahren muss.\nPROVISIONSHINWEIS: Mit der Anfrage bei und durch Inanspruchnahme der Dienstleistung der Firma von Poll Immobilien GmbH, wird ein Maklervertrag geschlossen. Sofern es durch die Tätigkeit der Firma VON POLL IMMOBILIEN GmbH zu einem wirksamen Hauptvertrag mit der Eigentümerseite kommt, hat der Interessent bei Abschluss\n- eines MIETVERTRAGS keine Provision/Maklercourtage an die von Poll Immobilien GmbH zu zahlen.\n- eines KAUFVERTRAGS die ortsübliche Provision/Maklercourtage an die von Poll Immobilien GmbH gegen Rechnung zu zahlen. \nHAFTUNG: Wir weisen darauf hin, dass die von uns weitergegebenen Objektinformationen, Unterlagen, Pläne etc. vom Verkäufer bzw. Vermieter stammen. Eine Haftung für die Richtigkeit oder Vollständigkeit der Angaben übernehmen wir daher nicht. Es obliegt daher unseren Kunden, die darin enthaltenen Objektinformationen und Angaben auf ihre Richtigkeit hin zu überprüfen. Alle Immobilienangebote sind freibleibend und vorbehaltlich Irrtümer, Zwischenverkauf- und Vermietung oder sonstiger Zwischenverwertung.\n\nUNSER SERVICE FÜR SIE ALS EIGENTÜMER: \nPlanen Sie den Verkauf oder die Vermietung Ihrer Immobilie, so ist es für Sie wichtig, deren Marktwert zu kennen. Lassen Sie kostenfrei und unverbindlich den aktuellen Wert Ihrer Immobilie professionell durch einen unserer Immobilienspezialisten einschätzen. Unser bundesweites und internationales Netzwerk ermöglicht es uns, Verkäufer bzw. Vermieter und Interessenten bestmöglich zusammenzuführen.']";gas;281;energy_consumption;135.8;;ONE_YEAR_FREE;40 MBit/s;telekom_layer_magenta_l;über VDSL;REGULAR;MagentaZuhause L;E;100 MBit/s;https://padlock.link/ioml;https://padlock.link/ml;true;100 MBit/s;web,email,bank,music,dl-ul,game,sd,mltstr,hd,fast-ul-dl;;;;;2019
2020-05-24 20:59:10.485389;Berlin;central_heating;18052783;n;n;https://pictures.immobilienscout24.de/listings/d6857049-d277-4a23-8b13-0445040820a5-1365039134.jpg/ORIG/resize/118x118%3E/extent/118x118/format/jpg/quality/80;7;11.16;1896;;;;11.16;109298331;n;false;n;Berlin;n;6;1;49;6.38;47.36;Berlin;10589;well_kept;normal;false;no_information;Kaiserin-Augusta-Allee;n;Kaiserin-Augusta-Allee;apartment;10589;1.5;n;;2,active;Deutschland;premium;wohnung_kauf;n;0;;true;002.01008679649;261000;profile0;4;1;true;n;showqualicontactform;n;n;Charlottenburg_Charlottenburg;498075;2;Berlin;/expose/109298331;"['""Augusta"" auf einen Blick \r\n\r\nDer schöne Altbau aus dem Jahr 1896 besteht aus 33 Wohn- und 3 Gewerbeeinheiten, die sich im Vorderhaus und Seitenflügel auf insgesamt 5 Geschosse verteilen.  Die gut geschnittenen 1 – 5-Zimmer-Wohnungen sind ca. 45 – 143 m² groß und größtenteils mit einem Balkon ausgestattet. Alle Wohneinheiten verfügen über einen Kellerraum. Die Wohnungen werden provisionsfrei verkauft!\r\n\r\nAltbau aus dem Jahr 1896\r\nVorderhaus und Seitenflügel\r\n37 Wohneinheiten\r\nEin- bis 5-Zimmer-Wohnungen\r\nErdgeschoss – 4. Obergeschoss\r\nSechs Leerwohnungen \r\nDrei Gewerbeeinheiten\r\nCa.  45² - 143 m²\r\nGrößtenteils mit Balkon\r\nKeller\r\nProvisionsfrei', 'Zwischen Spree und Charlottenburger Kanal \r\n\r\nSeien es ältere Menschen, die ihre Umgebung lieben, Familien, die für ihre Kinder eine ruhige und grüne Lage bevorzugen oder Studierende, die an der Universität der Künste eingeschrieben sind: \r\nSie alle suchen Wohnraum in ihrer Lieblingslage. Fündig werden sie in Charlottenburg. Hier lebt man ruhig, bürgerlich und im Grünen und ist durch die Anbindung an den Nahverkehr trotzdem in kurzer Zeit an allen Hotspots der Stadt.\r\n\r\nImmer schnell am Ziel\r\n\r\nDas ""Augusta"" ist hervorragend an den öffentlichen Nahverkehr der Hauptstadt angebunden: Direkt vor der Tür fährt die U7 von der Station ""Mierendorffplatz""; und nach 10 min zu Fuß (oder einer U-Bahn-Station) erreicht man ""Jungfernheide"": von dort fährt die Ringbahn, die einen mit nahezu allen Zielen in der Hauptstadt verbindet. \r\nDinge des täglichen Bedarfs sind vom ""Augusta"" aus rasch besorgt: Supermärkte, Discounter, Apotheken sowie eine Bankfiliale befinden sich direkt um die Ecke, nur wenige Schritte entfernt. Kindergärten und Schulen erreicht man ebenfalls in wenigen Gehminuten, darunter das Gottfried-Keller-Gymnasium.\r\n\r\nMuseen, Schloss & Shopping\r\n\r\nNicht nur mit der hervorragenden Infrastruktur kann das ""Augusta"" glänzen – auch das Freizeitangebot lässt nichts zu wünschen übrig. In 10 min zu Fuß erreicht man das Schloss Charlottenburg mit seinem kulturellen Angebot sowie den Schlossgarten, der Naherholung prädestiniert ist.\r\n\r\nCa. 50 m zur U-Bahn-Station ""Mierendorffplatz"" (U7) \r\n10 min Fußweg (oder eine U-Bahn-Station) zur S- und U-Bahn-Station ""Jungfernheide"" (Ringbahn, U7)\r\n10 min Fußweg zum Schloss Charlottenburg mit Schlosspark\r\nCa. 10 min mit der U-Bahn zur Shopping-Meile Kurfürstendamm\r\nCa. 15 min mit dem ÖPNV zum Savignyplatz mit Restaurants, Bars und Cafés\r\nZwei U-Bahn-Stationen zur Deutschen Oper']";gas;153.75;energy_consumption;159.4;true;ONE_YEAR_FREE;40 MBit/s;telekom_layer_magenta_l;über VDSL;REGULAR;MagentaZuhause L;;100 MBit/s;https://padlock.link/ioml;https://padlock.link/ml;true;100 MBit/s;web,email,bank,music,dl-ul,game,sd,mltstr,hd,fast-ul-dl;;;;;
2020-05-24 20:59:10.832534;Berlin;self_contained_central_heating;1163286;n;y;https://pictures.immobilienscout24.de/listings/6e1e9db4-9694-4af9-a30a-9ac04ae5f0e0-1361699003.jpg/ORIG/resize/118x118%3E/extent/118x118/format/jpg/quality/80;1;10.81;1910;;;;10.81;117063171;n;false;y;Berlin;y;7;1;no_information;6.01;81;Berlin;12161;well_kept;normal;false;no_information;no_information;n;no_information;apartment;12161;3;n;;2,active;Deutschland;standard;wohnung_kauf;y;1;;true;001.1163286;379000;profile0;4;3;true;n;;n;n;Friedenau_Schöneberg;117063888;4;Berlin;/expose/117063171;['Weitere Angebote zu unseren Eigentumswohnungen finden Sie auf unserer Homepage: http://www.wohllebe-immobilien.de/etw.php\nDie vermietete Eigentumswohnung befindet sich im 1.OG im Vorderhaus in einem Altbaugebäude aus dem Jahre 1910. Das Gebäude hat keinen Personenaufzug.\nThe dwelling is located in the 1. floor in a building of 1910.', 'Die vermietete Eigentumswohnung hat 3 Zimmer mit Echtholzparkett bzw. Dielen ausgelegt. Die Wohnung hat einen Balkon. Die Küche hat Platz für einen Esstisch. Es gibt ein Wannenbad mit Fenster. Für ein ausführliches Expose geben Sie bitte Ihren Namen und Postadresse an.', 'Das Gebäude befindet sich in ruhiger Lage von Berlin Friedenau, nahe dem Rüdesheimer Platz. Die U-Bahn ist fußläufig erreichbar. In der näheren Umgebung befinden sich sämtliche Einkaufsmöglichkeiten und Dienstleistungen, die man für den täglichen Bedarf benötigt. Auch Schulen, Kitas und andere (öffentliche) Einrichtungen sind fußläufig erreichbar.\nThe building is in a street of Berlin Friedenau, near the Rüdesheimer Platz. The U-Bahn is reachable  in a walking distance. In the near region you have schools and shopping possibilities around.'];gas;170;;;;ONE_YEAR_FREE;40 MBit/s;telekom_layer_magenta_l;über VDSL;REGULAR;MagentaZuhause L;;100 MBit/s;https://padlock.link/ioml;https://padlock.link/ml;true;100 MBit/s;web,email,bank,music,dl-ul,game,sd,mltstr,hd,fast-ul-dl;;;;;
