2020-05-24 20:59:11.190457;Berlin;central_heating;16682525;n;n;https://pictures.immobilienscout24.de/listings/5b96edc9-0903-4e94-b937-d0916958d43f-1361758801.jpeg/ORIG/resize/118x118%3E/extent/118x118/format/jpg/quality/80;14;11.35;1988;;;;11.35;117068205;y;false;y;Berlin;n;3;4;no_information;7.53;29;Berlin;10249;no_information;no_information;false;no_information;no_information;n;no_information;ground_floor;10249;1;n;;2,active;Deutschland;top;wohnung_kauf;n;0;;true;009.6024c677-c78f-4d6e-abe0-a8aeee2ed20b;133000;profile0;;1;true;n;showqualicontactform;n;n;Friedrichshain_Friedrichshain;117068205;1;Berlin;/expose/117068205;"['The Altbau-style apartment dating from 1988 is located in the sought-after district of Friedrichshain. The 29m2 of this property have been very well arranged, allowing to have a kitchen open to the living area as well as a sleeping area. \r\n\r\nThe whole building consists of a main building, a side wing and a cross wing. \r\nThis one is very well maintained. Indeed, numerous renovation works (new electrical system, water and sewer pipes, transformation of the attic, extension of the elevator...) were carried out in 1999.\r\n\r\nThe side wing where this property is located was also insulated with a composite thermal insulation facade in 2011.\r\n\r\nHoused on the ground floor, you will be able to enjoy the peace and quiet of this backyard location.\r\n\r\nI now invite you to a small guided tour.\r\nAs you enter the apartment, you will find yourself in the living space. On your right is the night corner. Opposite is the modern and functional bathroom with a glass shower, a cabinet and a washbasin. \r\nNow we come to the core of the apartment: the fully equipped kitchen open to the living area where you can install a sofa, a television and a coffee table to enjoy your evenings in front of your favourite films or to immerse yourself in your reading of the moment.\r\nThe apartment is fully furnished (included in the price) and can also be used for commercial purposes.\r\n\r\nThe apartment is available immediately.\r\nVisits are possible by appointment.  ', 'Key facts: \r\n\r\n- Side wing, right ground floor \r\n\r\n- 1 bedroom apartment \r\n\r\n- 29 square meters\r\n\r\n- Available now\r\n\r\n- 133.000€\r\n\r\n- Sold furnished\r\n\r\n- Equipped kitchen\r\n\r\n- Can be used for commercial purposes\r\n\r\n- Southwest orientation ', 'The apartment is located on Heidenfeldstraße in Berlin-Friedrichshain, in the northern part, on the border of Prenzlauer Berg. This central and dynamic district attracts both singles without children and families. The mix of population here gives the area its charm. \r\n\r\nThe Heidenfeldstraße is ideally positioned as it is close to the lively corners due to its proximity to the Landsberger Allee while remaining a quiet street. \r\n\r\nYou will find everything you need for everyday life such as grocery stores, pharmacies, shops, restaurants, bars, etc. You will quickly find your favourite spots.\r\n\r\nIn the meantime, we advise you to start your day with a walk or an early morning jog in the Volkspark, which is a 9-minute walk away. \r\n\r\nAfterwards you can go to the café ""Zum Kalten Hund"" where you can enjoy good pastries and coffee.\r\n\r\nWould you like to try some German specialities? The ""Budike"" is a must. \r\n\r\nFor lovers of Mediterranean cuisine we recommend the ""Pomodorino"", an Italian restaurant that will take you on a journey while staying in your neighbourhood. Other culinary specialities are also within walking distance, such as the ""Viet Bowl Friedrichshain"" or the ""GAO Fresh.Food.Fast"".\r\n\r\nWe invite you to go to Boxhagener Platz, which is less than 20 minutes away by tram, to enjoy the multitude of cafes, restaurants, bars and the fabulous antique market that takes place every Sunday.\r\n\r\nAs you can see, this area offers many possibilities due to its central location and the energy of its inhabitants. There is something for all tastes and ages!\r\n\r\nThe apartment is very well served by public transport:\r\n\r\n- S-Bahn station Landsberger Allee (8 minutes by foot)\r\n\r\n- Landsberger Allee/Petersburger Str. bus station (4 minutes on foot)', 'Visits are possible demand.\r\n\r\nPlease understand that we can only process enquiries with complete details (first and last name, email address).']";gas;;;;;ONE_YEAR_FREE;40 MBit/s;telekom_layer_magenta_l;über VDSL;REGULAR;MagentaZuhause L;;100 MBit/s;https://padlock.link/ioml;https://padlock.link/ml;true;100 MBit/s;web,email,bank,music,dl-ul,game,sd,mltstr,hd,fast-ul-dl;;;;;
2020-05-24 20:59:11.586506;Berlin;district_heating;15349709;n;n;https://pictures.immobilienscout24.de/listings/2028d164-017f-460b-841b-ef3d8294f166-1361767966.jpg/ORIG/resize/118x118%3E/extent/118x118/format/jpg/quality/80;17;14.32;1908;true;disabled;;14.32;117069413;n;false;n;Berlin;y;4;1;8/9;8.36;44.97;Berlin;13353;well_kept;no_information;false;no_information;"Br&uuml;sseler Stra&szlig;e";n;Brüsseler_Straße;apartment;13353;1.5;n;;2,active;Deutschland;standard;wohnung_kauf;y;1;;true;001.15297510;166389;profile0;5;1;true;n;showqualicontactform;n;n;Wedding_Wedding;BS8 WE 11;2;Berlin;/expose/117069413;['Im südlichen Teil Weddings - im Brüsseler Kiez - befinden sich die zur Eigennutzung oder als Kapitalanlage angebotenen 40 Wohnungen. Der Altbau liegt in einer eher ruhigen Lage in der Brüsseler Straße, von der aus das pulsierende Leben Berlins schnell erreicht werden kann.\r\nDas 1908 erbaute Haus formiert sich aus Vorderhaus, Seitenflügeln und Hinterhaus, fast quadratisch um einen begrünten Innenhof. Es bietet in insgesamt drei Gewerbe- und 73 Wohneinheiten schöne Stadtwohnungen und großzügige Arbeitsräume. Die Wohnungen überzeugen durch eine attraktive und durchdachte Raumaufteilung. Die Größen im Erdgeschoss bis zum vierten Obergeschoss variieren zwischen 36 m² und 80 m². Abgesehen von einer Gewerbeeinheit im Erdgeschoss mit 4 Räumen und einer Dachgeschoss-Wohnung mit 2,5 Zimmern, handelt es sich bei den verfügbaren Einheiten ausschließlich um 1- bis 2-Zimmer-Wohnungen. Die Dachgeschosswohnungen sind großzügig gestaltet und bieten mit 76 m² bis 103 m² attraktive Wohnungsgrößen und große Dachterrassen, die in der warmen Jahreszeit zum Aufenthalt im Freien mit einem Ausblick auf die städtische Umgebung einladen. \r\nDas Haus ist ein typischer Berliner Altbau, bei dem zahlreiche bauzeitliche Elemente bewahrt worden sind. Im vorderen Treppenhaus finden sich Buntglasfenster, dekorativ verzierte Treppengeländer und Türstöcke, Stuck an den Decken sowie Kassettentüren zeigen die Schönheit und die Geschichte dieses Gebäudes.\r\n\r\nMit dem Kauf einer Eigentumswohnung in Berlin-Wedding entscheiden Sie sich für eine attraktive Anlage in einer zunehmend beliebten Lage oder für die eigenen vier Wände in einer vielfältigen und abwechslungsreichen Nachbarschaft. \r\n\r\nWillkommen im „Colours of Wedding“.', '- Einheit Nr. 11\r\n- 1.OG \r\n- 1,5 Zimmer \r\n- ca. 45 m² \r\n- Kellerabteil\r\n- vermietet', 'Der zentral gelegene Wedding ist in all den Jahren ein ursprünglicher Teil Berlins geblieben, der sich nie verbogen hat. Bis heute versprüht der Ortsteil den Charme eines gewachsenen und lebendigen Wohnviertels, in dem man sowohl urige Berliner Eckkneipen als auch angesagte Cafés findet. Bei aller Beständigkeit ist hier ein deutlicher Wandel spürbar, der alte Strukturen reizvoll ergänzt, statt sie zu zerstören. Es ist ein aufstrebender, lebendiger Teil der Stadt, der immer mehr Menschen anzieht.\r\nNeben den großen grünen Parkanlagen, wie dem Volkspark Rehberge, ist der heutige Wedding vor allem bunt. Mittlerweile hat sich hier eine lebendige Kunstszene etabliert. Knapp 13.000 Studierende sind an der nur 500 Meter entfernten Beuth Hochschule für Technik Berlin eingeschrieben und verleihen dem Bezirk kulturell und wirtschaftlich eine zusätzliche Dynamik. Auch der Charité Campus Virchow-Klinikum ist weniger als einen Kilometer vom Objekt entfernt. \r\nDie Brüsseler Straße zählt zu den ruhigeren Lagen im Kiez, ist aber zugleich gut an die Hauptverkehrsadern, wie der Seestraße und der Einkaufsmeile Müllerstraße, angebunden. In nur wenigen hundert Metern Entfernung befinden sich der U-Bahnhof  und mehrere Tram- und Buslinien. In nur 10 Minuten gelangt man bis zur Friedrichstraße im historischen Zentrum Berlins. Hier wird entspanntes Wohnen mit dem Erleben des quirligen und spannenden Berlins kombiniert. Dieser Kontrast zeichnet das Leben in der Brüsseler Straße 8 und 9 aus und macht es interessant, vielfältig und lebenswert. \r\n', 'Die Wohnungen werden im Ist-Zustand verkauft.\r\nDas Objekt liegt in einem Milieuschutzgebiet.'];geothermal;161.74;energy_consumption;106;;ONE_YEAR_FREE;40 MBit/s;telekom_layer_magenta_l;über VDSL;REGULAR;MagentaZuhause L;;100 MBit/s;https://padlock.link/ioml;https://padlock.link/ml;true;100 MBit/s;web,email,bank,music,dl-ul,game,sd,mltstr,hd,fast-ul-dl;;;;;
2020-05-24 20:59:12.074629;Berlin;central_heating;17946136;n;n;https://pictures.immobilienscout24.de/listings/a8d16a69-dd76-4d4a-b312-63f8898db627-1361480052.jpg/ORIG/resize/118x118%3E/extent/118x118/format/jpg/quality/80;9;12.1;1910;;;;12.1;117045662;n;false;y;Berlin;y;4;1;no_information;7.07;27;Berlin;10829;refurbished;normal;false;no_information;no_information;n;no_information;apartment;10829;1;n;;2,active;Deutschland;top;wohnung_kauf;n;1;;true;002.01008662528;152000;profile0;5;1;true;n;showqualicontactform;n;n;Schöneberg_Schöneberg;117045662;1;Berlin;/expose/117045662;['Die angebotene 1-Zimmer-Eigentumswohnung befindet sich im 1. Obergeschoss des gepflegten Berliner Altbaus aus dem Jahre 1910, im angesagten Schöneberg.\n\nDie Wohnung befindet sich sehr ruhig gelegen im Seitenflügel und wird aktuell noch bis zum 30.06.2020 bewohnt.\nDie Wohnung wird leer und bezugsfrei verkauft. \n\nDer Wohnraum und der Flur ist mit einem Echtholzdielenfußboden ausgestattet, das innenliegende und elektrisch belüftete Badezimmer ist hell gefliest und mit einer Badewanne mit Duschabtrennung ausgestattet. \n\nDie kompakte Küche ist mit einem Linoleumboden ausgestattet.\n\nDie Wohnung wird über eine Gaszentralheizung beheizt, die Warmwasseraufbereitung erfolgt über einen elektrischen Durchlauferhitzer.', '- Echtholz-Dielenfußboden\n- typische Altbau-Deckenhöhe (ca. 2,80 m)\n- Kunststoff-Iso-Fenster\n- weiß tapezierte Wände\n- Keller verfügbar\n- Fahrradabstellmöglichket im Hof\n- gepflegter Altbau', 'Der Stadtteil Schöneberg befindet sich im Süd-Westen Berlins und gehört zu einem der aufstrebendsten Bezirken der City-West.\n \nDas Objekt befindet sich in einer ruhigen Seitenstraße im szenigen Schöneberg zwischen dem S-Bhf Südkreuz und S-Bhf Julius-Leber-Brücke. \n\nIn unmittelbarer Nähe finden Sie Einkaufsmöglichkeiten und Dienstleister des täglichen Bedarfs. \n\nDie Anbindung an den öffentlichen Nahverkehr ist sehr gut. Sowohl die S-Bahn, als auch Busse sind fußläufig erreichbar.', 'Besichtigungstermine sind nach Absprache möglich.'];gas;;energy_consumption;121;;ONE_YEAR_FREE;40 MBit/s;telekom_layer_magenta_l;über VDSL;REGULAR;MagentaZuhause L;D;100 MBit/s;https://padlock.link/ioml;https://padlock.link/ml;true;100 MBit/s;web,email,bank,music,dl-ul,game,sd,mltstr,hd,fast-ul-dl;;;;;
2020-05-24 20:59:12.410300;Berlin;no_information;174522;n;n;https://pictures.immobilienscout24.de/listings/64ead4f8-6ad7-4b02-931d-6ae2b7c870f9-1361605825.jpg/ORIG/resize/118x118%3E/extent/118x118/format/jpg/quality/80;8;12.86;;;disabled;;12.86;117053127;n;true;y;Berlin;y;4;;no_information;6.82;67;Berlin;13409;no_information;no_information;false;no_information;no_information;n;no_information;apartment;13409;3;n;;2,active;Deutschland;top;wohnung_kauf;n;;;true;001.174522;189000;profile0;;3;true;n;showqualicontactform;n;n;Reinickendorf_Reinickendorf;117053127;3;Berlin;/expose/117053127;['Die beiden größten Zimmer profitieren von der sonnigen Ausrichtung in die Südsonne und einer ansprechenden Altbauatmosphäre dank hoher Zimmerdecken und großer stilvoller Sprossenfenster. Zu zwei Seiten spendabel verglast ist der Anbau mit Wintergartenflair, der vom größten Zimmer abgeht. Dieses Zimmer, das optimal als Wohn- und Essbereich eingerichtet werden kann, liegt der geräumigen Küche am nächsten. Großzügig dimensioniert ist die Nutzung als Wohnküche möglich. Momentan ist ein Gasherd angeschlossen. Die Gasetagenheizung wurde 2014 erneuert. Neben der tollen Küche erfreut ein taghelles Badezimmer mit Wanne, Hänge-WC und anderen gepflegten Elementen. Zu dieser attraktiven Wohnung gehört ein Kellerabteil.\nBehaglich und lichtstark in einen gefälligen Stadtteil eingebettet, sowie architektonisch überzeugend geformt, zählt diese Wohnung zu einem begehrten Typus.\nEin Energieausweis ist nicht vorhanden.', 'Sie möchten den Marktwert Ihrer Immobilie wissen oder Ihre Immobilie verkaufen? Wir sind seit 1995 erfolgreich im Verkauf von Immobilien in Berlin, Potsdam und Umgebung tätig. Unsere exzellenten Eigentümerbewertungen sprechen für sich.\n\n•\tOftmals haben wir schon den richtigen Käufer für Ihre Immobilie in unserer Kartei\n•\tWir sind Bellevue Best Property Agent und Mitglied in den Verbänden IVD & FIABCI\n•\tWir benötigen keinen schriftlichen Alleinauftrag\n•\tKosten entstehen Ihnen bei uns keine\n•\tUnsere Spezialisten stehen Ihnen gerne für ein erstes – für Sie unverbindliches - Gespräch zur Verfügung\n\nWir freuen uns über Ihre Kontaktaufnahme unter einkauf@immoberlin.de oder (030) 895 72 20.\nBitte besuchen Sie auch unsere Website: \nhttps://www.immoberlin.de'];;;;;;ONE_YEAR_FREE;40 MBit/s;telekom_layer_magenta_l;über VDSL;REGULAR;MagentaZuhause L;;100 MBit/s;https://padlock.link/ioml;https://padlock.link/ml;true;100 MBit/s;web,email,bank,music,dl-ul,game,sd,mltstr,hd,fast-ul-dl;;;;;
2020-05-24 20:59:12.826282;Berlin;self_contained_central_heating;17689537;n;y;https://pictures.immobilienscout24.de/listings/2b8cdd48-b718-48b1-824d-6bbf1da46a6a-1370266932.jpg/ORIG/resize/118x118%3E/extent/118x118/format/jpg/quality/80;19;16.53;1905;;;;16.53;117064332;n;false;n;Berlin;y;8;1;47;9.26;75.38;Berlin;12049;well_kept;normal;false;no_information;"Allerstra&szlig;e";n;Allerstraße;apartment;12049;2;n;;2,active;Deutschland;premium;wohnung_kauf;n;3;;true;009.d41f4c69-eb7b-4709-b891-42c728a6b026;415000;profile0;5;2;true;n;showqualicontactform;n;n;Neukölln_Neukölln;TIM002_ALLER47_WE28;3;Berlin;/expose/117064332;['GEPFLEGTER ALTBAU ZWISCHEN HERMANNSTRAßE UND TEMPELHOFER FELD!\n\nDer 5-geschossige Altbau aus dem Jahre 1905 liegt inmitten des Schillerkiezes nahe des Tempelhofer Feldes. Es besteht aus zwei Vorderhäusern sowie einem Seitenflügel. Fahrradabstellmöglichkeiten befinden sich im sonnigen Innenhof.', 'CHARMANT | ALTBAUWOHNUNG | ZWEI BALKONE!\n\nDiese Wohnung befindet sich in einem gepflegten Zustand. Sie zeichnet sich vor allem durch folgende Ausstattungsmerkmale aus:\n\n* 2 Balkone\n* Dielenboden\n* Gefliestes Bad mit Duschwanne\n* Gut geschnitten\n* Hohe Decken\n* Super Lage im Schillerkiez', 'WOHNEN IM NEUKÖLLNER SCHILLERKIEZ\n\nDas gepflegte Wohnhaus liegt im Szenebezirk Neukölln zwischen Hermannstraße und Tempelhofer Feld. Der angesagte und beliebte Schillerkiez versprüht eine positive Energie, die sich über den ganzen Kiez erstreckt. Das vielfältige Angebot an Bars und außergewöhnlichen Restaurants verschlägt einem immer wieder den Atem. Ob arabisch, französisch, italienisch oder koreanisch – Für Sie wird auf jeden Fall etwas Passendes dabei sein! Jeden Samstag findet rund um den Herrfurthplatz der Schillermarkt statt. Hier finden Sie reichlich Auswahl an Feinkost, Blumen, Obst und Gemüse.\n\nDas Wohnhaus ist hervorragend an das öffentliche Verkehrsnetz angebunden. Die U-Bahn-Station (U8) „Leinestraße“ befindet sich in unmittelbarer Nähe. Hinzu kommt die S-Bahn Ring-Station (S41/42) „Hermannstraße“. Von dort aus gelangen Sie direkt zum Alexanderplatz, Hermannplatz als auch Volkspark Hasenheide. Einkaufsmöglichkeiten finden Sie Sie direkt im Schillerkiez. \n\nDas Tempelhofer Feld, welches fußläufig in ca. 5 Minuten zu erreichen ist, bietet einem Abenteuer und Entspannung zu gleich. Hier können Sie die Sonne genießen und die Seele baumeln lassen.', 'Wir freuen uns von Ihnen zu hören und stehen für weitere Fragen und einen Besichtigungstermin selbstverständlich gern zur Verfügung!'];gas;200;energy_required;151.3;true;ONE_YEAR_FREE;40 MBit/s;telekom_layer_magenta_l;über VDSL;REGULAR;MagentaZuhause L;NO_INFORMATION;100 MBit/s;https://padlock.link/ioml;https://padlock.link/ml;true;100 MBit/s;web,email,bank,music,dl-ul,game,sd,mltstr,hd,fast-ul-dl;;;;;
2020-05-24 20:59:13.262052;Berlin;central_heating;16614875;n;n;https://pictures.immobilienscout24.de/listings/0db07ea3-caa2-48da-9267-6ed9f7b67cd8-1361789784.jpg/ORIG/resize/118x118%3E/extent/118x118/format/jpg/quality/80;6;16.53;1910;;;;16.53;117071459;n;false;y;Berlin;y;2;1;no_information;9.26;35.41;Berlin;12053;no_information;no_information;false;no_information;no_information;n;no_information;apartment;12053;1;n;;2,active;Deutschland;standard;wohnung_kauf;y;2;;true;002.01007214379;100000;profile0;5;1;true;n;showqualicontactform;n;n;Neukölln_Neukölln;1824b;1;Berlin;/expose/117071459;['Bei dem Angebot handelt es sich um eine 1-Zimmer Wohnung mit Küche und Bad im 2 OG. des Seitenflügels. \nDie Wohnung ist dauerhaft vermietet an einen älteren Herrn. Die Nettokaltmiete beträgt 223,82 Euro zzgl. Nebenkosten und Kabelgebühr von 95 Euro.\nDie Warmmiete liegt bei 318,82 Euro. Die Kaltmiete wurde schon lange nicht erhöht.\nDas Hausgeld beträgt 194 Euro, davon ca. 57 Euro nicht umlagefähig.', 'Die Wohnung befindet sich in einer ruhigen Nebenstraße in einem pulsierenden lebendigen Stadtteil Reuterkiez. In der Nähe findet man Geschäfte, Supermärkte, Restaurants, Cafes und alles was man für das alltägliche Leben braucht. Hermannplatz mit der U-Bahn Station ist nur 450 Meter entfernt. Bis zur U-Bahn Station Boddingstraße sind es nur 600 Meter.\nBis zum Volkspark Hasenheide sind es nur 10 Minuten zu Fuß.', 'Widerrufsrecht:\nSie können Ihre Vertragserklärung innerhalb von 14 Tagen ohne Angabe von Gründen in Textform (z. B. Brief, Fax, E-Mail) widerrufen. Die Frist beginnt nach Erhalt dieser Belehrung in Textform, jedoch nicht vor Vertragsschluss und auch nicht vor Erfüllung unserer Informationspflichten gemäß Artikel 246 § 2 in Verbindung mit § 1 Abs. 1 und 2 EGBGB sowie unserer Pflichten gemäß § 312 e Abs. 1 Satz 1 BGB in Verbindung mit Artikel 246 § 3 EGBGB. Zur Wahrung der Widerrufsfrist genügt die rechtzeitige Absendung des Widerrufs. Der Widerruf ist zu richten an: L&B Immobiliya EuRUS GmbH, Friedrichstraße 81, 10117 Berlin, per Fax an 030/76214973 oder per email an info@immobiliya.de - - - - - - - - - - - - - - - - - - - - Widerrufsfolgen Im Falle eines wirksamen Widerrufs sind die beiderseits empfangenen Leistungen zurückzugewähren und ggf. gezogene Nutzungen (z. B. Zinsen) herauszugeben. Können Sie uns die empfangene Leistung ganz oder teilweise nicht oder nur in verschlechtertem Zustand zurückgewähren, müssen Sie uns insoweit ggf. Wertersatz leisten. Dies kann dazu führen, dass Sie die vertraglichen Zahlungsverpflichtungen für den Zeitraum bis zum Widerruf gleichwohl erfüllen müssen. Verpflichtungen zur Erstattung von Zahlungen müssen innerhalb von 30 Tagen erfüllt werden. Die Frist beginnt für Sie mit der Absendung Ihrer Widerrufserklärung, für uns mit deren Empfang.'];;194;;;;ONE_YEAR_FREE;40 MBit/s;telekom_layer_magenta_l;über VDSL;REGULAR;MagentaZuhause L;;100 MBit/s;https://padlock.link/ioml;https://padlock.link/ml;true;100 MBit/s;web,email,bank,music,dl-ul,game,sd,mltstr,hd,fast-ul-dl;;;;;
2020-05-24 20:59:13.620627;Berlin;no_information;18439236;n;y;https://pictures.immobilienscout24.de/listings/5c7b4747-b79b-4563-95e4-d6fe41561a1b-1361723310.png/ORIG/resize/118x118%3E/extent/118x118/format/jpg/quality/80;10;11.35;;;;;11.35;117065145;n;false;y;Berlin;y;8;;no_information;7.53;82;Berlin;10249;no_information;no_information;false;no_information;no_information;y;no_information;roof_storey;10249;3;n;;2,active;Deutschland;standard;wohnung_kauf;y;5;;true;002.01009255342;449000;profile0;5;3;true;n;showqualicontactform;n;n;Friedrichshain_Friedrichshain;VK-19003_ad;4;Berlin;/expose/117065145;['Die wunderschön geschnittene Dachgeschosswohnung befindet sich in einem Eckgebäude in einer ruhigen Seitenstraße in Berlin-Friedrichshain, unweit des Volksparks. Ob Joggen im Park, Erholung auf einer der weitläufigen Grünflächen oder Familienausflüge zu einer der vielen Spiel- und Sportplätze, all das befindet sich in unmittelbarer Umgebung der herrlichen Wohnung.\n\nDas nähere Umfeld bietet neben einer sehr guten Infrastruktur mit einladenden Cafés und Restaurants ein abwechslungsreiches Angebot und erfreut sich bei jungen Einwohnern sowie alteingesessenen Berlinern größter Beliebtheit.\n\nDurch die Anbindung an die Öffentlichen Verkehrsmittel über Tram und S-Bahn (Ringbahn Landsberger Allee) sind die umliegenden Kieze der Stadt schnell erreicht. \n\nMehrere Schulen und Kindergärten sowie ein Spiel- und Sportplatz machen darüber hinaus die Lage dieser Wohnung perfekt.\n\nNachdem Sie durch den Eingang des Hauses ins Treppenhaus gelangt sind, können Sie mit dem Aufzug zu Ihrer Wohnung gelangen.\n\nEin heller Flur verbindet alle Räume der Wohnung miteinander. Gleich zu Beginn auf der rechten Seite gelangen Sie in das Tageslicht-Bad, gefliest mit hellen Kacheln ausgestattet mit einer Dusche. Im Anschluss daran befindet sich ebenfalls auf der rechten Seite die Küche. Durch die verglaste Tür zur Dachterrasse erstrahlt die Küche im Tageslicht, insbesondere zur Mittagszeit. Mit wenigen Schritten über den gefliesten Küchenfußboden, können Sie auf die Dachterrasse austreten. Die südliche Ausrichtung bietet somit viel Licht und liegt ruhig in Richtung des Innenhofs.\n\nAm Ende des Flures, öffnet sich ein weiterer Raum, dieser kann beispielsweise als Arbeitszimmer genutzt werden. Das geräumige Wohnzimmer besticht durch seine Größe. Viel Platz für Möbel steht zur Verfügung, wodurch sich für jeden Bewohner ein charmantes Wohngefühl eröffnet. Jedes Zimmer wird durch direktes Tageslicht beleuchtet und lässt den Blick frei über die ruhige Seitenstraße. Durch die qualitativ hochwertigen Fenster wird die Geräusch-Kulisse, die auf den belebten Straßen Berlins entsteht, sehr gut abgeschirmt. Auch das Schlafzimmer ist sehr gut geschnitten und bietet viel Platz für Kleiderschränke. Die Wohnung ist ausschließlich mit Parkett ausgelegt, lediglich die Küche und das Badezimmer sind gefliest. Das Angebot wird durch ein Kellerabteil als Lagerfläche abgerundet.\n\n\nDie Wohnung befindet sich in einem vermieteten Zustand.', 'Die Wohnung liegt mitten im Herzen des jungen und belebten Szenebezirks Berlin-Friedrichshain. Das bekannte Wohnviertel in Berlin hat sich über die letzten Jahre als besonders gefragte Innenstadtlage bei Mietern und Investoren fest etabliert und überzeugt durch die gute und schnelle Anbindung an Berlin-Mitte im Westen, den Prenzlauer Berg im Norden, wie auch Kreuzberg und Neukölln im Süden.\n\nDie hochfrequentierte Durchmischung von einem hohen Anteil an gut erhaltenem Altbaubestand und einer stetig wachsenden Anzahl an Neubauten macht diesen Bezirk attraktiv und abwechslungsreich.\n\nFriedrichshain steht insbesondere für ein junges und frisches Leben. Nicht ohne Grund nennt man diesen Bezirk das Kneipen- und Restaurantviertel der Hauptstadt. Insbesondere rund um den Boxhagener Platz reihen sich eine Unzahl an Restaurants mit kulinarischen Spezialitäten aus aller Welt wie auch kleine Cafés.\nAn Samstagen finden verschiedene Wochenmärkte statt, zu dem eröffnet sich Ihnen zudem die Möglichkeit stets die frischesten und besten Produkte des Berliner Umlandes zu erwerben.\n\nMit dem sonntäglichen Flohmarkt am Boxhagener Platz findet sich hier ein weiteres unter den Bewohnern des Viertels beliebtes Spektakel. \n\nAuf der gegenüberliegenden Seite des Volksparks befindet sich das schöne „Bötzowviertel“ mit einem besonderen Bestand an Altbauten, wie auch den angrenzenden „Kollwitzkietz“.'];;;;;;ONE_YEAR_FREE;40 MBit/s;telekom_layer_magenta_l;über VDSL;REGULAR;MagentaZuhause L;;100 MBit/s;https://padlock.link/ioml;https://padlock.link/ml;true;100 MBit/s;web,email,bank,music,dl-ul,game,sd,mltstr,hd,fast-ul-dl;;;;;
