2020-05-24 20:39:26.121396;Berlin;district_heating;18593467;n;n;https://pictures.immobilienscout24.de/listings/1e9266a0-1b2a-481e-8883-4e8c84d37ea3-1371021697.jpg/ORIG/resize/118x118%3E/extent/118x118/format/jpg/quality/80;19;12.19;1910;;12.19;118714138;;district_heating;y;false;y;Berlin;y;3;1;183;no_information;energy_consumption;7.44;42.56;Berlin;10997;well_kept;sophisticated;F;false;no_information;no_information;n;no_information;raised_ground_floor;10997;1.5;175.9;n;;2,active;Deutschland;standard;wohnung_kauf;n;;;true;002.01009501804;147000;profile0;;1;true;n;showqualicontactform;n;n;Kreuzberg_Kreuzberg;FALC-TS-16101;2;Berlin;/expose/118714138;"['Sofort verfügbar!\nKaufen - einziehen - wohlfühlen!\n\nBitte sehen Sie sich die  360° - Besichtigung unter https://app.immoviewer.com/portal/tour/1818705 an, bevor Sie mit uns einen Besichtigungstermin vereinbaren!\n\nWollten Sie schon immer eine Wohnung am Görlitzer Park in Berlin- Kreuzberg besitzen? \n\nHier haben wir für Sie eine Gelegenheit eine 1,5  Zimmer Wohnung direkt gegenüber des Görlitzer Park zu kaufen. \n\nDiese großzügig geschnittene 1,5 -Zimmer Hochparterrewohnung befindet sich in einem ruhig gelegenen und gepflegten Seitenflügels eines Mehrfamilienhaus in Berlin-Kreuzberg.\n\nMitten im angesagten Kiez, aber trotzdem ruhig und weitab der Großstadthektik!\n\nDie ca. 42,56m² große Wohnung verfügt über eine geräumige gemütliche Küche mit Blick in den grünen Innenhof sowie ein geräumiges Wohnzimmer. \n\nÜber den großzügigen Flur erreichen Sie außerdem ein helles Schlafzimmer sowie ein Bad mit Badewanne. \n\nEin Kellerraum ist natürlich auch Bestandteil dieses Angebots.\n\nGerne begleiten wir Sie zu Ihrer persönlichen Sicherheit gerade jetzt in der Coronazeit, bei einer virtuellen Besichtigung oder per Videotelefonie (sog. FALC - Geisterbesichtigungen) durch diese schöne Wohnung.\n\nAls aktiver Sportler können Sie im Park neue Energie mit z.B. Joggen auftanken.', 'Der weitläufige Stadtteil Kreuzberg wird überwiegend von Studenten und Künstlern bewohnt. \n\nDiese ruhige, lichtdurchflutete 1,5 Zimmer Wohnung liegt in der begehrtesten Gegend von Kreuzberg, in der Görlitzer Straße. \n\nEine zentrale Lage, in der pulsierenden Stadt mit Charakter und einer lebendigen Atmosphäre.\n\nDie Wohnung ist perfekt gelegen, von hier haben sie einen einfachen Zugang zu allen Transportmitteln und sie liegt in der Nähe von Tech-Zentren einschließlich der ""Factory"". \n\nCafés und Restaurants finden Sie in Hülle und Fülle. Die berühmte Markthalle Neun erreichen Sie in nur fünf Minuten zu Fuß.\n\nSie investieren in einer der exponiertesten Lagen Berlins. \nKreuzberg ist gelebte multikulturelle Identität. Ein junger internationaler Mix bevölkert die Kieze und beherrscht das Wirtschaftsleben. Immobilien in Kreuzberg gehören zu den werthaltigsten Anlagen in Berlin.\n\nWas möchte man mehr?', 'Die Wohnung wurde komplett neu renoviert und sie befindet sich in einem tadellosen Zustand.\n\nDas Wohnzimmer und die Küche sind mit einem geölten Holzdielenboden belegt.\nIm Schlafzimmer wurde Echthozparkett verlegt.\nDer Flur ist mit einem hochwertigen, pflegeleichten und robusten Sisalteppeich versehen.\n\nDas Badezimmer wurde in den vergangenen Jahren komplett erneuert.\n\nDie Einbauküche mit allen notwendigen Elektrogeräten inkl. Waschmaschine, Induktionskochfeld und Dunstabzugshaube nach Außen ist im Kaufpreis bereits enthalten!\nDie Wohnung ist mit vielen Lichtgestaltungsmöglichkeiten (LED- Beleuchtungen) ausgestattet.\n\nIm Flur befindet sich in der abgehangenen Decke ein großer zusätzlicher Stauraum, der über zwei separate Zugänge leicht erreichbar ist.\n\nDas Haus wird über Fernwärme beheizt und befindet sich in einem guten Zustand (die Wasser- und Abwasserstränge wurden ca. 2000 erneuert).\n\nIm ruhigen Innenhof oder in einem separaten Fahrradkeller kann man sein Fahrrad sicher abstellen und die Ruhe genießen.\n\nEin Kellerabteil gehört zur Wohnung dazu.\n\nEinen ersten Eindruck über diese schöne Wohnung erhalten Sie vorab mittels unseren 360°- Rundgang:\nhttps://app.immoviewer.com/portal/tour/1818705', 'Bitte besuchen Sie unseren 3D-Rundgang auf: \nhttps://app.immoviewer.com/portal/tour/1818705\n\nDie Objektbeschreibung beruht ganz oder zum Teil auf Angaben des Eigentümers und ist Vor-Ort nachprüfbar. Für die Richtigkeit oder Vollständigkeit übernehmen wir keine Gewähr.\n\nUm mehr über diese zukunftsweisende Traumwohnung zu erfahren vereinbaren wir sehr gerne mit Ihnen einen persönlichen oder virtuellen Besichtigungstermin.\n\nWir bieten nicht nur eine kostenlose Hotline, sondern auch einen Service am Wochenende.\nBei Interesse geben Sie bitte immer Ihre vollständigen Kontaktdaten an.\n\nSie haben auf Anhieb nichts gefunden oder suchen Sie etwas ganz bestimmtes? \nTeilen Sie uns einfach mit was Sie suchen und wonach wir für Sie die Augen offen halten dürfen. Profitieren Sie von den Vorteilen einer professionellen Maklersuche. Der Suchauftrag ist unverbindlich.\nAuf unser Homepage www.falcimmo.de unter der Rubrik Immobiliensuche halten wir für Sie zum einen den Onlinesuchauftrag bereit, haben aber auch viele andere nützliche Informationen für Kaufinteressenten und Eigentümer.']";ONE_YEAR_FREE;40 MBit/s;telekom_layer_magenta_l;;über VDSL;REGULAR;disabled;MagentaZuhause L;100 MBit/s;https://padlock.link/ioml;https://padlock.link/ml;true;100 MBit/s;web,email,bank,music,dl-ul,game,sd,mltstr,hd,fast-ul-dl;2020;
2020-05-24 20:39:26.506605;Berlin;central_heating;18664549;n;y;https://pictures.immobilienscout24.de/listings/05230b06-f6cd-47f0-bc45-70e0f457a422-1370945541.jpg/ORIG/resize/118x118%3E/extent/118x118/format/jpg/quality/80;33;10.06;1998;;10.06;118690559;1;gas;n;false;y;Berlin;y;6;5;246;19;energy_consumption;5.28;75;Berlin;13156;first_time_use_after_refurbishment;sophisticated;;false;underground_garage;"Buchholzer Stra&szlig;e";y;Buchholzer_Straße;apartment;13156;3;80;n;;2,active;Deutschland;top;wohnung_kauf;n;1;;true;009.53e6399a-7730-471b-9458-1556ccba4263;295000;profile0;5;3;true;y;showqualicontactform;y;n;Niederschönhausen_Pankow;118690559;3;Berlin;/expose/118690559;['Das 1998 fertiggestellte Haus verfügt über einen großzügigen, begrünten und sehr gepflegten Garten mit einem Spielplatz und einem großzügigen Gemeinschaftsplatz zum grillen und Feuer machen. Diese Flächen sind nach Absprache mit den Nachbarn für Geburtstage, aber auch zum abendlichen gemeinsamen entspannen nutzbar und wurden von der Wohn-Gemeinschaft angelegt. Diese Einrichtungen gehören zum Gemeinschaftseigentum.\n\nIm Jahr 2018 gab es eine umfassende Fassaden- und Dachsanierung, bei der das Haus nicht nur eine moderne Farbgebung (Weiß-Anthrazit) erhielt, sondern auch Schäden am Dach und den Balkonen behoben wurden.\n\nDer Keller hat eine Deckenhöhe von 2,50m und weist ebenso wie die Tiefgarage keinerlei Feuchtigkeitsprobleme auf. Er eignet sich somit nicht nur für die Lagerung von ungeliebtem Hausrat.\n\nDas liebenswürdige, hilfsbereite und langjährige Hausmeisterehepaar bezieht im Gebäude eine eigene Wohnung und ist somit auch im Notfall schnell zu erreichen.', 'Die gesamte Wohnung wurd umfassend saniert:\n- Das Parkett wurde abgeschliffen und versiegelt\n- Alle Fensterrahmen wurden abgeschliffen und neu lackiert\n- Alle Fenster haben neue, moderne Fenstergriffe erhalten\n- Alle Heizkörper wurden neu lackiert und mit modernen Thermostaten ausgestattet\n- Alle Lichtschalter und Steckdosen wurden durch moderne Steuereinheiten ausgewechselt   \n- Neue Zimmertüren für die Bäder, Wohn- und Schlafzimmer wurden eingebaut\n- Neue moderne, weiße Sockelleisten wurden in der gesamten Wohnung verlegt \n- In beiden Bädern (Duschbad und Wannenbad) wurden die Waschbecken und das WC durch neue, moderne Sanitärkeramik ersetzt\n-Neue Armaturen in der Dusche (Regenwalddusche), den Waschbecken (Wasserhähne) und der Badewanne (Mischbatterie und Handdusche) geben den letzten Feinschliff', 'Wir befinden uns im Bezirk Niederschönhausen von Berlin-Pankow. Die Buchholzer Straße ist eine ruhige und sehr grüne Wohnstraße. Die nächste Bushaltestelle ist nur 2 Gehminuten entfernt und führt innerhalb von wenigen Stationen zum S- und U-Bahnhof Panow. Supermärkte, das Einkaufszentrum, Schulen, Kitas, Restaurants und Kaffee´s sind in nur wenigen Minuten mit dem Fahrrad oder dem Auto in allen Richtungen erreichbar.'];ONE_YEAR_FREE;40 MBit/s;telekom_layer_magenta_l;78;über VDSL;REGULAR;;MagentaZuhause L;100 MBit/s;https://padlock.link/ioml;https://padlock.link/ml;true;100 MBit/s;web,email,bank,music,dl-ul,game,sd,mltstr,hd,fast-ul-dl;2020;
2020-05-24 20:39:26.857538;Berlin;central_heating;6735470;n;y;https://pictures.immobilienscout24.de/listings/e82fb241-704f-4206-b329-0f2f4a8ce297-863886466.jpg/ORIG/resize/118x118%3E/extent/118x118/format/jpg/quality/80;9;14.14;1973;;;62285641;;district_heating;n;false;y;Berlin;y;4;3;256;22;;;41.15;Berlin;14197;well_kept;sophisticated;;false;no_information;Schlangenbaderstr. ;y;Schlangenbaderstr._;apartment;14197;2;;n;4;2,active;Deutschland;standard;wohnung_kauf;n;1;;true;001.6735470;176800;profile0;5;2;true;n;showqualicontactform;y;n;Wilmersdorf_Wilmersdorf;SCHB;2;Berlin;/expose/62285641;['Schöne helle 1,5 Zimmer Wohnung im Rheingauviertel . Ideal geschnitten , Einbauküche, renoviertes Bad mit großer Badewanne,   Barrierefreier Zugang ins Haus und in die Wohnung . Lift ! Balkon !', 'Großzügige 1,5 Zimmer Wohnung mit abgeteiltem Schlafraum und offener Küche.\nDIE BILDER ENTSTAMMEN EINER IDENTISCHEN VERGLEICHSWOHNUNG. \nDurch ebenerdige Eingänge und Aufzüge auf jeder Etage ist die Wohnung auch ideal für ältere Menschen oder Menschen mit körperlicher Behinderung. Junge fitte Menschen fühlen sich hier aber auch sehr wohl. Der nahe Grunewald lockt zum joggen und die ideale Verkehrsanbindung macht das Leben praktisch.', 'Zentral im Rheingauviertel ! Sowohl der Rüdesheimer Platz als auch die Schmargendorf sind fußläufig erreichbar. Bestens an den öffentlichen Nahverkehr angebunden ist die Wohnlage ideal für Alle welche viel Grün mitten in der Stadt suchen !', 'Die Wohnung ist ab Juli 2020 BEZUGSFREI. Wird aber im Moment noch bewohnt. Gerne vereinbaren wir mit Ihnen einen individuellen Besichtigungstermin. \nWir freuen uns über Ihre Anfrage ! \nRufen Sie uns an ! 030 / 80401960 bzw. 01794582268  Bitte beachten Sie daß wir nur Anfragen mit vollständiger Namens und Adressangabe sowie einer Tel. Nr. beantworten können.'];ONE_YEAR_FREE;40 MBit/s;telekom_layer_magenta_l;41.19;über VDSL;REGULAR;;MagentaZuhause L;100 MBit/s;https://padlock.link/ioml;https://padlock.link/ml;true;100 MBit/s;web,email,bank,music,dl-ul,game,sd,mltstr,hd,fast-ul-dl;2015;
2020-05-24 20:39:27.213406;Berlin;;309825;n;n;https://pictures.immobilienscout24.de/listings/88c89cf1-0990-4cc1-98bb-0ffb2cc1a07d-1370993991.jpg/ORIG/resize/118x118%3E/extent/118x118/format/jpg/quality/80;9;14.43;;;14.43;118687703;;no_information;n;false;n;Berlin;n;10;;;41;;7.95;501;Berlin;13347;no_information;no_information;;false;no_information;Nazarethkirchstr.;n;Nazarethkirchstr.;other;13347;1;;n;;2,active;Deutschland;standard;wohnung_kauf;n;;;true;001.309825;790000;profile1_listingtype;;1;true;n;;n;n;Wedding_Wedding;85f502d0-ebd5-49bd-9103-389efba41402;7;Berlin;/expose/118687703;['Bestand: \nDas bestehende Wohnhaus wurde 1904-05 auf der Ecke Nazareth-kirchstraße / Malplaquetstraße errichtet. Es besitzt drei Treppenhäuser die jeweils zwei Wohnungen pro Etage erschließen. Das Haus hat fünf Geschosse und einen, für die Entstehungszeit typischen,voluminösen Dachaufbau. Das Dach sitzt ohne Drempel oder besondere Attikakon-struktion direkt auf der obersten Geschossdecke auf. Die Baukonstruk-tion des Hauses ist konventionell, mit tragenden Mauerwerkswänden und Holzbalkendecken. Das Dach ist eine Holzkonstruktion mit Ziegel- und \nPappdeckung. Im Dachbereich existieren zwei der Straße zugewandte Giebel und ein Turmaufbau auf der Straßenecke. Es liegt ein Holzgut-achten vor, das die Schäden an der Geschossdecke untersucht und sie als örtlich und kleinteilig zu beseitigende eingestuft.  \n\nPlanung: \nDie Decke wird nach ihrer Sanierung als Holz-Beton Verbundkonstruktion für den Brand- und Schallschutz ertüchtigt. Die bestehende Holzkonstruktion wird abgetragen und durch neue Konstruktionen aus Holz und Stahl ersetzt. Bei den Mauerwerkswänden bleiben die Wände von Treppenhäusern und die bestehende Brandwand erhalten. Die Wohnungstrennwand wird als neue Mauerwerkswand in das Dachge-schoss fortgesetzt. Die vorhandenen Kaminzüge bleiben zum größten Teil erhalten und werden statisch und konstruktiv in die neuen Baukonstruktionen integriert. Das Dachgeschoss wird in zwei Einheiten unterteilt.\nDas Dach hat eine maximalen Ausbauhöhe von 7, 17 Metern. Es lassen sich zwei Wohnebenen realisieren.\nEin Aufzug zur Erschließung beider Einheiten ist genehmigt. ', 'Es sind zwei großzügige Wohnungen mit folgenden Größen genehmigt.\n\nWohnung 1                                                      Wohnung 2\nEbene 1         185,4 m²                                    Ebene 1          153,0 m²\nEbene 2          73,8 m²                                    Ebene 2           22,9 m²\nTerrassen       80,1 m²                                     Terrassen        51,8 m²\n\nWohnung 1 kann auch geteilt werden, dann sind 3 Wohnungen mit Erschließung über den Aufzug möglich.', 'Makleraufträge werden nicht erteilt. Der Dachrohling wird provisionsfrei verkauft. '];ONE_YEAR_FREE;40 MBit/s;telekom_layer_magenta_l;;über VDSL;REGULAR;;MagentaZuhause L;100 MBit/s;https://padlock.link/ioml;https://padlock.link/ml;true;100 MBit/s;web,email,bank,music,dl-ul,game,sd,mltstr,hd,fast-ul-dl;;
2020-05-24 20:39:27.573122;Berlin;central_heating;17576674;n;y;https://pictures.immobilienscout24.de/listings/d0665244-64f4-4717-a26b-778eed4e065e-1371032901.jpg/ORIG/resize/118x118%3E/extent/118x118/format/jpg/quality/80;24;12.24;1898;;12.24;118719072;;;y;false;y;Berlin;y;11;1;845;28;;6.53;219;Berlin;10777;no_information;no_information;;false;no_information;"Nollendorfstra&szlig;e";y;Nollendorfstraße;apartment;10777;5;;n;;2,active;Deutschland;standard;wohnung_kauf;n;3;;true;009.f22cdcd4-a268-48d7-9db8-7856769644ba;2250000;profile0;;5;true;n;showqualicontactform;n;n;Schöneberg_Schöneberg;118719072;7;Berlin;/expose/118719072;"['Das ganze Haus wurde seit den 90iger Jahren immer weiter gründlich saniert: z.B. Fassaden, Fahrstuhleinbau, Erneuerung aller Wasserzu- und –ableitungen, Klingelanlagen, Ausbau des großen Hinterhofs zu einem Garten und Spielplatz, Restaurierung des denkmalgeschützten Aufgangs, Schornsteine erneuert und vieles mehr. Der Gesamtwert des Hauses mit 44 Wohnungen ist daher hoch. \nDie Wohnung befindet sich im 3. Obergeschoss.\nEin großer Innenhof mit Fahrradstellplätzen, Baumbestand und einem Garten mit Sitzgruppe  lädt zum Lesen oder zum Picknick ein.', 'Das Haus steht unter Denkmalschutz, die Wohnung ist mit hochwertigem originalem Parkett ausgestattet. Die Decken sind zum Teil aufwändig bemalt. Die geräumige Loggia erweitert den Wohnwert. Zwei moderne Bäder sind im Jahr 2013 neu erstellt worden. In der Wohnküche ist ein Kamin mit Backofen vorhanden. Die Hochwertige Kücheneinrichtung ist im Kaufpreis enthalten.\nZu der Wohnung gehört eine Remise im 2. Hinterhof von ca. 25 qm die gewerblich genutzt werden kann.', ""Die Nollendorfstraße ist eine Wohn- und Einkaufsstraße im Berliner Ortsteil Schöneberg, die im späten 19.\xa0Jahrhundert angelegt wurde. Häufig wird sie nur die Nolle genannt.\n\nDie Nollendorfstraße gehörte zu den Schöneberger Straßen, die der Hobrecht'sche Bebauungsplan festsetzte. Den Namen erhielt sie 1864 genauso wie auch der Nollendorfplatz in Erinnerung an die Schlacht von 1813 bei Kulm und Nollendorf im Sudetenland. Die Straße liegt in der Nähe des sogenannten „Generalszuges“, dessen Straßen und Plätze nach Generälen und Schlachten der Befreiungskriege 1813–1815 benannt sind.\n\nDer Abschnitt zwischen der Eisenacher Straße und der Maaßenstraße ist eine von Autos befahrbare Zone mit Kleincafés, Friseursalons und Restaurants, wogegen der Abschnitt von der Maaßenstraße bis zur Zietenstraße eine von Mietshäusern dominierte Fußgängerzone ist.\n\nDer Winterfeldtplatz ist ein Wochenmarktplatz im Norden des Ortsteils Schöneberg des Berliner Bezirks Tempelhof-Schöneberg. Der in Nordsüdrichtung angeordnete, langrechteckige Platz mit einer Abmessung von rund 280\xa0Metern\xa0×\xa080\xa0Metern ist über die Maaßenstraße mit dem nur 200\xa0Meter weiter nördlich angrenzenden Nollendorfplatz samt U-Bahnhof der Linien U1, U2, U3 und U4 verbunden. Diese Achse verlängert sich im weiteren Verlauf über den Lützowplatz bis hin zum Großen Stern mit der Siegessäule.\n\nAuf dem bereits früher als Wochenmarkt genutzten Platz findet seit 1990 wieder jeden Mittwoch von 8 bis 13\xa0Uhr und jeden Samstag bis 15\xa0Uhr der größte Gemüse- und Wochenmarkt Berlins statt. An Samstagen hat sich der Markt mit seinen rund 250 Ständen zu einem überaus beliebten Magnet für Besucher von nah und fern entwickelt. An den anderen Tagen skaten und spielen dort Fußberollte Rollhockey.\nRund um den Platz floriert seit Jahrzehnten ein umfangreiches Angebot verschiedener Antiquariate.\nQuerstraßen wie die Winterfeldtstraße, Maaßenstraße, Pallasstraße und Goltzstraße bieten traditionsreiche Kneipenszenen und multikulturelle Restauration. Café Berio, Slumberland und das Habibi gehören seit vielen Jahren zu beliebten Institutionen. Seit einigen Jahren wächst das gastronomische Angebot beständig. Neben dem Hackeschen Markt, der Bergmannstraße, der Oderberger Straße, der Oranienburger Straße, der Oranienstraße, dem Kollwitzplatz und der Simon-Dach-Straße ist der Winterfeldtplatz ein Zentrum der Berliner Kneipen- und Café-Szene.\nDie nobelsten und vielfältigsten Angebote bietet das berühmte Kaufhaus des Westens am Wittenbergplatz. Wer Antiquitäten, insbesondere alte Bücher, liebt, kommt in den Straßen um den Winterfeldtplatz voll zum Zuge.\nBesonders zwischen Nollendorfplatz und Hauptstraße sorgt eine sehr lebendige Kneipenszene für Atmosphäre und hohen Freizeitwert. Charakteristisch ist geschlossene Bauweise. Über die Hälfte der Häuser ist Altbaubestand und inzwischen in der Regel modernisiert.\n\nDer Norden Schönebergs ist wegen seiner lebhaften Kultur- und Kneipenszene als Wohnadresse gerade bei jüngeren Leuten sehr beliebt.""]";ONE_YEAR_FREE;40 MBit/s;telekom_layer_magenta_l;219;über VDSL;REGULAR;;MagentaZuhause L;100 MBit/s;https://padlock.link/ioml;https://padlock.link/ml;true;100 MBit/s;web,email,bank,music,dl-ul,game,sd,mltstr,hd,fast-ul-dl;2013;
2020-05-24 20:39:27.912989;Berlin;central_heating;164338;y;n;https://pictures.immobilienscout24.de/listings/6734fba3-cb0b-4451-acfb-5325fa7cbc4f-1371024607.jpg/ORIG/resize/118x118%3E/extent/118x118/format/jpg/quality/80;11;10.62;2019;;10.62;118714779;;no_information;n;false;y;Berlin;y;8;9;;no_information;;5.93;81;Berlin;13187;mint_condition;sophisticated;;false;no_information;no_information;y;no_information;ground_floor;13187;3;;n;;2,active;Deutschland;top;wohnung_kauf;n;;;true;001.164338;495000;profile0;4;3;true;n;showqualicontactform;n;n;Pankow_Pankow;AIB12952;4;Berlin;/expose/118714779;"['Es handelt sich um eine erstklassige 3-Zimmer-Gartenwohnung mit ca. 81 qm exklusiver und moderner Wohnfläche, gelegen im Erdgeschoss eines Neubaus aus dem Jahre 2019.\r\rDie Wohnung verfügt über 74,65 qm Nettowohnfläche ohne Terrasse. Die 12,59 qm Terrassenfläche sind zu 50 % in die Wohnflächenberechnung angerechnet worden. Die Wohnung befindet sich in einem erstklassigen und modernen Zustand. Somit verfügt die Wohnung über 81 qm Wohnfläche. Die ca. 35 qm Gartenfläche sind nicht eingerechnet worden. \r\rDie Wohnung verfügt über einen offenen Eingangsbereich, ein exklusives Wohn- & Speisezimmer mit offener Küche, ein modernes Badezimmer sowie ein erstklassiges Schlafzimmer.   \rZu den besonderen Ausstattungsmerkmalen gehören: hochwertige Gesamtausstattung, Parkettböden, Fußbodenheizung, bodentiefe Fenster, Sonnenterrasse.\rDie Wohnung kann auch teilgewerblich genutzt werden.\rDie Wohnung ist nach Absprache bezugsfrei.', 'Eine gefragte Adresse in zentraler Lage von Berlin-Pankow – dicht Schlosspark Schönhausen! Öffentliche Verkehrsmittel, Einkaufsmöglichkeiten sowie mehrere Kindergärten befinden sich unmittelbarer Nähe. ', 'Unser Service für Eigentümer\rWir stehen Ihnen bei dem Verkauf Ihrer Immobilie vom Anfang bis zum fertigen Abschluss diskret und kompetent zur Verfügung. \rJeder Schritt erfolgt nach Absprache mit Ihnen. \rSie entscheiden über die Verkaufsstrategie Ihres Objektes, ob diskret und ""off-market"" oder eine qualifizierte Vermarktung in Print- sowie Onlinemedien. \rWir verfügen immer über den richtigen Käufer. \rZudem bewerten wir Ihre Immobilie kostenfrei, entsprechend dem aktuellen Marktwert.\rGerne beraten wir Sie kostenlos persönlich in unserem Büro, per Telefon oder per E-Mail!\rWir freuen uns von Ihnen zu hören!\rwww.immo-boerse.com']";ONE_YEAR_FREE;40 MBit/s;telekom_layer_magenta_l;;über VDSL;REGULAR;;MagentaZuhause L;100 MBit/s;https://padlock.link/ioml;https://padlock.link/ml;true;100 MBit/s;web,email,bank,music,dl-ul,game,sd,mltstr,hd,fast-ul-dl;;
2020-05-24 20:39:28.257560;Berlin;;17476392;n;y;https://pictures.immobilienscout24.de/listings/1b7a37ae-fc3b-4fb8-bcf8-42c836f49488-1371045599.jpg/ORIG/resize/118x118%3E/extent/118x118/format/jpg/quality/80;3;10.62;1994;;10.62;118723759;2;gas;y;true;y;Berlin;y;7;5;238;no_information;energy_required;5.96;103;Berlin;13189;no_information;normal;D;false;outside;no_information;n;no_information;no_information;13189;4;129.8;n;;2,active;Deutschland;standard;wohnung_kauf;n;1;;true;002.01008218971;399900;profile0;2;4;true;y;;n;n;Pankow_Pankow;WI 26233;5;Berlin;/expose/118723759;['Diese sofortigen Bezug geeignete Familienwohnung besticht durch mehrer Punkte, welche einer bis zu 4 köpfigen Familie beim Wohnungserwerb wichtig sein sollten.\n\nDazu nur ein wenig nach dem eigenen Geschmack renoviert, fertig ist das neue Familienheim.\n\nFür Einzelheiten fordern sie gern unser Expose ab.', '4 Zimmer \nKüche mit EBK\nGäste-WC mit Fenster\nTageslichtbad mit Wanne und Dusche\nFertigparkett in den Zimmern\nAbstellraum in und ausserhalb der Wohnung\ngroßer Balkon nach Süden\nseperater Gartenanteil zur Alleinbenutzung\n2 Pkw-Stellplätze\nKellerabteil\nWaschküche mit Anschlussmöglichkeit für WM und Trockner im Keller\nseperater Fahradraum', 'ruhige Anliegerstrasse \nfußläufig zum S-Bahnhof Wilhelmsruh', 'Das Haus wird im Alleinauftrag angeboten.\n\nGerne stehen wir für weitere Informationen zur Verfügung und vereinbaren bei Interesse einen individuellen Beratungstermin oder eine Begehung vor Ort.\n\nAuf Wunsch stellen die Experten der Wüstenrot Ihnen mögliche Finanzierungsmodelle vor und fertigen für Sie ein unverbindliches und passendes Finanzierungsangebot nach Ihren Vorgaben.\n\nBitte haben Sie Verständnis dafür, dass wir im Sinne unserer Auftraggeber nur nach Übermittlung Ihrer vollständigen Kontaktdaten weitere Unterlagen bereitstellen können. \n\nAlle im Exposé enthaltenen Angaben und Daten stammen vom Eigentümer und Auftraggeber.\nHaftungsausschluss: Trotz sorgfältiger Bearbeitung von Daten, Bildern und Informationen übernehmen wir keine Haftung für die Richtigkeit der Angaben, ebenso wenig für die Lieferfähigkeit des Angebotes bei Vermietung oder Verkauf.'];ONE_YEAR_FREE;40 MBit/s;telekom_layer_magenta_l;;über VDSL;REGULAR;;MagentaZuhause L;100 MBit/s;https://padlock.link/ioml;https://padlock.link/ml;true;100 MBit/s;web,email,bank,music,dl-ul,game,sd,mltstr,hd,fast-ul-dl;;
