timestamp;obj_regio1;obj_heatingType;obj_telekomTvOffer;obj_cId;obj_newlyConst;obj_balcony;obj_picture;obj_picturecount;obj_pricetrend;obj_telekomUploadSpeed;obj_telekomTrackingGroup;obj_telekomInternetTechnology;obj_yearConstructed;obj_telekomInternetType;obj_galleryAd;obj_pricetrendbuy;obj_scoutId;obj_firingTypes;obj_hasKitchen;obj_ExclusiveExpose;obj_telekomInternetProductName;obj_courtage;geo_bln;obj_cellar;obj_purchasePriceRange;obj_yearConstructedRange;obj_houseNumber;obj_energyType;obj_pricetrendrent;obj_livingSpace;geo_krs;obj_zipCode;obj_condition;obj_interiorQual;obj_energyEfficiencyClass;ga_cd_cxp_historicallisting;obj_telekomDownloadSpeed;obj_parkingSpace;obj_street;obj_lift;obj_telekomInternetUrlMobile;obj_telekomInternetUrl;obj_streetPlain;obj_typeOfFlat;geo_plz;obj_noRooms;obj_thermalChar;obj_assistedLiving;obj_ityp;obj_telekomHdTelephone;geo_land;ga_cd_via;obj_telekomInternet;obj_immotype;obj_rented;obj_telekomInternetServices;obj_telekomInternetProductAvailable;obj_cwId;obj_purchasePrice;ga_cd_application_requirements;obj_noRoomsRange;ga_cd_maillead_default_shown;obj_garden;evt_count_pm_sig;obj_barrierFree;obj_international;obj_regio3;obj_objectnumber;obj_livingSpaceRange;obj_regio2;URL;beschreibung;obj_usableArea;obj_noParkSpaces;obj_rentSubsidy;obj_lastRefurbish;obj_groupnumber;obj_project_id;obj_floor;obj_nbp;ga_cd_via_qualified;obj_numberOfFloors;obj_telekomHybridUploadSpeed;obj_telekomHybridDownloadSpeed
2020-05-24 20:55:46.553249;Berlin;central_heating;ONE_YEAR_FREE;174522;n;y;https://pictures.immobilienscout24.de/listings/f6c96858-7273-436a-a2b9-0b0e60165772-1364601614.jpg/ORIG/resize/118x118%3E/extent/118x118/format/jpg/quality/80;9;12.19;40 MBit/s;telekom_layer_magenta_l;über VDSL;1900;REGULAR;disabled;12.19;117583504;natural_gas_heavy;n;true;MagentaZuhause L;y;Berlin;y;10;1;no_information;energy_consumption;7.44;130;Berlin;10997;no_information;no_information;D;false;100 MBit/s;no_information;no_information;n;https://padlock.link/ioml;https://padlock.link/ml;no_information;apartment;10997;4;128;n;2,active;true;Deutschland;top;100 MBit/s;wohnung_kauf;n;web,email,bank,music,dl-ul,game,sd,mltstr,hd,fast-ul-dl;true;001.174522;799000;profile0;4;true;n;showqualicontactform;n;n;Kreuzberg_Kreuzberg;117583504;6;Berlin;/expose/117583504;['Diese Wohnung bietet das Erlebnis heller salonartiger Zimmer unter ca. 3,40 Meter hohen Decken mit schönen Aussichten in den Hof und einem behagliche Altbauambiente. Frappant ist der großzügige Wohn- und Essbereich, der aus den zwei größten Zimmern besteht. Denkbar ist, einen Teil als geschlossenes viertes Zimmer abzutrennen. Die beiden Grundbücher ermöglichen auch die Wiedereinrichtung zweier separat zugänglicher Wohnungen. Faszinierend sind die charaktervollen originalen Altbauelemente, wie z.B. die Holzprofiltüren, Holzdielenböden und großen Doppelkastenfenster. Ansprechend geräumig ist auch die gepflegte Küche, die ebenfalls einen markanten Holzdielenboden besitzt und auf die westwärts orientierte Loggia führt. Die zweite Sonnenloggia in bester Südlage zum baumbegrünten Hof ist von einem der beiden Schlafzimmer im Seitenflügel zugänglich. Dazwischen befindet sich eines der zwei Bäder, die jeweils mit einer Wanne ausgestattet sind. Diese sehr attraktive Wohnung zeigt sich in einem gepflegten Zustand. Für behagliche Raumstimmungen sorgt die Gaszentralheizung. Dieser beeindruckenden Wohnung ist ein Kellerraum zugeordnet. Fahrradabstellplätze sind im schönen Hof angelegt. Die Parkplatzsituation für Pkw ist für die Gegend recht gut.\nViel Bewegungsraum für Privates und Geselliges, anregend tagesbelichtet, charmante Interieurs, reizvolle Aussichten und eine  motivierende Kiezlage, das sind die Zutaten für eine exzellente Wohnqualität in Kreuzberg.', 'Sie möchten den Marktwert Ihrer Immobilie wissen oder Ihre Immobilie verkaufen? Wir sind seit 1995 erfolgreich im Verkauf von Immobilien in Berlin, Potsdam und Umgebung tätig. Unsere exzellenten Eigentümerbewertungen sprechen für sich.\n\n•\tOftmals haben wir schon den richtigen Käufer für Ihre Immobilie in unserer Kartei\n•\tWir sind Bellevue Best Property Agent und Mitglied in den Verbänden IVD & FIABCI\n•\tWir benötigen keinen schriftlichen Alleinauftrag\n•\tKosten entstehen Ihnen bei uns keine\n•\tUnsere Spezialisten stehen Ihnen gerne für ein erstes – für Sie unverbindliches - Gespräch zur Verfügung\n\nWir freuen uns über Ihre Kontaktaufnahme unter einkauf@immoberlin.de oder (030) 895 72 20.\nBitte besuchen Sie auch unsere Website: \nhttps://www.immoberlin.de'];;;;;;;;;;;;
2020-05-24 20:55:46.996736;Berlin;central_heating;ONE_YEAR_FREE;210901;n;y;https://pictures.immobilienscout24.de/listings/6818b422-0167-4f25-bfa8-e8f5881e7077-1365954413.jpg/ORIG/resize/118x118%3E/extent/118x118/format/jpg/quality/80;10;11.19;40 MBit/s;telekom_layer_magenta_l;über VDSL;1969;REGULAR;;11.19;117578533;oil;n;false;MagentaZuhause L;y;Berlin;n;4;2;no_information;energy_consumption;5.36;72;Berlin;13403;no_information;no_information;E;false;100 MBit/s;no_information;no_information;y;https://padlock.link/ioml;https://padlock.link/ml;no_information;ground_floor;13403;2.5;143;n;2,active;true;Deutschland;top;100 MBit/s;wohnung_kauf;n;web,email,bank,music,dl-ul,game,sd,mltstr,hd,fast-ul-dl;true;001.210901;195000;profile0;2;true;n;showqualicontactform;n;n;Wittenau_Reinickendorf;W-02I3T9a;3;Berlin;/expose/117578533;['Hereinspaziert! Entdecken Sie diese interessante Immobilie bei einer virtuellen Besichtigung bequem von zu Hause aus. Wir senden Ihnen gern das Exposé mit einem Link für den 3D-Rundgang. Zeit für Ihr Eigentum! Zum Verkauf steht eine schöne 2,5 Zimmer Wohnung im Erdgeschoss eines gepflegten Mehrfamilienhauses und bietet Wohnraum für Singles, Pärchen oder Familien mit einem Kind. Bereits beim Betreten der 72 m² Wohnung erkennt man an der großen Diele den funktionellen Grundriss, welcher sich weiterhin fortsetzt. In der Küche können Sie sich frei entfalten und Ihre Kochträume wahr werden lassen. Der ausgelegte Laminatboden erstreckt sich außer im gefliesten Bad und der Küche über die gesamte Wohnung. Des Weiteren verfügen die Kunststofffenster über eine doppelte Verglasung und sind mit manuellen Rollläden ausgestattet. Das Badezimmer wurde im vergangenen Jahr saniert und verfügt über eine ebenerdige Dusche, eine neue Belüftungsanlage und einen Handtuchheizkörper. In der kompletten Wohnung ist die Elektrik ausgetauscht worden und mit kindersicheren Steckdosen versehen. Ein vollständig verglaster Balkon rundet die gemütliche Wohnatmosphäre ab. Ebenso ist ein Stellplatz direkt auf dem Grundstück des Mehrfamilienhauses anmietbar.', 'Art Energieverbrauchsausweis \nEndenergieverbrauch 143 kWh/(m²*a) \nBefeuerungsart Öl \nBaujahr 1969 \nEnergieeffizienzklasse E', 'Der nördliche Bereich des Stadtteils Reinickendorf ist ein grüner Wohnbezirk und vereinigt die Vorzüge eines Wohngebiets mit guter Anbindung an die Innenstadt. Die Wohnung liegt in einem familienfreundlichen Umfeld mit Mehrfamilienhäusern. Im näheren Umfeld befinden sich fußläufig Kindereinrichtungen, Schulen, Sporteinrichtungen und Ärzte. Des Weiteren haben Sie Einkaufsmöglichkeiten in der Nähe und können Bankerledigungen tätigen und zugleich einen Spaziergang durch den Park machen um frische Luft zu holen. Die öffentlichen Verkehrsmittel U-Bahnhof Rathaus Reinickendorf, die S-Bahnlinie 25 und auch die Buslinie 221 bieten schnelle Verbindungen in die City. Ebenfalls ist die Stadtautobahn 111 und die Bundesstraße 96 gut mit dem Auto zu erreichen. Den Flughafen Tegel erreicht man in ca.10 Autominuten. Hier lässt sich ein ruhiges und naturnahes Wohnen mit städtischem Leben verbinden.', 'Sie möchten Ihre Immobilie verkaufen? Wir sind Ihnen dabei gern behilflich - engagiert, diskret und für Sie kostenlos! \nNutzen Sie unseren Rundumservice: von der Einschätzung, über das Finden eines bonitätsgeprüften Käufers, die Begleitung zum Notar bis zur endgültigen Übergabe. \nWir sind für Sie da und freuen uns auf Ihren Anruf. \nENGEL&VÖLKERS Berlin-Köpenick Tel: +49 30 58 59 90 50 \nDie Courtage in Höhe von 7,14 % inkl. der gesetzlichen Mehrwertsteuer auf den Kaufpreis ist mit dem Zustandekommen des Kaufvertrages (notarieller Vertragsabschluß) verdient, fällig und vom Käufer zu zahlen. Die Höhe der Bruttocourtage unterliegt einer Anpassung bei Steuersatzänderung. Die Vermittelnden und/oder Nachweisende Engel & Völkers Frohnau - Köpenick GmbH (Lizenznehmer der Engel & Völkers Immobilien GmbH ) und ggf. deren Beauftragter, erhalten einen unmittelbaren Zahlungsanspruch gegenüber dem Käufer. Alle Angaben sind ohne Gewähr und basieren ausschließlich auf Informationen, die uns von unserem Auftraggeber zur Verfügung gestellt wurden. Wir übernehmen keine Gewähr für die Vollständigkeit, Richtigkeit und Aktualität dieser Angaben. Die Grunderwerbsteuer, Notar- und Grundbuchkosten sind vom Käufer zu tragen. Im Übrigen gelten unsere Allgemeinen Geschäftsbedingungen. Irrtum und Zwischenverkauf vorbehalten.'];5;0;450;2019;540;;;;;;;
2020-05-24 20:55:47.362340;Berlin;no_information;ONE_YEAR_FREE;174522;n;n;https://pictures.immobilienscout24.de/listings/823186c5-e7dd-4b21-8c51-56fbb677b5ec-1364601230.jpg/ORIG/resize/118x118%3E/extent/118x118/format/jpg/quality/80;11;10.99;40 MBit/s;telekom_layer_magenta_l;über VDSL;;REGULAR;disabled;10.99;117583443;;y;true;MagentaZuhause L;y;Berlin;y;6;;no_information;;5.59;91;Berlin;13585;no_information;no_information;;false;100 MBit/s;no_information;no_information;n;https://padlock.link/ioml;https://padlock.link/ml;no_information;apartment;13585;3;;n;2,active;true;Deutschland;top;100 MBit/s;wohnung_kauf;n;web,email,bank,music,dl-ul,game,sd,mltstr,hd,fast-ul-dl;true;001.174522;300000;profile0;3;true;n;showqualicontactform;n;n;Spandau_Spandau;117583443;4;Berlin;/expose/117583443;['Im rückwärtigen Gartenhaus können Sie in dieser Wohnung eine sehr ruhige Lage genießen. Angenehm ist auch die Besonnung: Das größte Zimmer, ein kleineres Zimmer und die Küche haben Isolierfenster in den Süden. Das renovierungsbedürftige Badezimmer mit Wanne ist ebenfalls taghell. Eine Küchenausstattung gehört nicht zum Kaufumfang. Schön ist, dass in beide Richtungen der Blick auf Bäume in den Innenhöfen fällt. Für die Wärmeversorgung ist eine Gasetagenheizung zuständig.\nDieser Wohnung ist ein Kellerraum zugeordnet.\nMit ihren geräumigen Zimmerdimensionen und anregenden Tageshelligkeit bildet diese Wohnung eine exzellente Basis, um sich auf einfache Weise behaglich einrichten zu können, in einer attraktiven Spandauer Lage. \nEin Energieausweis ist nicht vorhanden.', 'Sie möchten den Marktwert Ihrer Immobilie wissen oder Ihre Immobilie verkaufen? Wir sind seit 1995 erfolgreich im Verkauf von Immobilien in Berlin, Potsdam und Umgebung tätig. Unsere exzellenten Eigentümerbewertungen sprechen für sich.\n\n•\tOftmals haben wir schon den richtigen Käufer für Ihre Immobilie in unserer Kartei\n•\tWir sind Bellevue Best Property Agent und Mitglied in den Verbänden IVD & FIABCI\n•\tWir benötigen keinen schriftlichen Alleinauftrag\n•\tKosten entstehen Ihnen bei uns keine\n•\tUnsere Spezialisten stehen Ihnen gerne für ein erstes – für Sie unverbindliches - Gespräch zur Verfügung\n\nWir freuen uns über Ihre Kontaktaufnahme unter einkauf@immoberlin.de oder (030) 895 72 20.\nBitte besuchen Sie auch unsere Website: \nhttps://www.immoberlin.de'];;;;;;;;;;;;
2020-05-24 20:55:47.941158;Berlin;no_information;;18347473;n;y;https://pictures.immobilienscout24.de/listings/e8e4872c-415c-40af-b7ca-6a5565991d39-1360533487.jpg/ORIG/resize/118x118%3E/extent/118x118/format/jpg/quality/80;6;10.99;;;;;;;10.99;116961883;;n;true;;n;Berlin;n;8;;4-8;;5.65;75;Berlin;13585;first_time_use;sophisticated;;false;;underground_garage;"Parkstra&szlig;e";y;;;Parkstraße;apartment;13585;3;;n;2,active;;Deutschland;schaufenster;;wohnung_kauf;n;;false;002.01009147967;476000;profile0;3;true;n;showqualicontactform;y;n;Spandau_Spandau;89679_H3 _078;3;Berlin;/expose/116961883;['Das Wohnensemble HAVELKIESEL erschließt Spandaus schönste Seiten.\n\nAls jüngster Teil des Wohnquartiers BUWOG SPEICHERBALLETT ist die Anlage HAVELKIESEL alles außer gewöhnlich: Die drei modernen Wohngebäude, eines von ihnen sanft abgerundet wie ein Kieselstein – daher der Name des Ensembles –, ruhen in einzigartiger Lage direkt am Flusslauf der Havel. Die Mehrzahl der 100 Eigentumswohnungen gewährt einen direkten Blick auf das Wasser und die vorbeiziehenden Boote – eine Szenerie, die einlädt, allein oder in gemütlicher Runde auf Balkon oder Terrasse den Stress des Alltags abzuschütteln und den Tag ausklingen zu lassen. \n\nSo naturnah und entschleunigt Sie im HAVELKIESEL auch leben, das Zentrum Spandaus, mit seiner historischen Altstadt und dem ICE-Bahnhof, ist nur wenige Minuten entfernt und die Verkehrsverbindungen in die Berliner City sind optimal. Auch Ihre Kinder werden sich hier wohlfühlen – ob auf den Spielplätzen oder im idyllischen, begrünten Innenhof.\n\nQuartiers-Highlights:\n\n- Direkte Wasserlage an der Havel, vis-à-vis der Insel Eiswerder\n- Quartierseigene Kita und Spielplätze\n- Autofreies Wohnquartier und innovatives Mobilitätskonzept\n- Nachhaltiges Wassermanagement\n- Ressourcenschonendes Energiekonzept\n- Barrierefrei zugängliche Außenbereiche mit Sitz- und Begegnungsflächen', 'Highlights dieser Wohnung\n\n- Barrierefrei nach BauO Bln §50\n- Großzügiger Wohn-/Koch-/Essbereich\n- Ca. 17 m² großer Masterbedroom\n- Weiteres Schlaf-/Kinderzimmer\n- Komfortables Duschbad\n- Balkon\n\nWeitere Ausstattungs-Details\n\n- Lichte Räume mit Deckenhöhe bis ca. 2,75 m\n- Bodentiefe Fenster\n- Eichenparkettboden\n- Deckenheizungssystem mit Kühlfunktion\n- Hochwertige Fliesen und Sanitärprodukte von Villeroy & Boch\n- Digitale Medienversorgung\n- Schön gestalteter, begrünter Hof mit Sitzgelegenheiten und Begegnungsflächen\n- Photovoltaikanlage\n- Tiefgarage mit E-Auto-Ladeplätzen\n- Tiefgaragenstellplatz, zzgl. ab 29.500,00 €', 'Als Teil des neuen Wohlfühlquartiers BUWOG SPEICHERBALLETT entsteht das einzigartige Wohnensemble HAVELKIESEL: direkt am Wasser und von Grün umgeben. Vor Ihnen liegt die idyllische Spandauer Havel, vis-à-vis die Insel Eiswerder, ein Stückchen weiter die Zitadelle Spandau, eine der besterhaltenen Renaissancefestungen Europas, wo vielfältige Kulturveranstaltungen wie z.B. Konzerte, Ausstellungen und Familienevents stattfinden. Der weitläufige Spandauer Forst ist nahe gelegen, und wenn Sie wollen, können Sie die Uferpromenade entlang bis zur nächsten Badestelle flanieren oder in den nahe gelegenen Parks joggen. Nicht zu vergessen: Vor Ihrer Haustür liegt der Havel-Radweg, einer der schönsten Flussradwege Deutschlands.\n\nDie grüne Wasserlage ist nur die eine Seite. Sie profitieren zugleich von der Nähe zum Stadtzentrum. Zu Shopping, Gastronomie und Kultur in der Fußgängerzone der Spandauer Altstadt oder den Spandau Arcaden sind es wenige Minuten, in einer halben Stunde kommen Sie nach Berlin-Mitte oder in die City West. Und soll es weiter weg gehen, dann sind Sie im Handumdrehen am ICE-Bahnhof Spandau. Von dort fährt auch der Airport-Express ohne Umsteigen zum Flughafen Schönefeld/BER. Die optimale Infrastruktur mit Kitas, Schulen, Ärzten, Geschäften und allem, was man für den täglichen Bedarf braucht, macht das BUWOG SPEICHERBALLETT zu einem perfekten Zuhause.\n\nBESTE ANBINDUNG\n\n- Nah an der City: ca. 30 Minuten bis Bahnhof Zoologischer Garten, Kurfürstendamm und Berlin-Mitte\n- Ca. 15 Minuten Spaziergang zur Altstadt Spandau\n- Perfekt vernetzt ab Bahnhof Spandau mit ICE-Anschluss\n- Ca. 15 Minuten bis zur Autobahn A100', 'Wir sind für Sie da!\n\nUnser Vertriebsteam ist auch aus dem sicheren Home-Office weiterhin für Sie erreichbar. Kommen Sie gerne auf uns zu für Ihren individuellen Beratungstermin. Die Showrooms sind derzeit geschlossen – aber per Telefon und E-Mail stehen wir Ihnen gern zur Verfügung. Auch Reservierungen von Wohnungen sind unverändert möglich.\n\nJetzt Termin vereinbaren!'];;;;;;89679;3;true;;;;
2020-05-24 20:55:48.385613;Berlin;central_heating;ONE_YEAR_FREE;185949;n;y;https://pictures.immobilienscout24.de/listings/1fd41505-2337-4c94-ae18-14c1885cc93a-1369416862.jpg/ORIG/resize/118x118%3E/extent/118x118/format/jpg/quality/80;15;11.37;40 MBit/s;telekom_layer_magenta_l;über VDSL;1937;REGULAR;disabled;11.37;117581166;no_information;n;true;MagentaZuhause L;n;Berlin;y;6;1;68;energy_consumption;5.8;63.72;Berlin;10719;no_information;no_information;F;false;100 MBit/s;no_information;"D&uuml;sseldorfer Str.";n;https://padlock.link/ioml;https://padlock.link/ml;Düsseldorfer_Str.;apartment;10719;3;173;n;2,active;true;Deutschland;premium;100 MBit/s;wohnung_kauf;y;web,email,bank,music,dl-ul,game,sd,mltstr,hd,fast-ul-dl;true;001.185949;267700;profile0;3;true;n;showqualicontactform;n;n;Wilmersdorf_Wilmersdorf;16720143;3;Berlin;/expose/117581166;['In einer guten, zentralen und zugleich ruhigen Lage in Wilmersdorf, nur rund zehn Gehminuten vom Kurfürstendamm entfernt, befindet sich das Mehrfamilienhaus in der Düsseldorfer Straße 68, 68a und 69. Hier wohnt man gediegen und zugleich mit allen urbanen Vorzügen von lokaler Nahversorgung, einem vielfältigen Gastronomieangebot bis hin zur Verkehrsanbindung.\r\n\r\nDas denkmalgeschützte Wohnhaus in der Düsseldorfer Straße überzeugt nicht nur mit seiner bevorzugten Lage. Einladend wird man von der hellen Fassade und den stilvollen Eingangstüren mit harmonischen Rundbögen und weißen Sprossenfenstern empfangen. Das Wohnhaus ist in geschlossener Bauweise errichtet und verfügt über insgesamt drei separate Aufgänge, jeweils einen Aufgang pro Hausnummer.\r\n\r\nVom ersten bis zum fünften Obergeschoss begeistern die Wohnungen in der Düsseldorfer Straße mit ihrer lichtdurchfluteten Raumatmosphäre und wunderschönen Sprossenfenstern, die ein großzügiges Raumgefühl vermitteln. Die 1- bis 3-Zimmer-Wohnungen sind durchdacht geschnitten und bieten Grundrisslösungen auf rund 48 bis 72 Quadratmetern für unterschiedliche Lebensstile. Die Gewerbeeinheiten lassen Raum auf 64 beziehungsweise 129 Quadratmetern. Die Wohnungen sind größtenteils mit einer separaten Küche, einem Dusch- und Wannenbad sowie teilweise mit einem separaten Gäste-WC und einem Abstellraum ausgestattet. Nahezu alle Wohnungen ermöglichen mit einem zum Hinterhof ausgerichteten Balkon das eigene, kleine Refugium unter freiem Himmel.\r\n\r\nDas Haus wird über eine zentrale Heizungs- und Warmwasseraufbereitungsanlage mit Energie versorgt. Im Erdgeschoss des Hauses gibt es zudem drei Gewerbeeinheiten.\r\n\r\nUmgebungsfilm: https://youtu.be/hJGuigFlfow\r\nGewerbe möbliert: https://youtu.be/Z9wrE-fBdLo\r\nGewerbe leer: https://youtu.be/zsHpSet-yDc\r\nWohnung leer: https://youtu.be/4-YoG7kqJIg\r\n\r\nACCENTRO App für iOS https://goo.gl/KvMJTa und für Android https://goo.gl/ACqL6H', 'Zuhause in der City West - willkommen in Wilmersdorf! Das besondere Lebensgefühl des alten und neuen West-Berlins kommt in Wilmersdorf in inspirierender Form zusammen. Nicht so hip wie Neukölln oder Kreuzberg, aber dennoch dynamisch, modern und dabei mit der richtigen Portion Gelassenheit - das ist Lebensqualität in Wilmersdorf. Wie kaum ein anderer Ortsteil glänzt Wilmersdorf vor allem durch sein Zusammenspiel aus zentraler Lage und Naherholung.\r\n\r\nWilmersdorf gilt als der gemütliche Teil der westlichen City - gut bürgerlich, wohlhabend und mit einem entspannten Lebensstil. Dabei wird Wilmersdorf immer jünger. Viele Familien und Jüngere aus den Szenevierteln ziehen hierher und freuen sich über viel Grün, viel Platz und eine gute Infrastruktur. In guter Lage im liebenswerten Wilmersdorf befindet sich das Mehrfamilienhaus in der Düsseldorfer Straße 68, 68a und 69. Der Standort punktet mit seiner Nähe zum Kurfürstendamm und den umliegenden Seitenstraßen. Mit einem spannenden Nebeneinander von alteingesessenen Traditionsgeschäften und innovativen Läden haben sich die Nebenstraßen als beliebte Adressen etabliert. Zahlreiche Cafés und Restaurants runden die Nahversorgung in diesem schönen Wohnviertel ab.\r\n\r\nNicht nur Shopping prägt die Nachbarschaft, auch der Preußenpark liegt nur knapp 15 Spazierminuten entfernt. Hier lässt es sich wunderbar durchatmen und entspannen. An den Wochenden lädt hier der beliebte Flohmarkt zum Schlendern und Stöbern ein. Der Nachwuchs findet hier auf einem Spielplatz sein Refugium zum Toben und Spielen. Ein beliebtes Ausflugsziel ist zudem der bis nach Schöneberg reichende Volkspark mit dem idyllischen Fennsee, der im Osten nahtlos in den Rudolf-Wilde-Park übergeht.\r\n\r\nAuch wenn es in Wilmersdorf nahezu alles vor Ort gibt, ist man doch bestens angebunden an den Nahverkehr mit Bus, S- und U-Bahn. Die U-Bahn-Linien U3, U7 und U9 sowie drei S-Bahn-Stationen bringen einen unkompliziert und auf schnellem Weg in alle anderen Bezirke der Hauptstadt.'];;;218.32;;1110;;2;;true;6;;
2020-05-24 20:55:48.712347;Berlin;central_heating;ONE_YEAR_FREE;174522;n;y;https://pictures.immobilienscout24.de/listings/670d11a5-1a19-43b1-b8ba-453c072e5f8f-1364602532.jpg/ORIG/resize/118x118%3E/extent/118x118/format/jpg/quality/80;12;11.48;10 MBit/s;telekom_layer_magenta_m;über VDSL;1905;REGULAR;disabled;11.48;117583764;district_heating;y;true;MagentaZuhause M;y;Berlin;y;10;1;no_information;energy_required;7.14;163;Berlin;10245;no_information;no_information;;false;50 MBit/s;underground_garage;no_information;y;https://padlock.link/iomm;https://padlock.link/mm;no_information;roof_storey;10245;5;83;n;2,active;true;Deutschland;schaufenster;50 MBit/s;wohnung_kauf;n;web,email,bank,music,dl-ul,game,sd,mltstr,hd,fast-ul-dl;true;001.174522;985000;profile0;5;true;n;showqualicontactform;n;n;Friedrichshain_Friedrichshain;117583764;7;Berlin;/expose/117583764;['Großartige Raumperspektiven auf imposanter, familien- und gastfreundlicher Fläche, eine starke Tageslichtintensität und exquisite Ausstattungen formen in dieser höchsten Wohnung im Haus ein Topambiente. Der großzügige Grundrisse bietet Raumkomfort für eine große Familie und Freunde. Neben den einladenden Gemein-schaftsflächen lassen sich geräumige Zimmer für die Privatsphäre, Gäste, Hobbys oder andere Zwecke nutzen.\nDiese Wohnung vermittelt ein repräsentatives Flair. Sie ist anregend taghell, wie in einer Galerie, akzentuiert von einer filigranen Stahltreppe zur Dachterrasse. Dieses frappante Foyer nebst Wohn-, Koch- und Essbereich wirkt samt Südterrasse kreativ. Eine Einbauküche ist nicht im Kaufpreis enthalten. Noch mehr Sonne dringt durch die obere Glastür und verglaste Flügeltür, die ein sehr attraktives Zimmer eröffnet. Denkbar ist die Einrichtung eines geräumigen und optimal tagesbelichteten Ateliers oder Heimbüros. Die vier großen Flügelfenster weisen in den Süden zur Spree und westwärts zur beliebten Abendsonne. Die anschließenden Räume lassen sich als komfortable Schlafräume nutzen. Auch ein Wirtschaftsraum ist vorhanden – eine universell nutzbare Wohnung.\nIn dem gepflegten Altbau sind Kellerräume und ein Personenaufzug vorhanden. Einfach erreichbar bietet diese Wohnung exzellente Raumqualitäten.\nMotivierende Sonnenhelligkeit, repräsentative Flächen, stilvolle Interieurs und die traumhaften Terrassen formen ein Topambiente.\nStellplätze zur Miete in einer Tiefgarage stehen zur Verfügung.', 'Sie möchten den Marktwert Ihrer Immobilie wissen oder Ihre Immobilie verkaufen? Wir sind seit 1995 erfolgreich im Verkauf von Immobilien in Berlin, Potsdam und Umgebung tätig. Unsere exzellenten Eigentümerbewertungen sprechen für sich.\n\n•\tOftmals haben wir schon den richtigen Käufer für Ihre Immobilie in unserer Kartei\n•\tWir sind Bellevue Best Property Agent und Mitglied in den Verbänden IVD & FIABCI\n•\tWir benötigen keinen schriftlichen Alleinauftrag\n•\tKosten entstehen Ihnen bei uns keine\n•\tUnsere Spezialisten stehen Ihnen gerne für ein erstes – für Sie unverbindliches - Gespräch zur Verfügung\n\nWir freuen uns über Ihre Kontaktaufnahme unter einkauf@immoberlin.de oder (030) 895 72 20.\nBitte besuchen Sie auch unsere Website: \nhttps://www.immoberlin.de'];;1;;;;;;;true;;;
