2020-05-24 21:07:06.692637;Berlin;central_heating;ONE_YEAR_FREE;16614875;n;n;https://pictures.immobilienscout24.de/listings/686b9395-9085-4584-ab29-fefde3ccd83c-1354641553.jpg/ORIG/resize/118x118%3E/extent/118x118/format/jpg/quality/80;15;14.43;40 MBit/s;telekom_layer_magenta_l;über VDSL;1900;;REGULAR;;;14.43;116206615;;gas;y;false;MagentaZuhause L;y;Berlin;y;3;1;no_information;7.95;27;Berlin;13357;fully_renovated;sophisticated;false;100 MBit/s;no_information;no_information;n;https://padlock.link/ioml;https://padlock.link/ml;no_information;ground_floor;13357;1;n;;2,active;true;Deutschland;standard;100 MBit/s;wohnung_kauf;n;;;web,email,bank,music,dl-ul,game,sd,mltstr,hd,fast-ul-dl;true;002.01007214379;134900;profile0;5;1;true;n;showqualicontactform;n;n;Wedding_Wedding;1783e;1;Berlin;/expose/116206615;['Bei dem Objekt handelt es sich um eine kompakte 1-Zimmer-Eigentumswohnung in einem sanierten Mehrfamilienhaus in gefragter Lage von Berlin – Mitte (OT Gesundbrunnen). Die Liegenschaft besteht aus Vorderhaus, Seitenflügel und Quergebäude. Das Gebäude wurde 1999 komplett modernisiert und renoviert. Die Modernisierung beinhaltete den Anbau vom Fahrstuhl sowie das Anbringen von Balkonen, die Renovierung der Treppenhäuser und des Kellers. Geheizt wird mit einer modernen und sparsamen Gaszentralheizung, welche auch die Warmwasserversorgung gewährleistet. \n\nDie Wohnung liegt im Erdgeschoss des Gartenhauses eines klassischen Berliner Altbaus und präsentiert sich als ideale Stadtwohnung für Singles und Berufspendler. Der Grundriss weiß trotz oder gerade auf Grund seiner kompakten Fläche mit einem großzügigen Badezimmer und einer funktionalen Küchennische zu überzeugen. Das Studio bietet Raum für eine individuelle Möblierung und Gestaltung.\nDie großen Fenster sind mit Rundbögen verziert. Im Wohnbereich durchfluten große, hohe Fenster mit Isolierverglasung die Räume mit viel Licht. Die von Flur aus ausziehbare Treppe führt zu einem Hochbett.', '- EG\n- Küchennische mit Einbauküche\n- Hochbett\n- großzügiges Wannenbad mit Handtuchheizkörper\n- Kellerabteil\n- gepflegtes Treppenhaus\n- attraktives Hofensemble\n- Fahrradabstellmöglichkeiten', 'Nahe Volkspark Humboldthain\nDas Umfeld Gesundbrunnen ist eine beliebte Lage von Berlin. Die Kolberger Straße ist eine ruhige Seitenstrasse. In unmittelbarer Nähe befindet sich\ndas Einkaufszentrum Gesundbrunnen-Center. Die tolle Berliner Mitte Lage lässt auch in Sachen Fortbewegung jeglichen Spielraum. Ob zu Fuß, mit dem Fahrrad, mit Bus, S+U-Bahn oder auch mit dem eigenen Auto lässt sich jedes Ziel in der Stadt zügig erreichen.', 'Widerrufsrecht:\nSie können Ihre Vertragserklärung innerhalb von 14 Tagen ohne Angabe von Gründen in Textform (z. B. Brief, Fax, E-Mail) widerrufen. Die Frist beginnt nach Erhalt dieser Belehrung in Textform, jedoch nicht vor Vertragsschluss und auch nicht vor Erfüllung unserer Informationspflichten gemäß Artikel 246 § 2 in Verbindung mit § 1 Abs. 1 und 2 EGBGB sowie unserer Pflichten gemäß § 312 e Abs. 1 Satz 1 BGB in Verbindung mit Artikel 246 § 3 EGBGB. Zur Wahrung der Widerrufsfrist genügt die rechtzeitige Absendung des Widerrufs. Der Widerruf ist zu richten an: L&B Immobiliya EuRUS GmbH, Frankfurter Allee 18, 10247 Berlin, per Fax an 030/76214973 oder per email an info@immobiliya.de - - - - - - - - - - - - - - - - - - - - Widerrufsfolgen Im Falle eines wirksamen Widerrufs sind die beiderseits empfangenen Leistungen zurückzugewähren und ggf. gezogene Nutzungen (z. B. Zinsen) herauszugeben. Können Sie uns die empfangene Leistung ganz oder teilweise nicht oder nur in verschlechtertem Zustand zurückgewähren, müssen Sie uns insoweit ggf. Wertersatz leisten. Dies kann dazu führen, dass Sie die vertraglichen Zahlungsverpflichtungen für den Zeitraum bis zum Widerruf gleichwohl erfüllen müssen. Verpflichtungen zur Erstattung von Zahlungen müssen innerhalb von 30 Tagen erfüllt werden. Die Frist beginnt für Sie mit der Absendung Ihrer Widerrufserklärung, für uns mit deren Empfang.'];;130.42;energy_consumption;E;155.97;;2019
2020-05-24 21:07:07.086412;Berlin;;ONE_YEAR_FREE;5418748;n;n;https://pictures.immobilienscout24.de/listings/0ffdc8d1-0ae6-4b32-bb50-0dcb387b7243-1362568950.jpg/ORIG/resize/118x118%3E/extent/118x118/format/jpg/quality/80;10;12.78;40 MBit/s;telekom_layer_magenta_l;über VDSL;1959;;REGULAR;disabled;;12.78;116207716;;geothermal;y;false;MagentaZuhause L;y;Berlin;y;4;2;no_information;7.25;30;Berlin;10557;well_kept;normal;false;100 MBit/s;no_information;no_information;y;https://padlock.link/ioml;https://padlock.link/ml;no_information;apartment;10557;1;n;;2,active;true;Deutschland;top;100 MBit/s;wohnung_kauf;n;11;;web,email,bank,music,dl-ul,game,sd,mltstr,hd,fast-ul-dl;true;001.5418748;195000;profile0;16;1;true;n;showqualicontactform;n;n;Tiergarten_Tiergarten;1605;1;Berlin;/expose/116207716;['Diese bezugsfreie 1-Zimmer-Wohnung liegt in der 11. Etage eines prominenten Punkt-Hochhauses der Interbau 1957 im beliebten Hansaviertel. Das gesamte Haus ist denkmalgeschützt.\r\n\r\nIn unmittelbarer Nähe des Berliner Tiergartens befindet sich die Wohnung, die sich bequem mit einem Fahrstuhl erreichen lässt. Der Wohnungsflur bietet Ihnen einen ausreichenden Stauraum. Das Bad verfügt über eine Badewanne. Der offene Wohn- und Schlafbereich schafft durch große Fenster ideale Lichtverhältnisse. Es befindet sich ebenfalls eine kleine aber feine Küchennische im Wohnbereich. Die Wohnung verfügt zudem über Schallschutzfenster und eine einbruchhemmende Tür.\r\n\r\nDie Wohnung eignet sich perfekt als erste eigene Wohnung oder als Pendler-/ Studentenwohnung.\r\n\r\nBesuchen Sie uns auch auf unserer Internetseite für weitere Informationen und Angebote: https://blacklabelimmobilien.de/', 'Die Spree ummantelt diesen Ortsteil von Berlin Tiergarten. Es gibt viel zu entdecken, von dem man nicht einmal ahnte, dass es da ist.\r\n\r\nMitte liegt einfach im Trend! Im Westen erstreckt sich der beliebte Bezirk Charlottenburg-Wilmersdorf. Berlin Mitte finden Sie im Osten und der Tiergarten liegt im Süden quasi direkt vor der Tür. \r\nDie Wohnung befindet sich im gefragten Hansaviertel, für welches die Aufnahme in UNESCO-Weltkulturerbe-Liste beantragt wird.\r\n\r\nDem Alltag entfliehen, die Seele baumeln lassen oder für den nächsten Berlin Marathon trainieren. Der Berliner Tiergarten bietet Ihnen dafür beste Voraussetzungen. Mit einer Fläche von ca. 200 ha erstreckt sich der Tiergarten links und rechts der Straße des 17. Juni. Romantische Ausflugslokale wie das „Café am Neuen See“ oder kulturelle Exkursionen zu den Gedenkstätten des Deutschen Wiederstands bis hinauf zur Siegessäule und hinab zum Haus der Kulturen der Welt.\r\n\r\nDie Anbindung an den öffentlichen Personennahverkehr ist unschlagbar verkehrsgünstig (U-Bahn 2 Stationen zum Kudamm, S-Bahn 1 bzw. 2 Stationen zum Hauptbahnhof/Friedrichstr.). Zudem erreichen sie die Technische Universität, sowie die Universität der Künste fußläufig. Alle Geschäfte des täglichen Bedarfs befinden sich innerhalb eines Umkreises von 100 m.', 'Das Team von Black Label Immobilien bietet Ihnen Unterstützung in allen Bereichen rund um den Kauf einer Immobilie. Unser internationales Team spricht fließend Englisch, Deutsch, Französisch und Mandarin, zudem arbeiten wir mit einem Team aus mehrsprachigen Anwälten, Notaren und Finanzierungsberatern zusammen.\r\n\r\nUm Ihren persönlichen Ansprüchen gerecht werden zu können, bieten wir Ihnen eine große Auswahl an verschiedenen Immobilien. Senden Sie uns einfach ihre Suchkriterien inklusive: \r\n\r\n- Art der gesuchten Immobilie\r\n- Ihr Budget\r\n- Bevorzugter Standort\r\n- Suchen Sie eine Immobilie als Investment oder zum Eigenbedarf? \r\n\r\nFür Unterstützung bei der Finanzierung Ihrer Immobilie vermitteln wir Ihnen gern einen Finanzierungspartner. \r\n\r\nSind Sie an einer Vermietung Ihrer neuen Immobilie interessiert? Hierfür bietet Black Label ein Verwaltungs-Paket sowohl für unmöblierte als auch möblierte Vermietungen, sowie einen kompletten Design- und Möblierungsservice, angepasst an ihre persönlichen Vorstellungen. Kontaktieren Sie uns, oder besuchen Sie uns in unserem Büro, um mehr Informationen zu erhalten.'];;156;;;;;
2020-05-24 21:07:07.562915;Berlin;central_heating;;1669339;n;n;https://pictures.immobilienscout24.de/listings/b3c412a6-184a-41d0-a634-720e85f1253c-1354632888.jpg/ORIG/resize/118x118%3E/extent/118x118/format/jpg/quality/80;6;11.48;;;;1905;;;;;11.48;116205690;;;y;false;;y;Berlin;n;4;1;10;7.14;45;Berlin;10245;no_information;no_information;false;;no_information;"Dirschauer Stra&szlig;e";n;;;Dirschauer_Straße;ground_floor;10245;2;n;;2,active;;Deutschland;top;;wohnung_kauf;n;0;;;false;001.1669339;198000;profile0;4;2;true;n;showqualicontactform;n;n;Friedrichshain_Friedrichshain;116205690;2;Berlin;/expose/116205690;"['Wer mitten im lebendigen Friedrichshain, aber ruhig leben möchte, ist hier richtig. Diese in der Parallelstraße der Simon-Dach-Straße gelegene Wohnung befindet sich im Seitenflügel. Das Mehrfamilienhaus wurde 1905 errichtet und 2008 grundlegend saniert. Die Multikulturelle Bewohnerschaft ist ruhig und nett.', 'Die Wohnung verfügt über ein Wohnzimmer, an das sich das Schlafzimmer anschließt. \nDas Duschbad und die Küche, ausgestattet mit einer Einbauküche von Ikea, gehen vom Flur ab.', 'Das Objekt zeichnet sich durch eine ausgezeichnete Lage im angesagten Friedrichshain aus. Der beliebte Platz ""Boxi"" mit seinen zahlreichen Cafés ist in 3 min zu Fuß zu erreichen. Der S-Bahnhof Warschauer Straße sowie die East-Side-Mall ober die Mercedes-Benz-Arena ist fußläufig ca. 10 min entfernt. Ringsherum gibt es zahlreiche Kitas und Schulen. Einkaufsmöglichkeiten bieten sich bei Aldi und Rewe ca. 5 min zu Fuß entfernt. Pakrplätze gibt es vor der Haustür.']";;260;energy_consumption;;154;45;
2020-05-24 21:07:08.061976;Berlin;central_heating;ONE_YEAR_FREE;213082;n;n;https://pictures.immobilienscout24.de/listings/bff233d7-a9e3-481e-b2d8-e8030181c363-1354771411.png/ORIG/resize/118x118%3E/extent/118x118/format/jpg/quality/80;4;12.78;40 MBit/s;telekom_layer_magenta_l;über VDSL;1919;;REGULAR;;;12.78;116234517;;gas;n;false;MagentaZuhause L;n;Berlin;n;5;1;no_information;7.25;58.7;Berlin;10555;well_kept;normal;false;100 MBit/s;no_information;no_information;n;https://padlock.link/ioml;https://padlock.link/ml;no_information;apartment;10555;2;n;2001;2,active;true;Deutschland;standard;100 MBit/s;wohnung_kauf;y;1;;web,email,bank,music,dl-ul,game,sd,mltstr,hd,fast-ul-dl;true;001.213082;234900;profile0;6;2;true;n;;n;n;Tiergarten_Tiergarten;rwi7598;2;Berlin;/expose/116234517;['Es handelt sich bei diesem Objekt um einen Altbau aus dem Jahre 1919 in einem, für diese Zeit typischen, Mix aus Wohnungen und Gewerbe. So findet man hier ein Vorderhaus mit 2 Seitenflügeln und einem Hinterhaus, die den 1. Innenhof umschließen. Hier gibt es Wohnungen und im EG Gewerbeflächen. Errichtet wurden ein Erdgeschoss, 4 Obergeschosse und ein teilweise ausgebautes Dach mit Terrassen. An der Straßenseite des Vorderhauses gibt es Balkone, die anderen Gebäudeteile haben zumeist einen französischen Balkon. \r\rDanach folgt ein 2. Hof und dahinter ein ehemaliges Fabrikgebäude das gewerblich genutzt wird. Dieses ist bereits vollständig verkauft. ', 'Diese vermietete Wohnung befindet sich im 1. OG des rechten Seitenflügels. Sie verfügt neben einem großen Durchgangszimmer mit Fenster zum Innenhof noch über ein weiteres Zimmer mit Südausrichtung und französischem Balkon. \r\rDie Küche mit Fenster und einem weiteren französischen Balkon zum Innenhof und das Duschbad erreicht man über den Flur. \r\rDie Wohnung wird vermietet als Kapitalanlage angeboten. Weitere Details auf Anfrage. ', 'Berlin-Tiergarten-Mitte - Unterhalb der Turmstraße zwischen Spree und Ottopark gelegen. Von hier aus gelangt man schnell in die Innenstadt, zur Universität und auch zum Reichstag. \rDie Straße Alt-Moabit ist die nach der Turmstraße zweitwichtigste und wohl lebendigste Geschäftsstraße Moabits. Die zentrale Lage bietet zwar keine Ruhe wie in ländlicher Abgeschiedenheit, aber durch diese sind zum Beispiel sämtliche Einkäufe fußläufig zu erledigen, und auch Busse und die U-Bahnlinie U9 schnell erreicht. Die größtenteils sanierten hübschen Jugendstilbauten in der Umgebung bieten eine sehr angenehme Wohnlage, und das Bundestagsufer in der Nähe einen tollen Spreeblick zur Naherholung.', 'Der Erwerb dieser Immobilie ist für den Käufer provisionsfrei. Alle Angaben sind ohne Gewähr und nach den Unterlagen des Eigentümers erstellt. Irrtümer und Änderungen vorbehalten. Bei aller Sorgfalt können wir keine Garantie dafür übernehmen, dass alle Angaben richtig sind, und das Objekt im Augenblick des Zugangs der Offerte noch verfügbar ist. \r\rBei Anfragen bitten wir um vollständige Absenderangaben. \r\rGerne zeigen wir Ihnen das Objekt, und freuen uns auf einen persönlichen Termin mit Ihnen. \r\rSie erreichen uns wie folgt:\rRüdiger Wilkanowski Immobilien\rin Kooperation mit:\r\rRoman Seidl Immobilien\rTelefon: 0173 / 2187927\rFax: 030 / 85605613\r\rGerne zeigen wir Ihnen das Objekt, und freuen uns auf einen persönlichen Termin mit Ihnen. \r\rWeitere interessante Angebote finden Sie auch im Internet unter www.wilkanowski-immobilien.de.\r\rSie wollen Ihre Immobilie verkaufen ?\r \rWir suchen im Stadtgebiet von Berlin Immobilien (freie Eigentumswohnungen, Mehrfamilienhäuser und Einfamilienhäuser). Sprechen sie uns gerne an oder vereinbaren Sie einen persönlichen Termin mit uns: 030-85605612.'];;188.26;energy_consumption;;129;;
2020-05-24 21:07:08.487744;Berlin;central_heating;ONE_YEAR_FREE;17089495;y;y;https://pictures.immobilienscout24.de/listings/f6cd4d51-4bd5-4ffc-a1a6-515c36f5252e-1358352210.jpg/ORIG/resize/118x118%3E/extent/118x118/format/jpg/quality/80;9;10.14;40 MBit/s;telekom_layer_magenta_l;über VDSL;2020;true;REGULAR;disabled;79562;10.14;110180285;1;no_information;n;true;MagentaZuhause L;y;Berlin;y;7;9;no_information;4.38;95.97;Berlin;12623;no_information;no_information;false;100 MBit/s;outside;no_information;n;https://padlock.link/ioml;https://padlock.link/ml;no_information;maisonette;12623;2;n;8541;2,active;true;Deutschland;standard;100 MBit/s;wohnung_kauf;n;0;true;web,email,bank,music,dl-ul,game,sd,mltstr,hd,fast-ul-dl;true;002.01007866969;389283;profile0;2;2;true;n;showqualicontactform;n;n;Mahlsdorf_Hellersdorf;03946-06;4;Berlin;/expose/110180285;['Die hochwertigen Wohnungen liegen in einer ruhigen und begrünten Einfamilienhaussiedlung an der Grenze zwischen Kaulsdorf und Mahlsdorf.\r\n\r\nDie zwei in Massivbauweise errichteten Häuser umfassen insgesamt 8 Eigentumswohnungen verschiedener Größen (ca. 60 m² bis 96 m²) und Wohnungstypen. Jede Wohnung bietet Ihnen einen Balkon bzw. eine Terrasse mit Blick in den Gartenbereich. Zusätzlich steht Ihnen ein persönlicher PKW-Stellplatz zur Verfügung, welcher den jeweiligen Wohnungen zugeordnet ist.\r\n\r\nDas Wohnensemble teilt sich auf in vier Maisonette-Wohnungen, zwei kleinere charmante Wohnungen und zwei großzügig geschnittene Wohnungen. Die Maisonette-Wohnungen erstrecken sich über Souterrain und Erdgeschoss in beiden Häusern. Im 1. Obergeschoss von Haus 1 befinden sich die zwei kleineren Wohnungen. Die zwei großen Wohnungen befinden sich im 2. Obergeschoss von Haus 1 sowie im 1. Obergeschoss von Haus 2.\r\n\r\nDie Wohnungen bieten Ihnen eine qualitativ hochwertige Ausstattung, welche eine energiesparende Fußbodenheizung mit Einzelraumsteuerung, erstklassige Markenarmaturen und Sanitärobjekte, Parkettböden, eine moderne Video-Türsprechanlage sowie Rollläden an allen Fenstern und Türen beinhaltet.\r\n\r\nAlle Einheiten auf einen Blick finden Sie auch auf unserer Projektseite: \r\nwww.wohnen-am-wuhletal.de', '- Fertigstellung ist geplant für Herbst 2020\r\n- qualitativ hochwertiges Parkett\r\n- energiesparende Fußbodenheizung mit Einzelraumsteuerung\r\n- erstklassige Markenarmaturen und Sanitärobjekte\r\n- alle Fenster und Türen erhalten Rollläden\r\n- moderne Video-Türsprechanlage\r\n- teilweise privater Gartenanteil', 'Einen Katzensprung vom Berliner Stadtzentrum entfernt, mitten im idyllischen Wohnumfeld entsteht eine moderne Wohnoase mit Anspruch und Ausblick. 30 Minuten Autofahrt bis zum Alexanderplatz, 10 Minuten Fußweg bis zur S-Bahn-Station und 15 Minuten mit dem Rad zum nächsten Badesee – zentraler kann man in Berlin kaum leben. Denn lebenswert ist es in Kaulsdorf allemal. Wer sich dem Berliner Stadttrubel entziehen und dennoch das Berliner Partyleben genießen möchte, wird hier sein Wohnglück finden. Sie genießen die Vorteile eines Wohngebietes mit Eigenheim-Flair und Gärtnercharme, ohne Arbeit und Mühe in Gartenpflege und Haussanierung investieren zu müssen. \r\n\r\nZahlreiche Einkaufsmöglichkeiten finden Sie in der näheren Umgebung wie zum Beispiel im Spree-Center-Hellersdorf und in vielen verschiedenen Supermärkten für den alltäglichen Bedarf. Ebenso gibt es viele Freizeitangebote und - Möglichkeiten vor Ort wie den Habermannsee, das FEZ Strandbad, den Weißen See, eine Tanzschule, den TSV Karlshorst e.V. und den Biesdorf Baggersee sowie einige Restaurants. Das Angebot für die Kinderbetreuung und Bildungseinrichtungen umfasst alle Altersklassen - von Kitas, Grundschulen hin zu den verschiedenen Oberschulen.', 'Bitte haben Sie Verständnis dafür, dass wir Ihre Anfrage nur in schriftlicher Form (bevorzugt per E-Mail) unter Angabe des vollständigen Namens und Ihrer Adresse, bearbeiten können.\r\n\r\nEine Besichtigung ist nach vorheriger Absprache mit uns möglich. \r\n\r\nGerne sind wir bei der Finanzierung dieses Objektes behilflich.\r\n\r\nWeitere aktuelle Immobilienangebote finden Sie unter www.bsk-immobilien.de.\r\nVERBRAUCHERINFO\r\n1. Maklerleistung ist der Nachweis der Gelegenheit zum Abschluss eines Vertrages bzw. Vermittlung eines Vertrages über eine Immobilie gegen die Courtagezahlungspflicht des Kunden\r\n2. Unternehmer,Anschrift,Beschwerdeadressat\r\nLBSi NordWest,Himmelreichallee 40,48149 Münster,Tel:0251/4124774,Fax:0251/4124799,eMail:info@lbsi-nordwest.de\r\nGF:Roland Hustert,Helmut Steinkamp\r\n3. Es besteht ein Widerrufsrecht\r\n4. Weitere Infos: verbraucherinfo.lbsi-nordwest.de'];;;;;;;
2020-05-24 21:07:08.839101;Berlin;self_contained_central_heating;ONE_YEAR_FREE;17476763;n;y;https://pictures.immobilienscout24.de/listings/751f33d1-389d-4c98-bba4-6dbf02659a66-1354662439.jpg/ORIG/resize/118x118%3E/extent/118x118/format/jpg/quality/80;11;11.14;40 MBit/s;telekom_layer_magenta_l;über VDSL;1900;;REGULAR;;;11.14;116207977;;gas;y;false;MagentaZuhause L;y;Berlin;y;11;1;no_information;6.17;200;Berlin;10437;no_information;no_information;false;100 MBit/s;no_information;no_information;n;https://padlock.link/ioml;https://padlock.link/ml;no_information;roof_storey;10437;4;n;1;2,active;true;Deutschland;top;100 MBit/s;wohnung_kauf;n;6;;web,email,bank,music,dl-ul,game,sd,mltstr,hd,fast-ul-dl;true;009.2f31766d-95e4-4ffa-a307-2f0bd139b84e;1100000;profile0;6;4;true;n;showqualicontactform;n;n;Prenzlauer_Berg_Prenzlauer_Berg;1221;7;Berlin;/expose/116207977;"['Viel mehr geht nicht. \n\nEin Maximum an Licht, viel Platz, 2 Terrassen, 2 Bäder, ein Kamin, eine Sauna und das alles mitten im Prenzlauer Berg über den Dächern von Berlin...diese Dachgeschosswohnung macht Lust auf mehr.\n\nDiese charmante Bleibe bietet einen Rückzugsort im Hinterhof, der dafür sorgt, dass Sie Alltag und Freizeit bestens voneinander trennen können. Am Abend wartet ein Kamin auf Sie, der für wohlige Wärme sorgt. Und wir wollen keinesfalls die hervorragende Aussicht vergessen, die Sie dank der beiden Terrassen haben.', '✓ 2 X Terrassen\n✓ 2 X Bäder\n✓ Sauna\n✓ Waschraum\n✓ Kamin\n✓ Einbauküche\n✓ Lichtdurchflutet\n✓ Spots', ""Der beliebte Stadtviertel entwickelte sich zur internationalen Trendikone und ist jetzt Anlaufpunkt für Einheimische, Trendsetter und Touristen aus aller Welt. Ein Kiezleben, wie man es sich wünscht. Der Prenzl'berg, auch Pregnant Hill genannt, ist mit seinen Kiezen äußerst familienfreundlich. \n\nDie Schönhauser Allee, die Kastanienallee, der Mauerpark und weitere beliebte Orte liegen nur ein Katzensprung entfernt. Prenzlauer Berg ist da, wo Akademiker auf Studenten treffen, Künstler mit Ärzten verweilen und etablierte gastronomische Betriebe mit kleinen Modeboutiquen den Sonnenuntergang genießen. Auch Naturbegeisterte kommen hier zur Geltung, im naheliegenden Mauerpark, in dem man wieder Kraft tanken und sich vom Alltag zurückziehen kann. \n\nDer Mauerpark kann auch anders, sehr begehrt ist er an Sonntagen, wo der berühmteste Flohmarkt Menschen aus aller Welt zum flanieren einlädt, zehn tausende von Menschen erleben den begehrtesten und vielfältigsten Flohmarkt in Berlin, für Sie um die Ecke, für andere eine Weltreise wert. \n\nDie S-Bahn Station Schönhauser Allee und die U-Bahn Station Eberswalder Straße gute Verkehrsverknüpfung und sind eine ideale Ausgangsposition. \n\nSupermärkte, wie Alnatura, REWE und Netto sind ebenfalls um die Ecke. Die Kita und auch die Grundschule sind fußläufig erreichbar.\n\n✓ S & U Schnönhauser Allee (5 min)\n✓ Supermarkt (ca. 5 min)\n✓ Kita (1 min)\n✓ Grundschule (ca. 5 min)\n✓ Mauerpark (ca. 1 km)\n✓ Kulturbrauerei (ca. 1,2 km)\n✓ Kastanienallee (8 min)"", 'Die Angaben sind ohne Gewähr und basieren auf Informationen, die uns vom Eigentümer zur Verfügung gestellt wurden. Wir übernehmen keine Gewähr für die Vollständigkeit, Richtigkeit und Aktualität dieser Angaben.']";;343;energy_consumption;;139;5;
2020-05-24 21:07:09.172444;Berlin;central_heating;ONE_YEAR_FREE;15485505;n;y;https://pictures.immobilienscout24.de/listings/36e4a07e-f7c2-40bb-9dd7-4694c9f87669-1354744153.jpg/ORIG/resize/118x118%3E/extent/118x118/format/jpg/quality/80;10;7.89;40 MBit/s;telekom_layer_magenta_l;über VDSL;1973;;REGULAR;disabled;;7.89;116231486;1;oil;n;true;MagentaZuhause L;y;Berlin;n;10;3;no_information;3.38;137.42;Berlin;14193;need_of_renovation;no_information;false;100 MBit/s;garage;no_information;n;https://padlock.link/ioml;https://padlock.link/ml;no_information;raised_ground_floor;14193;5;n;;2,active;true;Deutschland;standard;100 MBit/s;wohnung_kauf;n;1;;web,email,bank,music,dl-ul,game,sd,mltstr,hd,fast-ul-dl;true;002.01002710613;800000;profile0;3;5;true;n;showqualicontactform;n;n;Grunewald_Wilmersdorf;DKJF44320;6;Berlin;/expose/116231486;['Die zum Verkauf stehende Wohnung befindet sich in einem 8-Parteien-Haus mit 2 Aufgängen. Sie erstreckt sich über das Hochparterre und das Untergeschoss. \nIm Hochparterre befinden sich die Diele, ein Gäste-WC, die Küche, ein Bad mit Wanne und Dusche sowie drei Wohn-Schlafräume. Die überdachte Terrasse ist 11,9 m² groß. Sie hat einen direkten Zugang zum gemeinschaftlich genutzten Garten.\nIm Untergeschoss, welches über eine breite Treppe bequem zu erreichen ist, befinden sich 2 weitere Räume und ein Duschbad mit Fenster.\nDie Wohnung muss inklusive Neuverlegung der Elektrik  komplett renoviert werden.\nIm Kaufpreis enthalten ist eine Garage mit einer Grundfläche von 15,18 m².\n\nDen Wohnungseigentümern stehen zudem eine Waschküche und eine Sauna, welche sich im Keller befinden, zur gemeinschaftlichen Nutzung zur Verfügung.\n\nDer Energieausweis vom 10.04.2018 weist einen Energieverbrauch von 180,00  kWh/(m²a) aus.', '-2 Wohnebenen\n-2 Bäder, ein Gäste-WC\n-Terrasse\n-Gartennutzung\n-Garage', 'Grunewald zählt zu den besten Wohnlagen Berlins. Altehrwürdige Villen, gepflegte Gärten und baumgesäumte Straßen bestimmen das Bild. Neben Ruhe und Exklusivität sorgt die Nähe zur Natur für eine hohe Lebensqualität. Namensgeber für diesen Stadtteil ist der Grunewalder Forst, das größte Waldgebiet von Berlin. Mehrere Seen, der Grunewaldturm und das  Jagd-schloss Grunewald sind beliebte Ausflugsziele.\n\nAm Roseneck und dem Hagenplatz haben Sie neben guten Einkaufsmöglichkeiten für den täglichen Bedarf und verschiedenen Dienstleistungsangeboten auch eine Vielzahl von Restau-rants und Cafés. Diverse exklusive Tennisclubs, Reitvereine, Sport- und Golfclubs befinden sich in der Nähe.\n\nEin echter Lagevorteil ist die Nähe zur City West, die in den letzten Jahren eine erstaunliche Renaissance erfahren hat. Der Kurfürstendamm mit zahlreichen Designerboutiquen, dem Bi-kini-Haus und dem Waldorf Astoria zeigt sich in neuem Glanz. Im berühmten KaDeWe kann man nach Jahren des Umbaus wieder exklusiv shoppen und genießen.', 'WIR SIND IHR PARTNER RUND UM DIE IMMOBILIE.\n\nWAS IST IHRE IMMOBILIE WERT?\nWir bieten Eigentümern eine fachkundige und individuelle Beratung und Bewertung ihrer Immobilien in Berlin, Potsdam und Umland – professionell, unverbindlich, kostenfrei. Sprechen Sie uns an.\n\nIMMOBILIENVERKAUF\nWir vermitteln mit fundierter Marktwerteinschätzung und verkäuferischem Sachverstand Wohn- und Geschäftsimmobilien, Häuser, Grundstücke und Eigentumswohnungen.\n\nFür Ihr persönliches Informationsgespräch erreichen Sie uns unter 030 – 270 17 68 88.\n\nMit Ihrer Anfrage werden Ihre Kontaktdaten an uns übermittelt. Um Ihr Anliegen zu bearbeiten, werden Ihre Daten durch uns erfasst und digital gespeichert. Weitere Informationen zum Thema Datenschutz finden Sie auf unserer Homepage.\n\nMitglied im Immobilienverband Deutschland - IVD'];;519.71;energy_consumption;F;180;15.18;
