2020-05-24 21:15:01.957681;Berlin;;ONE_YEAR_FREE;15467035;n;y;https://pictures.immobilienscout24.de/listings/516946b9-683d-41dd-9a98-c622c594fd2d-1360822447.jpg/ORIG/resize/118x118%3E/extent/118x118/format/jpg/quality/80;4;11.12;40 MBit/s;telekom_layer_magenta_l;über VDSL;;REGULAR;;11.12;114773384;no_information;y;true;MagentaZuhause L;y;Berlin;n;7;;63;;6.14;29.54;Berlin;10627;first_time_use;sophisticated;false;100 MBit/s;no_information;"Bismarckstra&szlig;e";y;https://padlock.link/ioml;https://padlock.link/ml;Bismarckstraße;no_information;10627;1;;n;2,active;true;Deutschland;top;100 MBit/s;wohnung_kauf;n;5;web,email,bank,music,dl-ul,game,sd,mltstr,hd,fast-ul-dl;true;002.01000809712;305500;profile0;6;1;true;n;showqualicontactform;y;n;Charlottenburg_Charlottenburg;EW-39;1;Berlin;/expose/114773384;['HIGHLIGHTS\r\n\r\n– 39 moderne Studio- und Zwei-Zimmer-Wohnungen in einem Neubauprojekt in Berlins City West mit Wohnflächen von ca. 23 bis 48 m2.\r\n\r\n– Top-Lage im Westen Berlins in der Nähe der Technischen Universität, dem Kurfürstendamm und der Wilmersdorfer Straße, der Deutschen Oper Berlin, des Lietzensees und des Schlosses Charlottenburg.\r\n\r\n– Hervorragende Anbindung an die U- und S-Bahn und nur 1 Kilometer zur Autobahn A100. Alternativ erkunden Sie mit Ihrem E-Bike die Stadt (Ladestationen vorhanden).\r\n\r\n– Hochwertige Ausstattung wie Echtholzparkett mit Fußbodenheizung, hochwertigen Badezimmern, Einbauschrank und Einbauküche.\r\n\r\n– Möbelpakete sind auf Anfrage erhältlich.\r\n\r\n– Erwartete Fertigstellung: 2. Quartal 2022\r\n\r\nPROJEKT\r\n\r\nEmerald West ist wie ein verstecktes Juwel in einem ruhigen und gemütlichen Hinterhof der Bismarckstraße. Das Gebäude ist für Behinderte zugänglich und mit Aufzügen und einer Tiefgarage ausgestattet. Die helle Fassade und klaren Linien prägen die Architektur dieses Wohnprojekts. Die Apartments sind auf die Bedürfnisse des urbanen Lebens zugeschnitten. Kompakte, durchdachte Designs und intelligente Grundrisse schaffen ein tolles Raumgefühl. Große Fenster lassen viel Tageslicht in die Apartments.\r\n\r\n', '– Balkon oder Terrasse (fast alle Wohnungen, entsprechend dem Grundriss)\r\n\r\n– Echtholzparkett mit Fußbodenheizung\r\n\r\n– moderne Badezimmer\r\n\r\n– Einbauschrank\r\n\r\n– Einbauküche\r\n\r\n– Fahrradstellpläzte mit E-Bike-Ladestation\r\n\r\n– Möbelpakete auf Anfrage erhältlich', 'Die perfekte Lage für Ihr Investment\r\n\r\nCharlottenburg und die City West gehören zu den begehrtesten Gegenden Berlins. Es ist ein besonderer Ort, an dem der Charme West-Berlins und die internationale Atmosphäre zusammentreffen. Die Gegend besticht mit vielen Einkaufszentren, hervorragenden Kultur- und Bildungseinrichtungen (einschließlich der Technischen Universität Berlin). Wenn Sie in Charlottenburg investieren möchten, sind Sie hier genau richtig – mitten im westlichen Zentrum Berlins. \r\n\r\nDie Nachbarschaft hat alles was das Herz begehrt. Fußläufig erreichen Sie beispielsweise die Wilmersdorfer Straße zum shoppen, den Savignyplatz mit seinem pulsierendem Nachtleben, die berühmte Deutsche Oper und das schöne Schloss Charlottenburg. Und wenn Sie einen ruhigen Ort suchen, dann ist der Lietzensee ein idealer Ort zum Entspannen und für gemütliche Spaziergänge.\r\n\r\nDie U-Bahnstationen Bismarckstraße (U2, U7) und Sophie-Charlotte-Platz (U2) sind gleich um die Ecke. Der S-Bahnhof Charlottenburg (S3, S5, S7, S9, S42) liegt in unmittelbarer Nähe. Von dort sind es nur wenige Minuten zur Einkaufsmeile Kurfürstendamm, zum Kaufhaus KaDeWe und in die Innenstadt.'];;;;;;;;87397;true;
2020-05-24 21:15:02.304623;Berlin;district_heating;ONE_YEAR_FREE;15541766;n;n;https://pictures.immobilienscout24.de/listings/67c6c3d9-0502-4046-8d6b-4c38899ec345-1352030322.jpg/ORIG/resize/118x118%3E/extent/118x118/format/jpg/quality/80;4;11.12;40 MBit/s;telekom_layer_magenta_l;über VDSL;1969;REGULAR;;11.12;114772613;district_heating;n;false;MagentaZuhause L;y;Berlin;n;3;2;no_information;energy_consumption;6.13;27;Berlin;14059;well_kept;no_information;false;100 MBit/s;no_information;no_information;y;https://padlock.link/ioml;https://padlock.link/ml;no_information;apartment;14059;1;130.9;n;2,active;true;Deutschland;standard;100 MBit/s;wohnung_kauf;n;;web,email,bank,music,dl-ul,game,sd,mltstr,hd,fast-ul-dl;true;001.15472652;112000;profile0;;1;true;n;showqualicontactform;n;n;Charlottenburg_Charlottenburg;WO841_3;1;Berlin;/expose/114772613;"['Das helle Einraumapartment liegt im 5. Obergeschoss des Vorderhauses. Sie erreichen das Apartment bequem mit dem Personenaufzug. Das Apartment verfügt neben dem Wohn- und Schlafbereich über einen abgetrennten Küchenbereich und ein modernes Bad mit Dusche. Außerhalb der Wohnung, aber direkt neben der Wohnungseingangstür gelegen, befindet sich ein großzügiger Abstellraum.\n\nDas Apartment ist derzeit vermietet.', 'Die Fußböden in Flur und Bad sind gefliest. Im restlichen Bereich wurde ein Laminatboden verlegt. Das hell geflieste Bad wurde im Jahr 2016 komplett modernisiert und verfügt über eine Dusche, Hänge-WC und Waschbecken. Der Küchenbereich verfügt über eine Einbauküche inkl. Elektrogeräte. Die Wohnung wird über eine Fernwärme Zentralheizung mit Wärme versorgt. Die Warmwasserversorgung erfolgt dezentral über einen elektrischen Durchlauferhitzer.', '""Aus der Haustür, in den Schlosspark""\n\nMitten in der Stadt und doch im Grünen. Die Wohnung liegt direkt am Schloss Charlottenburg und der dazugehörigen öffentlichen Parkanlage. Raum für die verschiedensten Betätigungen an der frischen Luft ist hier ausreichend vorhanden. \nAlle Geschäfte und Einrichtungen des täglichen Bedarfs sind fußläufig erreichbar. Speziell der angrenzende ""Dankelmann-Kiez"" bietet eine Vielzahl kleiner Geschäfte und verschiedenster Restaurants und Cafés. \n\nDie Anbindung an den ÖPNV ist perfekt. Direkt vor der Tür halten die Buslinien 309 und M45. Der S-Bahnhof Westend mit der Linie S46, sowie der Ringbahn S41/S42 ist nur 500 m entfernt und fußläufig in etwa 5 Minuten zu erreichen.\n\nDie Autobahnauffahrt ""Spandauer Damm"" der A100 ist nur 2 Autominuten entfernt.', 'Wir haben Ihr Interesse geweckt? \nHier auf dieser Seite finden Sie jetzt die Möglichkeit der Kontaktaufnahme. Für weitere Informationen (Termine, Anschrift u.ä.) benötigen wir Ihre Angaben: Name, Vorname, Anschrift, E-Mail, Telefonnummer (fest/mobil).\nAnfragen ohne Angabe Ihrer Rückrufnummer und Ihrer Adresse können von uns nicht bearbeitet werden! \nFür alle weiteren Informationen rufen Sie uns bitte unter der Telefonnummer 0178 - 86 34 831 an. Es betreut Sie: \nJan Pillardy\n\nDie Angaben in diesem Angebot beruhen auf Angaben des Auftraggebers oder Dritten. Agas-Immobilien übernimmt keine Haftung und keine Gewähr für die Richtigkeit, Vollständigkeit und Aktualität dieser Angaben. Irrtum, Auslassungen und Zwischenverwertung vorbehalten. \n\nWir weisen vorsorglich darauf hin, dass der angegebene Kaufpreis bei entsprechender starker Nachfrage steigen kann. Der Käufer hat eine Provision in Höhe von 7,14 % inkl. MwST. vom Kaufpreis an uns für Nachweis und/oder Vermittlung des Kaufobjekts zu zahlen. Die Provision ist fällig und zahlbar bei Kaufvertragunterzeichnung.\n\nSuchende können sich gerne auf www.agas-immobilien.de/sie-suchen-wir-finden   für weitere/zukünftige Immobilien vormerken lassen. Sie erhalten dann Immobilienangebote, bevor diese online vermarktet werden.\n \nMöchten Sie eine Immobilie verkaufen oder vermieten, wir informieren Sie gerne diskret und unverbindlich über Ihre Möglichkeiten.\nwww.agas-immobilien.de']";;;;;E;;;;;
2020-05-24 21:15:02.711183;Berlin;central_heating;ONE_YEAR_FREE;185949;n;y;https://pictures.immobilienscout24.de/listings/55f3e5c1-b94e-417b-9196-458efe7bcc89-1370689593.jpg/ORIG/resize/118x118%3E/extent/118x118/format/jpg/quality/80;15;10.47;40 MBit/s;telekom_layer_magenta_l;über VDSL;1910;REGULAR;disabled;10.47;114762402;no_information;n;true;MagentaZuhause L;n;Berlin;n;7;1;20;energy_consumption;6.36;66.58;Berlin;13189;first_time_use_after_refurbishment;no_information;false;100 MBit/s;no_information;"Binzstra&szlig;e";y;https://padlock.link/ioml;https://padlock.link/ml;Binzstraße;apartment;13189;2;82.2;n;2,active;true;Deutschland;standard;100 MBit/s;wohnung_kauf;n;1;web,email,bank,music,dl-ul,game,sd,mltstr,hd,fast-ul-dl;true;001.185949;376600;profile0;4;2;true;n;showqualicontactform;n;n;Pankow_Pankow;16719378;3;Berlin;/expose/114762402;"['Südöstlich des Florakiezes im Kissingenviertel, zwischen Berliner Straße und Neumannstraße, befindet sich der charmante Altbau in der Binzstraße 20 in einer ruhigen, von Bäumen gesäumten Wohnstraße. Das gepflegte Mehrfamilienhaus wurde um 1910 erbaut und besteht aus einem Vorder- und einem Gartenhaus sowie einem gemeinsamen Innenhof. \r\n\r\nDen Wohnungen im Erdgeschoss sind jeweils eigene Terrassen mit kleinen Gärten zugeordnet. Der Altbau empfängt seine Bewohner mit einer hellen und freundlichen Fassade mit roten Akzenten. Alle Stilelemente im Treppenhaus wurden liebevoll saniert und die Details gekonnt herausgearbeitet. Stuckbilder an den Wänden im Eingangsbereich und geschwungene Handläufe erinnern an die Geschichte des Hauses und führen über elegante Türstöcke und Kassetten-Eingangstüren zu den Wohnungen. Alle Wohnungen sind über jeweils einen Aufzug am Vorderhaus und Hinterhaus erreichbar.\r\n\r\nVom Erdgeschoss bis zum dritten Obergeschoss bieten praktisch geschnittene 2- bis 3-Zimmerwohnungen mit einer Wohnfläche von 63 bis 97 Quadratmeter ein gemütliches Zuhause. Ein Großteil der Wohnungen ist mit einer Loggia oder einem Balkon ausgestattet. Die Wohnungen sind optimal geschnitten, sodass separat zugängliche und geräumige Zimmer viel Raum zum Einrichten geben. In allen Wohnungen gehen Zimmer, Bäder und Küchen direkt vom Flur ab. Die Bäder haben Tageslicht, die Küchen bieten ausreichend Platz zum Kochen und geselligen Beisammensein. \r\n\r\nDie Wohnungen sind laufend instandgesetzt worden. Isolierglasfenster, Heizkörper sowie Elektro- und Versorgungsleitungen sind erneuert worden, sodass ein zeitgemäßer Standard in den meisten der Wohnungen vorzufinden ist.\r\n\r\nUmgebungsfilm: https://youtu.be/5JfZE5F4jys\r\nWohnbeispiel: https://youtu.be/w5A-4yWso-c\r\n\r\nACCENTRO App für iOS https://goo.gl/KvMJTa und für Android https://goo.gl/ACqL6H', 'Pankow liegt im nördlichen Berlin und gehört mit Prenzlauer Berg und Weißensee zum Bezirk Pankow. Noch heute zeugt der grüne Ortsteil mit seinen zauberhaften Straßenzügen von einer Geschichte herrschaftlicher Sommerdomizile in großen Parkanlagen. Die Menschen in Pankow schätzen die Beschaulichkeit und Ruhe genauso wie die unmittelbare Nähe zum quirligen Prenzlauer Berg.\r\n\r\nFür jeden Geschmack bietet Pankow zahlreiche Erlebnismöglichkeiten. Einkaufen auf dem ältesten Berliner Wochenmarkt am alten Pankower Dorfanger, Spazieren im einzigen Naturschutzgebiet mit vielfältiger Vogelwelt inmitten einer Großstadt – ""Insel der Ruhe"" rund um den Faulen See oder eine Wandertour an der Panke, dem Namensgeber des Bezirks. Auf dem Weg entlang des kleinen Flusses streift man mehrere schöne Parkanlagen: den von Lenné gestalteten Bürgerpark oder den Schlosspark mit dem Schloss Schönhausen. Das Haus, einst Sommerresidenz von Königin Elisabeth Christine, Gattin von Friedrich dem Großen, war zu DDR-Zeiten Gästehaus und Amtssitz des Präsidenten der DDR. Das Schloss wurde liebevoll saniert und gibt als Museum interessante Einblicke in seine wechselvolle Geschichte.\r\n\r\nVom Schlosspark Schönhausen aus zweigt der Radfernweg Berlin-Usedom ab, welcher über 337 Kilometer lang ist und durch teilweise unberührte Naturlandschaften führt. Wer neben ruhiger und erholsamer Natur dynamische und pulsierende Kultur sucht, findet sie im Prenzlauer Berg in der Kulturbrauerei, im Prater oder in einem der unzähligen Cafés.\r\n\r\nNahe der Binzstraße lädt der Florakiez mit der lebendigen Florastraße zum Einkaufen und Verweilen ein. Kleine Spezialitätengeschäfte, besondere Boutiquen mit Ateliercharakter und gemütliche Restaurants bieten Bewohnern und Besuchern von Pankow eine große Vielfalt an Design und kulinarischen Genüssen. Der Florakiez belebt mit seinen Cafés, regelmäßigen Straßenfesten und Flohmärkten eine auf besondere Weise und macht Pankow so reizvoll.']";;;;276.57;;9700;;;;
2020-05-24 21:15:03.036975;Berlin;central_heating;ONE_YEAR_FREE;16965378;n;n;https://pictures.immobilienscout24.de/listings/36e6789f-2800-407b-8995-70eb44a9828f-1338546203.jpg/ORIG/resize/118x118%3E/extent/118x118/format/jpg/quality/80;9;11.24;40 MBit/s;telekom_layer_magenta_l;über VDSL;;REGULAR;disabled;11.24;114790497;no_information;y;false;MagentaZuhause L;y;Berlin;y;9;;no_information;;6.2;110.6;Berlin;10779;no_information;no_information;false;100 MBit/s;no_information;no_information;y;https://padlock.link/ioml;https://padlock.link/ml;no_information;terraced_flat;10779;2;;n;2,active;true;Deutschland;top;100 MBit/s;wohnung_kauf;n;;web,email,bank,music,dl-ul,game,sd,mltstr,hd,fast-ul-dl;true;009.25f24f06-0815-42ce-a148-7a07164ce1d2;555000;profile0;;2;true;n;showqualicontactform;n;n;Wilmersdorf_Wilmersdorf;MB-Immo221;5;Berlin;/expose/114790497;['In Kooperation mit der Alexander Koller Immobilienvermittlung können wir Ihnen hier eine Wohnung in unserer Hauptstadt anbieten. \n\nEine Investition in der Boomstadt Deutschlands, in einer schönen Trend-Lage! \n\nDie leerstehende Wohnung hat einen Balkon und sogar ein Gartenanteil, hat einen optimalen Grundriss für eine dauerhafte Vermietung, oder um die Wohnung selbst zu beziehen.\n\nDie Einheit ist unvermietet und kann sofort bezogen oder vermietet werden.\n\nEbenso stehen noch 3 weitere vermietete Wohnungen zum Verkauf. \n\nDrei Einheiten sind vermietet und die Mietverträge laufen schon einige Zeit. Hierdurch ergibt sich noch erhebliches Mietsteigerungspotential bei einer Neuvermietung.', '- Perfekter Schnitt für eine Kapitalanlage oder Selbstnutzung\n- Balkon und Gartenanteil\n- Gebäude mit Aufzug\n- Tageslichtbad mit Badewanne', 'Der Prager Platz liegt im Berliner Ortsteil Wilmersdorf an der Grenze zum Bayerischen Viertel im Ortsteil Schöneberg. In ihn münden die Prager-, Trautenau-, Prinzregenten-, Aschaffenburger und die Motzstraße. \n\nMit einer Grünanlage und einer Fontäne auf der Mittelinsel, einer kleinen Fußgängerzone und einer Einkaufspassage ist er ein Erholungs- und Freizeitbereich für die umliegenden Wohnviertel.\n\nDie Wohnungen liegen nur wenige Meter entfernt und zeigen zu einem schönen Innenhof.', 'Alle Angaben sind Angaben und Aussagen der Eigentümer. Irrtümliche Falschangaben oder Schreibfehler können nicht zur Haftung führen.\n\nIhr persönlicher Ansprechpartner rund um die Immobilie:\nAleksander Polaczek (Immobilienkaufmann i. A.)\nap@martinbloch.de\n\nMartin Bloch Immobilien - In guten Wänden\nT. 0821 - 2424 9296\nwww.martinbloch.de'];;;;;;;;;;
2020-05-24 21:15:03.407418;Berlin;central_heating;ONE_YEAR_FREE;15867627;n;n;https://pictures.immobilienscout24.de/listings/b1665cc9-7702-482b-9d41-4572b43d7ff4-1338110568.jpg/ORIG/resize/118x118%3E/extent/118x118/format/jpg/quality/80;17;12.1;40 MBit/s;telekom_layer_magenta_l;über VDSL;1910;REGULAR;disabled;12.1;114763570;oil;n;true;MagentaZuhause L;y;Berlin;y;9;1;29;energy_consumption;7.07;135.82;Berlin;10825;well_kept;no_information;false;100 MBit/s;no_information;"M&uuml;nchener Stra&szlig;e";y;https://padlock.link/ioml;https://padlock.link/ml;Münchener_Straße;apartment;10825;5;180.7;n;2,active;true;Deutschland;premium;100 MBit/s;wohnung_kauf;y;2;web,email,bank,music,dl-ul,game,sd,mltstr,hd,fast-ul-dl;true;002.01004615301;622000;profile0;5;5;true;n;showqualicontactform;y;n;Schöneberg_Schöneberg;AJS19084;6;Berlin;/expose/114763570;['TRAUMHAUS MIT NEUER KRONE\n\nEine echte Altberliner Perle ist das fünfgeschossige Gründerzeithaus an der Ecke Münchener Straße / Apostel-Paulus-Straße. Neben der aufwendigen und liebevollen Sanierung der Gebäudefassade und des Treppenhauses wird auch das Dachgeschoss ausgebaut. Dabei entstehen drei helle großzügige Maisonettewohnungen mit Galerie, großen Gauben und Dachterrasse zum gepflegten Innenhof. Durch den Bau von neuen Aufzügen sind vom Keller bis zum Dachgeschoss alle Wohnungen bequem erreichbar.\n\nDas Objekt besticht durch außergewöhnliche Grundrisse und charmante Altbaudetails. Neben den neuen Maisonettewohnungen im Dachgeschoss stehen außerdem 22 Wohnungen im Ist-Zustand zum Verkauf – diese eignen sich ideal für Kapitalanleger.\n\nZur Straßenseite genießen Sie einen entspannten Blick auf eine grüne Insel, eine kleine einladende Oase der Ruhe.\n\nDer Energieausweis liegt vor. Die Heizungs- und Warmwasserversorgung erfolgt aktuell über Heizöl. Der derzeitige Endenergieverbrauch des Gebäudes liegt bei 180,70 und entspricht der Effizienzklasse F.\nIm Zuge der Modernisierung des Gemeinschaftseigentums wird eine neue Heizanlage installiert.\n\nINFORMATIONEN ZUR VERMIETUNG\n\nDie aktuelle Netto-Kaltmiete beträgt ca. 830,00 EUR. Hier ist die Modernisierungsumlage noch nicht berücksichtigt. \nDas zukünftige Wohngeld wird ca. 445 EUR.', 'DIE WICHTIGSTEN FAKTEN IM ÜBERBLICK:\n\n• Vermietete Wohnung\n\n• Verkauf im Ist-Zustand (gepflegt)\n\n• Repräsentativer Altbau\n\n• Altbauelemente\n\n• Stuckelemente vorhanden\n\n• Doppelkastenfenster, teilweise Holz-Isolierglasfenster\n\n• Hohe Decken\n\n• Helle und großzügige Räume\n\n• Lichthof\n\n• Bestlage im Bayrischen Viertel\n\n• Beliebte Wohngegend \n\n• Ideale Anbindung an den ÖPNV\n\n\nAUFWENDIGE REVITALISIERUNG DES GEMEINSCHAFTSEIGENTUMS\n\n• Neugestaltung der Fassade \n\n• Neu ausgeführte Fensterbänke (Titanzinkblech/Aluminium)\n\n• Neugestaltete Treppenhäuser\n\n• Personenaufzug (neu, ebenerdig und geräumig)\n\n• Modernisierung der Haustechnik (Brennwerttechnik)\n\n• Attraktive Neugestaltung des Innenhofs \n', 'LEBEN UND KULTUR IM BAYERISCHEN VIERTEL \n\nBeim Kaffee Kunstausstellungen besuchen oder einfach Zeitung lesen – in dem Schöneberger Kiez liegen Kulturvielfalt und Lebensqualität ganz in der Nähe. \n\nDie Straßencafés und Restaurants im Bayerischen Viertel und rund um den Viktoria-Luise-Platz sind im Sommer stets gut gefüllt. In diesem traditionell literarischen Kiez werden vielerorts Lesungen, Salons und Diskussionen veranstaltet. Modeinteressierte können im Akazienkiez feine Boutiquen entdecken. ', 'Hat das Angebot Ihr Interesse geweckt ?\n\nBitte nutzen Sie das Kontaktformular oder rufen Sie uns an, falls Sie weitere Informationen benötigen oder eine Besichtigung gewünscht ist.\n\nAlle Angaben basieren ausschließlich auf Informationen, die uns von unserem Auftraggeber übermittelt wurden. Wir übernehmen keine Gewähr für die Vollständigkeit, \n\nRichtigkeit und Aktualität dieser Angaben. Es gelten unsere Allgemeinen Geschäftsbedingungen.'];;;;445;F;;true;;;
2020-05-24 21:15:03.863932;Berlin;district_heating;ONE_YEAR_FREE;97549;n;n;https://pictures.immobilienscout24.de/listings/048f2c09-1b35-4830-b3f8-d14210a2e2b1-1338323539.jpg/ORIG/resize/118x118%3E/extent/118x118/format/jpg/quality/80;4;12.7;40 MBit/s;telekom_layer_magenta_l;über VDSL;1900;REGULAR;;12.7;114776475;district_heating;n;false;MagentaZuhause L;y;Berlin;y;5;1;50;energy_consumption;7.58;65.25;Berlin;10559;no_information;no_information;false;100 MBit/s;no_information;"Stephanstra&szlig;e";n;https://padlock.link/ioml;https://padlock.link/ml;Stephanstraße;ground_floor;10559;2;69.8;n;2,active;true;Deutschland;top;100 MBit/s;wohnung_kauf;y;;web,email,bank,music,dl-ul,game,sd,mltstr,hd,fast-ul-dl;true;001.97549;219000;profile0;4;2;true;y;showqualicontactform;n;n;Tiergarten_Tiergarten;Stephan50:13;3;Berlin;/expose/114776475;"['- fünfgeschossige Bauweise im ""Kaufmann-Stil""\n- Jugendstil-Altbau\n- hervorragend erhaltene Stuckfassade\n\nDie Grundrisse entsprechen dem Baujahr, somit sind die Wohnungen mit hohen Decken und Dielen ausgestattet.\nDie meisten Bäder wurden nachträglich saniert oder neu eingebaut und sind gefließt. Das Haus wird mit Fernwärme versorgt.', '- vermietet\n- Garten\n- ruhiger Seitenflügel\n- Bad mit Dusche\n\nDa die Wohnung vermietet ist, stehen hier keine Innenfotos zur Verfügung.', 'Der Stuckaltbau liegt in zentraler Lage Nähe der S- und U-Bahn-Station ""Westhafen"" und der Turmstraße mit mehreren Einkaufsmöglichkeiten, Restaurants und Cafés. \nEsm handelt sich um eine ruhige Seitenstraße die trotzdem zur Versorgung besten geeignet ist.', 'Die monatliche Nettokaltmiete beträgt 297,38 €.']";;;;;;0;;;;
2020-05-24 21:15:04.193440;Berlin;district_heating;ONE_YEAR_FREE;17128611;n;n;https://pictures.immobilienscout24.de/listings/b7836102-93b0-43ef-a279-52eb589a1864-1286167899.jpg/ORIG/resize/118x118%3E/extent/118x118/format/jpg/quality/80;2;11.41;40 MBit/s;telekom_layer_magenta_l;über VDSL;1900;REGULAR;;11.41;110831864;district_heating;y;false;MagentaZuhause L;y;Berlin;y;5;1;20;energy_consumption;8.17;58.93;Berlin;10245;well_kept;normal;false;100 MBit/s;no_information;"Gr&uuml;nberger Str.";n;https://padlock.link/ioml;https://padlock.link/ml;Grünberger_Str.;apartment;10245;2;88;n;2,active;true;Deutschland;top;100 MBit/s;wohnung_kauf;y;0;web,email,bank,music,dl-ul,game,sd,mltstr,hd,fast-ul-dl;true;009.04694508-7020-4e60-bbea-99eee3b5b20a;229000;profile0;4;2;true;n;showqualicontactform;n;n;Friedrichshain_Friedrichshain;3037.03;2;Berlin;/expose/110831864;['Die zum Verkauf stehende Wohnung befindet sich im EG des Seitenflügels des Mehrfamilienhauses.\n\nDas Gebäude wurde im Jahr 2001 kernsaniert. Hierbei wurden u.a. alle wasserführenden Leitungen und auch die Elektroleitungen getauscht. Die Heizung wurde auf Fernwärme umgerüstet. Die Fenster wurden durch Isolierglasfenster ersetzt.\n\nDer Flur und die Wohnräume sind mit abgezogenen Dielen ausgestattet. \nKüche und Bad sind gefliest.\n\nDas innenliegende Duschbad ist mit Granitboden gefliest.\n\nEs ist eine Einbauküche mit Ober- und Unterschränken vorhanden.', '- innenliegendes Duschbad mit Granitboden\n- abgezogene Dielen\n- grundsolides saniertes Mehrfamilienhaus\n- Einbauküche', 'Die Grünberger Str. kreuzt die Warschauer Str. zwischen Frankfurter Tor und Comeniusplatz. Der quirlige Kiez rund um die Warschauer Str. ist weit über die Stadtgrenzen bekannt.\nViele Cafés liegen im Umkreis. Auch die üblichen infrastrukturellen Einrichtungen sind im nahen Umfeld erreichbar.', 'Alle Informationen beruhen auf Informationen der/des Verkäufers/in und wurden nach bestem Wissen und Gewissen zusammengestellt. Eine Gewähr für die Richtigkeit kann jedoch nicht übernommen werden.\n\nSie haben das Recht, diesen Vertrag innerhalb von 14 Tagen zu widerrufen. Dazu müssen Sie eine eindeutige Willenserklärung an uns schicken, aus der Ihr Widerrufswunsch hervorgeht. Bitte schicken Sie den Widerruf entweder per Post an Beate Quade e.Kfr., Bundesallee 66, 12161 Berlin oder per Email an die unten angegebene Adresse oder per Fax an: 030/ 850 72 78 23.'];;;2002;202.8;C;;;;;
2020-05-24 21:15:04.670879;Berlin;self_contained_central_heating;ONE_YEAR_FREE;246804;n;y;https://pictures.immobilienscout24.de/listings/dead675d-e5c1-4b03-bab3-0717149442e6-1357438672.jpg/ORIG/resize/118x118%3E/extent/118x118/format/jpg/quality/80;13;12.1;40 MBit/s;telekom_layer_magenta_l;über VDSL;1900;REGULAR;;12.1;114779033;gas;n;false;MagentaZuhause L;y;Berlin;y;9;1;2;energy_required;7.07;109.09;Berlin;10827;first_time_use_after_refurbishment;no_information;false;100 MBit/s;no_information;"Neue-Kulmer-Stra&szlig;e";y;https://padlock.link/ioml;https://padlock.link/ml;Neue-Kulmer-Straße;apartment;10827;3;192.3;n;2,active;true;Deutschland;premium;100 MBit/s;wohnung_kauf;n;5;web,email,bank,music,dl-ul,game,sd,mltstr,hd,fast-ul-dl;true;001.246804;715000;profile0;5;3;true;n;showqualicontactform;n;n;Schöneberg_Schöneberg;7728;5;Berlin;/expose/114779033;['Dieses große Eckhaus, gelegen am Willmanndamm / Neue Kulmer Straße ist gegliedert in zwei Vorderhäuser und wurde um die Jahrhundertwende erbaut. Das Gebäude beinhaltet 26 Wohneinheiten. Es verfügt über zwei Fahrstühle, sowie über einen Abstellplatz für Fahrräder im Innenhof. Die hier angebotene Dachwohnung befindet sich im rechten 5. Obergeschoss und hat drei große Zimmer und eine ca. 6m² große West-Terrasse. Die ca. 109 m² große Wohnung ist leicht mit dem Fahrstuhl zu erreichen und somit ideal für jung und alt. Sie bietet ausreichend Platz und ist durch ihre Lage sehr hell und sonnig. Das monatliche Wohngeld beträgt 254,- €.\r\nDiese Wohnug ist frisch saniert und bezugsfertig.', 'Perfekt sanierte Dachwohnung\r\nschöner Weitblick über Berlin \r\n3 Zimmer mit West-Terrasse\r\nneue Gasetagenheizung\r\nAufzug\r\nWohngeld 254 €\r\nRücklagen ca. 92.500 € Ende 2019', 'Der Willmanndamm und die Neue Kulmer Straße befindet sich in einer ruhigen und schön begrünten Umgebung, die von prächtigen Stuckaltbauten geprägt ist. Umrahmt von dem neu gestalteten Park am Gleisdreieck und dem Heinrich-von-Kleist-Park, nahe der  Einkaufsstraße Hauptstraße, verspricht der Willmanndamm städtisches Wohnen verbunden mit einem hohen Erholungsfaktor. Der Willmanndamm liegt mitten im beliebten Crellekiez und verfügt über einen wöchentlichen Markt, der Ihnen viele internationale, frische Köstlichkeiten bietet. Zudem ist der bekannte Wochenmarkt am Winterfeldtplatz nur einige Minuten zu Fuß entfernt. Der Willmanndamm hat gute Anbindungen an die öffentlichen Verkehrsmittel. Der S+U Bahnhof Yorckstraße ist in nur wenigen Schritten zu erreichen.'];;;;254;;2;true;;;true
