2020-05-24 20:55:51.930577;Berlin;central_heating;ONE_YEAR_FREE;15474925;n;n;https://pictures.immobilienscout24.de/listings/8791b016-ee02-4d92-ad6b-58c893509c7f-1364580924.png/ORIG/resize/118x118%3E/extent/118x118/format/jpg/quality/80;24;12.78;40 MBit/s;telekom_layer_magenta_l;über VDSL;1919;REGULAR;;12.78;117580066;gas;n;false;MagentaZuhause L;n;Berlin;n;6;1;73a;energy_consumption;7.25;63;Berlin;10555;no_information;no_information;;false;100 MBit/s;garage;Alt-Moabit;n;https://padlock.link/ioml;https://padlock.link/ml;Alt-Moabit;apartment;10555;2;129;n;2,active;true;Deutschland;top;100 MBit/s;wohnung_kauf;y;web,email,bank,music,dl-ul,game,sd,mltstr,hd,fast-ul-dl;true;001.15417560;299318;profile0;2;true;n;;n;n;Tiergarten_Tiergarten;K-19262_WE40_IN_CB;3;Berlin;/expose/117580066;"['Das 1919 erbaute Gebäude ist in ein Vorderhaus, ein Hinterhaus sowie zwei Seitenflügel aufgeteilt. Im hinteren Bereich des Grundstücks befindet sich ein Fabrikgebäude. Alle Einheiten des Gebäudes verteilen sich auf insgesamt vier Geschosse zuzüglich des Dachgeschosses.  \n\nDie Wohnung ist im 3. Obergeschoss des rechten Seitenflügels gelegen und überzeugt auf einer Wohnfläche von ca. 63 m². Diese verteilt sich auf zwei Zimmer sowie einem Flur nebst einer Küche und einem Dusch-Badezimmer.\n\nEs besteht weiterhin die Option, im Hofbereich zukünftig Balkone sowie einen Fahrstuhl anzusetzen.\n\nAuch stehen 2 Garagenstellplätze im Hinterhaus zum Verkauf, die bei Bedarf jeweils zu einem Preis von 40.393 EUR erworben werden können.  Die Garagen sind aktuell vermietet. Der jeweilige Mietvertrag könnte sodann wegen Eigenbedarfs gekündigt werden. \n\nDas Gebäude wurde 2019 in Eigentumswohnungen aufgeteilt. Die Wohnung ist seit 2014 zuverlässig vermietet. Den Mietern steht nach dem Verkauf der Wohnung eine 10-jährige Kündigungsschutzfrist zu.', 'NÄHE SCHULTHEISS-QUARTIER UND SPREE!\n\nDas Wohnensemble befindet sich in einer sehr beliebten Lage von Berlin-Moabit. Hier wird eine schöne und lebhafte Kiezatmosphäre mit viel hauptstädtischer Urbanität harmonisch vereint. Moabit ist ein Ortsteil von dem Berliner Bezirk Mitte und liegt somit im Herzen der Hauptstadt.\n\nNeben Europas größtem Kreuzbahnhof, dem Berliner Hauptbahnhof, befinden sind auch der „Hamburger Bahnhof"", das Museum für Gegenwartskunst und das Naturkundemuseum in unmittelbarer Nachbarschaft zu der Immobilie.\n\nFür Sportler bieten das Trainingsgelände des SC-Union Berlin sowie der Tennis-Club Tiergarten oder das großzügige Parkgelände des Tiergartens optimale Möglichkeiten zum Abschalten vom Alltag. \n\nKleine Traditionsgeschäfte, individuelle Cafés und Restaurants tragen zu der Beliebtheit des Viertels und zu der Wohnqualität der Kiezbewohner bei. Sonstige Geschäfte des täglichen Bedarfs sind hier ebenfalls allumfassend vertreten.\n\nZentrale U-Bahn-Linien und diverse Busse garantieren eine schnelle und flexible Anbindung an den ÖPNV. Auch ist die Stadtautobahn innerhalb weniger Minuten mit dem PKW erreicht.']";;1;198.12;;;;3;;;5;;
2020-05-24 20:55:52.367394;Berlin;floor_heating;ONE_YEAR_FREE;16736314;n;y;https://pictures.immobilienscout24.de/listings/5f46f583-4e91-497c-ab96-1904c021a315-1364222516.jpg/ORIG/resize/118x118%3E/extent/118x118/format/jpg/quality/80;9;10.29;2,4 MBit/s;telekom_layer_magenta_m_hybrid2;über Hybrid;;WITH_HYBRID;disabled;10.29;117521554;local_heating;n;true;MagentaZuhause M Hybrid (2);n;Berlin;n;7;;11;;4.13;66.19;Berlin;12527;first_time_use;sophisticated;;false;16 MBit/s;underground_garage;"Regattastra&szlig;e";y;https://padlock.link/mmh2sa;https://padlock.link/mmhy2;Regattastraße;apartment;12527;2;;n;2,active;true;Deutschland;schaufenster;50 MBit/s;wohnung_kauf;n;web,email,bank,music,dl-ul,game,sd,mltstr,hd;true;002.01007321877;400000;profile0;2;true;n;;y;n;Grünau_Köpenick;87093 55;3;Berlin;/expose/117521554;['Mit BUWOG THE VIEW erhält der Südosten Berlins ein architektonisches Highlight am Ufer der Dahme. Das Ensemble vereint in drei Gebäuden insgesamt 63 Eigentumswohnungen mit direktem Blick auf das Wasser – von jeder Wohnung aus! \nDirekt vor dem Ensemble verläuft die ruhige, 600 Meter lange Uferpromenade für Erholung und Entspannung. BUWOG The View besteht aus drei einzelnen Gebäuden (Haus I, Haus II, Haus III) und ist der neueste Bauabschnitt im nachhaltigen Quartier 52° Nord.\n\n\nHaus I + Haus III\n\nDie Häuser I und III wurden entworfen vom renommierten Architekturbüro PA GmbH Pätzold Architekten, Berlin. Die markante Fassadengestaltung macht die Häuser I und III einzigartig: Natürliches Holz und der maritime Charme von Cortenstahl schaffen einen angenehmen Kontrast. Um den Eindruck von Schiffsrümpfen zu verstärken, haben die Häuser I und III eine außergewöhnliche Trapezform. \nDie Anordnungen der Wohnbereiche an den Gebäudeecken bietet abwechslungsreiche Ausblicke von allen Wohnungen: Zum Wasser und auch zur Sonnenseite entdecken Sie das Spiel der Wellen und das glitzernde Wasser immer wieder neu. Genießen Sie Natur pur in einem zeitlos schönen Architektenhaus!\n\nDie Häuser I und III vereinen insgesamt 35 Eigentumswohnungen von 2 bis 4 Zimmern und mit 58 bis 145 m² Wohnfläche. Sämtliche Wohnungen bieten mit bodentiefen Panoramafenstern den direkten Blick aufs Wasser. \nDer Zugang über die Häuser I und III erfolgt über großzügige Eingangsfoyers mit einem durchdachten Beleuchtungskonzept. Auch die Außenanlagen sind geschmackvoll gestaltet, wo sich Gräser und Zierpflanzen harmonisch in die Uferlandschaft einfügen.', 'BUWOG THE VIEW vereint schönste Wasserlage mit  hochwertiger Architektur und bester Ausstattung. Parkettboden, hochwertige Sanitärobjekte und Fußbodenheizung in allen Wohnungen sorgen für ein zeitlos-elegantes Wohngefühl:\n\n• Genießen Sie den freien Blick auf das Wasser von allen Wohnungen aus\n• Optimale Grundrisse für viel Freiraum und Wohnqualität\n• Bodentiefe Fenster für ein helles, natürliches Wohngefühl\n• Alle Wohnungen mit großzügigem Balkon oder Loggia, Terrasse mit Blick auf die Dahme\n• Praktische Raumaufteilung mit Abstell- bzw. Hauswirtschaftsräumen\n• Im Erdgeschoss: Rollläden und abschließbare Fenster- und Türgriffe\n• Energieeffizient: EnEV 2014 inklusive Verschärfung EnEV 2016\n• Tiefgarage mit 12 E-Auto-Stellplätzen und 126 Fahrradstellplätzen\n• Tiefgaragenstellplatz verfügbar\n• Barrierefreier Zugang von der Tiefgarage in die Wohnetagen\n\nWeitere Ausstattungsmerkmale dieser Wohnung:\n\n• Ca. 31 m² Wohn-/Ess-/Kochbereich\n• Modernes Wannenbad mit zusätzlicher Dusche\n• Hauswirtschaftsraum\n• Ca. 11 m² großer Balkon', 'Genießen Sie das Wohnen am Wasser und erleben Sie die einzigartige Lage im Bezirk Treptow-Köpenick am Ufer der Dahme. Hier liegt das Quartier 52° Nord entlang der historischen Regattastrecke Grünau. Schritt für Schritt entsteht hier ein nachhaltiges Wohnquartier, dessen Herzstück ein 6.000 Quadratmeter quartierseigenes Wasserbecken ist. Es ist biologisch selbstreinigend und sorgt für ein angenehmes Mikroklima. Eine nachhaltige Energieerzeugung vor Ort und eine quartierseigene Kita runden das Gesamtkonzept ab.\nHier trifft beste Wohnlage im Grünen auf Freizeit und Erholung am Wasser und optimale Anbindung an die City. Daher erfreut sich Treptow-Köpenick seit Jahren wachsender Beliebtheit.\nDazu trägt die positive wirtschaftliche Entwicklung bei, wie etwa am nahen Wissenschafts- und Wirtschaftsstandort Adlershof (WISTA). In Deutschlands modernstem Technologiepark mit über 1.000 Übernehmen, 10 Forschungseinrichtungen und 6 Hochschulinstituten arbeiten und studieren über 25.000 Menschen. Im Mai 2019 verlegte die Allianz Deutschland AG, ihren Berliner Standort auf den neuen Allianz Campus nach Adlershof. Nehmen auch Sie Kurs auf Grünau!\n\nBeste Anbindung:\n\nErholsam wohnen im Quartier 52° Nord mit allen Vorteilen der Großstadt in Reichweite:\n\n• Perfekter Anschluss an die Stadtautobahn (A 113, A 117, A10)\n• Ca. 10 Minuten mit dem Auto zum WISTA, Europas modernstem Technologiepark\n• Ca. 15 Minuten mit dem Auto zum Flughafen Schönefeld / BER\n• Ca. 40 Minuten ab S-Bahnhof „Grünau“ bis Alexanderplatz, Friedrichstraße, Hauptbahnhof', 'Wir sind für Sie da\nUnser Vertriebsteam ist auch aus dem sicheren Home-Office weiterhin für Sie erreichbar. Kommen Sie gerne auf uns zu für Ihren individuellen Beratungstermin.  Die Showrooms sind derzeit geschlossen – aber per Telefon und E-Mail stehen wir Ihnen gern zur Verfügung. Auch Reservierungen von Wohnungen sind unverändert möglich.\nJetzt Termin vereinbaren! \n\n\nInformationen zur BUWOG und zum Quartier 52° Nord erhalten Sie auch auf www.52grad-nord.de'];;1;;;1;87093;2;true;;4;10 MBit/s;50 MBit/s
2020-05-24 20:55:52.842393;Berlin;no_information;ONE_YEAR_FREE;174522;n;y;https://pictures.immobilienscout24.de/listings/a7d76bb1-5249-46bc-9a6b-7d7cf519664e-1364602075.jpg/ORIG/resize/118x118%3E/extent/118x118/format/jpg/quality/80;10;16.54;40 MBit/s;telekom_layer_magenta_l;über VDSL;;REGULAR;disabled;16.54;117583592;;n;true;MagentaZuhause L;y;Berlin;n;8;;no_information;;8.84;80;Berlin;12051;no_information;no_information;;false;100 MBit/s;no_information;no_information;n;https://padlock.link/ioml;https://padlock.link/ml;no_information;apartment;12051;3;;n;2,active;true;Deutschland;top;100 MBit/s;wohnung_kauf;n;web,email,bank,music,dl-ul,game,sd,mltstr,hd,fast-ul-dl;true;001.174522;449000;profile0;3;true;n;showqualicontactform;n;n;Neukölln_Neukölln;117583592;3;Berlin;/expose/117583592;['Diese kernsanierte Altbauwohnung wurde sinnvoll umgebaut und mit viel Liebe zum Detail kreativ gestaltet. Der Flur wurde zur Küche geöffnet, wodurch eine ansprechende Fläche für einen groß-zügigen Wohn-, Koch- und Essbereich entstand. Frappant ist die kolorierte Verglasung zwischen diesem einladenden Wohn-, Koch- und Essbereich und dem Badezimmer. Sowohl der Kochbereich als auch das Bad faszinieren mit neuen individuellen Design-ausstattungen und Fenstern in Südlage. Beachtenswert sind u.a. die Kochinsel mit Gasherd und Waschsäulen. Der Wohn-, Koch- und Essbereich befindet sich im sogenannten „Berliner Zimmer“, das ein generöses Durchgangs-zimmer zwischen dem Wohn-zimmer im Vorderhaus und dem Seitenflügel ist. Das Wohnzimmer führt weiter auf die Loggia, die zur hübschen Straße einen angenehmen Aufenthalt bietet. Zur anderen Seite ist das Schlaf-zimmer durch zwei Türen zugänglich. Dieses behagliche Zimmer ist mit seinem Fenster in die Morgensonne zum Hof ausgerichtet. Akzentuiert wird das sehr wohnliche Ambiente in den beiden Zimmern und dem Wohn-, Koch- und Essbereich von markanten Holzdielenböden, die sehr gut renoviert wurden. Auch die originalen Holzprofiltüren wirken auf die exzellente Raumästhetik  ein.\nWer ein Altbauambiente mit komfortablen Räumlichkeiten sucht, geschickt garniert mit stilvollen modernen Designelementen, der sollte auf diese Wohnung aufmerksam werden.\nIn Zusammenhang mit der stark nachgefragten Lage wird ein erstklassiges Kaufangebot in sehr wohnlicher Lage geboten.\n\nEin Energieausweis ist nicht vorhanden.', 'Sie möchten den Marktwert Ihrer Immobilie wissen oder Ihre Immobilie verkaufen? Wir sind seit 1995 erfolgreich im Verkauf von Immobilien in Berlin, Potsdam und Umgebung tätig. Unsere exzellenten Eigentümerbewertungen sprechen für sich.\n\n•\tOftmals haben wir schon den richtigen Käufer für Ihre Immobilie in unserer Kartei\n•\tWir sind Bellevue Best Property Agent und Mitglied in den Verbänden IVD & FIABCI\n•\tWir benötigen keinen schriftlichen Alleinauftrag\n•\tKosten entstehen Ihnen bei uns keine\n•\tUnsere Spezialisten stehen Ihnen gerne für ein erstes – für Sie unverbindliches - Gespräch zur Verfügung\n\nWir freuen uns über Ihre Kontaktaufnahme unter einkauf@immoberlin.de oder (030) 895 72 20.\nBitte besuchen Sie auch unsere Website: \nhttps://www.immoberlin.de'];;;;;;;;;;;;
2020-05-24 20:55:53.242496;Berlin;floor_heating;;16736314;n;y;https://pictures.immobilienscout24.de/listings/b31fa9aa-6c8a-4515-913d-61ec86536df6-1364210958.jpg/ORIG/resize/118x118%3E/extent/118x118/format/jpg/quality/80;5;10.29;;;;;;disabled;10.29;117518392;local_heating;n;true;;n;Berlin;n;4;;5;;4.13;37.4;Berlin;12527;first_time_use;sophisticated;;false;;underground_garage;Gaffelsteig;y;;;Gaffelsteig;apartment;12527;1;;n;2,active;;Deutschland;schaufenster;;wohnung_kauf;n;;false;002.01007321877;195800;profile0;1;true;y;;n;n;Grünau_Köpenick;87624 44;1;Berlin;/expose/117518392;['Wem der Trubel von Berlin-Mitte zum Wohnen nicht zusagt, findet in Grünau einen charmanten Rückzugsort. Hier, in einer der schönsten Gegenden Berlins, entwickelt BUWOG direkt am Ufer der Dahme ein Wohnquartier in bevorzugter Lage: 52° Nord.\n\n\nBaufeld REGATTAHOF\n\nDas Haus am Regattahof sowie die Gartenhäuser am Gaffelsteig 5 und 7 vereinen klassische Bauweise mit moderner, frischer Architektur. Die Fassaden sind teilweise mit einer Holzfassade aus Lärchenholz versehen, was eine besonders lockere, ansprechende Optik ergibt.\nIn der Mitte des Ensembles liegt der Gartenhof mit terrassierten Aufenthaltsbereichen. Er bietet einen privaten Spielplatz sowie die Möglichkeiten zum Urban Gardening.\n\nNehmen Sie Kurs auf Grünau und finden Sie die perfekte Eigentumswohnung im Regattahof – ob zur Kapitalanlage oder als neues Zuhause:\n\n- Mikro-Apartments mit 1 Zimmer – top für Anleger! (28-42 m²)\n- Klassische Eigentumswohnungen mit 2 bis 3 Zimmern (47-97 m²)\n- Optionaler Stellplatz in der Tiefgarage\n- Balkon, Terrasse oder Privatgarten zum grünen Innenhof\n- Nur wenige Schritte bis zum Dahme-Ufer', 'Mikro-Apartments zeichnen sich anders als klassische 1-Zimmer-Wohnungen durch eine intelligente Raumaufteilung aus, die sie deutlich größer wirken lässt. Diese Raumwunder eignen sich besonders gut als Zweitwohnsitz für  Berufstätige, als Studentenwohnung oder ganz einfach für Singles, die gerne mit „leichtem Gepäck“ leben.\n\nMikro-Apartments sind zudem ein ideales Investitionsobjekt für Kapitalanleger.\n\n- Flur mit Garderobe\n- Ca. 25 m² Wohn-/Schlafbereich mit offenem Koch-/Essbereich\n- Komfortables Duschbad\n- Sonniger Balkon', 'Wasser, Architektur, Infrastruktur: Dieser Dreiklang macht Grünau besonders attraktiv für alle, die Hauptstadtnähe und Wohnen im Grünen schätzen. Auch im Trendbezirk Treptow-Köpenick ist der Berlin-Boom spürbar. Am Wissenschafts- und Wirtschaftsstandort Adlershof (WISTA) arbeiten und forschen über 25.000 Menschen. Ab 2019 wird diese Zahl durch den Berliner Standort der Allianz Deutschland AG weiter steigen. Und die neue Hochschule für Technik und Wirtschaft liegt auch nur 30 Minuten entfernt.\n\nBerlins wasser- und waldreichster Bezirk bietet jedoch nicht nur viele Jobs, sondern auch viel Natur und ein großes Freizeitangebot. Daher wird der Ortsteil Grünau immer beliebter. Hier, an der historischen Regattastrecke, liegt das Quartier 52° Nord mit dem Regattahof.', 'Wir sind für Sie da\nUnser Vertriebsteam ist auch aus dem sicheren Home-Office weiterhin für Sie erreichbar. Kommen Sie gerne auf uns zu für Ihren individuellen Beratungstermin.  Die Showrooms sind derzeit geschlossen – aber per Telefon und E-Mail stehen wir Ihnen gern zur Verfügung. Auch Reservierungen von Wohnungen sind unverändert möglich.\nJetzt Termin vereinbaren! \n\n\nInformationen zur BUWOG und zum Quartier 52° Nord erhalten Sie auch auf www.52grad-nord.de'];;;;;1;87624;3;true;;;;
2020-05-24 20:55:53.605782;Berlin;district_heating;ONE_YEAR_FREE;16225148;n;n;https://pictures.immobilienscout24.de/listings/b76d6d65-efaf-4dae-b667-3e919ec9a156-1356736636.jpg/ORIG/resize/118x118%3E/extent/118x118/format/jpg/quality/80;10;11.12;40 MBit/s;telekom_layer_magenta_l;über VDSL;1971;REGULAR;disabled;11.12;110915186;no_information;n;false;MagentaZuhause L;y;Berlin;n;5;3;no_information;energy_required;6.13;47.75;Berlin;14059;no_information;no_information;E;false;100 MBit/s;no_information;no_information;n;https://padlock.link/ioml;https://padlock.link/ml;no_information;apartment;14059;1;137;n;2,active;true;Deutschland;standard;100 MBit/s;wohnung_kauf;n;web,email,bank,music,dl-ul,game,sd,mltstr,hd,fast-ul-dl;true;001.15930480;229000;profile0;1;true;n;showqualicontactform;n;n;Charlottenburg_Charlottenburg;685;2;Berlin;/expose/110915186;['Die vermietete 1-Zimmer-Wohnung liegt im 2. OG des Vorderhauses und hat einen sehr schönen Grundriss. \nDas Haus aus der Gründerzeit verfügt über einen sehr schönen Innenhof mit einem gepflegten Treppenhaus.\nDie Immobilie umfasst insgesamt 17 Einheiten und wurde 2018 aufgeteilt.\nDer Mietvertrag wurde im Jahr 1998 abgeschlossen und die Rendite beträgt ca. 1,77 %. Bei der angegebenen Miete handelt es sich um die Miete ohne kalte Betriebskosten und ohne Kosten für Heizung und Warmwasser.\n\n', 'Die zum Verkauf stehende Eigentumswohnung befindet sich im Berliner Stadtteil Charlottenburg, unweit des Lietzensees - einer Lage, die zu den beliebtesten in ganz Berlin gehört.\nHier findet man diverse Einkaufsmöglichkeiten (rund um den Kaiserdamm), viele gastronomische Einrichtungen, Ärzte, Schulen, Kitas und Naherholungsmöglichkeiten - alles in fußläufiger Entfernung. Durch mehrere Buslinien und nah gelegene S- und U-Bahn-Stationen ist eine sehr gute Anbindung an den öffentlichen Nahverkehr gewährleistet.'];;;168.01;;;;2;;;;;
2020-05-24 20:55:53.999639;Berlin;central_heating;ONE_YEAR_FREE;999660;n;n;https://pictures.immobilienscout24.de/listings/f3aee3bc-3507-41dc-800e-fd92c1c592d4-1364789670.jpg/ORIG/resize/118x118%3E/extent/118x118/format/jpg/quality/80;8;11.14;40 MBit/s;telekom_layer_magenta_l;über VDSL;1900;REGULAR;disabled;11.14;117577809;gas;n;false;MagentaZuhause L;y;Berlin;y;7;1;no_information;energy_required;6.17;61.62;Berlin;10405;no_information;no_information;E;false;100 MBit/s;no_information;no_information;n;https://padlock.link/ioml;https://padlock.link/ml;no_information;apartment;10405;2;144;n;2,active;true;Deutschland;premium;100 MBit/s;wohnung_kauf;y;web,email,bank,music,dl-ul,game,sd,mltstr,hd,fast-ul-dl;true;001.999660;350000;profile0;2;true;n;showqualicontactform;n;n;Prenzlauer_Berg_Prenzlauer_Berg;3005;3;Berlin;/expose/117577809;['Die ca. 61,62 m² große 2 Zimmer-Wohnung befindet sich im 2. OG des ruhigen Seitenflügels. Baujahr des Gebäudes ist ca. im Jahre 1900. Das Gebäude ist in einer ruhigen Seitenstraße gelegen.\r\n\r\nDie Kapitalanlage besteht aus einem großen Wohnbereich mit einer offenen Wohnküche, einem tagesbelichteten Wannenbad, einem Flur und einem Schlafzimmer. Das Wohnzimmer und die Küche sind besonders hell auf Grund der drei großen Fenster mit Süd-Ost-Ausrichtung. Auch der Flur, der als kleines Zimmer genutzt werden kann, ist sehr hell. Er hat eine wunderbare Wand mit Glasbausteinen die Sonnenlicht durch lässt. Das Schlafzimmer geht in den ruhigen Innenhof raus.\r\n\r\nDie Wohnung ist mit charmanten Kassettentüren und hochwertigen Beschlägen ausgestattet. Zudem findet man hier zwei französische Balkone.\r\n\r\nHeizung und Warmwasserbereitung erfolgen über eine Gas-Zentralheizung. Ein Kellerraum gehört mit zur Wohnung. Der Innenhof ist begrünt und wird gepflegt.\r\n\r\nDie Wohnung ist seit April 2016 zuverlässig und unbefristet an den derzeitigen Mieter vermietet. Die Nettokalt-Miete beträgt 630 € zzgl. 150 € Nebenkostenvorauszahlung.\r\n\r\nDas Wohngeld beträgt gem. aktuellem Wirtschaftsplan ca. 229 €. Davon sind ca. 160 € umlagefähig.\r\n\r\nDie Wohnung liegt im Erhaltungsgebiet Kollwitzplatz.', 'Zusammenfassung / Highlights:\r\n- vermietete Kapitalanlage\r\n- 2 Zimmer-Wohnung mit Südost-Ausrichtung\r\n- im ruhigen Seitenflügel gelegen\r\n- bodentiefes Fenster im Wohnzimmer\r\n- offene Wohnküche\r\n- Schlafzimmer mit Fenster zum ruhigen Innenhof\r\n- Tageslichtbad mit Badewanne\r\n- tagesbelichteter Flur mit Glasbausteinen\r\n- ca. 2,16% Rendite\r\n- im Herzen vom Prenzlauer Berg gelegen\r\n- zahlreiche Parks fußläufig zu erreichen\r\n- viele Cafés und Restaurants in unmittelbarer Nähe', 'Die Wohnung befindet sich direkt im Kollwitzkiez nur wenige Gehminuten von der U-Bahnstation Senefelderplatz entfernt. Sie ist umgeben von zahlreichen Parks wie dem Teutoburger Platz, dem Park am Wasserturm und dem Leise-Park. Ebenfalls typisch für den Kiez sind die zahlreichen Bars und hippe Cafés, wie das Spooning Cookie Dough.\r\n\r\nNicht ohne Grund ist der Prenzlauer Berg einer der beliebtesten Stadtteile Berlins.\r\n\r\nVon der Wohnung aus gelangt man mit der Straßenbahn M2 innerhalb von ca. 6 Minuten direkt zum Alexanderplatz. Zur Friedrichstraße benötigt man nur ca. 18 Minuten und kann ebenfalls direkt durchfahren mit der U-Bahn U2.\r\n\r\nGeschäfte des täglichen Bedarfs wie zum Beispiel Netto, Edeka und Rossmann sind nur ca. 550m entfernt. Ärzte und Fitnessstudios liegen nur wenige Gehminuten entfernt.', 'Weitere interessante Immobilienangebote finden Sie auf unserer Homepage www.koeppl-berlin.de\r\n\r\nDieses Angebot basiert auf den Angaben des Eigentümers, ist freibleibend, unverbindlich, Irrtum und Zwischenverkauf vorbehalten.\r\n\r\nImmobilienmakler Dipl. Wi.-Ing. Klaus Koeppl ist Ihr persönlicher Ansprechpartner, wenn Sie eine Immobilie in Berlin und Umgebung verkaufen wollen. Lassen Sie sich kostenfrei und unverbindlich beraten.'];;;229;;2;;2;;true;6;;
2020-05-24 20:55:54.351998;Berlin;central_heating;ONE_YEAR_FREE;15875879;n;y;https://pictures.immobilienscout24.de/listings/64a9f82c-536a-41c0-be4b-cfa0d49f0b6a-1364592961.jpg/ORIG/resize/118x118%3E/extent/118x118/format/jpg/quality/80;15;9.48;40 MBit/s;telekom_layer_magenta_l;über VDSL;1990;REGULAR;;9.48;117580841;gas;y;false;MagentaZuhause L;y;Berlin;y;2;4;2;energy_consumption;5.02;32.15;Berlin;13129;well_kept;normal;D;false;100 MBit/s;no_information;Suderoder Str.;n;https://padlock.link/ioml;https://padlock.link/ml;Suderoder_Str.;roof_storey;13129;1;111.3;n;2,active;true;Deutschland;standard;100 MBit/s;wohnung_kauf;y;web,email,bank,music,dl-ul,game,sd,mltstr,hd,fast-ul-dl;true;002.01004695355;93250;profile0;1;true;n;showqualicontactform;n;n;Blankenburg_Weißensee;SU 15;1;Berlin;/expose/117580841;['Die Eigentumsanlage wurde im Jahr 1990 in Massivbauweise errichtet und umfasst insgesamt 12 Wohnungen und 15 Stellplätze im Außenbereich. Das Gebäude ist wärmeisoliert, voll unterkellert und wird mit Erdgas beheizt. Der Hauszugang ist behindertengerecht. Die Warmwasserversorgung der Einheiten erfolgt zentral.', 'Die Wohnung mit 32,15 m² im 2. OG/DG hat 1 Zimmer, Küche inkl. Einbauküche und Bad mit Fenster sowie Balkon. Die Fußböden bestehen in Bad, Flur und in der Küche aus Fliesen, das Wohnzimmer ist mit Laminat ausgelegt.  Die Fenster sind aus Kunststoff. Zur Wohnung gehört ein Kellerraum und das Sondernutzungsrecht an einem PKW-Stellplatz im Außenbereich.', 'Die Wohnung befindet sich im Ortsteil Blankenburg, einer begehrten Immobilienlage am nördlichen Stadtrand von Berlin. Das Golf Resort Berlin Pankow ist nur wenige Minuten entfernt. Die Bebauung in der näheren Umgebung besteht überwiegend aus Einfamilienhäusern. \n\xa0\nDinge des täglichen Bedarfs wie Kitas, Schulen, Einkaufsmöglichkeiten, Restaurants befinden sich in der unmittelbaren Umgebung. \n\nDie Anbindung an Berlin ist durch mehrere Busverbindungen und die nahe S-Bahnstation Blankenburg gut. Mit dem Auto ist man ebenso in wenigen Minuten über die B 2 oder die B 109 in Berlin.', 'Hausgeld 2020:\t\t218,00 Euro / Monat\ndavon Zuführung Rücklage:\t   55,50 Euro / Monat\ndavon umlagef. Betriebskosten:\t109,36 Euro / Monat\nGesamtmiete:\t\t 463,00 Euro / Monat \nNettokaltmiete:\t\t 293,00 Euro / Monat'];;1;218;;;;2;;;2;;
