2020-05-24 21:15:10.254881;Berlin;gas_heating;ONE_YEAR_FREE;18043117;n;y;https://pictures.immobilienscout24.de/listings/9bff2be5-191b-41d5-a19a-c405ddabbdb6-1369687679.jpg/ORIG/resize/118x118%3E/extent/118x118/format/jpg/quality/80;11;10.2;40 MBit/s;telekom_layer_magenta_l;über VDSL;1902;REGULAR;10.2;114727145;natural_gas_light;n;false;MagentaZuhause L;y;Berlin;n;4;1;167.41;77;6.17;85;Berlin;13055;no_information;no_information;false;100 MBit/s;no_information;Konrad-Wolf-Strasse;n;https://padlock.link/ioml;https://padlock.link/ml;Konrad-Wolf-Strasse;roof_storey;13055;3;n;2015;2,active;true;Deutschland;standard;100 MBit/s;wohnung_kauf;n;4;web,email,bank,music,dl-ul,game,sd,mltstr,hd,fast-ul-dl;true;002.01008718359;170000;profile0;4;3;true;n;showqualicontactform;n;n;Alt_Hohenschönhausen_Hohenschönhausen;4974;4;Berlin;/expose/114727145;"['Wir verkaufen zwei Dachgeschossrohlinge mit Baugenehmigung in der 4. Etage des kleinen Mietshauses\r\nEs besteht aus einem 4-geschossigen Vorderhaus und einer Remise im idyllischen, begrünten Hof. \r\nDie Wohnungseigentümergemeinschaft besteht aus derzeit 8  Etagenwohnungen, 2  Ladengeschäften, einre Gewerbeeinheit im 1. OG. und einer Remise. \r\nDas Haus wurde von seinen Besitzern kontinuierlich liebevoll  saniert und bietet den Mietern ein gepflegtes und angenehmes Umfeld.\r\nDie Hoffassade wurde 2015 umfassend saniert, der Dachboden ist gedämmt. Das Gebäude ist voll unterkellert.', 'Wir verkaufen zwei separate Dachgeschossrohlinge a 85 m2 mit Baugenehmigung.\r\n\r\nBeide Wohnungen wurden mit drei Zimmern geplant, schöner Terrasse, tagesbelichteten Wannenbädern und geräumigen Küchen.\r\n\r\nDie Rohlinge befinden sich in der 4. Etage des Hauses.\r\n\r\n', 'Das gepflegte Wohn- und Geschäftshaus aus der Gründerzeit befindet sich im Lichtenberger Ortsteil Alt-Hohenschönhausen. Eingebettet in die urbane, gewachsene Bebauung und umgeben von den großen Grünflächen der westlich an die Konrad-Wolf-Straße angrenzenden Friedhöfe Sankt Andreas und Sankt Markus und den Anlagen des Sportforums Berlin befindet sich das Mehrfamilienhaus. \r\rHier wohnen Sie zentrumsnah in einem ruhigen und grünen Quartier. Zum Alexanderplatz sowie in die beliebten Stadtviertel Friedrichshain und Prenzlauer Berg gelangt man mit der Straßenbahn in ca. 15-20 Minuten.\rDas Sportforum Hohenschönhausen (Europas größtes Sport- und Trainingszentrum) liegt ca. 300m entfernt und bietet eine Vielzahl von Sport- und Freizeitmöglichkeiten, z.B. ist dort auch ein Sportkindergarten  angesiedelt. In der Sandinostraße befindet sich zudem die Grundschule am Wilhelmsberg sowie die Gutenberg-Oberschule. Die Bewohner von Alt-Hohenschönhausen schätzen die innerstädtische Lage und die guten Verkehrsverbindungen ins Zentrum Berlins mit drei Tramlinien und zwei Buslinien.\r\n\r\nIm Quartier gibt es außerdem zahlreiche Parks und Wasserflächen. Das ca. 1.800 m entfernte Freibad Orankesee ist ein zu- und abflussloses Gewässer und bildet zusammen mit dem Oberseepark den Kern des Hohenschönhausener Villenviertels.\r\r\n\r\nDie Galerie 100 in der Konrad-Wolf-Str. 99 ist weit über den Kiez hinaus bekannt. Als Freizeit-Oasen locken über einen kurzen Spazier- oder Fahrradweg das Strandbad Orankesee und der Obersee mit dem 1913 angelegten Park, wo sich auch das Architekturmuseum ""Mies van der Rohe Haus"" befindet. In Gesundheitsfragen ist das Krankenhaus ""Rudolf Virchow"" schnell erreicht.\r\nWas darüber hinaus die Attraktivität der Lage seit 2013 auch belegt, ist die Fertigstellung einer Reihe neuer Mietshäuser auf dem Areal der alten, denkmalgeschützten Zuckerfabrik.']";energy_required;139.3;;disabled;;;90;
2020-05-24 21:15:10.702459;Berlin;central_heating;ONE_YEAR_FREE;68847;n;n;https://pictures.immobilienscout24.de/listings/abf854e9-9eea-4434-998e-9e43fb0cc827-1368437751.jpg/ORIG/resize/118x118%3E/extent/118x118/format/jpg/quality/80;10;6.58;40 MBit/s;telekom_layer_magenta_l;über VDSL;1994;REGULAR;6.58;114720606;gas;y;false;MagentaZuhause L;y;Berlin;n;4;5;283.52;no_information;4.02;66.95;Berlin;12559;well_kept;normal;false;100 MBit/s;outside;no_information;n;https://padlock.link/ioml;https://padlock.link/ml;no_information;apartment;12559;2;n;;2,active;true;Deutschland;top;100 MBit/s;wohnung_kauf;n;;web,email,bank,music,dl-ul,game,sd,mltstr,hd,fast-ul-dl;true;001.68847;189000;profile0;;2;true;n;showqualicontactform;n;n;Müggelheim_Köpenick;7898;3;Berlin;/expose/114720606;"['Umgeben von Wald, Wasser und frischer Luft befindet sich in einem etwa 1994 erbauten Wohnhaus die 2-Zimmer-Wohnung im 1. Obergeschoss. Praktisch geschnitten fügen sich ein Flur, zwei Zimmer, eine Küche und ein Badezimmer in den Grundriss der ca. 67m² großen Wohnung ein. Über den geräumigen Flur gelangen Sie in alle Räumlichkeiten separat. Das lichtdurchflutete Wohnzimmer, mit Erker, bietet genügen Platz für eine gemütliche Couch und einen Essbereich. Dem Wohnzimmer schließt sich die Küche, welche man ebenfalls über den Flur betreten kann, mit Einbauküche an. Das Tageslichtbadezimmer verfügt über eine Badewanne und einen Waschmaschinenanschluss. \nFür weitere Informationen fordern Sie sich bitte das ausführliche Exposé an!', '- Erker im Wohnzimmer\n- Tageslichtbadezimmer\n- Bodenbelag: Fliesen, Teppich', 'Müggelheim gehört zum Stadtbezirk Treptow/Köpenick. Durch seine wald- und wasserreiche Umgebung ist dieser Ort sehr geschätzt. Das Grundstück befindet sich nur wenige Gehminuten von Wald und Wasser entfernt. Die Dinge des täglichen Bedarfs wie Supermärkte, Tankstelle, Ärzte und Apotheken befinden sich im Ortskern. In Müggelheim gibt es eine Grundschule, mehrere Kitas sowie verschiedene Sportvereine (z.B. Wassersport, Tennis, Hockey, Fußball). Wunderschön gelegene Restaurants in und um Müggelheim laden Sie zum Verweilen und entspannen ein. In Müggelheim verkehrt die Buslinie 169, die Sie in ca. 5 Autominuten erreichen. Mit dem Bus gelangen Sie bequem in die Altstadt Köpenick bzw. zum S-Bahnhof Köpenick, mit dem direkt angrenzenden Einkaufsparadies ""Forum Köpenick"". Müggelheim liegt eingebettet zwischen dem Müggelsee und dem Langen See - ein absolutes Naturparadies. Hier bieten sich viele Möglichkeiten der aktiven Freizeitgestaltung an. Der Kleine und der Große Müggelsee gehören, wie auch die Spree, zu den beliebten Zielen der Wassersportler.', 'Wir suchen zum Eigenankauf sowie für ausgewählte Kunden Einfamilienhäuser, Wohnungen und Grundstücke in Berlin und Umgebung. Wir freuen uns auf Ihre Kontaktaufnahme! \n\nMPW Immobilien - Verkauf / Vermietung / Hausverwaltung\n\nwww.mpw-immobilien.de\n\nHöchste Kundenzufriedenheit in Berlin - www.makler-empfehlung.de']";energy_consumption;93;;disabled;;;;
2020-05-24 21:15:11.410832;Berlin;central_heating;ONE_YEAR_FREE;179106;n;y;https://pictures.immobilienscout24.de/listings/e5f515dd-bfb8-45f2-a363-06acbf9f8266-1337810692.jpg/ORIG/resize/118x118%3E/extent/118x118/format/jpg/quality/80;9;11.35;40 MBit/s;telekom_layer_magenta_l;über VDSL;1900;REGULAR;11.35;114743964;no_information;n;true;MagentaZuhause L;y;Berlin;y;8;1;400;no_information;7.53;117;Berlin;10243;need_of_renovation;no_information;false;100 MBit/s;no_information;no_information;y;https://padlock.link/ioml;https://padlock.link/ml;no_information;apartment;10243;3;n;;2,active;true;Deutschland;standard;100 MBit/s;wohnung_kauf;y;3;web,email,bank,music,dl-ul,game,sd,mltstr,hd,fast-ul-dl;true;001.179106;448000;profile0;5;3;true;n;;n;n;Friedrichshain_Friedrichshain;J12903D1;5;Berlin;/expose/114743964;['Kapitalanlage!\nDie Wohnung ist aktuell an glückliche Mieter vergeben, welche ab Kauf 8 Jahre Sonderkündigungsschutz haben!\nBei den abgebildeten Fotos handelt es sich um eine baugleiche Wohnung im 1.OG und dient nur für einen ersten Eindruck. \nDie hier angebotene Eigentumswohnung befindet sich im 3. OG in einem wunderschönen Berliner Altbau aus der Gründerzeit. 2001 wurde das Objekt modernisiert (u.a. Treppenhäuser, Fassade, Stränge, Gaszentralheizung, Bäder). Die Wohnung verfügt über tolle Altbaudetails und bekommt Anschluss an einen Aufzug außerdem gibt es hier einen Balkon. \nOptional ist ein Balkonanbau im Innenhof möglich, die Baugenehmigung liegt vor. \n\nInvestment!\nThe apartment is currently awarded to happy tenants, who have 8 years of special protection against termination from purchase!\nThe pictured photos are of an identical apartment on the 1st floor and are only used for a first impression. \nThe condominium offered here is on the 3rd floor in a beautiful Berlin old building from the Gründerzeit. 2001 the object was modernized (among other things staircases, front, strands, gas central heating, baths). The apartment has great old building details and gets connection to an elevator in addition there are one balcony here. Optionally a balcony extension is possible in the inner courtyard, the building permit is available. ', 'Altbau, Aufzug, Balkon/Terrasse, Dielen, Etagenwohnung, Gaszentralheizung, Keller, Stuck, vermietet dauerhaft, Renovierungsbedürftig', 'Die Mischung macht´s - Berlin-Friedrichshain: Seine Mischung aus Alteingesessen und Zugezogen, Altbauten und Neubauten, macht den Stadtteil besonders interessant. Beliebte Kieze, wie der Simon-Dach-Kiez sowie der Samariterkiez, mit internationalen Einwohnern sorgen hier für Vielfalt. Es lebt sich urban und doch frei. Kieze und Quartiere haben ihre ganz spezifische Atmosphäre bewahrt. Idyllische und ausgedehnte Grünanlagen wie den Volkspark Friedrichshain, findet man hier ebenso wie Kulturzentren und Gewerbestandorte. Einkaufen kann man in modernen Centern, wie dem zu Fuß erreichbaren Ring-Center oder dem naheliegenden Alexa sowie in Szeneläden oder auf zahlreichen Märkten um den Boxhagener Platz herum. Die Anbindung an das öffentliche Verkehrsnetz ist ebenfalls hervorragend.\nBerlin-Friedrichshain: Its mixture of old-established and moved in, old buildings and new buildings, makes the district particularly interesting. Popular neighbourhoods, such as the Simon-Dach-Kiez and the Samariterkiez, with international residents, ensure diversity here. It lives urban yet free. The neighborhoods and quarters have retained their very specific atmosphere. Idyllic and extensive green spaces such as the Volkspark Friedrichshain can be found here, as can cultural centres and industrial sites. Shopping can be done in modern centres such as the Ring-Center, which is within walking distance, or the nearby Alexa, as well as in trendy shops or at numerous markets around Boxhagener Platz. The connection to the public transport network is also excellent.', 'Sie möchten Ihre Immobilie verkaufen? Wir sind Ihr Partner für einen erfolgreichen Verkauf.\n1. Unsere Experten verfügen über tiefgehende Kenntnis des bestehenden Immobilienmarktes und entwickeln gerne eine individuelle Verkaufsstrategie für Sie. Wir bewerten Ihre Immobilie unverbindlich, kostenfrei und marktgerecht.\n2. Wir sind für Sie da und begleiten Sie von der kostenlosen Beratung bis hin zum Notartermin, immer getreu unserer Philosophie: kompetent, zuverlässig und diskret.\n3. Unser nationales und internationales Netzwerk sowie interne Synergien ermöglichen Ihnen den Zugang zu potenziellen Käufern aus aller Welt und somit einen erfolgreichen Abschluss. \nProfitieren Sie von unserem Know-How, rund 20 Jahren Erfahrung und 6 Büros in den besten Lagen Berlins. Gerne beraten wir Sie kostenlos in unserem Büro, per Telefon oder E-Mail!  \nEnergieausweis vorhanden:\nnein'];;;;;;666;;
2020-05-24 21:15:11.862297;Berlin;district_heating;ONE_YEAR_FREE;179106;n;n;https://pictures.immobilienscout24.de/listings/cc980b3f-9d4c-42a2-a318-2b44155b4d27-1337774072.jpg/ORIG/resize/118x118%3E/extent/118x118/format/jpg/quality/80;9;10.66;40 MBit/s;telekom_layer_magenta_l;über VDSL;1987;REGULAR;10.66;114741611;district_heating;n;true;MagentaZuhause L;n;Berlin;y;10;4;357.36;no_information;5.91;105;Berlin;10119;refurbished;no_information;false;100 MBit/s;no_information;no_information;n;https://padlock.link/ioml;https://padlock.link/ml;no_information;no_information;10119;4;n;;2,active;true;Deutschland;standard;100 MBit/s;wohnung_kauf;n;4;web,email,bank,music,dl-ul,game,sd,mltstr,hd,fast-ul-dl;true;001.179106;795000;profile0;5;4;true;n;;n;n;Mitte_Mitte;J12894D1;5;Berlin;/expose/114741611;"[""Diese praktische Vier-Zimmer-Wohnung ist perfekt für eine Familie: Großes Wohnzimmer, 3 Schlafzimmer, Küche, Bad. \nDie Basis stimmt: Elektrik, Fenster, Heizung, sowie alle Stränge und Leitungen sind bereits saniert – die Wohnung befindet sich in einem gepflegten Zustand. Derzeit verfügen Sie neben den 4 Zimmern über eine recht kleine Küche und ein sehr kleines Bad. Dies lässt sich aber durchaus ändern, so dass Sie ein sehr großzügiges Bad erhalten und die Küche als moderne offene Lösung in das (dann auch größere) Wohnzimmer integrieren. \nEine einmalige Chance, viel Platz in Berlin beliebtester Lage zu ergattern!\n\nThis practical four-room apartment is perfect for a family: large living room, 3 bedrooms, kitchen, bathroom. \nThe basis is right: Electricity, windows, heating, as well as all strands and lines are already reorganized - the apartment is in a maintained condition. At the moment you have a quite small kitchen and a very small bath beside the 4 rooms. But this can be changed, so that you get a very generous bathroom and integrate the kitchen as a modern open solution in the (then larger) living room. \nA unique chance to get your hands on a lot of space in Berlin's most popular location!"", 'Bezug nach Vereinbarung, Fernwärme, Keller, Leerstand, unvermietet, Selbstnutzung, Saniert', 'Diese Wohnlage gehört zu den beliebtesten der Stadt. Die Kombination aus grüner Idylle, extravaganten Einzelgeschäften sowie einem umfangreichen Angebot an Gastronomie macht diese Lage im Herzen von Berlin-Mitte so attraktiv. \nDie Einkaufsmöglichkeiten lassen keine Wünsche offen, alle Waren des täglichen Bedarfs können in fußläufiger Nähe eingekauft werden. Zum Shoppen und Flanieren laden der nahegelegene Hackesche Markt oder der Alexander Platz ein. Natürlich sind auch die anderen Zentren der Stadt, wie der Potsdamer Platz oder der Gendarmenmarkt, schnell und unproblematisch erreichbar. Die Verkehrsanbindungen sind hervorragend. In fußläufiger Nähe fahren diverse Buslinien, die Tram sowie die U-Bahn.\n\nThis residential area is one of the most popular in the city. The combination of a green idyll, extravagant individual shops and an extensive range of gastronomy makes this location in the heart of Berlin-Mitte so attractive. \nThe shopping possibilities leave nothing to be desired, all daily necessities can be bought within walking distance. The nearby Hackescher Markt or Alexander Platz invite you to shop and stroll. Of course, the other city centres, such as Potsdamer Platz or Gendarmenmarkt, can also be reached quick and easy. The transport connections are excellent. Various bus lines, the tram and the subway are within walking distance.\n', 'Sie möchten Ihre Immobilie verkaufen? Wir sind Ihr Partner für einen erfolgreichen Verkauf.\n1. Unsere Experten verfügen über tiefgehende Kenntnis des bestehenden Immobilienmarktes und entwickeln gerne eine individuelle Verkaufsstrategie für Sie. Wir bewerten Ihre Immobilie unverbindlich, kostenfrei und marktgerecht.\n2. Wir sind für Sie da und begleiten Sie von der kostenlosen Beratung bis hin zum Notartermin, immer getreu unserer Philosophie: kompetent, zuverlässig und diskret.\n3. Unser nationales und internationales Netzwerk sowie interne Synergien ermöglichen Ihnen den Zugang zu potenziellen Käufern aus aller Welt und somit einen erfolgreichen Abschluss. \nProfitieren Sie von unserem Know-How, rund 20 Jahren Erfahrung und 6 Büros in den besten Lagen Berlins. Gerne beraten wir Sie kostenlos in unserem Büro, per Telefon oder E-Mail!  \nEnergieausweis vorhanden:\nja']";energy_required;77;;;;666;;
2020-05-24 21:15:12.454810;Berlin;oil_heating;ONE_YEAR_FREE;179106;n;n;https://pictures.immobilienscout24.de/listings/3cd3bae5-2da8-4f9c-9629-86b11e66addd-1337761071.jpg/ORIG/resize/118x118%3E/extent/118x118/format/jpg/quality/80;8;12.1;40 MBit/s;telekom_layer_magenta_l;über VDSL;1900;REGULAR;12.1;114740844;no_information;n;true;MagentaZuhause L;y;Berlin;n;7;1;;no_information;7.07;140;Berlin;12159;need_of_renovation;no_information;false;100 MBit/s;no_information;no_information;y;https://padlock.link/ioml;https://padlock.link/ml;no_information;roof_storey;12159;4;n;;2,active;true;Deutschland;standard;100 MBit/s;wohnung_kauf;n;5;web,email,bank,music,dl-ul,game,sd,mltstr,hd,fast-ul-dl;true;001.179106;389000;profile0;5;4;true;n;;n;n;Schöneberg_Schöneberg;M281D1;6;Berlin;/expose/114740844;['Es handelt sich um einen seltenen Dachgeschossrohling im Gartenhaus eines um die Jahrhundertwende gebauten Altbaus. Der Rohling muss komplett saniert und ausgebaut werden. Aktuell liegt eine Baugenehmigung NUR FÜR EINEN AUSBAU sowie innerhalb der WEG für einen Anbau eines Lifts vor. Alles weitere gilt vor Ort zu prüfen.\n\nIt is a rare blank attic floor in the garden house of an old building built around the turn of the century. The blank must be completely renovated and removed. At the moment there is a building permit ONLY FOR EXPANSION as well as within the WAY for an extension of a lift. Everything else must be checked on site.', 'Altbau, Dachgeschoss, Dachterrasse, Sanierungsbedürftig, Aufzug', 'Seit der Gründung vor mehr als 135 Jahren als Villenkolonie Friedenau ist dieser Ortsteil Schönebergs bis heute ein Ort für Künstler geblieben. Frisches Grün, Straßen und Plätze, die zum Flanieren einladen. Diese Wohnlage im Herzen Friedenaus gehört zu den beliebtesten der Stadt. Die Einkaufsmöglichkeiten und das umfangreiche Angebot an Gastronomie lassen keine Wünsche offen, alle Waren des täglichen Bedarfs können in fußläufiger Nähe eingekauft werden. Die Einkaufssituation ist als sehr gut zu bezeichnen. Mit der Steglitzer Schloßstraße befindet sich eine der beliebtesten Einkaufsmeilen des Berliner Südwestens in unmittelbarer Nähe. Die Verkehrsanbindungen sind hervorragend. \nSince it was founded more than 135 years ago as the Friedenau villa colony, this district of Schöneberg has remained a place for artists to this day. Fresh greenery, streets and squares invite you to stroll. This residential area in the heart of Friedenau is one of the most popular in the city. The shopping possibilities and the extensive offer of gastronomy leave nothing to be desired, all goods of daily use can be bought within walking distance. The shopping situation can be described as very good. The Steglitzer Schloßstraße is one of the most popular shopping streets in the southwest of Berlin. The transport connections are excellent. \n\n', 'Sie möchten Ihre Immobilie verkaufen? Wir sind Ihr Partner für einen erfolgreichen Verkauf.\n1. Unsere Experten verfügen über tiefgehende Kenntnis des bestehenden Immobilienmarktes und entwickeln gerne eine individuelle Verkaufsstrategie für Sie. Wir bewerten Ihre Immobilie unverbindlich, kostenfrei und marktgerecht.\n2. Wir sind für Sie da und begleiten Sie von der kostenlosen Beratung bis hin zum Notartermin, immer getreu unserer Philosophie: kompetent, zuverlässig und diskret.\n3. Unser nationales und internationales Netzwerk sowie interne Synergien ermöglichen Ihnen den Zugang zu potenziellen Käufern aus aller Welt und somit einen erfolgreichen Abschluss. \nProfitieren Sie von unserem Know-How, rund 20 Jahren Erfahrung und 6 Büros in den besten Lagen Berlins. Gerne beraten wir Sie kostenlos in unserem Büro, per Telefon oder E-Mail!  \nEnergieausweis vorhanden:\nauf Anfrage'];;;;;;668;;
2020-05-24 21:15:12.952203;Berlin;district_heating;ONE_YEAR_FREE;164338;n;y;https://pictures.immobilienscout24.de/listings/ed582c1c-17fd-42b0-a2d6-55fbd1314200-1337166354.jpg/ORIG/resize/118x118%3E/extent/118x118/format/jpg/quality/80;4;11.3;40 MBit/s;telekom_layer_magenta_l;über VDSL;2004;REGULAR;11.3;114699938;district_heating;y;false;MagentaZuhause L;y;Berlin;y;11;6;;no_information;5.73;129;Berlin;10629;mint_condition;sophisticated;false;100 MBit/s;no_information;no_information;y;https://padlock.link/ioml;https://padlock.link/ml;no_information;apartment;10629;4;n;;2,active;true;Deutschland;top;100 MBit/s;wohnung_kauf;n;2;web,email,bank,music,dl-ul,game,sd,mltstr,hd,fast-ul-dl;true;001.164338;1230000;profile0;9;4;true;n;showqualicontactform;n;n;Charlottenburg_Charlottenburg;AIB12724;6;Berlin;/expose/114699938;"['Es handelt sich um eine exklusive 4-Zimmer Architekten-Wohnung mit ca. 129 qm repräsentativer und stilvoller Wohnfläche, gelegen im 2. Obergeschoss eines modernen Neubaus aus dem Jahre 2004.\r\rDie Wohnung verfügt über ein erstklassiges und stilvolles Wohnzimmer, einen exklusiven Speisebereich mit Zugang zum Sonnenbalkon, eine Küche mit exklusiver Bulthaup-Einbauküche, ein erstklassiges Kinderzimmer, ein Schlafzimmer mit exklusivem Bad en Suite sowie ein modernes Duschbad\r\rZu den besonderen Ausstattungsmerkmalen gehören: hochwertige Echtholzparkettböden, eine exklusive Bulthaup-Einbauküche, bodentiefe Fenster, modernes Lichtdesign, eine Fußbodenheizung sowie ein Sonnenbalkon. \r\rDie gesamte Wohnung befindet sich in einem modernen Gesamtzustand.  \r\rDie Heizungs- und Warmwasserversorgung erfolgt mittels Fernwärme.\rDer Energieverbrauchskennwert beträgt 72 kWh/(qm a).\r\rDas aktuelle Hausgeld beträgt monatlich nur ca. 325,-€\r\rDas Haus verfügt über einen Aufzug sowie über einen repräsentativen und barrierefreien Eingangsbereich.\rEin Stellplatz kann für 50.000,-€ erworben werden.\r\rWeitere Details teilen wir Ihnen auf Anfrage gern mit.', 'Eine bevorzugte City Wohnlage in Berlin-Charlottenburg.', 'Unser Service für Eigentümer\rWir stehen Ihnen bei dem Verkauf Ihrer Immobilie vom Anfang bis zum fertigen Abschluss diskret und kompetent zur Verfügung. \rJeder Schritt erfolgt nach Absprache mit Ihnen. \rSie entscheiden über die Verkaufsstrategie Ihres Objektes, ob diskret und ""off-market"" oder eine qualifizierte Vermarktung in Print- sowie Onlinemedien. \rWir verfügen immer über den richtigen Käufer. \rZudem bewerten wir Ihre Immobilie kostenfrei, entsprechend dem aktuellen Marktwert.\rGerne beraten wir Sie kostenlos persönlich in unserem Büro, per Telefon oder per E-Mail!\rWir freuen uns von Ihnen zu hören!\rwww.immo-boerse.com']";energy_consumption;72;;;;;;
2020-05-24 21:15:13.291878;Berlin;;;17211648;n;n;https://pictures.immobilienscout24.de/listings/459c3993-7239-42f7-a428-3c6c7136ff12-1337778567.jpg/ORIG/resize/118x118%3E/extent/118x118/format/jpg/quality/80;14;9.97;;;;;;9.97;114741907;no_information;n;false;;y;Berlin;y;8;;;no_information;5.62;61.66;Berlin;14199;first_time_use;no_information;false;;no_information;no_information;n;;;no_information;ground_floor;14199;2;n;;2,active;;Deutschland;standard;;wohnung_kauf;n;1;;false;009.f2ea51f8-7e85-4480-8fa0-d22e381ceadc;403000;profile0;4;2;true;n;showqualicontactform;n;n;Schmargendorf_Wilmersdorf;W20190312;3;Berlin;/expose/114741907;"['Diese sehr schöne 2-Zimmer Wohnung bietet Komfort und Gemütlichkeit. Das großzügige Wohnung verfügt über helle geräumige Zimmer mit guter Aufteilung und wohnlicher Atmosphäre.Die Wohnung verfügt über einen großzügigen Empfang , ein großes lichtdurchflutetes Wohnzimmer mit Zugang zur Sonnenterrasse, Küche, ein großes Schlafzimmer und Bad.', 'Erdgeschoss2-Zimmer-Wohnung Erstbezugenergieeffiziente Heizung attraktive Raumaufteilunggroßzügiger Wohn-/Ess-/KochbereichTerrasseKelleranteil gepflegtes Treppenhausruhige & grüne Stadtrandlagegute Einkaufsmöglichkeiten', 'Mit Bus und Bahn erreicht man den Stadtteil am einfachsten über die U-Bahn-Linie U3. Diese verkehrt von dem im Südwesten Berlins gelegenen See ""Krumme Lanke"" bis zum Nollendorfplatz in Schöneberg. In Schmargendorf liegt der Bahnhof Heidelberger Platz auf der Route der U3. Hier, 2 Kilometer außerhalb des Ortskerns, machen auch die Linien S-Bahn-Linien S41, S42 und S46 Station. Außerdem stehen den Schmargendorfern bis zu sechs Buslinien zur Verfügung.']";;;;;;;;
