timestamp;obj_regio1;obj_heatingType;obj_telekomTvOffer;obj_cId;obj_newlyConst;obj_balcony;obj_picture;obj_picturecount;obj_pricetrend;obj_telekomUploadSpeed;obj_telekomTrackingGroup;obj_telekomInternetTechnology;obj_yearConstructed;obj_telekomInternetType;obj_galleryAd;obj_pricetrendbuy;obj_scoutId;obj_firingTypes;obj_hasKitchen;obj_ExclusiveExpose;obj_telekomInternetProductName;obj_courtage;geo_bln;obj_cellar;obj_purchasePriceRange;obj_yearConstructedRange;obj_houseNumber;obj_energyType;obj_pricetrendrent;obj_livingSpace;geo_krs;obj_zipCode;obj_condition;obj_interiorQual;ga_cd_cxp_historicallisting;obj_telekomDownloadSpeed;obj_parkingSpace;obj_street;obj_lift;obj_telekomInternetUrlMobile;obj_telekomInternetUrl;obj_streetPlain;obj_typeOfFlat;geo_plz;obj_noRooms;obj_thermalChar;obj_assistedLiving;obj_ityp;obj_telekomHdTelephone;geo_land;ga_cd_via;obj_telekomInternet;obj_immotype;obj_rented;obj_floor;obj_telekomInternetServices;obj_telekomInternetProductAvailable;obj_cwId;obj_purchasePrice;ga_cd_application_requirements;obj_numberOfFloors;obj_noRoomsRange;ga_cd_maillead_default_shown;obj_garden;evt_count_pm_sig;obj_barrierFree;obj_international;obj_regio3;obj_objectnumber;obj_livingSpaceRange;obj_regio2;URL;beschreibung;obj_usableArea;obj_noParkSpaces;obj_lastRefurbish;obj_rentSubsidy;obj_energyEfficiencyClass;obj_groupnumber;ga_cd_via_qualified;obj_project_id;obj_nbp;ga_cd_developer_virtualreality
2020-05-24 21:14:58.929727;Berlin;self_contained_central_heating;ONE_YEAR_FREE;5418748;n;y;https://pictures.immobilienscout24.de/listings/c6402820-9afa-4bb9-862b-715f97bbb898-1360891861.jpg/ORIG/resize/118x118%3E/extent/118x118/format/jpg/quality/80;14;11.35;40 MBit/s;telekom_layer_magenta_l;über VDSL;1900;REGULAR;disabled;11.35;114762879;gas;y;false;MagentaZuhause L;y;Berlin;y;11;1;no_information;energy_required;7.54;287;Berlin;10245;first_time_use;luxury;false;100 MBit/s;no_information;no_information;y;https://padlock.link/ioml;https://padlock.link/ml;no_information;roof_storey;10245;5;136;n;2,active;true;Deutschland;top;100 MBit/s;wohnung_kauf;n;5;web,email,bank,music,dl-ul,game,sd,mltstr,hd,fast-ul-dl;true;001.5418748;2100000;profile0;5;5;true;n;showqualicontactform;n;n;Friedrichshain_Friedrichshain;WE59_IS;7;Berlin;/expose/114762879;['In einem klassischen Berliner Altbaujuwel der Jahrhundertwende baut der in Südafrika und Berlin lebende Architekt Swen Burgheim vier einzigartige Dachgeschosswohnungen aus, welche in Ihrer Gesamtheit wohl kein zweites Mal in Berlin zu finden sein werden.\r\n\r\nDas exklusive Penthouse, direkt über einen Fahrstuhl erreichbar, besticht durch modernen Komfort und historische Bauelemente. Großflächige Betonfliesen, original überarbeitete Flügeltüren sowie schwere und qualitätsvolle Holzböden schaffen zusätzlich zur modernen klaren Linie ein gemütliches Ambiente.\r\n\r\nDie weitläufige Raumaufteilung und die hohen Fenster ebenso wie die komplett verglaste Terrasse bilden eine loftartige Wohnatmosphäre. Das durchdachte Raumkonzept bietet trotz der offenen Wohnbereiche private Rückzugsmöglichkeiten. Beeindruckende Sichtachsen, fantastische Deckenhöhe von ca. 3,50 m sowie der optimale Schnitt der Räume zeigen den kosmopolitanen Baustil des Architekten.\r\n\r\nEine exklusive und vor allem einzigartige Einbauküche, die sich direkt an der Längsseite der Terrasse entlang zieht, besticht durch die riesigen Schiebefenster und schafft ein besonderes Kocherlebnis nahezu im Freien. Absolutes Highlight ist sicherlich die ca. 60 m² große Aufdachterrasse, von der aus Sie einen fulminanten und gigantischen Ausblick über Berlin genießen.\r\n\r\nLassen Sie sich bei einer gemeinsamen Besichtigung von diesem einzigartigen Wohnerlebnissen begeistern.', 'Friedrichshain ist in den letzten Jahren zum Trendbezirk in Berlin avanciert und prägt mit den angrenzenden Stadtteilen Mitte, Kreuzberg und Prenzlauer Berg die beliebte Ost-City Berlins.\r\n\r\nIn den letzten Jahren siedelten sich dort im großen Stil Zukunftsbranchen wie Entertainment oder die Medien- und Informationsindustrie an. Erfolgreiche Medienmenschen und Kreative finden hier ein spannendes Umfeld: Restaurants und Stadtstrände, Clubs und Shops und kulturelle Einrichtungen geben dem Quartier ein markantes Profil und machen dieses besonders für internationales Publikum attraktiv.\r\n\r\nDurch die Vielzahl an staatlichen, privaten und internationalen Schulen ist der Bezirk ebenso für Familien interessant. Gute Einkaufsmöglichkeiten bieten kleine inhabergeführte Läden und große Einkaufszentren um den Ostbahnhof. \r\n\r\nDie Wohnung befindet sich nur wenige Gehminuten vom Rummelsburger See und der Spree entfernt. Sie liegt in der Nähe von Alt Stralau, dem Treptower Park und dem Plänterwald, die beide viele Grünflächen bieten. \r\n\r\nDer Ortsteil verfügt insgesamt über ein breites und abwechslungsreiches gastronomisches Angebot in verschiedenen Preislagen, zahlreiche Cafés und Restaurants laden zum Verweilen ein. Eine optimale Anbindung an das öffentliche Verkehrssystem ist durch eine Vielzahl von U-/S-Bahnhöfen, das Busnetz und die Straßenbahn gegeben.', 'Das Team von Black Label Immobilien bietet Ihnen Unterstützung in allen Bereichen rund um den Kauf einer Immobilie. Unser internationales Team spricht fließend Englisch, Deutsch, Französisch und Mandarin, zudem arbeiten wir mit einem Team aus mehrsprachigen Anwälten, Notaren und Finanzierungsberatern zusammen.\r\nUm Ihren persönlichen Ansprüchen gerecht werden zu können, bieten wir Ihnen eine große Auswahl an verschiedenen Immobilien. Senden Sie uns einfach ihre Suchkriterien inklusive:\r\n\r\n- Art der gesuchten Immobilie\r\n- Ihr Budget\r\n- Bevorzugter Standort\r\n- Suchen Sie eine Immobilie als Investment oder zum Eigenbedarf?\r\n\r\nFür Unterstützung bei der Finanzierung Ihrer Immobilie vermitteln wir Ihnen gern einen Finanzierungspartner.\r\n\r\nSind Sie an einer Vermietung Ihrer neuen Immobilie interessiert? Hierfür bietet Black Label ein Verwaltungs-Paket sowohl für unmöblierte als auch möblierte Vermietungen, sowie einen kompletten Design- und Möblierungsservice, angepasst an ihre persönlichen Vorstellungen. Kontaktieren Sie uns, oder besuchen Sie uns in unserem Büro, um mehr Informationen zu erhalten.\r\n'];;;;;;;;;;
2020-05-24 21:14:59.331434;Berlin;no_information;ONE_YEAR_FREE;16609799;n;y;https://pictures.immobilienscout24.de/listings/899fea03-79f9-4e90-93b3-1bfa2bb02c37-1235509471.jpg/ORIG/resize/118x118%3E/extent/118x118/format/jpg/quality/80;33;11.86;40 MBit/s;telekom_layer_magenta_l;über VDSL;1990;REGULAR;;11.86;75871276;;n;false;MagentaZuhause L;n;Berlin;n;10;4;19;;7.23;130;Berlin;14050;modernized;sophisticated;false;100 MBit/s;underground_garage;Ulmenallee;n;https://padlock.link/ioml;https://padlock.link/ml;Ulmenallee;maisonette;14050;4;;n;2,active;true;Deutschland;standard;100 MBit/s;wohnung_kauf;n;;web,email,bank,music,dl-ul,game,sd,mltstr,hd,fast-ul-dl;true;001.16191648;850000;profile0;;4;true;y;;y;n;Charlottenburg_Charlottenburg;75871276;6;Berlin;/expose/75871276;['Privilegierte Traum-Lage im Herzen vom Westend am Branitzerplatz. 130 m2 Haus im Haus über drei Etagen mit eigenem Hauseingang und direktem Zugang zur Tiefgarage. Sehr stilvolle Architektur. Wohnbereich, Balkon, Küche, WC und Schlafraum in der 1. Etage. Weiterer Raum, Gäste-WC und Zugang zum Privatgarten (100 m2) im EG. Weiterer Wohnraum, Waschküche und Abstellraum im UG. Parkett- und Granitboden. Neu renoviert. In der Nähe exzellenter Schulen. Gemeinschaftsgarten.', 'Haus im Haus mit drei abgeschlossenen Räumen und einer weitläufigen Wohnlandschaft auf zwei Ebenen.\r\nSeparate Küche, Waschküche mit eigenem Waschbecken, Bad mit Wanne, Gästebad mit Dusche, Abstellraum.\r\nGroße Südterrasse, 100 m2 eigener Garten, Kaminanschluss.\r\nTiefgarage mit eigenem Stellplatz.', 'Beste Lage im Westend am Branitzerplatz. Zentral und gute Verkehrsanbindungen.'];130;1;2014;;;;;;;
2020-05-24 21:14:59.710491;Berlin;central_heating;ONE_YEAR_FREE;17228770;n;n;https://pictures.immobilienscout24.de/listings/14a18c7e-024e-4840-9738-450164f773aa-1358877504.jpg/ORIG/resize/118x118%3E/extent/118x118/format/jpg/quality/80;5;11.35;40 MBit/s;telekom_layer_magenta_l;über VDSL;1908;REGULAR;disabled;11.35;114794358;gas;n;false;MagentaZuhause L;y;Berlin;n;9;1;no_information;energy_consumption;7.53;120.01;Berlin;10249;need_of_renovation;no_information;false;100 MBit/s;no_information;no_information;n;https://padlock.link/ioml;https://padlock.link/ml;no_information;ground_floor;10249;4;128.2;n;2,active;true;Deutschland;top;100 MBit/s;wohnung_kauf;n;;web,email,bank,music,dl-ul,game,sd,mltstr,hd,fast-ul-dl;true;002.01007994385;550000;profile0;5;4;true;n;;n;n;Friedrichshain_Friedrichshain;#01011;5;Berlin;/expose/114794358;['Die Wohnung ist derzeit an eine Studenten-WG vermietet. Der Mietvertrag ist vom 01.08.2016. Die Teilungserklärung ist aus dem Jahre 1997.\n\nDie Wohnung kann auch vom Verkäufer nach Ihren Vorstellungen für 50.000,-€ saniert werden, nachdem die Mieter ausgezogen sind.', 'Die Ausstattung Ihrer Wohnung lässt nahezu keinen Wunsch offen und weist u.a. folgende Ausstattungsmerkmale auf:\n\n+ unrenoviert (kann auch saniert übergeben werden)\n+ ca. 4m hohe Decken\n+ Doppelkasten-Holz-Fenster\n+ sehr hohe Fenster\n+ Jalousien an allen Fenstern\n+ viele Altbau-Details (verzierte Holztüren z.T. mit Verglasung)\n+ 4 separate Zimmer\n+ Holzfußböden\n+ Badezimmer mit Fenster\n+ Keller', 'Alle Angaben stammen vom Verkäufer. Wir übernehmen hierfür keine Haftung.\n\nIhren Besichtigungstermin können Sie selbstverständlich individuell nach Ihren Wünschen mit uns vereinbaren. Zur Beantwortung Ihrer Fragen können Sie uns jederzeit kontaktieren.\n\nSie möchten Ihre Immobilie verkaufen?\n\nWir stehen Ihnen gerne bei allen Fragen und Anliegen beratend beiseite und treten dafür ein, dass vor allem\nSie profitieren. Nutzen Sie die positive Marktlage und unser geschultes Team, um den Höchstpreis zu erzielen. Gerne unterstützen wir Sie bei all Ihren Fragen und Anliegen rund um Ihre Immobilie. Ganz individuell gehen wir auf Ihre persönlichen Bedürfnisse ein, um Ihnen eine ehrliche und kompetente Beratung zu gewährleisten, denn Ihre Zufriedenheit ist unser Ziel.\n\nIhr IMMODO-Team'];;;;370;;;;;;
2020-05-24 21:15:00.221630;Berlin;;ONE_YEAR_FREE;16677860;n;y;https://pictures.immobilienscout24.de/listings/d7616967-2c36-41d0-8756-f6157954209b-1338089794.jpg/ORIG/resize/118x118%3E/extent/118x118/format/jpg/quality/80;6;12.7;40 MBit/s;telekom_layer_magenta_l;über VDSL;1958;REGULAR;;12.7;114762345;district_heating;y;false;MagentaZuhause L;y;Berlin;y;7;2;7;energy_consumption;7.58;58;Berlin;10557;well_kept;normal;false;100 MBit/s;no_information;"Paulstra&szlig;e";y;https://padlock.link/ioml;https://padlock.link/ml;Paulstraße;apartment;10557;2;96.76;n;2,active;true;Deutschland;top;100 MBit/s;wohnung_kauf;y;1;web,email,bank,music,dl-ul,game,sd,mltstr,hd,fast-ul-dl;true;009.b91b88e3-9ba2-49d7-bfd5-e0e1ba0ca04e;325000;profile0;7;2;true;n;showqualicontactform;n;n;Tiergarten_Tiergarten;B10030/WE84;2;Berlin;/expose/114762345;['Es handelt sich hierbei um eine vermietete, ca. 58m² große Zweizimmerwohnung im 1. OG des Vorderhauses. Sie ist Teil eines Wohnhauses und überzeugt mit einem praktischen Schnitt.\nBereits beim Betreten der Wohnung lässt sich feststellen, dass es sich hierbei um eine geräumige und helle Wohnung handelt, die mit Ihrem Charme überzeugt. \nIn den letzten Jahren hat die Eigentümergemeinschaft umfangreiche wohnwertverbessernde Maßnahmen ausgeführt.\nDas Dach wurde 2012 komplett saniert und zusätzlich auf den neuesten Stand der Wärmedämmung gebracht. Desweitern wurden in den letzten Jahren weitere umfangreiche Sanierungsmaßnahmen abgeschlossen (Treppenaufgänge mit moderner Rauchmeldeanlage, Heizungsübergabestation der Fernwärme, Warmwasserbereitung mir Druckerhöhungsanlage, Wassersteigstränge, Balkone, Müllhaus).\n\nDas Mietverhältnis besteht seit dem 15.11.2005. Die Teilung des Hauses wurde bereits 1989 durchgeführt. Da das Mietverhältnis nach der Teilungserklärung geschlossen wurde, liegt hier eine Kündigungsfrist für Eigenbedarf von 9 Monaten vor (Angaben ohne Gewähr).\n', 'Hier tobt das Leben – hier ist Berlin.\n\nDie Paulstraße direkt in Berlin-Moabit liegt im Herzen Berlins und stellt eine der belebtesten Gegenden der Hauptstadt dar.\n\nDas Haus befindet sich unweit der Turmstraße, welche jegliche Bedürfnisse des alltäglichen Lebens befriedigt und auch das Spree-Ufer lädt 100 Meter entfernt zu gemütlichen Spaziergängen ein.\n\nDas Kiezleben hat etliche Restaurants, Cafés und Szenekneipen zu bieten, die alle fußläufig zu erreichen sind.\n\nDie optimale Anbindung der Öffentlichen Verkehrsmittel ist durch einen nicht weit entfernten U-Bahnhof (U-Bhf Turmstraße) sichergestellt. Zudem ergänzen regelmäßig fahrende Busse den Bahnverkehr.\n\nSowohl der Flughafen Tegel, als auch der Berliner Hauptbahnhof, sind schnell und einfach zu erreichen.\n\nUm das Berliner Kiezleben zu vollenden - das Gebiet zählt aufgrund seiner facettenreichen Freizeitmöglichkeiten, zu den attraktivsten Wohnzielen für Jung und Alt.\n'];;;;193;C;1;;;;
2020-05-24 21:15:00.666237;Berlin;central_heating;ONE_YEAR_FREE;185949;n;y;https://pictures.immobilienscout24.de/listings/97c52c1f-639d-4b43-bd59-bea8204fe72f-1369389605.jpg/ORIG/resize/118x118%3E/extent/118x118/format/jpg/quality/80;15;17.43;10 MBit/s;telekom_layer_magenta_m;über VDSL;1900;REGULAR;disabled;;99939692;no_information;n;true;MagentaZuhause M;n;Berlin;y;7;1;30;energy_consumption;;73.97;Berlin;10247;refurbished;no_information;false;50 MBit/s;no_information;"Weserstra&szlig;e";n;https://padlock.link/iomm;https://padlock.link/mm;Weserstraße;apartment;10247;2;132;n;2,active;true;Deutschland;premium;50 MBit/s;wohnung_kauf;y;2;web,email,bank,music,dl-ul,game,sd,mltstr,hd,fast-ul-dl;true;001.185949;369900;profile0;5;2;true;n;showqualicontactform;n;n;Friedrichshain_Friedrichshain;16714067;3;Berlin;/expose/99939692;['Das Mehrfamilienhaus in der Weserstraße ist ein klassischer Berliner Altbau aus dem Jahr 1900. Die Fassade ist mit einem frischen und dezenten Farbanstrich versehen.\r\n\r\nDas Wohnhaus in bester Kiez-Lage bietet sechs sanierte 2- bis 4-Zimmer-Wohnungen mit ca. 51 bis 111 Quadratmetern. Hohe Decken und großzügige Grundrisse schaffen eine helle und offene Wohnatmosphäre. Alle Wohnungen sind zudem mit Balkonen bzw. einer Terrasse ausgestattet oder verfügen über einen Erker, wo man an sonnigen Tagen entspannte Stunden genießen kann. Alle Böden bestehen aus klassischen Dielen, die aufgearbeitet oder zum Teil auch komplett erneuert worden sind. Die meisten Küchen sind neu gefliest. Die Bäder haben größtenteils Fenster und verfügen über Badewannen. Ihren besonderen Charakter erhalten die Wohnungen durch den original erhaltenen Stuck, die überarbeiteten Türen und die eleganten Schiebetüren. Im Dachgeschoss befinden sich drei ausgebaute Wohnungen.\r\n\r\nBesuchen Sie unsere Objektseite WWW.EIGENTUMSWOHNUNG-FRIEDRICHSHAIN.DE und erfahren weitere Details, sehen Sie Bilder und Videos zum Objekt!\r\n\r\nHier gelangen Sie zu unserem Standortvideo https://youtu.be/03VTsoU0fj4 Zum Öffnen, kopieren Sie bitte den Link in Ihren Browser.\r\n\r\nFinden Sie Ihre Eigentumswohnung bequem mit der Accentro APP, aus einer großen Auswahl an vielen Berliner Standorten! Jetzt im App Store.', 'Die Weserstraße mit ihren klassischen Berliner Altbauten liegt im östlichen Teil Friedrichshains in einem ruhigen Wohnviertel. Baumgesäumte Straßen mit weiten Fußwegen prägen das Bild dieser Gegend. Abseitig der nahe gelegenen Frankfurter Allee findet man hier Ruhe umgeben von überwiegend gut sanierten Bestandsgebäuden.\r\n\r\nDer über Friedrichshain hinaus bekannte Boxhagener Platz, im Volksmund auch Boxi genannt, ist nur einige Meter von der Weserstraße entfernt und steht als Gartendenkmal unter Schutz. Hier trifft man sich zum Verweilen, mit Kindern auf dem Spielplatz oder genießt den Samstag auf dem Wochenmarkt.  Neben weiteren Parks und Grünflächen sind es vor allem auch die Spree und die südöstlich gelegene Rummelsburger Bucht, die zu entspannten Spaziergängen und Ausflügen einladen.\r\n\r\nDas Areal um die Weserstraße bietet die Vorzüge eines optimal erreichbaren Nahverkehrsnetzes. Fußläufig sind sowohl S- als auch U-Bahnanschlüsse erreichbar, die einen in jede Richtung der Stadt bringen. Von den Knotenpunkten Frankfurter Tor oder Warschauer Straße gelangt man in kurzer Zeit ebenso zum Fernbahnhof Ostbahnhof oder dem Flughafen Schönefeld.\r\n\r\nDie Lebensqualität rund um die Weserstraße wird darüber hinaus erhöht durch die fußläufig erreichbare Geschäftsstraße Frankfurter Allee mit kleinen Läden und großen Einkaufszentren. Sie mündet in die bekannte Karl-Marx-Allee, die die direkte Verbindung nach Berlin Mitte bildet.\r\n\r\nWer das pulsierende Treiben der Großstadt vorzieht, ist hier auch am richtigen Ort. Neben vielen ruhigen Winkeln finden sich Kieze mit Cafés und Restaurants für nahezu jeden Geschmack als auch Galerien und Kinos oder die Mercedes-Benz Arena für große Events.'];;;;238.07;E;7100;true;;;
2020-05-24 21:15:01.244010;Berlin;central_heating;ONE_YEAR_FREE;2825586;n;y;https://pictures.immobilienscout24.de/listings/fcebe4fd-a5ef-48cf-be5c-a42aca05dae0-1338456769.jpg/ORIG/resize/118x118%3E/extent/118x118/format/jpg/quality/80;8;11.12;40 MBit/s;telekom_layer_magenta_l;über VDSL;1957;REGULAR;;11.12;114786123;gas;y;true;MagentaZuhause L;y;Berlin;y;5;2;no_information;energy_consumption;6.13;40.11;Berlin;10625;modernized;no_information;false;100 MBit/s;no_information;no_information;n;https://padlock.link/ioml;https://padlock.link/ml;no_information;apartment;10625;1;174;n;2,active;true;Deutschland;top;100 MBit/s;wohnung_kauf;y;;web,email,bank,music,dl-ul,game,sd,mltstr,hd,fast-ul-dl;true;001.2825586;235000;profile0;;1;true;n;showqualicontactform;n;n;Charlottenburg_Charlottenburg;43130101-01932;1;Berlin;/expose/114786123;['Willkommen in unserem Apartment in Charlottenburg, einem der faszinierendsten und schönsten Stadtteile Berlins! Die 40,11 m2 große Wohnung ist im 1.Oberschoß des Vorderhauses eines Mehrfamilienhauses gelegen und besteht aus 1 Zimmer, Küche und Bad. Ein schöner und großer Südbalkon lädt zum Frühstück ein.\r\nDer Grundriss ist kompakt.\r\nDer Fußboden ist mit Laminatboden ausgelegt.\r\nAuf Wunsch und nach Absprache mit dem Mieter kann die Möblierung übernommen werden.\r\n\u2028\r\nDie sehr helle und große 1-Zimmerwohnung ist mit viel Liebe zum Detail ausgestattet und befindet sich in einer sehr verkehrsgünstigen City-Lage in einem der schönsten Berliner Bezirke. Sie werden die Lage  lieben, denn Sie sind mitten im Geschehen und überall sehr schnell am Ziel, egal ob im Westen, Osten, Süden oder Norden!!! \u2028\r\n\r\nGanz in der Nähe befindet sich die sehr belebte Wilmersdorfer Straße, sowie die Kantstraße, die zahlreiche Einkaufsmöglichkeiten bieten. Wer abends gern unter Menschen ist, ist auch richtig am Ort. Am beliebten und lebendigen Savignyplatz finden sich viele Restaurants, Pubs und Clubs. Hier ist für jeden Geschmack etwas dabei. \u2028\r\nDas Schloss Charlottenburg, Schillertheater, Deutsche Oper sind in wenigen Minuten zu Fuß erreichbar. \u2028\r\n\r\nMomentan ist die Wohnung noch vermietet aber nach Absprache mit dem Mieter verfügbar.', 'Auf Wunsch vollmöbliert, Badewanne, EBK', 'Zur S-Bahn, U-Bahn und Busse -benötigen Sie fußläufig 5 Minuten.\r\nMit dieser Verbindung kann man alle Sightseeing- und Szeneviertel und viele andere Ziele problemlos sehr schnell erreichen. \u2028\r\n\r\nIn direkter Fahrt erreichen Sie mit der S- Bahn den  Zoologische Garten (4 Min.), Hauptbahnhof (10 Min), Friedrichstraße/Unter den Linden (15 Min.), sowie die Kaiser-Wilhelm-Gedächtniskirche und das berühmte älteste Kaufhaus von Berlin (KADEWE).'];;;2013;;;;;;;
2020-05-24 21:15:01.593919;Berlin;central_heating;ONE_YEAR_FREE;15349584;n;n;https://pictures.immobilienscout24.de/listings/c172e6f9-9ecd-4952-aea2-f822341d680f-1346648244.jpg/ORIG/resize/118x118%3E/extent/118x118/format/jpg/quality/80;26;11.35;40 MBit/s;telekom_layer_magenta_l;über VDSL;1910;REGULAR;disabled;11.35;114766944;gas;n;false;MagentaZuhause L;y;Berlin;n;3;1;no_information;energy_consumption;7.53;22.96;Berlin;10249;no_information;no_information;false;100 MBit/s;no_information;no_information;n;https://padlock.link/ioml;https://padlock.link/ml;no_information;ground_floor;10249;1;122.9;n;2,active;true;Deutschland;premium;100 MBit/s;wohnung_kauf;y;5;web,email,bank,music,dl-ul,game,sd,mltstr,hd,fast-ul-dl;true;001.15297385;119000;profile0;;1;true;n;showqualicontactform;n;n;Friedrichshain_Friedrichshain;FH19PS4WE4 (1/778);1;Berlin;/expose/114766944;['Das klassische Berliner Wohngebäude aus der Jahrhundertwende wurde 1997 in Eigentumswohnungen aufgeteilt und befindet sich in einem ansprechenden Zustand. Die Wohnung befindet sich im Erdgeschoß des Seitenflügels mit Blick auf den Innenhof.\n', 'Die 1 Zimmerwohnung verfügt über ein geräumiges, innenliegendes Badezimmer und ist modern gefließt. Der Rest der Wohnung ist mit Laminat ausgestattet. Die Wohnung ist gut aufgeteilt und gewinnt durch das Hochbett zusätzlich Fläche zum Wohnen.', 'Die Altbauwohnung befindet sich in einer ruhigen Seitenstraße in direkter Nähe zur Petersburger Straße, nur wenige Gehminuten vom bunten Treiben des Boxhagener Platzes entfernt. Dem Straßenverlauf Richtung Osten folgend, gelangen Sie zum ruhigen und von Bäumen gesäumten Petersburger Platz. Vielfältige Gastronomie, kleine Künstlerateliers und kreative Lädchen reihen sich rund um die Simon-Dach-Straße aneinander und schaffen so diese ganz besondere Atmosphäre, für die Friedrichshain bis weit über die Stadtgrenzen hinaus, bekannt ist. Der Boxhagener Platz lockt mit seinen\nregelmäßigen Wochen- und Flohmärkten, es gibt diverse sportliche und kulturelle Treffpunkte, ein Bio-Supermarkt und Kinderspielplätze befinden sich in der Nähe. Daneben bietet der lebendige Bezirk noch etliche weitere Sehenswürdigkeiten, wie beispielsweise den Märchenbrunnen im Volkspark, die East-Side Gallery, die O2 World, die Oberbaumbrücke und das Frankfurter Tor. Die Infrastruktur ist bestens und bietet sämtliche Vorteile des Hauptstadtlebens. Es befinden sich mehrere TRAM- und U-Bahn Stationen in unmittelbarer Nähe und Sie gelangen bequem und unkompliziert, innerhalb weniger Minuten, zum Alexanderplatz. Die Stadtautobahn ist ebenfalls gut erreichbar.\n', 'Wir weisen darauf hin, dass alle genannten Angaben zum Objekt auf den Angaben des Eigentümers beruhen. Eine Haftung für Vollständigkeit und Richtigkeit der enthaltenen Angaben wird nicht übernommen. Dieses Exposé soll in knapper Form die wesentlichen Daten des Objektes darstellen. Bitte haben Sie Verständnis dafür, dass wir ausführliche Unterlagen nur nach einem persönlichen Gespräch und nach Angabe Ihrer vollständigen Postadresse und einer\xa0 Telefonnummer versenden. Ausführliche Informationen erhalten Sie gerne telefonisch oder per Mail unter:\nTel.:  49(0)30 450 870 95\nE-Mail: info@pureproperties.de\nMehr Infos unter pureproperties.de\nWir bewerten kostenfrei Ihre Immobilie. Falls Sie Ihre Immobilie verkaufen möchten, stehen wir Ihnen jederzeit gern bei Beratung und Verkauf zur Seite.\n'];;;;189.66;D;;true;;;
