timestamp;obj_regio1;obj_heatingType;obj_telekomTvOffer;obj_cId;obj_newlyConst;obj_balcony;obj_picture;obj_picturecount;obj_pricetrend;obj_telekomUploadSpeed;obj_telekomTrackingGroup;obj_telekomInternetTechnology;obj_yearConstructed;obj_telekomInternetType;obj_pricetrendbuy;obj_scoutId;obj_firingTypes;obj_hasKitchen;obj_ExclusiveExpose;obj_telekomInternetProductName;obj_courtage;geo_bln;obj_cellar;obj_purchasePriceRange;obj_yearConstructedRange;obj_rentSubsidy;obj_houseNumber;obj_energyType;obj_pricetrendrent;obj_livingSpace;geo_krs;obj_zipCode;obj_condition;obj_interiorQual;ga_cd_cxp_historicallisting;obj_telekomDownloadSpeed;obj_parkingSpace;obj_street;obj_lift;obj_telekomInternetUrlMobile;obj_telekomInternetUrl;obj_streetPlain;obj_typeOfFlat;geo_plz;obj_noRooms;obj_thermalChar;obj_assistedLiving;obj_ityp;obj_telekomHdTelephone;geo_land;ga_cd_via;obj_telekomInternet;obj_immotype;obj_rented;obj_telekomInternetServices;obj_telekomInternetProductAvailable;obj_cwId;obj_purchasePrice;ga_cd_application_requirements;obj_numberOfFloors;obj_noRoomsRange;ga_cd_maillead_default_shown;obj_garden;obj_barrierFree;obj_international;obj_regio3;obj_objectnumber;obj_livingSpaceRange;obj_regio2;URL;beschreibung;obj_floor;evt_count_pm_sig;obj_galleryAd;obj_energyEfficiencyClass;obj_lastRefurbish;ga_cd_via_qualified;obj_usableArea;obj_noParkSpaces;obj_groupnumber
2020-05-24 21:03:59.764838;Berlin;central_heating;ONE_YEAR_FREE;15474925;n;n;https://pictures.immobilienscout24.de/listings/e5ef8bf1-2201-4cbd-95c7-818e3f51f27d-1358498968.png/ORIG/resize/118x118%3E/extent/118x118/format/jpg/quality/80;8;10.99;40 MBit/s;telekom_layer_magenta_l;über VDSL;1955;REGULAR;10.99;116754629;oil;n;false;MagentaZuhause L;y;Berlin;y;3;2;186;no_information;energy_consumption;5.59;46.92;Berlin;13585;no_information;no_information;false;100 MBit/s;no_information;no_information;n;https://padlock.link/ioml;https://padlock.link/ml;no_information;raised_ground_floor;13585;2;134;n;2,active;true;Deutschland;top;100 MBit/s;wohnung_kauf;y;web,email,bank,music,dl-ul,game,sd,mltstr,hd,fast-ul-dl;true;001.15417560;118000;profile0;4;2;true;n;n;n;Spandau_Spandau;VK-19495_WE17;2;Berlin;/expose/116754629;"['Die Wohnanlage wurde 1955 erbaut und verfügt über 34 Wohneinheiten, die sich auf drei Wohnhäuser verteilen.\n\nDie Wohnung ist im hinteren Gebäude, von der Straße zurückgesetzt, und somit ruhig gelegen.  Die Lage im Hochparterre bietet einen bequemen Zugang.\n\nDie Wohnfläche von ca. 47 m² Wohnfläche verteilt sich auf zwei Zimmer nebst einem Badezimmer und einer Küche. \n\nEine Abstellkammer sorgt für zusätzlichen Stauraum. \n\nEin Keller ist der Wohnung ebenfalls zugeteilt. \n\nDie Wohnung ist zuverlässig vermietet.  Aufgrund des hohen Alters der Mieterin ist eine Kündigung wegen Eigenbedarfs wohl ausgeschlossen. Eine Investition in die Zukunft!', 'Die Beliebtheit Spandaus nimmt in den letzten Jahren immer mehr zu. Nicht nur für Familien, sondern auch für Singles und Investoren.\n\nEs gibt eine gute Infrastruktur mit Schulen, Kindergärten, Sportplätzen und vielfältigen Einkaufsmöglichkeiten.\n\nIn unmittelbarer Nähe zu dem Wohnhaus befinden sich diverse Geschäfte des täglichen Bedarfs. Auch die Spandauer Arcarden sind nur wenige Fahrminuten von dem Mehrfamilienhaus entfernt und bieten eine vielfältige Auswahl an Geschäften.\n\nWer dem Trubel der Stadt für einen Moment entfliehen möchte, findet seine Erholung im nahegelegenen Wröhmännerpark oder direkt an der schönen Havel. Hier kann man bei erholsamen Spaziergängen die Seele baumeln lassen oder sich bei sportlichen Freizeitaktivitäten auspowern.\n\nDie ""Zitadelle Spandau"" als eine der besterhaltenen Festungen der Hochrenaissance ist ebenfalls nur einen Katzensprung entfernt und ein beliebtes, kulturelles Ziel.\n\nDie Anbindung an den ÖPNV ist ebenfalls sehr gut. Diverse Buslinien halten nahezu vor der Haustür und ermöglichen eine entspannte sowie flexible Verbindung in die Spandauer Altstadt und Umgebung. Der S- und U-Bahnhof Rathaus Spandau bietet außerdem eine gute und schnelle Verknüpfung in die Hotspots der Hauptstadt.']";;;;;;;;;
2020-05-24 21:04:00.133949;Berlin;central_heating;ONE_YEAR_FREE;8128225;n;n;https://pictures.immobilienscout24.de/listings/dc04374a-9bab-4325-bed5-ff5b40b19836-1358328641.jpg/ORIG/resize/118x118%3E/extent/118x118/format/jpg/quality/80;10;11.73;40 MBit/s;telekom_layer_magenta_l;über VDSL;1926;REGULAR;11.73;116755824;district_heating;n;false;MagentaZuhause L;y;Berlin;n;7;1;282.15;18A;;5.75;74;Berlin;12157;well_kept;no_information;false;100 MBit/s;no_information;"Sch&ouml;nhauser Str.";n;https://padlock.link/ioml;https://padlock.link/ml;Schönhauser_Str.;apartment;12157;3;;n;2,active;true;Deutschland;top;100 MBit/s;wohnung_kauf;y;web,email,bank,music,dl-ul,game,sd,mltstr,hd,fast-ul-dl;true;001.8128225;329000;profile0;;3;true;n;n;n;Steglitz_Steglitz;C2305;3;Berlin;/expose/116755824;['Willkommen in Steglitz\n\nDas Mehrfamilienhaus verfügt über insgesamt 14 Wohneinheiten auf 5 Etagen (inkl. ausgebauten Dachgeschoss) und sorgt mit seiner hellen Fassade für einen freundlichen Empfang.\n\nDer parkähnlich angelegte Innenhofbereich lädt zum Verweilen ein und ist ein weiteres charakteristisches\nMerkmal des Objektes aus der Zeit um 1926.\n\nDer charmante Altbau steht unter Denkmalschutz und ist Teil eines Wohnensembles.\n\nDie vermietete Altbauwohnung befindet sich im 1.OG des Vorderhauses und hat eine Wohnfläche von 74,00 m². Die Fläche verteilt sich auf 3 Zimmer, Küche, Bad, Abstellkammer und Flur.\n\nDie Beheizung und die Warmwasserbereitung erfolgt über Fernwärme.\n\nMehr Informationen zu der Immobilie erhalten Sie selbstverständlich auf Anfrage. Vereinbaren Sie am besten jetzt Ihren persönlichen Besichtigungstermin. Wir freuen uns auf Sie.\n\nObjektdaten:\nBezug: vermietet\nEtage: Vorderhaus - 1.OG\nZimmer: 3\nWohnfläche: ca. 74,00 m²\nBad: Wannenbad mit Fenster\nHeizung: Zentralheizung\nBaujahr: 1926\nNettokaltmiete: EUR 536,76\nBetriebskosten: EUR 90,00\nHeizkosten: EUR 87,00\nGesamtmiete: EUR 713,76\n\nWohngeld: EUR 282,15\n\nObjekt-Nr.: C2305 / WE 06\n\nAlle Daten basieren auf Angaben des Eigentümers.', 'Die hier angebotene Immobilie befindet sich in der ruhigen und begrünten Schönhauser Straße nahe dem Lauenburger Platz. Geschäfte des täglichen Bedarfs und ein vielfältiges gastronomisches Angebot befinden sich in der nahegelegenen Bismarckstraße.\n\nGute Verkehrsanbindungen sind durch den S-Bahnhof Feuerbachstraße (etwa 7 Fußminuten entfernt) sowie die örtlichen Busverbindungen gewährleistet. Den U-Bahnhof Walther-Schreiber-Platz (U9) erreicht man zu Fuß in etwa 10 Minuten.\n\nErholungs- und Freizeitmöglichkeiten findet man unter anderem am Insulaner, wie auch im wenigen Fahrradminuten entfernten Stadtpark Steglitz.\n', 'Sie wollen Ihre Immobilie verkaufen?\nWir haben vielleicht schon einen Käufer für Sie!\nGerne kümmern wir uns professionell und engagiert um den Verkauf Ihres Objektes.\n\nWir beraten Sie mit unserer Erfahrung bei der Bewertung Ihrer Immobilie und der Kaufpreisfindung. Selbstverständlich begleiten wir Sie beim Verkauf bis zur Übergabe des Objektes.\n\n\n\n\nWeitere attraktive Angebote von vermieteten und bezugsfreien Eigentumswohnungen finden Sie unter: www.bamboola-immobilien.de'];1;showqualicontactform;;;;;;;
2020-05-24 21:04:00.562567;Berlin;central_heating;ONE_YEAR_FREE;466561;n;y;https://pictures.immobilienscout24.de/listings/cc228161-d47c-40e3-a098-8513f8554c01-1358368560.jpg/ORIG/resize/118x118%3E/extent/118x118/format/jpg/quality/80;16;12.24;40 MBit/s;telekom_layer_magenta_l;über VDSL;;REGULAR;12.24;116757833;oil;y;false;MagentaZuhause L;y;Berlin;y;7;;;no_information;energy_consumption;6.53;65;Berlin;10825;refurbished;sophisticated;false;100 MBit/s;no_information;no_information;n;https://padlock.link/ioml;https://padlock.link/ml;no_information;no_information;10825;2;200;n;2,active;true;Deutschland;standard;100 MBit/s;wohnung_kauf;n;web,email,bank,music,dl-ul,game,sd,mltstr,hd,fast-ul-dl;true;001.466561;385000;profile0;4;2;true;n;n;n;Schöneberg_Schöneberg;116757833;3;Berlin;/expose/116757833;['Die zum Verkauf kommende hochwertige und im Loft-Charakter ausgebaute EIN-RAUM-WOHNUNG bietet viel Platz und zeitgemäßes Wohnen inmitten von Berlin -Schöneberg.\n\nDie Wohnung befindet sich im Dachgeschoss – ohne Dachschrägen – mit einer Raumhöhe von  3.55 m! \n\nDer großzügig offen gestaltete Wohn- und Schlafbereich mit seiner Terrasse bildet das Herzstück der Wohnung.  Das einzig abgetrennte Zimmer ist das mega schöne Tageslicht-Bad mit einer bodengleichen Dusche und WC.  \n\nAusgebaut und komplett saniert in 2009 mit modernsten Materialien.  Durch die hochwertige Ausstattung mit maßgefertigten Einbauten wird die Qualität der einzelnen Details betont, wie z.B. Raumteiler mit 2 Flachbildschirme / TV-Anlage, ...  .\n\nHell und luftig gestaltet mit großen Fensterfronten und dem Charme eines Lofts verleihen dieser Immobilie absoluten Wohlfühlcharakter.', '+ hochwertige Einbauküche mit Ceran-Kochfeld   Backofen, Spülmaschine, ……\n+ Natursteinarbeitsplatte\n+ Raumhöhe ca. 3,55 m\n+ Tageslicht-Bad/ WC mit Natursteinwand\n+ bodengleiche Dusche mit Wasserfall\n+ unverputztes Klinkermauerwerk\n+ Parkett- und Natur-Schieferboden\n+ diverse Einbauten\n+ 2 TV-Flachbildschirme\n+ historische Berliner Doppelkastenfenster\n+ Waschmaschine- / Trockner-Kombigerät\n+ Kabelanschluss\n+ Balkon/Terrasse\nu.v.m.', 'Wohnen im Bayerischen Viertel – d.h. umgeben von moderner und historischer Architektur, zahlreichen Geschäfte für den täglichen Bedarf, legendäre Bars, Cafés und Restaurants. Potsdamer Straße, Akazienstraße Kiez, Winterfeldplatz sowie viele Freizeit- und Erholungsmöglichkeiten wie der Volkspark Schöneberg sind bequem fußläufig erreichbar. \n\nMit den öffentlichen Verkehrsmitteln U2 / U7 und etlichen Buslinien erreichen Sie schnell und bequem das Zentrum sowie alle Berliner Bezirke.  Mehrere Anschlussstellen zu den  Stadtautobahnen A 100 (Stadtring) und A 103 (Westtangente) im Autobahnkreuz Schöneberg sind gegeben.', 'Eine Besichtigung ist ausschließlich in unserer Begleitung und vorheriger Terminvereinbarung mit uns möglich.\n\t\t\t\nDie Ihnen genannten Angaben beruhen sich auf Informationen des Auftraggebers. Eine Haftung für die Richtigkeit und Vollständigkeit können wir daher, trotz großer Sorgfalt nicht übernehmen.\n\nBitte haben Sie Verständnis dafür, dass wir nur Anfragen mit Ihren gesamten Kontaktdaten und Telefonnummer bearbeiten können.'];4;showqualicontactform;disabled;NO_INFORMATION;2009;;;;
2020-05-24 21:04:00.886356;Berlin;central_heating;;14544073;n;y;https://pictures.immobilienscout24.de/listings/7714b29f-72af-4a99-b762-56c680932e80-1358279438.jpg/ORIG/resize/118x118%3E/extent/118x118/format/jpg/quality/80;1;11.3;;;;1917;;11.3;116751265;district_heating;y;false;;y;Berlin;y;10;1;;.;energy_required;5.73;100;Berlin;10719;fully_renovated;luxury;false;;no_information;"Lietzenburger Stra&szlig;e";y;;;Lietzenburger_Straße;apartment;10719;2.5;96.5;n;2,active;;Deutschland;standard;;wohnung_kauf;n;;;002.01000690340;990000;profile0;;2;true;n;n;n;Charlottenburg_Charlottenburg;312+;4;Berlin;/expose/116751265;['Das Wohnhaus befindet sich am Olivaer Platz nahe dem Kurfürstendamm.\n\nDie Wohnung ist im ruhigen Gartenhaus im 3. Obergeschoss gelegen.\n\nDiverse Einkaufsmöglichkeiten sind in unmittelbarer Nähe vorhanden.', 'Hochwertige Ausstattung:\n\n- Parkett\n- Einbauküche\n- Wannen- und Duschbad\n- großer Balkon\n- Kellerraum', '- der U-Bahnhof Adenauerplatz ist in ca. 5 Minuten fußläufig erreichbar außerdem stehen mehrere Buslinien unmittelbar zu Verfügung'];3;showqualicontactform;;;;;;;
2020-05-24 21:04:01.306158;Berlin;floor_heating;ONE_YEAR_FREE;5378269;n;y;https://pictures.immobilienscout24.de/listings/a6cb5a48-f8b5-4f39-95b8-f2d531369779-1358265014.jpg/ORIG/resize/118x118%3E/extent/118x118/format/jpg/quality/80;3;10.37;40 MBit/s;telekom_layer_magenta_l;über VDSL;2011;REGULAR;10.37;116750507;gas;n;false;MagentaZuhause L;y;Berlin;n;8;8;246;no_information;energy_required;4.8;88.94;Berlin;14167;mint_condition;no_information;false;100 MBit/s;no_information;no_information;y;https://padlock.link/ioml;https://padlock.link/ml;no_information;penthouse;14167;2;69;n;2,active;true;Deutschland;premium;100 MBit/s;wohnung_kauf;y;web,email,bank,music,dl-ul,game,sd,mltstr,hd,fast-ul-dl;true;001.5378269;449000;profile0;;2;true;n;n;n;Lichterfelde_Steglitz;835;4;Berlin;/expose/116750507;['Dieses Penthouse wurde auf der exzellenten Bausubstanz des zweitgrößten Baudenkmals Berlins errichtet.\n\nFür mehr Informationen fordern Sie bitte unser ausführliches Exposé an.', '- modernster Wohnraum mit lichtdurchfluteten Räumen \n- bodentiefe Fenster\n- 3-fach-Wärmeschutzverglasung\n- KfW-Effizienzhaus 70 Standard\n- 3,20 m hohen Decken', 'Zehlendorf und Steglitz zeichnen sich durch die höchste Kaufkraft, das höchste Bildungsniveau und die Nähe zum bekanntesten Naherholungsgebiet aller Berliner Bezirke, dem Grunewald, aus.', 'Zu einer Besichtigung des Penthouses laden wir Sie nach Absprache herzlich ein!'];4;showqualicontactform;;;;true;;;
2020-05-24 21:04:01.692256;Berlin;central_heating;ONE_YEAR_FREE;18598651;n;n;https://pictures.immobilienscout24.de/listings/8373c310-ac0d-4c94-80f8-c9d50ad46c51-1355341115.jpg/ORIG/resize/118x118%3E/extent/118x118/format/jpg/quality/80;8;11.48;40 MBit/s;telekom_layer_magenta_l;über VDSL;1968;REGULAR;11.48;116336132;district_heating;n;false;MagentaZuhause L;n;Berlin;n;5;2;;14;;7.14;33;Berlin;10249;fully_renovated;sophisticated;false;100 MBit/s;no_information;"Barnimstra&szlig;e";y;https://padlock.link/ioml;https://padlock.link/ml;Barnimstraße;apartment;10249;1;;n;2,active;true;Deutschland;standard;100 MBit/s;wohnung_kauf;n;web,email,bank,music,dl-ul,game,sd,mltstr,hd,fast-ul-dl;true;009.02c1a609-93a7-4f83-a34a-d40e617a30b5;220000;profile0;9;1;true;n;n;n;Friedrichshain_Friedrichshain;116336132;1;Berlin;/expose/116336132;['Bei dieser ansprechenden Immobilie handelt es sich um eine vollständig renovierte Wohnung im sechsten Stock. Zu dem Apartment zählt ein attraktives Zimmer.'];6;showqualicontactform;;;2018;;;;
2020-05-24 21:04:02.098775;Berlin;district_heating;ONE_YEAR_FREE;17610703;n;y;https://pictures.immobilienscout24.de/listings/b77e2659-b0aa-4319-bc47-43ddfe75fb6a-1358884483.jpg/ORIG/resize/118x118%3E/extent/118x118/format/jpg/quality/80;21;11.73;40 MBit/s;telekom_layer_magenta_l;über VDSL;1960;REGULAR;11.73;116757237;district_heating;y;false;MagentaZuhause L;y;Berlin;y;8;2;327;24;energy_required;5.75;74;Berlin;12167;no_information;sophisticated;false;100 MBit/s;no_information;Steglitzer Damm;y;https://padlock.link/ioml;https://padlock.link/ml;Steglitzer_Damm;no_information;12167;3;;n;2,active;true;Deutschland;top;100 MBit/s;wohnung_kauf;n;web,email,bank,music,dl-ul,game,sd,mltstr,hd,fast-ul-dl;true;009.eb808053-c275-4395-8fce-dc755606f8bd;460000;profile0;5;3;true;n;n;n;Steglitz_Steglitz;116757237;3;Berlin;/expose/116757237;"['Die angebotene Immobilie mit Balkon befindet sich im 4. Obergeschoss. Die 3-Zimmer-Wohnung hat ca. 74 m² und verfügt über ein Wohnzimmer mit offener Küche, zwei Schlafzimmer und Badezimmer. Das Objekt hat einen sehr funktionalen Grundriss und ist ideal für eine Familie oder als zukünftige Kapitalanlage mit einer nachhaltigen Vermietbarkeit und Wertsteigerung. Eine hochwertige und komfortable Ausstattung mit einer durchdachten Planung wird den neuen Eigentümer begeistern.\n\n\nThe offered property with balcony is on the 4th floor. The 3-room apartment has about 74 m² and has a living room with open kitchen, two bedrooms and bathroom. The property has a very functional floor plan and is ideal for a family or as a future capital investment with a sustainable rentability and appreciation. A high quality and comfortable furnishing with a well thought-out planning will inspire the new owner.', 'In unmittelbarer Nähe zum Stadtpark Steglitz liegt dieser neue Wohnkomplex in dem sich diese sonnige und elegante Wohnung befindet. Das Aufstockungsprojekt wurde sehr anspruchsvoll ausgeführt und vermittelt ein angenehmes Wohngefühl.\n\n\nIn close proximity to the Steglitz city park is this new residential complex in which this sunny and elegant apartment is located. The extension project was executed in a very sophisticated way and conveys a pleasant living feeling.', ""Zwischen Rathaus Steglitz und Berlin Südende, in unmittelbarer Umgebung des Stadtparks Steglitz, befindet sich das Quartier am Stadtpark Steglitz, ein Wohnensemble mit insgesamt 101 Wohnungen und 2 Gewerbeeinheiten. Zentral im grünen Bezirk Steglitz-Zehlendorf gelegen, befinden sich alle Geschäfte des täglichen Bedarfs in der unmittelbaren Umgebung des Projekts. Der Stadtpark Steglitz mit vielfältigen Freizeitmöglichkeiten ist ebenfalls nur einen Katzensprung entfernt.\nDie verkehrstechnische Anbindung des Quartiers ist als sehr gut zu bezeichnen. Bushaltestellen sind in wenigen Minuten zu Fuß erreichbar; S- und U- Bahnhof Rathaus Steglitz bzw. S-Bahnhof Südende in jeweils ca. 10 min. Alle drei Bahnhöfe bieten direkte Anbindung an die Berliner Innenstadt und auch nach Potsdam. Mit dem Auto hat man über die A 103 ebenfalls eine schnelle Anbindung an alle Teile Berlins und das Umland. \n\n\nThe Quartier am Stadtpark Steglitz, a residential ensemble with a total of 101 apartments and 2 commercial units, is located between Steglitz City Hall and Berlin Südende, in the immediate vicinity of Steglitz City Park. Centrally located in the green district of Steglitz-Zehlendorf, all shops for daily needs are in the immediate vicinity of the project. The Steglitz city park with its diverse leisure facilities is also only a stone's throw away.\nThe transport connections of the quarter can be described as very good. Bus stops can be reached on foot in a few minutes; the S- and U-Bahn stations Rathaus Steglitz and Südende in about 10 minutes. All three stations offer direct connections to the city centre of Berlin and Potsdam. By car, the A 103 motorway also provides a fast connection to all parts of Berlin and the surrounding area."", 'Der Mietvertrag ist bis zum 30.09.2022 befristet.\n\nThe rental agreement is limited until 30.09.2022.']";4;;;;;;74;;
2020-05-24 21:04:02.626367;Berlin;central_heating;ONE_YEAR_FREE;37030;n;y;https://pictures.immobilienscout24.de/listings/796dcd76-5803-457c-9a99-8b0558cac59d-1367336199.jpg/ORIG/resize/118x118%3E/extent/118x118/format/jpg/quality/80;20;10.37;40 MBit/s;telekom_layer_magenta_l;über VDSL;1900;REGULAR;10.37;116751611;gas;n;true;MagentaZuhause L;y;Berlin;y;11;1;;7;energy_required;4.8;198.41;Berlin;12203;no_information;no_information;false;100 MBit/s;outside;"Mommsenstra&szlig;e";n;https://padlock.link/ioml;https://padlock.link/ml;Mommsenstraße;raised_ground_floor;12203;5.5;120.9;n;2,active;true;Deutschland;schaufenster;100 MBit/s;wohnung_kauf;n;web,email,bank,music,dl-ul,game,sd,mltstr,hd,fast-ul-dl;true;001.37030;1380000;profile0;3;5;true;n;n;n;Lichterfelde_Steglitz;36947;7;Berlin;/expose/116751611;['Anfang 1900 errichtet, beherbergt die exklusive Gründerzeitvilla nach aufwendiger Sanierung in 2013 nun vier Wohneinheiten. Drei Zimmer, eine 45 qm große Wohnküche, ein elegantes Masterbad und ein Gäste-WC im Hochparterre sowie eine separate Einlieger-Wohnung mit Schlafzimmer, Ankleide und modernem Duschbad im Souterrain bieten Ihnen auf ca. 198 qm viel Raum zur Verwirklichung Ihrer Träume. Luftige Deckenhöhen von bis zu 3,30 m, historische Kassettentüren, Stuckdecken und liebevoll aufgearbeitete Parkettböden verleihen Ihrem neuen Zuhause eine anmutige Noblesse. Der offene Wohn-, Koch und Essbereich mit maßgefertigter Kochinsel, hellem Erker und gemütlichem Kamin bietet ein El Dorado für familiäres Beisammensein. Draußen lockt eine weitläufige Sonnenterrasse, auf der Sie wunderbar ein gemeinsames Barbecue mit Freunden genießen können, während sich die Kinder im großen Gemeinschaftsgarten amüsieren.', '+ bezugsfrei ab August 2021\r\n\r\n+ 2013 Wohnung modernisiert\r\n\r\n+ 2014/15 Außenisolierung\r\n\r\n+ 2019 Fassadenmodernisierung\r\n\r\n+ Sonnenbalkon mit Gartenanteil\r\n\r\n+ Deckenhöhe 3,30 m\r\n\r\n+ Einbauküche inklusive Miele-Geräte\r\n\r\n+ optionaler Einbauschrank\r\n\r\n+ historischer Stuck\r\n\r\n+ Einliegerwohnung\r\n\r\n+ moderner Kamin\r\n\r\n+Alarmanlage\r\n\r\n+ Außenstellplatz inklusive (Elektro-Anschluss möglich)', 'Gelegen in der Mommsenstraße 7 finden Sie vor der Haustür alles was das Herz begehrt und genießen gleichzeitig märchenhafte Ruhe und Entspannung in freundlicher Nachbarschaft. Repräsentative Bauten, inhabergeführte Geschäfte, herrliche Parkanlagen prägen das Stadtbild von Dahlem und der angrenzenden Villenkolonie Lichterfelde-West. Als Standort der Freien Universität Berlin – die seit 2007 den Elitestatus trägt – sowie zahlreicher Forschungseinrichtungen der Max-Planck-Gesellschaft ist Dahlem über die Grenzen der Hauptstadt hinaus bekannt. Mehrere berühmte Museen, der wunderschöne Botanische Garten sowie zahlreiche gute Schulen und Kindertagesstätten tragen darüber hinaus zur einzigartigen Wohnatmosphäre bei. Wertvolle Quality Time verbringen, können Sie in den entzückenden Cafés und Restaurants der Umgebung, der malerische Teltowkanals ist nur wenige Fahrradminuten entfernt und vom nahen S-Bahnhof Berlin-Lichterfelde West gelangen Sie schnell mit der S1 ins Stadtzentrum.', '++++++++++++++++++++++++++++++++++++++++++++\r\n\r\nUnser Verkaufsbüro in der Schlüterstraße 54 hat wieder geöffnet. Besuchen Sie uns Dienstags, Mittwochs oder Donnerstags zwischen 14 und 18 Uhr. Unsere Berater freuen sich auf Sie!\r\n\r\n++++++++++++++++++++++++++++++++++++++++++++\r\n\r\nBei Ziegert steht der Mensch im Mittelpunkt. Wir nehmen unsere gesellschaftliche Verantwortung selbstverständlich auch in dieser herausfordernden Zeit sehr ernst. Die Gesundheit unserer Kunden, Mitarbeiter und Partner hat für uns oberste Priorität. Aufgrund der aktuellen Situation werden daher unsere Showrooms vorübergehend geschlossen. Dennoch sind unsere ImmobilienberaterInnen weiterhin bestmöglich für Sie da. Wir freuen uns auf den Kontakt mit Ihnen per E-Mail, Telefon oder Videochat.\r\n\r\n++++++++++++++++++++++++++++++++++++++++++++\r\n\r\nVerkauf im unmöblierten Ist-Zustand (inklusive Einbauküche).\r\n\r\n++++++++++++++++++++++++++++++++++++++++++++\r\n\r\nSie wollen sich vergrößern oder verändern? Zögern Sie nicht und fragen Sie unsere Experten, welchen Wert Ihre Immobilie aktuell hat.\r\n\r\n++++++++++++++++++++++++++++++++++++++++++++\r\r\n\r\nDas ZIEGERT-Finanzierungsteam hilft Ihnen dabei, Ihre Träume zu leben. Wir zeigen Ihnen gern, wie man zum Beispiel den eigenen Mietzins in Eigentum verwandeln kann. Entdecken Sie Ihre Möglichkeiten und kontaktieren Sie uns unter +49 (0) 30 880 353 - 39 oder auf www.kaufen-statt-mieten.berlin.\r\n\r\n+++++++++++++++++++++++++++++++++++++++++++++'];0;showqualicontactform;disabled;;;true;;1;
