2020-05-24 21:15:05.059377;Berlin;district_heating;ONE_YEAR_FREE;97549;n;n;https://pictures.immobilienscout24.de/listings/a64d214b-a3a3-4e68-aca0-2f7c2eabcc4d-1338321031.jpg/ORIG/resize/118x118%3E/extent/118x118/format/jpg/quality/80;4;12.7;40 MBit/s;telekom_layer_magenta_l;über VDSL;1900;REGULAR;;12.7;114776303;district_heating;n;false;MagentaZuhause L;y;Berlin;y;2;1;50;energy_consumption;7.58;26.57;Berlin;10559;no_information;no_information;false;100 MBit/s;no_information;"Stephanstra&szlig;e";n;https://padlock.link/ioml;https://padlock.link/ml;Stephanstraße;apartment;10559;1;69.8;n;2,active;true;Deutschland;top;100 MBit/s;wohnung_kauf;y;3;web,email,bank,music,dl-ul,game,sd,mltstr,hd,fast-ul-dl;true;001.97549;99000;profile0;4;1;true;n;showqualicontactform;n;n;Tiergarten_Tiergarten;Stephan50:16;1;Berlin;/expose/114776303;"['Das Haus wird mit Fernwärme versorgt.', '- vermietet\n- ruhiger Seitenflügel\n- 3. Obergeschoss\n\nDa die Wohnung vermietet ist, stehen hier keine Innenfotos zur Verfügung.', 'Der Stuckaltbau liegt in zentraler Lage Nähe der S- und U-Bahn-Station ""Westhafen"" und der Turmstraße mit mehreren Einkaufsmöglichkeiten, Restaurants und Cafés.', 'Die monatliche Nettokaltmiete beträgt 145,37 €.']";;;;;;0;;;;
2020-05-24 21:15:05.425935;Berlin;central_heating;;185949;n;y;https://pictures.immobilienscout24.de/listings/e159711d-2aed-4647-a08a-c91c23b025e6-1370396027.jpg/ORIG/resize/118x118%3E/extent/118x118/format/jpg/quality/80;15;10.77;;;;1900;;disabled;10.77;114762949;no_information;n;true;;n;Berlin;y;9;1;225A;energy_consumption;5.67;61.8;Berlin;10117;first_time_use_after_refurbishment;no_information;false;;no_information;"Torstra&szlig;e";y;;;Torstraße;apartment;10117;2;128.8;n;2,active;;Deutschland;schaufenster;;wohnung_kauf;n;3;;false;001.185949;510000;profile0;5;2;true;n;showqualicontactform;n;n;Mitte_Mitte;16718710;3;Berlin;/expose/114762949;['Willkommen im LeNeuf, dem stilvollen Gründerzeit-Altbau in der Torstraße! Das Gebäude-Ensemble aus dem Jahr 1900 liegt zentral, im beliebten Berliner Szene Bezirk Mitte. \r\n\r\nDie historische Fassade besticht durch ihre überwiegend original erhaltenen Altbau-Elemente, aufgearbeiteten Rundbogen- und Holzdoppelkasten-Fenster. Das Gebäude besteht aus einem Vorderhaus mit fünf Gewerbeeinheiten, zwei Seitenflügeln und zwei Gartenhäusern, die über sechs separate Aufgänge und zwei Innenhöfe zu erreichen sind.\r\n\r\nDie 1- bis 3-Zimmerwohnungen vermitteln durch ihre Deckenhöhen von bis zu 3,70 Meter und ihren großen Doppelfenstern, einen besonders weiten und lichten Eindruck. Der Altbau-Charme wird durch überwiegend original erhaltene und überarbeitete Holzböden unterstrichen, die zum Teil als Tafelparkett, Fischgrät-Parkett oder als Dielen ausgeführt sind. Die meisten Wohnungen verfügen über Balkone oder lichtdurchflutete Erker.\r\n Im Zuge der umfangreichen Sanierungsarbeiten wird das Wohnhaus um neun wunderschöne Dachgeschoss-Neubau-Wohnungen erweitert und mit Aufzügen ausgestattet. Das Gebäude wird über eine Gaszentralheizung versorgt. Im ersten Innenhof befinden sich errichtete Abstellmöglichkeiten für Fahrräder.\r\n\r\nObjektseite: www.eigentumswohnung-mitte.de\r\nDrohnenfilm: https://youtu.be/1WlUKWuheNA\r\nWohnbeispiel: https://youtu.be/jZoDEedfQbU\r\n\r\nACCENTRO App für iOS https://goo.gl/KvMJTa und für Android https://goo.gl/ACqL6H', 'Wie der Name ‚Berlin-Mitte‘ verspricht: Hier lebt man mitten im Herzen der Stadt! Mitte setzt sich aus einer Vielzahl an lebendigen Kiezen mit eigenem Charakter zusammen. Die Torstraße liegt in einem der reizvollsten Quartiere – der Spandauer Vorstadt mit dem an kulturhistorischen Schätzen reichen Scheunenviertel.\r\n\r\nWohnen und Leben in der Torstraße bedeutet, alle Annehmlichkeiten des urbanen Lebens der Metropole Berlin direkt vor der Haustür zu haben. Hier bewegt man sich zwischen kulinarischer und kultureller Vielfalt. In südlicher Richtung pulsiert das Leben rund um die Friedrichstraße mit ihrer international renommierten Bühnenlandschaft vom Deutschen Theater über das Berliner Ensemble hin zum Friedrichstadt-Palast. Die nahegelegene Spree lädt zu Ausflügen mit dem Schiff durch die historische Mitte ein.\r\n\r\nDie nur etwa einen Kilometer entfernte Museumsinsel gehört zu den kulturellen Höhepunkten der Stadt, die sowohl Touristen als auch Einheimische immer wieder in ihren Bann zieht. Eine besondere Atmosphäre besonders in den Sommermonaten versprüht der angrenzende Monbijoupark. Die Strandbar an der Uferpromenade lädt unter freiem Himmel zum Tangotanzen ein, die Märchenhütte bietet besondere Interpretationen der Grimm’schen Märchen und im Kinderbad können sich die Kleinen genüsslich die Zeit vertreiben.\r\n\r\nDesign- und Kunstliebhaber kommen im ehemaligen Scheunenviertel zwischen Linienstraße, Weinmeisterstraße und rund um den Hackeschen Markt auf ihre Kosten. Galerien und exklusive Shops sind eine Oase mit besonderem Charme für Flaneure. So vielfältig sich der Kiez am Tag zeigt, so lebendig geht auch das Nachtleben zu. Cafés, Bars und Restaurants jeglicher Couleur lassen das Herz von Berlinern und Gästen gleichermaßen höherschlagen und spiegeln die besondere Atmosphäre der beliebten Metropole wider.'];;;;202.29;D;4900;true;;;
2020-05-24 21:15:05.768667;Berlin;floor_heating;ONE_YEAR_FREE;18027065;y;y;https://pictures.immobilienscout24.de/listings/57ec374b-48c7-4a28-9326-7201e394e649-1338579403.jpg/ORIG/resize/118x118%3E/extent/118x118/format/jpg/quality/80;11;11.37;40 MBit/s;telekom_layer_magenta_l;über VDSL;2019;REGULAR;;11.37;114792688;;n;false;MagentaZuhause L;y;Berlin;y;10;9;15;;5.79;104;Berlin;10711;no_information;luxury;false;100 MBit/s;no_information;"Katharinenstra&szlig;e";y;https://padlock.link/ioml;https://padlock.link/ml;Katharinenstraße;no_information;10711;4;;n;2,active;true;Deutschland;standard;100 MBit/s;wohnung_kauf;n;2;web,email,bank,music,dl-ul,game,sd,mltstr,hd,fast-ul-dl;true;009.9233d0ff-ce69-47de-ab6b-2b67a0fbd406;785000;profile0;6;4;true;y;showqualicontactform;y;n;Wilmersdorf_Wilmersdorf;01.34;5;Berlin;/expose/114792688;['Vier individuelle Wohnhäuser in traditioneller Architektursprache und der erste Wohnturm der City West bilden gemeinsam das HIGH WEST in der Heilbronner Straße, Ecke Karlsruher und Katharinenstraße, im Charlottenburger Ortsteil Halensee. Eine Tiefgarage ergänzt das Ensemble auf dem insgesamt 5.000 Quadratmeter großen Grundstück.\nWährend die Häuser komplett neu entstehen, wird der bisher rein gewerblich genutzte Turm entkernt, mit einer modernen Natursteinfassade versehen und durch neue Trennwände in attraktive Wohneinheiten unterteilt. Ob man „hoch hinaus“ will oder es eher „bodenständig“ mag – das HIGH WEST bietet ein breites Spektrum an Wohnungen unterschiedlicher Größe und Ausrichtung. Ein ideales Zuhause sowohl für Familien als auch für Singles und Paare.\n\nHelligkeit prägt die Wohnungen im HIGH WEST, die bis ins letzte Detail durchdacht und kompakt angelegt sind: Die Schlafzimmer liegen zum ruhigen Innenhof, alle Aufenthaltsräume verfügen über große Fensterfronten und jede Wohnung erhält eine Loggia, einen Balkon oder eine Terrasse. Freuen Sie sich auf eine wertige Ausstattung, die sämtliche moderne Standards erfüllt – auf Wunsch sind auch Sonderausführungen möglich. Insbesondere für die Einrichtung der Küchen stehen verschiedene Optionen zur Auswahl. Sprechen Sie uns an, wir beraten Sie gern!', 'Vom lebhaften Ku’damm über die gemütlichen Kieze in direkter Nachbarschaft bis hin zur grünen Lunge, dem Grunewald: Rund um das HIGH WEST erwartet Sie eine bunte Mischung verschiedenster Spots, Quartiere und Naherholungsziele, die ein Großstadtleben voller Abwechslung und Inspirationen bieten.\n\nOb Radeln, Joggen, Paddeln oder Schwimmen: Der Grunewald bietet mit seiner Seenkette, der Havel und dem Wannsee unzählige Möglichkeiten für Erholungssuchende wie Sportbegeisterte. Mit der S-Bahn erreicht man das grüne Paradies vom Bahnhof Charlottenburg aus bereits in fünf Minuten! Schöne Spaziergänge ermöglicht auch der nahe Lietzensee mit seinen idyllischen Uferwegen.\n\nAbseits vom Großstadttrubel geht es am westlichen Ende des Stuttgarter Platzes beschaulich zu. Entlang der schönen Leonhardt- und Windscheidstraße reihen sich originelle Geschäfte und Boutiquen, kreative Werkstätten und Feinkostläden aneinander. In den vielen Cafés und Restaurants trifft sich ein buntes Publikum aus Jung und Alt zum geselligen Miteinander.'];104;1;;312;;;;;;
2020-05-24 21:15:06.191813;Berlin;district_heating;ONE_YEAR_FREE;15541766;n;n;https://pictures.immobilienscout24.de/listings/dca1f68f-be09-49a8-9bea-df8b02624d38-1353120538.jpg/ORIG/resize/118x118%3E/extent/118x118/format/jpg/quality/80;8;11.12;40 MBit/s;telekom_layer_magenta_l;über VDSL;1969;REGULAR;;11.12;114773968;district_heating;n;false;MagentaZuhause L;y;Berlin;n;7;2;no_information;energy_consumption;6.13;74;Berlin;14059;well_kept;no_information;false;100 MBit/s;underground_garage;no_information;y;https://padlock.link/ioml;https://padlock.link/ml;no_information;apartment;14059;3;130.9;n;2,active;true;Deutschland;standard;100 MBit/s;wohnung_kauf;n;;web,email,bank,music,dl-ul,game,sd,mltstr,hd,fast-ul-dl;true;001.15472652;320000;profile0;;3;true;n;showqualicontactform;n;n;Charlottenburg_Charlottenburg;WO841_1;3;Berlin;/expose/114773968;"['Die helle 3-Zimmerwohnung liegt im 6. Obergeschoss des ruhig gelegenen Seitenflügels. Sie erreichen die Wohnung bequem mit dem Personenaufzug. Die Wohnung verfügt neben den drei Wohnräumen über ein modernes Bad mit Dusche, ein Gäste-WC sowie die Küche mit angrenzendem Abstell-/Vorratsraum.\n\nAus Wohn- und Schlafzimmer haben Sie einen herrlichen Ausblick auf das Schloss Charlottenburg und die dazugehörige Parkanlage. \n\nZur Wohnung gehören neben einem Kellerabteil auch zwei PKW-Stellplätze. Ein Stellplatz befindet sich in der Tiefgarage und ein weiterer überdachter Stellplatz auf dem Innenhof.\n\nDIE WOHNUNG IST NICHT VERMIETET UND BEZUGSFREI', 'Die Fußböden in Küche, Bad, Gäste-WC und im Eingangsbereich sind gefliest. In Büro, hinterem Flur, Wohn- und Schlafzimmer wurde Teppichboden verlegt. Das hell geflieste Bad wurde im September 2019 komplett modernisiert und verfügt über eine ebenerdige Dusche, Hänge-WC, Waschbecken und einen Handtuchheizkörper. Die Küche verfügt über eine Einbauküche inkl. Elektrogeräte. Die Wohnung wird über eine Fernwärme Zentralheizung mit Wärme versorgt. Die Warmwasserversorgung erfolgt dezentral über einen elektrischen Durchlauferhitzer.', '""Aus der Haustür, in den Schlosspark""\n\nMitten in der Stadt und doch im Grünen. Die Wohnung liegt direkt am Schloss Charlottenburg und der dazugehörigen öffentlichen Parkanlage. Raum für die verschiedenste Betätigungen an der frischen Luft ist hier ausreichend vorhanden. \nAlle Geschäfte und Einrichtungen des täglichen Bedarfs sind fußläufig erreichbar. Speziell der angrenzende ""Dankelmann-Kiez"" bietet eine Vielzahl kleiner Geschäfte und verschiedenster Restaurants und Cafés. \n\nDie Anbindung an den ÖPNV ist perfekt. Direkt vor der Tür halten die Buslinien 309 und M45. Der S-Bahnhof Westend mit der Linie S46, sowie der Ringbahn S41/S42 ist nur 500 m entfernt und fußläufig in etwa 5 Minuten zu erreichen.\n\nDie Autobahnauffahrt ""Spandauer Damm"" der A100 ist nur 2 Autominuten entfernt.', 'Wir haben Ihr Interesse geweckt? \nHier auf dieser Seite finden Sie jetzt die Möglichkeit der Kontaktaufnahme. Für weitere Informationen (Termine, Anschrift u.ä.) benötigen wir Ihre Angaben: Name, Vorname, Anschrift, E-Mail, Telefonnummer (fest/mobil).\nAnfragen ohne Angabe Ihrer Rückrufnummer und Ihrer Adresse können von uns nicht bearbeitet werden! \nFür alle weiteren Informationen rufen Sie uns bitte unter der Telefonnummer 0178 - 86 34 831 an. Es betreut Sie: \nJan Pillardy\n\nDie Angaben in diesem Angebot beruhen auf Angaben des Auftraggebers oder Dritten. Agas-Immobilien übernimmt keine Haftung und keine Gewähr für die Richtigkeit, Vollständigkeit und Aktualität dieser Angaben. Irrtum, Auslassungen und Zwischenverwertung vorbehalten. \n\nWir weisen vorsorglich darauf hin, dass der angegebene Kaufpreis bei entsprechender starker Nachfrage steigen kann. Der Käufer hat eine Provision in Höhe von 7,14 % inkl. MwST. vom Kaufpreis an uns für Nachweis und/oder Vermittlung des Kaufobjekts zu zahlen. Die Provision ist fällig und zahlbar bei Kaufvertragunterzeichnung.\n\nSuchende können sich gerne auf www.agas-immobilien.de/sie-suchen-wir-finden   für weitere/zukünftige Immobilien vormerken lassen. Sie erhalten dann Immobilienangebote, bevor diese online vermarktet werden.\n \nMöchten Sie eine Immobilie verkaufen oder vermieten, wir informieren Sie gerne diskret und unverbindlich über Ihre Möglichkeiten.\nwww.agas-immobilien.de']";;1;;;E;;;;;
2020-05-24 21:15:06.595063;Berlin;;ONE_YEAR_FREE;15467035;n;y;https://pictures.immobilienscout24.de/listings/73a1e40b-da6b-48db-ad0c-4a90707901b6-1360826502.jpg/ORIG/resize/118x118%3E/extent/118x118/format/jpg/quality/80;5;11.12;40 MBit/s;telekom_layer_magenta_l;über VDSL;;REGULAR;;11.12;114773382;geothermal;y;true;MagentaZuhause L;y;Berlin;n;7;;63;;6.14;33.4;Berlin;10627;first_time_use;sophisticated;false;100 MBit/s;no_information;"Bismarckstra&szlig;e";y;https://padlock.link/ioml;https://padlock.link/ml;Bismarckstraße;roof_storey;10627;1;;n;2,active;true;Deutschland;top;100 MBit/s;wohnung_kauf;n;5;web,email,bank,music,dl-ul,game,sd,mltstr,hd,fast-ul-dl;true;002.01000809712;343000;profile0;6;1;true;n;showqualicontactform;y;n;Charlottenburg_Charlottenburg;EW-38;1;Berlin;/expose/114773382;['Emerald West is a brand new project with 39 studios and one-bedroom apartments located in Berlin-Charlottenburg – one of the best locations in the city.\r\n\r\n- 39 modern studios and one-bedroom apartments in a new development building in Berlin’s City West: living spaces ranging in sizes from approx. 23 to 48 m²\r\n- Great location in western Berlin close to Technical University (TU Berlin), shopping mile Kurfürstendamm and Wilmersdorfer Straße, the Deutsche Oper Berlin, Lake Lietzensee and Charlottenburg Palace\r\n- Excellent connections to the subway and train station and just 1 kilometre to the autobahn A100. Alternatively, explore the city with your electric bike (charging stations available)\r\n- High-quality features, such as real wood parquet flooring with underfloor heating, high-quality bathrooms, fitted wardrobe and kitchen\r\n- Furniture packages are available on request\r\n- Expected completion: 2. Quarter of 2022\r\n\r\nEmerald West is like a hidden gem tucked into a quiet and cosy backyard of the main street Bismarckstraße. The building is accessible for the disabled, equipped with lifts and underground parking.', '– Balcony or terrace (see specific floor plan)\r\n\r\n– Real wood parquet flooring with underfloor heating\r\n\r\n– high-quality bathrooms\r\n\r\n– fitted wardrobe\r\n\r\n– fitted kitchen\r\n\r\n– Bicycle parking spaces with e-bike charging station\r\n\r\n– Furniture packages are available on request', 'Charlottenburg and City West are the most sought-after areas in Berlin – a place where international atmosphere and classic charm converge. The neighbourhood is home to many shopping malls, excellent cultural and educational facilities (including the Technical University Berlin). If you want to invest in property in Charlottenburg, you’ve come to the right place – in the midst of West Berlin.\r\n\r\nThe neighbourhood has everything for comfortable living. Shopping street Wilmersdorfer Straße, Savignyplatz, loved for its vibrant nightlife, the world-famous Deutsche Opera and beautiful Charlottenburg Palace – everything can be reached by foot. The Lietzensee Lake is a perfect place for relaxation and unhurried walks.\r\n\r\nThe underground stations Bismarckstrasse (U2, U7) and Sophie-Charlotte-Platz (U2) are just around the corner. The urban railway station Charlottenburg (S3, S5, S7, S9, S42) is close nearby. From there, the shopping boulevard Kurfürstendamm, KaDeWe department store and the city centre can be reached in a few minutes.', 'Your smart investment\r\n\r\nEmerald West is an ideal decision for investors. The demand for furnished and unfurnished studio apartments in Berlin is high. Central location and attractive purchase prices make this property especially interesting.\r\n\r\nWe have had good experiences with the property developer of Emerald West: the company stands for a high quality of construction and timely completion. We have always rented such apartments quickly for our buyers.\r\n\r\nWe have successfully guided clients through similar projects helping them to buy studios in Berlin. We make it easy to invest in real estate by offering personal support and tailormade services for individual needs at every stage of your purchase (including after-sales service). In addition, we have specialists who can help you with the financing of your apartment.'];;;;;;;;87397;true;
2020-05-24 21:15:06.986427;Berlin;floor_heating;ONE_YEAR_FREE;16048948;n;y;https://pictures.immobilienscout24.de/listings/4641aba6-9fc8-4bc8-8145-49da91a5d6a0-1338016054.jpg/ORIG/resize/118x118%3E/extent/118x118/format/jpg/quality/80;3;10.09;40 MBit/s;telekom_layer_magenta_l;über VDSL;2015;REGULAR;;10.09;114756754;;y;false;MagentaZuhause L;y;Berlin;y;8;8;no_information;;4.59;60;Berlin;14195;no_information;sophisticated;false;100 MBit/s;underground_garage;no_information;y;https://padlock.link/ioml;https://padlock.link/ml;no_information;apartment;14195;2;;n;2,active;true;Deutschland;top;100 MBit/s;wohnung_kauf;n;3;web,email,bank,music,dl-ul,game,sd,mltstr,hd,fast-ul-dl;true;001.15850880;460000;profile0;4;2;true;y;showqualicontactform;y;n;Zehlendorf_Zehlendorf;114756754;2;Berlin;/expose/114756754;['Die moderne Wohnung liegt im neuen Neubaukoplex vom Baujahr 2015. Die Wohnung hat einen praktischen Grundriss und verfügt über eine grosse Terrasse zum Wald. \n\nWohnung kann möbliert übernommen werden. \n\nBodentiefe Fenster\nFussbodenheizung\nGrosser Balkon\n5 min bis zur U Bahn Oskar-Helene-Heim'];;1;2015;;;;;;;
