2020-05-24 20:55:49.104710;Berlin;;ONE_YEAR_FREE;17425585;n;n;https://pictures.immobilienscout24.de/listings/519e6aa0-5173-462e-861c-2b528dd30f33-1364605499.jpg/ORIG/resize/118x118%3E/extent/118x118/format/jpg/quality/80;9;14.43;40 MBit/s;telekom_layer_magenta_l;über VDSL;1936;REGULAR;;14.43;117584490;no_information;y;true;MagentaZuhause L;n;Berlin;n;5;1;64;energy_consumption;7.95;56.52;Berlin;13359;refurbished;no_information;;false;100 MBit/s;no_information;"Soldiner Stra&szlig;e";n;https://padlock.link/ioml;https://padlock.link/ml;Soldiner_Straße;apartment;13359;2;185.4;n;2,active;true;Deutschland;schaufenster;100 MBit/s;wohnung_kauf;n;web,email,bank,music,dl-ul,game,sd,mltstr,hd,fast-ul-dl;true;002.01008164665;250000;profile0;2;true;n;showqualicontactform;n;n;Wedding_Wedding;13359SO64;2;Berlin;/expose/117584490;"['Sofort bezugsfrei:\nfür immer schön alt...und neu! \n\nWedding für Altbaufans:\n\n2012 wurde diese wunderschöne 2-Zimmerwohnung umfangreich saniert:\n\n- Neue Wasserleitung und Elektrik  \n- Böden abgeschliffen und neue Sockelleisten\n- Neues Badezimmer\n- Überabeitete Fenster und neue Türen\n\nIm zweiten Obergeschoss gelegen, bietet der Grundriss mit ca. 57 m2 Wohnfläche perfekte Räumlichkeiten: ein großzügiges Wohnzimmer mit Blick ins Grüne, ein ruhiges Schlafzimmer, ein Wannenbad mit Fenster und eine große Küche mit Platz für eine schöne Essecke.', 'Die sehr gut geschnittene Zweizimmer-Altbauwohnung befindet sich im zweiten Obergeschoss eines Berliner Altbaus und verfügt über folgende Ausstattungsmerkmale:\n\n- Tageslicht Badezimmer mit Badewanne\n- Einbauküche mit E-Geräten\n- Dielenfußboden\n- Möbel können übernommen werden\n- Terrazzo-Boden\n', 'Wohnen im neuen Weddinger Vorzeigekiez:\nWedding ist – erstmalig im 13. Jahrhundert urkundlich erwähnt – ein Ortsteil im Bezirk Berlin-Mitte. Uralt und doch sehr jung. Viele Studenten und Berufsanfänger entscheiden sich inzwischen für Wedding. Ist noch bezahlbar und die neue Stimmung stimmt. Der alte Soldinerkiez ist heute der neue Vorzeigekiez, gleich neben der Panke und nahe U-Bahnhof Osloer Straße. Hier spielen Polizisten mit den Kids Fußball, wirklich wahr! Entspannte Parkanlagen, viele heimische und multinationale Läden, in den kleinen Nebenstraßen großes Szenefeeling, eine optimale Verkehrsanbindung und fast mitten in Mitte. Dank der sehr guten Verkehrsanbindung gelangt man schnell überall hin, egal, ob City-West oder City-Ost. Gleich zwei U-Bahn- und drei S-Bahn-Stationen befinden sich in der Nähe – und wer durch die Stadt wandern will, nimmt den offiziellen ""Grünen Hauptweg"" durch das Berliner Stadtgebiet – den Pankeweg.\n']";;;266;;;;2;;true;;;
2020-05-24 20:55:49.512716;Berlin;floor_heating;;16736314;n;y;https://pictures.immobilienscout24.de/listings/fdef8751-334b-4088-88bb-4708c1af3253-1364208930.jpg/ORIG/resize/118x118%3E/extent/118x118/format/jpg/quality/80;5;10.29;;;;;;disabled;10.29;117517977;local_heating;n;true;;n;Berlin;n;5;;5;;4.13;41.8;Berlin;12527;first_time_use;sophisticated;;false;;underground_garage;Gaffelsteig;y;;;Gaffelsteig;apartment;12527;1;;n;2,active;;Deutschland;schaufenster;;wohnung_kauf;n;;false;002.01007321877;233000;profile0;1;true;y;;y;n;Grünau_Köpenick;87624 40;2;Berlin;/expose/117517977;['Wem der Trubel von Berlin-Mitte zum Wohnen nicht zusagt, findet in Grünau einen charmanten Rückzugsort. Hier, in einer der schönsten Gegenden Berlins, entwickelt BUWOG direkt am Ufer der Dahme ein Wohnquartier in bevorzugter Lage: 52° Nord.\n\n\nBaufeld REGATTAHOF\n\nDas Haus am Regattahof sowie die Gartenhäuser am Gaffelsteig 5 und 7 vereinen klassische Bauweise mit moderner, frischer Architektur. Die Fassaden sind teilweise mit einer Holzfassade aus Lärchenholz versehen, was eine besonders lockere, ansprechende Optik ergibt.\nIn der Mitte des Ensembles liegt der Gartenhof mit terrassierten Aufenthaltsbereichen. Er bietet einen privaten Spielplatz sowie die Möglichkeiten zum Urban Gardening.\n\nNehmen Sie Kurs auf Grünau und finden Sie die perfekte Eigentumswohnung im Regattahof – ob zur Kapitalanlage oder als neues Zuhause:\n\n- Mikro-Apartments mit 1 Zimmer – top für Anleger! (28-42 m²)\n- Klassische Eigentumswohnungen mit 2 bis 3 Zimmern (47-97 m²)\n- Optionaler Stellplatz in der Tiefgarage\n- Balkon, Terrasse oder Privatgarten zum grünen Innenhof\n- Nur wenige Schritte bis zum Dahme-Ufer', 'Mikro-Apartments zeichnen sich anders als klassische 1-Zimmer-Wohnungen durch eine intelligente Raumaufteilung aus, die sie deutlich größer wirken lässt. Diese Raumwunder eignen sich besonders gut als Zweitwohnsitz für  Berufstätige, als Studentenwohnung oder ganz einfach für Singles, die gerne mit „leichtem Gepäck“ leben.\n\nMikro-Apartments sind zudem ein ideales Investitionsobjekt für Kapitalanleger.\n\n- Barrierefrei\n- Flur mit Garderobe\n- Ca. 27 m² Wohn-/Schlafbereich mit offenem Koch-/Essbereich\n- Komfortables Duschbad\n- Abstellraum\n- Sonniger Balkon', 'Wasser, Architektur, Infrastruktur: Dieser Dreiklang macht Grünau besonders attraktiv für alle, die Hauptstadtnähe und Wohnen im Grünen schätzen. Auch im Trendbezirk Treptow-Köpenick ist der Berlin-Boom spürbar. Am Wissenschafts- und Wirtschaftsstandort Adlershof (WISTA) arbeiten und forschen über 25.000 Menschen. Ab 2019 wird diese Zahl durch den Berliner Standort der Allianz Deutschland AG weiter steigen. Und die neue Hochschule für Technik und Wirtschaft liegt auch nur 30 Minuten entfernt.\n\nBerlins wasser- und waldreichster Bezirk bietet jedoch nicht nur viele Jobs, sondern auch viel Natur und ein großes Freizeitangebot. Daher wird der Ortsteil Grünau immer beliebter. Hier, an der historischen Regattastrecke, liegt das Quartier 52° Nord mit dem Regattahof.', 'Wir sind für Sie da\nUnser Vertriebsteam ist auch aus dem sicheren Home-Office weiterhin für Sie erreichbar. Kommen Sie gerne auf uns zu für Ihren individuellen Beratungstermin.  Die Showrooms sind derzeit geschlossen – aber per Telefon und E-Mail stehen wir Ihnen gern zur Verfügung. Auch Reservierungen von Wohnungen sind unverändert möglich.\nJetzt Termin vereinbaren! \n\n\nInformationen zur BUWOG und zum Quartier 52° Nord erhalten Sie auch auf www.52grad-nord.de'];;;;;1;87624;3;true;;;;
2020-05-24 20:55:50.003021;Berlin;central_heating;ONE_YEAR_FREE;17228770;n;y;https://pictures.immobilienscout24.de/listings/d054eccc-c80f-4789-a52a-2fe9bf25f444-1364555352.jpg/ORIG/resize/118x118%3E/extent/118x118/format/jpg/quality/80;8;10.77;40 MBit/s;telekom_layer_magenta_l;über VDSL;1989;REGULAR;disabled;10.77;117577055;gas;n;false;MagentaZuhause L;y;Berlin;y;9;4;17;energy_consumption;5.67;72;Berlin;10119;modernized;no_information;;false;100 MBit/s;no_information;Almstadtstrasse;n;https://padlock.link/ioml;https://padlock.link/ml;Almstadtstrasse;roof_storey;10119;4;112.2;n;2,active;true;Deutschland;standard;100 MBit/s;wohnung_kauf;n;web,email,bank,music,dl-ul,game,sd,mltstr,hd,fast-ul-dl;true;002.01007994385;550000;profile0;4;true;y;;n;n;Mitte_Mitte;#01156;3;Berlin;/expose/117577055;['Die Ausstattung Ihrer Wohnung lässt nahezu keinen Wunsch offen und weist u.a. folgende Ausstattungsmerkmale auf:\n\n+ Erstbezug nach Sanierung\n+ großer Süd-West-Balkon\n+ 4 separate Zimmer\n+ separate Küche\n+ modernes Badezimmer mit Badewanne und sep. Dusche\n+ lichtdurchflutet\n+ neue ISO-Kunststofffenster z.T Velux\n+ neue Wärmeisolierung\n+ Fahrradstellplatz\n+ Keller', 'Seit dem Mauerfall ist Berlin-Mitte zum lebendigen und weltoffenen Zentrum der Hauptstadt geworden, wo das Herz der Millionenmetropole schlägt. Hier haben nicht nur namenhafte Unternehmen ihren Sitz in modernen Büros, auch die lebendige Start-up-Szene wird geprägt von der Vielfältigkeit, Kreativität und dem frischen Unternehmergeist der Hauptstadt. Sowohl sehr beliebt bei Touristen aber auch bei einheimischen Berlinern ist der Alexanderplatz mit dem wohl berühmtesten Wahrzeichen der Stadt, dem Fernsehturm sowie das Brandenburger Tor, der Potsdamer Platz oder die Prachtstraße „Unter den Linden“. Ob Shopping-Mall, Biosupermarkt, Espressobar, Nobelrestaurant oder Erlebnisgastronomie in Berlin-Mitte existiert ein schier unendliches Repertoire an Abendaktivitäten und Geschäften.', 'Alle Angaben stammen vom Verkäufer. Wir übernehmen hierfür keine Haftung.\n\nIhren Besichtigungstermin können Sie selbstverständlich individuell nach Ihren Wünschen mit uns vereinbaren. Zur Beantwortung Ihrer Fragen können Sie uns jederzeit kontaktieren.\n\nSie möchten Ihre Immobilie verkaufen?\n\nWir stehen Ihnen gerne bei allen Fragen und Anliegen beratend beiseite und treten dafür ein, dass vor allem\nSie profitieren. Nutzen Sie die positive Marktlage und unser geschultes Team, um den Höchstpreis zu erzielen. Gerne unterstützen wir Sie bei all Ihren Fragen und Anliegen rund um Ihre Immobilie. Ganz individuell gehen wir auf Ihre persönlichen Bedürfnisse ein, um Ihnen eine ehrliche und kompetente Beratung zu gewährleisten, denn Ihre Zufriedenheit ist unser Ziel.\n\nIhr IMMODO-Team'];;;230;;;;5;;;4;;
2020-05-24 20:55:50.376051;Berlin;combined_heat_and_power_plant;;430561;y;y;https://pictures.immobilienscout24.de/listings/445361a0-1561-4933-b4ba-6e10d7b707c0-1364576481.jpg/ORIG/resize/118x118%3E/extent/118x118/format/jpg/quality/80;5;10.62;;;;2022;;disabled;10.62;117579275;;n;false;;y;Berlin;y;8;9;no_information;;5.93;74.6;Berlin;13187;first_time_use;sophisticated;;false;;underground_garage;no_information;y;;;no_information;apartment;13187;2;;n;2,active;;Deutschland;top;;wohnung_kauf;n;;false;001.430561;469980;profile0;2;true;n;showqualicontactform;y;n;Pankow_Pankow;1.4.12;3;Berlin;/expose/117579275;['Es entstehen im Neubauprojekt NEUE FLORAHÖFE in 3 Häusern insgesamt 30 Eigentumswohnungen sowie drei Gewerbeeinheiten (in Haus 1) in unmittelbarer Umgebung der Florastraße in Berlin-Pankow. Von 1 bis 6 Zimmer-Wohnungen alles vertreten, vom Mikro-Apartment bis zum geräumigen Penthouse. Alle Einheiten mit Balkon und / oder Terrasse. Begrünte Außenanlagen, Fahrradständer, 3 Spielplätze. Modernes Fassadenkonzept, Aufzug, Kellerabteil, Tiefgaragen-Stellplatz auf Wunsch.\n\nNew building project in 3 houses with the total of 30 condominium in the immediate vicinity of Florastraße in Berlin-Pankow. The residential units are designed to satisfy every need: from 1 room to 6 room apartments in different types, from micro apartment to spacious penthouse. All units have balconies and / or a terrace. Landscaped internal courtyard including three outdoor playgrounds and bicycle stands are available. All three houses are equipped with lifts. Cellars are provided for all apartments. The facade concept is modern and future-oriented. Underground car parking available on request.', 'Fußbodenheizung, Premium-Beläge wie Parkett und Fliesen, elegante und moderne Bad-Armaturen\n\nFloor heating, premium flooring as parquet and tiles, elegant and contemporary bathroom tapware', 'Zwischen Rathaus Pankow und Florastraße, Bürgerpark und S-Bahnhof Wollankstraße gelegen, im Herzen Pankows. Zahlreiche Schulen und Kindertagestätte sind fußläufig zu erreichen. Ein attraktives Nahverkehrsangebot bestehend aus dem S-Bahnhof Wollankstraße, dem S- und U-Bahnhof Pankow und einer Bandbreite an Bus- und Straßenbahnlinien ist ein weiterer ausschlaggebender Bestandteil der ausgewogenen Infrastruktur.\n\nBetween town hall and Florastraße, Bürgerpark and railway station Wollankstraße located, in the heart of Pankow. Many schools and kindergarden are within walking distance. Attractive and efficient public transportation choices, e.g. railway and underground stations such as S-Bahnhof Wollankstraße, S- and U-Bahnhof Pankow and a big range of bus and tram lines are essentially for good public traffic connections and show the balanced infrastructure of the Florastraße and its surroundings.', 'Baubeginn wird in Kürze sein. Eine Baufertigstellung ist bis Ende 2022 vorgesehen.\n\nStart of construction planned shortly. Building completion planned for the end of 2022'];74.6;22;;;;70372;4;true;;5;;
2020-05-24 20:55:50.741207;Berlin;combined_heat_and_power_plant;;430561;y;y;https://pictures.immobilienscout24.de/listings/1a447440-cbf3-47ce-871a-c4ae4c5bb257-1364582805.jpg/ORIG/resize/118x118%3E/extent/118x118/format/jpg/quality/80;5;10.62;;;;2022;;disabled;10.62;117580236;;n;false;;y;Berlin;y;8;9;no_information;;5.93;78;Berlin;13187;first_time_use;sophisticated;;false;;underground_garage;no_information;y;;;no_information;apartment;13187;3;;n;2,active;;Deutschland;top;;wohnung_kauf;n;;false;001.430561;436800;profile0;3;true;n;showqualicontactform;y;n;Pankow_Pankow;1.1.04;3;Berlin;/expose/117580236;['Es entstehen im Neubauprojekt NEUE FLORAHÖFE in 3 Häusern insgesamt 30 Eigentumswohnungen sowie drei Gewerbeeinheiten (in Haus 1) in unmittelbarer Umgebung der Florastraße in Berlin-Pankow. Von 1 bis 6 Zimmer-Wohnungen alles vertreten, vom Mikro-Apartment bis zum geräumigen Penthouse. Alle Einheiten mit Balkon und / oder Terrasse. Begrünte Außenanlagen, Fahrradständer, 3 Spielplätze. Modernes Fassadenkonzept, Aufzug, Kellerabteil, Tiefgaragen-Stellplatz auf Wunsch.\n\nNew building project in 3 houses with the total of 30 condominium in the immediate vicinity of Florastraße in Berlin-Pankow. The residential units are designed to satisfy every need: from 1 room to 6 room apartments in different types, from micro apartment to spacious penthouse. All units have balconies and / or a terrace. Landscaped internal courtyard including three outdoor playgrounds and bicycle stands are available. All three houses are equipped with lifts. Cellars are provided for all apartments. The facade concept is modern and future-oriented. Underground car parking available on request.', 'Fußbodenheizung, Premium-Beläge wie Parkett und Fliesen, elegante und moderne Bad-Armaturen\n\nFloor heating, premium flooring as parquet and tiles, elegant and contemporary bathroom tapware', 'Zwischen Rathaus Pankow und Florastraße, Bürgerpark und S-Bahnhof Wollankstraße gelegen, im Herzen Pankows. Zahlreiche Schulen und Kindertagestätte sind fußläufig zu erreichen. Ein attraktives Nahverkehrsangebot bestehend aus dem S-Bahnhof Wollankstraße, dem S- und U-Bahnhof Pankow und einer Bandbreite an Bus- und Straßenbahnlinien ist ein weiterer ausschlaggebender Bestandteil der ausgewogenen Infrastruktur.\n\nBetween town hall and Florastraße, Bürgerpark and railway station Wollankstraße located, in the heart of Pankow. Many schools and kindergarden are within walking distance. Attractive and efficient public transportation choices, e.g. railway and underground stations such as S-Bahnhof Wollankstraße, S- and U-Bahnhof Pankow and a big range of bus and tram lines are essentially for good public traffic connections and show the balanced infrastructure of the Florastraße and its surroundings.', 'Baubeginn wird in Kürze sein. Eine Baufertigstellung ist bis Ende 2022 vorgesehen.\n\nStart of construction planned shortly. Building completion planned for the end of 2022'];78;22;;;;70372;1;true;;4;;
2020-05-24 20:55:51.104203;Berlin;no_information;;18347473;n;y;https://pictures.immobilienscout24.de/listings/c2351491-1989-4cb6-ade8-4c001ae668ef-1364196907.jpg/ORIG/resize/118x118%3E/extent/118x118/format/jpg/quality/80;5;10.99;;;;;;;10.99;117516190;;n;true;;n;Berlin;n;7;;4-8;;5.65;67;Berlin;13585;first_time_use;sophisticated;;false;;underground_garage;"Parkstra&szlig;e";y;;;Parkstraße;apartment;13585;2;;n;2,active;;Deutschland;schaufenster;;wohnung_kauf;n;;false;002.01009147967;359000;profile0;2;true;n;showqualicontactform;y;n;Spandau_Spandau;89679_H3 _063;3;Berlin;/expose/117516190;['Das Wohnensemble HAVELKIESEL erschließt Spandaus schönste Seiten.\n\nAls jüngster Teil des Wohnquartiers BUWOG SPEICHERBALLETT ist die Anlage HAVELKIESEL alles außer gewöhnlich: Die drei modernen Wohngebäude, eines von ihnen sanft abgerundet wie ein Kieselstein – daher der Name des Ensembles –, ruhen in einzigartiger Lage direkt am Flusslauf der Havel. Die Mehrzahl der 100 Eigentumswohnungen gewährt einen direkten Blick auf das Wasser und die vorbeiziehenden Boote – eine Szenerie, die einlädt, allein oder in gemütlicher Runde auf Balkon oder Terrasse den Stress des Alltags abzuschütteln und den Tag ausklingen zu lassen. \n\nSo naturnah und entschleunigt Sie im HAVELKIESEL auch leben, das Zentrum Spandaus, mit seiner historischen Altstadt und dem ICE-Bahnhof, ist nur wenige Minuten entfernt und die Verkehrsverbindungen in die Berliner City sind optimal. Auch Ihre Kinder werden sich hier wohlfühlen – ob auf den Spielplätzen oder im idyllischen, begrünten Innenhof.\n\nQuartiers-Highlights:\n\n- Direkte Wasserlage an der Havel, vis-à-vis der Insel Eiswerder\n- Quartierseigene Kita und Spielplätze\n- Autofreies Wohnquartier und innovatives Mobilitätskonzept\n- Nachhaltiges Wassermanagement\n- Ressourcenschonendes Energiekonzept\n- Barrierefrei zugängliche Außenbereiche mit Sitz- und Begegnungsflächen', 'Highlights dieser Wohnung\n\n- Barrierefrei\n- Großzügiger Wohn-/Koch-/Essbereich\n- Gut geschnittenes Schlafzimmer\n- Modernes Duschbad\n- Balkon in Westausrichtung\n\nWeitere Ausstattungs-Details\n\n- Lichte Räume mit Deckenhöhe bis ca. 2,75 m\n- Bodentiefe Fenster\n- Eichenparkettboden\n- Deckenheizungssystem mit Kühlfunktion\n- Hochwertige Fliesen und Sanitärprodukte von Villeroy & Boch\n- Digitale Medienversorgung\n- Schön gestalteter, begrünter Hof mit Sitzgelegenheiten und Begegnungsflächen\n- Photovoltaikanlage\n- Tiefgarage mit E-Auto-Ladeplätzen\n- Tiefgaragenstellplatz, zzgl. ab 29.500,00 €', 'Als Teil des neuen Wohlfühlquartiers BUWOG SPEICHERBALLETT entsteht das einzigartige Wohnensemble HAVELKIESEL: direkt am Wasser und von Grün umgeben. Vor Ihnen liegt die idyllische Spandauer Havel, vis-à-vis die Insel Eiswerder, ein Stückchen weiter die Zitadelle Spandau, eine der besterhaltenen Renaissancefestungen Europas, wo vielfältige Kulturveranstaltungen wie z.B. Konzerte, Ausstellungen und Familienevents stattfinden. Der weitläufige Spandauer Forst ist nahe gelegen, und wenn Sie wollen, können Sie die Uferpromenade entlang bis zur nächsten Badestelle flanieren oder in den nahe gelegenen Parks joggen. Nicht zu vergessen: Vor Ihrer Haustür liegt der Havel-Radweg, einer der schönsten Flussradwege Deutschlands.\n\nDie grüne Wasserlage ist nur die eine Seite. Sie profitieren zugleich von der Nähe zum Stadtzentrum. Zu Shopping, Gastronomie und Kultur in der Fußgängerzone der Spandauer Altstadt oder den Spandau Arcaden sind es wenige Minuten, in einer halben Stunde kommen Sie nach Berlin-Mitte oder in die City West. Und soll es weiter weg gehen, dann sind Sie im Handumdrehen am ICE-Bahnhof Spandau. Von dort fährt auch der Airport-Express ohne Umsteigen zum Flughafen Schönefeld/BER. Die optimale Infrastruktur mit Kitas, Schulen, Ärzten, Geschäften und allem, was man für den täglichen Bedarf braucht, macht das BUWOG SPEICHERBALLETT zu einem perfekten Zuhause.\n\nBESTE ANBINDUNG\n\n- Nah an der City: ca. 30 Minuten bis Bahnhof Zoologischer Garten, Kurfürstendamm und Berlin-Mitte\n- Ca. 15 Minuten Spaziergang zur Altstadt Spandau\n- Perfekt vernetzt ab Bahnhof Spandau mit ICE-Anschluss\n- Ca. 15 Minuten bis zur Autobahn A100', 'Wir sind für Sie da!\n\nUnser Vertriebsteam ist auch aus dem sicheren Home-Office weiterhin für Sie erreichbar. Kommen Sie gerne auf uns zu für Ihren individuellen Beratungstermin. Die Showrooms sind derzeit geschlossen – aber per Telefon und E-Mail stehen wir Ihnen gern zur Verfügung. Auch Reservierungen von Wohnungen sind unverändert möglich.\n\nJetzt Termin vereinbaren!'];;;;;;89679;2;true;;;;
2020-05-24 20:55:51.460518;Berlin;no_information;ONE_YEAR_FREE;174522;n;n;https://pictures.immobilienscout24.de/listings/d96846c3-8ac3-4f2d-8c63-53c8cc20780a-1364602963.jpg/ORIG/resize/118x118%3E/extent/118x118/format/jpg/quality/80;14;10.77;40 MBit/s;telekom_layer_magenta_l;über Glasfaser;;REGULAR;disabled;10.77;117583900;;y;true;MagentaZuhause L;y;Berlin;n;8;;no_information;;5.67;80;Berlin;10179;no_information;no_information;;false;100 MBit/s;no_information;no_information;y;https://padlock.link/ioml;https://padlock.link/ml;no_information;apartment;10179;2;;n;2,active;true;Deutschland;top;100 MBit/s;wohnung_kauf;n;web,email,bank,music,dl-ul,game,sd,mltstr,hd,fast-ul-dl;true;001.174522;465000;profile0;2;true;n;showqualicontactform;n;n;Mitte_Mitte;117583900;3;Berlin;/expose/117583900;['Großzügig, repräsentativ, stilvoll und sehr gepflegt, diese Wohnung lässt sich mit vielen attraktiven Eigenschaften beschreiben. Das prächtige Gebäude und die Wohnung wurden im Jahr 2000 nach Denkmalschutzvorgaben von Grund auf saniert. Viele typische Altbauelemente, wie z.B. charaktervolle Parkettböden inklusive Trittschallschutz, hohe Stuckdecken, Doppelflügeltüren sowie Doppelkastenfenster aus Holz und Messingbeschläge an Türen und Fenstern, erzeugen ein ansprechendes und äußerst behagliches Ambiente. Die zwei -salonartigen Zimmer sind mit einer eleganten Flügeltür intern verbunden. Die originale Eingangstür wurde aufgearbeitet und innen mit einer zusätzlichen Sicherheitsplatte samt einem Sicherheitsschloss ausgestattet.\nDie Küche hat einen französischen Balkon zum Innenhof sowie moderne Schrank und Geräteeinbauten. Neben den Schränken mit Holzfronten präsentieren sich Geräte von Siemens, wie z.B. ein Kühlschrank, Cerankochfeld mit Dunstabzugshaube, Backofen und eine Spülmaschine. Ebenfalls sehr sympathisch ist das taghelle und klassisch weiß geflieste Bad, das u.a. eine separate Dusche, Wanne und einen Waschmaschinenanschluss enthält.\nAn eines der Zimmer schließen ein begehbarer Kleiderschrank und ein Abstellraum an. Weitere Abstellfläche steht im zur Wohnung gehörenden Kellerabteil zur Verfügung.\nDie Raumwärme- und Warmwasserversorgung erfolgt durch eine Gaszentralheizung. Nochmals positiv erwähnenswert ist der Personenaufzug. Dank des Anwohnerparkens lässt sich einfach ein Pkw-Stellplatz im Freien finden.\nDiese Wohnung brilliert mit einer komfortablen Großzügigkeit und wunderschönen Ausstattungen in einer mehrfach attraktiven Lage.\n\nEin Energieausweis ist nicht vorhanden.', 'Sie möchten den Marktwert Ihrer Immobilie wissen oder Ihre Immobilie verkaufen? Wir sind seit 1995 erfolgreich im Verkauf von Immobilien in Berlin, Potsdam und Umgebung tätig. Unsere exzellenten Eigentümerbewertungen sprechen für sich.\n\n•\tOftmals haben wir schon den richtigen Käufer für Ihre Immobilie in unserer Kartei\n•\tWir sind Bellevue Best Property Agent und Mitglied in den Verbänden IVD & FIABCI\n•\tWir benötigen keinen schriftlichen Alleinauftrag\n•\tKosten entstehen Ihnen bei uns keine\n•\tUnsere Spezialisten stehen Ihnen gerne für ein erstes – für Sie unverbindliches - Gespräch zur Verfügung\n\nWir freuen uns über Ihre Kontaktaufnahme unter einkauf@immoberlin.de oder (030) 895 72 20.\nBitte besuchen Sie auch unsere Website: \nhttps://www.immoberlin.de'];;;;;;;;;;;;
