timestamp;obj_regio1;obj_heatingType;obj_cId;obj_newlyConst;obj_balcony;obj_picture;obj_picturecount;obj_pricetrend;obj_yearConstructed;ga_cd_developer_virtualreality;obj_galleryAd;obj_project_id;obj_pricetrendbuy;obj_scoutId;obj_hasKitchen;obj_ExclusiveExpose;obj_courtage;geo_bln;obj_cellar;obj_purchasePriceRange;obj_yearConstructedRange;obj_houseNumber;obj_pricetrendrent;obj_livingSpace;geo_krs;obj_zipCode;obj_condition;obj_interiorQual;ga_cd_cxp_historicallisting;obj_parkingSpace;obj_street;obj_lift;obj_streetPlain;obj_typeOfFlat;geo_plz;obj_noRooms;obj_assistedLiving;obj_groupnumber;obj_ityp;geo_land;ga_cd_via;obj_immotype;obj_rented;obj_floor;obj_nbp;obj_telekomInternetProductAvailable;obj_cwId;obj_purchasePrice;ga_cd_application_requirements;obj_numberOfFloors;obj_noRoomsRange;ga_cd_maillead_default_shown;obj_garden;evt_count_pm_sig;obj_barrierFree;obj_international;obj_regio3;obj_objectnumber;obj_livingSpaceRange;obj_regio2;URL;beschreibung;obj_firingTypes;obj_rentSubsidy;obj_energyType;obj_thermalChar;ga_cd_via_qualified;obj_telekomTvOffer;obj_telekomUploadSpeed;obj_telekomTrackingGroup;obj_telekomInternetTechnology;obj_telekomInternetType;obj_telekomInternetProductName;obj_energyEfficiencyClass;obj_telekomDownloadSpeed;obj_telekomInternetUrlMobile;obj_telekomInternetUrl;obj_telekomHdTelephone;obj_telekomInternet;obj_telekomInternetServices;obj_telekomHybridUploadSpeed;obj_noParkSpaces;obj_telekomHybridDownloadSpeed;obj_usableArea;obj_lastRefurbish
2020-05-24 20:59:05.462086;Berlin;floor_heating;15347;y;y;https://pictures.immobilienscout24.de/listings/4467b8bb-becb-45b8-9bcd-ea8963d20fff-1362977142.jpg/ORIG/resize/118x118%3E/extent/118x118/format/jpg/quality/80;13;10.7;2021;true;disabled;75109;10.7;108403233;n;true;n;Berlin;y;8;9;31/33;5.51;128;Berlin;10318;first_time_use;sophisticated;false;underground_garage;Blockdammweg;y;Blockdammweg;ground_floor;10318;5;n;7000200;2,active;Deutschland;premium;wohnung_kauf;n;0;true;false;001.15347;476900;profile0;4;5;true;n;showqualicontactform;n;n;Karlshorst_Lichtenberg;7000200-04.I.104;6;Berlin;/expose/108403233;['Hier bekommt jeder sein eingenes Reich\n\nSie haben drei Kinder und brauchen 4 Schlafzimmer? Kein Problem. In dieser 5 Zimmer-Wohnung bekommt jedes Ihrer Kids ein eigenes Reich. Natürlich bietet sich ein Zimmer auch perfekt als Arbeits- oder Gästezimmer an. Eben ganz nach Ihren Bedürfnissen. Die offene Küche, 2 Bäder und ein praktischer Abstellraum mit Platz für die Waschmaschine erleichtern sicher Ihren Alltag. Großes Plus der Wohnung ist ,dass sowohl Wanne als auch eine bodengleiche Dusche vorhanden sind.', '- Loggia\n- Abstellraum\n- Fußbodenheizung\n- gefliestes Bad\n- Keller\n- Fahrradkeller\n- Aufzug', 'Ihre Eigentumswohnung ist einzigartig und doch wichtiger Teil des Ganzen. Für die Parkstadt haben sich vier renommierte\nArchitekturbüros ins Zeug gelegt und sich bei ihren Planungen stark an der Rationalen Architektur orientiert. Denn die sieben\nWohnblöcke und sieben Stadtvillen spielen mit Fassadenflächen und Struktur, mit Backstein und farbigem Putz. Doch eine rationale Stadt ist unter Experten vor allem eines: eine schöne Stadt.', 'Besuchen Sie uns im Infobüro im Blockdammweg 30 in 10318 Berlin.\n\nDi – Do\t14:00 – 16:00 Uhr\nSa + So\t13:00 – 16:00 Uhr\n\nIhre und unsere Gesundheit ist uns wichtig! Für die kommende Zeit haben wir für die Vor-Ort-Beratungen viele Gesundheitsvorkehrungen getroffen und bitten um Beachtung und Verständnis. Informieren Sie sich bitte zu unseren Maßnahmen auf bonava.de/bleib-gesund'];;;;;;;;;;;;;;;;;;;;;;;
2020-05-24 20:59:05.827794;Berlin;;391483;n;n;https://pictures.immobilienscout24.de/listings/c8153390-7362-4f84-ad3c-98aa85bd1b96-1361739003.jpg/ORIG/resize/118x118%3E/extent/118x118/format/jpg/quality/80;7;10.76;1997;;;;10.76;117066315;n;false;y;Berlin;n;6;5;no_information;6.07;83;Berlin;13595;well_kept;no_information;false;duplex;no_information;n;no_information;apartment;13595;3;n;;2,active;Deutschland;top;wohnung_kauf;n;4;;;001.391483;295000;profile0;5;3;true;n;showqualicontactform;n;n;Spandau_Spandau;Wilhelm2;4;Berlin;/expose/117066315;"['Die hochwertig ausgestattete Eigentumswohnung befindet sich im 4. Obergeschoss rechts eines attraktiven Wohn- und Geschäftshauses in Eckbebauung, welches ca. 1997 erbaut wurde und mit neusten wärmetechni-schen Maßgaben versehen ist. Beheizt wird die Wohnanlage mit einer Gas-Brennwertechnik. Mit seinen geraden Linien und ansprechender Farbgestaltung hebt sich der Neubau elegant aus seiner Nachbarschaft im Herzen Spandaus hervor.\n\nDas moderne Eckhaus ist mit einem Personenaufzug, einer Tiefgarage und Sicherheitstechnik ausgestattet. Über das Erdgeschoss erstreckt sich ein Fitnessstudio für Frauenfitness und Gesundheitssport. Die Wohnungen sind über das gepflegte und moderne Treppenhaus oder bequem mit dem Personenaufzug zu erreichen, welcher auch bis in das Kellergeschoss führt. Insgesamt befindet sich das Gemeinschaftseigentum mit kleinem Innenhof in einem sehr gepflegten Zustand. Die Eingangsbereiche im Hausflur und zur Tiefgarageneinfahrt werden videoüberwacht und sorgen bei den Bewohnern für ein hohes Sicherheitsgefühl. \n\n', 'Die Wohnfläche beträgt ca. 83 m² und umfasst u. a. drei lichtdurchflutete Wohnräume und einen tagesbelichteten Flur mit offen gestalteter Küche im amerikanischen Stil. Des Weiteren verfügt die Wohnung über ein weiß gefliestes Wannenbad mit gelber Mosaikleiste im oberen Drittel, Hänge-WC, Handwaschbecken, Handtuchhalter, Waschmaschinenanschluss sowie einer in der Wand integrierten Ablagefläche für Kosmetika, Handtücher etc. Ein großer zur ruhigen Seitenstraße gelegener Balkon ist vom Wohnzimmer aus zugänglich.\n\nDer Grundriss der Wohnung ist praktisch und zeitgemäß gestaltet. Die offene Küche im Herzen der Wohnung befindet sich hinter einer Leichtbauwand, die eine optische Trennung zum Flur schafft. Die drei Wohnräume und das Badezimmer gehen jeweils vom Flur ab. Im Eingangsbereich der Wohnung wurde die Nische rechts von der Wohnungseingangstür sinnvoll mit Ablagemöglichkeiten genutzt. In allen Wohnräumen sind hochwertige Parkettböden mit Fußbodenheizung verbaut. Die Räume sind aufgrund der modernen, überwiegend nahezu bodentiefen Holzfenster lichtdurchflutet und schaffen ein offenes und freundliches Wohnambiente.\n\nDie Wohnung ist seit dem 01. Dezember 2015 für monatlich EUR 915,- brutto-warm (Kaltmiete EUR 690,- p.m.) vermietet.\n\nDas Wohngeld beträgt gem. Wirtschaftsplan 2020 EUR 248 zzgl. EUR 42,- Instandhaltungsrücklage.\n\nZu der Wohnung gehören ein Kellerraum sowie ein Duplex-Garagen-Einstellplatz (Doppelparker). Bei Bedarf besteht die Möglichkeit einen weiteren Garagen-Einstellplatz zu erwerben – Details auf Anfrage. \n', 'Die lichtdurchflutete und moderne Eigentumswohnung liegt zentral zwischen zwei beliebten Parkanlagen und einem idyllischem See, im historischen Ortsteil Wilhelmstadt des Berliner Bezirks Spandau. Dieser Ortsteil verfügt über eine gut ausgebaute Infrastruktur und ist auch für Naherholungsuchende ein interessantes Ziel, denn zahlreiche Grünanlagen und Wasserflächen ergänzen die Umgebung. So lädt auch der entlang der Kanäle gelegene landwirtschaftlich reizvolle Ort ""Klein Venedig"" zu ausgiebigen Spaziergängen ein. Die Lage bietet die Vorzüge grünen Wohnens in Berlin mit einer zentralen, verkehrs- sowie einkaufsgünstigen Lage.\n\nAn der von diversen Geschäften des täglichen Bedarfs geprägten Straße und unweit der Spandauer Arkaden gelegen, befindet sich die Wohnung in verkehrsgünstiger Lage. Der bekannte Kurfürstendamm mit seinen hochwertigen Geschäften und Restaurants ist in ca. 15 Autominuten erreichbar. Gute Anbindungen an öffentli-che Verkehrsmittel mit den umliegenden Busanbindungen sind gegeben. Eine Kindertagesstätte befindet sich fußläufig in der umliegenden Seitenstraße.\n\nDas im Jahr 2015 sanierte Schwimmbad an der Gatower Straße sowie die studentischen Bars am Sportplatz Wilhelmstraße sind schnell zu erreichen. Mit dem Südpark und Ortslagen wie Weinmeisterhöhe und Pichelsdorf verfügt Wilhelmstadt über wassernahe Gebiete mit hohem Erholungswert im Süden. Idyllische Grundstücke entdeckt man am Havelufer und an der Scharfen Lanke. Diese Gegend ist vor allem für ihre attraktiven Villen und Yachtklubs bekannt.\n']";gas;248;energy_consumption;71;;;;;;;;;;;;;;;;;;;
2020-05-24 20:59:06.208113;Berlin;;190449;n;n;https://pictures.immobilienscout24.de/listings/24a56dea-c344-4d95-8f26-dfe5f650873b-1361710224.jpg/ORIG/resize/118x118%3E/extent/118x118/format/jpg/quality/80;23;16.53;1894;;disabled;;16.53;117064049;n;false;y;Berlin;n;9;1;no_information;9.26;108;Berlin;12053;refurbished;no_information;false;no_information;no_information;y;no_information;ground_floor;12053;3;n;;2,active;Deutschland;premium;wohnung_kauf;n;;;true;001.190449;560000;profile0;1;3;true;n;;n;n;Neukölln_Neukölln;Altbauperle;5;Berlin;/expose/117064049;['Das wunderschöne Gründerzeitgebäude wurde 2013 neu saniert und empfängt seine Besucher mit einer opulenten Fassade und einem herrschaftlichen Eingangsbereich im Stil des Neobarock.\nDirekt von hier aus liegt links der Eingang zur Wohnung. Durch eine breite Flügeltür gelangt man in den begrünten und lichtdurchfluteten Innenhof.\nDie Wohnung wurde 2013 ebenfalls saniert.\nEs wurden eine neue Küche und zwei Bäder eingebaut. Die Küche wurde 2014 komplett neu eingebaut und lässt keine Wünsche offen. Sie besitzt einen modernen Herd mit Ceranfeldern und Dunstabzugshaube, einen Ofen und großzügige Einbauschränke. Der Boden ist hier mit großen grauen Fliesen belegt. \nDer große und fast quadratische Wohnraum gibt Ihnen sehr viel Gestaltungsspielraum. Wie in der ganzen Wohnung wurde auch hier ein Boden mit breiten Dielen aus Eichenholz verlegt.\nDie Wohnung ist perfekt geeignet für Paare oder eine Familie mit einem Kind.', '- 2013 saniert\n- zwei Bäder\n- Küche\n- Abstellraum\n- Terrasse mit Gartenzugang', 'Neukölln ist ein Stadtteil im stetigen Wandel, ein kultureller und sozioökonomischer Schmelztiegel. Wer sich durch Neukölln bewegt, durchläuft alle gesellschaftlichen Schichten Berlins. Dieses besondere Flair zieht mittlerweile viele Berlin-Touristen an. So gibt es hier türkische Supermärkte neben hippen Szene-Läden, ruhige Wohnstraßen neben quirligen Einkaufscentern. In nur 15 Minuten ist das Tempelhofer Feld zu erreichen. Hier scheinen Weite und Freiheit grenzenlos zu sein. Seit der Öffnung des Tempelhofer Feldes im Jahr 2010 ist Berlin um eine Besonderheit reicher – eine der größten innerstädtischen Freiflächen der Welt. Wo früher Flugzeuge starteten, gibt es nun über 300 Hektar grünen Freiraum zum Skaten, Schlendern, Gärtnern, Picknicken, Vogelbeobachten, Kite-Surfen und Vielem mehr.'];district_heating;;energy_required;94.4;true;ONE_YEAR_FREE;40 MBit/s;telekom_layer_magenta_l;über VDSL;REGULAR;MagentaZuhause L;C;100 MBit/s;https://padlock.link/ioml;https://padlock.link/ml;true;100 MBit/s;web,email,bank,music,dl-ul,game,sd,mltstr,hd,fast-ul-dl;;;;;
2020-05-24 20:59:06.697321;Berlin;central_heating;16123617;n;n;https://pictures.immobilienscout24.de/listings/3e75c1d1-c458-4050-b320-206fc4ee839b-1354162030.jpg/ORIG/resize/118x118%3E/extent/118x118/format/jpg/quality/80;8;15.23;2018;;disabled;72409;15.23;105297597;n;true;n;Berlin;y;6;9;45-46;8.89;37;Berlin;10627;first_time_use;sophisticated;false;underground_garage;"Schillerstra&szlig;e";y;Schillerstraße;ground_floor;10627;1;n;;2,active;Deutschland;schaufenster;wohnung_kauf;n;;true;true;002.01006554579;291000;profile0;6;1;true;y;showqualicontactform;y;n;Charlottenburg_Charlottenburg;DCBER3757_3.02;1;Berlin;/expose/105297597;['Das neue 6-geschossige Wohnensemble CARTE BLANCHE in Berlin-Charlottenburg bietet 80 Wohneinheiten und eine Gewerbeeinheit nebst Tiefgarage. Die zwischen Schillerstraße und Rückertstraße entstehende Eckbebauung verbindet eine klassisch-elegante Formensprache mit nachgefragten Wohnformen. Dazu gehören 1- bis 2-Zimmer-Mikro-Apartments sowie 3-Zimmer-Einheiten bis hin zur Penthouse-Wohnung mit 4 Zimmern. Hier findet sich für die unterschiedlichen Ansprüche von Singles und Studenten, Paaren und Familien genau die richtige Lösung. Mit Dachgarten, der Dachterrasse und dem begrünten Innenhof entsteht zusätzlicher Freiraum zur Entfaltung, während ein Concierge-Service Zeit für die wichtigen Dinge des Lebens spart. Eine Teeküche steht für die Hausgemeinschaft im Innenhofbereich zur Verfügung.\nAuch wenn sich die Wohnungen in der Größe unterscheiden, folgt die Ausstattung überall dem gleichen modernen Standard. In den Wohnräumen und Dielen ist Echtholz-Parkett verlegt. In allen Wohnräumen sorgt eine Fußbodenheizung für behagliche Temperaturen und schafft durch den Verzicht auf Heizkörper mehr Platz und Flexibilität bei der Möblierung. Im Zusammenspiel mit dem außenliegenden, elektrisch betriebenen Sonnenschutz ist ganzjährig eine angenehme Temperierung sichergestellt. In den Bädern komplettieren Fliesen von Villeroy & Boch, Sanitärkeramik von Keramag und Armaturen von Grohe die moderne Ausstattung der Wohnungen.', '• PROVISIONSFREIES ANGEBOT für den Käufer\n• 1 - 4 Zimmer-Wohnungen mit Größen von ca. 30 m² bis ca. 125 m² \n• Erdgeschosswohnungen zum Innenhof mit Privatgarten\n• Hochwertige Armaturen\n• Parkettfußboden in der Holzart Eiche\n• Fußbodenheizung \n• Deckenhöhe ca. 2,77 - 2,87 Meter\n• Teilweise Markisen oder Markisoletten als Sonnenschutz\n• Fast jede Wohnung mit Balkon oder Terrasse und eine Gemeinschafts-Dachterrasse\n• Barrierefreie Zugänge\n• Räumlichkeiten für den Concierge-Service\n• Videogegensprechanlage \n• Personenaufzug\n• Raum zur gemeinschaftlichen Nutzung im EG mit kleiner Küche und WC\n• Keller- & Kinderwagenräume im Untergeschoss\n• 160 Fahrradstellplätze\n• Tiefgarage mit 40 PKW-Stellplätzen (optional, Preise ab 38.000 EUR), auf Wunsch mit Elektroanschluss (kostenpflichtig)', 'Heute ist Charlottenburg eines der begehrtesten Viertel Berlins. Die Mietpreise, gerade in Verbindung mit kompakten Wohnungsgrößen, sind auf hohem Niveau stabil, der Weg in die Natur ist dank des nahen Grunewalds und des Großen Tiergartens nicht weit. Mit dem Ku’damm führt einer der bekanntesten Shopping-Boulevards der Welt durch das Viertel, auf dem Touristen neben Einheimischen flanieren. Unbeirrt von diesem Trubel entfaltet sich in den Seitenstraßen mit ihren großbürgerlichen Bauten eine ruhige Atmosphäre. Rund um die Kantstraße und den Savignyplatz locken unzählige Restaurants mit kulinarischer Vielfalt. Es ist diese Mischung aus Gelassenheit und vibrierendem Leben, die den besonderen Charme von Charlottenburg ausmacht.\nFür den Berliner hat sein Kiez nichts mit Orts- oder Verwaltungsgrenzen zu tun, sondern mit einer Umgebung, in der sich alles findet, was zum Leben dazugehört – zum guten Leben, wohlgemerkt. CARTE BLANCHE hat mit seiner Lage ungleich mehr zu bieten. Nur einen Steinwurf entfernt liegen die Wilmersdorfer Straße und die Wilmersdorfer Arcaden mit ihren vielen Geschäften. Eine umfassende Revitalisierung der Wilmersdorfer Arcaden ab Mitte 2018 bringt mit Maßnahmen wie einem neuen Design- und Gastronomiekonzept den Erlebnischarakter noch stärker zur Geltung. Mehrere Restaurants in der direkten Umgebung, von der italienischen bis zur veganen Küche von Attila Hildmann, bieten genug Auswahl, um den Abend nach einem anstrengenden Arbeitstag entspannt ausklingen zu lassen.', 'Weitere Informationen sowie ein Projektfilm finden Sie unter: www.carteblanche-berlin.de\n\n+++Haftungsausschuss+++\nAlle Angaben dienen nur der Information und stellen kein vertragliches\nAngebot dar. Die in den Grundrissen und Visualisierungen abgebildeten Ausstattungsgegenstände\n(Küchen, Möbel etc.) sind nicht im Leistungsumfang enthalten. Eine Gewähr\nfür die Richtigkeit und Vollständigkeit der Informationen bzw. für die Maßstäblichkeit\nder Abbildungen wird nicht übernommen. Das Bildmaterial dient lediglich der\nvorläufigen Illustration des Vorhabens und möglicher Ausstattungsvarianten, die von\ndem angebotenen Leistungsumfang abweichen können. Jegliche Abweichung in einem\nspäteren Planungsstadium bleibt ausdrücklich vorbehalten. Maßgeblich sind allein die\nAngaben im Kaufvertrag.'];district_heating;99;energy_required;77;;ONE_YEAR_FREE;2,4 MBit/s;telekom_layer_magenta_m_hybrid2;über Hybrid;WITH_HYBRID;MagentaZuhause M Hybrid (2);C;16 MBit/s;https://padlock.link/mmh2sa;https://padlock.link/mmhy2;true;50 MBit/s;web,email,bank,music,dl-ul,game,sd,mltstr,hd;10 MBit/s;1;50 MBit/s;;
2020-05-24 20:59:07.115459;Berlin;self_contained_central_heating;18052783;n;n;https://pictures.immobilienscout24.de/listings/6621288c-4d05-4ce4-bbd1-a0f4aa53e6cd-1363012227.jpg/ORIG/resize/118x118%3E/extent/118x118/format/jpg/quality/80;8;12.1;1900;;;;12.1;109935524;n;false;n;Berlin;y;7;1;80;7.07;82.28;Berlin;10829;need_of_renovation;no_information;false;no_information;"Gotenstra&szlig;e";n;Gotenstraße;ground_floor;10829;3;n;;2,active;Deutschland;premium;wohnung_kauf;n;;;true;002.01008679649;328000;profile0;4;3;true;n;showqualicontactform;n;n;Schöneberg_Schöneberg;498322;4;Berlin;/expose/109935524;"['Auf der Suche nach einer Wohnung in exzellenter Lage von Schöneberg, mit viel Potenzial für handwerkliche Fähigkeiten? Dann haben wir hier vielleicht das richtige Objekt gefunden. Eine im Erdgeschoss gelegene 3-Zimmer-Wohnung in unserem Projekt ""KLEINOD"", ein Berliner Altbau aus dem Jahr 1893. Das KLEINOD umfasst eine Gewerbefläche und 19 Eigentumswohnungen, die sich aus neun Drei-Zimmer- und zehn Ein-Zimmerwohnungen zusammensetzen. Mit seinen klassischen Elementen wie zum Beispiel dem wunderschön gestalteten Treppenhaus mit Buntglasfenstern, hohen Decken und feinen Stuckdetails weiß KLEINOD zu überzeugen. \r\n\r\nDie Erdgeschosswohnung bietet viel Potenzial Dein Wohnkomfort ganz nach Deinen Wünschen zu erschaffen! \r\nDie Wohnung ist unvermietet und weist eine Notwendigkeit einer komplett Sanierung auf. Hier kannst Du Deine neue Wohnung ganz nach Deinen Vorstellungen kreieren - nutze das Potenzial dieser schönen Altbauwohnung.', 'Diese Wohnung wird verkauft, wie Sie steht und liegt!\r\nWir weisen darauf hin, dass für diese Wohnung eine Komplettsanierung erforderlich ist.\r\nProvisionsfrei!', 'Das KLEINOD glänzt nicht nur durch seine herrschaftliche Gestaltung; auch durch ihre geniale Lage punktet diese einmalige Immobilie. Die Gotenstr. ist eine Anliegerstraße die trotz zentraler Lage und Anbindung, ruhig gelegen ist. Zudem bieten die direkte Nachbarschaft und Umgebung viele Freizeit- und Erholungsmöglichkeiten und eine Infrastruktur, die das tägliche Leben deutlich vereinfacht.\r\nDa ist man beim KLEINOD an der richtigen Adresse. Die nahe gelegene Hauptstraße bietet alles, was man im Alltag benötigt. \r\n\r\n-    Optimale Lage in Berlin-Schöneberg\r\n-    2 Gehminuten zum S-Bahnhof Julius-Leber-Brücke\r\n-    6 Gehminuten zur Hauptstraße\r\n-    10 Gehminuten zum U-Bahnhof Kleistpark (U7)\r\n-    20 Minuten mit dem Auto zum Flughafen Schönefeld oder Flughafen Tegel\r\n-    10 Minuten mit dem Fahrrad bis zum Tempelhofer Feld\r\n-    Eine Vielzahl an Restaurants, Cafés und Bars in unmittelbarer Umgebung\r\n-    Supermärkte fußläufig zu erreichen, zum Beispiel REWE, Edeka und Lidl']";natural_gas_light;218.59;energy_required;145.9;true;ONE_YEAR_FREE;40 MBit/s;telekom_layer_magenta_l;über VDSL;REGULAR;MagentaZuhause L;;100 MBit/s;https://padlock.link/ioml;https://padlock.link/ml;true;100 MBit/s;web,email,bank,music,dl-ul,game,sd,mltstr,hd,fast-ul-dl;;;;83;
2020-05-24 20:59:07.506619;Berlin;central_heating;2692046;n;n;https://pictures.immobilienscout24.de/listings/3f05a970-3818-4191-94e9-85566ae4a6ef-1361610495.jpeg/ORIG/resize/118x118%3E/extent/118x118/format/jpg/quality/80;2;8.25;1973;;;;8.25;117053558;n;false;y;Berlin;n;8;3;no_information;3.65;83;Berlin;14109;need_of_renovation;simple;false;no_information;no_information;n;no_information;apartment;14109;3;n;;2,active;Deutschland;premium;wohnung_kauf;n;1;;true;001.2692046;455000;profile0;2;3;true;n;showqualicontactform;n;n;Wannsee_Zehlendorf;14109-04-05;4;Berlin;/expose/117053558;['Klassisches 1973 Baujahr. Gepflegte Wohnanlage, sympathisch kleine WEG.', '3 Zimmer, Wannenbad, Duschbad mit Gäste-WC, Küche und großem Balkon.', 'Wannsee und „Löwe“ fussläufig, Bus und S-Bahn nur wenige hundert Meter entfernt. Bootsliegeplätze mit und ohne Vereinsbindung vis-a-vis. Glienicker Brücke 2 km entfernt', 'Maklerangebot, provisionspflichtig. Bei Interesse können Sie uns zur „sofortigen Leistung“, honorarpflichtig, beauftragen.'];gas;;;;true;ONE_YEAR_FREE;40 MBit/s;telekom_layer_magenta_l;über VDSL;REGULAR;MagentaZuhause L;;100 MBit/s;https://padlock.link/ioml;https://padlock.link/ml;true;100 MBit/s;web,email,bank,music,dl-ul,game,sd,mltstr,hd,fast-ul-dl;;;;;1973
2020-05-24 20:59:07.890276;Berlin;gas_heating;18052783;n;y;https://pictures.immobilienscout24.de/listings/64d92b1a-3ae0-4ab9-a15a-b1dccdbcf65c-1364849943.jpg/ORIG/resize/118x118%3E/extent/118x118/format/jpg/quality/80;17;11.24;1992;;;;11.24;117073696;y;false;n;Berlin;y;6;5;11;5.59;51.27;Berlin;12351;no_information;no_information;false;underground_garage;"Zaunk&ouml;nigweg";n;Zaunkönigweg;apartment;12351;2;n;17;2,active;Deutschland;premium;wohnung_kauf;n;;;true;002.01008679649;265000;profile0;4;2;true;n;showqualicontactform;n;n;Buckow_Neukölln;499068;2;Berlin;/expose/117073696;['Das Ensemble im Zaunkönigweg erhebt sich auf einem weitläufigen Gartengrundstück und besteht aus dem straßenseitigen Mehrfamilienhaus und den beiden Einfamilienhäusern zur ruhigen Gartenseite.\r\n\r\nIm Zaunkönig stehen insgesamt 23 vermietete Wohneinheiten mit Wohnflächen zwischen ca. 36 m² und ca. 156 m² zum Verkauf. Alle Einheiten sind fest vermietet und bieten Renditen von bis zu 2,7%. Optional kann in der Tiefgarage ein PKW-Stellplatz erworben werden.', 'TRAUMHAFTE TERRASSENWOHNUNG, SONNE DEN GANZEN TAG\r\nTERRASSE 25 m2\r\nDIELE, WOHNEN UND SCHLAFZIMMER MIT PARKETTBÖDEN\r\nKLEINE KÜCHE UND BAD GEFLIEST\r\nKÜCHE MIT KLEINER EINBAUKÜCHE\r\nEIN KELLER GEHÖRT ZUR WOHNUNG DAZU\r\nGARAGENSTELLPLATZ KANN FÜR 23000 EURO ERWORBEN WERDEN', 'Der im Südosten Berlins gelegene Ortsteil Buckow ist besonders für Ruhe liebende Familien interessant: Die Wohngegend ist geprägt durch Reihen- und Einfamilienhäuser und den weitläufigen Britzer Garten.\r\n\r\n500 Meter bis zum U-Bahnhof Britz-Süd (U7)\r\nVon hier aus benötigt man 25 Minuten bis zum S+U-Bahnhof Alexanderplatz\r\nIn 8 Minuten ist man mit dem Fahrrad am Schloss Britz\r\nIn 10 Minuten ist man mit dem Fahrrad im wunderschönen Britzer Garten\r\nEinkaufsmöglichkeiten sind fußläufig zu erreichen, z.B. Kaufland, Edeka, Aldi, Penny\r\nRestaurants, Cafés und Bars finden Sie in der näheren Umgebung\r\n'];no_information;174.42;energy_consumption;106.2;true;ONE_YEAR_FREE;40 MBit/s;telekom_layer_magenta_l;über VDSL;REGULAR;MagentaZuhause L;D;100 MBit/s;https://padlock.link/ioml;https://padlock.link/ml;true;100 MBit/s;web,email,bank,music,dl-ul,game,sd,mltstr,hd,fast-ul-dl;;1;;;
