2020-05-24 21:02:33.082520;Berlin;;ONE_YEAR_FREE;99526;y;y;https://pictures.immobilienscout24.de/listings/bf16ad7b-edf2-4780-9ee3-8cf188ac0cc8-1369080718.jpg/ORIG/resize/118x118%3E/extent/118x118/format/jpg/quality/80;7;10.77;40 MBit/s;telekom_layer_magenta_l;über Glasfaser;2019;REGULAR;10.77;116844308;no_information;y;true;MagentaZuhause L;y;Berlin;y;10;9;no_information;energy_required;5.67;110;Berlin;10179;mint_condition;no_information;false;100 MBit/s;no_information;no_information;n;https://padlock.link/ioml;https://padlock.link/ml;no_information;apartment;10179;4;64;n;;2,active;true;Deutschland;top;100 MBit/s;wohnung_kauf;n;2;web,email,bank,music,dl-ul,game,sd,mltstr,hd,fast-ul-dl;true;001.99526;905000;profile0;;4;true;n;showqualicontactform;n;n;Mitte_Mitte;12700;5;Berlin;/expose/116844308;"['Die 4-Zimmerwohnung befindet sich im 2. OG eines 2019 fertiggestellten Neubaus und verfügt über einen durchdachten Grundriss. Zwei Zimmer sowie ein Balkon haben den Blick zum Luisenstädtischen Kirchpark. Der 47m² große Wohn-Ess-Bereich, ein weiteres Zimmer und ein Südwestbalkon sind zum Innenhof ausgerichtet, der eine grüne Oase innerhalb des Wohnquartiers bildet. \r\n\r\nDurch die bodentiefen Fenster auf drei Seiten ist die Wohnung sehr hell. Die Einbauküche ist u.a. mit einer Villeroy & Boch Keramikspüle, einem Miele Induktionskochfeld (6 Kochzonen!), einem praktischen Eckschrank und einem luftreinigenden Airfiltersystem im Bereich der Dunstabzugshaube ausgestattet. Zwei vollwertige Bäder mit einer begehbaren Dusche bzw. einer Badewanne vervollständigen das Bild. \r\n\r\nZur Wohnung gehören ein Kellerabteil sowie ein Tiefgaragenstellplatz (Kaufpreis: €45.000 zzgl. 5,95% Käuferprovision).\r\nDie Wohnung ist bis Ende 2020 bezugsfertig.', 'Geräumiger Wohn-Ess-Bereich\r\nEinbauküche mit hochwertigen Geräten \r\n2 Bäder \r\n2 Balkone\r\nFußbodenheizung\r\nKellerabteil\r\nAufzug\r\nTiefgaragenstellplatz\r\nElektrisch bedienbare Jalousien\r\nHolzfenster mit Wärmeschutz-Isolierverglasung', 'Der Stadtquartier ""Luisenpark"" verbindet mit seinen großzügigen Freianlagen und der Ausrichtung direkt zum Park eine zentrale Lage mit einer hohen Lebensqualität. Der große Innenhof ist begrünt, kinderfreundlich und dank der unterirdischen Tiefgarage komplett autofrei. Trotz der ruhigen Mikrolage ist man aber mittendrin im Zentrum von Berlin auf dem ehemaligen Mauergrundstück zwischen den Trendbezirken Mitte und Kreuzberg, unweit von der historischen Mitte Berlins rund um die Museumsinsel und den Gendarmenmarkt und von den Restaurants und Bars im Kreuzberger Oranienkiez.\r\nAuch die Anbindung mit ÖPNV ist gut: zu Fuß sind es nur wenige Minuten zum U-Bahnhof Spittelmarkt (U2).\r\n\r\nEine quartierseigene Kindertagesstätte und die City Grundschule befinden sich in unmittelbarer Nähe.']";;;disabled;1;;;;B;;
2020-05-24 21:02:33.440760;Berlin;central_heating;ONE_YEAR_FREE;16123617;n;y;https://pictures.immobilienscout24.de/listings/6387e687-a08b-4d73-a20e-24bad8d9cbcd-1367171206.jpg/ORIG/resize/118x118%3E/extent/118x118/format/jpg/quality/80;12;10.77;40 MBit/s;telekom_layer_magenta_l;über VDSL;1999;REGULAR;10.77;116845872;gas;y;true;MagentaZuhause L;y;Berlin;y;11;5;no_information;energy_consumption;5.67;122.62;Berlin;10115;well_kept;sophisticated;false;100 MBit/s;no_information;no_information;y;https://padlock.link/ioml;https://padlock.link/ml;no_information;apartment;10115;2;85;n;;2,active;true;Deutschland;schaufenster;100 MBit/s;wohnung_kauf;n;2;web,email,bank,music,dl-ul,game,sd,mltstr,hd,fast-ul-dl;true;002.01006554579;1200000;profile0;3;2;true;n;showqualicontactform;n;n;Mitte_Mitte;DC-BER5729;6;Berlin;/expose/116845872;['Das zum Kauf angebotene Luxus-Loft befindet sich in einem dreigeschössigen Mehrfamilienhaus, welches im Jahre 1999 im Scheunenviertel unweit vom Rosenthaler Platz in Berlin-Mitte errichtet worden ist. Die Wohnung kann bequem durch einen Personenaufzug erreicht werden.\n\nDie ca. 122 Quadratmeter Wohnfläche verteilen sich auf insgesamt zwei Etagen.\nIm zweiten Obergeschoss befindet sich der großzügige Wohnbereich sowie ein Gäste-WC und ein offener Koch- und Essbereich mit direktem Zugang zum Südwest-Balkon. Die Design-Küche von der Marke DIRADE ist mit hochwertigen Elektrogeräten von Gaggenau ausgestattet.\n\nDie freitragende Treppe führt Sie in das Galeriegeschoss, welches sich ideal als Schlafbereich eignet und mit einem separaten Ankleidezimmer und einem Vollbad ausgestattet ist.\n\nDie großen Fensterfronten und die über fünf Meter hohen Decken sorgen für eine angenehme Wohnatmosphäre und viel Tageslicht in der gesamten Wohnung.\nDes Weiteren wird das Loft mittels einer Fußbodenheizung erwärmt.', '• 2 Zimmer \n• 1 Schlafzimmer \n• Design-Einbauküche \n• 1 Vollbad \n• Gäste-WC \n• Ankleidebereich\n• Echtholzdielen\n• Bisazza Fliesen\n• Fußbodenheizung \n• Gespachtelte Wände\n• Deckenhöhe ca. 5,20 Meter\n• Isolierglasfenster\n• Balkon mit Südwest-Ausrichtung\n• Alarmanlage\n• Personenaufzug\n• Keller', 'Wer in Mitte wohnt, wird unvermeidlich zu einem Teil der Metropole Berlin mit ihren Kiezen, Shoppingmeilen, Museen, Restaurants, Parkanlagen und dem Diplomatenviertel. In Mitte leben bedeutet ständige Veränderung und steter Wandel inmitten historischer Orte wie der Berliner Mauer und dem Roten Rathaus. Die nach dem Mauerfall im Jahre 1989 erblühte Musik-, Kunst-, Hoch- und Subkulturszene hat mittlerweile Künstler aus aller Welt angezogen, die nun neben Regierungsgebäuden, Botschaften und fantastischen Sternerestaurants ein innovatives, kreatives Miteinander leben.\n\nFlanieren Unter den Linden oder am Gendarmenmarkt, Berlins schönstem Platz, Shoppen am Alexander- und am Potsdamer Platz, für Liebhaber aber auch der Besuch des Fernsehturms, der Spielbank, des Alten Museums oder der Nationalgalerie, um neben dem Brandenburger Tor und dem Bode-Museum nur einige weitere Hotspots zu nennen, machen das Wohnen in Mitte zu einem im wahrsten Sinne des Wortes unendlichen Erlebnis – ob in einem luxuriösen und modernen Neubau oder in einem energetisch aufwendig sanierten Altbau aus der Gründerzeit.   \n\nFür wahre Entdecker hält die zwischen dem Rosa-Luxemburg-Platz und der nördlichen Friedrichstraße gelegene Spandauer Vorstadt mit dem Hackeschen Markt als Eingangstor und dem Scheunenviertel viele Überraschungen bereit, für ihre Studierenden die Humboldt-Universität und für Wissbegierige und Leseratten die Staatsbibliothek mit fast 10 Millionen Büchern zum Ausleihen.'];373.2;;disabled;;;;;C;true;true
2020-05-24 21:02:33.855684;Berlin;;ONE_YEAR_FREE;6860502;n;y;https://pictures.immobilienscout24.de/listings/79a60fea-b56c-40e5-a692-c68af9b6a66e-1358964834.jpg/ORIG/resize/118x118%3E/extent/118x118/format/jpg/quality/80;17;10.37;40 MBit/s;telekom_layer_magenta_l;über VDSL;1970;REGULAR;10.37;116813528;oil;n;true;MagentaZuhause L;y;Berlin;y;6;2;no_information;energy_consumption;4.8;81.18;Berlin;12207;well_kept;no_information;false;100 MBit/s;underground_garage;no_information;y;https://padlock.link/ioml;https://padlock.link/ml;no_information;apartment;12207;3;195.1;n;2006;2,active;true;Deutschland;top;100 MBit/s;wohnung_kauf;n;;web,email,bank,music,dl-ul,game,sd,mltstr,hd,fast-ul-dl;true;001.6860502;288000;profile0;6;3;true;y;showqualicontactform;n;n;Lichterfelde_Steglitz;43090105-04454;4;Berlin;/expose/116813528;['Die Wohnung liegt im 6. Obergeschoss und wurde stets vom Eigentümer renoviert und befindet sich somit in einem gepflegten Zustand. Es befinden sich überwiegend Holzdecken und ein hochwertiger Parkettfussboden im Wohnzimmer, Loggia und im Flur. \r\n \r\nDie Wohnanlage aus dem Jahre ca. 1970 wurde laufend instand gehalten und befindet sich in einem sehr guten Unterhaltungszustand.\r\n\r\nDer Wohnung ist ein eigenes Kellerabteil im Untergeschoss sowie ein Pkw-Einstellplatz auf dem Hof zugeordnet. Das monatliche Hausgeld beträgt derzeit ca. 317 EUR.', '- Holzdecken\r\n- Parkett-Boden (noch nie abgezogen)\r\n- neue Fenster\r\n- Dusche im Bad mit Tageslichtfenster\r\n- Möbelübernahme zum Teil möglich wenn gewünscht\r\n- ausreichende Intandhaltungsrücklagen vorhanden\r\n- Balkon\r\n- Wohnzimmer\r\n- Schlafzimmer\r\n- Gästezimmer\r\n- Küche mit Fenster', 'Die hier von uns exklusiv angebotene 3-Zimmer-Eigentumswohnung befindet sich in guter und ruhiger Lage von Lichterfelde. Unweit der Osdorfer Strasse mit S-Bahn-Anbindung. \r\n\r\nKeine Durchgangsstrasse\r\n\r\nEinkaufsmöglichkeiten:\r\nBäcker mit kleinem Imbiss\r\nZeitungsladen\r\nNähe S-Bahn befinden sich ALDI, Edeka, Rossmann, Schuhhof, KIK, Dänisches Bettenlager', 'S-Bahn 6 min.\r\nBuslinie 186 nur 3 min.\r\n\r\nUnsere Finanzierungsspezialisten der Postbank stellen Ihnen gern mögliche Finanzierungsmodelle vor und fertigen für Sie ein unverbindliches und passendes Finanzierungsangebot nach Ihren Vorgaben.\r\n\r\nBitte haben Sie Verständnis dafür, dass wir im Sinne unserer Auftraggeber nur nach Übermittlung Ihrer vollständigen Kontaktdaten sowie nach Vorliegen eines entsprechenden Finanzierungschecks weitere Unterlagen bereitstellen bzw. einen Besichtigungstermin vor Ort abstimmen können. Alle im Exposé enthaltenen Angaben und Daten stammen vom Eigentümer und Auftraggeber. \r\nHaftungsausschluss: Trotz sorgfältiger Bearbeitung von Daten, Bildern und Informationen übernehmen wir keine Haftung für die Richtigkeit der Angaben, ebenso wenig für die Lieferfähigkeit des Angebotes bei Vermietung oder Verkauf.'];317;;;1;;;;;;
2020-05-24 21:02:34.239331;Berlin;central_heating;ONE_YEAR_FREE;17076257;n;n;https://pictures.immobilienscout24.de/listings/530b9c85-2e4f-4600-ba78-b70a711b8aa1-1369099712.jpg/ORIG/resize/118x118%3E/extent/118x118/format/jpg/quality/80;8;16.54;40 MBit/s;telekom_layer_magenta_l;über VDSL;1900;REGULAR;16.54;116360965;district_heating;y;false;MagentaZuhause L;y;Berlin;y;6;1;27;energy_consumption;8.84;73.01;Berlin;12051;modernized;normal;false;100 MBit/s;no_information;"Hertastra&szlig;e";n;https://padlock.link/ioml;https://padlock.link/ml;Hertastraße;ground_floor;12051;3;190;n;;2,active;true;Deutschland;schaufenster;100 MBit/s;wohnung_kauf;n;0;web,email,bank,music,dl-ul,game,sd,mltstr,hd,fast-ul-dl;true;002.01007851690;299000;profile0;4;3;true;n;showqualicontactform;y;n;Neukölln_Neukölln;SIHE-11;3;Berlin;/expose/116360965;"['In der Silbersteinstraße, Ecke Hertastraße, bieten wir eine bezugsfreie 3-Zimmer-Wohnung im Erdgeschoss an.', 'WE 11:\n\n● EG im Vorderhaus\n● bezugsfrei\n● stufenloser Zugang und barrierearme Ausstattung\n● 3 Zimmer-Wohnung (Wohnzimmer, Arbeitszimmer, Schlafzimmer)\n● Laminatfussboden\n● PVC Fenster mit 3-fach Verglasung\n● elektrische Rollläden\n● EBK\n● Diese Wohnung können Sie auch kontaktlos in unseren virtuellen 3D-Touren besichtigen. Wir begleiten Sie dabei gerne per Video-Call und beantworten Ihnen direkt alle Fragen. \n\nVereinbaren Sie dazu einfach einen Termin zu einem Video-Call mit unserem Team!', 'Im bunten Treiben des In-Bezirks Neukölln finden sich eine Vielzahl an Restaurants und Bars, ebenso wie Cafés, in der nahen Umgebung. \nGeschäfte des täglichen Bedarfs sind wie die Anschlüsse an den ÖPNV fußläufig zu erreichen. Der Körnerpark bietet in Laufnähe einen Platz zur Erholung im Grünen.\n\nÖPNV:\nS+U Hermannstraße (S41, S42, S46, S47 + U8) 5 Minuten Fußweg\nBus 246, 370 ""S+U Hermannstr./Silbersteinstr."" 3 Minuten Fußweg', 'Wenden Sie sich an unser mehrsprachiges Team für weitere wichtige Informationen, Besichtigungen und das Exposé.\n\nDer Vertriebspartner ist YS real estate GmbH.']";374.63;12345;disabled;;;;;F;true;
2020-05-24 21:02:34.664811;Berlin;self_contained_central_heating;ONE_YEAR_FREE;17532864;n;y;https://pictures.immobilienscout24.de/listings/6fe87364-1bc0-4b9d-8b96-c0b1912ca245-1359085866.jpg/ORIG/resize/118x118%3E/extent/118x118/format/jpg/quality/80;13;13.06;40 MBit/s;telekom_layer_magenta_l;über VDSL;1996;REGULAR;13.06;116828952;gas;y;false;MagentaZuhause L;y;Berlin;y;8;5;27;;6.49;135;Berlin;13403;refurbished;sophisticated;false;100 MBit/s;no_information;"Schillingstra&szlig;e";n;https://padlock.link/ioml;https://padlock.link/ml;Schillingstraße;roof_storey;13403;4;;n;2019;2,active;true;Deutschland;premium;100 MBit/s;wohnung_kauf;n;4;web,email,bank,music,dl-ul,game,sd,mltstr,hd,fast-ul-dl;true;009.d53f6f16-60ab-4c52-9aaa-3b9f9fcb1cfc;479000;profile0;5;4;true;n;showqualicontactform;n;n;Reinickendorf_Reinickendorf;116828952;6;Berlin;/expose/116828952;['Diese familienfreundliche, kern- und luxussanierte Maisonette-Wohnung, deren beiden Etagen durch eine Wendeltreppe verbunden sind, begeistert vor allem mit ihrer Größe: es stehen neben je einem Wohn- und Schlafzimmer 2 weitere Zimmer zur Verfügung, die als Kinderzimmer und/oder Arbeitszimmer genutzt werden können. Das Wannenbad in der Dach-Etage (5.OG) wird durch ein zusätzliches WC im darunterliegenden Stockwerk ergänzt. Die Küche bietet Platz für einen großen Esstisch und ist mit einer hochwertigen Einbauküche ausgestattet. Beide Etagen der Wohnung bieten je einen eignen Eingang vom Hausflur sowie jeweils einen nach Nordwesten gerichteten Balkon.', '- Wohnzimmer und Schlafzimmer mit Balkon\r\n- Separate Kammer im Schlafzimmer (optimal als begehbares Ankleidezimmer nutzbar) \r\n- 2 weitere Zimmer (optional als Arbeits- oder Kinderzimmer nutzbar)\r\n- Wendeltreppe zwischen unterem und oberem Wohnungsflur\r\n- 2 Wohnungseingänge: untere Etage zum Flur, obere Etage: direkt zu einem der weiteren Zimmer\r\n- Gesamte Wohnung ist kern- und luxussaniert\r\n- Durchgehend hochwertiger Bodenbelag\r\n- Separate Küche (vollständig gefliest) mit offenem Eingang\r\n- Küche mit hochwertiger Einbauküche und Essbereich ausgestattet\r\n- Wannenbad mit Platz für eine Waschmaschine und separates Gäste WC', 'Die Schillingstraße im Stadtteil Reinickendorf ist eine ruhige Seitenstraße, unweit des Kurt-Schuhmacher-Platzes, dem zentralen Verkehrsknotenpunkt von Reinickendorf.\r\n\r\nDie Anbindung an den Nahverkehr ist hervorragend. Der nahelegende U-Bahnhof Scharnweberstraße (U6) ist fußläufig in wenigen Minuten zu erreichen. \r\n\r\nVom ebenfalls nahegelegenen S-Bahnhof Eichborndamm (S25) erreicht man in binnen weniger Minuten das Stadtzentrum, die Friedrichstraße in Mitte. Über die Auffahrt Eichborndamm erreichen Sie die Stadtautobahn A111 und sind dadurch schnell im Berliner Umland.'];435;;;1;;;;;true;
2020-05-24 21:02:35.051829;Berlin;central_heating;ONE_YEAR_FREE;4681225;n;y;https://pictures.immobilienscout24.de/listings/fb62b150-b102-44f0-ad54-0cd46118404a-1369772276.jpg/ORIG/resize/118x118%3E/extent/118x118/format/jpg/quality/80;8;11.19;40 MBit/s;telekom_layer_magenta_l;über VDSL;1964;REGULAR;11.19;116825941;oil;y;true;MagentaZuhause L;y;Berlin;y;4;2;no_information;energy_consumption;5.36;67;Berlin;13403;well_kept;normal;false;100 MBit/s;no_information;no_information;y;https://padlock.link/ioml;https://padlock.link/ml;no_information;roof_storey;13403;3;101.8;n;2018;2,active;true;Deutschland;standard;100 MBit/s;wohnung_kauf;n;;web,email,bank,music,dl-ul,game,sd,mltstr,hd,fast-ul-dl;true;001.4681225;198000;profile0;8;3;true;n;showqualicontactform;n;n;Wittenau_Reinickendorf;43100103-00868;3;Berlin;/expose/116825941;['Die Eigentumswohnung verfügt mit hellen 2 1/2 Zimmern über eine funktionale Aufteilung und lässt mit dem vom Wohnzimmer und nach Westen ausgerichteten Sonnenbalkon für Berlin seltenen Fernblick kaum Wünsche offen. \r\n\r\nEin Kinder- oder Arbeitszimmer, ein Schlafzimmer sowie ein Flur mit großzügiger Abstellecke bieten Platz für die individuellen Wohnvorstellungen. Eine komfortable Einbauküche wird auf Wunsch mitverkauft. Das Wannenbad hat ein Tageslichtfenster. \r\n\r\nEin Kellerraum im Nachbarhaus der Anlage schafft zusätzlichen Stauraum für Dinge, die nicht ständig gebraucht werden.', '- Sonnenbalkon mit Fernblick\r\n- tagesbelichtetes Wannenbad\r\n- Einbauküche\r\n- Kunststoffisolierglasfenster\r\n- Keller\r\n- Zentralheizung\r\n- Stellplatz für das Auto vor dem Haus falls frei', 'Die Wohnung befindet sich in einer in den Sechziger Jahren erbauten Wohnanlage südlich vom Rathaus in Reinickendorf. \r\n\r\nSie haben eine sehr gute Anbindung an die Autobahn, die nächste S-Bahnstation Eichborndamm ist in ca. 5 Minuten in nur 450m Entfernung, die U-Bahnstation Rathaus Reinickendorf in 950m erreichbar. Die nächste Bushaltestelle (Linie 221) ist ca. 100m entfernt. \r\n\r\nViele Einkaufsmöglichkeiten sowie Dienstleister des täglichen Bedarfs sind teils fußläufig erreichbar.', 'Gerne stehen wir Ihnen für einen individuellen Besichtigungstermin zur Verfügung. Schreiben Sie uns hierzu bitte eine E-Mail oder rufen Sie uns an: 030/ 20 67 99 21 40.\r\n\r\nAuf Wunsch erstellen Ihnen die Finanzierungsexperten der Postbank ein unverbindliches Finanzierungsangebot. Bei Renovierungs- oder Umbauwünschen stehen wir Ihnen ebenfalls kompetent zu Seite.\r\n\r\nBitte haben Sie Verständnis dafür, dass wir im Sinne unserer Auftraggeber nur nach Übermittlung Ihrer vollständigen Kontaktdaten weitere Informationen bereitstellen oder Besichtigungstermine nach Legitimation vereinbaren können. \r\n\r\nDer veröffentlichte Preis ist ein Angebotspreis, der je nach Nachfrage sinken oder steigen kann.'];269;;disabled;;6;;;D;;
2020-05-24 21:02:35.544115;Berlin;central_heating;ONE_YEAR_FREE;17375622;n;y;https://pictures.immobilienscout24.de/listings/48f29202-6e0b-44c5-80c9-e2a517295a67-1369964433.jpg/ORIG/resize/118x118%3E/extent/118x118/format/jpg/quality/80;17;10.95;40 MBit/s;telekom_layer_magenta_l;über VDSL;1907;REGULAR;10.95;116810739;gas;n;false;MagentaZuhause L;y;Berlin;y;9;1;23;energy_required;6.54;115.08;Berlin;10409;first_time_use_after_refurbishment;luxury;false;100 MBit/s;no_information;"Schieritzstra&szlig;e";y;https://padlock.link/ioml;https://padlock.link/ml;Schieritzstraße;apartment;10409;4;123.2;n;2019;2,active;true;Deutschland;standard;100 MBit/s;wohnung_kauf;n;2;web,email,bank,music,dl-ul,game,sd,mltstr,hd,fast-ul-dl;true;009.b656c4ad-3002-420c-a514-f877424fb9c1;650000;profile0;5;4;true;n;showqualicontactform;n;n;Prenzlauer_Berg_Prenzlauer_Berg;SCHRI-23, WE13;5;Berlin;/expose/116810739;['COVID-19: ERSTBESICHTIGUNG PER VIDEO MÖGLICH - BITTE SCHREIBEN SIE EINFACH EINE KURZE NACHRICHT und SIE ERHALTEN AUSFÜHRLICHE VIDEOS ZUR WOHNUNG UND DEM HAUS\n\nDie angebotene 4-Zimmer-Wohnung befindet sich in einem ruhigen fünfgeschossigen Mehrfamilien-wohnhaus aus dem Jahr 1907. Das Wohnhaus besteht in Summe aus 29 Altbauwohnungen sowie einem kleinen Ladengeschäft im Erdgeschoss. Das Mehrfamilienhaus wurde in den letzten Jahren umfassend saniert (u.a. Dachausbau und -erneuerung, Kellersanierung mit neuen Metallgitterverschlägen,  Erneuerung der Frisch- und Abwasserleitungen im Kellerbereich, Fassadensanierung,  Heizungsanlage, Hausflur, Einbau eines Fahrstuhls) und befindet sich in einem sehr guten Zustand. Der Ausbau einer Loggia zur Südseite ist optional (gegen Aufpreis) möglich. \nDie hochwertige Eigentumswohnung umfassend saniert und befindet sich in einem neuwertigen Zustand.', 'Sollten Sie Wert auf eine hochwertig ausgestattete und repräsentative Eigentumswohnung im szenigen und familienfreundlichen Bezirk Prenzlauer Berger legen, dann ist diese Eigentumswohnung genau das Richtige für Sie!\nDie hier angebotene Eigentumswohnung besitzt eine exklusive und hochwertige Ausstattung. Die 2. Etage erreichen Sie bequem über den neu installierten Fahrstuhl. Auf ca. 115,08 m² Wohnfläche erwarten Sie großzügig geschnittene und Licht durchflutete Zimmer. Dem Stil des Hauses und der Wohnung entsprechend, sind alle Zimmer und die Küche mit einem hochwertigen Dielenboden ausgestattet. Ein besonderes Augenmerk verdient der repräsentative, geräumige Wohn- und Essbereich. Zusätzlich bietet der gut-geschnittene Grundriss flexible Nutzungsmöglichkeiten für eine 3-4-köpfige Familie als auch einen 1- bis 2-Personen-Haushalt mit separaten Arbeitsbereich.\nAbgerundet wird dieses exklusive Angebot mit einem luxuriösen Wannenbad mit Waschtisch, WC und einer separaten Regendusche sowie einem großflächigen Oberlicht. Ein Gäste-WC ist selbstverständlich vorhanden. Der Ausbau einer Loggia zur Südseite ist optional (gegen Aufpreis) möglich.', 'Der Berliner Bezirk Prenzlauer Berg ist ein gutsituierter Szenestadtteil der Hauptstadt. Seine Attraktivität verdankt er einer bunten Mischung aus trendigen Cafés, Restaurants, Galerien und Theater sowie diversen grünen Familien- und Wohnkiezen. \nDie angebotene Eigentumswohnung befindet sich in einer ruhigen, baumgesäumten und familien-freundlichen Wohnstraße. Hinter dem Innenhof des Gebäudes erstreckt sich eine grüne Parkanlage der umliegenden Wohnhäuser. In unmittelbarer Nähe sind zahlreiche Einkaufsmöglichkeiten vorhanden.\nNur ca. 100 m entfernt befindet sich die Greifswalder Straße, von der zahlreiche Busse und Straßenbahnen in Richtung Alexanderplatz oder Hackescher Markt abfahren. Mit der Tram M4 können innerhalb weniger Minuten der Volkspark Friedrichshain oder der Weißenseer Park erreicht werden. \nDer S-Bahnhof Greifswalder Straße liegt zu Fuß nur ca. 5-10 min entfernt. Von dort fahren in regelmäßigen Abständen die Ringbahn sowie weitere S-Bahnlinien, wie die S85 und S9. Durch die S9 besteht sogar eine direkte Verbindung zum Flughafen Schönefeld.', 'Besichtigungen in Zeiten von COVID-19:\nDie Besichtigungen erfolgen einzeln und in größeren zeitlichen Anständen. Sollte eine Vor-Ort Besichtigung nicht gewünscht sein, kann auch kurzfristig Videomaterial aus der Wohnung zur Verfügung gestellt werden.'];233.99;;;;;;;D;;
2020-05-24 21:02:35.891415;Berlin;;ONE_YEAR_FREE;99526;y;y;https://pictures.immobilienscout24.de/listings/15bd568c-2ae1-45f0-83bb-116dcfd2d122-1368360494.jpg/ORIG/resize/118x118%3E/extent/118x118/format/jpg/quality/80;8;11.37;40 MBit/s;telekom_layer_magenta_l;über VDSL;2019;REGULAR;11.37;116813550;no_information;y;true;MagentaZuhause L;y;Berlin;y;9;9;no_information;energy_required;5.79;72.59;Berlin;10707;no_information;no_information;false;100 MBit/s;no_information;no_information;n;https://padlock.link/ioml;https://padlock.link/ml;no_information;roof_storey;10707;3;77;n;;2,active;true;Deutschland;standard;100 MBit/s;wohnung_kauf;n;5;web,email,bank,music,dl-ul,game,sd,mltstr,hd,fast-ul-dl;true;001.99526;639950;profile0;5;3;true;n;showqualicontactform;n;n;Wilmersdorf_Wilmersdorf;12692;3;Berlin;/expose/116813550;"['Das Haus Brandenburg - eine umfassende Renovierung eines beeindruckenden Gebäudes aus dem Jahr 1910 und der Anbau einer nagelneuen Penthouse-Ebene - bietet elegantes und anspruchsvolles Wohnen in einer der angesehensten und wohlhabendsten Lagen Berlins.\n\nPenthouse 47, eine komplett neue Wohnung und als solche nicht den neuen Mietbeschränkungen unterworfen, bietet drei gut ausgestattete Zimmer mit einer Wohnfläche von 72,59 Quadratmetern. Zwei große Schlafzimmer haben von ihren zwei privaten Balkonen aus einen schönen Dachausblick, während die 30 Quadratmeter große Küche/Wohnzimmer - komplett mit voll ausgestatteter Einbauküche - zu einem weiteren privaten, raumlangen Balkon mit einem wunderschönen westlichen Aspekt führt.\n\nEin besonderes Highlight ist das Designer-Bad mit einem wunderschönen Oberlicht, das von der Badewanne aus eine einzigartige Sternensicht ermöglicht!', 'Voll ausgestattete Einbauküche inklusive\r\nZwei große Doppelzimmer\r\nDrei private Balkone\r\nNicht einschränkende Gewölbedecken bieten Penthouse-Charme\r\nOst-West-Orientierung garantiert den ganzen Tag Sonne\r\nAtemberaubende Dachaussichten aus allen Zimmern\r\nBrandneue Aufzüge', 'Der Bezirk Charlottenburg-Wilmersdorf liegt mitten in West-Berlin und gehört zu den schönsten Stadtteilen Berlins und ist eine der Hauptstützen der Berliner Wohlstandselite. Dieses blühende Kulturzentrum bietet den Besuchern eine unverwechselbare und beeindruckende Sammlung von Attraktionen: Zahlreiche Fachgeschäfte bieten komplizierte Produkte an, Restaurants mit exquisiten Menüs säumen die Plätze und Prominente flanieren durch die Straßen.\n\nDas Gebiet beherbergt bedeutende Universitäten wie die Technische Universität Berlin und die Universität der Künste Berlin sowie historisch und kulturell bedeutende Stätten wie das Schloss Charlottenburg und die Deutsche Oper Berlin, die Heimat des Berliner Staatsballetts. Zu den weiteren Sehenswürdigkeiten zählen der Volkspark Wilmersdorf, das KaDeWe und die Kaiser-Wilhelm-Gedächtniskirche.\n\nDas weltberühmte Luxus-Einkaufsviertel Kurfürstendamm ist nur wenige Gehminuten entfernt und verfügt über eine hervorragende Busanbindung in der ganzen Stadt; der U-Bahnhof Konstanzer Straße (U7) liegt direkt gegenüber dem Haus.']";;;disabled;0;;;;;;
