2020-05-24 21:15:13.687394;Berlin;central_heating;ONE_YEAR_FREE;213082;n;y;https://pictures.immobilienscout24.de/listings/d319c21e-af82-4edb-bad5-7aed0734155f-1357305401.jpg/ORIG/resize/118x118%3E/extent/118x118/format/jpg/quality/80;10;11.49;40 MBit/s;telekom_layer_magenta_l;über VDSL;1890;REGULAR;11.49;114740529;oil;n;false;MagentaZuhause L;y;Berlin;y;9;1;299.03;no_information;6.07;134.8;Berlin;12165;well_kept;normal;false;100 MBit/s;no_information;no_information;n;https://padlock.link/ioml;https://padlock.link/ml;no_information;roof_storey;12165;3;n;;2,active;true;Deutschland;standard;100 MBit/s;wohnung_kauf;n;5;web,email,bank,music,dl-ul,game,sd,mltstr,hd,fast-ul-dl;true;001.213082;639000;profile0;5;3;true;n;;n;n;Steglitz_Steglitz;rwi7496;6;Berlin;/expose/114740529;['Es handelt sich hier um einen prachtvollen Altbau aus dem Jahre 1890, der mit 4 Geschossen ausgeführt wurde. Das Dach ist ausgebaut. \r\rEin Energieausweis ist nicht erforderlich, da das Haus unter Denkmalschutz steht.', 'Diese freie Wohnung im Dachgeschoss des Hauses bietet 3 Zimmer die alle vom Flur aus erreichbar sind. Die Küche, von angenehmer Größe, bietet ein Fenster. Neben dem Vollbad ist eine Abstellkammer für weiteren Stauraum vorhanden. Die Wohnung bietet für mehr Licht eine Reihe von Oberlichtern, auch im großzügigen Wohnraum. Eine Terrasse ist ebenfalls vorhanden. Weitere Details auf Anfrage.', 'Steglitz ist eine beliebte Wohnlage, mit sehr viel gut erhaltener und sanierter Altbausubstanz und guter Sozialstruktur. Das Haus liegt in einer ruhigen Seitenstrasse zwischen der Schloss- und der Rothenburgstrasse in der Nähe des Rathaus Steglitz. \r\rDie Schlossstrasse ist als pulsierende Geschäfts- und Einkaufsstraße mit hervorragenden Einkaufsmöglichkeiten bekannt, wo sich der tägliche Bedarf leicht und in fußläufiger Distanz decken lässt. Die Anbindung an den ÖPNV ist ebenfalls hervorragend durch die U-Bahn- und S-Bahn-Haltestelle Rathaus Steglitz. Wer mit dem Auto unterwegs ist wird die schnelle Erreichbarkeit der A103 zu schätzen wissen. ', 'Der Käufer hat bei Abschluss des Kaufvertrages eine Provision in Höhe von 7,14 % inkl. Mehrwertsteuer vom Kaufpreis an uns zu zahlen. Verdient und fällig bei Beurkundung. Alle Angaben sind ohne Gewähr und nach den Unterlagen des Eigentümers erstellt. Irrtümer und Änderungen vorbehalten. Bei aller Sorgfalt können wir keine Garantie dafür übernehmen, dass alle Angaben richtig sind, und das Objekt im Augenblick des Zugangs der Offerte noch verfügbar ist. \r\rBei Anfragen bitten wir um vollständige Absenderangaben. \r\rGerne zeigen wir Ihnen das Objekt, und freuen uns auf einen persönlichen Termin mit Ihnen. \r\rSie erreichen uns wie folgt:\rRüdiger Wilkanowski Immobilien\rIn Kooperation mit:\r\rMartin Bormann Immobilien\rTelefon: 0178-9377856\rFax: 030 / 85605613\r\rGerne zeigen wir Ihnen das Objekt, und freuen uns auf einen persönlichen Termin mit Ihnen. \r\rWeitere interessante Angebote finden Sie auch im Internet unter www.wilkanowski-immobilien.de.\r\rSie wollen Ihre Immobilie verkaufen ?\r \rWir suchen im Stadtgebiet von Berlin Immobilien (freie Eigentumswohnungen, Mehrfamilienhäuser und Einfamilienhäuser). Sprechen sie uns gerne an oder vereinbaren Sie einen persönlichen Termin mit uns: 030-85605612.'];energy_consumption;108;;;D;2000;;
2020-05-24 21:15:14.056159;Berlin;no_information;ONE_YEAR_FREE;782573;n;n;https://pictures.immobilienscout24.de/listings/957c389d-6cad-429b-ac63-81ca8fdccad6-1337503901.jpg/ORIG/resize/118x118%3E/extent/118x118/format/jpg/quality/80;11;16.53;40 MBit/s;telekom_layer_magenta_l;über VDSL;1900;REGULAR;16.53;114725111;no_information;n;false;MagentaZuhause L;y;Berlin;n;8;1;300;no_information;9.26;81.16;Berlin;12043;modernized;no_information;false;100 MBit/s;no_information;no_information;n;https://padlock.link/ioml;https://padlock.link/ml;no_information;apartment;12043;3;n;;2,active;true;Deutschland;standard;100 MBit/s;wohnung_kauf;n;4;web,email,bank,music,dl-ul,game,sd,mltstr,hd,fast-ul-dl;true;001.782573;419000;profile0;5;3;true;n;showqualicontactform;n;n;Neukölln_Neukölln;51246;4;Berlin;/expose/114725111;"['Modernisierter Altbau aus der Jahrhundertwende bestehend aus Vorderhaus, Quergebäude und Fabrikgebäude.\r\rIm Treppenhaus liegt dem Bewohner bzw. Besucher bereits der  ""rote Teppich"" in Kombination mit messingfarbenden Treppenläuferstangen aus. Passend dazu geschwungene Treppengeländer und dazu große Flügeltüren. Vereinzelt noch farbige Bleiverglasungen.\r\rDie Wohnräume sind hell und freundllich und bieten den Bewohnern den ganzen Nachmittag Sonne pur.', '- Aufzug\r- Loggia (ca. 4 x 2m) mit Rundbogen\r- Einbauküche mit Essplatz\r- großes Wannenbad mit Wand-WC\r- Laminat (Darunter Dielen)\r- Fliesen in Bad und Küche\r- Kunstoff-Iso-Fenster\r\rDie in dem 3D-Grundriss dargestellte Inneneinrichtung spiegelt lediglich eine von vielen Möglichkeiten dar !', '""Ich bin aus Rixdorf"" so hies es früher. Ein Dorf mitten in Neukölln. Vom zentralen Platz an der Karl-Marx-Strasse über die Richardstrasse ist der Eingang nach Alt-Rixdorf, dass 1737 entstand.\r\rIm Frühjahr und Sommer kommt man hier mit den Leuten leicht ins Gespräch. Eine bunte Vielfalt: Es gibt das Café Botanico mit wunderschönem Permakultur-Garten und italienischer Küche und das Prachtwerk in der Ganghoferstraße, das durch seine hohen, weiten Räume, Liebe zum Detail und zu den Gästen auffällt. Andere bevorzugen eher  die Kaffeehaus-Atmosphäre des Cafe Rix oder die Hofperle. Der Heimathafen Neukölln und die Neuköllner Oper bieten bunte Facetten des Musiktheaters. Der Alfred-Scholz-Platz mit seiner  offene Bühne und der Rixbox als Treffpunkt. \r\rEin Stadtteil der Trends und Traditionen. Ein Multikulti-Bezirk mit dem besonderen Flair der viel zu bieten hat.\r\rEin Szenekiez für Studierende, Kreative und Kunstschaffende. Die Kreativen kommen. Straßenkunst hautnah erleben oder auf kullinarische Weltreise gehen.\r\rEin Geheimtipp ! Sogar die New Yorck Times hat Neukölln in ihrem Travel-Guide als neue ""destination for modern bohemians"" bezeichnet.', 'Hinweis:\rAlle Angaben sind ohne Gewähr und basieren ausschließlich auf Informationen, die uns von unserem Auftraggeber zur Verfügung gestellt wurden. Wir übernehmen keine Gewähr für die Vollständigkeit, Richtigkeit und Aktualität dieser Angaben .']";;;;;;;;
2020-05-24 21:15:14.534922;Berlin;district_heating;ONE_YEAR_FREE;12972376;n;y;https://pictures.immobilienscout24.de/listings/ac40f8ce-9aa4-4ec6-9880-4a1191a45370-1337702726.png/ORIG/resize/118x118%3E/extent/118x118/format/jpg/quality/80;9;11.12;40 MBit/s;telekom_layer_magenta_l;über VDSL;1960;REGULAR;11.12;114736730;combined_heat_and_power_fossil_fuels;y;false;MagentaZuhause L;y;Berlin;y;7;2;243.22;00;6.13;55;Berlin;10623;well_kept;normal;false;100 MBit/s;outside;Knesebeckstr.;y;https://padlock.link/ioml;https://padlock.link/ml;Knesebeckstr.;apartment;10623;2;n;2003;2,active;true;Deutschland;standard;100 MBit/s;wohnung_kauf;n;4;web,email,bank,music,dl-ul,game,sd,mltstr,hd,fast-ul-dl;true;001.12972376;350000;profile0;;2;true;n;showqualicontactform;n;n;Charlottenburg_Charlottenburg;42023V;2;Berlin;/expose/114736730;['Grundsaniert und umgebaut im Frühling 2003:\t\n\n- Erneuerung der Heizungsanlage\n- Erneuerung der Elektrik auch Anschluss der \n  Lautsprecher im Bad, Wohn- und Schlafzimmer\n- Austausch der Bodenbeläge\n- Austausch aller Fenster\n- Erneuerung der Sanitäranlagen\n- Qualitätsmaterialien (Keramik-Fliesen-Wandfliesen, \n  Holzlaminat)\n\nDie Wohnung wird komplett möbliert verkauft. \nZur Möblierung gehört folgende Ausstattung:\n\nDoppelbett + Schlafsofa, Sessel, Stühle, Tisch, Esstisch, 2 Kleiderschränke, Regale, Vitrine, Einbauküche mit Spülmaschine, Kühlschrank, und Gefrierkombi, Waschmaschine, Plasma-TV, Video, DVD, Dolby-Sorround System in der ganzen Wohnung, Mikrowelle, Duschbad mit Massage-Regenduschköpfen.', 'Mit der Wohnung wird ein Stellplatz auf dem Hof verkauft. Dieser kostet 35.000,00 EUR!', 'S-Bahn Savignyplatz oder U-Bahn Zoologischer Garten. Einkaufsmöglichkeiten - sowie tolle Restaurant, Bäcker und kleine Geschäfte sind direkt vor der Haustür.'];energy_consumption;133.7;1;disabled;;2;55;
2020-05-24 21:15:14.926863;Berlin;gas_heating;ONE_YEAR_FREE;18043117;n;y;https://pictures.immobilienscout24.de/listings/d99e50a7-87b0-4d49-917c-28c274c39003-1370040037.jpg/ORIG/resize/118x118%3E/extent/118x118/format/jpg/quality/80;13;10.2;40 MBit/s;telekom_layer_magenta_l;über VDSL;1902;REGULAR;10.2;114727138;natural_gas_light;n;false;MagentaZuhause L;y;Berlin;n;4;1;167.41;77;6.17;85;Berlin;13055;no_information;no_information;false;100 MBit/s;no_information;Konrad-Wolf-Strasse;n;https://padlock.link/ioml;https://padlock.link/ml;Konrad-Wolf-Strasse;roof_storey;13055;3;n;2015;2,active;true;Deutschland;premium;100 MBit/s;wohnung_kauf;n;4;web,email,bank,music,dl-ul,game,sd,mltstr,hd,fast-ul-dl;true;002.01008718359;170000;profile0;4;3;true;n;showqualicontactform;n;n;Alt_Hohenschönhausen_Hohenschönhausen;4973;4;Berlin;/expose/114727138;"['Wir verkaufen zwei Dachgeschossrohlinge mit Baugenehmigung in der 4. Etage des kleinen Mietshauses\r\nEs besteht aus einem 4-geschossigen Vorderhaus und einer Remise im idyllischen, begrünten Hof. \r\nDie Wohnungseigentümergemeinschaft besteht aus derzeit 8  Etagenwohnungen, 2  Ladengeschäften, einre Gewerbeeinheit im 1. OG. und einer Remise. \r\nDas Haus wurde von seinen Besitzern kontinuierlich liebevoll  saniert und bietet den Mietern ein gepflegtes und angenehmes Umfeld.\r\nDie Hoffassade wurde 2015 umfassend saniert, der Dachboden ist gedämmt. Das Gebäude ist voll unterkellert.', 'Wir verkaufen zwei separate Dachgeschossrohlinge a 85 m2 mit Baugenehmigung.\r\n\r\nBeide Wohnungen wurden mit drei Zimmern geplant, schöner Terrasse, tagesbelichteten Wannenbädern und geräumigen Küchen.\r\n\r\nDie Rohlinge befinden sich in der 4. Etage des Hauses.\r\n\r\n', 'Das gepflegte Wohn- und Geschäftshaus aus der Gründerzeit befindet sich im Lichtenberger Ortsteil Alt-Hohenschönhausen. Eingebettet in die urbane, gewachsene Bebauung und umgeben von den großen Grünflächen der westlich an die Konrad-Wolf-Straße angrenzenden Friedhöfe Sankt Andreas und Sankt Markus und den Anlagen des Sportforums Berlin befindet sich das Mehrfamilienhaus. \r\rHier wohnen Sie zentrumsnah in einem ruhigen und grünen Quartier. Zum Alexanderplatz sowie in die beliebten Stadtviertel Friedrichshain und Prenzlauer Berg gelangt man mit der Straßenbahn in ca. 15-20 Minuten.\rDas Sportforum Hohenschönhausen (Europas größtes Sport- und Trainingszentrum) liegt ca. 300m entfernt und bietet eine Vielzahl von Sport- und Freizeitmöglichkeiten, z.B. ist dort auch ein Sportkindergarten  angesiedelt. In der Sandinostraße befindet sich zudem die Grundschule am Wilhelmsberg sowie die Gutenberg-Oberschule. Die Bewohner von Alt-Hohenschönhausen schätzen die innerstädtische Lage und die guten Verkehrsverbindungen ins Zentrum Berlins mit drei Tramlinien und zwei Buslinien.\r\n\r\nIm Quartier gibt es außerdem zahlreiche Parks und Wasserflächen. Das ca. 1.800 m entfernte Freibad Orankesee ist ein zu- und abflussloses Gewässer und bildet zusammen mit dem Oberseepark den Kern des Hohenschönhausener Villenviertels.\r\r\n\r\nDie Galerie 100 in der Konrad-Wolf-Str. 99 ist weit über den Kiez hinaus bekannt. Als Freizeit-Oasen locken über einen kurzen Spazier- oder Fahrradweg das Strandbad Orankesee und der Obersee mit dem 1913 angelegten Park, wo sich auch das Architekturmuseum ""Mies van der Rohe Haus"" befindet. In Gesundheitsfragen ist das Krankenhaus ""Rudolf Virchow"" schnell erreicht.\r\nWas darüber hinaus die Attraktivität der Lage seit 2013 auch belegt, ist die Fertigstellung einer Reihe neuer Mietshäuser auf dem Areal der alten, denkmalgeschützten Zuckerfabrik.']";energy_required;139.3;;disabled;;;90;true
2020-05-24 21:15:15.374420;Berlin;no_information;ONE_YEAR_FREE;164338;n;n;https://pictures.immobilienscout24.de/listings/d3dd2ba1-51c4-4f25-a20e-d934f2388aca-1345402253.jpg/ORIG/resize/118x118%3E/extent/118x118/format/jpg/quality/80;8;12.78;40 MBit/s;telekom_layer_magenta_l;über VDSL;1880;REGULAR;12.78;114709007;no_information;n;false;MagentaZuhause L;y;Berlin;n;8;1;;no_information;7.23;57;Berlin;10785;first_time_use;sophisticated;false;100 MBit/s;no_information;no_information;n;https://padlock.link/ioml;https://padlock.link/ml;no_information;apartment;10785;2;n;2020;2,active;true;Deutschland;top;100 MBit/s;wohnung_kauf;n;2;web,email,bank,music,dl-ul,game,sd,mltstr,hd,fast-ul-dl;true;001.164338;499000;profile0;;2;true;n;showqualicontactform;n;n;Tiergarten_Tiergarten;114709007;2;Berlin;/expose/114709007;"['Es handelt sich um eine repräsentative Stuck -Residenz mit ca. 57 qm Wohnfläche im 1. Obergeschoss im einzigartigen viergeschossigen Stadtpalais, welches im Jahre 1880 vom Maurermeister Paul Garnn und Otto Krantz errichtet wurde. \r\r\rDas Objekt wird zurzeit bis Frühjahr 2020 umfangreich modernisiert. \r\rDas Objekt verfügt über alte originale Stilelemente und Stuckverzierungen aus dem Jahre 1880.\r\rWeitere Details teilen wir Ihnen gerne auf Nachfrage mit!', 'Eine attraktive Adresse in alter Wohnlage von Mitte / Tiergarten – fast direkt am Potsdamer Platz!', 'Unser Service für Eigentümer\rWir stehen Ihnen bei dem Verkauf Ihrer Immobilie vom Anfang bis zum fertigen Abschluss diskret und kompetent zur Verfügung. \rJeder Schritt erfolgt nach Absprache mit Ihnen. \rSie entscheiden über die Verkaufsstrategie Ihres Objektes, ob diskret und ""off-market"" oder eine qualifizierte Vermarktung in Print- sowie Onlinemedien. \rWir verfügen immer über den richtigen Käufer. \rZudem bewerten wir Ihre Immobilie kostenfrei, entsprechend dem aktuellen Marktwert.\rGerne beraten wir Sie kostenlos persönlich in unserem Büro, per Telefon oder per E-Mail!\rWir freuen uns von Ihnen zu hören!\rwww.immo-boerse24.de']";energy_consumption;243;;;;;;
2020-05-24 21:15:15.741617;Berlin;central_heating;ONE_YEAR_FREE;213082;n;n;https://pictures.immobilienscout24.de/listings/7c46fc8e-515f-4d00-b707-e875bb4c3b20-1359025490.jpg/ORIG/resize/118x118%3E/extent/118x118/format/jpg/quality/80;8;12.7;40 MBit/s;telekom_layer_magenta_l;über VDSL;1900;REGULAR;12.7;114746061;district_heating;n;false;MagentaZuhause L;y;Berlin;y;2;1;160.34;50;7.58;26.58;Berlin;10559;well_kept;normal;false;100 MBit/s;no_information;"Stephanstra&szlig;e";n;https://padlock.link/ioml;https://padlock.link/ml;Stephanstraße;apartment;10559;1;n;;2,active;true;Deutschland;standard;100 MBit/s;wohnung_kauf;y;3;web,email,bank,music,dl-ul,game,sd,mltstr,hd,fast-ul-dl;true;001.213082;99000;profile0;5;1;true;n;;n;n;Tiergarten_Tiergarten;rwi7125;1;Berlin;/expose/114746061;['Das Haus ist ein prächtiger, gepflegter Jugendstilaltbau aus dem Jahre 1900. Er besitzt 5 Geschosse und besteht aus einem Vorderhaus, Seitenflügel und Quergebäude.', 'Diese Wohnung befindet sich im 3.OG des Seitenflügels und hat 1 Zimmer, ein gefliestes Bad mit Dusche, WC und Waschbecken und eine Küche. \r\rSie wird vermietet als Kapitalanlage angeboten. \r\rWeitere Details auf Anfrage.', 'Berlin-Tiergarten - In einer ruhigen Seitenstraße liegt dieses schöne Objekt. Dieser Bereich ist bekannt für seine Gründerzeitbauten. In diesem Gebiet gibt es bestimmten Milieuschutz, sodass dieser Anblick auch noch lange erhalten bleibt. Die Anbindungen sind gut. Auf der Perlebergerstraße fährt ein Bus und die nächste U-Bahn ist die Station Birkenstraße oder Turmstraße. Der Fritz-Schloß-Park lädt zum spazieren gehen ein. Von hier aus kommt man schnell ins Zentrum Berlins, sowie zur Universität und auch zur Autobahn.', 'Der Käufer hat bei Abschluss des Kaufvertrages eine Provision in Höhe von 7,14 % inkl. Mehrwertsteuer vom Kaufpreis an uns zu zahlen. Verdient und fällig bei Beurkundung. Alle Angaben sind ohne Gewähr und nach den Unterlagen des Eigentümers erstellt. Irrtümer und Änderungen vorbehalten. Bei aller Sorgfalt können wir keine Garantie dafür übernehmen, dass alle Angaben richtig sind, und das Objekt im Augenblick des Zugangs der Offerte noch verfügbar ist. \r\rBei Anfragen bitten wir um vollständige Absenderangaben. \r\rGerne zeigen wir Ihnen das Objekt, und freuen uns auf einen persönlichen Termin mit Ihnen. \r\rSie erreichen uns wie folgt:\rRüdiger Wilkanowski Immobilien\rIn Kooperation mit:\r\rJohannes Rudert Immobilien\rTelefon: 0174-9542360\rFax: 030 / 85605613\r\rGerne zeigen wir Ihnen das Objekt, und freuen uns auf einen persönlichen Termin mit Ihnen. \r\rWeitere interessante Angebote finden Sie auch im Internet unter www.wilkanowski-immobilien.de.\r\rSie wollen Ihre Immobilie verkaufen ?\r \rWir suchen im Stadtgebiet von Berlin Immobilien (freie Eigentumswohnungen, Mehrfamilienhäuser und Einfamilienhäuser). Sprechen sie uns gerne an oder vereinbaren Sie einen persönlichen Termin mit uns: 030-85605612.'];energy_consumption;69.8;;;;2001;;
2020-05-24 21:15:16.108805;Berlin;gas_heating;ONE_YEAR_FREE;661644;n;y;https://pictures.immobilienscout24.de/listings/f555508b-647c-4eb2-b8bd-2f403d00f64c-1337502040.jpg/ORIG/resize/118x118%3E/extent/118x118/format/jpg/quality/80;11;11.24;40 MBit/s;telekom_layer_magenta_l;über VDSL;1910;REGULAR;11.24;114684348;gas;y;false;MagentaZuhause L;y;Berlin;y;8;1;219;no_information;6.2;68.15;Berlin;10713;mint_condition;sophisticated;false;100 MBit/s;no_information;no_information;y;https://padlock.link/ioml;https://padlock.link/ml;no_information;roof_storey;10713;3;n;2010;2,active;true;Deutschland;standard;100 MBit/s;wohnung_kauf;n;5;web,email,bank,music,dl-ul,game,sd,mltstr,hd,fast-ul-dl;true;001.661644;429000;profile0;5;3;true;n;;n;n;Wilmersdorf_Wilmersdorf;114684348;3;Berlin;/expose/114684348;['Durch das Zusammenspiel von optimal komprimierter Raumaufteilung, repräsentativen Raumhöhen, überdurchschnittlich wertiger Ausstattung, exponiertem Standort zwischen Stadtpark und Kurfürstendamm sowie einem sehr attraktiven Kaufpreis für drei Zimmer mit Balkonterrasse inmitten der City-West überzeugt diese sonnendurchflutete Eigentumswohnung sofort!', '- 3 große, sonnenhelle Wohnräume\n- Design-Einbauküche\n- Masterbad mit Badewanne, großem Oberlicht, Glasduschtrennwand\n- S/W-Balkonterrasse\n- Personenaufzug\n- Kellerraum', 'Diese Dachgeschosswohnung befindet sich im 5. Obergeschoss des Vorderhauses eines repräsentativen Wilmersdorfer Komfortaltbaus, inmitten der Berliner City-West, direkt gegenüber des Volksparks Wilmersdorf.\n\nVon diesem Topstandort aus erreicht man in wenigen Geh-/Fahrminuten den Ludwigkirchplatz, den Kurfürstendamm, den Grunewald, das KaDeWe, den Tiergarten. Selbst zum Potsdamer Platz sind es mit dem Fahrrad keine zwanzig Minuten.\n\nÖPNV (Zone A):\n\nBuss 101, 104, 249\nU-Bahn 7 (Blissestraße), 7,9 (Berliner Straße)\nS-Bahn 41, 42, 46 (Bundesplatz)', 'Bitte beachten Sie, dass wir nur vollständig ausgefüllte Anfragen mit Namen, Anschrift und Telefonnummer bearbeiten können. \n\nRDM - Seit 1982 Mitglied im Ring Deutscher Makler - Landesverband Berlin-Brandenburg'];energy_consumption;98.8;;disabled;C;;68.15;
