2020-05-24 20:49:30.397549;Berlin;;ONE_YEAR_FREE;174522;n;y;https://pictures.immobilienscout24.de/listings/d72c685f-4ae7-4fc0-975b-0a9bed7af2c2-1367868485.jpg/ORIG/resize/118x118%3E/extent/118x118/format/jpg/quality/80;9;11.19;40 MBit/s;telekom_layer_magenta_l;über VDSL;;REGULAR;11.19;118141143;;y;true;MagentaZuhause L;y;Berlin;n;4;;;no_information;;5.36;56;Berlin;13509;no_information;no_information;;false;100 MBit/s;no_information;no_information;n;https://padlock.link/ioml;https://padlock.link/ml;no_information;apartment;13509;3;;n;;2,active;true;Deutschland;top;100 MBit/s;wohnung_kauf;y;;web,email,bank,music,dl-ul,game,sd,mltstr,hd,fast-ul-dl;true;001.174522;180000;profile0;;3;true;y;showqualicontactform;n;n;Wittenau_Reinickendorf;118141143;2;Berlin;/expose/118141143;['Diese Wohnung umfasst drei angenehme Zimmer, eine Küche und ein 2014 saniertes Badezimmer. Im Zuge der Sanierung wurde das Bad u.a. mit neuen Abwasserrohren, großformatigen Fliesen, einem neuen Waschtisch, einer neuen Toilette und Eckwanne ausgestattet. Auch die Küche hat große Bodenfliesen und gepflegte Einbauten. Die behaglichen Zimmer und der Flur verfügen noch über die originalen charaktervollen Holzdielenböden, die in einem guten Zustand aufwarten. Die Doppelkastenfenster und Tür zur Loggia sind mit Rollläden ausgestattet. Akzentuiert wird das Ambiente von massiven Holzinnentüren. Die zurzeit vermietete Wohnung kann bei Bedarf gekündigt werden. Zu dieser gepflegten Wohnung gehört ein ca. 15 m2 großer Kellerraum. Der zughörige eigene Garten hat ein Gartenhaus und einen Wasseranschluss.\nIn der wohnlichen Lage lässt sich die Sonnenloggia besonders gut genießen. Mit dem speziellen Extra des separaten Gartens wird dieses Immobilienangebot noch attraktiver. Dank der guten Lage-, Architektur- und Raumqualitäten bietet diese Wohnung einen hohen Anlagewert.\n\nEin Energieausweis ist nicht vorhanden.', 'Sie möchten den Marktwert Ihrer Immobilie wissen oder Ihre Immobilie verkaufen? Wir sind seit 1995 erfolgreich im Verkauf von Immobilien in Berlin, Potsdam und Umgebung tätig. Unsere exzellenten Eigentümerbewertungen sprechen für sich.\n\n•\tOftmals haben wir schon den richtigen Käufer für Ihre Immobilie in unserer Kartei\n•\tWir sind Bellevue Best Property Agent und Mitglied in den Verbänden IVD & FIABCI\n•\tWir benötigen keinen schriftlichen Alleinauftrag\n•\tKosten entstehen Ihnen bei uns keine\n•\tUnsere Spezialisten stehen Ihnen gerne für ein erstes – für Sie unverbindliches - Gespräch zur Verfügung\n\nWir freuen uns über Ihre Kontaktaufnahme unter einkauf@immoberlin.de oder (030) 895 72 20.\nBitte besuchen Sie auch unsere Website: \nhttps://www.immoberlin.de'];no_information;disabled;;;;;;
2020-05-24 20:49:30.864946;Berlin;;ONE_YEAR_FREE;174522;n;n;https://pictures.immobilienscout24.de/listings/2dfe5513-785b-4d36-be37-d300d6e43bca-1367869894.jpg/ORIG/resize/118x118%3E/extent/118x118/format/jpg/quality/80;13;11.13;40 MBit/s;telekom_layer_magenta_l;über VDSL;1954;REGULAR;11.13;118141391;natural_gas_light;n;true;MagentaZuhause L;y;Berlin;n;6;2;;no_information;energy_consumption;5.02;57;Berlin;12249;no_information;no_information;F;false;100 MBit/s;outside;no_information;n;https://padlock.link/ioml;https://padlock.link/ml;no_information;apartment;12249;2;162;n;;2,active;true;Deutschland;top;100 MBit/s;wohnung_kauf;n;;web,email,bank,music,dl-ul,game,sd,mltstr,hd,fast-ul-dl;true;001.174522;279000;profile0;;2;true;n;showqualicontactform;n;n;Lankwitz_Steglitz;118141391;2;Berlin;/expose/118141391;['Diese äußerst ansprechende, anregend lichtdurchflutete Wohnung bietet das Privileg des Ersteinzuges nach einer Kernsanierung. Eingebaut wurden Fenster mit energiesparendem Isolierglas und Granitfensterbänken. Sehr attraktiv ist die neu gestaltete Offenheit, um direkt in die Wohnküche gehen zu können. Der Fußboden im Küchenbereich wurde zum größten Teil neu gefliest. Die Fußböden in den Zimmern und im Flur brillieren mit abgezogenen Holzdielen. Die Zimmerdecken erhielten Stuckleisten und Rosetten.\nDie Schwellen und alten Türen werden aufgearbeitet und hergerichtet. Fein gespachtelte Wände, z.T. abgehangene Decken und moderne LED-Beleuchtungen akzentuieren das Ambiente. Attraktiv ist auch das taghelle Bad. Vor dem neuen Putz ist eine Neuinstallation aller Rohrleitungen und elektrischen Leitungen durchgeführt worden. Zudem wurden elektrische Durchlauferhitzer, Wassermengenregler/-zähler sowie Breitbandkabel- und Netzwerkanschlüsse installiert. Eine Küchenausstattung gehört nicht zum Kaufumfang. Die Haustür wurde bereits 2007 erneuert. Ein zur Wohnung gehöriger großer Kellerraum und ein Pkw-Stellplatz perfektionieren das Angebot.\nDie Wohnanlage verfügt über eine neue Heizung, heizbare Treppenhäuser und eine moderne Klingelanlage. Die Dächer wurden saniert. Es existiert seit Jahren ein vernünftiger Wirtschaftsplan. Auch die Fassade wurde bereits saniert, so dass kein Sanierungsstau besteht. Die Rücklagen der WEG sind sehr gut. \nDiese Wohnung ist für einen Single oder ein Paar die Erfüllung eines Traumes – eine Altbauperle in behaglicher Lage.', 'Sie möchten den Marktwert Ihrer Immobilie wissen oder Ihre Immobilie verkaufen? Wir sind seit 1995 erfolgreich im Verkauf von Immobilien in Berlin, Potsdam und Umgebung tätig. Unsere exzellenten Eigentümerbewertungen sprechen für sich.\n\n•\tOftmals haben wir schon den richtigen Käufer für Ihre Immobilie in unserer Kartei\n•\tWir sind Bellevue Best Property Agent und Mitglied in den Verbänden IVD & FIABCI\n•\tWir benötigen keinen schriftlichen Alleinauftrag\n•\tKosten entstehen Ihnen bei uns keine\n•\tUnsere Spezialisten stehen Ihnen gerne für ein erstes – für Sie unverbindliches - Gespräch zur Verfügung\n\nWir freuen uns über Ihre Kontaktaufnahme unter einkauf@immoberlin.de oder (030) 895 72 20.\nBitte besuchen Sie auch unsere Website: \nhttps://www.immoberlin.de'];central_heating;disabled;;;;;;
2020-05-24 20:49:31.193326;Berlin;;ONE_YEAR_FREE;174522;n;y;https://pictures.immobilienscout24.de/listings/e4da5cd5-11aa-4412-95d9-4f9b656a3725-1367869252.jpg/ORIG/resize/118x118%3E/extent/118x118/format/jpg/quality/80;7;9.13;40 MBit/s;telekom_layer_magenta_l;über VDSL;;REGULAR;9.13;118141269;;n;true;MagentaZuhause L;y;Berlin;n;4;;;no_information;;5.09;60;Berlin;12555;no_information;no_information;;false;100 MBit/s;no_information;no_information;n;https://padlock.link/ioml;https://padlock.link/ml;no_information;apartment;12555;2;;n;;2,active;true;Deutschland;top;100 MBit/s;wohnung_kauf;y;;web,email,bank,music,dl-ul,game,sd,mltstr,hd,fast-ul-dl;true;001.174522;199000;profile0;;2;true;n;showqualicontactform;n;n;Köpenick_Köpenick;118141269;2;Berlin;/expose/118141269;['Diese Wohnung bietet einen komfortablen Grundriss, ausgehend von einer geräumigen Diele. Zur rechten Seite zweigt der Wohn- und Essbereich in attraktiver L-Form ab. Er öffnet sich durch eine großzügige Fenster-/Türfront der überdachten Südterrasse, die eine sehr sonnige und lauschige Atmosphäre bietet. Ein zweites Fenster in Südlage verstärkt das tageslichtstarke Ambiente im Wohn- und Essbereich. Gegenüber der Einbauküche ist die Abstellkammer sehr praktisch. Neben der Küche befindet sich das große, weiß geflieste Badezimmer, das u.a. mit einer Wanne und einem Waschmaschinenanschluss ausgestattet ist. Direkt an das Bad angrenzend ist das Schlafzimmer ein behagliches Refugium. Kein Heizkörper stört in dieser Wohnung den klaren Ausblick, denn überall gibt es Fußbodenheizungen. Zukunftsweisend ist die behindertengerechte Bauweise dieses Hauses.\nDiese Lage-, Architektur- und Ausstattungsqualitäten bilden  \nexzellente Voraussetzungen für eine stetige Mietattraktivität. \nEin Energieausweis ist nicht vorhanden.', 'Sie möchten den Marktwert Ihrer Immobilie wissen oder Ihre Immobilie verkaufen? Wir sind seit 1995 erfolgreich im Verkauf von Immobilien in Berlin, Potsdam und Umgebung tätig. Unsere exzellenten Eigentümerbewertungen sprechen für sich.\n\n• Oftmals haben wir schon den richtigen Käufer für \n  Ihre Immobilie in unserer Kartei\n• Wir sind Bellevue Best Property Agent und Mitglied \n  in den Verbänden IVD & FIABCI\n• Wir benötigen keinen schriftlichen Alleinauftrag\n• Kosten entstehen Ihnen bei uns keine\n• Unsere Spezialisten stehen Ihnen gerne für ein \n  erstes – für Sie unverbindliches - Gespräch zur \n  Verfügung\n\nWir freuen uns über Ihre Kontaktaufnahme unter einkauf@immoberlin.de oder (030) 895 72 20.\nBitte besuchen Sie auch unsere Website: \nhttps://www.immoberlin.de'];no_information;disabled;;;;;;
2020-05-24 20:49:31.565752;Berlin;;ONE_YEAR_FREE;3773239;n;y;https://pictures.immobilienscout24.de/listings/e00c152c-ef58-4e14-9a96-d48a8c89b398-1367974546.jpg/ORIG/resize/118x118%3E/extent/118x118/format/jpg/quality/80;12;8.81;2,4 MBit/s;telekom_layer_magenta_m_hybrid2;über Hybrid;1997;WITH_HYBRID;8.81;118154865;district_heating;y;false;MagentaZuhause M Hybrid (2);n;Berlin;y;3;5;126.77;36;energy_consumption;3.97;34.17;Berlin;12587;well_kept;normal;C;false;16 MBit/s;no_information;Charlotte-E.-Pauly-Str.;n;https://padlock.link/mmh2sa;https://padlock.link/mmhy2;Charlotte-E.-Pauly-Str.;terraced_flat;12587;1;88.8;n;;2,active;true;Deutschland;standard;50 MBit/s;wohnung_kauf;y;3;web,email,bank,music,dl-ul,game,sd,mltstr,hd;true;001.3773239;119500;profile0;3;1;true;n;showqualicontactform;n;n;Friedrichshagen_Köpenick;118154865;1;Berlin;/expose/118154865;['- Wohnanlage Baujahr 1997\n- 176 Einheiten\n- Davon 15 Gewerbeeinheiten im EG\n- Großzügiger Innenhof mit Spielplatz\n- Vollwärmedämmung\n- Durchgehend Isolierglasfenster (Kunststoff)\n- Laufende Instandhaltung\n- Komfortable Instandhaltungsrücklage', '- 1 Zimmer, Flur, Küche, Bad, Abstellraum\n- 34,17 m²\n- 3. OG (DG)\n- Großzügige Sonnenterrasse\n- Durchgehend Rolläden\n- Kellerabteil (Sondereigentum)\n- Modernes Bad mit Hänge-WC + Fenster\n- Einbauküche (Teil des Angebots)\n- Voll möbliert (Möbel sind Teil des Angebots)', '- Friedrichshagen\n- Versorgung in der nahe gelegenen Bölschestr.\n- Fußläufig zum Müggelsee\n- Sehr ruhige Lage', 'Die Wohnung ist seit 2009 an einen einzelnen Herrn vermietet. Es wurde ein Brutto-Inklusivvertrag (Pauschalmiete inkl. Nebenkosten) abgeschlossen. Die aktuelle Pauschalmiete beträgt € 441,72. Mitvermietet sind diverse Möbel, die im Kaufpreis enthalten sind.\n\nDer Pauschalmietvertrag wird inzwischen, in gegenseitigem Einvernehmen, wie ein normaler Mietvertrag behandelt. Rechnerisch wird eine Nettokaltmiete in Höhe von € 312,08 und Vorauszahlungen für Nebenkosten in Höhe von € 129,64. Über die Nebenkosten wird jährlich abgerechnet.\n\nDie Wohnung wird durch den Mieter in gepflegtem Zustand gehalten. Es besteht keine Kündigungssperrfrist.\n\nAlle Angaben nach bestem Wissen. Irrtum und Auslassungen vorbehalten. Weitere Informationen und Besichtigungen auf Anfrage.'];district_heating;;;;10 MBit/s;50 MBit/s;;
2020-05-24 20:49:31.904751;Berlin;;ONE_YEAR_FREE;174522;n;n;https://pictures.immobilienscout24.de/listings/7c9000d2-c5ec-4ba9-a266-37db2fb91098-1367869592.jpg/ORIG/resize/118x118%3E/extent/118x118/format/jpg/quality/80;11;10.37;40 MBit/s;telekom_layer_magenta_l;über VDSL;1900;REGULAR;10.37;118141330;oil;n;true;MagentaZuhause L;y;Berlin;n;8;1;;no_information;energy_consumption;4.8;113;Berlin;12203;no_information;no_information;;false;100 MBit/s;no_information;no_information;n;https://padlock.link/ioml;https://padlock.link/ml;no_information;apartment;12203;3;192.4;n;;2,active;true;Deutschland;top;100 MBit/s;wohnung_kauf;n;;web,email,bank,music,dl-ul,game,sd,mltstr,hd,fast-ul-dl;true;001.174522;419000;profile0;;3;true;n;showqualicontactform;n;n;Lichterfelde_Steglitz;118141330;5;Berlin;/expose/118141330;['Die großzügige Wohndiele dieser attraktiven Wohnung kann als geselliges Zentrum genutzt werden. Vor dem stilvollen Kamin lässt sich auf dem charaktervollen Parkettboden eine gemütliche Wohnlounge einrichten, von der zwei Zimmer, die Küche und das Badezimmer direkt zugänglich sind. Das dritte geräumige Zimmer mit großem Fenster ist über einen kleinen Zwischenflur erreichbar, von dem eine Abstellkammer abgeht. Unter den ca. 2,75 Meter hohen Decken präsentiert sich in den drei Zimmern ein exquisites Ambiente, das von wunderschönen, sehr gepflegten Parkettböden in Fischgrätenmuster akzentuiert wird.\nDie originalen Doppelkastenfenster aus Holz sind ebenfalls in einem guten Erhaltungszustand und lassen viel Tageslicht hinein. Die Küche ist als Wohnküche sehr familien- und gastfreundlich dimensioniert. Sie hat zwei Fenster und ist ebenfalls mit behaglichem Parkett ausgestattet. Zeitgemäß sind die großen Fliesen an der Wand bei der Keramikspüle und beim Cerankochfeld sowie die integrierten Schrank- und Geräteeinbauten. Apart gestaltet mit extragroßen Wand- und Bodenfliesen wurde das taghelle Bad. Der hölzerne Waschtisch, die gläserne Duschwand an der Wanne, klassischen Armaturen, Handtuchheizung und anderen Sanitärelemente zeugen von einem ansprechenden Design. Die Wärmeversorgung aller Räumlichkeiten erfolgt durch eine Zentralheizung. Dieser renovierten Wohnung ist ein Kelleranteil zugeordnet. Sehr angenehm ist, dass der große Garten mitgenutzt werden darf. \nin sehr gefragter Lage erhalten Sie In dieser hübschen Stadtvilla eine komfortable Zimmergroßzügigkeit und ein charmantes Ambiente.', 'Sie möchten den Marktwert Ihrer Immobilie wissen oder Ihre Immobilie verkaufen? Wir sind seit 1995 erfolgreich im Verkauf von Immobilien in Berlin, Potsdam und Umgebung tätig. Unsere exzellenten Eigentümerbewertungen sprechen für sich.\n\n•\tOftmals haben wir schon den richtigen Käufer für Ihre Immobilie in unserer Kartei\n•\tWir sind Bellevue Best Property Agent und Mitglied in den Verbänden IVD & FIABCI\n•\tWir benötigen keinen schriftlichen Alleinauftrag\n•\tKosten entstehen Ihnen bei uns keine\n•\tUnsere Spezialisten stehen Ihnen gerne für ein erstes – für Sie unverbindliches - Gespräch zur Verfügung\n\nWir freuen uns über Ihre Kontaktaufnahme unter einkauf@immoberlin.de oder (030) 895 72 20.\nBitte besuchen Sie auch unsere Website: \nhttps://www.immoberlin.de'];central_heating;disabled;;;;;;
2020-05-24 20:49:32.245800;Berlin;;ONE_YEAR_FREE;3587410;n;y;https://pictures.immobilienscout24.de/listings/d93f2686-4f45-4ab0-beb6-2498651c5ee6-1368444352.jpg/ORIG/resize/118x118%3E/extent/118x118/format/jpg/quality/80;2;7.89;40 MBit/s;telekom_layer_magenta_l;über VDSL;1899;REGULAR;7.89;118151412;no_information;y;false;MagentaZuhause L;y;Berlin;y;11;1;;no_information;;3.38;300;Berlin;14193;no_information;no_information;;false;100 MBit/s;no_information;no_information;n;https://padlock.link/ioml;https://padlock.link/ml;no_information;maisonette;14193;8;;n;;2,active;true;Deutschland;top;100 MBit/s;wohnung_kauf;n;;web,email,bank,music,dl-ul,game,sd,mltstr,hd,fast-ul-dl;true;001.3587410;1990000;profile0;3;5;true;n;showqualicontactform;n;n;Grunewald_Wilmersdorf;29;7;Berlin;/expose/118151412;['Maisonnette-Wohnung über 3 Etagen  in historischer, denkmalgeschützter Grunewald-Villa mit ca. 800 m² Garten. Diese großzügigen Wohnungen gehören zu einem herrschaftlichen Landhaus, welches sich nach dem Betreten des historischen Treppenhauses in zwei Teile aufteilt. Zum Verkauf steht der rechte Teil dieser ungewöhnlichen Villa. \r\n\r\n', 'Das Villenviertel Grunewald um die oberen Grunewaldseen gehört zu den beliebtesten und teuersten Wohngegenden Berlins. Die City-West ist schnell erreichbar. In der Nähe befindet sich der Kurfürstendamm mit eleganten Boutiquen, Cafés, Restaurants und die Schaubühne. Die Seen in der Umgebung und der Grunewald laden zu erholsamen Spaziergängen ein. Mehrere gute Schulen, auch bilinguale, sind bequem erreichbar. Es handelt sich um eine Oase des gepflegten Lebensstils inmitten Berlins.\u2028 Am nahe gelegenen Roseneck finden Sie das Wiener Caféhaus, Restaurants, Geschäfte des täglichen Bedarfs, Banken, Ärzte und Apotheken.\r\n', 'Sehr geehrte(r) Interessent*in,\r\n\r\ngerne übersenden wir Ihnen ein aussagekräftiges, kostenloses und unverbindliches Exposé, sobald wir Ihren Namen, Ihre Telefonnummer und Ihre Anschrift erhalten haben. Aufgrund der gesetzlichen Vorgaben und zur Sicherheit der Eigentümer dürfen wir andernfalls keine Informationen herausgeben. \r\n\r\nSeit über 25 Jahren hat  Mögling Immobilien Berlin Erfahrung in der Vermarktung hochwertiger Villen, Einfamilienhäuser, Grundstücken und Eigentumswohnungen speziell im Berliner Südwesten. Wir verfügen über weitreichende persönliche Kontakte sowie ortsspezifische Detailkenntnisse und sind als Ihr persönlicher Ansprechpartner an Ihrer Seite auch nach erfolgreicher Vermittlung einer Immobilie. Wir arbeiten äußerst diskret und gehen auf Ihre Wünsche ein. Wir arbeiten fair, partnerschaftlich und langfristig mit unseren Kunden zusammen. Wir leben von Ihren guten Empfehlungen.'];gas_heating;disabled;;;;;;
2020-05-24 20:49:32.631551;Berlin;;ONE_YEAR_FREE;10140;n;y;https://pictures.immobilienscout24.de/listings/ed4fcb07-4f82-4b75-9d25-1ab11425059f-1367923611.jpg/ORIG/resize/118x118%3E/extent/118x118/format/jpg/quality/80;9;12.41;40 MBit/s;telekom_layer_magenta_l;über VDSL;1937;REGULAR;12.41;118147430;district_heating;y;false;MagentaZuhause L;y;Berlin;y;3;1;192.55;21;energy_consumption;6.33;39.24;Berlin;12099;well_kept;normal;D;false;100 MBit/s;no_information;Nackenheimer Weg;n;https://padlock.link/ioml;https://padlock.link/ml;Nackenheimer_Weg;roof_storey;12099;2;107;n;;2,active;true;Deutschland;top;100 MBit/s;wohnung_kauf;y;3;web,email,bank,music,dl-ul,game,sd,mltstr,hd,fast-ul-dl;true;001.10140;140000;profile0;;2;true;y;showqualicontactform;n;n;Tempelhof_Tempelhof;4081;1;Berlin;/expose/118147430;"['Die vermietete 2-Zimmer-Dachgeschosswohnung mit Balkon, separater Küche mit Einbauküche, Bad mit Badewanne und Fenster befindet sich im DG links in einem 1937 erbauten und im Jahr 1999 sanierten Mehrfamilienhaus in 12099 Berlin. Zur Wohnung gehört ein Kellerabteil. Die Wohnung entspricht Miteigentumsanteilen (MEA) von 8.832 / 100.000stel. Der Fahrradraum und der großflächige Innenhof mit Grünflächen und Spielplatz sind zur gemeinschaftlichen Nutzung freigegeben. Das Objekt wird durch eine Fernwärme-Zentralheizung erwärmt. Die Hausgeldvorauszahlung beträgt monatlich 192,55 € (rund 97,00 € umlegbar) und beinhaltet eine Instandhaltungsrücklage. Zum 31.12.2018 betrug die Instandhaltungsrücklage rund 20.500,00 € (Anteil rund 1.810,00 €). Die jährliche Einzahlung in die Instandhaltungsrücklage wurde zuletzt mit 25.000,00 € (Anteil 2.200,00 €) beschlossen. Die Objektreinigung erfolgt durch eine Dienstleistungsfirma. Die Wohnung ist seit 06/2019 vermietet und erzielt eine Jahresnettomiete in Höhe von 4.237,92 € (monatlich 353,16 €). Vor Neuvermietung wurde das Laminat erneuert. \n\nEs besteht die Möglichkeit für den Käufer per Beitrittsantrag in die Mietenpool GbR der WEG einzutreten, wobei dies die Zustimmung der Geschäftsführung bedarf. Die monatliche Mietausschütttung schwankt zwischen mindestens 210,00 € bis maximal 330,00 €. Es wurde nach Abzug der Sondereigentumsverwaltungskosten (in 2019 monatlich 21,00 €) im Jahr:\n- 2016 insgesamt 3.234,56 € (durchschnittlich 269,55 €/Monat),\n- 2017 insgesamt 3.294,86 € (durchschnittlich 274,57 €/Monat),\n- 2018 insgesamt 3.311,84 € (durchschnittlich 275,99 €/Monat) und\n- 2019 insgesamt 2.998,51 € (durchschnittlich 249,88 €/Monat),\nJahresnettomiete ausgezahlt. \n\nHINWEISE ZUM OBJEKT / KAUF:\n- Verwalterzustimmung erforderlich (Kosten 153,39 € trägt Käufer)\n- Diverse Instandsetzungen am Objekt erforderlich:\n* Abwasseraustritt im Keller (Lecksuche in Arbeit)\n* Brandwand zum Nachbarobjekt mit Rissen (Sanierung empfohlen)\n* Legionellenbefund (Gefährdungsanalyse, Termparaturerhöhung und Perlatorenaustausch beauftragt)', '- 2-Zimmer-Dachgeschosswohnung (Nr. 9) mit 39,24 m² Wohnfläche,\n- Laminat (Neuverlegung in 05/2019) in Flur und Wohnräumen, \n- Balkon,\n- separate Küche mit Einbauküche und Fenster,\n- Bad mit Badewanne und Fenster,\n- Waschmaschinenanschluss im Bad,\n- Kellerabteil (Nr. 9),\n- Fernwärme-Zentralheizung,\n- Fahrradraum,\n- DSL (Download) bis 1.000 MBit/s bzw. 1 GB/s möglich,\n- Daten Energieverbrauchsausweis: \nAusstellungsdatum 05.09.2018, Gültigkeit 04.09.2028, Baujahr 1937, Energieträger Fernwärme, Energieverbrauchskennwert 107 kWh/(m²xa) - ""D""', 'Die vermietete 2-Zimmer-Dachgeschosswohnung mit Balkon, separater Küche mit Einbauküche, Bad mit Badewanne und Fenster befindet sich in 12099 Berlin - Tempelhof. Versorgungs- und Dienstleistungseinrichtungen, Schule, Kindergarten, Ärzte sind ca. 5-10 Minuten entfernt. Die A100 ist in weniger als 5 Minuten mit dem Auto erreichbar. In direkter Umgebung befinden der Oberlandpark und das Tempelhofer Feld. Die Haltestellen der Buslinien 246 (+ N46),  277 (+ N77) und der Knotenpunkt ""Hermannstraße"" mit den S- und U-Bahnlinien S41, S42, S45, S46, S47 und U8, sowie den Buslinien 370, 377, M44 und N8 sind in 5 Minuten zu Fuß erreichbar.', 'Unsere Objektangebotsangaben basieren auf Informationen, die uns vom Eigentümer / Anbieter erteilt wurden. Eine Haftung für deren Richtigkeit und Vollständigkeit können wir deshalb nicht übernehmen.\n\nBitte beachten Sie, dass die beworbene Wohnung derzeitig bewohnt ist und Besichtigungstermine erst mit den Mietern abgestimmt werden müssen. Sobald dies gelungen ist, werden wir uns auf Ihre Anfrage rückmelden.\n\nSollten Sie Fragen zum Objekt haben, können Sie sich an Herrn Rumpelt (0351 / 2677613, 0173 / 3909362 oder info@freudenberg-dresden.de) wenden.\n\nNach Erhalt Ihrer Anfrage (bitte mit Angabe Ihrer Postanschrift) werden wir Ihnen Unterlagen und Fotos zum angebotenen Objekt zur Verfügung stellen.']";central_heating;;0;;;;200;
2020-05-24 20:49:32.985989;Berlin;;;300581;n;y;https://pictures.immobilienscout24.de/listings/c687c55a-07fa-4e9f-8841-2c94f930fd41-1367642270.jpg/ORIG/resize/118x118%3E/extent/118x118/format/jpg/quality/80;11;12.19;;;;1900;;12.19;118108284;gas;n;false;;y;Berlin;n;8;1;290;xx;energy_consumption;7.44;84.43;Berlin;10999;fully_renovated;no_information;NO_INFORMATION;false;;no_information;"Reichenberger Stra&szlig;e";n;;;Reichenberger_Straße;raised_ground_floor;10999;3;110;n;;2,active;;Deutschland;top;;wohnung_kauf;n;;;;001.300581;420000;profile0;;3;true;n;showqualicontactform;n;n;Kreuzberg_Kreuzberg;118108284;4;Berlin;/expose/118108284;['Die Wohnung wurde noch Auszug des Mieters komplett renoviert, alle Türen und Türrahmen wurden neu lackiert.\nDie Diele bietet noch Raum für eine Garderobe und verfügt über den Zugang zur Kammer als zusätzlichen Stauraum.\nAlle Zimmer sind direkt und separat von der Diele begehbar.\nDie zum Hof liegende Küche bietet ausreichenden Platz für einen kleinen Esstisch.\nDas Wannenbad mit Fenster verfügt auch über einen Waschmaschinenstellplatz.', 'Die Zimmer, die Diele und die Küche sind mit Laminat versehen.\nDas Bad ist gefliest, die Warmwasserversorgung erfolgt zentral, kein Durchlauferhitzer oder Boiler.\nDer Balkon ist zum Hof ausgerichtet.\nDie Wohnung verfügt über Isolierverglasung.\nDie Wärmeversorgung erfolgt über von eine Gaszentralheizung. Der Gasbrenner wurde 2019 erneuert.', 'Seitenflügel Erdgeschoss/Hochparterre rechts\n(Laut Teilungserklärung Erdgeschoss, baulich jedoch Hochparterre).\nDie Reichenberger Straße ist eine nach wie vor begehrte Lage, zentral gelegen im ehemaligen SO 36 in Kreuzberg und in unmittelbarer Nähe des Paul-Lincke-Ufers am Landwehrkanal - ein nicht nur in Kreuzberg überaus beliebter Ort.\nSchulen, Kindergärten oder Sportplätze sind schnell zu erreichen.\nDie Nahverkehrsanbindung so wie auch die Anbindung mit dem Pkw ist aufgrund der zentralen Lage des Objekts gut gewährleistet:\nUmsteige-U-Bhf Kottbusser sowie die Buslinie M29 in der Reichenberger Strasse.\nHerzlich willkommen in Kreuzberg!', 'Auf Wunsch vermitteln wir Immobilien zur Eigennutzung sowie zur Kapitalanlage.\nFür eine unverbindliche Beratung bzw. Einschätzung stehen wir Ihnen gerne zur Verfügung.\nKontaktieren Sie uns telefonisch oder per E-Mail: 030 881 33 89 oder duelk-immobilien@t-online.de'];central_heating;;;;;;;
