timestamp;obj_regio1;obj_heatingType;obj_telekomTvOffer;obj_cId;obj_newlyConst;obj_balcony;obj_picture;obj_picturecount;obj_pricetrend;obj_telekomUploadSpeed;obj_telekomTrackingGroup;obj_telekomInternetTechnology;obj_yearConstructed;obj_telekomInternetType;obj_pricetrendbuy;obj_scoutId;obj_firingTypes;obj_hasKitchen;obj_ExclusiveExpose;obj_telekomInternetProductName;obj_courtage;geo_bln;obj_cellar;obj_purchasePriceRange;obj_yearConstructedRange;obj_houseNumber;obj_energyType;obj_pricetrendrent;obj_livingSpace;geo_krs;obj_zipCode;obj_condition;obj_interiorQual;ga_cd_cxp_historicallisting;obj_telekomDownloadSpeed;obj_parkingSpace;obj_street;obj_lift;obj_telekomInternetUrlMobile;obj_telekomInternetUrl;obj_streetPlain;obj_typeOfFlat;geo_plz;obj_noRooms;obj_thermalChar;obj_assistedLiving;obj_lastRefurbish;obj_ityp;obj_telekomHdTelephone;geo_land;ga_cd_via;obj_telekomInternet;obj_immotype;obj_rented;obj_floor;obj_telekomInternetServices;obj_telekomInternetProductAvailable;obj_cwId;obj_purchasePrice;ga_cd_application_requirements;obj_numberOfFloors;obj_noRoomsRange;ga_cd_maillead_default_shown;obj_garden;evt_count_pm_sig;obj_barrierFree;obj_international;obj_regio3;obj_objectnumber;obj_livingSpaceRange;obj_regio2;URL;beschreibung;obj_rentSubsidy;obj_groupnumber;obj_galleryAd;obj_noParkSpaces;obj_usableArea;obj_project_id;obj_nbp;obj_energyEfficiencyClass;ga_cd_via_qualified;ga_cd_developer_virtualreality
2020-05-24 21:02:30.292692;Berlin;floor_heating;ONE_YEAR_FREE;18267813;n;y;https://pictures.immobilienscout24.de/listings/28fbcfd3-3f0f-40d5-99a1-e0d14c1f8ce7-1361320562.jpg/ORIG/resize/118x118%3E/extent/118x118/format/jpg/quality/80;9;12.24;40 MBit/s;telekom_layer_magenta_l;über VDSL;1961;REGULAR;12.24;116812725;no_information;n;false;MagentaZuhause L;n;Berlin;y;8;2;18;energy_consumption;6.53;59.4;Berlin;10781;first_time_use_after_refurbishment;no_information;false;100 MBit/s;no_information;"Eisenacher Stra&szlig;e";y;https://padlock.link/ioml;https://padlock.link/ml;Eisenacher_Straße;roof_storey;10781;2;119.6;n;2020;2,active;true;Deutschland;standard;100 MBit/s;wohnung_kauf;n;5;web,email,bank,music,dl-ul,game,sd,mltstr,hd,fast-ul-dl;true;002.01009069705;484380;profile0;6;2;true;n;showqualicontactform;n;n;Schöneberg_Schöneberg;eed5d294-27b7-4a82-9e86-740c33cedcd3;2;Berlin;/expose/116812725;['__Das Gebäude__\n\nSteht man an der Ecke Eisenacher Straße/Luitpoldstraße, strahlt einen die Fassade von U_Topia und damit eine wundervolle Zukunft des Wohnens an. Denn hier wurde fast alles neu gestaltet. Das fängt bereits beim überarbeiteten Treppenhaus und dem begrünten Hof an, auf dem die Nachbarschaft zusammenfinden und sich den schönen Seiten des Lebens widmen kann. Noch deutlicher wird es aber in den Wohnungen, die durch drei unterschiedliche Grundrissarten überzeugen und frisch saniert sind. Sie bieten alles, was man zum zeitgemäßen Wohnen braucht. Dazu zählen Balkone an jeder Einheit, neue und hochwertige Parkettböden und ein durchdachtes Elektrikkonzept, um stets mit der neuesten Technik Schritt zu halten. Das schafft die Voraussetzungen, sich eine eigene kleine Welt ganz nach den eigenen Vorstellungen zu errichten.\n\n__Die Wohnung__\n\nDiese 2-Zimmer-Wohnung ist ideal für Paare, die sich ein modernes und für die Zukunft gerüstetes Zuhause einrichten möchten. Dafür sorgt unter anderem die Ausstattung mit einem durchdachten Elektrikkonzept für etwaige Smart-Home-Lösungen. Hinzu kommt ein günstiger Schnitt mit einem Tageslicht-Wannenbad, einer kompakten Küche und viel Wohnraum in zwei weitläufigen Zimmern. Das größere prädestiniert sich als Wohnzimmer mit anliegendem Westbalkon, auf dem man gemeinsam in der Abendsonne auf die vorzügliche Wohnsituation anstoßen kann.\n\n__Die Lage__\n\nZwischen Heinrich-Von-Kleist-Park und Viktoria-Luise-Platz zwar ruhig gelegen, befindet sich U_Topia dennoch im Herzen Schönebergs - und hier wird Vielfalt großgeschrieben. Jeder ist so wie er ist und soll auch so sein. Das spiegelt sich auch im Angebot wieder: In unmittelbarer Nähe laden Cafés, Bars und Restaurants zu kulinarischen Highlights aus aller Herren Länder ein. Nicht weit entfernt befinden sich zudem Kurfürstendamm und Tauentzienstraße mit einem Shoppingangebot, wie man es nirgendwo sonst in Berlin findet. Will man mal raus, sind ausgedehnte Spaziergänge im Tiergarten, auf dem Tempelhofer Feld und im Park am Gleisdreieck möglich. Die erreicht man, wie den Rest der Stadt, ganz einfach vom U-Bahnhof Nollendorfplatz aus mit diversen U-Bahnlinien. ', 'Frisch saniert\n\nWestbalkon\n\nWannenbad mit Tageslicht   \n\nBegehrter Grundriss\n\nZentrale Lage in Schöneberg', 'Zwischen Heinrich-Von-Kleist-Park und Viktoria-Luise-Platz zwar ruhig gelegen, befindet sich U_Topia dennoch im Herzen Schönebergs - und hier wird Vielfalt großgeschrieben. Jeder ist so wie er ist und soll auch so sein. Das spiegelt sich auch im Angebot wider: In unmittelbarer Nähe laden Cafés, Bars und Restaurants zu kulinarischen Highlights aus aller Herren Länder ein. Nicht weit entfernt befinden sich zudem Kurfürstendamm und Tauentzienstraße mit einem Shoppingangebot, wie man es nirgendwo sonst in Berlin findet. Will man mal raus, sind ausgedehnte Spaziergänge im Tiergarten, auf dem Tempelhofer Feld und im Park am Gleisdreieck möglich. Die erreicht man, wie den Rest der Stadt, ganz einfach vom U-Bahnhof Nollendorfplatz aus mit diversen U-Bahnlinien.', 'Traumwohnung gefunden? Dann nutzen Sie jetzt die EverEstate Immobilienfinanzierung in Zusammenarbeit mit unserem Partner ZIEGERT Immobilien und profitieren Sie von jahrelanger Expertise in Verbindung mit kompetenter Beratung. Kontaktieren Sie uns unter +49 (0) 30 / 700 1797 59 oder auf www.everestate.de/immobilienfinanzierung-mit-everestate und erhalten Sie auf Ihre Bedürfnisse zugeschnittene Angebote.'];;;;;;;;;;
2020-05-24 21:02:30.689220;Berlin;district_heating;ONE_YEAR_FREE;4332135;n;y;https://pictures.immobilienscout24.de/listings/c9a7ea58-b8d1-4ad0-a335-e7a16ba594a0-1359059033.jpg/ORIG/resize/118x118%3E/extent/118x118/format/jpg/quality/80;19;10.3;10 MBit/s;telekom_layer_magenta_m;über VDSL;1950;REGULAR;10.3;116825924;no_information;y;false;MagentaZuhause M;n;Berlin;y;7;1;2;;4.2;80;Berlin;14165;mint_condition;luxury;false;50 MBit/s;no_information;Hocksteinweg;n;https://padlock.link/iomm;https://padlock.link/mm;Hocksteinweg;other;14165;3;;n;2019;2,active;true;Deutschland;standard;50 MBit/s;wohnung_kauf;n;3;web,email,bank,music,dl-ul,game,sd,mltstr,hd,fast-ul-dl;true;001.4332135;333000;profile0;3;3;true;n;showqualicontactform;n;n;Zehlendorf_Zehlendorf;7de86bc5-0609-41de-834b-07fa553c0eb4;3;Berlin;/expose/116825924;['Bei dieser ansprechenden Immobilie handelt es sich um eine neuwertige freie  Wohnung (Bj. 2012) in der dritten Etage, die durch eine luxuriöse Innenausstattung besticht und ab sofort zum Kauf steht (Wohnung Nr. 28, s.s Teilungserklärung). Zu dem Apartment zählen drei schöne Zimmer. Beheizt wird das Objekt, das sich in einem Haus aus dem Jahr 1950 befindet, per Fernheizung (zentral Heizung und Warmwasser). Dachausbau - Jahr 2012. Das monatlich zu entrichtende Hausgeld beträgt 248,00\xa0€ inklusive Heizung, Warmwasser, Betriebskosten, Instanhaltungsrücklage und Verwaltungshonorar. Eine  Terrasse ca. 8 qm  können Sie an sonnigen Tagen zum zweiten Wohnzimmer machen. Praktischerweise gibt es auch einen Kellerraum (ca. 10 qm). Hier finden Sie genügend Stauraum für Ihre Habseligkeiten. Ihnen steht außerdem eine Einbauküche mit hochwertige Elektrogeräte zur Verfügung. Die Wohnung kann provisionsfrei von privat übernommen werden.\n\nZimmer 1  -  ca. 26 qm\nEss-Ecke  -  ca.  9 qm\nKüche       - ca.  8 qm\nFlur 1, 2,3  - ca.  9 qm\nBad           -  ca.  7 qm\nZimmer 2  - ca. 16 qm\nZimmer 3  - ca. 15 qm\nTerrasse   - ca. 8  qm\n______________\nGesamt:        ca. 98 qm\n- Schrägen   ca. 18 qm\n________________\nInsgesamt    ca. 80 qm\n\n', '- Eichenparkett, massiv Holz\n- neue Fenster, Isofenster (Holz)\n- EBK mit Elektrogeräte \n- voll möbliert. Kann mann auch ohne Möbel die Wohnung übernehmen  (der Preis ändert sich nicht).\n- Das Badezimmer ist vollausgestattet mit Badewanne und Fenster.\n\n', 'Sehr ruhige Lage in schönsten Bezirk Berlin-Zehlendorf.\nEinkaufsmöglichkeiten, Schulen, Kindergarten, Apotheke, Bushaltestelle u.a. sind zu Fuß erreichbar.', 'Frei ab sofort.\nProvisionsfrei.\nOhne Möbel auch möglich.'];248;;;;;;;;;
2020-05-24 21:02:31.111811;Berlin;central_heating;ONE_YEAR_FREE;179106;n;n;https://pictures.immobilienscout24.de/listings/58ffb2e2-6dee-45be-aa3d-6e703b9193c1-1360534870.jpg/ORIG/resize/118x118%3E/extent/118x118/format/jpg/quality/80;12;12.78;40 MBit/s;telekom_layer_magenta_l;über VDSL;1919;REGULAR;12.78;116812924;no_information;n;true;MagentaZuhause L;y;Berlin;n;8;1;no_information;;7.25;91.96;Berlin;10555;need_of_renovation;no_information;false;100 MBit/s;no_information;no_information;n;https://padlock.link/ioml;https://padlock.link/ml;no_information;no_information;10555;3;;n;;2,active;true;Deutschland;standard;100 MBit/s;wohnung_kauf;n;2;web,email,bank,music,dl-ul,game,sd,mltstr,hd,fast-ul-dl;true;001.179106;449000;profile0;4;3;true;n;;n;n;Tiergarten_Tiergarten;M327D1;4;Berlin;/expose/116812924;['Die hier angebotene Eigentumswohnung befindet sich im 2. OG des Vorderhauses. Der eindrucksvolle Altbau aus dem Jahr 1919 präsentiert sich in einem guten Zustand. In dieser Wohnung erwartet Sie ein klassischer Grundriss. Die Wohnfläche von ca. 92 m² verteilt sich auf 3 Zimmer, Küche sowie Bad. Eine Abstellkammer sorgt für zusätzlichen Stauraum. Der Balkon rundet diese Wohnung ab. Die Einheit bietet enorm viel Potential. Durch einige Renovierungsarbeiten erwecken Sie hier den besonderen Altbaucharme. Es besteht gem. Teilungserklärung weiterhin die Möglichkeit, einen Fahrstuhl sowie einen weiteren Balkon im Hofbereich anzubauen, um somit eine Wertsteigerung zu erzielen. Die Wohnung eignet sich besonders für Pärchen, die gerne zentral gelegen wohnen möchten.\n\nThe condominium offered here is located on the 2nd floor of the front building. The impressive old building from the year 1919 presents itself in a good condition. In this apartment a classical floor plan awaits you. The living space of approx. 91 m² is divided into 3 rooms, kitchen and bathroom. A storeroom provides additional storage space. The balcony completes this apartment. The unit offers enormous potential. Through some renovation work you will awaken the special charm of the old building. According to the declaration of partition, there is still the possibility to add an elevator and another balcony in the courtyard area, in order to achieve an increase in value. The apartment is particularly suitable for couples who would like to live in a central location.\n\n', 'Altbau, Gaszentralheizung, unvermietet, Leerstand, Selbstnutzung, Seniorengerechtes Wohnen, Renovierungsbedürftig, Aufzug mgl.', 'Das Gebäude befindet sich in guter Lage des Ortsteils Moabit. Umgeben vom wunderschönen Spreebogen, dem Westfälischen Viertel sowie dem Großen Tiergarten und Kleinen Tiergarten präsentiert sich dieses Objekt in einer gefragten Wohngegend. Die Straßenzüge, meist geprägt von wunderschönen Altbauten, laden zum Spazieren und Verweilen ein. Die hier vorhandenen Cafés und Restaurants bieten ein tolles gastronomisches Angebot. Nicht weit entfernt bieten Ihnen der Ökomarkt sowie die Arminiusmarkthalle frische Lebensmittel. Die stets lebendige Turmstraße mit ihrem ebenfalls sehr breiten Angebot an Gastronomie sowie das neu erbaute Schultheiss Quartier befinden sich in direkter Nähe. Die Anbindung ist sehr gut. Diverse Buslinien, die U-Bahn sowie die S-Bahn verkehren im direkten Umfeld.\nThe building is in a good location in Moabit. Surrounded by the beautiful Spreebogen, the Westphalian quarter as well as the large Tiergarten and the small Tiergarten this object presents itself in a sought-after residential area. The streets, mostly characterized by beautiful old buildings, invite you to stroll and linger. The cafés and restaurants available here offer a great gastronomic offer. Not far away the Ökomarkt and the Arminiusmarkthalle offer fresh food. The always lively Turmstraße with its wide range of gastronomy as well as the newly built Schultheiss Quartier are in the immediate vicinity. The connection is very good. Various bus lines, the underground as well as the S-Bahn run in the immediate vicinity.\n\n', 'Sie möchten Ihre Immobilie verkaufen? Wir sind Ihr Partner für einen erfolgreichen Verkauf.\n1. Unsere Experten verfügen über tiefgehende Kenntnis des bestehenden Immobilienmarktes und entwickeln gerne eine individuelle Verkaufsstrategie für Sie. Wir bewerten Ihre Immobilie unverbindlich, kostenfrei und marktgerecht.\n2. Wir sind für Sie da und begleiten Sie von der kostenlosen Beratung bis hin zum Notartermin, immer getreu unserer Philosophie: kompetent, zuverlässig und diskret.\n3. Unser nationales und internationales Netzwerk sowie interne Synergien ermöglichen Ihnen den Zugang zu potenziellen Käufern aus aller Welt und somit einen erfolgreichen Abschluss. \nProfitieren Sie von unserem Know-How, rund 20 Jahren Erfahrung und 6 Büros in den besten Lagen Berlins. Gerne beraten wir Sie kostenlos in unserem Büro, per Telefon oder E-Mail!  \nEnergieausweis vorhanden:\nnein'];274.64;666;;;;;;;;
2020-05-24 21:02:31.581073;Berlin;central_heating;ONE_YEAR_FREE;5359196;n;n;https://pictures.immobilienscout24.de/listings/c508d9d4-073f-4e0c-93a1-85e538448294-1359283929.jpg/ORIG/resize/118x118%3E/extent/118x118/format/jpg/quality/80;1;10.77;40 MBit/s;telekom_layer_magenta_l;über Glasfaser;1900;REGULAR;10.77;116847335;gas;y;false;MagentaZuhause L;y;Berlin;n;11;1;no_information;;5.67;225;Berlin;10179;refurbished;no_information;false;100 MBit/s;underground_garage;no_information;y;https://padlock.link/ioml;https://padlock.link/ml;no_information;roof_storey;10179;5;;n;;2,active;true;Deutschland;standard;100 MBit/s;wohnung_kauf;n;5;web,email,bank,music,dl-ul,game,sd,mltstr,hd,fast-ul-dl;true;001.5359196;1500000;profile0;5;5;true;n;showqualicontactform;n;n;Mitte_Mitte;F124#VCJmox;7;Berlin;/expose/116847335;['Die 5 Zimmer Dachgeschosswohnung befindet sich in einem gepflegten Altbau aus dem Jahr 1900. Das Dachgeschoss wurde  2014 aufwendig saniertr.\nDie Raumaufteilung ist großzügig angelegt und vermittelt ein hohes Maß an Räumlichkeit.\nAlle Räume sind hochwertig und ansprechend ausgestattet.\nMit dem Fahrstuhl gelangt man bis zur Wohnung.\nDer Stellplatz für 60.000,-€, in einer nahe gelegenen Tiefgarage, wird zusammen mit der Wohnung verkauft, so dass der Gesamtpreis für die Wohnung inkl. Stellplatz 1.560.000,-€ beträgt.\nDie Wohnung befindet sich in einem neuwertigen Zustand.', 'Die Immobilie liegt zentral und trotzdem ruhig in der Mitte von Berlin, unweit von der Museumsinsel, dem Alexanderplatz und dem Gendarmenmarkt.\nGute Anbindung an öffentliche Verkehrsmittel wie U-und S-Bahn sowie diverse Buslinien. Geschäfte zur Abdeckung des täglichen Bedarfs befinden sich in unmittelbarer Umgebung.', 'Sollten Sie hier Ihre Immobilie nicht gefunden haben, senden Sie uns bitte eine E-Mail mit Ihren Suchkriterien. Gern stellen wir Ihnen unsere diesbezüglichen Angebote vor. Selbstverständlich stehen wir Ihnen auch telefonisch gern zur Verfügung.\n\nDie Angaben in diesem Exposé beruhen auf die uns erteilten Informationen des Auftraggebers. Alle Angaben aus diesem Exposé stammen vom Verkäufer.\nDer Immobilienmakler hat insbesondere die Wohnflächenangabe des Verkäufers nicht überprüft und keine eigene Wohnflächenberechnung erstellt. \nWir bemühen uns, möglichst vollständige und richtige Angaben zu erhalten und an Sie weiterzuleiten. Wir übernehmen jedoch keine Haftung für die Angaben im Exposé.\n\nAufgrund der Makler- und Bauträgerverordnung sind wir verpflichtet, auf die Nachweis/-Vermittlungsprovision zu verweisen. Sie beträgt derzeit 7,14 % inkl. der gesetzlich gültigen Mehrwertsteuer vom tatsächlich erzielten Kaufpreis und ist fällig und zahlbar vom Käufer an die Heydukowski & Co. GbR bei Abschluss des notariellen Kaufvertrages oder eines wirtschaftlichen im Wesentlichen identischen Abschlusses. Eine Weitergabe dieser ausschließlich für Sie bestimmten Unterlagen an Dritte löst bei deren Kauf die Provisionspflicht des Empfängers aus.'];690;;disabled;1;;;;;;
2020-05-24 21:02:31.932505;Berlin;central_heating;ONE_YEAR_FREE;17840250;n;y;https://pictures.immobilienscout24.de/listings/1d8cb3d0-ac77-4abe-b2f3-272896146fd4-1359056907.jpg/ORIG/resize/118x118%3E/extent/118x118/format/jpg/quality/80;7;11.13;40 MBit/s;telekom_layer_magenta_l;über VDSL;1982;REGULAR;11.13;116823810;oil;y;false;MagentaZuhause L;n;Berlin;y;5;4;51;;5.02;62.39;Berlin;12247;well_kept;normal;false;100 MBit/s;garage;Leonorenstr.;n;https://padlock.link/ioml;https://padlock.link/ml;Leonorenstr.;apartment;12247;2;;n;;2,active;true;Deutschland;standard;100 MBit/s;wohnung_kauf;y;3;web,email,bank,music,dl-ul,game,sd,mltstr,hd,fast-ul-dl;true;002.01008543772;239500;profile0;2;2;true;y;showqualicontactform;n;n;Lankwitz_Steglitz;116823810;3;Berlin;/expose/116823810;['Das Gebäude in der Leonorenstraße 51 wurde 1982 erbaut. Bei den 14 Wohneinheiten handelt es sich um eine moderne Raumgestaltung von Zwei-Zimmer-Wohnungen. In Berlin ist diese\nWohnungsgröße sowohl bei Mietern, wie auch bei Kapitalanlegern stark nachgefragt.', 'Die Wohnungen verfügen über einen Balkon und teilweise über einen Garagen- bzw. Außenstellplatz vor dem Haus. Die Wohnung ist vermietet. Haben Sie bitte deshalb Verständnis das wir Bilder der Wohnung nicht im Internet veröffentlichen. Eine Besichtigung der Wohnung wird bei konkreten Kaufinteresse wird natürlich organisiert.', 'Neben der guten Ausstattung erfahren die Wohnungen durch ihre attraktive Lage (Naherholungsmöglichkeiten im Stadtpark Steglitz und im Schlosspark Lichterfelde) sowie durch die gute City-Anbindung zum Steglitzer Einkaufsboulevard Schloßstraße eine große Nachfrage.', 'Zur Förderung der wirtschaftlichen\nAbsichten der „Gemeinschaft der Erwerber“ hat sich der Eigentümer dazu entschlossen Erwerbern die Möglichkeit einzuräumen dem aktuellen Mietenpool Leonorenstr. 51 GbR beizutreten., Hier werden die Mieten der beigetretenen Wohnungseigentümer nach einem der m2 Wohnfläche und den Anteilen untereinander zugrunde liegenden Schlüssel gepoolt.\nDarunter ist zu verstehen, dass die Mieten aller Eigentümer auf ein gemeinschaftliches Konto eingezahlt werden. Die vereinnahmten Mieten\nwerden nach dem bestehenden Verteilungsschlüssel aufgeteilt und an die Eigentümer überwiesen. Der diesem System zugrunde liegende Vorteil ist, dass ein individuellesKostenrisiko durch Leerstand nicht\nbesteht. Des Weiteren partizipiert jeder Eigentümer davon, dass im Fall der Mieterhöhung bei einzelnen Mietverhältnissen die Gesamtsumme der ausschüttbaren Mieten erhöht wird, ebenso partizipiert jeder Eigentümer daran, dass die Möglichkeit besteht, bei Neuvermietungen von Wohnraum eine höhere\nMiete als vorher zu erzielen. Auch das kommt der Gemeinschaft der Anleger zu Gute.\nFür die Eigentümer wird das Maß an Sicherheit auch für den monatlichen Kapitaldienst erhöht. Aus dem Kaufpreis wird eine feste Summe\nvon EUR 45 pro m2 auf ein Sonderkonto\ndes Mietenpools gezahlt.'];160;;;1;62.39;;;;;
2020-05-24 21:02:32.367468;Berlin;floor_heating;ONE_YEAR_FREE;17535455;n;y;https://pictures.immobilienscout24.de/listings/d76f1be2-1ebe-4d87-8d00-4c0db65ae501-1358878900.jpg/ORIG/resize/118x118%3E/extent/118x118/format/jpg/quality/80;7;10.77;40 MBit/s;telekom_layer_magenta_l;über Glasfaser;;REGULAR;10.77;116806810;;n;false;MagentaZuhause L;n;Berlin;n;8;;14a;;5.67;62.38;Berlin;10557;first_time_use;sophisticated;false;100 MBit/s;no_information;"Heidestra&szlig;e";y;https://padlock.link/ioml;https://padlock.link/ml;Heidestraße;apartment;10557;2;;n;;2,active;true;Deutschland;premium;100 MBit/s;wohnung_kauf;n;3;web,email,bank,music,dl-ul,game,sd,mltstr,hd,fast-ul-dl;true;002.01008231578;479000;profile0;5;2;true;n;showqualicontactform;n;n;Mitte_Mitte;60109_H9 215;3;Berlin;/expose/116806810;['*** JETZT RESERVIEREN! Die letzten Wohneinheiten sind im Verkauf! ***\n\nDirekt am Wasser und in Top-Lage: BUWOG THE ONE ist das neue Wahrzeichen der Europacity. Das markante Gebäude liegt direkt am Otto-Weidt-Platz, dem neuen Stadtplatz. Perfekt angebunden an Hauptbahnhof, Regierungsviertel und Friedrichstraße.\n\nBUWOG THE ONE bietet smart geschnittene Eigentumswohnungen mit 2 bis 3 Zimmern und Wohnflächen von ca. 62 bis 79\u2009m², einfach auf einer Wellenlänge mit der Metropole. Perfekt für Kapitalanleger und Eigennutzer.', 'Smart One Plus: Die 2-Zimmer-Wohnung. Smartes Wohnen in BUWOG THE ONE – das ist maximaler Komfort bei effizienter Flächennutzung.\n\n- Lichtdurchfluteter Wohn-/Ess-/Kochbereich\n- Modernes Duschbad\n- Abstellraum\n- Hauswirtschaftsraum\n- Zwei Balkone mit Ost- und West-Ausrichtung\n- Optional: Tiefgaragen-Stellplatz', 'Die Europacity – Berlins neue Mitte\n\nDie Europacity ist das wichtigste Projekt Berlins seit dem Bau des Potsdamer Platzes. Direkt am Hauptbahnhof, in Reichweite von Charité, Regierungsviertel, Friedrichstraße und City West schlägt das neue Herz der Metropole. BUWOG THE ONE ist die erste Adresse Berlins, direkt am neuen Stadtplatz. \n\nMit den plastisch gefalteten dreieckigen Fassaden öffnet sich BUWOG THE ONE zur Promenade des Berlin-Spandauer Schifffahrtskanals. Über die neue Fußgängerbrücke sind Sie perfekt an die angrenzenden Quartiere von Mitte und Prenzlauer Berg angebunden.\n\nOb Business oder Shopping, Kultur oder Erholung: BUWOG THE ONE bietet Ihnen die Fülle aller Möglichkeiten.\n\nBeste Anbindung:\n\nMit BUWOG THE ONE sind Sie mitten drin:\n\n• Hauptbahnhof, Charité und Regierungsviertel zu Fuß erreichbar\n• Berlin-Mitte und Prenzlauer Berg direkt in der Nachbarschaft\n• Perfekter Anschluss an die Autobahn (A 111, A100)\n• 10 Minuten ab S-Bahn „Hauptbahnhof“ bis Alexanderplatz oder Zoologischer Garten\n• Ca. 20 Minuten mit dem ÖPNV bis Flughafen Tegel', 'Wir sind für Sie da\nUnser Vertriebsteam ist auch aus dem sicheren Home-Office weiterhin für Sie erreichbar. Kommen Sie gerne auf uns zu für Ihren individuellen Beratungstermin.  Die Showrooms sind derzeit geschlossen – aber per Telefon und E-Mail stehen wir Ihnen gern zur Verfügung. Auch Reservierungen von Wohnungen sind unverändert möglich.\nJetzt Termin vereinbaren! \n\n\nWeitere Informationen auf www.buwog-theone.com'];;1;;;;60109;true;;;
2020-05-24 21:02:32.721511;Berlin;;ONE_YEAR_FREE;99526;n;y;https://pictures.immobilienscout24.de/listings/72f791c0-c0ee-44b7-8688-b93ea474fe58-1370693556.jpg/ORIG/resize/118x118%3E/extent/118x118/format/jpg/quality/80;10;9.73;40 MBit/s;telekom_layer_magenta_l;über VDSL;1954;REGULAR;9.73;116813539;no_information;n;true;MagentaZuhause L;y;Berlin;y;9;2;10B;energy_consumption;3.79;113;Berlin;14195;need_of_renovation;no_information;false;100 MBit/s;no_information;"Taylorstra&szlig;e";n;https://padlock.link/ioml;https://padlock.link/ml;Taylorstraße;apartment;14195;5;49;n;;2,active;true;Deutschland;standard;100 MBit/s;wohnung_kauf;n;2;web,email,bank,music,dl-ul,game,sd,mltstr,hd,fast-ul-dl;true;001.99526;621500;profile0;;5;true;n;showqualicontactform;n;n;Dahlem_Zehlendorf;12695;5;Berlin;/expose/116813539;['In einer parkähnlichen Anlage hinter dem Alliierten Museum in Dahlem befindet sich diese schöne Familienwohnung. Neben einem geräumigen Wohn-Ess-Bereich verfügt sie über eine separate Küche, Bad, Gäste-WC und 4 weitere Zimmer, die als Schlafzimmer, Gästezimmer, Hobbyzimmer oder Büro nutzbar sind.\r\nDas fünfgeschossige Haus wurde zwischen 2005 und 2007 umfassend saniert (Fassadendämmung, Anbau Balkone, Fahrstuhleinbau, Umgestaltung Grünanlagen) und um ein Dachgeschoss aufgestockt. Vom großen Westbalkon der Wohnung, der vom Wohnzimmer zugänglich ist, blickt man auf die Kieferbäume.\r\n\r\nEin Außenstellplatz befindet sich vor der Haustür.', 'Geräumiger Wohn-Ess-Bereich \r\nKüche mit Einbaumöbeln und Theke\r\nBad mit Außenfenster\r\nGäste-WC mit Außenfenster\r\n4 weitere Zimmer  \r\nZweiflüglige Fenstertür zum Westbalkon\r\nSchallhemmende Wohnungseingangstür\r\nZentralheizung\r\nKellerraum\r\nAufzug\r\nAußenstellplatz', 'Wer in Berlin-Dahlem wohnt, der schätzt die besondere Mischung aus dörflichem Ambiente und großstädtischem Charme: Einerseits ist die Natur mit den vielen Bäumen, Parks und dem weitläufigen Grunewald prägend, andererseits sorgen die Freie Universität, mehrere Museen und Botschaften für internationales Flair.\r\nFür Familien mit Kindern bietet Dahlem sehr gute Kindertagesstätten und Schulen. Gleichzeitig ist man mit dem Auto über die Clayallee schnell am Kurfürstendamm mit seinen edlen Boutiquen und gehobenen Restaurants.'];;;disabled;1;;;;;;
