2020-05-24 21:04:03.392060;Berlin;central_heating;ONE_YEAR_FREE;5517279;n;y;https://pictures.immobilienscout24.de/listings/fd81e0db-d7e7-4424-8d12-3030211eaa72-1358350375.jpg/ORIG/resize/118x118%3E/extent/118x118/format/jpg/quality/80;16;10.37;40 MBit/s;telekom_layer_magenta_l;über VDSL;1970;REGULAR;10.37;116757069;oil;y;false;MagentaZuhause L;y;Berlin;y;5;2;289.22;no_information;energy_consumption;4.8;74.69;Berlin;12207;well_kept;normal;false;100 MBit/s;no_information;no_information;y;https://padlock.link/ioml;https://padlock.link/ml;no_information;apartment;12207;3;177;n;2,active;true;Deutschland;standard;100 MBit/s;wohnung_kauf;n;web,email,bank,music,dl-ul,game,sd,mltstr,hd,fast-ul-dl;true;001.5517279;244900;profile0;11;3;true;n;n;n;Lichterfelde_Steglitz;O3028;3;Berlin;/expose/116757069;"['Die zum Kauf angebotene Eigentumswohnung befindet sich im 8. Obergeschoss eines Mehrfamilienhauses, Baujahr 1970, in Berlin-Lichterfelde. Die Einheit ist bequem über den Aufzug erreichbar.\n\nDie Wohnung wird bezugsfrei und im jetzigen Zustand veräußert. Die Einheit ist sofort nutzbar, obwohl ein Großteil der Oberflächen und Einrichtungen nicht mehr dem heutigen Zeitgeist entspricht. \n\nViel Spielraum, um eigene Vorstellungen und Wünsche verwirklichen zu können.', 'Bei einer Größe von ca. 74,69 m² bietet die Wohnung folgendes Raumprogramm:\r\n\r\n""    Wohn-/Essbereich (durchgesteckt, d.h. von beiden gegenüberliegenden Fassaden aus belichtet)\r\n\r\n""    zwei separate Zimmer\r\n\r\n""    vorderer Flur mit Garderobenecke; hinterer Flur mit Einbauschränken\r\n\r\n""    Küche mit Einbaumöbeln und Einbaugeräten\r\n\r\n""    Tageslichtwannenbad + Gäste-Toilette\r\n\r\n""    Loggia mit Westausrichtung\r\n\r\nEbenfalls zum Sondereigentum gehört der wohnungsbezogene Abstellverschlag im Erd-geschoss des Hauses.', 'Die angebotene Eigentumswohnung befindet sich in Berlin-Lichterfelde, einem Ortsteil des Verwaltungsbezirks Zehlendorf-Steglitz. Die Entfernung zur Berliner Innenstadt (Bezugspunkt: Potsdamer Platz) beträgt in etwa 11,0 km. Vom Bahnhof Lichterfelde-Ost aus ist die City mit den Regionalexpress-Zügen der Linien RE3, RE4 und 5 in nur 10 bis 12 Minuten erreichbar.\r\n\r\nIm näheren Wohnungsumfeld sind alle Versorgungseinrichtungen des täglichen Bedarfs vorhanden. Am S-Bhf. Osdorfer Straße, dieser ist von der angebotenen Wohnung ca. 400 m entfernt, sind mehrere Discounter ansässig. Rund um den Kranoldplatz hat sich das Ortsteilzentrum von Lichterfelde mit Bahnhof, der Shopping-Galerie ""LIO"" sowie zahlreichen Läden und gastronomischen Einrichtungen etabliert. Zudem finden hier regelmäßig Markttage statt.\r\n\r\nAusgewählte Entfernungen zur angebotenen Wohnung betragen jeweils per Luftlinie:\r\n\r\nS-Bhf. Osdorfer Straße    - ca.    400 m\r\n(diverse Discounter)\r\nLilienthalpark    - ca.    800 m\r\nS+RB-Bhf. Lichterfelde Ost    - ca.    1,7 km\r\nFernbahnanschluss\r\nKarnoldplatz (Markt)    - ca.    1,7 km\r\n""LIO"" Shopping-Center\r\n\r\n', 'Für Rückfragen zu diesem  Angebot oder zur Vereinbarung eines Besichtigungstermins stehen wir Ihnen gerne zur Verfügung.\r\n\r\nWir freuen uns über Ihre Kontaktaufnahme! \r\n\r\nIhr Consens-Immobilien Team']";8;showqualicontactform;;F;;;0;;
2020-05-24 21:04:03.758771;Berlin;central_heating;ONE_YEAR_FREE;859480;n;n;https://pictures.immobilienscout24.de/listings/25e16af9-3892-4326-9481-c777650c7fe2-1358329626.jpg/ORIG/resize/118x118%3E/extent/118x118/format/jpg/quality/80;11;11.48;10 MBit/s;telekom_layer_magenta_m;über VDSL;1906;REGULAR;11.48;116755915;gas;y;false;MagentaZuhause M;y;Berlin;y;5;1;196;no_information;energy_consumption;7.14;57.25;Berlin;10243;modernized;no_information;false;50 MBit/s;no_information;no_information;n;https://padlock.link/iomm;https://padlock.link/mm;no_information;apartment;10243;2;179.9;n;2,active;true;Deutschland;top;50 MBit/s;wohnung_kauf;y;web,email,bank,music,dl-ul,game,sd,mltstr,hd,fast-ul-dl;true;001.859480;246200;profile0;4;2;true;n;n;n;Friedrichshain_Friedrichshain;1715;2;Berlin;/expose/116755915;"['Typischer Altbau an der Warschauer Str. - Vorderhaus, Seitenflügel, Hinterhaus - dahinter ein großzügiger, freier Innenhof zwischen den Häusern. Das Gebäude wurde ca. 1910 errichtet und in den 1990er Jahren modernisiert. \nDie Beheizung und Warmwasserbereitung erfolgt über eine nagelneue Gas-Zentralheizung (Inbetriebnahme: 22.10.2019) Aktuell ist die Gemeinschaft bei einer umfangreichen Renovierung der gesamten Wohnanlage - die Finanzierung erfolgt aus der Rücklage:\n\nBereits erledigt:\n- neue Gas-Zentralheizung mit Warmwasserbereitung (2019)\n- Dämmung der Fassaden am VH\n- Dämmung der beiden Hausdurchfahrten\n\nIn Arbeit:\n- Reparatur und Anstrich der Fassaden am Seitenflügel und Hinterhaus\n- Reparatur und Instandsetzung des Kellerbereichs\n- Renovierung der Treppenhäuser\n\nIn Vorbereitung:\n- Balkonanbauten am Hinterhaus zum ""Hinterhof""', 'Schöne, vollständig modernisierte 2 Zimmerwohnung im 1. Obergeschoss des Hinterhauses mit Blick in einen weitläufigen Hof zwischen den Häusern des Quartier. Dadurch sehr hell und ruhig!\n\nAusstattung:\n- 2 Zimmer\n- Küche mit moderner Einbauküche (2 Jahre alt)\n- neu gestaltetes Wannenbad mit Fenster\n- moderne Elektrik \n- abgezogene Dielen in den Wohnräumen und im Flur\n\n- Anbau eines Balkons bereits genehmigt und geplant\n- Kellerraum zur Wohnung\n\nAUF GRUND DER AKTUELLEN GRUNDBUCHLAGE IST EINE FINANZIERUNG DES KAUFPREISES ÜBER EINE BANK DERZEIT NICHT MÖGLICH!', 'Das Umfeld  ""Warschauer Straße"" - zwischen Frankfurter Tor und Warschauer Brücke - ist ein angesagter Berliner Kiez. Beliebt, vielfältig, urban! \n\nWer hier lebt, wohnt ""mittendrin"".\n\nDie hier angebotene Wohnung liegt im Hinterhaus - ruhig, beschaulich - kaum geht es aus dem Vorderhaus, schlägt einem das quirlige Leben des Friedrichshain entgegen.\n\nÜberzeugen Sie sich selbst!!!\n\u2003', 'Bitte haben Sie Verständnis dafür, dass wir Ihre Anfrage nur bei Übermittlung Ihrer VOLLSTÄNDIGEN Kontakt-/ Adressdaten schnellstmöglich beantworten können und Ihnen erst im Rahmen unserer Exposézusendung die genaue Objektadresse benennen. Für eine Grundstücksbesichtigung stehen wir Ihnen bei weiterem Interesse dann selbstverständlich gerne zur Verfügung.']";;showqualicontactform;;F;;;;;
2020-05-24 21:04:04.133218;Berlin;central_heating;ONE_YEAR_FREE;16164513;n;y;https://pictures.immobilienscout24.de/listings/04e14dae-dee7-49b0-b388-d11b2eabf602-1358834871.jpg/ORIG/resize/118x118%3E/extent/118x118/format/jpg/quality/80;8;11.37;40 MBit/s;telekom_layer_magenta_l;über VDSL;1967;REGULAR;11.37;116757787;natural_gas_light;y;false;MagentaZuhause L;y;Berlin;n;3;2;179;no_information;energy_consumption;5.8;34;Berlin;10717;no_information;no_information;false;100 MBit/s;no_information;no_information;n;https://padlock.link/ioml;https://padlock.link/ml;no_information;apartment;10717;1;176;n;2,active;true;Deutschland;premium;100 MBit/s;wohnung_kauf;n;web,email,bank,music,dl-ul,game,sd,mltstr,hd,fast-ul-dl;true;002.01006791836;149000;profile0;;1;true;n;n;n;Wilmersdorf_Wilmersdorf;1842;1;Berlin;/expose/116757787;['Das Baujahr des Hauses wird mit 1967 angegeben und ist vom Stil her typisch für die moderne Bauweise des Zeitraumes Ende 60iger/Anfang 70iger Jahre.\n\nDas Objekt verfügt über fünf Vollgeschosse mit Fahrstuhl. Die Wohnung selbst befindet sich im 3.OG. ', 'Die Wohnung selbst besteht aus einem großen Zimmer mit Schlafnische, welches aufgrund der großen Fensterflächen sehr hell ist. Vorgelagert ist der straßenseitige Balkon mit Platz für einen Tisch und zwei Stühle.\n\nDie Diele mit Einbauschrank, die Einbauküche mit Fenster und das innenliegende, geflieste Wannenbad komplettieren das Raumangebot.', 'In unmittelbarer Nähe zum Volkspark Wilmersdorf gelegen, lässt die umgebende, quirlige Infrastruktur kaum Wünsche offen. Einkaufsmöglichkeiten des täglichen Bedarfs, Restaurants und mehr sind direkt vor der Tür vorhanden. \n\nDie Anbindung an den öffentlichen Nahverkehr ist als nahezu optimal zu bezeichnen. U-Bahnhof Blissestrasse und Berliner Str. sind jeweils ca. 300 Meter entfernt, der S-Bahnhof Bundesplatz ca. 12 Fußminuten. Buslinien (z.B. 104/ 249) befinden sich in unmittelbarer Nähe. Mit dem KFZ ist man in ca. 3 Minuten auf der Stadtautobahn A100. Große Einfahrtstraßen verlaufen in verschiedene Richtungen.\n\n'];3;showqualicontactform;;;;true;;;
2020-05-24 21:04:04.531075;Berlin;self_contained_central_heating;ONE_YEAR_FREE;16480061;n;n;https://pictures.immobilienscout24.de/listings/b3b0f2ca-593b-4ce2-862b-cffe9dc32abc-1358315914.jpg/ORIG/resize/118x118%3E/extent/118x118/format/jpg/quality/80;15;10.47;40 MBit/s;telekom_layer_magenta_l;über VDSL;1905;REGULAR;10.47;116754741;gas;n;false;MagentaZuhause L;n;Berlin;y;10;1;320;9;energy_required;6.36;178;Berlin;13187;well_kept;normal;false;100 MBit/s;no_information;Ossietzkystr.;y;https://padlock.link/ioml;https://padlock.link/ml;Ossietzkystr.;apartment;13187;5;102;n;2,active;true;Deutschland;top;100 MBit/s;wohnung_kauf;y;web,email,bank,music,dl-ul,game,sd,mltstr,hd,fast-ul-dl;true;002.01007331745;824000;profile0;5;5;true;y;n;n;Pankow_Pankow;STOsW6;7;Berlin;/expose/116754741;['Der stilvolle 5-geschossige Altbau aus der Gründerzeit wurde um ca.1905 erbaut.\rDas einladende Treppenhaus besticht neben seinen dekorativen Stuckelementen, Buntglasfenstern und prächtigen Holzgeländer mit einem modernen Personenaufzug von 2017. Das unterkellerte Gebäude besteht aus einem Vorderhaus mit sechs Wohn - sowie zwei Gewerbeeinheiten und einem begrünten Innenhof. \r\rDie vermietete geräumige und lichtdurchflutete ca. 178 m²  große 5-Zimmerwohnung birgt viel Potenzial mit ca. 3,40 m hohen Wänden sowie originalen Flügeltüren. \r\rDer Innenhof ist sehr gepflegt und bietet Platz für das Abstellen von Fahrrädern.\rDie Beheizung erfolgt über eine Gas-Etagenheizung.', '• NKM: €797,-\r• Hausgeld: €320,-\r• davon nicht umlegbar: €108,-\r• Mietverhältnis seit 07/1997\r• Teilung nach WEG:07/2012\r• 10-jährige Sperrfrist\r\r• Stuckverzierungen\r• ca. 3,40 m hohe Decken\r• Holzkastenfenster\r• teilweise originale Flügeltüren\r• gepflegter Innenhof mit Sitzgelegenheit und Fahrradbügel\r• ca. 10 Fußminuten zum S-/U-Bhf. Pankow\r• nahe Rathaus Center Pankow\r• nahe Schlosspark, Sommerbad Pankow, Volkspark Schönholzer Heide', 'Der gepflegte Gründerzeit-Altbau befindet sich in einer Seitenstraße in unmittelbarer Nähe zum beliebten Rathaus Center Pankow sowie vielen individuellen Läden, Bars und Cafés.\r\rAnbindung zu den öffentlichen Verkehrsmitteln bietet der S- und U-Bhf. Pankow (ca. 600 m Entfernung) sowie Bus und Tram (wenige Gehminuten entfernt).\r\rDer florierende Bezirk Pankow ist bekannt für seine reichhaltigen und facettenreichen Kulturangebote und Kunstprojekte - angrenzend an den Ortsteil Prenzlauer Berg bietet der Standort Abwechslung und Ruhe gleichermaßen.\r\rErholung für Familien und Naturbegeisterte garantieren der nahegelegene Schlosspark, das Sommerbad Pankow sowie der Volkspark Schönholzer Heide.\r\rGeschäfte des täglichen Bedarfs sowie Apotheken, Kitas und Schulen sind ebenfalls in unmittelbarer Nähe zahlreich vorhanden.', 'Weitere Immobilien finden Sie unter: www.homeestate.de\r\rÜbrigens: Unser Team steht Ihnen an 7 Tagen in der Woche für Besichtigungen gerne zur Verfügung - und das sogar in 8 Sprachen. \r\rWir freuen uns sehr, Sie persönlich kennenzulernen.'];2;showqualicontactform;;;;;178;;
2020-05-24 21:04:04.885111;Berlin;combined_heat_and_power_plant;ONE_YEAR_FREE;1312;n;y;https://pictures.immobilienscout24.de/listings/2f4f790f-2cbc-40fd-9435-37cc1627f1cf-1358267156.jpg/ORIG/resize/118x118%3E/extent/118x118/format/jpg/quality/80;16;8.54;40 MBit/s;telekom_layer_magenta_l;über VDSL;1909;REGULAR;8.54;116750817;combined_heat_and_power_fossil_fuels;y;false;MagentaZuhause L;y;Berlin;y;3;1;205;no_information;energy_consumption;5.03;48.58;Berlin;13125;refurbished;sophisticated;false;100 MBit/s;outside;no_information;n;https://padlock.link/ioml;https://padlock.link/ml;no_information;apartment;13125;2;110.5;n;2,active;true;Deutschland;top;100 MBit/s;wohnung_kauf;y;web,email,bank,music,dl-ul,game,sd,mltstr,hd,fast-ul-dl;true;001.1312;149900;profile0;2;2;true;n;n;n;Buch_Pankow;LPWE108STP158_AB2;2;Berlin;/expose/116750817;"['Historie neu erleben: Der Ludwigpark, eine 32.000 m² große Parkanlage mit sechzehn Häusern wurde ca. 1908/1909 in Berlin-Pankow (OT Buch) nach den Plänen des Stadtbaudirektors Ludwig Hoffmann errichtet. Es ist eines der besonderen Denkmäler in Berlin Buch. Die Häuser des  Ludwigparks wurden in den Jahren 2008/2009 umfangreich kernsaniert, modernisiert und in Eigentumswohnungen umgewandelt. Der Ludwigpark teilt sich in privates Wohnen und eine Pflegeimmobilie ServiceLeben der RENAFAN.\n\nAuszug aus der Modernisierung 2008/2009: \n\n- neue Zentralheizung\n- neue Elektroleitungen \n- neue Sanitärinstallationen \n- neue Steig- und Fallrohre \n- neuer Fußbodenaufbau \n- restaurierte Doppelkastenfenster \n- neue große, freischwebende Balkone\n- komplett sanierte Fassade \n- komplett saniertes Dach \n- komplett sanierter Keller \n- sanierte Treppenhäuser \n- neu gestaltete Parkanlagen mit Sitzgelegenheiten \n- Fahrrad Abstellräume \n- neu angelegte außen liegende Parkplätze \n- Baubegleitung und Abnahme seinerzeit durch den TÜV', 'Wohnkomfort im liebevoll sanierten Denkmal: Weitblick aus der sonnendurchfluteten Wohnung und vom großen Balkon. Aufgrund der Lage des Hauses am höchsten Punkt des Parkgrundstücks entspricht die erste Etage hier gewissermaßen dem 2. Stock eines vergleichbaren Gebäudes.\nKompakter 1,5 Zimmer Grundriss mit hohen Decken und gelungener Separierung von Wohnen und Schlafen. Wohnzimmer mit großer Doppelflügeltür zum Balkon in der ersten Etage, mit Eichendielen hochwertig ausgestattet. Praktischer Wandrücksprung für reichlich Stauraum direkt neben dem Badezimmer. \n\nWas dürfen Sie erwarten:\n  \n- großer Süd-Ost Balkon \n- Wohnen / Essen kombiniert \n- Einbauküche mit Markengeräten, großes Fenster für optimale Belüftung \n- Bad mit Dusche (Glastür-Einstieg) und Waschmaschinenanschluss. \n- praktische Wandnische für Einbauschrank \n- massives Eichenparkett \n- hochwertige Fliesen im Bad\n- Marken-Keramik und Qualitäts-Armaturen im Bad \n- hohe Decken\n- Kellerabteil\n- uvm.\n\nDie Wohnung wurde zum 01.03.2020 vermietet!', 'Berlin Buch - die Gesundheitsstadt - heute Ortsteil von Berlins einwohnerreichstem Bezirk Pankow, bietet nicht nur attraktive Arbeitsplätze im Gesundheitsbereich, sondern auch Erholung und entspanntes Leben abseits der Großstadthektik. \n\nExzellente Forschung, maximale und spezialisierte Gesundheitsversorgung, wissensbasierte Wirtschaft und vielfältige Aus- und Weiterbildung in der Gesundheitswirtschaft sind Markenzeichen von Buch. Mit seiner klaren Ausrichtung  auf Biomedizin hat der Gesundheitsstandort ein herausragendes Innovations- und Wachstumspotential. Innerhalb der Innovationsstrategie der Hauptstadtregion ist Berlin-Buch als Zukunftsort ausgewiesen.\n\nDie Bucher schätzen die grüne und ruhige Lage ihres Ortes. Mit Kind und Kegel belagern sie im Sommer den Schlosspark, der von einem früheren Bucher Gutsherren angelegt wurde und durch den das Flüsschen Panke fließt. Die angrenzende barocke Schlosskirche ist ein Kleinod von Berlin.\n\nAuf dem denkmalgeschützten Stadtgut Berlin-Buch findet man Ateliers von Berliner Künstlern, das Restaurant ""Zum Speicher"", eine Scheune für Konzerte und Theater sowie ein kleines Hotel. In der nahe gelegenen Schlosspark-Passage lässt es sich angenehm einkaufen. Der Bucher Forst, der zum Naturpark Barnim gehört, bietet Erholung direkt vor der Haustür. Seit den 90er Jahren entwickelte sich aus dem historischen Krankenhauskomplex der weltweit anerkannte Wissenschaftsstandort Berlin-Buch mit circa 4.800 Beschäftigten. Damit ist Buch einer der wichtigsten Gesundheits-, Wissenschafts- und Technologiestandorte in Berlin-Brandenburg.\nFußläufig entfernt vom Ludwigpark ist das Bucher Zentrum und die Schlossparkpassagen mit Supermärkten (Kaufland, Rewe) und vielen Geschäften für den täglichen Bedarf. \nSiehe auch: www.buch.de\n\nInnerhalb von 21 Minuten erreicht die S-Bahn bequem den Bahnhof Friedrichstraße in Berlins Mitte.\n\nÜber die B2 oder die A10 gelangt man auch mit dem Auto schnell und bequem ins Zentrum und in die anderen Berliner Bezirke.', 'Kaufpreiszusammenstellung:\n\nKaufpreis WE:            149.900,00 € inkl. EBK\nKaufpreis STP:               5.000,00 € (nicht optional!)\nKaufpreis insgesamt:  154.900,00 €\n\nAktuelle Nettokaltmiete:    388,64 €/mtl.\nAkt. Stellplatzmiete netto:   28,00 €/mtl.\n\nHausgeld ab 01/2020:       176,00 €/mtl.\nInstandhaltungsrücklage:    29,00 €/mtl.\n(Angaben gemäß Wirtschaftsplan 2020)\n\nFür Rückfragen und einen Besichtigungstermin stehen wir Ihnen gerne nach Vereinbarung zur Verfügung. Ihr Ansprechpartner, Andreas Butz, ist auch am Wochenende telefonisch mobil erreichbar: 0173-95 55 194.']";1;showqualicontactform;;;2009;;;1;315
2020-05-24 21:04:05.417266;Berlin;self_contained_central_heating;ONE_YEAR_FREE;16480061;n;n;https://pictures.immobilienscout24.de/listings/78e11772-77e7-4a08-914f-fe1b38c4fc92-1358371664.jpg/ORIG/resize/118x118%3E/extent/118x118/format/jpg/quality/80;10;11.12;40 MBit/s;telekom_layer_magenta_l;über VDSL;1895;REGULAR;11.12;116758665;gas;n;false;MagentaZuhause L;n;Berlin;y;9;1;167;27;energy_required;6.13;77;Berlin;10789;well_kept;normal;false;100 MBit/s;no_information;"N&uuml;rnberger Strasse";n;https://padlock.link/ioml;https://padlock.link/ml;Nürnberger_Strasse;apartment;10789;3;172.5;n;2,active;true;Deutschland;top;100 MBit/s;wohnung_kauf;n;web,email,bank,music,dl-ul,game,sd,mltstr,hd,fast-ul-dl;true;002.01007331745;509000;profile0;2;3;true;y;n;n;Charlottenburg_Charlottenburg;STNW8;3;Berlin;/expose/116758665;['Dieser klassische Altbau entstand ca. im Jahre 1895. Die Kubatur ist simpel und genial zugleich - es handelt sich hier um ein Vorderhaus mit einem Seitenflügel sowie einem ruhigen, begrünten Innenhof, der sich nach Süden und Westen hin öffnet.\r\rHofseitig besteht laut Teilungserklärung die Möglichkeit, einen Balkon an der südlichen Fassade des Seitenflügels anzubringen (s. Grundriss).', '• Teils Dielenböden\r• Teils originale Flügeltüren aus der Gründerzeit\r• Holzdoppelkastenfenster\r• Individuelle Raumaufteilung \r• Balkonanbau laut Teilungserklärung möglich\r• Gasetagenheizung\r• Kellerabteil\r• Elektroauto-Ladestation direkt vor der Haustür\r• Nahe U-Bahn-Station „Augsburger Straße“ \r• Nahe S-/U-/Bus- und Fernbahnhof Zoologischer Garten\r• Teilung nach WEG: 05/2019\r• Kein Denkmalobjekt/ kein Milieuschutzgebiet', 'Mitten in City West, im Herzen Berlins, fünf Fußminuten zum Kurfürstendamm entfernt, befindet sich Ihr neues Domizil.\r\rDiese Top-Lage bietet Wohn– und Lebensqualität auf höchstem Niveau, ob kulinarisch, kulturell oder für den täglichen Bedarf. In Sichtweite befindet sich die U-Bahnstation Augsburger Straße (U3).', 'Weitere bezugsfreie Immobilien finden Sie unter: www.homeestate.de\noder unter: \nwww.nuernberger27.de \n\nUnter folgendem Link finden Sie eine Tour durch die Wohnung: https://my.matterport.com/show/?m=KL6PXQLiMv1\n\nÜbrigens: Unser Team steht Ihnen an 7 Tagen in der Woche für Besichtigungen gerne zur Verfügung - und das sogar in 8 Sprachen. \n\nWir freuen uns, Sie schon bald persönlich kennenzulernen!'];2;showqualicontactform;;F;;;;;
2020-05-24 21:04:06.114028;Berlin;central_heating;ONE_YEAR_FREE;15474925;n;n;https://pictures.immobilienscout24.de/listings/2047e18d-8082-47ea-a49c-fb00680fd7d8-1358276492.png/ORIG/resize/118x118%3E/extent/118x118/format/jpg/quality/80;10;12.78;40 MBit/s;telekom_layer_magenta_l;über VDSL;1900;REGULAR;12.78;116751324;district_heating;n;false;MagentaZuhause L;y;Berlin;y;4;1;188.88;50;energy_consumption;7.25;52.71;Berlin;10559;well_kept;no_information;false;100 MBit/s;no_information;Stephanstr.;n;https://padlock.link/ioml;https://padlock.link/ml;Stephanstr.;apartment;10559;2;69.8;n;2,active;true;Deutschland;top;100 MBit/s;wohnung_kauf;y;web,email,bank,music,dl-ul,game,sd,mltstr,hd,fast-ul-dl;true;001.15417560;189000;profile0;4;2;true;n;n;n;Tiergarten_Tiergarten;VK-16083_WE27;2;Berlin;/expose/116751324;['Diese 2-Zimmer-Wohnung befindet sich in einem imposanten 4-geschossigen Altbaugebäude, welches in ein Vorderhaus, einen Seitenflügel und ein Hinterhaus aufgeteilt ist und über 31 Einheiten verfügt.\n\nDas Haus wurde um die Jahrhundertwende erbaut und 2015 in Eigentumseinheiten aufgeteilt. \n\nDie Wohnung befindet sich im 3. OG  im Seitenflügel und verfügt über ca. 52,71 m².\n\nVom Eingangsbereich gelangt man links in das  Schlafzimmer, geradezu befinden sich die Küche und das Badezimmer.  Das Wohnzimmer liegt auf der rechten Seite mit Blick in den Innenhof.\n\nDie Wohnung ist seit 2001 zuverlässig vermietet.  Dem Mieter steht nach dem Verkauf der Wohnung eine 10-jährige Kündigungsschutzfrist zu.', 'Schöne und lebhafte Kiezatmosphäre mit viel hauptstädtischer Urbanität - das geht im Stephankiez in Moabit harmonisch zusammen.   Moabit ist ein Ortsteil vom Bezirk Mitte, dem Regierungsviertel, und liegt somit im Herzen von Berlin.\n\nNeben Europas größtem Kreuzbahnhof, dem Berlin Hauptbahnhof, befinden sind auch der „Hamburger Bahnhof“, das Museum für Gegenwartskunst, und das Naturkundemuseum in der Nachbarschaft der Immobilie.\n\nFür Sportler bieten das Trainingsgelände des SC-Union Berlin sowie der Tennis-Club Tiergarten oder das großzügiges Parkgelände des Tiergarten selbst optimale Möglichkeiten.\n\nOb kleine Traditionsgeschäfte, Einkaufszentrum oder Kulturfabrik, Cafés oder Theater -   hier ist vieles in fußläufiger Nähe erreichbar. \n\nDie gute Anbindung in alle Richtungen der Hauptstadt weiß man zu schätzen und zu nutzen.'];3;;;;;;;;
2020-05-24 21:04:06.480304;Berlin;central_heating;ONE_YEAR_FREE;4963961;n;y;https://pictures.immobilienscout24.de/listings/52824f52-45e5-40b6-b867-9beac450c731-1358360680.jpg/ORIG/resize/118x118%3E/extent/118x118/format/jpg/quality/80;6;11.3;40 MBit/s;telekom_layer_magenta_l;über VDSL;1910;REGULAR;11.3;116757460;gas;n;false;MagentaZuhause L;y;Berlin;y;7;1;;no_information;energy_consumption;5.73;59.3;Berlin;14059;no_information;sophisticated;false;100 MBit/s;no_information;no_information;y;https://padlock.link/ioml;https://padlock.link/ml;no_information;apartment;14059;2;98.84;n;2,active;true;Deutschland;standard;100 MBit/s;wohnung_kauf;n;web,email,bank,music,dl-ul,game,sd,mltstr,hd,fast-ul-dl;true;001.4963961;335000;profile0;5;2;true;n;n;n;Charlottenburg_Charlottenburg;116757460;2;Berlin;/expose/116757460;['Berliner Altbau von 1910. \nAngeboten werden verschiedene, leerstehende Wohnungen, 40 - 150 qm, darunter drei Dachgeschosswohnungen mit Balkonen.', 'Derzeit befindet sich das Dach, die Fassade, der Aufzug sowie die leerstehenden Wohnungen in der Renovierungsphase. Weitere Details auf Anfrage.\nDie Bilder sind Musterbilder aus unterschiedlichen Wohnungen!', 'Das Haus in der Sophie-Charlotten-Str. befindet sich am Litzensee nahe Bus und U Bahn. Der Klausenerplatz und das Charlottenburger Schloss sind ebenfalls fußläufig zu erreichen. Schulen, Kindergärten und alle Geschäfte des täglichen Bedarfs befinden sich in unmittelbarer Nähe.', 'Auf Anfragen von Maklerkollegen bitte ich abzusehen!!!\n\nDie Immobilie wird im Alleinauftrag angeboten. Gerne übersenden wir Ihnen weitere Informationen zum Objekt. Vollständige Angaben zu den angebotenen Wohnungen werden nur übermittelt, wenn die Kontaktdaten des Interessenten vorliegen.\n\nAlle Angaben sind ohne Gewähr und basieren ausschließlich auf Informationen, die uns von unserem Auftraggeber übermittelt wurden. Wir übernehmen keine Gewähr/Haftung für die Vollständigkeit, Richtigkeit und Aktualität dieser Angaben. Es obliegt daher unseren Kunden, die darin enthaltenen Objektinformationen/Pläne und Angaben auf ihre Richtigkeit hin zu überprüfen. Zwischenverkauf bleibt vorbehalten. Die Weitergabe dieses Exposees an Dritte, ohne unsere Zustimmung löst gegebenenfalls Courtage- bzw. Schadensersatzansprüche aus.'];2;showqualicontactform;;NO_INFORMATION;2020;;59.3;;
2020-05-24 21:04:06.821016;Berlin;central_heating;;14544073;n;y;https://pictures.immobilienscout24.de/listings/fb731ada-0904-4baa-a46b-ffa4230e1507-1358289126.jpg/ORIG/resize/118x118%3E/extent/118x118/format/jpg/quality/80;1;7.89;;;;1977;;7.89;116752381;gas;y;false;;y;Berlin;y;8;3;;.;energy_required;3.38;77;Berlin;14193;well_kept;no_information;false;;no_information;Koenigsallee;n;;;Koenigsallee;apartment;14193;2;115.5;n;2,active;;Deutschland;standard;;wohnung_kauf;n;;;002.01000690340;500000;profile0;;2;true;n;n;n;Grunewald_Wilmersdorf;217+;3;Berlin;/expose/116752381;['Das Wohnhaus befindet sich im Ortsteil Grunewald nahe dem Kurfürstendamm.\n\nDer Kurfürstendamm mit vielen Läden, Boutiquen und Restaurants \nlädt zum Bummeln ein. \n\nDie Wohnung ist im 3. Obergeschoss eines 1977 erbauten Wohnhauses gelegen.\n\nDiverse Einkaufsmöglichkeiten sind in der nahen Umgebung vorhanden.', '- Parkett\n- Einbauküche\n- Wannenbad\n- Terrasse\n- Abstellraum\n- Kellerraum', '- der S-Bahnhof Halensee ist mit dem Bus in ca. 5 Minuten erreichbar\n\n- der Kurfürstendamm ist mit dem PKW ca. 5 Minuten entfernt'];3;showqualicontactform;;;;;;;
